game_id,away_team_id,away_team_name,home_team_id,home_team_name,batting_team,inning,top_bot,event_text,event_num,game_datetime,stadium_name,attendance,sport_id,season
6508864,615415,Bluffton Beavers,615168,Capital Comets,615415,1,top,Tyler Forest popped up to ss (0-2 FS).,1,2026-03-14 10:30:00-04:00,"Lancaster, OH",75,MBA,2026
6508864,615415,Bluffton Beavers,615168,Capital Comets,615415,1,top,Drew Snipes flied out to rf (1-2 KBF).,2,2026-03-14 10:30:00-04:00,"Lancaster, OH",75,MBA,2026
6508864,615415,Bluffton Beavers,615168,Capital Comets,615415,1,top,Ayden Spriggs grounded out to p unassisted (1-0 B).,3,2026-03-14 10:30:00-04:00,"Lancaster, OH",75,MBA,2026
6508864,615415,Bluffton Beavers,615168,Capital Comets,615168,1,bot,Charlie Colson walked (3-2 KBBBKFB).,4,2026-03-14 10:30:00-04:00,"Lancaster, OH",75,MBA,2026
6508864,615415,Bluffton Beavers,615168,Capital Comets,615168,1,bot,Charlie Colson stole second.,5,2026-03-14 10:30:00-04:00,"Lancaster, OH",75,MBA,2026
6508864,615415,Bluffton Beavers,615168,Capital Comets,615168,1,bot,Kielan LaMarr flied out to cf (1-1 KB).,6,2026-03-14 10:30:00-04:00,"Lancaster, OH",75,MBA,2026
6508864,615415,Bluffton Beavers,615168,Capital Comets,615168,1,bot,Bryce Kyees walked (3-2 BBBKFFB).,7,2026-03-14 10:30:00-04:00,"Lancaster, OH",75,MBA,2026
6508864,615415,Bluffton Beavers,615168,Capital Comets,615168,1,bot,Gio Mastrorosa flied out to lf (0-2 SF).,8,2026-03-14 10:30:00-04:00,"Lancaster, OH",75,MBA,2026
6508864,615415,Bluffton Beavers,615168,Capital Comets,615168,1,bot,Bryce Kyees stole second3a Charlie Colson stole third.,9,2026-03-14 10:30:00-04:00,"Lancaster, OH",75,MBA,2026
6508864,615415,Bluffton Beavers,615168,Capital Comets,615168,1,bot,Ty Clifton lined out to cf (2-2 FBKFBFF).,10,2026-03-14 10:30:00-04:00,"Lancaster, OH",75,MBA,2026
6508864,615415,Bluffton Beavers,615168,Capital Comets,615415,2,top,Xander Greulich singled down the lf line (1-2 KBF).,11,2026-03-14 10:30:00-04:00,"Lancaster, OH",75,MBA,2026
6508864,615415,Bluffton Beavers,615168,Capital Comets,615415,2,top,Nathan Rorick struck out looking (2-2 BBSSK).,12,2026-03-14 10:30:00-04:00,"Lancaster, OH",75,MBA,2026
6508864,615415,Bluffton Beavers,615168,Capital Comets,615415,2,top,Sam Archambeau flied out to rf (1-0 B).,13,2026-03-14 10:30:00-04:00,"Lancaster, OH",75,MBA,2026
6508864,615415,Bluffton Beavers,615168,Capital Comets,615415,2,top,Carsen Riddle doubled to left center (1-2 KFFB)3a Xander Greulich advanced to third.,14,2026-03-14 10:30:00-04:00,"Lancaster, OH",75,MBA,2026
6508864,615415,Bluffton Beavers,615168,Capital Comets,615415,2,top,Liam George struck out swinging (0-2 FFS).,15,2026-03-14 10:30:00-04:00,"Lancaster, OH",75,MBA,2026
6508864,615415,Bluffton Beavers,615168,Capital Comets,615168,2,bot,Justin Weaver flied out to rf (1-1 BK).,16,2026-03-14 10:30:00-04:00,"Lancaster, OH",75,MBA,2026
6508864,615415,Bluffton Beavers,615168,Capital Comets,615168,2,bot,Robby Harrison hit by pitch (1-2 KFH).,17,2026-03-14 10:30:00-04:00,"Lancaster, OH",75,MBA,2026
6508864,615415,Bluffton Beavers,615168,Capital Comets,615168,2,bot,"Grayson Gulley reached on a fielder's choice to pitcher, bunt (0-0)3a Robby Harrison out at second p to ss.",18,2026-03-14 10:30:00-04:00,"Lancaster, OH",75,MBA,2026
6508864,615415,Bluffton Beavers,615168,Capital Comets,615168,2,bot,Grayson Gulley stole second.,19,2026-03-14 10:30:00-04:00,"Lancaster, OH",75,MBA,2026
6508864,615415,Bluffton Beavers,615168,Capital Comets,615168,2,bot,M. Andryszczyk flied out to cf (0-2 FS).,20,2026-03-14 10:30:00-04:00,"Lancaster, OH",75,MBA,2026
6508864,615415,Bluffton Beavers,615168,Capital Comets,615415,3,top,Torin Long walked (3-2 BKBBKB).,21,2026-03-14 10:30:00-04:00,"Lancaster, OH",75,MBA,2026
6508864,615415,Bluffton Beavers,615168,Capital Comets,615415,3,top,"Tyler Forest reached first on a fielding error by p, bunt, SAC (0-0)3a Torin Long advanced to second.",22,2026-03-14 10:30:00-04:00,"Lancaster, OH",75,MBA,2026
6508864,615415,Bluffton Beavers,615168,Capital Comets,615415,3,top,"Drew Snipes reached on a fielder's choice to pitcher, bunt (0-1 F)3a Tyler Forest out at second p to ss3a Torin Long advanced to third.",23,2026-03-14 10:30:00-04:00,"Lancaster, OH",75,MBA,2026
6508864,615415,Bluffton Beavers,615168,Capital Comets,615415,3,top,"Ayden Spriggs singled through the right side, RBI (0-0)3a Drew Snipes advanced to second3a Torin Long scored.",24,2026-03-14 10:30:00-04:00,"Lancaster, OH",75,MBA,2026
6508864,615415,Bluffton Beavers,615168,Capital Comets,615415,3,top,Xander Greulich singled to right field (0-0)3a Ayden Spriggs advanced to second3a Drew Snipes advanced to third.,25,2026-03-14 10:30:00-04:00,"Lancaster, OH",75,MBA,2026
6508864,615415,Bluffton Beavers,615168,Capital Comets,615415,3,top,"Nathan Rorick reached on a fielder's choice to second base, RBI (3-2 SBBFB)3a Xander Greulich out at second 2b to ss3a Ayden Spriggs advanced to third3a Drew Snipes scored, unearned.",26,2026-03-14 10:30:00-04:00,"Lancaster, OH",75,MBA,2026
6508864,615415,Bluffton Beavers,615168,Capital Comets,615415,3,top,"Sam Archambeau singled to right center, RBI (0-0)3a Nathan Rorick advanced to third3a Ayden Spriggs scored, unearned.",27,2026-03-14 10:30:00-04:00,"Lancaster, OH",75,MBA,2026
6508864,615415,Bluffton Beavers,615168,Capital Comets,615415,3,top,Carsen Riddle struck out swinging (0-2 SFS).,28,2026-03-14 10:30:00-04:00,"Lancaster, OH",75,MBA,2026
6508864,615415,Bluffton Beavers,615168,Capital Comets,615168,3,bot,Charlie Colson singled through the right side (0-2 KKF).,29,2026-03-14 10:30:00-04:00,"Lancaster, OH",75,MBA,2026
6508864,615415,Bluffton Beavers,615168,Capital Comets,615168,3,bot,Charlie Colson stole second.,30,2026-03-14 10:30:00-04:00,"Lancaster, OH",75,MBA,2026
6508864,615415,Bluffton Beavers,615168,Capital Comets,615168,3,bot,Kielan LaMarr hit by pitch (2-0 BH).,31,2026-03-14 10:30:00-04:00,"Lancaster, OH",75,MBA,2026
6508864,615415,Bluffton Beavers,615168,Capital Comets,615168,3,bot,Bryce Kyees walked (3-0 BBBB)3a Kielan LaMarr advanced to second3a Charlie Colson advanced to third.,32,2026-03-14 10:30:00-04:00,"Lancaster, OH",75,MBA,2026
6508864,615415,Bluffton Beavers,615168,Capital Comets,615168,3,bot,"Gio Mastrorosa singled down the lf line, 2 RBI (2-2 BSBK)3a Bryce Kyees advanced to second, out at third lf to 3b3a Kielan LaMarr scored3a Charlie Colson scored.",33,2026-03-14 10:30:00-04:00,"Lancaster, OH",75,MBA,2026
6508864,615415,Bluffton Beavers,615168,Capital Comets,615168,3,bot,Ty Clifton walked (3-0 BBBB)3a Gio Mastrorosa advanced to second.,34,2026-03-14 10:30:00-04:00,"Lancaster, OH",75,MBA,2026
6508864,615415,Bluffton Beavers,615168,Capital Comets,615168,3,bot,Justin Weaver grounded into double play ss to 2b to 1b (1-0 B)3a Ty Clifton out on the play.,35,2026-03-14 10:30:00-04:00,"Lancaster, OH",75,MBA,2026
6508864,615415,Bluffton Beavers,615168,Capital Comets,615415,4,top,Liam George lined out to ss (2-1 FBB).,36,2026-03-14 10:30:00-04:00,"Lancaster, OH",75,MBA,2026
6508864,615415,Bluffton Beavers,615168,Capital Comets,615415,4,top,Torin Long fouled out to c (1-1 BF).,37,2026-03-14 10:30:00-04:00,"Lancaster, OH",75,MBA,2026
6508864,615415,Bluffton Beavers,615168,Capital Comets,615415,4,top,Tyler Forest doubled to left center (0-1 K).,38,2026-03-14 10:30:00-04:00,"Lancaster, OH",75,MBA,2026
6508864,615415,Bluffton Beavers,615168,Capital Comets,615415,4,top,Drew Snipes flied out to cf (1-2 BKS).,39,2026-03-14 10:30:00-04:00,"Lancaster, OH",75,MBA,2026
6508864,615415,Bluffton Beavers,615168,Capital Comets,615168,4,bot,Robby Harrison grounded out to 3b (1-2 KBS).,40,2026-03-14 10:30:00-04:00,"Lancaster, OH",75,MBA,2026
6508864,615415,Bluffton Beavers,615168,Capital Comets,615168,4,bot,Grayson Gulley struck out swinging (2-2 BFKBS).,41,2026-03-14 10:30:00-04:00,"Lancaster, OH",75,MBA,2026
6508864,615415,Bluffton Beavers,615168,Capital Comets,615168,4,bot,M. Andryszczyk struck out looking (1-2 KBKK).,42,2026-03-14 10:30:00-04:00,"Lancaster, OH",75,MBA,2026
6508864,615415,Bluffton Beavers,615168,Capital Comets,615415,5,top,Ayden Spriggs walked (3-1 KBBBB).,43,2026-03-14 10:30:00-04:00,"Lancaster, OH",75,MBA,2026
6508864,615415,Bluffton Beavers,615168,Capital Comets,615415,5,top,Xander Greulich flied out to rf (0-0).,44,2026-03-14 10:30:00-04:00,"Lancaster, OH",75,MBA,2026
6508864,615415,Bluffton Beavers,615168,Capital Comets,615415,5,top,Nathan Rorick struck out swinging (2-2 KSBFBS).,45,2026-03-14 10:30:00-04:00,"Lancaster, OH",75,MBA,2026
6508864,615415,Bluffton Beavers,615168,Capital Comets,615415,5,top,Sam Archambeau singled to left center (1-0 B)3a Ayden Spriggs advanced to third.,46,2026-03-14 10:30:00-04:00,"Lancaster, OH",75,MBA,2026
6508864,615415,Bluffton Beavers,615168,Capital Comets,615415,5,top,Sam Archambeau stole second3a Ayden Spriggs stole home.,47,2026-03-14 10:30:00-04:00,"Lancaster, OH",75,MBA,2026
6508864,615415,Bluffton Beavers,615168,Capital Comets,615415,5,top,Carsen Riddle flied out to lf (1-2 FFB).,48,2026-03-14 10:30:00-04:00,"Lancaster, OH",75,MBA,2026
6508864,615415,Bluffton Beavers,615168,Capital Comets,615168,5,bot,Charlie Colson struck out swinging (3-2 BKBSBS).,49,2026-03-14 10:30:00-04:00,"Lancaster, OH",75,MBA,2026
6508864,615415,Bluffton Beavers,615168,Capital Comets,615168,5,bot,Kielan LaMarr popped up to ss (0-1 K).,50,2026-03-14 10:30:00-04:00,"Lancaster, OH",75,MBA,2026
6508864,615415,Bluffton Beavers,615168,Capital Comets,615168,5,bot,Bryce Kyees flied out to cf (0-0).,51,2026-03-14 10:30:00-04:00,"Lancaster, OH",75,MBA,2026
6508864,615415,Bluffton Beavers,615168,Capital Comets,615415,6,top,Liam George struck out swinging (0-2 SFS).,52,2026-03-14 10:30:00-04:00,"Lancaster, OH",75,MBA,2026
6508864,615415,Bluffton Beavers,615168,Capital Comets,615415,6,top,Torin Long struck out looking (0-2 KFK).,53,2026-03-14 10:30:00-04:00,"Lancaster, OH",75,MBA,2026
6508864,615415,Bluffton Beavers,615168,Capital Comets,615415,6,top,Tyler Forest flied out to lf (1-2 FFFFB).,54,2026-03-14 10:30:00-04:00,"Lancaster, OH",75,MBA,2026
6508864,615415,Bluffton Beavers,615168,Capital Comets,615168,6,bot,Gio Mastrorosa doubled to right center (3-2 FBBBF).,55,2026-03-14 10:30:00-04:00,"Lancaster, OH",75,MBA,2026
6508864,615415,Bluffton Beavers,615168,Capital Comets,615168,6,bot,Ty Clifton popped up to ss (0-0).,56,2026-03-14 10:30:00-04:00,"Lancaster, OH",75,MBA,2026
6508864,615415,Bluffton Beavers,615168,Capital Comets,615168,6,bot,Justin Weaver struck out swinging (2-2 BSFBS).,57,2026-03-14 10:30:00-04:00,"Lancaster, OH",75,MBA,2026
6508864,615415,Bluffton Beavers,615168,Capital Comets,615168,6,bot,Robby Harrison singled to left field (0-0)3a Gio Mastrorosa advanced to third.,58,2026-03-14 10:30:00-04:00,"Lancaster, OH",75,MBA,2026
6508864,615415,Bluffton Beavers,615168,Capital Comets,615168,6,bot,Grayson Gulley struck out swinging (2-2 BSSBS).,59,2026-03-14 10:30:00-04:00,"Lancaster, OH",75,MBA,2026
6508864,615415,Bluffton Beavers,615168,Capital Comets,615415,7,top,Casey Wilkins to p for Nash Andrix.,60,2026-03-14 10:30:00-04:00,"Lancaster, OH",75,MBA,2026
6508864,615415,Bluffton Beavers,615168,Capital Comets,615415,7,top,Drew Snipes flied out to lf (0-2 FFFF).,61,2026-03-14 10:30:00-04:00,"Lancaster, OH",75,MBA,2026
6508864,615415,Bluffton Beavers,615168,Capital Comets,615415,7,top,Ayden Spriggs flied out to rf (3-2 BFFBB).,62,2026-03-14 10:30:00-04:00,"Lancaster, OH",75,MBA,2026
6508864,615415,Bluffton Beavers,615168,Capital Comets,615415,7,top,Xander Greulich lined out to ss (0-1 S).,63,2026-03-14 10:30:00-04:00,"Lancaster, OH",75,MBA,2026
6508864,615415,Bluffton Beavers,615168,Capital Comets,615168,7,bot,Noah Davis to p for Riley Reyna.,64,2026-03-14 10:30:00-04:00,"Lancaster, OH",75,MBA,2026
6508864,615415,Bluffton Beavers,615168,Capital Comets,615168,7,bot,M. Andryszczyk flied out to cf (1-2 SFFB).,65,2026-03-14 10:30:00-04:00,"Lancaster, OH",75,MBA,2026
6508864,615415,Bluffton Beavers,615168,Capital Comets,615168,7,bot,Charlie Colson hit by pitch (2-1 BKH).,66,2026-03-14 10:30:00-04:00,"Lancaster, OH",75,MBA,2026
6508864,615415,Bluffton Beavers,615168,Capital Comets,615168,7,bot,Charlie Colson stole second.,67,2026-03-14 10:30:00-04:00,"Lancaster, OH",75,MBA,2026
6508864,615415,Bluffton Beavers,615168,Capital Comets,615168,7,bot,Kielan LaMarr flied out to cf (1-2 SSBF)3a Charlie Colson advanced to third.,68,2026-03-14 10:30:00-04:00,"Lancaster, OH",75,MBA,2026
6508864,615415,Bluffton Beavers,615168,Capital Comets,615168,7,bot,"Bryce Kyees singled to center field, RBI (3-1 BBBK)3a Charlie Colson scored.",69,2026-03-14 10:30:00-04:00,"Lancaster, OH",75,MBA,2026
6508864,615415,Bluffton Beavers,615168,Capital Comets,615168,7,bot,Gio Mastrorosa hit by pitch (3-2 KBBSH)3a Bryce Kyees advanced to second.,70,2026-03-14 10:30:00-04:00,"Lancaster, OH",75,MBA,2026
6508864,615415,Bluffton Beavers,615168,Capital Comets,615168,7,bot,Ty Clifton flied out to rf (0-0).,71,2026-03-14 10:30:00-04:00,"Lancaster, OH",75,MBA,2026
6508864,615415,Bluffton Beavers,615168,Capital Comets,615415,8,top,Nathan Rorick struck out swinging (2-2 BKBFS).,72,2026-03-14 10:30:00-04:00,"Lancaster, OH",75,MBA,2026
6508864,615415,Bluffton Beavers,615168,Capital Comets,615415,8,top,Sam Archambeau grounded out to 2b (0-1 K).,73,2026-03-14 10:30:00-04:00,"Lancaster, OH",75,MBA,2026
6508864,615415,Bluffton Beavers,615168,Capital Comets,615415,8,top,Carsen Riddle struck out looking (2-2 FBFBK).,74,2026-03-14 10:30:00-04:00,"Lancaster, OH",75,MBA,2026
6508864,615415,Bluffton Beavers,615168,Capital Comets,615168,8,bot,Hutch Crociata pinch hit for Justin Weaver.,75,2026-03-14 10:30:00-04:00,"Lancaster, OH",75,MBA,2026
6508864,615415,Bluffton Beavers,615168,Capital Comets,615168,8,bot,Hutch Crociata walked (3-2 BBKKBB).,76,2026-03-14 10:30:00-04:00,"Lancaster, OH",75,MBA,2026
6508864,615415,Bluffton Beavers,615168,Capital Comets,615168,8,bot,Robby Harrison reached first on a fielding error by ss (0-0)3a Hutch Crociata advanced to second.,77,2026-03-14 10:30:00-04:00,"Lancaster, OH",75,MBA,2026
6508864,615415,Bluffton Beavers,615168,Capital Comets,615168,8,bot,Grayson Gulley struck out swinging (1-2 FBFS).,78,2026-03-14 10:30:00-04:00,"Lancaster, OH",75,MBA,2026
6508864,615415,Bluffton Beavers,615168,Capital Comets,615168,8,bot,M. Andryszczyk fouled out to rf (2-1 BFB)3a Hutch Crociata advanced to third.,79,2026-03-14 10:30:00-04:00,"Lancaster, OH",75,MBA,2026
6508864,615415,Bluffton Beavers,615168,Capital Comets,615168,8,bot,Alexander James to p for Noah Davis.,80,2026-03-14 10:30:00-04:00,"Lancaster, OH",75,MBA,2026
6508864,615415,Bluffton Beavers,615168,Capital Comets,615168,8,bot,Robby Harrison stole second.,81,2026-03-14 10:30:00-04:00,"Lancaster, OH",75,MBA,2026
6508864,615415,Bluffton Beavers,615168,Capital Comets,615168,8,bot,Charlie Colson walked (3-2 BKBFBFFB).,82,2026-03-14 10:30:00-04:00,"Lancaster, OH",75,MBA,2026
6508864,615415,Bluffton Beavers,615168,Capital Comets,615168,8,bot,Kielan LaMarr popped up to 2b (2-1 FBB).,83,2026-03-14 10:30:00-04:00,"Lancaster, OH",75,MBA,2026
6508864,615415,Bluffton Beavers,615168,Capital Comets,615415,9,top,Hutch Crociata to rf.,84,2026-03-14 10:30:00-04:00,"Lancaster, OH",75,MBA,2026
6508864,615415,Bluffton Beavers,615168,Capital Comets,615415,9,top,Liam George struck out looking (3-2 BSBBKK).,85,2026-03-14 10:30:00-04:00,"Lancaster, OH",75,MBA,2026
6508864,615415,Bluffton Beavers,615168,Capital Comets,615415,9,top,Torin Long hit by pitch (2-0 BH).,86,2026-03-14 10:30:00-04:00,"Lancaster, OH",75,MBA,2026
6508864,615415,Bluffton Beavers,615168,Capital Comets,615415,9,top,Tyler Forest singled to center field (1-0 B)3a Torin Long advanced to second.,87,2026-03-14 10:30:00-04:00,"Lancaster, OH",75,MBA,2026
6508864,615415,Bluffton Beavers,615168,Capital Comets,615415,9,top,Drew Snipes struck out swinging (3-2 KBFBFFBFS).,88,2026-03-14 10:30:00-04:00,"Lancaster, OH",75,MBA,2026
6508864,615415,Bluffton Beavers,615168,Capital Comets,615415,9,top,Ayden Spriggs grounded out to 2b (0-2 KK).,89,2026-03-14 10:30:00-04:00,"Lancaster, OH",75,MBA,2026
6508864,615415,Bluffton Beavers,615168,Capital Comets,615168,9,bot,Bryce Kyees singled down the lf line (3-2 FKBFBB).,90,2026-03-14 10:30:00-04:00,"Lancaster, OH",75,MBA,2026
6508864,615415,Bluffton Beavers,615168,Capital Comets,615168,9,bot,Gio Mastrorosa popped up to 3b (1-2 KKB).,91,2026-03-14 10:30:00-04:00,"Lancaster, OH",75,MBA,2026
6508864,615415,Bluffton Beavers,615168,Capital Comets,615168,9,bot,Ty Clifton singled through the left side (1-0 B)3a Bryce Kyees advanced to second.,92,2026-03-14 10:30:00-04:00,"Lancaster, OH",75,MBA,2026
6508864,615415,Bluffton Beavers,615168,Capital Comets,615168,9,bot,Ty Clifton advanced to second3a Bryce Kyees advanced to third on a wild pitch.,93,2026-03-14 10:30:00-04:00,"Lancaster, OH",75,MBA,2026
6508864,615415,Bluffton Beavers,615168,Capital Comets,615168,9,bot,Hutch Crociata walked (3-2 BBKFBFFFB).,94,2026-03-14 10:30:00-04:00,"Lancaster, OH",75,MBA,2026
6508864,615415,Bluffton Beavers,615168,Capital Comets,615168,9,bot,Robby Harrison fouled out to 1b (3-1 KBBB).,95,2026-03-14 10:30:00-04:00,"Lancaster, OH",75,MBA,2026
6508864,615415,Bluffton Beavers,615168,Capital Comets,615168,9,bot,Trent Clark pinch hit for Grayson Gulley.,96,2026-03-14 10:30:00-04:00,"Lancaster, OH",75,MBA,2026
6508864,615415,Bluffton Beavers,615168,Capital Comets,615168,9,bot,Trent Clark popped up to 2b (0-0).,97,2026-03-14 10:30:00-04:00,"Lancaster, OH",75,MBA,2026
