game_id,away_team_id,away_team_name,home_team_id,home_team_name,batting_team,inning,top_bot,event_text,event_num,game_datetime,stadium_name,attendance,sport_id,season
6462557,614881,Harding Bisons,614882,Henderson St. Reddies,614881,1,top,"Bowie,Nathan singled to left field (3-2 FBBFB).",1,2026-03-08T14:00:00-04:00,"Clyde Berry Field (Arkadelphia, AR)",101,MBA,2026
6462557,614881,Harding Bisons,614882,Henderson St. Reddies,614881,1,top,"Lacey,Logan flied out to rf (0-0).",2,2026-03-08T14:00:00-04:00,"Clyde Berry Field (Arkadelphia, AR)",101,MBA,2026
6462557,614881,Harding Bisons,614882,Henderson St. Reddies,614881,1,top,"West,Phoenix reached on a fielder's choice hit to second base (1-0 B); Bowie,Nathan advanced to second base on a fielding error by Rodriguez,Boe (E6).",3,2026-03-08T14:00:00-04:00,"Clyde Berry Field (Arkadelphia, AR)",101,MBA,2026
6462557,614881,Harding Bisons,614882,Henderson St. Reddies,614881,1,top,"Newsom,Cooper fouled out in first base side foul territory putout by 1b (1-2 KSB).",4,2026-03-08T14:00:00-04:00,"Clyde Berry Field (Arkadelphia, AR)",101,MBA,2026
6462557,614881,Harding Bisons,614882,Henderson St. Reddies,614881,1,top,"Helms,Collin grounded out to short, ss to 1b (2-1 BSB).",5,2026-03-08T14:00:00-04:00,"Clyde Berry Field (Arkadelphia, AR)",101,MBA,2026
6462557,614881,Harding Bisons,614882,Henderson St. Reddies,614882,1,bot,"Rodriguez,Boe flied out to rf (3-2 BBBKSF).",6,2026-03-08T14:00:00-04:00,"Clyde Berry Field (Arkadelphia, AR)",101,MBA,2026
6462557,614881,Harding Bisons,614882,Henderson St. Reddies,614882,1,bot,"Campbell,Tripp struck out swinging (0-2 SKS).",7,2026-03-08T14:00:00-04:00,"Clyde Berry Field (Arkadelphia, AR)",101,MBA,2026
6462557,614881,Harding Bisons,614882,Henderson St. Reddies,614882,1,bot,"Ross,Tanner popped up in first base side foul territory putout by 1b (1-2 KSB).",8,2026-03-08T14:00:00-04:00,"Clyde Berry Field (Arkadelphia, AR)",101,MBA,2026
6462557,614881,Harding Bisons,614882,Henderson St. Reddies,614881,2,top,"Davis,Dom ground-rule doubled to left field (0-0).",9,2026-03-08T14:00:00-04:00,"Clyde Berry Field (Arkadelphia, AR)",101,MBA,2026
6462557,614881,Harding Bisons,614882,Henderson St. Reddies,614881,2,top,"Jones,Easton struck out swinging (3-2 BFBBFFS).",10,2026-03-08T14:00:00-04:00,"Clyde Berry Field (Arkadelphia, AR)",101,MBA,2026
6462557,614881,Harding Bisons,614882,Henderson St. Reddies,614881,2,top,"Opoien,Jack struck out swinging (0-2 KKFS).",11,2026-03-08T14:00:00-04:00,"Clyde Berry Field (Arkadelphia, AR)",101,MBA,2026
6462557,614881,Harding Bisons,614882,Henderson St. Reddies,614881,2,top,"Jackson,Johnathan grounded out up the middle, ss to 1b (1-0 B).",12,2026-03-08T14:00:00-04:00,"Clyde Berry Field (Arkadelphia, AR)",101,MBA,2026
6462557,614881,Harding Bisons,614882,Henderson St. Reddies,614882,2,bot,"Garcia,Adam flied out to rf (1-1 SB).",13,2026-03-08T14:00:00-04:00,"Clyde Berry Field (Arkadelphia, AR)",101,MBA,2026
6462557,614881,Harding Bisons,614882,Henderson St. Reddies,614882,2,bot,"McClure,Cooper flied out to cf (2-2 BFSB).",14,2026-03-08T14:00:00-04:00,"Clyde Berry Field (Arkadelphia, AR)",101,MBA,2026
6462557,614881,Harding Bisons,614882,Henderson St. Reddies,614882,2,bot,"Krznarich,Mason flied out to lf (1-1 BF).",15,2026-03-08T14:00:00-04:00,"Clyde Berry Field (Arkadelphia, AR)",101,MBA,2026
6462557,614881,Harding Bisons,614882,Henderson St. Reddies,614881,3,top,"Bowie,Nathan reached on a fielding error fielding by 2b by McClure,Cooper (E4) (0-0).",16,2026-03-08T14:00:00-04:00,"Clyde Berry Field (Arkadelphia, AR)",101,MBA,2026
6462557,614881,Harding Bisons,614882,Henderson St. Reddies,614881,3,top,"Lacey,Logan singled to center field (0-1 K); Bowie,Nathan advanced to second base.",17,2026-03-08T14:00:00-04:00,"Clyde Berry Field (Arkadelphia, AR)",101,MBA,2026
6462557,614881,Harding Bisons,614882,Henderson St. Reddies,614881,3,top,"West,Phoenix grounded out to the infield, 3b to 1b (0-1 K); Bowie,Nathan advanced to third base; Lacey,Logan advanced to second base.",18,2026-03-08T14:00:00-04:00,"Clyde Berry Field (Arkadelphia, AR)",101,MBA,2026
6462557,614881,Harding Bisons,614882,Henderson St. Reddies,614881,3,top,"Newsom,Cooper walked (3-2 FBBFFBB).",19,2026-03-08T14:00:00-04:00,"Clyde Berry Field (Arkadelphia, AR)",101,MBA,2026
6462557,614881,Harding Bisons,614882,Henderson St. Reddies,614881,3,top,"Helms,Collin sacrifice fly to left center putout by lf, RBI (1-0 B); Bowie,Nathan scored, unearned.",20,2026-03-08T14:00:00-04:00,"Clyde Berry Field (Arkadelphia, AR)",101,MBA,2026
6462557,614881,Harding Bisons,614882,Henderson St. Reddies,614881,3,top,"Davis,Dom flied out to cf (1-1 SB).",21,2026-03-08T14:00:00-04:00,"Clyde Berry Field (Arkadelphia, AR)",101,MBA,2026
6462557,614881,Harding Bisons,614882,Henderson St. Reddies,614882,3,bot,"Moore,Nate popped up to the infield putout by 3b (0-0).",22,2026-03-08T14:00:00-04:00,"Clyde Berry Field (Arkadelphia, AR)",101,MBA,2026
6462557,614881,Harding Bisons,614882,Henderson St. Reddies,614882,3,bot,"Fitch,Grant struck out swinging (1-2 KKBS).",23,2026-03-08T14:00:00-04:00,"Clyde Berry Field (Arkadelphia, AR)",101,MBA,2026
6462557,614881,Harding Bisons,614882,Henderson St. Reddies,614882,3,bot,"Edmonds,Cale singled to right field (0-0).",24,2026-03-08T14:00:00-04:00,"Clyde Berry Field (Arkadelphia, AR)",101,MBA,2026
6462557,614881,Harding Bisons,614882,Henderson St. Reddies,614882,3,bot,"Rodriguez,Boe struck out swinging (0-2 KKS).",25,2026-03-08T14:00:00-04:00,"Clyde Berry Field (Arkadelphia, AR)",101,MBA,2026
6462557,614881,Harding Bisons,614882,Henderson St. Reddies,614881,4,top,"Jones,Easton flied out to right center putout by rf (0-1 F).",26,2026-03-08T14:00:00-04:00,"Clyde Berry Field (Arkadelphia, AR)",101,MBA,2026
6462557,614881,Harding Bisons,614882,Henderson St. Reddies,614881,4,top,"Opoien,Jack doubled to left field (0-1 K).",27,2026-03-08T14:00:00-04:00,"Clyde Berry Field (Arkadelphia, AR)",101,MBA,2026
6462557,614881,Harding Bisons,614882,Henderson St. Reddies,614881,4,top,"Jackson,Johnathan struck out swinging (3-2 BFBKBS).",28,2026-03-08T14:00:00-04:00,"Clyde Berry Field (Arkadelphia, AR)",101,MBA,2026
6462557,614881,Harding Bisons,614882,Henderson St. Reddies,614881,4,top,"Bowie,Nathan flied out to lf (2-2 BFKFBFF).",29,2026-03-08T14:00:00-04:00,"Clyde Berry Field (Arkadelphia, AR)",101,MBA,2026
6462557,614881,Harding Bisons,614882,Henderson St. Reddies,614882,4,bot,"Campbell,Tripp struck out swinging (0-2 KFS).",30,2026-03-08T14:00:00-04:00,"Clyde Berry Field (Arkadelphia, AR)",101,MBA,2026
6462557,614881,Harding Bisons,614882,Henderson St. Reddies,614882,4,bot,"Ross,Tanner grounded out, ss to 1b (0-0).",31,2026-03-08T14:00:00-04:00,"Clyde Berry Field (Arkadelphia, AR)",101,MBA,2026
6462557,614881,Harding Bisons,614882,Henderson St. Reddies,614882,4,bot,"Garcia,Adam flied out to lf (2-1 BKB).",32,2026-03-08T14:00:00-04:00,"Clyde Berry Field (Arkadelphia, AR)",101,MBA,2026
6462557,614881,Harding Bisons,614882,Henderson St. Reddies,614881,5,top,"Lacey,Logan walked (3-1 BKBBB).",33,2026-03-08T14:00:00-04:00,"Clyde Berry Field (Arkadelphia, AR)",101,MBA,2026
6462557,614881,Harding Bisons,614882,Henderson St. Reddies,614881,5,top,"West,Phoenix flied out in first base side foul territory putout by rf (0-0).",34,2026-03-08T14:00:00-04:00,"Clyde Berry Field (Arkadelphia, AR)",101,MBA,2026
6462557,614881,Harding Bisons,614882,Henderson St. Reddies,614881,5,top,"Newsom,Cooper flied out to rf (0-1 K).",35,2026-03-08T14:00:00-04:00,"Clyde Berry Field (Arkadelphia, AR)",101,MBA,2026
6462557,614881,Harding Bisons,614882,Henderson St. Reddies,614881,5,top,"Lacey,Logan stole second base.",36,2026-03-08T14:00:00-04:00,"Clyde Berry Field (Arkadelphia, AR)",101,MBA,2026
6462557,614881,Harding Bisons,614882,Henderson St. Reddies,614881,5,top,"Helms,Collin flied out to rf (3-2 KBBFFBFFF).",37,2026-03-08T14:00:00-04:00,"Clyde Berry Field (Arkadelphia, AR)",101,MBA,2026
6462557,614881,Harding Bisons,614882,Henderson St. Reddies,614882,5,bot,"McClure,Cooper singled to left field (0-0).",38,2026-03-08T14:00:00-04:00,"Clyde Berry Field (Arkadelphia, AR)",101,MBA,2026
6462557,614881,Harding Bisons,614882,Henderson St. Reddies,614882,5,bot,"Krznarich,Mason struck out swinging (2-2 FFBFBS).",39,2026-03-08T14:00:00-04:00,"Clyde Berry Field (Arkadelphia, AR)",101,MBA,2026
6462557,614881,Harding Bisons,614882,Henderson St. Reddies,614882,5,bot,"Moore,Nate popped up to second base (0-0).",40,2026-03-08T14:00:00-04:00,"Clyde Berry Field (Arkadelphia, AR)",101,MBA,2026
6462557,614881,Harding Bisons,614882,Henderson St. Reddies,614882,5,bot,"Fitch,Grant singled to right field (1-0 B); McClure,Cooper advanced to second base.",41,2026-03-08T14:00:00-04:00,"Clyde Berry Field (Arkadelphia, AR)",101,MBA,2026
6462557,614881,Harding Bisons,614882,Henderson St. Reddies,614882,5,bot,"Edmonds,Cale struck out swinging (1-2 KKBS).",42,2026-03-08T14:00:00-04:00,"Clyde Berry Field (Arkadelphia, AR)",101,MBA,2026
6462557,614881,Harding Bisons,614882,Henderson St. Reddies,614881,6,top,"Davis,Dom grounded out to short, ss to 1b (0-1 K).",43,2026-03-08T14:00:00-04:00,"Clyde Berry Field (Arkadelphia, AR)",101,MBA,2026
6462557,614881,Harding Bisons,614882,Henderson St. Reddies,614881,6,top,"Jones,Easton struck out swinging (1-2 SSBFFS).",44,2026-03-08T14:00:00-04:00,"Clyde Berry Field (Arkadelphia, AR)",101,MBA,2026
6462557,614881,Harding Bisons,614882,Henderson St. Reddies,614881,6,top,"Opoien,Jack struck out swinging (2-2 FBFBFS).",45,2026-03-08T14:00:00-04:00,"Clyde Berry Field (Arkadelphia, AR)",101,MBA,2026
6462557,614881,Harding Bisons,614882,Henderson St. Reddies,614882,6,bot,"Rodriguez,Boe singled to left field (0-2 KK).",46,2026-03-08T14:00:00-04:00,"Clyde Berry Field (Arkadelphia, AR)",101,MBA,2026
6462557,614881,Harding Bisons,614882,Henderson St. Reddies,614882,6,bot,"Campbell,Tripp popped up up the middle putout by ss (0-0).",47,2026-03-08T14:00:00-04:00,"Clyde Berry Field (Arkadelphia, AR)",101,MBA,2026
6462557,614881,Harding Bisons,614882,Henderson St. Reddies,614882,6,bot,"Ross,Tanner reached on a fielder's choice hit to short (0-1 K); Rodriguez,Boe out at second base, ss to 2b.",48,2026-03-08T14:00:00-04:00,"Clyde Berry Field (Arkadelphia, AR)",101,MBA,2026
6462557,614881,Harding Bisons,614882,Henderson St. Reddies,614882,6,bot,"Garcia,Adam reached on a fielder's choice hit to second base (1-2 KBKF); Ross,Tanner out at second base, 2b to ss.",49,2026-03-08T14:00:00-04:00,"Clyde Berry Field (Arkadelphia, AR)",101,MBA,2026
6462557,614881,Harding Bisons,614882,Henderson St. Reddies,614881,7,top,"Jackson,Johnathan hit by pitch (0-1 KB).",50,2026-03-08T14:00:00-04:00,"Clyde Berry Field (Arkadelphia, AR)",101,MBA,2026
6462557,614881,Harding Bisons,614882,Henderson St. Reddies,614881,7,top,"HSUB pitching change: Bates,Tyler replaces Goines,Dawson.",51,2026-03-08T14:00:00-04:00,"Clyde Berry Field (Arkadelphia, AR)",101,MBA,2026
6462557,614881,Harding Bisons,614882,Henderson St. Reddies,614881,7,top,"Bowie,Nathan grounded out to first base, unassisted (0-2 SF); Jackson,Johnathan advanced to second base.",52,2026-03-08T14:00:00-04:00,"Clyde Berry Field (Arkadelphia, AR)",101,MBA,2026
6462557,614881,Harding Bisons,614882,Henderson St. Reddies,614881,7,top,"Jackson,Johnathan stole third base.",53,2026-03-08T14:00:00-04:00,"Clyde Berry Field (Arkadelphia, AR)",101,MBA,2026
6462557,614881,Harding Bisons,614882,Henderson St. Reddies,614881,7,top,"Lacey,Logan sacrifice fly to cf, RBI (2-2 BKFB); Jackson,Johnathan scored.",54,2026-03-08T14:00:00-04:00,"Clyde Berry Field (Arkadelphia, AR)",101,MBA,2026
6462557,614881,Harding Bisons,614882,Henderson St. Reddies,614881,7,top,"West,Phoenix singled to right field (1-0 B).",55,2026-03-08T14:00:00-04:00,"Clyde Berry Field (Arkadelphia, AR)",101,MBA,2026
6462557,614881,Harding Bisons,614882,Henderson St. Reddies,614881,7,top,"West,Phoenix stole second base.",56,2026-03-08T14:00:00-04:00,"Clyde Berry Field (Arkadelphia, AR)",101,MBA,2026
6462557,614881,Harding Bisons,614882,Henderson St. Reddies,614881,7,top,"Newsom,Cooper hit by pitch (0-1 KB).",57,2026-03-08T14:00:00-04:00,"Clyde Berry Field (Arkadelphia, AR)",101,MBA,2026
6462557,614881,Harding Bisons,614882,Henderson St. Reddies,614881,7,top,"Helms,Collin struck out swinging (2-2 BFBFS).",58,2026-03-08T14:00:00-04:00,"Clyde Berry Field (Arkadelphia, AR)",101,MBA,2026
6462557,614881,Harding Bisons,614882,Henderson St. Reddies,614882,7,bot,"McClure,Cooper singled to center field (2-2 BBKFF).",59,2026-03-08T14:00:00-04:00,"Clyde Berry Field (Arkadelphia, AR)",101,MBA,2026
6462557,614881,Harding Bisons,614882,Henderson St. Reddies,614882,7,bot,"Krznarich,Mason flied out to shallow left field putout by lf (0-1 K).",60,2026-03-08T14:00:00-04:00,"Clyde Berry Field (Arkadelphia, AR)",101,MBA,2026
6462557,614881,Harding Bisons,614882,Henderson St. Reddies,614882,7,bot,"Moore,Nate grounded into double play to short, unassisted (2-1 BBK); McClure,Cooper out at 2B on the play, ss to 1b.",61,2026-03-08T14:00:00-04:00,"Clyde Berry Field (Arkadelphia, AR)",101,MBA,2026
6462557,614881,Harding Bisons,614882,Henderson St. Reddies,614881,8,top,"HSUB pitching change: Richardson,Rhett22 replaces Bates,Tyler.",62,2026-03-08T14:00:00-04:00,"Clyde Berry Field (Arkadelphia, AR)",101,MBA,2026
6462557,614881,Harding Bisons,614882,Henderson St. Reddies,614881,8,top,"Davis,Dom lined out to left center putout by lf (1-1 BF).",63,2026-03-08T14:00:00-04:00,"Clyde Berry Field (Arkadelphia, AR)",101,MBA,2026
6462557,614881,Harding Bisons,614882,Henderson St. Reddies,614881,8,top,"Jones,Easton doubled to left field (0-0).",64,2026-03-08T14:00:00-04:00,"Clyde Berry Field (Arkadelphia, AR)",101,MBA,2026
6462557,614881,Harding Bisons,614882,Henderson St. Reddies,614881,8,top,"Jones,Easton stole third base.",65,2026-03-08T14:00:00-04:00,"Clyde Berry Field (Arkadelphia, AR)",101,MBA,2026
6462557,614881,Harding Bisons,614882,Henderson St. Reddies,614881,8,top,"Opoien,Jack struck out swinging on dropped third strike, out at first c to 1b (0-2 KSS).",66,2026-03-08T14:00:00-04:00,"Clyde Berry Field (Arkadelphia, AR)",101,MBA,2026
6462557,614881,Harding Bisons,614882,Henderson St. Reddies,614881,8,top,"Jackson,Johnathan struck out looking (2-2 BSBKK).",67,2026-03-08T14:00:00-04:00,"Clyde Berry Field (Arkadelphia, AR)",101,MBA,2026
6462557,614881,Harding Bisons,614882,Henderson St. Reddies,614882,8,bot,"Fitch,Grant doubled down the right field line (0-2 SF).",68,2026-03-08T14:00:00-04:00,"Clyde Berry Field (Arkadelphia, AR)",101,MBA,2026
6462557,614881,Harding Bisons,614882,Henderson St. Reddies,614882,8,bot,"HU pitching change: Kelley,Austin replaces Jay,Merritt.",69,2026-03-08T14:00:00-04:00,"Clyde Berry Field (Arkadelphia, AR)",101,MBA,2026
6462557,614881,Harding Bisons,614882,Henderson St. Reddies,614882,8,bot,"HSUB substitution: McClendon,Cole pinch hitting for Edmonds,Cale.",70,2026-03-08T14:00:00-04:00,"Clyde Berry Field (Arkadelphia, AR)",101,MBA,2026
6462557,614881,Harding Bisons,614882,Henderson St. Reddies,614882,8,bot,"McClendon,Cole singled to center field (1-0 B); Fitch,Grant advanced from second base, scored on play and a muffed throw by Jones,Easton (E8); McClendon,Cole advanced to second base on error.",71,2026-03-08T14:00:00-04:00,"Clyde Berry Field (Arkadelphia, AR)",101,MBA,2026
6462557,614881,Harding Bisons,614882,Henderson St. Reddies,614882,8,bot,"McClendon,Cole advanced to third base on a balk.",72,2026-03-08T14:00:00-04:00,"Clyde Berry Field (Arkadelphia, AR)",101,MBA,2026
6462557,614881,Harding Bisons,614882,Henderson St. Reddies,614882,8,bot,"Rodriguez,Boe struck out swinging (3-2 FBSBBS).",73,2026-03-08T14:00:00-04:00,"Clyde Berry Field (Arkadelphia, AR)",101,MBA,2026
6462557,614881,Harding Bisons,614882,Henderson St. Reddies,614882,8,bot,"Campbell,Tripp intentionally walked (2-0 BB).",74,2026-03-08T14:00:00-04:00,"Clyde Berry Field (Arkadelphia, AR)",101,MBA,2026
6462557,614881,Harding Bisons,614882,Henderson St. Reddies,614882,8,bot,"Ross,Tanner reached on a fielder's choice hit to third base, RBI (0-1 K); McClendon,Cole scored; Campbell,Tripp out at second base, 3b to 2b.",75,2026-03-08T14:00:00-04:00,"Clyde Berry Field (Arkadelphia, AR)",101,MBA,2026
6462557,614881,Harding Bisons,614882,Henderson St. Reddies,614882,8,bot,"Garcia,Adam popped up to third base (0-0).",76,2026-03-08T14:00:00-04:00,"Clyde Berry Field (Arkadelphia, AR)",101,MBA,2026
6462557,614881,Harding Bisons,614882,Henderson St. Reddies,614881,9,top,"HSUB substitution: Flake,Trevor replaces McClendon,Cole at 3b, batting 9th.",77,2026-03-08T14:00:00-04:00,"Clyde Berry Field (Arkadelphia, AR)",101,MBA,2026
6462557,614881,Harding Bisons,614882,Henderson St. Reddies,614881,9,top,"Bowie,Nathan reached on a throwing error throwing by ss by Rodriguez,Boe (E6) (1-1 BF).",78,2026-03-08T14:00:00-04:00,"Clyde Berry Field (Arkadelphia, AR)",101,MBA,2026
6462557,614881,Harding Bisons,614882,Henderson St. Reddies,614881,9,top,"Lacey,Logan grounded into double play to short, ss to 2b to 1b (0-0); Bowie,Nathan out at 2B on the play, ss to 2b.",79,2026-03-08T14:00:00-04:00,"Clyde Berry Field (Arkadelphia, AR)",101,MBA,2026
6462557,614881,Harding Bisons,614882,Henderson St. Reddies,614881,9,top,"West,Phoenix flied out to rf (1-2 SBK).",80,2026-03-08T14:00:00-04:00,"Clyde Berry Field (Arkadelphia, AR)",101,MBA,2026
6462557,614881,Harding Bisons,614882,Henderson St. Reddies,614882,9,bot,"McClure,Cooper hit by pitch (1-0 BB).",81,2026-03-08T14:00:00-04:00,"Clyde Berry Field (Arkadelphia, AR)",101,MBA,2026
6462557,614881,Harding Bisons,614882,Henderson St. Reddies,614882,9,bot,"HU pitching change: Howell,Ricky replaces Kelley,Austin.",82,2026-03-08T14:00:00-04:00,"Clyde Berry Field (Arkadelphia, AR)",101,MBA,2026
6462557,614881,Harding Bisons,614882,Henderson St. Reddies,614882,9,bot,"Krznarich,Mason homered to right field, walk off, 2RBI (0-0); McClure,Cooper scored from first base.",83,2026-03-08T14:00:00-04:00,"Clyde Berry Field (Arkadelphia, AR)",101,MBA,2026
