game_id,away_team_id,away_team_name,home_team_id,home_team_name,batting_team,inning,top_bot,event_text,event_num,game_datetime,stadium_name,attendance,sport_id,season
6484273,615102,Caldwell Cougars,614994,Staten Island Dolphins,615102,1,top,"Christian Rinick singled to left field, advanced to second on a fielding error by lf (1-0 B).",1,2026-03-07T12:00:00-05:00,CSI Baseball Complex (NY),175,MBA,2026
6484273,615102,Caldwell Cougars,614994,Staten Island Dolphins,615102,1,top,Stephen Young jr. struck out looking (1-2 BKSK).,2,2026-03-07T12:00:00-05:00,CSI Baseball Complex (NY),175,MBA,2026
6484273,615102,Caldwell Cougars,614994,Staten Island Dolphins,615102,1,top,Jimmy Kurtz grounded out to 1b unassisted (0-1 K); Christian Rinick advanced to third.,3,2026-03-07T12:00:00-05:00,CSI Baseball Complex (NY),175,MBA,2026
6484273,615102,Caldwell Cougars,614994,Staten Island Dolphins,615102,1,top,"Justin Levine singled to left field, RBI (0-2 KK); Christian Rinick scored, unearned.",4,2026-03-07T12:00:00-05:00,CSI Baseball Complex (NY),175,MBA,2026
6484273,615102,Caldwell Cougars,614994,Staten Island Dolphins,615102,1,top,Jimmy Turchi flied out to rf (1-2 BSSF).,5,2026-03-07T12:00:00-05:00,CSI Baseball Complex (NY),175,MBA,2026
6484273,615102,Caldwell Cougars,614994,Staten Island Dolphins,614994,1,bot,Jamel Vera singled to center field (0-0).,6,2026-03-07T12:00:00-05:00,CSI Baseball Complex (NY),175,MBA,2026
6484273,615102,Caldwell Cougars,614994,Staten Island Dolphins,614994,1,bot,Jamel Vera stole second.,7,2026-03-07T12:00:00-05:00,CSI Baseball Complex (NY),175,MBA,2026
6484273,615102,Caldwell Cougars,614994,Staten Island Dolphins,614994,1,bot,Michael Flashner walked (3-1 KBBBB).,8,2026-03-07T12:00:00-05:00,CSI Baseball Complex (NY),175,MBA,2026
6484273,615102,Caldwell Cougars,614994,Staten Island Dolphins,614994,1,bot,Jason Romance grounded out to p (0-1 K); Michael Flashner advanced to second; Jamel Vera advanced to third.,9,2026-03-07T12:00:00-05:00,CSI Baseball Complex (NY),175,MBA,2026
6484273,615102,Caldwell Cougars,614994,Staten Island Dolphins,614994,1,bot,"JJ Hunter flied out to lf, sacrifice fly, RBI (1-2 BKK); Jamel Vera scored.",10,2026-03-07T12:00:00-05:00,CSI Baseball Complex (NY),175,MBA,2026
6484273,615102,Caldwell Cougars,614994,Staten Island Dolphins,614994,1,bot,Jack Kehoe walked (3-1 BFBBB).,11,2026-03-07T12:00:00-05:00,CSI Baseball Complex (NY),175,MBA,2026
6484273,615102,Caldwell Cougars,614994,Staten Island Dolphins,614994,1,bot,Ryan Ortega grounded out to 1b unassisted (0-2 SK).,12,2026-03-07T12:00:00-05:00,CSI Baseball Complex (NY),175,MBA,2026
6484273,615102,Caldwell Cougars,614994,Staten Island Dolphins,615102,2,top,Ethan Arter struck out swinging (1-2 FKFBS).,13,2026-03-07T12:00:00-05:00,CSI Baseball Complex (NY),175,MBA,2026
6484273,615102,Caldwell Cougars,614994,Staten Island Dolphins,615102,2,top,Alan Hernandez reached first on a fielding error by ss (1-2 FSB).,14,2026-03-07T12:00:00-05:00,CSI Baseball Complex (NY),175,MBA,2026
6484273,615102,Caldwell Cougars,614994,Staten Island Dolphins,615102,2,top,Alan Hernandez stole second.,15,2026-03-07T12:00:00-05:00,CSI Baseball Complex (NY),175,MBA,2026
6484273,615102,Caldwell Cougars,614994,Staten Island Dolphins,615102,2,top,"Enrique Beltra doubled to left center, RBI (2-1 FBB); Alan Hernandez scored.",16,2026-03-07T12:00:00-05:00,CSI Baseball Complex (NY),175,MBA,2026
6484273,615102,Caldwell Cougars,614994,Staten Island Dolphins,615102,2,top,Izaiah Robinson grounded out to 2b (1-2 BSF); Enrique Beltra advanced to third.,17,2026-03-07T12:00:00-05:00,CSI Baseball Complex (NY),175,MBA,2026
6484273,615102,Caldwell Cougars,614994,Staten Island Dolphins,615102,2,top,"Christian Rinick doubled down the rf line, RBI (2-1 KBB); Enrique Beltra scored.",18,2026-03-07T12:00:00-05:00,CSI Baseball Complex (NY),175,MBA,2026
6484273,615102,Caldwell Cougars,614994,Staten Island Dolphins,615102,2,top,Christian Rinick advanced to third on a wild pitch.,19,2026-03-07T12:00:00-05:00,CSI Baseball Complex (NY),175,MBA,2026
6484273,615102,Caldwell Cougars,614994,Staten Island Dolphins,615102,2,top,Stephen Young jr. struck out swinging (2-2 KSBBS).,20,2026-03-07T12:00:00-05:00,CSI Baseball Complex (NY),175,MBA,2026
6484273,615102,Caldwell Cougars,614994,Staten Island Dolphins,614994,2,bot,Jaden Waterman walked (3-1 BBBKB).,21,2026-03-07T12:00:00-05:00,CSI Baseball Complex (NY),175,MBA,2026
6484273,615102,Caldwell Cougars,614994,Staten Island Dolphins,614994,2,bot,Nicholas Rodriguez walked (3-2 BKBKBFB); Jaden Waterman advanced to second.,22,2026-03-07T12:00:00-05:00,CSI Baseball Complex (NY),175,MBA,2026
6484273,615102,Caldwell Cougars,614994,Staten Island Dolphins,614994,2,bot,Brandon Bartick reached on a fielder's choice (3-2 KBFFBFB); Nicholas Rodriguez out at second 3b to 2b; Jaden Waterman advanced to third.,23,2026-03-07T12:00:00-05:00,CSI Baseball Complex (NY),175,MBA,2026
6484273,615102,Caldwell Cougars,614994,Staten Island Dolphins,614994,2,bot,"Jamel Vera reached first on a fielding error by 2b, RBI (0-1 K); Brandon Bartick advanced to second; Jaden Waterman scored.",24,2026-03-07T12:00:00-05:00,CSI Baseball Complex (NY),175,MBA,2026
6484273,615102,Caldwell Cougars,614994,Staten Island Dolphins,614994,2,bot,"Michael Flashner singled up the middle, RBI (1-2 BSF); Jamel Vera advanced to second; Brandon Bartick scored.",25,2026-03-07T12:00:00-05:00,CSI Baseball Complex (NY),175,MBA,2026
6484273,615102,Caldwell Cougars,614994,Staten Island Dolphins,614994,2,bot,Jason Romance grounded into double play 3b to 1b (0-0); Michael Flashner advanced to second; Jamel Vera out on the play.,26,2026-03-07T12:00:00-05:00,CSI Baseball Complex (NY),175,MBA,2026
6484273,615102,Caldwell Cougars,614994,Staten Island Dolphins,615102,3,top,Jimmy Kurtz singled through the right side (0-2 KK).,27,2026-03-07T12:00:00-05:00,CSI Baseball Complex (NY),175,MBA,2026
6484273,615102,Caldwell Cougars,614994,Staten Island Dolphins,615102,3,top,Justin Levine lined out to cf (2-2 KBBK).,28,2026-03-07T12:00:00-05:00,CSI Baseball Complex (NY),175,MBA,2026
6484273,615102,Caldwell Cougars,614994,Staten Island Dolphins,615102,3,top,Jimmy Turchi grounded out to 3b (0-0); Jimmy Kurtz advanced to second.,29,2026-03-07T12:00:00-05:00,CSI Baseball Complex (NY),175,MBA,2026
6484273,615102,Caldwell Cougars,614994,Staten Island Dolphins,615102,3,top,Ethan Arter walked (3-0 BBBB).,30,2026-03-07T12:00:00-05:00,CSI Baseball Complex (NY),175,MBA,2026
6484273,615102,Caldwell Cougars,614994,Staten Island Dolphins,615102,3,top,"Alan Hernandez doubled to right center, out at third rf to ss to 3b, 2 RBI (2-2 BFBF); Ethan Arter scored; Jimmy Kurtz scored.",31,2026-03-07T12:00:00-05:00,CSI Baseball Complex (NY),175,MBA,2026
6484273,615102,Caldwell Cougars,614994,Staten Island Dolphins,614994,3,bot,JJ Hunter walked (3-0 BBBB).,32,2026-03-07T12:00:00-05:00,CSI Baseball Complex (NY),175,MBA,2026
6484273,615102,Caldwell Cougars,614994,Staten Island Dolphins,614994,3,bot,Jack Kehoe struck out swinging (2-2 BBFSS).,33,2026-03-07T12:00:00-05:00,CSI Baseball Complex (NY),175,MBA,2026
6484273,615102,Caldwell Cougars,614994,Staten Island Dolphins,614994,3,bot,Ryan Ortega fouled out to c (0-1 K).,34,2026-03-07T12:00:00-05:00,CSI Baseball Complex (NY),175,MBA,2026
6484273,615102,Caldwell Cougars,614994,Staten Island Dolphins,614994,3,bot,"Jaden Waterman homered to center field, 2 RBI (2-2 SBBF); JJ Hunter scored.",35,2026-03-07T12:00:00-05:00,CSI Baseball Complex (NY),175,MBA,2026
6484273,615102,Caldwell Cougars,614994,Staten Island Dolphins,614994,3,bot,Nicholas Rodriguez walked (3-0 BBBB).,36,2026-03-07T12:00:00-05:00,CSI Baseball Complex (NY),175,MBA,2026
6484273,615102,Caldwell Cougars,614994,Staten Island Dolphins,614994,3,bot,Brandon Bartick singled to shortstop (2-1 KBB); Nicholas Rodriguez advanced to second.,37,2026-03-07T12:00:00-05:00,CSI Baseball Complex (NY),175,MBA,2026
6484273,615102,Caldwell Cougars,614994,Staten Island Dolphins,614994,3,bot,Jonathan Gambone to p for Vinny Sangataldo.,38,2026-03-07T12:00:00-05:00,CSI Baseball Complex (NY),175,MBA,2026
6484273,615102,Caldwell Cougars,614994,Staten Island Dolphins,614994,3,bot,"Jamel Vera doubled to right field, RBI (1-0 B); Brandon Bartick advanced to third; Nicholas Rodriguez scored.",39,2026-03-07T12:00:00-05:00,CSI Baseball Complex (NY),175,MBA,2026
6484273,615102,Caldwell Cougars,614994,Staten Island Dolphins,614994,3,bot,Michael Flashner popped up to lf (0-2 KF).,40,2026-03-07T12:00:00-05:00,CSI Baseball Complex (NY),175,MBA,2026
6484273,615102,Caldwell Cougars,614994,Staten Island Dolphins,615102,4,top,Enrique Beltra walked (3-2 KBBBKB).,41,2026-03-07T12:00:00-05:00,CSI Baseball Complex (NY),175,MBA,2026
6484273,615102,Caldwell Cougars,614994,Staten Island Dolphins,615102,4,top,Ryan Palm to p for Aidan Kielty.,42,2026-03-07T12:00:00-05:00,CSI Baseball Complex (NY),175,MBA,2026
6484273,615102,Caldwell Cougars,614994,Staten Island Dolphins,615102,4,top,Izaiah Robinson popped up to ss (1-2 BFF).,43,2026-03-07T12:00:00-05:00,CSI Baseball Complex (NY),175,MBA,2026
6484273,615102,Caldwell Cougars,614994,Staten Island Dolphins,615102,4,top,Christian Rinick flied out to lf (0-0).,44,2026-03-07T12:00:00-05:00,CSI Baseball Complex (NY),175,MBA,2026
6484273,615102,Caldwell Cougars,614994,Staten Island Dolphins,615102,4,top,Stephen Young jr. flied out to rf (1-2 KSBF).,45,2026-03-07T12:00:00-05:00,CSI Baseball Complex (NY),175,MBA,2026
6484273,615102,Caldwell Cougars,614994,Staten Island Dolphins,614994,4,bot,Jason Romance flied out to rf (3-1 BKBB).,46,2026-03-07T12:00:00-05:00,CSI Baseball Complex (NY),175,MBA,2026
6484273,615102,Caldwell Cougars,614994,Staten Island Dolphins,614994,4,bot,JJ Hunter struck out looking (1-2 KFFBFK).,47,2026-03-07T12:00:00-05:00,CSI Baseball Complex (NY),175,MBA,2026
6484273,615102,Caldwell Cougars,614994,Staten Island Dolphins,614994,4,bot,Jack Kehoe struck out swinging (1-2 BKKS).,48,2026-03-07T12:00:00-05:00,CSI Baseball Complex (NY),175,MBA,2026
6484273,615102,Caldwell Cougars,614994,Staten Island Dolphins,615102,5,top,Jimmy Kurtz grounded out to 1b unassisted (0-1 K).,49,2026-03-07T12:00:00-05:00,CSI Baseball Complex (NY),175,MBA,2026
6484273,615102,Caldwell Cougars,614994,Staten Island Dolphins,615102,5,top,"Justin Levine struck out swinging, out at first c to 1b (2-2 BKKBS).",50,2026-03-07T12:00:00-05:00,CSI Baseball Complex (NY),175,MBA,2026
6484273,615102,Caldwell Cougars,614994,Staten Island Dolphins,615102,5,top,Jimmy Turchi singled through the left side (2-1 BBF).,51,2026-03-07T12:00:00-05:00,CSI Baseball Complex (NY),175,MBA,2026
6484273,615102,Caldwell Cougars,614994,Staten Island Dolphins,615102,5,top,Ethan Arter grounded out to 3b (2-0 BB).,52,2026-03-07T12:00:00-05:00,CSI Baseball Complex (NY),175,MBA,2026
6484273,615102,Caldwell Cougars,614994,Staten Island Dolphins,614994,5,bot,Ryan Ortega grounded out to ss (0-0).,53,2026-03-07T12:00:00-05:00,CSI Baseball Complex (NY),175,MBA,2026
6484273,615102,Caldwell Cougars,614994,Staten Island Dolphins,614994,5,bot,Jaden Waterman grounded out to 3b (1-1 KB).,54,2026-03-07T12:00:00-05:00,CSI Baseball Complex (NY),175,MBA,2026
6484273,615102,Caldwell Cougars,614994,Staten Island Dolphins,614994,5,bot,Nicholas Rodriguez grounded out to 3b (1-1 BK).,55,2026-03-07T12:00:00-05:00,CSI Baseball Complex (NY),175,MBA,2026
6484273,615102,Caldwell Cougars,614994,Staten Island Dolphins,615102,6,top,Ryan Fiore to p for Ryan Palm.,56,2026-03-07T12:00:00-05:00,CSI Baseball Complex (NY),175,MBA,2026
6484273,615102,Caldwell Cougars,614994,Staten Island Dolphins,615102,6,top,Alan Hernandez singled to left center (0-0).,57,2026-03-07T12:00:00-05:00,CSI Baseball Complex (NY),175,MBA,2026
6484273,615102,Caldwell Cougars,614994,Staten Island Dolphins,615102,6,top,"Enrique Beltra homered to center field, 2 RBI (2-0 BB); Alan Hernandez scored.",58,2026-03-07T12:00:00-05:00,CSI Baseball Complex (NY),175,MBA,2026
6484273,615102,Caldwell Cougars,614994,Staten Island Dolphins,615102,6,top,Izaiah Robinson struck out swinging (2-2 FBFFBS).,59,2026-03-07T12:00:00-05:00,CSI Baseball Complex (NY),175,MBA,2026
6484273,615102,Caldwell Cougars,614994,Staten Island Dolphins,615102,6,top,Christian Rinick flied out to rf (3-1 KBBB).,60,2026-03-07T12:00:00-05:00,CSI Baseball Complex (NY),175,MBA,2026
6484273,615102,Caldwell Cougars,614994,Staten Island Dolphins,615102,6,top,Stephen Young jr. flied out to cf (0-0).,61,2026-03-07T12:00:00-05:00,CSI Baseball Complex (NY),175,MBA,2026
6484273,615102,Caldwell Cougars,614994,Staten Island Dolphins,614994,6,bot,Brandon Bartick flied out to cf (1-2 SFFB).,62,2026-03-07T12:00:00-05:00,CSI Baseball Complex (NY),175,MBA,2026
6484273,615102,Caldwell Cougars,614994,Staten Island Dolphins,614994,6,bot,"Jamel Vera singled to pitcher, bunt (1-1 FB).",63,2026-03-07T12:00:00-05:00,CSI Baseball Complex (NY),175,MBA,2026
6484273,615102,Caldwell Cougars,614994,Staten Island Dolphins,614994,6,bot,"Jamel Vera advanced to third on a throwing error by p, failed pickoff attempt.",64,2026-03-07T12:00:00-05:00,CSI Baseball Complex (NY),175,MBA,2026
6484273,615102,Caldwell Cougars,614994,Staten Island Dolphins,614994,6,bot,"Michael Flashner flied out to cf, sacrifice fly, RBI (1-1 KB); Jamel Vera scored, unearned.",65,2026-03-07T12:00:00-05:00,CSI Baseball Complex (NY),175,MBA,2026
6484273,615102,Caldwell Cougars,614994,Staten Island Dolphins,614994,6,bot,Jason Romance walked (3-1 BBBKB).,66,2026-03-07T12:00:00-05:00,CSI Baseball Complex (NY),175,MBA,2026
6484273,615102,Caldwell Cougars,614994,Staten Island Dolphins,614994,6,bot,JJ Hunter popped up to rf (2-2 BBFS).,67,2026-03-07T12:00:00-05:00,CSI Baseball Complex (NY),175,MBA,2026
6484273,615102,Caldwell Cougars,614994,Staten Island Dolphins,615102,7,top,Jack Kehoe to p.,68,2026-03-07T12:00:00-05:00,CSI Baseball Complex (NY),175,MBA,2026
6484273,615102,Caldwell Cougars,614994,Staten Island Dolphins,615102,7,top,Tommy Bressmer to rf for Ryan Fiore.,69,2026-03-07T12:00:00-05:00,CSI Baseball Complex (NY),175,MBA,2026
6484273,615102,Caldwell Cougars,614994,Staten Island Dolphins,615102,7,top,Jimmy Kurtz doubled to right center (1-1 BS).,70,2026-03-07T12:00:00-05:00,CSI Baseball Complex (NY),175,MBA,2026
6484273,615102,Caldwell Cougars,614994,Staten Island Dolphins,615102,7,top,Justin Levine hit by pitch (1-0 H).,71,2026-03-07T12:00:00-05:00,CSI Baseball Complex (NY),175,MBA,2026
6484273,615102,Caldwell Cougars,614994,Staten Island Dolphins,615102,7,top,Jimmy Turchi struck out swinging (0-2 FFS).,72,2026-03-07T12:00:00-05:00,CSI Baseball Complex (NY),175,MBA,2026
6484273,615102,Caldwell Cougars,614994,Staten Island Dolphins,615102,7,top,Ethan Arter lined out to cf (1-2 KBFF).,73,2026-03-07T12:00:00-05:00,CSI Baseball Complex (NY),175,MBA,2026
6484273,615102,Caldwell Cougars,614994,Staten Island Dolphins,615102,7,top,Alan Hernandez struck out swinging (2-2 SFBBS).,74,2026-03-07T12:00:00-05:00,CSI Baseball Complex (NY),175,MBA,2026
6484273,615102,Caldwell Cougars,614994,Staten Island Dolphins,614994,7,bot,Jack Kehoe grounded out to 2b (0-0).,75,2026-03-07T12:00:00-05:00,CSI Baseball Complex (NY),175,MBA,2026
6484273,615102,Caldwell Cougars,614994,Staten Island Dolphins,614994,7,bot,Ryan Ortega grounded out to ss (1-2 KSB).,76,2026-03-07T12:00:00-05:00,CSI Baseball Complex (NY),175,MBA,2026
6484273,615102,Caldwell Cougars,614994,Staten Island Dolphins,614994,7,bot,Jaden Waterman walked (3-0 BBBB).,77,2026-03-07T12:00:00-05:00,CSI Baseball Complex (NY),175,MBA,2026
6484273,615102,Caldwell Cougars,614994,Staten Island Dolphins,614994,7,bot,Nicholas Rodriguez flied out to rf (1-2 KBS).,78,2026-03-07T12:00:00-05:00,CSI Baseball Complex (NY),175,MBA,2026
6484273,615102,Caldwell Cougars,614994,Staten Island Dolphins,615102,8,top,Enrique Beltra walked (3-2 BBSBKB).,79,2026-03-07T12:00:00-05:00,CSI Baseball Complex (NY),175,MBA,2026
6484273,615102,Caldwell Cougars,614994,Staten Island Dolphins,615102,8,top,Izaiah Robinson singled to center field (2-1 KBB); Enrique Beltra advanced to second.,80,2026-03-07T12:00:00-05:00,CSI Baseball Complex (NY),175,MBA,2026
6484273,615102,Caldwell Cougars,614994,Staten Island Dolphins,615102,8,top,Christian Rinick reached on a fielder's choice (0-0); Izaiah Robinson advanced to second; Enrique Beltra out at third p to 3b.,81,2026-03-07T12:00:00-05:00,CSI Baseball Complex (NY),175,MBA,2026
6484273,615102,Caldwell Cougars,614994,Staten Island Dolphins,615102,8,top,Christian Rinick stole second; Izaiah Robinson stole third.,82,2026-03-07T12:00:00-05:00,CSI Baseball Complex (NY),175,MBA,2026
6484273,615102,Caldwell Cougars,614994,Staten Island Dolphins,615102,8,top,"Stephen Young jr. flied out to cf, sacrifice fly, RBI (1-2 BSK); Christian Rinick advanced to third; Izaiah Robinson scored.",83,2026-03-07T12:00:00-05:00,CSI Baseball Complex (NY),175,MBA,2026
6484273,615102,Caldwell Cougars,614994,Staten Island Dolphins,615102,8,top,Jimmy Kurtz grounded out to 1b unassisted (2-0 BB).,84,2026-03-07T12:00:00-05:00,CSI Baseball Complex (NY),175,MBA,2026
6484273,615102,Caldwell Cougars,614994,Staten Island Dolphins,614994,8,bot,John Rigas to p for Jonathan Gambone.,85,2026-03-07T12:00:00-05:00,CSI Baseball Complex (NY),175,MBA,2026
6484273,615102,Caldwell Cougars,614994,Staten Island Dolphins,614994,8,bot,Vin Vargas to 2b for Stephen Young jr..,86,2026-03-07T12:00:00-05:00,CSI Baseball Complex (NY),175,MBA,2026
6484273,615102,Caldwell Cougars,614994,Staten Island Dolphins,614994,8,bot,Brandon Bartick struck out swinging (1-2 BSFS).,87,2026-03-07T12:00:00-05:00,CSI Baseball Complex (NY),175,MBA,2026
6484273,615102,Caldwell Cougars,614994,Staten Island Dolphins,614994,8,bot,Jamel Vera lined out to 1b (0-0).,88,2026-03-07T12:00:00-05:00,CSI Baseball Complex (NY),175,MBA,2026
6484273,615102,Caldwell Cougars,614994,Staten Island Dolphins,614994,8,bot,Michael Flashner doubled to left center (0-2 FK).,89,2026-03-07T12:00:00-05:00,CSI Baseball Complex (NY),175,MBA,2026
6484273,615102,Caldwell Cougars,614994,Staten Island Dolphins,614994,8,bot,Jason Romance reached on a fielder's choice (1-0 B); Michael Flashner out at third 3b unassisted.,90,2026-03-07T12:00:00-05:00,CSI Baseball Complex (NY),175,MBA,2026
