game_id,away_team_id,away_team_name,home_team_id,home_team_name,batting_team,inning,top_bot,event_text,event_num,game_datetime,stadium_name,attendance,sport_id,season
6484356,615006,Augusta Jaguars,617152,Middle Georgia Knights,615006,1,top,Nate Martin hit by pitch (3-2 BKSBH).,1,2026-03-14T14:00:00-04:00,"Stuckey Field (Macon , GA)",175,MBA,2026
6484356,615006,Augusta Jaguars,617152,Middle Georgia Knights,615006,1,top,Matty Go walked (3-0 BBBB); Nate Martin advanced to second.,2,2026-03-14T14:00:00-04:00,"Stuckey Field (Macon , GA)",175,MBA,2026
6484356,615006,Augusta Jaguars,617152,Middle Georgia Knights,615006,1,top,Nolan Turner struck out swinging (3-2 BBBKSS).,3,2026-03-14T14:00:00-04:00,"Stuckey Field (Macon , GA)",175,MBA,2026
6484356,615006,Augusta Jaguars,617152,Middle Georgia Knights,615006,1,top,Landon Leonard hit by pitch (1-1 KH); Matty Go advanced to second; Nate Martin advanced to third.,4,2026-03-14T14:00:00-04:00,"Stuckey Field (Macon , GA)",175,MBA,2026
6484356,615006,Augusta Jaguars,617152,Middle Georgia Knights,615006,1,top,"Aidan Cannaday walked, RBI (3-2 BFBFBFB); Landon Leonard advanced to second; Matty Go advanced to third; Nate Martin scored.",5,2026-03-14T14:00:00-04:00,"Stuckey Field (Macon , GA)",175,MBA,2026
6484356,615006,Augusta Jaguars,617152,Middle Georgia Knights,615006,1,top,"KJ Moon flied out to cf, sacrifice fly, RBI (0-0); Landon Leonard advanced to third; Matty Go scored.",6,2026-03-14T14:00:00-04:00,"Stuckey Field (Macon , GA)",175,MBA,2026
6484356,615006,Augusta Jaguars,617152,Middle Georgia Knights,615006,1,top,Roland Chance struck out swinging (2-2 KBBFS).,7,2026-03-14T14:00:00-04:00,"Stuckey Field (Macon , GA)",175,MBA,2026
6484356,615006,Augusta Jaguars,617152,Middle Georgia Knights,617152,1,bot,"Teonis Pimentel homered to left field, RBI (2-0 BB).",8,2026-03-14T14:00:00-04:00,"Stuckey Field (Macon , GA)",175,MBA,2026
6484356,615006,Augusta Jaguars,617152,Middle Georgia Knights,617152,1,bot,Justin Aponte singled up the middle (0-1 S).,9,2026-03-14T14:00:00-04:00,"Stuckey Field (Macon , GA)",175,MBA,2026
6484356,615006,Augusta Jaguars,617152,Middle Georgia Knights,617152,1,bot,Mikal Ashley hit by pitch (2-1 BFH); Justin Aponte advanced to second.,10,2026-03-14T14:00:00-04:00,"Stuckey Field (Macon , GA)",175,MBA,2026
6484356,615006,Augusta Jaguars,617152,Middle Georgia Knights,617152,1,bot,Justin Aponte stole third.,11,2026-03-14T14:00:00-04:00,"Stuckey Field (Macon , GA)",175,MBA,2026
6484356,615006,Augusta Jaguars,617152,Middle Georgia Knights,617152,1,bot,"Sebastian Collender singled through the right side, RBI (2-1 KBB); Mikal Ashley advanced to second; Justin Aponte scored.",12,2026-03-14T14:00:00-04:00,"Stuckey Field (Macon , GA)",175,MBA,2026
6484356,615006,Augusta Jaguars,617152,Middle Georgia Knights,617152,1,bot,Patrick Crosby struck out looking (1-2 KKBK).,13,2026-03-14T14:00:00-04:00,"Stuckey Field (Macon , GA)",175,MBA,2026
6484356,615006,Augusta Jaguars,617152,Middle Georgia Knights,617152,1,bot,Luke Davis singled through the left side (1-0 B); Sebastian Collender advanced to second; Mikal Ashley advanced to third.,14,2026-03-14T14:00:00-04:00,"Stuckey Field (Macon , GA)",175,MBA,2026
6484356,615006,Augusta Jaguars,617152,Middle Georgia Knights,617152,1,bot,"Seve Fernandez flied out to rf, sacrifice fly, RBI (0-1 K); Luke Davis advanced to second; Sebastian Collender out at third rf to c to 2b to 3b; Mikal Ashley scored.",15,2026-03-14T14:00:00-04:00,"Stuckey Field (Macon , GA)",175,MBA,2026
6484356,615006,Augusta Jaguars,617152,Middle Georgia Knights,615006,2,top,Jake Vachon struck out looking (2-2 KBSBK).,16,2026-03-14T14:00:00-04:00,"Stuckey Field (Macon , GA)",175,MBA,2026
6484356,615006,Augusta Jaguars,617152,Middle Georgia Knights,615006,2,top,Jakob Cowart walked (3-0 BBBB).,17,2026-03-14T14:00:00-04:00,"Stuckey Field (Macon , GA)",175,MBA,2026
6484356,615006,Augusta Jaguars,617152,Middle Georgia Knights,615006,2,top,Jakob Cowart stole second.,18,2026-03-14T14:00:00-04:00,"Stuckey Field (Macon , GA)",175,MBA,2026
6484356,615006,Augusta Jaguars,617152,Middle Georgia Knights,615006,2,top,Jakob Cowart advanced to third on a wild pitch.,19,2026-03-14T14:00:00-04:00,"Stuckey Field (Macon , GA)",175,MBA,2026
6484356,615006,Augusta Jaguars,617152,Middle Georgia Knights,615006,2,top,Nate Martin walked (3-1 FBBBB).,20,2026-03-14T14:00:00-04:00,"Stuckey Field (Macon , GA)",175,MBA,2026
6484356,615006,Augusta Jaguars,617152,Middle Georgia Knights,615006,2,top,Brodie Keener to p for Steven Sams.,21,2026-03-14T14:00:00-04:00,"Stuckey Field (Macon , GA)",175,MBA,2026
6484356,615006,Augusta Jaguars,617152,Middle Georgia Knights,615006,2,top,"Matty Go flied out to cf, sacrifice fly, RBI (2-0 BB); Jakob Cowart scored.",22,2026-03-14T14:00:00-04:00,"Stuckey Field (Macon , GA)",175,MBA,2026
6484356,615006,Augusta Jaguars,617152,Middle Georgia Knights,615006,2,top,Nolan Turner reached on a fielder's choice (0-1 K); Nate Martin out at second ss to 2b.,23,2026-03-14T14:00:00-04:00,"Stuckey Field (Macon , GA)",175,MBA,2026
6484356,615006,Augusta Jaguars,617152,Middle Georgia Knights,617152,2,bot,Jonathan Bay flied out to rf (0-1 F).,24,2026-03-14T14:00:00-04:00,"Stuckey Field (Macon , GA)",175,MBA,2026
6484356,615006,Augusta Jaguars,617152,Middle Georgia Knights,617152,2,bot,Reco Coney singled to shortstop (2-2 KBKB).,25,2026-03-14T14:00:00-04:00,"Stuckey Field (Macon , GA)",175,MBA,2026
6484356,615006,Augusta Jaguars,617152,Middle Georgia Knights,617152,2,bot,Reco Coney stole second.,26,2026-03-14T14:00:00-04:00,"Stuckey Field (Macon , GA)",175,MBA,2026
6484356,615006,Augusta Jaguars,617152,Middle Georgia Knights,617152,2,bot,Teonis Pimentel fouled out to 1b (2-2 BKBK).,27,2026-03-14T14:00:00-04:00,"Stuckey Field (Macon , GA)",175,MBA,2026
6484356,615006,Augusta Jaguars,617152,Middle Georgia Knights,617152,2,bot,Justin Aponte grounded out to p (0-1 K).,28,2026-03-14T14:00:00-04:00,"Stuckey Field (Macon , GA)",175,MBA,2026
6484356,615006,Augusta Jaguars,617152,Middle Georgia Knights,615006,3,top,Landon Leonard grounded out to ss (1-2 KKB).,29,2026-03-14T14:00:00-04:00,"Stuckey Field (Macon , GA)",175,MBA,2026
6484356,615006,Augusta Jaguars,617152,Middle Georgia Knights,615006,3,top,Aidan Cannaday struck out swinging (1-2 KBSS).,30,2026-03-14T14:00:00-04:00,"Stuckey Field (Macon , GA)",175,MBA,2026
6484356,615006,Augusta Jaguars,617152,Middle Georgia Knights,615006,3,top,KJ Moon walked (3-2 BBBKFFB).,31,2026-03-14T14:00:00-04:00,"Stuckey Field (Macon , GA)",175,MBA,2026
6484356,615006,Augusta Jaguars,617152,Middle Georgia Knights,615006,3,top,KJ Moon advanced to second on a wild pitch.,32,2026-03-14T14:00:00-04:00,"Stuckey Field (Macon , GA)",175,MBA,2026
6484356,615006,Augusta Jaguars,617152,Middle Georgia Knights,615006,3,top,Roland Chance struck out swinging (3-2 KBKBBS).,33,2026-03-14T14:00:00-04:00,"Stuckey Field (Macon , GA)",175,MBA,2026
6484356,615006,Augusta Jaguars,617152,Middle Georgia Knights,617152,3,bot,Mikal Ashley singled up the middle (2-2 KSBB).,34,2026-03-14T14:00:00-04:00,"Stuckey Field (Macon , GA)",175,MBA,2026
6484356,615006,Augusta Jaguars,617152,Middle Georgia Knights,617152,3,bot,Sebastian Collender singled to center field (0-0); Mikal Ashley advanced to second.,35,2026-03-14T14:00:00-04:00,"Stuckey Field (Macon , GA)",175,MBA,2026
6484356,615006,Augusta Jaguars,617152,Middle Georgia Knights,617152,3,bot,Sebastian Collender advanced to second; Mikal Ashley advanced to third on a wild pitch.,36,2026-03-14T14:00:00-04:00,"Stuckey Field (Macon , GA)",175,MBA,2026
6484356,615006,Augusta Jaguars,617152,Middle Georgia Knights,617152,3,bot,Patrick Crosby grounded out to ss (2-2 FFBB).,37,2026-03-14T14:00:00-04:00,"Stuckey Field (Macon , GA)",175,MBA,2026
6484356,615006,Augusta Jaguars,617152,Middle Georgia Knights,617152,3,bot,"Luke Davis flied out to lf, sacrifice fly, RBI (1-0 B); Mikal Ashley scored.",38,2026-03-14T14:00:00-04:00,"Stuckey Field (Macon , GA)",175,MBA,2026
6484356,615006,Augusta Jaguars,617152,Middle Georgia Knights,617152,3,bot,"Seve Fernandez singled to left center, RBI (1-0 B); Sebastian Collender scored.",39,2026-03-14T14:00:00-04:00,"Stuckey Field (Macon , GA)",175,MBA,2026
6484356,615006,Augusta Jaguars,617152,Middle Georgia Knights,617152,3,bot,Jamie Whittier to p for Caleb Jatko.,40,2026-03-14T14:00:00-04:00,"Stuckey Field (Macon , GA)",175,MBA,2026
6484356,615006,Augusta Jaguars,617152,Middle Georgia Knights,617152,3,bot,Seve Fernandez stole second.,41,2026-03-14T14:00:00-04:00,"Stuckey Field (Macon , GA)",175,MBA,2026
6484356,615006,Augusta Jaguars,617152,Middle Georgia Knights,617152,3,bot,"Jonathan Bay singled to center field, RBI (2-1 BKB); Seve Fernandez scored.",42,2026-03-14T14:00:00-04:00,"Stuckey Field (Macon , GA)",175,MBA,2026
6484356,615006,Augusta Jaguars,617152,Middle Georgia Knights,617152,3,bot,"Reco Coney doubled down the lf line, RBI (0-0); Jonathan Bay scored.",43,2026-03-14T14:00:00-04:00,"Stuckey Field (Macon , GA)",175,MBA,2026
6484356,615006,Augusta Jaguars,617152,Middle Georgia Knights,617152,3,bot,Teonis Pimentel flied out to cf to right center (1-1 KB).,44,2026-03-14T14:00:00-04:00,"Stuckey Field (Macon , GA)",175,MBA,2026
6484356,615006,Augusta Jaguars,617152,Middle Georgia Knights,615006,4,top,Jake Vachon singled up the middle (2-2 SBFBF).,45,2026-03-14T14:00:00-04:00,"Stuckey Field (Macon , GA)",175,MBA,2026
6484356,615006,Augusta Jaguars,617152,Middle Georgia Knights,615006,4,top,"Jakob Cowart singled, bunt (0-0); Jake Vachon advanced to second.",46,2026-03-14T14:00:00-04:00,"Stuckey Field (Macon , GA)",175,MBA,2026
6484356,615006,Augusta Jaguars,617152,Middle Georgia Knights,615006,4,top,"Nate Martin popped up to c, bunt (0-1 F).",47,2026-03-14T14:00:00-04:00,"Stuckey Field (Macon , GA)",175,MBA,2026
6484356,615006,Augusta Jaguars,617152,Middle Georgia Knights,615006,4,top,Matty Go flied out to lf to left center (2-2 KKBB).,48,2026-03-14T14:00:00-04:00,"Stuckey Field (Macon , GA)",175,MBA,2026
6484356,615006,Augusta Jaguars,617152,Middle Georgia Knights,615006,4,top,Nolan Turner grounded out to 1b unassisted (1-2 SBF).,49,2026-03-14T14:00:00-04:00,"Stuckey Field (Macon , GA)",175,MBA,2026
6484356,615006,Augusta Jaguars,617152,Middle Georgia Knights,617152,4,bot,Justin Aponte grounded out to 2b (0-0).,50,2026-03-14T14:00:00-04:00,"Stuckey Field (Macon , GA)",175,MBA,2026
6484356,615006,Augusta Jaguars,617152,Middle Georgia Knights,617152,4,bot,Mikal Ashley singled to right center (1-2 FKB).,51,2026-03-14T14:00:00-04:00,"Stuckey Field (Macon , GA)",175,MBA,2026
6484356,615006,Augusta Jaguars,617152,Middle Georgia Knights,617152,4,bot,Sebastian Collender hit by pitch (1-0 H); Mikal Ashley advanced to second.,52,2026-03-14T14:00:00-04:00,"Stuckey Field (Macon , GA)",175,MBA,2026
6484356,615006,Augusta Jaguars,617152,Middle Georgia Knights,617152,4,bot,Patrick Crosby singled to center field (0-1 K); Sebastian Collender advanced to second; Mikal Ashley advanced to third.,53,2026-03-14T14:00:00-04:00,"Stuckey Field (Macon , GA)",175,MBA,2026
6484356,615006,Augusta Jaguars,617152,Middle Georgia Knights,617152,4,bot,"Luke Davis grounded out to ss, RBI (2-1 BKB); Patrick Crosby advanced to second; Sebastian Collender advanced to third; Mikal Ashley scored.",54,2026-03-14T14:00:00-04:00,"Stuckey Field (Macon , GA)",175,MBA,2026
6484356,615006,Augusta Jaguars,617152,Middle Georgia Knights,617152,4,bot,"Seve Fernandez singled to right field, 2 RBI (0-0); Patrick Crosby scored; Sebastian Collender scored.",55,2026-03-14T14:00:00-04:00,"Stuckey Field (Macon , GA)",175,MBA,2026
6484356,615006,Augusta Jaguars,617152,Middle Georgia Knights,617152,4,bot,Riley Akins to p for Jamie Whittier.,56,2026-03-14T14:00:00-04:00,"Stuckey Field (Macon , GA)",175,MBA,2026
6484356,615006,Augusta Jaguars,617152,Middle Georgia Knights,617152,4,bot,Jonathan Bay grounded out to 2b (0-2 KK).,57,2026-03-14T14:00:00-04:00,"Stuckey Field (Macon , GA)",175,MBA,2026
6484356,615006,Augusta Jaguars,617152,Middle Georgia Knights,615006,5,top,Landon Leonard grounded out to ss (0-1 S).,58,2026-03-14T14:00:00-04:00,"Stuckey Field (Macon , GA)",175,MBA,2026
6484356,615006,Augusta Jaguars,617152,Middle Georgia Knights,615006,5,top,Aidan Cannaday grounded out to 2b (0-2 KS).,59,2026-03-14T14:00:00-04:00,"Stuckey Field (Macon , GA)",175,MBA,2026
6484356,615006,Augusta Jaguars,617152,Middle Georgia Knights,615006,5,top,KJ Moon grounded out to ss (1-2 BKK).,60,2026-03-14T14:00:00-04:00,"Stuckey Field (Macon , GA)",175,MBA,2026
6484356,615006,Augusta Jaguars,617152,Middle Georgia Knights,617152,5,bot,Harris Bachelder to 1b for Roland Chance.,61,2026-03-14T14:00:00-04:00,"Stuckey Field (Macon , GA)",175,MBA,2026
6484356,615006,Augusta Jaguars,617152,Middle Georgia Knights,617152,5,bot,Reco Coney struck out swinging (2-2 KSBBS).,62,2026-03-14T14:00:00-04:00,"Stuckey Field (Macon , GA)",175,MBA,2026
6484356,615006,Augusta Jaguars,617152,Middle Georgia Knights,617152,5,bot,Teonis Pimentel struck out looking (1-2 BKFK).,63,2026-03-14T14:00:00-04:00,"Stuckey Field (Macon , GA)",175,MBA,2026
6484356,615006,Augusta Jaguars,617152,Middle Georgia Knights,617152,5,bot,Justin Aponte struck out swinging (2-2 BBKFS).,64,2026-03-14T14:00:00-04:00,"Stuckey Field (Macon , GA)",175,MBA,2026
6484356,615006,Augusta Jaguars,617152,Middle Georgia Knights,615006,6,top,Harris Bachelder struck out swinging (3-2 BFBBKS).,65,2026-03-14T14:00:00-04:00,"Stuckey Field (Macon , GA)",175,MBA,2026
6484356,615006,Augusta Jaguars,617152,Middle Georgia Knights,615006,6,top,Jake Vachon walked (3-0 BBBB).,66,2026-03-14T14:00:00-04:00,"Stuckey Field (Macon , GA)",175,MBA,2026
6484356,615006,Augusta Jaguars,617152,Middle Georgia Knights,615006,6,top,Jakob Cowart popped up to ss (1-0 B).,67,2026-03-14T14:00:00-04:00,"Stuckey Field (Macon , GA)",175,MBA,2026
6484356,615006,Augusta Jaguars,617152,Middle Georgia Knights,615006,6,top,Nate Martin grounded out to p (1-0 B).,68,2026-03-14T14:00:00-04:00,"Stuckey Field (Macon , GA)",175,MBA,2026
6484356,615006,Augusta Jaguars,617152,Middle Georgia Knights,617152,6,bot,Mikal Ashley singled to center field (1-2 KKB).,69,2026-03-14T14:00:00-04:00,"Stuckey Field (Macon , GA)",175,MBA,2026
6484356,615006,Augusta Jaguars,617152,Middle Georgia Knights,617152,6,bot,Sebastian Collender struck out swinging (2-2 FKBBS).,70,2026-03-14T14:00:00-04:00,"Stuckey Field (Macon , GA)",175,MBA,2026
6484356,615006,Augusta Jaguars,617152,Middle Georgia Knights,617152,6,bot,Patrick Crosby walked (3-0 BBBB); Mikal Ashley advanced to second.,71,2026-03-14T14:00:00-04:00,"Stuckey Field (Macon , GA)",175,MBA,2026
6484356,615006,Augusta Jaguars,617152,Middle Georgia Knights,617152,6,bot,"Luke Davis doubled to right center, RBI (0-0); Patrick Crosby advanced to third; Mikal Ashley scored.",72,2026-03-14T14:00:00-04:00,"Stuckey Field (Macon , GA)",175,MBA,2026
6484356,615006,Augusta Jaguars,617152,Middle Georgia Knights,617152,6,bot,"Seve Fernandez singled to right center, RBI (1-1 BF); Luke Davis advanced to third; Patrick Crosby scored.",73,2026-03-14T14:00:00-04:00,"Stuckey Field (Macon , GA)",175,MBA,2026
6484356,615006,Augusta Jaguars,617152,Middle Georgia Knights,617152,6,bot,Jonathan Bay walked (3-0 BBBB); Seve Fernandez advanced to second.,74,2026-03-14T14:00:00-04:00,"Stuckey Field (Macon , GA)",175,MBA,2026
6484356,615006,Augusta Jaguars,617152,Middle Georgia Knights,617152,6,bot,Jude King to p for Riley Akins.,75,2026-03-14T14:00:00-04:00,"Stuckey Field (Macon , GA)",175,MBA,2026
6484356,615006,Augusta Jaguars,617152,Middle Georgia Knights,617152,6,bot,"Reco Coney singled to left center, RBI (1-1 BS); Jonathan Bay advanced to second; Seve Fernandez advanced to third; Luke Davis scored.",76,2026-03-14T14:00:00-04:00,"Stuckey Field (Macon , GA)",175,MBA,2026
6484356,615006,Augusta Jaguars,617152,Middle Georgia Knights,617152,6,bot,Teonis Pimentel popped up to 2b (3-1 KBBB).,77,2026-03-14T14:00:00-04:00,"Stuckey Field (Macon , GA)",175,MBA,2026
6484356,615006,Augusta Jaguars,617152,Middle Georgia Knights,617152,6,bot,Justin Aponte struck out swinging (0-2 KKFS).,78,2026-03-14T14:00:00-04:00,"Stuckey Field (Macon , GA)",175,MBA,2026
6484356,615006,Augusta Jaguars,617152,Middle Georgia Knights,615006,7,top,Brandon Exley to p for Brodie Keener.,79,2026-03-14T14:00:00-04:00,"Stuckey Field (Macon , GA)",175,MBA,2026
6484356,615006,Augusta Jaguars,617152,Middle Georgia Knights,615006,7,top,Matty Go popped up to 1b (1-0 B).,80,2026-03-14T14:00:00-04:00,"Stuckey Field (Macon , GA)",175,MBA,2026
6484356,615006,Augusta Jaguars,617152,Middle Georgia Knights,615006,7,top,Nolan Turner singled to shortstop (2-2 BBKKF).,81,2026-03-14T14:00:00-04:00,"Stuckey Field (Macon , GA)",175,MBA,2026
6484356,615006,Augusta Jaguars,617152,Middle Georgia Knights,615006,7,top,Wyatt Talik pinch hit for Landon Leonard.,82,2026-03-14T14:00:00-04:00,"Stuckey Field (Macon , GA)",175,MBA,2026
6484356,615006,Augusta Jaguars,617152,Middle Georgia Knights,615006,7,top,Wyatt Talik grounded out to 2b (0-0); Nolan Turner advanced to second.,83,2026-03-14T14:00:00-04:00,"Stuckey Field (Macon , GA)",175,MBA,2026
6484356,615006,Augusta Jaguars,617152,Middle Georgia Knights,615006,7,top,"Aidan Cannaday singled to right field, RBI (1-2 KBK); Nolan Turner scored.",84,2026-03-14T14:00:00-04:00,"Stuckey Field (Macon , GA)",175,MBA,2026
6484356,615006,Augusta Jaguars,617152,Middle Georgia Knights,615006,7,top,KJ Moon struck out swinging (0-2 FFS).,85,2026-03-14T14:00:00-04:00,"Stuckey Field (Macon , GA)",175,MBA,2026
6484356,615006,Augusta Jaguars,617152,Middle Georgia Knights,617152,7,bot,Mikal Ashley singled to right center (1-0 B).,86,2026-03-14T14:00:00-04:00,"Stuckey Field (Macon , GA)",175,MBA,2026
6484356,615006,Augusta Jaguars,617152,Middle Georgia Knights,617152,7,bot,"Sebastian Collender homered to left field, 2 RBI (1-0 B); Mikal Ashley scored.",87,2026-03-14T14:00:00-04:00,"Stuckey Field (Macon , GA)",175,MBA,2026
