game_id,away_team_id,away_team_name,home_team_id,home_team_name,batting_team,inning,top_bot,event_text,event_num,game_datetime,stadium_name,attendance,sport_id,season
6492179,614632,Jacksonville St. Gamecocks,614728,Sam Houston Bearkats,614632,1,top,J. Pate grounded out to 2b (1-2 KFB).,1,2026-03-14T15:00:00-04:00,"Don Sanders (Huntsville, TX)",739,MBA,2026
6492179,614632,Jacksonville St. Gamecocks,614728,Sam Houston Bearkats,614632,1,top,T. King singled to center field (0-0).,2,2026-03-14T15:00:00-04:00,"Don Sanders (Huntsville, TX)",739,MBA,2026
6492179,614632,Jacksonville St. Gamecocks,614728,Sam Houston Bearkats,614632,1,top,C. Blauser walked (3-1 BKBBB); T. King advanced to second.,3,2026-03-14T15:00:00-04:00,"Don Sanders (Huntsville, TX)",739,MBA,2026
6492179,614632,Jacksonville St. Gamecocks,614728,Sam Houston Bearkats,614632,1,top,B. Thomas struck out looking (2-2 BBKKK).,4,2026-03-14T15:00:00-04:00,"Don Sanders (Huntsville, TX)",739,MBA,2026
6492179,614632,Jacksonville St. Gamecocks,614728,Sam Houston Bearkats,614632,1,top,"G. Ashe doubled down the lf line, 2 RBI (3-1 FBBB); C. Blauser scored; T. King scored.",5,2026-03-14T15:00:00-04:00,"Don Sanders (Huntsville, TX)",739,MBA,2026
6492179,614632,Jacksonville St. Gamecocks,614728,Sam Houston Bearkats,614632,1,top,L. Williams singled to second base (1-0 B); G. Ashe advanced to third.,6,2026-03-14T15:00:00-04:00,"Don Sanders (Huntsville, TX)",739,MBA,2026
6492179,614632,Jacksonville St. Gamecocks,614728,Sam Houston Bearkats,614632,1,top,L. Williams stole second.,7,2026-03-14T15:00:00-04:00,"Don Sanders (Huntsville, TX)",739,MBA,2026
6492179,614632,Jacksonville St. Gamecocks,614728,Sam Houston Bearkats,614632,1,top,Williams steals 2B on 1-0 pitch.,8,2026-03-14T15:00:00-04:00,"Don Sanders (Huntsville, TX)",739,MBA,2026
6492179,614632,Jacksonville St. Gamecocks,614728,Sam Houston Bearkats,614632,1,top,"Williamson doubled to right center, 2 RBI (3-1 BBBK); L. Williams scored; G. Ashe scored.",9,2026-03-14T15:00:00-04:00,"Don Sanders (Huntsville, TX)",739,MBA,2026
6492179,614632,Jacksonville St. Gamecocks,614728,Sam Houston Bearkats,614632,1,top,SHSU mound visit - catcher (1).,10,2026-03-14T15:00:00-04:00,"Don Sanders (Huntsville, TX)",739,MBA,2026
6492179,614632,Jacksonville St. Gamecocks,614728,Sam Houston Bearkats,614632,1,top,C. Johnson fouled out to 3b (0-1 K).,11,2026-03-14T15:00:00-04:00,"Don Sanders (Huntsville, TX)",739,MBA,2026
6492179,614632,Jacksonville St. Gamecocks,614728,Sam Houston Bearkats,614728,1,bot,"Curtis, J. singled to center field (1-1 BF).",12,2026-03-14T15:00:00-04:00,"Don Sanders (Huntsville, TX)",739,MBA,2026
6492179,614632,Jacksonville St. Gamecocks,614728,Sam Houston Bearkats,614728,1,bot,"Franden, R. grounded into double play 3b to 2b to 1b (1-0 B); Curtis, J. out on the play.",13,2026-03-14T15:00:00-04:00,"Don Sanders (Huntsville, TX)",739,MBA,2026
6492179,614632,Jacksonville St. Gamecocks,614728,Sam Houston Bearkats,614728,1,bot,"Alvord, H. grounded out to 2b (2-2 KBFB).",14,2026-03-14T15:00:00-04:00,"Don Sanders (Huntsville, TX)",739,MBA,2026
6492179,614632,Jacksonville St. Gamecocks,614728,Sam Houston Bearkats,614632,2,top,M. Cash walked (3-0 BBBB).,15,2026-03-14T15:00:00-04:00,"Don Sanders (Huntsville, TX)",739,MBA,2026
6492179,614632,Jacksonville St. Gamecocks,614728,Sam Houston Bearkats,614632,2,top,"J. Pate singled to third base, bunt (0-0); M. Cash advanced to second.",16,2026-03-14T15:00:00-04:00,"Don Sanders (Huntsville, TX)",739,MBA,2026
6492179,614632,Jacksonville St. Gamecocks,614728,Sam Houston Bearkats,614632,2,top,"T. King singled to pitcher, bunt (1-1 BF); J. Pate advanced to second; M. Cash advanced to third.",17,2026-03-14T15:00:00-04:00,"Don Sanders (Huntsville, TX)",739,MBA,2026
6492179,614632,Jacksonville St. Gamecocks,614728,Sam Houston Bearkats,614632,2,top,"C. Blauser singled to center field, RBI (0-2 KS); T. King advanced to second; J. Pate advanced to third; M. Cash scored.",18,2026-03-14T15:00:00-04:00,"Don Sanders (Huntsville, TX)",739,MBA,2026
6492179,614632,Jacksonville St. Gamecocks,614728,Sam Houston Bearkats,614632,2,top,"Murphy, M. to p for Aloisio, C..",19,2026-03-14T15:00:00-04:00,"Don Sanders (Huntsville, TX)",739,MBA,2026
6492179,614632,Jacksonville St. Gamecocks,614728,Sam Houston Bearkats,614632,2,top,"B. Thomas homered to right field, 4 RBI (1-2 BFSFF); C. Blauser scored; T. King scored; J. Pate scored.",20,2026-03-14T15:00:00-04:00,"Don Sanders (Huntsville, TX)",739,MBA,2026
6492179,614632,Jacksonville St. Gamecocks,614728,Sam Houston Bearkats,614632,2,top,G. Ashe flied out to lf (0-2 KKF).,21,2026-03-14T15:00:00-04:00,"Don Sanders (Huntsville, TX)",739,MBA,2026
6492179,614632,Jacksonville St. Gamecocks,614728,Sam Houston Bearkats,614632,2,top,L. Williams flied out to cf (3-2 FBBBS).,22,2026-03-14T15:00:00-04:00,"Don Sanders (Huntsville, TX)",739,MBA,2026
6492179,614632,Jacksonville St. Gamecocks,614728,Sam Houston Bearkats,614632,2,top,"Williamson homered to right center, RBI (1-0 B).",23,2026-03-14T15:00:00-04:00,"Don Sanders (Huntsville, TX)",739,MBA,2026
6492179,614632,Jacksonville St. Gamecocks,614728,Sam Houston Bearkats,614632,2,top,C. Johnson struck out swinging (2-2 BBFFS).,24,2026-03-14T15:00:00-04:00,"Don Sanders (Huntsville, TX)",739,MBA,2026
6492179,614632,Jacksonville St. Gamecocks,614728,Sam Houston Bearkats,614728,2,bot,"Corcoran, C. struck out swinging (2-2 BKBFFFFS).",25,2026-03-14T15:00:00-04:00,"Don Sanders (Huntsville, TX)",739,MBA,2026
6492179,614632,Jacksonville St. Gamecocks,614728,Sam Houston Bearkats,614728,2,bot,"Baker, W. struck out swinging (0-2 KFS).",26,2026-03-14T15:00:00-04:00,"Don Sanders (Huntsville, TX)",739,MBA,2026
6492179,614632,Jacksonville St. Gamecocks,614728,Sam Houston Bearkats,614728,2,bot,"Marthilj, T. grounded out to ss (2-2 FKFBB).",27,2026-03-14T15:00:00-04:00,"Don Sanders (Huntsville, TX)",739,MBA,2026
6492179,614632,Jacksonville St. Gamecocks,614728,Sam Houston Bearkats,614632,3,top,M. Cash flied out to rf (3-2 BFBKB).,28,2026-03-14T15:00:00-04:00,"Don Sanders (Huntsville, TX)",739,MBA,2026
6492179,614632,Jacksonville St. Gamecocks,614728,Sam Houston Bearkats,614632,3,top,J. Pate flied out to lf (2-2 KBBF).,29,2026-03-14T15:00:00-04:00,"Don Sanders (Huntsville, TX)",739,MBA,2026
6492179,614632,Jacksonville St. Gamecocks,614728,Sam Houston Bearkats,614632,3,top,T. King reached on a throwing error by 2b (0-2 SS).,30,2026-03-14T15:00:00-04:00,"Don Sanders (Huntsville, TX)",739,MBA,2026
6492179,614632,Jacksonville St. Gamecocks,614728,Sam Houston Bearkats,614632,3,top,C. Blauser singled to center field (0-0); T. King advanced to second.,31,2026-03-14T15:00:00-04:00,"Don Sanders (Huntsville, TX)",739,MBA,2026
6492179,614632,Jacksonville St. Gamecocks,614728,Sam Houston Bearkats,614632,3,top,B. Thomas walked (3-1 BBBKB); C. Blauser advanced to second; T. King advanced to third.,32,2026-03-14T15:00:00-04:00,"Don Sanders (Huntsville, TX)",739,MBA,2026
6492179,614632,Jacksonville St. Gamecocks,614728,Sam Houston Bearkats,614632,3,top,"G. Ashe doubled to right center, 3 RBI (1-2 BKF); B. Thomas scored, unearned; C. Blauser scored, unearned; T. King scored, unearned.",33,2026-03-14T15:00:00-04:00,"Don Sanders (Huntsville, TX)",739,MBA,2026
6492179,614632,Jacksonville St. Gamecocks,614728,Sam Houston Bearkats,614632,3,top,L. Williams flied out to lf (0-2 SK).,34,2026-03-14T15:00:00-04:00,"Don Sanders (Huntsville, TX)",739,MBA,2026
6492179,614632,Jacksonville St. Gamecocks,614728,Sam Houston Bearkats,614728,3,bot,"Brown, B. struck out swinging (0-2 KFS).",35,2026-03-14T15:00:00-04:00,"Don Sanders (Huntsville, TX)",739,MBA,2026
6492179,614632,Jacksonville St. Gamecocks,614728,Sam Houston Bearkats,614728,3,bot,"Martinez, J. struck out looking (3-2 KBBBSFK).",36,2026-03-14T15:00:00-04:00,"Don Sanders (Huntsville, TX)",739,MBA,2026
6492179,614632,Jacksonville St. Gamecocks,614728,Sam Houston Bearkats,614728,3,bot,"Cotton, C. struck out looking (1-2 KSBK).",37,2026-03-14T15:00:00-04:00,"Don Sanders (Huntsville, TX)",739,MBA,2026
6492179,614632,Jacksonville St. Gamecocks,614728,Sam Houston Bearkats,614632,4,top,"Ryden, T. to p for Murphy, M..",38,2026-03-14T15:00:00-04:00,"Don Sanders (Huntsville, TX)",739,MBA,2026
6492179,614632,Jacksonville St. Gamecocks,614728,Sam Houston Bearkats,614632,4,top,Williamson singled to left field (3-2 BFBFB).,39,2026-03-14T15:00:00-04:00,"Don Sanders (Huntsville, TX)",739,MBA,2026
6492179,614632,Jacksonville St. Gamecocks,614728,Sam Houston Bearkats,614632,4,top,Williamson stole second.,40,2026-03-14T15:00:00-04:00,"Don Sanders (Huntsville, TX)",739,MBA,2026
6492179,614632,Jacksonville St. Gamecocks,614728,Sam Houston Bearkats,614632,4,top,Williamson steals 2B on 1-1 pitch.,41,2026-03-14T15:00:00-04:00,"Don Sanders (Huntsville, TX)",739,MBA,2026
6492179,614632,Jacksonville St. Gamecocks,614728,Sam Houston Bearkats,614632,4,top,C. Johnson struck out looking (2-2 BFSBK).,42,2026-03-14T15:00:00-04:00,"Don Sanders (Huntsville, TX)",739,MBA,2026
6492179,614632,Jacksonville St. Gamecocks,614728,Sam Houston Bearkats,614632,4,top,M. Cash singled to third base (3-2 KBBBK); Williamson advanced to third.,43,2026-03-14T15:00:00-04:00,"Don Sanders (Huntsville, TX)",739,MBA,2026
6492179,614632,Jacksonville St. Gamecocks,614728,Sam Houston Bearkats,614632,4,top,"J. Pate singled to left field, RBI (2-0 BB); M. Cash advanced to second; Williamson scored.",44,2026-03-14T15:00:00-04:00,"Don Sanders (Huntsville, TX)",739,MBA,2026
6492179,614632,Jacksonville St. Gamecocks,614728,Sam Houston Bearkats,614632,4,top,"T. King singled to left field, RBI (2-2 BKBK); J. Pate advanced to second; M. Cash scored.",45,2026-03-14T15:00:00-04:00,"Don Sanders (Huntsville, TX)",739,MBA,2026
6492179,614632,Jacksonville St. Gamecocks,614728,Sam Houston Bearkats,614632,4,top,C. Blauser flied out to rf (0-0).,46,2026-03-14T15:00:00-04:00,"Don Sanders (Huntsville, TX)",739,MBA,2026
6492179,614632,Jacksonville St. Gamecocks,614728,Sam Houston Bearkats,614632,4,top,B. Thomas hit by pitch (0-0); T. King advanced to second; J. Pate advanced to third.,47,2026-03-14T15:00:00-04:00,"Don Sanders (Huntsville, TX)",739,MBA,2026
6492179,614632,Jacksonville St. Gamecocks,614728,Sam Houston Bearkats,614632,4,top,G. Ashe flied out to rf (3-2 BBFBK).,48,2026-03-14T15:00:00-04:00,"Don Sanders (Huntsville, TX)",739,MBA,2026
6492179,614632,Jacksonville St. Gamecocks,614728,Sam Houston Bearkats,614728,4,bot,"Curtis, J. singled to catcher, bunt (0-0).",49,2026-03-14T15:00:00-04:00,"Don Sanders (Huntsville, TX)",739,MBA,2026
6492179,614632,Jacksonville St. Gamecocks,614728,Sam Houston Bearkats,614728,4,bot,"Franden, R. grounded out to 3b (1-0 B); Curtis, J. advanced to second.",50,2026-03-14T15:00:00-04:00,"Don Sanders (Huntsville, TX)",739,MBA,2026
6492179,614632,Jacksonville St. Gamecocks,614728,Sam Houston Bearkats,614728,4,bot,"Alvord, H. hit by pitch (2-2 BKKB).",51,2026-03-14T15:00:00-04:00,"Don Sanders (Huntsville, TX)",739,MBA,2026
6492179,614632,Jacksonville St. Gamecocks,614728,Sam Houston Bearkats,614728,4,bot,"Alvord, H. stole second; Curtis, J. stole third.",52,2026-03-14T15:00:00-04:00,"Don Sanders (Huntsville, TX)",739,MBA,2026
6492179,614632,Jacksonville St. Gamecocks,614728,Sam Houston Bearkats,614728,4,bot,Curtis/Alvord double steal on 0-0 pitch.,53,2026-03-14T15:00:00-04:00,"Don Sanders (Huntsville, TX)",739,MBA,2026
6492179,614632,Jacksonville St. Gamecocks,614728,Sam Houston Bearkats,614728,4,bot,"Corcoran, C. walked (3-2 BBFKBB).",54,2026-03-14T15:00:00-04:00,"Don Sanders (Huntsville, TX)",739,MBA,2026
6492179,614632,Jacksonville St. Gamecocks,614728,Sam Houston Bearkats,614728,4,bot,JSU mound visit - catcher (1).,55,2026-03-14T15:00:00-04:00,"Don Sanders (Huntsville, TX)",739,MBA,2026
6492179,614632,Jacksonville St. Gamecocks,614728,Sam Houston Bearkats,614728,4,bot,"Baker, W. walked, RBI (3-1 BKBBB); Corcoran, C. advanced to second; Alvord, H. advanced to third; Curtis, J. scored.",56,2026-03-14T15:00:00-04:00,"Don Sanders (Huntsville, TX)",739,MBA,2026
6492179,614632,Jacksonville St. Gamecocks,614728,Sam Houston Bearkats,614728,4,bot,JSU mound visit - coach (1).,57,2026-03-14T15:00:00-04:00,"Don Sanders (Huntsville, TX)",739,MBA,2026
6492179,614632,Jacksonville St. Gamecocks,614728,Sam Houston Bearkats,614728,4,bot,"Marthilj, T. doubled to right center, 3 RBI (1-1 BK); Baker, W. scored; Corcoran, C. scored; Alvord, H. scored.",58,2026-03-14T15:00:00-04:00,"Don Sanders (Huntsville, TX)",739,MBA,2026
6492179,614632,Jacksonville St. Gamecocks,614728,Sam Houston Bearkats,614728,4,bot,"Brown, B. grounded out to ss (1-1 KB); Marthilj, T. advanced to third.",59,2026-03-14T15:00:00-04:00,"Don Sanders (Huntsville, TX)",739,MBA,2026
6492179,614632,Jacksonville St. Gamecocks,614728,Sam Houston Bearkats,614728,4,bot,"Martinez, J. walked (3-2 BBBKSFB).",60,2026-03-14T15:00:00-04:00,"Don Sanders (Huntsville, TX)",739,MBA,2026
6492179,614632,Jacksonville St. Gamecocks,614728,Sam Houston Bearkats,614728,4,bot,"Martinez, J. stole second.",61,2026-03-14T15:00:00-04:00,"Don Sanders (Huntsville, TX)",739,MBA,2026
6492179,614632,Jacksonville St. Gamecocks,614728,Sam Houston Bearkats,614728,4,bot,Martinez steals 2B on 1-0 pitch.,62,2026-03-14T15:00:00-04:00,"Don Sanders (Huntsville, TX)",739,MBA,2026
6492179,614632,Jacksonville St. Gamecocks,614728,Sam Houston Bearkats,614728,4,bot,"Cotton, C. grounded out to p (2-1 BBF).",63,2026-03-14T15:00:00-04:00,"Don Sanders (Huntsville, TX)",739,MBA,2026
6492179,614632,Jacksonville St. Gamecocks,614728,Sam Houston Bearkats,614632,5,top,"Bazmore, S. to p for Ryden, T..",64,2026-03-14T15:00:00-04:00,"Don Sanders (Huntsville, TX)",739,MBA,2026
6492179,614632,Jacksonville St. Gamecocks,614728,Sam Houston Bearkats,614632,5,top,L. Williams singled through the right side (0-2 KK).,65,2026-03-14T15:00:00-04:00,"Don Sanders (Huntsville, TX)",739,MBA,2026
6492179,614632,Jacksonville St. Gamecocks,614728,Sam Houston Bearkats,614632,5,top,Williamson grounded out to 1b unassisted (0-2 FK); L. Williams advanced to second.,66,2026-03-14T15:00:00-04:00,"Don Sanders (Huntsville, TX)",739,MBA,2026
6492179,614632,Jacksonville St. Gamecocks,614728,Sam Houston Bearkats,614632,5,top,C. Johnson struck out swinging (2-2 KFBBFS).,67,2026-03-14T15:00:00-04:00,"Don Sanders (Huntsville, TX)",739,MBA,2026
6492179,614632,Jacksonville St. Gamecocks,614728,Sam Houston Bearkats,614632,5,top,M. Cash flied out to cf (1-1 SB).,68,2026-03-14T15:00:00-04:00,"Don Sanders (Huntsville, TX)",739,MBA,2026
6492179,614632,Jacksonville St. Gamecocks,614728,Sam Houston Bearkats,614728,5,bot,G. Knight to p for B. Bryans.,69,2026-03-14T15:00:00-04:00,"Don Sanders (Huntsville, TX)",739,MBA,2026
6492179,614632,Jacksonville St. Gamecocks,614728,Sam Houston Bearkats,614728,5,bot,"Curtis, J. hit by pitch (1-0 B).",70,2026-03-14T15:00:00-04:00,"Don Sanders (Huntsville, TX)",739,MBA,2026
6492179,614632,Jacksonville St. Gamecocks,614728,Sam Houston Bearkats,614728,5,bot,"Dean, E. pinch hit for Franden, R..",71,2026-03-14T15:00:00-04:00,"Don Sanders (Huntsville, TX)",739,MBA,2026
6492179,614632,Jacksonville St. Gamecocks,614728,Sam Houston Bearkats,614728,5,bot,"Curtis, J. advanced to second on a balk.",72,2026-03-14T15:00:00-04:00,"Don Sanders (Huntsville, TX)",739,MBA,2026
6492179,614632,Jacksonville St. Gamecocks,614728,Sam Houston Bearkats,614728,5,bot,Balk prior to 2-1 pitch.,73,2026-03-14T15:00:00-04:00,"Don Sanders (Huntsville, TX)",739,MBA,2026
6492179,614632,Jacksonville St. Gamecocks,614728,Sam Houston Bearkats,614728,5,bot,"Dean, E. struck out swinging (3-2 BFBFBS).",74,2026-03-14T15:00:00-04:00,"Don Sanders (Huntsville, TX)",739,MBA,2026
6492179,614632,Jacksonville St. Gamecocks,614728,Sam Houston Bearkats,614728,5,bot,"Curtis, J. out at second c to 2b, picked off, caught stealing.",75,2026-03-14T15:00:00-04:00,"Don Sanders (Huntsville, TX)",739,MBA,2026
6492179,614632,Jacksonville St. Gamecocks,614728,Sam Houston Bearkats,614728,5,bot,Curtis caught prior to 0-0 pitch.,76,2026-03-14T15:00:00-04:00,"Don Sanders (Huntsville, TX)",739,MBA,2026
6492179,614632,Jacksonville St. Gamecocks,614728,Sam Houston Bearkats,614728,5,bot,"Alvord, H. homered to left field, RBI (1-2 FFB).",77,2026-03-14T15:00:00-04:00,"Don Sanders (Huntsville, TX)",739,MBA,2026
6492179,614632,Jacksonville St. Gamecocks,614728,Sam Houston Bearkats,614728,5,bot,Distance:394  Exit velo:102 mph.,78,2026-03-14T15:00:00-04:00,"Don Sanders (Huntsville, TX)",739,MBA,2026
6492179,614632,Jacksonville St. Gamecocks,614728,Sam Houston Bearkats,614728,5,bot,"Corcoran, C. struck out swinging (1-2 BKKS).",79,2026-03-14T15:00:00-04:00,"Don Sanders (Huntsville, TX)",739,MBA,2026
6492179,614632,Jacksonville St. Gamecocks,614728,Sam Houston Bearkats,614632,6,top,J. Pate doubled to left center (1-0 B).,80,2026-03-14T15:00:00-04:00,"Don Sanders (Huntsville, TX)",739,MBA,2026
6492179,614632,Jacksonville St. Gamecocks,614728,Sam Houston Bearkats,614632,6,top,T. King flied out to cf (1-0 B); J. Pate advanced to third.,81,2026-03-14T15:00:00-04:00,"Don Sanders (Huntsville, TX)",739,MBA,2026
6492179,614632,Jacksonville St. Gamecocks,614728,Sam Houston Bearkats,614632,6,top,JSU offensive timeout (1).,82,2026-03-14T15:00:00-04:00,"Don Sanders (Huntsville, TX)",739,MBA,2026
6492179,614632,Jacksonville St. Gamecocks,614728,Sam Houston Bearkats,614632,6,top,"C. Blauser flied out to lf, SF, RBI (3-2 KBKBB); J. Pate scored.",83,2026-03-14T15:00:00-04:00,"Don Sanders (Huntsville, TX)",739,MBA,2026
6492179,614632,Jacksonville St. Gamecocks,614728,Sam Houston Bearkats,614632,6,top,B. Thomas singled to right field (1-0 B).,84,2026-03-14T15:00:00-04:00,"Don Sanders (Huntsville, TX)",739,MBA,2026
6492179,614632,Jacksonville St. Gamecocks,614728,Sam Houston Bearkats,614632,6,top,G. Ashe hit by pitch (3-2 KBBBFF); B. Thomas advanced to second.,85,2026-03-14T15:00:00-04:00,"Don Sanders (Huntsville, TX)",739,MBA,2026
6492179,614632,Jacksonville St. Gamecocks,614728,Sam Houston Bearkats,614632,6,top,E. Williams pinch ran for G. Ashe.,86,2026-03-14T15:00:00-04:00,"Don Sanders (Huntsville, TX)",739,MBA,2026
6492179,614632,Jacksonville St. Gamecocks,614728,Sam Houston Bearkats,614632,6,top,"Kendrick, N. to p for Bazmore, S..",87,2026-03-14T15:00:00-04:00,"Don Sanders (Huntsville, TX)",739,MBA,2026
6492179,614632,Jacksonville St. Gamecocks,614728,Sam Houston Bearkats,614632,6,top,Richardson pinch hit for L. Williams.,88,2026-03-14T15:00:00-04:00,"Don Sanders (Huntsville, TX)",739,MBA,2026
6492179,614632,Jacksonville St. Gamecocks,614728,Sam Houston Bearkats,614632,6,top,Richardson grounded out to 3b (1-0 B).,89,2026-03-14T15:00:00-04:00,"Don Sanders (Huntsville, TX)",739,MBA,2026
6492179,614632,Jacksonville St. Gamecocks,614728,Sam Houston Bearkats,614728,6,bot,T. King to lf.,90,2026-03-14T15:00:00-04:00,"Don Sanders (Huntsville, TX)",739,MBA,2026
6492179,614632,Jacksonville St. Gamecocks,614728,Sam Houston Bearkats,614728,6,bot,E. Williams to c.,91,2026-03-14T15:00:00-04:00,"Don Sanders (Huntsville, TX)",739,MBA,2026
6492179,614632,Jacksonville St. Gamecocks,614728,Sam Houston Bearkats,614728,6,bot,Richardson to 1b.,92,2026-03-14T15:00:00-04:00,"Don Sanders (Huntsville, TX)",739,MBA,2026
6492179,614632,Jacksonville St. Gamecocks,614728,Sam Houston Bearkats,614728,6,bot,M. Cash to 3b.,93,2026-03-14T15:00:00-04:00,"Don Sanders (Huntsville, TX)",739,MBA,2026
6492179,614632,Jacksonville St. Gamecocks,614728,Sam Houston Bearkats,614728,6,bot,S. Schmidt to p for G. Knight.,94,2026-03-14T15:00:00-04:00,"Don Sanders (Huntsville, TX)",739,MBA,2026
6492179,614632,Jacksonville St. Gamecocks,614728,Sam Houston Bearkats,614728,6,bot,"Baker, W. struck out swinging (3-2 BBBKFS).",95,2026-03-14T15:00:00-04:00,"Don Sanders (Huntsville, TX)",739,MBA,2026
6492179,614632,Jacksonville St. Gamecocks,614728,Sam Houston Bearkats,614728,6,bot,"Marthilj, T. struck out swinging (2-2 BBFKS).",96,2026-03-14T15:00:00-04:00,"Don Sanders (Huntsville, TX)",739,MBA,2026
6492179,614632,Jacksonville St. Gamecocks,614728,Sam Houston Bearkats,614728,6,bot,"Brown, B. struck out looking (2-2 KBBKK).",97,2026-03-14T15:00:00-04:00,"Don Sanders (Huntsville, TX)",739,MBA,2026
6492179,614632,Jacksonville St. Gamecocks,614728,Sam Houston Bearkats,614632,7,top,Williamson doubled to left field (1-0 B).,98,2026-03-14T15:00:00-04:00,"Don Sanders (Huntsville, TX)",739,MBA,2026
6492179,614632,Jacksonville St. Gamecocks,614728,Sam Houston Bearkats,614632,7,top,O. Peña pinch hit for C. Johnson.,99,2026-03-14T15:00:00-04:00,"Don Sanders (Huntsville, TX)",739,MBA,2026
6492179,614632,Jacksonville St. Gamecocks,614728,Sam Houston Bearkats,614632,7,top,O. Peña grounded out to 3b (0-0).,100,2026-03-14T15:00:00-04:00,"Don Sanders (Huntsville, TX)",739,MBA,2026
6492179,614632,Jacksonville St. Gamecocks,614728,Sam Houston Bearkats,614632,7,top,"M. Cash homered to right field, 2 RBI (3-1 KBBB); Williamson scored.",101,2026-03-14T15:00:00-04:00,"Don Sanders (Huntsville, TX)",739,MBA,2026
6492179,614632,Jacksonville St. Gamecocks,614728,Sam Houston Bearkats,614632,7,top,Distance:358  Exit velo:96 mph.,102,2026-03-14T15:00:00-04:00,"Don Sanders (Huntsville, TX)",739,MBA,2026
6492179,614632,Jacksonville St. Gamecocks,614728,Sam Houston Bearkats,614632,7,top,T. Majette pinch hit for J. Pate.,103,2026-03-14T15:00:00-04:00,"Don Sanders (Huntsville, TX)",739,MBA,2026
6492179,614632,Jacksonville St. Gamecocks,614728,Sam Houston Bearkats,614632,7,top,T. Majette grounded out to 2b (0-0).,104,2026-03-14T15:00:00-04:00,"Don Sanders (Huntsville, TX)",739,MBA,2026
6492179,614632,Jacksonville St. Gamecocks,614728,Sam Houston Bearkats,614632,7,top,T. King struck out looking (1-2 BFFK).,105,2026-03-14T15:00:00-04:00,"Don Sanders (Huntsville, TX)",739,MBA,2026
6492179,614632,Jacksonville St. Gamecocks,614728,Sam Houston Bearkats,614728,7,bot,T. Majette to rf.,106,2026-03-14T15:00:00-04:00,"Don Sanders (Huntsville, TX)",739,MBA,2026
6492179,614632,Jacksonville St. Gamecocks,614728,Sam Houston Bearkats,614728,7,bot,T. King to ss.,107,2026-03-14T15:00:00-04:00,"Don Sanders (Huntsville, TX)",739,MBA,2026
6492179,614632,Jacksonville St. Gamecocks,614728,Sam Houston Bearkats,614728,7,bot,O. Peña to 3b.,108,2026-03-14T15:00:00-04:00,"Don Sanders (Huntsville, TX)",739,MBA,2026
6492179,614632,Jacksonville St. Gamecocks,614728,Sam Houston Bearkats,614728,7,bot,M. Cash to lf.,109,2026-03-14T15:00:00-04:00,"Don Sanders (Huntsville, TX)",739,MBA,2026
6492179,614632,Jacksonville St. Gamecocks,614728,Sam Houston Bearkats,614728,7,bot,"Orth, K. pinch hit for Martinez, J..",110,2026-03-14T15:00:00-04:00,"Don Sanders (Huntsville, TX)",739,MBA,2026
6492179,614632,Jacksonville St. Gamecocks,614728,Sam Houston Bearkats,614728,7,bot,"Orth, K. struck out swinging (1-2 SFBS).",111,2026-03-14T15:00:00-04:00,"Don Sanders (Huntsville, TX)",739,MBA,2026
6492179,614632,Jacksonville St. Gamecocks,614728,Sam Houston Bearkats,614728,7,bot,"Demmer, K. pinch hit for Cotton, C..",112,2026-03-14T15:00:00-04:00,"Don Sanders (Huntsville, TX)",739,MBA,2026
6492179,614632,Jacksonville St. Gamecocks,614728,Sam Houston Bearkats,614728,7,bot,"Demmer, K. singled to shortstop (0-1 K).",113,2026-03-14T15:00:00-04:00,"Don Sanders (Huntsville, TX)",739,MBA,2026
6492179,614632,Jacksonville St. Gamecocks,614728,Sam Houston Bearkats,614728,7,bot,"Blackman, P. pinch hit for Curtis, J..",114,2026-03-14T15:00:00-04:00,"Don Sanders (Huntsville, TX)",739,MBA,2026
6492179,614632,Jacksonville St. Gamecocks,614728,Sam Houston Bearkats,614728,7,bot,"Blackman, P. tripled to right center, RBI (1-0 B); Demmer, K. scored.",115,2026-03-14T15:00:00-04:00,"Don Sanders (Huntsville, TX)",739,MBA,2026
6492179,614632,Jacksonville St. Gamecocks,614728,Sam Houston Bearkats,614728,7,bot,"Dean, E. to dh.",116,2026-03-14T15:00:00-04:00,"Don Sanders (Huntsville, TX)",739,MBA,2026
6492179,614632,Jacksonville St. Gamecocks,614728,Sam Houston Bearkats,614728,7,bot,J. Sibley to p for S. Schmidt.,117,2026-03-14T15:00:00-04:00,"Don Sanders (Huntsville, TX)",739,MBA,2026
6492179,614632,Jacksonville St. Gamecocks,614728,Sam Houston Bearkats,614728,7,bot,"Dean, E. struck out looking (2-2 SSBBK).",118,2026-03-14T15:00:00-04:00,"Don Sanders (Huntsville, TX)",739,MBA,2026
6492179,614632,Jacksonville St. Gamecocks,614728,Sam Houston Bearkats,614728,7,bot,"Blackman, P. scored on a wild pitch.",119,2026-03-14T15:00:00-04:00,"Don Sanders (Huntsville, TX)",739,MBA,2026
6492179,614632,Jacksonville St. Gamecocks,614728,Sam Houston Bearkats,614728,7,bot,Blackman scores on WPon 0-0 pitch.,120,2026-03-14T15:00:00-04:00,"Don Sanders (Huntsville, TX)",739,MBA,2026
6492179,614632,Jacksonville St. Gamecocks,614728,Sam Houston Bearkats,614728,7,bot,"Alvord, H. struck out swinging (2-2 BSBKS).",121,2026-03-14T15:00:00-04:00,"Don Sanders (Huntsville, TX)",739,MBA,2026
