game_id,away_team_id,away_team_name,home_team_id,home_team_name,batting_team,inning,top_bot,event_text,event_num,game_datetime,stadium_name,attendance,sport_id,season
6494606,615037,Gannon Golden Knights,614903,Tiffin Dragons,615037,1,top,H. Troiano struck out swinging.,1,2026-02-28T14:30:00-05:00,"McConnell Family Stadium (Erie, PA)",125,MBA,2026
6494606,615037,Gannon Golden Knights,614903,Tiffin Dragons,615037,1,top,C. Smith popped up to 3b.,2,2026-02-28T14:30:00-05:00,"McConnell Family Stadium (Erie, PA)",125,MBA,2026
6494606,615037,Gannon Golden Knights,614903,Tiffin Dragons,615037,1,top,W. Parker out at first 1b to p.,3,2026-02-28T14:30:00-05:00,"McConnell Family Stadium (Erie, PA)",125,MBA,2026
6494606,615037,Gannon Golden Knights,614903,Tiffin Dragons,614903,1,bot,G. Cady lined out to rf.,4,2026-02-28T14:30:00-05:00,"McConnell Family Stadium (Erie, PA)",125,MBA,2026
6494606,615037,Gannon Golden Knights,614903,Tiffin Dragons,614903,1,bot,J. Skrelja struck out swinging.,5,2026-02-28T14:30:00-05:00,"McConnell Family Stadium (Erie, PA)",125,MBA,2026
6494606,615037,Gannon Golden Knights,614903,Tiffin Dragons,614903,1,bot,B. Clark walked.,6,2026-02-28T14:30:00-05:00,"McConnell Family Stadium (Erie, PA)",125,MBA,2026
6494606,615037,Gannon Golden Knights,614903,Tiffin Dragons,614903,1,bot,B. Clark stole second.,7,2026-02-28T14:30:00-05:00,"McConnell Family Stadium (Erie, PA)",125,MBA,2026
6494606,615037,Gannon Golden Knights,614903,Tiffin Dragons,614903,1,bot,"A. Deitschel tripled to right field, RBI; B. Clark scored.",8,2026-02-28T14:30:00-05:00,"McConnell Family Stadium (Erie, PA)",125,MBA,2026
6494606,615037,Gannon Golden Knights,614903,Tiffin Dragons,614903,1,bot,A. Deitschel scored on a passed ball.,9,2026-02-28T14:30:00-05:00,"McConnell Family Stadium (Erie, PA)",125,MBA,2026
6494606,615037,Gannon Golden Knights,614903,Tiffin Dragons,614903,1,bot,M. Patellis doubled to left field.,10,2026-02-28T14:30:00-05:00,"McConnell Family Stadium (Erie, PA)",125,MBA,2026
6494606,615037,Gannon Golden Knights,614903,Tiffin Dragons,614903,1,bot,"G. Marceric homered to left field, 2 RBI; M. Patellis scored.",11,2026-02-28T14:30:00-05:00,"McConnell Family Stadium (Erie, PA)",125,MBA,2026
6494606,615037,Gannon Golden Knights,614903,Tiffin Dragons,614903,1,bot,L. Westerman struck out looking.,12,2026-02-28T14:30:00-05:00,"McConnell Family Stadium (Erie, PA)",125,MBA,2026
6494606,615037,Gannon Golden Knights,614903,Tiffin Dragons,615037,2,top,I. Soto struck out looking.,13,2026-02-28T14:30:00-05:00,"McConnell Family Stadium (Erie, PA)",125,MBA,2026
6494606,615037,Gannon Golden Knights,614903,Tiffin Dragons,615037,2,top,D. Costello struck out swinging.,14,2026-02-28T14:30:00-05:00,"McConnell Family Stadium (Erie, PA)",125,MBA,2026
6494606,615037,Gannon Golden Knights,614903,Tiffin Dragons,615037,2,top,C. Mullins struck out swinging.,15,2026-02-28T14:30:00-05:00,"McConnell Family Stadium (Erie, PA)",125,MBA,2026
6494606,615037,Gannon Golden Knights,614903,Tiffin Dragons,614903,2,bot,H. Steinke to p for Z. Tkatch.,16,2026-02-28T14:30:00-05:00,"McConnell Family Stadium (Erie, PA)",125,MBA,2026
6494606,615037,Gannon Golden Knights,614903,Tiffin Dragons,614903,2,bot,J. Leach walked.,17,2026-02-28T14:30:00-05:00,"McConnell Family Stadium (Erie, PA)",125,MBA,2026
6494606,615037,Gannon Golden Knights,614903,Tiffin Dragons,614903,2,bot,J. Hernandez walked; J. Leach advanced to second.,18,2026-02-28T14:30:00-05:00,"McConnell Family Stadium (Erie, PA)",125,MBA,2026
6494606,615037,Gannon Golden Knights,614903,Tiffin Dragons,614903,2,bot,G. Cady grounded into double play 3b to 1b; J. Hernandez advanced to second; J. Leach out on the play.,19,2026-02-28T14:30:00-05:00,"McConnell Family Stadium (Erie, PA)",125,MBA,2026
6494606,615037,Gannon Golden Knights,614903,Tiffin Dragons,614903,2,bot,"J. Skrelja singled to pitcher, RBI; J. Hernandez scored.",20,2026-02-28T14:30:00-05:00,"McConnell Family Stadium (Erie, PA)",125,MBA,2026
6494606,615037,Gannon Golden Knights,614903,Tiffin Dragons,614903,2,bot,"B. Clark doubled to right field, RBI; J. Skrelja scored.",21,2026-02-28T14:30:00-05:00,"McConnell Family Stadium (Erie, PA)",125,MBA,2026
6494606,615037,Gannon Golden Knights,614903,Tiffin Dragons,614903,2,bot,A. Deitschel grounded out to ss.,22,2026-02-28T14:30:00-05:00,"McConnell Family Stadium (Erie, PA)",125,MBA,2026
6494606,615037,Gannon Golden Knights,614903,Tiffin Dragons,615037,3,top,B. Koroly tripled to right field.,23,2026-02-28T14:30:00-05:00,"McConnell Family Stadium (Erie, PA)",125,MBA,2026
6494606,615037,Gannon Golden Knights,614903,Tiffin Dragons,615037,3,top,C. Atherton walked.,24,2026-02-28T14:30:00-05:00,"McConnell Family Stadium (Erie, PA)",125,MBA,2026
6494606,615037,Gannon Golden Knights,614903,Tiffin Dragons,615037,3,top,F. Kula walked; C. Atherton advanced to second.,25,2026-02-28T14:30:00-05:00,"McConnell Family Stadium (Erie, PA)",125,MBA,2026
6494606,615037,Gannon Golden Knights,614903,Tiffin Dragons,615037,3,top,F. Kula advanced to second; C. Atherton advanced to third; B. Koroly scored on a wild pitch.,26,2026-02-28T14:30:00-05:00,"McConnell Family Stadium (Erie, PA)",125,MBA,2026
6494606,615037,Gannon Golden Knights,614903,Tiffin Dragons,615037,3,top,"H. Troiano singled to left field, RBI; F. Kula advanced to third; C. Atherton scored.",27,2026-02-28T14:30:00-05:00,"McConnell Family Stadium (Erie, PA)",125,MBA,2026
6494606,615037,Gannon Golden Knights,614903,Tiffin Dragons,615037,3,top,C. Smith grounded out to 3b; H. Troiano advanced to second.,28,2026-02-28T14:30:00-05:00,"McConnell Family Stadium (Erie, PA)",125,MBA,2026
6494606,615037,Gannon Golden Knights,614903,Tiffin Dragons,615037,3,top,"W. Parker reached on a fielder's choice to shortstop, RBI; H. Troiano out at third ss unassisted; F. Kula scored.",29,2026-02-28T14:30:00-05:00,"McConnell Family Stadium (Erie, PA)",125,MBA,2026
6494606,615037,Gannon Golden Knights,614903,Tiffin Dragons,615037,3,top,I. Soto grounded out to ss.,30,2026-02-28T14:30:00-05:00,"McConnell Family Stadium (Erie, PA)",125,MBA,2026
6494606,615037,Gannon Golden Knights,614903,Tiffin Dragons,614903,3,bot,M. Patellis struck out swinging.,31,2026-02-28T14:30:00-05:00,"McConnell Family Stadium (Erie, PA)",125,MBA,2026
6494606,615037,Gannon Golden Knights,614903,Tiffin Dragons,614903,3,bot,G. Marceric grounded out to 3b.,32,2026-02-28T14:30:00-05:00,"McConnell Family Stadium (Erie, PA)",125,MBA,2026
6494606,615037,Gannon Golden Knights,614903,Tiffin Dragons,614903,3,bot,L. Westerman popped up to ss.,33,2026-02-28T14:30:00-05:00,"McConnell Family Stadium (Erie, PA)",125,MBA,2026
6494606,615037,Gannon Golden Knights,614903,Tiffin Dragons,615037,4,top,"D. Costello struck out swinging, out at first c to 1b.",34,2026-02-28T14:30:00-05:00,"McConnell Family Stadium (Erie, PA)",125,MBA,2026
6494606,615037,Gannon Golden Knights,614903,Tiffin Dragons,615037,4,top,C. Mullins walked.,35,2026-02-28T14:30:00-05:00,"McConnell Family Stadium (Erie, PA)",125,MBA,2026
6494606,615037,Gannon Golden Knights,614903,Tiffin Dragons,615037,4,top,B. Koroly reached on a fielder's choice to second base; C. Mullins out at second 2b to ss.,36,2026-02-28T14:30:00-05:00,"McConnell Family Stadium (Erie, PA)",125,MBA,2026
6494606,615037,Gannon Golden Knights,614903,Tiffin Dragons,615037,4,top,C. Atherton lined out to ss.,37,2026-02-28T14:30:00-05:00,"McConnell Family Stadium (Erie, PA)",125,MBA,2026
6494606,615037,Gannon Golden Knights,614903,Tiffin Dragons,614903,4,bot,J. Leach grounded out to 3b.,38,2026-02-28T14:30:00-05:00,"McConnell Family Stadium (Erie, PA)",125,MBA,2026
6494606,615037,Gannon Golden Knights,614903,Tiffin Dragons,614903,4,bot,J. Hernandez struck out looking.,39,2026-02-28T14:30:00-05:00,"McConnell Family Stadium (Erie, PA)",125,MBA,2026
6494606,615037,Gannon Golden Knights,614903,Tiffin Dragons,614903,4,bot,G. Cady popped up to ss.,40,2026-02-28T14:30:00-05:00,"McConnell Family Stadium (Erie, PA)",125,MBA,2026
6494606,615037,Gannon Golden Knights,614903,Tiffin Dragons,615037,5,top,H. Bush to p for T. Hedges.,41,2026-02-28T14:30:00-05:00,"McConnell Family Stadium (Erie, PA)",125,MBA,2026
6494606,615037,Gannon Golden Knights,614903,Tiffin Dragons,615037,5,top,F. Kula struck out swinging.,42,2026-02-28T14:30:00-05:00,"McConnell Family Stadium (Erie, PA)",125,MBA,2026
6494606,615037,Gannon Golden Knights,614903,Tiffin Dragons,615037,5,top,H. Troiano walked.,43,2026-02-28T14:30:00-05:00,"McConnell Family Stadium (Erie, PA)",125,MBA,2026
6494606,615037,Gannon Golden Knights,614903,Tiffin Dragons,615037,5,top,C. Smith singled to left field; H. Troiano advanced to second.,44,2026-02-28T14:30:00-05:00,"McConnell Family Stadium (Erie, PA)",125,MBA,2026
6494606,615037,Gannon Golden Knights,614903,Tiffin Dragons,615037,5,top,W. Parker struck out swinging.,45,2026-02-28T14:30:00-05:00,"McConnell Family Stadium (Erie, PA)",125,MBA,2026
6494606,615037,Gannon Golden Knights,614903,Tiffin Dragons,615037,5,top,"I. Soto reached first on an error by 3b; C. Smith advanced to second; H. Troiano advanced to third, out at home 3b to c.",46,2026-02-28T14:30:00-05:00,"McConnell Family Stadium (Erie, PA)",125,MBA,2026
6494606,615037,Gannon Golden Knights,614903,Tiffin Dragons,614903,5,bot,J. Skrelja hit by pitch.,47,2026-02-28T14:30:00-05:00,"McConnell Family Stadium (Erie, PA)",125,MBA,2026
6494606,615037,Gannon Golden Knights,614903,Tiffin Dragons,614903,5,bot,"J. Skrelja out at first p to 1b, picked off.",48,2026-02-28T14:30:00-05:00,"McConnell Family Stadium (Erie, PA)",125,MBA,2026
6494606,615037,Gannon Golden Knights,614903,Tiffin Dragons,614903,5,bot,B. Clark doubled to right field.,49,2026-02-28T14:30:00-05:00,"McConnell Family Stadium (Erie, PA)",125,MBA,2026
6494606,615037,Gannon Golden Knights,614903,Tiffin Dragons,614903,5,bot,A. Deitschel flied out to lf.,50,2026-02-28T14:30:00-05:00,"McConnell Family Stadium (Erie, PA)",125,MBA,2026
6494606,615037,Gannon Golden Knights,614903,Tiffin Dragons,614903,5,bot,"M. Patellis reached first on an error by ss; B. Clark scored, unearned.",51,2026-02-28T14:30:00-05:00,"McConnell Family Stadium (Erie, PA)",125,MBA,2026
6494606,615037,Gannon Golden Knights,614903,Tiffin Dragons,614903,5,bot,G. Marceric singled to left field; M. Patellis advanced to second.,52,2026-02-28T14:30:00-05:00,"McConnell Family Stadium (Erie, PA)",125,MBA,2026
6494606,615037,Gannon Golden Knights,614903,Tiffin Dragons,614903,5,bot,G. Marceric advanced to second; M. Patellis advanced to third on a wild pitch.,53,2026-02-28T14:30:00-05:00,"McConnell Family Stadium (Erie, PA)",125,MBA,2026
6494606,615037,Gannon Golden Knights,614903,Tiffin Dragons,614903,5,bot,L. Westerman walked.,54,2026-02-28T14:30:00-05:00,"McConnell Family Stadium (Erie, PA)",125,MBA,2026
6494606,615037,Gannon Golden Knights,614903,Tiffin Dragons,614903,5,bot,A. Wheelock to p for H. Steinke.,55,2026-02-28T14:30:00-05:00,"McConnell Family Stadium (Erie, PA)",125,MBA,2026
6494606,615037,Gannon Golden Knights,614903,Tiffin Dragons,614903,5,bot,"G. Marceric advanced to third; M. Patellis scored on a wild pitch, unearned.",56,2026-02-28T14:30:00-05:00,"McConnell Family Stadium (Erie, PA)",125,MBA,2026
6494606,615037,Gannon Golden Knights,614903,Tiffin Dragons,614903,5,bot,"G. Marceric stole home, unearned.",57,2026-02-28T14:30:00-05:00,"McConnell Family Stadium (Erie, PA)",125,MBA,2026
6494606,615037,Gannon Golden Knights,614903,Tiffin Dragons,614903,5,bot,"L. Westerman out at second p to 2b, picked off, caught stealing.",58,2026-02-28T14:30:00-05:00,"McConnell Family Stadium (Erie, PA)",125,MBA,2026
6494606,615037,Gannon Golden Knights,614903,Tiffin Dragons,615037,6,top,M. Smith pinch hit for D. Costello.,59,2026-02-28T14:30:00-05:00,"McConnell Family Stadium (Erie, PA)",125,MBA,2026
6494606,615037,Gannon Golden Knights,614903,Tiffin Dragons,615037,6,top,M. Smith walked.,60,2026-02-28T14:30:00-05:00,"McConnell Family Stadium (Erie, PA)",125,MBA,2026
6494606,615037,Gannon Golden Knights,614903,Tiffin Dragons,615037,6,top,C. Mullins reached on a fielder's choice to shortstop; M. Smith out at second ss to 2b.,61,2026-02-28T14:30:00-05:00,"McConnell Family Stadium (Erie, PA)",125,MBA,2026
6494606,615037,Gannon Golden Knights,614903,Tiffin Dragons,615037,6,top,B. Koroly struck out swinging.,62,2026-02-28T14:30:00-05:00,"McConnell Family Stadium (Erie, PA)",125,MBA,2026
6494606,615037,Gannon Golden Knights,614903,Tiffin Dragons,615037,6,top,C. Mullins advanced to second on a wild pitch.,63,2026-02-28T14:30:00-05:00,"McConnell Family Stadium (Erie, PA)",125,MBA,2026
6494606,615037,Gannon Golden Knights,614903,Tiffin Dragons,615037,6,top,C. Atherton hit by pitch.,64,2026-02-28T14:30:00-05:00,"McConnell Family Stadium (Erie, PA)",125,MBA,2026
6494606,615037,Gannon Golden Knights,614903,Tiffin Dragons,615037,6,top,C. Mullins stole third.,65,2026-02-28T14:30:00-05:00,"McConnell Family Stadium (Erie, PA)",125,MBA,2026
6494606,615037,Gannon Golden Knights,614903,Tiffin Dragons,615037,6,top,F. Kula walked; C. Atherton advanced to second.,66,2026-02-28T14:30:00-05:00,"McConnell Family Stadium (Erie, PA)",125,MBA,2026
6494606,615037,Gannon Golden Knights,614903,Tiffin Dragons,615037,6,top,M. Brunecz to p for H. Bush.,67,2026-02-28T14:30:00-05:00,"McConnell Family Stadium (Erie, PA)",125,MBA,2026
6494606,615037,Gannon Golden Knights,614903,Tiffin Dragons,615037,6,top,"H. Troiano doubled to center field, 2 RBI; F. Kula advanced to third; C. Atherton scored; C. Mullins scored.",68,2026-02-28T14:30:00-05:00,"McConnell Family Stadium (Erie, PA)",125,MBA,2026
6494606,615037,Gannon Golden Knights,614903,Tiffin Dragons,615037,6,top,C. Smith popped up to 3b.,69,2026-02-28T14:30:00-05:00,"McConnell Family Stadium (Erie, PA)",125,MBA,2026
6494606,615037,Gannon Golden Knights,614903,Tiffin Dragons,614903,6,bot,M. Smith to rf for D. Costello.,70,2026-02-28T14:30:00-05:00,"McConnell Family Stadium (Erie, PA)",125,MBA,2026
6494606,615037,Gannon Golden Knights,614903,Tiffin Dragons,614903,6,bot,J. Leach flied out to lf.,71,2026-02-28T14:30:00-05:00,"McConnell Family Stadium (Erie, PA)",125,MBA,2026
6494606,615037,Gannon Golden Knights,614903,Tiffin Dragons,614903,6,bot,J. Hernandez struck out looking.,72,2026-02-28T14:30:00-05:00,"McConnell Family Stadium (Erie, PA)",125,MBA,2026
6494606,615037,Gannon Golden Knights,614903,Tiffin Dragons,614903,6,bot,G. Cady singled to left field.,73,2026-02-28T14:30:00-05:00,"McConnell Family Stadium (Erie, PA)",125,MBA,2026
6494606,615037,Gannon Golden Knights,614903,Tiffin Dragons,614903,6,bot,J. Skrelja grounded out to 3b.,74,2026-02-28T14:30:00-05:00,"McConnell Family Stadium (Erie, PA)",125,MBA,2026
6494606,615037,Gannon Golden Knights,614903,Tiffin Dragons,615037,7,top,W. Parker hit by pitch.,75,2026-02-28T14:30:00-05:00,"McConnell Family Stadium (Erie, PA)",125,MBA,2026
6494606,615037,Gannon Golden Knights,614903,Tiffin Dragons,615037,7,top,W. Parker advanced to second on a passed ball.,76,2026-02-28T14:30:00-05:00,"McConnell Family Stadium (Erie, PA)",125,MBA,2026
6494606,615037,Gannon Golden Knights,614903,Tiffin Dragons,615037,7,top,I. Soto walked.,77,2026-02-28T14:30:00-05:00,"McConnell Family Stadium (Erie, PA)",125,MBA,2026
6494606,615037,Gannon Golden Knights,614903,Tiffin Dragons,615037,7,top,"M. Smith singled to center field, RBI; I. Soto advanced to second; W. Parker scored.",78,2026-02-28T14:30:00-05:00,"McConnell Family Stadium (Erie, PA)",125,MBA,2026
6494606,615037,Gannon Golden Knights,614903,Tiffin Dragons,615037,7,top,B. Madison to p for M. Brunecz.,79,2026-02-28T14:30:00-05:00,"McConnell Family Stadium (Erie, PA)",125,MBA,2026
6494606,615037,Gannon Golden Knights,614903,Tiffin Dragons,615037,7,top,B. Smith pinch hit for C. Mullins.,80,2026-02-28T14:30:00-05:00,"McConnell Family Stadium (Erie, PA)",125,MBA,2026
6494606,615037,Gannon Golden Knights,614903,Tiffin Dragons,615037,7,top,B. Smith struck out looking.,81,2026-02-28T14:30:00-05:00,"McConnell Family Stadium (Erie, PA)",125,MBA,2026
6494606,615037,Gannon Golden Knights,614903,Tiffin Dragons,615037,7,top,B. Koroly struck out swinging.,82,2026-02-28T14:30:00-05:00,"McConnell Family Stadium (Erie, PA)",125,MBA,2026
6494606,615037,Gannon Golden Knights,614903,Tiffin Dragons,615037,7,top,I. Soto stole third.,83,2026-02-28T14:30:00-05:00,"McConnell Family Stadium (Erie, PA)",125,MBA,2026
6494606,615037,Gannon Golden Knights,614903,Tiffin Dragons,615037,7,top,"C. Atherton doubled to left field, RBI; M. Smith advanced to third; I. Soto scored.",84,2026-02-28T14:30:00-05:00,"McConnell Family Stadium (Erie, PA)",125,MBA,2026
6494606,615037,Gannon Golden Knights,614903,Tiffin Dragons,615037,7,top,F. Kula struck out swinging.,85,2026-02-28T14:30:00-05:00,"McConnell Family Stadium (Erie, PA)",125,MBA,2026
6494606,615037,Gannon Golden Knights,614903,Tiffin Dragons,614903,7,bot,J. Walsh to p for A. Wheelock.,86,2026-02-28T14:30:00-05:00,"McConnell Family Stadium (Erie, PA)",125,MBA,2026
6494606,615037,Gannon Golden Knights,614903,Tiffin Dragons,614903,7,bot,B. Smith to c for C. Mullins.,87,2026-02-28T14:30:00-05:00,"McConnell Family Stadium (Erie, PA)",125,MBA,2026
6494606,615037,Gannon Golden Knights,614903,Tiffin Dragons,614903,7,bot,B. Clark popped up to ss.,88,2026-02-28T14:30:00-05:00,"McConnell Family Stadium (Erie, PA)",125,MBA,2026
6494606,615037,Gannon Golden Knights,614903,Tiffin Dragons,614903,7,bot,A. Deitschel walked.,89,2026-02-28T14:30:00-05:00,"McConnell Family Stadium (Erie, PA)",125,MBA,2026
6494606,615037,Gannon Golden Knights,614903,Tiffin Dragons,614903,7,bot,A. Deitschel stole second.,90,2026-02-28T14:30:00-05:00,"McConnell Family Stadium (Erie, PA)",125,MBA,2026
6494606,615037,Gannon Golden Knights,614903,Tiffin Dragons,614903,7,bot,M. Patellis flied out to lf; A. Deitschel advanced to third.,91,2026-02-28T14:30:00-05:00,"McConnell Family Stadium (Erie, PA)",125,MBA,2026
6494606,615037,Gannon Golden Knights,614903,Tiffin Dragons,614903,7,bot,"G. Marceric doubled to left field, RBI; A. Deitschel scored.",92,2026-02-28T14:30:00-05:00,"McConnell Family Stadium (Erie, PA)",125,MBA,2026
6494606,615037,Gannon Golden Knights,614903,Tiffin Dragons,614903,7,bot,"G. Marceric out at third c to 3b, caught stealing.",93,2026-02-28T14:30:00-05:00,"McConnell Family Stadium (Erie, PA)",125,MBA,2026
6494606,615037,Gannon Golden Knights,614903,Tiffin Dragons,615037,8,top,H. Troiano flied out to cf.,94,2026-02-28T14:30:00-05:00,"McConnell Family Stadium (Erie, PA)",125,MBA,2026
6494606,615037,Gannon Golden Knights,614903,Tiffin Dragons,615037,8,top,C. Smith grounded out to 2b.,95,2026-02-28T14:30:00-05:00,"McConnell Family Stadium (Erie, PA)",125,MBA,2026
6494606,615037,Gannon Golden Knights,614903,Tiffin Dragons,615037,8,top,"W. Parker singled to center field, advanced to second on a fielding error by cf.",96,2026-02-28T14:30:00-05:00,"McConnell Family Stadium (Erie, PA)",125,MBA,2026
6494606,615037,Gannon Golden Knights,614903,Tiffin Dragons,615037,8,top,W. Parker advanced to third on a wild pitch.,97,2026-02-28T14:30:00-05:00,"McConnell Family Stadium (Erie, PA)",125,MBA,2026
6494606,615037,Gannon Golden Knights,614903,Tiffin Dragons,615037,8,top,I. Soto flied out to cf.,98,2026-02-28T14:30:00-05:00,"McConnell Family Stadium (Erie, PA)",125,MBA,2026
6494606,615037,Gannon Golden Knights,614903,Tiffin Dragons,614903,8,bot,L. Oakes to p for J. Walsh.,99,2026-02-28T14:30:00-05:00,"McConnell Family Stadium (Erie, PA)",125,MBA,2026
6494606,615037,Gannon Golden Knights,614903,Tiffin Dragons,614903,8,bot,L. Westerman singled to left field.,100,2026-02-28T14:30:00-05:00,"McConnell Family Stadium (Erie, PA)",125,MBA,2026
6494606,615037,Gannon Golden Knights,614903,Tiffin Dragons,614903,8,bot,J. Leach struck out looking.,101,2026-02-28T14:30:00-05:00,"McConnell Family Stadium (Erie, PA)",125,MBA,2026
6494606,615037,Gannon Golden Knights,614903,Tiffin Dragons,614903,8,bot,J. Hernandez struck out looking.,102,2026-02-28T14:30:00-05:00,"McConnell Family Stadium (Erie, PA)",125,MBA,2026
6494606,615037,Gannon Golden Knights,614903,Tiffin Dragons,614903,8,bot,L. Westerman stole second.,103,2026-02-28T14:30:00-05:00,"McConnell Family Stadium (Erie, PA)",125,MBA,2026
6494606,615037,Gannon Golden Knights,614903,Tiffin Dragons,614903,8,bot,G. Cady walked.,104,2026-02-28T14:30:00-05:00,"McConnell Family Stadium (Erie, PA)",125,MBA,2026
6494606,615037,Gannon Golden Knights,614903,Tiffin Dragons,614903,8,bot,J. Skrelja struck out looking.,105,2026-02-28T14:30:00-05:00,"McConnell Family Stadium (Erie, PA)",125,MBA,2026
6494606,615037,Gannon Golden Knights,614903,Tiffin Dragons,615037,9,top,B. Polilli to p for B. Madison.,106,2026-02-28T14:30:00-05:00,"McConnell Family Stadium (Erie, PA)",125,MBA,2026
6494606,615037,Gannon Golden Knights,614903,Tiffin Dragons,615037,9,top,M. Smith struck out looking.,107,2026-02-28T14:30:00-05:00,"McConnell Family Stadium (Erie, PA)",125,MBA,2026
6494606,615037,Gannon Golden Knights,614903,Tiffin Dragons,615037,9,top,B. Smith struck out swinging.,108,2026-02-28T14:30:00-05:00,"McConnell Family Stadium (Erie, PA)",125,MBA,2026
6494606,615037,Gannon Golden Knights,614903,Tiffin Dragons,615037,9,top,B. Koroly grounded out to 2b.,109,2026-02-28T14:30:00-05:00,"McConnell Family Stadium (Erie, PA)",125,MBA,2026
