game_id,away_team_id,away_team_name,home_team_id,home_team_name,batting_team,inning,top_bot,event_text,event_num,game_datetime,stadium_name,attendance,sport_id,season
6498923,614846,Alabama A&M Bulldogs,614674,UNC Asheville Bulldogs,614846,1,top,Miles Jackso lined out to cf (3-2 KBBBF).,1,2026-03-06T15:00:00-05:00,"Greenwood Field (Asheville, NC)",200,MBA,2026
6498923,614846,Alabama A&M Bulldogs,614674,UNC Asheville Bulldogs,614846,1,top,AJ Anderson singled to left field (0-1 K).,2,2026-03-06T15:00:00-05:00,"Greenwood Field (Asheville, NC)",200,MBA,2026
6498923,614846,Alabama A&M Bulldogs,614674,UNC Asheville Bulldogs,614846,1,top,Brycen Hammo popped up to ss (1-0 B).,3,2026-03-06T15:00:00-05:00,"Greenwood Field (Asheville, NC)",200,MBA,2026
6498923,614846,Alabama A&M Bulldogs,614674,UNC Asheville Bulldogs,614846,1,top,Tervell John struck out swinging (1-2 SFBS).,4,2026-03-06T15:00:00-05:00,"Greenwood Field (Asheville, NC)",200,MBA,2026
6498923,614846,Alabama A&M Bulldogs,614674,UNC Asheville Bulldogs,614674,1,bot,L. Lowe grounded out to 3b (3-1 BKBB).,5,2026-03-06T15:00:00-05:00,"Greenwood Field (Asheville, NC)",200,MBA,2026
6498923,614846,Alabama A&M Bulldogs,614674,UNC Asheville Bulldogs,614674,1,bot,P. Gillen singled through the right side (0-1 K).,6,2026-03-06T15:00:00-05:00,"Greenwood Field (Asheville, NC)",200,MBA,2026
6498923,614846,Alabama A&M Bulldogs,614674,UNC Asheville Bulldogs,614674,1,bot,B. Johnson flied out to cf (1-0 B).,7,2026-03-06T15:00:00-05:00,"Greenwood Field (Asheville, NC)",200,MBA,2026
6498923,614846,Alabama A&M Bulldogs,614674,UNC Asheville Bulldogs,614674,1,bot,B. Green grounded out to 3b (1-1 BK).,8,2026-03-06T15:00:00-05:00,"Greenwood Field (Asheville, NC)",200,MBA,2026
6498923,614846,Alabama A&M Bulldogs,614674,UNC Asheville Bulldogs,614846,2,top,Keondre Fiel struck out swinging (2-2 KBFBS).,9,2026-03-06T15:00:00-05:00,"Greenwood Field (Asheville, NC)",200,MBA,2026
6498923,614846,Alabama A&M Bulldogs,614674,UNC Asheville Bulldogs,614846,2,top,Wilmer Cueva singled up the middle (1-0 B).,10,2026-03-06T15:00:00-05:00,"Greenwood Field (Asheville, NC)",200,MBA,2026
6498923,614846,Alabama A&M Bulldogs,614674,UNC Asheville Bulldogs,614846,2,top,Zak Rice lined out to cf (1-0 B).,11,2026-03-06T15:00:00-05:00,"Greenwood Field (Asheville, NC)",200,MBA,2026
6498923,614846,Alabama A&M Bulldogs,614674,UNC Asheville Bulldogs,614846,2,top,KJ Stanfield grounded out to c unassisted (2-2 BBFS).,12,2026-03-06T15:00:00-05:00,"Greenwood Field (Asheville, NC)",200,MBA,2026
6498923,614846,Alabama A&M Bulldogs,614674,UNC Asheville Bulldogs,614674,2,bot,J. Minarik flied out to lf (2-2 BFKB).,13,2026-03-06T15:00:00-05:00,"Greenwood Field (Asheville, NC)",200,MBA,2026
6498923,614846,Alabama A&M Bulldogs,614674,UNC Asheville Bulldogs,614674,2,bot,O. Michelson walked (3-2 BBKBFB).,14,2026-03-06T15:00:00-05:00,"Greenwood Field (Asheville, NC)",200,MBA,2026
6498923,614846,Alabama A&M Bulldogs,614674,UNC Asheville Bulldogs,614674,2,bot,Z. Swangim singled through the left side (0-0)3a O. Michelson advanced to second.,15,2026-03-06T15:00:00-05:00,"Greenwood Field (Asheville, NC)",200,MBA,2026
6498923,614846,Alabama A&M Bulldogs,614674,UNC Asheville Bulldogs,614674,2,bot,C. McGinnis fouled out to 3b (0-0).,16,2026-03-06T15:00:00-05:00,"Greenwood Field (Asheville, NC)",200,MBA,2026
6498923,614846,Alabama A&M Bulldogs,614674,UNC Asheville Bulldogs,614674,2,bot,"Klingemann singled up the middle (1-2 KFB)3a Z. Swangim advanced to second, out at third cf to 3b3a O. Michelson advanced to third.",17,2026-03-06T15:00:00-05:00,"Greenwood Field (Asheville, NC)",200,MBA,2026
6498923,614846,Alabama A&M Bulldogs,614674,UNC Asheville Bulldogs,614846,3,top,Devante Well walked (3-1 BFBBB).,18,2026-03-06T15:00:00-05:00,"Greenwood Field (Asheville, NC)",200,MBA,2026
6498923,614846,Alabama A&M Bulldogs,614674,UNC Asheville Bulldogs,614846,3,top,Miles Jackso fouled out to 1b (1-1 BS).,19,2026-03-06T15:00:00-05:00,"Greenwood Field (Asheville, NC)",200,MBA,2026
6498923,614846,Alabama A&M Bulldogs,614674,UNC Asheville Bulldogs,614846,3,top,AJ Anderson singled through the right side (2-2 KSBB)3a Devante Well advanced to second.,20,2026-03-06T15:00:00-05:00,"Greenwood Field (Asheville, NC)",200,MBA,2026
6498923,614846,Alabama A&M Bulldogs,614674,UNC Asheville Bulldogs,614846,3,top,"Brycen Hammo singled to right center, RBI (0-1 S)3a AJ Anderson advanced to second3a Devante Well scored.",21,2026-03-06T15:00:00-05:00,"Greenwood Field (Asheville, NC)",200,MBA,2026
6498923,614846,Alabama A&M Bulldogs,614674,UNC Asheville Bulldogs,614846,3,top,Tervell John reached on a fielder's choice (1-1 SB)3a Brycen Hammo out at second 3b to 2b3a AJ Anderson advanced to third.,22,2026-03-06T15:00:00-05:00,"Greenwood Field (Asheville, NC)",200,MBA,2026
6498923,614846,Alabama A&M Bulldogs,614674,UNC Asheville Bulldogs,614846,3,top,Keondre Fiel struck out swinging (3-2 KBBBKS).,23,2026-03-06T15:00:00-05:00,"Greenwood Field (Asheville, NC)",200,MBA,2026
6498923,614846,Alabama A&M Bulldogs,614674,UNC Asheville Bulldogs,614674,3,bot,L. Lowe flied out to cf to left center (1-2 SKB).,24,2026-03-06T15:00:00-05:00,"Greenwood Field (Asheville, NC)",200,MBA,2026
6498923,614846,Alabama A&M Bulldogs,614674,UNC Asheville Bulldogs,614674,3,bot,P. Gillen reached on a fielding error by 1b (3-1 BBBK).,25,2026-03-06T15:00:00-05:00,"Greenwood Field (Asheville, NC)",200,MBA,2026
6498923,614846,Alabama A&M Bulldogs,614674,UNC Asheville Bulldogs,614674,3,bot,"B. Johnson tripled down the rf line, RBI (2-1 KBB)3a P. Gillen scored, unearned.",26,2026-03-06T15:00:00-05:00,"Greenwood Field (Asheville, NC)",200,MBA,2026
6498923,614846,Alabama A&M Bulldogs,614674,UNC Asheville Bulldogs,614674,3,bot,B. Johnson scored on a wild pitch.,27,2026-03-06T15:00:00-05:00,"Greenwood Field (Asheville, NC)",200,MBA,2026
6498923,614846,Alabama A&M Bulldogs,614674,UNC Asheville Bulldogs,614674,3,bot,B. Green grounded out to 2b up the middle (2-1 KBB).,28,2026-03-06T15:00:00-05:00,"Greenwood Field (Asheville, NC)",200,MBA,2026
6498923,614846,Alabama A&M Bulldogs,614674,UNC Asheville Bulldogs,614674,3,bot,J. Minarik walked (3-0 BBBB).,29,2026-03-06T15:00:00-05:00,"Greenwood Field (Asheville, NC)",200,MBA,2026
6498923,614846,Alabama A&M Bulldogs,614674,UNC Asheville Bulldogs,614674,3,bot,O. Michelson walked (3-0 BBBB)3a J. Minarik advanced to second.,30,2026-03-06T15:00:00-05:00,"Greenwood Field (Asheville, NC)",200,MBA,2026
6498923,614846,Alabama A&M Bulldogs,614674,UNC Asheville Bulldogs,614674,3,bot,"Z. Swangim singled up the middle, advanced to second on the throw, RBI (3-2 KBKFBB)3a O. Michelson advanced to third3a J. Minarik scored, unearned.",31,2026-03-06T15:00:00-05:00,"Greenwood Field (Asheville, NC)",200,MBA,2026
6498923,614846,Alabama A&M Bulldogs,614674,UNC Asheville Bulldogs,614674,3,bot,"C. McGinnis walked (3-0 BBBB)3a Z. Swangim advanced to third3a O. Michelson scored on a wild pitch, unearned.",32,2026-03-06T15:00:00-05:00,"Greenwood Field (Asheville, NC)",200,MBA,2026
6498923,614846,Alabama A&M Bulldogs,614674,UNC Asheville Bulldogs,614674,3,bot,Evan Hurlbur to p for Edyn Barber.,33,2026-03-06T15:00:00-05:00,"Greenwood Field (Asheville, NC)",200,MBA,2026
6498923,614846,Alabama A&M Bulldogs,614674,UNC Asheville Bulldogs,614674,3,bot,"Z. Swangim out at home c to 2b to c, caught stealing.",34,2026-03-06T15:00:00-05:00,"Greenwood Field (Asheville, NC)",200,MBA,2026
6498923,614846,Alabama A&M Bulldogs,614674,UNC Asheville Bulldogs,614846,4,top,Wilmer Cueva flied out to lf to left center (0-0).,35,2026-03-06T15:00:00-05:00,"Greenwood Field (Asheville, NC)",200,MBA,2026
6498923,614846,Alabama A&M Bulldogs,614674,UNC Asheville Bulldogs,614846,4,top,Zak Rice walked (3-2 BBBFSB).,36,2026-03-06T15:00:00-05:00,"Greenwood Field (Asheville, NC)",200,MBA,2026
6498923,614846,Alabama A&M Bulldogs,614674,UNC Asheville Bulldogs,614846,4,top,KJ Stanfield walked (3-2 KSBFBBB)3a Zak Rice advanced to second.,37,2026-03-06T15:00:00-05:00,"Greenwood Field (Asheville, NC)",200,MBA,2026
6498923,614846,Alabama A&M Bulldogs,614674,UNC Asheville Bulldogs,614846,4,top,Devante Well struck out swinging (1-2 BKFS).,38,2026-03-06T15:00:00-05:00,"Greenwood Field (Asheville, NC)",200,MBA,2026
6498923,614846,Alabama A&M Bulldogs,614674,UNC Asheville Bulldogs,614846,4,top,Miles Jackso walked (3-0 BBBB)3a KJ Stanfield advanced to second3a Zak Rice advanced to third.,39,2026-03-06T15:00:00-05:00,"Greenwood Field (Asheville, NC)",200,MBA,2026
6498923,614846,Alabama A&M Bulldogs,614674,UNC Asheville Bulldogs,614846,4,top,AJ Anderson struck out swinging (0-2 KSS).,40,2026-03-06T15:00:00-05:00,"Greenwood Field (Asheville, NC)",200,MBA,2026
6498923,614846,Alabama A&M Bulldogs,614674,UNC Asheville Bulldogs,614674,4,bot,Klingemann walked (3-2 BBBKKB).,41,2026-03-06T15:00:00-05:00,"Greenwood Field (Asheville, NC)",200,MBA,2026
6498923,614846,Alabama A&M Bulldogs,614674,UNC Asheville Bulldogs,614674,4,bot,L. Lowe flied out to rf (3-1 BBKB).,42,2026-03-06T15:00:00-05:00,"Greenwood Field (Asheville, NC)",200,MBA,2026
6498923,614846,Alabama A&M Bulldogs,614674,UNC Asheville Bulldogs,614674,4,bot,P. Gillen lined out to lf (0-1 F).,43,2026-03-06T15:00:00-05:00,"Greenwood Field (Asheville, NC)",200,MBA,2026
6498923,614846,Alabama A&M Bulldogs,614674,UNC Asheville Bulldogs,614674,4,bot,B. Johnson walked (3-1 BSBBB)3a Klingemann advanced to second.,44,2026-03-06T15:00:00-05:00,"Greenwood Field (Asheville, NC)",200,MBA,2026
6498923,614846,Alabama A&M Bulldogs,614674,UNC Asheville Bulldogs,614674,4,bot,B. Green flied out to lf (0-1 K).,45,2026-03-06T15:00:00-05:00,"Greenwood Field (Asheville, NC)",200,MBA,2026
6498923,614846,Alabama A&M Bulldogs,614674,UNC Asheville Bulldogs,614846,5,top,Brycen Hammo grounded out to 2b (1-1 BF).,46,2026-03-06T15:00:00-05:00,"Greenwood Field (Asheville, NC)",200,MBA,2026
6498923,614846,Alabama A&M Bulldogs,614674,UNC Asheville Bulldogs,614846,5,top,Tervell John walked (3-2 BBFBKB).,47,2026-03-06T15:00:00-05:00,"Greenwood Field (Asheville, NC)",200,MBA,2026
6498923,614846,Alabama A&M Bulldogs,614674,UNC Asheville Bulldogs,614846,5,top,Keondre Fiel walked (3-2 BKBBFB)3a Tervell John advanced to second.,48,2026-03-06T15:00:00-05:00,"Greenwood Field (Asheville, NC)",200,MBA,2026
6498923,614846,Alabama A&M Bulldogs,614674,UNC Asheville Bulldogs,614846,5,top,B. Barna to p for L. Boesen.,49,2026-03-06T15:00:00-05:00,"Greenwood Field (Asheville, NC)",200,MBA,2026
6498923,614846,Alabama A&M Bulldogs,614674,UNC Asheville Bulldogs,614846,5,top,"Keondre Fiel advanced to second3a Tervell John out at third c to 3b, caught stealing.",50,2026-03-06T15:00:00-05:00,"Greenwood Field (Asheville, NC)",200,MBA,2026
6498923,614846,Alabama A&M Bulldogs,614674,UNC Asheville Bulldogs,614846,5,top,"Wilmer Cueva singled down the lf line, RBI (1-2 KFFB)3a Keondre Fiel scored.",51,2026-03-06T15:00:00-05:00,"Greenwood Field (Asheville, NC)",200,MBA,2026
6498923,614846,Alabama A&M Bulldogs,614674,UNC Asheville Bulldogs,614846,5,top,Zak Rice singled to second base (2-2 BKKB)3a Wilmer Cueva advanced to second.,52,2026-03-06T15:00:00-05:00,"Greenwood Field (Asheville, NC)",200,MBA,2026
6498923,614846,Alabama A&M Bulldogs,614674,UNC Asheville Bulldogs,614846,5,top,KJ Stanfield walked (3-1 KBBBB)3a Zak Rice advanced to second3a Wilmer Cueva advanced to third.,53,2026-03-06T15:00:00-05:00,"Greenwood Field (Asheville, NC)",200,MBA,2026
6498923,614846,Alabama A&M Bulldogs,614674,UNC Asheville Bulldogs,614846,5,top,Devante Well reached on a fielder's choice (0-0)3a KJ Stanfield advanced to second3a Zak Rice out at third 3b unassisted.,54,2026-03-06T15:00:00-05:00,"Greenwood Field (Asheville, NC)",200,MBA,2026
6498923,614846,Alabama A&M Bulldogs,614674,UNC Asheville Bulldogs,614674,5,bot,J. Minarik singled down the rf line (3-2 FBKBBF).,55,2026-03-06T15:00:00-05:00,"Greenwood Field (Asheville, NC)",200,MBA,2026
6498923,614846,Alabama A&M Bulldogs,614674,UNC Asheville Bulldogs,614674,5,bot,E. Krumpe pinch hit for O. Michelson.,56,2026-03-06T15:00:00-05:00,"Greenwood Field (Asheville, NC)",200,MBA,2026
6498923,614846,Alabama A&M Bulldogs,614674,UNC Asheville Bulldogs,614674,5,bot,E. Krumpe singled to right field (2-0 BB)3a J. Minarik advanced to second.,57,2026-03-06T15:00:00-05:00,"Greenwood Field (Asheville, NC)",200,MBA,2026
6498923,614846,Alabama A&M Bulldogs,614674,UNC Asheville Bulldogs,614674,5,bot,Z. Swangim hit by pitch (0-0)3a E. Krumpe advanced to second3a J. Minarik advanced to third.,58,2026-03-06T15:00:00-05:00,"Greenwood Field (Asheville, NC)",200,MBA,2026
6498923,614846,Alabama A&M Bulldogs,614674,UNC Asheville Bulldogs,614674,5,bot,William Tarp to p for Evan Hurlbur.,59,2026-03-06T15:00:00-05:00,"Greenwood Field (Asheville, NC)",200,MBA,2026
6498923,614846,Alabama A&M Bulldogs,614674,UNC Asheville Bulldogs,614674,5,bot,"C. McGinnis flied out to lf, SF, RBI (0-0)3a J. Minarik scored.",60,2026-03-06T15:00:00-05:00,"Greenwood Field (Asheville, NC)",200,MBA,2026
6498923,614846,Alabama A&M Bulldogs,614674,UNC Asheville Bulldogs,614674,5,bot,Klingemann singled through the left side (0-0)3a Z. Swangim advanced to second3a E. Krumpe advanced to third.,61,2026-03-06T15:00:00-05:00,"Greenwood Field (Asheville, NC)",200,MBA,2026
6498923,614846,Alabama A&M Bulldogs,614674,UNC Asheville Bulldogs,614674,5,bot,"L. Lowe reached on a fielder's choice, RBI (1-1 BK)3a Klingemann advanced to second3a Z. Swangim out at third ss to 3b3a E. Krumpe scored.",62,2026-03-06T15:00:00-05:00,"Greenwood Field (Asheville, NC)",200,MBA,2026
6498923,614846,Alabama A&M Bulldogs,614674,UNC Asheville Bulldogs,614674,5,bot,"P. Gillen singled through the right side, RBI (0-1 K)3a L. Lowe advanced to third3a Klingemann scored.",63,2026-03-06T15:00:00-05:00,"Greenwood Field (Asheville, NC)",200,MBA,2026
6498923,614846,Alabama A&M Bulldogs,614674,UNC Asheville Bulldogs,614674,5,bot,B. Johnson walked (3-2 BFBBFB)3a P. Gillen advanced to second.,64,2026-03-06T15:00:00-05:00,"Greenwood Field (Asheville, NC)",200,MBA,2026
6498923,614846,Alabama A&M Bulldogs,614674,UNC Asheville Bulldogs,614674,5,bot,B. Green flied out to cf to left center (0-2 SS).,65,2026-03-06T15:00:00-05:00,"Greenwood Field (Asheville, NC)",200,MBA,2026
6498923,614846,Alabama A&M Bulldogs,614674,UNC Asheville Bulldogs,614846,6,top,Miles Jackso grounded out to ss (2-0 BB).,66,2026-03-06T15:00:00-05:00,"Greenwood Field (Asheville, NC)",200,MBA,2026
6498923,614846,Alabama A&M Bulldogs,614674,UNC Asheville Bulldogs,614846,6,top,AJ Anderson singled to left center (1-2 BKF).,67,2026-03-06T15:00:00-05:00,"Greenwood Field (Asheville, NC)",200,MBA,2026
6498923,614846,Alabama A&M Bulldogs,614674,UNC Asheville Bulldogs,614846,6,top,Brycen Hammo grounded into double play 2b to 1b (2-2 BSFB)3a AJ Anderson out on the play.,68,2026-03-06T15:00:00-05:00,"Greenwood Field (Asheville, NC)",200,MBA,2026
6498923,614846,Alabama A&M Bulldogs,614674,UNC Asheville Bulldogs,614674,6,bot,"J. Minarik homered to left field, RBI.",69,2026-03-06T15:00:00-05:00,"Greenwood Field (Asheville, NC)",200,MBA,2026
6498923,614846,Alabama A&M Bulldogs,614674,UNC Asheville Bulldogs,614674,6,bot,E. Krumpe to dh.,70,2026-03-06T15:00:00-05:00,"Greenwood Field (Asheville, NC)",200,MBA,2026
6498923,614846,Alabama A&M Bulldogs,614674,UNC Asheville Bulldogs,614674,6,bot,E. Krumpe flied out to rf (2-1 BBK).,71,2026-03-06T15:00:00-05:00,"Greenwood Field (Asheville, NC)",200,MBA,2026
6498923,614846,Alabama A&M Bulldogs,614674,UNC Asheville Bulldogs,614674,6,bot,Z. Swangim doubled down the lf line (0-1 K).,72,2026-03-06T15:00:00-05:00,"Greenwood Field (Asheville, NC)",200,MBA,2026
6498923,614846,Alabama A&M Bulldogs,614674,UNC Asheville Bulldogs,614674,6,bot,C. McGinnis fouled out to c (0-0).,73,2026-03-06T15:00:00-05:00,"Greenwood Field (Asheville, NC)",200,MBA,2026
6498923,614846,Alabama A&M Bulldogs,614674,UNC Asheville Bulldogs,614674,6,bot,Klingemann grounded out to ss (3-2 BKBBKF).,74,2026-03-06T15:00:00-05:00,"Greenwood Field (Asheville, NC)",200,MBA,2026
6498923,614846,Alabama A&M Bulldogs,614674,UNC Asheville Bulldogs,614846,7,top,Tervell John walked (3-1 BBKBB).,75,2026-03-06T15:00:00-05:00,"Greenwood Field (Asheville, NC)",200,MBA,2026
6498923,614846,Alabama A&M Bulldogs,614674,UNC Asheville Bulldogs,614846,7,top,Keondre Fiel struck out swinging (3-2 BBFBFS).,76,2026-03-06T15:00:00-05:00,"Greenwood Field (Asheville, NC)",200,MBA,2026
6498923,614846,Alabama A&M Bulldogs,614674,UNC Asheville Bulldogs,614846,7,top,Wilmer Cueva flied out to lf (0-1 K).,77,2026-03-06T15:00:00-05:00,"Greenwood Field (Asheville, NC)",200,MBA,2026
6498923,614846,Alabama A&M Bulldogs,614674,UNC Asheville Bulldogs,614846,7,top,Zak Rice walked (3-2 KBBKBB)3a Tervell John advanced to second.,78,2026-03-06T15:00:00-05:00,"Greenwood Field (Asheville, NC)",200,MBA,2026
6498923,614846,Alabama A&M Bulldogs,614674,UNC Asheville Bulldogs,614846,7,top,R. Howell to p for B. Barna.,79,2026-03-06T15:00:00-05:00,"Greenwood Field (Asheville, NC)",200,MBA,2026
6498923,614846,Alabama A&M Bulldogs,614674,UNC Asheville Bulldogs,614846,7,top,KJ Stanfield struck out looking (2-2 BFBFFK).,80,2026-03-06T15:00:00-05:00,"Greenwood Field (Asheville, NC)",200,MBA,2026
6498923,614846,Alabama A&M Bulldogs,614674,UNC Asheville Bulldogs,614674,7,bot,L. Lowe reached on a fielding error by 3b (0-1 K).,81,2026-03-06T15:00:00-05:00,"Greenwood Field (Asheville, NC)",200,MBA,2026
6498923,614846,Alabama A&M Bulldogs,614674,UNC Asheville Bulldogs,614674,7,bot,P. Gillen flied out to cf (1-1 BK).,82,2026-03-06T15:00:00-05:00,"Greenwood Field (Asheville, NC)",200,MBA,2026
6498923,614846,Alabama A&M Bulldogs,614674,UNC Asheville Bulldogs,614674,7,bot,L. Lowe stole second.,83,2026-03-06T15:00:00-05:00,"Greenwood Field (Asheville, NC)",200,MBA,2026
6498923,614846,Alabama A&M Bulldogs,614674,UNC Asheville Bulldogs,614674,7,bot,B. Johnson flied out to lf (2-1 BFB).,84,2026-03-06T15:00:00-05:00,"Greenwood Field (Asheville, NC)",200,MBA,2026
6498923,614846,Alabama A&M Bulldogs,614674,UNC Asheville Bulldogs,614674,7,bot,L. Lowe advanced to third on a wild pitch.,85,2026-03-06T15:00:00-05:00,"Greenwood Field (Asheville, NC)",200,MBA,2026
6498923,614846,Alabama A&M Bulldogs,614674,UNC Asheville Bulldogs,614674,7,bot,"B. Green struck out swinging, out at first c to 1b (2-2 FBBSS).",86,2026-03-06T15:00:00-05:00,"Greenwood Field (Asheville, NC)",200,MBA,2026
6498923,614846,Alabama A&M Bulldogs,614674,UNC Asheville Bulldogs,614846,8,top,Devante Well flied out to rf to right center (0-0).,87,2026-03-06T15:00:00-05:00,"Greenwood Field (Asheville, NC)",200,MBA,2026
6498923,614846,Alabama A&M Bulldogs,614674,UNC Asheville Bulldogs,614846,8,top,Miles Jackso walked (3-1 BKBBB).,88,2026-03-06T15:00:00-05:00,"Greenwood Field (Asheville, NC)",200,MBA,2026
6498923,614846,Alabama A&M Bulldogs,614674,UNC Asheville Bulldogs,614846,8,top,"Miles Jackso out at second c unassisted, interference.",89,2026-03-06T15:00:00-05:00,"Greenwood Field (Asheville, NC)",200,MBA,2026
6498923,614846,Alabama A&M Bulldogs,614674,UNC Asheville Bulldogs,614846,8,top,AJ Anderson singled to left center (0-2 KS).,90,2026-03-06T15:00:00-05:00,"Greenwood Field (Asheville, NC)",200,MBA,2026
6498923,614846,Alabama A&M Bulldogs,614674,UNC Asheville Bulldogs,614846,8,top,Brycen Hammo grounded out to ss (2-0 BB).,91,2026-03-06T15:00:00-05:00,"Greenwood Field (Asheville, NC)",200,MBA,2026
6498923,614846,Alabama A&M Bulldogs,614674,UNC Asheville Bulldogs,614674,8,bot,J. Minarik singled to left field (0-2 SS).,92,2026-03-06T15:00:00-05:00,"Greenwood Field (Asheville, NC)",200,MBA,2026
6498923,614846,Alabama A&M Bulldogs,614674,UNC Asheville Bulldogs,614674,8,bot,E. Krumpe flied out to cf (0-0).,93,2026-03-06T15:00:00-05:00,"Greenwood Field (Asheville, NC)",200,MBA,2026
6498923,614846,Alabama A&M Bulldogs,614674,UNC Asheville Bulldogs,614674,8,bot,Z. Swangim walked (3-2 BKKBBB)3a J. Minarik advanced to second.,94,2026-03-06T15:00:00-05:00,"Greenwood Field (Asheville, NC)",200,MBA,2026
6498923,614846,Alabama A&M Bulldogs,614674,UNC Asheville Bulldogs,614674,8,bot,C. McGinnis flied out to cf (0-0).,95,2026-03-06T15:00:00-05:00,"Greenwood Field (Asheville, NC)",200,MBA,2026
6498923,614846,Alabama A&M Bulldogs,614674,UNC Asheville Bulldogs,614674,8,bot,Klingemann singled through the right side (0-0)3a Z. Swangim advanced to second3a J. Minarik advanced to third.,96,2026-03-06T15:00:00-05:00,"Greenwood Field (Asheville, NC)",200,MBA,2026
6498923,614846,Alabama A&M Bulldogs,614674,UNC Asheville Bulldogs,614674,8,bot,L. Lowe flied out to cf (1-0 B).,97,2026-03-06T15:00:00-05:00,"Greenwood Field (Asheville, NC)",200,MBA,2026
6498923,614846,Alabama A&M Bulldogs,614674,UNC Asheville Bulldogs,614846,9,top,Isaac Castro pinch hit for Tervell John.,98,2026-03-06T15:00:00-05:00,"Greenwood Field (Asheville, NC)",200,MBA,2026
6498923,614846,Alabama A&M Bulldogs,614674,UNC Asheville Bulldogs,614846,9,top,Isaac Castro walked (3-2 BBKFBB).,99,2026-03-06T15:00:00-05:00,"Greenwood Field (Asheville, NC)",200,MBA,2026
6498923,614846,Alabama A&M Bulldogs,614674,UNC Asheville Bulldogs,614846,9,top,Keondre Fiel reached on a fielder's choice (0-1 K)3a Isaac Castro out at second ss to 2b.,100,2026-03-06T15:00:00-05:00,"Greenwood Field (Asheville, NC)",200,MBA,2026
6498923,614846,Alabama A&M Bulldogs,614674,UNC Asheville Bulldogs,614846,9,top,Wilmer Cueva hit by pitch (1-0 B)3a Keondre Fiel advanced to second.,101,2026-03-06T15:00:00-05:00,"Greenwood Field (Asheville, NC)",200,MBA,2026
6498923,614846,Alabama A&M Bulldogs,614674,UNC Asheville Bulldogs,614846,9,top,"Zak Rice singled to left field, RBI (0-0)3a Wilmer Cueva advanced to second3a Keondre Fiel scored.",102,2026-03-06T15:00:00-05:00,"Greenwood Field (Asheville, NC)",200,MBA,2026
6498923,614846,Alabama A&M Bulldogs,614674,UNC Asheville Bulldogs,614846,9,top,Colin Mason pinch hit for KJ Stanfield.,103,2026-03-06T15:00:00-05:00,"Greenwood Field (Asheville, NC)",200,MBA,2026
6498923,614846,Alabama A&M Bulldogs,614674,UNC Asheville Bulldogs,614846,9,top,Colin Mason singled to left field (0-1 K)3a Zak Rice advanced to second3a Wilmer Cueva advanced to third.,104,2026-03-06T15:00:00-05:00,"Greenwood Field (Asheville, NC)",200,MBA,2026
6498923,614846,Alabama A&M Bulldogs,614674,UNC Asheville Bulldogs,614846,9,top,"Devante Well out at first 1b to p, RBI (3-1 KBBB)3a Colin Mason advanced to second3a Zak Rice advanced to third3a Wilmer Cueva scored.",105,2026-03-06T15:00:00-05:00,"Greenwood Field (Asheville, NC)",200,MBA,2026
6498923,614846,Alabama A&M Bulldogs,614674,UNC Asheville Bulldogs,614846,9,top,Miles Jackso popped up to 3b (1-2 KBK).,106,2026-03-06T15:00:00-05:00,"Greenwood Field (Asheville, NC)",200,MBA,2026
