game_id,away_team_id,away_team_name,home_team_id,home_team_name,batting_team,inning,top_bot,event_text,event_num,game_datetime,stadium_name,attendance,sport_id,season
6499083,614877,Francis Marion Patriots,614942,Barton Bulldogs,614877,1,top,Zander Buchan grounded out to ss (1-2 BFF).,1,2026-03-06T14:00:00-05:00,"Fleming Stadium (Wilson, NC)",150,MBA,2026
6499083,614877,Francis Marion Patriots,614942,Barton Bulldogs,614877,1,top,Will Dorrell grounded out to 1b unassisted (0-1 K).,2,2026-03-06T14:00:00-05:00,"Fleming Stadium (Wilson, NC)",150,MBA,2026
6499083,614877,Francis Marion Patriots,614942,Barton Bulldogs,614877,1,top,Charlie Bussey III walked (3-2 FBSBBB).,3,2026-03-06T14:00:00-05:00,"Fleming Stadium (Wilson, NC)",150,MBA,2026
6499083,614877,Francis Marion Patriots,614942,Barton Bulldogs,614877,1,top,Charlie Bussey III advanced to second on a wild pitch.,4,2026-03-06T14:00:00-05:00,"Fleming Stadium (Wilson, NC)",150,MBA,2026
6499083,614877,Francis Marion Patriots,614942,Barton Bulldogs,614877,1,top,Ethan McAnally grounded out to ss (1-0 B).,5,2026-03-06T14:00:00-05:00,"Fleming Stadium (Wilson, NC)",150,MBA,2026
6499083,614877,Francis Marion Patriots,614942,Barton Bulldogs,614942,1,bot,Isaiah White grounded out to ss (1-2 SKB).,6,2026-03-06T14:00:00-05:00,"Fleming Stadium (Wilson, NC)",150,MBA,2026
6499083,614877,Francis Marion Patriots,614942,Barton Bulldogs,614942,1,bot,Tyler Hughesman grounded out to ss (0-1 K).,7,2026-03-06T14:00:00-05:00,"Fleming Stadium (Wilson, NC)",150,MBA,2026
6499083,614877,Francis Marion Patriots,614942,Barton Bulldogs,614942,1,bot,Vincent Santostefano struck out looking (0-2 KSK).,8,2026-03-06T14:00:00-05:00,"Fleming Stadium (Wilson, NC)",150,MBA,2026
6499083,614877,Francis Marion Patriots,614942,Barton Bulldogs,614877,2,top,Riley Orr doubled to right center (2-1 KBB).,9,2026-03-06T14:00:00-05:00,"Fleming Stadium (Wilson, NC)",150,MBA,2026
6499083,614877,Francis Marion Patriots,614942,Barton Bulldogs,614877,2,top,Matthew Manuel grounded out to 3b (1-1 KB).,10,2026-03-06T14:00:00-05:00,"Fleming Stadium (Wilson, NC)",150,MBA,2026
6499083,614877,Francis Marion Patriots,614942,Barton Bulldogs,614877,2,top,Dariel Villaran Goundis hit by pitch (0-0).,11,2026-03-06T14:00:00-05:00,"Fleming Stadium (Wilson, NC)",150,MBA,2026
6499083,614877,Francis Marion Patriots,614942,Barton Bulldogs,614877,2,top,Logan Davis flied out to lf (0-1 K).,12,2026-03-06T14:00:00-05:00,"Fleming Stadium (Wilson, NC)",150,MBA,2026
6499083,614877,Francis Marion Patriots,614942,Barton Bulldogs,614877,2,top,Riley Orr stole third.,13,2026-03-06T14:00:00-05:00,"Fleming Stadium (Wilson, NC)",150,MBA,2026
6499083,614877,Francis Marion Patriots,614942,Barton Bulldogs,614877,2,top,Brandon Vargas lined out to cf (2-1 BKB).,14,2026-03-06T14:00:00-05:00,"Fleming Stadium (Wilson, NC)",150,MBA,2026
6499083,614877,Francis Marion Patriots,614942,Barton Bulldogs,614942,2,bot,Mason McDougall lined out to rf (2-1 KBB).,15,2026-03-06T14:00:00-05:00,"Fleming Stadium (Wilson, NC)",150,MBA,2026
6499083,614877,Francis Marion Patriots,614942,Barton Bulldogs,614942,2,bot,Ben Kablach struck out swinging (2-2 KKBBS).,16,2026-03-06T14:00:00-05:00,"Fleming Stadium (Wilson, NC)",150,MBA,2026
6499083,614877,Francis Marion Patriots,614942,Barton Bulldogs,614942,2,bot,Gregory Melo struck out looking (0-2 SSK).,17,2026-03-06T14:00:00-05:00,"Fleming Stadium (Wilson, NC)",150,MBA,2026
6499083,614877,Francis Marion Patriots,614942,Barton Bulldogs,614877,3,top,Zander Buchan singled to left field (2-0 BB).,18,2026-03-06T14:00:00-05:00,"Fleming Stadium (Wilson, NC)",150,MBA,2026
6499083,614877,Francis Marion Patriots,614942,Barton Bulldogs,614877,3,top,"Will Dorrell grounded out to 3b, SAC, bunt (0-0)3a Zander Buchan advanced to third.",19,2026-03-06T14:00:00-05:00,"Fleming Stadium (Wilson, NC)",150,MBA,2026
6499083,614877,Francis Marion Patriots,614942,Barton Bulldogs,614877,3,top,Charlie Bussey III popped up to c (3-1 KBBB).,20,2026-03-06T14:00:00-05:00,"Fleming Stadium (Wilson, NC)",150,MBA,2026
6499083,614877,Francis Marion Patriots,614942,Barton Bulldogs,614877,3,top,Ethan McAnally grounded out to ss (2-0 BB).,21,2026-03-06T14:00:00-05:00,"Fleming Stadium (Wilson, NC)",150,MBA,2026
6499083,614877,Francis Marion Patriots,614942,Barton Bulldogs,614942,3,bot,David Liuex singled to right center (2-2 SBBF).,22,2026-03-06T14:00:00-05:00,"Fleming Stadium (Wilson, NC)",150,MBA,2026
6499083,614877,Francis Marion Patriots,614942,Barton Bulldogs,614942,3,bot,Jackson Marvel struck out swinging (1-2 FBSS).,23,2026-03-06T14:00:00-05:00,"Fleming Stadium (Wilson, NC)",150,MBA,2026
6499083,614877,Francis Marion Patriots,614942,Barton Bulldogs,614942,3,bot,Cameron Greenway pinch ran for David Liuex.,24,2026-03-06T14:00:00-05:00,"Fleming Stadium (Wilson, NC)",150,MBA,2026
6499083,614877,Francis Marion Patriots,614942,Barton Bulldogs,614942,3,bot,Cameron Greenway stole second.,25,2026-03-06T14:00:00-05:00,"Fleming Stadium (Wilson, NC)",150,MBA,2026
6499083,614877,Francis Marion Patriots,614942,Barton Bulldogs,614942,3,bot,Myles Odom lined out to lf (0-1 K).,26,2026-03-06T14:00:00-05:00,"Fleming Stadium (Wilson, NC)",150,MBA,2026
6499083,614877,Francis Marion Patriots,614942,Barton Bulldogs,614942,3,bot,Isaiah White flied out to rf (2-2 BFBS).,27,2026-03-06T14:00:00-05:00,"Fleming Stadium (Wilson, NC)",150,MBA,2026
6499083,614877,Francis Marion Patriots,614942,Barton Bulldogs,614877,4,top,Vincent Santostefano to lf.,28,2026-03-06T14:00:00-05:00,"Fleming Stadium (Wilson, NC)",150,MBA,2026
6499083,614877,Francis Marion Patriots,614942,Barton Bulldogs,614877,4,top,Cameron Greenway to rf.,29,2026-03-06T14:00:00-05:00,"Fleming Stadium (Wilson, NC)",150,MBA,2026
6499083,614877,Francis Marion Patriots,614942,Barton Bulldogs,614877,4,top,"Riley Orr homered to left field, RBI (0-0).",30,2026-03-06T14:00:00-05:00,"Fleming Stadium (Wilson, NC)",150,MBA,2026
6499083,614877,Francis Marion Patriots,614942,Barton Bulldogs,614877,4,top,Matthew Manuel singled to left field (1-1 BF).,31,2026-03-06T14:00:00-05:00,"Fleming Stadium (Wilson, NC)",150,MBA,2026
6499083,614877,Francis Marion Patriots,614942,Barton Bulldogs,614877,4,top,Dariel Villaran Goundis singled to right center (2-2 KBSBF)3a Matthew Manuel advanced to third.,32,2026-03-06T14:00:00-05:00,"Fleming Stadium (Wilson, NC)",150,MBA,2026
6499083,614877,Francis Marion Patriots,614942,Barton Bulldogs,614877,4,top,Dariel Villaran Goundis stole second.,33,2026-03-06T14:00:00-05:00,"Fleming Stadium (Wilson, NC)",150,MBA,2026
6499083,614877,Francis Marion Patriots,614942,Barton Bulldogs,614877,4,top,"Logan Davis grounded out to 2b, RBI (2-2 BSFB)3a Dariel Villaran Goundis advanced to third3a Matthew Manuel scored.",34,2026-03-06T14:00:00-05:00,"Fleming Stadium (Wilson, NC)",150,MBA,2026
6499083,614877,Francis Marion Patriots,614942,Barton Bulldogs,614877,4,top,"Brandon Vargas singled to third base, advanced to second on a throwing error by 3b, RBI (0-0)3a Dariel Villaran Goundis scored.",35,2026-03-06T14:00:00-05:00,"Fleming Stadium (Wilson, NC)",150,MBA,2026
6499083,614877,Francis Marion Patriots,614942,Barton Bulldogs,614877,4,top,Brandon Vargas stole third.,36,2026-03-06T14:00:00-05:00,"Fleming Stadium (Wilson, NC)",150,MBA,2026
6499083,614877,Francis Marion Patriots,614942,Barton Bulldogs,614877,4,top,"Zander Buchan grounded out to 3b, RBI (0-1 K)3a Brandon Vargas scored, unearned.",37,2026-03-06T14:00:00-05:00,"Fleming Stadium (Wilson, NC)",150,MBA,2026
6499083,614877,Francis Marion Patriots,614942,Barton Bulldogs,614877,4,top,Will Dorrell grounded out to 2b (0-0).,38,2026-03-06T14:00:00-05:00,"Fleming Stadium (Wilson, NC)",150,MBA,2026
6499083,614877,Francis Marion Patriots,614942,Barton Bulldogs,614942,4,bot,Tyler Hughesman grounded out to ss (1-2 KBK).,39,2026-03-06T14:00:00-05:00,"Fleming Stadium (Wilson, NC)",150,MBA,2026
6499083,614877,Francis Marion Patriots,614942,Barton Bulldogs,614942,4,bot,Vincent Santostefano struck out swinging (2-2 BFBFS).,40,2026-03-06T14:00:00-05:00,"Fleming Stadium (Wilson, NC)",150,MBA,2026
6499083,614877,Francis Marion Patriots,614942,Barton Bulldogs,614942,4,bot,Mason McDougall flied out to lf (0-0).,41,2026-03-06T14:00:00-05:00,"Fleming Stadium (Wilson, NC)",150,MBA,2026
6499083,614877,Francis Marion Patriots,614942,Barton Bulldogs,614877,5,top,Charlie Bussey III grounded out to ss (1-2 FKB).,42,2026-03-06T14:00:00-05:00,"Fleming Stadium (Wilson, NC)",150,MBA,2026
6499083,614877,Francis Marion Patriots,614942,Barton Bulldogs,614877,5,top,Ethan McAnally singled to right field (0-0).,43,2026-03-06T14:00:00-05:00,"Fleming Stadium (Wilson, NC)",150,MBA,2026
6499083,614877,Francis Marion Patriots,614942,Barton Bulldogs,614877,5,top,Riley Orr singled to left field (0-1 K)3a Ethan McAnally advanced to third.,44,2026-03-06T14:00:00-05:00,"Fleming Stadium (Wilson, NC)",150,MBA,2026
6499083,614877,Francis Marion Patriots,614942,Barton Bulldogs,614877,5,top,"Matthew Manuel doubled to left center, RBI (0-0)3a Riley Orr advanced to third3a Ethan McAnally scored.",45,2026-03-06T14:00:00-05:00,"Fleming Stadium (Wilson, NC)",150,MBA,2026
6499083,614877,Francis Marion Patriots,614942,Barton Bulldogs,614877,5,top,"Dariel Villaran Goundis grounded out to ss, RBI (1-2 BKF)3a Matthew Manuel advanced to third3a Riley Orr scored.",46,2026-03-06T14:00:00-05:00,"Fleming Stadium (Wilson, NC)",150,MBA,2026
6499083,614877,Francis Marion Patriots,614942,Barton Bulldogs,614877,5,top,Logan Davis flied out to cf (0-0).,47,2026-03-06T14:00:00-05:00,"Fleming Stadium (Wilson, NC)",150,MBA,2026
6499083,614877,Francis Marion Patriots,614942,Barton Bulldogs,614942,5,bot,Ben Kablach struck out swinging (3-2 KBFFBFB).,48,2026-03-06T14:00:00-05:00,"Fleming Stadium (Wilson, NC)",150,MBA,2026
6499083,614877,Francis Marion Patriots,614942,Barton Bulldogs,614942,5,bot,Gregory Melo grounded out to ss (0-1 S).,49,2026-03-06T14:00:00-05:00,"Fleming Stadium (Wilson, NC)",150,MBA,2026
6499083,614877,Francis Marion Patriots,614942,Barton Bulldogs,614942,5,bot,Cameron Greenway singled to center field (3-1 BBBK).,50,2026-03-06T14:00:00-05:00,"Fleming Stadium (Wilson, NC)",150,MBA,2026
6499083,614877,Francis Marion Patriots,614942,Barton Bulldogs,614942,5,bot,Jackson Marvel flied out to cf (1-2 BSK).,51,2026-03-06T14:00:00-05:00,"Fleming Stadium (Wilson, NC)",150,MBA,2026
6499083,614877,Francis Marion Patriots,614942,Barton Bulldogs,614877,6,top,"Brandon Vargas homered to left field, RBI (0-0).",52,2026-03-06T14:00:00-05:00,"Fleming Stadium (Wilson, NC)",150,MBA,2026
6499083,614877,Francis Marion Patriots,614942,Barton Bulldogs,614877,6,top,Zander Buchan grounded out to 3b (0-0).,53,2026-03-06T14:00:00-05:00,"Fleming Stadium (Wilson, NC)",150,MBA,2026
6499083,614877,Francis Marion Patriots,614942,Barton Bulldogs,614877,6,top,Will Dorrell lined out to rf (2-2 BBSF).,54,2026-03-06T14:00:00-05:00,"Fleming Stadium (Wilson, NC)",150,MBA,2026
6499083,614877,Francis Marion Patriots,614942,Barton Bulldogs,614877,6,top,Charlie Bussey III reached first on a fielding error by 3b (2-1 BFB).,55,2026-03-06T14:00:00-05:00,"Fleming Stadium (Wilson, NC)",150,MBA,2026
6499083,614877,Francis Marion Patriots,614942,Barton Bulldogs,614877,6,top,Ty Stewart to p.,56,2026-03-06T14:00:00-05:00,"Fleming Stadium (Wilson, NC)",150,MBA,2026
6499083,614877,Francis Marion Patriots,614942,Barton Bulldogs,614877,6,top,Mason McDougall to dh.,57,2026-03-06T14:00:00-05:00,"Fleming Stadium (Wilson, NC)",150,MBA,2026
6499083,614877,Francis Marion Patriots,614942,Barton Bulldogs,614877,6,top,Charlie Bussey III stole second.,58,2026-03-06T14:00:00-05:00,"Fleming Stadium (Wilson, NC)",150,MBA,2026
6499083,614877,Francis Marion Patriots,614942,Barton Bulldogs,614877,6,top,Ethan McAnally grounded out to ss (3-0 BBB).,59,2026-03-06T14:00:00-05:00,"Fleming Stadium (Wilson, NC)",150,MBA,2026
6499083,614877,Francis Marion Patriots,614942,Barton Bulldogs,614942,6,bot,Myles Odom struck out swinging (1-2 KSBS).,60,2026-03-06T14:00:00-05:00,"Fleming Stadium (Wilson, NC)",150,MBA,2026
6499083,614877,Francis Marion Patriots,614942,Barton Bulldogs,614942,6,bot,Isaiah White walked (3-0 BBBB).,61,2026-03-06T14:00:00-05:00,"Fleming Stadium (Wilson, NC)",150,MBA,2026
6499083,614877,Francis Marion Patriots,614942,Barton Bulldogs,614942,6,bot,Tyler Hughesman fouled out to 3b (0-1 K).,62,2026-03-06T14:00:00-05:00,"Fleming Stadium (Wilson, NC)",150,MBA,2026
6499083,614877,Francis Marion Patriots,614942,Barton Bulldogs,614942,6,bot,Vincent Santostefano struck out swinging (3-2 FKBBBS).,63,2026-03-06T14:00:00-05:00,"Fleming Stadium (Wilson, NC)",150,MBA,2026
6499083,614877,Francis Marion Patriots,614942,Barton Bulldogs,614877,7,top,Riley Orr grounded out to 1b unassisted (2-2 KKBFB).,64,2026-03-06T14:00:00-05:00,"Fleming Stadium (Wilson, NC)",150,MBA,2026
6499083,614877,Francis Marion Patriots,614942,Barton Bulldogs,614877,7,top,Matthew Manuel grounded out to p (1-1 BK).,65,2026-03-06T14:00:00-05:00,"Fleming Stadium (Wilson, NC)",150,MBA,2026
6499083,614877,Francis Marion Patriots,614942,Barton Bulldogs,614877,7,top,Dariel Villaran Goundis struck out looking (1-2 BKKK).,66,2026-03-06T14:00:00-05:00,"Fleming Stadium (Wilson, NC)",150,MBA,2026
6499083,614877,Francis Marion Patriots,614942,Barton Bulldogs,614942,7,bot,Zeph Arnold to p for Eze Rojas.,67,2026-03-06T14:00:00-05:00,"Fleming Stadium (Wilson, NC)",150,MBA,2026
6499083,614877,Francis Marion Patriots,614942,Barton Bulldogs,614942,7,bot,John Lupienski to c for Dariel Villaran Goundis.,68,2026-03-06T14:00:00-05:00,"Fleming Stadium (Wilson, NC)",150,MBA,2026
6499083,614877,Francis Marion Patriots,614942,Barton Bulldogs,614942,7,bot,Mason McDougall singled to right field (3-2 BBFBS).,69,2026-03-06T14:00:00-05:00,"Fleming Stadium (Wilson, NC)",150,MBA,2026
6499083,614877,Francis Marion Patriots,614942,Barton Bulldogs,614942,7,bot,Ben Kablach reached on a fielder's choice (1-2 SFB)3a Mason McDougall out at second 3b to 2b.,70,2026-03-06T14:00:00-05:00,"Fleming Stadium (Wilson, NC)",150,MBA,2026
6499083,614877,Francis Marion Patriots,614942,Barton Bulldogs,614942,7,bot,Gregory Melo singled to pitcher (1-1 BK)3a Ben Kablach advanced to second.,71,2026-03-06T14:00:00-05:00,"Fleming Stadium (Wilson, NC)",150,MBA,2026
6499083,614877,Francis Marion Patriots,614942,Barton Bulldogs,614942,7,bot,Cameron Greenway walked (3-1 BBKBB)3a Gregory Melo advanced to second3a Ben Kablach advanced to third.,72,2026-03-06T14:00:00-05:00,"Fleming Stadium (Wilson, NC)",150,MBA,2026
6499083,614877,Francis Marion Patriots,614942,Barton Bulldogs,614942,7,bot,"Jackson Marvel hit by pitch, RBI (3-1 BBSH)3a Cameron Greenway advanced to second3a Gregory Melo advanced to third3a Ben Kablach scored.",73,2026-03-06T14:00:00-05:00,"Fleming Stadium (Wilson, NC)",150,MBA,2026
6499083,614877,Francis Marion Patriots,614942,Barton Bulldogs,614942,7,bot,"Myles Odom reached first on a fielding error by 2b, RBI (1-1 SB)3a Jackson Marvel advanced to second3a Cameron Greenway advanced to third3a Gregory Melo scored.",74,2026-03-06T14:00:00-05:00,"Fleming Stadium (Wilson, NC)",150,MBA,2026
6499083,614877,Francis Marion Patriots,614942,Barton Bulldogs,614942,7,bot,Roman Edwards to p for Zeph Arnold.,75,2026-03-06T14:00:00-05:00,"Fleming Stadium (Wilson, NC)",150,MBA,2026
6499083,614877,Francis Marion Patriots,614942,Barton Bulldogs,614942,7,bot,"Isaiah White walked, RBI (3-0 BBBB)3a Myles Odom advanced to second3a Jackson Marvel advanced to third3a Cameron Greenway scored.",76,2026-03-06T14:00:00-05:00,"Fleming Stadium (Wilson, NC)",150,MBA,2026
6499083,614877,Francis Marion Patriots,614942,Barton Bulldogs,614942,7,bot,"Tyler Hughesman walked, RBI (3-1 KBBBB)3a Isaiah White advanced to second3a Myles Odom advanced to third3a Jackson Marvel scored, unearned.",77,2026-03-06T14:00:00-05:00,"Fleming Stadium (Wilson, NC)",150,MBA,2026
6499083,614877,Francis Marion Patriots,614942,Barton Bulldogs,614942,7,bot,Vincent Santostefano struck out swinging (2-2 BBFSS).,78,2026-03-06T14:00:00-05:00,"Fleming Stadium (Wilson, NC)",150,MBA,2026
6499083,614877,Francis Marion Patriots,614942,Barton Bulldogs,614942,7,bot,Mason McDougall grounded out to p (0-1 S).,79,2026-03-06T14:00:00-05:00,"Fleming Stadium (Wilson, NC)",150,MBA,2026
6499083,614877,Francis Marion Patriots,614942,Barton Bulldogs,614877,8,top,Logan Davis singled to right center (0-1 K).,80,2026-03-06T14:00:00-05:00,"Fleming Stadium (Wilson, NC)",150,MBA,2026
6499083,614877,Francis Marion Patriots,614942,Barton Bulldogs,614877,8,top,Brandon Vargas reached on a fielder's choice (1-2 BKK)3a Logan Davis out at second 3b to 2b.,81,2026-03-06T14:00:00-05:00,"Fleming Stadium (Wilson, NC)",150,MBA,2026
6499083,614877,Francis Marion Patriots,614942,Barton Bulldogs,614877,8,top,Zander Buchan singled to left field (2-0 BB)3a Brandon Vargas advanced to second.,82,2026-03-06T14:00:00-05:00,"Fleming Stadium (Wilson, NC)",150,MBA,2026
6499083,614877,Francis Marion Patriots,614942,Barton Bulldogs,614877,8,top,Brandon Vargas advanced to third on a wild pitch.,83,2026-03-06T14:00:00-05:00,"Fleming Stadium (Wilson, NC)",150,MBA,2026
6499083,614877,Francis Marion Patriots,614942,Barton Bulldogs,614877,8,top,Will Dorrell struck out swinging (1-2 FFFFB).,84,2026-03-06T14:00:00-05:00,"Fleming Stadium (Wilson, NC)",150,MBA,2026
6499083,614877,Francis Marion Patriots,614942,Barton Bulldogs,614877,8,top,Charlie Bussey III walked (3-2 BBFBFB)3a Zander Buchan advanced to second3a Brandon Vargas scored on a wild pitch.,85,2026-03-06T14:00:00-05:00,"Fleming Stadium (Wilson, NC)",150,MBA,2026
6499083,614877,Francis Marion Patriots,614942,Barton Bulldogs,614877,8,top,Jordan Winslow to p for Ty Stewart.,86,2026-03-06T14:00:00-05:00,"Fleming Stadium (Wilson, NC)",150,MBA,2026
6499083,614877,Francis Marion Patriots,614942,Barton Bulldogs,614877,8,top,Charlie Bussey III advanced to second on a balk3a Zander Buchan advanced to third on a balk.,87,2026-03-06T14:00:00-05:00,"Fleming Stadium (Wilson, NC)",150,MBA,2026
6499083,614877,Francis Marion Patriots,614942,Barton Bulldogs,614877,8,top,Ethan McAnally struck out looking (3-2 SBBKBK).,88,2026-03-06T14:00:00-05:00,"Fleming Stadium (Wilson, NC)",150,MBA,2026
6499083,614877,Francis Marion Patriots,614942,Barton Bulldogs,614942,8,bot,Ben Kablach grounded out to ss (1-2 FBK).,89,2026-03-06T14:00:00-05:00,"Fleming Stadium (Wilson, NC)",150,MBA,2026
6499083,614877,Francis Marion Patriots,614942,Barton Bulldogs,614942,8,bot,Gregory Melo struck out swinging (0-2 SKS).,90,2026-03-06T14:00:00-05:00,"Fleming Stadium (Wilson, NC)",150,MBA,2026
6499083,614877,Francis Marion Patriots,614942,Barton Bulldogs,614942,8,bot,Cameron Greenway walked (3-2 SBBSBB).,91,2026-03-06T14:00:00-05:00,"Fleming Stadium (Wilson, NC)",150,MBA,2026
6499083,614877,Francis Marion Patriots,614942,Barton Bulldogs,614942,8,bot,Jackson Marvel grounded out to 3b (0-0).,92,2026-03-06T14:00:00-05:00,"Fleming Stadium (Wilson, NC)",150,MBA,2026
6499083,614877,Francis Marion Patriots,614942,Barton Bulldogs,614877,9,top,Riley Orr singled to shortstop (2-0 BB).,93,2026-03-06T14:00:00-05:00,"Fleming Stadium (Wilson, NC)",150,MBA,2026
6499083,614877,Francis Marion Patriots,614942,Barton Bulldogs,614877,9,top,Matthew Manuel hit by pitch (2-0 BH)3a Riley Orr advanced to second.,94,2026-03-06T14:00:00-05:00,"Fleming Stadium (Wilson, NC)",150,MBA,2026
6499083,614877,Francis Marion Patriots,614942,Barton Bulldogs,614877,9,top,"John Lupienski singled to pitcher, bunt (1-0 B)3a Matthew Manuel advanced to second3a Riley Orr advanced to third.",95,2026-03-06T14:00:00-05:00,"Fleming Stadium (Wilson, NC)",150,MBA,2026
6499083,614877,Francis Marion Patriots,614942,Barton Bulldogs,614877,9,top,"Logan Davis walked, RBI (3-2 BSBBFFB)3a John Lupienski advanced to second3a Matthew Manuel advanced to third3a Riley Orr scored.",96,2026-03-06T14:00:00-05:00,"Fleming Stadium (Wilson, NC)",150,MBA,2026
6499083,614877,Francis Marion Patriots,614942,Barton Bulldogs,614877,9,top,Anderson Hanes to p for Jordan Winslow.,97,2026-03-06T14:00:00-05:00,"Fleming Stadium (Wilson, NC)",150,MBA,2026
6499083,614877,Francis Marion Patriots,614942,Barton Bulldogs,614877,9,top,"Brandon Vargas reached on a fielder's choice, RBI (1-1 KB)3a Logan Davis out at second ss to 2b3a John Lupienski advanced to third3a Matthew Manuel scored.",98,2026-03-06T14:00:00-05:00,"Fleming Stadium (Wilson, NC)",150,MBA,2026
6499083,614877,Francis Marion Patriots,614942,Barton Bulldogs,614877,9,top,Brandon Vargas stole second.,99,2026-03-06T14:00:00-05:00,"Fleming Stadium (Wilson, NC)",150,MBA,2026
6499083,614877,Francis Marion Patriots,614942,Barton Bulldogs,614877,9,top,Zander Buchan lined out to cf (1-0 B).,100,2026-03-06T14:00:00-05:00,"Fleming Stadium (Wilson, NC)",150,MBA,2026
6499083,614877,Francis Marion Patriots,614942,Barton Bulldogs,614877,9,top,Will Dorrell grounded out to 1b unassisted (2-2 BFSB).,101,2026-03-06T14:00:00-05:00,"Fleming Stadium (Wilson, NC)",150,MBA,2026
6499083,614877,Francis Marion Patriots,614942,Barton Bulldogs,614942,9,bot,Myles Odom singled to left field (1-0 B).,102,2026-03-06T14:00:00-05:00,"Fleming Stadium (Wilson, NC)",150,MBA,2026
6499083,614877,Francis Marion Patriots,614942,Barton Bulldogs,614942,9,bot,Isaiah White hit by pitch (0-0)3a Myles Odom advanced to second.,103,2026-03-06T14:00:00-05:00,"Fleming Stadium (Wilson, NC)",150,MBA,2026
6499083,614877,Francis Marion Patriots,614942,Barton Bulldogs,614942,9,bot,Tyler Hughesman walked (3-2 BSBKBB)3a Isaiah White advanced to second3a Myles Odom advanced to third.,104,2026-03-06T14:00:00-05:00,"Fleming Stadium (Wilson, NC)",150,MBA,2026
6499083,614877,Francis Marion Patriots,614942,Barton Bulldogs,614942,9,bot,Giuseppe Seidita pinch hit for Vincent Santostefano.,105,2026-03-06T14:00:00-05:00,"Fleming Stadium (Wilson, NC)",150,MBA,2026
6499083,614877,Francis Marion Patriots,614942,Barton Bulldogs,614942,9,bot,"Giuseppe Seidita flied out to cf, sacrifice fly, RBI (3-1 KBBB)3a Tyler Hughesman advanced to second3a Isaiah White advanced to third3a Myles Odom scored.",106,2026-03-06T14:00:00-05:00,"Fleming Stadium (Wilson, NC)",150,MBA,2026
6499083,614877,Francis Marion Patriots,614942,Barton Bulldogs,614942,9,bot,"Mason McDougall flied out to rf, sacrifice fly, RBI (3-2 BKBFFB)3a Tyler Hughesman advanced to third3a Isaiah White scored.",107,2026-03-06T14:00:00-05:00,"Fleming Stadium (Wilson, NC)",150,MBA,2026
6499083,614877,Francis Marion Patriots,614942,Barton Bulldogs,614942,9,bot,Ben Kablach lined out to rf (2-2 KBSB).,108,2026-03-06T14:00:00-05:00,"Fleming Stadium (Wilson, NC)",150,MBA,2026
