game_id,away_team_id,away_team_name,home_team_id,home_team_name,batting_team,inning,top_bot,event_text,event_num,game_datetime,stadium_name,attendance,sport_id,season
6499259,614877,Francis Marion Patriots,614909,Wingate Bulldogs,614877,1,top,Brandon Varg struck out swinging (1-2 BKSS).,1,2026-03-17T18:00:00-04:00,"Ron Christopher Stadium (Wingate, NC)",72,MBA,2026
6499259,614877,Francis Marion Patriots,614909,Wingate Bulldogs,614877,1,top,"Charlie Buss homered to left center, RBI (2-1 KBB).",2,2026-03-17T18:00:00-04:00,"Ron Christopher Stadium (Wingate, NC)",72,MBA,2026
6499259,614877,Francis Marion Patriots,614909,Wingate Bulldogs,614877,1,top,Riley Orr struck out looking (1-2 BKSK).,3,2026-03-17T18:00:00-04:00,"Ron Christopher Stadium (Wingate, NC)",72,MBA,2026
6499259,614877,Francis Marion Patriots,614909,Wingate Bulldogs,614877,1,top,Ethan McAnal walked (3-2 BBBKKB).,4,2026-03-17T18:00:00-04:00,"Ron Christopher Stadium (Wingate, NC)",72,MBA,2026
6499259,614877,Francis Marion Patriots,614909,Wingate Bulldogs,614877,1,top,Ethan McAnal stole second.,5,2026-03-17T18:00:00-04:00,"Ron Christopher Stadium (Wingate, NC)",72,MBA,2026
6499259,614877,Francis Marion Patriots,614909,Wingate Bulldogs,614877,1,top,Will Dorrell struck out swinging (1-2 BKSS).,6,2026-03-17T18:00:00-04:00,"Ron Christopher Stadium (Wingate, NC)",72,MBA,2026
6499259,614877,Francis Marion Patriots,614909,Wingate Bulldogs,614909,1,bot,G. Groppuso flied out to rf (1-1 BK).,7,2026-03-17T18:00:00-04:00,"Ron Christopher Stadium (Wingate, NC)",72,MBA,2026
6499259,614877,Francis Marion Patriots,614909,Wingate Bulldogs,614909,1,bot,"Jalen Evans struck out swinging, out at first c to 1b (0-2 SSS).",8,2026-03-17T18:00:00-04:00,"Ron Christopher Stadium (Wingate, NC)",72,MBA,2026
6499259,614877,Francis Marion Patriots,614909,Wingate Bulldogs,614909,1,bot,Bowen Powell struck out swinging (1-2 KBSFS).,9,2026-03-17T18:00:00-04:00,"Ron Christopher Stadium (Wingate, NC)",72,MBA,2026
6499259,614877,Francis Marion Patriots,614909,Wingate Bulldogs,614877,2,top,Zander Bucha walked (3-1 BBBKB).,10,2026-03-17T18:00:00-04:00,"Ron Christopher Stadium (Wingate, NC)",72,MBA,2026
6499259,614877,Francis Marion Patriots,614909,Wingate Bulldogs,614877,2,top,"Evan Matile homered to right field, 2 RBI (1-2 KKB)3a Zander Bucha scored.",11,2026-03-17T18:00:00-04:00,"Ron Christopher Stadium (Wingate, NC)",72,MBA,2026
6499259,614877,Francis Marion Patriots,614909,Wingate Bulldogs,614877,2,top,Daniel Husse singled to pitcher (1-1 BS).,12,2026-03-17T18:00:00-04:00,"Ron Christopher Stadium (Wingate, NC)",72,MBA,2026
6499259,614877,Francis Marion Patriots,614909,Wingate Bulldogs,614877,2,top,Logan Davis fouled out to lf (1-2 FFB)3a Daniel Husse advanced to second.,13,2026-03-17T18:00:00-04:00,"Ron Christopher Stadium (Wingate, NC)",72,MBA,2026
6499259,614877,Francis Marion Patriots,614909,Wingate Bulldogs,614877,2,top,C. Carpenter to p for Nick Papciak.,14,2026-03-17T18:00:00-04:00,"Ron Christopher Stadium (Wingate, NC)",72,MBA,2026
6499259,614877,Francis Marion Patriots,614909,Wingate Bulldogs,614877,2,top,Brandon Varg flied out to rf (1-1 BK).,15,2026-03-17T18:00:00-04:00,"Ron Christopher Stadium (Wingate, NC)",72,MBA,2026
6499259,614877,Francis Marion Patriots,614909,Wingate Bulldogs,614877,2,top,"Charlie Buss homered to center field, 2 RBI (2-2 KBBKF)3a Daniel Husse scored.",16,2026-03-17T18:00:00-04:00,"Ron Christopher Stadium (Wingate, NC)",72,MBA,2026
6499259,614877,Francis Marion Patriots,614909,Wingate Bulldogs,614877,2,top,Riley Orr struck out looking (3-2 KBFFBFBFK).,17,2026-03-17T18:00:00-04:00,"Ron Christopher Stadium (Wingate, NC)",72,MBA,2026
6499259,614877,Francis Marion Patriots,614909,Wingate Bulldogs,614909,2,bot,"T. McCammon homered to right field, RBI (0-0).",18,2026-03-17T18:00:00-04:00,"Ron Christopher Stadium (Wingate, NC)",72,MBA,2026
6499259,614877,Francis Marion Patriots,614909,Wingate Bulldogs,614909,2,bot,"S. Sullivan homered to left field, RBI (1-2 BSK).",19,2026-03-17T18:00:00-04:00,"Ron Christopher Stadium (Wingate, NC)",72,MBA,2026
6499259,614877,Francis Marion Patriots,614909,Wingate Bulldogs,614909,2,bot,J. Courville flied out to cf (2-2 BKSB).,20,2026-03-17T18:00:00-04:00,"Ron Christopher Stadium (Wingate, NC)",72,MBA,2026
6499259,614877,Francis Marion Patriots,614909,Wingate Bulldogs,614909,2,bot,Will Farrell struck out swinging (3-2 BBFBKS).,21,2026-03-17T18:00:00-04:00,"Ron Christopher Stadium (Wingate, NC)",72,MBA,2026
6499259,614877,Francis Marion Patriots,614909,Wingate Bulldogs,614909,2,bot,Max Reaume struck out swinging (1-2 KSFBS).,22,2026-03-17T18:00:00-04:00,"Ron Christopher Stadium (Wingate, NC)",72,MBA,2026
6499259,614877,Francis Marion Patriots,614909,Wingate Bulldogs,614877,3,top,Ethan McAnal grounded out to ss (0-0).,23,2026-03-17T18:00:00-04:00,"Ron Christopher Stadium (Wingate, NC)",72,MBA,2026
6499259,614877,Francis Marion Patriots,614909,Wingate Bulldogs,614877,3,top,Will Dorrell grounded out to 2b (3-1 BSBB).,24,2026-03-17T18:00:00-04:00,"Ron Christopher Stadium (Wingate, NC)",72,MBA,2026
6499259,614877,Francis Marion Patriots,614909,Wingate Bulldogs,614877,3,top,Zander Bucha grounded out to 1b unassisted (1-1 BK).,25,2026-03-17T18:00:00-04:00,"Ron Christopher Stadium (Wingate, NC)",72,MBA,2026
6499259,614877,Francis Marion Patriots,614909,Wingate Bulldogs,614909,3,bot,R. Benamati struck out swinging (1-2 BSKS).,26,2026-03-17T18:00:00-04:00,"Ron Christopher Stadium (Wingate, NC)",72,MBA,2026
6499259,614877,Francis Marion Patriots,614909,Wingate Bulldogs,614909,3,bot,G. Groppuso struck out looking (2-2 BFFBK).,27,2026-03-17T18:00:00-04:00,"Ron Christopher Stadium (Wingate, NC)",72,MBA,2026
6499259,614877,Francis Marion Patriots,614909,Wingate Bulldogs,614909,3,bot,Jalen Evans walked (3-2 BBKBFB).,28,2026-03-17T18:00:00-04:00,"Ron Christopher Stadium (Wingate, NC)",72,MBA,2026
6499259,614877,Francis Marion Patriots,614909,Wingate Bulldogs,614909,3,bot,Bowen Powell flied out to lf (1-0 B).,29,2026-03-17T18:00:00-04:00,"Ron Christopher Stadium (Wingate, NC)",72,MBA,2026
6499259,614877,Francis Marion Patriots,614909,Wingate Bulldogs,614877,4,top,Evan Matile grounded out to 1b unassisted (1-1 BK).,30,2026-03-17T18:00:00-04:00,"Ron Christopher Stadium (Wingate, NC)",72,MBA,2026
6499259,614877,Francis Marion Patriots,614909,Wingate Bulldogs,614877,4,top,Daniel Husse popped up to ss (1-2 BFS).,31,2026-03-17T18:00:00-04:00,"Ron Christopher Stadium (Wingate, NC)",72,MBA,2026
6499259,614877,Francis Marion Patriots,614909,Wingate Bulldogs,614877,4,top,Logan Davis popped up to 2b (1-0 B).,32,2026-03-17T18:00:00-04:00,"Ron Christopher Stadium (Wingate, NC)",72,MBA,2026
6499259,614877,Francis Marion Patriots,614909,Wingate Bulldogs,614909,4,bot,T. McCammon flied out to cf (3-1 BFBB).,33,2026-03-17T18:00:00-04:00,"Ron Christopher Stadium (Wingate, NC)",72,MBA,2026
6499259,614877,Francis Marion Patriots,614909,Wingate Bulldogs,614909,4,bot,S. Sullivan walked (3-2 FBBFBB).,34,2026-03-17T18:00:00-04:00,"Ron Christopher Stadium (Wingate, NC)",72,MBA,2026
6499259,614877,Francis Marion Patriots,614909,Wingate Bulldogs,614909,4,bot,J. Courville flied out to cf (0-0).,35,2026-03-17T18:00:00-04:00,"Ron Christopher Stadium (Wingate, NC)",72,MBA,2026
6499259,614877,Francis Marion Patriots,614909,Wingate Bulldogs,614909,4,bot,Will Farrell reached on a fielder's choice (1-2 FSB)3a S. Sullivan out at second ss to 2b.,36,2026-03-17T18:00:00-04:00,"Ron Christopher Stadium (Wingate, NC)",72,MBA,2026
6499259,614877,Francis Marion Patriots,614909,Wingate Bulldogs,614877,5,top,C. Shuster to p for C. Carpenter.,37,2026-03-17T18:00:00-04:00,"Ron Christopher Stadium (Wingate, NC)",72,MBA,2026
6499259,614877,Francis Marion Patriots,614909,Wingate Bulldogs,614877,5,top,Brandon Varg popped up to 2b (0-1 K).,38,2026-03-17T18:00:00-04:00,"Ron Christopher Stadium (Wingate, NC)",72,MBA,2026
6499259,614877,Francis Marion Patriots,614909,Wingate Bulldogs,614877,5,top,Charlie Buss lined out to cf (1-1 KB).,39,2026-03-17T18:00:00-04:00,"Ron Christopher Stadium (Wingate, NC)",72,MBA,2026
6499259,614877,Francis Marion Patriots,614909,Wingate Bulldogs,614877,5,top,Riley Orr struck out swinging (1-2 BFFS).,40,2026-03-17T18:00:00-04:00,"Ron Christopher Stadium (Wingate, NC)",72,MBA,2026
6499259,614877,Francis Marion Patriots,614909,Wingate Bulldogs,614909,5,bot,Max Reaume walked (3-2 FFBBFFFBB).,41,2026-03-17T18:00:00-04:00,"Ron Christopher Stadium (Wingate, NC)",72,MBA,2026
6499259,614877,Francis Marion Patriots,614909,Wingate Bulldogs,614909,5,bot,"Max Reaume out at second c to ss, caught stealing.",42,2026-03-17T18:00:00-04:00,"Ron Christopher Stadium (Wingate, NC)",72,MBA,2026
6499259,614877,Francis Marion Patriots,614909,Wingate Bulldogs,614909,5,bot,Mason Huffst to p for Jackson Madd.,43,2026-03-17T18:00:00-04:00,"Ron Christopher Stadium (Wingate, NC)",72,MBA,2026
6499259,614877,Francis Marion Patriots,614909,Wingate Bulldogs,614909,5,bot,R. Benamati walked (3-0 BBBB).,44,2026-03-17T18:00:00-04:00,"Ron Christopher Stadium (Wingate, NC)",72,MBA,2026
6499259,614877,Francis Marion Patriots,614909,Wingate Bulldogs,614909,5,bot,R. Benamati stole second.,45,2026-03-17T18:00:00-04:00,"Ron Christopher Stadium (Wingate, NC)",72,MBA,2026
6499259,614877,Francis Marion Patriots,614909,Wingate Bulldogs,614909,5,bot,"G. Groppuso homered down the rf line, 2 RBI (2-2 KBBF)3a R. Benamati scored.",46,2026-03-17T18:00:00-04:00,"Ron Christopher Stadium (Wingate, NC)",72,MBA,2026
6499259,614877,Francis Marion Patriots,614909,Wingate Bulldogs,614909,5,bot,Jalen Evans flied out to lf (2-2 KSBB).,47,2026-03-17T18:00:00-04:00,"Ron Christopher Stadium (Wingate, NC)",72,MBA,2026
6499259,614877,Francis Marion Patriots,614909,Wingate Bulldogs,614909,5,bot,Bowen Powell walked (3-1 BKBBB).,48,2026-03-17T18:00:00-04:00,"Ron Christopher Stadium (Wingate, NC)",72,MBA,2026
6499259,614877,Francis Marion Patriots,614909,Wingate Bulldogs,614909,5,bot,T. McCammon popped up to ss (2-1 FBB).,49,2026-03-17T18:00:00-04:00,"Ron Christopher Stadium (Wingate, NC)",72,MBA,2026
6499259,614877,Francis Marion Patriots,614909,Wingate Bulldogs,614877,6,top,Ethan McAnal walked (3-2 BKBBKB).,50,2026-03-17T18:00:00-04:00,"Ron Christopher Stadium (Wingate, NC)",72,MBA,2026
6499259,614877,Francis Marion Patriots,614909,Wingate Bulldogs,614877,6,top,Will Dorrell walked (3-1 SBBBB)3a Ethan McAnal advanced to second.,51,2026-03-17T18:00:00-04:00,"Ron Christopher Stadium (Wingate, NC)",72,MBA,2026
6499259,614877,Francis Marion Patriots,614909,Wingate Bulldogs,614877,6,top,C. Starnes to p for C. Shuster.,52,2026-03-17T18:00:00-04:00,"Ron Christopher Stadium (Wingate, NC)",72,MBA,2026
6499259,614877,Francis Marion Patriots,614909,Wingate Bulldogs,614877,6,top,"Zander Bucha doubled down the rf line, RBI (1-1 KB)3a Will Dorrell advanced to third3a Ethan McAnal scored.",53,2026-03-17T18:00:00-04:00,"Ron Christopher Stadium (Wingate, NC)",72,MBA,2026
6499259,614877,Francis Marion Patriots,614909,Wingate Bulldogs,614877,6,top,Evan Matile grounded out to c (2-2 BSKB).,54,2026-03-17T18:00:00-04:00,"Ron Christopher Stadium (Wingate, NC)",72,MBA,2026
6499259,614877,Francis Marion Patriots,614909,Wingate Bulldogs,614877,6,top,"Daniel Husse flied out to cf, SF, RBI (1-1 KB)3a Zander Bucha advanced to third3a Will Dorrell scored.",55,2026-03-17T18:00:00-04:00,"Ron Christopher Stadium (Wingate, NC)",72,MBA,2026
6499259,614877,Francis Marion Patriots,614909,Wingate Bulldogs,614877,6,top,Logan Davis struck out swinging (1-2 SBKS).,56,2026-03-17T18:00:00-04:00,"Ron Christopher Stadium (Wingate, NC)",72,MBA,2026
6499259,614877,Francis Marion Patriots,614909,Wingate Bulldogs,614909,6,bot,"S. Sullivan reached on a throwing error by 3b, advanced to second (2-1 BFB).",57,2026-03-17T18:00:00-04:00,"Ron Christopher Stadium (Wingate, NC)",72,MBA,2026
6499259,614877,Francis Marion Patriots,614909,Wingate Bulldogs,614909,6,bot,"J. Courville singled to left field, RBI (1-2 BFS)3a S. Sullivan scored, unearned.",58,2026-03-17T18:00:00-04:00,"Ron Christopher Stadium (Wingate, NC)",72,MBA,2026
6499259,614877,Francis Marion Patriots,614909,Wingate Bulldogs,614909,6,bot,Will Farrell flied out to lf (0-0).,59,2026-03-17T18:00:00-04:00,"Ron Christopher Stadium (Wingate, NC)",72,MBA,2026
6499259,614877,Francis Marion Patriots,614909,Wingate Bulldogs,614909,6,bot,Max Reaume walked (3-1 BFBBB)3a J. Courville advanced to second.,60,2026-03-17T18:00:00-04:00,"Ron Christopher Stadium (Wingate, NC)",72,MBA,2026
6499259,614877,Francis Marion Patriots,614909,Wingate Bulldogs,614909,6,bot,Owen Powell to p for Mason Huffst.,61,2026-03-17T18:00:00-04:00,"Ron Christopher Stadium (Wingate, NC)",72,MBA,2026
6499259,614877,Francis Marion Patriots,614909,Wingate Bulldogs,614909,6,bot,"R. Benamati singled to right field, RBI (1-1 BF)3a Max Reaume advanced to third3a J. Courville scored.",62,2026-03-17T18:00:00-04:00,"Ron Christopher Stadium (Wingate, NC)",72,MBA,2026
6499259,614877,Francis Marion Patriots,614909,Wingate Bulldogs,614909,6,bot,R. Benamati stole second.,63,2026-03-17T18:00:00-04:00,"Ron Christopher Stadium (Wingate, NC)",72,MBA,2026
6499259,614877,Francis Marion Patriots,614909,Wingate Bulldogs,614909,6,bot,"G. Groppuso singled to left center, 2 RBI (1-1 BK)3a R. Benamati scored3a Max Reaume scored.",64,2026-03-17T18:00:00-04:00,"Ron Christopher Stadium (Wingate, NC)",72,MBA,2026
6499259,614877,Francis Marion Patriots,614909,Wingate Bulldogs,614909,6,bot,Jalen Evans reached on a fielder's choice (1-0 B)3a G. Groppuso out at second 3b to 2b.,65,2026-03-17T18:00:00-04:00,"Ron Christopher Stadium (Wingate, NC)",72,MBA,2026
6499259,614877,Francis Marion Patriots,614909,Wingate Bulldogs,614909,6,bot,Bowen Powell flied out to lf (0-0).,66,2026-03-17T18:00:00-04:00,"Ron Christopher Stadium (Wingate, NC)",72,MBA,2026
6499259,614877,Francis Marion Patriots,614909,Wingate Bulldogs,614877,7,top,P. Jensen to p for C. Starnes.,67,2026-03-17T18:00:00-04:00,"Ron Christopher Stadium (Wingate, NC)",72,MBA,2026
6499259,614877,Francis Marion Patriots,614909,Wingate Bulldogs,614877,7,top,Brandon Varg singled to shortstop (1-2 KBK).,68,2026-03-17T18:00:00-04:00,"Ron Christopher Stadium (Wingate, NC)",72,MBA,2026
6499259,614877,Francis Marion Patriots,614909,Wingate Bulldogs,614877,7,top,Brandon Varg advanced to second on a wild pitch.,69,2026-03-17T18:00:00-04:00,"Ron Christopher Stadium (Wingate, NC)",72,MBA,2026
6499259,614877,Francis Marion Patriots,614909,Wingate Bulldogs,614877,7,top,Charlie Buss walked (3-0 BBBB).,70,2026-03-17T18:00:00-04:00,"Ron Christopher Stadium (Wingate, NC)",72,MBA,2026
6499259,614877,Francis Marion Patriots,614909,Wingate Bulldogs,614877,7,top,Riley Orr grounded into double play 2b to ss to 1b (2-0 BB)3a Charlie Buss out on the play3a Brandon Varg advanced to third.,71,2026-03-17T18:00:00-04:00,"Ron Christopher Stadium (Wingate, NC)",72,MBA,2026
6499259,614877,Francis Marion Patriots,614909,Wingate Bulldogs,614877,7,top,Ethan McAnal struck out swinging (0-2 KSS).,72,2026-03-17T18:00:00-04:00,"Ron Christopher Stadium (Wingate, NC)",72,MBA,2026
6499259,614877,Francis Marion Patriots,614909,Wingate Bulldogs,614909,7,bot,T. McCammon flied out to cf (0-1 K).,73,2026-03-17T18:00:00-04:00,"Ron Christopher Stadium (Wingate, NC)",72,MBA,2026
6499259,614877,Francis Marion Patriots,614909,Wingate Bulldogs,614909,7,bot,S. Sullivan tripled to left center (0-0).,74,2026-03-17T18:00:00-04:00,"Ron Christopher Stadium (Wingate, NC)",72,MBA,2026
6499259,614877,Francis Marion Patriots,614909,Wingate Bulldogs,614909,7,bot,"J. Courville singled up the middle, RBI (2-2 KBBFF)3a S. Sullivan scored.",75,2026-03-17T18:00:00-04:00,"Ron Christopher Stadium (Wingate, NC)",72,MBA,2026
6499259,614877,Francis Marion Patriots,614909,Wingate Bulldogs,614909,7,bot,"Will Farrell tripled to right center, RBI (2-2 KFBBF)3a J. Courville scored.",76,2026-03-17T18:00:00-04:00,"Ron Christopher Stadium (Wingate, NC)",72,MBA,2026
6499259,614877,Francis Marion Patriots,614909,Wingate Bulldogs,614909,7,bot,Roman Edward to p for Owen Powell.,77,2026-03-17T18:00:00-04:00,"Ron Christopher Stadium (Wingate, NC)",72,MBA,2026
6499259,614877,Francis Marion Patriots,614909,Wingate Bulldogs,614909,7,bot,Max Reaume hit by pitch (0-0).,78,2026-03-17T18:00:00-04:00,"Ron Christopher Stadium (Wingate, NC)",72,MBA,2026
6499259,614877,Francis Marion Patriots,614909,Wingate Bulldogs,614909,7,bot,"R. Benamati singled to pitcher, bunt, advanced to second on an error by 1b, RBI (2-1 BBS)3a Max Reaume advanced to third3a Will Farrell scored.",79,2026-03-17T18:00:00-04:00,"Ron Christopher Stadium (Wingate, NC)",72,MBA,2026
6499259,614877,Francis Marion Patriots,614909,Wingate Bulldogs,614909,7,bot,G. Groppuso intentionally walked.,80,2026-03-17T18:00:00-04:00,"Ron Christopher Stadium (Wingate, NC)",72,MBA,2026
6499259,614877,Francis Marion Patriots,614909,Wingate Bulldogs,614909,7,bot,"Jalen Evans reached on an error by 3b (1-0 B)3a G. Groppuso advanced to second3a R. Benamati advanced to third3a Max Reaume scored, unearned.",81,2026-03-17T18:00:00-04:00,"Ron Christopher Stadium (Wingate, NC)",72,MBA,2026
6499259,614877,Francis Marion Patriots,614909,Wingate Bulldogs,614909,7,bot,Bowen Powell reached on a fielder's choice (2-1 BBF)3a Jalen Evans advanced to second3a G. Groppuso advanced to third3a R. Benamati out at home 3b to c.,82,2026-03-17T18:00:00-04:00,"Ron Christopher Stadium (Wingate, NC)",72,MBA,2026
6499259,614877,Francis Marion Patriots,614909,Wingate Bulldogs,614909,7,bot,"T. McCammon singled to third base, RBI (2-2 KBSFB)3a Bowen Powell advanced to second3a Jalen Evans advanced to third3a G. Groppuso scored, unearned.",83,2026-03-17T18:00:00-04:00,"Ron Christopher Stadium (Wingate, NC)",72,MBA,2026
6499259,614877,Francis Marion Patriots,614909,Wingate Bulldogs,614909,7,bot,"S. Sullivan hit by pitch, RBI (1-1 BS)3a T. McCammon advanced to second3a Bowen Powell advanced to third3a Jalen Evans scored, unearned.",84,2026-03-17T18:00:00-04:00,"Ron Christopher Stadium (Wingate, NC)",72,MBA,2026
6499259,614877,Francis Marion Patriots,614909,Wingate Bulldogs,614909,7,bot,"J. Courville singled through the left side, 2 RBI (1-1 FB)3a S. Sullivan advanced to second3a T. McCammon scored, unearned3a Bowen Powell scored, unearned.",85,2026-03-17T18:00:00-04:00,"Ron Christopher Stadium (Wingate, NC)",72,MBA,2026
6499259,614877,Francis Marion Patriots,614909,Wingate Bulldogs,614909,7,bot,Will Farrell struck out swinging (0-2 KFS).,86,2026-03-17T18:00:00-04:00,"Ron Christopher Stadium (Wingate, NC)",72,MBA,2026
6499259,614877,Francis Marion Patriots,614909,Wingate Bulldogs,614877,8,top,Will Dorrell flied out to rf (2-1 BKB).,87,2026-03-17T18:00:00-04:00,"Ron Christopher Stadium (Wingate, NC)",72,MBA,2026
6499259,614877,Francis Marion Patriots,614909,Wingate Bulldogs,614877,8,top,Zander Bucha singled to pitcher (1-1 KB).,88,2026-03-17T18:00:00-04:00,"Ron Christopher Stadium (Wingate, NC)",72,MBA,2026
6499259,614877,Francis Marion Patriots,614909,Wingate Bulldogs,614877,8,top,Adrian Nina pinch ran for Zander Bucha.,89,2026-03-17T18:00:00-04:00,"Ron Christopher Stadium (Wingate, NC)",72,MBA,2026
6499259,614877,Francis Marion Patriots,614909,Wingate Bulldogs,614877,8,top,Evan Matile singled to pitcher (1-1 KB)3a Adrian Nina advanced to second.,90,2026-03-17T18:00:00-04:00,"Ron Christopher Stadium (Wingate, NC)",72,MBA,2026
6499259,614877,Francis Marion Patriots,614909,Wingate Bulldogs,614877,8,top,Evan Matile advanced to second3a Adrian Nina advanced to third on a wild pitch.,91,2026-03-17T18:00:00-04:00,"Ron Christopher Stadium (Wingate, NC)",72,MBA,2026
6499259,614877,Francis Marion Patriots,614909,Wingate Bulldogs,614877,8,top,Daniel Husse hit by pitch (1-0 B).,92,2026-03-17T18:00:00-04:00,"Ron Christopher Stadium (Wingate, NC)",72,MBA,2026
6499259,614877,Francis Marion Patriots,614909,Wingate Bulldogs,614877,8,top,Logan Davis reached on a fielder's choice (1-0 B)3a Daniel Husse advanced to second3a Evan Matile advanced to third3a Adrian Nina out at home p to c.,93,2026-03-17T18:00:00-04:00,"Ron Christopher Stadium (Wingate, NC)",72,MBA,2026
6499259,614877,Francis Marion Patriots,614909,Wingate Bulldogs,614877,8,top,"Brandon Varg singled to shortstop, RBI (3-2 BKFBB)3a Logan Davis advanced to second3a Daniel Husse advanced to third3a Evan Matile scored.",94,2026-03-17T18:00:00-04:00,"Ron Christopher Stadium (Wingate, NC)",72,MBA,2026
6499259,614877,Francis Marion Patriots,614909,Wingate Bulldogs,614877,8,top,Charlie Buss struck out looking (1-2 KBSK).,95,2026-03-17T18:00:00-04:00,"Ron Christopher Stadium (Wingate, NC)",72,MBA,2026
6499259,614877,Francis Marion Patriots,614909,Wingate Bulldogs,614909,8,bot,John Lupiens to c for Adrian Nina.,96,2026-03-17T18:00:00-04:00,"Ron Christopher Stadium (Wingate, NC)",72,MBA,2026
6499259,614877,Francis Marion Patriots,614909,Wingate Bulldogs,614909,8,bot,Max Reaume walked (3-2 BKBSBB).,97,2026-03-17T18:00:00-04:00,"Ron Christopher Stadium (Wingate, NC)",72,MBA,2026
6499259,614877,Francis Marion Patriots,614909,Wingate Bulldogs,614909,8,bot,Tristan Neel to p for Roman Edward.,98,2026-03-17T18:00:00-04:00,"Ron Christopher Stadium (Wingate, NC)",72,MBA,2026
6499259,614877,Francis Marion Patriots,614909,Wingate Bulldogs,614909,8,bot,R. Benamati walked (3-2 BKBBFB)3a Max Reaume advanced to second.,99,2026-03-17T18:00:00-04:00,"Ron Christopher Stadium (Wingate, NC)",72,MBA,2026
6499259,614877,Francis Marion Patriots,614909,Wingate Bulldogs,614909,8,bot,R. Benamati advanced to second3a Max Reaume advanced to third on a wild pitch.,100,2026-03-17T18:00:00-04:00,"Ron Christopher Stadium (Wingate, NC)",72,MBA,2026
6499259,614877,Francis Marion Patriots,614909,Wingate Bulldogs,614909,8,bot,"G. Groppuso singled to shortstop, RBI (3-2 BBKBK)3a R. Benamati advanced to third3a Max Reaume scored.",101,2026-03-17T18:00:00-04:00,"Ron Christopher Stadium (Wingate, NC)",72,MBA,2026
6499259,614877,Francis Marion Patriots,614909,Wingate Bulldogs,614909,8,bot,G. Groppuso stole second.,102,2026-03-17T18:00:00-04:00,"Ron Christopher Stadium (Wingate, NC)",72,MBA,2026
6499259,614877,Francis Marion Patriots,614909,Wingate Bulldogs,614909,8,bot,Jalen Evans struck out looking (2-2 FBBSFK).,103,2026-03-17T18:00:00-04:00,"Ron Christopher Stadium (Wingate, NC)",72,MBA,2026
6499259,614877,Francis Marion Patriots,614909,Wingate Bulldogs,614909,8,bot,"Bowen Powell singled to left field, 2 RBI (0-0)3a G. Groppuso scored3a R. Benamati scored.",104,2026-03-17T18:00:00-04:00,"Ron Christopher Stadium (Wingate, NC)",72,MBA,2026
6499259,614877,Francis Marion Patriots,614909,Wingate Bulldogs,614909,8,bot,T. McCammon singled up the middle (2-2 KBBKF)3a Bowen Powell advanced to second.,105,2026-03-17T18:00:00-04:00,"Ron Christopher Stadium (Wingate, NC)",72,MBA,2026
6499259,614877,Francis Marion Patriots,614909,Wingate Bulldogs,614909,8,bot,Ju. Barham pinch hit for S. Sullivan.,106,2026-03-17T18:00:00-04:00,"Ron Christopher Stadium (Wingate, NC)",72,MBA,2026
6499259,614877,Francis Marion Patriots,614909,Wingate Bulldogs,614909,8,bot,Tripp Triple to p for Tristan Neel.,107,2026-03-17T18:00:00-04:00,"Ron Christopher Stadium (Wingate, NC)",72,MBA,2026
6499259,614877,Francis Marion Patriots,614909,Wingate Bulldogs,614909,8,bot,T. McCammon advanced to second3a Bowen Powell advanced to third on a wild pitch.,108,2026-03-17T18:00:00-04:00,"Ron Christopher Stadium (Wingate, NC)",72,MBA,2026
6499259,614877,Francis Marion Patriots,614909,Wingate Bulldogs,614909,8,bot,Ju. Barham walked (3-2 BFBFBB).,109,2026-03-17T18:00:00-04:00,"Ron Christopher Stadium (Wingate, NC)",72,MBA,2026
6499259,614877,Francis Marion Patriots,614909,Wingate Bulldogs,614909,8,bot,"J. Courville walked, RBI (3-2 FBBKBB)3a Ju. Barham advanced to second3a T. McCammon advanced to third3a Bowen Powell scored.",110,2026-03-17T18:00:00-04:00,"Ron Christopher Stadium (Wingate, NC)",72,MBA,2026
6499259,614877,Francis Marion Patriots,614909,Wingate Bulldogs,614909,8,bot,"Will Farrell reached on a fielder's choice, RBI (1-1 KB)3a J. Courville out at second 3b to 2b3a Ju. Barham advanced to third3a T. McCammon scored.",111,2026-03-17T18:00:00-04:00,"Ron Christopher Stadium (Wingate, NC)",72,MBA,2026
6499259,614877,Francis Marion Patriots,614909,Wingate Bulldogs,614909,8,bot,Max Reaume flied out to rf (0-0).,112,2026-03-17T18:00:00-04:00,"Ron Christopher Stadium (Wingate, NC)",72,MBA,2026
6499259,614877,Francis Marion Patriots,614909,Wingate Bulldogs,614877,9,top,J. Toney to p for P. Jensen.,113,2026-03-17T18:00:00-04:00,"Ron Christopher Stadium (Wingate, NC)",72,MBA,2026
6499259,614877,Francis Marion Patriots,614909,Wingate Bulldogs,614877,9,top,"Riley Orr homered to left field, RBI (1-0 B).",114,2026-03-17T18:00:00-04:00,"Ron Christopher Stadium (Wingate, NC)",72,MBA,2026
6499259,614877,Francis Marion Patriots,614909,Wingate Bulldogs,614877,9,top,Ethan McAnal struck out swinging (1-2 KBSS).,115,2026-03-17T18:00:00-04:00,"Ron Christopher Stadium (Wingate, NC)",72,MBA,2026
6499259,614877,Francis Marion Patriots,614909,Wingate Bulldogs,614877,9,top,Will Dorrell grounded out to 2b (1-1 SB).,116,2026-03-17T18:00:00-04:00,"Ron Christopher Stadium (Wingate, NC)",72,MBA,2026
6499259,614877,Francis Marion Patriots,614909,Wingate Bulldogs,614877,9,top,John Lupiens grounded out to ss (1-0 B).,117,2026-03-17T18:00:00-04:00,"Ron Christopher Stadium (Wingate, NC)",72,MBA,2026
