game_id,away_team_id,away_team_name,home_team_id,home_team_name,batting_team,inning,top_bot,event_text,event_num,game_datetime,stadium_name,attendance,sport_id,season
6509316,615041,UIndy Greyhounds,614971,McKendree Bearcats,615041,1,top,Garrett Rusch struck out swinging (1-2 KBFS).,1,2026-03-07T16:00:00-05:00,"Hypes Field (Lebanon, IL)",50,MBA,2026
6509316,615041,UIndy Greyhounds,614971,McKendree Bearcats,615041,1,top,Austin Bode grounded out to 2b (2-2 KBBFFF).,2,2026-03-07T16:00:00-05:00,"Hypes Field (Lebanon, IL)",50,MBA,2026
6509316,615041,UIndy Greyhounds,614971,McKendree Bearcats,615041,1,top,Solen Munson struck out swinging (1-2 SBSFS).,3,2026-03-07T16:00:00-05:00,"Hypes Field (Lebanon, IL)",50,MBA,2026
6509316,615041,UIndy Greyhounds,614971,McKendree Bearcats,614971,1,bot,Gabe Deaver singled through the left side (0-0).,4,2026-03-07T16:00:00-05:00,"Hypes Field (Lebanon, IL)",50,MBA,2026
6509316,615041,UIndy Greyhounds,614971,McKendree Bearcats,614971,1,bot,Gabe Deaver Failed pickoff attempt.,5,2026-03-07T16:00:00-05:00,"Hypes Field (Lebanon, IL)",50,MBA,2026
6509316,615041,UIndy Greyhounds,614971,McKendree Bearcats,614971,1,bot,Peyton Bittle struck out swinging (3-2 FBKBBS).,6,2026-03-07T16:00:00-05:00,"Hypes Field (Lebanon, IL)",50,MBA,2026
6509316,615041,UIndy Greyhounds,614971,McKendree Bearcats,614971,1,bot,Gabe Deaver Failed pickoff attempt.,7,2026-03-07T16:00:00-05:00,"Hypes Field (Lebanon, IL)",50,MBA,2026
6509316,615041,UIndy Greyhounds,614971,McKendree Bearcats,614971,1,bot,Gabe Deaver Failed pickoff attempt.,8,2026-03-07T16:00:00-05:00,"Hypes Field (Lebanon, IL)",50,MBA,2026
6509316,615041,UIndy Greyhounds,614971,McKendree Bearcats,614971,1,bot,Gabe Deaver Failed pickoff attempt.,9,2026-03-07T16:00:00-05:00,"Hypes Field (Lebanon, IL)",50,MBA,2026
6509316,615041,UIndy Greyhounds,614971,McKendree Bearcats,614971,1,bot,Max Meuli singled to left field (3-2 BKBSB)3a Gabe Deaver advanced to second.,10,2026-03-07T16:00:00-05:00,"Hypes Field (Lebanon, IL)",50,MBA,2026
6509316,615041,UIndy Greyhounds,614971,McKendree Bearcats,614971,1,bot,Gavin Arseneau flied out to lf (1-2 FSFBF).,11,2026-03-07T16:00:00-05:00,"Hypes Field (Lebanon, IL)",50,MBA,2026
6509316,615041,UIndy Greyhounds,614971,McKendree Bearcats,614971,1,bot,Javy Garcia singled to shortstop (0-0)3a Max Meuli advanced to second3a Gabe Deaver advanced to third.,12,2026-03-07T16:00:00-05:00,"Hypes Field (Lebanon, IL)",50,MBA,2026
6509316,615041,UIndy Greyhounds,614971,McKendree Bearcats,614971,1,bot,Quest Hull struck out swinging (2-2 BSBSS).,13,2026-03-07T16:00:00-05:00,"Hypes Field (Lebanon, IL)",50,MBA,2026
6509316,615041,UIndy Greyhounds,614971,McKendree Bearcats,615041,2,top,Chase Mason hit by pitch (1-0 H).,14,2026-03-07T16:00:00-05:00,"Hypes Field (Lebanon, IL)",50,MBA,2026
6509316,615041,UIndy Greyhounds,614971,McKendree Bearcats,615041,2,top,Gavin Duran struck out looking (1-2 FBFK).,15,2026-03-07T16:00:00-05:00,"Hypes Field (Lebanon, IL)",50,MBA,2026
6509316,615041,UIndy Greyhounds,614971,McKendree Bearcats,615041,2,top,"Chase Mason out at second c to 2b, caught stealing.",16,2026-03-07T16:00:00-05:00,"Hypes Field (Lebanon, IL)",50,MBA,2026
6509316,615041,UIndy Greyhounds,614971,McKendree Bearcats,615041,2,top,Luke Smock fouled out to ss (2-2 FBBK).,17,2026-03-07T16:00:00-05:00,"Hypes Field (Lebanon, IL)",50,MBA,2026
6509316,615041,UIndy Greyhounds,614971,McKendree Bearcats,614971,2,bot,Sage McMinn flied out to cf (1-2 FBS).,18,2026-03-07T16:00:00-05:00,"Hypes Field (Lebanon, IL)",50,MBA,2026
6509316,615041,UIndy Greyhounds,614971,McKendree Bearcats,614971,2,bot,Gavin Noreus struck out swinging (3-2 BKBKBS).,19,2026-03-07T16:00:00-05:00,"Hypes Field (Lebanon, IL)",50,MBA,2026
6509316,615041,UIndy Greyhounds,614971,McKendree Bearcats,614971,2,bot,Tyler Butash struck out looking (1-2 BKFK).,20,2026-03-07T16:00:00-05:00,"Hypes Field (Lebanon, IL)",50,MBA,2026
6509316,615041,UIndy Greyhounds,614971,McKendree Bearcats,615041,3,top,Brayton Bowen walked (3-0 BBBB).,21,2026-03-07T16:00:00-05:00,"Hypes Field (Lebanon, IL)",50,MBA,2026
6509316,615041,UIndy Greyhounds,614971,McKendree Bearcats,615041,3,top,"Joey Humphrey grounded out to p, bunt (2-1 BBK)3a Brayton Bowen advanced to second.",22,2026-03-07T16:00:00-05:00,"Hypes Field (Lebanon, IL)",50,MBA,2026
6509316,615041,UIndy Greyhounds,614971,McKendree Bearcats,615041,3,top,Nathan Jessup struck out swinging (1-2 SBKS).,23,2026-03-07T16:00:00-05:00,"Hypes Field (Lebanon, IL)",50,MBA,2026
6509316,615041,UIndy Greyhounds,614971,McKendree Bearcats,615041,3,top,Garrett Rusch grounded out to 3b (1-0 B).,24,2026-03-07T16:00:00-05:00,"Hypes Field (Lebanon, IL)",50,MBA,2026
6509316,615041,UIndy Greyhounds,614971,McKendree Bearcats,614971,3,bot,Gabe Deaver out at first 2b to p (0-2 KS).,25,2026-03-07T16:00:00-05:00,"Hypes Field (Lebanon, IL)",50,MBA,2026
6509316,615041,UIndy Greyhounds,614971,McKendree Bearcats,614971,3,bot,Peyton Bittle flied out to lf (1-0 B).,26,2026-03-07T16:00:00-05:00,"Hypes Field (Lebanon, IL)",50,MBA,2026
6509316,615041,UIndy Greyhounds,614971,McKendree Bearcats,614971,3,bot,Max Meuli doubled to left field (1-1 BF).,27,2026-03-07T16:00:00-05:00,"Hypes Field (Lebanon, IL)",50,MBA,2026
6509316,615041,UIndy Greyhounds,614971,McKendree Bearcats,614971,3,bot,"Gavin Arseneau homered to right field, 2 RBI (1-0 B)3a Max Meuli scored.",28,2026-03-07T16:00:00-05:00,"Hypes Field (Lebanon, IL)",50,MBA,2026
6509316,615041,UIndy Greyhounds,614971,McKendree Bearcats,614971,3,bot,Javy Garcia doubled to left center (1-2 SBS).,29,2026-03-07T16:00:00-05:00,"Hypes Field (Lebanon, IL)",50,MBA,2026
6509316,615041,UIndy Greyhounds,614971,McKendree Bearcats,614971,3,bot,Quest Hull struck out looking (2-2 BBKKK).,30,2026-03-07T16:00:00-05:00,"Hypes Field (Lebanon, IL)",50,MBA,2026
6509316,615041,UIndy Greyhounds,614971,McKendree Bearcats,615041,4,top,Austin Bode walked (3-1 BKBBB).,31,2026-03-07T16:00:00-05:00,"Hypes Field (Lebanon, IL)",50,MBA,2026
6509316,615041,UIndy Greyhounds,614971,McKendree Bearcats,615041,4,top,Solen Munson grounded out to 2b (0-1 F)3a Austin Bode advanced to second.,32,2026-03-07T16:00:00-05:00,"Hypes Field (Lebanon, IL)",50,MBA,2026
6509316,615041,UIndy Greyhounds,614971,McKendree Bearcats,615041,4,top,Chase Mason grounded out to 3b (1-1 BK).,33,2026-03-07T16:00:00-05:00,"Hypes Field (Lebanon, IL)",50,MBA,2026
6509316,615041,UIndy Greyhounds,614971,McKendree Bearcats,615041,4,top,Gavin Duran struck out looking (1-2 FBFK).,34,2026-03-07T16:00:00-05:00,"Hypes Field (Lebanon, IL)",50,MBA,2026
6509316,615041,UIndy Greyhounds,614971,McKendree Bearcats,614971,4,bot,Sage McMinn singled to right field (0-0).,35,2026-03-07T16:00:00-05:00,"Hypes Field (Lebanon, IL)",50,MBA,2026
6509316,615041,UIndy Greyhounds,614971,McKendree Bearcats,614971,4,bot,Gavin Noreus singled to center field (1-0 B)3a Sage McMinn advanced to second.,36,2026-03-07T16:00:00-05:00,"Hypes Field (Lebanon, IL)",50,MBA,2026
6509316,615041,UIndy Greyhounds,614971,McKendree Bearcats,614971,4,bot,Tyler Butash struck out swinging (1-2 SKBS).,37,2026-03-07T16:00:00-05:00,"Hypes Field (Lebanon, IL)",50,MBA,2026
6509316,615041,UIndy Greyhounds,614971,McKendree Bearcats,614971,4,bot,Gabe Deaver flied out to rf (1-2 KFFB)3a Sage McMinn advanced to third.,38,2026-03-07T16:00:00-05:00,"Hypes Field (Lebanon, IL)",50,MBA,2026
6509316,615041,UIndy Greyhounds,614971,McKendree Bearcats,614971,4,bot,Peyton Bittle flied out to cf (0-0).,39,2026-03-07T16:00:00-05:00,"Hypes Field (Lebanon, IL)",50,MBA,2026
6509316,615041,UIndy Greyhounds,614971,McKendree Bearcats,615041,5,top,Luke Smock grounded out to 2b (0-0).,40,2026-03-07T16:00:00-05:00,"Hypes Field (Lebanon, IL)",50,MBA,2026
6509316,615041,UIndy Greyhounds,614971,McKendree Bearcats,615041,5,top,Brayton Bowen walked (3-1 BKBBB).,41,2026-03-07T16:00:00-05:00,"Hypes Field (Lebanon, IL)",50,MBA,2026
6509316,615041,UIndy Greyhounds,614971,McKendree Bearcats,615041,5,top,Joey Humphrey grounded out to 1b unassisted (2-0 BB)3a Brayton Bowen advanced to second.,42,2026-03-07T16:00:00-05:00,"Hypes Field (Lebanon, IL)",50,MBA,2026
6509316,615041,UIndy Greyhounds,614971,McKendree Bearcats,615041,5,top,Nathan Jessup hit by pitch (3-1 BFBH).,43,2026-03-07T16:00:00-05:00,"Hypes Field (Lebanon, IL)",50,MBA,2026
6509316,615041,UIndy Greyhounds,614971,McKendree Bearcats,615041,5,top,Garrett Rusch reached on a fielder's choice to shortstop (0-0)3a Nathan Jessup out at second ss to 2b.,44,2026-03-07T16:00:00-05:00,"Hypes Field (Lebanon, IL)",50,MBA,2026
6509316,615041,UIndy Greyhounds,614971,McKendree Bearcats,614971,5,bot,Max Meuli lined out to ss (0-0).,45,2026-03-07T16:00:00-05:00,"Hypes Field (Lebanon, IL)",50,MBA,2026
6509316,615041,UIndy Greyhounds,614971,McKendree Bearcats,614971,5,bot,Gavin Arseneau walked (3-1 FBBBB).,46,2026-03-07T16:00:00-05:00,"Hypes Field (Lebanon, IL)",50,MBA,2026
6509316,615041,UIndy Greyhounds,614971,McKendree Bearcats,614971,5,bot,Javy Garcia struck out swinging (2-2 BKFBS).,47,2026-03-07T16:00:00-05:00,"Hypes Field (Lebanon, IL)",50,MBA,2026
6509316,615041,UIndy Greyhounds,614971,McKendree Bearcats,614971,5,bot,Quest Hull struck out swinging (1-2 BKSS).,48,2026-03-07T16:00:00-05:00,"Hypes Field (Lebanon, IL)",50,MBA,2026
6509316,615041,UIndy Greyhounds,614971,McKendree Bearcats,615041,6,top,Austin Bode walked (3-1 BKBBB).,49,2026-03-07T16:00:00-05:00,"Hypes Field (Lebanon, IL)",50,MBA,2026
6509316,615041,UIndy Greyhounds,614971,McKendree Bearcats,615041,6,top,"Solen Munson homered to center field, 2 RBI (3-1 BSBB)3a Austin Bode scored.",50,2026-03-07T16:00:00-05:00,"Hypes Field (Lebanon, IL)",50,MBA,2026
6509316,615041,UIndy Greyhounds,614971,McKendree Bearcats,615041,6,top,Chase Mason struck out swinging (1-2 FKBS).,51,2026-03-07T16:00:00-05:00,"Hypes Field (Lebanon, IL)",50,MBA,2026
6509316,615041,UIndy Greyhounds,614971,McKendree Bearcats,615041,6,top,Gavin Duran singled to center field (1-1 BS).,52,2026-03-07T16:00:00-05:00,"Hypes Field (Lebanon, IL)",50,MBA,2026
6509316,615041,UIndy Greyhounds,614971,McKendree Bearcats,615041,6,top,Luke Smock reached on a fielder's choice to shortstop (0-1 F)3a Gavin Duran out at second ss to 2b.,53,2026-03-07T16:00:00-05:00,"Hypes Field (Lebanon, IL)",50,MBA,2026
6509316,615041,UIndy Greyhounds,614971,McKendree Bearcats,615041,6,top,Luke Smock stole second.,54,2026-03-07T16:00:00-05:00,"Hypes Field (Lebanon, IL)",50,MBA,2026
6509316,615041,UIndy Greyhounds,614971,McKendree Bearcats,615041,6,top,Brayton Bowen was intentionally walked (3-0 BBBB).,55,2026-03-07T16:00:00-05:00,"Hypes Field (Lebanon, IL)",50,MBA,2026
6509316,615041,UIndy Greyhounds,614971,McKendree Bearcats,615041,6,top,Joey Humphrey struck out swinging (2-2 KBBFS).,56,2026-03-07T16:00:00-05:00,"Hypes Field (Lebanon, IL)",50,MBA,2026
6509316,615041,UIndy Greyhounds,614971,McKendree Bearcats,614971,6,bot,Ryan Degroot to 3b for Garrett Rusch.,57,2026-03-07T16:00:00-05:00,"Hypes Field (Lebanon, IL)",50,MBA,2026
6509316,615041,UIndy Greyhounds,614971,McKendree Bearcats,614971,6,bot,Sage McMinn struck out swinging (3-2 BSBBSFS).,58,2026-03-07T16:00:00-05:00,"Hypes Field (Lebanon, IL)",50,MBA,2026
6509316,615041,UIndy Greyhounds,614971,McKendree Bearcats,614971,6,bot,Gavin Noreus struck out looking (0-2 SSK).,59,2026-03-07T16:00:00-05:00,"Hypes Field (Lebanon, IL)",50,MBA,2026
6509316,615041,UIndy Greyhounds,614971,McKendree Bearcats,614971,6,bot,Tyler Butash struck out looking (0-2 KSK).,60,2026-03-07T16:00:00-05:00,"Hypes Field (Lebanon, IL)",50,MBA,2026
6509316,615041,UIndy Greyhounds,614971,McKendree Bearcats,615041,7,top,Peyton Apps to p for Calan Kujawa.,61,2026-03-07T16:00:00-05:00,"Hypes Field (Lebanon, IL)",50,MBA,2026
6509316,615041,UIndy Greyhounds,614971,McKendree Bearcats,615041,7,top,Austin Pokley pinch hit for Nathan Jessup.,62,2026-03-07T16:00:00-05:00,"Hypes Field (Lebanon, IL)",50,MBA,2026
6509316,615041,UIndy Greyhounds,614971,McKendree Bearcats,615041,7,top,Austin Pokley flied out to cf (2-2 BKBK).,63,2026-03-07T16:00:00-05:00,"Hypes Field (Lebanon, IL)",50,MBA,2026
6509316,615041,UIndy Greyhounds,614971,McKendree Bearcats,615041,7,top,Ryan Degroot singled up the middle (3-1 BBKB).,64,2026-03-07T16:00:00-05:00,"Hypes Field (Lebanon, IL)",50,MBA,2026
6509316,615041,UIndy Greyhounds,614971,McKendree Bearcats,615041,7,top,Austin Bode walked (3-0 BBBB)3a Ryan Degroot advanced to second.,65,2026-03-07T16:00:00-05:00,"Hypes Field (Lebanon, IL)",50,MBA,2026
6509316,615041,UIndy Greyhounds,614971,McKendree Bearcats,615041,7,top,Eli Dyer to p for Peyton Apps.,66,2026-03-07T16:00:00-05:00,"Hypes Field (Lebanon, IL)",50,MBA,2026
6509316,615041,UIndy Greyhounds,614971,McKendree Bearcats,615041,7,top,Solen Munson grounded out to 1b unassisted (0-1 K)3a Austin Bode advanced to second3a Ryan Degroot advanced to third.,67,2026-03-07T16:00:00-05:00,"Hypes Field (Lebanon, IL)",50,MBA,2026
6509316,615041,UIndy Greyhounds,614971,McKendree Bearcats,615041,7,top,"Ryan Degroot out at home c unassisted, caught stealing.",68,2026-03-07T16:00:00-05:00,"Hypes Field (Lebanon, IL)",50,MBA,2026
6509316,615041,UIndy Greyhounds,614971,McKendree Bearcats,614971,7,bot,Maddux Bach to cf for Austin Pokley.,69,2026-03-07T16:00:00-05:00,"Hypes Field (Lebanon, IL)",50,MBA,2026
6509316,615041,UIndy Greyhounds,614971,McKendree Bearcats,614971,7,bot,Gabe Deaver doubled to left center (0-0).,70,2026-03-07T16:00:00-05:00,"Hypes Field (Lebanon, IL)",50,MBA,2026
6509316,615041,UIndy Greyhounds,614971,McKendree Bearcats,614971,7,bot,Peyton Bittle struck out swinging (0-2 FKFS).,71,2026-03-07T16:00:00-05:00,"Hypes Field (Lebanon, IL)",50,MBA,2026
6509316,615041,UIndy Greyhounds,614971,McKendree Bearcats,614971,7,bot,Max Meuli flied out to rf (2-0 BB)3a Gabe Deaver advanced to third.,72,2026-03-07T16:00:00-05:00,"Hypes Field (Lebanon, IL)",50,MBA,2026
6509316,615041,UIndy Greyhounds,614971,McKendree Bearcats,614971,7,bot,Gavin Arseneau was intentionally walked (3-0 BBBB).,73,2026-03-07T16:00:00-05:00,"Hypes Field (Lebanon, IL)",50,MBA,2026
6509316,615041,UIndy Greyhounds,614971,McKendree Bearcats,614971,7,bot,Gavin Arseneau stole second.,74,2026-03-07T16:00:00-05:00,"Hypes Field (Lebanon, IL)",50,MBA,2026
6509316,615041,UIndy Greyhounds,614971,McKendree Bearcats,614971,7,bot,Javy Garcia struck out swinging (1-2 FKBS).,75,2026-03-07T16:00:00-05:00,"Hypes Field (Lebanon, IL)",50,MBA,2026
6509316,615041,UIndy Greyhounds,614971,McKendree Bearcats,615041,8,top,Chase Mason struck out looking (1-2 KBFK).,76,2026-03-07T16:00:00-05:00,"Hypes Field (Lebanon, IL)",50,MBA,2026
6509316,615041,UIndy Greyhounds,614971,McKendree Bearcats,615041,8,top,Gavin Duran singled to right field (0-0).,77,2026-03-07T16:00:00-05:00,"Hypes Field (Lebanon, IL)",50,MBA,2026
6509316,615041,UIndy Greyhounds,614971,McKendree Bearcats,615041,8,top,Luke Smock reached on a fielder's choice to third base (0-0)3a Gavin Duran out at second 3b to 2b.,78,2026-03-07T16:00:00-05:00,"Hypes Field (Lebanon, IL)",50,MBA,2026
6509316,615041,UIndy Greyhounds,614971,McKendree Bearcats,615041,8,top,"Luke Smock out at first p to 1b to ss, picked off.",79,2026-03-07T16:00:00-05:00,"Hypes Field (Lebanon, IL)",50,MBA,2026
6509316,615041,UIndy Greyhounds,614971,McKendree Bearcats,614971,8,bot,Jeryn Shortt to p for Kaleb Marrs.,80,2026-03-07T16:00:00-05:00,"Hypes Field (Lebanon, IL)",50,MBA,2026
6509316,615041,UIndy Greyhounds,614971,McKendree Bearcats,614971,8,bot,Quest Hull hit by pitch (1-1 SH).,81,2026-03-07T16:00:00-05:00,"Hypes Field (Lebanon, IL)",50,MBA,2026
6509316,615041,UIndy Greyhounds,614971,McKendree Bearcats,614971,8,bot,Sage McMinn hit by pitch (3-0 BBH)3a Quest Hull advanced to second.,82,2026-03-07T16:00:00-05:00,"Hypes Field (Lebanon, IL)",50,MBA,2026
6509316,615041,UIndy Greyhounds,614971,McKendree Bearcats,614971,8,bot,Gavin Noreus struck out looking (3-2 BFFBBFK).,83,2026-03-07T16:00:00-05:00,"Hypes Field (Lebanon, IL)",50,MBA,2026
6509316,615041,UIndy Greyhounds,614971,McKendree Bearcats,614971,8,bot,Hunter Sherman pinch hit for Tyler Butash.,84,2026-03-07T16:00:00-05:00,"Hypes Field (Lebanon, IL)",50,MBA,2026
6509316,615041,UIndy Greyhounds,614971,McKendree Bearcats,614971,8,bot,Hunter Sherman reached on a fielder's choice to third base (1-0 B)3a Sage McMinn advanced to second3a Quest Hull out at third 3b unassisted.,85,2026-03-07T16:00:00-05:00,"Hypes Field (Lebanon, IL)",50,MBA,2026
6509316,615041,UIndy Greyhounds,614971,McKendree Bearcats,614971,8,bot,Kyle Richardson pinch ran for Hunter Sherman.,86,2026-03-07T16:00:00-05:00,"Hypes Field (Lebanon, IL)",50,MBA,2026
6509316,615041,UIndy Greyhounds,614971,McKendree Bearcats,614971,8,bot,Gabe Deaver flied out to cf (1-2 BKK).,87,2026-03-07T16:00:00-05:00,"Hypes Field (Lebanon, IL)",50,MBA,2026
6509316,615041,UIndy Greyhounds,614971,McKendree Bearcats,615041,9,top,Kyle Richardson to c.,88,2026-03-07T16:00:00-05:00,"Hypes Field (Lebanon, IL)",50,MBA,2026
6509316,615041,UIndy Greyhounds,614971,McKendree Bearcats,615041,9,top,Brayton Bowen struck out swinging (1-2 BKFS).,89,2026-03-07T16:00:00-05:00,"Hypes Field (Lebanon, IL)",50,MBA,2026
6509316,615041,UIndy Greyhounds,614971,McKendree Bearcats,615041,9,top,Joey Humphrey grounded out to 3b (1-1 BK).,90,2026-03-07T16:00:00-05:00,"Hypes Field (Lebanon, IL)",50,MBA,2026
6509316,615041,UIndy Greyhounds,614971,McKendree Bearcats,615041,9,top,Maddux Bach hit by pitch (2-0 BH).,91,2026-03-07T16:00:00-05:00,"Hypes Field (Lebanon, IL)",50,MBA,2026
6509316,615041,UIndy Greyhounds,614971,McKendree Bearcats,615041,9,top,"Ryan Degroot singled (1-1 BF)3a Maddux Bach advanced to third, out at home lf to ss to c.",92,2026-03-07T16:00:00-05:00,"Hypes Field (Lebanon, IL)",50,MBA,2026
6509316,615041,UIndy Greyhounds,614971,McKendree Bearcats,614971,9,bot,Peyton Bittle popped up to ss (1-1 BF).,93,2026-03-07T16:00:00-05:00,"Hypes Field (Lebanon, IL)",50,MBA,2026
6509316,615041,UIndy Greyhounds,614971,McKendree Bearcats,614971,9,bot,Max Meuli fouled out to 1b (0-0).,94,2026-03-07T16:00:00-05:00,"Hypes Field (Lebanon, IL)",50,MBA,2026
6509316,615041,UIndy Greyhounds,614971,McKendree Bearcats,614971,9,bot,Gavin Arseneau struck out swinging (2-2 KSBBS).,95,2026-03-07T16:00:00-05:00,"Hypes Field (Lebanon, IL)",50,MBA,2026
6509316,615041,UIndy Greyhounds,614971,McKendree Bearcats,615041,10,top,Austin Bode walked (3-2 SBBBKB).,96,2026-03-07T16:00:00-05:00,"Hypes Field (Lebanon, IL)",50,MBA,2026
6509316,615041,UIndy Greyhounds,614971,McKendree Bearcats,615041,10,top,Solen Munson grounded into double play 2b to ss to 1b (0-1 S)3a Austin Bode out on the play.,97,2026-03-07T16:00:00-05:00,"Hypes Field (Lebanon, IL)",50,MBA,2026
6509316,615041,UIndy Greyhounds,614971,McKendree Bearcats,615041,10,top,Chase Mason walked (3-0 BBBB).,98,2026-03-07T16:00:00-05:00,"Hypes Field (Lebanon, IL)",50,MBA,2026
6509316,615041,UIndy Greyhounds,614971,McKendree Bearcats,615041,10,top,Chase Mason stole second.,99,2026-03-07T16:00:00-05:00,"Hypes Field (Lebanon, IL)",50,MBA,2026
6509316,615041,UIndy Greyhounds,614971,McKendree Bearcats,615041,10,top,Chase Mason stole third.,100,2026-03-07T16:00:00-05:00,"Hypes Field (Lebanon, IL)",50,MBA,2026
6509316,615041,UIndy Greyhounds,614971,McKendree Bearcats,615041,10,top,Gavin Duran walked (3-1 KBBBB).,101,2026-03-07T16:00:00-05:00,"Hypes Field (Lebanon, IL)",50,MBA,2026
6509316,615041,UIndy Greyhounds,614971,McKendree Bearcats,615041,10,top,Gavin Duran stole second.,102,2026-03-07T16:00:00-05:00,"Hypes Field (Lebanon, IL)",50,MBA,2026
6509316,615041,UIndy Greyhounds,614971,McKendree Bearcats,615041,10,top,"Luke Smock singled, 2 RBI (1-2 BFK)3a Gavin Duran scored3a Chase Mason scored.",103,2026-03-07T16:00:00-05:00,"Hypes Field (Lebanon, IL)",50,MBA,2026
6509316,615041,UIndy Greyhounds,614971,McKendree Bearcats,615041,10,top,Luke Smock stole second.,104,2026-03-07T16:00:00-05:00,"Hypes Field (Lebanon, IL)",50,MBA,2026
6509316,615041,UIndy Greyhounds,614971,McKendree Bearcats,615041,10,top,Brayton Bowen walked (3-2 BFSBBB).,105,2026-03-07T16:00:00-05:00,"Hypes Field (Lebanon, IL)",50,MBA,2026
6509316,615041,UIndy Greyhounds,614971,McKendree Bearcats,615041,10,top,Ben Amador to p for Eli Dyer.,106,2026-03-07T16:00:00-05:00,"Hypes Field (Lebanon, IL)",50,MBA,2026
6509316,615041,UIndy Greyhounds,614971,McKendree Bearcats,615041,10,top,"Joey Humphrey reached first on an error by 3b, RBI (3-2 BKFBB)3a Brayton Bowen advanced to second3a Luke Smock scored, unearned.",107,2026-03-07T16:00:00-05:00,"Hypes Field (Lebanon, IL)",50,MBA,2026
6509316,615041,UIndy Greyhounds,614971,McKendree Bearcats,615041,10,top,Maddux Bach hit by pitch (3-2 KBBBFH)3a Joey Humphrey advanced to second3a Brayton Bowen advanced to third.,108,2026-03-07T16:00:00-05:00,"Hypes Field (Lebanon, IL)",50,MBA,2026
6509316,615041,UIndy Greyhounds,614971,McKendree Bearcats,615041,10,top,"Ryan Degroot walked, RBI (3-0 BBBB)3a Maddux Bach advanced to second3a Joey Humphrey advanced to third3a Brayton Bowen scored, unearned.",109,2026-03-07T16:00:00-05:00,"Hypes Field (Lebanon, IL)",50,MBA,2026
6509316,615041,UIndy Greyhounds,614971,McKendree Bearcats,615041,10,top,Austin Bode struck out looking (0-2 KFK).,110,2026-03-07T16:00:00-05:00,"Hypes Field (Lebanon, IL)",50,MBA,2026
6509316,615041,UIndy Greyhounds,614971,McKendree Bearcats,614971,10,bot,Javy Garcia struck out swinging (0-2 FSFS).,111,2026-03-07T16:00:00-05:00,"Hypes Field (Lebanon, IL)",50,MBA,2026
6509316,615041,UIndy Greyhounds,614971,McKendree Bearcats,614971,10,bot,Quest Hull struck out swinging (1-2 BKSS).,112,2026-03-07T16:00:00-05:00,"Hypes Field (Lebanon, IL)",50,MBA,2026
6509316,615041,UIndy Greyhounds,614971,McKendree Bearcats,614971,10,bot,Sage McMinn popped up to c (0-0).,113,2026-03-07T16:00:00-05:00,"Hypes Field (Lebanon, IL)",50,MBA,2026
