game_id,away_team_id,away_team_name,home_team_id,home_team_name,batting_team,inning,top_bot,event_text,event_num,game_datetime,stadium_name,attendance,sport_id,season
6509810,614686,Niagara Purple Eagles,614826,Merrimack Warriors,614686,1,top,Noah Konings grounded out to c (0-1 K).,1,2026-03-07T13:00:00-05:00,"North Andover, MA",0,MBA,2026
6509810,614686,Niagara Purple Eagles,614826,Merrimack Warriors,614686,1,top,Tyler Vivacqua singled to right field (0-0).,2,2026-03-07T13:00:00-05:00,"North Andover, MA",0,MBA,2026
6509810,614686,Niagara Purple Eagles,614826,Merrimack Warriors,614686,1,top,Rees Kozar reached on a fielder's choice (1-0 B)3a Tyler Vivacqua out at second 3b to 2b.,3,2026-03-07T13:00:00-05:00,"North Andover, MA",0,MBA,2026
6509810,614686,Niagara Purple Eagles,614826,Merrimack Warriors,614686,1,top,Nick Cote grounded out to 3b (0-1 S).,4,2026-03-07T13:00:00-05:00,"North Andover, MA",0,MBA,2026
6509810,614686,Niagara Purple Eagles,614826,Merrimack Warriors,614826,1,bot,DeShiro Matt struck out swinging (2-2 SBFBS).,5,2026-03-07T13:00:00-05:00,"North Andover, MA",0,MBA,2026
6509810,614686,Niagara Purple Eagles,614826,Merrimack Warriors,614826,1,bot,Hamilton Jayden fouled out to ss (0-1 K).,6,2026-03-07T13:00:00-05:00,"North Andover, MA",0,MBA,2026
6509810,614686,Niagara Purple Eagles,614826,Merrimack Warriors,614826,1,bot,Frammartino Joey singled to center field (2-2 KBKBFF).,7,2026-03-07T13:00:00-05:00,"North Andover, MA",0,MBA,2026
6509810,614686,Niagara Purple Eagles,614826,Merrimack Warriors,614826,1,bot,Frammartino Joey advanced to second on a passed ball.,8,2026-03-07T13:00:00-05:00,"North Andover, MA",0,MBA,2026
6509810,614686,Niagara Purple Eagles,614826,Merrimack Warriors,614826,1,bot,Greg Cristino flied out to cf (0-1 S).,9,2026-03-07T13:00:00-05:00,"North Andover, MA",0,MBA,2026
6509810,614686,Niagara Purple Eagles,614826,Merrimack Warriors,614686,2,top,Jacob Brooks struck out swinging (2-2 BBKFS).,10,2026-03-07T13:00:00-05:00,"North Andover, MA",0,MBA,2026
6509810,614686,Niagara Purple Eagles,614826,Merrimack Warriors,614686,2,top,Elijha Hammill grounded out to 1b unassisted (0-0).,11,2026-03-07T13:00:00-05:00,"North Andover, MA",0,MBA,2026
6509810,614686,Niagara Purple Eagles,614826,Merrimack Warriors,614686,2,top,Shawn Cameron singled to right field (2-2 BKBF).,12,2026-03-07T13:00:00-05:00,"North Andover, MA",0,MBA,2026
6509810,614686,Niagara Purple Eagles,614826,Merrimack Warriors,614686,2,top,Jason Green grounded out to 2b (0-0).,13,2026-03-07T13:00:00-05:00,"North Andover, MA",0,MBA,2026
6509810,614686,Niagara Purple Eagles,614826,Merrimack Warriors,614826,2,bot,Andrews Jack grounded out to 3b (3-2 KBBFFB).,14,2026-03-07T13:00:00-05:00,"North Andover, MA",0,MBA,2026
6509810,614686,Niagara Purple Eagles,614826,Merrimack Warriors,614826,2,bot,Craigue Brooks struck out swinging (0-2 KSS).,15,2026-03-07T13:00:00-05:00,"North Andover, MA",0,MBA,2026
6509810,614686,Niagara Purple Eagles,614826,Merrimack Warriors,614826,2,bot,McKinnon Brett walked (3-2 KBKBBB).,16,2026-03-07T13:00:00-05:00,"North Andover, MA",0,MBA,2026
6509810,614686,Niagara Purple Eagles,614826,Merrimack Warriors,614826,2,bot,Goode Chris flied out to rf (0-1 S).,17,2026-03-07T13:00:00-05:00,"North Andover, MA",0,MBA,2026
6509810,614686,Niagara Purple Eagles,614826,Merrimack Warriors,614686,3,top,Carmen Panaro grounded out to 1b unassisted (1-1 BS).,18,2026-03-07T13:00:00-05:00,"North Andover, MA",0,MBA,2026
6509810,614686,Niagara Purple Eagles,614826,Merrimack Warriors,614686,3,top,Noah Konings singled through the right side (1-0 B).,19,2026-03-07T13:00:00-05:00,"North Andover, MA",0,MBA,2026
6509810,614686,Niagara Purple Eagles,614826,Merrimack Warriors,614686,3,top,Tyler Vivacqua doubled down the lf line (0-0)3a Noah Konings advanced to third.,20,2026-03-07T13:00:00-05:00,"North Andover, MA",0,MBA,2026
6509810,614686,Niagara Purple Eagles,614826,Merrimack Warriors,614686,3,top,"Rees Kozar singled up the middle, RBI (2-2 KBFB)3a Tyler Vivacqua advanced to third3a Noah Konings scored.",21,2026-03-07T13:00:00-05:00,"North Andover, MA",0,MBA,2026
6509810,614686,Niagara Purple Eagles,614826,Merrimack Warriors,614686,3,top,Nick Cote popped up to rf (0-0).,22,2026-03-07T13:00:00-05:00,"North Andover, MA",0,MBA,2026
6509810,614686,Niagara Purple Eagles,614826,Merrimack Warriors,614686,3,top,Jacob Brooks reached on a fielder's choice (0-0)3a Rees Kozar out at second 3b to 2b.,23,2026-03-07T13:00:00-05:00,"North Andover, MA",0,MBA,2026
6509810,614686,Niagara Purple Eagles,614826,Merrimack Warriors,614826,3,bot,DePalma Jack grounded out to p (0-0).,24,2026-03-07T13:00:00-05:00,"North Andover, MA",0,MBA,2026
6509810,614686,Niagara Purple Eagles,614826,Merrimack Warriors,614826,3,bot,DeShiro Matt grounded out to 2b (3-2 SFFBBB).,25,2026-03-07T13:00:00-05:00,"North Andover, MA",0,MBA,2026
6509810,614686,Niagara Purple Eagles,614826,Merrimack Warriors,614826,3,bot,Hamilton Jayden struck out swinging (1-2 KBKS).,26,2026-03-07T13:00:00-05:00,"North Andover, MA",0,MBA,2026
6509810,614686,Niagara Purple Eagles,614826,Merrimack Warriors,614686,4,top,Elijha Hammill singled to center field (3-1 BFBB).,27,2026-03-07T13:00:00-05:00,"North Andover, MA",0,MBA,2026
6509810,614686,Niagara Purple Eagles,614826,Merrimack Warriors,614686,4,top,Shawn Cameron grounded out to 2b (1-0 B)3a Elijha Hammill advanced to second.,28,2026-03-07T13:00:00-05:00,"North Andover, MA",0,MBA,2026
6509810,614686,Niagara Purple Eagles,614826,Merrimack Warriors,614686,4,top,Jason Green struck out swinging (0-2 SSS).,29,2026-03-07T13:00:00-05:00,"North Andover, MA",0,MBA,2026
6509810,614686,Niagara Purple Eagles,614826,Merrimack Warriors,614686,4,top,"Carmen Panaro singled to left center, RBI (0-0)3a Elijha Hammill scored.",30,2026-03-07T13:00:00-05:00,"North Andover, MA",0,MBA,2026
6509810,614686,Niagara Purple Eagles,614826,Merrimack Warriors,614686,4,top,Noah Konings grounded out to ss (0-0).,31,2026-03-07T13:00:00-05:00,"North Andover, MA",0,MBA,2026
6509810,614686,Niagara Purple Eagles,614826,Merrimack Warriors,614826,4,bot,Frammartino Joey struck out swinging (1-2 BKFFS).,32,2026-03-07T13:00:00-05:00,"North Andover, MA",0,MBA,2026
6509810,614686,Niagara Purple Eagles,614826,Merrimack Warriors,614826,4,bot,Greg Cristino flied out to rf (3-1 BFBB).,33,2026-03-07T13:00:00-05:00,"North Andover, MA",0,MBA,2026
6509810,614686,Niagara Purple Eagles,614826,Merrimack Warriors,614826,4,bot,Andrews Jack flied out to rf (2-0 BB).,34,2026-03-07T13:00:00-05:00,"North Andover, MA",0,MBA,2026
6509810,614686,Niagara Purple Eagles,614826,Merrimack Warriors,614686,5,top,Tyler Vivacqua popped up to ss (1-1 BF).,35,2026-03-07T13:00:00-05:00,"North Andover, MA",0,MBA,2026
6509810,614686,Niagara Purple Eagles,614826,Merrimack Warriors,614686,5,top,Rees Kozar struck out swinging (2-2 BBKFS).,36,2026-03-07T13:00:00-05:00,"North Andover, MA",0,MBA,2026
6509810,614686,Niagara Purple Eagles,614826,Merrimack Warriors,614686,5,top,Nick Cote grounded out to 2b (0-2 KS).,37,2026-03-07T13:00:00-05:00,"North Andover, MA",0,MBA,2026
6509810,614686,Niagara Purple Eagles,614826,Merrimack Warriors,614826,5,bot,Craigue Brooks hit by pitch (1-1 SH).,38,2026-03-07T13:00:00-05:00,"North Andover, MA",0,MBA,2026
6509810,614686,Niagara Purple Eagles,614826,Merrimack Warriors,614826,5,bot,Craigue Brooks advanced to second on a passed ball.,39,2026-03-07T13:00:00-05:00,"North Andover, MA",0,MBA,2026
6509810,614686,Niagara Purple Eagles,614826,Merrimack Warriors,614826,5,bot,"McKinnon Brett struck out swinging, out at first c to 1b (2-2 KBSBS).",40,2026-03-07T13:00:00-05:00,"North Andover, MA",0,MBA,2026
6509810,614686,Niagara Purple Eagles,614826,Merrimack Warriors,614826,5,bot,Goode Chris struck out swinging (0-2 KSS).,41,2026-03-07T13:00:00-05:00,"North Andover, MA",0,MBA,2026
6509810,614686,Niagara Purple Eagles,614826,Merrimack Warriors,614826,5,bot,DePalma Jack struck out looking (3-2 BKBFFBK).,42,2026-03-07T13:00:00-05:00,"North Andover, MA",0,MBA,2026
6509810,614686,Niagara Purple Eagles,614826,Merrimack Warriors,614686,6,top,Jacob Brooks grounded out to ss (3-2 FBBBF).,43,2026-03-07T13:00:00-05:00,"North Andover, MA",0,MBA,2026
6509810,614686,Niagara Purple Eagles,614826,Merrimack Warriors,614686,6,top,Elijha Hammill singled to center field (1-0 B).,44,2026-03-07T13:00:00-05:00,"North Andover, MA",0,MBA,2026
6509810,614686,Niagara Purple Eagles,614826,Merrimack Warriors,614686,6,top,Shawn Cameron grounded out to ss (1-2 BKFF)3a Elijha Hammill advanced to second.,45,2026-03-07T13:00:00-05:00,"North Andover, MA",0,MBA,2026
6509810,614686,Niagara Purple Eagles,614826,Merrimack Warriors,614686,6,top,Jason Green flied out to rf (0-2 FS).,46,2026-03-07T13:00:00-05:00,"North Andover, MA",0,MBA,2026
6509810,614686,Niagara Purple Eagles,614826,Merrimack Warriors,614826,6,bot,DeShiro Matt flied out to cf (0-1 K).,47,2026-03-07T13:00:00-05:00,"North Andover, MA",0,MBA,2026
6509810,614686,Niagara Purple Eagles,614826,Merrimack Warriors,614826,6,bot,Hamilton Jayden flied out to lf (0-0).,48,2026-03-07T13:00:00-05:00,"North Andover, MA",0,MBA,2026
6509810,614686,Niagara Purple Eagles,614826,Merrimack Warriors,614826,6,bot,Frammartino Joey grounded out to 2b (3-2 KKBBFFB).,49,2026-03-07T13:00:00-05:00,"North Andover, MA",0,MBA,2026
6509810,614686,Niagara Purple Eagles,614826,Merrimack Warriors,614686,7,top,Bradshaw Michael to p for Hunkele Nick.,50,2026-03-07T13:00:00-05:00,"North Andover, MA",0,MBA,2026
6509810,614686,Niagara Purple Eagles,614826,Merrimack Warriors,614686,7,top,Carmen Panaro singled through the right side (3-2 BBFFBS).,51,2026-03-07T13:00:00-05:00,"North Andover, MA",0,MBA,2026
6509810,614686,Niagara Purple Eagles,614826,Merrimack Warriors,614686,7,top,Noah Konings singled (1-2 BKF)3a Carmen Panaro advanced to second.,52,2026-03-07T13:00:00-05:00,"North Andover, MA",0,MBA,2026
6509810,614686,Niagara Purple Eagles,614826,Merrimack Warriors,614686,7,top,Noah Konings advanced to second on a passed ball3a Carmen Panaro advanced to third on a passed ball.,53,2026-03-07T13:00:00-05:00,"North Andover, MA",0,MBA,2026
6509810,614686,Niagara Purple Eagles,614826,Merrimack Warriors,614686,7,top,"Tyler Vivacqua singled through the right side, 2 RBI (1-2 BFF)3a Noah Konings scored3a Carmen Panaro scored.",54,2026-03-07T13:00:00-05:00,"North Andover, MA",0,MBA,2026
6509810,614686,Niagara Purple Eagles,614826,Merrimack Warriors,614686,7,top,Tyler Vivacqua advanced to second on a passed ball.,55,2026-03-07T13:00:00-05:00,"North Andover, MA",0,MBA,2026
6509810,614686,Niagara Purple Eagles,614826,Merrimack Warriors,614686,7,top,Rees Kozar flied out to lf (1-2 BFF).,56,2026-03-07T13:00:00-05:00,"North Andover, MA",0,MBA,2026
6509810,614686,Niagara Purple Eagles,614826,Merrimack Warriors,614686,7,top,Curtis McKay pinch hit for Nick Cote.,57,2026-03-07T13:00:00-05:00,"North Andover, MA",0,MBA,2026
6509810,614686,Niagara Purple Eagles,614826,Merrimack Warriors,614686,7,top,Curtis McKay grounded into double play ss to 1b to 3b (0-1 F)3a Tyler Vivacqua out on the play.,58,2026-03-07T13:00:00-05:00,"North Andover, MA",0,MBA,2026
6509810,614686,Niagara Purple Eagles,614826,Merrimack Warriors,614826,7,bot,Greg Cristino singled (0-1 K).,59,2026-03-07T13:00:00-05:00,"North Andover, MA",0,MBA,2026
6509810,614686,Niagara Purple Eagles,614826,Merrimack Warriors,614826,7,bot,Andrews Jack struck out looking (3-2 FBBBFK).,60,2026-03-07T13:00:00-05:00,"North Andover, MA",0,MBA,2026
6509810,614686,Niagara Purple Eagles,614826,Merrimack Warriors,614826,7,bot,Craigue Brooks singled through the left side (3-2 BKBSB)3a Greg Cristino advanced to second.,61,2026-03-07T13:00:00-05:00,"North Andover, MA",0,MBA,2026
6509810,614686,Niagara Purple Eagles,614826,Merrimack Warriors,614826,7,bot,McKinnon Brett grounded into double play 3b to 1b (1-0 B)3a Greg Cristino out on the play.,62,2026-03-07T13:00:00-05:00,"North Andover, MA",0,MBA,2026
6509810,614686,Niagara Purple Eagles,614826,Merrimack Warriors,614686,8,top,Jacob Brooks singled up the middle (0-0).,63,2026-03-07T13:00:00-05:00,"North Andover, MA",0,MBA,2026
6509810,614686,Niagara Purple Eagles,614826,Merrimack Warriors,614686,8,top,Elijha Hammill lined out to 3b (1-1 KB)3a Jacob Brooks out at second 3b to 1b.,64,2026-03-07T13:00:00-05:00,"North Andover, MA",0,MBA,2026
6509810,614686,Niagara Purple Eagles,614826,Merrimack Warriors,614686,8,top,Shawn Cameron flied out to lf (0-1 F).,65,2026-03-07T13:00:00-05:00,"North Andover, MA",0,MBA,2026
6509810,614686,Niagara Purple Eagles,614826,Merrimack Warriors,614826,8,bot,Luke Glenn to p for Nate Bennett.,66,2026-03-07T13:00:00-05:00,"North Andover, MA",0,MBA,2026
6509810,614686,Niagara Purple Eagles,614826,Merrimack Warriors,614826,8,bot,Scanlon Christian pinch hit for Goode Chris.,67,2026-03-07T13:00:00-05:00,"North Andover, MA",0,MBA,2026
6509810,614686,Niagara Purple Eagles,614826,Merrimack Warriors,614826,8,bot,"Scanlon Christian grounded out to p, bunt (0-0).",68,2026-03-07T13:00:00-05:00,"North Andover, MA",0,MBA,2026
6509810,614686,Niagara Purple Eagles,614826,Merrimack Warriors,614826,8,bot,McGovern Garrett pinch hit for DePalma Jack.,69,2026-03-07T13:00:00-05:00,"North Andover, MA",0,MBA,2026
6509810,614686,Niagara Purple Eagles,614826,Merrimack Warriors,614826,8,bot,McGovern Garrett struck out looking (1-2 SBSK).,70,2026-03-07T13:00:00-05:00,"North Andover, MA",0,MBA,2026
6509810,614686,Niagara Purple Eagles,614826,Merrimack Warriors,614826,8,bot,DeShiro Matt grounded out to 2b (2-2 BFKB).,71,2026-03-07T13:00:00-05:00,"North Andover, MA",0,MBA,2026
6509810,614686,Niagara Purple Eagles,614826,Merrimack Warriors,614686,9,top,Scanlon Christian to cf.,72,2026-03-07T13:00:00-05:00,"North Andover, MA",0,MBA,2026
6509810,614686,Niagara Purple Eagles,614826,Merrimack Warriors,614686,9,top,McGovern Garrett to c.,73,2026-03-07T13:00:00-05:00,"North Andover, MA",0,MBA,2026
6509810,614686,Niagara Purple Eagles,614826,Merrimack Warriors,614686,9,top,Kieinser Chris to p for Bradshaw Michael.,74,2026-03-07T13:00:00-05:00,"North Andover, MA",0,MBA,2026
6509810,614686,Niagara Purple Eagles,614826,Merrimack Warriors,614686,9,top,Jason Green walked (3-0 BBBB).,75,2026-03-07T13:00:00-05:00,"North Andover, MA",0,MBA,2026
6509810,614686,Niagara Purple Eagles,614826,Merrimack Warriors,614686,9,top,Carmen Panaro reached on a fielder's choice (1-2 KFB)3a Jason Green out at second ss unassisted.,76,2026-03-07T13:00:00-05:00,"North Andover, MA",0,MBA,2026
6509810,614686,Niagara Purple Eagles,614826,Merrimack Warriors,614686,9,top,Noah Konings flied out to cf (0-0).,77,2026-03-07T13:00:00-05:00,"North Andover, MA",0,MBA,2026
6509810,614686,Niagara Purple Eagles,614826,Merrimack Warriors,614686,9,top,Tyler Vivacqua grounded out to ss (0-1 K).,78,2026-03-07T13:00:00-05:00,"North Andover, MA",0,MBA,2026
6509810,614686,Niagara Purple Eagles,614826,Merrimack Warriors,614826,9,bot,Andrew Damiani to p for Luke Glenn.,79,2026-03-07T13:00:00-05:00,"North Andover, MA",0,MBA,2026
6509810,614686,Niagara Purple Eagles,614826,Merrimack Warriors,614826,9,bot,Hamilton Jayden struck out swinging (1-2 KBFS).,80,2026-03-07T13:00:00-05:00,"North Andover, MA",0,MBA,2026
6509810,614686,Niagara Purple Eagles,614826,Merrimack Warriors,614826,9,bot,Frammartino Joey walked (3-2 BBBKKB).,81,2026-03-07T13:00:00-05:00,"North Andover, MA",0,MBA,2026
6509810,614686,Niagara Purple Eagles,614826,Merrimack Warriors,614826,9,bot,Frammartino Joey advanced to second on a passed ball.,82,2026-03-07T13:00:00-05:00,"North Andover, MA",0,MBA,2026
6509810,614686,Niagara Purple Eagles,614826,Merrimack Warriors,614826,9,bot,Greg Cristino singled to center field (2-1 BBK)3a Frammartino Joey advanced to third.,83,2026-03-07T13:00:00-05:00,"North Andover, MA",0,MBA,2026
6509810,614686,Niagara Purple Eagles,614826,Merrimack Warriors,614826,9,bot,Andrews Jack hit by pitch (2-1 BKH)3a Greg Cristino advanced to second.,84,2026-03-07T13:00:00-05:00,"North Andover, MA",0,MBA,2026
6509810,614686,Niagara Purple Eagles,614826,Merrimack Warriors,614826,9,bot,Craigue Brooks struck out swinging (0-2 KKFS).,85,2026-03-07T13:00:00-05:00,"North Andover, MA",0,MBA,2026
6509810,614686,Niagara Purple Eagles,614826,Merrimack Warriors,614826,9,bot,McKinnon Brett struck out swinging (0-2 KFS).,86,2026-03-07T13:00:00-05:00,"North Andover, MA",0,MBA,2026
