game_id,away_team_id,away_team_name,home_team_id,home_team_name,batting_team,inning,top_bot,event_text,event_num,game_datetime,stadium_name,attendance,sport_id,season
6512016,615279,Franciscan Barons,615447,Waynesburg Yellow Jackets,615279,1,top,Nicholas Peffer grounded out to p (0-0).,1,2026-03-24T16:00:00-04:00,"Waynesburg Field (Waynesburg, PA)",110,MBA,2026
6512016,615279,Franciscan Barons,615447,Waynesburg Yellow Jackets,615279,1,top,Andrew Hunton grounded out to ss (1-0 B).,2,2026-03-24T16:00:00-04:00,"Waynesburg Field (Waynesburg, PA)",110,MBA,2026
6512016,615279,Franciscan Barons,615447,Waynesburg Yellow Jackets,615279,1,top,Zachary Cook lined out to 2b (1-0 B).,3,2026-03-24T16:00:00-04:00,"Waynesburg Field (Waynesburg, PA)",110,MBA,2026
6512016,615279,Franciscan Barons,615447,Waynesburg Yellow Jackets,615447,1,bot,Jordan Mosley hit by pitch (3-2 KKBFBH).,4,2026-03-24T16:00:00-04:00,"Waynesburg Field (Waynesburg, PA)",110,MBA,2026
6512016,615279,Franciscan Barons,615447,Waynesburg Yellow Jackets,615447,1,bot,Hunter Hamilton walked (3-0 BBBB); Jordan Mosley advanced to second.,5,2026-03-24T16:00:00-04:00,"Waynesburg Field (Waynesburg, PA)",110,MBA,2026
6512016,615279,Franciscan Barons,615447,Waynesburg Yellow Jackets,615447,1,bot,Trent Giraffa reached on a fielder's choice (2-2 KBBFF); Hunter Hamilton out at second p to 2b; Jordan Mosley advanced to third.,6,2026-03-24T16:00:00-04:00,"Waynesburg Field (Waynesburg, PA)",110,MBA,2026
6512016,615279,Franciscan Barons,615447,Waynesburg Yellow Jackets,615447,1,bot,Jose Lopez walked (3-0 BBBB); Trent Giraffa advanced to second.,7,2026-03-24T16:00:00-04:00,"Waynesburg Field (Waynesburg, PA)",110,MBA,2026
6512016,615279,Franciscan Barons,615447,Waynesburg Yellow Jackets,615447,1,bot,"Mason Leonard singled to left field, 2 RBI (0-1 K); Jose Lopez advanced to second; Trent Giraffa scored; Jordan Mosley scored.",8,2026-03-24T16:00:00-04:00,"Waynesburg Field (Waynesburg, PA)",110,MBA,2026
6512016,615279,Franciscan Barons,615447,Waynesburg Yellow Jackets,615447,1,bot,"Weston Winchester singled to right center, RBI (2-1 FBB); Mason Leonard advanced to second; Jose Lopez scored.",9,2026-03-24T16:00:00-04:00,"Waynesburg Field (Waynesburg, PA)",110,MBA,2026
6512016,615279,Franciscan Barons,615447,Waynesburg Yellow Jackets,615447,1,bot,Sam Watson struck out looking (1-2 SBFK).,10,2026-03-24T16:00:00-04:00,"Waynesburg Field (Waynesburg, PA)",110,MBA,2026
6512016,615279,Franciscan Barons,615447,Waynesburg Yellow Jackets,615447,1,bot,Noah Gabriel flied out to lf (0-0).,11,2026-03-24T16:00:00-04:00,"Waynesburg Field (Waynesburg, PA)",110,MBA,2026
6512016,615279,Franciscan Barons,615447,Waynesburg Yellow Jackets,615279,2,top,Josiah Bodie singled through the left side (2-1 BFB).,12,2026-03-24T16:00:00-04:00,"Waynesburg Field (Waynesburg, PA)",110,MBA,2026
6512016,615279,Franciscan Barons,615447,Waynesburg Yellow Jackets,615279,2,top,"Matteo Lindia doubled to right center, RBI (1-0 B); Josiah Bodie scored.",13,2026-03-24T16:00:00-04:00,"Waynesburg Field (Waynesburg, PA)",110,MBA,2026
6512016,615279,Franciscan Barons,615447,Waynesburg Yellow Jackets,615279,2,top,"Michael Manocchio singled to right field, RBI (3-2 SBBFB); Matteo Lindia scored.",14,2026-03-24T16:00:00-04:00,"Waynesburg Field (Waynesburg, PA)",110,MBA,2026
6512016,615279,Franciscan Barons,615447,Waynesburg Yellow Jackets,615279,2,top,Michael Manocchio stole second.,15,2026-03-24T16:00:00-04:00,"Waynesburg Field (Waynesburg, PA)",110,MBA,2026
6512016,615279,Franciscan Barons,615447,Waynesburg Yellow Jackets,615279,2,top,"Aidan McKito singled to right field, RBI (3-1 BBBK); Michael Manocchio scored.",16,2026-03-24T16:00:00-04:00,"Waynesburg Field (Waynesburg, PA)",110,MBA,2026
6512016,615279,Franciscan Barons,615447,Waynesburg Yellow Jackets,615279,2,top,Holden Armstrong hit by pitch (1-0 H); Aidan McKito advanced to second.,17,2026-03-24T16:00:00-04:00,"Waynesburg Field (Waynesburg, PA)",110,MBA,2026
6512016,615279,Franciscan Barons,615447,Waynesburg Yellow Jackets,615279,2,top,Austun Runtas to p for Zander Allen.,18,2026-03-24T16:00:00-04:00,"Waynesburg Field (Waynesburg, PA)",110,MBA,2026
6512016,615279,Franciscan Barons,615447,Waynesburg Yellow Jackets,615279,2,top,John Nemmers walked (3-2 KKBFFBBB); Holden Armstrong advanced to second; Aidan McKito advanced to third.,19,2026-03-24T16:00:00-04:00,"Waynesburg Field (Waynesburg, PA)",110,MBA,2026
6512016,615279,Franciscan Barons,615447,Waynesburg Yellow Jackets,615279,2,top,"Nicholas Peffer doubled to right field, 2 RBI (2-0 BB); John Nemmers advanced to third; Holden Armstrong scored; Aidan McKito scored.",20,2026-03-24T16:00:00-04:00,"Waynesburg Field (Waynesburg, PA)",110,MBA,2026
6512016,615279,Franciscan Barons,615447,Waynesburg Yellow Jackets,615279,2,top,Andrew Hunton grounded out to p (1-2 SBF).,21,2026-03-24T16:00:00-04:00,"Waynesburg Field (Waynesburg, PA)",110,MBA,2026
6512016,615279,Franciscan Barons,615447,Waynesburg Yellow Jackets,615279,2,top,"Zachary Cook singled to second base, RBI (1-1 FB); Nicholas Peffer advanced to third, scored on a throwing error by 2b, unearned; John Nemmers scored.",22,2026-03-24T16:00:00-04:00,"Waynesburg Field (Waynesburg, PA)",110,MBA,2026
6512016,615279,Franciscan Barons,615447,Waynesburg Yellow Jackets,615279,2,top,Zach Scibelli to p for Austun Runtas.,23,2026-03-24T16:00:00-04:00,"Waynesburg Field (Waynesburg, PA)",110,MBA,2026
6512016,615279,Franciscan Barons,615447,Waynesburg Yellow Jackets,615279,2,top,Zachary Cook advanced to second on a balk.,24,2026-03-24T16:00:00-04:00,"Waynesburg Field (Waynesburg, PA)",110,MBA,2026
6512016,615279,Franciscan Barons,615447,Waynesburg Yellow Jackets,615279,2,top,Josiah Bodie flied out to rf (0-2 KF).,25,2026-03-24T16:00:00-04:00,"Waynesburg Field (Waynesburg, PA)",110,MBA,2026
6512016,615279,Franciscan Barons,615447,Waynesburg Yellow Jackets,615279,2,top,Matteo Lindia struck out swinging (1-2 KSBS).,26,2026-03-24T16:00:00-04:00,"Waynesburg Field (Waynesburg, PA)",110,MBA,2026
6512016,615279,Franciscan Barons,615447,Waynesburg Yellow Jackets,615447,2,bot,Kaden Flambard grounded out to ss (2-1 BBK).,27,2026-03-24T16:00:00-04:00,"Waynesburg Field (Waynesburg, PA)",110,MBA,2026
6512016,615279,Franciscan Barons,615447,Waynesburg Yellow Jackets,615447,2,bot,Jordan Mosley reached first on an error by 1b (3-2 KSBBB).,28,2026-03-24T16:00:00-04:00,"Waynesburg Field (Waynesburg, PA)",110,MBA,2026
6512016,615279,Franciscan Barons,615447,Waynesburg Yellow Jackets,615447,2,bot,Hunter Hamilton doubled down the lf line (1-0 B); Jordan Mosley advanced to third.,29,2026-03-24T16:00:00-04:00,"Waynesburg Field (Waynesburg, PA)",110,MBA,2026
6512016,615279,Franciscan Barons,615447,Waynesburg Yellow Jackets,615447,2,bot,"Trent Giraffa grounded out to ss, RBI (0-0); Hunter Hamilton advanced to third; Jordan Mosley scored.",30,2026-03-24T16:00:00-04:00,"Waynesburg Field (Waynesburg, PA)",110,MBA,2026
6512016,615279,Franciscan Barons,615447,Waynesburg Yellow Jackets,615447,2,bot,Jose Lopez hit by pitch (1-0 H).,31,2026-03-24T16:00:00-04:00,"Waynesburg Field (Waynesburg, PA)",110,MBA,2026
6512016,615279,Franciscan Barons,615447,Waynesburg Yellow Jackets,615447,2,bot,Jose Lopez stole second.,32,2026-03-24T16:00:00-04:00,"Waynesburg Field (Waynesburg, PA)",110,MBA,2026
6512016,615279,Franciscan Barons,615447,Waynesburg Yellow Jackets,615447,2,bot,Mason Leonard walked (3-1 BBSBB).,33,2026-03-24T16:00:00-04:00,"Waynesburg Field (Waynesburg, PA)",110,MBA,2026
6512016,615279,Franciscan Barons,615447,Waynesburg Yellow Jackets,615447,2,bot,Evan Speicher to p for Harold Gildehaus.,34,2026-03-24T16:00:00-04:00,"Waynesburg Field (Waynesburg, PA)",110,MBA,2026
6512016,615279,Franciscan Barons,615447,Waynesburg Yellow Jackets,615447,2,bot,Weston Winchester popped up to 2b (1-1 BS).,35,2026-03-24T16:00:00-04:00,"Waynesburg Field (Waynesburg, PA)",110,MBA,2026
6512016,615279,Franciscan Barons,615447,Waynesburg Yellow Jackets,615279,3,top,Michael Manocchio walked (3-2 BBBKFFB).,36,2026-03-24T16:00:00-04:00,"Waynesburg Field (Waynesburg, PA)",110,MBA,2026
6512016,615279,Franciscan Barons,615447,Waynesburg Yellow Jackets,615279,3,top,Aidan McKito reached on a fielder's choice (1-0 B); Michael Manocchio out at second 3b to 2b.,37,2026-03-24T16:00:00-04:00,"Waynesburg Field (Waynesburg, PA)",110,MBA,2026
6512016,615279,Franciscan Barons,615447,Waynesburg Yellow Jackets,615279,3,top,Holden Armstrong reached on a fielder's choice (0-1 K); Aidan McKito out at second p to 2b.,38,2026-03-24T16:00:00-04:00,"Waynesburg Field (Waynesburg, PA)",110,MBA,2026
6512016,615279,Franciscan Barons,615447,Waynesburg Yellow Jackets,615279,3,top,"John Nemmers doubled to left center, RBI (0-0); Holden Armstrong scored.",39,2026-03-24T16:00:00-04:00,"Waynesburg Field (Waynesburg, PA)",110,MBA,2026
6512016,615279,Franciscan Barons,615447,Waynesburg Yellow Jackets,615279,3,top,John Nemmers advanced to third on a wild pitch.,40,2026-03-24T16:00:00-04:00,"Waynesburg Field (Waynesburg, PA)",110,MBA,2026
6512016,615279,Franciscan Barons,615447,Waynesburg Yellow Jackets,615279,3,top,Nicholas Peffer flied out to lf (2-2 FBBF).,41,2026-03-24T16:00:00-04:00,"Waynesburg Field (Waynesburg, PA)",110,MBA,2026
6512016,615279,Franciscan Barons,615447,Waynesburg Yellow Jackets,615447,3,bot,"Sam Watson reached first on a throwing error by 3b, advanced to second (1-2 BFS).",42,2026-03-24T16:00:00-04:00,"Waynesburg Field (Waynesburg, PA)",110,MBA,2026
6512016,615279,Franciscan Barons,615447,Waynesburg Yellow Jackets,615447,3,bot,"Noah Gabriel reached first on an error by p, SAC, bunt (0-1 F); Sam Watson scored, unearned.",43,2026-03-24T16:00:00-04:00,"Waynesburg Field (Waynesburg, PA)",110,MBA,2026
6512016,615279,Franciscan Barons,615447,Waynesburg Yellow Jackets,615447,3,bot,"Kaden Flambard hit by pitch (0-0); Noah Gabriel advanced to third, scored on a throwing error by 1b, unearned.",44,2026-03-24T16:00:00-04:00,"Waynesburg Field (Waynesburg, PA)",110,MBA,2026
6512016,615279,Franciscan Barons,615447,Waynesburg Yellow Jackets,615447,3,bot,Jordan Mosley grounded out to c (0-0); Kaden Flambard advanced to second.,45,2026-03-24T16:00:00-04:00,"Waynesburg Field (Waynesburg, PA)",110,MBA,2026
6512016,615279,Franciscan Barons,615447,Waynesburg Yellow Jackets,615447,3,bot,Hunter Hamilton grounded out to 3b (0-0); Kaden Flambard advanced to third.,46,2026-03-24T16:00:00-04:00,"Waynesburg Field (Waynesburg, PA)",110,MBA,2026
6512016,615279,Franciscan Barons,615447,Waynesburg Yellow Jackets,615447,3,bot,Trent Giraffa flied out to rf (0-0).,47,2026-03-24T16:00:00-04:00,"Waynesburg Field (Waynesburg, PA)",110,MBA,2026
6512016,615279,Franciscan Barons,615447,Waynesburg Yellow Jackets,615279,4,top,Josh Mosley to p for Zach Scibelli.,48,2026-03-24T16:00:00-04:00,"Waynesburg Field (Waynesburg, PA)",110,MBA,2026
6512016,615279,Franciscan Barons,615447,Waynesburg Yellow Jackets,615279,4,top,Andrew Hunton struck out swinging (0-2 KSFS).,49,2026-03-24T16:00:00-04:00,"Waynesburg Field (Waynesburg, PA)",110,MBA,2026
6512016,615279,Franciscan Barons,615447,Waynesburg Yellow Jackets,615279,4,top,Zachary Cook struck out swinging (2-2 BKSBS).,50,2026-03-24T16:00:00-04:00,"Waynesburg Field (Waynesburg, PA)",110,MBA,2026
6512016,615279,Franciscan Barons,615447,Waynesburg Yellow Jackets,615279,4,top,Josiah Bodie flied out to cf (2-2 SBKB).,51,2026-03-24T16:00:00-04:00,"Waynesburg Field (Waynesburg, PA)",110,MBA,2026
6512016,615279,Franciscan Barons,615447,Waynesburg Yellow Jackets,615447,4,bot,Jose Lopez hit by pitch (3-1 KBBH).,52,2026-03-24T16:00:00-04:00,"Waynesburg Field (Waynesburg, PA)",110,MBA,2026
6512016,615279,Franciscan Barons,615447,Waynesburg Yellow Jackets,615447,4,bot,"Mason Leonard grounded out to p, SAC, bunt (1-1 FB); Jose Lopez advanced to second.",53,2026-03-24T16:00:00-04:00,"Waynesburg Field (Waynesburg, PA)",110,MBA,2026
6512016,615279,Franciscan Barons,615447,Waynesburg Yellow Jackets,615447,4,bot,Weston Winchester flied out to rf (0-0); Jose Lopez advanced to third.,54,2026-03-24T16:00:00-04:00,"Waynesburg Field (Waynesburg, PA)",110,MBA,2026
6512016,615279,Franciscan Barons,615447,Waynesburg Yellow Jackets,615447,4,bot,Sam Watson struck out swinging (1-2 FBFS).,55,2026-03-24T16:00:00-04:00,"Waynesburg Field (Waynesburg, PA)",110,MBA,2026
6512016,615279,Franciscan Barons,615447,Waynesburg Yellow Jackets,615279,5,top,Matteo Lindia grounded out to ss (0-0).,56,2026-03-24T16:00:00-04:00,"Waynesburg Field (Waynesburg, PA)",110,MBA,2026
6512016,615279,Franciscan Barons,615447,Waynesburg Yellow Jackets,615279,5,top,Michael Manocchio fouled out to 3b (0-1 K).,57,2026-03-24T16:00:00-04:00,"Waynesburg Field (Waynesburg, PA)",110,MBA,2026
6512016,615279,Franciscan Barons,615447,Waynesburg Yellow Jackets,615279,5,top,Aidan McKito singled to left center (2-2 KBBKFF).,58,2026-03-24T16:00:00-04:00,"Waynesburg Field (Waynesburg, PA)",110,MBA,2026
6512016,615279,Franciscan Barons,615447,Waynesburg Yellow Jackets,615279,5,top,Aidan McKito stole second.,59,2026-03-24T16:00:00-04:00,"Waynesburg Field (Waynesburg, PA)",110,MBA,2026
6512016,615279,Franciscan Barons,615447,Waynesburg Yellow Jackets,615279,5,top,Holden Armstrong popped up to rf (0-2 KS).,60,2026-03-24T16:00:00-04:00,"Waynesburg Field (Waynesburg, PA)",110,MBA,2026
6512016,615279,Franciscan Barons,615447,Waynesburg Yellow Jackets,615447,5,bot,Noah Gabriel singled to third base (0-0).,61,2026-03-24T16:00:00-04:00,"Waynesburg Field (Waynesburg, PA)",110,MBA,2026
6512016,615279,Franciscan Barons,615447,Waynesburg Yellow Jackets,615447,5,bot,"Noah Gabriel out at second c to 2b, caught stealing.",62,2026-03-24T16:00:00-04:00,"Waynesburg Field (Waynesburg, PA)",110,MBA,2026
6512016,615279,Franciscan Barons,615447,Waynesburg Yellow Jackets,615447,5,bot,Kaden Flambard struck out swinging (2-2 FBKBFS).,63,2026-03-24T16:00:00-04:00,"Waynesburg Field (Waynesburg, PA)",110,MBA,2026
6512016,615279,Franciscan Barons,615447,Waynesburg Yellow Jackets,615447,5,bot,Jordan Mosley struck out looking (1-2 KBKK).,64,2026-03-24T16:00:00-04:00,"Waynesburg Field (Waynesburg, PA)",110,MBA,2026
6512016,615279,Franciscan Barons,615447,Waynesburg Yellow Jackets,615279,6,top,Mike McReady to p for Josh Mosley.,65,2026-03-24T16:00:00-04:00,"Waynesburg Field (Waynesburg, PA)",110,MBA,2026
6512016,615279,Franciscan Barons,615447,Waynesburg Yellow Jackets,615279,6,top,John Nemmers flied out to lf (0-0).,66,2026-03-24T16:00:00-04:00,"Waynesburg Field (Waynesburg, PA)",110,MBA,2026
6512016,615279,Franciscan Barons,615447,Waynesburg Yellow Jackets,615279,6,top,"Nicholas Peffer singled, bunt (0-1 K).",67,2026-03-24T16:00:00-04:00,"Waynesburg Field (Waynesburg, PA)",110,MBA,2026
6512016,615279,Franciscan Barons,615447,Waynesburg Yellow Jackets,615279,6,top,"Andrew Hunton grounded out to p, SAC, bunt (0-0); Nicholas Peffer advanced to second.",68,2026-03-24T16:00:00-04:00,"Waynesburg Field (Waynesburg, PA)",110,MBA,2026
6512016,615279,Franciscan Barons,615447,Waynesburg Yellow Jackets,615279,6,top,"Zachary Cook doubled to right field, RBI (2-1 BBF); Nicholas Peffer scored.",69,2026-03-24T16:00:00-04:00,"Waynesburg Field (Waynesburg, PA)",110,MBA,2026
6512016,615279,Franciscan Barons,615447,Waynesburg Yellow Jackets,615279,6,top,"Josiah Bodie doubled to left field, RBI (0-1 F); Zachary Cook scored.",70,2026-03-24T16:00:00-04:00,"Waynesburg Field (Waynesburg, PA)",110,MBA,2026
6512016,615279,Franciscan Barons,615447,Waynesburg Yellow Jackets,615279,6,top,Nick Manko to p for Mike McReady.,71,2026-03-24T16:00:00-04:00,"Waynesburg Field (Waynesburg, PA)",110,MBA,2026
6512016,615279,Franciscan Barons,615447,Waynesburg Yellow Jackets,615279,6,top,Matteo Lindia flied out to cf (3-2 BBKFFFB).,72,2026-03-24T16:00:00-04:00,"Waynesburg Field (Waynesburg, PA)",110,MBA,2026
6512016,615279,Franciscan Barons,615447,Waynesburg Yellow Jackets,615447,6,bot,Vincent Patts to p for Evan Speicher.,73,2026-03-24T16:00:00-04:00,"Waynesburg Field (Waynesburg, PA)",110,MBA,2026
6512016,615279,Franciscan Barons,615447,Waynesburg Yellow Jackets,615447,6,bot,Hunter Hamilton flied out to lf (0-0).,74,2026-03-24T16:00:00-04:00,"Waynesburg Field (Waynesburg, PA)",110,MBA,2026
6512016,615279,Franciscan Barons,615447,Waynesburg Yellow Jackets,615447,6,bot,Trent Giraffa grounded out to p (2-1 BBK).,75,2026-03-24T16:00:00-04:00,"Waynesburg Field (Waynesburg, PA)",110,MBA,2026
6512016,615279,Franciscan Barons,615447,Waynesburg Yellow Jackets,615447,6,bot,Jose Lopez hit by pitch (3-2 SBKBBH).,76,2026-03-24T16:00:00-04:00,"Waynesburg Field (Waynesburg, PA)",110,MBA,2026
6512016,615279,Franciscan Barons,615447,Waynesburg Yellow Jackets,615447,6,bot,"Mason Leonard doubled to right field, RBI (1-0 B); Jose Lopez scored.",77,2026-03-24T16:00:00-04:00,"Waynesburg Field (Waynesburg, PA)",110,MBA,2026
6512016,615279,Franciscan Barons,615447,Waynesburg Yellow Jackets,615447,6,bot,Weston Winchester flied out to cf (0-1 K).,78,2026-03-24T16:00:00-04:00,"Waynesburg Field (Waynesburg, PA)",110,MBA,2026
6512016,615279,Franciscan Barons,615447,Waynesburg Yellow Jackets,615279,7,top,Mo Kiger to p for Nick Manko.,79,2026-03-24T16:00:00-04:00,"Waynesburg Field (Waynesburg, PA)",110,MBA,2026
6512016,615279,Franciscan Barons,615447,Waynesburg Yellow Jackets,615279,7,top,Michael Manocchio grounded out to 1b unassisted (1-2 KBK).,80,2026-03-24T16:00:00-04:00,"Waynesburg Field (Waynesburg, PA)",110,MBA,2026
6512016,615279,Franciscan Barons,615447,Waynesburg Yellow Jackets,615279,7,top,Aidan McKito grounded out to 3b (1-1 KB).,81,2026-03-24T16:00:00-04:00,"Waynesburg Field (Waynesburg, PA)",110,MBA,2026
6512016,615279,Franciscan Barons,615447,Waynesburg Yellow Jackets,615279,7,top,Holden Armstrong hit by pitch (1-2 SKFH).,82,2026-03-24T16:00:00-04:00,"Waynesburg Field (Waynesburg, PA)",110,MBA,2026
6512016,615279,Franciscan Barons,615447,Waynesburg Yellow Jackets,615279,7,top,Holden Armstrong stole second.,83,2026-03-24T16:00:00-04:00,"Waynesburg Field (Waynesburg, PA)",110,MBA,2026
6512016,615279,Franciscan Barons,615447,Waynesburg Yellow Jackets,615279,7,top,"John Nemmers reached first on a throwing error by 3b, advanced to second (1-0 B); Holden Armstrong scored, unearned.",84,2026-03-24T16:00:00-04:00,"Waynesburg Field (Waynesburg, PA)",110,MBA,2026
6512016,615279,Franciscan Barons,615447,Waynesburg Yellow Jackets,615279,7,top,"Nicholas Peffer doubled to left field, RBI (2-1 BBF); John Nemmers scored, unearned.",85,2026-03-24T16:00:00-04:00,"Waynesburg Field (Waynesburg, PA)",110,MBA,2026
6512016,615279,Franciscan Barons,615447,Waynesburg Yellow Jackets,615279,7,top,Nicholas Peffer advanced to third on a wild pitch.,86,2026-03-24T16:00:00-04:00,"Waynesburg Field (Waynesburg, PA)",110,MBA,2026
6512016,615279,Franciscan Barons,615447,Waynesburg Yellow Jackets,615279,7,top,"Andrew Hunton doubled to right center, RBI (3-2 KKBBB); Nicholas Peffer scored, unearned.",87,2026-03-24T16:00:00-04:00,"Waynesburg Field (Waynesburg, PA)",110,MBA,2026
6512016,615279,Franciscan Barons,615447,Waynesburg Yellow Jackets,615279,7,top,Hudson Pincavitch to p for Mo Kiger.,88,2026-03-24T16:00:00-04:00,"Waynesburg Field (Waynesburg, PA)",110,MBA,2026
6512016,615279,Franciscan Barons,615447,Waynesburg Yellow Jackets,615279,7,top,Zachary Cook grounded out to 2b (1-0 B).,89,2026-03-24T16:00:00-04:00,"Waynesburg Field (Waynesburg, PA)",110,MBA,2026
6512016,615279,Franciscan Barons,615447,Waynesburg Yellow Jackets,615447,7,bot,Hunter Mamie pinch hit for Sam Watson.,90,2026-03-24T16:00:00-04:00,"Waynesburg Field (Waynesburg, PA)",110,MBA,2026
6512016,615279,Franciscan Barons,615447,Waynesburg Yellow Jackets,615447,7,bot,Hunter Mamie flied out to cf (0-0).,91,2026-03-24T16:00:00-04:00,"Waynesburg Field (Waynesburg, PA)",110,MBA,2026
6512016,615279,Franciscan Barons,615447,Waynesburg Yellow Jackets,615447,7,bot,Noah Gabriel flied out to cf (0-0).,92,2026-03-24T16:00:00-04:00,"Waynesburg Field (Waynesburg, PA)",110,MBA,2026
6512016,615279,Franciscan Barons,615447,Waynesburg Yellow Jackets,615447,7,bot,Kaden Flambard hit by pitch (2-2 BKFH).,93,2026-03-24T16:00:00-04:00,"Waynesburg Field (Waynesburg, PA)",110,MBA,2026
6512016,615279,Franciscan Barons,615447,Waynesburg Yellow Jackets,615447,7,bot,Jordan Mosley flied out to rf (1-0 B).,94,2026-03-24T16:00:00-04:00,"Waynesburg Field (Waynesburg, PA)",110,MBA,2026
6512016,615279,Franciscan Barons,615447,Waynesburg Yellow Jackets,615279,8,top,Hunter Mamie to c.,95,2026-03-24T16:00:00-04:00,"Waynesburg Field (Waynesburg, PA)",110,MBA,2026
6512016,615279,Franciscan Barons,615447,Waynesburg Yellow Jackets,615279,8,top,Connor Lolli to lf for Andrew Hunton.,96,2026-03-24T16:00:00-04:00,"Waynesburg Field (Waynesburg, PA)",110,MBA,2026
6512016,615279,Franciscan Barons,615447,Waynesburg Yellow Jackets,615279,8,top,Josiah Bodie flied out to cf (0-0).,97,2026-03-24T16:00:00-04:00,"Waynesburg Field (Waynesburg, PA)",110,MBA,2026
6512016,615279,Franciscan Barons,615447,Waynesburg Yellow Jackets,615279,8,top,Matteo Lindia grounded out to 1b unassisted (1-0 B).,98,2026-03-24T16:00:00-04:00,"Waynesburg Field (Waynesburg, PA)",110,MBA,2026
6512016,615279,Franciscan Barons,615447,Waynesburg Yellow Jackets,615279,8,top,Michael Manocchio grounded out to 2b (0-1 F).,99,2026-03-24T16:00:00-04:00,"Waynesburg Field (Waynesburg, PA)",110,MBA,2026
6512016,615279,Franciscan Barons,615447,Waynesburg Yellow Jackets,615447,8,bot,Hunter Hamilton hit by pitch (2-2 FBFH).,100,2026-03-24T16:00:00-04:00,"Waynesburg Field (Waynesburg, PA)",110,MBA,2026
6512016,615279,Franciscan Barons,615447,Waynesburg Yellow Jackets,615447,8,bot,Trent Giraffa grounded out to 3b (1-1 KB); Hunter Hamilton advanced to second.,101,2026-03-24T16:00:00-04:00,"Waynesburg Field (Waynesburg, PA)",110,MBA,2026
6512016,615279,Franciscan Barons,615447,Waynesburg Yellow Jackets,615447,8,bot,Jose Lopez lined into double play 2b (0-1 K); Hunter Hamilton out on the play.,102,2026-03-24T16:00:00-04:00,"Waynesburg Field (Waynesburg, PA)",110,MBA,2026
6512016,615279,Franciscan Barons,615447,Waynesburg Yellow Jackets,615279,9,top,Aidan McKito lined out to ss (0-1 K).,103,2026-03-24T16:00:00-04:00,"Waynesburg Field (Waynesburg, PA)",110,MBA,2026
6512016,615279,Franciscan Barons,615447,Waynesburg Yellow Jackets,615279,9,top,Holden Armstrong flied out to rf (1-1 KB).,104,2026-03-24T16:00:00-04:00,"Waynesburg Field (Waynesburg, PA)",110,MBA,2026
6512016,615279,Franciscan Barons,615447,Waynesburg Yellow Jackets,615279,9,top,John Nemmers popped up to 3b (3-1 BFBB).,105,2026-03-24T16:00:00-04:00,"Waynesburg Field (Waynesburg, PA)",110,MBA,2026
6512016,615279,Franciscan Barons,615447,Waynesburg Yellow Jackets,615447,9,bot,Mason Leonard grounded out to ss (0-1 F).,106,2026-03-24T16:00:00-04:00,"Waynesburg Field (Waynesburg, PA)",110,MBA,2026
6512016,615279,Franciscan Barons,615447,Waynesburg Yellow Jackets,615447,9,bot,Weston Winchester grounded out to 1b unassisted (1-0 B).,107,2026-03-24T16:00:00-04:00,"Waynesburg Field (Waynesburg, PA)",110,MBA,2026
6512016,615279,Franciscan Barons,615447,Waynesburg Yellow Jackets,615447,9,bot,Hunter Mamie grounded out to ss (2-2 KBBK).,108,2026-03-24T16:00:00-04:00,"Waynesburg Field (Waynesburg, PA)",110,MBA,2026
