game_id,away_team_id,away_team_name,home_team_id,home_team_name,batting_team,inning,top_bot,event_text,event_num,game_datetime,stadium_name,attendance,sport_id,season
6517643,614990,Okla. Baptist Bison,614918,Ark.-Monticello Boll Weevils,614990,1,top,L. Schaefer struck out looking.,1,2026-02-21T16:00:00-05:00,"Weevils Field (Monticello, AR)",135,MBA,2026
6517643,614990,Okla. Baptist Bison,614918,Ark.-Monticello Boll Weevils,614990,1,top,"Q. Johnson homered to right center, RBI.",2,2026-02-21T16:00:00-05:00,"Weevils Field (Monticello, AR)",135,MBA,2026
6517643,614990,Okla. Baptist Bison,614918,Ark.-Monticello Boll Weevils,614990,1,top,T. Amosa fouled out to 3b.,3,2026-02-21T16:00:00-05:00,"Weevils Field (Monticello, AR)",135,MBA,2026
6517643,614990,Okla. Baptist Bison,614918,Ark.-Monticello Boll Weevils,614990,1,top,"Z. Bennett singled to right field, out at second rf to ss.",4,2026-02-21T16:00:00-05:00,"Weevils Field (Monticello, AR)",135,MBA,2026
6517643,614990,Okla. Baptist Bison,614918,Ark.-Monticello Boll Weevils,614918,1,bot,C. Tanner singled to left field.,5,2026-02-21T16:00:00-05:00,"Weevils Field (Monticello, AR)",135,MBA,2026
6517643,614990,Okla. Baptist Bison,614918,Ark.-Monticello Boll Weevils,614918,1,bot,D. Lizarraga flied out to rf.,6,2026-02-21T16:00:00-05:00,"Weevils Field (Monticello, AR)",135,MBA,2026
6517643,614990,Okla. Baptist Bison,614918,Ark.-Monticello Boll Weevils,614918,1,bot,E. Olaybal struck out looking.,7,2026-02-21T16:00:00-05:00,"Weevils Field (Monticello, AR)",135,MBA,2026
6517643,614990,Okla. Baptist Bison,614918,Ark.-Monticello Boll Weevils,614918,1,bot,G. Kuttenkul struck out swinging.,8,2026-02-21T16:00:00-05:00,"Weevils Field (Monticello, AR)",135,MBA,2026
6517643,614990,Okla. Baptist Bison,614918,Ark.-Monticello Boll Weevils,614990,2,top,K. Morris struck out swinging.,9,2026-02-21T16:00:00-05:00,"Weevils Field (Monticello, AR)",135,MBA,2026
6517643,614990,Okla. Baptist Bison,614918,Ark.-Monticello Boll Weevils,614990,2,top,K. Latimer singled to left field.,10,2026-02-21T16:00:00-05:00,"Weevils Field (Monticello, AR)",135,MBA,2026
6517643,614990,Okla. Baptist Bison,614918,Ark.-Monticello Boll Weevils,614990,2,top,K. Latimer Failed pickoff attempt.,11,2026-02-21T16:00:00-05:00,"Weevils Field (Monticello, AR)",135,MBA,2026
6517643,614990,Okla. Baptist Bison,614918,Ark.-Monticello Boll Weevils,614990,2,top,M. Marsic fouled out to 3b.,12,2026-02-21T16:00:00-05:00,"Weevils Field (Monticello, AR)",135,MBA,2026
6517643,614990,Okla. Baptist Bison,614918,Ark.-Monticello Boll Weevils,614990,2,top,K. Latimer Failed pickoff attempt.,13,2026-02-21T16:00:00-05:00,"Weevils Field (Monticello, AR)",135,MBA,2026
6517643,614990,Okla. Baptist Bison,614918,Ark.-Monticello Boll Weevils,614990,2,top,M. Cox walked3a K. Latimer advanced to second.,14,2026-02-21T16:00:00-05:00,"Weevils Field (Monticello, AR)",135,MBA,2026
6517643,614990,Okla. Baptist Bison,614918,Ark.-Monticello Boll Weevils,614990,2,top,B. Green hit by pitch3a M. Cox advanced to second3a K. Latimer advanced to third.,15,2026-02-21T16:00:00-05:00,"Weevils Field (Monticello, AR)",135,MBA,2026
6517643,614990,Okla. Baptist Bison,614918,Ark.-Monticello Boll Weevils,614990,2,top,L. Schaefer struck out looking.,16,2026-02-21T16:00:00-05:00,"Weevils Field (Monticello, AR)",135,MBA,2026
6517643,614990,Okla. Baptist Bison,614918,Ark.-Monticello Boll Weevils,614918,2,bot,E. Marvin grounded out to 2b.,17,2026-02-21T16:00:00-05:00,"Weevils Field (Monticello, AR)",135,MBA,2026
6517643,614990,Okla. Baptist Bison,614918,Ark.-Monticello Boll Weevils,614918,2,bot,D. Barry singled through the left side.,18,2026-02-21T16:00:00-05:00,"Weevils Field (Monticello, AR)",135,MBA,2026
6517643,614990,Okla. Baptist Bison,614918,Ark.-Monticello Boll Weevils,614918,2,bot,"J. Riedling homered to right center, 2 RBI3a D. Barry scored.",19,2026-02-21T16:00:00-05:00,"Weevils Field (Monticello, AR)",135,MBA,2026
6517643,614990,Okla. Baptist Bison,614918,Ark.-Monticello Boll Weevils,614918,2,bot,S. Hernandez walked.,20,2026-02-21T16:00:00-05:00,"Weevils Field (Monticello, AR)",135,MBA,2026
6517643,614990,Okla. Baptist Bison,614918,Ark.-Monticello Boll Weevils,614918,2,bot,S. Hernandez Failed pickoff attempt.,21,2026-02-21T16:00:00-05:00,"Weevils Field (Monticello, AR)",135,MBA,2026
6517643,614990,Okla. Baptist Bison,614918,Ark.-Monticello Boll Weevils,614918,2,bot,S. Hernandez Failed pickoff attempt.,22,2026-02-21T16:00:00-05:00,"Weevils Field (Monticello, AR)",135,MBA,2026
6517643,614990,Okla. Baptist Bison,614918,Ark.-Monticello Boll Weevils,614918,2,bot,S. Hernandez stole second.,23,2026-02-21T16:00:00-05:00,"Weevils Field (Monticello, AR)",135,MBA,2026
6517643,614990,Okla. Baptist Bison,614918,Ark.-Monticello Boll Weevils,614918,2,bot,D. Floyd flied out to rf.,24,2026-02-21T16:00:00-05:00,"Weevils Field (Monticello, AR)",135,MBA,2026
6517643,614990,Okla. Baptist Bison,614918,Ark.-Monticello Boll Weevils,614918,2,bot,"C. Tanner singled to left field, RBI3a S. Hernandez scored.",25,2026-02-21T16:00:00-05:00,"Weevils Field (Monticello, AR)",135,MBA,2026
6517643,614990,Okla. Baptist Bison,614918,Ark.-Monticello Boll Weevils,614918,2,bot,C. Tanner Failed pickoff attempt.,26,2026-02-21T16:00:00-05:00,"Weevils Field (Monticello, AR)",135,MBA,2026
6517643,614990,Okla. Baptist Bison,614918,Ark.-Monticello Boll Weevils,614918,2,bot,"D. Lizarraga doubled to center field, RBI3a C. Tanner scored.",27,2026-02-21T16:00:00-05:00,"Weevils Field (Monticello, AR)",135,MBA,2026
6517643,614990,Okla. Baptist Bison,614918,Ark.-Monticello Boll Weevils,614918,2,bot,E. Olaybal grounded out to 2b.,28,2026-02-21T16:00:00-05:00,"Weevils Field (Monticello, AR)",135,MBA,2026
6517643,614990,Okla. Baptist Bison,614918,Ark.-Monticello Boll Weevils,614990,3,top,Q. Johnson walked.,29,2026-02-21T16:00:00-05:00,"Weevils Field (Monticello, AR)",135,MBA,2026
6517643,614990,Okla. Baptist Bison,614918,Ark.-Monticello Boll Weevils,614990,3,top,T. Amosa singled to right field3a Q. Johnson advanced to third.,30,2026-02-21T16:00:00-05:00,"Weevils Field (Monticello, AR)",135,MBA,2026
6517643,614990,Okla. Baptist Bison,614918,Ark.-Monticello Boll Weevils,614990,3,top,"Z. Bennett flied out to cf, SAC, RBI3a Q. Johnson scored.",31,2026-02-21T16:00:00-05:00,"Weevils Field (Monticello, AR)",135,MBA,2026
6517643,614990,Okla. Baptist Bison,614918,Ark.-Monticello Boll Weevils,614990,3,top,"K. Morris homered to center field, 2 RBI3a T. Amosa scored.",32,2026-02-21T16:00:00-05:00,"Weevils Field (Monticello, AR)",135,MBA,2026
6517643,614990,Okla. Baptist Bison,614918,Ark.-Monticello Boll Weevils,614990,3,top,K. Latimer reached first on an error by ss.,33,2026-02-21T16:00:00-05:00,"Weevils Field (Monticello, AR)",135,MBA,2026
6517643,614990,Okla. Baptist Bison,614918,Ark.-Monticello Boll Weevils,614990,3,top,M. Marsic fouled out to 3b.,34,2026-02-21T16:00:00-05:00,"Weevils Field (Monticello, AR)",135,MBA,2026
6517643,614990,Okla. Baptist Bison,614918,Ark.-Monticello Boll Weevils,614990,3,top,K. Latimer Failed pickoff attempt.,35,2026-02-21T16:00:00-05:00,"Weevils Field (Monticello, AR)",135,MBA,2026
6517643,614990,Okla. Baptist Bison,614918,Ark.-Monticello Boll Weevils,614990,3,top,K. Latimer Failed pickoff attempt.,36,2026-02-21T16:00:00-05:00,"Weevils Field (Monticello, AR)",135,MBA,2026
6517643,614990,Okla. Baptist Bison,614918,Ark.-Monticello Boll Weevils,614990,3,top,M. Cox struck out swinging.,37,2026-02-21T16:00:00-05:00,"Weevils Field (Monticello, AR)",135,MBA,2026
6517643,614990,Okla. Baptist Bison,614918,Ark.-Monticello Boll Weevils,614918,3,bot,G. Kuttenkul flied out to rf.,38,2026-02-21T16:00:00-05:00,"Weevils Field (Monticello, AR)",135,MBA,2026
6517643,614990,Okla. Baptist Bison,614918,Ark.-Monticello Boll Weevils,614918,3,bot,E. Marvin reached first on an error by 3b.,39,2026-02-21T16:00:00-05:00,"Weevils Field (Monticello, AR)",135,MBA,2026
6517643,614990,Okla. Baptist Bison,614918,Ark.-Monticello Boll Weevils,614918,3,bot,E. Marvin advanced to second on a wild pitch.,40,2026-02-21T16:00:00-05:00,"Weevils Field (Monticello, AR)",135,MBA,2026
6517643,614990,Okla. Baptist Bison,614918,Ark.-Monticello Boll Weevils,614918,3,bot,D. Barry singled to center field.,41,2026-02-21T16:00:00-05:00,"Weevils Field (Monticello, AR)",135,MBA,2026
6517643,614990,Okla. Baptist Bison,614918,Ark.-Monticello Boll Weevils,614918,3,bot,J. Riedling struck out swinging.,42,2026-02-21T16:00:00-05:00,"Weevils Field (Monticello, AR)",135,MBA,2026
6517643,614990,Okla. Baptist Bison,614918,Ark.-Monticello Boll Weevils,614918,3,bot,S. Hernandez hit by pitch3a D. Barry advanced to second3a E. Marvin advanced to third.,43,2026-02-21T16:00:00-05:00,"Weevils Field (Monticello, AR)",135,MBA,2026
6517643,614990,Okla. Baptist Bison,614918,Ark.-Monticello Boll Weevils,614918,3,bot,"E. Marvin out at home c unassisted, caught stealing.",44,2026-02-21T16:00:00-05:00,"Weevils Field (Monticello, AR)",135,MBA,2026
6517643,614990,Okla. Baptist Bison,614918,Ark.-Monticello Boll Weevils,614990,4,top,B. Green flied out to cf.,45,2026-02-21T16:00:00-05:00,"Weevils Field (Monticello, AR)",135,MBA,2026
6517643,614990,Okla. Baptist Bison,614918,Ark.-Monticello Boll Weevils,614990,4,top,L. Schaefer grounded out to 3b.,46,2026-02-21T16:00:00-05:00,"Weevils Field (Monticello, AR)",135,MBA,2026
6517643,614990,Okla. Baptist Bison,614918,Ark.-Monticello Boll Weevils,614990,4,top,Q. Johnson doubled through the right side.,47,2026-02-21T16:00:00-05:00,"Weevils Field (Monticello, AR)",135,MBA,2026
6517643,614990,Okla. Baptist Bison,614918,Ark.-Monticello Boll Weevils,614990,4,top,"T. Amosa doubled to center field, RBI3a Q. Johnson scored.",48,2026-02-21T16:00:00-05:00,"Weevils Field (Monticello, AR)",135,MBA,2026
6517643,614990,Okla. Baptist Bison,614918,Ark.-Monticello Boll Weevils,614990,4,top,Z. Bennett flied out to cf.,49,2026-02-21T16:00:00-05:00,"Weevils Field (Monticello, AR)",135,MBA,2026
6517643,614990,Okla. Baptist Bison,614918,Ark.-Monticello Boll Weevils,614918,4,bot,D. Floyd singled through the left side.,50,2026-02-21T16:00:00-05:00,"Weevils Field (Monticello, AR)",135,MBA,2026
6517643,614990,Okla. Baptist Bison,614918,Ark.-Monticello Boll Weevils,614918,4,bot,C. Tanner walked3a D. Floyd advanced to second.,51,2026-02-21T16:00:00-05:00,"Weevils Field (Monticello, AR)",135,MBA,2026
6517643,614990,Okla. Baptist Bison,614918,Ark.-Monticello Boll Weevils,614918,4,bot,D. Lizarraga flied out to cf3a D. Floyd advanced to third on the throw.,52,2026-02-21T16:00:00-05:00,"Weevils Field (Monticello, AR)",135,MBA,2026
6517643,614990,Okla. Baptist Bison,614918,Ark.-Monticello Boll Weevils,614918,4,bot,"E. Olaybal flied out to lf, SAC, RBI3a D. Floyd scored.",53,2026-02-21T16:00:00-05:00,"Weevils Field (Monticello, AR)",135,MBA,2026
6517643,614990,Okla. Baptist Bison,614918,Ark.-Monticello Boll Weevils,614918,4,bot,C. Tanner stole second.,54,2026-02-21T16:00:00-05:00,"Weevils Field (Monticello, AR)",135,MBA,2026
6517643,614990,Okla. Baptist Bison,614918,Ark.-Monticello Boll Weevils,614918,4,bot,G. Kuttenkul flied out to rf.,55,2026-02-21T16:00:00-05:00,"Weevils Field (Monticello, AR)",135,MBA,2026
6517643,614990,Okla. Baptist Bison,614918,Ark.-Monticello Boll Weevils,614990,5,top,C. Graf to p for H. Heath.,56,2026-02-21T16:00:00-05:00,"Weevils Field (Monticello, AR)",135,MBA,2026
6517643,614990,Okla. Baptist Bison,614918,Ark.-Monticello Boll Weevils,614990,5,top,K. Morris hit by pitch.,57,2026-02-21T16:00:00-05:00,"Weevils Field (Monticello, AR)",135,MBA,2026
6517643,614990,Okla. Baptist Bison,614918,Ark.-Monticello Boll Weevils,614990,5,top,K. Latimer struck out swinging.,58,2026-02-21T16:00:00-05:00,"Weevils Field (Monticello, AR)",135,MBA,2026
6517643,614990,Okla. Baptist Bison,614918,Ark.-Monticello Boll Weevils,614990,5,top,K. Morris stole second.,59,2026-02-21T16:00:00-05:00,"Weevils Field (Monticello, AR)",135,MBA,2026
6517643,614990,Okla. Baptist Bison,614918,Ark.-Monticello Boll Weevils,614990,5,top,M. Marsic flied out to lf.,60,2026-02-21T16:00:00-05:00,"Weevils Field (Monticello, AR)",135,MBA,2026
6517643,614990,Okla. Baptist Bison,614918,Ark.-Monticello Boll Weevils,614990,5,top,M. Cox grounded out to ss.,61,2026-02-21T16:00:00-05:00,"Weevils Field (Monticello, AR)",135,MBA,2026
6517643,614990,Okla. Baptist Bison,614918,Ark.-Monticello Boll Weevils,614918,5,bot,"E. Marvin homered to right center, RBI.",62,2026-02-21T16:00:00-05:00,"Weevils Field (Monticello, AR)",135,MBA,2026
6517643,614990,Okla. Baptist Bison,614918,Ark.-Monticello Boll Weevils,614918,5,bot,D. Barry grounded out to 3b.,63,2026-02-21T16:00:00-05:00,"Weevils Field (Monticello, AR)",135,MBA,2026
6517643,614990,Okla. Baptist Bison,614918,Ark.-Monticello Boll Weevils,614918,5,bot,J. Riedling walked.,64,2026-02-21T16:00:00-05:00,"Weevils Field (Monticello, AR)",135,MBA,2026
6517643,614990,Okla. Baptist Bison,614918,Ark.-Monticello Boll Weevils,614918,5,bot,J. Riedling Failed pickoff attempt.,65,2026-02-21T16:00:00-05:00,"Weevils Field (Monticello, AR)",135,MBA,2026
6517643,614990,Okla. Baptist Bison,614918,Ark.-Monticello Boll Weevils,614918,5,bot,J. Riedling stole second.,66,2026-02-21T16:00:00-05:00,"Weevils Field (Monticello, AR)",135,MBA,2026
6517643,614990,Okla. Baptist Bison,614918,Ark.-Monticello Boll Weevils,614918,5,bot,S. Hernandez hit by pitch.,67,2026-02-21T16:00:00-05:00,"Weevils Field (Monticello, AR)",135,MBA,2026
6517643,614990,Okla. Baptist Bison,614918,Ark.-Monticello Boll Weevils,614918,5,bot,L. Hernandez to p for M. Peters.,68,2026-02-21T16:00:00-05:00,"Weevils Field (Monticello, AR)",135,MBA,2026
6517643,614990,Okla. Baptist Bison,614918,Ark.-Monticello Boll Weevils,614918,5,bot,"D. Floyd doubled down the lf line, RBI3a S. Hernandez advanced to third3a J. Riedling scored.",69,2026-02-21T16:00:00-05:00,"Weevils Field (Monticello, AR)",135,MBA,2026
6517643,614990,Okla. Baptist Bison,614918,Ark.-Monticello Boll Weevils,614918,5,bot,"C. Tanner homered down the rf line, 3 RBI3a D. Floyd scored3a S. Hernandez scored.",70,2026-02-21T16:00:00-05:00,"Weevils Field (Monticello, AR)",135,MBA,2026
6517643,614990,Okla. Baptist Bison,614918,Ark.-Monticello Boll Weevils,614918,5,bot,D. Lizarraga walked.,71,2026-02-21T16:00:00-05:00,"Weevils Field (Monticello, AR)",135,MBA,2026
6517643,614990,Okla. Baptist Bison,614918,Ark.-Monticello Boll Weevils,614918,5,bot,E. Olaybal singled to left field3a D. Lizarraga advanced to second.,72,2026-02-21T16:00:00-05:00,"Weevils Field (Monticello, AR)",135,MBA,2026
6517643,614990,Okla. Baptist Bison,614918,Ark.-Monticello Boll Weevils,614918,5,bot,G. Kuttenkul singled to right field3a E. Olaybal advanced to second3a D. Lizarraga advanced to third.,73,2026-02-21T16:00:00-05:00,"Weevils Field (Monticello, AR)",135,MBA,2026
6517643,614990,Okla. Baptist Bison,614918,Ark.-Monticello Boll Weevils,614918,5,bot,"E. Marvin singled to center field, RBI3a G. Kuttenkul advanced to second3a E. Olaybal advanced to third3a D. Lizarraga scored.",74,2026-02-21T16:00:00-05:00,"Weevils Field (Monticello, AR)",135,MBA,2026
6517643,614990,Okla. Baptist Bison,614918,Ark.-Monticello Boll Weevils,614918,5,bot,"D. Barry hit by pitch, RBI3a E. Marvin advanced to second3a G. Kuttenkul advanced to third3a E. Olaybal scored.",75,2026-02-21T16:00:00-05:00,"Weevils Field (Monticello, AR)",135,MBA,2026
6517643,614990,Okla. Baptist Bison,614918,Ark.-Monticello Boll Weevils,614918,5,bot,"J. Riedling doubled to right field, 3 RBI3a D. Barry advanced to third3a E. Marvin scored3a G. Kuttenkul scored.",76,2026-02-21T16:00:00-05:00,"Weevils Field (Monticello, AR)",135,MBA,2026
6517643,614990,Okla. Baptist Bison,614918,Ark.-Monticello Boll Weevils,614918,5,bot,D. Ronquist to p for L. Hernandez.,77,2026-02-21T16:00:00-05:00,"Weevils Field (Monticello, AR)",135,MBA,2026
6517643,614990,Okla. Baptist Bison,614918,Ark.-Monticello Boll Weevils,614918,5,bot,S. Hernandez walked.,78,2026-02-21T16:00:00-05:00,"Weevils Field (Monticello, AR)",135,MBA,2026
6517643,614990,Okla. Baptist Bison,614918,Ark.-Monticello Boll Weevils,614918,5,bot,D. Floyd struck out swinging.,79,2026-02-21T16:00:00-05:00,"Weevils Field (Monticello, AR)",135,MBA,2026
6517643,614990,Okla. Baptist Bison,614918,Ark.-Monticello Boll Weevils,614918,5,bot,C. Tanner flied out to rf.,80,2026-02-21T16:00:00-05:00,"Weevils Field (Monticello, AR)",135,MBA,2026
6517643,614990,Okla. Baptist Bison,614918,Ark.-Monticello Boll Weevils,614990,6,top,B. Green grounded out to p.,81,2026-02-21T16:00:00-05:00,"Weevils Field (Monticello, AR)",135,MBA,2026
6517643,614990,Okla. Baptist Bison,614918,Ark.-Monticello Boll Weevils,614990,6,top,"L. Schaefer homered to left field, RBI.",82,2026-02-21T16:00:00-05:00,"Weevils Field (Monticello, AR)",135,MBA,2026
6517643,614990,Okla. Baptist Bison,614918,Ark.-Monticello Boll Weevils,614990,6,top,Q. Johnson lined out to lf.,83,2026-02-21T16:00:00-05:00,"Weevils Field (Monticello, AR)",135,MBA,2026
6517643,614990,Okla. Baptist Bison,614918,Ark.-Monticello Boll Weevils,614990,6,top,T. Amosa singled up the middle.,84,2026-02-21T16:00:00-05:00,"Weevils Field (Monticello, AR)",135,MBA,2026
6517643,614990,Okla. Baptist Bison,614918,Ark.-Monticello Boll Weevils,614990,6,top,T. Amosa advanced to second on a wild pitch.,85,2026-02-21T16:00:00-05:00,"Weevils Field (Monticello, AR)",135,MBA,2026
6517643,614990,Okla. Baptist Bison,614918,Ark.-Monticello Boll Weevils,614990,6,top,"Z. Bennett doubled to left field, RBI3a T. Amosa scored.",86,2026-02-21T16:00:00-05:00,"Weevils Field (Monticello, AR)",135,MBA,2026
6517643,614990,Okla. Baptist Bison,614918,Ark.-Monticello Boll Weevils,614990,6,top,K. Morris grounded out to 2b.,87,2026-02-21T16:00:00-05:00,"Weevils Field (Monticello, AR)",135,MBA,2026
6517643,614990,Okla. Baptist Bison,614918,Ark.-Monticello Boll Weevils,614918,6,bot,D. Lizarraga hit by pitch.,88,2026-02-21T16:00:00-05:00,"Weevils Field (Monticello, AR)",135,MBA,2026
6517643,614990,Okla. Baptist Bison,614918,Ark.-Monticello Boll Weevils,614918,6,bot,"D. Lizarraga stole second, advanced to third on an error by c.",89,2026-02-21T16:00:00-05:00,"Weevils Field (Monticello, AR)",135,MBA,2026
6517643,614990,Okla. Baptist Bison,614918,Ark.-Monticello Boll Weevils,614918,6,bot,"E. Olaybal grounded out to ss, RBI3a D. Lizarraga scored.",90,2026-02-21T16:00:00-05:00,"Weevils Field (Monticello, AR)",135,MBA,2026
6517643,614990,Okla. Baptist Bison,614918,Ark.-Monticello Boll Weevils,614918,6,bot,G. Kuttenkul struck out looking.,91,2026-02-21T16:00:00-05:00,"Weevils Field (Monticello, AR)",135,MBA,2026
6517643,614990,Okla. Baptist Bison,614918,Ark.-Monticello Boll Weevils,614918,6,bot,"E. Marvin homered to center field, RBI.",92,2026-02-21T16:00:00-05:00,"Weevils Field (Monticello, AR)",135,MBA,2026
6517643,614990,Okla. Baptist Bison,614918,Ark.-Monticello Boll Weevils,614918,6,bot,D. Barry singled to third base.,93,2026-02-21T16:00:00-05:00,"Weevils Field (Monticello, AR)",135,MBA,2026
6517643,614990,Okla. Baptist Bison,614918,Ark.-Monticello Boll Weevils,614918,6,bot,J. Riedling hit by pitch3a D. Barry advanced to second.,94,2026-02-21T16:00:00-05:00,"Weevils Field (Monticello, AR)",135,MBA,2026
6517643,614990,Okla. Baptist Bison,614918,Ark.-Monticello Boll Weevils,614918,6,bot,S. Hernandez walked3a J. Riedling advanced to second3a D. Barry advanced to third.,95,2026-02-21T16:00:00-05:00,"Weevils Field (Monticello, AR)",135,MBA,2026
6517643,614990,Okla. Baptist Bison,614918,Ark.-Monticello Boll Weevils,614918,6,bot,D. Floyd struck out swinging.,96,2026-02-21T16:00:00-05:00,"Weevils Field (Monticello, AR)",135,MBA,2026
6517643,614990,Okla. Baptist Bison,614918,Ark.-Monticello Boll Weevils,614990,7,top,J. Skelly to p for C. Graf.,97,2026-02-21T16:00:00-05:00,"Weevils Field (Monticello, AR)",135,MBA,2026
6517643,614990,Okla. Baptist Bison,614918,Ark.-Monticello Boll Weevils,614990,7,top,K. Latimer grounded out to 3b.,98,2026-02-21T16:00:00-05:00,"Weevils Field (Monticello, AR)",135,MBA,2026
6517643,614990,Okla. Baptist Bison,614918,Ark.-Monticello Boll Weevils,614990,7,top,M. Marsic grounded out to p.,99,2026-02-21T16:00:00-05:00,"Weevils Field (Monticello, AR)",135,MBA,2026
6517643,614990,Okla. Baptist Bison,614918,Ark.-Monticello Boll Weevils,614990,7,top,M. Cox doubled to right field.,100,2026-02-21T16:00:00-05:00,"Weevils Field (Monticello, AR)",135,MBA,2026
6517643,614990,Okla. Baptist Bison,614918,Ark.-Monticello Boll Weevils,614990,7,top,B. Green grounded out to 2b.,101,2026-02-21T16:00:00-05:00,"Weevils Field (Monticello, AR)",135,MBA,2026
