game_id,away_team_id,away_team_name,home_team_id,home_team_name,batting_team,inning,top_bot,event_text,event_num,game_datetime,stadium_name,attendance,sport_id,season
6518598,614894,Pittsburg St. Gorillas,614964,Ark.-Fort Smith Lions,614894,1,top,J. McNealy hit by pitch.,1,2026-03-01T14:00:00-05:00,"Crowder Field (Fort Smith, AR)",232,MBA,2026
6518598,614894,Pittsburg St. Gorillas,614964,Ark.-Fort Smith Lions,614894,1,top,J. McNealy stole second.,2,2026-03-01T14:00:00-05:00,"Crowder Field (Fort Smith, AR)",232,MBA,2026
6518598,614894,Pittsburg St. Gorillas,614964,Ark.-Fort Smith Lions,614894,1,top,E. Bacon grounded out to ss3a J. McNealy advanced to third.,3,2026-03-01T14:00:00-05:00,"Crowder Field (Fort Smith, AR)",232,MBA,2026
6518598,614894,Pittsburg St. Gorillas,614964,Ark.-Fort Smith Lions,614894,1,top,D. Brewer was intentionally walked.,4,2026-03-01T14:00:00-05:00,"Crowder Field (Fort Smith, AR)",232,MBA,2026
6518598,614894,Pittsburg St. Gorillas,614964,Ark.-Fort Smith Lions,614894,1,top,D. Brewer advanced to second on a passed ball.,5,2026-03-01T14:00:00-05:00,"Crowder Field (Fort Smith, AR)",232,MBA,2026
6518598,614894,Pittsburg St. Gorillas,614964,Ark.-Fort Smith Lions,614894,1,top,"I. Webb doubled to left field, 2 RBI3a D. Brewer scored3a J. McNealy scored.",6,2026-03-01T14:00:00-05:00,"Crowder Field (Fort Smith, AR)",232,MBA,2026
6518598,614894,Pittsburg St. Gorillas,614964,Ark.-Fort Smith Lions,614894,1,top,G. Nottleman singled to right field3a I. Webb advanced to third.,7,2026-03-01T14:00:00-05:00,"Crowder Field (Fort Smith, AR)",232,MBA,2026
6518598,614894,Pittsburg St. Gorillas,614964,Ark.-Fort Smith Lions,614894,1,top,G. Nottleman stole second3a I. Webb scored on the throw.,8,2026-03-01T14:00:00-05:00,"Crowder Field (Fort Smith, AR)",232,MBA,2026
6518598,614894,Pittsburg St. Gorillas,614964,Ark.-Fort Smith Lions,614894,1,top,"L. Midgett homered to left field, 2 RBI3a G. Nottleman scored.",9,2026-03-01T14:00:00-05:00,"Crowder Field (Fort Smith, AR)",232,MBA,2026
6518598,614894,Pittsburg St. Gorillas,614964,Ark.-Fort Smith Lions,614894,1,top,L. Bruce struck out swinging.,10,2026-03-01T14:00:00-05:00,"Crowder Field (Fort Smith, AR)",232,MBA,2026
6518598,614894,Pittsburg St. Gorillas,614964,Ark.-Fort Smith Lions,614894,1,top,C. Harris hit by pitch.,11,2026-03-01T14:00:00-05:00,"Crowder Field (Fort Smith, AR)",232,MBA,2026
6518598,614894,Pittsburg St. Gorillas,614964,Ark.-Fort Smith Lions,614894,1,top,C. Harris stole second.,12,2026-03-01T14:00:00-05:00,"Crowder Field (Fort Smith, AR)",232,MBA,2026
6518598,614894,Pittsburg St. Gorillas,614964,Ark.-Fort Smith Lions,614894,1,top,C. Wesslund struck out looking.,13,2026-03-01T14:00:00-05:00,"Crowder Field (Fort Smith, AR)",232,MBA,2026
6518598,614894,Pittsburg St. Gorillas,614964,Ark.-Fort Smith Lions,614964,1,bot,N. Mazzola singled up the middle.,14,2026-03-01T14:00:00-05:00,"Crowder Field (Fort Smith, AR)",232,MBA,2026
6518598,614894,Pittsburg St. Gorillas,614964,Ark.-Fort Smith Lions,614964,1,bot,C. Earleywin reached on a fielder's choice3a N. Mazzola out at second 2b to ss.,15,2026-03-01T14:00:00-05:00,"Crowder Field (Fort Smith, AR)",232,MBA,2026
6518598,614894,Pittsburg St. Gorillas,614964,Ark.-Fort Smith Lions,614964,1,bot,C. Earleywin advanced to second on a wild pitch.,16,2026-03-01T14:00:00-05:00,"Crowder Field (Fort Smith, AR)",232,MBA,2026
6518598,614894,Pittsburg St. Gorillas,614964,Ark.-Fort Smith Lions,614964,1,bot,C. Earleywin stole third.,17,2026-03-01T14:00:00-05:00,"Crowder Field (Fort Smith, AR)",232,MBA,2026
6518598,614894,Pittsburg St. Gorillas,614964,Ark.-Fort Smith Lions,614964,1,bot,C. Snowden walked.,18,2026-03-01T14:00:00-05:00,"Crowder Field (Fort Smith, AR)",232,MBA,2026
6518598,614894,Pittsburg St. Gorillas,614964,Ark.-Fort Smith Lions,614964,1,bot,C. Snowden stole second.,19,2026-03-01T14:00:00-05:00,"Crowder Field (Fort Smith, AR)",232,MBA,2026
6518598,614894,Pittsburg St. Gorillas,614964,Ark.-Fort Smith Lions,614964,1,bot,C. Eisenhowe struck out swinging.,20,2026-03-01T14:00:00-05:00,"Crowder Field (Fort Smith, AR)",232,MBA,2026
6518598,614894,Pittsburg St. Gorillas,614964,Ark.-Fort Smith Lions,614964,1,bot,W. Pierce walked.,21,2026-03-01T14:00:00-05:00,"Crowder Field (Fort Smith, AR)",232,MBA,2026
6518598,614894,Pittsburg St. Gorillas,614964,Ark.-Fort Smith Lions,614964,1,bot,L. Sweat flied out to cf.,22,2026-03-01T14:00:00-05:00,"Crowder Field (Fort Smith, AR)",232,MBA,2026
6518598,614894,Pittsburg St. Gorillas,614964,Ark.-Fort Smith Lions,614894,2,top,J. McNealy struck out swinging.,23,2026-03-01T14:00:00-05:00,"Crowder Field (Fort Smith, AR)",232,MBA,2026
6518598,614894,Pittsburg St. Gorillas,614964,Ark.-Fort Smith Lions,614894,2,top,E. Bacon flied out to cf.,24,2026-03-01T14:00:00-05:00,"Crowder Field (Fort Smith, AR)",232,MBA,2026
6518598,614894,Pittsburg St. Gorillas,614964,Ark.-Fort Smith Lions,614894,2,top,D. Brewer singled to left field.,25,2026-03-01T14:00:00-05:00,"Crowder Field (Fort Smith, AR)",232,MBA,2026
6518598,614894,Pittsburg St. Gorillas,614964,Ark.-Fort Smith Lions,614894,2,top,D. Brewer advanced to second on a wild pitch.,26,2026-03-01T14:00:00-05:00,"Crowder Field (Fort Smith, AR)",232,MBA,2026
6518598,614894,Pittsburg St. Gorillas,614964,Ark.-Fort Smith Lions,614894,2,top,"I. Webb singled to center field, RBI3a D. Brewer scored.",27,2026-03-01T14:00:00-05:00,"Crowder Field (Fort Smith, AR)",232,MBA,2026
6518598,614894,Pittsburg St. Gorillas,614964,Ark.-Fort Smith Lions,614894,2,top,I. Webb stole second.,28,2026-03-01T14:00:00-05:00,"Crowder Field (Fort Smith, AR)",232,MBA,2026
6518598,614894,Pittsburg St. Gorillas,614964,Ark.-Fort Smith Lions,614894,2,top,G. Nottleman hit by pitch.,29,2026-03-01T14:00:00-05:00,"Crowder Field (Fort Smith, AR)",232,MBA,2026
6518598,614894,Pittsburg St. Gorillas,614964,Ark.-Fort Smith Lions,614894,2,top,L. Midgett hit by pitch3a G. Nottleman advanced to second3a I. Webb advanced to third.,30,2026-03-01T14:00:00-05:00,"Crowder Field (Fort Smith, AR)",232,MBA,2026
6518598,614894,Pittsburg St. Gorillas,614964,Ark.-Fort Smith Lions,614894,2,top,T. Kelsey to p for A. Almeida.,31,2026-03-01T14:00:00-05:00,"Crowder Field (Fort Smith, AR)",232,MBA,2026
6518598,614894,Pittsburg St. Gorillas,614964,Ark.-Fort Smith Lions,614894,2,top,L. Midgett advanced to second3a G. Nottleman advanced to third3a I. Webb scored on a passed ball.,32,2026-03-01T14:00:00-05:00,"Crowder Field (Fort Smith, AR)",232,MBA,2026
6518598,614894,Pittsburg St. Gorillas,614964,Ark.-Fort Smith Lions,614894,2,top,L. Bruce walked.,33,2026-03-01T14:00:00-05:00,"Crowder Field (Fort Smith, AR)",232,MBA,2026
6518598,614894,Pittsburg St. Gorillas,614964,Ark.-Fort Smith Lions,614894,2,top,L. Bruce advanced to second3a L. Midgett advanced to third3a G. Nottleman scored on a wild pitch.,34,2026-03-01T14:00:00-05:00,"Crowder Field (Fort Smith, AR)",232,MBA,2026
6518598,614894,Pittsburg St. Gorillas,614964,Ark.-Fort Smith Lions,614894,2,top,C. Harris flied out to lf.,35,2026-03-01T14:00:00-05:00,"Crowder Field (Fort Smith, AR)",232,MBA,2026
6518598,614894,Pittsburg St. Gorillas,614964,Ark.-Fort Smith Lions,614964,2,bot,S. Anders grounded out to 2b.,36,2026-03-01T14:00:00-05:00,"Crowder Field (Fort Smith, AR)",232,MBA,2026
6518598,614894,Pittsburg St. Gorillas,614964,Ark.-Fort Smith Lions,614964,2,bot,C. Heckendor pinch hit for C. Allen.,37,2026-03-01T14:00:00-05:00,"Crowder Field (Fort Smith, AR)",232,MBA,2026
6518598,614894,Pittsburg St. Gorillas,614964,Ark.-Fort Smith Lions,614964,2,bot,C. Heckendor reached first on a fielding error by 1b.,38,2026-03-01T14:00:00-05:00,"Crowder Field (Fort Smith, AR)",232,MBA,2026
6518598,614894,Pittsburg St. Gorillas,614964,Ark.-Fort Smith Lions,614964,2,bot,A. Kudler singled to left field3a C. Heckendor advanced to second.,39,2026-03-01T14:00:00-05:00,"Crowder Field (Fort Smith, AR)",232,MBA,2026
6518598,614894,Pittsburg St. Gorillas,614964,Ark.-Fort Smith Lions,614964,2,bot,N. Mazzola grounded into double play 2b to ss to 1b3a A. Kudler out on the play.,40,2026-03-01T14:00:00-05:00,"Crowder Field (Fort Smith, AR)",232,MBA,2026
6518598,614894,Pittsburg St. Gorillas,614964,Ark.-Fort Smith Lions,614894,3,top,C. Heckendor to c.,41,2026-03-01T14:00:00-05:00,"Crowder Field (Fort Smith, AR)",232,MBA,2026
6518598,614894,Pittsburg St. Gorillas,614964,Ark.-Fort Smith Lions,614894,3,top,C. Wesslund hit by pitch.,42,2026-03-01T14:00:00-05:00,"Crowder Field (Fort Smith, AR)",232,MBA,2026
6518598,614894,Pittsburg St. Gorillas,614964,Ark.-Fort Smith Lions,614894,3,top,J. McNealy singled to third base3a C. Wesslund advanced to second.,43,2026-03-01T14:00:00-05:00,"Crowder Field (Fort Smith, AR)",232,MBA,2026
6518598,614894,Pittsburg St. Gorillas,614964,Ark.-Fort Smith Lions,614894,3,top,E. Bacon reached on a fielder's choice3a J. McNealy out at second 1b to ss3a C. Wesslund advanced to third.,44,2026-03-01T14:00:00-05:00,"Crowder Field (Fort Smith, AR)",232,MBA,2026
6518598,614894,Pittsburg St. Gorillas,614964,Ark.-Fort Smith Lions,614894,3,top,D. Brewer was intentionally walked3a E. Bacon advanced to second.,45,2026-03-01T14:00:00-05:00,"Crowder Field (Fort Smith, AR)",232,MBA,2026
6518598,614894,Pittsburg St. Gorillas,614964,Ark.-Fort Smith Lions,614894,3,top,"I. Webb singled down the lf line, 2 RBI3a D. Brewer advanced to second3a E. Bacon scored3a C. Wesslund scored.",46,2026-03-01T14:00:00-05:00,"Crowder Field (Fort Smith, AR)",232,MBA,2026
6518598,614894,Pittsburg St. Gorillas,614964,Ark.-Fort Smith Lions,614894,3,top,G. Nottleman flied out to lf.,47,2026-03-01T14:00:00-05:00,"Crowder Field (Fort Smith, AR)",232,MBA,2026
6518598,614894,Pittsburg St. Gorillas,614964,Ark.-Fort Smith Lions,614894,3,top,"L. Midgett doubled to left field, advanced to third on a throwing error by ss, 2 RBI3a I. Webb scored3a D. Brewer scored.",48,2026-03-01T14:00:00-05:00,"Crowder Field (Fort Smith, AR)",232,MBA,2026
6518598,614894,Pittsburg St. Gorillas,614964,Ark.-Fort Smith Lions,614894,3,top,L. Bruce struck out swinging.,49,2026-03-01T14:00:00-05:00,"Crowder Field (Fort Smith, AR)",232,MBA,2026
6518598,614894,Pittsburg St. Gorillas,614964,Ark.-Fort Smith Lions,614964,3,bot,C. Earleywin singled through the left side.,50,2026-03-01T14:00:00-05:00,"Crowder Field (Fort Smith, AR)",232,MBA,2026
6518598,614894,Pittsburg St. Gorillas,614964,Ark.-Fort Smith Lions,614964,3,bot,C. Snowden grounded out to ss3a C. Earleywin advanced to second.,51,2026-03-01T14:00:00-05:00,"Crowder Field (Fort Smith, AR)",232,MBA,2026
6518598,614894,Pittsburg St. Gorillas,614964,Ark.-Fort Smith Lions,614964,3,bot,C. Eisenhowe grounded out to 2b.,52,2026-03-01T14:00:00-05:00,"Crowder Field (Fort Smith, AR)",232,MBA,2026
6518598,614894,Pittsburg St. Gorillas,614964,Ark.-Fort Smith Lions,614964,3,bot,"W. Pierce singled to left field, RBI3a C. Earleywin scored.",53,2026-03-01T14:00:00-05:00,"Crowder Field (Fort Smith, AR)",232,MBA,2026
6518598,614894,Pittsburg St. Gorillas,614964,Ark.-Fort Smith Lions,614964,3,bot,L. Sweat reached on a fielder's choice3a W. Pierce out at second 2b to ss.,54,2026-03-01T14:00:00-05:00,"Crowder Field (Fort Smith, AR)",232,MBA,2026
6518598,614894,Pittsburg St. Gorillas,614964,Ark.-Fort Smith Lions,614894,4,top,C. Harris struck out looking.,55,2026-03-01T14:00:00-05:00,"Crowder Field (Fort Smith, AR)",232,MBA,2026
6518598,614894,Pittsburg St. Gorillas,614964,Ark.-Fort Smith Lions,614894,4,top,C. Wesslund singled to center field.,56,2026-03-01T14:00:00-05:00,"Crowder Field (Fort Smith, AR)",232,MBA,2026
6518598,614894,Pittsburg St. Gorillas,614964,Ark.-Fort Smith Lions,614894,4,top,J. McNealy flied out to lf.,57,2026-03-01T14:00:00-05:00,"Crowder Field (Fort Smith, AR)",232,MBA,2026
6518598,614894,Pittsburg St. Gorillas,614964,Ark.-Fort Smith Lions,614894,4,top,E. Bacon singled through the left side3a C. Wesslund advanced to second.,58,2026-03-01T14:00:00-05:00,"Crowder Field (Fort Smith, AR)",232,MBA,2026
6518598,614894,Pittsburg St. Gorillas,614964,Ark.-Fort Smith Lions,614894,4,top,E. Bacon advanced to second3a C. Wesslund advanced to third on a wild pitch.,59,2026-03-01T14:00:00-05:00,"Crowder Field (Fort Smith, AR)",232,MBA,2026
6518598,614894,Pittsburg St. Gorillas,614964,Ark.-Fort Smith Lions,614894,4,top,D. Brewer grounded out to ss.,60,2026-03-01T14:00:00-05:00,"Crowder Field (Fort Smith, AR)",232,MBA,2026
6518598,614894,Pittsburg St. Gorillas,614964,Ark.-Fort Smith Lions,614964,4,bot,E. Seitz to p for T. Blecha.,61,2026-03-01T14:00:00-05:00,"Crowder Field (Fort Smith, AR)",232,MBA,2026
6518598,614894,Pittsburg St. Gorillas,614964,Ark.-Fort Smith Lions,614964,4,bot,S. Anders walked.,62,2026-03-01T14:00:00-05:00,"Crowder Field (Fort Smith, AR)",232,MBA,2026
6518598,614894,Pittsburg St. Gorillas,614964,Ark.-Fort Smith Lions,614964,4,bot,C. Heckendor doubled to left field3a S. Anders advanced to third.,63,2026-03-01T14:00:00-05:00,"Crowder Field (Fort Smith, AR)",232,MBA,2026
6518598,614894,Pittsburg St. Gorillas,614964,Ark.-Fort Smith Lions,614964,4,bot,A. Kudler lined into double play 2b3a C. Heckendor out on the play.,64,2026-03-01T14:00:00-05:00,"Crowder Field (Fort Smith, AR)",232,MBA,2026
6518598,614894,Pittsburg St. Gorillas,614964,Ark.-Fort Smith Lions,614964,4,bot,N. Mazzola popped up to ss.,65,2026-03-01T14:00:00-05:00,"Crowder Field (Fort Smith, AR)",232,MBA,2026
6518598,614894,Pittsburg St. Gorillas,614964,Ark.-Fort Smith Lions,614894,5,top,I. Webb popped up to ss.,66,2026-03-01T14:00:00-05:00,"Crowder Field (Fort Smith, AR)",232,MBA,2026
6518598,614894,Pittsburg St. Gorillas,614964,Ark.-Fort Smith Lions,614894,5,top,G. Nottleman doubled to left center.,67,2026-03-01T14:00:00-05:00,"Crowder Field (Fort Smith, AR)",232,MBA,2026
6518598,614894,Pittsburg St. Gorillas,614964,Ark.-Fort Smith Lions,614894,5,top,L. Midgett flied out to lf.,68,2026-03-01T14:00:00-05:00,"Crowder Field (Fort Smith, AR)",232,MBA,2026
6518598,614894,Pittsburg St. Gorillas,614964,Ark.-Fort Smith Lions,614894,5,top,L. Bruce lined out to 2b.,69,2026-03-01T14:00:00-05:00,"Crowder Field (Fort Smith, AR)",232,MBA,2026
6518598,614894,Pittsburg St. Gorillas,614964,Ark.-Fort Smith Lions,614964,5,bot,S. Dandridge to rf for E. Bacon.,70,2026-03-01T14:00:00-05:00,"Crowder Field (Fort Smith, AR)",232,MBA,2026
6518598,614894,Pittsburg St. Gorillas,614964,Ark.-Fort Smith Lions,614964,5,bot,C. Carter to lf for D. Brewer.,71,2026-03-01T14:00:00-05:00,"Crowder Field (Fort Smith, AR)",232,MBA,2026
6518598,614894,Pittsburg St. Gorillas,614964,Ark.-Fort Smith Lions,614964,5,bot,B. Sarwinski to cf for I. Webb.,72,2026-03-01T14:00:00-05:00,"Crowder Field (Fort Smith, AR)",232,MBA,2026
6518598,614894,Pittsburg St. Gorillas,614964,Ark.-Fort Smith Lions,614964,5,bot,J. Cotton to ss for J. McNealy.,73,2026-03-01T14:00:00-05:00,"Crowder Field (Fort Smith, AR)",232,MBA,2026
6518598,614894,Pittsburg St. Gorillas,614964,Ark.-Fort Smith Lions,614964,5,bot,K. Koester to 1b for L. Midgett.,74,2026-03-01T14:00:00-05:00,"Crowder Field (Fort Smith, AR)",232,MBA,2026
6518598,614894,Pittsburg St. Gorillas,614964,Ark.-Fort Smith Lions,614964,5,bot,C. Earleywin struck out looking.,75,2026-03-01T14:00:00-05:00,"Crowder Field (Fort Smith, AR)",232,MBA,2026
6518598,614894,Pittsburg St. Gorillas,614964,Ark.-Fort Smith Lions,614964,5,bot,C. Snowden grounded out to 3b.,76,2026-03-01T14:00:00-05:00,"Crowder Field (Fort Smith, AR)",232,MBA,2026
6518598,614894,Pittsburg St. Gorillas,614964,Ark.-Fort Smith Lions,614964,5,bot,C. Eisenhowe struck out swinging.,77,2026-03-01T14:00:00-05:00,"Crowder Field (Fort Smith, AR)",232,MBA,2026
6518598,614894,Pittsburg St. Gorillas,614964,Ark.-Fort Smith Lions,614894,6,top,C. Phillips to p for T. Kelsey.,78,2026-03-01T14:00:00-05:00,"Crowder Field (Fort Smith, AR)",232,MBA,2026
6518598,614894,Pittsburg St. Gorillas,614964,Ark.-Fort Smith Lions,614894,6,top,C. Harris flied out to lf.,79,2026-03-01T14:00:00-05:00,"Crowder Field (Fort Smith, AR)",232,MBA,2026
6518598,614894,Pittsburg St. Gorillas,614964,Ark.-Fort Smith Lions,614894,6,top,C. Wesslund flied out to rf.,80,2026-03-01T14:00:00-05:00,"Crowder Field (Fort Smith, AR)",232,MBA,2026
6518598,614894,Pittsburg St. Gorillas,614964,Ark.-Fort Smith Lions,614894,6,top,J. Cotton reached first on a fielding error by ss.,81,2026-03-01T14:00:00-05:00,"Crowder Field (Fort Smith, AR)",232,MBA,2026
6518598,614894,Pittsburg St. Gorillas,614964,Ark.-Fort Smith Lions,614894,6,top,S. Dandridge popped up to ss.,82,2026-03-01T14:00:00-05:00,"Crowder Field (Fort Smith, AR)",232,MBA,2026
6518598,614894,Pittsburg St. Gorillas,614964,Ark.-Fort Smith Lions,614964,6,bot,C. Long to p for E. Seitz.,83,2026-03-01T14:00:00-05:00,"Crowder Field (Fort Smith, AR)",232,MBA,2026
6518598,614894,Pittsburg St. Gorillas,614964,Ark.-Fort Smith Lions,614964,6,bot,W. Pierce struck out looking.,84,2026-03-01T14:00:00-05:00,"Crowder Field (Fort Smith, AR)",232,MBA,2026
6518598,614894,Pittsburg St. Gorillas,614964,Ark.-Fort Smith Lions,614964,6,bot,L. Sweat struck out looking.,85,2026-03-01T14:00:00-05:00,"Crowder Field (Fort Smith, AR)",232,MBA,2026
6518598,614894,Pittsburg St. Gorillas,614964,Ark.-Fort Smith Lions,614964,6,bot,S. Anders struck out looking.,86,2026-03-01T14:00:00-05:00,"Crowder Field (Fort Smith, AR)",232,MBA,2026
6518598,614894,Pittsburg St. Gorillas,614964,Ark.-Fort Smith Lions,614894,7,top,C. Carter walked.,87,2026-03-01T14:00:00-05:00,"Crowder Field (Fort Smith, AR)",232,MBA,2026
6518598,614894,Pittsburg St. Gorillas,614964,Ark.-Fort Smith Lions,614894,7,top,B. Sarwinski reached on a fielder's choice3a C. Carter advanced to second on a fielding error by 2b.,88,2026-03-01T14:00:00-05:00,"Crowder Field (Fort Smith, AR)",232,MBA,2026
6518598,614894,Pittsburg St. Gorillas,614964,Ark.-Fort Smith Lions,614894,7,top,B. Patterson pinch hit for G. Nottleman.,89,2026-03-01T14:00:00-05:00,"Crowder Field (Fort Smith, AR)",232,MBA,2026
6518598,614894,Pittsburg St. Gorillas,614964,Ark.-Fort Smith Lions,614894,7,top,"B. Patterson singled up the middle, RBI3a B. Sarwinski advanced to second3a C. Carter scored, unearned.",90,2026-03-01T14:00:00-05:00,"Crowder Field (Fort Smith, AR)",232,MBA,2026
6518598,614894,Pittsburg St. Gorillas,614964,Ark.-Fort Smith Lions,614894,7,top,K. Koester struck out swinging.,91,2026-03-01T14:00:00-05:00,"Crowder Field (Fort Smith, AR)",232,MBA,2026
6518598,614894,Pittsburg St. Gorillas,614964,Ark.-Fort Smith Lions,614894,7,top,L. Bruce hit by pitch3a B. Patterson advanced to second3a B. Sarwinski advanced to third.,92,2026-03-01T14:00:00-05:00,"Crowder Field (Fort Smith, AR)",232,MBA,2026
6518598,614894,Pittsburg St. Gorillas,614964,Ark.-Fort Smith Lions,614894,7,top,A. Branson pinch ran for L. Bruce.,93,2026-03-01T14:00:00-05:00,"Crowder Field (Fort Smith, AR)",232,MBA,2026
6518598,614894,Pittsburg St. Gorillas,614964,Ark.-Fort Smith Lions,614894,7,top,"C. Harris grounded out to 3b, RBI3a A. Branson advanced to second3a B. Patterson advanced to third3a B. Sarwinski scored.",94,2026-03-01T14:00:00-05:00,"Crowder Field (Fort Smith, AR)",232,MBA,2026
6518598,614894,Pittsburg St. Gorillas,614964,Ark.-Fort Smith Lions,614894,7,top,"C. Wesslund singled up the middle, 2 RBI3a A. Branson scored, unearned3a B. Patterson scored, unearned.",95,2026-03-01T14:00:00-05:00,"Crowder Field (Fort Smith, AR)",232,MBA,2026
6518598,614894,Pittsburg St. Gorillas,614964,Ark.-Fort Smith Lions,614894,7,top,C. Wesslund advanced to second on a passed ball.,96,2026-03-01T14:00:00-05:00,"Crowder Field (Fort Smith, AR)",232,MBA,2026
6518598,614894,Pittsburg St. Gorillas,614964,Ark.-Fort Smith Lions,614894,7,top,J. Cotton walked.,97,2026-03-01T14:00:00-05:00,"Crowder Field (Fort Smith, AR)",232,MBA,2026
6518598,614894,Pittsburg St. Gorillas,614964,Ark.-Fort Smith Lions,614894,7,top,S. Dandridge lined out to rf to right center.,98,2026-03-01T14:00:00-05:00,"Crowder Field (Fort Smith, AR)",232,MBA,2026
6518598,614894,Pittsburg St. Gorillas,614964,Ark.-Fort Smith Lions,614964,7,bot,A. Branson to 3b.,99,2026-03-01T14:00:00-05:00,"Crowder Field (Fort Smith, AR)",232,MBA,2026
6518598,614894,Pittsburg St. Gorillas,614964,Ark.-Fort Smith Lions,614964,7,bot,C. Heckendor struck out swinging.,100,2026-03-01T14:00:00-05:00,"Crowder Field (Fort Smith, AR)",232,MBA,2026
6518598,614894,Pittsburg St. Gorillas,614964,Ark.-Fort Smith Lions,614964,7,bot,A. Kudler singled to center field.,101,2026-03-01T14:00:00-05:00,"Crowder Field (Fort Smith, AR)",232,MBA,2026
6518598,614894,Pittsburg St. Gorillas,614964,Ark.-Fort Smith Lions,614964,7,bot,T. Wiley pinch hit for N. Mazzola.,102,2026-03-01T14:00:00-05:00,"Crowder Field (Fort Smith, AR)",232,MBA,2026
6518598,614894,Pittsburg St. Gorillas,614964,Ark.-Fort Smith Lions,614964,7,bot,T. Wiley walked3a A. Kudler advanced to second.,103,2026-03-01T14:00:00-05:00,"Crowder Field (Fort Smith, AR)",232,MBA,2026
6518598,614894,Pittsburg St. Gorillas,614964,Ark.-Fort Smith Lions,614964,7,bot,A. Bercher pinch hit for C. Earleywin.,104,2026-03-01T14:00:00-05:00,"Crowder Field (Fort Smith, AR)",232,MBA,2026
6518598,614894,Pittsburg St. Gorillas,614964,Ark.-Fort Smith Lions,614964,7,bot,A. Bercher reached on a fielder's choice3a T. Wiley out at second p to 2b3a A. Kudler advanced to third.,105,2026-03-01T14:00:00-05:00,"Crowder Field (Fort Smith, AR)",232,MBA,2026
6518598,614894,Pittsburg St. Gorillas,614964,Ark.-Fort Smith Lions,614964,7,bot,J. Young pinch hit for C. Snowden.,106,2026-03-01T14:00:00-05:00,"Crowder Field (Fort Smith, AR)",232,MBA,2026
6518598,614894,Pittsburg St. Gorillas,614964,Ark.-Fort Smith Lions,614964,7,bot,A. Bercher advanced to second on a wild pitch.,107,2026-03-01T14:00:00-05:00,"Crowder Field (Fort Smith, AR)",232,MBA,2026
6518598,614894,Pittsburg St. Gorillas,614964,Ark.-Fort Smith Lions,614964,7,bot,"J. Young doubled down the lf line, 2 RBI3a A. Bercher scored3a A. Kudler scored.",108,2026-03-01T14:00:00-05:00,"Crowder Field (Fort Smith, AR)",232,MBA,2026
6518598,614894,Pittsburg St. Gorillas,614964,Ark.-Fort Smith Lions,614964,7,bot,L. Lundquist pinch hit for C. Eisenhowe.,109,2026-03-01T14:00:00-05:00,"Crowder Field (Fort Smith, AR)",232,MBA,2026
6518598,614894,Pittsburg St. Gorillas,614964,Ark.-Fort Smith Lions,614964,7,bot,L. Lundquist grounded out to 2b.,110,2026-03-01T14:00:00-05:00,"Crowder Field (Fort Smith, AR)",232,MBA,2026
6518598,614894,Pittsburg St. Gorillas,614964,Ark.-Fort Smith Lions,614894,8,top,T. Wiley to lf.,111,2026-03-01T14:00:00-05:00,"Crowder Field (Fort Smith, AR)",232,MBA,2026
6518598,614894,Pittsburg St. Gorillas,614964,Ark.-Fort Smith Lions,614894,8,top,A. Bercher to dh.,112,2026-03-01T14:00:00-05:00,"Crowder Field (Fort Smith, AR)",232,MBA,2026
6518598,614894,Pittsburg St. Gorillas,614964,Ark.-Fort Smith Lions,614894,8,top,J. Young to cf.,113,2026-03-01T14:00:00-05:00,"Crowder Field (Fort Smith, AR)",232,MBA,2026
6518598,614894,Pittsburg St. Gorillas,614964,Ark.-Fort Smith Lions,614894,8,top,L. Lundquist to 1b.,114,2026-03-01T14:00:00-05:00,"Crowder Field (Fort Smith, AR)",232,MBA,2026
