game_id,away_team_id,away_team_name,home_team_id,home_team_name,batting_team,inning,top_bot,event_text,event_num,game_datetime,stadium_name,attendance,sport_id,season
6519470,615123,Chaminade Silverswords,614989,CUI Golden Eagles,615123,1,top,C. Fujii struck out looking.,1,2026-02-13T17:00:00-05:00,"Golden Eagles Field (Irvine, CA)",0,MBA,2026
6519470,615123,Chaminade Silverswords,614989,CUI Golden Eagles,615123,1,top,T. Mooney grounded out to p unassisted.,2,2026-02-13T17:00:00-05:00,"Golden Eagles Field (Irvine, CA)",0,MBA,2026
6519470,615123,Chaminade Silverswords,614989,CUI Golden Eagles,615123,1,top,T. Ayala struck out looking.,3,2026-02-13T17:00:00-05:00,"Golden Eagles Field (Irvine, CA)",0,MBA,2026
6519470,615123,Chaminade Silverswords,614989,CUI Golden Eagles,614989,1,bot,N. Caira flied out to cf.,4,2026-02-13T17:00:00-05:00,"Golden Eagles Field (Irvine, CA)",0,MBA,2026
6519470,615123,Chaminade Silverswords,614989,CUI Golden Eagles,614989,1,bot,W. Madison flied out to ss.,5,2026-02-13T17:00:00-05:00,"Golden Eagles Field (Irvine, CA)",0,MBA,2026
6519470,615123,Chaminade Silverswords,614989,CUI Golden Eagles,614989,1,bot,I. Walz flied out to cf.,6,2026-02-13T17:00:00-05:00,"Golden Eagles Field (Irvine, CA)",0,MBA,2026
6519470,615123,Chaminade Silverswords,614989,CUI Golden Eagles,615123,2,top,B. Poler doubled down the rf line.,7,2026-02-13T17:00:00-05:00,"Golden Eagles Field (Irvine, CA)",0,MBA,2026
6519470,615123,Chaminade Silverswords,614989,CUI Golden Eagles,615123,2,top,A. Karns struck out swinging.,8,2026-02-13T17:00:00-05:00,"Golden Eagles Field (Irvine, CA)",0,MBA,2026
6519470,615123,Chaminade Silverswords,614989,CUI Golden Eagles,615123,2,top,A. Greb reached on a fielder's choice3a B. Poler out at third p to 3b to 2b.,9,2026-02-13T17:00:00-05:00,"Golden Eagles Field (Irvine, CA)",0,MBA,2026
6519470,615123,Chaminade Silverswords,614989,CUI Golden Eagles,615123,2,top,"A. Greb out at first c to ss, picked off.",10,2026-02-13T17:00:00-05:00,"Golden Eagles Field (Irvine, CA)",0,MBA,2026
6519470,615123,Chaminade Silverswords,614989,CUI Golden Eagles,614989,2,bot,D. Knowles doubled to left field.,11,2026-02-13T17:00:00-05:00,"Golden Eagles Field (Irvine, CA)",0,MBA,2026
6519470,615123,Chaminade Silverswords,614989,CUI Golden Eagles,614989,2,bot,L. Spitler fouled out to 1b.,12,2026-02-13T17:00:00-05:00,"Golden Eagles Field (Irvine, CA)",0,MBA,2026
6519470,615123,Chaminade Silverswords,614989,CUI Golden Eagles,614989,2,bot,Baruch II struck out swinging.,13,2026-02-13T17:00:00-05:00,"Golden Eagles Field (Irvine, CA)",0,MBA,2026
6519470,615123,Chaminade Silverswords,614989,CUI Golden Eagles,614989,2,bot,"J. Bolden doubled to left center, RBI3a D. Knowles scored.",14,2026-02-13T17:00:00-05:00,"Golden Eagles Field (Irvine, CA)",0,MBA,2026
6519470,615123,Chaminade Silverswords,614989,CUI Golden Eagles,614989,2,bot,I. Stewart struck out swinging.,15,2026-02-13T17:00:00-05:00,"Golden Eagles Field (Irvine, CA)",0,MBA,2026
6519470,615123,Chaminade Silverswords,614989,CUI Golden Eagles,615123,3,top,C. Wagner grounded out to 2b.,16,2026-02-13T17:00:00-05:00,"Golden Eagles Field (Irvine, CA)",0,MBA,2026
6519470,615123,Chaminade Silverswords,614989,CUI Golden Eagles,615123,3,top,E. Williams walked.,17,2026-02-13T17:00:00-05:00,"Golden Eagles Field (Irvine, CA)",0,MBA,2026
6519470,615123,Chaminade Silverswords,614989,CUI Golden Eagles,615123,3,top,B. Braga struck out swinging.,18,2026-02-13T17:00:00-05:00,"Golden Eagles Field (Irvine, CA)",0,MBA,2026
6519470,615123,Chaminade Silverswords,614989,CUI Golden Eagles,615123,3,top,E. Williams stole second.,19,2026-02-13T17:00:00-05:00,"Golden Eagles Field (Irvine, CA)",0,MBA,2026
6519470,615123,Chaminade Silverswords,614989,CUI Golden Eagles,615123,3,top,C. Fujii grounded out to 3b.,20,2026-02-13T17:00:00-05:00,"Golden Eagles Field (Irvine, CA)",0,MBA,2026
6519470,615123,Chaminade Silverswords,614989,CUI Golden Eagles,614989,3,bot,N. Erickson struck out swinging.,21,2026-02-13T17:00:00-05:00,"Golden Eagles Field (Irvine, CA)",0,MBA,2026
6519470,615123,Chaminade Silverswords,614989,CUI Golden Eagles,614989,3,bot,"N. Caira homered to right center, RBI.",22,2026-02-13T17:00:00-05:00,"Golden Eagles Field (Irvine, CA)",0,MBA,2026
6519470,615123,Chaminade Silverswords,614989,CUI Golden Eagles,614989,3,bot,W. Madison grounded out to 2b.,23,2026-02-13T17:00:00-05:00,"Golden Eagles Field (Irvine, CA)",0,MBA,2026
6519470,615123,Chaminade Silverswords,614989,CUI Golden Eagles,614989,3,bot,I. Walz flied out to cf.,24,2026-02-13T17:00:00-05:00,"Golden Eagles Field (Irvine, CA)",0,MBA,2026
6519470,615123,Chaminade Silverswords,614989,CUI Golden Eagles,615123,4,top,T. Mooney grounded out to 2b.,25,2026-02-13T17:00:00-05:00,"Golden Eagles Field (Irvine, CA)",0,MBA,2026
6519470,615123,Chaminade Silverswords,614989,CUI Golden Eagles,615123,4,top,T. Ayala grounded out to 2b.,26,2026-02-13T17:00:00-05:00,"Golden Eagles Field (Irvine, CA)",0,MBA,2026
6519470,615123,Chaminade Silverswords,614989,CUI Golden Eagles,615123,4,top,B. Poler grounded out to 2b.,27,2026-02-13T17:00:00-05:00,"Golden Eagles Field (Irvine, CA)",0,MBA,2026
6519470,615123,Chaminade Silverswords,614989,CUI Golden Eagles,614989,4,bot,D. Knowles reached first on an error by 2b.,28,2026-02-13T17:00:00-05:00,"Golden Eagles Field (Irvine, CA)",0,MBA,2026
6519470,615123,Chaminade Silverswords,614989,CUI Golden Eagles,614989,4,bot,L. Spitler singled to left field3a D. Knowles advanced to second.,29,2026-02-13T17:00:00-05:00,"Golden Eagles Field (Irvine, CA)",0,MBA,2026
6519470,615123,Chaminade Silverswords,614989,CUI Golden Eagles,614989,4,bot,"Baruch II grounded out to p, SAC, bunt3a L. Spitler advanced to second3a D. Knowles advanced to third.",30,2026-02-13T17:00:00-05:00,"Golden Eagles Field (Irvine, CA)",0,MBA,2026
6519470,615123,Chaminade Silverswords,614989,CUI Golden Eagles,614989,4,bot,"J. Bolden grounded out to 2b, RBI3a L. Spitler advanced to third3a D. Knowles scored, unearned.",31,2026-02-13T17:00:00-05:00,"Golden Eagles Field (Irvine, CA)",0,MBA,2026
6519470,615123,Chaminade Silverswords,614989,CUI Golden Eagles,614989,4,bot,I. Stewart flied out to cf to left center.,32,2026-02-13T17:00:00-05:00,"Golden Eagles Field (Irvine, CA)",0,MBA,2026
6519470,615123,Chaminade Silverswords,614989,CUI Golden Eagles,615123,5,top,A. Karns struck out looking.,33,2026-02-13T17:00:00-05:00,"Golden Eagles Field (Irvine, CA)",0,MBA,2026
6519470,615123,Chaminade Silverswords,614989,CUI Golden Eagles,615123,5,top,A. Greb grounded out to ss.,34,2026-02-13T17:00:00-05:00,"Golden Eagles Field (Irvine, CA)",0,MBA,2026
6519470,615123,Chaminade Silverswords,614989,CUI Golden Eagles,615123,5,top,C. Wagner flied out to lf.,35,2026-02-13T17:00:00-05:00,"Golden Eagles Field (Irvine, CA)",0,MBA,2026
6519470,615123,Chaminade Silverswords,614989,CUI Golden Eagles,614989,5,bot,N. Erickson struck out swinging.,36,2026-02-13T17:00:00-05:00,"Golden Eagles Field (Irvine, CA)",0,MBA,2026
6519470,615123,Chaminade Silverswords,614989,CUI Golden Eagles,614989,5,bot,N. Caira struck out swinging.,37,2026-02-13T17:00:00-05:00,"Golden Eagles Field (Irvine, CA)",0,MBA,2026
6519470,615123,Chaminade Silverswords,614989,CUI Golden Eagles,614989,5,bot,W. Madison flied out to cf.,38,2026-02-13T17:00:00-05:00,"Golden Eagles Field (Irvine, CA)",0,MBA,2026
6519470,615123,Chaminade Silverswords,614989,CUI Golden Eagles,615123,6,top,E. Williams struck out swinging.,39,2026-02-13T17:00:00-05:00,"Golden Eagles Field (Irvine, CA)",0,MBA,2026
6519470,615123,Chaminade Silverswords,614989,CUI Golden Eagles,615123,6,top,B. Braga singled to left field.,40,2026-02-13T17:00:00-05:00,"Golden Eagles Field (Irvine, CA)",0,MBA,2026
6519470,615123,Chaminade Silverswords,614989,CUI Golden Eagles,615123,6,top,C. Fujii flied out to rf.,41,2026-02-13T17:00:00-05:00,"Golden Eagles Field (Irvine, CA)",0,MBA,2026
6519470,615123,Chaminade Silverswords,614989,CUI Golden Eagles,615123,6,top,T. Mooney walked3a B. Braga advanced to second.,42,2026-02-13T17:00:00-05:00,"Golden Eagles Field (Irvine, CA)",0,MBA,2026
6519470,615123,Chaminade Silverswords,614989,CUI Golden Eagles,615123,6,top,T. Ayala grounded out to 2b.,43,2026-02-13T17:00:00-05:00,"Golden Eagles Field (Irvine, CA)",0,MBA,2026
6519470,615123,Chaminade Silverswords,614989,CUI Golden Eagles,614989,6,bot,I. Walz singled to center field.,44,2026-02-13T17:00:00-05:00,"Golden Eagles Field (Irvine, CA)",0,MBA,2026
6519470,615123,Chaminade Silverswords,614989,CUI Golden Eagles,614989,6,bot,I. Walz advanced to second on a passed ball.,45,2026-02-13T17:00:00-05:00,"Golden Eagles Field (Irvine, CA)",0,MBA,2026
6519470,615123,Chaminade Silverswords,614989,CUI Golden Eagles,614989,6,bot,D. Knowles singled to right field3a I. Walz advanced to third.,46,2026-02-13T17:00:00-05:00,"Golden Eagles Field (Irvine, CA)",0,MBA,2026
6519470,615123,Chaminade Silverswords,614989,CUI Golden Eagles,614989,6,bot,D. Knowles stole second.,47,2026-02-13T17:00:00-05:00,"Golden Eagles Field (Irvine, CA)",0,MBA,2026
6519470,615123,Chaminade Silverswords,614989,CUI Golden Eagles,614989,6,bot,"L. Spitler grounded out to c, RBI3a I. Walz scored.",48,2026-02-13T17:00:00-05:00,"Golden Eagles Field (Irvine, CA)",0,MBA,2026
6519470,615123,Chaminade Silverswords,614989,CUI Golden Eagles,614989,6,bot,Baruch II grounded out to p3a D. Knowles advanced to third.,49,2026-02-13T17:00:00-05:00,"Golden Eagles Field (Irvine, CA)",0,MBA,2026
6519470,615123,Chaminade Silverswords,614989,CUI Golden Eagles,614989,6,bot,K. Seo to p for C. Cody.,50,2026-02-13T17:00:00-05:00,"Golden Eagles Field (Irvine, CA)",0,MBA,2026
6519470,615123,Chaminade Silverswords,614989,CUI Golden Eagles,614989,6,bot,J. Bolden grounded out to p.,51,2026-02-13T17:00:00-05:00,"Golden Eagles Field (Irvine, CA)",0,MBA,2026
6519470,615123,Chaminade Silverswords,614989,CUI Golden Eagles,615123,7,top,"B. Poler struck out swinging, out at first c to 1b.",52,2026-02-13T17:00:00-05:00,"Golden Eagles Field (Irvine, CA)",0,MBA,2026
6519470,615123,Chaminade Silverswords,614989,CUI Golden Eagles,615123,7,top,C. Breeze pinch hit for A. Karns.,53,2026-02-13T17:00:00-05:00,"Golden Eagles Field (Irvine, CA)",0,MBA,2026
6519470,615123,Chaminade Silverswords,614989,CUI Golden Eagles,615123,7,top,C. Breeze walked.,54,2026-02-13T17:00:00-05:00,"Golden Eagles Field (Irvine, CA)",0,MBA,2026
6519470,615123,Chaminade Silverswords,614989,CUI Golden Eagles,615123,7,top,C. Kim pinch ran for C. Breeze.,55,2026-02-13T17:00:00-05:00,"Golden Eagles Field (Irvine, CA)",0,MBA,2026
6519470,615123,Chaminade Silverswords,614989,CUI Golden Eagles,615123,7,top,A. Greb grounded into double play ss to 2b to 1b3a C. Kim out on the play.,56,2026-02-13T17:00:00-05:00,"Golden Eagles Field (Irvine, CA)",0,MBA,2026
6519470,615123,Chaminade Silverswords,614989,CUI Golden Eagles,614989,7,bot,I. Stewart grounded out to p.,57,2026-02-13T17:00:00-05:00,"Golden Eagles Field (Irvine, CA)",0,MBA,2026
6519470,615123,Chaminade Silverswords,614989,CUI Golden Eagles,614989,7,bot,N. Erickson hit by pitch.,58,2026-02-13T17:00:00-05:00,"Golden Eagles Field (Irvine, CA)",0,MBA,2026
6519470,615123,Chaminade Silverswords,614989,CUI Golden Eagles,614989,7,bot,N. Caira flied out to lf to left center.,59,2026-02-13T17:00:00-05:00,"Golden Eagles Field (Irvine, CA)",0,MBA,2026
6519470,615123,Chaminade Silverswords,614989,CUI Golden Eagles,614989,7,bot,W. Madison reached first on an error by 2b3a N. Erickson advanced to third.,60,2026-02-13T17:00:00-05:00,"Golden Eagles Field (Irvine, CA)",0,MBA,2026
6519470,615123,Chaminade Silverswords,614989,CUI Golden Eagles,614989,7,bot,I. Walz grounded out to ss.,61,2026-02-13T17:00:00-05:00,"Golden Eagles Field (Irvine, CA)",0,MBA,2026
6519470,615123,Chaminade Silverswords,614989,CUI Golden Eagles,615123,8,top,M. Panichi to p for S. Timmons.,62,2026-02-13T17:00:00-05:00,"Golden Eagles Field (Irvine, CA)",0,MBA,2026
6519470,615123,Chaminade Silverswords,614989,CUI Golden Eagles,615123,8,top,N. Caira to lf.,63,2026-02-13T17:00:00-05:00,"Golden Eagles Field (Irvine, CA)",0,MBA,2026
6519470,615123,Chaminade Silverswords,614989,CUI Golden Eagles,615123,8,top,J. Bolden to rf.,64,2026-02-13T17:00:00-05:00,"Golden Eagles Field (Irvine, CA)",0,MBA,2026
6519470,615123,Chaminade Silverswords,614989,CUI Golden Eagles,615123,8,top,S. Voortman to cf for N. Erickson.,65,2026-02-13T17:00:00-05:00,"Golden Eagles Field (Irvine, CA)",0,MBA,2026
6519470,615123,Chaminade Silverswords,614989,CUI Golden Eagles,615123,8,top,H. Clark pinch hit for C. Wagner.,66,2026-02-13T17:00:00-05:00,"Golden Eagles Field (Irvine, CA)",0,MBA,2026
6519470,615123,Chaminade Silverswords,614989,CUI Golden Eagles,615123,8,top,"H. Clark singled, advanced to second on an error by lf.",67,2026-02-13T17:00:00-05:00,"Golden Eagles Field (Irvine, CA)",0,MBA,2026
6519470,615123,Chaminade Silverswords,614989,CUI Golden Eagles,615123,8,top,A. Perry pinch ran for H. Clark.,68,2026-02-13T17:00:00-05:00,"Golden Eagles Field (Irvine, CA)",0,MBA,2026
6519470,615123,Chaminade Silverswords,614989,CUI Golden Eagles,615123,8,top,E. Williams singled to shortstop3a A. Perry advanced to third.,69,2026-02-13T17:00:00-05:00,"Golden Eagles Field (Irvine, CA)",0,MBA,2026
6519470,615123,Chaminade Silverswords,614989,CUI Golden Eagles,615123,8,top,"B. Braga flied out to lf, SAC, RBI3a A. Perry scored.",70,2026-02-13T17:00:00-05:00,"Golden Eagles Field (Irvine, CA)",0,MBA,2026
6519470,615123,Chaminade Silverswords,614989,CUI Golden Eagles,615123,8,top,C. Fujii flied out to cf.,71,2026-02-13T17:00:00-05:00,"Golden Eagles Field (Irvine, CA)",0,MBA,2026
6519470,615123,Chaminade Silverswords,614989,CUI Golden Eagles,615123,8,top,E. Williams stole second.,72,2026-02-13T17:00:00-05:00,"Golden Eagles Field (Irvine, CA)",0,MBA,2026
6519470,615123,Chaminade Silverswords,614989,CUI Golden Eagles,615123,8,top,T. Mooney fouled out to lf.,73,2026-02-13T17:00:00-05:00,"Golden Eagles Field (Irvine, CA)",0,MBA,2026
6519470,615123,Chaminade Silverswords,614989,CUI Golden Eagles,614989,8,bot,B. Poler to rf.,74,2026-02-13T17:00:00-05:00,"Golden Eagles Field (Irvine, CA)",0,MBA,2026
6519470,615123,Chaminade Silverswords,614989,CUI Golden Eagles,614989,8,bot,C. Kim to dh.,75,2026-02-13T17:00:00-05:00,"Golden Eagles Field (Irvine, CA)",0,MBA,2026
6519470,615123,Chaminade Silverswords,614989,CUI Golden Eagles,614989,8,bot,A. Perry to cf.,76,2026-02-13T17:00:00-05:00,"Golden Eagles Field (Irvine, CA)",0,MBA,2026
6519470,615123,Chaminade Silverswords,614989,CUI Golden Eagles,614989,8,bot,A. Greb to lf.,77,2026-02-13T17:00:00-05:00,"Golden Eagles Field (Irvine, CA)",0,MBA,2026
6519470,615123,Chaminade Silverswords,614989,CUI Golden Eagles,614989,8,bot,D. Knowles flied out to rf.,78,2026-02-13T17:00:00-05:00,"Golden Eagles Field (Irvine, CA)",0,MBA,2026
6519470,615123,Chaminade Silverswords,614989,CUI Golden Eagles,614989,8,bot,L. Spitler struck out swinging.,79,2026-02-13T17:00:00-05:00,"Golden Eagles Field (Irvine, CA)",0,MBA,2026
6519470,615123,Chaminade Silverswords,614989,CUI Golden Eagles,614989,8,bot,Baruch II grounded out to 2b.,80,2026-02-13T17:00:00-05:00,"Golden Eagles Field (Irvine, CA)",0,MBA,2026
6519470,615123,Chaminade Silverswords,614989,CUI Golden Eagles,615123,9,top,T. Ayala lined out to rf.,81,2026-02-13T17:00:00-05:00,"Golden Eagles Field (Irvine, CA)",0,MBA,2026
6519470,615123,Chaminade Silverswords,614989,CUI Golden Eagles,615123,9,top,"B. Poler struck out swinging, out at first c to 1b.",82,2026-02-13T17:00:00-05:00,"Golden Eagles Field (Irvine, CA)",0,MBA,2026
6519470,615123,Chaminade Silverswords,614989,CUI Golden Eagles,615123,9,top,C. Kim walked.,83,2026-02-13T17:00:00-05:00,"Golden Eagles Field (Irvine, CA)",0,MBA,2026
6519470,615123,Chaminade Silverswords,614989,CUI Golden Eagles,615123,9,top,A. Greb reached on a fielder's choice3a C. Kim out at second 3b to 2b.,84,2026-02-13T17:00:00-05:00,"Golden Eagles Field (Irvine, CA)",0,MBA,2026
