game_id,away_team_id,away_team_name,home_team_id,home_team_name,batting_team,inning,top_bot,event_text,event_num,game_datetime,stadium_name,attendance,sport_id,season
6526500,615434,Maranatha Baptist Sabercats,615398,Wis.-Platteville Pioneers,615434,1,top,Reece Martin struck out looking (1-2 BKSK).,1,2026-03-09T15:00:00-04:00,"Washington Park (Watertown, WI)",58,MBA,2026
6526500,615434,Maranatha Baptist Sabercats,615398,Wis.-Platteville Pioneers,615434,1,top,Emerson Pease struck out swinging (2-2 BSSBS).,2,2026-03-09T15:00:00-04:00,"Washington Park (Watertown, WI)",58,MBA,2026
6526500,615434,Maranatha Baptist Sabercats,615398,Wis.-Platteville Pioneers,615434,1,top,Jonathan Jeske walked (3-2 BKBFBFB).,3,2026-03-09T15:00:00-04:00,"Washington Park (Watertown, WI)",58,MBA,2026
6526500,615434,Maranatha Baptist Sabercats,615398,Wis.-Platteville Pioneers,615434,1,top,Teddy Haugen grounded out to p (2-2 BFBFF).,4,2026-03-09T15:00:00-04:00,"Washington Park (Watertown, WI)",58,MBA,2026
6526500,615434,Maranatha Baptist Sabercats,615398,Wis.-Platteville Pioneers,615398,1,bot,Trinity Beland singled through the left side (1-0 B).,5,2026-03-09T15:00:00-04:00,"Washington Park (Watertown, WI)",58,MBA,2026
6526500,615434,Maranatha Baptist Sabercats,615398,Wis.-Platteville Pioneers,615398,1,bot,Trinity Beland stole second.,6,2026-03-09T15:00:00-04:00,"Washington Park (Watertown, WI)",58,MBA,2026
6526500,615434,Maranatha Baptist Sabercats,615398,Wis.-Platteville Pioneers,615398,1,bot,Caleb Parker grounded out to 1b unassisted (1-1 KB)3a Trinity Beland advanced to third.,7,2026-03-09T15:00:00-04:00,"Washington Park (Watertown, WI)",58,MBA,2026
6526500,615434,Maranatha Baptist Sabercats,615398,Wis.-Platteville Pioneers,615398,1,bot,"Anthony Massa singled to second base, RBI (1-1 BK)3a Trinity Beland scored.",8,2026-03-09T15:00:00-04:00,"Washington Park (Watertown, WI)",58,MBA,2026
6526500,615434,Maranatha Baptist Sabercats,615398,Wis.-Platteville Pioneers,615398,1,bot,Connor Gresens singled through the right side (2-2 BKBK)3a Anthony Massa advanced to second.,9,2026-03-09T15:00:00-04:00,"Washington Park (Watertown, WI)",58,MBA,2026
6526500,615434,Maranatha Baptist Sabercats,615398,Wis.-Platteville Pioneers,615398,1,bot,Tarron Bockhop struck out swinging (3-2 BBKBKS)3a Connor Gresens stole second3a Anthony Massa stole third.,10,2026-03-09T15:00:00-04:00,"Washington Park (Watertown, WI)",58,MBA,2026
6526500,615434,Maranatha Baptist Sabercats,615398,Wis.-Platteville Pioneers,615398,1,bot,"Kaleb Elwood reached first on a fielding error by 2b (1-1 KB)3a Connor Gresens advanced to third3a Anthony Massa scored, unearned.",11,2026-03-09T15:00:00-04:00,"Washington Park (Watertown, WI)",58,MBA,2026
6526500,615434,Maranatha Baptist Sabercats,615398,Wis.-Platteville Pioneers,615398,1,bot,"Kaleb Elwood advanced to second on a throwing error by p, advanced to third3a Connor Gresens scored, unearned.",12,2026-03-09T15:00:00-04:00,"Washington Park (Watertown, WI)",58,MBA,2026
6526500,615434,Maranatha Baptist Sabercats,615398,Wis.-Platteville Pioneers,615398,1,bot,"Mason Molitor singled to left field, RBI (1-0 B)3a Kaleb Elwood scored, unearned.",13,2026-03-09T15:00:00-04:00,"Washington Park (Watertown, WI)",58,MBA,2026
6526500,615434,Maranatha Baptist Sabercats,615398,Wis.-Platteville Pioneers,615398,1,bot,Dylan Rippentrop walked (3-2 KKBBFBB)3a Mason Molitor advanced to second.,14,2026-03-09T15:00:00-04:00,"Washington Park (Watertown, WI)",58,MBA,2026
6526500,615434,Maranatha Baptist Sabercats,615398,Wis.-Platteville Pioneers,615398,1,bot,Brayden Knoll singled to first base (2-2 BKBS)3a Dylan Rippentrop advanced to second3a Mason Molitor advanced to third.,15,2026-03-09T15:00:00-04:00,"Washington Park (Watertown, WI)",58,MBA,2026
6526500,615434,Maranatha Baptist Sabercats,615398,Wis.-Platteville Pioneers,615398,1,bot,"Brayden Knoll advanced to second3a Dylan Rippentrop advanced to third3a Mason Molitor scored on a passed ball, unearned.",16,2026-03-09T15:00:00-04:00,"Washington Park (Watertown, WI)",58,MBA,2026
6526500,615434,Maranatha Baptist Sabercats,615398,Wis.-Platteville Pioneers,615398,1,bot,Trinity Beland flied out to rf (2-1 KBB).,17,2026-03-09T15:00:00-04:00,"Washington Park (Watertown, WI)",58,MBA,2026
6526500,615434,Maranatha Baptist Sabercats,615398,Wis.-Platteville Pioneers,615434,2,top,Judson Martin grounded out to p (1-2 KBS).,18,2026-03-09T15:00:00-04:00,"Washington Park (Watertown, WI)",58,MBA,2026
6526500,615434,Maranatha Baptist Sabercats,615398,Wis.-Platteville Pioneers,615434,2,top,Sebastian Martin singled to right field (0-2 FF).,19,2026-03-09T15:00:00-04:00,"Washington Park (Watertown, WI)",58,MBA,2026
6526500,615434,Maranatha Baptist Sabercats,615398,Wis.-Platteville Pioneers,615434,2,top,Cameron Spencer struck out swinging (0-2 FKS).,20,2026-03-09T15:00:00-04:00,"Washington Park (Watertown, WI)",58,MBA,2026
6526500,615434,Maranatha Baptist Sabercats,615398,Wis.-Platteville Pioneers,615434,2,top,"Sebastian Martin out at first p to 1b, picked off.",21,2026-03-09T15:00:00-04:00,"Washington Park (Watertown, WI)",58,MBA,2026
6526500,615434,Maranatha Baptist Sabercats,615398,Wis.-Platteville Pioneers,615398,2,bot,Caleb Parker reached first on a fielding error by 2b (1-1 BF).,22,2026-03-09T15:00:00-04:00,"Washington Park (Watertown, WI)",58,MBA,2026
6526500,615434,Maranatha Baptist Sabercats,615398,Wis.-Platteville Pioneers,615398,2,bot,Anthony Massa lined out to 2b (0-0).,23,2026-03-09T15:00:00-04:00,"Washington Park (Watertown, WI)",58,MBA,2026
6526500,615434,Maranatha Baptist Sabercats,615398,Wis.-Platteville Pioneers,615398,2,bot,Connor Gresens flied out to cf (0-0).,24,2026-03-09T15:00:00-04:00,"Washington Park (Watertown, WI)",58,MBA,2026
6526500,615434,Maranatha Baptist Sabercats,615398,Wis.-Platteville Pioneers,615398,2,bot,Caleb Parker stole second.,25,2026-03-09T15:00:00-04:00,"Washington Park (Watertown, WI)",58,MBA,2026
6526500,615434,Maranatha Baptist Sabercats,615398,Wis.-Platteville Pioneers,615398,2,bot,Tarron Bockhop flied out to lf (3-2 KBKBB).,26,2026-03-09T15:00:00-04:00,"Washington Park (Watertown, WI)",58,MBA,2026
6526500,615434,Maranatha Baptist Sabercats,615398,Wis.-Platteville Pioneers,615434,3,top,Ben Werner struck out swinging (0-2 KFS).,27,2026-03-09T15:00:00-04:00,"Washington Park (Watertown, WI)",58,MBA,2026
6526500,615434,Maranatha Baptist Sabercats,615398,Wis.-Platteville Pioneers,615434,3,top,Timothy Searle struck out looking (3-2 BBBKKK).,28,2026-03-09T15:00:00-04:00,"Washington Park (Watertown, WI)",58,MBA,2026
6526500,615434,Maranatha Baptist Sabercats,615398,Wis.-Platteville Pioneers,615434,3,top,Reece Martin popped up to ss (0-0).,29,2026-03-09T15:00:00-04:00,"Washington Park (Watertown, WI)",58,MBA,2026
6526500,615434,Maranatha Baptist Sabercats,615398,Wis.-Platteville Pioneers,615398,3,bot,Kaleb Elwood walked (3-1 BBBKB).,30,2026-03-09T15:00:00-04:00,"Washington Park (Watertown, WI)",58,MBA,2026
6526500,615434,Maranatha Baptist Sabercats,615398,Wis.-Platteville Pioneers,615398,3,bot,"Kaleb Elwood advanced to second on a throwing error by 1b, advanced to third.",31,2026-03-09T15:00:00-04:00,"Washington Park (Watertown, WI)",58,MBA,2026
6526500,615434,Maranatha Baptist Sabercats,615398,Wis.-Platteville Pioneers,615398,3,bot,"Mason Molitor singled to center field, RBI (0-1 K)3a Kaleb Elwood scored.",32,2026-03-09T15:00:00-04:00,"Washington Park (Watertown, WI)",58,MBA,2026
6526500,615434,Maranatha Baptist Sabercats,615398,Wis.-Platteville Pioneers,615398,3,bot,Dylan Rippentrop reached on a fielder's choice to pitcher (1-1 BF)3a Mason Molitor out at second p to ss.,33,2026-03-09T15:00:00-04:00,"Washington Park (Watertown, WI)",58,MBA,2026
6526500,615434,Maranatha Baptist Sabercats,615398,Wis.-Platteville Pioneers,615398,3,bot,Brayden Knoll struck out swinging (1-2 FFBFS).,34,2026-03-09T15:00:00-04:00,"Washington Park (Watertown, WI)",58,MBA,2026
6526500,615434,Maranatha Baptist Sabercats,615398,Wis.-Platteville Pioneers,615398,3,bot,"Trinity Beland singled to left center, advanced to second on the throw (2-2 KKBFB)3a Dylan Rippentrop advanced to third.",35,2026-03-09T15:00:00-04:00,"Washington Park (Watertown, WI)",58,MBA,2026
6526500,615434,Maranatha Baptist Sabercats,615398,Wis.-Platteville Pioneers,615398,3,bot,"Caleb Parker doubled to left center, 2 RBI (0-1 F)3a Trinity Beland scored3a Dylan Rippentrop scored.",36,2026-03-09T15:00:00-04:00,"Washington Park (Watertown, WI)",58,MBA,2026
6526500,615434,Maranatha Baptist Sabercats,615398,Wis.-Platteville Pioneers,615398,3,bot,"Anthony Massa doubled to right field, RBI (0-1 K)3a Caleb Parker scored.",37,2026-03-09T15:00:00-04:00,"Washington Park (Watertown, WI)",58,MBA,2026
6526500,615434,Maranatha Baptist Sabercats,615398,Wis.-Platteville Pioneers,615398,3,bot,"Connor Gresens singled through the right side, RBI (1-0 B)3a Anthony Massa scored.",38,2026-03-09T15:00:00-04:00,"Washington Park (Watertown, WI)",58,MBA,2026
6526500,615434,Maranatha Baptist Sabercats,615398,Wis.-Platteville Pioneers,615398,3,bot,Tarron Bockhop flied out to cf (0-1 K).,39,2026-03-09T15:00:00-04:00,"Washington Park (Watertown, WI)",58,MBA,2026
6526500,615434,Maranatha Baptist Sabercats,615398,Wis.-Platteville Pioneers,615434,4,top,Emerson Pease grounded out to 3b (2-0 BB).,40,2026-03-09T15:00:00-04:00,"Washington Park (Watertown, WI)",58,MBA,2026
6526500,615434,Maranatha Baptist Sabercats,615398,Wis.-Platteville Pioneers,615434,4,top,Jonathan Jeske singled to center field (1-0 B).,41,2026-03-09T15:00:00-04:00,"Washington Park (Watertown, WI)",58,MBA,2026
6526500,615434,Maranatha Baptist Sabercats,615398,Wis.-Platteville Pioneers,615434,4,top,Teddy Haugen reached on a fielder's choice to shortstop (0-0)3a Jonathan Jeske out at second ss to 2b.,42,2026-03-09T15:00:00-04:00,"Washington Park (Watertown, WI)",58,MBA,2026
6526500,615434,Maranatha Baptist Sabercats,615398,Wis.-Platteville Pioneers,615434,4,top,Judson Martin singled to center field (1-2 KBFF)3a Teddy Haugen advanced to second.,43,2026-03-09T15:00:00-04:00,"Washington Park (Watertown, WI)",58,MBA,2026
6526500,615434,Maranatha Baptist Sabercats,615398,Wis.-Platteville Pioneers,615434,4,top,Sebastian Martin struck out looking (1-2 SSBK).,44,2026-03-09T15:00:00-04:00,"Washington Park (Watertown, WI)",58,MBA,2026
6526500,615434,Maranatha Baptist Sabercats,615398,Wis.-Platteville Pioneers,615398,4,bot,"Kaleb Elwood popped up to p, bunt (0-0).",45,2026-03-09T15:00:00-04:00,"Washington Park (Watertown, WI)",58,MBA,2026
6526500,615434,Maranatha Baptist Sabercats,615398,Wis.-Platteville Pioneers,615398,4,bot,Mason Molitor grounded out to 2b (1-2 KFB).,46,2026-03-09T15:00:00-04:00,"Washington Park (Watertown, WI)",58,MBA,2026
6526500,615434,Maranatha Baptist Sabercats,615398,Wis.-Platteville Pioneers,615398,4,bot,Dylan Rippentrop doubled to right field (1-2 BKFFF).,47,2026-03-09T15:00:00-04:00,"Washington Park (Watertown, WI)",58,MBA,2026
6526500,615434,Maranatha Baptist Sabercats,615398,Wis.-Platteville Pioneers,615398,4,bot,Brayden Knoll grounded out to 2b (0-0).,48,2026-03-09T15:00:00-04:00,"Washington Park (Watertown, WI)",58,MBA,2026
6526500,615434,Maranatha Baptist Sabercats,615398,Wis.-Platteville Pioneers,615434,5,top,Pierce Nelson to p for Jordan Stanton.,49,2026-03-09T15:00:00-04:00,"Washington Park (Watertown, WI)",58,MBA,2026
6526500,615434,Maranatha Baptist Sabercats,615398,Wis.-Platteville Pioneers,615434,5,top,Ethan Birkel to c for Connor Gresens.,50,2026-03-09T15:00:00-04:00,"Washington Park (Watertown, WI)",58,MBA,2026
6526500,615434,Maranatha Baptist Sabercats,615398,Wis.-Platteville Pioneers,615434,5,top,Cameron Spencer struck out looking (1-2 KFBK).,51,2026-03-09T15:00:00-04:00,"Washington Park (Watertown, WI)",58,MBA,2026
6526500,615434,Maranatha Baptist Sabercats,615398,Wis.-Platteville Pioneers,615434,5,top,Ben Werner struck out swinging (2-2 KKBBS).,52,2026-03-09T15:00:00-04:00,"Washington Park (Watertown, WI)",58,MBA,2026
6526500,615434,Maranatha Baptist Sabercats,615398,Wis.-Platteville Pioneers,615434,5,top,Timothy Searle struck out looking (1-2 KFBK).,53,2026-03-09T15:00:00-04:00,"Washington Park (Watertown, WI)",58,MBA,2026
6526500,615434,Maranatha Baptist Sabercats,615398,Wis.-Platteville Pioneers,615398,5,bot,Trinity Beland flied out to cf (1-1 BK).,54,2026-03-09T15:00:00-04:00,"Washington Park (Watertown, WI)",58,MBA,2026
6526500,615434,Maranatha Baptist Sabercats,615398,Wis.-Platteville Pioneers,615398,5,bot,Caleb Parker grounded out to p (2-1 BBK).,55,2026-03-09T15:00:00-04:00,"Washington Park (Watertown, WI)",58,MBA,2026
6526500,615434,Maranatha Baptist Sabercats,615398,Wis.-Platteville Pioneers,615398,5,bot,Anthony Massa walked (3-1 BBBKB).,56,2026-03-09T15:00:00-04:00,"Washington Park (Watertown, WI)",58,MBA,2026
6526500,615434,Maranatha Baptist Sabercats,615398,Wis.-Platteville Pioneers,615398,5,bot,Ethan Birkel struck out swinging (1-2 KBKFS).,57,2026-03-09T15:00:00-04:00,"Washington Park (Watertown, WI)",58,MBA,2026
6526500,615434,Maranatha Baptist Sabercats,615398,Wis.-Platteville Pioneers,615434,6,top,Reece Martin grounded out to ss (1-0 B).,58,2026-03-09T15:00:00-04:00,"Washington Park (Watertown, WI)",58,MBA,2026
6526500,615434,Maranatha Baptist Sabercats,615398,Wis.-Platteville Pioneers,615434,6,top,Emerson Pease struck out swinging (0-2 KKS).,59,2026-03-09T15:00:00-04:00,"Washington Park (Watertown, WI)",58,MBA,2026
6526500,615434,Maranatha Baptist Sabercats,615398,Wis.-Platteville Pioneers,615434,6,top,Jonathan Jeske grounded out to p (0-2 KK).,60,2026-03-09T15:00:00-04:00,"Washington Park (Watertown, WI)",58,MBA,2026
6526500,615434,Maranatha Baptist Sabercats,615398,Wis.-Platteville Pioneers,615398,6,bot,Xander Martinez pinch hit for Tarron Bockhop.,61,2026-03-09T15:00:00-04:00,"Washington Park (Watertown, WI)",58,MBA,2026
6526500,615434,Maranatha Baptist Sabercats,615398,Wis.-Platteville Pioneers,615398,6,bot,Reece Martin to 3b.,62,2026-03-09T15:00:00-04:00,"Washington Park (Watertown, WI)",58,MBA,2026
6526500,615434,Maranatha Baptist Sabercats,615398,Wis.-Platteville Pioneers,615398,6,bot,Sebastian Martin to p.,63,2026-03-09T15:00:00-04:00,"Washington Park (Watertown, WI)",58,MBA,2026
6526500,615434,Maranatha Baptist Sabercats,615398,Wis.-Platteville Pioneers,615398,6,bot,Robert Trautman to 2b for Ben Werner.,64,2026-03-09T15:00:00-04:00,"Washington Park (Watertown, WI)",58,MBA,2026
6526500,615434,Maranatha Baptist Sabercats,615398,Wis.-Platteville Pioneers,615398,6,bot,Jonathan Jeske to 1b.,65,2026-03-09T15:00:00-04:00,"Washington Park (Watertown, WI)",58,MBA,2026
6526500,615434,Maranatha Baptist Sabercats,615398,Wis.-Platteville Pioneers,615398,6,bot,Xander Martinez popped up to 3b (2-2 BKBK).,66,2026-03-09T15:00:00-04:00,"Washington Park (Watertown, WI)",58,MBA,2026
6526500,615434,Maranatha Baptist Sabercats,615398,Wis.-Platteville Pioneers,615398,6,bot,Kaleb Elwood doubled to left field (1-1 BK).,67,2026-03-09T15:00:00-04:00,"Washington Park (Watertown, WI)",58,MBA,2026
6526500,615434,Maranatha Baptist Sabercats,615398,Wis.-Platteville Pioneers,615398,6,bot,Mason Molitor flied out to lf (3-2 BKBBF).,68,2026-03-09T15:00:00-04:00,"Washington Park (Watertown, WI)",58,MBA,2026
6526500,615434,Maranatha Baptist Sabercats,615398,Wis.-Platteville Pioneers,615398,6,bot,Kaleb Elwood advanced to third on a wild pitch.,69,2026-03-09T15:00:00-04:00,"Washington Park (Watertown, WI)",58,MBA,2026
6526500,615434,Maranatha Baptist Sabercats,615398,Wis.-Platteville Pioneers,615398,6,bot,Dylan Rippentrop lined out to rf (2-1 BSB).,70,2026-03-09T15:00:00-04:00,"Washington Park (Watertown, WI)",58,MBA,2026
6526500,615434,Maranatha Baptist Sabercats,615398,Wis.-Platteville Pioneers,615434,7,top,Teddy Haugen singled to left field (0-0).,71,2026-03-09T15:00:00-04:00,"Washington Park (Watertown, WI)",58,MBA,2026
6526500,615434,Maranatha Baptist Sabercats,615398,Wis.-Platteville Pioneers,615434,7,top,Judson Martin struck out looking (0-2 FKK).,72,2026-03-09T15:00:00-04:00,"Washington Park (Watertown, WI)",58,MBA,2026
6526500,615434,Maranatha Baptist Sabercats,615398,Wis.-Platteville Pioneers,615434,7,top,Sebastian Martin struck out looking (2-2 BFSBFK).,73,2026-03-09T15:00:00-04:00,"Washington Park (Watertown, WI)",58,MBA,2026
6526500,615434,Maranatha Baptist Sabercats,615398,Wis.-Platteville Pioneers,615434,7,top,Cameron Spencer struck out looking (2-2 BSBKFK).,74,2026-03-09T15:00:00-04:00,"Washington Park (Watertown, WI)",58,MBA,2026
