game_id,away_team_id,away_team_name,home_team_id,home_team_name,batting_team,inning,top_bot,event_text,event_num,game_datetime,stadium_name,attendance,sport_id,season
6528901,615113,Emporia St. Hornets,615106,Central Okla. Bronchos,615113,1,top,Logan Myers flied out to lf (1-1 KB).,1,2026-03-13T17:00:00-04:00,"Wendell Simmons Field (Edmond, OK)",213,MBA,2026
6528901,615113,Emporia St. Hornets,615106,Central Okla. Bronchos,615113,1,top,Evan Abbott grounded out to ss (1-0 B).,2,2026-03-13T17:00:00-04:00,"Wendell Simmons Field (Edmond, OK)",213,MBA,2026
6528901,615113,Emporia St. Hornets,615106,Central Okla. Bronchos,615113,1,top,Frankie Santiago walked (3-0 BBBB).,3,2026-03-13T17:00:00-04:00,"Wendell Simmons Field (Edmond, OK)",213,MBA,2026
6528901,615113,Emporia St. Hornets,615106,Central Okla. Bronchos,615113,1,top,Noah Steele struck out looking (1-2 KFBK).,4,2026-03-13T17:00:00-04:00,"Wendell Simmons Field (Edmond, OK)",213,MBA,2026
6528901,615113,Emporia St. Hornets,615106,Central Okla. Bronchos,615106,1,bot,Colton Ayres walked (3-1 BBKBB).,5,2026-03-13T17:00:00-04:00,"Wendell Simmons Field (Edmond, OK)",213,MBA,2026
6528901,615113,Emporia St. Hornets,615106,Central Okla. Bronchos,615106,1,bot,Caleb Castle struck out swinging (2-2 KBFBFS).,6,2026-03-13T17:00:00-04:00,"Wendell Simmons Field (Edmond, OK)",213,MBA,2026
6528901,615113,Emporia St. Hornets,615106,Central Okla. Bronchos,615106,1,bot,Drake Lee flied out to cf (1-0 B).,7,2026-03-13T17:00:00-04:00,"Wendell Simmons Field (Edmond, OK)",213,MBA,2026
6528901,615113,Emporia St. Hornets,615106,Central Okla. Bronchos,615106,1,bot,Luke Stout struck out swinging (1-2 KBSS).,8,2026-03-13T17:00:00-04:00,"Wendell Simmons Field (Edmond, OK)",213,MBA,2026
6528901,615113,Emporia St. Hornets,615106,Central Okla. Bronchos,615113,2,top,Nathon Cruz hit by pitch (3-1 BFBBH).,9,2026-03-13T17:00:00-04:00,"Wendell Simmons Field (Edmond, OK)",213,MBA,2026
6528901,615113,Emporia St. Hornets,615106,Central Okla. Bronchos,615113,2,top,"Brady Unrein grounded out to p, bunt, SAC (0-1 F)3a Nathon Cruz advanced to second.",10,2026-03-13T17:00:00-04:00,"Wendell Simmons Field (Edmond, OK)",213,MBA,2026
6528901,615113,Emporia St. Hornets,615106,Central Okla. Bronchos,615113,2,top,Dylan Brisbois walked (3-1 BSBBB).,11,2026-03-13T17:00:00-04:00,"Wendell Simmons Field (Edmond, OK)",213,MBA,2026
6528901,615113,Emporia St. Hornets,615106,Central Okla. Bronchos,615113,2,top,"Cooper Schwindt singled to center field, RBI (0-2 KF)3a Dylan Brisbois advanced to second3a Nathon Cruz scored.",12,2026-03-13T17:00:00-04:00,"Wendell Simmons Field (Edmond, OK)",213,MBA,2026
6528901,615113,Emporia St. Hornets,615106,Central Okla. Bronchos,615113,2,top,Tyler Coffin singled to right center (1-0 B)3a Cooper Schwindt advanced to second3a Dylan Brisbois advanced to third.,13,2026-03-13T17:00:00-04:00,"Wendell Simmons Field (Edmond, OK)",213,MBA,2026
6528901,615113,Emporia St. Hornets,615106,Central Okla. Bronchos,615113,2,top,"Logan Myers flied out to cf, sacrifice fly, RBI (2-2 FBFBFFF)3a Cooper Schwindt advanced to third3a Dylan Brisbois scored.",14,2026-03-13T17:00:00-04:00,"Wendell Simmons Field (Edmond, OK)",213,MBA,2026
6528901,615113,Emporia St. Hornets,615106,Central Okla. Bronchos,615113,2,top,"Evan Abbott singled to left field, RBI (0-1 K)3a Tyler Coffin advanced to second3a Cooper Schwindt scored.",15,2026-03-13T17:00:00-04:00,"Wendell Simmons Field (Edmond, OK)",213,MBA,2026
6528901,615113,Emporia St. Hornets,615106,Central Okla. Bronchos,615113,2,top,Frankie Santiago struck out looking (3-2 BKBBSK).,16,2026-03-13T17:00:00-04:00,"Wendell Simmons Field (Edmond, OK)",213,MBA,2026
6528901,615113,Emporia St. Hornets,615106,Central Okla. Bronchos,615106,2,bot,Elijah Alexander flied out to lf (1-0 B).,17,2026-03-13T17:00:00-04:00,"Wendell Simmons Field (Edmond, OK)",213,MBA,2026
6528901,615113,Emporia St. Hornets,615106,Central Okla. Bronchos,615106,2,bot,Carson Taylor grounded out to 1b unassisted (0-2 KK).,18,2026-03-13T17:00:00-04:00,"Wendell Simmons Field (Edmond, OK)",213,MBA,2026
6528901,615113,Emporia St. Hornets,615106,Central Okla. Bronchos,615106,2,bot,Wyatt Yetter grounded out to ss (0-2 KK).,19,2026-03-13T17:00:00-04:00,"Wendell Simmons Field (Edmond, OK)",213,MBA,2026
6528901,615113,Emporia St. Hornets,615106,Central Okla. Bronchos,615113,3,top,Noah Steele flied out to cf (1-0 B).,20,2026-03-13T17:00:00-04:00,"Wendell Simmons Field (Edmond, OK)",213,MBA,2026
6528901,615113,Emporia St. Hornets,615106,Central Okla. Bronchos,615113,3,top,"Nathon Cruz homered down the lf line, RBI (1-0 B).",21,2026-03-13T17:00:00-04:00,"Wendell Simmons Field (Edmond, OK)",213,MBA,2026
6528901,615113,Emporia St. Hornets,615106,Central Okla. Bronchos,615113,3,top,Brady Unrein flied out to lf (1-1 KB).,22,2026-03-13T17:00:00-04:00,"Wendell Simmons Field (Edmond, OK)",213,MBA,2026
6528901,615113,Emporia St. Hornets,615106,Central Okla. Bronchos,615113,3,top,Dylan Brisbois struck out swinging (2-2 BSKBS).,23,2026-03-13T17:00:00-04:00,"Wendell Simmons Field (Edmond, OK)",213,MBA,2026
6528901,615113,Emporia St. Hornets,615106,Central Okla. Bronchos,615106,3,bot,Cade Mills singled to left field (2-2 BBSF).,24,2026-03-13T17:00:00-04:00,"Wendell Simmons Field (Edmond, OK)",213,MBA,2026
6528901,615113,Emporia St. Hornets,615106,Central Okla. Bronchos,615106,3,bot,Cade Mills advanced to second on a wild pitch.,25,2026-03-13T17:00:00-04:00,"Wendell Simmons Field (Edmond, OK)",213,MBA,2026
6528901,615113,Emporia St. Hornets,615106,Central Okla. Bronchos,615106,3,bot,"Kade Sheldon struck out swinging, out at first c to 1b (2-2 BKFBK).",26,2026-03-13T17:00:00-04:00,"Wendell Simmons Field (Edmond, OK)",213,MBA,2026
6528901,615113,Emporia St. Hornets,615106,Central Okla. Bronchos,615106,3,bot,Colton Ayres walked (3-0 BBBB).,27,2026-03-13T17:00:00-04:00,"Wendell Simmons Field (Edmond, OK)",213,MBA,2026
6528901,615113,Emporia St. Hornets,615106,Central Okla. Bronchos,615106,3,bot,Caleb Castle flied out to rf (0-1 F).,28,2026-03-13T17:00:00-04:00,"Wendell Simmons Field (Edmond, OK)",213,MBA,2026
6528901,615113,Emporia St. Hornets,615106,Central Okla. Bronchos,615106,3,bot,"Drake Lee singled up the middle, RBI (3-2 BBKFB)3a Colton Ayres advanced to third3a Cade Mills scored.",29,2026-03-13T17:00:00-04:00,"Wendell Simmons Field (Edmond, OK)",213,MBA,2026
6528901,615113,Emporia St. Hornets,615106,Central Okla. Bronchos,615106,3,bot,Luke Stout walked (3-1 BBBKB)3a Drake Lee advanced to second.,30,2026-03-13T17:00:00-04:00,"Wendell Simmons Field (Edmond, OK)",213,MBA,2026
6528901,615113,Emporia St. Hornets,615106,Central Okla. Bronchos,615106,3,bot,"Elijah Alexander singled, advanced to second on a fielding error by 1b (2-2 BBKK)3a Luke Stout advanced to third3a Drake Lee scored, unearned3a Colton Ayres scored, unearned.",31,2026-03-13T17:00:00-04:00,"Wendell Simmons Field (Edmond, OK)",213,MBA,2026
6528901,615113,Emporia St. Hornets,615106,Central Okla. Bronchos,615106,3,bot,Carson Taylor walked (3-2 BKBSBFB).,32,2026-03-13T17:00:00-04:00,"Wendell Simmons Field (Edmond, OK)",213,MBA,2026
6528901,615113,Emporia St. Hornets,615106,Central Okla. Bronchos,615106,3,bot,"Wyatt Yetter reached on a fielder's choice to shortstop, 2 RBI (0-2 KSFF)3a Carson Taylor advanced to second3a Elijah Alexander scored, unearned3a Luke Stout scored, unearned.",33,2026-03-13T17:00:00-04:00,"Wendell Simmons Field (Edmond, OK)",213,MBA,2026
6528901,615113,Emporia St. Hornets,615106,Central Okla. Bronchos,615106,3,bot,Cade Mills struck out swinging (0-2 KFS).,34,2026-03-13T17:00:00-04:00,"Wendell Simmons Field (Edmond, OK)",213,MBA,2026
6528901,615113,Emporia St. Hornets,615106,Central Okla. Bronchos,615113,4,top,Cooper Schwindt grounded out to 1b unassisted (0-0).,35,2026-03-13T17:00:00-04:00,"Wendell Simmons Field (Edmond, OK)",213,MBA,2026
6528901,615113,Emporia St. Hornets,615106,Central Okla. Bronchos,615113,4,top,Tyler Coffin singled up the middle (2-1 KBB).,36,2026-03-13T17:00:00-04:00,"Wendell Simmons Field (Edmond, OK)",213,MBA,2026
6528901,615113,Emporia St. Hornets,615106,Central Okla. Bronchos,615113,4,top,Logan Myers flied out to rf (2-1 KBB).,37,2026-03-13T17:00:00-04:00,"Wendell Simmons Field (Edmond, OK)",213,MBA,2026
6528901,615113,Emporia St. Hornets,615106,Central Okla. Bronchos,615113,4,top,"Evan Abbott doubled down the lf line, RBI (0-0)3a Tyler Coffin scored.",38,2026-03-13T17:00:00-04:00,"Wendell Simmons Field (Edmond, OK)",213,MBA,2026
6528901,615113,Emporia St. Hornets,615106,Central Okla. Bronchos,615113,4,top,Frankie Santiago struck out swinging (1-2 BSKFS).,39,2026-03-13T17:00:00-04:00,"Wendell Simmons Field (Edmond, OK)",213,MBA,2026
6528901,615113,Emporia St. Hornets,615106,Central Okla. Bronchos,615106,4,bot,Nick Woodcock to p for Seth Stover.,40,2026-03-13T17:00:00-04:00,"Wendell Simmons Field (Edmond, OK)",213,MBA,2026
6528901,615113,Emporia St. Hornets,615106,Central Okla. Bronchos,615106,4,bot,Kade Sheldon walked (3-2 KBFBBB).,41,2026-03-13T17:00:00-04:00,"Wendell Simmons Field (Edmond, OK)",213,MBA,2026
6528901,615113,Emporia St. Hornets,615106,Central Okla. Bronchos,615106,4,bot,Colton Ayres struck out swinging (1-2 SBKFFS).,42,2026-03-13T17:00:00-04:00,"Wendell Simmons Field (Edmond, OK)",213,MBA,2026
6528901,615113,Emporia St. Hornets,615106,Central Okla. Bronchos,615106,4,bot,Caleb Castle reached on a fielder's choice to shortstop (0-1 F)3a Kade Sheldon out at second ss to 2b.,43,2026-03-13T17:00:00-04:00,"Wendell Simmons Field (Edmond, OK)",213,MBA,2026
6528901,615113,Emporia St. Hornets,615106,Central Okla. Bronchos,615106,4,bot,Drake Lee singled through the left side (2-2 BKBF)3a Caleb Castle advanced to second.,44,2026-03-13T17:00:00-04:00,"Wendell Simmons Field (Edmond, OK)",213,MBA,2026
6528901,615113,Emporia St. Hornets,615106,Central Okla. Bronchos,615106,4,bot,Luke Stout grounded out to 1b unassisted (1-1 BK).,45,2026-03-13T17:00:00-04:00,"Wendell Simmons Field (Edmond, OK)",213,MBA,2026
6528901,615113,Emporia St. Hornets,615106,Central Okla. Bronchos,615113,5,top,Chase Yarger to p for Danny Satterlee.,46,2026-03-13T17:00:00-04:00,"Wendell Simmons Field (Edmond, OK)",213,MBA,2026
6528901,615113,Emporia St. Hornets,615106,Central Okla. Bronchos,615113,5,top,Noah Steele struck out swinging (2-2 BKKBS).,47,2026-03-13T17:00:00-04:00,"Wendell Simmons Field (Edmond, OK)",213,MBA,2026
6528901,615113,Emporia St. Hornets,615106,Central Okla. Bronchos,615113,5,top,Nathon Cruz walked (3-2 BBKFBB).,48,2026-03-13T17:00:00-04:00,"Wendell Simmons Field (Edmond, OK)",213,MBA,2026
6528901,615113,Emporia St. Hornets,615106,Central Okla. Bronchos,615113,5,top,Brady Unrein reached on a fielder's choice to third base (1-1 BF)3a Nathon Cruz out at second 3b to 2b.,49,2026-03-13T17:00:00-04:00,"Wendell Simmons Field (Edmond, OK)",213,MBA,2026
6528901,615113,Emporia St. Hornets,615106,Central Okla. Bronchos,615113,5,top,Dylan Brisbois grounded out to 3b (1-1 SB).,50,2026-03-13T17:00:00-04:00,"Wendell Simmons Field (Edmond, OK)",213,MBA,2026
6528901,615113,Emporia St. Hornets,615106,Central Okla. Bronchos,615106,5,bot,Elijah Alexander grounded out to ss (2-2 KBFBF).,51,2026-03-13T17:00:00-04:00,"Wendell Simmons Field (Edmond, OK)",213,MBA,2026
6528901,615113,Emporia St. Hornets,615106,Central Okla. Bronchos,615106,5,bot,Carson Taylor singled through the right side (2-2 KKBB).,52,2026-03-13T17:00:00-04:00,"Wendell Simmons Field (Edmond, OK)",213,MBA,2026
6528901,615113,Emporia St. Hornets,615106,Central Okla. Bronchos,615106,5,bot,Wyatt Yetter doubled down the rf line (2-1 BKB)3a Carson Taylor advanced to third.,53,2026-03-13T17:00:00-04:00,"Wendell Simmons Field (Edmond, OK)",213,MBA,2026
6528901,615113,Emporia St. Hornets,615106,Central Okla. Bronchos,615106,5,bot,"Cade Mills grounded out to 2b, RBI (0-0)3a Wyatt Yetter advanced to third3a Carson Taylor scored.",54,2026-03-13T17:00:00-04:00,"Wendell Simmons Field (Edmond, OK)",213,MBA,2026
6528901,615113,Emporia St. Hornets,615106,Central Okla. Bronchos,615106,5,bot,Kade Sheldon flied out to lf (0-0).,55,2026-03-13T17:00:00-04:00,"Wendell Simmons Field (Edmond, OK)",213,MBA,2026
6528901,615113,Emporia St. Hornets,615106,Central Okla. Bronchos,615113,6,top,Cooper Schwindt walked (3-0 BBBB).,56,2026-03-13T17:00:00-04:00,"Wendell Simmons Field (Edmond, OK)",213,MBA,2026
6528901,615113,Emporia St. Hornets,615106,Central Okla. Bronchos,615113,6,top,Cooper Schwindt advanced to second on a wild pitch.,57,2026-03-13T17:00:00-04:00,"Wendell Simmons Field (Edmond, OK)",213,MBA,2026
6528901,615113,Emporia St. Hornets,615106,Central Okla. Bronchos,615113,6,top,"Tyler Coffin out at first p to 2b, bunt, SAC (1-0 B)3a Cooper Schwindt advanced to third.",58,2026-03-13T17:00:00-04:00,"Wendell Simmons Field (Edmond, OK)",213,MBA,2026
6528901,615113,Emporia St. Hornets,615106,Central Okla. Bronchos,615113,6,top,"Logan Myers doubled to left center, RBI (0-0)3a Cooper Schwindt scored.",59,2026-03-13T17:00:00-04:00,"Wendell Simmons Field (Edmond, OK)",213,MBA,2026
6528901,615113,Emporia St. Hornets,615106,Central Okla. Bronchos,615113,6,top,Evan Abbott reached first on a fielding error by 2b (3-2 BKBBK)3a Logan Myers advanced to third.,60,2026-03-13T17:00:00-04:00,"Wendell Simmons Field (Edmond, OK)",213,MBA,2026
6528901,615113,Emporia St. Hornets,615106,Central Okla. Bronchos,615113,6,top,Evan Abbott stole second.,61,2026-03-13T17:00:00-04:00,"Wendell Simmons Field (Edmond, OK)",213,MBA,2026
6528901,615113,Emporia St. Hornets,615106,Central Okla. Bronchos,615113,6,top,"Frankie Santiago grounded out to 2b, RBI (1-1 SB)3a Evan Abbott advanced to third3a Logan Myers scored, unearned.",62,2026-03-13T17:00:00-04:00,"Wendell Simmons Field (Edmond, OK)",213,MBA,2026
6528901,615113,Emporia St. Hornets,615106,Central Okla. Bronchos,615113,6,top,Noah Steele grounded out to ss (1-2 KSB).,63,2026-03-13T17:00:00-04:00,"Wendell Simmons Field (Edmond, OK)",213,MBA,2026
6528901,615113,Emporia St. Hornets,615106,Central Okla. Bronchos,615106,6,bot,Colton Ayres hit by pitch (1-0 H).,64,2026-03-13T17:00:00-04:00,"Wendell Simmons Field (Edmond, OK)",213,MBA,2026
6528901,615113,Emporia St. Hornets,615106,Central Okla. Bronchos,615106,6,bot,Colton Ayres stole second.,65,2026-03-13T17:00:00-04:00,"Wendell Simmons Field (Edmond, OK)",213,MBA,2026
6528901,615113,Emporia St. Hornets,615106,Central Okla. Bronchos,615106,6,bot,Caleb Castle walked (3-2 FBBFBB).,66,2026-03-13T17:00:00-04:00,"Wendell Simmons Field (Edmond, OK)",213,MBA,2026
6528901,615113,Emporia St. Hornets,615106,Central Okla. Bronchos,615106,6,bot,"Drake Lee out at first 3b to 2b, bunt, SAC (0-1 F)3a Caleb Castle advanced to second3a Colton Ayres advanced to third.",67,2026-03-13T17:00:00-04:00,"Wendell Simmons Field (Edmond, OK)",213,MBA,2026
6528901,615113,Emporia St. Hornets,615106,Central Okla. Bronchos,615106,6,bot,Luke Stout struck out swinging (0-2 FKS).,68,2026-03-13T17:00:00-04:00,"Wendell Simmons Field (Edmond, OK)",213,MBA,2026
6528901,615113,Emporia St. Hornets,615106,Central Okla. Bronchos,615106,6,bot,Elijah Alexander struck out looking (2-2 BFSBK).,69,2026-03-13T17:00:00-04:00,"Wendell Simmons Field (Edmond, OK)",213,MBA,2026
6528901,615113,Emporia St. Hornets,615106,Central Okla. Bronchos,615113,7,top,Mylan Childers to p for Chase Yarger.,70,2026-03-13T17:00:00-04:00,"Wendell Simmons Field (Edmond, OK)",213,MBA,2026
6528901,615113,Emporia St. Hornets,615106,Central Okla. Bronchos,615113,7,top,Nathon Cruz hit by pitch (1-2 KFH).,71,2026-03-13T17:00:00-04:00,"Wendell Simmons Field (Edmond, OK)",213,MBA,2026
6528901,615113,Emporia St. Hornets,615106,Central Okla. Bronchos,615113,7,top,Brady Unrein walked (3-0 BBBB)3a Nathon Cruz advanced to second.,72,2026-03-13T17:00:00-04:00,"Wendell Simmons Field (Edmond, OK)",213,MBA,2026
6528901,615113,Emporia St. Hornets,615106,Central Okla. Bronchos,615113,7,top,Zack Hudspeth to p for Mylan Childers.,73,2026-03-13T17:00:00-04:00,"Wendell Simmons Field (Edmond, OK)",213,MBA,2026
6528901,615113,Emporia St. Hornets,615106,Central Okla. Bronchos,615113,7,top,"Dylan Brisbois singled, bunt (0-0)3a Brady Unrein advanced to second3a Nathon Cruz advanced to third.",74,2026-03-13T17:00:00-04:00,"Wendell Simmons Field (Edmond, OK)",213,MBA,2026
6528901,615113,Emporia St. Hornets,615106,Central Okla. Bronchos,615113,7,top,Cooper Schwindt struck out swinging (1-2 KSBS).,75,2026-03-13T17:00:00-04:00,"Wendell Simmons Field (Edmond, OK)",213,MBA,2026
6528901,615113,Emporia St. Hornets,615106,Central Okla. Bronchos,615113,7,top,Tyler Coffin struck out swinging (0-2 SSS).,76,2026-03-13T17:00:00-04:00,"Wendell Simmons Field (Edmond, OK)",213,MBA,2026
6528901,615113,Emporia St. Hornets,615106,Central Okla. Bronchos,615113,7,top,Dylan Brisbois advanced to second3a Brady Unrein advanced to third3a Nathon Cruz scored on a wild pitch.,77,2026-03-13T17:00:00-04:00,"Wendell Simmons Field (Edmond, OK)",213,MBA,2026
6528901,615113,Emporia St. Hornets,615106,Central Okla. Bronchos,615113,7,top,Logan Myers grounded out to 1b unassisted (3-2 KBSBB).,78,2026-03-13T17:00:00-04:00,"Wendell Simmons Field (Edmond, OK)",213,MBA,2026
6528901,615113,Emporia St. Hornets,615106,Central Okla. Bronchos,615106,7,bot,Jake Khasaempanth to p for Nick Woodcock.,79,2026-03-13T17:00:00-04:00,"Wendell Simmons Field (Edmond, OK)",213,MBA,2026
6528901,615113,Emporia St. Hornets,615106,Central Okla. Bronchos,615106,7,bot,Carson Taylor fouled out to 1b (1-2 KBF).,80,2026-03-13T17:00:00-04:00,"Wendell Simmons Field (Edmond, OK)",213,MBA,2026
6528901,615113,Emporia St. Hornets,615106,Central Okla. Bronchos,615106,7,bot,Wyatt Yetter flied out to lf (3-2 KKBBB).,81,2026-03-13T17:00:00-04:00,"Wendell Simmons Field (Edmond, OK)",213,MBA,2026
6528901,615113,Emporia St. Hornets,615106,Central Okla. Bronchos,615106,7,bot,Cade Mills flied out to lf (1-1 KB).,82,2026-03-13T17:00:00-04:00,"Wendell Simmons Field (Edmond, OK)",213,MBA,2026
6528901,615113,Emporia St. Hornets,615106,Central Okla. Bronchos,615113,8,top,Evan Abbott grounded out to 2b (0-2 KK).,83,2026-03-13T17:00:00-04:00,"Wendell Simmons Field (Edmond, OK)",213,MBA,2026
6528901,615113,Emporia St. Hornets,615106,Central Okla. Bronchos,615113,8,top,Frankie Santiago struck out swinging (0-2 KSS).,84,2026-03-13T17:00:00-04:00,"Wendell Simmons Field (Edmond, OK)",213,MBA,2026
6528901,615113,Emporia St. Hornets,615106,Central Okla. Bronchos,615113,8,top,Noah Steele flied out to lf (2-0 BB).,85,2026-03-13T17:00:00-04:00,"Wendell Simmons Field (Edmond, OK)",213,MBA,2026
6528901,615113,Emporia St. Hornets,615106,Central Okla. Bronchos,615106,8,bot,Graeme Rios to p for Jake Khasaempanth.,86,2026-03-13T17:00:00-04:00,"Wendell Simmons Field (Edmond, OK)",213,MBA,2026
6528901,615113,Emporia St. Hornets,615106,Central Okla. Bronchos,615106,8,bot,Kade Sheldon struck out swinging (1-2 KKBS).,87,2026-03-13T17:00:00-04:00,"Wendell Simmons Field (Edmond, OK)",213,MBA,2026
6528901,615113,Emporia St. Hornets,615106,Central Okla. Bronchos,615106,8,bot,Colton Ayres grounded out to 1b unassisted (3-2 BFKBB).,88,2026-03-13T17:00:00-04:00,"Wendell Simmons Field (Edmond, OK)",213,MBA,2026
6528901,615113,Emporia St. Hornets,615106,Central Okla. Bronchos,615106,8,bot,Caleb Castle struck out looking (3-2 FBKFBBK).,89,2026-03-13T17:00:00-04:00,"Wendell Simmons Field (Edmond, OK)",213,MBA,2026
6528901,615113,Emporia St. Hornets,615106,Central Okla. Bronchos,615113,9,top,Nathon Cruz hit by pitch (1-0 H).,90,2026-03-13T17:00:00-04:00,"Wendell Simmons Field (Edmond, OK)",213,MBA,2026
6528901,615113,Emporia St. Hornets,615106,Central Okla. Bronchos,615113,9,top,Brady Unrein reached first on a fielding error by 3b (0-1 F)3a Nathon Cruz advanced to second.,91,2026-03-13T17:00:00-04:00,"Wendell Simmons Field (Edmond, OK)",213,MBA,2026
6528901,615113,Emporia St. Hornets,615106,Central Okla. Bronchos,615113,9,top,"Dylan Brisbois reached on a fielder's choice, bunt (1-1 BF)3a Brady Unrein advanced to second3a Nathon Cruz out at third p to 3b.",92,2026-03-13T17:00:00-04:00,"Wendell Simmons Field (Edmond, OK)",213,MBA,2026
6528901,615113,Emporia St. Hornets,615106,Central Okla. Bronchos,615113,9,top,Brady Unrein stole third.,93,2026-03-13T17:00:00-04:00,"Wendell Simmons Field (Edmond, OK)",213,MBA,2026
6528901,615113,Emporia St. Hornets,615106,Central Okla. Bronchos,615113,9,top,"Cooper Schwindt grounded out to 3b, RBI (3-2 FKBBB)3a Dylan Brisbois advanced to second3a Brady Unrein scored, unearned.",94,2026-03-13T17:00:00-04:00,"Wendell Simmons Field (Edmond, OK)",213,MBA,2026
6528901,615113,Emporia St. Hornets,615106,Central Okla. Bronchos,615113,9,top,Tyler Coffin struck out swinging (0-2 SKS).,95,2026-03-13T17:00:00-04:00,"Wendell Simmons Field (Edmond, OK)",213,MBA,2026
6528901,615113,Emporia St. Hornets,615106,Central Okla. Bronchos,615106,9,bot,Grant Huffman to p for Graeme Rios.,96,2026-03-13T17:00:00-04:00,"Wendell Simmons Field (Edmond, OK)",213,MBA,2026
6528901,615113,Emporia St. Hornets,615106,Central Okla. Bronchos,615106,9,bot,Drake Lee hit by pitch (1-0 H).,97,2026-03-13T17:00:00-04:00,"Wendell Simmons Field (Edmond, OK)",213,MBA,2026
6528901,615113,Emporia St. Hornets,615106,Central Okla. Bronchos,615106,9,bot,Luke Stout grounded out to c (1-2 BKF)3a Drake Lee advanced to second.,98,2026-03-13T17:00:00-04:00,"Wendell Simmons Field (Edmond, OK)",213,MBA,2026
6528901,615113,Emporia St. Hornets,615106,Central Okla. Bronchos,615106,9,bot,Elijah Alexander flied out to rf (0-0)3a Drake Lee advanced to third.,99,2026-03-13T17:00:00-04:00,"Wendell Simmons Field (Edmond, OK)",213,MBA,2026
6528901,615113,Emporia St. Hornets,615106,Central Okla. Bronchos,615106,9,bot,Carson Taylor grounded out to 2b (3-2 BBKSB).,100,2026-03-13T17:00:00-04:00,"Wendell Simmons Field (Edmond, OK)",213,MBA,2026
