game_id,away_team_id,away_team_name,home_team_id,home_team_name,batting_team,inning,top_bot,event_text,event_num,game_datetime,stadium_name,attendance,sport_id,season
6531328,614847,Alabama St. Hornets,614603,Florida A&M Rattlers,614847,1,top,A. Malpass popped up to ss.,1,2026-02-20T18:00:00-05:00,"Vero Beach, FL",759,MBA,2026
6531328,614847,Alabama St. Hornets,614603,Florida A&M Rattlers,614847,1,top,M. Oropeza singled to right center.,2,2026-02-20T18:00:00-05:00,"Vero Beach, FL",759,MBA,2026
6531328,614847,Alabama St. Hornets,614603,Florida A&M Rattlers,614847,1,top,C. Clark grounded out to 2b3a M. Oropeza advanced to second.,3,2026-02-20T18:00:00-05:00,"Vero Beach, FL",759,MBA,2026
6531328,614847,Alabama St. Hornets,614603,Florida A&M Rattlers,614847,1,top,"J. Williams doubled to left center, RBI3a M. Oropeza scored.",4,2026-02-20T18:00:00-05:00,"Vero Beach, FL",759,MBA,2026
6531328,614847,Alabama St. Hornets,614603,Florida A&M Rattlers,614847,1,top,A. Espaillat struck out swinging.,5,2026-02-20T18:00:00-05:00,"Vero Beach, FL",759,MBA,2026
6531328,614847,Alabama St. Hornets,614603,Florida A&M Rattlers,614603,1,bot,J. Crews singled to shortstop.,6,2026-02-20T18:00:00-05:00,"Vero Beach, FL",759,MBA,2026
6531328,614847,Alabama St. Hornets,614603,Florida A&M Rattlers,614603,1,bot,W. Brown walked3a J. Crews advanced to second.,7,2026-02-20T18:00:00-05:00,"Vero Beach, FL",759,MBA,2026
6531328,614847,Alabama St. Hornets,614603,Florida A&M Rattlers,614603,1,bot,J. Campbell flied out to cf.,8,2026-02-20T18:00:00-05:00,"Vero Beach, FL",759,MBA,2026
6531328,614847,Alabama St. Hornets,614603,Florida A&M Rattlers,614603,1,bot,"E. Miller singled down the rf line, RBI3a W. Brown advanced to third3a J. Crews scored.",9,2026-02-20T18:00:00-05:00,"Vero Beach, FL",759,MBA,2026
6531328,614847,Alabama St. Hornets,614603,Florida A&M Rattlers,614603,1,bot,A. Parzych popped up to ss.,10,2026-02-20T18:00:00-05:00,"Vero Beach, FL",759,MBA,2026
6531328,614847,Alabama St. Hornets,614603,Florida A&M Rattlers,614603,1,bot,"M. Potter singled to left field, RBI3a E. Miller advanced to second3a W. Brown scored.",11,2026-02-20T18:00:00-05:00,"Vero Beach, FL",759,MBA,2026
6531328,614847,Alabama St. Hornets,614603,Florida A&M Rattlers,614603,1,bot,C. Ryals reached first on a fielding error by 3b3a M. Potter advanced to second3a E. Miller advanced to third.,12,2026-02-20T18:00:00-05:00,"Vero Beach, FL",759,MBA,2026
6531328,614847,Alabama St. Hornets,614603,Florida A&M Rattlers,614603,1,bot,J. Figueroa flied out to rf down the rf line.,13,2026-02-20T18:00:00-05:00,"Vero Beach, FL",759,MBA,2026
6531328,614847,Alabama St. Hornets,614603,Florida A&M Rattlers,614847,2,top,F. Santana lined out to 1b.,14,2026-02-20T18:00:00-05:00,"Vero Beach, FL",759,MBA,2026
6531328,614847,Alabama St. Hornets,614603,Florida A&M Rattlers,614847,2,top,"T. Callaway homered to center field, RBI.",15,2026-02-20T18:00:00-05:00,"Vero Beach, FL",759,MBA,2026
6531328,614847,Alabama St. Hornets,614603,Florida A&M Rattlers,614847,2,top,D. Chandler flied out to lf.,16,2026-02-20T18:00:00-05:00,"Vero Beach, FL",759,MBA,2026
6531328,614847,Alabama St. Hornets,614603,Florida A&M Rattlers,614847,2,top,B. Divine struck out swinging.,17,2026-02-20T18:00:00-05:00,"Vero Beach, FL",759,MBA,2026
6531328,614847,Alabama St. Hornets,614603,Florida A&M Rattlers,614603,2,bot,M. Perez popped up to 2b.,18,2026-02-20T18:00:00-05:00,"Vero Beach, FL",759,MBA,2026
6531328,614847,Alabama St. Hornets,614603,Florida A&M Rattlers,614603,2,bot,J. Crews singled to right center.,19,2026-02-20T18:00:00-05:00,"Vero Beach, FL",759,MBA,2026
6531328,614847,Alabama St. Hornets,614603,Florida A&M Rattlers,614603,2,bot,W. Brown struck out looking.,20,2026-02-20T18:00:00-05:00,"Vero Beach, FL",759,MBA,2026
6531328,614847,Alabama St. Hornets,614603,Florida A&M Rattlers,614603,2,bot,J. Campbell struck out swinging.,21,2026-02-20T18:00:00-05:00,"Vero Beach, FL",759,MBA,2026
6531328,614847,Alabama St. Hornets,614603,Florida A&M Rattlers,614847,3,top,A. Malpass walked.,22,2026-02-20T18:00:00-05:00,"Vero Beach, FL",759,MBA,2026
6531328,614847,Alabama St. Hornets,614603,Florida A&M Rattlers,614847,3,top,M. Oropeza hit by pitch3a A. Malpass advanced to second.,23,2026-02-20T18:00:00-05:00,"Vero Beach, FL",759,MBA,2026
6531328,614847,Alabama St. Hornets,614603,Florida A&M Rattlers,614847,3,top,"C. Clark out at first p to 2b, SAC, bunt3a M. Oropeza advanced to second3a A. Malpass advanced to third.",24,2026-02-20T18:00:00-05:00,"Vero Beach, FL",759,MBA,2026
6531328,614847,Alabama St. Hornets,614603,Florida A&M Rattlers,614847,3,top,J. Williams struck out swinging.,25,2026-02-20T18:00:00-05:00,"Vero Beach, FL",759,MBA,2026
6531328,614847,Alabama St. Hornets,614603,Florida A&M Rattlers,614847,3,top,A. Espaillat struck out looking.,26,2026-02-20T18:00:00-05:00,"Vero Beach, FL",759,MBA,2026
6531328,614847,Alabama St. Hornets,614603,Florida A&M Rattlers,614603,3,bot,E. Miller grounded out to ss.,27,2026-02-20T18:00:00-05:00,"Vero Beach, FL",759,MBA,2026
6531328,614847,Alabama St. Hornets,614603,Florida A&M Rattlers,614603,3,bot,A. Parzych struck out looking.,28,2026-02-20T18:00:00-05:00,"Vero Beach, FL",759,MBA,2026
6531328,614847,Alabama St. Hornets,614603,Florida A&M Rattlers,614603,3,bot,"M. Potter struck out swinging, out at first c to 1b.",29,2026-02-20T18:00:00-05:00,"Vero Beach, FL",759,MBA,2026
6531328,614847,Alabama St. Hornets,614603,Florida A&M Rattlers,614847,4,top,F. Santana reached first on a fielding error by 2b.,30,2026-02-20T18:00:00-05:00,"Vero Beach, FL",759,MBA,2026
6531328,614847,Alabama St. Hornets,614603,Florida A&M Rattlers,614847,4,top,F. Santana advanced to second on a balk.,31,2026-02-20T18:00:00-05:00,"Vero Beach, FL",759,MBA,2026
6531328,614847,Alabama St. Hornets,614603,Florida A&M Rattlers,614847,4,top,T. Callaway popped up to ss.,32,2026-02-20T18:00:00-05:00,"Vero Beach, FL",759,MBA,2026
6531328,614847,Alabama St. Hornets,614603,Florida A&M Rattlers,614847,4,top,D. Chandler struck out looking.,33,2026-02-20T18:00:00-05:00,"Vero Beach, FL",759,MBA,2026
6531328,614847,Alabama St. Hornets,614603,Florida A&M Rattlers,614847,4,top,B. Divine popped up to 2b.,34,2026-02-20T18:00:00-05:00,"Vero Beach, FL",759,MBA,2026
6531328,614847,Alabama St. Hornets,614603,Florida A&M Rattlers,614603,4,bot,C. Ryals flied out to rf.,35,2026-02-20T18:00:00-05:00,"Vero Beach, FL",759,MBA,2026
6531328,614847,Alabama St. Hornets,614603,Florida A&M Rattlers,614603,4,bot,J. Figueroa grounded out to 3b.,36,2026-02-20T18:00:00-05:00,"Vero Beach, FL",759,MBA,2026
6531328,614847,Alabama St. Hornets,614603,Florida A&M Rattlers,614603,4,bot,M. Perez grounded out to ss.,37,2026-02-20T18:00:00-05:00,"Vero Beach, FL",759,MBA,2026
6531328,614847,Alabama St. Hornets,614603,Florida A&M Rattlers,614847,5,top,A. Malpass walked.,38,2026-02-20T18:00:00-05:00,"Vero Beach, FL",759,MBA,2026
6531328,614847,Alabama St. Hornets,614603,Florida A&M Rattlers,614847,5,top,A. Malpass stole second.,39,2026-02-20T18:00:00-05:00,"Vero Beach, FL",759,MBA,2026
6531328,614847,Alabama St. Hornets,614603,Florida A&M Rattlers,614847,5,top,M. Oropeza walked.,40,2026-02-20T18:00:00-05:00,"Vero Beach, FL",759,MBA,2026
6531328,614847,Alabama St. Hornets,614603,Florida A&M Rattlers,614847,5,top,C. Clark flied out to cf3a M. Oropeza advanced to second3a A. Malpass advanced to third.,41,2026-02-20T18:00:00-05:00,"Vero Beach, FL",759,MBA,2026
6531328,614847,Alabama St. Hornets,614603,Florida A&M Rattlers,614847,5,top,C. Lincoln to p for G. Workman.,42,2026-02-20T18:00:00-05:00,"Vero Beach, FL",759,MBA,2026
6531328,614847,Alabama St. Hornets,614603,Florida A&M Rattlers,614847,5,top,"J. Williams reached on a fielder's choice to pitcher, RBI3a M. Oropeza advanced to third3a A. Malpass scored.",43,2026-02-20T18:00:00-05:00,"Vero Beach, FL",759,MBA,2026
6531328,614847,Alabama St. Hornets,614603,Florida A&M Rattlers,614847,5,top,"A. Espaillat homered to center field, 3 RBI3a J. Williams scored3a M. Oropeza scored.",44,2026-02-20T18:00:00-05:00,"Vero Beach, FL",759,MBA,2026
6531328,614847,Alabama St. Hornets,614603,Florida A&M Rattlers,614847,5,top,F. Santana grounded out to 3b.,45,2026-02-20T18:00:00-05:00,"Vero Beach, FL",759,MBA,2026
6531328,614847,Alabama St. Hornets,614603,Florida A&M Rattlers,614847,5,top,T. Callaway struck out looking.,46,2026-02-20T18:00:00-05:00,"Vero Beach, FL",759,MBA,2026
6531328,614847,Alabama St. Hornets,614603,Florida A&M Rattlers,614603,5,bot,J. Crews flied out to cf.,47,2026-02-20T18:00:00-05:00,"Vero Beach, FL",759,MBA,2026
6531328,614847,Alabama St. Hornets,614603,Florida A&M Rattlers,614603,5,bot,W. Brown lined out to cf to right center.,48,2026-02-20T18:00:00-05:00,"Vero Beach, FL",759,MBA,2026
6531328,614847,Alabama St. Hornets,614603,Florida A&M Rattlers,614603,5,bot,J. Campbell singled to left field.,49,2026-02-20T18:00:00-05:00,"Vero Beach, FL",759,MBA,2026
6531328,614847,Alabama St. Hornets,614603,Florida A&M Rattlers,614603,5,bot,J. Campbell advanced to second on a wild pitch.,50,2026-02-20T18:00:00-05:00,"Vero Beach, FL",759,MBA,2026
6531328,614847,Alabama St. Hornets,614603,Florida A&M Rattlers,614603,5,bot,E. Miller walked.,51,2026-02-20T18:00:00-05:00,"Vero Beach, FL",759,MBA,2026
6531328,614847,Alabama St. Hornets,614603,Florida A&M Rattlers,614603,5,bot,A. Parzych flied out to cf.,52,2026-02-20T18:00:00-05:00,"Vero Beach, FL",759,MBA,2026
6531328,614847,Alabama St. Hornets,614603,Florida A&M Rattlers,614847,6,top,D. Chandler singled to left field.,53,2026-02-20T18:00:00-05:00,"Vero Beach, FL",759,MBA,2026
6531328,614847,Alabama St. Hornets,614603,Florida A&M Rattlers,614847,6,top,"B. Divine grounded out to 3b, SAC, bunt3a D. Chandler advanced to second.",54,2026-02-20T18:00:00-05:00,"Vero Beach, FL",759,MBA,2026
6531328,614847,Alabama St. Hornets,614603,Florida A&M Rattlers,614847,6,top,A. Malpass singled to first base3a D. Chandler advanced to third.,55,2026-02-20T18:00:00-05:00,"Vero Beach, FL",759,MBA,2026
6531328,614847,Alabama St. Hornets,614603,Florida A&M Rattlers,614847,6,top,"M. Oropeza singled to right field, RBI3a A. Malpass advanced to third3a D. Chandler scored.",56,2026-02-20T18:00:00-05:00,"Vero Beach, FL",759,MBA,2026
6531328,614847,Alabama St. Hornets,614603,Florida A&M Rattlers,614847,6,top,J. Garner to p for C. Lincoln.,57,2026-02-20T18:00:00-05:00,"Vero Beach, FL",759,MBA,2026
6531328,614847,Alabama St. Hornets,614603,Florida A&M Rattlers,614847,6,top,"C. Clark singled to center field, RBI3a M. Oropeza advanced to second3a A. Malpass scored.",58,2026-02-20T18:00:00-05:00,"Vero Beach, FL",759,MBA,2026
6531328,614847,Alabama St. Hornets,614603,Florida A&M Rattlers,614847,6,top,J. Williams flied out to lf3a C. Clark advanced to second3a M. Oropeza advanced to third.,59,2026-02-20T18:00:00-05:00,"Vero Beach, FL",759,MBA,2026
6531328,614847,Alabama St. Hornets,614603,Florida A&M Rattlers,614847,6,top,"A. Espaillat reached first on a throwing error by ss3a C. Clark advanced to third3a M. Oropeza scored, unearned.",60,2026-02-20T18:00:00-05:00,"Vero Beach, FL",759,MBA,2026
6531328,614847,Alabama St. Hornets,614603,Florida A&M Rattlers,614847,6,top,F. Santana grounded out to ss.,61,2026-02-20T18:00:00-05:00,"Vero Beach, FL",759,MBA,2026
6531328,614847,Alabama St. Hornets,614603,Florida A&M Rattlers,614603,6,bot,M. Potter walked.,62,2026-02-20T18:00:00-05:00,"Vero Beach, FL",759,MBA,2026
6531328,614847,Alabama St. Hornets,614603,Florida A&M Rattlers,614603,6,bot,"C. Ryals doubled to center field, RBI3a M. Potter scored.",63,2026-02-20T18:00:00-05:00,"Vero Beach, FL",759,MBA,2026
6531328,614847,Alabama St. Hornets,614603,Florida A&M Rattlers,614603,6,bot,J. Figueroa walked.,64,2026-02-20T18:00:00-05:00,"Vero Beach, FL",759,MBA,2026
6531328,614847,Alabama St. Hornets,614603,Florida A&M Rattlers,614603,6,bot,M. Perez flied out to rf3a C. Ryals advanced to third.,65,2026-02-20T18:00:00-05:00,"Vero Beach, FL",759,MBA,2026
6531328,614847,Alabama St. Hornets,614603,Florida A&M Rattlers,614603,6,bot,J. Peterson to p for J. LaBoy.,66,2026-02-20T18:00:00-05:00,"Vero Beach, FL",759,MBA,2026
6531328,614847,Alabama St. Hornets,614603,Florida A&M Rattlers,614603,6,bot,"J. Crews reached on a fielder's choice to shortstop, RBI3a J. Figueroa out at second ss unassisted3a C. Ryals scored.",67,2026-02-20T18:00:00-05:00,"Vero Beach, FL",759,MBA,2026
6531328,614847,Alabama St. Hornets,614603,Florida A&M Rattlers,614603,6,bot,W. Brown walked3a J. Crews advanced to second.,68,2026-02-20T18:00:00-05:00,"Vero Beach, FL",759,MBA,2026
6531328,614847,Alabama St. Hornets,614603,Florida A&M Rattlers,614603,6,bot,J. Campbell reached on a fielder's choice to shortstop3a W. Brown out at second ss to 2b.,69,2026-02-20T18:00:00-05:00,"Vero Beach, FL",759,MBA,2026
6531328,614847,Alabama St. Hornets,614603,Florida A&M Rattlers,614847,7,top,T. Callaway grounded out to ss.,70,2026-02-20T18:00:00-05:00,"Vero Beach, FL",759,MBA,2026
6531328,614847,Alabama St. Hornets,614603,Florida A&M Rattlers,614847,7,top,D. Chandler walked.,71,2026-02-20T18:00:00-05:00,"Vero Beach, FL",759,MBA,2026
6531328,614847,Alabama St. Hornets,614603,Florida A&M Rattlers,614847,7,top,B. Divine grounded out to ss3a D. Chandler advanced to second.,72,2026-02-20T18:00:00-05:00,"Vero Beach, FL",759,MBA,2026
6531328,614847,Alabama St. Hornets,614603,Florida A&M Rattlers,614847,7,top,A. Malpass walked.,73,2026-02-20T18:00:00-05:00,"Vero Beach, FL",759,MBA,2026
6531328,614847,Alabama St. Hornets,614603,Florida A&M Rattlers,614847,7,top,M. Oropeza out at first 1b to p.,74,2026-02-20T18:00:00-05:00,"Vero Beach, FL",759,MBA,2026
6531328,614847,Alabama St. Hornets,614603,Florida A&M Rattlers,614603,7,bot,E. Miller singled to right center.,75,2026-02-20T18:00:00-05:00,"Vero Beach, FL",759,MBA,2026
6531328,614847,Alabama St. Hornets,614603,Florida A&M Rattlers,614603,7,bot,A. Monile pinch hit for A. Parzych.,76,2026-02-20T18:00:00-05:00,"Vero Beach, FL",759,MBA,2026
6531328,614847,Alabama St. Hornets,614603,Florida A&M Rattlers,614603,7,bot,A. Monile grounded into double play ss to 2b to 1b3a E. Miller out on the play.,77,2026-02-20T18:00:00-05:00,"Vero Beach, FL",759,MBA,2026
6531328,614847,Alabama St. Hornets,614603,Florida A&M Rattlers,614603,7,bot,M. Potter fouled out to 1b.,78,2026-02-20T18:00:00-05:00,"Vero Beach, FL",759,MBA,2026
6531328,614847,Alabama St. Hornets,614603,Florida A&M Rattlers,614847,8,top,A. Monile to rf.,79,2026-02-20T18:00:00-05:00,"Vero Beach, FL",759,MBA,2026
6531328,614847,Alabama St. Hornets,614603,Florida A&M Rattlers,614847,8,top,C. Clark struck out swinging.,80,2026-02-20T18:00:00-05:00,"Vero Beach, FL",759,MBA,2026
6531328,614847,Alabama St. Hornets,614603,Florida A&M Rattlers,614847,8,top,J. Williams flied out to lf.,81,2026-02-20T18:00:00-05:00,"Vero Beach, FL",759,MBA,2026
6531328,614847,Alabama St. Hornets,614603,Florida A&M Rattlers,614847,8,top,A. Espaillat grounded out to 2b.,82,2026-02-20T18:00:00-05:00,"Vero Beach, FL",759,MBA,2026
6531328,614847,Alabama St. Hornets,614603,Florida A&M Rattlers,614603,8,bot,C. Ryals grounded out to p.,83,2026-02-20T18:00:00-05:00,"Vero Beach, FL",759,MBA,2026
6531328,614847,Alabama St. Hornets,614603,Florida A&M Rattlers,614603,8,bot,J. Figueroa walked.,84,2026-02-20T18:00:00-05:00,"Vero Beach, FL",759,MBA,2026
6531328,614847,Alabama St. Hornets,614603,Florida A&M Rattlers,614603,8,bot,M. Perez grounded into double play 3b to 2b to 1b3a J. Figueroa out on the play.,85,2026-02-20T18:00:00-05:00,"Vero Beach, FL",759,MBA,2026
6531328,614847,Alabama St. Hornets,614603,Florida A&M Rattlers,614847,9,top,D. Morgan to p for J. Garner.,86,2026-02-20T18:00:00-05:00,"Vero Beach, FL",759,MBA,2026
6531328,614847,Alabama St. Hornets,614603,Florida A&M Rattlers,614847,9,top,Q. Jenkins pinch hit for F. Santana.,87,2026-02-20T18:00:00-05:00,"Vero Beach, FL",759,MBA,2026
6531328,614847,Alabama St. Hornets,614603,Florida A&M Rattlers,614847,9,top,Q. Jenkins walked.,88,2026-02-20T18:00:00-05:00,"Vero Beach, FL",759,MBA,2026
6531328,614847,Alabama St. Hornets,614603,Florida A&M Rattlers,614847,9,top,Q. Jenkins advanced to second on a wild pitch.,89,2026-02-20T18:00:00-05:00,"Vero Beach, FL",759,MBA,2026
6531328,614847,Alabama St. Hornets,614603,Florida A&M Rattlers,614847,9,top,T. Callaway lined out to ss.,90,2026-02-20T18:00:00-05:00,"Vero Beach, FL",759,MBA,2026
6531328,614847,Alabama St. Hornets,614603,Florida A&M Rattlers,614847,9,top,Q. Jenkins advanced to third on a wild pitch.,91,2026-02-20T18:00:00-05:00,"Vero Beach, FL",759,MBA,2026
6531328,614847,Alabama St. Hornets,614603,Florida A&M Rattlers,614847,9,top,D. Chandler walked.,92,2026-02-20T18:00:00-05:00,"Vero Beach, FL",759,MBA,2026
6531328,614847,Alabama St. Hornets,614603,Florida A&M Rattlers,614847,9,top,D. Chandler advanced to second3a Q. Jenkins scored on a wild pitch.,93,2026-02-20T18:00:00-05:00,"Vero Beach, FL",759,MBA,2026
6531328,614847,Alabama St. Hornets,614603,Florida A&M Rattlers,614847,9,top,D. Chandler advanced to third on a wild pitch.,94,2026-02-20T18:00:00-05:00,"Vero Beach, FL",759,MBA,2026
6531328,614847,Alabama St. Hornets,614603,Florida A&M Rattlers,614847,9,top,B. Divine walked.,95,2026-02-20T18:00:00-05:00,"Vero Beach, FL",759,MBA,2026
6531328,614847,Alabama St. Hornets,614603,Florida A&M Rattlers,614847,9,top,R. Young to p for D. Morgan.,96,2026-02-20T18:00:00-05:00,"Vero Beach, FL",759,MBA,2026
6531328,614847,Alabama St. Hornets,614603,Florida A&M Rattlers,614847,9,top,B. Divine advanced to second.,97,2026-02-20T18:00:00-05:00,"Vero Beach, FL",759,MBA,2026
6531328,614847,Alabama St. Hornets,614603,Florida A&M Rattlers,614847,9,top,A. Malpass walked.,98,2026-02-20T18:00:00-05:00,"Vero Beach, FL",759,MBA,2026
6531328,614847,Alabama St. Hornets,614603,Florida A&M Rattlers,614847,9,top,"M. Oropeza singled down the rf line, RBI, advanced to second3a A. Malpass advanced to third3a B. Divine advanced to third, out at home rf to c to 3b3a D. Chandler scored.",99,2026-02-20T18:00:00-05:00,"Vero Beach, FL",759,MBA,2026
6531328,614847,Alabama St. Hornets,614603,Florida A&M Rattlers,614847,9,top,C. Clark grounded out to 2b.,100,2026-02-20T18:00:00-05:00,"Vero Beach, FL",759,MBA,2026
6531328,614847,Alabama St. Hornets,614603,Florida A&M Rattlers,614603,9,bot,Q. Jenkins to ss.,101,2026-02-20T18:00:00-05:00,"Vero Beach, FL",759,MBA,2026
6531328,614847,Alabama St. Hornets,614603,Florida A&M Rattlers,614603,9,bot,J. Alfonso to 3b for B. Divine.,102,2026-02-20T18:00:00-05:00,"Vero Beach, FL",759,MBA,2026
6531328,614847,Alabama St. Hornets,614603,Florida A&M Rattlers,614603,9,bot,J. Crews grounded out to 3b.,103,2026-02-20T18:00:00-05:00,"Vero Beach, FL",759,MBA,2026
6531328,614847,Alabama St. Hornets,614603,Florida A&M Rattlers,614603,9,bot,W. Brown walked.,104,2026-02-20T18:00:00-05:00,"Vero Beach, FL",759,MBA,2026
6531328,614847,Alabama St. Hornets,614603,Florida A&M Rattlers,614603,9,bot,J. McKenzie pinch hit for J. Campbell.,105,2026-02-20T18:00:00-05:00,"Vero Beach, FL",759,MBA,2026
6531328,614847,Alabama St. Hornets,614603,Florida A&M Rattlers,614603,9,bot,J. McKenzie struck out swinging.,106,2026-02-20T18:00:00-05:00,"Vero Beach, FL",759,MBA,2026
6531328,614847,Alabama St. Hornets,614603,Florida A&M Rattlers,614603,9,bot,Z. Sigmon pinch hit for E. Miller.,107,2026-02-20T18:00:00-05:00,"Vero Beach, FL",759,MBA,2026
6531328,614847,Alabama St. Hornets,614603,Florida A&M Rattlers,614603,9,bot,Z. Sigmon struck out swinging.,108,2026-02-20T18:00:00-05:00,"Vero Beach, FL",759,MBA,2026
