game_id,away_team_id,away_team_name,home_team_id,home_team_name,batting_team,inning,top_bot,event_text,event_num,game_datetime,stadium_name,attendance,sport_id,season
6531069,615053,Maryville (MO) Saints,615090,Upper Iowa Peacocks,615053,1,top,Matthew Raus grounded out to 2b (2-1 BKB).,1,2026-03-20T15:00:00-04:00,"Robertson Woods Field (Fayette, IA)",147,MBA,2026
6531069,615053,Maryville (MO) Saints,615090,Upper Iowa Peacocks,615053,1,top,Jace Burton lined out to rf (0-2 KS).,2,2026-03-20T15:00:00-04:00,"Robertson Woods Field (Fayette, IA)",147,MBA,2026
6531069,615053,Maryville (MO) Saints,615090,Upper Iowa Peacocks,615053,1,top,Jack Meyer struck out swinging (0-2 SKS).,3,2026-03-20T15:00:00-04:00,"Robertson Woods Field (Fayette, IA)",147,MBA,2026
6531069,615053,Maryville (MO) Saints,615090,Upper Iowa Peacocks,615090,1,bot,C. Luzum singled to right field (1-1 KB).,4,2026-03-20T15:00:00-04:00,"Robertson Woods Field (Fayette, IA)",147,MBA,2026
6531069,615053,Maryville (MO) Saints,615090,Upper Iowa Peacocks,615090,1,bot,T. Meiners struck out looking (2-2 BBKKK).,5,2026-03-20T15:00:00-04:00,"Robertson Woods Field (Fayette, IA)",147,MBA,2026
6531069,615053,Maryville (MO) Saints,615090,Upper Iowa Peacocks,615090,1,bot,B. Zimmer grounded into double play ss to 2b to 1b (0-0)3a C. Luzum out on the play.,6,2026-03-20T15:00:00-04:00,"Robertson Woods Field (Fayette, IA)",147,MBA,2026
6531069,615053,Maryville (MO) Saints,615090,Upper Iowa Peacocks,615053,2,top,Dominic Anse struck out swinging (2-2 KFBFBS).,7,2026-03-20T15:00:00-04:00,"Robertson Woods Field (Fayette, IA)",147,MBA,2026
6531069,615053,Maryville (MO) Saints,615090,Upper Iowa Peacocks,615053,2,top,Steven Schne walked (3-2 SFBBFFBFB).,8,2026-03-20T15:00:00-04:00,"Robertson Woods Field (Fayette, IA)",147,MBA,2026
6531069,615053,Maryville (MO) Saints,615090,Upper Iowa Peacocks,615053,2,top,"Dominic Shar tripled to center field, RBI (2-2 KBKB)3a Steven Schne scored.",9,2026-03-20T15:00:00-04:00,"Robertson Woods Field (Fayette, IA)",147,MBA,2026
6531069,615053,Maryville (MO) Saints,615090,Upper Iowa Peacocks,615053,2,top,"Brady Kindha singled to third base, RBI (1-2 KBK)3a Dominic Shar scored.",10,2026-03-20T15:00:00-04:00,"Robertson Woods Field (Fayette, IA)",147,MBA,2026
6531069,615053,Maryville (MO) Saints,615090,Upper Iowa Peacocks,615053,2,top,Greyson Rath singled to shortstop (0-1 S)3a Brady Kindha advanced to second.,11,2026-03-20T15:00:00-04:00,"Robertson Woods Field (Fayette, IA)",147,MBA,2026
6531069,615053,Maryville (MO) Saints,615090,Upper Iowa Peacocks,615053,2,top,"Justin Gorsk grounded out to 3b, SAC, bunt (0-0)3a Greyson Rath advanced to second3a Brady Kindha advanced to third.",12,2026-03-20T15:00:00-04:00,"Robertson Woods Field (Fayette, IA)",147,MBA,2026
6531069,615053,Maryville (MO) Saints,615090,Upper Iowa Peacocks,615053,2,top,Matthew Raus grounded out to ss (3-2 BFKBFBF).,13,2026-03-20T15:00:00-04:00,"Robertson Woods Field (Fayette, IA)",147,MBA,2026
6531069,615053,Maryville (MO) Saints,615090,Upper Iowa Peacocks,615090,2,bot,J. Vargas grounded out to 1b unassisted (0-2 KS).,14,2026-03-20T15:00:00-04:00,"Robertson Woods Field (Fayette, IA)",147,MBA,2026
6531069,615053,Maryville (MO) Saints,615090,Upper Iowa Peacocks,615090,2,bot,G.Bombardier fouled out to 3b (2-2 BFKB).,15,2026-03-20T15:00:00-04:00,"Robertson Woods Field (Fayette, IA)",147,MBA,2026
6531069,615053,Maryville (MO) Saints,615090,Upper Iowa Peacocks,615090,2,bot,J. Hoodjer walked (3-2 BBKBFB).,16,2026-03-20T15:00:00-04:00,"Robertson Woods Field (Fayette, IA)",147,MBA,2026
6531069,615053,Maryville (MO) Saints,615090,Upper Iowa Peacocks,615090,2,bot,H. Jones doubled to left center (0-1 K)3a J. Hoodjer advanced to third.,17,2026-03-20T15:00:00-04:00,"Robertson Woods Field (Fayette, IA)",147,MBA,2026
6531069,615053,Maryville (MO) Saints,615090,Upper Iowa Peacocks,615090,2,bot,P. Safranski flied out to lf (1-1 SB).,18,2026-03-20T15:00:00-04:00,"Robertson Woods Field (Fayette, IA)",147,MBA,2026
6531069,615053,Maryville (MO) Saints,615090,Upper Iowa Peacocks,615053,3,top,Jace Burton flied out to cf (3-1 KBBB).,19,2026-03-20T15:00:00-04:00,"Robertson Woods Field (Fayette, IA)",147,MBA,2026
6531069,615053,Maryville (MO) Saints,615090,Upper Iowa Peacocks,615053,3,top,Jack Meyer grounded out to ss (0-0).,20,2026-03-20T15:00:00-04:00,"Robertson Woods Field (Fayette, IA)",147,MBA,2026
6531069,615053,Maryville (MO) Saints,615090,Upper Iowa Peacocks,615053,3,top,Dominic Anse grounded out to 3b (0-0).,21,2026-03-20T15:00:00-04:00,"Robertson Woods Field (Fayette, IA)",147,MBA,2026
6531069,615053,Maryville (MO) Saints,615090,Upper Iowa Peacocks,615090,3,bot,"J. Klug grounded out to 3b, bunt (0-1 K).",22,2026-03-20T15:00:00-04:00,"Robertson Woods Field (Fayette, IA)",147,MBA,2026
6531069,615053,Maryville (MO) Saints,615090,Upper Iowa Peacocks,615090,3,bot,C. Luzum fouled out to c (2-2 KKBFB).,23,2026-03-20T15:00:00-04:00,"Robertson Woods Field (Fayette, IA)",147,MBA,2026
6531069,615053,Maryville (MO) Saints,615090,Upper Iowa Peacocks,615090,3,bot,T. Meiners grounded out to ss (2-2 KBBF).,24,2026-03-20T15:00:00-04:00,"Robertson Woods Field (Fayette, IA)",147,MBA,2026
6531069,615053,Maryville (MO) Saints,615090,Upper Iowa Peacocks,615053,4,top,Steven Schne struck out swinging (2-2 KSBBS).,25,2026-03-20T15:00:00-04:00,"Robertson Woods Field (Fayette, IA)",147,MBA,2026
6531069,615053,Maryville (MO) Saints,615090,Upper Iowa Peacocks,615053,4,top,Dominic Shar walked (3-2 BBBKKFB).,26,2026-03-20T15:00:00-04:00,"Robertson Woods Field (Fayette, IA)",147,MBA,2026
6531069,615053,Maryville (MO) Saints,615090,Upper Iowa Peacocks,615053,4,top,"Dominic Shar out at second c to 2b, caught stealing.",27,2026-03-20T15:00:00-04:00,"Robertson Woods Field (Fayette, IA)",147,MBA,2026
6531069,615053,Maryville (MO) Saints,615090,Upper Iowa Peacocks,615053,4,top,Brady Kindha struck out looking (1-2 SSBK).,28,2026-03-20T15:00:00-04:00,"Robertson Woods Field (Fayette, IA)",147,MBA,2026
6531069,615053,Maryville (MO) Saints,615090,Upper Iowa Peacocks,615090,4,bot,B. Zimmer flied out to cf to left center (1-1 BK).,29,2026-03-20T15:00:00-04:00,"Robertson Woods Field (Fayette, IA)",147,MBA,2026
6531069,615053,Maryville (MO) Saints,615090,Upper Iowa Peacocks,615090,4,bot,J. Vargas grounded out to ss (0-0).,30,2026-03-20T15:00:00-04:00,"Robertson Woods Field (Fayette, IA)",147,MBA,2026
6531069,615053,Maryville (MO) Saints,615090,Upper Iowa Peacocks,615090,4,bot,G.Bombardier walked (3-2 BBSBKB).,31,2026-03-20T15:00:00-04:00,"Robertson Woods Field (Fayette, IA)",147,MBA,2026
6531069,615053,Maryville (MO) Saints,615090,Upper Iowa Peacocks,615090,4,bot,G.Bombardier stole second.,32,2026-03-20T15:00:00-04:00,"Robertson Woods Field (Fayette, IA)",147,MBA,2026
6531069,615053,Maryville (MO) Saints,615090,Upper Iowa Peacocks,615090,4,bot,J. Hoodjer grounded out to 3b (1-1 KB).,33,2026-03-20T15:00:00-04:00,"Robertson Woods Field (Fayette, IA)",147,MBA,2026
6531069,615053,Maryville (MO) Saints,615090,Upper Iowa Peacocks,615053,5,top,Greyson Rath flied out to cf to left center (0-1 K).,34,2026-03-20T15:00:00-04:00,"Robertson Woods Field (Fayette, IA)",147,MBA,2026
6531069,615053,Maryville (MO) Saints,615090,Upper Iowa Peacocks,615053,5,top,Justin Gorsk flied out to rf (0-0).,35,2026-03-20T15:00:00-04:00,"Robertson Woods Field (Fayette, IA)",147,MBA,2026
6531069,615053,Maryville (MO) Saints,615090,Upper Iowa Peacocks,615053,5,top,Matthew Raus singled to center field (3-1 BBBK).,36,2026-03-20T15:00:00-04:00,"Robertson Woods Field (Fayette, IA)",147,MBA,2026
6531069,615053,Maryville (MO) Saints,615090,Upper Iowa Peacocks,615053,5,top,Jace Burton singled to right field (0-0)3a Matthew Raus advanced to third.,37,2026-03-20T15:00:00-04:00,"Robertson Woods Field (Fayette, IA)",147,MBA,2026
6531069,615053,Maryville (MO) Saints,615090,Upper Iowa Peacocks,615053,5,top,"Jack Meyer singled to center field, RBI (0-2 KFF)3a Jace Burton advanced to second3a Matthew Raus scored.",38,2026-03-20T15:00:00-04:00,"Robertson Woods Field (Fayette, IA)",147,MBA,2026
6531069,615053,Maryville (MO) Saints,615090,Upper Iowa Peacocks,615053,5,top,Dominic Anse struck out looking (3-2 BBKBKFFK).,39,2026-03-20T15:00:00-04:00,"Robertson Woods Field (Fayette, IA)",147,MBA,2026
6531069,615053,Maryville (MO) Saints,615090,Upper Iowa Peacocks,615090,5,bot,H. Jones struck out looking (3-2 KBBFBK).,40,2026-03-20T15:00:00-04:00,"Robertson Woods Field (Fayette, IA)",147,MBA,2026
6531069,615053,Maryville (MO) Saints,615090,Upper Iowa Peacocks,615090,5,bot,"P. Safranski reached on a throwing error by c, bunt (0-0).",41,2026-03-20T15:00:00-04:00,"Robertson Woods Field (Fayette, IA)",147,MBA,2026
6531069,615053,Maryville (MO) Saints,615090,Upper Iowa Peacocks,615090,5,bot,"P. Safranski out at first p to 1b, picked off.",42,2026-03-20T15:00:00-04:00,"Robertson Woods Field (Fayette, IA)",147,MBA,2026
6531069,615053,Maryville (MO) Saints,615090,Upper Iowa Peacocks,615090,5,bot,J. Klug struck out swinging (2-2 KBBFS).,43,2026-03-20T15:00:00-04:00,"Robertson Woods Field (Fayette, IA)",147,MBA,2026
6531069,615053,Maryville (MO) Saints,615090,Upper Iowa Peacocks,615053,6,top,C. Powell to p for G. Olson.,44,2026-03-20T15:00:00-04:00,"Robertson Woods Field (Fayette, IA)",147,MBA,2026
6531069,615053,Maryville (MO) Saints,615090,Upper Iowa Peacocks,615053,6,top,B. Lund to ss for T. Meiners.,45,2026-03-20T15:00:00-04:00,"Robertson Woods Field (Fayette, IA)",147,MBA,2026
6531069,615053,Maryville (MO) Saints,615090,Upper Iowa Peacocks,615053,6,top,Steven Schne walked (3-0 BBBB).,46,2026-03-20T15:00:00-04:00,"Robertson Woods Field (Fayette, IA)",147,MBA,2026
6531069,615053,Maryville (MO) Saints,615090,Upper Iowa Peacocks,615053,6,top,"Dominic Shar singled to right field, advanced to second on the throw (1-0 B)3a Steven Schne advanced to third.",47,2026-03-20T15:00:00-04:00,"Robertson Woods Field (Fayette, IA)",147,MBA,2026
6531069,615053,Maryville (MO) Saints,615090,Upper Iowa Peacocks,615053,6,top,Brady Kindha singled to third base (1-2 KBF).,48,2026-03-20T15:00:00-04:00,"Robertson Woods Field (Fayette, IA)",147,MBA,2026
6531069,615053,Maryville (MO) Saints,615090,Upper Iowa Peacocks,615053,6,top,"Greyson Rath singled to left field, RBI (0-2 KF)3a Brady Kindha advanced to second3a Dominic Shar advanced to third3a Steven Schne scored.",49,2026-03-20T15:00:00-04:00,"Robertson Woods Field (Fayette, IA)",147,MBA,2026
6531069,615053,Maryville (MO) Saints,615090,Upper Iowa Peacocks,615053,6,top,"Justin Gorsk hit by pitch, RBI (1-0 B)3a Greyson Rath advanced to second3a Brady Kindha advanced to third3a Dominic Shar scored.",50,2026-03-20T15:00:00-04:00,"Robertson Woods Field (Fayette, IA)",147,MBA,2026
6531069,615053,Maryville (MO) Saints,615090,Upper Iowa Peacocks,615053,6,top,B. Nicodemus to p for C. Powell.,51,2026-03-20T15:00:00-04:00,"Robertson Woods Field (Fayette, IA)",147,MBA,2026
6531069,615053,Maryville (MO) Saints,615090,Upper Iowa Peacocks,615053,6,top,"Matthew Raus reached on a fielding error by 2b (0-1 K)3a Justin Gorsk advanced to third3a Greyson Rath scored, unearned3a Brady Kindha scored, unearned.",52,2026-03-20T15:00:00-04:00,"Robertson Woods Field (Fayette, IA)",147,MBA,2026
6531069,615053,Maryville (MO) Saints,615090,Upper Iowa Peacocks,615053,6,top,Jace Burton struck out looking (3-2 KFBBFFBFFFFK)3a Matthew Raus stole second.,53,2026-03-20T15:00:00-04:00,"Robertson Woods Field (Fayette, IA)",147,MBA,2026
6531069,615053,Maryville (MO) Saints,615090,Upper Iowa Peacocks,615053,6,top,Jack Meyer struck out swinging (2-2 FKBBS).,54,2026-03-20T15:00:00-04:00,"Robertson Woods Field (Fayette, IA)",147,MBA,2026
6531069,615053,Maryville (MO) Saints,615090,Upper Iowa Peacocks,615053,6,top,"Dominic Anse singled to left field, 2 RBI (0-1 S)3a Matthew Raus scored, unearned3a Justin Gorsk scored, unearned.",55,2026-03-20T15:00:00-04:00,"Robertson Woods Field (Fayette, IA)",147,MBA,2026
6531069,615053,Maryville (MO) Saints,615090,Upper Iowa Peacocks,615053,6,top,Steven Schne struck out looking (1-2 KBKFK).,56,2026-03-20T15:00:00-04:00,"Robertson Woods Field (Fayette, IA)",147,MBA,2026
6531069,615053,Maryville (MO) Saints,615090,Upper Iowa Peacocks,615090,6,bot,C. Luzum lined out to ss (2-2 KFBFBF).,57,2026-03-20T15:00:00-04:00,"Robertson Woods Field (Fayette, IA)",147,MBA,2026
6531069,615053,Maryville (MO) Saints,615090,Upper Iowa Peacocks,615090,6,bot,B. Lund struck out looking (2-2 BSSBK).,58,2026-03-20T15:00:00-04:00,"Robertson Woods Field (Fayette, IA)",147,MBA,2026
6531069,615053,Maryville (MO) Saints,615090,Upper Iowa Peacocks,615090,6,bot,B. Zimmer flied out to rf (0-0).,59,2026-03-20T15:00:00-04:00,"Robertson Woods Field (Fayette, IA)",147,MBA,2026
6531069,615053,Maryville (MO) Saints,615090,Upper Iowa Peacocks,615053,7,top,Dominic Shar struck out looking (3-2 BBKBKK).,60,2026-03-20T15:00:00-04:00,"Robertson Woods Field (Fayette, IA)",147,MBA,2026
6531069,615053,Maryville (MO) Saints,615090,Upper Iowa Peacocks,615053,7,top,Brady Kindha walked (3-1 SBBBB).,61,2026-03-20T15:00:00-04:00,"Robertson Woods Field (Fayette, IA)",147,MBA,2026
6531069,615053,Maryville (MO) Saints,615090,Upper Iowa Peacocks,615053,7,top,Greyson Rath flied out to rf (1-1 BK).,62,2026-03-20T15:00:00-04:00,"Robertson Woods Field (Fayette, IA)",147,MBA,2026
6531069,615053,Maryville (MO) Saints,615090,Upper Iowa Peacocks,615053,7,top,Justin Gorsk popped up to ss to left center (1-0 B).,63,2026-03-20T15:00:00-04:00,"Robertson Woods Field (Fayette, IA)",147,MBA,2026
6531069,615053,Maryville (MO) Saints,615090,Upper Iowa Peacocks,615090,7,bot,J. Vargas flied out to lf (3-1 BBSB).,64,2026-03-20T15:00:00-04:00,"Robertson Woods Field (Fayette, IA)",147,MBA,2026
6531069,615053,Maryville (MO) Saints,615090,Upper Iowa Peacocks,615090,7,bot,G.Bombardier doubled to center field (0-0).,65,2026-03-20T15:00:00-04:00,"Robertson Woods Field (Fayette, IA)",147,MBA,2026
6531069,615053,Maryville (MO) Saints,615090,Upper Iowa Peacocks,615090,7,bot,J. Hoodjer lined into double play 2b to ss (0-1 S)3a G.Bombardier out on the play.,66,2026-03-20T15:00:00-04:00,"Robertson Woods Field (Fayette, IA)",147,MBA,2026
6531069,615053,Maryville (MO) Saints,615090,Upper Iowa Peacocks,615053,8,top,Matthew Raus hit by pitch (0-2 KF).,67,2026-03-20T15:00:00-04:00,"Robertson Woods Field (Fayette, IA)",147,MBA,2026
6531069,615053,Maryville (MO) Saints,615090,Upper Iowa Peacocks,615053,8,top,Jace Burton grounded out to 3b (0-1 K)3a Matthew Raus advanced to second.,68,2026-03-20T15:00:00-04:00,"Robertson Woods Field (Fayette, IA)",147,MBA,2026
6531069,615053,Maryville (MO) Saints,615090,Upper Iowa Peacocks,615053,8,top,Jack Meyer singled through the right side (1-1 FB)3a Matthew Raus advanced to third.,69,2026-03-20T15:00:00-04:00,"Robertson Woods Field (Fayette, IA)",147,MBA,2026
6531069,615053,Maryville (MO) Saints,615090,Upper Iowa Peacocks,615053,8,top,Jack Meyer stole second.,70,2026-03-20T15:00:00-04:00,"Robertson Woods Field (Fayette, IA)",147,MBA,2026
6531069,615053,Maryville (MO) Saints,615090,Upper Iowa Peacocks,615053,8,top,Dominic Anse struck out looking (3-2 BBFSBK).,71,2026-03-20T15:00:00-04:00,"Robertson Woods Field (Fayette, IA)",147,MBA,2026
6531069,615053,Maryville (MO) Saints,615090,Upper Iowa Peacocks,615053,8,top,"Steven Schne reached on a throwing error by c (3-1 BBBK)3a Jack Meyer scored, unearned3a Matthew Raus scored, unearned.",72,2026-03-20T15:00:00-04:00,"Robertson Woods Field (Fayette, IA)",147,MBA,2026
6531069,615053,Maryville (MO) Saints,615090,Upper Iowa Peacocks,615053,8,top,Dominic Shar struck out swinging (2-2 KBBKS).,73,2026-03-20T15:00:00-04:00,"Robertson Woods Field (Fayette, IA)",147,MBA,2026
6531069,615053,Maryville (MO) Saints,615090,Upper Iowa Peacocks,615090,8,bot,H. Jones grounded out to ss (3-2 BKFBFB).,74,2026-03-20T15:00:00-04:00,"Robertson Woods Field (Fayette, IA)",147,MBA,2026
6531069,615053,Maryville (MO) Saints,615090,Upper Iowa Peacocks,615090,8,bot,P. Safranski doubled to left field (3-1 BBFB).,75,2026-03-20T15:00:00-04:00,"Robertson Woods Field (Fayette, IA)",147,MBA,2026
6531069,615053,Maryville (MO) Saints,615090,Upper Iowa Peacocks,615090,8,bot,"J. Klug struck out swinging, reached first on a throwing error by c (2-2 BFBSS)3a P. Safranski advanced to third.",76,2026-03-20T15:00:00-04:00,"Robertson Woods Field (Fayette, IA)",147,MBA,2026
6531069,615053,Maryville (MO) Saints,615090,Upper Iowa Peacocks,615090,8,bot,C. Luzum fouled out to c (1-1 BF).,77,2026-03-20T15:00:00-04:00,"Robertson Woods Field (Fayette, IA)",147,MBA,2026
6531069,615053,Maryville (MO) Saints,615090,Upper Iowa Peacocks,615090,8,bot,B. Lund popped up to 1b (0-0).,78,2026-03-20T15:00:00-04:00,"Robertson Woods Field (Fayette, IA)",147,MBA,2026
