game_id,away_team_id,away_team_name,home_team_id,home_team_name,batting_team,inning,top_bot,event_text,event_num,game_datetime,stadium_name,attendance,sport_id,season
6533043,615261,Messiah Falcons,615323,Randolph-Macon Yellow Jackets,615261,1,top,I. Parido grounded out to 2b.,1,2026-02-21T12:00:00-05:00,"Estes Park (Ashland, VA)",360,MBA,2026
6533043,615261,Messiah Falcons,615323,Randolph-Macon Yellow Jackets,615261,1,top,C. Reid singled to right field.,2,2026-02-21T12:00:00-05:00,"Estes Park (Ashland, VA)",360,MBA,2026
6533043,615261,Messiah Falcons,615323,Randolph-Macon Yellow Jackets,615261,1,top,"C. Reid out at second c to ss, caught stealing.",3,2026-02-21T12:00:00-05:00,"Estes Park (Ashland, VA)",360,MBA,2026
6533043,615261,Messiah Falcons,615323,Randolph-Macon Yellow Jackets,615261,1,top,D. Hurst walked.,4,2026-02-21T12:00:00-05:00,"Estes Park (Ashland, VA)",360,MBA,2026
6533043,615261,Messiah Falcons,615323,Randolph-Macon Yellow Jackets,615261,1,top,C. Reyna struck out looking.,5,2026-02-21T12:00:00-05:00,"Estes Park (Ashland, VA)",360,MBA,2026
6533043,615261,Messiah Falcons,615323,Randolph-Macon Yellow Jackets,615323,1,bot,J. Bowles singled to left field.,6,2026-02-21T12:00:00-05:00,"Estes Park (Ashland, VA)",360,MBA,2026
6533043,615261,Messiah Falcons,615323,Randolph-Macon Yellow Jackets,615323,1,bot,Z. Wernoski fouled out to 1b.,7,2026-02-21T12:00:00-05:00,"Estes Park (Ashland, VA)",360,MBA,2026
6533043,615261,Messiah Falcons,615323,Randolph-Macon Yellow Jackets,615323,1,bot,C. Schmitt walked; J. Bowles advanced to second.,8,2026-02-21T12:00:00-05:00,"Estes Park (Ashland, VA)",360,MBA,2026
6533043,615261,Messiah Falcons,615323,Randolph-Macon Yellow Jackets,615323,1,bot,Z. Stolze struck out swinging.,9,2026-02-21T12:00:00-05:00,"Estes Park (Ashland, VA)",360,MBA,2026
6533043,615261,Messiah Falcons,615323,Randolph-Macon Yellow Jackets,615323,1,bot,T. Gates struck out swinging.,10,2026-02-21T12:00:00-05:00,"Estes Park (Ashland, VA)",360,MBA,2026
6533043,615261,Messiah Falcons,615323,Randolph-Macon Yellow Jackets,615261,2,top,"N. Moyer reached first on a throwing error by 3b, advanced to second.",11,2026-02-21T12:00:00-05:00,"Estes Park (Ashland, VA)",360,MBA,2026
6533043,615261,Messiah Falcons,615323,Randolph-Macon Yellow Jackets,615261,2,top,N. Moyer advanced to third on a balk.,12,2026-02-21T12:00:00-05:00,"Estes Park (Ashland, VA)",360,MBA,2026
6533043,615261,Messiah Falcons,615323,Randolph-Macon Yellow Jackets,615261,2,top,"B. Burkholde grounded out to 2b, RBI; N. Moyer scored, unearned.",13,2026-02-21T12:00:00-05:00,"Estes Park (Ashland, VA)",360,MBA,2026
6533043,615261,Messiah Falcons,615323,Randolph-Macon Yellow Jackets,615261,2,top,M. Luchovick grounded out to ss.,14,2026-02-21T12:00:00-05:00,"Estes Park (Ashland, VA)",360,MBA,2026
6533043,615261,Messiah Falcons,615323,Randolph-Macon Yellow Jackets,615261,2,top,L. Ott lined out to 2b.,15,2026-02-21T12:00:00-05:00,"Estes Park (Ashland, VA)",360,MBA,2026
6533043,615261,Messiah Falcons,615323,Randolph-Macon Yellow Jackets,615323,2,bot,J. Quici reached first on a fielding error by p.,16,2026-02-21T12:00:00-05:00,"Estes Park (Ashland, VA)",360,MBA,2026
6533043,615261,Messiah Falcons,615323,Randolph-Macon Yellow Jackets,615323,2,bot,L. Duff struck out swinging.,17,2026-02-21T12:00:00-05:00,"Estes Park (Ashland, VA)",360,MBA,2026
6533043,615261,Messiah Falcons,615323,Randolph-Macon Yellow Jackets,615323,2,bot,J. Baffone reached on a fielder's choice; J. Quici advanced to second on an error by 2b.,18,2026-02-21T12:00:00-05:00,"Estes Park (Ashland, VA)",360,MBA,2026
6533043,615261,Messiah Falcons,615323,Randolph-Macon Yellow Jackets,615323,2,bot,J. Hill walked; J. Baffone advanced to second; J. Quici advanced to third.,19,2026-02-21T12:00:00-05:00,"Estes Park (Ashland, VA)",360,MBA,2026
6533043,615261,Messiah Falcons,615323,Randolph-Macon Yellow Jackets,615323,2,bot,"J. Bowles singled to right field, RBI; J. Hill advanced to second; J. Baffone advanced to third; J. Quici scored, unearned.",20,2026-02-21T12:00:00-05:00,"Estes Park (Ashland, VA)",360,MBA,2026
6533043,615261,Messiah Falcons,615323,Randolph-Macon Yellow Jackets,615323,2,bot,Z. Wernoski lined out to ss.,21,2026-02-21T12:00:00-05:00,"Estes Park (Ashland, VA)",360,MBA,2026
6533043,615261,Messiah Falcons,615323,Randolph-Macon Yellow Jackets,615323,2,bot,"C. Schmitt singled to left field, RBI; J. Bowles advanced to second; J. Hill advanced to third; J. Baffone scored, unearned.",22,2026-02-21T12:00:00-05:00,"Estes Park (Ashland, VA)",360,MBA,2026
6533043,615261,Messiah Falcons,615323,Randolph-Macon Yellow Jackets,615323,2,bot,Z. Stolze fouled out to c.,23,2026-02-21T12:00:00-05:00,"Estes Park (Ashland, VA)",360,MBA,2026
6533043,615261,Messiah Falcons,615323,Randolph-Macon Yellow Jackets,615261,3,top,D. Martinez singled to right field.,24,2026-02-21T12:00:00-05:00,"Estes Park (Ashland, VA)",360,MBA,2026
6533043,615261,Messiah Falcons,615323,Randolph-Macon Yellow Jackets,615261,3,top,D. Martinez stole second.,25,2026-02-21T12:00:00-05:00,"Estes Park (Ashland, VA)",360,MBA,2026
6533043,615261,Messiah Falcons,615323,Randolph-Macon Yellow Jackets,615261,3,top,I. Parido struck out swinging.,26,2026-02-21T12:00:00-05:00,"Estes Park (Ashland, VA)",360,MBA,2026
6533043,615261,Messiah Falcons,615323,Randolph-Macon Yellow Jackets,615261,3,top,C. Reid popped up to rf.,27,2026-02-21T12:00:00-05:00,"Estes Park (Ashland, VA)",360,MBA,2026
6533043,615261,Messiah Falcons,615323,Randolph-Macon Yellow Jackets,615261,3,top,D. Hurst popped up to lf.,28,2026-02-21T12:00:00-05:00,"Estes Park (Ashland, VA)",360,MBA,2026
6533043,615261,Messiah Falcons,615323,Randolph-Macon Yellow Jackets,615323,3,bot,M. Lavanga pinch hit for T. Gates.,29,2026-02-21T12:00:00-05:00,"Estes Park (Ashland, VA)",360,MBA,2026
6533043,615261,Messiah Falcons,615323,Randolph-Macon Yellow Jackets,615323,3,bot,M. Lavanga struck out looking.,30,2026-02-21T12:00:00-05:00,"Estes Park (Ashland, VA)",360,MBA,2026
6533043,615261,Messiah Falcons,615323,Randolph-Macon Yellow Jackets,615323,3,bot,J. Quici struck out looking.,31,2026-02-21T12:00:00-05:00,"Estes Park (Ashland, VA)",360,MBA,2026
6533043,615261,Messiah Falcons,615323,Randolph-Macon Yellow Jackets,615323,3,bot,"L. Duff struck out swinging, out at first c to 1b.",32,2026-02-21T12:00:00-05:00,"Estes Park (Ashland, VA)",360,MBA,2026
6533043,615261,Messiah Falcons,615323,Randolph-Macon Yellow Jackets,615261,4,top,C. Schmitt to 1b.,33,2026-02-21T12:00:00-05:00,"Estes Park (Ashland, VA)",360,MBA,2026
6533043,615261,Messiah Falcons,615323,Randolph-Macon Yellow Jackets,615261,4,top,M. Lavanga to lf.,34,2026-02-21T12:00:00-05:00,"Estes Park (Ashland, VA)",360,MBA,2026
6533043,615261,Messiah Falcons,615323,Randolph-Macon Yellow Jackets,615261,4,top,W. Wian to p for C. Schuma.,35,2026-02-21T12:00:00-05:00,"Estes Park (Ashland, VA)",360,MBA,2026
6533043,615261,Messiah Falcons,615323,Randolph-Macon Yellow Jackets,615261,4,top,C. Reyna struck out swinging.,36,2026-02-21T12:00:00-05:00,"Estes Park (Ashland, VA)",360,MBA,2026
6533043,615261,Messiah Falcons,615323,Randolph-Macon Yellow Jackets,615261,4,top,N. Moyer struck out swinging.,37,2026-02-21T12:00:00-05:00,"Estes Park (Ashland, VA)",360,MBA,2026
6533043,615261,Messiah Falcons,615323,Randolph-Macon Yellow Jackets,615261,4,top,B. Burkholde struck out swinging.,38,2026-02-21T12:00:00-05:00,"Estes Park (Ashland, VA)",360,MBA,2026
6533043,615261,Messiah Falcons,615323,Randolph-Macon Yellow Jackets,615323,4,bot,"J. Baffone struck out swinging, out at first c to 1b.",39,2026-02-21T12:00:00-05:00,"Estes Park (Ashland, VA)",360,MBA,2026
6533043,615261,Messiah Falcons,615323,Randolph-Macon Yellow Jackets,615323,4,bot,J. Hill grounded out to c.,40,2026-02-21T12:00:00-05:00,"Estes Park (Ashland, VA)",360,MBA,2026
6533043,615261,Messiah Falcons,615323,Randolph-Macon Yellow Jackets,615323,4,bot,J. Bowles walked.,41,2026-02-21T12:00:00-05:00,"Estes Park (Ashland, VA)",360,MBA,2026
6533043,615261,Messiah Falcons,615323,Randolph-Macon Yellow Jackets,615323,4,bot,"Z. Wernoski singled to third base, bunt; J. Bowles advanced to second.",42,2026-02-21T12:00:00-05:00,"Estes Park (Ashland, VA)",360,MBA,2026
6533043,615261,Messiah Falcons,615323,Randolph-Macon Yellow Jackets,615323,4,bot,C. Schmitt walked; Z. Wernoski advanced to second; J. Bowles advanced to third.,43,2026-02-21T12:00:00-05:00,"Estes Park (Ashland, VA)",360,MBA,2026
6533043,615261,Messiah Falcons,615323,Randolph-Macon Yellow Jackets,615323,4,bot,D. Knight to p for C. Foltz.,44,2026-02-21T12:00:00-05:00,"Estes Park (Ashland, VA)",360,MBA,2026
6533043,615261,Messiah Falcons,615323,Randolph-Macon Yellow Jackets,615323,4,bot,Z. Stolze grounded out p to ss to 1b.,45,2026-02-21T12:00:00-05:00,"Estes Park (Ashland, VA)",360,MBA,2026
6533043,615261,Messiah Falcons,615323,Randolph-Macon Yellow Jackets,615261,5,top,M. Luchovick flied out to cf.,46,2026-02-21T12:00:00-05:00,"Estes Park (Ashland, VA)",360,MBA,2026
6533043,615261,Messiah Falcons,615323,Randolph-Macon Yellow Jackets,615261,5,top,L. Ott grounded out to 2b.,47,2026-02-21T12:00:00-05:00,"Estes Park (Ashland, VA)",360,MBA,2026
6533043,615261,Messiah Falcons,615323,Randolph-Macon Yellow Jackets,615261,5,top,D. Martinez flied out to rf.,48,2026-02-21T12:00:00-05:00,"Estes Park (Ashland, VA)",360,MBA,2026
6533043,615261,Messiah Falcons,615323,Randolph-Macon Yellow Jackets,615323,5,bot,M. Smith to 3b for D. Hurst.,49,2026-02-21T12:00:00-05:00,"Estes Park (Ashland, VA)",360,MBA,2026
6533043,615261,Messiah Falcons,615323,Randolph-Macon Yellow Jackets,615323,5,bot,M. Lavanga grounded out to 3b.,50,2026-02-21T12:00:00-05:00,"Estes Park (Ashland, VA)",360,MBA,2026
6533043,615261,Messiah Falcons,615323,Randolph-Macon Yellow Jackets,615323,5,bot,J. Quici hit by pitch.,51,2026-02-21T12:00:00-05:00,"Estes Park (Ashland, VA)",360,MBA,2026
6533043,615261,Messiah Falcons,615323,Randolph-Macon Yellow Jackets,615323,5,bot,J. Quici advanced to second on a wild pitch.,52,2026-02-21T12:00:00-05:00,"Estes Park (Ashland, VA)",360,MBA,2026
6533043,615261,Messiah Falcons,615323,Randolph-Macon Yellow Jackets,615323,5,bot,L. Duff singled to right field; J. Quici advanced to third.,53,2026-02-21T12:00:00-05:00,"Estes Park (Ashland, VA)",360,MBA,2026
6533043,615261,Messiah Falcons,615323,Randolph-Macon Yellow Jackets,615323,5,bot,"J. Baffone singled down the lf line, RBI; L. Duff advanced to second; J. Quici scored.",54,2026-02-21T12:00:00-05:00,"Estes Park (Ashland, VA)",360,MBA,2026
6533043,615261,Messiah Falcons,615323,Randolph-Macon Yellow Jackets,615323,5,bot,J. Hill grounded out to 3b; L. Duff out at third 3b unassisted.,55,2026-02-21T12:00:00-05:00,"Estes Park (Ashland, VA)",360,MBA,2026
6533043,615261,Messiah Falcons,615323,Randolph-Macon Yellow Jackets,615261,6,top,I. Parido lined out to rf.,56,2026-02-21T12:00:00-05:00,"Estes Park (Ashland, VA)",360,MBA,2026
6533043,615261,Messiah Falcons,615323,Randolph-Macon Yellow Jackets,615261,6,top,C. Reid singled to left field.,57,2026-02-21T12:00:00-05:00,"Estes Park (Ashland, VA)",360,MBA,2026
6533043,615261,Messiah Falcons,615323,Randolph-Macon Yellow Jackets,615261,6,top,M. Smith struck out swinging.,58,2026-02-21T12:00:00-05:00,"Estes Park (Ashland, VA)",360,MBA,2026
6533043,615261,Messiah Falcons,615323,Randolph-Macon Yellow Jackets,615261,6,top,C. Reyna flied out to cf.,59,2026-02-21T12:00:00-05:00,"Estes Park (Ashland, VA)",360,MBA,2026
6533043,615261,Messiah Falcons,615323,Randolph-Macon Yellow Jackets,615323,6,bot,J. Bowles grounded out to 2b.,60,2026-02-21T12:00:00-05:00,"Estes Park (Ashland, VA)",360,MBA,2026
6533043,615261,Messiah Falcons,615323,Randolph-Macon Yellow Jackets,615323,6,bot,Z. Wernoski grounded out to ss.,61,2026-02-21T12:00:00-05:00,"Estes Park (Ashland, VA)",360,MBA,2026
6533043,615261,Messiah Falcons,615323,Randolph-Macon Yellow Jackets,615323,6,bot,C. Schmitt walked.,62,2026-02-21T12:00:00-05:00,"Estes Park (Ashland, VA)",360,MBA,2026
6533043,615261,Messiah Falcons,615323,Randolph-Macon Yellow Jackets,615323,6,bot,Z. Stolze singled to left field; C. Schmitt advanced to second.,63,2026-02-21T12:00:00-05:00,"Estes Park (Ashland, VA)",360,MBA,2026
6533043,615261,Messiah Falcons,615323,Randolph-Macon Yellow Jackets,615323,6,bot,Z. Stolze advanced to second on a passed ball; C. Schmitt advanced to third on a passed ball.,64,2026-02-21T12:00:00-05:00,"Estes Park (Ashland, VA)",360,MBA,2026
6533043,615261,Messiah Falcons,615323,Randolph-Macon Yellow Jackets,615323,6,bot,"M. Lavanga singled to left field, RBI; Z. Stolze advanced to third; C. Schmitt scored.",65,2026-02-21T12:00:00-05:00,"Estes Park (Ashland, VA)",360,MBA,2026
6533043,615261,Messiah Falcons,615323,Randolph-Macon Yellow Jackets,615323,6,bot,J. Quici flied out to cf.,66,2026-02-21T12:00:00-05:00,"Estes Park (Ashland, VA)",360,MBA,2026
6533043,615261,Messiah Falcons,615323,Randolph-Macon Yellow Jackets,615261,7,top,N. Moyer struck out looking.,67,2026-02-21T12:00:00-05:00,"Estes Park (Ashland, VA)",360,MBA,2026
6533043,615261,Messiah Falcons,615323,Randolph-Macon Yellow Jackets,615261,7,top,B. Burkholde doubled to right field.,68,2026-02-21T12:00:00-05:00,"Estes Park (Ashland, VA)",360,MBA,2026
6533043,615261,Messiah Falcons,615323,Randolph-Macon Yellow Jackets,615261,7,top,B. Travaglin pinch ran for B. Burkholde.,69,2026-02-21T12:00:00-05:00,"Estes Park (Ashland, VA)",360,MBA,2026
6533043,615261,Messiah Falcons,615323,Randolph-Macon Yellow Jackets,615261,7,top,"M. Luchovick singled down the lf line, RBI; B. Travaglin scored.",70,2026-02-21T12:00:00-05:00,"Estes Park (Ashland, VA)",360,MBA,2026
6533043,615261,Messiah Falcons,615323,Randolph-Macon Yellow Jackets,615261,7,top,L. Ott struck out looking.,71,2026-02-21T12:00:00-05:00,"Estes Park (Ashland, VA)",360,MBA,2026
6533043,615261,Messiah Falcons,615323,Randolph-Macon Yellow Jackets,615261,7,top,M. Luchovick advanced to second on a wild pitch.,72,2026-02-21T12:00:00-05:00,"Estes Park (Ashland, VA)",360,MBA,2026
6533043,615261,Messiah Falcons,615323,Randolph-Macon Yellow Jackets,615261,7,top,D. Martinez flied out to cf.,73,2026-02-21T12:00:00-05:00,"Estes Park (Ashland, VA)",360,MBA,2026
6533043,615261,Messiah Falcons,615323,Randolph-Macon Yellow Jackets,615323,7,bot,L. Duff walked.,74,2026-02-21T12:00:00-05:00,"Estes Park (Ashland, VA)",360,MBA,2026
6533043,615261,Messiah Falcons,615323,Randolph-Macon Yellow Jackets,615323,7,bot,J. Baffone lined out to cf.,75,2026-02-21T12:00:00-05:00,"Estes Park (Ashland, VA)",360,MBA,2026
6533043,615261,Messiah Falcons,615323,Randolph-Macon Yellow Jackets,615323,7,bot,J. Hill flied out to rf.,76,2026-02-21T12:00:00-05:00,"Estes Park (Ashland, VA)",360,MBA,2026
6533043,615261,Messiah Falcons,615323,Randolph-Macon Yellow Jackets,615323,7,bot,L. Duff stole second.,77,2026-02-21T12:00:00-05:00,"Estes Park (Ashland, VA)",360,MBA,2026
6533043,615261,Messiah Falcons,615323,Randolph-Macon Yellow Jackets,615323,7,bot,J. Bowles grounded out to 2b.,78,2026-02-21T12:00:00-05:00,"Estes Park (Ashland, VA)",360,MBA,2026
6533043,615261,Messiah Falcons,615323,Randolph-Macon Yellow Jackets,615261,8,top,I. Parido flied out to rf.,79,2026-02-21T12:00:00-05:00,"Estes Park (Ashland, VA)",360,MBA,2026
6533043,615261,Messiah Falcons,615323,Randolph-Macon Yellow Jackets,615261,8,top,C. Reid flied out to 2b.,80,2026-02-21T12:00:00-05:00,"Estes Park (Ashland, VA)",360,MBA,2026
6533043,615261,Messiah Falcons,615323,Randolph-Macon Yellow Jackets,615261,8,top,M. Smith flied out to rf.,81,2026-02-21T12:00:00-05:00,"Estes Park (Ashland, VA)",360,MBA,2026
6533043,615261,Messiah Falcons,615323,Randolph-Macon Yellow Jackets,615323,8,bot,W. Cloudt to p for D. Knight.,82,2026-02-21T12:00:00-05:00,"Estes Park (Ashland, VA)",360,MBA,2026
6533043,615261,Messiah Falcons,615323,Randolph-Macon Yellow Jackets,615323,8,bot,Z. Wernoski lined out to rf.,83,2026-02-21T12:00:00-05:00,"Estes Park (Ashland, VA)",360,MBA,2026
6533043,615261,Messiah Falcons,615323,Randolph-Macon Yellow Jackets,615323,8,bot,C. Schmitt flied out to rf.,84,2026-02-21T12:00:00-05:00,"Estes Park (Ashland, VA)",360,MBA,2026
6533043,615261,Messiah Falcons,615323,Randolph-Macon Yellow Jackets,615323,8,bot,Z. Stolze singled to left center.,85,2026-02-21T12:00:00-05:00,"Estes Park (Ashland, VA)",360,MBA,2026
6533043,615261,Messiah Falcons,615323,Randolph-Macon Yellow Jackets,615323,8,bot,M. Lavanga struck out swinging.,86,2026-02-21T12:00:00-05:00,"Estes Park (Ashland, VA)",360,MBA,2026
6533043,615261,Messiah Falcons,615323,Randolph-Macon Yellow Jackets,615261,9,top,E. Brooks to lf for M. Lavanga.,87,2026-02-21T12:00:00-05:00,"Estes Park (Ashland, VA)",360,MBA,2026
6533043,615261,Messiah Falcons,615323,Randolph-Macon Yellow Jackets,615261,9,top,C. Reyna grounded out to 3b.,88,2026-02-21T12:00:00-05:00,"Estes Park (Ashland, VA)",360,MBA,2026
6533043,615261,Messiah Falcons,615323,Randolph-Macon Yellow Jackets,615261,9,top,N. Moyer flied out to lf.,89,2026-02-21T12:00:00-05:00,"Estes Park (Ashland, VA)",360,MBA,2026
6533043,615261,Messiah Falcons,615323,Randolph-Macon Yellow Jackets,615261,9,top,L. Mark pinch hit for B. Travaglin.,90,2026-02-21T12:00:00-05:00,"Estes Park (Ashland, VA)",360,MBA,2026
6533043,615261,Messiah Falcons,615323,Randolph-Macon Yellow Jackets,615261,9,top,L. Mark struck out swinging.,91,2026-02-21T12:00:00-05:00,"Estes Park (Ashland, VA)",360,MBA,2026
