game_id,away_team_id,away_team_name,home_team_id,home_team_name,batting_team,inning,top_bot,event_text,event_num,game_datetime,stadium_name,attendance,sport_id,season
6533696,614723,St. Bonaventure Bonnies,614652,Marshall Thundering Herd,614723,1,top,Anthony Fernandez struck out swinging (1-2 BFFS).,1,2026-03-06T18:00:00-05:00,"Jack Cook Field (Huntington, WV)",1327,MBA,2026
6533696,614723,St. Bonaventure Bonnies,614652,Marshall Thundering Herd,614723,1,top,Joey Bruno grounded out to 2b (1-2 SKB).,2,2026-03-06T18:00:00-05:00,"Jack Cook Field (Huntington, WV)",1327,MBA,2026
6533696,614723,St. Bonaventure Bonnies,614652,Marshall Thundering Herd,614723,1,top,Chris Hoalcraft grounded out to ss (1-2 KKBFF).,3,2026-03-06T18:00:00-05:00,"Jack Cook Field (Huntington, WV)",1327,MBA,2026
6533696,614723,St. Bonaventure Bonnies,614652,Marshall Thundering Herd,614652,1,bot,Evan Bottone singled through the right side (0-0).,4,2026-03-06T18:00:00-05:00,"Jack Cook Field (Huntington, WV)",1327,MBA,2026
6533696,614723,St. Bonaventure Bonnies,614652,Marshall Thundering Herd,614652,1,bot,Evan Bottone stole second.,5,2026-03-06T18:00:00-05:00,"Jack Cook Field (Huntington, WV)",1327,MBA,2026
6533696,614723,St. Bonaventure Bonnies,614652,Marshall Thundering Herd,614652,1,bot,Tyler Kamerer walked (3-1 BKBBB).,6,2026-03-06T18:00:00-05:00,"Jack Cook Field (Huntington, WV)",1327,MBA,2026
6533696,614723,St. Bonaventure Bonnies,614652,Marshall Thundering Herd,614652,1,bot,Jackson Halter struck out looking (2-2 KBBSF).,7,2026-03-06T18:00:00-05:00,"Jack Cook Field (Huntington, WV)",1327,MBA,2026
6533696,614723,St. Bonaventure Bonnies,614652,Marshall Thundering Herd,614652,1,bot,AJ Havrilla walked (3-2 BBFKFFBB); Tyler Kamerer advanced to second; Evan Bottone advanced to third.,8,2026-03-06T18:00:00-05:00,"Jack Cook Field (Huntington, WV)",1327,MBA,2026
6533696,614723,St. Bonaventure Bonnies,614652,Marshall Thundering Herd,614652,1,bot,Cooper Hinson struck out looking (3-2 BSBFFBF).,9,2026-03-06T18:00:00-05:00,"Jack Cook Field (Huntington, WV)",1327,MBA,2026
6533696,614723,St. Bonaventure Bonnies,614652,Marshall Thundering Herd,614652,1,bot,Ethan Murdoch struck out swinging (0-2 FKF).,10,2026-03-06T18:00:00-05:00,"Jack Cook Field (Huntington, WV)",1327,MBA,2026
6533696,614723,St. Bonaventure Bonnies,614652,Marshall Thundering Herd,614723,2,top,"Manuel Castro homered to left field, RBI (0-0).",11,2026-03-06T18:00:00-05:00,"Jack Cook Field (Huntington, WV)",1327,MBA,2026
6533696,614723,St. Bonaventure Bonnies,614652,Marshall Thundering Herd,614723,2,top,Alex Hebenstreit flied out to cf (1-1 BK).,12,2026-03-06T18:00:00-05:00,"Jack Cook Field (Huntington, WV)",1327,MBA,2026
6533696,614723,St. Bonaventure Bonnies,614652,Marshall Thundering Herd,614723,2,top,"Antonio Cordeiro struck out swinging, out at first c to 1b (0-2 FKS).",13,2026-03-06T18:00:00-05:00,"Jack Cook Field (Huntington, WV)",1327,MBA,2026
6533696,614723,St. Bonaventure Bonnies,614652,Marshall Thundering Herd,614723,2,top,Joey Calabretti struck out looking (1-2 SBFF).,14,2026-03-06T18:00:00-05:00,"Jack Cook Field (Huntington, WV)",1327,MBA,2026
6533696,614723,St. Bonaventure Bonnies,614652,Marshall Thundering Herd,614652,2,bot,Mason Onate lined out to cf (2-1 BBF).,15,2026-03-06T18:00:00-05:00,"Jack Cook Field (Huntington, WV)",1327,MBA,2026
6533696,614723,St. Bonaventure Bonnies,614652,Marshall Thundering Herd,614652,2,bot,Jack Smith grounded out to p unassisted (2-2 SFBB).,16,2026-03-06T18:00:00-05:00,"Jack Cook Field (Huntington, WV)",1327,MBA,2026
6533696,614723,St. Bonaventure Bonnies,614652,Marshall Thundering Herd,614652,2,bot,Jackson Golden grounded out to ss (0-1 F).,17,2026-03-06T18:00:00-05:00,"Jack Cook Field (Huntington, WV)",1327,MBA,2026
6533696,614723,St. Bonaventure Bonnies,614652,Marshall Thundering Herd,614723,3,top,Conner Vercollone singled to right field (1-1 SB).,18,2026-03-06T18:00:00-05:00,"Jack Cook Field (Huntington, WV)",1327,MBA,2026
6533696,614723,St. Bonaventure Bonnies,614652,Marshall Thundering Herd,614723,3,top,"Gavin Constantine reached on a fielder's choice, bunt (0-1 F); Conner Vercollone out at second p to ss.",19,2026-03-06T18:00:00-05:00,"Jack Cook Field (Huntington, WV)",1327,MBA,2026
6533696,614723,St. Bonaventure Bonnies,614652,Marshall Thundering Herd,614723,3,top,Anthony Fernandez popped up to 2b (0-1 F).,20,2026-03-06T18:00:00-05:00,"Jack Cook Field (Huntington, WV)",1327,MBA,2026
6533696,614723,St. Bonaventure Bonnies,614652,Marshall Thundering Herd,614723,3,top,"Gavin Constantine out at first p to 1b to 2b, picked off.",21,2026-03-06T18:00:00-05:00,"Jack Cook Field (Huntington, WV)",1327,MBA,2026
6533696,614723,St. Bonaventure Bonnies,614652,Marshall Thundering Herd,614652,3,bot,"Evan Bottone grounded out to p, bunt (0-0).",22,2026-03-06T18:00:00-05:00,"Jack Cook Field (Huntington, WV)",1327,MBA,2026
6533696,614723,St. Bonaventure Bonnies,614652,Marshall Thundering Herd,614652,3,bot,Tyler Kamerer doubled to left field (0-1 S).,23,2026-03-06T18:00:00-05:00,"Jack Cook Field (Huntington, WV)",1327,MBA,2026
6533696,614723,St. Bonaventure Bonnies,614652,Marshall Thundering Herd,614652,3,bot,Tyler Kamerer advanced to third on a wild pitch.,24,2026-03-06T18:00:00-05:00,"Jack Cook Field (Huntington, WV)",1327,MBA,2026
6533696,614723,St. Bonaventure Bonnies,614652,Marshall Thundering Herd,614652,3,bot,Jackson Halter struck out swinging (1-2 KSBS).,25,2026-03-06T18:00:00-05:00,"Jack Cook Field (Huntington, WV)",1327,MBA,2026
6533696,614723,St. Bonaventure Bonnies,614652,Marshall Thundering Herd,614652,3,bot,"AJ Havrilla singled to center field, RBI (3-2 BKSBBFF); Tyler Kamerer scored.",26,2026-03-06T18:00:00-05:00,"Jack Cook Field (Huntington, WV)",1327,MBA,2026
6533696,614723,St. Bonaventure Bonnies,614652,Marshall Thundering Herd,614652,3,bot,Cooper Hinson popped up to 2b (0-0).,27,2026-03-06T18:00:00-05:00,"Jack Cook Field (Huntington, WV)",1327,MBA,2026
6533696,614723,St. Bonaventure Bonnies,614652,Marshall Thundering Herd,614723,4,top,Joey Bruno struck out swinging (0-2 SKS).,28,2026-03-06T18:00:00-05:00,"Jack Cook Field (Huntington, WV)",1327,MBA,2026
6533696,614723,St. Bonaventure Bonnies,614652,Marshall Thundering Herd,614723,4,top,Chris Hoalcraft struck out swinging (2-2 BBKKF).,29,2026-03-06T18:00:00-05:00,"Jack Cook Field (Huntington, WV)",1327,MBA,2026
6533696,614723,St. Bonaventure Bonnies,614652,Marshall Thundering Herd,614723,4,top,Manuel Castro struck out swinging (1-2 BKFS).,30,2026-03-06T18:00:00-05:00,"Jack Cook Field (Huntington, WV)",1327,MBA,2026
6533696,614723,St. Bonaventure Bonnies,614652,Marshall Thundering Herd,614652,4,bot,Ethan Murdoch reached first on a throwing error by ss (0-0).,31,2026-03-06T18:00:00-05:00,"Jack Cook Field (Huntington, WV)",1327,MBA,2026
6533696,614723,St. Bonaventure Bonnies,614652,Marshall Thundering Herd,614652,4,bot,Mason Onate struck out swinging (0-2 KFS).,32,2026-03-06T18:00:00-05:00,"Jack Cook Field (Huntington, WV)",1327,MBA,2026
6533696,614723,St. Bonaventure Bonnies,614652,Marshall Thundering Herd,614652,4,bot,Jack Smith popped up to ss (0-2 SS).,33,2026-03-06T18:00:00-05:00,"Jack Cook Field (Huntington, WV)",1327,MBA,2026
6533696,614723,St. Bonaventure Bonnies,614652,Marshall Thundering Herd,614652,4,bot,Jackson Golden singled through the left side (0-1 K); Ethan Murdoch advanced to second.,34,2026-03-06T18:00:00-05:00,"Jack Cook Field (Huntington, WV)",1327,MBA,2026
6533696,614723,St. Bonaventure Bonnies,614652,Marshall Thundering Herd,614652,4,bot,Evan Bottone walked (3-2 KFFBBFBB); Jackson Golden advanced to second; Ethan Murdoch advanced to third.,35,2026-03-06T18:00:00-05:00,"Jack Cook Field (Huntington, WV)",1327,MBA,2026
6533696,614723,St. Bonaventure Bonnies,614652,Marshall Thundering Herd,614652,4,bot,"Tyler Kamerer doubled to left field, 3 RBI (0-0); Evan Bottone scored, unearned; Jackson Golden scored, unearned; Ethan Murdoch scored, unearned.",36,2026-03-06T18:00:00-05:00,"Jack Cook Field (Huntington, WV)",1327,MBA,2026
6533696,614723,St. Bonaventure Bonnies,614652,Marshall Thundering Herd,614652,4,bot,Jackson Halter struck out swinging (1-2 BKSS).,37,2026-03-06T18:00:00-05:00,"Jack Cook Field (Huntington, WV)",1327,MBA,2026
6533696,614723,St. Bonaventure Bonnies,614652,Marshall Thundering Herd,614723,5,top,Alex Hebenstreit struck out looking (2-2 KBFFB).,38,2026-03-06T18:00:00-05:00,"Jack Cook Field (Huntington, WV)",1327,MBA,2026
6533696,614723,St. Bonaventure Bonnies,614652,Marshall Thundering Herd,614723,5,top,Antonio Cordeiro doubled down the lf line (1-0 B).,39,2026-03-06T18:00:00-05:00,"Jack Cook Field (Huntington, WV)",1327,MBA,2026
6533696,614723,St. Bonaventure Bonnies,614652,Marshall Thundering Herd,614723,5,top,Joey Calabretti struck out looking (0-2 SFK).,40,2026-03-06T18:00:00-05:00,"Jack Cook Field (Huntington, WV)",1327,MBA,2026
6533696,614723,St. Bonaventure Bonnies,614652,Marshall Thundering Herd,614723,5,top,Conner Vercollone struck out swinging (2-2 BFSBS).,41,2026-03-06T18:00:00-05:00,"Jack Cook Field (Huntington, WV)",1327,MBA,2026
6533696,614723,St. Bonaventure Bonnies,614652,Marshall Thundering Herd,614652,5,bot,AJ Havrilla grounded out to 3b (1-0 B).,42,2026-03-06T18:00:00-05:00,"Jack Cook Field (Huntington, WV)",1327,MBA,2026
6533696,614723,St. Bonaventure Bonnies,614652,Marshall Thundering Herd,614652,5,bot,Cooper Hinson flied out to rf (2-1 BKB).,43,2026-03-06T18:00:00-05:00,"Jack Cook Field (Huntington, WV)",1327,MBA,2026
6533696,614723,St. Bonaventure Bonnies,614652,Marshall Thundering Herd,614652,5,bot,Ethan Murdoch flied out to cf (1-2 FBK).,44,2026-03-06T18:00:00-05:00,"Jack Cook Field (Huntington, WV)",1327,MBA,2026
6533696,614723,St. Bonaventure Bonnies,614652,Marshall Thundering Herd,614723,6,top,Gavin Constantine singled to left field (1-0 B).,45,2026-03-06T18:00:00-05:00,"Jack Cook Field (Huntington, WV)",1327,MBA,2026
6533696,614723,St. Bonaventure Bonnies,614652,Marshall Thundering Herd,614723,6,top,Anthony Fernandez singled to left center (2-2 FBBS); Gavin Constantine advanced to second.,46,2026-03-06T18:00:00-05:00,"Jack Cook Field (Huntington, WV)",1327,MBA,2026
6533696,614723,St. Bonaventure Bonnies,614652,Marshall Thundering Herd,614723,6,top,"Joey Bruno out at first 1b to 2b, SAC, bunt (1-0 B); Anthony Fernandez advanced to second; Gavin Constantine advanced to third.",47,2026-03-06T18:00:00-05:00,"Jack Cook Field (Huntington, WV)",1327,MBA,2026
6533696,614723,St. Bonaventure Bonnies,614652,Marshall Thundering Herd,614723,6,top,"Chris Hoalcraft reached first on a fielding error by 2b, RBI (1-1 FB); Anthony Fernandez scored, unearned; Gavin Constantine scored.",48,2026-03-06T18:00:00-05:00,"Jack Cook Field (Huntington, WV)",1327,MBA,2026
6533696,614723,St. Bonaventure Bonnies,614652,Marshall Thundering Herd,614723,6,top,Manuel Castro flied out to cf (1-0 B).,49,2026-03-06T18:00:00-05:00,"Jack Cook Field (Huntington, WV)",1327,MBA,2026
6533696,614723,St. Bonaventure Bonnies,614652,Marshall Thundering Herd,614723,6,top,"Chris Hoalcraft out at first p to 1b to 2b, picked off.",50,2026-03-06T18:00:00-05:00,"Jack Cook Field (Huntington, WV)",1327,MBA,2026
6533696,614723,St. Bonaventure Bonnies,614652,Marshall Thundering Herd,614652,6,bot,Mark Holm to p for David James.,51,2026-03-06T18:00:00-05:00,"Jack Cook Field (Huntington, WV)",1327,MBA,2026
6533696,614723,St. Bonaventure Bonnies,614652,Marshall Thundering Herd,614652,6,bot,Mason Onate flied out to rf (1-0 B).,52,2026-03-06T18:00:00-05:00,"Jack Cook Field (Huntington, WV)",1327,MBA,2026
6533696,614723,St. Bonaventure Bonnies,614652,Marshall Thundering Herd,614652,6,bot,Jack Smith flied out to cf (0-0).,53,2026-03-06T18:00:00-05:00,"Jack Cook Field (Huntington, WV)",1327,MBA,2026
6533696,614723,St. Bonaventure Bonnies,614652,Marshall Thundering Herd,614652,6,bot,Jackson Golden doubled to right center (2-1 FBB).,54,2026-03-06T18:00:00-05:00,"Jack Cook Field (Huntington, WV)",1327,MBA,2026
6533696,614723,St. Bonaventure Bonnies,614652,Marshall Thundering Herd,614652,6,bot,Evan Bottone struck out looking (3-2 BBKBFF).,55,2026-03-06T18:00:00-05:00,"Jack Cook Field (Huntington, WV)",1327,MBA,2026
6533696,614723,St. Bonaventure Bonnies,614652,Marshall Thundering Herd,614723,7,top,Alex Hebenstreit singled to third base (0-1 K).,56,2026-03-06T18:00:00-05:00,"Jack Cook Field (Huntington, WV)",1327,MBA,2026
6533696,614723,St. Bonaventure Bonnies,614652,Marshall Thundering Herd,614723,7,top,Antonio Cordeiro grounded into double play ss to 2b to 1b (0-0); Alex Hebenstreit out on the play.,57,2026-03-06T18:00:00-05:00,"Jack Cook Field (Huntington, WV)",1327,MBA,2026
6533696,614723,St. Bonaventure Bonnies,614652,Marshall Thundering Herd,614723,7,top,Joey Calabretti flied out to cf (1-2 FKB).,58,2026-03-06T18:00:00-05:00,"Jack Cook Field (Huntington, WV)",1327,MBA,2026
6533696,614723,St. Bonaventure Bonnies,614652,Marshall Thundering Herd,614652,7,bot,Tyler Kamerer walked (3-2 KBBFBFFFFFFB).,59,2026-03-06T18:00:00-05:00,"Jack Cook Field (Huntington, WV)",1327,MBA,2026
6533696,614723,St. Bonaventure Bonnies,614652,Marshall Thundering Herd,614652,7,bot,Jackson Halter flied out to cf (1-0 B).,60,2026-03-06T18:00:00-05:00,"Jack Cook Field (Huntington, WV)",1327,MBA,2026
6533696,614723,St. Bonaventure Bonnies,614652,Marshall Thundering Herd,614652,7,bot,Tyler Kamerer advanced to second on a wild pitch.,61,2026-03-06T18:00:00-05:00,"Jack Cook Field (Huntington, WV)",1327,MBA,2026
6533696,614723,St. Bonaventure Bonnies,614652,Marshall Thundering Herd,614652,7,bot,AJ Havrilla struck out swinging (2-2 KBFFB).,62,2026-03-06T18:00:00-05:00,"Jack Cook Field (Huntington, WV)",1327,MBA,2026
6533696,614723,St. Bonaventure Bonnies,614652,Marshall Thundering Herd,614652,7,bot,"Cooper Hinson doubled to right field, RBI (0-1 K); Tyler Kamerer scored.",63,2026-03-06T18:00:00-05:00,"Jack Cook Field (Huntington, WV)",1327,MBA,2026
6533696,614723,St. Bonaventure Bonnies,614652,Marshall Thundering Herd,614652,7,bot,Joey Calabretti to p.,64,2026-03-06T18:00:00-05:00,"Jack Cook Field (Huntington, WV)",1327,MBA,2026
6533696,614723,St. Bonaventure Bonnies,614652,Marshall Thundering Herd,614652,7,bot,David James to dh for Mark Holm.,65,2026-03-06T18:00:00-05:00,"Jack Cook Field (Huntington, WV)",1327,MBA,2026
6533696,614723,St. Bonaventure Bonnies,614652,Marshall Thundering Herd,614652,7,bot,Cam Harthan pinch ran for Cooper Hinson.,66,2026-03-06T18:00:00-05:00,"Jack Cook Field (Huntington, WV)",1327,MBA,2026
6533696,614723,St. Bonaventure Bonnies,614652,Marshall Thundering Herd,614652,7,bot,Ethan Murdoch flied out to cf (1-0 B).,67,2026-03-06T18:00:00-05:00,"Jack Cook Field (Huntington, WV)",1327,MBA,2026
6533696,614723,St. Bonaventure Bonnies,614652,Marshall Thundering Herd,614723,8,top,Evan Bottone to lf.,68,2026-03-06T18:00:00-05:00,"Jack Cook Field (Huntington, WV)",1327,MBA,2026
6533696,614723,St. Bonaventure Bonnies,614652,Marshall Thundering Herd,614723,8,top,Cam Harthan to cf.,69,2026-03-06T18:00:00-05:00,"Jack Cook Field (Huntington, WV)",1327,MBA,2026
6533696,614723,St. Bonaventure Bonnies,614652,Marshall Thundering Herd,614723,8,top,Conner Vercollone singled through the right side (0-1 F).,70,2026-03-06T18:00:00-05:00,"Jack Cook Field (Huntington, WV)",1327,MBA,2026
6533696,614723,St. Bonaventure Bonnies,614652,Marshall Thundering Herd,614723,8,top,"Gavin Constantine out at first p to 2b, SAC, bunt (0-0); Conner Vercollone advanced to second.",71,2026-03-06T18:00:00-05:00,"Jack Cook Field (Huntington, WV)",1327,MBA,2026
6533696,614723,St. Bonaventure Bonnies,614652,Marshall Thundering Herd,614723,8,top,Anthony Fernandez flied out to cf (2-2 BBFF).,72,2026-03-06T18:00:00-05:00,"Jack Cook Field (Huntington, WV)",1327,MBA,2026
6533696,614723,St. Bonaventure Bonnies,614652,Marshall Thundering Herd,614723,8,top,"Joey Bruno singled through the right side, RBI (2-2 KBBF); Conner Vercollone scored.",73,2026-03-06T18:00:00-05:00,"Jack Cook Field (Huntington, WV)",1327,MBA,2026
6533696,614723,St. Bonaventure Bonnies,614652,Marshall Thundering Herd,614723,8,top,Chris Hoalcraft singled up the middle (1-1 BK); Joey Bruno advanced to second.,74,2026-03-06T18:00:00-05:00,"Jack Cook Field (Huntington, WV)",1327,MBA,2026
6533696,614723,St. Bonaventure Bonnies,614652,Marshall Thundering Herd,614723,8,top,Charlie Krebs to p for Bryce Blevins.,75,2026-03-06T18:00:00-05:00,"Jack Cook Field (Huntington, WV)",1327,MBA,2026
6533696,614723,St. Bonaventure Bonnies,614652,Marshall Thundering Herd,614723,8,top,Manuel Castro flied out to rf (1-0 B).,76,2026-03-06T18:00:00-05:00,"Jack Cook Field (Huntington, WV)",1327,MBA,2026
6533696,614723,St. Bonaventure Bonnies,614652,Marshall Thundering Herd,614652,8,bot,Mason Onate struck out swinging (1-2 BFSF).,77,2026-03-06T18:00:00-05:00,"Jack Cook Field (Huntington, WV)",1327,MBA,2026
6533696,614723,St. Bonaventure Bonnies,614652,Marshall Thundering Herd,614652,8,bot,Jack Smith reached first on a throwing error by 3b (1-2 BSF).,78,2026-03-06T18:00:00-05:00,"Jack Cook Field (Huntington, WV)",1327,MBA,2026
6533696,614723,St. Bonaventure Bonnies,614652,Marshall Thundering Herd,614652,8,bot,Jackson Golden grounded out to 2b (2-2 KBFB); Jack Smith advanced to second.,79,2026-03-06T18:00:00-05:00,"Jack Cook Field (Huntington, WV)",1327,MBA,2026
6533696,614723,St. Bonaventure Bonnies,614652,Marshall Thundering Herd,614652,8,bot,Evan Bottone flied out to cf (0-0).,80,2026-03-06T18:00:00-05:00,"Jack Cook Field (Huntington, WV)",1327,MBA,2026
6533696,614723,St. Bonaventure Bonnies,614652,Marshall Thundering Herd,614723,9,top,Christian Lamothe pinch hit for Alex Hebenstreit.,81,2026-03-06T18:00:00-05:00,"Jack Cook Field (Huntington, WV)",1327,MBA,2026
6533696,614723,St. Bonaventure Bonnies,614652,Marshall Thundering Herd,614723,9,top,Christian Lamothe struck out swinging (0-2 KSS).,82,2026-03-06T18:00:00-05:00,"Jack Cook Field (Huntington, WV)",1327,MBA,2026
6533696,614723,St. Bonaventure Bonnies,614652,Marshall Thundering Herd,614723,9,top,Antonio Cordeiro walked (3-1 BBSBB).,83,2026-03-06T18:00:00-05:00,"Jack Cook Field (Huntington, WV)",1327,MBA,2026
6533696,614723,St. Bonaventure Bonnies,614652,Marshall Thundering Herd,614723,9,top,Chris Florentino pinch ran for Christian Lamothe.,84,2026-03-06T18:00:00-05:00,"Jack Cook Field (Huntington, WV)",1327,MBA,2026
6533696,614723,St. Bonaventure Bonnies,614652,Marshall Thundering Herd,614723,9,top,Joey Calabretti fouled out to 3b (3-2 BKBBF).,85,2026-03-06T18:00:00-05:00,"Jack Cook Field (Huntington, WV)",1327,MBA,2026
6533696,614723,St. Bonaventure Bonnies,614652,Marshall Thundering Herd,614723,9,top,Conner Vercollone struck out looking (3-2 BSBFBK).,86,2026-03-06T18:00:00-05:00,"Jack Cook Field (Huntington, WV)",1327,MBA,2026
