game_id,away_team_id,away_team_name,home_team_id,home_team_name,batting_team,inning,top_bot,event_text,event_num,game_datetime,stadium_name,attendance,sport_id,season
6534182,614724,Saint Joseph's Hawks,614563,Bucknell Bison,614724,1,top,"GALE, Joey fouled out to 1b (0-2 FSFFF).",1,2026-03-06T14:00:00-05:00,"Depew Field (Lewisburg, PA)",0,MBA,2026
6534182,614724,Saint Joseph's Hawks,614563,Bucknell Bison,614724,1,top,"KELSEY, Alex flied out to cf (0-2 KFF).",2,2026-03-06T14:00:00-05:00,"Depew Field (Lewisburg, PA)",0,MBA,2026
6534182,614724,Saint Joseph's Hawks,614563,Bucknell Bison,614724,1,top,"JANESKO, Jason struck out looking (2-2 BSFBK).",3,2026-03-06T14:00:00-05:00,"Depew Field (Lewisburg, PA)",0,MBA,2026
6534182,614724,Saint Joseph's Hawks,614563,Bucknell Bison,614563,1,bot,Billy Fluharty struck out swinging (1-2 BSSF).,4,2026-03-06T14:00:00-05:00,"Depew Field (Lewisburg, PA)",0,MBA,2026
6534182,614724,Saint Joseph's Hawks,614563,Bucknell Bison,614563,1,bot,John Calabrese grounded out to p (0-2 KS).,5,2026-03-06T14:00:00-05:00,"Depew Field (Lewisburg, PA)",0,MBA,2026
6534182,614724,Saint Joseph's Hawks,614563,Bucknell Bison,614563,1,bot,Michael Trommer flied out to cf (1-2 FSFB).,6,2026-03-06T14:00:00-05:00,"Depew Field (Lewisburg, PA)",0,MBA,2026
6534182,614724,Saint Joseph's Hawks,614563,Bucknell Bison,614724,2,top,"PRIMROSE, Blake singled to left field (2-2 BSFB).",7,2026-03-06T14:00:00-05:00,"Depew Field (Lewisburg, PA)",0,MBA,2026
6534182,614724,Saint Joseph's Hawks,614563,Bucknell Bison,614724,2,top,"PAGANO, Joey lined out to 2b (0-2 FF).",8,2026-03-06T14:00:00-05:00,"Depew Field (Lewisburg, PA)",0,MBA,2026
6534182,614724,Saint Joseph's Hawks,614563,Bucknell Bison,614724,2,top,"APPLEGATE, Carson popped up to 2b (1-2 BFF).",9,2026-03-06T14:00:00-05:00,"Depew Field (Lewisburg, PA)",0,MBA,2026
6534182,614724,Saint Joseph's Hawks,614563,Bucknell Bison,614724,2,top,"BEGGY, Richard singled to center field (2-2 BBSFF)3a PRIMROSE, Blake advanced to second.",10,2026-03-06T14:00:00-05:00,"Depew Field (Lewisburg, PA)",0,MBA,2026
6534182,614724,Saint Joseph's Hawks,614563,Bucknell Bison,614724,2,top,"SAKER, Jack reached on a fielder's choice (0-0)3a BEGGY, Richard out at second ss to 2b.",11,2026-03-06T14:00:00-05:00,"Depew Field (Lewisburg, PA)",0,MBA,2026
6534182,614724,Saint Joseph's Hawks,614563,Bucknell Bison,614563,2,bot,Ty Lagoni flied out to rf (2-1 BBK).,12,2026-03-06T14:00:00-05:00,"Depew Field (Lewisburg, PA)",0,MBA,2026
6534182,614724,Saint Joseph's Hawks,614563,Bucknell Bison,614563,2,bot,Garrett Mathias doubled to left field (3-1 BBSB).,13,2026-03-06T14:00:00-05:00,"Depew Field (Lewisburg, PA)",0,MBA,2026
6534182,614724,Saint Joseph's Hawks,614563,Bucknell Bison,614563,2,bot,Zach Selfon grounded out to 2b (1-1 KB)3a Garrett Mathias advanced to third.,14,2026-03-06T14:00:00-05:00,"Depew Field (Lewisburg, PA)",0,MBA,2026
6534182,614724,Saint Joseph's Hawks,614563,Bucknell Bison,614563,2,bot,Ryan Facinelli struck out swinging (2-2 SKBBS).,15,2026-03-06T14:00:00-05:00,"Depew Field (Lewisburg, PA)",0,MBA,2026
6534182,614724,Saint Joseph's Hawks,614563,Bucknell Bison,614724,3,top,"DICKINSON, Tim grounded out to p, bunt (1-0 B).",16,2026-03-06T14:00:00-05:00,"Depew Field (Lewisburg, PA)",0,MBA,2026
6534182,614724,Saint Joseph's Hawks,614563,Bucknell Bison,614724,3,top,"GALE, Joey struck out swinging (0-2 KKS).",17,2026-03-06T14:00:00-05:00,"Depew Field (Lewisburg, PA)",0,MBA,2026
6534182,614724,Saint Joseph's Hawks,614563,Bucknell Bison,614724,3,top,"KELSEY, Alex grounded out to 2b (2-2 BFBK).",18,2026-03-06T14:00:00-05:00,"Depew Field (Lewisburg, PA)",0,MBA,2026
6534182,614724,Saint Joseph's Hawks,614563,Bucknell Bison,614563,3,bot,Andrew Swenson struck out swinging (0-2 KSS).,19,2026-03-06T14:00:00-05:00,"Depew Field (Lewisburg, PA)",0,MBA,2026
6534182,614724,Saint Joseph's Hawks,614563,Bucknell Bison,614563,3,bot,Deacon Bowne struck out swinging (3-2 BKBKBS).,20,2026-03-06T14:00:00-05:00,"Depew Field (Lewisburg, PA)",0,MBA,2026
6534182,614724,Saint Joseph's Hawks,614563,Bucknell Bison,614563,3,bot,Billy Fluharty singled through the left side (0-1 F).,21,2026-03-06T14:00:00-05:00,"Depew Field (Lewisburg, PA)",0,MBA,2026
6534182,614724,Saint Joseph's Hawks,614563,Bucknell Bison,614563,3,bot,John Calabrese grounded out to 3b (2-0 BB).,22,2026-03-06T14:00:00-05:00,"Depew Field (Lewisburg, PA)",0,MBA,2026
6534182,614724,Saint Joseph's Hawks,614563,Bucknell Bison,614724,4,top,"JANESKO, Jason struck out swinging (1-2 KBKS).",23,2026-03-06T14:00:00-05:00,"Depew Field (Lewisburg, PA)",0,MBA,2026
6534182,614724,Saint Joseph's Hawks,614563,Bucknell Bison,614724,4,top,"PRIMROSE, Blake tripled to center field (1-2 BKF).",24,2026-03-06T14:00:00-05:00,"Depew Field (Lewisburg, PA)",0,MBA,2026
6534182,614724,Saint Joseph's Hawks,614563,Bucknell Bison,614724,4,top,"PAGANO, Joey singled to first base, RBI (0-0)3a PRIMROSE, Blake scored.",25,2026-03-06T14:00:00-05:00,"Depew Field (Lewisburg, PA)",0,MBA,2026
6534182,614724,Saint Joseph's Hawks,614563,Bucknell Bison,614724,4,top,"PAGANO, Joey stole second.",26,2026-03-06T14:00:00-05:00,"Depew Field (Lewisburg, PA)",0,MBA,2026
6534182,614724,Saint Joseph's Hawks,614563,Bucknell Bison,614724,4,top,"APPLEGATE, Carson flied out to cf (3-1 BBSB).",27,2026-03-06T14:00:00-05:00,"Depew Field (Lewisburg, PA)",0,MBA,2026
6534182,614724,Saint Joseph's Hawks,614563,Bucknell Bison,614724,4,top,"BEGGY, Richard grounded out to 2b (1-2 SBF).",28,2026-03-06T14:00:00-05:00,"Depew Field (Lewisburg, PA)",0,MBA,2026
6534182,614724,Saint Joseph's Hawks,614563,Bucknell Bison,614563,4,bot,Michael Trommer out at first 1b to p (1-1 FB).,29,2026-03-06T14:00:00-05:00,"Depew Field (Lewisburg, PA)",0,MBA,2026
6534182,614724,Saint Joseph's Hawks,614563,Bucknell Bison,614563,4,bot,Ty Lagoni flied out to lf (2-1 KBB).,30,2026-03-06T14:00:00-05:00,"Depew Field (Lewisburg, PA)",0,MBA,2026
6534182,614724,Saint Joseph's Hawks,614563,Bucknell Bison,614563,4,bot,Garrett Mathias struck out swinging (3-2 KBBSBS).,31,2026-03-06T14:00:00-05:00,"Depew Field (Lewisburg, PA)",0,MBA,2026
6534182,614724,Saint Joseph's Hawks,614563,Bucknell Bison,614724,5,top,"SAKER, Jack struck out swinging (0-2 KFF).",32,2026-03-06T14:00:00-05:00,"Depew Field (Lewisburg, PA)",0,MBA,2026
6534182,614724,Saint Joseph's Hawks,614563,Bucknell Bison,614724,5,top,"DICKINSON, Tim walked (3-1 SBBBB).",33,2026-03-06T14:00:00-05:00,"Depew Field (Lewisburg, PA)",0,MBA,2026
6534182,614724,Saint Joseph's Hawks,614563,Bucknell Bison,614724,5,top,"GALE, Joey lined out to cf (0-0).",34,2026-03-06T14:00:00-05:00,"Depew Field (Lewisburg, PA)",0,MBA,2026
6534182,614724,Saint Joseph's Hawks,614563,Bucknell Bison,614724,5,top,"DICKINSON, Tim out at second c to ss, caught stealing.",35,2026-03-06T14:00:00-05:00,"Depew Field (Lewisburg, PA)",0,MBA,2026
6534182,614724,Saint Joseph's Hawks,614563,Bucknell Bison,614563,5,bot,Zach Selfon hit by pitch (0-0).,36,2026-03-06T14:00:00-05:00,"Depew Field (Lewisburg, PA)",0,MBA,2026
6534182,614724,Saint Joseph's Hawks,614563,Bucknell Bison,614563,5,bot,"Ryan Facinelli popped up to 3b, bunt (0-0).",37,2026-03-06T14:00:00-05:00,"Depew Field (Lewisburg, PA)",0,MBA,2026
6534182,614724,Saint Joseph's Hawks,614563,Bucknell Bison,614563,5,bot,Andrew Swenson struck out swinging (2-2 FBBKF).,38,2026-03-06T14:00:00-05:00,"Depew Field (Lewisburg, PA)",0,MBA,2026
6534182,614724,Saint Joseph's Hawks,614563,Bucknell Bison,614563,5,bot,Deacon Bowne struck out swinging (1-2 SBKS).,39,2026-03-06T14:00:00-05:00,"Depew Field (Lewisburg, PA)",0,MBA,2026
6534182,614724,Saint Joseph's Hawks,614563,Bucknell Bison,614724,6,top,"KELSEY, Alex struck out looking (0-2 KKK).",40,2026-03-06T14:00:00-05:00,"Depew Field (Lewisburg, PA)",0,MBA,2026
6534182,614724,Saint Joseph's Hawks,614563,Bucknell Bison,614724,6,top,"JANESKO, Jason flied out to cf (2-1 BKB).",41,2026-03-06T14:00:00-05:00,"Depew Field (Lewisburg, PA)",0,MBA,2026
6534182,614724,Saint Joseph's Hawks,614563,Bucknell Bison,614724,6,top,"PRIMROSE, Blake lined out to 2b (0-0).",42,2026-03-06T14:00:00-05:00,"Depew Field (Lewisburg, PA)",0,MBA,2026
6534182,614724,Saint Joseph's Hawks,614563,Bucknell Bison,614563,6,bot,"COPPOLA, Christian to p for McCARRON, Duke.",43,2026-03-06T14:00:00-05:00,"Depew Field (Lewisburg, PA)",0,MBA,2026
6534182,614724,Saint Joseph's Hawks,614563,Bucknell Bison,614563,6,bot,Billy Fluharty struck out swinging (1-2 BKSS).,44,2026-03-06T14:00:00-05:00,"Depew Field (Lewisburg, PA)",0,MBA,2026
6534182,614724,Saint Joseph's Hawks,614563,Bucknell Bison,614563,6,bot,John Calabrese struck out swinging (1-2 SKBS).,45,2026-03-06T14:00:00-05:00,"Depew Field (Lewisburg, PA)",0,MBA,2026
6534182,614724,Saint Joseph's Hawks,614563,Bucknell Bison,614563,6,bot,Michael Trommer struck out swinging (1-2 BKSS).,46,2026-03-06T14:00:00-05:00,"Depew Field (Lewisburg, PA)",0,MBA,2026
6534182,614724,Saint Joseph's Hawks,614563,Bucknell Bison,614724,7,top,"PAGANO, Joey lined out to 1b (2-2 BKBF).",47,2026-03-06T14:00:00-05:00,"Depew Field (Lewisburg, PA)",0,MBA,2026
6534182,614724,Saint Joseph's Hawks,614563,Bucknell Bison,614724,7,top,"APPLEGATE, Carson grounded out to 3b (0-2 SF).",48,2026-03-06T14:00:00-05:00,"Depew Field (Lewisburg, PA)",0,MBA,2026
6534182,614724,Saint Joseph's Hawks,614563,Bucknell Bison,614724,7,top,"BEGGY, Richard grounded out to 3b (2-2 SBSB).",49,2026-03-06T14:00:00-05:00,"Depew Field (Lewisburg, PA)",0,MBA,2026
6534182,614724,Saint Joseph's Hawks,614563,Bucknell Bison,614563,7,bot,Ty Lagoni singled to left field (0-2 KS).,50,2026-03-06T14:00:00-05:00,"Depew Field (Lewisburg, PA)",0,MBA,2026
6534182,614724,Saint Joseph's Hawks,614563,Bucknell Bison,614563,7,bot,"Ty Lagoni out at second c to ss, caught stealing.",51,2026-03-06T14:00:00-05:00,"Depew Field (Lewisburg, PA)",0,MBA,2026
6534182,614724,Saint Joseph's Hawks,614563,Bucknell Bison,614563,7,bot,Garrett Mathias struck out swinging (3-2 KKBBBS).,52,2026-03-06T14:00:00-05:00,"Depew Field (Lewisburg, PA)",0,MBA,2026
6534182,614724,Saint Joseph's Hawks,614563,Bucknell Bison,614563,7,bot,Zach Selfon grounded out to 3b (1-2 KKFFFB).,53,2026-03-06T14:00:00-05:00,"Depew Field (Lewisburg, PA)",0,MBA,2026
6534182,614724,Saint Joseph's Hawks,614563,Bucknell Bison,614724,8,top,Mikey Myro to p for Jonathan Adelmann.,54,2026-03-06T14:00:00-05:00,"Depew Field (Lewisburg, PA)",0,MBA,2026
6534182,614724,Saint Joseph's Hawks,614563,Bucknell Bison,614724,8,top,"SAKER, Jack fouled out to 1b (2-1 KBB).",55,2026-03-06T14:00:00-05:00,"Depew Field (Lewisburg, PA)",0,MBA,2026
6534182,614724,Saint Joseph's Hawks,614563,Bucknell Bison,614724,8,top,"DICKINSON, Tim out at first 1b to p (1-0 B).",56,2026-03-06T14:00:00-05:00,"Depew Field (Lewisburg, PA)",0,MBA,2026
6534182,614724,Saint Joseph's Hawks,614563,Bucknell Bison,614724,8,top,"GALE, Joey singled to left field (2-2 BKBFF).",57,2026-03-06T14:00:00-05:00,"Depew Field (Lewisburg, PA)",0,MBA,2026
6534182,614724,Saint Joseph's Hawks,614563,Bucknell Bison,614724,8,top,"KELSEY, Alex tripled to right center, RBI (1-1 BF)3a GALE, Joey scored.",58,2026-03-06T14:00:00-05:00,"Depew Field (Lewisburg, PA)",0,MBA,2026
6534182,614724,Saint Joseph's Hawks,614563,Bucknell Bison,614724,8,top,"JANESKO, Jason walked (3-2 BFBBSB).",59,2026-03-06T14:00:00-05:00,"Depew Field (Lewisburg, PA)",0,MBA,2026
6534182,614724,Saint Joseph's Hawks,614563,Bucknell Bison,614724,8,top,"JANESKO, Jason stole second.",60,2026-03-06T14:00:00-05:00,"Depew Field (Lewisburg, PA)",0,MBA,2026
6534182,614724,Saint Joseph's Hawks,614563,Bucknell Bison,614724,8,top,"PRIMROSE, Blake fouled out to 3b (3-2 BKKBB).",61,2026-03-06T14:00:00-05:00,"Depew Field (Lewisburg, PA)",0,MBA,2026
6534182,614724,Saint Joseph's Hawks,614563,Bucknell Bison,614563,8,bot,Lleyton Coupe pinch hit for Ryan Facinelli.,62,2026-03-06T14:00:00-05:00,"Depew Field (Lewisburg, PA)",0,MBA,2026
6534182,614724,Saint Joseph's Hawks,614563,Bucknell Bison,614563,8,bot,Lleyton Coupe struck out swinging (1-2 KKBS).,63,2026-03-06T14:00:00-05:00,"Depew Field (Lewisburg, PA)",0,MBA,2026
6534182,614724,Saint Joseph's Hawks,614563,Bucknell Bison,614563,8,bot,Andrew Swenson struck out swinging (0-2 SKS).,64,2026-03-06T14:00:00-05:00,"Depew Field (Lewisburg, PA)",0,MBA,2026
6534182,614724,Saint Joseph's Hawks,614563,Bucknell Bison,614563,8,bot,Chris Morabito pinch hit for Deacon Bowne.,65,2026-03-06T14:00:00-05:00,"Depew Field (Lewisburg, PA)",0,MBA,2026
6534182,614724,Saint Joseph's Hawks,614563,Bucknell Bison,614563,8,bot,Chris Morabito grounded out to p (1-1 FB).,66,2026-03-06T14:00:00-05:00,"Depew Field (Lewisburg, PA)",0,MBA,2026
6534182,614724,Saint Joseph's Hawks,614563,Bucknell Bison,614724,9,top,Lleyton Coupe to 1b.,67,2026-03-06T14:00:00-05:00,"Depew Field (Lewisburg, PA)",0,MBA,2026
6534182,614724,Saint Joseph's Hawks,614563,Bucknell Bison,614724,9,top,Luke Nascimento to c for Chris Morabito.,68,2026-03-06T14:00:00-05:00,"Depew Field (Lewisburg, PA)",0,MBA,2026
6534182,614724,Saint Joseph's Hawks,614563,Bucknell Bison,614724,9,top,"PAGANO, Joey grounded out to 2b (1-1 FB).",69,2026-03-06T14:00:00-05:00,"Depew Field (Lewisburg, PA)",0,MBA,2026
6534182,614724,Saint Joseph's Hawks,614563,Bucknell Bison,614724,9,top,"APPLEGATE, Carson struck out swinging (1-2 BKFS).",70,2026-03-06T14:00:00-05:00,"Depew Field (Lewisburg, PA)",0,MBA,2026
6534182,614724,Saint Joseph's Hawks,614563,Bucknell Bison,614724,9,top,"BEGGY, Richard singled to third base (1-2 KSB).",71,2026-03-06T14:00:00-05:00,"Depew Field (Lewisburg, PA)",0,MBA,2026
6534182,614724,Saint Joseph's Hawks,614563,Bucknell Bison,614724,9,top,"SAKER, Jack grounded out to 3b (0-0).",72,2026-03-06T14:00:00-05:00,"Depew Field (Lewisburg, PA)",0,MBA,2026
6534182,614724,Saint Joseph's Hawks,614563,Bucknell Bison,614563,9,bot,"GAINES, Andrew to p for COPPOLA, Christian.",73,2026-03-06T14:00:00-05:00,"Depew Field (Lewisburg, PA)",0,MBA,2026
6534182,614724,Saint Joseph's Hawks,614563,Bucknell Bison,614563,9,bot,Billy Fluharty flied out to cf (2-2 KBFFB).,74,2026-03-06T14:00:00-05:00,"Depew Field (Lewisburg, PA)",0,MBA,2026
6534182,614724,Saint Joseph's Hawks,614563,Bucknell Bison,614563,9,bot,John Calabrese struck out swinging (2-2 BKBSS).,75,2026-03-06T14:00:00-05:00,"Depew Field (Lewisburg, PA)",0,MBA,2026
6534182,614724,Saint Joseph's Hawks,614563,Bucknell Bison,614563,9,bot,Michael Trommer struck out looking (0-2 KFK).,76,2026-03-06T14:00:00-05:00,"Depew Field (Lewisburg, PA)",0,MBA,2026
