game_id,away_team_id,away_team_name,home_team_id,home_team_name,batting_team,inning,top_bot,event_text,event_num,game_datetime,stadium_name,attendance,sport_id,season
6534651,615441,Cairn Highlanders,615378,Washington Col. Shoremen,615441,1,top,AJ Ramirez doubled down the rf line (0-0).,1,2026-03-19T15:00:00-04:00,"Athey Park (Chestertown, MD)",101,MBA,2026
6534651,615441,Cairn Highlanders,615378,Washington Col. Shoremen,615441,1,top,Cameron Burnes struck out swinging (0-0).,2,2026-03-19T15:00:00-04:00,"Athey Park (Chestertown, MD)",101,MBA,2026
6534651,615441,Cairn Highlanders,615378,Washington Col. Shoremen,615441,1,top,Ethan Perez grounded out to 2b (0-0)3a AJ Ramirez advanced to third.,3,2026-03-19T15:00:00-04:00,"Athey Park (Chestertown, MD)",101,MBA,2026
6534651,615441,Cairn Highlanders,615378,Washington Col. Shoremen,615441,1,top,Christian Spadea flied out to cf (0-0).,4,2026-03-19T15:00:00-04:00,"Athey Park (Chestertown, MD)",101,MBA,2026
6534651,615441,Cairn Highlanders,615378,Washington Col. Shoremen,615378,1,bot,Ty Powell popped up to 3b (0-0).,5,2026-03-19T15:00:00-04:00,"Athey Park (Chestertown, MD)",101,MBA,2026
6534651,615441,Cairn Highlanders,615378,Washington Col. Shoremen,615378,1,bot,Brett Connolly grounded out to 2b (0-0).,6,2026-03-19T15:00:00-04:00,"Athey Park (Chestertown, MD)",101,MBA,2026
6534651,615441,Cairn Highlanders,615378,Washington Col. Shoremen,615378,1,bot,Chase Ruppel doubled to left center (0-0).,7,2026-03-19T15:00:00-04:00,"Athey Park (Chestertown, MD)",101,MBA,2026
6534651,615441,Cairn Highlanders,615378,Washington Col. Shoremen,615378,1,bot,"Chase Ruppel stole third, scored on a throwing error by c.",8,2026-03-19T15:00:00-04:00,"Athey Park (Chestertown, MD)",101,MBA,2026
6534651,615441,Cairn Highlanders,615378,Washington Col. Shoremen,615378,1,bot,"Drew Kinsey homered down the lf line, RBI (0-0).",9,2026-03-19T15:00:00-04:00,"Athey Park (Chestertown, MD)",101,MBA,2026
6534651,615441,Cairn Highlanders,615378,Washington Col. Shoremen,615378,1,bot,Brady Wozniak walked (0-0).,10,2026-03-19T15:00:00-04:00,"Athey Park (Chestertown, MD)",101,MBA,2026
6534651,615441,Cairn Highlanders,615378,Washington Col. Shoremen,615378,1,bot,Brady Wozniak stole second.,11,2026-03-19T15:00:00-04:00,"Athey Park (Chestertown, MD)",101,MBA,2026
6534651,615441,Cairn Highlanders,615378,Washington Col. Shoremen,615378,1,bot,"Ty Everitt singled to right field, RBI (0-0)3a Brady Wozniak scored.",12,2026-03-19T15:00:00-04:00,"Athey Park (Chestertown, MD)",101,MBA,2026
6534651,615441,Cairn Highlanders,615378,Washington Col. Shoremen,615378,1,bot,Ty Everitt advanced to second on a balk.,13,2026-03-19T15:00:00-04:00,"Athey Park (Chestertown, MD)",101,MBA,2026
6534651,615441,Cairn Highlanders,615378,Washington Col. Shoremen,615378,1,bot,Dino DiMauro grounded out to 2b (0-0).,14,2026-03-19T15:00:00-04:00,"Athey Park (Chestertown, MD)",101,MBA,2026
6534651,615441,Cairn Highlanders,615378,Washington Col. Shoremen,615441,2,top,Matthew Urena reached first on a fielding error by 3b (0-0).,15,2026-03-19T15:00:00-04:00,"Athey Park (Chestertown, MD)",101,MBA,2026
6534651,615441,Cairn Highlanders,615378,Washington Col. Shoremen,615441,2,top,"Jay Sariano grounded out to 3b, SAC, bunt (0-0)3a Matthew Urena advanced to second.",16,2026-03-19T15:00:00-04:00,"Athey Park (Chestertown, MD)",101,MBA,2026
6534651,615441,Cairn Highlanders,615378,Washington Col. Shoremen,615441,2,top,Jake Murnock singled to center field (0-0)3a Matthew Urena advanced to third.,17,2026-03-19T15:00:00-04:00,"Athey Park (Chestertown, MD)",101,MBA,2026
6534651,615441,Cairn Highlanders,615378,Washington Col. Shoremen,615441,2,top,"Caden Hill singled through the left side, RBI (0-0)3a Jake Murnock advanced to second3a Matthew Urena scored, unearned.",18,2026-03-19T15:00:00-04:00,"Athey Park (Chestertown, MD)",101,MBA,2026
6534651,615441,Cairn Highlanders,615378,Washington Col. Shoremen,615441,2,top,"Stephen Persiani doubled to right center, RBI (0-0)3a Caden Hill advanced to third3a Jake Murnock scored.",19,2026-03-19T15:00:00-04:00,"Athey Park (Chestertown, MD)",101,MBA,2026
6534651,615441,Cairn Highlanders,615378,Washington Col. Shoremen,615441,2,top,AJ Ramirez popped up to 2b down the rf line (0-0).,20,2026-03-19T15:00:00-04:00,"Athey Park (Chestertown, MD)",101,MBA,2026
6534651,615441,Cairn Highlanders,615378,Washington Col. Shoremen,615441,2,top,Cameron Burnes lined out to ss (0-0).,21,2026-03-19T15:00:00-04:00,"Athey Park (Chestertown, MD)",101,MBA,2026
6534651,615441,Cairn Highlanders,615378,Washington Col. Shoremen,615378,2,bot,"Pete Kokinis homered to right center, RBI (0-0).",22,2026-03-19T15:00:00-04:00,"Athey Park (Chestertown, MD)",101,MBA,2026
6534651,615441,Cairn Highlanders,615378,Washington Col. Shoremen,615378,2,bot,Ryan Timmons grounded out to 1b unassisted (0-0).,23,2026-03-19T15:00:00-04:00,"Athey Park (Chestertown, MD)",101,MBA,2026
6534651,615441,Cairn Highlanders,615378,Washington Col. Shoremen,615378,2,bot,Ty Powell hit by pitch (0-0).,24,2026-03-19T15:00:00-04:00,"Athey Park (Chestertown, MD)",101,MBA,2026
6534651,615441,Cairn Highlanders,615378,Washington Col. Shoremen,615378,2,bot,Brett Connolly singled through the right side (0-0)3a Ty Powell advanced to second.,25,2026-03-19T15:00:00-04:00,"Athey Park (Chestertown, MD)",101,MBA,2026
6534651,615441,Cairn Highlanders,615378,Washington Col. Shoremen,615378,2,bot,Chase Ruppel reached on a fielder's choice to first base (0-0)3a Brett Connolly advanced to second on a throwing error by 1b3a Ty Powell advanced to third.,26,2026-03-19T15:00:00-04:00,"Athey Park (Chestertown, MD)",101,MBA,2026
6534651,615441,Cairn Highlanders,615378,Washington Col. Shoremen,615378,2,bot,Chase Ruppel advanced to second on a wild pitch3a Brett Connolly advanced to third on a wild pitch3a Ty Powell scored on a wild pitch.,27,2026-03-19T15:00:00-04:00,"Athey Park (Chestertown, MD)",101,MBA,2026
6534651,615441,Cairn Highlanders,615378,Washington Col. Shoremen,615378,2,bot,"Drew Kinsey flied out to cf, sacrifice fly, RBI (0-0)3a Brett Connolly scored, unearned.",28,2026-03-19T15:00:00-04:00,"Athey Park (Chestertown, MD)",101,MBA,2026
6534651,615441,Cairn Highlanders,615378,Washington Col. Shoremen,615378,2,bot,Chase Ruppel advanced to third on a wild pitch.,29,2026-03-19T15:00:00-04:00,"Athey Park (Chestertown, MD)",101,MBA,2026
6534651,615441,Cairn Highlanders,615378,Washington Col. Shoremen,615378,2,bot,Brady Wozniak flied out to rf (0-0).,30,2026-03-19T15:00:00-04:00,"Athey Park (Chestertown, MD)",101,MBA,2026
6534651,615441,Cairn Highlanders,615378,Washington Col. Shoremen,615441,3,top,Ethan Perez flied out to rf (0-0).,31,2026-03-19T15:00:00-04:00,"Athey Park (Chestertown, MD)",101,MBA,2026
6534651,615441,Cairn Highlanders,615378,Washington Col. Shoremen,615441,3,top,"Christian Spadea homered to left field, RBI (0-0).",32,2026-03-19T15:00:00-04:00,"Athey Park (Chestertown, MD)",101,MBA,2026
6534651,615441,Cairn Highlanders,615378,Washington Col. Shoremen,615441,3,top,Matthew Urena lined out to ss (0-0).,33,2026-03-19T15:00:00-04:00,"Athey Park (Chestertown, MD)",101,MBA,2026
6534651,615441,Cairn Highlanders,615378,Washington Col. Shoremen,615441,3,top,Jay Sariano singled to right field (0-0).,34,2026-03-19T15:00:00-04:00,"Athey Park (Chestertown, MD)",101,MBA,2026
6534651,615441,Cairn Highlanders,615378,Washington Col. Shoremen,615441,3,top,Jake Murnock struck out swinging (0-0).,35,2026-03-19T15:00:00-04:00,"Athey Park (Chestertown, MD)",101,MBA,2026
6534651,615441,Cairn Highlanders,615378,Washington Col. Shoremen,615378,3,bot,Stephen Persiani to dh.,36,2026-03-19T15:00:00-04:00,"Athey Park (Chestertown, MD)",101,MBA,2026
6534651,615441,Cairn Highlanders,615378,Washington Col. Shoremen,615378,3,bot,Dylan Ferriera to p.,37,2026-03-19T15:00:00-04:00,"Athey Park (Chestertown, MD)",101,MBA,2026
6534651,615441,Cairn Highlanders,615378,Washington Col. Shoremen,615378,3,bot,Ty Everitt hit by pitch (0-0).,38,2026-03-19T15:00:00-04:00,"Athey Park (Chestertown, MD)",101,MBA,2026
6534651,615441,Cairn Highlanders,615378,Washington Col. Shoremen,615378,3,bot,Ty Everitt stole second.,39,2026-03-19T15:00:00-04:00,"Athey Park (Chestertown, MD)",101,MBA,2026
6534651,615441,Cairn Highlanders,615378,Washington Col. Shoremen,615378,3,bot,Dino DiMauro flied out to lf to left center (0-0).,40,2026-03-19T15:00:00-04:00,"Athey Park (Chestertown, MD)",101,MBA,2026
6534651,615441,Cairn Highlanders,615378,Washington Col. Shoremen,615378,3,bot,Pete Kokinis singled through the left side (0-0)3a Ty Everitt advanced to third.,41,2026-03-19T15:00:00-04:00,"Athey Park (Chestertown, MD)",101,MBA,2026
6534651,615441,Cairn Highlanders,615378,Washington Col. Shoremen,615378,3,bot,"Ryan Timmons grounded out to p, SAC, bunt (0-0)3a Pete Kokinis advanced to second.",42,2026-03-19T15:00:00-04:00,"Athey Park (Chestertown, MD)",101,MBA,2026
6534651,615441,Cairn Highlanders,615378,Washington Col. Shoremen,615378,3,bot,Ty Powell grounded out to 3b (0-0).,43,2026-03-19T15:00:00-04:00,"Athey Park (Chestertown, MD)",101,MBA,2026
6534651,615441,Cairn Highlanders,615378,Washington Col. Shoremen,615441,4,top,Caden Hill struck out swinging (0-0).,44,2026-03-19T15:00:00-04:00,"Athey Park (Chestertown, MD)",101,MBA,2026
6534651,615441,Cairn Highlanders,615378,Washington Col. Shoremen,615441,4,top,Stephen Persiani struck out swinging (0-0).,45,2026-03-19T15:00:00-04:00,"Athey Park (Chestertown, MD)",101,MBA,2026
6534651,615441,Cairn Highlanders,615378,Washington Col. Shoremen,615441,4,top,AJ Ramirez singled down the lf line (0-0).,46,2026-03-19T15:00:00-04:00,"Athey Park (Chestertown, MD)",101,MBA,2026
6534651,615441,Cairn Highlanders,615378,Washington Col. Shoremen,615441,4,top,Cameron Burnes singled to second base (0-0)3a AJ Ramirez advanced to third.,47,2026-03-19T15:00:00-04:00,"Athey Park (Chestertown, MD)",101,MBA,2026
6534651,615441,Cairn Highlanders,615378,Washington Col. Shoremen,615441,4,top,Ethan Perez lined out to cf (0-0).,48,2026-03-19T15:00:00-04:00,"Athey Park (Chestertown, MD)",101,MBA,2026
6534651,615441,Cairn Highlanders,615378,Washington Col. Shoremen,615378,4,bot,Brett Connolly grounded out to 2b (0-0).,49,2026-03-19T15:00:00-04:00,"Athey Park (Chestertown, MD)",101,MBA,2026
6534651,615441,Cairn Highlanders,615378,Washington Col. Shoremen,615378,4,bot,Chase Ruppel fouled out to 1b (0-0).,50,2026-03-19T15:00:00-04:00,"Athey Park (Chestertown, MD)",101,MBA,2026
6534651,615441,Cairn Highlanders,615378,Washington Col. Shoremen,615378,4,bot,Drew Kinsey doubled to right field (0-0).,51,2026-03-19T15:00:00-04:00,"Athey Park (Chestertown, MD)",101,MBA,2026
6534651,615441,Cairn Highlanders,615378,Washington Col. Shoremen,615378,4,bot,"Brady Wozniak singled up the middle, RBI (0-0)3a Drew Kinsey scored.",52,2026-03-19T15:00:00-04:00,"Athey Park (Chestertown, MD)",101,MBA,2026
6534651,615441,Cairn Highlanders,615378,Washington Col. Shoremen,615378,4,bot,Ty Everitt out at first 1b to p (0-0).,53,2026-03-19T15:00:00-04:00,"Athey Park (Chestertown, MD)",101,MBA,2026
6534651,615441,Cairn Highlanders,615378,Washington Col. Shoremen,615441,5,top,Christian Spadea flied out to lf (0-0).,54,2026-03-19T15:00:00-04:00,"Athey Park (Chestertown, MD)",101,MBA,2026
6534651,615441,Cairn Highlanders,615378,Washington Col. Shoremen,615441,5,top,Matthew Urena grounded out to 1b unassisted (0-0).,55,2026-03-19T15:00:00-04:00,"Athey Park (Chestertown, MD)",101,MBA,2026
6534651,615441,Cairn Highlanders,615378,Washington Col. Shoremen,615441,5,top,Jay Sariano struck out swinging (0-0).,56,2026-03-19T15:00:00-04:00,"Athey Park (Chestertown, MD)",101,MBA,2026
6534651,615441,Cairn Highlanders,615378,Washington Col. Shoremen,615378,5,bot,Dino DiMauro singled to pitcher (0-0).,57,2026-03-19T15:00:00-04:00,"Athey Park (Chestertown, MD)",101,MBA,2026
6534651,615441,Cairn Highlanders,615378,Washington Col. Shoremen,615378,5,bot,"Pete Kokinis doubled to left center, RBI (0-0)3a Dino DiMauro scored.",58,2026-03-19T15:00:00-04:00,"Athey Park (Chestertown, MD)",101,MBA,2026
6534651,615441,Cairn Highlanders,615378,Washington Col. Shoremen,615378,5,bot,Ryan Timmons grounded out to 1b unassisted (0-0)3a Pete Kokinis advanced to third.,59,2026-03-19T15:00:00-04:00,"Athey Park (Chestertown, MD)",101,MBA,2026
6534651,615441,Cairn Highlanders,615378,Washington Col. Shoremen,615378,5,bot,Ty Powell walked (0-0).,60,2026-03-19T15:00:00-04:00,"Athey Park (Chestertown, MD)",101,MBA,2026
6534651,615441,Cairn Highlanders,615378,Washington Col. Shoremen,615378,5,bot,Ty Powell advanced to second on a wild pitch.,61,2026-03-19T15:00:00-04:00,"Athey Park (Chestertown, MD)",101,MBA,2026
6534651,615441,Cairn Highlanders,615378,Washington Col. Shoremen,615378,5,bot,"Brett Connolly singled to right center, 2 RBI (0-0)3a Ty Powell scored3a Pete Kokinis scored.",62,2026-03-19T15:00:00-04:00,"Athey Park (Chestertown, MD)",101,MBA,2026
6534651,615441,Cairn Highlanders,615378,Washington Col. Shoremen,615378,5,bot,"Chase Ruppel doubled down the lf line, RBI (0-0)3a Brett Connolly scored.",63,2026-03-19T15:00:00-04:00,"Athey Park (Chestertown, MD)",101,MBA,2026
6534651,615441,Cairn Highlanders,615378,Washington Col. Shoremen,615378,5,bot,Drew Kinsey reached first on a throwing error by ss (0-0)3a Chase Ruppel advanced to third.,64,2026-03-19T15:00:00-04:00,"Athey Park (Chestertown, MD)",101,MBA,2026
6534651,615441,Cairn Highlanders,615378,Washington Col. Shoremen,615378,5,bot,Drew Kinsey stole second.,65,2026-03-19T15:00:00-04:00,"Athey Park (Chestertown, MD)",101,MBA,2026
6534651,615441,Cairn Highlanders,615378,Washington Col. Shoremen,615378,5,bot,Brady Wozniak walked (0-0).,66,2026-03-19T15:00:00-04:00,"Athey Park (Chestertown, MD)",101,MBA,2026
6534651,615441,Cairn Highlanders,615378,Washington Col. Shoremen,615378,5,bot,Ty Everitt grounded into double play ss to 2b to 1b (0-0)3a Brady Wozniak out on the play.,67,2026-03-19T15:00:00-04:00,"Athey Park (Chestertown, MD)",101,MBA,2026
6534651,615441,Cairn Highlanders,615378,Washington Col. Shoremen,615441,6,top,Jake Murnock popped up to cf to right center (0-0).,68,2026-03-19T15:00:00-04:00,"Athey Park (Chestertown, MD)",101,MBA,2026
6534651,615441,Cairn Highlanders,615378,Washington Col. Shoremen,615441,6,top,Caden Hill grounded out to 3b (0-0).,69,2026-03-19T15:00:00-04:00,"Athey Park (Chestertown, MD)",101,MBA,2026
6534651,615441,Cairn Highlanders,615378,Washington Col. Shoremen,615441,6,top,Stephen Persiani walked (0-0).,70,2026-03-19T15:00:00-04:00,"Athey Park (Chestertown, MD)",101,MBA,2026
6534651,615441,Cairn Highlanders,615378,Washington Col. Shoremen,615441,6,top,AJ Ramirez singled to shortstop (0-0)3a Stephen Persiani advanced to second.,71,2026-03-19T15:00:00-04:00,"Athey Park (Chestertown, MD)",101,MBA,2026
6534651,615441,Cairn Highlanders,615378,Washington Col. Shoremen,615441,6,top,Cameron Burnes grounded out to 2b (0-0).,72,2026-03-19T15:00:00-04:00,"Athey Park (Chestertown, MD)",101,MBA,2026
6534651,615441,Cairn Highlanders,615378,Washington Col. Shoremen,615378,6,bot,Jackson Esbenshade to p for Dylan Ferriera.,73,2026-03-19T15:00:00-04:00,"Athey Park (Chestertown, MD)",101,MBA,2026
6534651,615441,Cairn Highlanders,615378,Washington Col. Shoremen,615378,6,bot,Dino DiMauro hit by pitch (0-0).,74,2026-03-19T15:00:00-04:00,"Athey Park (Chestertown, MD)",101,MBA,2026
6534651,615441,Cairn Highlanders,615378,Washington Col. Shoremen,615378,6,bot,"Pete Kokinis tripled to right center, RBI (0-0)3a Dino DiMauro scored.",75,2026-03-19T15:00:00-04:00,"Athey Park (Chestertown, MD)",101,MBA,2026
6534651,615441,Cairn Highlanders,615378,Washington Col. Shoremen,615378,6,bot,"Ryan Timmons grounded out to 2b, RBI (0-0)3a Pete Kokinis scored.",76,2026-03-19T15:00:00-04:00,"Athey Park (Chestertown, MD)",101,MBA,2026
6534651,615441,Cairn Highlanders,615378,Washington Col. Shoremen,615378,6,bot,"Ty Powell grounded out to p, bunt (0-0).",77,2026-03-19T15:00:00-04:00,"Athey Park (Chestertown, MD)",101,MBA,2026
6534651,615441,Cairn Highlanders,615378,Washington Col. Shoremen,615378,6,bot,Brett Connolly hit by pitch (0-0).,78,2026-03-19T15:00:00-04:00,"Athey Park (Chestertown, MD)",101,MBA,2026
6534651,615441,Cairn Highlanders,615378,Washington Col. Shoremen,615378,6,bot,"Chase Ruppel walked (0-0)3a Brett Connolly advanced to second, out at third c to 3b.",79,2026-03-19T15:00:00-04:00,"Athey Park (Chestertown, MD)",101,MBA,2026
6534651,615441,Cairn Highlanders,615378,Washington Col. Shoremen,615441,7,top,Justin Shipley to p for Matt Corda.,80,2026-03-19T15:00:00-04:00,"Athey Park (Chestertown, MD)",101,MBA,2026
6534651,615441,Cairn Highlanders,615378,Washington Col. Shoremen,615441,7,top,Ethan Perez walked (0-0).,81,2026-03-19T15:00:00-04:00,"Athey Park (Chestertown, MD)",101,MBA,2026
6534651,615441,Cairn Highlanders,615378,Washington Col. Shoremen,615441,7,top,"Christian Spadea reached on a fielder's choice to third base (0-0)3a Ethan Perez advanced to second, advanced to third on a throwing error by 3b.",82,2026-03-19T15:00:00-04:00,"Athey Park (Chestertown, MD)",101,MBA,2026
6534651,615441,Cairn Highlanders,615378,Washington Col. Shoremen,615441,7,top,Matthew Urena walked (0-0)3a Christian Spadea advanced to second.,83,2026-03-19T15:00:00-04:00,"Athey Park (Chestertown, MD)",101,MBA,2026
6534651,615441,Cairn Highlanders,615378,Washington Col. Shoremen,615441,7,top,"Jay Sariano singled through the right side, RBI (0-0)3a Matthew Urena advanced to second3a Christian Spadea advanced to third3a Ethan Perez scored.",84,2026-03-19T15:00:00-04:00,"Athey Park (Chestertown, MD)",101,MBA,2026
6534651,615441,Cairn Highlanders,615378,Washington Col. Shoremen,615441,7,top,"Jake Murnock singled through the right side, 2 RBI (0-0)3a Jay Sariano advanced to second3a Matthew Urena scored3a Christian Spadea scored.",85,2026-03-19T15:00:00-04:00,"Athey Park (Chestertown, MD)",101,MBA,2026
6534651,615441,Cairn Highlanders,615378,Washington Col. Shoremen,615441,7,top,Jay Sariano stole third.,86,2026-03-19T15:00:00-04:00,"Athey Park (Chestertown, MD)",101,MBA,2026
6534651,615441,Cairn Highlanders,615378,Washington Col. Shoremen,615441,7,top,Caden Hill struck out swinging (0-0)3a Jake Murnock stole second.,87,2026-03-19T15:00:00-04:00,"Athey Park (Chestertown, MD)",101,MBA,2026
6534651,615441,Cairn Highlanders,615378,Washington Col. Shoremen,615441,7,top,"Stephen Persiani grounded out to 2b, RBI (0-0)3a Jake Murnock advanced to third3a Jay Sariano scored.",88,2026-03-19T15:00:00-04:00,"Athey Park (Chestertown, MD)",101,MBA,2026
6534651,615441,Cairn Highlanders,615378,Washington Col. Shoremen,615441,7,top,AJ Ramirez grounded out to 1b unassisted (0-0).,89,2026-03-19T15:00:00-04:00,"Athey Park (Chestertown, MD)",101,MBA,2026
6534651,615441,Cairn Highlanders,615378,Washington Col. Shoremen,615378,7,bot,Drew Kinsey grounded out to 2b up the middle (0-0).,90,2026-03-19T15:00:00-04:00,"Athey Park (Chestertown, MD)",101,MBA,2026
6534651,615441,Cairn Highlanders,615378,Washington Col. Shoremen,615378,7,bot,Brady Wozniak singled up the middle (0-0).,91,2026-03-19T15:00:00-04:00,"Athey Park (Chestertown, MD)",101,MBA,2026
6534651,615441,Cairn Highlanders,615378,Washington Col. Shoremen,615378,7,bot,"Brady Wozniak out at second c to 2b, caught stealing.",92,2026-03-19T15:00:00-04:00,"Athey Park (Chestertown, MD)",101,MBA,2026
6534651,615441,Cairn Highlanders,615378,Washington Col. Shoremen,615378,7,bot,Ty Everitt walked (0-0).,93,2026-03-19T15:00:00-04:00,"Athey Park (Chestertown, MD)",101,MBA,2026
6534651,615441,Cairn Highlanders,615378,Washington Col. Shoremen,615378,7,bot,Ty Everitt stole second.,94,2026-03-19T15:00:00-04:00,"Athey Park (Chestertown, MD)",101,MBA,2026
6534651,615441,Cairn Highlanders,615378,Washington Col. Shoremen,615378,7,bot,Dino DiMauro walked (0-0).,95,2026-03-19T15:00:00-04:00,"Athey Park (Chestertown, MD)",101,MBA,2026
6534651,615441,Cairn Highlanders,615378,Washington Col. Shoremen,615378,7,bot,"Pete Kokinis doubled to left field, 2 RBI (0-0)3a Dino DiMauro scored3a Ty Everitt scored.",96,2026-03-19T15:00:00-04:00,"Athey Park (Chestertown, MD)",101,MBA,2026
6534651,615441,Cairn Highlanders,615378,Washington Col. Shoremen,615378,7,bot,Ryan Timmons flied out to lf (0-0).,97,2026-03-19T15:00:00-04:00,"Athey Park (Chestertown, MD)",101,MBA,2026
6534651,615441,Cairn Highlanders,615378,Washington Col. Shoremen,615441,8,top,Luke Girillo to p for Justin Shipley.,98,2026-03-19T15:00:00-04:00,"Athey Park (Chestertown, MD)",101,MBA,2026
6534651,615441,Cairn Highlanders,615378,Washington Col. Shoremen,615441,8,top,Cameron Burnes grounded out to ss (0-0).,99,2026-03-19T15:00:00-04:00,"Athey Park (Chestertown, MD)",101,MBA,2026
6534651,615441,Cairn Highlanders,615378,Washington Col. Shoremen,615441,8,top,Ethan Perez reached first on a fielding error by p (0-0).,100,2026-03-19T15:00:00-04:00,"Athey Park (Chestertown, MD)",101,MBA,2026
6534651,615441,Cairn Highlanders,615378,Washington Col. Shoremen,615441,8,top,Ethan Perez stole second.,101,2026-03-19T15:00:00-04:00,"Athey Park (Chestertown, MD)",101,MBA,2026
6534651,615441,Cairn Highlanders,615378,Washington Col. Shoremen,615441,8,top,"Christian Spadea singled up the middle, RBI (0-0)3a Ethan Perez scored, unearned.",102,2026-03-19T15:00:00-04:00,"Athey Park (Chestertown, MD)",101,MBA,2026
6534651,615441,Cairn Highlanders,615378,Washington Col. Shoremen,615441,8,top,Matthew Urena doubled to right center (0-0)3a Christian Spadea advanced to third.,103,2026-03-19T15:00:00-04:00,"Athey Park (Chestertown, MD)",101,MBA,2026
6534651,615441,Cairn Highlanders,615378,Washington Col. Shoremen,615441,8,top,Jay Sariano walked (0-0)3a Matthew Urena advanced to third on a wild pitch3a Christian Spadea scored on a wild pitch.,104,2026-03-19T15:00:00-04:00,"Athey Park (Chestertown, MD)",101,MBA,2026
6534651,615441,Cairn Highlanders,615378,Washington Col. Shoremen,615441,8,top,Jay Sariano stole second3a Matthew Urena scored on a throwing error by c.,105,2026-03-19T15:00:00-04:00,"Athey Park (Chestertown, MD)",101,MBA,2026
6534651,615441,Cairn Highlanders,615378,Washington Col. Shoremen,615441,8,top,Jake Murnock grounded out p to 2b to 1b (0-0)3a Jay Sariano advanced to third.,106,2026-03-19T15:00:00-04:00,"Athey Park (Chestertown, MD)",101,MBA,2026
6534651,615441,Cairn Highlanders,615378,Washington Col. Shoremen,615441,8,top,Caden Hill struck out swinging (0-0).,107,2026-03-19T15:00:00-04:00,"Athey Park (Chestertown, MD)",101,MBA,2026
6534651,615441,Cairn Highlanders,615378,Washington Col. Shoremen,615378,8,bot,Christian Spadea to p.,108,2026-03-19T15:00:00-04:00,"Athey Park (Chestertown, MD)",101,MBA,2026
6534651,615441,Cairn Highlanders,615378,Washington Col. Shoremen,615378,8,bot,Trevor Golden to 1b for Stephen Persiani.,109,2026-03-19T15:00:00-04:00,"Athey Park (Chestertown, MD)",101,MBA,2026
6534651,615441,Cairn Highlanders,615378,Washington Col. Shoremen,615378,8,bot,/  for Jackson Esbenshade.,110,2026-03-19T15:00:00-04:00,"Athey Park (Chestertown, MD)",101,MBA,2026
6534651,615441,Cairn Highlanders,615378,Washington Col. Shoremen,615378,8,bot,Ty Powell grounded out to ss (0-0).,111,2026-03-19T15:00:00-04:00,"Athey Park (Chestertown, MD)",101,MBA,2026
6534651,615441,Cairn Highlanders,615378,Washington Col. Shoremen,615378,8,bot,Brett Connolly singled to shortstop (0-0).,112,2026-03-19T15:00:00-04:00,"Athey Park (Chestertown, MD)",101,MBA,2026
6534651,615441,Cairn Highlanders,615378,Washington Col. Shoremen,615378,8,bot,"Brett Connolly out at second c to 2b, caught stealing.",113,2026-03-19T15:00:00-04:00,"Athey Park (Chestertown, MD)",101,MBA,2026
6534651,615441,Cairn Highlanders,615378,Washington Col. Shoremen,615378,8,bot,Chase Ruppel grounded out to ss (0-0).,114,2026-03-19T15:00:00-04:00,"Athey Park (Chestertown, MD)",101,MBA,2026
6534651,615441,Cairn Highlanders,615378,Washington Col. Shoremen,615441,9,top,Manny Aponte to p for Luke Girillo.,115,2026-03-19T15:00:00-04:00,"Athey Park (Chestertown, MD)",101,MBA,2026
6534651,615441,Cairn Highlanders,615378,Washington Col. Shoremen,615441,9,top,Trevor Golden reached first on a fielding error by 2b (0-0).,116,2026-03-19T15:00:00-04:00,"Athey Park (Chestertown, MD)",101,MBA,2026
6534651,615441,Cairn Highlanders,615378,Washington Col. Shoremen,615441,9,top,Trevor Golden advanced to second on a wild pitch.,117,2026-03-19T15:00:00-04:00,"Athey Park (Chestertown, MD)",101,MBA,2026
6534651,615441,Cairn Highlanders,615378,Washington Col. Shoremen,615441,9,top,AJ Ramirez grounded out to 2b (0-0)3a Trevor Golden advanced to third.,118,2026-03-19T15:00:00-04:00,"Athey Park (Chestertown, MD)",101,MBA,2026
6534651,615441,Cairn Highlanders,615378,Washington Col. Shoremen,615441,9,top,"Trevor Golden scored on a wild pitch, unearned.",119,2026-03-19T15:00:00-04:00,"Athey Park (Chestertown, MD)",101,MBA,2026
6534651,615441,Cairn Highlanders,615378,Washington Col. Shoremen,615441,9,top,Cameron Burnes struck out swinging (0-0).,120,2026-03-19T15:00:00-04:00,"Athey Park (Chestertown, MD)",101,MBA,2026
6534651,615441,Cairn Highlanders,615378,Washington Col. Shoremen,615441,9,top,Ethan Perez singled up the middle (0-0).,121,2026-03-19T15:00:00-04:00,"Athey Park (Chestertown, MD)",101,MBA,2026
6534651,615441,Cairn Highlanders,615378,Washington Col. Shoremen,615441,9,top,"Christian Spadea doubled to left center, RBI (0-0)3a Ethan Perez scored, unearned.",122,2026-03-19T15:00:00-04:00,"Athey Park (Chestertown, MD)",101,MBA,2026
6534651,615441,Cairn Highlanders,615378,Washington Col. Shoremen,615441,9,top,Matthew Urena grounded out to 1b unassisted (0-0).,123,2026-03-19T15:00:00-04:00,"Athey Park (Chestertown, MD)",101,MBA,2026
