game_id,away_team_id,away_team_name,home_team_id,home_team_name,batting_team,inning,top_bot,event_text,event_num,game_datetime,stadium_name,attendance,sport_id,season
6534210,614717,Rhode Island Rams,614633,Jacksonville Dolphins,614717,1,top,C. Grotyohan flied out to cf.,1,2026-02-14T13:00:00-05:00,"John Sessions Stadium (Jacksonville, FL)",0,MBA,2026
6534210,614717,Rhode Island Rams,614633,Jacksonville Dolphins,614717,1,top,R. Moroney struck out looking.,2,2026-02-14T13:00:00-05:00,"John Sessions Stadium (Jacksonville, FL)",0,MBA,2026
6534210,614717,Rhode Island Rams,614633,Jacksonville Dolphins,614717,1,top,J. Hopko struck out swinging.,3,2026-02-14T13:00:00-05:00,"John Sessions Stadium (Jacksonville, FL)",0,MBA,2026
6534210,614717,Rhode Island Rams,614633,Jacksonville Dolphins,614633,1,bot,C. Walter hit by pitch.,4,2026-02-14T13:00:00-05:00,"John Sessions Stadium (Jacksonville, FL)",0,MBA,2026
6534210,614717,Rhode Island Rams,614633,Jacksonville Dolphins,614633,1,bot,J. Shields singled to right field3a C. Walter advanced to second.,5,2026-02-14T13:00:00-05:00,"John Sessions Stadium (Jacksonville, FL)",0,MBA,2026
6534210,614717,Rhode Island Rams,614633,Jacksonville Dolphins,614633,1,bot,"R. Vergara singled to right field, RBI3a J. Shields advanced to second3a C. Walter scored.",6,2026-02-14T13:00:00-05:00,"John Sessions Stadium (Jacksonville, FL)",0,MBA,2026
6534210,614717,Rhode Island Rams,614633,Jacksonville Dolphins,614633,1,bot,S. Grunberg struck out swinging3a R. Vergara stole second3a J. Shields stole third.,7,2026-02-14T13:00:00-05:00,"John Sessions Stadium (Jacksonville, FL)",0,MBA,2026
6534210,614717,Rhode Island Rams,614633,Jacksonville Dolphins,614633,1,bot,"D. Bermudez doubled to left field, 2 RBI3a R. Vergara scored3a J. Shields scored.",8,2026-02-14T13:00:00-05:00,"John Sessions Stadium (Jacksonville, FL)",0,MBA,2026
6534210,614717,Rhode Island Rams,614633,Jacksonville Dolphins,614633,1,bot,L. Baratta grounded out to 2b3a D. Bermudez advanced to third.,9,2026-02-14T13:00:00-05:00,"John Sessions Stadium (Jacksonville, FL)",0,MBA,2026
6534210,614717,Rhode Island Rams,614633,Jacksonville Dolphins,614633,1,bot,N. DeLisi grounded out to 3b.,10,2026-02-14T13:00:00-05:00,"John Sessions Stadium (Jacksonville, FL)",0,MBA,2026
6534210,614717,Rhode Island Rams,614633,Jacksonville Dolphins,614717,2,top,R. King walked.,11,2026-02-14T13:00:00-05:00,"John Sessions Stadium (Jacksonville, FL)",0,MBA,2026
6534210,614717,Rhode Island Rams,614633,Jacksonville Dolphins,614717,2,top,S. Penney flied out to lf.,12,2026-02-14T13:00:00-05:00,"John Sessions Stadium (Jacksonville, FL)",0,MBA,2026
6534210,614717,Rhode Island Rams,614633,Jacksonville Dolphins,614717,2,top,R. King advanced to second on a throwing error by p.,13,2026-02-14T13:00:00-05:00,"John Sessions Stadium (Jacksonville, FL)",0,MBA,2026
6534210,614717,Rhode Island Rams,614633,Jacksonville Dolphins,614717,2,top,R. Henschel walked.,14,2026-02-14T13:00:00-05:00,"John Sessions Stadium (Jacksonville, FL)",0,MBA,2026
6534210,614717,Rhode Island Rams,614633,Jacksonville Dolphins,614717,2,top,B. Connolly hit by pitch3a R. Henschel advanced to second3a R. King advanced to third.,15,2026-02-14T13:00:00-05:00,"John Sessions Stadium (Jacksonville, FL)",0,MBA,2026
6534210,614717,Rhode Island Rams,614633,Jacksonville Dolphins,614717,2,top,"R. Thompson flied out to cf, sacrifice fly, RBI3a R. Henschel advanced to third3a R. King scored.",16,2026-02-14T13:00:00-05:00,"John Sessions Stadium (Jacksonville, FL)",0,MBA,2026
6534210,614717,Rhode Island Rams,614633,Jacksonville Dolphins,614717,2,top,"D. Leikus singled to left field, RBI3a B. Connolly advanced to second3a R. Henschel scored.",17,2026-02-14T13:00:00-05:00,"John Sessions Stadium (Jacksonville, FL)",0,MBA,2026
6534210,614717,Rhode Island Rams,614633,Jacksonville Dolphins,614717,2,top,C. Grotyohan reached on a fielder's choice3a D. Leikus out at second ss to 2b.,18,2026-02-14T13:00:00-05:00,"John Sessions Stadium (Jacksonville, FL)",0,MBA,2026
6534210,614717,Rhode Island Rams,614633,Jacksonville Dolphins,614633,2,bot,B. Edmonds singled to left field.,19,2026-02-14T13:00:00-05:00,"John Sessions Stadium (Jacksonville, FL)",0,MBA,2026
6534210,614717,Rhode Island Rams,614633,Jacksonville Dolphins,614633,2,bot,S. Mummau flied out to cf.,20,2026-02-14T13:00:00-05:00,"John Sessions Stadium (Jacksonville, FL)",0,MBA,2026
6534210,614717,Rhode Island Rams,614633,Jacksonville Dolphins,614633,2,bot,C. Walter singled to right field3a B. Edmonds advanced to second.,21,2026-02-14T13:00:00-05:00,"John Sessions Stadium (Jacksonville, FL)",0,MBA,2026
6534210,614717,Rhode Island Rams,614633,Jacksonville Dolphins,614633,2,bot,C. Walter advanced to second3a B. Edmonds advanced to third on a wild pitch.,22,2026-02-14T13:00:00-05:00,"John Sessions Stadium (Jacksonville, FL)",0,MBA,2026
6534210,614717,Rhode Island Rams,614633,Jacksonville Dolphins,614633,2,bot,"J. Shields grounded out to p unassisted, RBI3a C. Walter advanced to third3a B. Edmonds scored.",23,2026-02-14T13:00:00-05:00,"John Sessions Stadium (Jacksonville, FL)",0,MBA,2026
6534210,614717,Rhode Island Rams,614633,Jacksonville Dolphins,614633,2,bot,R. Vergara hit by pitch.,24,2026-02-14T13:00:00-05:00,"John Sessions Stadium (Jacksonville, FL)",0,MBA,2026
6534210,614717,Rhode Island Rams,614633,Jacksonville Dolphins,614633,2,bot,S. Grunberg flied out to cf.,25,2026-02-14T13:00:00-05:00,"John Sessions Stadium (Jacksonville, FL)",0,MBA,2026
6534210,614717,Rhode Island Rams,614633,Jacksonville Dolphins,614717,3,top,R. Moroney flied out to rf.,26,2026-02-14T13:00:00-05:00,"John Sessions Stadium (Jacksonville, FL)",0,MBA,2026
6534210,614717,Rhode Island Rams,614633,Jacksonville Dolphins,614717,3,top,J. Hopko walked.,27,2026-02-14T13:00:00-05:00,"John Sessions Stadium (Jacksonville, FL)",0,MBA,2026
6534210,614717,Rhode Island Rams,614633,Jacksonville Dolphins,614717,3,top,R. King flied out to rf.,28,2026-02-14T13:00:00-05:00,"John Sessions Stadium (Jacksonville, FL)",0,MBA,2026
6534210,614717,Rhode Island Rams,614633,Jacksonville Dolphins,614717,3,top,S. Penney singled3a J. Hopko advanced to third.,29,2026-02-14T13:00:00-05:00,"John Sessions Stadium (Jacksonville, FL)",0,MBA,2026
6534210,614717,Rhode Island Rams,614633,Jacksonville Dolphins,614717,3,top,R. Henschel walked3a S. Penney advanced to second.,30,2026-02-14T13:00:00-05:00,"John Sessions Stadium (Jacksonville, FL)",0,MBA,2026
6534210,614717,Rhode Island Rams,614633,Jacksonville Dolphins,614717,3,top,D. Pieto to p for G. Dicks.,31,2026-02-14T13:00:00-05:00,"John Sessions Stadium (Jacksonville, FL)",0,MBA,2026
6534210,614717,Rhode Island Rams,614633,Jacksonville Dolphins,614717,3,top,B. Connolly struck out looking.,32,2026-02-14T13:00:00-05:00,"John Sessions Stadium (Jacksonville, FL)",0,MBA,2026
6534210,614717,Rhode Island Rams,614633,Jacksonville Dolphins,614633,3,bot,D. Bermudez flied out to cf.,33,2026-02-14T13:00:00-05:00,"John Sessions Stadium (Jacksonville, FL)",0,MBA,2026
6534210,614717,Rhode Island Rams,614633,Jacksonville Dolphins,614633,3,bot,L. Baratta popped up to ss.,34,2026-02-14T13:00:00-05:00,"John Sessions Stadium (Jacksonville, FL)",0,MBA,2026
6534210,614717,Rhode Island Rams,614633,Jacksonville Dolphins,614633,3,bot,N. DeLisi lined out to cf.,35,2026-02-14T13:00:00-05:00,"John Sessions Stadium (Jacksonville, FL)",0,MBA,2026
6534210,614717,Rhode Island Rams,614633,Jacksonville Dolphins,614717,4,top,R. Thompson walked.,36,2026-02-14T13:00:00-05:00,"John Sessions Stadium (Jacksonville, FL)",0,MBA,2026
6534210,614717,Rhode Island Rams,614633,Jacksonville Dolphins,614717,4,top,D. Leikus struck out swinging.,37,2026-02-14T13:00:00-05:00,"John Sessions Stadium (Jacksonville, FL)",0,MBA,2026
6534210,614717,Rhode Island Rams,614633,Jacksonville Dolphins,614717,4,top,C. Grotyohan struck out swinging.,38,2026-02-14T13:00:00-05:00,"John Sessions Stadium (Jacksonville, FL)",0,MBA,2026
6534210,614717,Rhode Island Rams,614633,Jacksonville Dolphins,614717,4,top,R. Thompson stole second.,39,2026-02-14T13:00:00-05:00,"John Sessions Stadium (Jacksonville, FL)",0,MBA,2026
6534210,614717,Rhode Island Rams,614633,Jacksonville Dolphins,614717,4,top,R. Moroney struck out swinging.,40,2026-02-14T13:00:00-05:00,"John Sessions Stadium (Jacksonville, FL)",0,MBA,2026
6534210,614717,Rhode Island Rams,614633,Jacksonville Dolphins,614633,4,bot,B. Edmonds struck out swinging.,41,2026-02-14T13:00:00-05:00,"John Sessions Stadium (Jacksonville, FL)",0,MBA,2026
6534210,614717,Rhode Island Rams,614633,Jacksonville Dolphins,614633,4,bot,S. Mummau walked.,42,2026-02-14T13:00:00-05:00,"John Sessions Stadium (Jacksonville, FL)",0,MBA,2026
6534210,614717,Rhode Island Rams,614633,Jacksonville Dolphins,614633,4,bot,S. Mummau stole second.,43,2026-02-14T13:00:00-05:00,"John Sessions Stadium (Jacksonville, FL)",0,MBA,2026
6534210,614717,Rhode Island Rams,614633,Jacksonville Dolphins,614633,4,bot,C. Walter flied out to rf3a S. Mummau advanced to third.,44,2026-02-14T13:00:00-05:00,"John Sessions Stadium (Jacksonville, FL)",0,MBA,2026
6534210,614717,Rhode Island Rams,614633,Jacksonville Dolphins,614633,4,bot,J. Shields flied out to lf.,45,2026-02-14T13:00:00-05:00,"John Sessions Stadium (Jacksonville, FL)",0,MBA,2026
6534210,614717,Rhode Island Rams,614633,Jacksonville Dolphins,614717,5,top,J. Hopko grounded out to 2b.,46,2026-02-14T13:00:00-05:00,"John Sessions Stadium (Jacksonville, FL)",0,MBA,2026
6534210,614717,Rhode Island Rams,614633,Jacksonville Dolphins,614717,5,top,R. King struck out swinging.,47,2026-02-14T13:00:00-05:00,"John Sessions Stadium (Jacksonville, FL)",0,MBA,2026
6534210,614717,Rhode Island Rams,614633,Jacksonville Dolphins,614717,5,top,S. Penney doubled to right center.,48,2026-02-14T13:00:00-05:00,"John Sessions Stadium (Jacksonville, FL)",0,MBA,2026
6534210,614717,Rhode Island Rams,614633,Jacksonville Dolphins,614717,5,top,R. Henschel walked.,49,2026-02-14T13:00:00-05:00,"John Sessions Stadium (Jacksonville, FL)",0,MBA,2026
6534210,614717,Rhode Island Rams,614633,Jacksonville Dolphins,614717,5,top,B. Connolly grounded out to 3b unassisted.,50,2026-02-14T13:00:00-05:00,"John Sessions Stadium (Jacksonville, FL)",0,MBA,2026
6534210,614717,Rhode Island Rams,614633,Jacksonville Dolphins,614633,5,bot,P. Aikens to p for J. Sabbath.,51,2026-02-14T13:00:00-05:00,"John Sessions Stadium (Jacksonville, FL)",0,MBA,2026
6534210,614717,Rhode Island Rams,614633,Jacksonville Dolphins,614633,5,bot,R. Vergara flied out to cf.,52,2026-02-14T13:00:00-05:00,"John Sessions Stadium (Jacksonville, FL)",0,MBA,2026
6534210,614717,Rhode Island Rams,614633,Jacksonville Dolphins,614633,5,bot,S. Grunberg walked.,53,2026-02-14T13:00:00-05:00,"John Sessions Stadium (Jacksonville, FL)",0,MBA,2026
6534210,614717,Rhode Island Rams,614633,Jacksonville Dolphins,614633,5,bot,D. Bermudez singled to center field3a S. Grunberg advanced to second.,54,2026-02-14T13:00:00-05:00,"John Sessions Stadium (Jacksonville, FL)",0,MBA,2026
6534210,614717,Rhode Island Rams,614633,Jacksonville Dolphins,614633,5,bot,"L. Baratta singled to left field, advanced to second, RBI3a D. Bermudez advanced to third3a S. Grunberg scored.",55,2026-02-14T13:00:00-05:00,"John Sessions Stadium (Jacksonville, FL)",0,MBA,2026
6534210,614717,Rhode Island Rams,614633,Jacksonville Dolphins,614633,5,bot,"N. DeLisi singled, 2 RBI3a L. Baratta scored3a D. Bermudez scored.",56,2026-02-14T13:00:00-05:00,"John Sessions Stadium (Jacksonville, FL)",0,MBA,2026
6534210,614717,Rhode Island Rams,614633,Jacksonville Dolphins,614633,5,bot,B. Edmonds hit by pitch3a N. DeLisi advanced to second.,57,2026-02-14T13:00:00-05:00,"John Sessions Stadium (Jacksonville, FL)",0,MBA,2026
6534210,614717,Rhode Island Rams,614633,Jacksonville Dolphins,614633,5,bot,S. Mummau hit by pitch3a B. Edmonds advanced to second3a N. DeLisi advanced to third.,58,2026-02-14T13:00:00-05:00,"John Sessions Stadium (Jacksonville, FL)",0,MBA,2026
6534210,614717,Rhode Island Rams,614633,Jacksonville Dolphins,614633,5,bot,"C. Walter singled, 2 RBI3a S. Mummau advanced to second3a B. Edmonds scored3a N. DeLisi scored.",59,2026-02-14T13:00:00-05:00,"John Sessions Stadium (Jacksonville, FL)",0,MBA,2026
6534210,614717,Rhode Island Rams,614633,Jacksonville Dolphins,614633,5,bot,C. Maloney to p for P. Aikens.,60,2026-02-14T13:00:00-05:00,"John Sessions Stadium (Jacksonville, FL)",0,MBA,2026
6534210,614717,Rhode Island Rams,614633,Jacksonville Dolphins,614633,5,bot,C. Walter advanced to second3a S. Mummau advanced to third on a balk.,61,2026-02-14T13:00:00-05:00,"John Sessions Stadium (Jacksonville, FL)",0,MBA,2026
6534210,614717,Rhode Island Rams,614633,Jacksonville Dolphins,614633,5,bot,"J. Shields flied out to lf, SAC, RBI3a C. Walter advanced to third3a S. Mummau scored.",62,2026-02-14T13:00:00-05:00,"John Sessions Stadium (Jacksonville, FL)",0,MBA,2026
6534210,614717,Rhode Island Rams,614633,Jacksonville Dolphins,614633,5,bot,R. Vergara walked.,63,2026-02-14T13:00:00-05:00,"John Sessions Stadium (Jacksonville, FL)",0,MBA,2026
6534210,614717,Rhode Island Rams,614633,Jacksonville Dolphins,614633,5,bot,S. Grunberg struck out swinging.,64,2026-02-14T13:00:00-05:00,"John Sessions Stadium (Jacksonville, FL)",0,MBA,2026
6534210,614717,Rhode Island Rams,614633,Jacksonville Dolphins,614717,6,top,"R. Thompson homered to left center, RBI.",65,2026-02-14T13:00:00-05:00,"John Sessions Stadium (Jacksonville, FL)",0,MBA,2026
6534210,614717,Rhode Island Rams,614633,Jacksonville Dolphins,614717,6,top,D. Leikus flied out to cf.,66,2026-02-14T13:00:00-05:00,"John Sessions Stadium (Jacksonville, FL)",0,MBA,2026
6534210,614717,Rhode Island Rams,614633,Jacksonville Dolphins,614717,6,top,C. Grotyohan struck out swinging.,67,2026-02-14T13:00:00-05:00,"John Sessions Stadium (Jacksonville, FL)",0,MBA,2026
6534210,614717,Rhode Island Rams,614633,Jacksonville Dolphins,614717,6,top,R. Moroney struck out looking.,68,2026-02-14T13:00:00-05:00,"John Sessions Stadium (Jacksonville, FL)",0,MBA,2026
6534210,614717,Rhode Island Rams,614633,Jacksonville Dolphins,614633,6,bot,D. Bermudez walked.,69,2026-02-14T13:00:00-05:00,"John Sessions Stadium (Jacksonville, FL)",0,MBA,2026
6534210,614717,Rhode Island Rams,614633,Jacksonville Dolphins,614633,6,bot,L. Baratta popped up to ss.,70,2026-02-14T13:00:00-05:00,"John Sessions Stadium (Jacksonville, FL)",0,MBA,2026
6534210,614717,Rhode Island Rams,614633,Jacksonville Dolphins,614633,6,bot,N. DeLisi grounded out to ss3a D. Bermudez advanced to second.,71,2026-02-14T13:00:00-05:00,"John Sessions Stadium (Jacksonville, FL)",0,MBA,2026
6534210,614717,Rhode Island Rams,614633,Jacksonville Dolphins,614633,6,bot,B. Edmonds flied out to rf.,72,2026-02-14T13:00:00-05:00,"John Sessions Stadium (Jacksonville, FL)",0,MBA,2026
6534210,614717,Rhode Island Rams,614633,Jacksonville Dolphins,614717,7,top,J. Hopko flied out to cf.,73,2026-02-14T13:00:00-05:00,"John Sessions Stadium (Jacksonville, FL)",0,MBA,2026
6534210,614717,Rhode Island Rams,614633,Jacksonville Dolphins,614717,7,top,R. King struck out swinging.,74,2026-02-14T13:00:00-05:00,"John Sessions Stadium (Jacksonville, FL)",0,MBA,2026
6534210,614717,Rhode Island Rams,614633,Jacksonville Dolphins,614717,7,top,S. Penney walked.,75,2026-02-14T13:00:00-05:00,"John Sessions Stadium (Jacksonville, FL)",0,MBA,2026
6534210,614717,Rhode Island Rams,614633,Jacksonville Dolphins,614717,7,top,L. Hartman to p for D. Pieto.,76,2026-02-14T13:00:00-05:00,"John Sessions Stadium (Jacksonville, FL)",0,MBA,2026
6534210,614717,Rhode Island Rams,614633,Jacksonville Dolphins,614717,7,top,R. Henschel grounded out to 3b.,77,2026-02-14T13:00:00-05:00,"John Sessions Stadium (Jacksonville, FL)",0,MBA,2026
6534210,614717,Rhode Island Rams,614633,Jacksonville Dolphins,614633,7,bot,S. Mummau flied out to lf.,78,2026-02-14T13:00:00-05:00,"John Sessions Stadium (Jacksonville, FL)",0,MBA,2026
6534210,614717,Rhode Island Rams,614633,Jacksonville Dolphins,614633,7,bot,C. Walter walked.,79,2026-02-14T13:00:00-05:00,"John Sessions Stadium (Jacksonville, FL)",0,MBA,2026
6534210,614717,Rhode Island Rams,614633,Jacksonville Dolphins,614633,7,bot,C. Walter stole second.,80,2026-02-14T13:00:00-05:00,"John Sessions Stadium (Jacksonville, FL)",0,MBA,2026
6534210,614717,Rhode Island Rams,614633,Jacksonville Dolphins,614633,7,bot,"J. Shields singled, RBI3a C. Walter scored.",81,2026-02-14T13:00:00-05:00,"John Sessions Stadium (Jacksonville, FL)",0,MBA,2026
6534210,614717,Rhode Island Rams,614633,Jacksonville Dolphins,614633,7,bot,R. Vergara singled3a J. Shields advanced to third.,82,2026-02-14T13:00:00-05:00,"John Sessions Stadium (Jacksonville, FL)",0,MBA,2026
6534210,614717,Rhode Island Rams,614633,Jacksonville Dolphins,614633,7,bot,R. Vergara advanced to second on a wild pitch.,83,2026-02-14T13:00:00-05:00,"John Sessions Stadium (Jacksonville, FL)",0,MBA,2026
6534210,614717,Rhode Island Rams,614633,Jacksonville Dolphins,614633,7,bot,S. Grunberg struck out looking.,84,2026-02-14T13:00:00-05:00,"John Sessions Stadium (Jacksonville, FL)",0,MBA,2026
6534210,614717,Rhode Island Rams,614633,Jacksonville Dolphins,614633,7,bot,D. Bermudez flied out to rf.,85,2026-02-14T13:00:00-05:00,"John Sessions Stadium (Jacksonville, FL)",0,MBA,2026
6534210,614717,Rhode Island Rams,614633,Jacksonville Dolphins,614717,8,top,B. Connolly flied out to cf.,86,2026-02-14T13:00:00-05:00,"John Sessions Stadium (Jacksonville, FL)",0,MBA,2026
6534210,614717,Rhode Island Rams,614633,Jacksonville Dolphins,614717,8,top,R. Thompson grounded out to ss.,87,2026-02-14T13:00:00-05:00,"John Sessions Stadium (Jacksonville, FL)",0,MBA,2026
6534210,614717,Rhode Island Rams,614633,Jacksonville Dolphins,614717,8,top,T. Gormley pinch hit for D. Leikus.,88,2026-02-14T13:00:00-05:00,"John Sessions Stadium (Jacksonville, FL)",0,MBA,2026
6534210,614717,Rhode Island Rams,614633,Jacksonville Dolphins,614717,8,top,T. Gormley lined out to 2b.,89,2026-02-14T13:00:00-05:00,"John Sessions Stadium (Jacksonville, FL)",0,MBA,2026
6534210,614717,Rhode Island Rams,614633,Jacksonville Dolphins,614633,8,bot,J. Tolentino to c for T. Gormley.,90,2026-02-14T13:00:00-05:00,"John Sessions Stadium (Jacksonville, FL)",0,MBA,2026
6534210,614717,Rhode Island Rams,614633,Jacksonville Dolphins,614633,8,bot,L. Lavigueur to p for C. Maloney.,91,2026-02-14T13:00:00-05:00,"John Sessions Stadium (Jacksonville, FL)",0,MBA,2026
6534210,614717,Rhode Island Rams,614633,Jacksonville Dolphins,614633,8,bot,L. Baratta flied out to lf.,92,2026-02-14T13:00:00-05:00,"John Sessions Stadium (Jacksonville, FL)",0,MBA,2026
6534210,614717,Rhode Island Rams,614633,Jacksonville Dolphins,614633,8,bot,N. DeLisi walked.,93,2026-02-14T13:00:00-05:00,"John Sessions Stadium (Jacksonville, FL)",0,MBA,2026
6534210,614717,Rhode Island Rams,614633,Jacksonville Dolphins,614633,8,bot,B. Edmonds lined into double play ss to 1b3a N. DeLisi out on the play.,94,2026-02-14T13:00:00-05:00,"John Sessions Stadium (Jacksonville, FL)",0,MBA,2026
6534210,614717,Rhode Island Rams,614633,Jacksonville Dolphins,614717,9,top,S. Updike to p for L. Hartman.,95,2026-02-14T13:00:00-05:00,"John Sessions Stadium (Jacksonville, FL)",0,MBA,2026
6534210,614717,Rhode Island Rams,614633,Jacksonville Dolphins,614717,9,top,C. Grotyohan flied out to rf.,96,2026-02-14T13:00:00-05:00,"John Sessions Stadium (Jacksonville, FL)",0,MBA,2026
6534210,614717,Rhode Island Rams,614633,Jacksonville Dolphins,614717,9,top,R. Moroney singled to right field.,97,2026-02-14T13:00:00-05:00,"John Sessions Stadium (Jacksonville, FL)",0,MBA,2026
6534210,614717,Rhode Island Rams,614633,Jacksonville Dolphins,614717,9,top,J. Hopko singled3a R. Moroney advanced to second.,98,2026-02-14T13:00:00-05:00,"John Sessions Stadium (Jacksonville, FL)",0,MBA,2026
6534210,614717,Rhode Island Rams,614633,Jacksonville Dolphins,614717,9,top,R. King reached on a fielder's choice3a J. Hopko advanced to second3a R. Moroney advanced to third on an error by 3b.,99,2026-02-14T13:00:00-05:00,"John Sessions Stadium (Jacksonville, FL)",0,MBA,2026
6534210,614717,Rhode Island Rams,614633,Jacksonville Dolphins,614717,9,top,"R. King advanced to second3a J. Hopko advanced to third3a R. Moroney scored on a wild pitch, unearned.",100,2026-02-14T13:00:00-05:00,"John Sessions Stadium (Jacksonville, FL)",0,MBA,2026
6534210,614717,Rhode Island Rams,614633,Jacksonville Dolphins,614717,9,top,"S. Penney flied out to lf, SAC, RBI3a J. Hopko scored, unearned.",101,2026-02-14T13:00:00-05:00,"John Sessions Stadium (Jacksonville, FL)",0,MBA,2026
6534210,614717,Rhode Island Rams,614633,Jacksonville Dolphins,614717,9,top,"R. Henschel doubled, RBI3a R. King scored, unearned.",102,2026-02-14T13:00:00-05:00,"John Sessions Stadium (Jacksonville, FL)",0,MBA,2026
6534210,614717,Rhode Island Rams,614633,Jacksonville Dolphins,614717,9,top,B. Connolly struck out swinging.,103,2026-02-14T13:00:00-05:00,"John Sessions Stadium (Jacksonville, FL)",0,MBA,2026
