game_id,away_team_id,away_team_name,home_team_id,home_team_name,batting_team,inning,top_bot,event_text,event_num,game_datetime,stadium_name,attendance,sport_id,season
6545950,615458,Albertus Magnus Falcons,615431,Lakeland Muskies,615458,1,top,"Adriel Espada singled to third base, bunt (1-0 B).",1,2026-03-12T14:30:00-04:00,"Davenport, FL",0,MBA,2026
6545950,615458,Albertus Magnus Falcons,615431,Lakeland Muskies,615458,1,top,Adriel Espada stole second.,2,2026-03-12T14:30:00-04:00,"Davenport, FL",0,MBA,2026
6545950,615458,Albertus Magnus Falcons,615431,Lakeland Muskies,615458,1,top,Mark Whittington popped out to c (2-2 BFKB).,3,2026-03-12T14:30:00-04:00,"Davenport, FL",0,MBA,2026
6545950,615458,Albertus Magnus Falcons,615431,Lakeland Muskies,615458,1,top,Adriel Espada stole third.,4,2026-03-12T14:30:00-04:00,"Davenport, FL",0,MBA,2026
6545950,615458,Albertus Magnus Falcons,615431,Lakeland Muskies,615458,1,top,"Eric Galarza grounded out to ss, RBI (1-1 KB); Adriel Espada scored.",5,2026-03-12T14:30:00-04:00,"Davenport, FL",0,MBA,2026
6545950,615458,Albertus Magnus Falcons,615431,Lakeland Muskies,615458,1,top,Joey O'Hara struck out looking (3-2 BBSBFK).,6,2026-03-12T14:30:00-04:00,"Davenport, FL",0,MBA,2026
6545950,615458,Albertus Magnus Falcons,615431,Lakeland Muskies,615431,1,bot,J.T. Cortinas singled to left field (1-0 B).,7,2026-03-12T14:30:00-04:00,"Davenport, FL",0,MBA,2026
6545950,615458,Albertus Magnus Falcons,615431,Lakeland Muskies,615431,1,bot,Jordan Domingue walked (3-2 BBBKFFB); J.T. Cortinas advanced to second.,8,2026-03-12T14:30:00-04:00,"Davenport, FL",0,MBA,2026
6545950,615458,Albertus Magnus Falcons,615431,Lakeland Muskies,615431,1,bot,Sean Gregorius hit by pitch (3-2 KSFBBH); Jordan Domingue advanced to second; J.T. Cortinas advanced to third.,9,2026-03-12T14:30:00-04:00,"Davenport, FL",0,MBA,2026
6545950,615458,Albertus Magnus Falcons,615431,Lakeland Muskies,615431,1,bot,"Dylan Costello flied out to rf, SAC, RBI (3-1 BSBB); Jordan Domingue advanced to third; J.T. Cortinas scored.",10,2026-03-12T14:30:00-04:00,"Davenport, FL",0,MBA,2026
6545950,615458,Albertus Magnus Falcons,615431,Lakeland Muskies,615431,1,bot,"Chris Finn grounded out to p, SAC, bunt, RBI (0-0); Sean Gregorius advanced to second; Jordan Domingue scored.",11,2026-03-12T14:30:00-04:00,"Davenport, FL",0,MBA,2026
6545950,615458,Albertus Magnus Falcons,615431,Lakeland Muskies,615431,1,bot,Logan South flied out to cf (1-2 FFB).,12,2026-03-12T14:30:00-04:00,"Davenport, FL",0,MBA,2026
6545950,615458,Albertus Magnus Falcons,615431,Lakeland Muskies,615458,2,top,Gio Morales struck out swinging (0-2 KFS).,13,2026-03-12T14:30:00-04:00,"Davenport, FL",0,MBA,2026
6545950,615458,Albertus Magnus Falcons,615431,Lakeland Muskies,615458,2,top,Baltazar Mesa singled to right field (0-1 K).,14,2026-03-12T14:30:00-04:00,"Davenport, FL",0,MBA,2026
6545950,615458,Albertus Magnus Falcons,615431,Lakeland Muskies,615458,2,top,Robert Anton singled to right field (0-1 F); Baltazar Mesa advanced to second.,15,2026-03-12T14:30:00-04:00,"Davenport, FL",0,MBA,2026
6545950,615458,Albertus Magnus Falcons,615431,Lakeland Muskies,615458,2,top,Hunter Sincovic struck out swinging (3-2 FBBBKS).,16,2026-03-12T14:30:00-04:00,"Davenport, FL",0,MBA,2026
6545950,615458,Albertus Magnus Falcons,615431,Lakeland Muskies,615458,2,top,Anthony Abate struck out swinging (1-2 KBFS).,17,2026-03-12T14:30:00-04:00,"Davenport, FL",0,MBA,2026
6545950,615458,Albertus Magnus Falcons,615431,Lakeland Muskies,615431,2,bot,Mikey Hernandez grounded out to ss (0-0).,18,2026-03-12T14:30:00-04:00,"Davenport, FL",0,MBA,2026
6545950,615458,Albertus Magnus Falcons,615431,Lakeland Muskies,615431,2,bot,Hayden Smith grounded out to ss (1-2 BKF).,19,2026-03-12T14:30:00-04:00,"Davenport, FL",0,MBA,2026
6545950,615458,Albertus Magnus Falcons,615431,Lakeland Muskies,615431,2,bot,Chris Day struck out looking (3-2 KKFBFBFBFK).,20,2026-03-12T14:30:00-04:00,"Davenport, FL",0,MBA,2026
6545950,615458,Albertus Magnus Falcons,615431,Lakeland Muskies,615458,3,top,Adriel Espada struck out looking (1-2 KSBK).,21,2026-03-12T14:30:00-04:00,"Davenport, FL",0,MBA,2026
6545950,615458,Albertus Magnus Falcons,615431,Lakeland Muskies,615458,3,top,Mark Whittington grounded out to 3b (0-0).,22,2026-03-12T14:30:00-04:00,"Davenport, FL",0,MBA,2026
6545950,615458,Albertus Magnus Falcons,615431,Lakeland Muskies,615458,3,top,Eric Galarza grounded out to 2b (0-0).,23,2026-03-12T14:30:00-04:00,"Davenport, FL",0,MBA,2026
6545950,615458,Albertus Magnus Falcons,615431,Lakeland Muskies,615431,3,bot,"J.T. Cortinas reached first on an error by ss, advanced to second (2-1 BFB).",24,2026-03-12T14:30:00-04:00,"Davenport, FL",0,MBA,2026
6545950,615458,Albertus Magnus Falcons,615431,Lakeland Muskies,615431,3,bot,"Jordan Domingue grounded out to p, SAC, bunt (0-0); J.T. Cortinas advanced to third.",25,2026-03-12T14:30:00-04:00,"Davenport, FL",0,MBA,2026
6545950,615458,Albertus Magnus Falcons,615431,Lakeland Muskies,615431,3,bot,"Sean Gregorius singled to center field, RBI (2-2 BBFFFF); J.T. Cortinas scored, unearned.",26,2026-03-12T14:30:00-04:00,"Davenport, FL",0,MBA,2026
6545950,615458,Albertus Magnus Falcons,615431,Lakeland Muskies,615431,3,bot,Dylan Costello flied out to rf (0-1 K).,27,2026-03-12T14:30:00-04:00,"Davenport, FL",0,MBA,2026
6545950,615458,Albertus Magnus Falcons,615431,Lakeland Muskies,615431,3,bot,Sean Gregorius stole second.,28,2026-03-12T14:30:00-04:00,"Davenport, FL",0,MBA,2026
6545950,615458,Albertus Magnus Falcons,615431,Lakeland Muskies,615431,3,bot,"Chris Finn doubled to left field, RBI (1-0 B); Sean Gregorius scored.",29,2026-03-12T14:30:00-04:00,"Davenport, FL",0,MBA,2026
6545950,615458,Albertus Magnus Falcons,615431,Lakeland Muskies,615431,3,bot,Logan South grounded out to 3b (2-2 BBFF).,30,2026-03-12T14:30:00-04:00,"Davenport, FL",0,MBA,2026
6545950,615458,Albertus Magnus Falcons,615431,Lakeland Muskies,615458,4,top,Joey O'Hara reached first on an error by 3b (1-1 KB).,31,2026-03-12T14:30:00-04:00,"Davenport, FL",0,MBA,2026
6545950,615458,Albertus Magnus Falcons,615431,Lakeland Muskies,615458,4,top,Gio Morales reached first on an error by p (0-0); Joey O'Hara advanced to second.,32,2026-03-12T14:30:00-04:00,"Davenport, FL",0,MBA,2026
6545950,615458,Albertus Magnus Falcons,615431,Lakeland Muskies,615458,4,top,"Gio Morales Failed pickoff attempt; Joey O'Hara advanced to third, out at home p to 1b to c.",33,2026-03-12T14:30:00-04:00,"Davenport, FL",0,MBA,2026
6545950,615458,Albertus Magnus Falcons,615431,Lakeland Muskies,615458,4,top,Gio Morales stole second.,34,2026-03-12T14:30:00-04:00,"Davenport, FL",0,MBA,2026
6545950,615458,Albertus Magnus Falcons,615431,Lakeland Muskies,615458,4,top,Baltazar Mesa lined out to rf (0-2 FFF); Gio Morales out at third rf to ss.,35,2026-03-12T14:30:00-04:00,"Davenport, FL",0,MBA,2026
6545950,615458,Albertus Magnus Falcons,615431,Lakeland Muskies,615431,4,bot,Mikey Hernandez flied out to lf (1-1 BF).,36,2026-03-12T14:30:00-04:00,"Davenport, FL",0,MBA,2026
6545950,615458,Albertus Magnus Falcons,615431,Lakeland Muskies,615431,4,bot,Hayden Smith flied out to cf (1-2 BFK).,37,2026-03-12T14:30:00-04:00,"Davenport, FL",0,MBA,2026
6545950,615458,Albertus Magnus Falcons,615431,Lakeland Muskies,615431,4,bot,Chris Day flied out to rf (0-0).,38,2026-03-12T14:30:00-04:00,"Davenport, FL",0,MBA,2026
6545950,615458,Albertus Magnus Falcons,615431,Lakeland Muskies,615458,5,top,Robert Anton popped up to 2b (1-2 FFB).,39,2026-03-12T14:30:00-04:00,"Davenport, FL",0,MBA,2026
6545950,615458,Albertus Magnus Falcons,615431,Lakeland Muskies,615458,5,top,Hunter Sincovic grounded out to p (1-2 FFB).,40,2026-03-12T14:30:00-04:00,"Davenport, FL",0,MBA,2026
6545950,615458,Albertus Magnus Falcons,615431,Lakeland Muskies,615458,5,top,Anthony Abate flied out to cf (0-1 K).,41,2026-03-12T14:30:00-04:00,"Davenport, FL",0,MBA,2026
6545950,615458,Albertus Magnus Falcons,615431,Lakeland Muskies,615431,5,bot,J.T. Cortinas popped up to ss (2-2 BBKF).,42,2026-03-12T14:30:00-04:00,"Davenport, FL",0,MBA,2026
6545950,615458,Albertus Magnus Falcons,615431,Lakeland Muskies,615431,5,bot,"Jordan Domingue reached first on an error by 3b, advanced to second (2-2 BBFS).",43,2026-03-12T14:30:00-04:00,"Davenport, FL",0,MBA,2026
6545950,615458,Albertus Magnus Falcons,615431,Lakeland Muskies,615431,5,bot,Sean Gregorius singled to left field (0-2 SK); Jordan Domingue advanced to third.,44,2026-03-12T14:30:00-04:00,"Davenport, FL",0,MBA,2026
6545950,615458,Albertus Magnus Falcons,615431,Lakeland Muskies,615431,5,bot,"Sean Gregorius stole second; Jordan Domingue scored on an error by c, unearned.",45,2026-03-12T14:30:00-04:00,"Davenport, FL",0,MBA,2026
6545950,615458,Albertus Magnus Falcons,615431,Lakeland Muskies,615431,5,bot,Sean Gregorius advanced to third on a wild pitch.,46,2026-03-12T14:30:00-04:00,"Davenport, FL",0,MBA,2026
6545950,615458,Albertus Magnus Falcons,615431,Lakeland Muskies,615431,5,bot,"Dylan Costello singled to pitcher, bunt, out at second p to c to 3b, RBI (2-1 FBB); Sean Gregorius scored, unearned.",47,2026-03-12T14:30:00-04:00,"Davenport, FL",0,MBA,2026
6545950,615458,Albertus Magnus Falcons,615431,Lakeland Muskies,615431,5,bot,Chris Finn flied out to lf (1-2 FKB).,48,2026-03-12T14:30:00-04:00,"Davenport, FL",0,MBA,2026
6545950,615458,Albertus Magnus Falcons,615431,Lakeland Muskies,615458,6,top,Adriel Espada struck out swinging (0-2 KFS).,49,2026-03-12T14:30:00-04:00,"Davenport, FL",0,MBA,2026
6545950,615458,Albertus Magnus Falcons,615431,Lakeland Muskies,615458,6,top,Mark Whittington singled to center field (1-2 FKBF).,50,2026-03-12T14:30:00-04:00,"Davenport, FL",0,MBA,2026
6545950,615458,Albertus Magnus Falcons,615431,Lakeland Muskies,615458,6,top,Eric Galarza singled to left field (0-0); Mark Whittington advanced to second.,51,2026-03-12T14:30:00-04:00,"Davenport, FL",0,MBA,2026
6545950,615458,Albertus Magnus Falcons,615431,Lakeland Muskies,615458,6,top,Joey O'Hara grounded into double play ss to 2b to 1b (0-1 K); Eric Galarza out on the play; Mark Whittington advanced to third.,52,2026-03-12T14:30:00-04:00,"Davenport, FL",0,MBA,2026
6545950,615458,Albertus Magnus Falcons,615431,Lakeland Muskies,615431,6,bot,Logan South grounded out to 1b unassisted (0-0).,53,2026-03-12T14:30:00-04:00,"Davenport, FL",0,MBA,2026
6545950,615458,Albertus Magnus Falcons,615431,Lakeland Muskies,615431,6,bot,Mikey Hernandez struck out swinging (0-2 KKS).,54,2026-03-12T14:30:00-04:00,"Davenport, FL",0,MBA,2026
6545950,615458,Albertus Magnus Falcons,615431,Lakeland Muskies,615431,6,bot,Hayden Smith walked (3-2 BBSKBB).,55,2026-03-12T14:30:00-04:00,"Davenport, FL",0,MBA,2026
6545950,615458,Albertus Magnus Falcons,615431,Lakeland Muskies,615431,6,bot,Chris Day popped up to 2b (1-0 B).,56,2026-03-12T14:30:00-04:00,"Davenport, FL",0,MBA,2026
6545950,615458,Albertus Magnus Falcons,615431,Lakeland Muskies,615458,7,top,Gio Morales grounded out to 2b (1-0 B).,57,2026-03-12T14:30:00-04:00,"Davenport, FL",0,MBA,2026
6545950,615458,Albertus Magnus Falcons,615431,Lakeland Muskies,615458,7,top,Baltazar Mesa doubled to center field (1-1 BF).,58,2026-03-12T14:30:00-04:00,"Davenport, FL",0,MBA,2026
6545950,615458,Albertus Magnus Falcons,615431,Lakeland Muskies,615458,7,top,Robert Anton flied out to rf (2-2 BFFB).,59,2026-03-12T14:30:00-04:00,"Davenport, FL",0,MBA,2026
6545950,615458,Albertus Magnus Falcons,615431,Lakeland Muskies,615458,7,top,Hunter Sincovic popped up to ss (1-2 BFF).,60,2026-03-12T14:30:00-04:00,"Davenport, FL",0,MBA,2026
6545950,615458,Albertus Magnus Falcons,615431,Lakeland Muskies,615431,7,bot,Hristos Tomczak to p for Peyton Thomas.,61,2026-03-12T14:30:00-04:00,"Davenport, FL",0,MBA,2026
6545950,615458,Albertus Magnus Falcons,615431,Lakeland Muskies,615431,7,bot,J.T. Cortinas walked (3-2 FBSBBFB).,62,2026-03-12T14:30:00-04:00,"Davenport, FL",0,MBA,2026
6545950,615458,Albertus Magnus Falcons,615431,Lakeland Muskies,615431,7,bot,"Jordan Domingue grounded out to p, SAC, bunt (0-0); J.T. Cortinas advanced to second.",63,2026-03-12T14:30:00-04:00,"Davenport, FL",0,MBA,2026
6545950,615458,Albertus Magnus Falcons,615431,Lakeland Muskies,615431,7,bot,Sean Gregorius singled to left field (0-1 F); J.T. Cortinas advanced to third.,64,2026-03-12T14:30:00-04:00,"Davenport, FL",0,MBA,2026
6545950,615458,Albertus Magnus Falcons,615431,Lakeland Muskies,615431,7,bot,Sean Gregorius stole second.,65,2026-03-12T14:30:00-04:00,"Davenport, FL",0,MBA,2026
6545950,615458,Albertus Magnus Falcons,615431,Lakeland Muskies,615431,7,bot,"Dylan Costello flied out to rf, SAC, RBI (1-1 KB); J.T. Cortinas scored.",66,2026-03-12T14:30:00-04:00,"Davenport, FL",0,MBA,2026
6545950,615458,Albertus Magnus Falcons,615431,Lakeland Muskies,615431,7,bot,Chris Finn grounded out to 2b (1-1 FB).,67,2026-03-12T14:30:00-04:00,"Davenport, FL",0,MBA,2026
6545950,615458,Albertus Magnus Falcons,615431,Lakeland Muskies,615458,8,top,Eli Watkins to p for Owen Fekety.,68,2026-03-12T14:30:00-04:00,"Davenport, FL",0,MBA,2026
6545950,615458,Albertus Magnus Falcons,615431,Lakeland Muskies,615458,8,top,Anthony Abate grounded out to ss (0-1 K).,69,2026-03-12T14:30:00-04:00,"Davenport, FL",0,MBA,2026
6545950,615458,Albertus Magnus Falcons,615431,Lakeland Muskies,615458,8,top,Adriel Espada flied out to lf (0-0).,70,2026-03-12T14:30:00-04:00,"Davenport, FL",0,MBA,2026
6545950,615458,Albertus Magnus Falcons,615431,Lakeland Muskies,615458,8,top,Mark Whittington doubled to left field (0-0).,71,2026-03-12T14:30:00-04:00,"Davenport, FL",0,MBA,2026
6545950,615458,Albertus Magnus Falcons,615431,Lakeland Muskies,615458,8,top,"Eric Galarza singled to left field (1-0 B); Mark Whittington advanced to third, out at home lf to c.",72,2026-03-12T14:30:00-04:00,"Davenport, FL",0,MBA,2026
6545950,615458,Albertus Magnus Falcons,615431,Lakeland Muskies,615431,8,bot,Logan South hit by pitch (3-1 KBBH).,73,2026-03-12T14:30:00-04:00,"Davenport, FL",0,MBA,2026
6545950,615458,Albertus Magnus Falcons,615431,Lakeland Muskies,615431,8,bot,"Mikey Hernandez homered to left field, 2 RBI (2-0 BB); Logan South scored.",74,2026-03-12T14:30:00-04:00,"Davenport, FL",0,MBA,2026
6545950,615458,Albertus Magnus Falcons,615431,Lakeland Muskies,615431,8,bot,Hayden Smith flied out to cf (1-1 BK).,75,2026-03-12T14:30:00-04:00,"Davenport, FL",0,MBA,2026
6545950,615458,Albertus Magnus Falcons,615431,Lakeland Muskies,615431,8,bot,Chris Day doubled to center field (3-2 KSBFBB).,76,2026-03-12T14:30:00-04:00,"Davenport, FL",0,MBA,2026
6545950,615458,Albertus Magnus Falcons,615431,Lakeland Muskies,615431,8,bot,J.T. Cortinas flied out to lf (0-0).,77,2026-03-12T14:30:00-04:00,"Davenport, FL",0,MBA,2026
6545950,615458,Albertus Magnus Falcons,615431,Lakeland Muskies,615431,8,bot,Jordan Domingue flied out to cf (0-1 K).,78,2026-03-12T14:30:00-04:00,"Davenport, FL",0,MBA,2026
6545950,615458,Albertus Magnus Falcons,615431,Lakeland Muskies,615458,9,top,Joey O'Hara flied out to rf (1-0 B).,79,2026-03-12T14:30:00-04:00,"Davenport, FL",0,MBA,2026
6545950,615458,Albertus Magnus Falcons,615431,Lakeland Muskies,615458,9,top,Gio Morales reached first on an error by ss (1-0 B).,80,2026-03-12T14:30:00-04:00,"Davenport, FL",0,MBA,2026
6545950,615458,Albertus Magnus Falcons,615431,Lakeland Muskies,615458,9,top,Baltazar Mesa flied out to rf (2-2 KBFBF).,81,2026-03-12T14:30:00-04:00,"Davenport, FL",0,MBA,2026
6545950,615458,Albertus Magnus Falcons,615431,Lakeland Muskies,615458,9,top,Robert Anton reached on a fielder's choice (1-0 B); Gio Morales out at second ss unassisted.,82,2026-03-12T14:30:00-04:00,"Davenport, FL",0,MBA,2026
