game_id,away_team_id,away_team_name,home_team_id,home_team_name,batting_team,inning,top_bot,event_text,event_num,game_datetime,stadium_name,attendance,sport_id,season
6545777,614953,King (TN) Tornado,614929,North Greenville Trailblazers,614953,1,top,L. Janney struck out swinging.,1,2026-02-14T15:00:00-05:00,"Ray & Bea Dillard Field (Tigerville, SC)",120,MBA,2026
6545777,614953,King (TN) Tornado,614929,North Greenville Trailblazers,614953,1,top,C. Rosario grounded out to ss.,2,2026-02-14T15:00:00-05:00,"Ray & Bea Dillard Field (Tigerville, SC)",120,MBA,2026
6545777,614953,King (TN) Tornado,614929,North Greenville Trailblazers,614953,1,top,M. Garcia grounded out to ss.,3,2026-02-14T15:00:00-05:00,"Ray & Bea Dillard Field (Tigerville, SC)",120,MBA,2026
6545777,614953,King (TN) Tornado,614929,North Greenville Trailblazers,614929,1,bot,"T. Powell struck out swinging, out at first c to 1b.",4,2026-02-14T15:00:00-05:00,"Ray & Bea Dillard Field (Tigerville, SC)",120,MBA,2026
6545777,614953,King (TN) Tornado,614929,North Greenville Trailblazers,614929,1,bot,"J. Foulks struck out swinging, out at first c to 1b.",5,2026-02-14T15:00:00-05:00,"Ray & Bea Dillard Field (Tigerville, SC)",120,MBA,2026
6545777,614953,King (TN) Tornado,614929,North Greenville Trailblazers,614929,1,bot,C. Dean singled through the left side.,6,2026-02-14T15:00:00-05:00,"Ray & Bea Dillard Field (Tigerville, SC)",120,MBA,2026
6545777,614953,King (TN) Tornado,614929,North Greenville Trailblazers,614929,1,bot,L. McGaha struck out looking.,7,2026-02-14T15:00:00-05:00,"Ray & Bea Dillard Field (Tigerville, SC)",120,MBA,2026
6545777,614953,King (TN) Tornado,614929,North Greenville Trailblazers,614953,2,top,T. Regan singled up the middle.,8,2026-02-14T15:00:00-05:00,"Ray & Bea Dillard Field (Tigerville, SC)",120,MBA,2026
6545777,614953,King (TN) Tornado,614929,North Greenville Trailblazers,614953,2,top,K. Richardso singled to left field3a T. Regan advanced to second.,9,2026-02-14T15:00:00-05:00,"Ray & Bea Dillard Field (Tigerville, SC)",120,MBA,2026
6545777,614953,King (TN) Tornado,614929,North Greenville Trailblazers,614953,2,top,"K. Hirschfel reached on a fielder's choice to first base, bunt3a K. Richardso advanced to second3a T. Regan advanced to third.",10,2026-02-14T15:00:00-05:00,"Ray & Bea Dillard Field (Tigerville, SC)",120,MBA,2026
6545777,614953,King (TN) Tornado,614929,North Greenville Trailblazers,614953,2,top,"A. Vidal doubled to right center, 2 RBI3a K. Hirschfel advanced to third3a K. Richardso scored3a T. Regan scored.",11,2026-02-14T15:00:00-05:00,"Ray & Bea Dillard Field (Tigerville, SC)",120,MBA,2026
6545777,614953,King (TN) Tornado,614929,North Greenville Trailblazers,614953,2,top,"D. Adams singled to right field, RBI3a A. Vidal advanced to third3a K. Hirschfel scored.",12,2026-02-14T15:00:00-05:00,"Ray & Bea Dillard Field (Tigerville, SC)",120,MBA,2026
6545777,614953,King (TN) Tornado,614929,North Greenville Trailblazers,614953,2,top,"J. Ruiz grounded out to p, SAC, bunt, RBI3a D. Adams advanced to second3a A. Vidal scored.",13,2026-02-14T15:00:00-05:00,"Ray & Bea Dillard Field (Tigerville, SC)",120,MBA,2026
6545777,614953,King (TN) Tornado,614929,North Greenville Trailblazers,614953,2,top,L. Janney hit by pitch.,14,2026-02-14T15:00:00-05:00,"Ray & Bea Dillard Field (Tigerville, SC)",120,MBA,2026
6545777,614953,King (TN) Tornado,614929,North Greenville Trailblazers,614953,2,top,"C. Rosario singled to right field, advanced to second on the throw3a L. Janney advanced to third3a D. Adams advanced to third, out at home rf to c.",15,2026-02-14T15:00:00-05:00,"Ray & Bea Dillard Field (Tigerville, SC)",120,MBA,2026
6545777,614953,King (TN) Tornado,614929,North Greenville Trailblazers,614953,2,top,"M. Garcia doubled to left center, 2 RBI3a C. Rosario scored3a L. Janney scored.",16,2026-02-14T15:00:00-05:00,"Ray & Bea Dillard Field (Tigerville, SC)",120,MBA,2026
6545777,614953,King (TN) Tornado,614929,North Greenville Trailblazers,614953,2,top,T. Regan singled to right field3a M. Garcia advanced to third.,17,2026-02-14T15:00:00-05:00,"Ray & Bea Dillard Field (Tigerville, SC)",120,MBA,2026
6545777,614953,King (TN) Tornado,614929,North Greenville Trailblazers,614953,2,top,K. Richardso struck out swinging.,18,2026-02-14T15:00:00-05:00,"Ray & Bea Dillard Field (Tigerville, SC)",120,MBA,2026
6545777,614953,King (TN) Tornado,614929,North Greenville Trailblazers,614929,2,bot,J. Pospisil hit by pitch.,19,2026-02-14T15:00:00-05:00,"Ray & Bea Dillard Field (Tigerville, SC)",120,MBA,2026
6545777,614953,King (TN) Tornado,614929,North Greenville Trailblazers,614929,2,bot,K. Tullos struck out looking.,20,2026-02-14T15:00:00-05:00,"Ray & Bea Dillard Field (Tigerville, SC)",120,MBA,2026
6545777,614953,King (TN) Tornado,614929,North Greenville Trailblazers,614929,2,bot,C. McKee reached first on a throwing error by 3b3a J. Pospisil advanced to second.,21,2026-02-14T15:00:00-05:00,"Ray & Bea Dillard Field (Tigerville, SC)",120,MBA,2026
6545777,614953,King (TN) Tornado,614929,North Greenville Trailblazers,614929,2,bot,D. Whitaker popped up to 3b.,22,2026-02-14T15:00:00-05:00,"Ray & Bea Dillard Field (Tigerville, SC)",120,MBA,2026
6545777,614953,King (TN) Tornado,614929,North Greenville Trailblazers,614929,2,bot,M. Swinney walked3a C. McKee advanced to second3a J. Pospisil advanced to third.,23,2026-02-14T15:00:00-05:00,"Ray & Bea Dillard Field (Tigerville, SC)",120,MBA,2026
6545777,614953,King (TN) Tornado,614929,North Greenville Trailblazers,614929,2,bot,T. Powell fouled out to rf.,24,2026-02-14T15:00:00-05:00,"Ray & Bea Dillard Field (Tigerville, SC)",120,MBA,2026
6545777,614953,King (TN) Tornado,614929,North Greenville Trailblazers,614953,3,top,K. Herlong to p for B. Price.,25,2026-02-14T15:00:00-05:00,"Ray & Bea Dillard Field (Tigerville, SC)",120,MBA,2026
6545777,614953,King (TN) Tornado,614929,North Greenville Trailblazers,614953,3,top,K. Hirschfel struck out looking.,26,2026-02-14T15:00:00-05:00,"Ray & Bea Dillard Field (Tigerville, SC)",120,MBA,2026
6545777,614953,King (TN) Tornado,614929,North Greenville Trailblazers,614953,3,top,A. Vidal singled up the middle.,27,2026-02-14T15:00:00-05:00,"Ray & Bea Dillard Field (Tigerville, SC)",120,MBA,2026
6545777,614953,King (TN) Tornado,614929,North Greenville Trailblazers,614953,3,top,A. Vidal advanced to second on a balk.,28,2026-02-14T15:00:00-05:00,"Ray & Bea Dillard Field (Tigerville, SC)",120,MBA,2026
6545777,614953,King (TN) Tornado,614929,North Greenville Trailblazers,614953,3,top,D. Adams struck out swinging.,29,2026-02-14T15:00:00-05:00,"Ray & Bea Dillard Field (Tigerville, SC)",120,MBA,2026
6545777,614953,King (TN) Tornado,614929,North Greenville Trailblazers,614953,3,top,J. Ruiz grounded out to 3b.,30,2026-02-14T15:00:00-05:00,"Ray & Bea Dillard Field (Tigerville, SC)",120,MBA,2026
6545777,614953,King (TN) Tornado,614929,North Greenville Trailblazers,614929,3,bot,J. Foulks flied out to rf.,31,2026-02-14T15:00:00-05:00,"Ray & Bea Dillard Field (Tigerville, SC)",120,MBA,2026
6545777,614953,King (TN) Tornado,614929,North Greenville Trailblazers,614929,3,bot,C. Dean grounded out to ss.,32,2026-02-14T15:00:00-05:00,"Ray & Bea Dillard Field (Tigerville, SC)",120,MBA,2026
6545777,614953,King (TN) Tornado,614929,North Greenville Trailblazers,614929,3,bot,L. McGaha grounded out to 2b.,33,2026-02-14T15:00:00-05:00,"Ray & Bea Dillard Field (Tigerville, SC)",120,MBA,2026
6545777,614953,King (TN) Tornado,614929,North Greenville Trailblazers,614953,4,top,L. Janney grounded out to ss.,34,2026-02-14T15:00:00-05:00,"Ray & Bea Dillard Field (Tigerville, SC)",120,MBA,2026
6545777,614953,King (TN) Tornado,614929,North Greenville Trailblazers,614953,4,top,C. Rosario struck out swinging.,35,2026-02-14T15:00:00-05:00,"Ray & Bea Dillard Field (Tigerville, SC)",120,MBA,2026
6545777,614953,King (TN) Tornado,614929,North Greenville Trailblazers,614953,4,top,M. Garcia walked.,36,2026-02-14T15:00:00-05:00,"Ray & Bea Dillard Field (Tigerville, SC)",120,MBA,2026
6545777,614953,King (TN) Tornado,614929,North Greenville Trailblazers,614953,4,top,T. Regan singled through the left side3a M. Garcia advanced to second.,37,2026-02-14T15:00:00-05:00,"Ray & Bea Dillard Field (Tigerville, SC)",120,MBA,2026
6545777,614953,King (TN) Tornado,614929,North Greenville Trailblazers,614953,4,top,"K. Richardso homered to left field, 3 RBI3a T. Regan scored3a M. Garcia scored.",38,2026-02-14T15:00:00-05:00,"Ray & Bea Dillard Field (Tigerville, SC)",120,MBA,2026
6545777,614953,King (TN) Tornado,614929,North Greenville Trailblazers,614953,4,top,K. Hirschfel struck out looking.,39,2026-02-14T15:00:00-05:00,"Ray & Bea Dillard Field (Tigerville, SC)",120,MBA,2026
6545777,614953,King (TN) Tornado,614929,North Greenville Trailblazers,614929,4,bot,J. Pospisil grounded out to 3b.,40,2026-02-14T15:00:00-05:00,"Ray & Bea Dillard Field (Tigerville, SC)",120,MBA,2026
6545777,614953,King (TN) Tornado,614929,North Greenville Trailblazers,614929,4,bot,K. Tullos walked.,41,2026-02-14T15:00:00-05:00,"Ray & Bea Dillard Field (Tigerville, SC)",120,MBA,2026
6545777,614953,King (TN) Tornado,614929,North Greenville Trailblazers,614929,4,bot,C. McKee struck out looking.,42,2026-02-14T15:00:00-05:00,"Ray & Bea Dillard Field (Tigerville, SC)",120,MBA,2026
6545777,614953,King (TN) Tornado,614929,North Greenville Trailblazers,614929,4,bot,D. Whitaker popped up to 1b.,43,2026-02-14T15:00:00-05:00,"Ray & Bea Dillard Field (Tigerville, SC)",120,MBA,2026
6545777,614953,King (TN) Tornado,614929,North Greenville Trailblazers,614953,5,top,C. Cox to p for K. Herlong.,44,2026-02-14T15:00:00-05:00,"Ray & Bea Dillard Field (Tigerville, SC)",120,MBA,2026
6545777,614953,King (TN) Tornado,614929,North Greenville Trailblazers,614953,5,top,A. Vidal walked.,45,2026-02-14T15:00:00-05:00,"Ray & Bea Dillard Field (Tigerville, SC)",120,MBA,2026
6545777,614953,King (TN) Tornado,614929,North Greenville Trailblazers,614953,5,top,D. Adams doubled to left field3a A. Vidal advanced to third.,46,2026-02-14T15:00:00-05:00,"Ray & Bea Dillard Field (Tigerville, SC)",120,MBA,2026
6545777,614953,King (TN) Tornado,614929,North Greenville Trailblazers,614953,5,top,J. Ruiz struck out looking.,47,2026-02-14T15:00:00-05:00,"Ray & Bea Dillard Field (Tigerville, SC)",120,MBA,2026
6545777,614953,King (TN) Tornado,614929,North Greenville Trailblazers,614953,5,top,L. Janney walked.,48,2026-02-14T15:00:00-05:00,"Ray & Bea Dillard Field (Tigerville, SC)",120,MBA,2026
6545777,614953,King (TN) Tornado,614929,North Greenville Trailblazers,614953,5,top,C. Rosario grounded into double play 2b to ss to 1b3a L. Janney out on the play.,49,2026-02-14T15:00:00-05:00,"Ray & Bea Dillard Field (Tigerville, SC)",120,MBA,2026
6545777,614953,King (TN) Tornado,614929,North Greenville Trailblazers,614929,5,bot,M. Swinney flied out to rf.,50,2026-02-14T15:00:00-05:00,"Ray & Bea Dillard Field (Tigerville, SC)",120,MBA,2026
6545777,614953,King (TN) Tornado,614929,North Greenville Trailblazers,614929,5,bot,T. Powell tripled down the lf line.,51,2026-02-14T15:00:00-05:00,"Ray & Bea Dillard Field (Tigerville, SC)",120,MBA,2026
6545777,614953,King (TN) Tornado,614929,North Greenville Trailblazers,614929,5,bot,"J. Foulks singled up the middle, RBI3a T. Powell scored.",52,2026-02-14T15:00:00-05:00,"Ray & Bea Dillard Field (Tigerville, SC)",120,MBA,2026
6545777,614953,King (TN) Tornado,614929,North Greenville Trailblazers,614929,5,bot,J. Foulks stole second.,53,2026-02-14T15:00:00-05:00,"Ray & Bea Dillard Field (Tigerville, SC)",120,MBA,2026
6545777,614953,King (TN) Tornado,614929,North Greenville Trailblazers,614929,5,bot,"C. Dean doubled down the lf line, RBI3a J. Foulks scored.",54,2026-02-14T15:00:00-05:00,"Ray & Bea Dillard Field (Tigerville, SC)",120,MBA,2026
6545777,614953,King (TN) Tornado,614929,North Greenville Trailblazers,614929,5,bot,L. McGaha grounded out to 3b.,55,2026-02-14T15:00:00-05:00,"Ray & Bea Dillard Field (Tigerville, SC)",120,MBA,2026
6545777,614953,King (TN) Tornado,614929,North Greenville Trailblazers,614929,5,bot,D. Willis to p for M. Kahlenber.,56,2026-02-14T15:00:00-05:00,"Ray & Bea Dillard Field (Tigerville, SC)",120,MBA,2026
6545777,614953,King (TN) Tornado,614929,North Greenville Trailblazers,614929,5,bot,J. Pospisil struck out swinging.,57,2026-02-14T15:00:00-05:00,"Ray & Bea Dillard Field (Tigerville, SC)",120,MBA,2026
6545777,614953,King (TN) Tornado,614929,North Greenville Trailblazers,614953,6,top,M. Garcia grounded out to 2b.,58,2026-02-14T15:00:00-05:00,"Ray & Bea Dillard Field (Tigerville, SC)",120,MBA,2026
6545777,614953,King (TN) Tornado,614929,North Greenville Trailblazers,614953,6,top,T. Regan struck out looking.,59,2026-02-14T15:00:00-05:00,"Ray & Bea Dillard Field (Tigerville, SC)",120,MBA,2026
6545777,614953,King (TN) Tornado,614929,North Greenville Trailblazers,614953,6,top,K. Richardso walked.,60,2026-02-14T15:00:00-05:00,"Ray & Bea Dillard Field (Tigerville, SC)",120,MBA,2026
6545777,614953,King (TN) Tornado,614929,North Greenville Trailblazers,614953,6,top,"K. Hirschfel homered to left field, 2 RBI3a K. Richardso scored.",61,2026-02-14T15:00:00-05:00,"Ray & Bea Dillard Field (Tigerville, SC)",120,MBA,2026
6545777,614953,King (TN) Tornado,614929,North Greenville Trailblazers,614953,6,top,A. Vidal struck out swinging.,62,2026-02-14T15:00:00-05:00,"Ray & Bea Dillard Field (Tigerville, SC)",120,MBA,2026
6545777,614953,King (TN) Tornado,614929,North Greenville Trailblazers,614929,6,bot,K. Tullos grounded out to ss.,63,2026-02-14T15:00:00-05:00,"Ray & Bea Dillard Field (Tigerville, SC)",120,MBA,2026
6545777,614953,King (TN) Tornado,614929,North Greenville Trailblazers,614929,6,bot,C. McKee singled to second base.,64,2026-02-14T15:00:00-05:00,"Ray & Bea Dillard Field (Tigerville, SC)",120,MBA,2026
6545777,614953,King (TN) Tornado,614929,North Greenville Trailblazers,614929,6,bot,J. Dawkins pinch hit for D. Whitaker.,65,2026-02-14T15:00:00-05:00,"Ray & Bea Dillard Field (Tigerville, SC)",120,MBA,2026
6545777,614953,King (TN) Tornado,614929,North Greenville Trailblazers,614929,6,bot,H. Dryden pinch ran for C. McKee.,66,2026-02-14T15:00:00-05:00,"Ray & Bea Dillard Field (Tigerville, SC)",120,MBA,2026
6545777,614953,King (TN) Tornado,614929,North Greenville Trailblazers,614929,6,bot,J. Dawkins struck out swinging.,67,2026-02-14T15:00:00-05:00,"Ray & Bea Dillard Field (Tigerville, SC)",120,MBA,2026
6545777,614953,King (TN) Tornado,614929,North Greenville Trailblazers,614929,6,bot,M. Swinney flied out to rf.,68,2026-02-14T15:00:00-05:00,"Ray & Bea Dillard Field (Tigerville, SC)",120,MBA,2026
6545777,614953,King (TN) Tornado,614929,North Greenville Trailblazers,614953,7,top,S. Hegler to c for H. Dryden.,69,2026-02-14T15:00:00-05:00,"Ray & Bea Dillard Field (Tigerville, SC)",120,MBA,2026
6545777,614953,King (TN) Tornado,614929,North Greenville Trailblazers,614953,7,top,J. Dawkins to lf.,70,2026-02-14T15:00:00-05:00,"Ray & Bea Dillard Field (Tigerville, SC)",120,MBA,2026
6545777,614953,King (TN) Tornado,614929,North Greenville Trailblazers,614953,7,top,K. Roach to p for C. Cox.,71,2026-02-14T15:00:00-05:00,"Ray & Bea Dillard Field (Tigerville, SC)",120,MBA,2026
6545777,614953,King (TN) Tornado,614929,North Greenville Trailblazers,614953,7,top,D. Adams grounded out to 3b.,72,2026-02-14T15:00:00-05:00,"Ray & Bea Dillard Field (Tigerville, SC)",120,MBA,2026
6545777,614953,King (TN) Tornado,614929,North Greenville Trailblazers,614953,7,top,J. Ruiz grounded out to 2b.,73,2026-02-14T15:00:00-05:00,"Ray & Bea Dillard Field (Tigerville, SC)",120,MBA,2026
6545777,614953,King (TN) Tornado,614929,North Greenville Trailblazers,614953,7,top,L. Janney grounded out to 2b.,74,2026-02-14T15:00:00-05:00,"Ray & Bea Dillard Field (Tigerville, SC)",120,MBA,2026
6545777,614953,King (TN) Tornado,614929,North Greenville Trailblazers,614929,7,bot,T. Powell struck out looking.,75,2026-02-14T15:00:00-05:00,"Ray & Bea Dillard Field (Tigerville, SC)",120,MBA,2026
6545777,614953,King (TN) Tornado,614929,North Greenville Trailblazers,614929,7,bot,J. Foulks flied out to rf.,76,2026-02-14T15:00:00-05:00,"Ray & Bea Dillard Field (Tigerville, SC)",120,MBA,2026
6545777,614953,King (TN) Tornado,614929,North Greenville Trailblazers,614929,7,bot,C. Dean grounded out to ss.,77,2026-02-14T15:00:00-05:00,"Ray & Bea Dillard Field (Tigerville, SC)",120,MBA,2026
6545777,614953,King (TN) Tornado,614929,North Greenville Trailblazers,614953,8,top,C. Rosario singled through the right side.,78,2026-02-14T15:00:00-05:00,"Ray & Bea Dillard Field (Tigerville, SC)",120,MBA,2026
6545777,614953,King (TN) Tornado,614929,North Greenville Trailblazers,614953,8,top,M. Garcia walked3a C. Rosario advanced to second.,79,2026-02-14T15:00:00-05:00,"Ray & Bea Dillard Field (Tigerville, SC)",120,MBA,2026
6545777,614953,King (TN) Tornado,614929,North Greenville Trailblazers,614953,8,top,"T. Regan popped up to p, bunt.",80,2026-02-14T15:00:00-05:00,"Ray & Bea Dillard Field (Tigerville, SC)",120,MBA,2026
6545777,614953,King (TN) Tornado,614929,North Greenville Trailblazers,614953,8,top,"M. Garcia advanced to second3a C. Rosario out at second p to 2b to 3b to ss, picked off.",81,2026-02-14T15:00:00-05:00,"Ray & Bea Dillard Field (Tigerville, SC)",120,MBA,2026
6545777,614953,King (TN) Tornado,614929,North Greenville Trailblazers,614953,8,top,J. Witcher pinch ran for M. Garcia.,82,2026-02-14T15:00:00-05:00,"Ray & Bea Dillard Field (Tigerville, SC)",120,MBA,2026
6545777,614953,King (TN) Tornado,614929,North Greenville Trailblazers,614953,8,top,K. Richardso struck out swinging.,83,2026-02-14T15:00:00-05:00,"Ray & Bea Dillard Field (Tigerville, SC)",120,MBA,2026
6545777,614953,King (TN) Tornado,614929,North Greenville Trailblazers,614929,8,bot,L. McGaha grounded out to ss.,84,2026-02-14T15:00:00-05:00,"Ray & Bea Dillard Field (Tigerville, SC)",120,MBA,2026
6545777,614953,King (TN) Tornado,614929,North Greenville Trailblazers,614929,8,bot,J. Pospisil hit by pitch.,85,2026-02-14T15:00:00-05:00,"Ray & Bea Dillard Field (Tigerville, SC)",120,MBA,2026
6545777,614953,King (TN) Tornado,614929,North Greenville Trailblazers,614929,8,bot,K. Tullos singled up the middle3a J. Pospisil advanced to second.,86,2026-02-14T15:00:00-05:00,"Ray & Bea Dillard Field (Tigerville, SC)",120,MBA,2026
6545777,614953,King (TN) Tornado,614929,North Greenville Trailblazers,614929,8,bot,K. Pomeroy to p for D. Willis.,87,2026-02-14T15:00:00-05:00,"Ray & Bea Dillard Field (Tigerville, SC)",120,MBA,2026
6545777,614953,King (TN) Tornado,614929,North Greenville Trailblazers,614929,8,bot,S. Hegler grounded out to 2b3a K. Tullos advanced to second3a J. Pospisil advanced to third.,88,2026-02-14T15:00:00-05:00,"Ray & Bea Dillard Field (Tigerville, SC)",120,MBA,2026
6545777,614953,King (TN) Tornado,614929,North Greenville Trailblazers,614929,8,bot,K. Tullos advanced to third3a J. Pospisil scored on a wild pitch.,89,2026-02-14T15:00:00-05:00,"Ray & Bea Dillard Field (Tigerville, SC)",120,MBA,2026
6545777,614953,King (TN) Tornado,614929,North Greenville Trailblazers,614929,8,bot,J. Dawkins hit by pitch.,90,2026-02-14T15:00:00-05:00,"Ray & Bea Dillard Field (Tigerville, SC)",120,MBA,2026
6545777,614953,King (TN) Tornado,614929,North Greenville Trailblazers,614929,8,bot,M. Swinney walked3a J. Dawkins advanced to second.,91,2026-02-14T15:00:00-05:00,"Ray & Bea Dillard Field (Tigerville, SC)",120,MBA,2026
6545777,614953,King (TN) Tornado,614929,North Greenville Trailblazers,614929,8,bot,"T. Powell singled through the left side, 2 RBI3a M. Swinney advanced to second3a J. Dawkins scored3a K. Tullos scored.",92,2026-02-14T15:00:00-05:00,"Ray & Bea Dillard Field (Tigerville, SC)",120,MBA,2026
6545777,614953,King (TN) Tornado,614929,North Greenville Trailblazers,614929,8,bot,J. Webster to p for K. Pomeroy.,93,2026-02-14T15:00:00-05:00,"Ray & Bea Dillard Field (Tigerville, SC)",120,MBA,2026
6545777,614953,King (TN) Tornado,614929,North Greenville Trailblazers,614929,8,bot,J. Foulks struck out looking.,94,2026-02-14T15:00:00-05:00,"Ray & Bea Dillard Field (Tigerville, SC)",120,MBA,2026
6545777,614953,King (TN) Tornado,614929,North Greenville Trailblazers,614953,9,top,W. Evans to p for K. Roach.,95,2026-02-14T15:00:00-05:00,"Ray & Bea Dillard Field (Tigerville, SC)",120,MBA,2026
6545777,614953,King (TN) Tornado,614929,North Greenville Trailblazers,614953,9,top,K. Hirschfel grounded out to 2b.,96,2026-02-14T15:00:00-05:00,"Ray & Bea Dillard Field (Tigerville, SC)",120,MBA,2026
6545777,614953,King (TN) Tornado,614929,North Greenville Trailblazers,614953,9,top,A. Vidal walked.,97,2026-02-14T15:00:00-05:00,"Ray & Bea Dillard Field (Tigerville, SC)",120,MBA,2026
6545777,614953,King (TN) Tornado,614929,North Greenville Trailblazers,614953,9,top,A. Vidal advanced to second on a wild pitch.,98,2026-02-14T15:00:00-05:00,"Ray & Bea Dillard Field (Tigerville, SC)",120,MBA,2026
6545777,614953,King (TN) Tornado,614929,North Greenville Trailblazers,614953,9,top,D. Adams struck out looking.,99,2026-02-14T15:00:00-05:00,"Ray & Bea Dillard Field (Tigerville, SC)",120,MBA,2026
6545777,614953,King (TN) Tornado,614929,North Greenville Trailblazers,614953,9,top,J. Ruiz flied out to rf.,100,2026-02-14T15:00:00-05:00,"Ray & Bea Dillard Field (Tigerville, SC)",120,MBA,2026
6545777,614953,King (TN) Tornado,614929,North Greenville Trailblazers,614929,9,bot,"C. Dean struck out swinging, out at first c to 1b.",101,2026-02-14T15:00:00-05:00,"Ray & Bea Dillard Field (Tigerville, SC)",120,MBA,2026
6545777,614953,King (TN) Tornado,614929,North Greenville Trailblazers,614929,9,bot,L. McGaha grounded out to ss.,102,2026-02-14T15:00:00-05:00,"Ray & Bea Dillard Field (Tigerville, SC)",120,MBA,2026
6545777,614953,King (TN) Tornado,614929,North Greenville Trailblazers,614929,9,bot,J. Pospisil popped up to ss.,103,2026-02-14T15:00:00-05:00,"Ray & Bea Dillard Field (Tigerville, SC)",120,MBA,2026
