game_id,away_team_id,away_team_name,home_team_id,home_team_name,batting_team,inning,top_bot,event_text,event_num,game_datetime,stadium_name,attendance,sport_id,season
6545481,615483,JWU (Providence) Wildcats,615370,Ursinus Bears,615483,1,top,Ryan Ducey lined out to rf (1-1 KB).,1,2026-03-14T17:30:00-04:00,"Lexington, SC",0,MBA,2026
6545481,615483,JWU (Providence) Wildcats,615370,Ursinus Bears,615483,1,top,Jack Obert flied out to cf (3-1 BKBB).,2,2026-03-14T17:30:00-04:00,"Lexington, SC",0,MBA,2026
6545481,615483,JWU (Providence) Wildcats,615370,Ursinus Bears,615483,1,top,Jack Dwyer flied out to rf (3-2 BFBFB).,3,2026-03-14T17:30:00-04:00,"Lexington, SC",0,MBA,2026
6545481,615483,JWU (Providence) Wildcats,615370,Ursinus Bears,615370,1,bot,Brandon Sullivan doubled down the lf line (1-2 KKB).,4,2026-03-14T17:30:00-04:00,"Lexington, SC",0,MBA,2026
6545481,615483,JWU (Providence) Wildcats,615370,Ursinus Bears,615370,1,bot,Matthew Callahan out at first 1b to p (0-1 K); Brandon Sullivan advanced to third.,5,2026-03-14T17:30:00-04:00,"Lexington, SC",0,MBA,2026
6545481,615483,JWU (Providence) Wildcats,615370,Ursinus Bears,615370,1,bot,Luke Kopec hit by pitch (1-1 KH).,6,2026-03-14T17:30:00-04:00,"Lexington, SC",0,MBA,2026
6545481,615483,JWU (Providence) Wildcats,615370,Ursinus Bears,615370,1,bot,"Shane Beaver singled to right center, RBI (0-0); Luke Kopec advanced to third; Brandon Sullivan scored.",7,2026-03-14T17:30:00-04:00,"Lexington, SC",0,MBA,2026
6545481,615483,JWU (Providence) Wildcats,615370,Ursinus Bears,615370,1,bot,Shane Beaver stole second.,8,2026-03-14T17:30:00-04:00,"Lexington, SC",0,MBA,2026
6545481,615483,JWU (Providence) Wildcats,615370,Ursinus Bears,615370,1,bot,"Isaac Gesford grounded out to 2b, RBI (2-2 FBFBF); Shane Beaver advanced to third; Luke Kopec scored.",9,2026-03-14T17:30:00-04:00,"Lexington, SC",0,MBA,2026
6545481,615483,JWU (Providence) Wildcats,615370,Ursinus Bears,615370,1,bot,Brett Barrett flied out to rf (0-1 K).,10,2026-03-14T17:30:00-04:00,"Lexington, SC",0,MBA,2026
6545481,615483,JWU (Providence) Wildcats,615370,Ursinus Bears,615483,2,top,Jeff Valdez Jimenez grounded out to ss (0-1 K).,11,2026-03-14T17:30:00-04:00,"Lexington, SC",0,MBA,2026
6545481,615483,JWU (Providence) Wildcats,615370,Ursinus Bears,615483,2,top,"Justin Hernandez doubled down the rf line, advanced to third on an error by rf (0-0).",12,2026-03-14T17:30:00-04:00,"Lexington, SC",0,MBA,2026
6545481,615483,JWU (Providence) Wildcats,615370,Ursinus Bears,615483,2,top,Diego Taveras popped up to 2b (3-1 BBKB).,13,2026-03-14T17:30:00-04:00,"Lexington, SC",0,MBA,2026
6545481,615483,JWU (Providence) Wildcats,615370,Ursinus Bears,615483,2,top,Jeremy Auren grounded out to 2b (0-1 K).,14,2026-03-14T17:30:00-04:00,"Lexington, SC",0,MBA,2026
6545481,615483,JWU (Providence) Wildcats,615370,Ursinus Bears,615370,2,bot,Devin Fogg flied out to lf down the lf line (2-2 SFBB).,15,2026-03-14T17:30:00-04:00,"Lexington, SC",0,MBA,2026
6545481,615483,JWU (Providence) Wildcats,615370,Ursinus Bears,615370,2,bot,George Nestor struck out swinging (1-2 SSBS).,16,2026-03-14T17:30:00-04:00,"Lexington, SC",0,MBA,2026
6545481,615483,JWU (Providence) Wildcats,615370,Ursinus Bears,615370,2,bot,Kyle Rosenfeld reached first on an error by ss (0-0).,17,2026-03-14T17:30:00-04:00,"Lexington, SC",0,MBA,2026
6545481,615483,JWU (Providence) Wildcats,615370,Ursinus Bears,615370,2,bot,Brandon Sullivan singled up the middle (0-1 F); Kyle Rosenfeld advanced to third.,18,2026-03-14T17:30:00-04:00,"Lexington, SC",0,MBA,2026
6545481,615483,JWU (Providence) Wildcats,615370,Ursinus Bears,615370,2,bot,Brandon Sullivan stole second.,19,2026-03-14T17:30:00-04:00,"Lexington, SC",0,MBA,2026
6545481,615483,JWU (Providence) Wildcats,615370,Ursinus Bears,615370,2,bot,"Matthew Callahan singled to third base, RBI (2-2 BKKFBF); Brandon Sullivan advanced to third; Kyle Rosenfeld scored, unearned.",20,2026-03-14T17:30:00-04:00,"Lexington, SC",0,MBA,2026
6545481,615483,JWU (Providence) Wildcats,615370,Ursinus Bears,615370,2,bot,Luke Kopec flied out to rf (1-2 FBK).,21,2026-03-14T17:30:00-04:00,"Lexington, SC",0,MBA,2026
6545481,615483,JWU (Providence) Wildcats,615370,Ursinus Bears,615483,3,top,Gianni Melendez grounded out to ss (0-2 FK).,22,2026-03-14T17:30:00-04:00,"Lexington, SC",0,MBA,2026
6545481,615483,JWU (Providence) Wildcats,615370,Ursinus Bears,615483,3,top,Sam Schoenberg struck out swinging (1-2 FBKS).,23,2026-03-14T17:30:00-04:00,"Lexington, SC",0,MBA,2026
6545481,615483,JWU (Providence) Wildcats,615370,Ursinus Bears,615483,3,top,Ryan Ducey struck out looking (0-2 KFK).,24,2026-03-14T17:30:00-04:00,"Lexington, SC",0,MBA,2026
6545481,615483,JWU (Providence) Wildcats,615370,Ursinus Bears,615370,3,bot,Shane Beaver walked (3-1 BFBBB).,25,2026-03-14T17:30:00-04:00,"Lexington, SC",0,MBA,2026
6545481,615483,JWU (Providence) Wildcats,615370,Ursinus Bears,615370,3,bot,Isaac Gesford struck out looking (1-2 FKBFK).,26,2026-03-14T17:30:00-04:00,"Lexington, SC",0,MBA,2026
6545481,615483,JWU (Providence) Wildcats,615370,Ursinus Bears,615370,3,bot,Brett Barrett reached on a fielder's choice (0-1 K); Shane Beaver out at second ss to 2b.,27,2026-03-14T17:30:00-04:00,"Lexington, SC",0,MBA,2026
6545481,615483,JWU (Providence) Wildcats,615370,Ursinus Bears,615370,3,bot,Devin Fogg flied out to cf (0-1 K).,28,2026-03-14T17:30:00-04:00,"Lexington, SC",0,MBA,2026
6545481,615483,JWU (Providence) Wildcats,615370,Ursinus Bears,615483,4,top,Jack Obert flied out to cf (0-1 K).,29,2026-03-14T17:30:00-04:00,"Lexington, SC",0,MBA,2026
6545481,615483,JWU (Providence) Wildcats,615370,Ursinus Bears,615483,4,top,Jack Dwyer flied out to cf (1-0 B).,30,2026-03-14T17:30:00-04:00,"Lexington, SC",0,MBA,2026
6545481,615483,JWU (Providence) Wildcats,615370,Ursinus Bears,615483,4,top,Jeff Valdez Jimenez grounded out to ss (1-1 KB).,31,2026-03-14T17:30:00-04:00,"Lexington, SC",0,MBA,2026
6545481,615483,JWU (Providence) Wildcats,615370,Ursinus Bears,615370,4,bot,George Nestor singled to center field (0-2 KK).,32,2026-03-14T17:30:00-04:00,"Lexington, SC",0,MBA,2026
6545481,615483,JWU (Providence) Wildcats,615370,Ursinus Bears,615370,4,bot,"Kyle Rosenfeld grounded out to p, SAC, bunt (1-0 B); George Nestor advanced to second.",33,2026-03-14T17:30:00-04:00,"Lexington, SC",0,MBA,2026
6545481,615483,JWU (Providence) Wildcats,615370,Ursinus Bears,615370,4,bot,Brandon Sullivan hit by pitch (3-2 BFSBFH).,34,2026-03-14T17:30:00-04:00,"Lexington, SC",0,MBA,2026
6545481,615483,JWU (Providence) Wildcats,615370,Ursinus Bears,615370,4,bot,Matthew Callahan grounded out to 3b (3-2 BKKBB); Brandon Sullivan advanced to second; George Nestor advanced to third.,35,2026-03-14T17:30:00-04:00,"Lexington, SC",0,MBA,2026
6545481,615483,JWU (Providence) Wildcats,615370,Ursinus Bears,615370,4,bot,Luke Kopec grounded out to ss (0-0).,36,2026-03-14T17:30:00-04:00,"Lexington, SC",0,MBA,2026
6545481,615483,JWU (Providence) Wildcats,615370,Ursinus Bears,615483,5,top,Justin Hernandez doubled down the lf line (1-2 KSB).,37,2026-03-14T17:30:00-04:00,"Lexington, SC",0,MBA,2026
6545481,615483,JWU (Providence) Wildcats,615370,Ursinus Bears,615483,5,top,Diego Taveras singled to right field (3-1 BBFB); Justin Hernandez advanced to third.,38,2026-03-14T17:30:00-04:00,"Lexington, SC",0,MBA,2026
6545481,615483,JWU (Providence) Wildcats,615370,Ursinus Bears,615483,5,top,Jeremy Auren struck out swinging (0-2 KKFFS).,39,2026-03-14T17:30:00-04:00,"Lexington, SC",0,MBA,2026
6545481,615483,JWU (Providence) Wildcats,615370,Ursinus Bears,615483,5,top,Diego Taveras advanced to second on a passed ball; Justin Hernandez scored on a passed ball.,40,2026-03-14T17:30:00-04:00,"Lexington, SC",0,MBA,2026
6545481,615483,JWU (Providence) Wildcats,615370,Ursinus Bears,615483,5,top,Gianni Melendez flied out to cf (2-2 KBBF).,41,2026-03-14T17:30:00-04:00,"Lexington, SC",0,MBA,2026
6545481,615483,JWU (Providence) Wildcats,615370,Ursinus Bears,615483,5,top,Sam Schoenberg grounded out to 2b (0-2 FK).,42,2026-03-14T17:30:00-04:00,"Lexington, SC",0,MBA,2026
6545481,615483,JWU (Providence) Wildcats,615370,Ursinus Bears,615370,5,bot,Shane Beaver singled to shortstop (0-1 K).,43,2026-03-14T17:30:00-04:00,"Lexington, SC",0,MBA,2026
6545481,615483,JWU (Providence) Wildcats,615370,Ursinus Bears,615370,5,bot,Isaac Gesford grounded into double play 2b to ss to 1b (0-0); Shane Beaver out on the play.,44,2026-03-14T17:30:00-04:00,"Lexington, SC",0,MBA,2026
6545481,615483,JWU (Providence) Wildcats,615370,Ursinus Bears,615370,5,bot,Brett Barrett grounded out to p (1-2 BKK).,45,2026-03-14T17:30:00-04:00,"Lexington, SC",0,MBA,2026
6545481,615483,JWU (Providence) Wildcats,615370,Ursinus Bears,615483,6,top,Max Shilstone to p for Chase Martin.,46,2026-03-14T17:30:00-04:00,"Lexington, SC",0,MBA,2026
6545481,615483,JWU (Providence) Wildcats,615370,Ursinus Bears,615483,6,top,Ryan Ducey popped up to 2b (1-2 KFBF).,47,2026-03-14T17:30:00-04:00,"Lexington, SC",0,MBA,2026
6545481,615483,JWU (Providence) Wildcats,615370,Ursinus Bears,615483,6,top,Jack Obert grounded out to 2b (1-2 KSB).,48,2026-03-14T17:30:00-04:00,"Lexington, SC",0,MBA,2026
6545481,615483,JWU (Providence) Wildcats,615370,Ursinus Bears,615483,6,top,Jack Dwyer struck out swinging (2-2 BBKSS).,49,2026-03-14T17:30:00-04:00,"Lexington, SC",0,MBA,2026
6545481,615483,JWU (Providence) Wildcats,615370,Ursinus Bears,615370,6,bot,Devin Fogg struck out swinging (0-2 KSS).,50,2026-03-14T17:30:00-04:00,"Lexington, SC",0,MBA,2026
6545481,615483,JWU (Providence) Wildcats,615370,Ursinus Bears,615370,6,bot,George Nestor grounded out to 3b (0-0).,51,2026-03-14T17:30:00-04:00,"Lexington, SC",0,MBA,2026
6545481,615483,JWU (Providence) Wildcats,615370,Ursinus Bears,615370,6,bot,Kyle Rosenfeld struck out swinging (1-2 BKKS).,52,2026-03-14T17:30:00-04:00,"Lexington, SC",0,MBA,2026
6545481,615483,JWU (Providence) Wildcats,615370,Ursinus Bears,615483,7,top,Jeff Valdez Jimenez walked (3-0 BBBB).,53,2026-03-14T17:30:00-04:00,"Lexington, SC",0,MBA,2026
6545481,615483,JWU (Providence) Wildcats,615370,Ursinus Bears,615483,7,top,Justin Hernandez struck out swinging (0-2 KSS).,54,2026-03-14T17:30:00-04:00,"Lexington, SC",0,MBA,2026
6545481,615483,JWU (Providence) Wildcats,615370,Ursinus Bears,615483,7,top,Diego Taveras flied out to rf to right center (1-1 BK).,55,2026-03-14T17:30:00-04:00,"Lexington, SC",0,MBA,2026
6545481,615483,JWU (Providence) Wildcats,615370,Ursinus Bears,615483,7,top,Jeremy Auren struck out looking (2-2 BFBFK).,56,2026-03-14T17:30:00-04:00,"Lexington, SC",0,MBA,2026
6545481,615483,JWU (Providence) Wildcats,615370,Ursinus Bears,615370,7,bot,Brandon Sullivan singled to center field (2-1 KBB).,57,2026-03-14T17:30:00-04:00,"Lexington, SC",0,MBA,2026
6545481,615483,JWU (Providence) Wildcats,615370,Ursinus Bears,615370,7,bot,Matthew Callahan singled through the left side (0-1 F); Brandon Sullivan advanced to second.,58,2026-03-14T17:30:00-04:00,"Lexington, SC",0,MBA,2026
6545481,615483,JWU (Providence) Wildcats,615370,Ursinus Bears,615370,7,bot,Evan Lamothe to p for Brady Morin.,59,2026-03-14T17:30:00-04:00,"Lexington, SC",0,MBA,2026
6545481,615483,JWU (Providence) Wildcats,615370,Ursinus Bears,615370,7,bot,Luke Kopec popped up to 2b (2-2 BKBF).,60,2026-03-14T17:30:00-04:00,"Lexington, SC",0,MBA,2026
6545481,615483,JWU (Providence) Wildcats,615370,Ursinus Bears,615370,7,bot,Matthew Callahan advanced to second; Brandon Sullivan advanced to third on an error by p.,61,2026-03-14T17:30:00-04:00,"Lexington, SC",0,MBA,2026
6545481,615483,JWU (Providence) Wildcats,615370,Ursinus Bears,615370,7,bot,"Shane Beaver flied out to lf, sacrifice fly, RBI (2-0 BB); Brandon Sullivan scored.",62,2026-03-14T17:30:00-04:00,"Lexington, SC",0,MBA,2026
6545481,615483,JWU (Providence) Wildcats,615370,Ursinus Bears,615370,7,bot,"Isaac Gesford singled up the middle, RBI (0-1 K); Matthew Callahan scored, unearned.",63,2026-03-14T17:30:00-04:00,"Lexington, SC",0,MBA,2026
6545481,615483,JWU (Providence) Wildcats,615370,Ursinus Bears,615370,7,bot,Brett Barrett hit by pitch (1-1 KH); Isaac Gesford advanced to second.,64,2026-03-14T17:30:00-04:00,"Lexington, SC",0,MBA,2026
6545481,615483,JWU (Providence) Wildcats,615370,Ursinus Bears,615370,7,bot,Devin Fogg popped up to ss (1-1 BK).,65,2026-03-14T17:30:00-04:00,"Lexington, SC",0,MBA,2026
6545481,615483,JWU (Providence) Wildcats,615370,Ursinus Bears,615483,8,top,Gianni Melendez walked (3-1 BBSBB).,66,2026-03-14T17:30:00-04:00,"Lexington, SC",0,MBA,2026
6545481,615483,JWU (Providence) Wildcats,615370,Ursinus Bears,615483,8,top,Sam Schoenberg lined into double play 1b (3-2 BKBBK); Gianni Melendez out on the play.,67,2026-03-14T17:30:00-04:00,"Lexington, SC",0,MBA,2026
6545481,615483,JWU (Providence) Wildcats,615370,Ursinus Bears,615483,8,top,Ryan Ducey lined out to lf (0-1 K).,68,2026-03-14T17:30:00-04:00,"Lexington, SC",0,MBA,2026
6545481,615483,JWU (Providence) Wildcats,615370,Ursinus Bears,615370,8,bot,George Nestor walked (3-2 BBKFBB).,69,2026-03-14T17:30:00-04:00,"Lexington, SC",0,MBA,2026
6545481,615483,JWU (Providence) Wildcats,615370,Ursinus Bears,615370,8,bot,Kyle Rosenfeld struck out looking (2-2 BBKFK).,70,2026-03-14T17:30:00-04:00,"Lexington, SC",0,MBA,2026
6545481,615483,JWU (Providence) Wildcats,615370,Ursinus Bears,615370,8,bot,Brandon Sullivan flied out to lf (0-0).,71,2026-03-14T17:30:00-04:00,"Lexington, SC",0,MBA,2026
6545481,615483,JWU (Providence) Wildcats,615370,Ursinus Bears,615370,8,bot,George Nestor stole second.,72,2026-03-14T17:30:00-04:00,"Lexington, SC",0,MBA,2026
6545481,615483,JWU (Providence) Wildcats,615370,Ursinus Bears,615370,8,bot,Matthew Callahan grounded out to ss (3-2 KBBFBF).,73,2026-03-14T17:30:00-04:00,"Lexington, SC",0,MBA,2026
6545481,615483,JWU (Providence) Wildcats,615370,Ursinus Bears,615483,9,top,Jack Obert singled down the rf line (3-2 BBBKS).,74,2026-03-14T17:30:00-04:00,"Lexington, SC",0,MBA,2026
6545481,615483,JWU (Providence) Wildcats,615370,Ursinus Bears,615483,9,top,Austin Downs to p for Max Shilstone.,75,2026-03-14T17:30:00-04:00,"Lexington, SC",0,MBA,2026
6545481,615483,JWU (Providence) Wildcats,615370,Ursinus Bears,615483,9,top,Jack Dwyer flied out to lf (1-1 KB).,76,2026-03-14T17:30:00-04:00,"Lexington, SC",0,MBA,2026
6545481,615483,JWU (Providence) Wildcats,615370,Ursinus Bears,615483,9,top,Jeff Valdez Jimenez lined out to 2b (1-2 KBK).,77,2026-03-14T17:30:00-04:00,"Lexington, SC",0,MBA,2026
6545481,615483,JWU (Providence) Wildcats,615370,Ursinus Bears,615483,9,top,Justin Hernandez singled to right field (1-2 BKF); Jack Obert advanced to second.,78,2026-03-14T17:30:00-04:00,"Lexington, SC",0,MBA,2026
6545481,615483,JWU (Providence) Wildcats,615370,Ursinus Bears,615483,9,top,Corey Magill pinch ran for Justin Hernandez.,79,2026-03-14T17:30:00-04:00,"Lexington, SC",0,MBA,2026
6545481,615483,JWU (Providence) Wildcats,615370,Ursinus Bears,615483,9,top,"Diego Taveras singled to right center, RBI (0-1 K); Corey Magill advanced to third; Jack Obert scored.",80,2026-03-14T17:30:00-04:00,"Lexington, SC",0,MBA,2026
6545481,615483,JWU (Providence) Wildcats,615370,Ursinus Bears,615483,9,top,Jeremy Auren flied out to lf (0-1 K).,81,2026-03-14T17:30:00-04:00,"Lexington, SC",0,MBA,2026
