game_id,away_team_id,away_team_name,home_team_id,home_team_name,batting_team,inning,top_bot,event_text,event_num,game_datetime,stadium_name,attendance,sport_id,season
6549936,615465,Martin Luther Knights,615496,Bethany Lutheran Vikings,615465,1,top,John Westendorf popped up to 2b (0-0).,1,2026-03-21T17:00:00-04:00,"Franklin Rogers Park (Mankato, MN)",238,MBA,2026
6549936,615465,Martin Luther Knights,615496,Bethany Lutheran Vikings,615465,1,top,Mark Vogel singled up the middle (0-0).,2,2026-03-21T17:00:00-04:00,"Franklin Rogers Park (Mankato, MN)",238,MBA,2026
6549936,615465,Martin Luther Knights,615496,Bethany Lutheran Vikings,615465,1,top,Parker Winghart flied out to rf (0-0).,3,2026-03-21T17:00:00-04:00,"Franklin Rogers Park (Mankato, MN)",238,MBA,2026
6549936,615465,Martin Luther Knights,615496,Bethany Lutheran Vikings,615465,1,top,Carlos Walta walked (0-0); Mark Vogel advanced to second.,4,2026-03-21T17:00:00-04:00,"Franklin Rogers Park (Mankato, MN)",238,MBA,2026
6549936,615465,Martin Luther Knights,615496,Bethany Lutheran Vikings,615465,1,top,Jackson Anderson struck out swinging (0-0).,5,2026-03-21T17:00:00-04:00,"Franklin Rogers Park (Mankato, MN)",238,MBA,2026
6549936,615465,Martin Luther Knights,615496,Bethany Lutheran Vikings,615496,1,bot,Jayden Knutson grounded out to 2b (0-0).,6,2026-03-21T17:00:00-04:00,"Franklin Rogers Park (Mankato, MN)",238,MBA,2026
6549936,615465,Martin Luther Knights,615496,Bethany Lutheran Vikings,615496,1,bot,Kyle Carlberg singled (0-0).,7,2026-03-21T17:00:00-04:00,"Franklin Rogers Park (Mankato, MN)",238,MBA,2026
6549936,615465,Martin Luther Knights,615496,Bethany Lutheran Vikings,615496,1,bot,"Kyle Carlberg out at second c to ss, caught stealing.",8,2026-03-21T17:00:00-04:00,"Franklin Rogers Park (Mankato, MN)",238,MBA,2026
6549936,615465,Martin Luther Knights,615496,Bethany Lutheran Vikings,615496,1,bot,Xander Meissner struck out swinging (0-0).,9,2026-03-21T17:00:00-04:00,"Franklin Rogers Park (Mankato, MN)",238,MBA,2026
6549936,615465,Martin Luther Knights,615496,Bethany Lutheran Vikings,615465,2,top,Micah Herbst struck out swinging (0-0).,10,2026-03-21T17:00:00-04:00,"Franklin Rogers Park (Mankato, MN)",238,MBA,2026
6549936,615465,Martin Luther Knights,615496,Bethany Lutheran Vikings,615465,2,top,William Salgat walked (0-0).,11,2026-03-21T17:00:00-04:00,"Franklin Rogers Park (Mankato, MN)",238,MBA,2026
6549936,615465,Martin Luther Knights,615496,Bethany Lutheran Vikings,615465,2,top,William Salgat advanced to second on a wild pitch.,12,2026-03-21T17:00:00-04:00,"Franklin Rogers Park (Mankato, MN)",238,MBA,2026
6549936,615465,Martin Luther Knights,615496,Bethany Lutheran Vikings,615465,2,top,Michel Krebs grounded out to 3b (0-0); William Salgat advanced to third.,13,2026-03-21T17:00:00-04:00,"Franklin Rogers Park (Mankato, MN)",238,MBA,2026
6549936,615465,Martin Luther Knights,615496,Bethany Lutheran Vikings,615465,2,top,Logan Gray-Ives struck out swinging (0-0).,14,2026-03-21T17:00:00-04:00,"Franklin Rogers Park (Mankato, MN)",238,MBA,2026
6549936,615465,Martin Luther Knights,615496,Bethany Lutheran Vikings,615496,2,bot,Gary Swann grounded out to ss (0-0).,15,2026-03-21T17:00:00-04:00,"Franklin Rogers Park (Mankato, MN)",238,MBA,2026
6549936,615465,Martin Luther Knights,615496,Bethany Lutheran Vikings,615496,2,bot,Vincent Curzie singled up the middle (0-0).,16,2026-03-21T17:00:00-04:00,"Franklin Rogers Park (Mankato, MN)",238,MBA,2026
6549936,615465,Martin Luther Knights,615496,Bethany Lutheran Vikings,615496,2,bot,Vincent Curzie advanced to second on a wild pitch.,17,2026-03-21T17:00:00-04:00,"Franklin Rogers Park (Mankato, MN)",238,MBA,2026
6549936,615465,Martin Luther Knights,615496,Bethany Lutheran Vikings,615496,2,bot,Yunior Pena Torres struck out looking (0-0).,18,2026-03-21T17:00:00-04:00,"Franklin Rogers Park (Mankato, MN)",238,MBA,2026
6549936,615465,Martin Luther Knights,615496,Bethany Lutheran Vikings,615496,2,bot,Seth Jones hit by pitch (0-0).,19,2026-03-21T17:00:00-04:00,"Franklin Rogers Park (Mankato, MN)",238,MBA,2026
6549936,615465,Martin Luther Knights,615496,Bethany Lutheran Vikings,615496,2,bot,Jared Harry walked (0-0); Seth Jones advanced to second; Vincent Curzie advanced to third.,20,2026-03-21T17:00:00-04:00,"Franklin Rogers Park (Mankato, MN)",238,MBA,2026
6549936,615465,Martin Luther Knights,615496,Bethany Lutheran Vikings,615496,2,bot,Joshua Miller reached on a fielder's choice (0-0); Jared Harry out at second ss to 2b.,21,2026-03-21T17:00:00-04:00,"Franklin Rogers Park (Mankato, MN)",238,MBA,2026
6549936,615465,Martin Luther Knights,615496,Bethany Lutheran Vikings,615465,3,top,"John Westendorf struck out swinging, out at first c unassisted (0-0).",22,2026-03-21T17:00:00-04:00,"Franklin Rogers Park (Mankato, MN)",238,MBA,2026
6549936,615465,Martin Luther Knights,615496,Bethany Lutheran Vikings,615465,3,top,Mark Vogel walked (0-0).,23,2026-03-21T17:00:00-04:00,"Franklin Rogers Park (Mankato, MN)",238,MBA,2026
6549936,615465,Martin Luther Knights,615496,Bethany Lutheran Vikings,615465,3,top,Parker Winghart struck out looking (0-0).,24,2026-03-21T17:00:00-04:00,"Franklin Rogers Park (Mankato, MN)",238,MBA,2026
6549936,615465,Martin Luther Knights,615496,Bethany Lutheran Vikings,615465,3,top,Carlos Walta struck out swinging (0-0).,25,2026-03-21T17:00:00-04:00,"Franklin Rogers Park (Mankato, MN)",238,MBA,2026
6549936,615465,Martin Luther Knights,615496,Bethany Lutheran Vikings,615496,3,bot,Jayden Knutson struck out looking (0-0).,26,2026-03-21T17:00:00-04:00,"Franklin Rogers Park (Mankato, MN)",238,MBA,2026
6549936,615465,Martin Luther Knights,615496,Bethany Lutheran Vikings,615496,3,bot,Kyle Carlberg doubled down the rf line (0-0).,27,2026-03-21T17:00:00-04:00,"Franklin Rogers Park (Mankato, MN)",238,MBA,2026
6549936,615465,Martin Luther Knights,615496,Bethany Lutheran Vikings,615496,3,bot,Xander Meissner struck out swinging (0-0).,28,2026-03-21T17:00:00-04:00,"Franklin Rogers Park (Mankato, MN)",238,MBA,2026
6549936,615465,Martin Luther Knights,615496,Bethany Lutheran Vikings,615496,3,bot,"Kyle Carlberg out at third c to 3b, caught stealing.",29,2026-03-21T17:00:00-04:00,"Franklin Rogers Park (Mankato, MN)",238,MBA,2026
6549936,615465,Martin Luther Knights,615496,Bethany Lutheran Vikings,615465,4,top,Jackson Anderson struck out swinging (0-0).,30,2026-03-21T17:00:00-04:00,"Franklin Rogers Park (Mankato, MN)",238,MBA,2026
6549936,615465,Martin Luther Knights,615496,Bethany Lutheran Vikings,615465,4,top,Micah Herbst struck out swinging (0-0).,31,2026-03-21T17:00:00-04:00,"Franklin Rogers Park (Mankato, MN)",238,MBA,2026
6549936,615465,Martin Luther Knights,615496,Bethany Lutheran Vikings,615465,4,top,William Salgat popped up to 2b (0-0).,32,2026-03-21T17:00:00-04:00,"Franklin Rogers Park (Mankato, MN)",238,MBA,2026
6549936,615465,Martin Luther Knights,615496,Bethany Lutheran Vikings,615496,4,bot,Gary Swann singled through the right side (0-0).,33,2026-03-21T17:00:00-04:00,"Franklin Rogers Park (Mankato, MN)",238,MBA,2026
6549936,615465,Martin Luther Knights,615496,Bethany Lutheran Vikings,615496,4,bot,Vincent Curzie grounded out to p (0-0); Gary Swann advanced to second.,34,2026-03-21T17:00:00-04:00,"Franklin Rogers Park (Mankato, MN)",238,MBA,2026
6549936,615465,Martin Luther Knights,615496,Bethany Lutheran Vikings,615496,4,bot,Yunior Pena Torres flied out to cf (0-0); Gary Swann advanced to third.,35,2026-03-21T17:00:00-04:00,"Franklin Rogers Park (Mankato, MN)",238,MBA,2026
6549936,615465,Martin Luther Knights,615496,Bethany Lutheran Vikings,615496,4,bot,Seth Jones hit by pitch (0-0).,36,2026-03-21T17:00:00-04:00,"Franklin Rogers Park (Mankato, MN)",238,MBA,2026
6549936,615465,Martin Luther Knights,615496,Bethany Lutheran Vikings,615496,4,bot,Jared Harry struck out swinging (0-0).,37,2026-03-21T17:00:00-04:00,"Franklin Rogers Park (Mankato, MN)",238,MBA,2026
6549936,615465,Martin Luther Knights,615496,Bethany Lutheran Vikings,615465,5,top,Michel Krebs flied out to rf (0-0).,38,2026-03-21T17:00:00-04:00,"Franklin Rogers Park (Mankato, MN)",238,MBA,2026
6549936,615465,Martin Luther Knights,615496,Bethany Lutheran Vikings,615465,5,top,Logan Gray-Ives walked (0-0).,39,2026-03-21T17:00:00-04:00,"Franklin Rogers Park (Mankato, MN)",238,MBA,2026
6549936,615465,Martin Luther Knights,615496,Bethany Lutheran Vikings,615465,5,top,John Westendorf flied out to cf (0-0).,40,2026-03-21T17:00:00-04:00,"Franklin Rogers Park (Mankato, MN)",238,MBA,2026
6549936,615465,Martin Luther Knights,615496,Bethany Lutheran Vikings,615465,5,top,Mark Vogel struck out swinging (0-0).,41,2026-03-21T17:00:00-04:00,"Franklin Rogers Park (Mankato, MN)",238,MBA,2026
6549936,615465,Martin Luther Knights,615496,Bethany Lutheran Vikings,615496,5,bot,Joshua Miller doubled through the right side (0-0).,42,2026-03-21T17:00:00-04:00,"Franklin Rogers Park (Mankato, MN)",238,MBA,2026
6549936,615465,Martin Luther Knights,615496,Bethany Lutheran Vikings,615496,5,bot,"Jayden Knutson singled, bunt (0-0); Joshua Miller advanced to third.",43,2026-03-21T17:00:00-04:00,"Franklin Rogers Park (Mankato, MN)",238,MBA,2026
6549936,615465,Martin Luther Knights,615496,Bethany Lutheran Vikings,615496,5,bot,Kyle Carlberg singled (0-0); Jayden Knutson advanced to second.,44,2026-03-21T17:00:00-04:00,"Franklin Rogers Park (Mankato, MN)",238,MBA,2026
6549936,615465,Martin Luther Knights,615496,Bethany Lutheran Vikings,615496,5,bot,"Xander Meissner grounded out to ss, RBI (0-0); Kyle Carlberg advanced to second; Jayden Knutson advanced to third; Joshua Miller scored.",45,2026-03-21T17:00:00-04:00,"Franklin Rogers Park (Mankato, MN)",238,MBA,2026
6549936,615465,Martin Luther Knights,615496,Bethany Lutheran Vikings,615496,5,bot,"Gary Swann flied out to rf, sacrifice fly, RBI (0-0); Kyle Carlberg advanced to third; Jayden Knutson scored.",46,2026-03-21T17:00:00-04:00,"Franklin Rogers Park (Mankato, MN)",238,MBA,2026
6549936,615465,Martin Luther Knights,615496,Bethany Lutheran Vikings,615496,5,bot,Vincent Curzie struck out swinging (0-0).,47,2026-03-21T17:00:00-04:00,"Franklin Rogers Park (Mankato, MN)",238,MBA,2026
6549936,615465,Martin Luther Knights,615496,Bethany Lutheran Vikings,615465,6,top,"Parker Winghart singled, out at second lf to 2b (0-0).",48,2026-03-21T17:00:00-04:00,"Franklin Rogers Park (Mankato, MN)",238,MBA,2026
6549936,615465,Martin Luther Knights,615496,Bethany Lutheran Vikings,615465,6,top,Carlos Walta walked (0-0).,49,2026-03-21T17:00:00-04:00,"Franklin Rogers Park (Mankato, MN)",238,MBA,2026
6549936,615465,Martin Luther Knights,615496,Bethany Lutheran Vikings,615465,6,top,Tyson Reger to p for Nate Hoffman.,50,2026-03-21T17:00:00-04:00,"Franklin Rogers Park (Mankato, MN)",238,MBA,2026
6549936,615465,Martin Luther Knights,615496,Bethany Lutheran Vikings,615465,6,top,Jackson Anderson struck out swinging (0-0).,51,2026-03-21T17:00:00-04:00,"Franklin Rogers Park (Mankato, MN)",238,MBA,2026
6549936,615465,Martin Luther Knights,615496,Bethany Lutheran Vikings,615465,6,top,Carlos Walta advanced to second.,52,2026-03-21T17:00:00-04:00,"Franklin Rogers Park (Mankato, MN)",238,MBA,2026
6549936,615465,Martin Luther Knights,615496,Bethany Lutheran Vikings,615465,6,top,Micah Herbst struck out swinging (0-0).,53,2026-03-21T17:00:00-04:00,"Franklin Rogers Park (Mankato, MN)",238,MBA,2026
6549936,615465,Martin Luther Knights,615496,Bethany Lutheran Vikings,615496,6,bot,Carlos Walta to p.,54,2026-03-21T17:00:00-04:00,"Franklin Rogers Park (Mankato, MN)",238,MBA,2026
6549936,615465,Martin Luther Knights,615496,Bethany Lutheran Vikings,615496,6,bot,Aidan Berg to dh.,55,2026-03-21T17:00:00-04:00,"Franklin Rogers Park (Mankato, MN)",238,MBA,2026
6549936,615465,Martin Luther Knights,615496,Bethany Lutheran Vikings,615496,6,bot,Yunior Pena Torres walked (0-0).,56,2026-03-21T17:00:00-04:00,"Franklin Rogers Park (Mankato, MN)",238,MBA,2026
6549936,615465,Martin Luther Knights,615496,Bethany Lutheran Vikings,615496,6,bot,Seth Jones hit by pitch (0-0); Yunior Pena Torres advanced to second.,57,2026-03-21T17:00:00-04:00,"Franklin Rogers Park (Mankato, MN)",238,MBA,2026
6549936,615465,Martin Luther Knights,615496,Bethany Lutheran Vikings,615496,6,bot,"Jared Harry reached first on a throwing error by p, bunt (0-0); Seth Jones advanced to second; Yunior Pena Torres advanced to third.",58,2026-03-21T17:00:00-04:00,"Franklin Rogers Park (Mankato, MN)",238,MBA,2026
6549936,615465,Martin Luther Knights,615496,Bethany Lutheran Vikings,615496,6,bot,Joshua Miller reached on a fielder's choice (0-0); Jared Harry advanced to second; Seth Jones advanced to third; Yunior Pena Torres out at home 3b to c.,59,2026-03-21T17:00:00-04:00,"Franklin Rogers Park (Mankato, MN)",238,MBA,2026
6549936,615465,Martin Luther Knights,615496,Bethany Lutheran Vikings,615496,6,bot,"Jayden Knutson singled to left center, 2 RBI (0-0); Joshua Miller advanced to second; Jared Harry scored, unearned; Seth Jones scored.",60,2026-03-21T17:00:00-04:00,"Franklin Rogers Park (Mankato, MN)",238,MBA,2026
6549936,615465,Martin Luther Knights,615496,Bethany Lutheran Vikings,615496,6,bot,"Jayden Knutson advanced to second; Joshua Miller out at second p to 2b to 3b to ss, picked off.",61,2026-03-21T17:00:00-04:00,"Franklin Rogers Park (Mankato, MN)",238,MBA,2026
6549936,615465,Martin Luther Knights,615496,Bethany Lutheran Vikings,615496,6,bot,Kyle Carlberg lined out to 2b (0-0).,62,2026-03-21T17:00:00-04:00,"Franklin Rogers Park (Mankato, MN)",238,MBA,2026
6549936,615465,Martin Luther Knights,615496,Bethany Lutheran Vikings,615465,7,top,William Salgat struck out swinging (0-0).,63,2026-03-21T17:00:00-04:00,"Franklin Rogers Park (Mankato, MN)",238,MBA,2026
6549936,615465,Martin Luther Knights,615496,Bethany Lutheran Vikings,615465,7,top,Michel Krebs grounded out to 3b (0-0).,64,2026-03-21T17:00:00-04:00,"Franklin Rogers Park (Mankato, MN)",238,MBA,2026
6549936,615465,Martin Luther Knights,615496,Bethany Lutheran Vikings,615465,7,top,Logan Gray-Ives hit by pitch (0-0).,65,2026-03-21T17:00:00-04:00,"Franklin Rogers Park (Mankato, MN)",238,MBA,2026
6549936,615465,Martin Luther Knights,615496,Bethany Lutheran Vikings,615465,7,top,John Westendorf grounded out to 2b (0-0).,66,2026-03-21T17:00:00-04:00,"Franklin Rogers Park (Mankato, MN)",238,MBA,2026
6549936,615465,Martin Luther Knights,615496,Bethany Lutheran Vikings,615496,7,bot,Xander Meissner singled down the rf line (0-0).,67,2026-03-21T17:00:00-04:00,"Franklin Rogers Park (Mankato, MN)",238,MBA,2026
6549936,615465,Martin Luther Knights,615496,Bethany Lutheran Vikings,615496,7,bot,Gary Swann singled through the left side (0-0); Xander Meissner advanced to second.,68,2026-03-21T17:00:00-04:00,"Franklin Rogers Park (Mankato, MN)",238,MBA,2026
6549936,615465,Martin Luther Knights,615496,Bethany Lutheran Vikings,615496,7,bot,"Vincent Curzie singled through the left side, RBI (0-0); Gary Swann advanced to second; Xander Meissner scored.",69,2026-03-21T17:00:00-04:00,"Franklin Rogers Park (Mankato, MN)",238,MBA,2026
6549936,615465,Martin Luther Knights,615496,Bethany Lutheran Vikings,615496,7,bot,Yunior Pena Torres walked (0-0); Vincent Curzie advanced to second; Gary Swann advanced to third.,70,2026-03-21T17:00:00-04:00,"Franklin Rogers Park (Mankato, MN)",238,MBA,2026
6549936,615465,Martin Luther Knights,615496,Bethany Lutheran Vikings,615496,7,bot,"Seth Jones singled through the right side, RBI (0-0); Yunior Pena Torres advanced to second; Vincent Curzie advanced to third; Gary Swann scored.",71,2026-03-21T17:00:00-04:00,"Franklin Rogers Park (Mankato, MN)",238,MBA,2026
6549936,615465,Martin Luther Knights,615496,Bethany Lutheran Vikings,615496,7,bot,Silas Winkel to p for Carlos Walta.,72,2026-03-21T17:00:00-04:00,"Franklin Rogers Park (Mankato, MN)",238,MBA,2026
6549936,615465,Martin Luther Knights,615496,Bethany Lutheran Vikings,615496,7,bot,Jared Harry grounded into double play 3b to 2b to 1b (0-0); Seth Jones out on the play; Yunior Pena Torres advanced to third; Vincent Curzie scored.,73,2026-03-21T17:00:00-04:00,"Franklin Rogers Park (Mankato, MN)",238,MBA,2026
6549936,615465,Martin Luther Knights,615496,Bethany Lutheran Vikings,615496,7,bot,"Joshua Miller singled up the middle, RBI (0-0); Yunior Pena Torres scored.",74,2026-03-21T17:00:00-04:00,"Franklin Rogers Park (Mankato, MN)",238,MBA,2026
6549936,615465,Martin Luther Knights,615496,Bethany Lutheran Vikings,615496,7,bot,Jayden Knutson grounded out to 2b (0-0).,75,2026-03-21T17:00:00-04:00,"Franklin Rogers Park (Mankato, MN)",238,MBA,2026
6549936,615465,Martin Luther Knights,615496,Bethany Lutheran Vikings,615465,8,top,Ethan Lung to p for Tyson Reger.,76,2026-03-21T17:00:00-04:00,"Franklin Rogers Park (Mankato, MN)",238,MBA,2026
6549936,615465,Martin Luther Knights,615496,Bethany Lutheran Vikings,615465,8,top,Mark Vogel popped up to ss (0-0).,77,2026-03-21T17:00:00-04:00,"Franklin Rogers Park (Mankato, MN)",238,MBA,2026
6549936,615465,Martin Luther Knights,615496,Bethany Lutheran Vikings,615465,8,top,Parker Winghart popped up to ss (0-0).,78,2026-03-21T17:00:00-04:00,"Franklin Rogers Park (Mankato, MN)",238,MBA,2026
6549936,615465,Martin Luther Knights,615496,Bethany Lutheran Vikings,615465,8,top,Ethan Melso pinch hit for Silas Winkel.,79,2026-03-21T17:00:00-04:00,"Franklin Rogers Park (Mankato, MN)",238,MBA,2026
6549936,615465,Martin Luther Knights,615496,Bethany Lutheran Vikings,615465,8,top,Ethan Melso walked (0-0).,80,2026-03-21T17:00:00-04:00,"Franklin Rogers Park (Mankato, MN)",238,MBA,2026
6549936,615465,Martin Luther Knights,615496,Bethany Lutheran Vikings,615465,8,top,Jackson Anderson singled through the left side (0-0); Ethan Melso advanced to third.,81,2026-03-21T17:00:00-04:00,"Franklin Rogers Park (Mankato, MN)",238,MBA,2026
6549936,615465,Martin Luther Knights,615496,Bethany Lutheran Vikings,615465,8,top,Nathan Vance pinch hit for Micah Herbst.,82,2026-03-21T17:00:00-04:00,"Franklin Rogers Park (Mankato, MN)",238,MBA,2026
6549936,615465,Martin Luther Knights,615496,Bethany Lutheran Vikings,615465,8,top,Jackson Anderson stole second.,83,2026-03-21T17:00:00-04:00,"Franklin Rogers Park (Mankato, MN)",238,MBA,2026
6549936,615465,Martin Luther Knights,615496,Bethany Lutheran Vikings,615465,8,top,"Nathan Vance singled to right center, 2 RBI (0-0); Jackson Anderson scored; Ethan Melso scored.",84,2026-03-21T17:00:00-04:00,"Franklin Rogers Park (Mankato, MN)",238,MBA,2026
6549936,615465,Martin Luther Knights,615496,Bethany Lutheran Vikings,615465,8,top,William Salgat hit by pitch (0-0); Nathan Vance advanced to second.,85,2026-03-21T17:00:00-04:00,"Franklin Rogers Park (Mankato, MN)",238,MBA,2026
6549936,615465,Martin Luther Knights,615496,Bethany Lutheran Vikings,615465,8,top,Michel Krebs grounded out to ss (0-0).,86,2026-03-21T17:00:00-04:00,"Franklin Rogers Park (Mankato, MN)",238,MBA,2026
6549936,615465,Martin Luther Knights,615496,Bethany Lutheran Vikings,615496,8,bot,Ethan Melso to p.,87,2026-03-21T17:00:00-04:00,"Franklin Rogers Park (Mankato, MN)",238,MBA,2026
6549936,615465,Martin Luther Knights,615496,Bethany Lutheran Vikings,615496,8,bot,Nathan Vance to rf.,88,2026-03-21T17:00:00-04:00,"Franklin Rogers Park (Mankato, MN)",238,MBA,2026
6549936,615465,Martin Luther Knights,615496,Bethany Lutheran Vikings,615496,8,bot,Kyle Carlberg hit by pitch (0-0).,89,2026-03-21T17:00:00-04:00,"Franklin Rogers Park (Mankato, MN)",238,MBA,2026
6549936,615465,Martin Luther Knights,615496,Bethany Lutheran Vikings,615496,8,bot,Kaden Gonzalez pinch ran for Kyle Carlberg.,90,2026-03-21T17:00:00-04:00,"Franklin Rogers Park (Mankato, MN)",238,MBA,2026
6549936,615465,Martin Luther Knights,615496,Bethany Lutheran Vikings,615496,8,bot,"Xander Meissner homered, 2 RBI (0-0); Kaden Gonzalez scored.",91,2026-03-21T17:00:00-04:00,"Franklin Rogers Park (Mankato, MN)",238,MBA,2026
6549936,615465,Martin Luther Knights,615496,Bethany Lutheran Vikings,615496,8,bot,Gary Swann grounded out to 3b (0-0).,92,2026-03-21T17:00:00-04:00,"Franklin Rogers Park (Mankato, MN)",238,MBA,2026
6549936,615465,Martin Luther Knights,615496,Bethany Lutheran Vikings,615496,8,bot,Vincent Curzie flied out to cf (0-0).,93,2026-03-21T17:00:00-04:00,"Franklin Rogers Park (Mankato, MN)",238,MBA,2026
6549936,615465,Martin Luther Knights,615496,Bethany Lutheran Vikings,615496,8,bot,Parker Anderson pinch hit for Yunior Pena Torres.,94,2026-03-21T17:00:00-04:00,"Franklin Rogers Park (Mankato, MN)",238,MBA,2026
6549936,615465,Martin Luther Knights,615496,Bethany Lutheran Vikings,615496,8,bot,Parker Anderson flied out to cf (0-0).,95,2026-03-21T17:00:00-04:00,"Franklin Rogers Park (Mankato, MN)",238,MBA,2026
6549936,615465,Martin Luther Knights,615496,Bethany Lutheran Vikings,615465,9,top,Parker Anderson to 3b.,96,2026-03-21T17:00:00-04:00,"Franklin Rogers Park (Mankato, MN)",238,MBA,2026
6549936,615465,Martin Luther Knights,615496,Bethany Lutheran Vikings,615465,9,top,Kaden Gonzalez to lf.,97,2026-03-21T17:00:00-04:00,"Franklin Rogers Park (Mankato, MN)",238,MBA,2026
6549936,615465,Martin Luther Knights,615496,Bethany Lutheran Vikings,615465,9,top,Caeden Willaert to p for Ethan Lung.,98,2026-03-21T17:00:00-04:00,"Franklin Rogers Park (Mankato, MN)",238,MBA,2026
6549936,615465,Martin Luther Knights,615496,Bethany Lutheran Vikings,615465,9,top,Logan Gray-Ives struck out swinging (0-0).,99,2026-03-21T17:00:00-04:00,"Franklin Rogers Park (Mankato, MN)",238,MBA,2026
6549936,615465,Martin Luther Knights,615496,Bethany Lutheran Vikings,615465,9,top,John Westendorf struck out swinging (0-0).,100,2026-03-21T17:00:00-04:00,"Franklin Rogers Park (Mankato, MN)",238,MBA,2026
6549936,615465,Martin Luther Knights,615496,Bethany Lutheran Vikings,615465,9,top,Mark Vogel grounded out to 1b unassisted (0-0).,101,2026-03-21T17:00:00-04:00,"Franklin Rogers Park (Mankato, MN)",238,MBA,2026
