game_id,away_team_id,away_team_name,home_team_id,home_team_name,batting_team,inning,top_bot,event_text,event_num,game_datetime,stadium_name,attendance,sport_id,season
6549148,615256,Maryville (TN) Scots,615139,Adrian Bulldogs,615256,1,top,Masin Hall struck out looking (0-0).,1,2026-03-07T11:00:00-05:00,"Ted Leonard Park (Greensboro, NC)",200,MBA,2026
6549148,615256,Maryville (TN) Scots,615139,Adrian Bulldogs,615256,1,top,Brayden Evans singled to center field (0-0).,2,2026-03-07T11:00:00-05:00,"Ted Leonard Park (Greensboro, NC)",200,MBA,2026
6549148,615256,Maryville (TN) Scots,615139,Adrian Bulldogs,615256,1,top,Colin Dunworth popped up to 2b (0-0).,3,2026-03-07T11:00:00-05:00,"Ted Leonard Park (Greensboro, NC)",200,MBA,2026
6549148,615256,Maryville (TN) Scots,615139,Adrian Bulldogs,615256,1,top,Det Dettwiller flied out to lf (0-0).,4,2026-03-07T11:00:00-05:00,"Ted Leonard Park (Greensboro, NC)",200,MBA,2026
6549148,615256,Maryville (TN) Scots,615139,Adrian Bulldogs,615139,1,bot,Nic Bruder grounded out to 2b (0-0).,5,2026-03-07T11:00:00-05:00,"Ted Leonard Park (Greensboro, NC)",200,MBA,2026
6549148,615256,Maryville (TN) Scots,615139,Adrian Bulldogs,615139,1,bot,Casey Finn flied out to rf (0-0).,6,2026-03-07T11:00:00-05:00,"Ted Leonard Park (Greensboro, NC)",200,MBA,2026
6549148,615256,Maryville (TN) Scots,615139,Adrian Bulldogs,615139,1,bot,Jake Burns tripled to right center (0-0).,7,2026-03-07T11:00:00-05:00,"Ted Leonard Park (Greensboro, NC)",200,MBA,2026
6549148,615256,Maryville (TN) Scots,615139,Adrian Bulldogs,615139,1,bot,Gabe Jones flied out to rf (0-0).,8,2026-03-07T11:00:00-05:00,"Ted Leonard Park (Greensboro, NC)",200,MBA,2026
6549148,615256,Maryville (TN) Scots,615139,Adrian Bulldogs,615256,2,top,Frank Derner grounded out to 1b unassisted (0-0).,9,2026-03-07T11:00:00-05:00,"Ted Leonard Park (Greensboro, NC)",200,MBA,2026
6549148,615256,Maryville (TN) Scots,615139,Adrian Bulldogs,615256,2,top,Nick Curry flied out to cf (0-0).,10,2026-03-07T11:00:00-05:00,"Ted Leonard Park (Greensboro, NC)",200,MBA,2026
6549148,615256,Maryville (TN) Scots,615139,Adrian Bulldogs,615256,2,top,Lucas Mendoza walked (0-0).,11,2026-03-07T11:00:00-05:00,"Ted Leonard Park (Greensboro, NC)",200,MBA,2026
6549148,615256,Maryville (TN) Scots,615139,Adrian Bulldogs,615256,2,top,Luke Wright reached on a fielder's choice (0-0); Lucas Mendoza out at second ss unassisted.,12,2026-03-07T11:00:00-05:00,"Ted Leonard Park (Greensboro, NC)",200,MBA,2026
6549148,615256,Maryville (TN) Scots,615139,Adrian Bulldogs,615139,2,bot,Jaxon McGuigan tripled to right center (0-0).,13,2026-03-07T11:00:00-05:00,"Ted Leonard Park (Greensboro, NC)",200,MBA,2026
6549148,615256,Maryville (TN) Scots,615139,Adrian Bulldogs,615139,2,bot,"Aiden Melvin flied out to rf, sacrifice fly, RBI (0-0); Jaxon McGuigan scored.",14,2026-03-07T11:00:00-05:00,"Ted Leonard Park (Greensboro, NC)",200,MBA,2026
6549148,615256,Maryville (TN) Scots,615139,Adrian Bulldogs,615139,2,bot,Christian Oliver grounded out to ss (0-0).,15,2026-03-07T11:00:00-05:00,"Ted Leonard Park (Greensboro, NC)",200,MBA,2026
6549148,615256,Maryville (TN) Scots,615139,Adrian Bulldogs,615139,2,bot,Rolando Jimenez singled to right field (0-0).,16,2026-03-07T11:00:00-05:00,"Ted Leonard Park (Greensboro, NC)",200,MBA,2026
6549148,615256,Maryville (TN) Scots,615139,Adrian Bulldogs,615139,2,bot,"Rolando Jimenez picked off, out at first p to 1b.",17,2026-03-07T11:00:00-05:00,"Ted Leonard Park (Greensboro, NC)",200,MBA,2026
6549148,615256,Maryville (TN) Scots,615139,Adrian Bulldogs,615256,3,top,Jay Pichardo grounded out to 3b (0-0).,18,2026-03-07T11:00:00-05:00,"Ted Leonard Park (Greensboro, NC)",200,MBA,2026
6549148,615256,Maryville (TN) Scots,615139,Adrian Bulldogs,615256,3,top,Masin Hall grounded out to 2b (0-0).,19,2026-03-07T11:00:00-05:00,"Ted Leonard Park (Greensboro, NC)",200,MBA,2026
6549148,615256,Maryville (TN) Scots,615139,Adrian Bulldogs,615256,3,top,Brayden Evans walked (0-0).,20,2026-03-07T11:00:00-05:00,"Ted Leonard Park (Greensboro, NC)",200,MBA,2026
6549148,615256,Maryville (TN) Scots,615139,Adrian Bulldogs,615256,3,top,Colin Dunworth grounded out to 3b (0-0).,21,2026-03-07T11:00:00-05:00,"Ted Leonard Park (Greensboro, NC)",200,MBA,2026
6549148,615256,Maryville (TN) Scots,615139,Adrian Bulldogs,615139,3,bot,"Gavino Gomez popped up to 3b, bunt (0-0).",22,2026-03-07T11:00:00-05:00,"Ted Leonard Park (Greensboro, NC)",200,MBA,2026
6549148,615256,Maryville (TN) Scots,615139,Adrian Bulldogs,615139,3,bot,Nic Bruder flied out to cf (0-0).,23,2026-03-07T11:00:00-05:00,"Ted Leonard Park (Greensboro, NC)",200,MBA,2026
6549148,615256,Maryville (TN) Scots,615139,Adrian Bulldogs,615139,3,bot,Casey Finn grounded out to 3b (0-0).,24,2026-03-07T11:00:00-05:00,"Ted Leonard Park (Greensboro, NC)",200,MBA,2026
6549148,615256,Maryville (TN) Scots,615139,Adrian Bulldogs,615256,4,top,Det Dettwiller hit by pitch (0-0).,25,2026-03-07T11:00:00-05:00,"Ted Leonard Park (Greensboro, NC)",200,MBA,2026
6549148,615256,Maryville (TN) Scots,615139,Adrian Bulldogs,615256,4,top,Frank Derner grounded out to ss (0-0); Det Dettwiller advanced to second.,26,2026-03-07T11:00:00-05:00,"Ted Leonard Park (Greensboro, NC)",200,MBA,2026
6549148,615256,Maryville (TN) Scots,615139,Adrian Bulldogs,615256,4,top,Nick Curry singled to center field (0-0).,27,2026-03-07T11:00:00-05:00,"Ted Leonard Park (Greensboro, NC)",200,MBA,2026
6549148,615256,Maryville (TN) Scots,615139,Adrian Bulldogs,615256,4,top,"Lucas Mendoza singled to left field, RBI (0-0); Nick Curry advanced to second; Det Dettwiller scored.",28,2026-03-07T11:00:00-05:00,"Ted Leonard Park (Greensboro, NC)",200,MBA,2026
6549148,615256,Maryville (TN) Scots,615139,Adrian Bulldogs,615256,4,top,Lucas Mendoza advanced to second; Nick Curry advanced to third on a wild pitch.,29,2026-03-07T11:00:00-05:00,"Ted Leonard Park (Greensboro, NC)",200,MBA,2026
6549148,615256,Maryville (TN) Scots,615139,Adrian Bulldogs,615256,4,top,Luke Wright flied out to cf (0-0).,30,2026-03-07T11:00:00-05:00,"Ted Leonard Park (Greensboro, NC)",200,MBA,2026
6549148,615256,Maryville (TN) Scots,615139,Adrian Bulldogs,615256,4,top,Jay Pichardo struck out swinging (0-0).,31,2026-03-07T11:00:00-05:00,"Ted Leonard Park (Greensboro, NC)",200,MBA,2026
6549148,615256,Maryville (TN) Scots,615139,Adrian Bulldogs,615139,4,bot,Jake Burns grounded out to ss (0-0).,32,2026-03-07T11:00:00-05:00,"Ted Leonard Park (Greensboro, NC)",200,MBA,2026
6549148,615256,Maryville (TN) Scots,615139,Adrian Bulldogs,615139,4,bot,Gabe Jones singled to center field (0-0).,33,2026-03-07T11:00:00-05:00,"Ted Leonard Park (Greensboro, NC)",200,MBA,2026
6549148,615256,Maryville (TN) Scots,615139,Adrian Bulldogs,615139,4,bot,"Jaxon McGuigan reached first on an error by lf, advanced to second (0-0); Gabe Jones advanced to third.",34,2026-03-07T11:00:00-05:00,"Ted Leonard Park (Greensboro, NC)",200,MBA,2026
6549148,615256,Maryville (TN) Scots,615139,Adrian Bulldogs,615139,4,bot,"Aiden Melvin singled to right field, RBI (0-0); Jaxon McGuigan advanced to third; Gabe Jones scored, unearned.",35,2026-03-07T11:00:00-05:00,"Ted Leonard Park (Greensboro, NC)",200,MBA,2026
6549148,615256,Maryville (TN) Scots,615139,Adrian Bulldogs,615139,4,bot,"Christian Oliver flied out to lf, sacrifice fly, RBI (0-0); Jaxon McGuigan scored, unearned.",36,2026-03-07T11:00:00-05:00,"Ted Leonard Park (Greensboro, NC)",200,MBA,2026
6549148,615256,Maryville (TN) Scots,615139,Adrian Bulldogs,615139,4,bot,Rolando Jimenez hit by pitch (0-0); Aiden Melvin advanced to second.,37,2026-03-07T11:00:00-05:00,"Ted Leonard Park (Greensboro, NC)",200,MBA,2026
6549148,615256,Maryville (TN) Scots,615139,Adrian Bulldogs,615139,4,bot,Gavino Gomez grounded out to p (0-0).,38,2026-03-07T11:00:00-05:00,"Ted Leonard Park (Greensboro, NC)",200,MBA,2026
6549148,615256,Maryville (TN) Scots,615139,Adrian Bulldogs,615256,5,top,Masin Hall singled to right field (0-0).,39,2026-03-07T11:00:00-05:00,"Ted Leonard Park (Greensboro, NC)",200,MBA,2026
6549148,615256,Maryville (TN) Scots,615139,Adrian Bulldogs,615256,5,top,Brayden Evans walked (0-0); Masin Hall advanced to second.,40,2026-03-07T11:00:00-05:00,"Ted Leonard Park (Greensboro, NC)",200,MBA,2026
6549148,615256,Maryville (TN) Scots,615139,Adrian Bulldogs,615256,5,top,"Colin Dunworth grounded out to 3b, SAC, bunt (0-0); Brayden Evans advanced to second; Masin Hall advanced to third.",41,2026-03-07T11:00:00-05:00,"Ted Leonard Park (Greensboro, NC)",200,MBA,2026
6549148,615256,Maryville (TN) Scots,615139,Adrian Bulldogs,615256,5,top,Logan Krause pinch hit for Det Dettwiller.,42,2026-03-07T11:00:00-05:00,"Ted Leonard Park (Greensboro, NC)",200,MBA,2026
6549148,615256,Maryville (TN) Scots,615139,Adrian Bulldogs,615256,5,top,Logan Krause walked (0-0).,43,2026-03-07T11:00:00-05:00,"Ted Leonard Park (Greensboro, NC)",200,MBA,2026
6549148,615256,Maryville (TN) Scots,615139,Adrian Bulldogs,615256,5,top,"Frank Derner grounded out to 2b, RBI (0-0); Logan Krause advanced to second; Brayden Evans advanced to third; Masin Hall scored.",44,2026-03-07T11:00:00-05:00,"Ted Leonard Park (Greensboro, NC)",200,MBA,2026
6549148,615256,Maryville (TN) Scots,615139,Adrian Bulldogs,615256,5,top,"Nick Curry homered to left field, 3 RBI (0-0); Logan Krause scored; Brayden Evans scored.",45,2026-03-07T11:00:00-05:00,"Ted Leonard Park (Greensboro, NC)",200,MBA,2026
6549148,615256,Maryville (TN) Scots,615139,Adrian Bulldogs,615256,5,top,Lucas Mendoza struck out swinging (0-0).,46,2026-03-07T11:00:00-05:00,"Ted Leonard Park (Greensboro, NC)",200,MBA,2026
6549148,615256,Maryville (TN) Scots,615139,Adrian Bulldogs,615139,5,bot,Nic Bruder singled to center field (0-0).,47,2026-03-07T11:00:00-05:00,"Ted Leonard Park (Greensboro, NC)",200,MBA,2026
6549148,615256,Maryville (TN) Scots,615139,Adrian Bulldogs,615139,5,bot,Casey Finn singled to second base (0-0); Nic Bruder advanced to second.,48,2026-03-07T11:00:00-05:00,"Ted Leonard Park (Greensboro, NC)",200,MBA,2026
6549148,615256,Maryville (TN) Scots,615139,Adrian Bulldogs,615139,5,bot,"Jake Burns reached first on an error by c, SAC, bunt, advanced to third (0-0); Casey Finn scored; Nic Bruder scored.",49,2026-03-07T11:00:00-05:00,"Ted Leonard Park (Greensboro, NC)",200,MBA,2026
6549148,615256,Maryville (TN) Scots,615139,Adrian Bulldogs,615139,5,bot,"Gabe Jones doubled to left field, RBI (0-0); Jake Burns scored, unearned.",50,2026-03-07T11:00:00-05:00,"Ted Leonard Park (Greensboro, NC)",200,MBA,2026
6549148,615256,Maryville (TN) Scots,615139,Adrian Bulldogs,615139,5,bot,Jaxon McGuigan hit by pitch (0-0).,51,2026-03-07T11:00:00-05:00,"Ted Leonard Park (Greensboro, NC)",200,MBA,2026
6549148,615256,Maryville (TN) Scots,615139,Adrian Bulldogs,615139,5,bot,Pete Pappas to p for Kyle Timko.,52,2026-03-07T11:00:00-05:00,"Ted Leonard Park (Greensboro, NC)",200,MBA,2026
6549148,615256,Maryville (TN) Scots,615139,Adrian Bulldogs,615139,5,bot,Aiden Melvin grounded out to 2b (0-0); Jaxon McGuigan advanced to second; Gabe Jones advanced to third.,53,2026-03-07T11:00:00-05:00,"Ted Leonard Park (Greensboro, NC)",200,MBA,2026
6549148,615256,Maryville (TN) Scots,615139,Adrian Bulldogs,615139,5,bot,"Christian Oliver singled to left center, 2 RBI (0-0); Jaxon McGuigan scored; Gabe Jones scored.",54,2026-03-07T11:00:00-05:00,"Ted Leonard Park (Greensboro, NC)",200,MBA,2026
6549148,615256,Maryville (TN) Scots,615139,Adrian Bulldogs,615139,5,bot,Rolando Jimenez singled to left field (0-0); Christian Oliver advanced to second.,55,2026-03-07T11:00:00-05:00,"Ted Leonard Park (Greensboro, NC)",200,MBA,2026
6549148,615256,Maryville (TN) Scots,615139,Adrian Bulldogs,615139,5,bot,Gavino Gomez grounded out to p (0-0); Rolando Jimenez advanced to second; Christian Oliver advanced to third.,56,2026-03-07T11:00:00-05:00,"Ted Leonard Park (Greensboro, NC)",200,MBA,2026
6549148,615256,Maryville (TN) Scots,615139,Adrian Bulldogs,615139,5,bot,Nic Bruder fouled out to 1b (0-0).,57,2026-03-07T11:00:00-05:00,"Ted Leonard Park (Greensboro, NC)",200,MBA,2026
6549148,615256,Maryville (TN) Scots,615139,Adrian Bulldogs,615256,6,top,Landon Kozlowski to p for Edward Bieniasz.,58,2026-03-07T11:00:00-05:00,"Ted Leonard Park (Greensboro, NC)",200,MBA,2026
6549148,615256,Maryville (TN) Scots,615139,Adrian Bulldogs,615256,6,top,Irvin Hernandez pinch hit for Luke Wright.,59,2026-03-07T11:00:00-05:00,"Ted Leonard Park (Greensboro, NC)",200,MBA,2026
6549148,615256,Maryville (TN) Scots,615139,Adrian Bulldogs,615256,6,top,Irvin Hernandez flied out to cf (0-0).,60,2026-03-07T11:00:00-05:00,"Ted Leonard Park (Greensboro, NC)",200,MBA,2026
6549148,615256,Maryville (TN) Scots,615139,Adrian Bulldogs,615256,6,top,Jay Pichardo grounded out to p (0-0).,61,2026-03-07T11:00:00-05:00,"Ted Leonard Park (Greensboro, NC)",200,MBA,2026
6549148,615256,Maryville (TN) Scots,615139,Adrian Bulldogs,615256,6,top,Masin Hall fouled out to 1b (0-0).,62,2026-03-07T11:00:00-05:00,"Ted Leonard Park (Greensboro, NC)",200,MBA,2026
6549148,615256,Maryville (TN) Scots,615139,Adrian Bulldogs,615139,6,bot,Irvin Hernandez to 3b.,63,2026-03-07T11:00:00-05:00,"Ted Leonard Park (Greensboro, NC)",200,MBA,2026
6549148,615256,Maryville (TN) Scots,615139,Adrian Bulldogs,615139,6,bot,Casey Finn walked (0-0).,64,2026-03-07T11:00:00-05:00,"Ted Leonard Park (Greensboro, NC)",200,MBA,2026
6549148,615256,Maryville (TN) Scots,615139,Adrian Bulldogs,615139,6,bot,Jake Burns grounded out to 2b (0-0); Casey Finn advanced to second.,65,2026-03-07T11:00:00-05:00,"Ted Leonard Park (Greensboro, NC)",200,MBA,2026
6549148,615256,Maryville (TN) Scots,615139,Adrian Bulldogs,615139,6,bot,"Gabe Jones doubled to left center, RBI (0-0); Casey Finn scored.",66,2026-03-07T11:00:00-05:00,"Ted Leonard Park (Greensboro, NC)",200,MBA,2026
6549148,615256,Maryville (TN) Scots,615139,Adrian Bulldogs,615139,6,bot,Jaxon McGuigan grounded out to 3b (0-0).,67,2026-03-07T11:00:00-05:00,"Ted Leonard Park (Greensboro, NC)",200,MBA,2026
6549148,615256,Maryville (TN) Scots,615139,Adrian Bulldogs,615139,6,bot,"Aiden Melvin doubled to left center, RBI (0-0); Gabe Jones scored.",68,2026-03-07T11:00:00-05:00,"Ted Leonard Park (Greensboro, NC)",200,MBA,2026
6549148,615256,Maryville (TN) Scots,615139,Adrian Bulldogs,615139,6,bot,Christian Oliver flied out to rf (0-0).,69,2026-03-07T11:00:00-05:00,"Ted Leonard Park (Greensboro, NC)",200,MBA,2026
6549148,615256,Maryville (TN) Scots,615139,Adrian Bulldogs,615256,7,top,Brayden Evans walked (0-0).,70,2026-03-07T11:00:00-05:00,"Ted Leonard Park (Greensboro, NC)",200,MBA,2026
6549148,615256,Maryville (TN) Scots,615139,Adrian Bulldogs,615256,7,top,Colin Dunworth fouled out to lf (0-0).,71,2026-03-07T11:00:00-05:00,"Ted Leonard Park (Greensboro, NC)",200,MBA,2026
6549148,615256,Maryville (TN) Scots,615139,Adrian Bulldogs,615256,7,top,Logan Krause grounded into double play 2b to ss to 1b (0-0); Brayden Evans out on the play.,72,2026-03-07T11:00:00-05:00,"Ted Leonard Park (Greensboro, NC)",200,MBA,2026
6549148,615256,Maryville (TN) Scots,615139,Adrian Bulldogs,615139,7,bot,Logan Krause to dh.,73,2026-03-07T11:00:00-05:00,"Ted Leonard Park (Greensboro, NC)",200,MBA,2026
6549148,615256,Maryville (TN) Scots,615139,Adrian Bulldogs,615139,7,bot,Gavin Mohrman to p for Pete Pappas.,74,2026-03-07T11:00:00-05:00,"Ted Leonard Park (Greensboro, NC)",200,MBA,2026
6549148,615256,Maryville (TN) Scots,615139,Adrian Bulldogs,615139,7,bot,Drew Henry to rf for Colin Dunworth.,75,2026-03-07T11:00:00-05:00,"Ted Leonard Park (Greensboro, NC)",200,MBA,2026
6549148,615256,Maryville (TN) Scots,615139,Adrian Bulldogs,615139,7,bot,Rolando Jimenez grounded out to ss (0-0).,76,2026-03-07T11:00:00-05:00,"Ted Leonard Park (Greensboro, NC)",200,MBA,2026
6549148,615256,Maryville (TN) Scots,615139,Adrian Bulldogs,615139,7,bot,Jack Boike pinch hit for Gavino Gomez.,77,2026-03-07T11:00:00-05:00,"Ted Leonard Park (Greensboro, NC)",200,MBA,2026
6549148,615256,Maryville (TN) Scots,615139,Adrian Bulldogs,615139,7,bot,Jack Boike walked (0-0).,78,2026-03-07T11:00:00-05:00,"Ted Leonard Park (Greensboro, NC)",200,MBA,2026
6549148,615256,Maryville (TN) Scots,615139,Adrian Bulldogs,615139,7,bot,Jack Boike stole second.,79,2026-03-07T11:00:00-05:00,"Ted Leonard Park (Greensboro, NC)",200,MBA,2026
6549148,615256,Maryville (TN) Scots,615139,Adrian Bulldogs,615139,7,bot,Jack Boike advanced to third on a wild pitch.,80,2026-03-07T11:00:00-05:00,"Ted Leonard Park (Greensboro, NC)",200,MBA,2026
6549148,615256,Maryville (TN) Scots,615139,Adrian Bulldogs,615139,7,bot,"Nic Bruder doubled to center field, RBI (0-0); Jack Boike scored.",81,2026-03-07T11:00:00-05:00,"Ted Leonard Park (Greensboro, NC)",200,MBA,2026
6549148,615256,Maryville (TN) Scots,615139,Adrian Bulldogs,615139,7,bot,Casey Finn struck out looking (0-0).,82,2026-03-07T11:00:00-05:00,"Ted Leonard Park (Greensboro, NC)",200,MBA,2026
6549148,615256,Maryville (TN) Scots,615139,Adrian Bulldogs,615139,7,bot,Nic Bruder stole third.,83,2026-03-07T11:00:00-05:00,"Ted Leonard Park (Greensboro, NC)",200,MBA,2026
6549148,615256,Maryville (TN) Scots,615139,Adrian Bulldogs,615139,7,bot,Jake Burns struck out swinging (0-0).,84,2026-03-07T11:00:00-05:00,"Ted Leonard Park (Greensboro, NC)",200,MBA,2026
6549148,615256,Maryville (TN) Scots,615139,Adrian Bulldogs,615256,8,top,Jack Boike to cf.,85,2026-03-07T11:00:00-05:00,"Ted Leonard Park (Greensboro, NC)",200,MBA,2026
6549148,615256,Maryville (TN) Scots,615139,Adrian Bulldogs,615256,8,top,Frank Derner singled to center field (0-0).,86,2026-03-07T11:00:00-05:00,"Ted Leonard Park (Greensboro, NC)",200,MBA,2026
6549148,615256,Maryville (TN) Scots,615139,Adrian Bulldogs,615256,8,top,Nick Curry singled to shortstop (0-0); Frank Derner advanced to second.,87,2026-03-07T11:00:00-05:00,"Ted Leonard Park (Greensboro, NC)",200,MBA,2026
6549148,615256,Maryville (TN) Scots,615139,Adrian Bulldogs,615256,8,top,Luke Winter pinch hit for Lucas Mendoza.,88,2026-03-07T11:00:00-05:00,"Ted Leonard Park (Greensboro, NC)",200,MBA,2026
6549148,615256,Maryville (TN) Scots,615139,Adrian Bulldogs,615256,8,top,"Luke Winter reached first on an error by p (0-0); Nick Curry advanced to third; Frank Derner scored, unearned.",89,2026-03-07T11:00:00-05:00,"Ted Leonard Park (Greensboro, NC)",200,MBA,2026
6549148,615256,Maryville (TN) Scots,615139,Adrian Bulldogs,615256,8,top,Irvin Hernandez walked (0-0); Luke Winter advanced to second.,90,2026-03-07T11:00:00-05:00,"Ted Leonard Park (Greensboro, NC)",200,MBA,2026
6549148,615256,Maryville (TN) Scots,615139,Adrian Bulldogs,615256,8,top,Tyler Mileski to p for Landon Kozlowski.,91,2026-03-07T11:00:00-05:00,"Ted Leonard Park (Greensboro, NC)",200,MBA,2026
6549148,615256,Maryville (TN) Scots,615139,Adrian Bulldogs,615256,8,top,Titus Suggs pinch hit for Jay Pichardo.,92,2026-03-07T11:00:00-05:00,"Ted Leonard Park (Greensboro, NC)",200,MBA,2026
6549148,615256,Maryville (TN) Scots,615139,Adrian Bulldogs,615256,8,top,"Titus Suggs doubled down the lf line, 3 RBI (0-0); Irvin Hernandez scored; Luke Winter scored, unearned; Nick Curry scored.",93,2026-03-07T11:00:00-05:00,"Ted Leonard Park (Greensboro, NC)",200,MBA,2026
6549148,615256,Maryville (TN) Scots,615139,Adrian Bulldogs,615256,8,top,Masin Hall singled to left field (0-0); Titus Suggs advanced to third.,94,2026-03-07T11:00:00-05:00,"Ted Leonard Park (Greensboro, NC)",200,MBA,2026
6549148,615256,Maryville (TN) Scots,615139,Adrian Bulldogs,615256,8,top,"Brayden Evans singled to left field, RBI (0-0); Masin Hall advanced to second; Titus Suggs scored.",95,2026-03-07T11:00:00-05:00,"Ted Leonard Park (Greensboro, NC)",200,MBA,2026
6549148,615256,Maryville (TN) Scots,615139,Adrian Bulldogs,615256,8,top,Lincoln Lipinski to p for Tyler Mileski.,96,2026-03-07T11:00:00-05:00,"Ted Leonard Park (Greensboro, NC)",200,MBA,2026
6549148,615256,Maryville (TN) Scots,615139,Adrian Bulldogs,615256,8,top,"Drew Henry singled, bunt (0-0); Brayden Evans advanced to second; Masin Hall advanced to third.",97,2026-03-07T11:00:00-05:00,"Ted Leonard Park (Greensboro, NC)",200,MBA,2026
6549148,615256,Maryville (TN) Scots,615139,Adrian Bulldogs,615256,8,top,Logan Krause struck out swinging (0-0).,98,2026-03-07T11:00:00-05:00,"Ted Leonard Park (Greensboro, NC)",200,MBA,2026
6549148,615256,Maryville (TN) Scots,615139,Adrian Bulldogs,615256,8,top,"Frank Derner flied out to lf, sacrifice fly, RBI (0-0); Masin Hall scored, unearned.",99,2026-03-07T11:00:00-05:00,"Ted Leonard Park (Greensboro, NC)",200,MBA,2026
6549148,615256,Maryville (TN) Scots,615139,Adrian Bulldogs,615256,8,top,"Nick Curry singled to left field, RBI (0-0); Drew Henry advanced to second; Brayden Evans scored, unearned.",100,2026-03-07T11:00:00-05:00,"Ted Leonard Park (Greensboro, NC)",200,MBA,2026
6549148,615256,Maryville (TN) Scots,615139,Adrian Bulldogs,615256,8,top,Luke Winter struck out looking (0-0).,101,2026-03-07T11:00:00-05:00,"Ted Leonard Park (Greensboro, NC)",200,MBA,2026
6549148,615256,Maryville (TN) Scots,615139,Adrian Bulldogs,615139,8,bot,Drew Henry to cf.,102,2026-03-07T11:00:00-05:00,"Ted Leonard Park (Greensboro, NC)",200,MBA,2026
6549148,615256,Maryville (TN) Scots,615139,Adrian Bulldogs,615139,8,bot,Luke Winter to c.,103,2026-03-07T11:00:00-05:00,"Ted Leonard Park (Greensboro, NC)",200,MBA,2026
6549148,615256,Maryville (TN) Scots,615139,Adrian Bulldogs,615139,8,bot,Garrett Edgar to rf for Titus Suggs.,104,2026-03-07T11:00:00-05:00,"Ted Leonard Park (Greensboro, NC)",200,MBA,2026
6549148,615256,Maryville (TN) Scots,615139,Adrian Bulldogs,615139,8,bot,Gabe Jones walked (0-0).,105,2026-03-07T11:00:00-05:00,"Ted Leonard Park (Greensboro, NC)",200,MBA,2026
6549148,615256,Maryville (TN) Scots,615139,Adrian Bulldogs,615139,8,bot,"Jaxon McGuigan grounded out to p, SAC, bunt (0-0); Gabe Jones advanced to second.",106,2026-03-07T11:00:00-05:00,"Ted Leonard Park (Greensboro, NC)",200,MBA,2026
6549148,615256,Maryville (TN) Scots,615139,Adrian Bulldogs,615139,8,bot,Aiden Melvin grounded out to 3b (0-0).,107,2026-03-07T11:00:00-05:00,"Ted Leonard Park (Greensboro, NC)",200,MBA,2026
6549148,615256,Maryville (TN) Scots,615139,Adrian Bulldogs,615139,8,bot,Christian Oliver struck out looking (0-0).,108,2026-03-07T11:00:00-05:00,"Ted Leonard Park (Greensboro, NC)",200,MBA,2026
6549148,615256,Maryville (TN) Scots,615139,Adrian Bulldogs,615256,9,top,Irvin Hernandez singled to right field (0-0).,109,2026-03-07T11:00:00-05:00,"Ted Leonard Park (Greensboro, NC)",200,MBA,2026
6549148,615256,Maryville (TN) Scots,615139,Adrian Bulldogs,615256,9,top,"Garrett Edgar grounded out to 3b, SAC, bunt (0-0); Irvin Hernandez advanced to second.",110,2026-03-07T11:00:00-05:00,"Ted Leonard Park (Greensboro, NC)",200,MBA,2026
6549148,615256,Maryville (TN) Scots,615139,Adrian Bulldogs,615256,9,top,Masin Hall struck out swinging (0-0).,111,2026-03-07T11:00:00-05:00,"Ted Leonard Park (Greensboro, NC)",200,MBA,2026
6549148,615256,Maryville (TN) Scots,615139,Adrian Bulldogs,615256,9,top,Brayden Evans walked (0-0).,112,2026-03-07T11:00:00-05:00,"Ted Leonard Park (Greensboro, NC)",200,MBA,2026
6549148,615256,Maryville (TN) Scots,615139,Adrian Bulldogs,615256,9,top,Drew Henry struck out swinging (0-0).,113,2026-03-07T11:00:00-05:00,"Ted Leonard Park (Greensboro, NC)",200,MBA,2026
6549148,615256,Maryville (TN) Scots,615139,Adrian Bulldogs,615139,9,bot,Cam Oliver pinch hit for Rolando Jimenez.,114,2026-03-07T11:00:00-05:00,"Ted Leonard Park (Greensboro, NC)",200,MBA,2026
6549148,615256,Maryville (TN) Scots,615139,Adrian Bulldogs,615139,9,bot,Cam Oliver grounded out to 2b (0-0).,115,2026-03-07T11:00:00-05:00,"Ted Leonard Park (Greensboro, NC)",200,MBA,2026
6549148,615256,Maryville (TN) Scots,615139,Adrian Bulldogs,615139,9,bot,Jack Boike grounded out to 2b (0-0).,116,2026-03-07T11:00:00-05:00,"Ted Leonard Park (Greensboro, NC)",200,MBA,2026
6549148,615256,Maryville (TN) Scots,615139,Adrian Bulldogs,615139,9,bot,Nic Bruder singled to left field (0-0).,117,2026-03-07T11:00:00-05:00,"Ted Leonard Park (Greensboro, NC)",200,MBA,2026
6549148,615256,Maryville (TN) Scots,615139,Adrian Bulldogs,615139,9,bot,Casey Finn walked (0-0); Nic Bruder advanced to second.,118,2026-03-07T11:00:00-05:00,"Ted Leonard Park (Greensboro, NC)",200,MBA,2026
6549148,615256,Maryville (TN) Scots,615139,Adrian Bulldogs,615139,9,bot,Jake Burns struck out swinging (0-0).,119,2026-03-07T11:00:00-05:00,"Ted Leonard Park (Greensboro, NC)",200,MBA,2026
