game_id,away_team_id,away_team_name,home_team_id,home_team_name,batting_team,inning,top_bot,event_text,event_num,game_datetime,stadium_name,attendance,sport_id,season
6553818,614935,Colo. Christian Cougars,615106,Central Okla. Bronchos,614935,1,top,L. Hinze grounded out to 2b.,1,2026-02-13T01:00:00-05:00,"Wendell Simmons Field (Edmond, OK)",129,MBA,2026
6553818,614935,Colo. Christian Cougars,615106,Central Okla. Bronchos,614935,1,top,G. Rangel flied out to lf.,2,2026-02-13T01:00:00-05:00,"Wendell Simmons Field (Edmond, OK)",129,MBA,2026
6553818,614935,Colo. Christian Cougars,615106,Central Okla. Bronchos,614935,1,top,M. Hagel-Pit struck out swinging.,3,2026-02-13T01:00:00-05:00,"Wendell Simmons Field (Edmond, OK)",129,MBA,2026
6553818,614935,Colo. Christian Cougars,615106,Central Okla. Bronchos,615106,1,bot,K. Sheldon singled through the left side.,4,2026-02-13T01:00:00-05:00,"Wendell Simmons Field (Edmond, OK)",129,MBA,2026
6553818,614935,Colo. Christian Cougars,615106,Central Okla. Bronchos,615106,1,bot,L. Stout struck out swinging.,5,2026-02-13T01:00:00-05:00,"Wendell Simmons Field (Edmond, OK)",129,MBA,2026
6553818,614935,Colo. Christian Cougars,615106,Central Okla. Bronchos,615106,1,bot,K. Sheldon stole second.,6,2026-02-13T01:00:00-05:00,"Wendell Simmons Field (Edmond, OK)",129,MBA,2026
6553818,614935,Colo. Christian Cougars,615106,Central Okla. Bronchos,615106,1,bot,E. Alexander struck out swinging.,7,2026-02-13T01:00:00-05:00,"Wendell Simmons Field (Edmond, OK)",129,MBA,2026
6553818,614935,Colo. Christian Cougars,615106,Central Okla. Bronchos,615106,1,bot,T. Rowe flied out to lf.,8,2026-02-13T01:00:00-05:00,"Wendell Simmons Field (Edmond, OK)",129,MBA,2026
6553818,614935,Colo. Christian Cougars,615106,Central Okla. Bronchos,614935,2,top,A. Welsh hit by pitch.,9,2026-02-13T01:00:00-05:00,"Wendell Simmons Field (Edmond, OK)",129,MBA,2026
6553818,614935,Colo. Christian Cougars,615106,Central Okla. Bronchos,614935,2,top,N. Mensen struck out looking.,10,2026-02-13T01:00:00-05:00,"Wendell Simmons Field (Edmond, OK)",129,MBA,2026
6553818,614935,Colo. Christian Cougars,615106,Central Okla. Bronchos,614935,2,top,C. Lacy flied out to lf.,11,2026-02-13T01:00:00-05:00,"Wendell Simmons Field (Edmond, OK)",129,MBA,2026
6553818,614935,Colo. Christian Cougars,615106,Central Okla. Bronchos,614935,2,top,N. Owens struck out swinging.,12,2026-02-13T01:00:00-05:00,"Wendell Simmons Field (Edmond, OK)",129,MBA,2026
6553818,614935,Colo. Christian Cougars,615106,Central Okla. Bronchos,615106,2,bot,C. Ayres singled to left center.,13,2026-02-13T01:00:00-05:00,"Wendell Simmons Field (Edmond, OK)",129,MBA,2026
6553818,614935,Colo. Christian Cougars,615106,Central Okla. Bronchos,615106,2,bot,J. Archambea fouled out to rf.,14,2026-02-13T01:00:00-05:00,"Wendell Simmons Field (Edmond, OK)",129,MBA,2026
6553818,614935,Colo. Christian Cougars,615106,Central Okla. Bronchos,615106,2,bot,C. Taylor flied out to rf.,15,2026-02-13T01:00:00-05:00,"Wendell Simmons Field (Edmond, OK)",129,MBA,2026
6553818,614935,Colo. Christian Cougars,615106,Central Okla. Bronchos,615106,2,bot,C. Mills singled through the left side3a C. Ayres advanced to third.,16,2026-02-13T01:00:00-05:00,"Wendell Simmons Field (Edmond, OK)",129,MBA,2026
6553818,614935,Colo. Christian Cougars,615106,Central Okla. Bronchos,615106,2,bot,C. Mills stole second.,17,2026-02-13T01:00:00-05:00,"Wendell Simmons Field (Edmond, OK)",129,MBA,2026
6553818,614935,Colo. Christian Cougars,615106,Central Okla. Bronchos,615106,2,bot,C. Castle flied out to cf.,18,2026-02-13T01:00:00-05:00,"Wendell Simmons Field (Edmond, OK)",129,MBA,2026
6553818,614935,Colo. Christian Cougars,615106,Central Okla. Bronchos,614935,3,top,E. Kang struck out swinging.,19,2026-02-13T01:00:00-05:00,"Wendell Simmons Field (Edmond, OK)",129,MBA,2026
6553818,614935,Colo. Christian Cougars,615106,Central Okla. Bronchos,614935,3,top,Z. Bote singled up the middle.,20,2026-02-13T01:00:00-05:00,"Wendell Simmons Field (Edmond, OK)",129,MBA,2026
6553818,614935,Colo. Christian Cougars,615106,Central Okla. Bronchos,614935,3,top,L. Hinze reached on a fielder's choice to shortstop3a Z. Bote out at second ss unassisted.,21,2026-02-13T01:00:00-05:00,"Wendell Simmons Field (Edmond, OK)",129,MBA,2026
6553818,614935,Colo. Christian Cougars,615106,Central Okla. Bronchos,614935,3,top,G. Rangel singled to center field3a L. Hinze advanced to third.,22,2026-02-13T01:00:00-05:00,"Wendell Simmons Field (Edmond, OK)",129,MBA,2026
6553818,614935,Colo. Christian Cougars,615106,Central Okla. Bronchos,614935,3,top,M. Hagel-Pit struck out swinging.,23,2026-02-13T01:00:00-05:00,"Wendell Simmons Field (Edmond, OK)",129,MBA,2026
6553818,614935,Colo. Christian Cougars,615106,Central Okla. Bronchos,615106,3,bot,K. Sheldon flied out to cf.,24,2026-02-13T01:00:00-05:00,"Wendell Simmons Field (Edmond, OK)",129,MBA,2026
6553818,614935,Colo. Christian Cougars,615106,Central Okla. Bronchos,615106,3,bot,L. Stout singled to right field.,25,2026-02-13T01:00:00-05:00,"Wendell Simmons Field (Edmond, OK)",129,MBA,2026
6553818,614935,Colo. Christian Cougars,615106,Central Okla. Bronchos,615106,3,bot,E. Alexander struck out looking.,26,2026-02-13T01:00:00-05:00,"Wendell Simmons Field (Edmond, OK)",129,MBA,2026
6553818,614935,Colo. Christian Cougars,615106,Central Okla. Bronchos,615106,3,bot,T. Rowe popped up to 1b.,27,2026-02-13T01:00:00-05:00,"Wendell Simmons Field (Edmond, OK)",129,MBA,2026
6553818,614935,Colo. Christian Cougars,615106,Central Okla. Bronchos,614935,4,top,A. Welsh struck out looking.,28,2026-02-13T01:00:00-05:00,"Wendell Simmons Field (Edmond, OK)",129,MBA,2026
6553818,614935,Colo. Christian Cougars,615106,Central Okla. Bronchos,614935,4,top,N. Mensen popped up to 1b.,29,2026-02-13T01:00:00-05:00,"Wendell Simmons Field (Edmond, OK)",129,MBA,2026
6553818,614935,Colo. Christian Cougars,615106,Central Okla. Bronchos,614935,4,top,C. Lacy struck out swinging.,30,2026-02-13T01:00:00-05:00,"Wendell Simmons Field (Edmond, OK)",129,MBA,2026
6553818,614935,Colo. Christian Cougars,615106,Central Okla. Bronchos,615106,4,bot,C. Ayres flied out to cf.,31,2026-02-13T01:00:00-05:00,"Wendell Simmons Field (Edmond, OK)",129,MBA,2026
6553818,614935,Colo. Christian Cougars,615106,Central Okla. Bronchos,615106,4,bot,J. Archambea reached first on a throwing error by 3b.,32,2026-02-13T01:00:00-05:00,"Wendell Simmons Field (Edmond, OK)",129,MBA,2026
6553818,614935,Colo. Christian Cougars,615106,Central Okla. Bronchos,615106,4,bot,C. Taylor singled to left field3a J. Archambea advanced to third.,33,2026-02-13T01:00:00-05:00,"Wendell Simmons Field (Edmond, OK)",129,MBA,2026
6553818,614935,Colo. Christian Cougars,615106,Central Okla. Bronchos,615106,4,bot,"C. Mills reached on a fielder's choice, RBI3a C. Taylor out at second ss to 2b3a J. Archambea scored, unearned.",34,2026-02-13T01:00:00-05:00,"Wendell Simmons Field (Edmond, OK)",129,MBA,2026
6553818,614935,Colo. Christian Cougars,615106,Central Okla. Bronchos,615106,4,bot,C. Castle singled to center field3a C. Mills advanced to second.,35,2026-02-13T01:00:00-05:00,"Wendell Simmons Field (Edmond, OK)",129,MBA,2026
6553818,614935,Colo. Christian Cougars,615106,Central Okla. Bronchos,615106,4,bot,K. Sheldon popped up to 2b.,36,2026-02-13T01:00:00-05:00,"Wendell Simmons Field (Edmond, OK)",129,MBA,2026
6553818,614935,Colo. Christian Cougars,615106,Central Okla. Bronchos,614935,5,top,N. Owens hit by pitch.,37,2026-02-13T01:00:00-05:00,"Wendell Simmons Field (Edmond, OK)",129,MBA,2026
6553818,614935,Colo. Christian Cougars,615106,Central Okla. Bronchos,614935,5,top,N. Owens advanced to second on a wild pitch.,38,2026-02-13T01:00:00-05:00,"Wendell Simmons Field (Edmond, OK)",129,MBA,2026
6553818,614935,Colo. Christian Cougars,615106,Central Okla. Bronchos,614935,5,top,E. Kang flied out to lf.,39,2026-02-13T01:00:00-05:00,"Wendell Simmons Field (Edmond, OK)",129,MBA,2026
6553818,614935,Colo. Christian Cougars,615106,Central Okla. Bronchos,614935,5,top,Z. Bote struck out swinging.,40,2026-02-13T01:00:00-05:00,"Wendell Simmons Field (Edmond, OK)",129,MBA,2026
6553818,614935,Colo. Christian Cougars,615106,Central Okla. Bronchos,614935,5,top,L. Hinze walked.,41,2026-02-13T01:00:00-05:00,"Wendell Simmons Field (Edmond, OK)",129,MBA,2026
6553818,614935,Colo. Christian Cougars,615106,Central Okla. Bronchos,614935,5,top,G. Rangel grounded out to 1b unassisted.,42,2026-02-13T01:00:00-05:00,"Wendell Simmons Field (Edmond, OK)",129,MBA,2026
6553818,614935,Colo. Christian Cougars,615106,Central Okla. Bronchos,615106,5,bot,L. Stout flied out to cf.,43,2026-02-13T01:00:00-05:00,"Wendell Simmons Field (Edmond, OK)",129,MBA,2026
6553818,614935,Colo. Christian Cougars,615106,Central Okla. Bronchos,615106,5,bot,E. Alexander doubled to left center.,44,2026-02-13T01:00:00-05:00,"Wendell Simmons Field (Edmond, OK)",129,MBA,2026
6553818,614935,Colo. Christian Cougars,615106,Central Okla. Bronchos,615106,5,bot,T. Rowe flied out to lf.,45,2026-02-13T01:00:00-05:00,"Wendell Simmons Field (Edmond, OK)",129,MBA,2026
6553818,614935,Colo. Christian Cougars,615106,Central Okla. Bronchos,615106,5,bot,C. Ayres flied out to rf.,46,2026-02-13T01:00:00-05:00,"Wendell Simmons Field (Edmond, OK)",129,MBA,2026
6553818,614935,Colo. Christian Cougars,615106,Central Okla. Bronchos,614935,6,top,B. Schramm pinch hit for M. Hagel-Pit.,47,2026-02-13T01:00:00-05:00,"Wendell Simmons Field (Edmond, OK)",129,MBA,2026
6553818,614935,Colo. Christian Cougars,615106,Central Okla. Bronchos,614935,6,top,B. Schramm struck out looking.,48,2026-02-13T01:00:00-05:00,"Wendell Simmons Field (Edmond, OK)",129,MBA,2026
6553818,614935,Colo. Christian Cougars,615106,Central Okla. Bronchos,614935,6,top,A. Welsh flied out to cf.,49,2026-02-13T01:00:00-05:00,"Wendell Simmons Field (Edmond, OK)",129,MBA,2026
6553818,614935,Colo. Christian Cougars,615106,Central Okla. Bronchos,614935,6,top,N. Mensen singled up the middle.,50,2026-02-13T01:00:00-05:00,"Wendell Simmons Field (Edmond, OK)",129,MBA,2026
6553818,614935,Colo. Christian Cougars,615106,Central Okla. Bronchos,614935,6,top,N. Mensen stole second.,51,2026-02-13T01:00:00-05:00,"Wendell Simmons Field (Edmond, OK)",129,MBA,2026
6553818,614935,Colo. Christian Cougars,615106,Central Okla. Bronchos,614935,6,top,C. Lacy struck out swinging.,52,2026-02-13T01:00:00-05:00,"Wendell Simmons Field (Edmond, OK)",129,MBA,2026
6553818,614935,Colo. Christian Cougars,615106,Central Okla. Bronchos,615106,6,bot,J. Archambea flied out to lf.,53,2026-02-13T01:00:00-05:00,"Wendell Simmons Field (Edmond, OK)",129,MBA,2026
6553818,614935,Colo. Christian Cougars,615106,Central Okla. Bronchos,615106,6,bot,C. Taylor grounded out to ss.,54,2026-02-13T01:00:00-05:00,"Wendell Simmons Field (Edmond, OK)",129,MBA,2026
6553818,614935,Colo. Christian Cougars,615106,Central Okla. Bronchos,615106,6,bot,C. Mills walked.,55,2026-02-13T01:00:00-05:00,"Wendell Simmons Field (Edmond, OK)",129,MBA,2026
6553818,614935,Colo. Christian Cougars,615106,Central Okla. Bronchos,615106,6,bot,C. Castle reached on a fielder's choice3a C. Mills out at second ss to 2b.,56,2026-02-13T01:00:00-05:00,"Wendell Simmons Field (Edmond, OK)",129,MBA,2026
6553818,614935,Colo. Christian Cougars,615106,Central Okla. Bronchos,614935,7,top,D. Lee to 1b for L. Stout.,57,2026-02-13T01:00:00-05:00,"Wendell Simmons Field (Edmond, OK)",129,MBA,2026
6553818,614935,Colo. Christian Cougars,615106,Central Okla. Bronchos,614935,7,top,B. Berlowitz to p for B. Jones.,58,2026-02-13T01:00:00-05:00,"Wendell Simmons Field (Edmond, OK)",129,MBA,2026
6553818,614935,Colo. Christian Cougars,615106,Central Okla. Bronchos,614935,7,top,N. Owens struck out swinging.,59,2026-02-13T01:00:00-05:00,"Wendell Simmons Field (Edmond, OK)",129,MBA,2026
6553818,614935,Colo. Christian Cougars,615106,Central Okla. Bronchos,614935,7,top,E. Kang grounded out to 3b.,60,2026-02-13T01:00:00-05:00,"Wendell Simmons Field (Edmond, OK)",129,MBA,2026
6553818,614935,Colo. Christian Cougars,615106,Central Okla. Bronchos,614935,7,top,Z. Bote struck out swinging.,61,2026-02-13T01:00:00-05:00,"Wendell Simmons Field (Edmond, OK)",129,MBA,2026
