game_id,away_team_id,away_team_name,home_team_id,home_team_name,batting_team,inning,top_bot,event_text,event_num,game_datetime,stadium_name,attendance,sport_id,season
6555570,614932,UCCS Mountain Lions,615017,Chico St. Wildcats,614932,1,top,Q. Medin grounded out to 2b (1-2 BSK).,1,2026-02-20T03:00:00-05:00,"Nettleton Stadium (Chico, CA)",0,MBA,2026
6555570,614932,UCCS Mountain Lions,615017,Chico St. Wildcats,614932,1,top,B. Killeen walked (3-0 BBBB).,2,2026-02-20T03:00:00-05:00,"Nettleton Stadium (Chico, CA)",0,MBA,2026
6555570,614932,UCCS Mountain Lions,615017,Chico St. Wildcats,614932,1,top,B. Peterson flied out to cf (1-2 KFBF).,3,2026-02-20T03:00:00-05:00,"Nettleton Stadium (Chico, CA)",0,MBA,2026
6555570,614932,UCCS Mountain Lions,615017,Chico St. Wildcats,614932,1,top,N. Oliver struck out looking (1-2 SBKK).,4,2026-02-20T03:00:00-05:00,"Nettleton Stadium (Chico, CA)",0,MBA,2026
6555570,614932,UCCS Mountain Lions,615017,Chico St. Wildcats,615017,1,bot,"ROLLING, K. struck out swinging (3-2 KBBBKS).",5,2026-02-20T03:00:00-05:00,"Nettleton Stadium (Chico, CA)",0,MBA,2026
6555570,614932,UCCS Mountain Lions,615017,Chico St. Wildcats,615017,1,bot,"WALTON, M. lined out to cf (3-2 FBKFFBB).",6,2026-02-20T03:00:00-05:00,"Nettleton Stadium (Chico, CA)",0,MBA,2026
6555570,614932,UCCS Mountain Lions,615017,Chico St. Wildcats,615017,1,bot,"SNITKO, J. flied out to lf (2-2 BKBK).",7,2026-02-20T03:00:00-05:00,"Nettleton Stadium (Chico, CA)",0,MBA,2026
6555570,614932,UCCS Mountain Lions,615017,Chico St. Wildcats,614932,2,top,T. Dale singled to third base (1-0 B).,8,2026-02-20T03:00:00-05:00,"Nettleton Stadium (Chico, CA)",0,MBA,2026
6555570,614932,UCCS Mountain Lions,615017,Chico St. Wildcats,614932,2,top,T. Dale stole second.,9,2026-02-20T03:00:00-05:00,"Nettleton Stadium (Chico, CA)",0,MBA,2026
6555570,614932,UCCS Mountain Lions,615017,Chico St. Wildcats,614932,2,top,T. Mayberry walked (3-1 BBFBB).,10,2026-02-20T03:00:00-05:00,"Nettleton Stadium (Chico, CA)",0,MBA,2026
6555570,614932,UCCS Mountain Lions,615017,Chico St. Wildcats,614932,2,top,"T. Buchman singled, bunt (1-1 BF)3a T. Mayberry advanced to second3a T. Dale advanced to third.",11,2026-02-20T03:00:00-05:00,"Nettleton Stadium (Chico, CA)",0,MBA,2026
6555570,614932,UCCS Mountain Lions,615017,Chico St. Wildcats,614932,2,top,Vandegrift infield fly to 2b (2-1 BBK).,12,2026-02-20T03:00:00-05:00,"Nettleton Stadium (Chico, CA)",0,MBA,2026
6555570,614932,UCCS Mountain Lions,615017,Chico St. Wildcats,614932,2,top,"McCURLEY, A. to p for SEIBERT, A..",13,2026-02-20T03:00:00-05:00,"Nettleton Stadium (Chico, CA)",0,MBA,2026
6555570,614932,UCCS Mountain Lions,615017,Chico St. Wildcats,614932,2,top,"T. Genrich reached on a fielding error by ss, advanced to second on a fielding error by lf, advanced to third on the error, RBI (0-1 S)3a T. Buchman scored on the error3a T. Mayberry scored on the error3a T. Dale scored on the error.",14,2026-02-20T03:00:00-05:00,"Nettleton Stadium (Chico, CA)",0,MBA,2026
6555570,614932,UCCS Mountain Lions,615017,Chico St. Wildcats,614932,2,top,Q. Medin hit by pitch.,15,2026-02-20T03:00:00-05:00,"Nettleton Stadium (Chico, CA)",0,MBA,2026
6555570,614932,UCCS Mountain Lions,615017,Chico St. Wildcats,614932,2,top,"Q. Medin stole second3a T. Genrich scored on a throwing error by c, unearned.",16,2026-02-20T03:00:00-05:00,"Nettleton Stadium (Chico, CA)",0,MBA,2026
6555570,614932,UCCS Mountain Lions,615017,Chico St. Wildcats,614932,2,top,B. Killeen struck out swinging (1-2 KBFS).,17,2026-02-20T03:00:00-05:00,"Nettleton Stadium (Chico, CA)",0,MBA,2026
6555570,614932,UCCS Mountain Lions,615017,Chico St. Wildcats,614932,2,top,"B. Peterson doubled, advanced to third on a throwing error by 1b3a Q. Medin scored on the error.",18,2026-02-20T03:00:00-05:00,"Nettleton Stadium (Chico, CA)",0,MBA,2026
6555570,614932,UCCS Mountain Lions,615017,Chico St. Wildcats,614932,2,top,"N. Oliver singled to left field, RBI (1-1 BK)3a B. Peterson scored, unearned.",19,2026-02-20T03:00:00-05:00,"Nettleton Stadium (Chico, CA)",0,MBA,2026
6555570,614932,UCCS Mountain Lions,615017,Chico St. Wildcats,614932,2,top,T. Dale reached on a fielder's choice to second base (0-0)3a N. Oliver out at second 2b unassisted.,20,2026-02-20T03:00:00-05:00,"Nettleton Stadium (Chico, CA)",0,MBA,2026
6555570,614932,UCCS Mountain Lions,615017,Chico St. Wildcats,615017,2,bot,"CANTU, J. fouled out to 3b (2-2 KSFBFB).",21,2026-02-20T03:00:00-05:00,"Nettleton Stadium (Chico, CA)",0,MBA,2026
6555570,614932,UCCS Mountain Lions,615017,Chico St. Wildcats,615017,2,bot,"BAKER, M. struck out looking (3-2 FBBFBK).",22,2026-02-20T03:00:00-05:00,"Nettleton Stadium (Chico, CA)",0,MBA,2026
6555570,614932,UCCS Mountain Lions,615017,Chico St. Wildcats,615017,2,bot,"GADD, J. struck out looking (2-2 FFBBK).",23,2026-02-20T03:00:00-05:00,"Nettleton Stadium (Chico, CA)",0,MBA,2026
6555570,614932,UCCS Mountain Lions,615017,Chico St. Wildcats,614932,3,top,T. Mayberry reached on a fielding error by ss (2-2 KBBK).,24,2026-02-20T03:00:00-05:00,"Nettleton Stadium (Chico, CA)",0,MBA,2026
6555570,614932,UCCS Mountain Lions,615017,Chico St. Wildcats,614932,3,top,T. Buchman struck out swinging (1-2 KBFS).,25,2026-02-20T03:00:00-05:00,"Nettleton Stadium (Chico, CA)",0,MBA,2026
6555570,614932,UCCS Mountain Lions,615017,Chico St. Wildcats,614932,3,top,Vandegrift fouled out to c (2-2 BKFBF).,26,2026-02-20T03:00:00-05:00,"Nettleton Stadium (Chico, CA)",0,MBA,2026
6555570,614932,UCCS Mountain Lions,615017,Chico St. Wildcats,614932,3,top,T. Genrich out at first ss to 2b (0-0).,27,2026-02-20T03:00:00-05:00,"Nettleton Stadium (Chico, CA)",0,MBA,2026
6555570,614932,UCCS Mountain Lions,615017,Chico St. Wildcats,615017,3,bot,"WRIGHT, B. hit by pitch (0-0).",28,2026-02-20T03:00:00-05:00,"Nettleton Stadium (Chico, CA)",0,MBA,2026
6555570,614932,UCCS Mountain Lions,615017,Chico St. Wildcats,615017,3,bot,"COLOMA, K. flied out to lf (2-0 BB).",29,2026-02-20T03:00:00-05:00,"Nettleton Stadium (Chico, CA)",0,MBA,2026
6555570,614932,UCCS Mountain Lions,615017,Chico St. Wildcats,615017,3,bot,"WRIGHT, B. advanced to second on a wild pitch.",30,2026-02-20T03:00:00-05:00,"Nettleton Stadium (Chico, CA)",0,MBA,2026
6555570,614932,UCCS Mountain Lions,615017,Chico St. Wildcats,615017,3,bot,"WRIGHT, B. advanced to third on a passed ball.",31,2026-02-20T03:00:00-05:00,"Nettleton Stadium (Chico, CA)",0,MBA,2026
6555570,614932,UCCS Mountain Lions,615017,Chico St. Wildcats,615017,3,bot,"HODGES, J. walked (3-2 KFBBBB).",32,2026-02-20T03:00:00-05:00,"Nettleton Stadium (Chico, CA)",0,MBA,2026
6555570,614932,UCCS Mountain Lions,615017,Chico St. Wildcats,615017,3,bot,"ROLLING, K. singled to left field, RBI (0-1 K)3a HODGES, J. advanced to second3a WRIGHT, B. scored.",33,2026-02-20T03:00:00-05:00,"Nettleton Stadium (Chico, CA)",0,MBA,2026
6555570,614932,UCCS Mountain Lions,615017,Chico St. Wildcats,615017,3,bot,"ROLLING, K. advanced to second on a wild pitch3a HODGES, J. advanced to third on a wild pitch.",34,2026-02-20T03:00:00-05:00,"Nettleton Stadium (Chico, CA)",0,MBA,2026
6555570,614932,UCCS Mountain Lions,615017,Chico St. Wildcats,615017,3,bot,"WALTON, M. struck out swinging (1-2 BKFS).",35,2026-02-20T03:00:00-05:00,"Nettleton Stadium (Chico, CA)",0,MBA,2026
6555570,614932,UCCS Mountain Lions,615017,Chico St. Wildcats,615017,3,bot,"SNITKO, J. flied out to cf (0-0).",36,2026-02-20T03:00:00-05:00,"Nettleton Stadium (Chico, CA)",0,MBA,2026
6555570,614932,UCCS Mountain Lions,615017,Chico St. Wildcats,614932,4,top,Q. Medin flied out to rf (1-2 KKB).,37,2026-02-20T03:00:00-05:00,"Nettleton Stadium (Chico, CA)",0,MBA,2026
6555570,614932,UCCS Mountain Lions,615017,Chico St. Wildcats,614932,4,top,B. Killeen flied out to rf (1-2 FFB).,38,2026-02-20T03:00:00-05:00,"Nettleton Stadium (Chico, CA)",0,MBA,2026
6555570,614932,UCCS Mountain Lions,615017,Chico St. Wildcats,614932,4,top,B. Peterson grounded out to 3b (0-2 KK).,39,2026-02-20T03:00:00-05:00,"Nettleton Stadium (Chico, CA)",0,MBA,2026
6555570,614932,UCCS Mountain Lions,615017,Chico St. Wildcats,615017,4,bot,"CANTU, J. grounded out to 2b (1-1 BK).",40,2026-02-20T03:00:00-05:00,"Nettleton Stadium (Chico, CA)",0,MBA,2026
6555570,614932,UCCS Mountain Lions,615017,Chico St. Wildcats,615017,4,bot,"BAKER, M. grounded out to ss (3-2 BBKKFBFF).",41,2026-02-20T03:00:00-05:00,"Nettleton Stadium (Chico, CA)",0,MBA,2026
6555570,614932,UCCS Mountain Lions,615017,Chico St. Wildcats,615017,4,bot,"GADD, J. singled to left field (1-0 B).",42,2026-02-20T03:00:00-05:00,"Nettleton Stadium (Chico, CA)",0,MBA,2026
6555570,614932,UCCS Mountain Lions,615017,Chico St. Wildcats,615017,4,bot,"WRIGHT, B. reached on a fielding error by ss (1-1 KB)3a GADD, J. advanced to second.",43,2026-02-20T03:00:00-05:00,"Nettleton Stadium (Chico, CA)",0,MBA,2026
6555570,614932,UCCS Mountain Lions,615017,Chico St. Wildcats,615017,4,bot,"COLOMA, K. tripled down the rf line, 2 RBI (3-2 BBKSBF)3a WRIGHT, B. scored, unearned3a GADD, J. scored, unearned.",44,2026-02-20T03:00:00-05:00,"Nettleton Stadium (Chico, CA)",0,MBA,2026
6555570,614932,UCCS Mountain Lions,615017,Chico St. Wildcats,615017,4,bot,"HODGES, J. singled up the middle, RBI (1-2 KFB)3a COLOMA, K. scored, unearned.",45,2026-02-20T03:00:00-05:00,"Nettleton Stadium (Chico, CA)",0,MBA,2026
6555570,614932,UCCS Mountain Lions,615017,Chico St. Wildcats,615017,4,bot,"ROLLING, K. flied out to lf (2-1 BFB).",46,2026-02-20T03:00:00-05:00,"Nettleton Stadium (Chico, CA)",0,MBA,2026
6555570,614932,UCCS Mountain Lions,615017,Chico St. Wildcats,614932,5,top,N. Oliver grounded out to 3b (2-2 BKFBK).,47,2026-02-20T03:00:00-05:00,"Nettleton Stadium (Chico, CA)",0,MBA,2026
6555570,614932,UCCS Mountain Lions,615017,Chico St. Wildcats,614932,5,top,T. Dale struck out swinging (1-2 BKSS).,48,2026-02-20T03:00:00-05:00,"Nettleton Stadium (Chico, CA)",0,MBA,2026
6555570,614932,UCCS Mountain Lions,615017,Chico St. Wildcats,614932,5,top,T. Mayberry flied out to lf (2-2 BSSFB).,49,2026-02-20T03:00:00-05:00,"Nettleton Stadium (Chico, CA)",0,MBA,2026
6555570,614932,UCCS Mountain Lions,615017,Chico St. Wildcats,615017,5,bot,"WALTON, M. flied out to rf (2-1 BBK).",50,2026-02-20T03:00:00-05:00,"Nettleton Stadium (Chico, CA)",0,MBA,2026
6555570,614932,UCCS Mountain Lions,615017,Chico St. Wildcats,615017,5,bot,"SNITKO, J. walked (3-1 BSBBB).",51,2026-02-20T03:00:00-05:00,"Nettleton Stadium (Chico, CA)",0,MBA,2026
6555570,614932,UCCS Mountain Lions,615017,Chico St. Wildcats,615017,5,bot,"CANTU, J. reached on a fielder's choice to second base (3-2 KBBKB)3a SNITKO, J. out at second 2b to ss.",52,2026-02-20T03:00:00-05:00,"Nettleton Stadium (Chico, CA)",0,MBA,2026
6555570,614932,UCCS Mountain Lions,615017,Chico St. Wildcats,615017,5,bot,"BAKER, M. struck out swinging (1-2 BFFS).",53,2026-02-20T03:00:00-05:00,"Nettleton Stadium (Chico, CA)",0,MBA,2026
6555570,614932,UCCS Mountain Lions,615017,Chico St. Wildcats,614932,6,top,T. Buchman flied out to rf (2-1 FBB).,54,2026-02-20T03:00:00-05:00,"Nettleton Stadium (Chico, CA)",0,MBA,2026
6555570,614932,UCCS Mountain Lions,615017,Chico St. Wildcats,614932,6,top,Vandegrift flied out to lf (0-0).,55,2026-02-20T03:00:00-05:00,"Nettleton Stadium (Chico, CA)",0,MBA,2026
6555570,614932,UCCS Mountain Lions,615017,Chico St. Wildcats,614932,6,top,T. Genrich struck out looking (2-2 KSBFBFK).,56,2026-02-20T03:00:00-05:00,"Nettleton Stadium (Chico, CA)",0,MBA,2026
6555570,614932,UCCS Mountain Lions,615017,Chico St. Wildcats,615017,6,bot,J. Harbison to p for J. Fink.,57,2026-02-20T03:00:00-05:00,"Nettleton Stadium (Chico, CA)",0,MBA,2026
6555570,614932,UCCS Mountain Lions,615017,Chico St. Wildcats,615017,6,bot,"FOLEY, S. pinch hit for GADD, J..",58,2026-02-20T03:00:00-05:00,"Nettleton Stadium (Chico, CA)",0,MBA,2026
6555570,614932,UCCS Mountain Lions,615017,Chico St. Wildcats,615017,6,bot,"FOLEY, S. reached on an error by 1b, assist by 2b (2-2 BKKB).",59,2026-02-20T03:00:00-05:00,"Nettleton Stadium (Chico, CA)",0,MBA,2026
6555570,614932,UCCS Mountain Lions,615017,Chico St. Wildcats,615017,6,bot,"WRIGHT, B. hit by pitch (1-0 B)3a FOLEY, S. advanced to second.",60,2026-02-20T03:00:00-05:00,"Nettleton Stadium (Chico, CA)",0,MBA,2026
6555570,614932,UCCS Mountain Lions,615017,Chico St. Wildcats,615017,6,bot,"COLOMA, K. struck out swinging, bunt (2-2 BSBKS).",61,2026-02-20T03:00:00-05:00,"Nettleton Stadium (Chico, CA)",0,MBA,2026
6555570,614932,UCCS Mountain Lions,615017,Chico St. Wildcats,615017,6,bot,"HODGES, J. singled to right field, RBI (0-2 KK)3a WRIGHT, B. advanced to third3a FOLEY, S. scored, unearned.",62,2026-02-20T03:00:00-05:00,"Nettleton Stadium (Chico, CA)",0,MBA,2026
6555570,614932,UCCS Mountain Lions,615017,Chico St. Wildcats,615017,6,bot,"ROLLING, K. reached on a fielder's choice to catcher (1-0 B)3a HODGES, J. advanced to second3a WRIGHT, B. out at home p to c.",63,2026-02-20T03:00:00-05:00,"Nettleton Stadium (Chico, CA)",0,MBA,2026
6555570,614932,UCCS Mountain Lions,615017,Chico St. Wildcats,615017,6,bot,"WALTON, M. singled to right field, RBI (1-1 FB)3a ROLLING, K. advanced to second3a HODGES, J. scored, unearned.",64,2026-02-20T03:00:00-05:00,"Nettleton Stadium (Chico, CA)",0,MBA,2026
6555570,614932,UCCS Mountain Lions,615017,Chico St. Wildcats,615017,6,bot,"SNITKO, J. reached on a fielder's choice to third base (2-1 BKB)3a WALTON, M. out at second 3b to 2b.",65,2026-02-20T03:00:00-05:00,"Nettleton Stadium (Chico, CA)",0,MBA,2026
6555570,614932,UCCS Mountain Lions,615017,Chico St. Wildcats,614932,7,top,"FOLEY, S. to dh.",66,2026-02-20T03:00:00-05:00,"Nettleton Stadium (Chico, CA)",0,MBA,2026
6555570,614932,UCCS Mountain Lions,615017,Chico St. Wildcats,614932,7,top,Q. Medin doubled down the rf line (1-2 BSSF).,67,2026-02-20T03:00:00-05:00,"Nettleton Stadium (Chico, CA)",0,MBA,2026
6555570,614932,UCCS Mountain Lions,615017,Chico St. Wildcats,614932,7,top,B. Killeen struck out looking (1-2 SFBK).,68,2026-02-20T03:00:00-05:00,"Nettleton Stadium (Chico, CA)",0,MBA,2026
6555570,614932,UCCS Mountain Lions,615017,Chico St. Wildcats,614932,7,top,B. Peterson flied out to cf3a Q. Medin advanced to third.,69,2026-02-20T03:00:00-05:00,"Nettleton Stadium (Chico, CA)",0,MBA,2026
6555570,614932,UCCS Mountain Lions,615017,Chico St. Wildcats,614932,7,top,N. Oliver popped up to 2b (0-0).,70,2026-02-20T03:00:00-05:00,"Nettleton Stadium (Chico, CA)",0,MBA,2026
6555570,614932,UCCS Mountain Lions,615017,Chico St. Wildcats,615017,7,bot,"CANTU, J. struck out swinging (0-2 KSS).",71,2026-02-20T03:00:00-05:00,"Nettleton Stadium (Chico, CA)",0,MBA,2026
6555570,614932,UCCS Mountain Lions,615017,Chico St. Wildcats,615017,7,bot,"BAKER, M. flied out to cf (0-0).",72,2026-02-20T03:00:00-05:00,"Nettleton Stadium (Chico, CA)",0,MBA,2026
6555570,614932,UCCS Mountain Lions,615017,Chico St. Wildcats,615017,7,bot,"FOLEY, S. to dh.",73,2026-02-20T03:00:00-05:00,"Nettleton Stadium (Chico, CA)",0,MBA,2026
6555570,614932,UCCS Mountain Lions,615017,Chico St. Wildcats,615017,7,bot,"FOLEY, S. singled to center field (3-1 BBKB).",74,2026-02-20T03:00:00-05:00,"Nettleton Stadium (Chico, CA)",0,MBA,2026
6555570,614932,UCCS Mountain Lions,615017,Chico St. Wildcats,615017,7,bot,"FOLEY, S. out at first c to 1b, picked off.",75,2026-02-20T03:00:00-05:00,"Nettleton Stadium (Chico, CA)",0,MBA,2026
6555570,614932,UCCS Mountain Lions,615017,Chico St. Wildcats,614932,8,top,Chico State is challenging Pick Off3a call stands.,76,2026-02-20T03:00:00-05:00,"Nettleton Stadium (Chico, CA)",0,MBA,2026
6555570,614932,UCCS Mountain Lions,615017,Chico St. Wildcats,614932,8,top,"NEUGEBAUER to p for McCURLEY, A..",77,2026-02-20T03:00:00-05:00,"Nettleton Stadium (Chico, CA)",0,MBA,2026
6555570,614932,UCCS Mountain Lions,615017,Chico St. Wildcats,614932,8,top,T. Dale struck out looking (1-2 FBFK).,78,2026-02-20T03:00:00-05:00,"Nettleton Stadium (Chico, CA)",0,MBA,2026
6555570,614932,UCCS Mountain Lions,615017,Chico St. Wildcats,614932,8,top,T. Mayberry walked (3-2 KBBFBFFB).,79,2026-02-20T03:00:00-05:00,"Nettleton Stadium (Chico, CA)",0,MBA,2026
6555570,614932,UCCS Mountain Lions,615017,Chico St. Wildcats,614932,8,top,T. Mayberry stole second.,80,2026-02-20T03:00:00-05:00,"Nettleton Stadium (Chico, CA)",0,MBA,2026
6555570,614932,UCCS Mountain Lions,615017,Chico St. Wildcats,614932,8,top,L. Whalen pinch ran for T. Mayberry.,81,2026-02-20T03:00:00-05:00,"Nettleton Stadium (Chico, CA)",0,MBA,2026
6555570,614932,UCCS Mountain Lions,615017,Chico St. Wildcats,614932,8,top,T. Buchman singled to first base3a L. Whalen advanced to third.,82,2026-02-20T03:00:00-05:00,"Nettleton Stadium (Chico, CA)",0,MBA,2026
6555570,614932,UCCS Mountain Lions,615017,Chico St. Wildcats,614932,8,top,"Vandegrift reached on a fielder's choice to first base, bunt (0-1 F)3a T. Buchman advanced to second3a L. Whalen out at home 1b to c.",83,2026-02-20T03:00:00-05:00,"Nettleton Stadium (Chico, CA)",0,MBA,2026
6555570,614932,UCCS Mountain Lions,615017,Chico St. Wildcats,614932,8,top,"T. Genrich singled to center field3a Vandegrift advanced to second3a T. Buchman advanced to third, out at home cf to c.",84,2026-02-20T03:00:00-05:00,"Nettleton Stadium (Chico, CA)",0,MBA,2026
6555570,614932,UCCS Mountain Lions,615017,Chico St. Wildcats,615017,8,bot,UCCS challenges out at homeplate3a call confirmed.,85,2026-02-20T03:00:00-05:00,"Nettleton Stadium (Chico, CA)",0,MBA,2026
6555570,614932,UCCS Mountain Lions,615017,Chico St. Wildcats,615017,8,bot,L. Whalen to dh.,86,2026-02-20T03:00:00-05:00,"Nettleton Stadium (Chico, CA)",0,MBA,2026
6555570,614932,UCCS Mountain Lions,615017,Chico St. Wildcats,615017,8,bot,"WRIGHT, B. flied out to cf (0-0).",87,2026-02-20T03:00:00-05:00,"Nettleton Stadium (Chico, CA)",0,MBA,2026
6555570,614932,UCCS Mountain Lions,615017,Chico St. Wildcats,615017,8,bot,"ROBERTS, R. pinch hit for COLOMA, K..",88,2026-02-20T03:00:00-05:00,"Nettleton Stadium (Chico, CA)",0,MBA,2026
6555570,614932,UCCS Mountain Lions,615017,Chico St. Wildcats,615017,8,bot,"ROBERTS, R. struck out swinging (1-2 KSBFS).",89,2026-02-20T03:00:00-05:00,"Nettleton Stadium (Chico, CA)",0,MBA,2026
6555570,614932,UCCS Mountain Lions,615017,Chico St. Wildcats,615017,8,bot,"HODGES, J. grounded out to 2b (0-2 FK).",90,2026-02-20T03:00:00-05:00,"Nettleton Stadium (Chico, CA)",0,MBA,2026
6555570,614932,UCCS Mountain Lions,615017,Chico St. Wildcats,614932,9,top,"WRIGHT, B. to lf.",91,2026-02-20T03:00:00-05:00,"Nettleton Stadium (Chico, CA)",0,MBA,2026
6555570,614932,UCCS Mountain Lions,615017,Chico St. Wildcats,614932,9,top,"CASE, C. to rf for ROBERTS, R..",92,2026-02-20T03:00:00-05:00,"Nettleton Stadium (Chico, CA)",0,MBA,2026
6555570,614932,UCCS Mountain Lions,615017,Chico St. Wildcats,614932,9,top,"LOPEZ, M. to p for NEUGEBAUER.",93,2026-02-20T03:00:00-05:00,"Nettleton Stadium (Chico, CA)",0,MBA,2026
6555570,614932,UCCS Mountain Lions,615017,Chico St. Wildcats,614932,9,top,Q. Medin struck out swinging (3-2 FBBBKFS).,94,2026-02-20T03:00:00-05:00,"Nettleton Stadium (Chico, CA)",0,MBA,2026
6555570,614932,UCCS Mountain Lions,615017,Chico St. Wildcats,614932,9,top,B. Killeen singled to center field.,95,2026-02-20T03:00:00-05:00,"Nettleton Stadium (Chico, CA)",0,MBA,2026
6555570,614932,UCCS Mountain Lions,615017,Chico St. Wildcats,614932,9,top,B. Peterson singled to left field (1-0 B)3a B. Killeen advanced to third.,96,2026-02-20T03:00:00-05:00,"Nettleton Stadium (Chico, CA)",0,MBA,2026
6555570,614932,UCCS Mountain Lions,615017,Chico St. Wildcats,614932,9,top,B. Peterson stole second.,97,2026-02-20T03:00:00-05:00,"Nettleton Stadium (Chico, CA)",0,MBA,2026
6555570,614932,UCCS Mountain Lions,615017,Chico St. Wildcats,614932,9,top,"N. Oliver reached on a dropped fly by lf, SF, RBI (0-0)3a B. Killeen scored.",98,2026-02-20T03:00:00-05:00,"Nettleton Stadium (Chico, CA)",0,MBA,2026
6555570,614932,UCCS Mountain Lions,615017,Chico St. Wildcats,614932,9,top,T. Dale flied out to cf (2-2 BKBSF).,99,2026-02-20T03:00:00-05:00,"Nettleton Stadium (Chico, CA)",0,MBA,2026
6555570,614932,UCCS Mountain Lions,615017,Chico St. Wildcats,614932,9,top,N. Oliver stole second3a B. Peterson stole third.,100,2026-02-20T03:00:00-05:00,"Nettleton Stadium (Chico, CA)",0,MBA,2026
6555570,614932,UCCS Mountain Lions,615017,Chico St. Wildcats,614932,9,top,L. Whalen struck out swinging (1-2 BKFFFS).,101,2026-02-20T03:00:00-05:00,"Nettleton Stadium (Chico, CA)",0,MBA,2026
6555570,614932,UCCS Mountain Lions,615017,Chico St. Wildcats,615017,9,bot,M. Hartle to p for J. Harbison.,102,2026-02-20T03:00:00-05:00,"Nettleton Stadium (Chico, CA)",0,MBA,2026
6555570,614932,UCCS Mountain Lions,615017,Chico St. Wildcats,615017,9,bot,"ROLLING, K. walked (3-0 BBBB).",103,2026-02-20T03:00:00-05:00,"Nettleton Stadium (Chico, CA)",0,MBA,2026
6555570,614932,UCCS Mountain Lions,615017,Chico St. Wildcats,615017,9,bot,"ROLLING, K. advanced to second on a wild pitch.",104,2026-02-20T03:00:00-05:00,"Nettleton Stadium (Chico, CA)",0,MBA,2026
6555570,614932,UCCS Mountain Lions,615017,Chico St. Wildcats,615017,9,bot,"WALTON, M. reached on a fielding error by ss (1-0 B)3a ROLLING, K. advanced to third.",105,2026-02-20T03:00:00-05:00,"Nettleton Stadium (Chico, CA)",0,MBA,2026
6555570,614932,UCCS Mountain Lions,615017,Chico St. Wildcats,615017,9,bot,"SNITKO, J. popped up to 2b (1-2 KSFB).",106,2026-02-20T03:00:00-05:00,"Nettleton Stadium (Chico, CA)",0,MBA,2026
6555570,614932,UCCS Mountain Lions,615017,Chico St. Wildcats,615017,9,bot,"CANTU, J. reached on a fielder's choice to third base, RBI3a WALTON, M. out at second 3b to 2b3a ROLLING, K. scored, unearned.",107,2026-02-20T03:00:00-05:00,"Nettleton Stadium (Chico, CA)",0,MBA,2026
6555570,614932,UCCS Mountain Lions,615017,Chico St. Wildcats,615017,9,bot,"WHITE, B. pinch ran for CANTU, J..",108,2026-02-20T03:00:00-05:00,"Nettleton Stadium (Chico, CA)",0,MBA,2026
6555570,614932,UCCS Mountain Lions,615017,Chico St. Wildcats,615017,9,bot,"BAKER, M. walked (3-1 BBBKB)3a WHITE, B. advanced to second.",109,2026-02-20T03:00:00-05:00,"Nettleton Stadium (Chico, CA)",0,MBA,2026
6555570,614932,UCCS Mountain Lions,615017,Chico St. Wildcats,615017,9,bot,"BAKER, M. advanced to second on a wild pitch3a WHITE, B. advanced to third on a wild pitch.",110,2026-02-20T03:00:00-05:00,"Nettleton Stadium (Chico, CA)",0,MBA,2026
6555570,614932,UCCS Mountain Lions,615017,Chico St. Wildcats,615017,9,bot,"FOLEY, S. walked (3-1 BKBBB).",111,2026-02-20T03:00:00-05:00,"Nettleton Stadium (Chico, CA)",0,MBA,2026
6555570,614932,UCCS Mountain Lions,615017,Chico St. Wildcats,615017,9,bot,"WRIGHT, B. struck out swinging (1-2 BKFS).",112,2026-02-20T03:00:00-05:00,"Nettleton Stadium (Chico, CA)",0,MBA,2026
6555570,614932,UCCS Mountain Lions,615017,Chico St. Wildcats,614932,10,top,"NACHREINER to c for WHITE, B..",113,2026-02-20T03:00:00-05:00,"Nettleton Stadium (Chico, CA)",0,MBA,2026
6555570,614932,UCCS Mountain Lions,615017,Chico St. Wildcats,614932,10,top,"POOLE, J. to p for LOPEZ, M..",114,2026-02-20T03:00:00-05:00,"Nettleton Stadium (Chico, CA)",0,MBA,2026
6555570,614932,UCCS Mountain Lions,615017,Chico St. Wildcats,614932,10,top,T. Buchman struck out swinging (3-2 KBFBBS).,115,2026-02-20T03:00:00-05:00,"Nettleton Stadium (Chico, CA)",0,MBA,2026
6555570,614932,UCCS Mountain Lions,615017,Chico St. Wildcats,614932,10,top,Vandegrift flied out to rf (3-1 BBBK).,116,2026-02-20T03:00:00-05:00,"Nettleton Stadium (Chico, CA)",0,MBA,2026
6555570,614932,UCCS Mountain Lions,615017,Chico St. Wildcats,614932,10,top,T. Genrich flied out to cf (2-1 BBK).,117,2026-02-20T03:00:00-05:00,"Nettleton Stadium (Chico, CA)",0,MBA,2026
6555570,614932,UCCS Mountain Lions,615017,Chico St. Wildcats,615017,10,bot,"CASE, C. singled to left field (2-1 BBK).",118,2026-02-20T03:00:00-05:00,"Nettleton Stadium (Chico, CA)",0,MBA,2026
6555570,614932,UCCS Mountain Lions,615017,Chico St. Wildcats,615017,10,bot,"HODGES, J. walked (3-2 BBKFBFFFFB)3a CASE, C. advanced to second.",119,2026-02-20T03:00:00-05:00,"Nettleton Stadium (Chico, CA)",0,MBA,2026
6555570,614932,UCCS Mountain Lions,615017,Chico St. Wildcats,615017,10,bot,"ROLLING, K. grounded out to p unassisted3a HODGES, J. advanced to second3a CASE, C. advanced to third.",120,2026-02-20T03:00:00-05:00,"Nettleton Stadium (Chico, CA)",0,MBA,2026
6555570,614932,UCCS Mountain Lions,615017,Chico St. Wildcats,615017,10,bot,"WALTON, M. intentionally walked.",121,2026-02-20T03:00:00-05:00,"Nettleton Stadium (Chico, CA)",0,MBA,2026
6555570,614932,UCCS Mountain Lions,615017,Chico St. Wildcats,615017,10,bot,"SNITKO, J. flied out to lf, SF, RBI (0-0)3a CASE, C. scored.",122,2026-02-20T03:00:00-05:00,"Nettleton Stadium (Chico, CA)",0,MBA,2026
6555570,614932,UCCS Mountain Lions,615017,Chico St. Wildcats,615017,10,bot,UCCS challenge play at home3a call stands.,123,2026-02-20T03:00:00-05:00,"Nettleton Stadium (Chico, CA)",0,MBA,2026
