game_id,away_team_id,away_team_name,home_team_id,home_team_name,batting_team,inning,top_bot,event_text,event_num,game_datetime,stadium_name,attendance,sport_id,season
6556916,615348,Salve Regina Seahawks,615357,Stevens Ducks,615348,1,top,J. Harring walked.,1,2026-03-01T11:00:00-05:00,"Nationals Youth Academy (Washington, DC)",34,MBA,2026
6556916,615348,Salve Regina Seahawks,615357,Stevens Ducks,615348,1,top,J. Harring stole second.,2,2026-03-01T11:00:00-05:00,"Nationals Youth Academy (Washington, DC)",34,MBA,2026
6556916,615348,Salve Regina Seahawks,615357,Stevens Ducks,615348,1,top,S. Donovan walked.,3,2026-03-01T11:00:00-05:00,"Nationals Youth Academy (Washington, DC)",34,MBA,2026
6556916,615348,Salve Regina Seahawks,615357,Stevens Ducks,615348,1,top,"D. Rogers singled to center field, RBI3a S. Donovan advanced to second3a J. Harring scored.",4,2026-03-01T11:00:00-05:00,"Nationals Youth Academy (Washington, DC)",34,MBA,2026
6556916,615348,Salve Regina Seahawks,615357,Stevens Ducks,615348,1,top,E. Hamilton hit by pitch3a D. Rogers advanced to second3a S. Donovan advanced to third.,5,2026-03-01T11:00:00-05:00,"Nationals Youth Academy (Washington, DC)",34,MBA,2026
6556916,615348,Salve Regina Seahawks,615357,Stevens Ducks,615348,1,top,"S. Williams flied out to cf, sacrifice fly, RBI3a D. Rogers advanced to third3a S. Donovan scored.",6,2026-03-01T11:00:00-05:00,"Nationals Youth Academy (Washington, DC)",34,MBA,2026
6556916,615348,Salve Regina Seahawks,615357,Stevens Ducks,615348,1,top,"E. O’Rourke reached first on a dropped fly by cf3a E. Hamilton advanced to second3a D. Rogers scored, unearned.",7,2026-03-01T11:00:00-05:00,"Nationals Youth Academy (Washington, DC)",34,MBA,2026
6556916,615348,Salve Regina Seahawks,615357,Stevens Ducks,615348,1,top,D. Cimini grounded out to p.,8,2026-03-01T11:00:00-05:00,"Nationals Youth Academy (Washington, DC)",34,MBA,2026
6556916,615348,Salve Regina Seahawks,615357,Stevens Ducks,615348,1,top,G. Schopps struck out swinging.,9,2026-03-01T11:00:00-05:00,"Nationals Youth Academy (Washington, DC)",34,MBA,2026
6556916,615348,Salve Regina Seahawks,615357,Stevens Ducks,615357,1,bot,C. Krese struck out swinging.,10,2026-03-01T11:00:00-05:00,"Nationals Youth Academy (Washington, DC)",34,MBA,2026
6556916,615348,Salve Regina Seahawks,615357,Stevens Ducks,615357,1,bot,"Balewitz, Jr popped up to ss.",11,2026-03-01T11:00:00-05:00,"Nationals Youth Academy (Washington, DC)",34,MBA,2026
6556916,615348,Salve Regina Seahawks,615357,Stevens Ducks,615357,1,bot,Q. Sterling grounded out to p.,12,2026-03-01T11:00:00-05:00,"Nationals Youth Academy (Washington, DC)",34,MBA,2026
6556916,615348,Salve Regina Seahawks,615357,Stevens Ducks,615348,2,top,J. Anastasop struck out swinging.,13,2026-03-01T11:00:00-05:00,"Nationals Youth Academy (Washington, DC)",34,MBA,2026
6556916,615348,Salve Regina Seahawks,615357,Stevens Ducks,615348,2,top,J. Harring walked.,14,2026-03-01T11:00:00-05:00,"Nationals Youth Academy (Washington, DC)",34,MBA,2026
6556916,615348,Salve Regina Seahawks,615357,Stevens Ducks,615348,2,top,"S. Donovan tripled to right field, RBI3a J. Harring scored.",15,2026-03-01T11:00:00-05:00,"Nationals Youth Academy (Washington, DC)",34,MBA,2026
6556916,615348,Salve Regina Seahawks,615357,Stevens Ducks,615348,2,top,D. Rogers walked.,16,2026-03-01T11:00:00-05:00,"Nationals Youth Academy (Washington, DC)",34,MBA,2026
6556916,615348,Salve Regina Seahawks,615357,Stevens Ducks,615348,2,top,V. Stigliano to p for R. Hughes.,17,2026-03-01T11:00:00-05:00,"Nationals Youth Academy (Washington, DC)",34,MBA,2026
6556916,615348,Salve Regina Seahawks,615357,Stevens Ducks,615348,2,top,"E. Hamilton flied out to lf, sacrifice fly, RBI3a S. Donovan scored.",18,2026-03-01T11:00:00-05:00,"Nationals Youth Academy (Washington, DC)",34,MBA,2026
6556916,615348,Salve Regina Seahawks,615357,Stevens Ducks,615348,2,top,S. Williams flied out to lf.,19,2026-03-01T11:00:00-05:00,"Nationals Youth Academy (Washington, DC)",34,MBA,2026
6556916,615348,Salve Regina Seahawks,615357,Stevens Ducks,615357,2,bot,G. Zitko flied out to cf.,20,2026-03-01T11:00:00-05:00,"Nationals Youth Academy (Washington, DC)",34,MBA,2026
6556916,615348,Salve Regina Seahawks,615357,Stevens Ducks,615357,2,bot,G. Wolf popped up to ss.,21,2026-03-01T11:00:00-05:00,"Nationals Youth Academy (Washington, DC)",34,MBA,2026
6556916,615348,Salve Regina Seahawks,615357,Stevens Ducks,615357,2,bot,A. Barringto struck out looking.,22,2026-03-01T11:00:00-05:00,"Nationals Youth Academy (Washington, DC)",34,MBA,2026
6556916,615348,Salve Regina Seahawks,615357,Stevens Ducks,615348,3,top,E. O’Rourke walked.,23,2026-03-01T11:00:00-05:00,"Nationals Youth Academy (Washington, DC)",34,MBA,2026
6556916,615348,Salve Regina Seahawks,615357,Stevens Ducks,615348,3,top,D. Cimini struck out looking.,24,2026-03-01T11:00:00-05:00,"Nationals Youth Academy (Washington, DC)",34,MBA,2026
6556916,615348,Salve Regina Seahawks,615357,Stevens Ducks,615348,3,top,G. Schopps reached on a fielder's choice to shortstop3a E. O’Rourke out at second ss to 2b.,25,2026-03-01T11:00:00-05:00,"Nationals Youth Academy (Washington, DC)",34,MBA,2026
6556916,615348,Salve Regina Seahawks,615357,Stevens Ducks,615348,3,top,J. Anastasop hit by pitch3a G. Schopps advanced to second.,26,2026-03-01T11:00:00-05:00,"Nationals Youth Academy (Washington, DC)",34,MBA,2026
6556916,615348,Salve Regina Seahawks,615357,Stevens Ducks,615348,3,top,J. Harring grounded out to 2b.,27,2026-03-01T11:00:00-05:00,"Nationals Youth Academy (Washington, DC)",34,MBA,2026
6556916,615348,Salve Regina Seahawks,615357,Stevens Ducks,615357,3,bot,T. Wilke singled to left field.,28,2026-03-01T11:00:00-05:00,"Nationals Youth Academy (Washington, DC)",34,MBA,2026
6556916,615348,Salve Regina Seahawks,615357,Stevens Ducks,615357,3,bot,J. Wein walked3a T. Wilke advanced to second.,29,2026-03-01T11:00:00-05:00,"Nationals Youth Academy (Washington, DC)",34,MBA,2026
6556916,615348,Salve Regina Seahawks,615357,Stevens Ducks,615357,3,bot,"J. Wu grounded out to p, SAC, bunt3a J. Wein advanced to second3a T. Wilke advanced to third.",30,2026-03-01T11:00:00-05:00,"Nationals Youth Academy (Washington, DC)",34,MBA,2026
6556916,615348,Salve Regina Seahawks,615357,Stevens Ducks,615357,3,bot,"C. Krese flied out to cf, sacrifice fly, RBI3a T. Wilke scored.",31,2026-03-01T11:00:00-05:00,"Nationals Youth Academy (Washington, DC)",34,MBA,2026
6556916,615348,Salve Regina Seahawks,615357,Stevens Ducks,615357,3,bot,"Balewitz, Jr flied out to cf.",32,2026-03-01T11:00:00-05:00,"Nationals Youth Academy (Washington, DC)",34,MBA,2026
6556916,615348,Salve Regina Seahawks,615357,Stevens Ducks,615348,4,top,D. Guerard to p for V. Stigliano.,33,2026-03-01T11:00:00-05:00,"Nationals Youth Academy (Washington, DC)",34,MBA,2026
6556916,615348,Salve Regina Seahawks,615357,Stevens Ducks,615348,4,top,S. Donovan singled to left field.,34,2026-03-01T11:00:00-05:00,"Nationals Youth Academy (Washington, DC)",34,MBA,2026
6556916,615348,Salve Regina Seahawks,615357,Stevens Ducks,615348,4,top,D. Rogers walked3a S. Donovan advanced to second.,35,2026-03-01T11:00:00-05:00,"Nationals Youth Academy (Washington, DC)",34,MBA,2026
6556916,615348,Salve Regina Seahawks,615357,Stevens Ducks,615348,4,top,"E. Hamilton singled to catcher, bunt3a D. Rogers advanced to third on a throwing error by c3a S. Donovan scored.",36,2026-03-01T11:00:00-05:00,"Nationals Youth Academy (Washington, DC)",34,MBA,2026
6556916,615348,Salve Regina Seahawks,615357,Stevens Ducks,615348,4,top,"S. Williams flied out to cf, sacrifice fly, RBI3a D. Rogers scored, unearned.",37,2026-03-01T11:00:00-05:00,"Nationals Youth Academy (Washington, DC)",34,MBA,2026
6556916,615348,Salve Regina Seahawks,615357,Stevens Ducks,615348,4,top,E. O’Rourke grounded out to 2b.,38,2026-03-01T11:00:00-05:00,"Nationals Youth Academy (Washington, DC)",34,MBA,2026
6556916,615348,Salve Regina Seahawks,615357,Stevens Ducks,615348,4,top,D. Cimini grounded out to ss.,39,2026-03-01T11:00:00-05:00,"Nationals Youth Academy (Washington, DC)",34,MBA,2026
6556916,615348,Salve Regina Seahawks,615357,Stevens Ducks,615357,4,bot,Q. Sterling flied out to lf.,40,2026-03-01T11:00:00-05:00,"Nationals Youth Academy (Washington, DC)",34,MBA,2026
6556916,615348,Salve Regina Seahawks,615357,Stevens Ducks,615357,4,bot,G. Zitko reached first on a fielding error by 3b.,41,2026-03-01T11:00:00-05:00,"Nationals Youth Academy (Washington, DC)",34,MBA,2026
6556916,615348,Salve Regina Seahawks,615357,Stevens Ducks,615357,4,bot,G. Wolf fouled out to 1b.,42,2026-03-01T11:00:00-05:00,"Nationals Youth Academy (Washington, DC)",34,MBA,2026
6556916,615348,Salve Regina Seahawks,615357,Stevens Ducks,615357,4,bot,A. Barringto popped up to ss.,43,2026-03-01T11:00:00-05:00,"Nationals Youth Academy (Washington, DC)",34,MBA,2026
6556916,615348,Salve Regina Seahawks,615357,Stevens Ducks,615348,5,top,E. Carrier to p for D. Guerard.,44,2026-03-01T11:00:00-05:00,"Nationals Youth Academy (Washington, DC)",34,MBA,2026
6556916,615348,Salve Regina Seahawks,615357,Stevens Ducks,615348,5,top,G. Schopps flied out to rf.,45,2026-03-01T11:00:00-05:00,"Nationals Youth Academy (Washington, DC)",34,MBA,2026
6556916,615348,Salve Regina Seahawks,615357,Stevens Ducks,615348,5,top,J. Anastasop struck out swinging.,46,2026-03-01T11:00:00-05:00,"Nationals Youth Academy (Washington, DC)",34,MBA,2026
6556916,615348,Salve Regina Seahawks,615357,Stevens Ducks,615348,5,top,J. Harring singled to center field.,47,2026-03-01T11:00:00-05:00,"Nationals Youth Academy (Washington, DC)",34,MBA,2026
6556916,615348,Salve Regina Seahawks,615357,Stevens Ducks,615348,5,top,S. Donovan walked3a J. Harring advanced to second.,48,2026-03-01T11:00:00-05:00,"Nationals Youth Academy (Washington, DC)",34,MBA,2026
6556916,615348,Salve Regina Seahawks,615357,Stevens Ducks,615348,5,top,D. Rogers lined out to lf.,49,2026-03-01T11:00:00-05:00,"Nationals Youth Academy (Washington, DC)",34,MBA,2026
6556916,615348,Salve Regina Seahawks,615357,Stevens Ducks,615357,5,bot,T. Wilke flied out to cf.,50,2026-03-01T11:00:00-05:00,"Nationals Youth Academy (Washington, DC)",34,MBA,2026
6556916,615348,Salve Regina Seahawks,615357,Stevens Ducks,615357,5,bot,J. Wein lined out to cf.,51,2026-03-01T11:00:00-05:00,"Nationals Youth Academy (Washington, DC)",34,MBA,2026
6556916,615348,Salve Regina Seahawks,615357,Stevens Ducks,615357,5,bot,J. Wu flied out to cf.,52,2026-03-01T11:00:00-05:00,"Nationals Youth Academy (Washington, DC)",34,MBA,2026
6556916,615348,Salve Regina Seahawks,615357,Stevens Ducks,615348,6,top,Z. DeGeorge to p for E. Carrier.,53,2026-03-01T11:00:00-05:00,"Nationals Youth Academy (Washington, DC)",34,MBA,2026
6556916,615348,Salve Regina Seahawks,615357,Stevens Ducks,615348,6,top,E. Hamilton walked.,54,2026-03-01T11:00:00-05:00,"Nationals Youth Academy (Washington, DC)",34,MBA,2026
6556916,615348,Salve Regina Seahawks,615357,Stevens Ducks,615348,6,top,S. Williams popped up to ss.,55,2026-03-01T11:00:00-05:00,"Nationals Youth Academy (Washington, DC)",34,MBA,2026
6556916,615348,Salve Regina Seahawks,615357,Stevens Ducks,615348,6,top,E. Hamilton advanced to second on a wild pitch.,56,2026-03-01T11:00:00-05:00,"Nationals Youth Academy (Washington, DC)",34,MBA,2026
6556916,615348,Salve Regina Seahawks,615357,Stevens Ducks,615348,6,top,E. O’Rourke hit by pitch.,57,2026-03-01T11:00:00-05:00,"Nationals Youth Academy (Washington, DC)",34,MBA,2026
6556916,615348,Salve Regina Seahawks,615357,Stevens Ducks,615348,6,top,E. O’Rourke advanced to second on a wild pitch3a E. Hamilton advanced to third.,58,2026-03-01T11:00:00-05:00,"Nationals Youth Academy (Washington, DC)",34,MBA,2026
6556916,615348,Salve Regina Seahawks,615357,Stevens Ducks,615348,6,top,"D. Cimini reached on a fielder's choice to second base, RBI3a E. O’Rourke advanced to third3a E. Hamilton scored.",59,2026-03-01T11:00:00-05:00,"Nationals Youth Academy (Washington, DC)",34,MBA,2026
6556916,615348,Salve Regina Seahawks,615357,Stevens Ducks,615348,6,top,D. Cimini advanced to second3a E. O’Rourke scored on a passed ball.,60,2026-03-01T11:00:00-05:00,"Nationals Youth Academy (Washington, DC)",34,MBA,2026
6556916,615348,Salve Regina Seahawks,615357,Stevens Ducks,615348,6,top,G. Schopps walked.,61,2026-03-01T11:00:00-05:00,"Nationals Youth Academy (Washington, DC)",34,MBA,2026
6556916,615348,Salve Regina Seahawks,615357,Stevens Ducks,615348,6,top,Y. Anthony to p for Z. DeGeorge.,62,2026-03-01T11:00:00-05:00,"Nationals Youth Academy (Washington, DC)",34,MBA,2026
6556916,615348,Salve Regina Seahawks,615357,Stevens Ducks,615348,6,top,D. Cimini stole third.,63,2026-03-01T11:00:00-05:00,"Nationals Youth Academy (Washington, DC)",34,MBA,2026
6556916,615348,Salve Regina Seahawks,615357,Stevens Ducks,615348,6,top,J. Anastasop walked3a G. Schopps advanced to second.,64,2026-03-01T11:00:00-05:00,"Nationals Youth Academy (Washington, DC)",34,MBA,2026
6556916,615348,Salve Regina Seahawks,615357,Stevens Ducks,615348,6,top,"J. Harring singled to center field, RBI3a J. Anastasop advanced to second3a G. Schopps advanced to third3a D. Cimini scored.",65,2026-03-01T11:00:00-05:00,"Nationals Youth Academy (Washington, DC)",34,MBA,2026
6556916,615348,Salve Regina Seahawks,615357,Stevens Ducks,615348,6,top,S. Donovan struck out swinging.,66,2026-03-01T11:00:00-05:00,"Nationals Youth Academy (Washington, DC)",34,MBA,2026
6556916,615348,Salve Regina Seahawks,615357,Stevens Ducks,615348,6,top,D. Rogers flied out to lf.,67,2026-03-01T11:00:00-05:00,"Nationals Youth Academy (Washington, DC)",34,MBA,2026
6556916,615348,Salve Regina Seahawks,615357,Stevens Ducks,615357,6,bot,C. Krese lined out to 2b.,68,2026-03-01T11:00:00-05:00,"Nationals Youth Academy (Washington, DC)",34,MBA,2026
6556916,615348,Salve Regina Seahawks,615357,Stevens Ducks,615357,6,bot,"Balewitz, Jr flied out to rf.",69,2026-03-01T11:00:00-05:00,"Nationals Youth Academy (Washington, DC)",34,MBA,2026
6556916,615348,Salve Regina Seahawks,615357,Stevens Ducks,615357,6,bot,Q. Sterling struck out looking.,70,2026-03-01T11:00:00-05:00,"Nationals Youth Academy (Washington, DC)",34,MBA,2026
6556916,615348,Salve Regina Seahawks,615357,Stevens Ducks,615348,7,top,R. Schneider to p for Y. Anthony.,71,2026-03-01T11:00:00-05:00,"Nationals Youth Academy (Washington, DC)",34,MBA,2026
6556916,615348,Salve Regina Seahawks,615357,Stevens Ducks,615348,7,top,E. Hamilton singled up the middle.,72,2026-03-01T11:00:00-05:00,"Nationals Youth Academy (Washington, DC)",34,MBA,2026
6556916,615348,Salve Regina Seahawks,615357,Stevens Ducks,615348,7,top,E. Hamilton advanced to second on a passed ball.,73,2026-03-01T11:00:00-05:00,"Nationals Youth Academy (Washington, DC)",34,MBA,2026
6556916,615348,Salve Regina Seahawks,615357,Stevens Ducks,615348,7,top,S. Williams walked.,74,2026-03-01T11:00:00-05:00,"Nationals Youth Academy (Washington, DC)",34,MBA,2026
6556916,615348,Salve Regina Seahawks,615357,Stevens Ducks,615348,7,top,E. O’Rourke lined out to rf3a E. Hamilton advanced to third.,75,2026-03-01T11:00:00-05:00,"Nationals Youth Academy (Washington, DC)",34,MBA,2026
6556916,615348,Salve Regina Seahawks,615357,Stevens Ducks,615348,7,top,N. Russo pinch hit for D. Cimini.,76,2026-03-01T11:00:00-05:00,"Nationals Youth Academy (Washington, DC)",34,MBA,2026
6556916,615348,Salve Regina Seahawks,615357,Stevens Ducks,615348,7,top,N. Russo hit by pitch3a S. Williams advanced to second.,77,2026-03-01T11:00:00-05:00,"Nationals Youth Academy (Washington, DC)",34,MBA,2026
6556916,615348,Salve Regina Seahawks,615357,Stevens Ducks,615348,7,top,C. McLachlan to p for R. Schneider.,78,2026-03-01T11:00:00-05:00,"Nationals Youth Academy (Washington, DC)",34,MBA,2026
6556916,615348,Salve Regina Seahawks,615357,Stevens Ducks,615348,7,top,"G. Schopps walked, RBI3a N. Russo advanced to second3a S. Williams advanced to third3a E. Hamilton scored.",79,2026-03-01T11:00:00-05:00,"Nationals Youth Academy (Washington, DC)",34,MBA,2026
6556916,615348,Salve Regina Seahawks,615357,Stevens Ducks,615348,7,top,"J. Anastasop singled to right field, RBI3a G. Schopps advanced to second3a N. Russo advanced to third3a S. Williams scored.",80,2026-03-01T11:00:00-05:00,"Nationals Youth Academy (Washington, DC)",34,MBA,2026
6556916,615348,Salve Regina Seahawks,615357,Stevens Ducks,615348,7,top,J. Harring lined into double play ss to 1b3a J. Anastasop out on the play.,81,2026-03-01T11:00:00-05:00,"Nationals Youth Academy (Washington, DC)",34,MBA,2026
6556916,615348,Salve Regina Seahawks,615357,Stevens Ducks,615357,7,bot,N. Russo to dh.,82,2026-03-01T11:00:00-05:00,"Nationals Youth Academy (Washington, DC)",34,MBA,2026
6556916,615348,Salve Regina Seahawks,615357,Stevens Ducks,615357,7,bot,G. Zitko struck out swinging.,83,2026-03-01T11:00:00-05:00,"Nationals Youth Academy (Washington, DC)",34,MBA,2026
6556916,615348,Salve Regina Seahawks,615357,Stevens Ducks,615357,7,bot,G. Wolf singled to center field.,84,2026-03-01T11:00:00-05:00,"Nationals Youth Academy (Washington, DC)",34,MBA,2026
6556916,615348,Salve Regina Seahawks,615357,Stevens Ducks,615357,7,bot,A. Barringto grounded into double play 2b to ss to 1b3a G. Wolf out on the play.,85,2026-03-01T11:00:00-05:00,"Nationals Youth Academy (Washington, DC)",34,MBA,2026
6556916,615348,Salve Regina Seahawks,615357,Stevens Ducks,615348,8,top,D. Qira to p for C. McLachlan.,86,2026-03-01T11:00:00-05:00,"Nationals Youth Academy (Washington, DC)",34,MBA,2026
6556916,615348,Salve Regina Seahawks,615357,Stevens Ducks,615348,8,top,S. Donovan walked.,87,2026-03-01T11:00:00-05:00,"Nationals Youth Academy (Washington, DC)",34,MBA,2026
6556916,615348,Salve Regina Seahawks,615357,Stevens Ducks,615348,8,top,A. Schmit pinch hit for D. Rogers.,88,2026-03-01T11:00:00-05:00,"Nationals Youth Academy (Washington, DC)",34,MBA,2026
6556916,615348,Salve Regina Seahawks,615357,Stevens Ducks,615348,8,top,A. Schmit flied out to rf.,89,2026-03-01T11:00:00-05:00,"Nationals Youth Academy (Washington, DC)",34,MBA,2026
6556916,615348,Salve Regina Seahawks,615357,Stevens Ducks,615348,8,top,B. Smolinski pinch ran for S. Donovan.,90,2026-03-01T11:00:00-05:00,"Nationals Youth Academy (Washington, DC)",34,MBA,2026
6556916,615348,Salve Regina Seahawks,615357,Stevens Ducks,615348,8,top,E. Hamilton lined out to ss.,91,2026-03-01T11:00:00-05:00,"Nationals Youth Academy (Washington, DC)",34,MBA,2026
6556916,615348,Salve Regina Seahawks,615357,Stevens Ducks,615348,8,top,S. Williams out at first 1b to p.,92,2026-03-01T11:00:00-05:00,"Nationals Youth Academy (Washington, DC)",34,MBA,2026
6556916,615348,Salve Regina Seahawks,615357,Stevens Ducks,615357,8,bot,B. Smolinski to c.,93,2026-03-01T11:00:00-05:00,"Nationals Youth Academy (Washington, DC)",34,MBA,2026
6556916,615348,Salve Regina Seahawks,615357,Stevens Ducks,615357,8,bot,A. Schmit to cf.,94,2026-03-01T11:00:00-05:00,"Nationals Youth Academy (Washington, DC)",34,MBA,2026
6556916,615348,Salve Regina Seahawks,615357,Stevens Ducks,615357,8,bot,V. Wadhwani pinch hit for T. Wilke.,95,2026-03-01T11:00:00-05:00,"Nationals Youth Academy (Washington, DC)",34,MBA,2026
6556916,615348,Salve Regina Seahawks,615357,Stevens Ducks,615357,8,bot,V. Wadhwani struck out swinging.,96,2026-03-01T11:00:00-05:00,"Nationals Youth Academy (Washington, DC)",34,MBA,2026
6556916,615348,Salve Regina Seahawks,615357,Stevens Ducks,615357,8,bot,N. Hill pinch hit for J. Wein.,97,2026-03-01T11:00:00-05:00,"Nationals Youth Academy (Washington, DC)",34,MBA,2026
6556916,615348,Salve Regina Seahawks,615357,Stevens Ducks,615357,8,bot,N. Hill struck out swinging.,98,2026-03-01T11:00:00-05:00,"Nationals Youth Academy (Washington, DC)",34,MBA,2026
6556916,615348,Salve Regina Seahawks,615357,Stevens Ducks,615357,8,bot,J. Zachery pinch hit for J. Wu.,99,2026-03-01T11:00:00-05:00,"Nationals Youth Academy (Washington, DC)",34,MBA,2026
6556916,615348,Salve Regina Seahawks,615357,Stevens Ducks,615357,8,bot,J. Zachery popped up to 2b.,100,2026-03-01T11:00:00-05:00,"Nationals Youth Academy (Washington, DC)",34,MBA,2026
6556916,615348,Salve Regina Seahawks,615357,Stevens Ducks,615348,9,top,V. Wadhwani to 3b.,101,2026-03-01T11:00:00-05:00,"Nationals Youth Academy (Washington, DC)",34,MBA,2026
6556916,615348,Salve Regina Seahawks,615357,Stevens Ducks,615348,9,top,N. Hill to rf.,102,2026-03-01T11:00:00-05:00,"Nationals Youth Academy (Washington, DC)",34,MBA,2026
6556916,615348,Salve Regina Seahawks,615357,Stevens Ducks,615348,9,top,J. Zachery to 2b.,103,2026-03-01T11:00:00-05:00,"Nationals Youth Academy (Washington, DC)",34,MBA,2026
6556916,615348,Salve Regina Seahawks,615357,Stevens Ducks,615348,9,top,N. Stopnik to p for D. Qira.,104,2026-03-01T11:00:00-05:00,"Nationals Youth Academy (Washington, DC)",34,MBA,2026
6556916,615348,Salve Regina Seahawks,615357,Stevens Ducks,615348,9,top,C. Kilareski pinch hit for E. O’Rourke.,105,2026-03-01T11:00:00-05:00,"Nationals Youth Academy (Washington, DC)",34,MBA,2026
6556916,615348,Salve Regina Seahawks,615357,Stevens Ducks,615348,9,top,C. Kilareski walked.,106,2026-03-01T11:00:00-05:00,"Nationals Youth Academy (Washington, DC)",34,MBA,2026
6556916,615348,Salve Regina Seahawks,615357,Stevens Ducks,615348,9,top,"A. Santora to c for Balewitz, Jr.",107,2026-03-01T11:00:00-05:00,"Nationals Youth Academy (Washington, DC)",34,MBA,2026
6556916,615348,Salve Regina Seahawks,615357,Stevens Ducks,615348,9,top,A. Wong to ss for C. Krese.,108,2026-03-01T11:00:00-05:00,"Nationals Youth Academy (Washington, DC)",34,MBA,2026
6556916,615348,Salve Regina Seahawks,615357,Stevens Ducks,615348,9,top,N. Russo struck out swinging.,109,2026-03-01T11:00:00-05:00,"Nationals Youth Academy (Washington, DC)",34,MBA,2026
6556916,615348,Salve Regina Seahawks,615357,Stevens Ducks,615348,9,top,G. Schopps fouled out to 1b.,110,2026-03-01T11:00:00-05:00,"Nationals Youth Academy (Washington, DC)",34,MBA,2026
6556916,615348,Salve Regina Seahawks,615357,Stevens Ducks,615348,9,top,J. Anastasop grounded out to 3b.,111,2026-03-01T11:00:00-05:00,"Nationals Youth Academy (Washington, DC)",34,MBA,2026
6556916,615348,Salve Regina Seahawks,615357,Stevens Ducks,615357,9,bot,C. Kilareski to lf.,112,2026-03-01T11:00:00-05:00,"Nationals Youth Academy (Washington, DC)",34,MBA,2026
6556916,615348,Salve Regina Seahawks,615357,Stevens Ducks,615357,9,bot,C. Ryan to p for N. Romanowsk.,113,2026-03-01T11:00:00-05:00,"Nationals Youth Academy (Washington, DC)",34,MBA,2026
6556916,615348,Salve Regina Seahawks,615357,Stevens Ducks,615357,9,bot,A. Wong flied out to rf.,114,2026-03-01T11:00:00-05:00,"Nationals Youth Academy (Washington, DC)",34,MBA,2026
6556916,615348,Salve Regina Seahawks,615357,Stevens Ducks,615357,9,bot,A. Santora singled to center field.,115,2026-03-01T11:00:00-05:00,"Nationals Youth Academy (Washington, DC)",34,MBA,2026
6556916,615348,Salve Regina Seahawks,615357,Stevens Ducks,615357,9,bot,J. Reichlin pinch hit for Q. Sterling.,116,2026-03-01T11:00:00-05:00,"Nationals Youth Academy (Washington, DC)",34,MBA,2026
6556916,615348,Salve Regina Seahawks,615357,Stevens Ducks,615357,9,bot,J. Reichlin struck out swinging.,117,2026-03-01T11:00:00-05:00,"Nationals Youth Academy (Washington, DC)",34,MBA,2026
6556916,615348,Salve Regina Seahawks,615357,Stevens Ducks,615357,9,bot,E. Simpson pinch hit for G. Zitko.,118,2026-03-01T11:00:00-05:00,"Nationals Youth Academy (Washington, DC)",34,MBA,2026
6556916,615348,Salve Regina Seahawks,615357,Stevens Ducks,615357,9,bot,A. Santora advanced to second.,119,2026-03-01T11:00:00-05:00,"Nationals Youth Academy (Washington, DC)",34,MBA,2026
6556916,615348,Salve Regina Seahawks,615357,Stevens Ducks,615357,9,bot,E. Simpson struck out looking.,120,2026-03-01T11:00:00-05:00,"Nationals Youth Academy (Washington, DC)",34,MBA,2026
