game_id,away_team_id,away_team_name,home_team_id,home_team_name,batting_team,inning,top_bot,event_text,event_num,game_datetime,stadium_name,attendance,sport_id,season
6565329,615157,Bethel (MN) Royals,615260,UMass Boston Beacons,615157,1,top,Drew Girtz hit by pitch (1-0 H).,1,2026-03-17T00:00:00-04:00,"Monan Park (Boston, MA)",0,MBA,2026
6565329,615157,Bethel (MN) Royals,615260,UMass Boston Beacons,615157,1,top,"Drew Girtz advanced to second on an error by p, advanced to third.",2,2026-03-17T00:00:00-04:00,"Monan Park (Boston, MA)",0,MBA,2026
6565329,615157,Bethel (MN) Royals,615260,UMass Boston Beacons,615157,1,top,"Chris Cannon grounded out to 2b, RBI (1-2 BKFF)3a Drew Girtz scored.",3,2026-03-17T00:00:00-04:00,"Monan Park (Boston, MA)",0,MBA,2026
6565329,615157,Bethel (MN) Royals,615260,UMass Boston Beacons,615157,1,top,Oran Hinkle doubled to right center (1-1 FB).,4,2026-03-17T00:00:00-04:00,"Monan Park (Boston, MA)",0,MBA,2026
6565329,615157,Bethel (MN) Royals,615260,UMass Boston Beacons,615157,1,top,Sam Abbas hit by pitch (1-0 H).,5,2026-03-17T00:00:00-04:00,"Monan Park (Boston, MA)",0,MBA,2026
6565329,615157,Bethel (MN) Royals,615260,UMass Boston Beacons,615157,1,top,Seth Nelson struck out swinging (0-2 KKS).,6,2026-03-17T00:00:00-04:00,"Monan Park (Boston, MA)",0,MBA,2026
6565329,615157,Bethel (MN) Royals,615260,UMass Boston Beacons,615157,1,top,Sam Abbas advanced to second3a Oran Hinkle advanced to third on an error by p.,7,2026-03-17T00:00:00-04:00,"Monan Park (Boston, MA)",0,MBA,2026
6565329,615157,Bethel (MN) Royals,615260,UMass Boston Beacons,615157,1,top,Hayden Sperbeck popped up to 1b (3-1 BKBB).,8,2026-03-17T00:00:00-04:00,"Monan Park (Boston, MA)",0,MBA,2026
6565329,615157,Bethel (MN) Royals,615260,UMass Boston Beacons,615260,1,bot,Breon Parker struck out swinging (1-2 KBFS).,9,2026-03-17T00:00:00-04:00,"Monan Park (Boston, MA)",0,MBA,2026
6565329,615157,Bethel (MN) Royals,615260,UMass Boston Beacons,615260,1,bot,Nick Farnacci doubled to right field (2-2 KBBF).,10,2026-03-17T00:00:00-04:00,"Monan Park (Boston, MA)",0,MBA,2026
6565329,615157,Bethel (MN) Royals,615260,UMass Boston Beacons,615260,1,bot,Nick Farnacci stole third.,11,2026-03-17T00:00:00-04:00,"Monan Park (Boston, MA)",0,MBA,2026
6565329,615157,Bethel (MN) Royals,615260,UMass Boston Beacons,615260,1,bot,Elliot Miles hit by pitch (3-2 KFBBFBFFH).,12,2026-03-17T00:00:00-04:00,"Monan Park (Boston, MA)",0,MBA,2026
6565329,615157,Bethel (MN) Royals,615260,UMass Boston Beacons,615260,1,bot,"Brandon Gaer singled to left field, RBI (1-2 FKB)3a Elliot Miles advanced to second3a Nick Farnacci scored.",13,2026-03-17T00:00:00-04:00,"Monan Park (Boston, MA)",0,MBA,2026
6565329,615157,Bethel (MN) Royals,615260,UMass Boston Beacons,615260,1,bot,Brandon Gaer advanced to second3a Elliot Miles advanced to third on an error by p.,14,2026-03-17T00:00:00-04:00,"Monan Park (Boston, MA)",0,MBA,2026
6565329,615157,Bethel (MN) Royals,615260,UMass Boston Beacons,615260,1,bot,Jayden Lafleur walked (3-1 BBBKB).,15,2026-03-17T00:00:00-04:00,"Monan Park (Boston, MA)",0,MBA,2026
6565329,615157,Bethel (MN) Royals,615260,UMass Boston Beacons,615260,1,bot,Cole Bissaillon struck out swinging (1-2 KFBS).,16,2026-03-17T00:00:00-04:00,"Monan Park (Boston, MA)",0,MBA,2026
6565329,615157,Bethel (MN) Royals,615260,UMass Boston Beacons,615260,1,bot,"Ben Sherry walked, RBI (3-1 BKBBB)3a Jayden Lafleur advanced to second3a Brandon Gaer advanced to third3a Elliot Miles scored.",17,2026-03-17T00:00:00-04:00,"Monan Park (Boston, MA)",0,MBA,2026
6565329,615157,Bethel (MN) Royals,615260,UMass Boston Beacons,615260,1,bot,"Ryan Slack singled to third base, RBI (1-2 SSB)3a Ben Sherry advanced to second3a Jayden Lafleur advanced to third3a Brandon Gaer scored.",18,2026-03-17T00:00:00-04:00,"Monan Park (Boston, MA)",0,MBA,2026
6565329,615157,Bethel (MN) Royals,615260,UMass Boston Beacons,615260,1,bot,Nicolas Piscioniere struck out swinging (0-2 KKS).,19,2026-03-17T00:00:00-04:00,"Monan Park (Boston, MA)",0,MBA,2026
6565329,615157,Bethel (MN) Royals,615260,UMass Boston Beacons,615157,2,top,Carson Christiansen struck out looking (3-2 BBBKKK).,20,2026-03-17T00:00:00-04:00,"Monan Park (Boston, MA)",0,MBA,2026
6565329,615157,Bethel (MN) Royals,615260,UMass Boston Beacons,615157,2,top,Ben Trucke hit by pitch (1-1 KH).,21,2026-03-17T00:00:00-04:00,"Monan Park (Boston, MA)",0,MBA,2026
6565329,615157,Bethel (MN) Royals,615260,UMass Boston Beacons,615157,2,top,Ben Trucke advanced to second on a passed ball.,22,2026-03-17T00:00:00-04:00,"Monan Park (Boston, MA)",0,MBA,2026
6565329,615157,Bethel (MN) Royals,615260,UMass Boston Beacons,615157,2,top,Chris Lavin walked (3-2 FBBBFB).,23,2026-03-17T00:00:00-04:00,"Monan Park (Boston, MA)",0,MBA,2026
6565329,615157,Bethel (MN) Royals,615260,UMass Boston Beacons,615157,2,top,Drew Girtz flied out to lf (2-2 BSBKFF).,24,2026-03-17T00:00:00-04:00,"Monan Park (Boston, MA)",0,MBA,2026
6565329,615157,Bethel (MN) Royals,615260,UMass Boston Beacons,615157,2,top,Chris Cannon walked (3-1 KBBBB)3a Chris Lavin advanced to second3a Ben Trucke advanced to third.,25,2026-03-17T00:00:00-04:00,"Monan Park (Boston, MA)",0,MBA,2026
6565329,615157,Bethel (MN) Royals,615260,UMass Boston Beacons,615157,2,top,Oran Hinkle popped up to 2b (1-0 B).,26,2026-03-17T00:00:00-04:00,"Monan Park (Boston, MA)",0,MBA,2026
6565329,615157,Bethel (MN) Royals,615260,UMass Boston Beacons,615260,2,bot,Nainoa Hayashi to ss for Seth Nelson.,27,2026-03-17T00:00:00-04:00,"Monan Park (Boston, MA)",0,MBA,2026
6565329,615157,Bethel (MN) Royals,615260,UMass Boston Beacons,615260,2,bot,Breon Parker popped up to 3b (1-2 BFF).,28,2026-03-17T00:00:00-04:00,"Monan Park (Boston, MA)",0,MBA,2026
6565329,615157,Bethel (MN) Royals,615260,UMass Boston Beacons,615260,2,bot,Nick Farnacci singled to right field (3-1 BFBB).,29,2026-03-17T00:00:00-04:00,"Monan Park (Boston, MA)",0,MBA,2026
6565329,615157,Bethel (MN) Royals,615260,UMass Boston Beacons,615260,2,bot,Elliot Miles lined out to cf (0-0).,30,2026-03-17T00:00:00-04:00,"Monan Park (Boston, MA)",0,MBA,2026
6565329,615157,Bethel (MN) Royals,615260,UMass Boston Beacons,615260,2,bot,"Nick Farnacci out at first p to 1b, picked off.",31,2026-03-17T00:00:00-04:00,"Monan Park (Boston, MA)",0,MBA,2026
6565329,615157,Bethel (MN) Royals,615260,UMass Boston Beacons,615157,3,top,Sam Abbas hit by pitch (1-1 FH).,32,2026-03-17T00:00:00-04:00,"Monan Park (Boston, MA)",0,MBA,2026
6565329,615157,Bethel (MN) Royals,615260,UMass Boston Beacons,615157,3,top,Nainoa Hayashi struck out swinging (2-2 KBBFS).,33,2026-03-17T00:00:00-04:00,"Monan Park (Boston, MA)",0,MBA,2026
6565329,615157,Bethel (MN) Royals,615260,UMass Boston Beacons,615157,3,top,Sam Abbas advanced to second on a wild pitch.,34,2026-03-17T00:00:00-04:00,"Monan Park (Boston, MA)",0,MBA,2026
6565329,615157,Bethel (MN) Royals,615260,UMass Boston Beacons,615157,3,top,Hayden Sperbeck walked (3-2 BFFBBFB).,35,2026-03-17T00:00:00-04:00,"Monan Park (Boston, MA)",0,MBA,2026
6565329,615157,Bethel (MN) Royals,615260,UMass Boston Beacons,615157,3,top,Jack Cangelosi to p for Dowd Ritter.,36,2026-03-17T00:00:00-04:00,"Monan Park (Boston, MA)",0,MBA,2026
6565329,615157,Bethel (MN) Royals,615260,UMass Boston Beacons,615157,3,top,Carson Christiansen popped up to 3b (0-0).,37,2026-03-17T00:00:00-04:00,"Monan Park (Boston, MA)",0,MBA,2026
6565329,615157,Bethel (MN) Royals,615260,UMass Boston Beacons,615157,3,top,Ben Trucke walked (3-0 BBBB)3a Hayden Sperbeck advanced to second3a Sam Abbas advanced to third.,38,2026-03-17T00:00:00-04:00,"Monan Park (Boston, MA)",0,MBA,2026
6565329,615157,Bethel (MN) Royals,615260,UMass Boston Beacons,615157,3,top,"Chris Lavin doubled to center field, 3 RBI (1-2 KBFF)3a Ben Trucke scored3a Hayden Sperbeck scored3a Sam Abbas scored.",39,2026-03-17T00:00:00-04:00,"Monan Park (Boston, MA)",0,MBA,2026
6565329,615157,Bethel (MN) Royals,615260,UMass Boston Beacons,615157,3,top,Drew Girtz grounded out to 1b unassisted (2-1 KBB).,40,2026-03-17T00:00:00-04:00,"Monan Park (Boston, MA)",0,MBA,2026
6565329,615157,Bethel (MN) Royals,615260,UMass Boston Beacons,615260,3,bot,Brandon Gaer hit by pitch (3-1 SBBH).,41,2026-03-17T00:00:00-04:00,"Monan Park (Boston, MA)",0,MBA,2026
6565329,615157,Bethel (MN) Royals,615260,UMass Boston Beacons,615260,3,bot,"Brandon Gaer out at second c to 2b, caught stealing.",42,2026-03-17T00:00:00-04:00,"Monan Park (Boston, MA)",0,MBA,2026
6565329,615157,Bethel (MN) Royals,615260,UMass Boston Beacons,615260,3,bot,Jayden Lafleur grounded out to ss (2-2 BKKB).,43,2026-03-17T00:00:00-04:00,"Monan Park (Boston, MA)",0,MBA,2026
6565329,615157,Bethel (MN) Royals,615260,UMass Boston Beacons,615260,3,bot,Cole Bissaillon grounded out to 3b (1-0 B).,44,2026-03-17T00:00:00-04:00,"Monan Park (Boston, MA)",0,MBA,2026
6565329,615157,Bethel (MN) Royals,615260,UMass Boston Beacons,615157,4,top,Owen Ellsworth to p for Jack Cangelosi.,45,2026-03-17T00:00:00-04:00,"Monan Park (Boston, MA)",0,MBA,2026
6565329,615157,Bethel (MN) Royals,615260,UMass Boston Beacons,615157,4,top,Chris Cannon struck out looking (2-2 KKBBK).,46,2026-03-17T00:00:00-04:00,"Monan Park (Boston, MA)",0,MBA,2026
6565329,615157,Bethel (MN) Royals,615260,UMass Boston Beacons,615157,4,top,Oran Hinkle walked (3-2 KBBBFB).,47,2026-03-17T00:00:00-04:00,"Monan Park (Boston, MA)",0,MBA,2026
6565329,615157,Bethel (MN) Royals,615260,UMass Boston Beacons,615157,4,top,Sam Abbas reached first on an error by 3b (0-1 K)3a Oran Hinkle advanced to second.,48,2026-03-17T00:00:00-04:00,"Monan Park (Boston, MA)",0,MBA,2026
6565329,615157,Bethel (MN) Royals,615260,UMass Boston Beacons,615157,4,top,Nainoa Hayashi singled to center field (0-2 FS)3a Sam Abbas advanced to second3a Oran Hinkle advanced to third.,49,2026-03-17T00:00:00-04:00,"Monan Park (Boston, MA)",0,MBA,2026
6565329,615157,Bethel (MN) Royals,615260,UMass Boston Beacons,615157,4,top,Hayden Sperbeck struck out swinging (1-2 FBFS).,50,2026-03-17T00:00:00-04:00,"Monan Park (Boston, MA)",0,MBA,2026
6565329,615157,Bethel (MN) Royals,615260,UMass Boston Beacons,615157,4,top,Carson Christiansen lined out to cf (0-0).,51,2026-03-17T00:00:00-04:00,"Monan Park (Boston, MA)",0,MBA,2026
6565329,615157,Bethel (MN) Royals,615260,UMass Boston Beacons,615260,4,bot,Ben Sherry doubled to right center (1-2 BKKF).,52,2026-03-17T00:00:00-04:00,"Monan Park (Boston, MA)",0,MBA,2026
6565329,615157,Bethel (MN) Royals,615260,UMass Boston Beacons,615260,4,bot,Ryan Slack struck out swinging (1-2 KBSS).,53,2026-03-17T00:00:00-04:00,"Monan Park (Boston, MA)",0,MBA,2026
6565329,615157,Bethel (MN) Royals,615260,UMass Boston Beacons,615260,4,bot,Dylan Agvent to rf for Nicolas Piscioniere.,54,2026-03-17T00:00:00-04:00,"Monan Park (Boston, MA)",0,MBA,2026
6565329,615157,Bethel (MN) Royals,615260,UMass Boston Beacons,615260,4,bot,"Dylan Agvent doubled to left field, RBI (1-1 FB)3a Ben Sherry scored.",55,2026-03-17T00:00:00-04:00,"Monan Park (Boston, MA)",0,MBA,2026
6565329,615157,Bethel (MN) Royals,615260,UMass Boston Beacons,615260,4,bot,Breon Parker singled to pitcher (0-0)3a Dylan Agvent advanced to third.,56,2026-03-17T00:00:00-04:00,"Monan Park (Boston, MA)",0,MBA,2026
6565329,615157,Bethel (MN) Royals,615260,UMass Boston Beacons,615260,4,bot,"Nick Farnacci singled to left center, RBI (1-1 SB)3a Breon Parker advanced to second3a Dylan Agvent scored.",57,2026-03-17T00:00:00-04:00,"Monan Park (Boston, MA)",0,MBA,2026
6565329,615157,Bethel (MN) Royals,615260,UMass Boston Beacons,615260,4,bot,Jay Krieger to p for Roman Lachenmayer.,58,2026-03-17T00:00:00-04:00,"Monan Park (Boston, MA)",0,MBA,2026
6565329,615157,Bethel (MN) Royals,615260,UMass Boston Beacons,615260,4,bot,Elliot Miles hit by pitch (2-0 BH)3a Nick Farnacci advanced to second3a Breon Parker advanced to third.,59,2026-03-17T00:00:00-04:00,"Monan Park (Boston, MA)",0,MBA,2026
6565329,615157,Bethel (MN) Royals,615260,UMass Boston Beacons,615260,4,bot,Brandon Gaer grounded into double play p to c to 1b (2-2 BKKB)3a Breon Parker out on the play.,60,2026-03-17T00:00:00-04:00,"Monan Park (Boston, MA)",0,MBA,2026
6565329,615157,Bethel (MN) Royals,615260,UMass Boston Beacons,615157,5,top,Ben Trucke struck out swinging (0-2 KSS).,61,2026-03-17T00:00:00-04:00,"Monan Park (Boston, MA)",0,MBA,2026
6565329,615157,Bethel (MN) Royals,615260,UMass Boston Beacons,615157,5,top,Max Garner to 1b for Jayden Lafleur.,62,2026-03-17T00:00:00-04:00,"Monan Park (Boston, MA)",0,MBA,2026
6565329,615157,Bethel (MN) Royals,615260,UMass Boston Beacons,615157,5,top,Chris Lavin flied out to cf (0-2 KS).,63,2026-03-17T00:00:00-04:00,"Monan Park (Boston, MA)",0,MBA,2026
6565329,615157,Bethel (MN) Royals,615260,UMass Boston Beacons,615157,5,top,Drew Girtz flied out to lf (2-0 BB).,64,2026-03-17T00:00:00-04:00,"Monan Park (Boston, MA)",0,MBA,2026
6565329,615157,Bethel (MN) Royals,615260,UMass Boston Beacons,615260,5,bot,Max Garner struck out looking (1-2 SFBK).,65,2026-03-17T00:00:00-04:00,"Monan Park (Boston, MA)",0,MBA,2026
6565329,615157,Bethel (MN) Royals,615260,UMass Boston Beacons,615260,5,bot,Cole Bissaillon popped up to ss (0-0).,66,2026-03-17T00:00:00-04:00,"Monan Park (Boston, MA)",0,MBA,2026
6565329,615157,Bethel (MN) Royals,615260,UMass Boston Beacons,615260,5,bot,Ben Sherry flied out to rf (1-2 KBF).,67,2026-03-17T00:00:00-04:00,"Monan Park (Boston, MA)",0,MBA,2026
6565329,615157,Bethel (MN) Royals,615260,UMass Boston Beacons,615157,6,top,Chris Cannon lined out to 2b (0-1 K).,68,2026-03-17T00:00:00-04:00,"Monan Park (Boston, MA)",0,MBA,2026
6565329,615157,Bethel (MN) Royals,615260,UMass Boston Beacons,615157,6,top,Oran Hinkle singled to center field (3-2 KBBBF).,69,2026-03-17T00:00:00-04:00,"Monan Park (Boston, MA)",0,MBA,2026
6565329,615157,Bethel (MN) Royals,615260,UMass Boston Beacons,615157,6,top,Sam Abbas doubled to left field (0-0)3a Oran Hinkle advanced to third.,70,2026-03-17T00:00:00-04:00,"Monan Park (Boston, MA)",0,MBA,2026
6565329,615157,Bethel (MN) Royals,615260,UMass Boston Beacons,615157,6,top,"Nainoa Hayashi grounded out to ss, RBI (1-2 KFB)3a Sam Abbas advanced to third3a Oran Hinkle scored.",71,2026-03-17T00:00:00-04:00,"Monan Park (Boston, MA)",0,MBA,2026
6565329,615157,Bethel (MN) Royals,615260,UMass Boston Beacons,615157,6,top,"Hayden Sperbeck singled to left field, RBI (0-2 KF)3a Sam Abbas scored.",72,2026-03-17T00:00:00-04:00,"Monan Park (Boston, MA)",0,MBA,2026
6565329,615157,Bethel (MN) Royals,615260,UMass Boston Beacons,615157,6,top,"Carson Christiansen doubled to right field, RBI (0-1 F)3a Hayden Sperbeck scored.",73,2026-03-17T00:00:00-04:00,"Monan Park (Boston, MA)",0,MBA,2026
6565329,615157,Bethel (MN) Royals,615260,UMass Boston Beacons,615157,6,top,Ben Trucke reached on catcher's interference (0-0).,74,2026-03-17T00:00:00-04:00,"Monan Park (Boston, MA)",0,MBA,2026
6565329,615157,Bethel (MN) Royals,615260,UMass Boston Beacons,615157,6,top,Chris Lavin grounded out to 3b unassisted (2-2 BFBF).,75,2026-03-17T00:00:00-04:00,"Monan Park (Boston, MA)",0,MBA,2026
6565329,615157,Bethel (MN) Royals,615260,UMass Boston Beacons,615260,6,bot,Ryan Slack struck out swinging (0-2 KFS).,76,2026-03-17T00:00:00-04:00,"Monan Park (Boston, MA)",0,MBA,2026
6565329,615157,Bethel (MN) Royals,615260,UMass Boston Beacons,615260,6,bot,Dylan Agvent struck out swinging (2-2 SBBFS).,77,2026-03-17T00:00:00-04:00,"Monan Park (Boston, MA)",0,MBA,2026
6565329,615157,Bethel (MN) Royals,615260,UMass Boston Beacons,615260,6,bot,Breon Parker grounded out to 2b (3-2 BFBSBF).,78,2026-03-17T00:00:00-04:00,"Monan Park (Boston, MA)",0,MBA,2026
6565329,615157,Bethel (MN) Royals,615260,UMass Boston Beacons,615157,7,top,Drew Girtz popped up to ss (1-1 KB).,79,2026-03-17T00:00:00-04:00,"Monan Park (Boston, MA)",0,MBA,2026
6565329,615157,Bethel (MN) Royals,615260,UMass Boston Beacons,615157,7,top,Chris Cannon doubled to center field (1-0 B).,80,2026-03-17T00:00:00-04:00,"Monan Park (Boston, MA)",0,MBA,2026
6565329,615157,Bethel (MN) Royals,615260,UMass Boston Beacons,615157,7,top,Oran Hinkle flied out to lf (2-2 BSBFF).,81,2026-03-17T00:00:00-04:00,"Monan Park (Boston, MA)",0,MBA,2026
6565329,615157,Bethel (MN) Royals,615260,UMass Boston Beacons,615157,7,top,Sam Abbas walked (0-0).,82,2026-03-17T00:00:00-04:00,"Monan Park (Boston, MA)",0,MBA,2026
6565329,615157,Bethel (MN) Royals,615260,UMass Boston Beacons,615157,7,top,Nainoa Hayashi out at first ss to 2b (0-0).,83,2026-03-17T00:00:00-04:00,"Monan Park (Boston, MA)",0,MBA,2026
6565329,615157,Bethel (MN) Royals,615260,UMass Boston Beacons,615260,7,bot,Nick Farnacci struck out looking (2-2 KBBFK).,84,2026-03-17T00:00:00-04:00,"Monan Park (Boston, MA)",0,MBA,2026
6565329,615157,Bethel (MN) Royals,615260,UMass Boston Beacons,615260,7,bot,Elliot Miles hit by pitch (1-0 H).,85,2026-03-17T00:00:00-04:00,"Monan Park (Boston, MA)",0,MBA,2026
6565329,615157,Bethel (MN) Royals,615260,UMass Boston Beacons,615260,7,bot,Brandon Gaer walked (3-1 BBBKB)3a Elliot Miles advanced to second.,86,2026-03-17T00:00:00-04:00,"Monan Park (Boston, MA)",0,MBA,2026
6565329,615157,Bethel (MN) Royals,615260,UMass Boston Beacons,615260,7,bot,Max Garner singled to third base (1-2 SKB)3a Brandon Gaer advanced to second3a Elliot Miles advanced to third.,87,2026-03-17T00:00:00-04:00,"Monan Park (Boston, MA)",0,MBA,2026
6565329,615157,Bethel (MN) Royals,615260,UMass Boston Beacons,615260,7,bot,Chase Beloin to c for Cole Bissaillon.,88,2026-03-17T00:00:00-04:00,"Monan Park (Boston, MA)",0,MBA,2026
6565329,615157,Bethel (MN) Royals,615260,UMass Boston Beacons,615260,7,bot,Wes Sturrup to dh for Brandon Gaer.,89,2026-03-17T00:00:00-04:00,"Monan Park (Boston, MA)",0,MBA,2026
6565329,615157,Bethel (MN) Royals,615260,UMass Boston Beacons,615260,7,bot,Chase Beloin struck out swinging (3-2 BBSBFS).,90,2026-03-17T00:00:00-04:00,"Monan Park (Boston, MA)",0,MBA,2026
6565329,615157,Bethel (MN) Royals,615260,UMass Boston Beacons,615260,7,bot,Ben Sherry struck out swinging (0-2 KFS).,91,2026-03-17T00:00:00-04:00,"Monan Park (Boston, MA)",0,MBA,2026
6565329,615157,Bethel (MN) Royals,615260,UMass Boston Beacons,615157,8,top,Connor Curtis to p for Owen Ellsworth.,92,2026-03-17T00:00:00-04:00,"Monan Park (Boston, MA)",0,MBA,2026
6565329,615157,Bethel (MN) Royals,615260,UMass Boston Beacons,615157,8,top,Andrew Carlson to c for Chase Beloin.,93,2026-03-17T00:00:00-04:00,"Monan Park (Boston, MA)",0,MBA,2026
6565329,615157,Bethel (MN) Royals,615260,UMass Boston Beacons,615157,8,top,Hayden Sperbeck struck out swinging (1-2 SFBS).,94,2026-03-17T00:00:00-04:00,"Monan Park (Boston, MA)",0,MBA,2026
6565329,615157,Bethel (MN) Royals,615260,UMass Boston Beacons,615157,8,top,Carson Christiansen grounded out to 1b unassisted (0-0).,95,2026-03-17T00:00:00-04:00,"Monan Park (Boston, MA)",0,MBA,2026
6565329,615157,Bethel (MN) Royals,615260,UMass Boston Beacons,615157,8,top,Ben Trucke walked (3-1 BBKBB).,96,2026-03-17T00:00:00-04:00,"Monan Park (Boston, MA)",0,MBA,2026
6565329,615157,Bethel (MN) Royals,615260,UMass Boston Beacons,615157,8,top,Ben Trucke advanced to second on a wild pitch.,97,2026-03-17T00:00:00-04:00,"Monan Park (Boston, MA)",0,MBA,2026
6565329,615157,Bethel (MN) Royals,615260,UMass Boston Beacons,615157,8,top,Chris Lavin struck out looking (3-2 BKBSFFFFBK).,98,2026-03-17T00:00:00-04:00,"Monan Park (Boston, MA)",0,MBA,2026
6565329,615157,Bethel (MN) Royals,615260,UMass Boston Beacons,615260,8,bot,Brandon Witter to p for Jay Krieger.,99,2026-03-17T00:00:00-04:00,"Monan Park (Boston, MA)",0,MBA,2026
6565329,615157,Bethel (MN) Royals,615260,UMass Boston Beacons,615260,8,bot,Ryan Slack grounded out to ss (0-0).,100,2026-03-17T00:00:00-04:00,"Monan Park (Boston, MA)",0,MBA,2026
6565329,615157,Bethel (MN) Royals,615260,UMass Boston Beacons,615260,8,bot,Dylan Agvent singled to right field (0-1 K).,101,2026-03-17T00:00:00-04:00,"Monan Park (Boston, MA)",0,MBA,2026
6565329,615157,Bethel (MN) Royals,615260,UMass Boston Beacons,615260,8,bot,Breon Parker singled to third base (0-0)3a Dylan Agvent advanced to second.,102,2026-03-17T00:00:00-04:00,"Monan Park (Boston, MA)",0,MBA,2026
6565329,615157,Bethel (MN) Royals,615260,UMass Boston Beacons,615260,8,bot,Nick Farnacci struck out looking (3-2 BBFFFBK).,103,2026-03-17T00:00:00-04:00,"Monan Park (Boston, MA)",0,MBA,2026
6565329,615157,Bethel (MN) Royals,615260,UMass Boston Beacons,615260,8,bot,Cavan Banks to p for Brandon Witter.,104,2026-03-17T00:00:00-04:00,"Monan Park (Boston, MA)",0,MBA,2026
6565329,615157,Bethel (MN) Royals,615260,UMass Boston Beacons,615260,8,bot,Elliot Miles lined out to 2b (2-2 BSBF).,105,2026-03-17T00:00:00-04:00,"Monan Park (Boston, MA)",0,MBA,2026
6565329,615157,Bethel (MN) Royals,615260,UMass Boston Beacons,615157,9,top,Drew Girtz singled to left field (1-0 B).,106,2026-03-17T00:00:00-04:00,"Monan Park (Boston, MA)",0,MBA,2026
6565329,615157,Bethel (MN) Royals,615260,UMass Boston Beacons,615157,9,top,Drew Girtz advanced to second on a passed ball.,107,2026-03-17T00:00:00-04:00,"Monan Park (Boston, MA)",0,MBA,2026
6565329,615157,Bethel (MN) Royals,615260,UMass Boston Beacons,615157,9,top,Chris Cannon grounded out to 2b (2-1 BKB)3a Drew Girtz advanced to third.,108,2026-03-17T00:00:00-04:00,"Monan Park (Boston, MA)",0,MBA,2026
6565329,615157,Bethel (MN) Royals,615260,UMass Boston Beacons,615157,9,top,"Oran Hinkle flied out to cf, sacrifice fly, RBI (2-0 BB)3a Drew Girtz scored.",109,2026-03-17T00:00:00-04:00,"Monan Park (Boston, MA)",0,MBA,2026
6565329,615157,Bethel (MN) Royals,615260,UMass Boston Beacons,615157,9,top,Sam Abbas struck out looking (3-2 SKBBBK).,110,2026-03-17T00:00:00-04:00,"Monan Park (Boston, MA)",0,MBA,2026
6565329,615157,Bethel (MN) Royals,615260,UMass Boston Beacons,615260,9,bot,Wes Sturrup struck out looking (2-2 BBKKK).,111,2026-03-17T00:00:00-04:00,"Monan Park (Boston, MA)",0,MBA,2026
6565329,615157,Bethel (MN) Royals,615260,UMass Boston Beacons,615260,9,bot,Max Garner singled to third base (3-1 FBBB).,112,2026-03-17T00:00:00-04:00,"Monan Park (Boston, MA)",0,MBA,2026
6565329,615157,Bethel (MN) Royals,615260,UMass Boston Beacons,615260,9,bot,Dylan Kennedy-Fujah to c for Andrew Carlson.,113,2026-03-17T00:00:00-04:00,"Monan Park (Boston, MA)",0,MBA,2026
6565329,615157,Bethel (MN) Royals,615260,UMass Boston Beacons,615260,9,bot,Dylan Kennedy-Fujah struck out swinging (1-2 KKBS).,114,2026-03-17T00:00:00-04:00,"Monan Park (Boston, MA)",0,MBA,2026
6565329,615157,Bethel (MN) Royals,615260,UMass Boston Beacons,615260,9,bot,Max Garner stole second.,115,2026-03-17T00:00:00-04:00,"Monan Park (Boston, MA)",0,MBA,2026
6565329,615157,Bethel (MN) Royals,615260,UMass Boston Beacons,615260,9,bot,Ben Sherry walked (3-1 BBBKB).,116,2026-03-17T00:00:00-04:00,"Monan Park (Boston, MA)",0,MBA,2026
6565329,615157,Bethel (MN) Royals,615260,UMass Boston Beacons,615260,9,bot,Ryan Slack walked (3-0 BBBB)3a Ben Sherry advanced to second3a Max Garner advanced to third.,117,2026-03-17T00:00:00-04:00,"Monan Park (Boston, MA)",0,MBA,2026
6565329,615157,Bethel (MN) Royals,615260,UMass Boston Beacons,615260,9,bot,Dylan Agvent struck out swinging (2-2 BKBKS).,118,2026-03-17T00:00:00-04:00,"Monan Park (Boston, MA)",0,MBA,2026
