game_id,away_team_id,away_team_name,home_team_id,home_team_name,batting_team,inning,top_bot,event_text,event_num,game_datetime,stadium_name,attendance,sport_id,season
6566231,615283,UMSV Dolphins,615407,Yeshiva Maccabees,615283,1,top,Zach Turko flied out to rf (0-0).,1,2026-03-23T00:00:00-04:00,"New York, NY",4,MBA,2026
6566231,615283,UMSV Dolphins,615407,Yeshiva Maccabees,615283,1,top,Will Granata struck out swinging (2-2 BBKKS).,2,2026-03-23T00:00:00-04:00,"New York, NY",4,MBA,2026
6566231,615283,UMSV Dolphins,615407,Yeshiva Maccabees,615283,1,top,Stephen Marinez tripled to center field (3-1 BBBK).,3,2026-03-23T00:00:00-04:00,"New York, NY",4,MBA,2026
6566231,615283,UMSV Dolphins,615407,Yeshiva Maccabees,615283,1,top,Pablo Austin lined out to ss (0-1 K).,4,2026-03-23T00:00:00-04:00,"New York, NY",4,MBA,2026
6566231,615283,UMSV Dolphins,615407,Yeshiva Maccabees,615407,1,bot,Reuben Benzaquen singled to center field (0-0).,5,2026-03-23T00:00:00-04:00,"New York, NY",4,MBA,2026
6566231,615283,UMSV Dolphins,615407,Yeshiva Maccabees,615407,1,bot,Reuben Benzaquen advanced to second on a wild pitch.,6,2026-03-23T00:00:00-04:00,"New York, NY",4,MBA,2026
6566231,615283,UMSV Dolphins,615407,Yeshiva Maccabees,615407,1,bot,Simmy Goldberger grounded out to ss (1-1 BF); Reuben Benzaquen advanced to third.,7,2026-03-23T00:00:00-04:00,"New York, NY",4,MBA,2026
6566231,615283,UMSV Dolphins,615407,Yeshiva Maccabees,615407,1,bot,"Reuben Benzaquen out at third p to 3b, picked off.",8,2026-03-23T00:00:00-04:00,"New York, NY",4,MBA,2026
6566231,615283,UMSV Dolphins,615407,Yeshiva Maccabees,615407,1,bot,Josh Paskoff grounded out to 3b (0-0).,9,2026-03-23T00:00:00-04:00,"New York, NY",4,MBA,2026
6566231,615283,UMSV Dolphins,615407,Yeshiva Maccabees,615283,2,top,Kyle Brindisi struck out swinging (2-2 KFBBS).,10,2026-03-23T00:00:00-04:00,"New York, NY",4,MBA,2026
6566231,615283,UMSV Dolphins,615407,Yeshiva Maccabees,615283,2,top,Michael Akalski singled to shortstop (1-2 KKB).,11,2026-03-23T00:00:00-04:00,"New York, NY",4,MBA,2026
6566231,615283,UMSV Dolphins,615407,Yeshiva Maccabees,615283,2,top,Andrew Farina singled to left field (2-0 BB); Michael Akalski advanced to second.,12,2026-03-23T00:00:00-04:00,"New York, NY",4,MBA,2026
6566231,615283,UMSV Dolphins,615407,Yeshiva Maccabees,615283,2,top,Aidan Glynn flied out to cf (1-1 BK).,13,2026-03-23T00:00:00-04:00,"New York, NY",4,MBA,2026
6566231,615283,UMSV Dolphins,615407,Yeshiva Maccabees,615283,2,top,Tyler Margolis walked (3-0 BBBB); Andrew Farina advanced to second; Michael Akalski advanced to third.,14,2026-03-23T00:00:00-04:00,"New York, NY",4,MBA,2026
6566231,615283,UMSV Dolphins,615407,Yeshiva Maccabees,615283,2,top,"Zach Turko doubled, 3 RBI (0-1 K); Tyler Margolis scored; Andrew Farina scored; Michael Akalski scored.",15,2026-03-23T00:00:00-04:00,"New York, NY",4,MBA,2026
6566231,615283,UMSV Dolphins,615407,Yeshiva Maccabees,615283,2,top,"Will Granata singled to center field, RBI (0-1 S); Zach Turko scored.",16,2026-03-23T00:00:00-04:00,"New York, NY",4,MBA,2026
6566231,615283,UMSV Dolphins,615407,Yeshiva Maccabees,615283,2,top,Stephen Marinez grounded out to p (1-2 KBF).,17,2026-03-23T00:00:00-04:00,"New York, NY",4,MBA,2026
6566231,615283,UMSV Dolphins,615407,Yeshiva Maccabees,615407,2,bot,Noah Steinmetz grounded out to 1b unassisted (1-1 BK).,18,2026-03-23T00:00:00-04:00,"New York, NY",4,MBA,2026
6566231,615283,UMSV Dolphins,615407,Yeshiva Maccabees,615407,2,bot,Jacob Canner grounded out to 3b (1-2 KFB).,19,2026-03-23T00:00:00-04:00,"New York, NY",4,MBA,2026
6566231,615283,UMSV Dolphins,615407,Yeshiva Maccabees,615407,2,bot,RJ Hellman struck out looking (0-2 KFK).,20,2026-03-23T00:00:00-04:00,"New York, NY",4,MBA,2026
6566231,615283,UMSV Dolphins,615407,Yeshiva Maccabees,615283,3,top,Pablo Austin singled to shortstop (1-0 B).,21,2026-03-23T00:00:00-04:00,"New York, NY",4,MBA,2026
6566231,615283,UMSV Dolphins,615407,Yeshiva Maccabees,615283,3,top,Pablo Austin stole second.,22,2026-03-23T00:00:00-04:00,"New York, NY",4,MBA,2026
6566231,615283,UMSV Dolphins,615407,Yeshiva Maccabees,615283,3,top,"Kyle Brindisi doubled to left field, RBI (3-2 BFFFFBB); Pablo Austin scored.",23,2026-03-23T00:00:00-04:00,"New York, NY",4,MBA,2026
6566231,615283,UMSV Dolphins,615407,Yeshiva Maccabees,615283,3,top,Izzy Gober to p for David Cohen.,24,2026-03-23T00:00:00-04:00,"New York, NY",4,MBA,2026
6566231,615283,UMSV Dolphins,615407,Yeshiva Maccabees,615283,3,top,Kyle Brindisi advanced to third on a wild pitch.,25,2026-03-23T00:00:00-04:00,"New York, NY",4,MBA,2026
6566231,615283,UMSV Dolphins,615407,Yeshiva Maccabees,615283,3,top,"Michael Akalski singled to center field, RBI (1-0 B); Kyle Brindisi scored.",26,2026-03-23T00:00:00-04:00,"New York, NY",4,MBA,2026
6566231,615283,UMSV Dolphins,615407,Yeshiva Maccabees,615283,3,top,Andrew Farina popped up to 2b (0-0).,27,2026-03-23T00:00:00-04:00,"New York, NY",4,MBA,2026
6566231,615283,UMSV Dolphins,615407,Yeshiva Maccabees,615283,3,top,Aidan Glynn reached on a fielder's choice (0-0); Michael Akalski out at second ss to 2b.,28,2026-03-23T00:00:00-04:00,"New York, NY",4,MBA,2026
6566231,615283,UMSV Dolphins,615407,Yeshiva Maccabees,615283,3,top,Tyler Margolis out at first ss to 2b (1-1 BF).,29,2026-03-23T00:00:00-04:00,"New York, NY",4,MBA,2026
6566231,615283,UMSV Dolphins,615407,Yeshiva Maccabees,615407,3,bot,Josh Canner singled to center field (0-1 S).,30,2026-03-23T00:00:00-04:00,"New York, NY",4,MBA,2026
6566231,615283,UMSV Dolphins,615407,Yeshiva Maccabees,615407,3,bot,Gavriel Weinstein walked (3-1 BBKBB); Josh Canner advanced to second.,31,2026-03-23T00:00:00-04:00,"New York, NY",4,MBA,2026
6566231,615283,UMSV Dolphins,615407,Yeshiva Maccabees,615407,3,bot,"Assaf Perl grounded out to p, SAC (0-0); Gavriel Weinstein advanced to second; Josh Canner advanced to third.",32,2026-03-23T00:00:00-04:00,"New York, NY",4,MBA,2026
6566231,615283,UMSV Dolphins,615407,Yeshiva Maccabees,615407,3,bot,Reuben Benzaquen struck out looking (3-2 KBBFBK).,33,2026-03-23T00:00:00-04:00,"New York, NY",4,MBA,2026
6566231,615283,UMSV Dolphins,615407,Yeshiva Maccabees,615407,3,bot,"Simmy Goldberger reached first on an error by 1b (2-2 BKSFB); Gavriel Weinstein scored, unearned; Josh Canner scored, unearned.",34,2026-03-23T00:00:00-04:00,"New York, NY",4,MBA,2026
6566231,615283,UMSV Dolphins,615407,Yeshiva Maccabees,615407,3,bot,Moshe Weisenberg pinch hit for Josh Paskoff.,35,2026-03-23T00:00:00-04:00,"New York, NY",4,MBA,2026
6566231,615283,UMSV Dolphins,615407,Yeshiva Maccabees,615407,3,bot,Moshe Weisenberg struck out looking (1-2 BFFK).,36,2026-03-23T00:00:00-04:00,"New York, NY",4,MBA,2026
6566231,615283,UMSV Dolphins,615407,Yeshiva Maccabees,615283,4,top,Zach Turko walked (3-0 BBBB).,37,2026-03-23T00:00:00-04:00,"New York, NY",4,MBA,2026
6566231,615283,UMSV Dolphins,615407,Yeshiva Maccabees,615283,4,top,Zach Turko stole second.,38,2026-03-23T00:00:00-04:00,"New York, NY",4,MBA,2026
6566231,615283,UMSV Dolphins,615407,Yeshiva Maccabees,615283,4,top,Zach Turko advanced to third on a wild pitch.,39,2026-03-23T00:00:00-04:00,"New York, NY",4,MBA,2026
6566231,615283,UMSV Dolphins,615407,Yeshiva Maccabees,615283,4,top,Will Granata walked (3-2 BBKBFB).,40,2026-03-23T00:00:00-04:00,"New York, NY",4,MBA,2026
6566231,615283,UMSV Dolphins,615407,Yeshiva Maccabees,615283,4,top,"Stephen Marinez tripled to right field, 2 RBI (0-1 K); Will Granata scored; Zach Turko scored.",41,2026-03-23T00:00:00-04:00,"New York, NY",4,MBA,2026
6566231,615283,UMSV Dolphins,615407,Yeshiva Maccabees,615283,4,top,"Pablo Austin doubled to right field, RBI (0-0); Stephen Marinez scored.",42,2026-03-23T00:00:00-04:00,"New York, NY",4,MBA,2026
6566231,615283,UMSV Dolphins,615407,Yeshiva Maccabees,615283,4,top,Kyle Brindisi walked (3-2 BBFFBB).,43,2026-03-23T00:00:00-04:00,"New York, NY",4,MBA,2026
6566231,615283,UMSV Dolphins,615407,Yeshiva Maccabees,615283,4,top,Michael Akalski hit by pitch (2-0 BH); Kyle Brindisi advanced to second; Pablo Austin advanced to third.,44,2026-03-23T00:00:00-04:00,"New York, NY",4,MBA,2026
6566231,615283,UMSV Dolphins,615407,Yeshiva Maccabees,615283,4,top,"Andrew Farina doubled to center field, 2 RBI (1-0 B); Michael Akalski advanced to third; Kyle Brindisi scored; Pablo Austin scored.",45,2026-03-23T00:00:00-04:00,"New York, NY",4,MBA,2026
6566231,615283,UMSV Dolphins,615407,Yeshiva Maccabees,615283,4,top,Eli Zirdok to p for Izzy Gober.,46,2026-03-23T00:00:00-04:00,"New York, NY",4,MBA,2026
6566231,615283,UMSV Dolphins,615407,Yeshiva Maccabees,615283,4,top,Aidan Glynn flied out to cf (1-0 B).,47,2026-03-23T00:00:00-04:00,"New York, NY",4,MBA,2026
6566231,615283,UMSV Dolphins,615407,Yeshiva Maccabees,615283,4,top,Logan Garcia pinch hit for Tyler Margolis.,48,2026-03-23T00:00:00-04:00,"New York, NY",4,MBA,2026
6566231,615283,UMSV Dolphins,615407,Yeshiva Maccabees,615283,4,top,Logan Garcia struck out swinging (2-2 BKFBS).,49,2026-03-23T00:00:00-04:00,"New York, NY",4,MBA,2026
6566231,615283,UMSV Dolphins,615407,Yeshiva Maccabees,615283,4,top,Zach Turko lined out to 3b (0-1 K).,50,2026-03-23T00:00:00-04:00,"New York, NY",4,MBA,2026
6566231,615283,UMSV Dolphins,615407,Yeshiva Maccabees,615407,4,bot,Logan Garcia to cf.,51,2026-03-23T00:00:00-04:00,"New York, NY",4,MBA,2026
6566231,615283,UMSV Dolphins,615407,Yeshiva Maccabees,615407,4,bot,Devin Lane to 1b for Will Granata.,52,2026-03-23T00:00:00-04:00,"New York, NY",4,MBA,2026
6566231,615283,UMSV Dolphins,615407,Yeshiva Maccabees,615407,4,bot,Brendan Meaney to lf for Kyle Brindisi.,53,2026-03-23T00:00:00-04:00,"New York, NY",4,MBA,2026
6566231,615283,UMSV Dolphins,615407,Yeshiva Maccabees,615407,4,bot,Sean McManus to dh for Michael Akalski.,54,2026-03-23T00:00:00-04:00,"New York, NY",4,MBA,2026
6566231,615283,UMSV Dolphins,615407,Yeshiva Maccabees,615407,4,bot,Noah Steinmetz struck out looking (1-2 KBKK).,55,2026-03-23T00:00:00-04:00,"New York, NY",4,MBA,2026
6566231,615283,UMSV Dolphins,615407,Yeshiva Maccabees,615407,4,bot,Jacob Canner struck out looking (2-2 KKBBFK).,56,2026-03-23T00:00:00-04:00,"New York, NY",4,MBA,2026
6566231,615283,UMSV Dolphins,615407,Yeshiva Maccabees,615407,4,bot,RJ Hellman grounded out to 2b (2-0 BB).,57,2026-03-23T00:00:00-04:00,"New York, NY",4,MBA,2026
6566231,615283,UMSV Dolphins,615407,Yeshiva Maccabees,615283,5,top,Devin Lane walked (3-1 BBKBB).,58,2026-03-23T00:00:00-04:00,"New York, NY",4,MBA,2026
6566231,615283,UMSV Dolphins,615407,Yeshiva Maccabees,615283,5,top,Stephen Marinez flied out to cf (3-2 BBKFBFFF).,59,2026-03-23T00:00:00-04:00,"New York, NY",4,MBA,2026
6566231,615283,UMSV Dolphins,615407,Yeshiva Maccabees,615283,5,top,Devin Lane advanced to second on a wild pitch.,60,2026-03-23T00:00:00-04:00,"New York, NY",4,MBA,2026
6566231,615283,UMSV Dolphins,615407,Yeshiva Maccabees,615283,5,top,Pablo Austin singled to shortstop (1-0 B).,61,2026-03-23T00:00:00-04:00,"New York, NY",4,MBA,2026
6566231,615283,UMSV Dolphins,615407,Yeshiva Maccabees,615283,5,top,"Brendan Meaney reached on a fielder's choice, advanced to second (0-0); Pablo Austin out at second p to ss; Devin Lane advanced to third, scored on an error by ss, unearned.",62,2026-03-23T00:00:00-04:00,"New York, NY",4,MBA,2026
6566231,615283,UMSV Dolphins,615407,Yeshiva Maccabees,615283,5,top,Sean McManus flied out to rf (1-2 BKK).,63,2026-03-23T00:00:00-04:00,"New York, NY",4,MBA,2026
6566231,615283,UMSV Dolphins,615407,Yeshiva Maccabees,615407,5,bot,Josh Canner reached first on an error by 1b (0-1 K).,64,2026-03-23T00:00:00-04:00,"New York, NY",4,MBA,2026
6566231,615283,UMSV Dolphins,615407,Yeshiva Maccabees,615407,5,bot,"Josh Canner out at first p to 1b, picked off.",65,2026-03-23T00:00:00-04:00,"New York, NY",4,MBA,2026
6566231,615283,UMSV Dolphins,615407,Yeshiva Maccabees,615407,5,bot,Gavriel Weinstein struck out swinging (1-2 BFSS).,66,2026-03-23T00:00:00-04:00,"New York, NY",4,MBA,2026
6566231,615283,UMSV Dolphins,615407,Yeshiva Maccabees,615407,5,bot,Assaf Perl grounded out to p (0-0).,67,2026-03-23T00:00:00-04:00,"New York, NY",4,MBA,2026
6566231,615283,UMSV Dolphins,615407,Yeshiva Maccabees,615283,6,top,Moshe Weisenberg to c.,68,2026-03-23T00:00:00-04:00,"New York, NY",4,MBA,2026
6566231,615283,UMSV Dolphins,615407,Yeshiva Maccabees,615283,6,top,RJ Hellman to dh.,69,2026-03-23T00:00:00-04:00,"New York, NY",4,MBA,2026
6566231,615283,UMSV Dolphins,615407,Yeshiva Maccabees,615283,6,top,Josh Canner to p.,70,2026-03-23T00:00:00-04:00,"New York, NY",4,MBA,2026
6566231,615283,UMSV Dolphins,615407,Yeshiva Maccabees,615283,6,top,/  for Eli Zirdok.,71,2026-03-23T00:00:00-04:00,"New York, NY",4,MBA,2026
6566231,615283,UMSV Dolphins,615407,Yeshiva Maccabees,615283,6,top,Reuben Benzaquen to cf.,72,2026-03-23T00:00:00-04:00,"New York, NY",4,MBA,2026
6566231,615283,UMSV Dolphins,615407,Yeshiva Maccabees,615283,6,top,Jacob Canner to rf.,73,2026-03-23T00:00:00-04:00,"New York, NY",4,MBA,2026
6566231,615283,UMSV Dolphins,615407,Yeshiva Maccabees,615283,6,top,Eli Zirdok to 2b for RJ Hellman.,74,2026-03-23T00:00:00-04:00,"New York, NY",4,MBA,2026
6566231,615283,UMSV Dolphins,615407,Yeshiva Maccabees,615283,6,top,Andrew Farina tripled to right field (0-0).,75,2026-03-23T00:00:00-04:00,"New York, NY",4,MBA,2026
6566231,615283,UMSV Dolphins,615407,Yeshiva Maccabees,615283,6,top,"Aidan Glynn reached first on an error by 3b (3-2 KBFFBB); Andrew Farina scored, unearned.",76,2026-03-23T00:00:00-04:00,"New York, NY",4,MBA,2026
6566231,615283,UMSV Dolphins,615407,Yeshiva Maccabees,615283,6,top,Aidan Glynn advanced to second on a wild pitch.,77,2026-03-23T00:00:00-04:00,"New York, NY",4,MBA,2026
6566231,615283,UMSV Dolphins,615407,Yeshiva Maccabees,615283,6,top,Aidan Glynn advanced to third on a wild pitch.,78,2026-03-23T00:00:00-04:00,"New York, NY",4,MBA,2026
6566231,615283,UMSV Dolphins,615407,Yeshiva Maccabees,615283,6,top,Logan Garcia walked (3-0 BBBB).,79,2026-03-23T00:00:00-04:00,"New York, NY",4,MBA,2026
6566231,615283,UMSV Dolphins,615407,Yeshiva Maccabees,615283,6,top,"Zach Turko flied out to cf, SAC, RBI (1-0 B); Aidan Glynn scored, unearned.",80,2026-03-23T00:00:00-04:00,"New York, NY",4,MBA,2026
6566231,615283,UMSV Dolphins,615407,Yeshiva Maccabees,615283,6,top,Logan Garcia advanced to second on a wild pitch.,81,2026-03-23T00:00:00-04:00,"New York, NY",4,MBA,2026
6566231,615283,UMSV Dolphins,615407,Yeshiva Maccabees,615283,6,top,Devin Lane hit by pitch (3-0 BBBH).,82,2026-03-23T00:00:00-04:00,"New York, NY",4,MBA,2026
6566231,615283,UMSV Dolphins,615407,Yeshiva Maccabees,615283,6,top,Stephen Marinez popped up to 2b (1-1 KB).,83,2026-03-23T00:00:00-04:00,"New York, NY",4,MBA,2026
6566231,615283,UMSV Dolphins,615407,Yeshiva Maccabees,615283,6,top,"Devin Lane out at first p to 1b, picked off.",84,2026-03-23T00:00:00-04:00,"New York, NY",4,MBA,2026
6566231,615283,UMSV Dolphins,615407,Yeshiva Maccabees,615407,6,bot,Reuben Benzaquen struck out looking (3-2 BKBKBK).,85,2026-03-23T00:00:00-04:00,"New York, NY",4,MBA,2026
6566231,615283,UMSV Dolphins,615407,Yeshiva Maccabees,615407,6,bot,Simmy Goldberger struck out swinging (0-0).,86,2026-03-23T00:00:00-04:00,"New York, NY",4,MBA,2026
6566231,615283,UMSV Dolphins,615407,Yeshiva Maccabees,615407,6,bot,Moshe Weisenberg grounded out to 2b (0-2 KF).,87,2026-03-23T00:00:00-04:00,"New York, NY",4,MBA,2026
6566231,615283,UMSV Dolphins,615407,Yeshiva Maccabees,615283,7,top,Ahron Riss to p for Josh Canner.,88,2026-03-23T00:00:00-04:00,"New York, NY",4,MBA,2026
6566231,615283,UMSV Dolphins,615407,Yeshiva Maccabees,615283,7,top,Pablo Austin singled to right field (1-2 BFF).,89,2026-03-23T00:00:00-04:00,"New York, NY",4,MBA,2026
6566231,615283,UMSV Dolphins,615407,Yeshiva Maccabees,615283,7,top,Pablo Austin advanced to second on a wild pitch.,90,2026-03-23T00:00:00-04:00,"New York, NY",4,MBA,2026
6566231,615283,UMSV Dolphins,615407,Yeshiva Maccabees,615283,7,top,Pablo Austin advanced to third on a wild pitch.,91,2026-03-23T00:00:00-04:00,"New York, NY",4,MBA,2026
6566231,615283,UMSV Dolphins,615407,Yeshiva Maccabees,615283,7,top,Brendan Meaney walked (3-2 KBFBBB).,92,2026-03-23T00:00:00-04:00,"New York, NY",4,MBA,2026
6566231,615283,UMSV Dolphins,615407,Yeshiva Maccabees,615283,7,top,Brendan Meaney advanced to second on a wild pitch.,93,2026-03-23T00:00:00-04:00,"New York, NY",4,MBA,2026
6566231,615283,UMSV Dolphins,615407,Yeshiva Maccabees,615283,7,top,Sean McManus walked (3-2 KBBBKB).,94,2026-03-23T00:00:00-04:00,"New York, NY",4,MBA,2026
6566231,615283,UMSV Dolphins,615407,Yeshiva Maccabees,615283,7,top,Jayson Nigro pinch hit for Andrew Farina.,95,2026-03-23T00:00:00-04:00,"New York, NY",4,MBA,2026
6566231,615283,UMSV Dolphins,615407,Yeshiva Maccabees,615283,7,top,"Jayson Nigro doubled down the lf line, 2 RBI (3-2 BKFBB); Sean McManus advanced to third; Brendan Meaney scored; Pablo Austin scored.",96,2026-03-23T00:00:00-04:00,"New York, NY",4,MBA,2026
6566231,615283,UMSV Dolphins,615407,Yeshiva Maccabees,615283,7,top,Aidan Glynn hit by pitch (2-0 BH).,97,2026-03-23T00:00:00-04:00,"New York, NY",4,MBA,2026
6566231,615283,UMSV Dolphins,615407,Yeshiva Maccabees,615283,7,top,Logan Garcia grounded into double play ss to 2b to 1b (2-1 BKB); Aidan Glynn out on the play; Jayson Nigro advanced to third; Sean McManus scored.,98,2026-03-23T00:00:00-04:00,"New York, NY",4,MBA,2026
6566231,615283,UMSV Dolphins,615407,Yeshiva Maccabees,615283,7,top,Jeremiah McKenzie pinch hit for Zach Turko.,99,2026-03-23T00:00:00-04:00,"New York, NY",4,MBA,2026
6566231,615283,UMSV Dolphins,615407,Yeshiva Maccabees,615283,7,top,Jeremiah McKenzie popped up to ss (1-0 B).,100,2026-03-23T00:00:00-04:00,"New York, NY",4,MBA,2026
6566231,615283,UMSV Dolphins,615407,Yeshiva Maccabees,615407,7,bot,Jeremiah McKenzie to 2b.,101,2026-03-23T00:00:00-04:00,"New York, NY",4,MBA,2026
6566231,615283,UMSV Dolphins,615407,Yeshiva Maccabees,615407,7,bot,Jayson Nigro to ss.,102,2026-03-23T00:00:00-04:00,"New York, NY",4,MBA,2026
6566231,615283,UMSV Dolphins,615407,Yeshiva Maccabees,615407,7,bot,Noah Steinmetz grounded out to 3b (0-0).,103,2026-03-23T00:00:00-04:00,"New York, NY",4,MBA,2026
6566231,615283,UMSV Dolphins,615407,Yeshiva Maccabees,615407,7,bot,Jacob Canner to rf for Ahron Riss.,104,2026-03-23T00:00:00-04:00,"New York, NY",4,MBA,2026
6566231,615283,UMSV Dolphins,615407,Yeshiva Maccabees,615407,7,bot,Ahron Riss to p for Jacob Canner.,105,2026-03-23T00:00:00-04:00,"New York, NY",4,MBA,2026
6566231,615283,UMSV Dolphins,615407,Yeshiva Maccabees,615407,7,bot,Ahron Riss struck out looking (1-2 KKBK).,106,2026-03-23T00:00:00-04:00,"New York, NY",4,MBA,2026
6566231,615283,UMSV Dolphins,615407,Yeshiva Maccabees,615407,7,bot,Eli Zirdok grounded out to 2b (2-2 KFBB).,107,2026-03-23T00:00:00-04:00,"New York, NY",4,MBA,2026
