game_id,away_team_id,away_team_name,home_team_id,home_team_name,batting_team,inning,top_bot,event_text,event_num,game_datetime,stadium_name,attendance,sport_id,season
6300804,596442,Washington St. Cougars,596487,Arkansas Razorbacks,596442,1,top,"Hartman, M singled to second base, bunt (0-0).",1,2025-02-17T00:00:00-05:00,"Baum-Walker Stadium (Fayetteville, AR)",8780,MBA,2025
6300804,596442,Washington St. Cougars,596487,Arkansas Razorbacks,596442,1,top,"Roy, G reached on a fielder's choice (1-1 SB); Hartman, M out at second 2b unassisted.",2,2025-02-17T00:00:00-05:00,"Baum-Walker Stadium (Fayetteville, AR)",8780,MBA,2025
6300804,596442,Washington St. Cougars,596487,Arkansas Razorbacks,596442,1,top,"Johnstone, L struck out swinging (1-2 BKSS).",3,2025-02-17T00:00:00-05:00,"Baum-Walker Stadium (Fayetteville, AR)",8780,MBA,2025
6300804,596442,Washington St. Cougars,596487,Arkansas Razorbacks,596442,1,top,"Roy, G stole second.",4,2025-02-17T00:00:00-05:00,"Baum-Walker Stadium (Fayetteville, AR)",8780,MBA,2025
6300804,596442,Washington St. Cougars,596487,Arkansas Razorbacks,596442,1,top,"Longo, R struck out swinging (0-2 SKS).",5,2025-02-17T00:00:00-05:00,"Baum-Walker Stadium (Fayetteville, AR)",8780,MBA,2025
6300804,596442,Washington St. Cougars,596487,Arkansas Razorbacks,596487,1,bot,Davalan walked (3-2 KBBFBB).,6,2025-02-17T00:00:00-05:00,"Baum-Walker Stadium (Fayetteville, AR)",8780,MBA,2025
6300804,596442,Washington St. Cougars,596487,Arkansas Razorbacks,596487,1,bot,W. Aloy singled to pitcher (1-2 KBF); Davalan advanced to second.,7,2025-02-17T00:00:00-05:00,"Baum-Walker Stadium (Fayetteville, AR)",8780,MBA,2025
6300804,596442,Washington St. Cougars,596487,Arkansas Razorbacks,596487,1,bot,"Haider, R to p for Robinson, J.",8,2025-02-17T00:00:00-05:00,"Baum-Walker Stadium (Fayetteville, AR)",8780,MBA,2025
6300804,596442,Washington St. Cougars,596487,Arkansas Razorbacks,596487,1,bot,Peppi flied out to lf (3-1 BKBB).,9,2025-02-17T00:00:00-05:00,"Baum-Walker Stadium (Fayetteville, AR)",8780,MBA,2025
6300804,596442,Washington St. Cougars,596487,Arkansas Razorbacks,596487,1,bot,Iredale lined out to rf (1-0 B).,10,2025-02-17T00:00:00-05:00,"Baum-Walker Stadium (Fayetteville, AR)",8780,MBA,2025
6300804,596442,Washington St. Cougars,596487,Arkansas Razorbacks,596487,1,bot,K. Aloy walked (3-1 BBBKB); W. Aloy advanced to second; Davalan advanced to third.,11,2025-02-17T00:00:00-05:00,"Baum-Walker Stadium (Fayetteville, AR)",8780,MBA,2025
6300804,596442,Washington St. Cougars,596487,Arkansas Razorbacks,596487,1,bot,Helfrick struck out swinging (1-2 FBFS).,12,2025-02-17T00:00:00-05:00,"Baum-Walker Stadium (Fayetteville, AR)",8780,MBA,2025
6300804,596442,Washington St. Cougars,596487,Arkansas Razorbacks,596442,2,top,"Skjonsby, R grounded out to 2b (3-2 BBBKK).",13,2025-02-17T00:00:00-05:00,"Baum-Walker Stadium (Fayetteville, AR)",8780,MBA,2025
6300804,596442,Washington St. Cougars,596487,Arkansas Razorbacks,596442,2,top,"Obenour, O grounded out to p, bunt (0-0).",14,2025-02-17T00:00:00-05:00,"Baum-Walker Stadium (Fayetteville, AR)",8780,MBA,2025
6300804,596442,Washington St. Cougars,596487,Arkansas Razorbacks,596442,2,top,"Cresswell, W struck out looking (0-2 KFK).",15,2025-02-17T00:00:00-05:00,"Baum-Walker Stadium (Fayetteville, AR)",8780,MBA,2025
6300804,596442,Washington St. Cougars,596487,Arkansas Razorbacks,596487,2,bot,Boles grounded out to 2b (0-0).,16,2025-02-17T00:00:00-05:00,"Baum-Walker Stadium (Fayetteville, AR)",8780,MBA,2025
6300804,596442,Washington St. Cougars,596487,Arkansas Razorbacks,596487,2,bot,Kozeal struck out swinging (1-2 FFBS).,17,2025-02-17T00:00:00-05:00,"Baum-Walker Stadium (Fayetteville, AR)",8780,MBA,2025
6300804,596442,Washington St. Cougars,596487,Arkansas Razorbacks,596487,2,bot,Thomas Jr. walked (3-0 BBBB).,18,2025-02-17T00:00:00-05:00,"Baum-Walker Stadium (Fayetteville, AR)",8780,MBA,2025
6300804,596442,Washington St. Cougars,596487,Arkansas Razorbacks,596487,2,bot,"Thomas Jr. out at second c to ss, caught stealing.",19,2025-02-17T00:00:00-05:00,"Baum-Walker Stadium (Fayetteville, AR)",8780,MBA,2025
6300804,596442,Washington St. Cougars,596487,Arkansas Razorbacks,596442,3,top,"Northrop, K grounded out to 3b (1-0 B).",20,2025-02-17T00:00:00-05:00,"Baum-Walker Stadium (Fayetteville, AR)",8780,MBA,2025
6300804,596442,Washington St. Cougars,596487,Arkansas Razorbacks,596442,3,top,"Watterson, C singled to catcher, bunt (0-0).",21,2025-02-17T00:00:00-05:00,"Baum-Walker Stadium (Fayetteville, AR)",8780,MBA,2025
6300804,596442,Washington St. Cougars,596487,Arkansas Razorbacks,596442,3,top,"Watterson, C out at second c to ss, caught stealing.",22,2025-02-17T00:00:00-05:00,"Baum-Walker Stadium (Fayetteville, AR)",8780,MBA,2025
6300804,596442,Washington St. Cougars,596487,Arkansas Razorbacks,596442,3,top,"Hartman, M out at first 1b to 2b to 1b (1-2 FKB).",23,2025-02-17T00:00:00-05:00,"Baum-Walker Stadium (Fayetteville, AR)",8780,MBA,2025
6300804,596442,Washington St. Cougars,596487,Arkansas Razorbacks,596487,3,bot,Davalan fouled out to lf (1-1 BK).,24,2025-02-17T00:00:00-05:00,"Baum-Walker Stadium (Fayetteville, AR)",8780,MBA,2025
6300804,596442,Washington St. Cougars,596487,Arkansas Razorbacks,596487,3,bot,W. Aloy lined out to 2b (0-0).,25,2025-02-17T00:00:00-05:00,"Baum-Walker Stadium (Fayetteville, AR)",8780,MBA,2025
6300804,596442,Washington St. Cougars,596487,Arkansas Razorbacks,596487,3,bot,Peppi hit by pitch (1-2 KSB).,26,2025-02-17T00:00:00-05:00,"Baum-Walker Stadium (Fayetteville, AR)",8780,MBA,2025
6300804,596442,Washington St. Cougars,596487,Arkansas Razorbacks,596487,3,bot,Iredale lined out to rf (2-1 KBB).,27,2025-02-17T00:00:00-05:00,"Baum-Walker Stadium (Fayetteville, AR)",8780,MBA,2025
6300804,596442,Washington St. Cougars,596487,Arkansas Razorbacks,596442,4,top,"Roy, G struck out swinging, out at first c to 1b (2-2 BKFBS).",28,2025-02-17T00:00:00-05:00,"Baum-Walker Stadium (Fayetteville, AR)",8780,MBA,2025
6300804,596442,Washington St. Cougars,596487,Arkansas Razorbacks,596442,4,top,"Johnstone, L struck out looking (2-2 KBFBK).",29,2025-02-17T00:00:00-05:00,"Baum-Walker Stadium (Fayetteville, AR)",8780,MBA,2025
6300804,596442,Washington St. Cougars,596487,Arkansas Razorbacks,596442,4,top,"Longo, R grounded out to 3b (3-2 SKFBFBB).",30,2025-02-17T00:00:00-05:00,"Baum-Walker Stadium (Fayetteville, AR)",8780,MBA,2025
6300804,596442,Washington St. Cougars,596487,Arkansas Razorbacks,596487,4,bot,"Chambers, B to p for Haider, R.",31,2025-02-17T00:00:00-05:00,"Baum-Walker Stadium (Fayetteville, AR)",8780,MBA,2025
6300804,596442,Washington St. Cougars,596487,Arkansas Razorbacks,596487,4,bot,"K. Aloy homered to left field, RBI (0-2 KK).",32,2025-02-17T00:00:00-05:00,"Baum-Walker Stadium (Fayetteville, AR)",8780,MBA,2025
6300804,596442,Washington St. Cougars,596487,Arkansas Razorbacks,596487,4,bot,Helfrick walked (3-2 BBFFBB).,33,2025-02-17T00:00:00-05:00,"Baum-Walker Stadium (Fayetteville, AR)",8780,MBA,2025
6300804,596442,Washington St. Cougars,596487,Arkansas Razorbacks,596487,4,bot,Boles singled to right field (2-2 BKFB); Helfrick advanced to second.,34,2025-02-17T00:00:00-05:00,"Baum-Walker Stadium (Fayetteville, AR)",8780,MBA,2025
6300804,596442,Washington St. Cougars,596487,Arkansas Razorbacks,596487,4,bot,"Kozeal singled to third base, bunt (0-1 S); Boles advanced to second; Helfrick advanced to third, scored on a throwing error by 3b.",35,2025-02-17T00:00:00-05:00,"Baum-Walker Stadium (Fayetteville, AR)",8780,MBA,2025
6300804,596442,Washington St. Cougars,596487,Arkansas Razorbacks,596487,4,bot,Thomas Jr. walked (3-2 KKBFBBFB); Kozeal advanced to second; Boles advanced to third.,36,2025-02-17T00:00:00-05:00,"Baum-Walker Stadium (Fayetteville, AR)",8780,MBA,2025
6300804,596442,Washington St. Cougars,596487,Arkansas Razorbacks,596487,4,bot,"Davalan grounded out to 2b, RBI (1-2 KFB); Thomas Jr. advanced to second; Kozeal advanced to third; Boles scored.",37,2025-02-17T00:00:00-05:00,"Baum-Walker Stadium (Fayetteville, AR)",8780,MBA,2025
6300804,596442,Washington St. Cougars,596487,Arkansas Razorbacks,596487,4,bot,"W. Aloy singled to right field, 2 RBI (2-1 BBF); Thomas Jr. scored; Kozeal scored.",38,2025-02-17T00:00:00-05:00,"Baum-Walker Stadium (Fayetteville, AR)",8780,MBA,2025
6300804,596442,Washington St. Cougars,596487,Arkansas Razorbacks,596487,4,bot,Peppi flied out to rf (0-0).,39,2025-02-17T00:00:00-05:00,"Baum-Walker Stadium (Fayetteville, AR)",8780,MBA,2025
6300804,596442,Washington St. Cougars,596487,Arkansas Razorbacks,596487,4,bot,Iredale reached on a fielder's choice (2-2 KFBBF); W. Aloy out at second ss to 2b.,40,2025-02-17T00:00:00-05:00,"Baum-Walker Stadium (Fayetteville, AR)",8780,MBA,2025
6300804,596442,Washington St. Cougars,596487,Arkansas Razorbacks,596442,5,top,"Skjonsby, R doubled down the rf line (2-0 BB).",41,2025-02-17T00:00:00-05:00,"Baum-Walker Stadium (Fayetteville, AR)",8780,MBA,2025
6300804,596442,Washington St. Cougars,596487,Arkansas Razorbacks,596442,5,top,"Obenour, O struck out swinging (0-2 FFS).",42,2025-02-17T00:00:00-05:00,"Baum-Walker Stadium (Fayetteville, AR)",8780,MBA,2025
6300804,596442,Washington St. Cougars,596487,Arkansas Razorbacks,596442,5,top,"Cresswell, W singled to left field (0-0); Skjonsby, R advanced to third.",43,2025-02-17T00:00:00-05:00,"Baum-Walker Stadium (Fayetteville, AR)",8780,MBA,2025
6300804,596442,Washington St. Cougars,596487,Arkansas Razorbacks,596442,5,top,"Northrop, K grounded out to 3b, bunt, SAC, RBI (0-0); Cresswell, W advanced to second; Skjonsby, R scored.",44,2025-02-17T00:00:00-05:00,"Baum-Walker Stadium (Fayetteville, AR)",8780,MBA,2025
6300804,596442,Washington St. Cougars,596487,Arkansas Razorbacks,596442,5,top,"Watterson, C walked (3-2 BFBFBB).",45,2025-02-17T00:00:00-05:00,"Baum-Walker Stadium (Fayetteville, AR)",8780,MBA,2025
6300804,596442,Washington St. Cougars,596487,Arkansas Razorbacks,596442,5,top,"Hartman, M struck out swinging (2-2 SKFFFFBBFFS).",46,2025-02-17T00:00:00-05:00,"Baum-Walker Stadium (Fayetteville, AR)",8780,MBA,2025
6300804,596442,Washington St. Cougars,596487,Arkansas Razorbacks,596487,5,bot,K. Aloy walked (3-2 BKSBBB).,47,2025-02-17T00:00:00-05:00,"Baum-Walker Stadium (Fayetteville, AR)",8780,MBA,2025
6300804,596442,Washington St. Cougars,596487,Arkansas Razorbacks,596487,5,bot,"Hutzezon, I to p for Chambers, B.",48,2025-02-17T00:00:00-05:00,"Baum-Walker Stadium (Fayetteville, AR)",8780,MBA,2025
6300804,596442,Washington St. Cougars,596487,Arkansas Razorbacks,596487,5,bot,Helfrick doubled down the lf line (1-0 B); K. Aloy advanced to third.,49,2025-02-17T00:00:00-05:00,"Baum-Walker Stadium (Fayetteville, AR)",8780,MBA,2025
6300804,596442,Washington St. Cougars,596487,Arkansas Razorbacks,596487,5,bot,"Boles doubled to center field, 2 RBI (2-1 BBS); Helfrick scored; K. Aloy scored.",50,2025-02-17T00:00:00-05:00,"Baum-Walker Stadium (Fayetteville, AR)",8780,MBA,2025
6300804,596442,Washington St. Cougars,596487,Arkansas Razorbacks,596487,5,bot,"Kozeal reached on a throwing error by 3b, advanced to second on the error (2-2 BFBS); Boles advanced to third on the error.",51,2025-02-17T00:00:00-05:00,"Baum-Walker Stadium (Fayetteville, AR)",8780,MBA,2025
6300804,596442,Washington St. Cougars,596487,Arkansas Razorbacks,596487,5,bot,"Thomas Jr. singled to left field, advanced to second on a throwing error by 3b, RBI (0-1 K); Kozeal advanced to third, scored on the error, unearned; Boles scored.",52,2025-02-17T00:00:00-05:00,"Baum-Walker Stadium (Fayetteville, AR)",8780,MBA,2025
6300804,596442,Washington St. Cougars,596487,Arkansas Razorbacks,596487,5,bot,"Davalan singled to right field, RBI (1-0 B); Thomas Jr. scored.",53,2025-02-17T00:00:00-05:00,"Baum-Walker Stadium (Fayetteville, AR)",8780,MBA,2025
6300804,596442,Washington St. Cougars,596487,Arkansas Razorbacks,596487,5,bot,"Davalan stole second, advanced to third on a wild pitch.",54,2025-02-17T00:00:00-05:00,"Baum-Walker Stadium (Fayetteville, AR)",8780,MBA,2025
6300804,596442,Washington St. Cougars,596487,Arkansas Razorbacks,596487,5,bot,W. Aloy walked (3-2 KBBSBB).,55,2025-02-17T00:00:00-05:00,"Baum-Walker Stadium (Fayetteville, AR)",8780,MBA,2025
6300804,596442,Washington St. Cougars,596487,Arkansas Razorbacks,596487,5,bot,Robinett pinch hit for Peppi.,56,2025-02-17T00:00:00-05:00,"Baum-Walker Stadium (Fayetteville, AR)",8780,MBA,2025
6300804,596442,Washington St. Cougars,596487,Arkansas Razorbacks,596487,5,bot,"Stowe, T to p for Hutzezon, I.",57,2025-02-17T00:00:00-05:00,"Baum-Walker Stadium (Fayetteville, AR)",8780,MBA,2025
6300804,596442,Washington St. Cougars,596487,Arkansas Razorbacks,596487,5,bot,Robinett struck out swinging (2-2 FBBSS).,58,2025-02-17T00:00:00-05:00,"Baum-Walker Stadium (Fayetteville, AR)",8780,MBA,2025
6300804,596442,Washington St. Cougars,596487,Arkansas Razorbacks,596487,5,bot,"Iredale singled to center field, RBI (0-0); W. Aloy advanced to second; Davalan scored.",59,2025-02-17T00:00:00-05:00,"Baum-Walker Stadium (Fayetteville, AR)",8780,MBA,2025
6300804,596442,Washington St. Cougars,596487,Arkansas Razorbacks,596487,5,bot,K. Aloy struck out swinging (3-2 KFBBBS).,60,2025-02-17T00:00:00-05:00,"Baum-Walker Stadium (Fayetteville, AR)",8780,MBA,2025
6300804,596442,Washington St. Cougars,596487,Arkansas Razorbacks,596487,5,bot,Helfrick walked (3-2 BBKKBFB); Iredale advanced to second; W. Aloy advanced to third.,61,2025-02-17T00:00:00-05:00,"Baum-Walker Stadium (Fayetteville, AR)",8780,MBA,2025
6300804,596442,Washington St. Cougars,596487,Arkansas Razorbacks,596487,5,bot,Boles struck out swinging (2-2 BFSBS).,62,2025-02-17T00:00:00-05:00,"Baum-Walker Stadium (Fayetteville, AR)",8780,MBA,2025
6300804,596442,Washington St. Cougars,596487,Arkansas Razorbacks,596442,6,top,Robinett to 1b.,63,2025-02-17T00:00:00-05:00,"Baum-Walker Stadium (Fayetteville, AR)",8780,MBA,2025
6300804,596442,Washington St. Cougars,596487,Arkansas Razorbacks,596442,6,top,Becker to c for Helfrick.,64,2025-02-17T00:00:00-05:00,"Baum-Walker Stadium (Fayetteville, AR)",8780,MBA,2025
6300804,596442,Washington St. Cougars,596487,Arkansas Razorbacks,596442,6,top,Bybee to p for Beidelschies.,65,2025-02-17T00:00:00-05:00,"Baum-Walker Stadium (Fayetteville, AR)",8780,MBA,2025
6300804,596442,Washington St. Cougars,596487,Arkansas Razorbacks,596442,6,top,"Roy, G singled to center field (1-0 B).",66,2025-02-17T00:00:00-05:00,"Baum-Walker Stadium (Fayetteville, AR)",8780,MBA,2025
6300804,596442,Washington St. Cougars,596487,Arkansas Razorbacks,596442,6,top,"Johnstone, L grounded out to 1b unassisted (1-1 BK); Roy, G advanced to second.",67,2025-02-17T00:00:00-05:00,"Baum-Walker Stadium (Fayetteville, AR)",8780,MBA,2025
6300804,596442,Washington St. Cougars,596487,Arkansas Razorbacks,596442,6,top,"Longo, R doubled to left field, RBI (1-2 KKFBF); Roy, G scored.",68,2025-02-17T00:00:00-05:00,"Baum-Walker Stadium (Fayetteville, AR)",8780,MBA,2025
6300804,596442,Washington St. Cougars,596487,Arkansas Razorbacks,596442,6,top,"Skjonsby, R out at first 1b to 2b to p (1-2 FBSF); Longo, R advanced to third.",69,2025-02-17T00:00:00-05:00,"Baum-Walker Stadium (Fayetteville, AR)",8780,MBA,2025
6300804,596442,Washington St. Cougars,596487,Arkansas Razorbacks,596442,6,top,"Obenour, O flied out to cf (0-0).",70,2025-02-17T00:00:00-05:00,"Baum-Walker Stadium (Fayetteville, AR)",8780,MBA,2025
6300804,596442,Washington St. Cougars,596487,Arkansas Razorbacks,596487,6,bot,Kozeal flied out to lf (2-1 BBK).,71,2025-02-17T00:00:00-05:00,"Baum-Walker Stadium (Fayetteville, AR)",8780,MBA,2025
6300804,596442,Washington St. Cougars,596487,Arkansas Razorbacks,596487,6,bot,Thomas Jr. walked (3-1 BBBKB).,72,2025-02-17T00:00:00-05:00,"Baum-Walker Stadium (Fayetteville, AR)",8780,MBA,2025
6300804,596442,Washington St. Cougars,596487,Arkansas Razorbacks,596487,6,bot,Davalan flied out to rf (0-0).,73,2025-02-17T00:00:00-05:00,"Baum-Walker Stadium (Fayetteville, AR)",8780,MBA,2025
6300804,596442,Washington St. Cougars,596487,Arkansas Razorbacks,596487,6,bot,W. Aloy walked (3-0 BBBB); Thomas Jr. advanced to second.,74,2025-02-17T00:00:00-05:00,"Baum-Walker Stadium (Fayetteville, AR)",8780,MBA,2025
6300804,596442,Washington St. Cougars,596487,Arkansas Razorbacks,596487,6,bot,Robinett walked (3-0 BBBB); W. Aloy advanced to second; Thomas Jr. advanced to third.,75,2025-02-17T00:00:00-05:00,"Baum-Walker Stadium (Fayetteville, AR)",8780,MBA,2025
6300804,596442,Washington St. Cougars,596487,Arkansas Razorbacks,596487,6,bot,"Iredale hit by pitch, RBI (2-2 BBKKF); Robinett advanced to second; W. Aloy advanced to third; Thomas Jr. scored.",76,2025-02-17T00:00:00-05:00,"Baum-Walker Stadium (Fayetteville, AR)",8780,MBA,2025
6300804,596442,Washington St. Cougars,596487,Arkansas Razorbacks,596487,6,bot,K. Aloy struck out swinging (0-2 KFS).,77,2025-02-17T00:00:00-05:00,"Baum-Walker Stadium (Fayetteville, AR)",8780,MBA,2025
6300804,596442,Washington St. Cougars,596487,Arkansas Razorbacks,596442,7,top,Gibler to p for Bybee.,78,2025-02-17T00:00:00-05:00,"Baum-Walker Stadium (Fayetteville, AR)",8780,MBA,2025
6300804,596442,Washington St. Cougars,596487,Arkansas Razorbacks,596442,7,top,"Cresswell, W struck out looking (1-2 BFKK).",79,2025-02-17T00:00:00-05:00,"Baum-Walker Stadium (Fayetteville, AR)",8780,MBA,2025
6300804,596442,Washington St. Cougars,596487,Arkansas Razorbacks,596442,7,top,"Myers, G pinch hit for Northrop, K.",80,2025-02-17T00:00:00-05:00,"Baum-Walker Stadium (Fayetteville, AR)",8780,MBA,2025
6300804,596442,Washington St. Cougars,596487,Arkansas Razorbacks,596442,7,top,"Myers, G walked (3-0 BBBB).",81,2025-02-17T00:00:00-05:00,"Baum-Walker Stadium (Fayetteville, AR)",8780,MBA,2025
6300804,596442,Washington St. Cougars,596487,Arkansas Razorbacks,596442,7,top,"Kennel, E pinch hit for Watterson, C.",82,2025-02-17T00:00:00-05:00,"Baum-Walker Stadium (Fayetteville, AR)",8780,MBA,2025
6300804,596442,Washington St. Cougars,596487,Arkansas Razorbacks,596442,7,top,"Kennel, E grounded into double play ss to 2b to 1b (1-1 BK); Myers, G out on the play.",83,2025-02-17T00:00:00-05:00,"Baum-Walker Stadium (Fayetteville, AR)",8780,MBA,2025
