game_id,away_team_id,away_team_name,home_team_id,home_team_name,batting_team,inning,top_bot,event_text,event_num,game_datetime,stadium_name,attendance,sport_id,season
6301662,596698,Stonehill Skyhawks,596705,High Point Panthers,596698,1,top,"Parks,S walked.",1,2025-03-09T00:00:00-05:00,"Williard Stadium (High Point, NC)",110,MBA,2025
6301662,596698,Stonehill Skyhawks,596705,High Point Panthers,596698,1,top,"McGee,S struck out looking.",2,2025-03-09T00:00:00-05:00,"Williard Stadium (High Point, NC)",110,MBA,2025
6301662,596698,Stonehill Skyhawks,596705,High Point Panthers,596698,1,top,"Parks,S out at second p to 1b to ss, caught stealing.",3,2025-03-09T00:00:00-05:00,"Williard Stadium (High Point, NC)",110,MBA,2025
6301662,596698,Stonehill Skyhawks,596705,High Point Panthers,596698,1,top,"Cohall,A grounded out to ss.",4,2025-03-09T00:00:00-05:00,"Williard Stadium (High Point, NC)",110,MBA,2025
6301662,596698,Stonehill Skyhawks,596705,High Point Panthers,596705,1,bot,DURSCHLAG flied out to rf.,5,2025-03-09T00:00:00-05:00,"Williard Stadium (High Point, NC)",110,MBA,2025
6301662,596698,Stonehill Skyhawks,596705,High Point Panthers,596705,1,bot,ECHAZARETTA singled to left field.,6,2025-03-09T00:00:00-05:00,"Williard Stadium (High Point, NC)",110,MBA,2025
6301662,596698,Stonehill Skyhawks,596705,High Point Panthers,596705,1,bot,JOHNSON walked3a ECHAZARETTA advanced to second.,7,2025-03-09T00:00:00-05:00,"Williard Stadium (High Point, NC)",110,MBA,2025
6301662,596698,Stonehill Skyhawks,596705,High Point Panthers,596705,1,bot,SIMPSON struck out swinging.,8,2025-03-09T00:00:00-05:00,"Williard Stadium (High Point, NC)",110,MBA,2025
6301662,596698,Stonehill Skyhawks,596705,High Point Panthers,596705,1,bot,"JOHNSON out at second c to ss, caught stealing.",9,2025-03-09T00:00:00-05:00,"Williard Stadium (High Point, NC)",110,MBA,2025
6301662,596698,Stonehill Skyhawks,596705,High Point Panthers,596698,2,top,"Thorbahn,J struck out swinging.",10,2025-03-09T00:00:00-05:00,"Williard Stadium (High Point, NC)",110,MBA,2025
6301662,596698,Stonehill Skyhawks,596705,High Point Panthers,596698,2,top,"Gaspar,T flied out to rf.",11,2025-03-09T00:00:00-05:00,"Williard Stadium (High Point, NC)",110,MBA,2025
6301662,596698,Stonehill Skyhawks,596705,High Point Panthers,596698,2,top,"Sparr,G grounded out to 3b.",12,2025-03-09T00:00:00-05:00,"Williard Stadium (High Point, NC)",110,MBA,2025
6301662,596698,Stonehill Skyhawks,596705,High Point Panthers,596705,2,bot,HILLER flied out to rf.,13,2025-03-09T00:00:00-05:00,"Williard Stadium (High Point, NC)",110,MBA,2025
6301662,596698,Stonehill Skyhawks,596705,High Point Panthers,596705,2,bot,MELTON walked.,14,2025-03-09T00:00:00-05:00,"Williard Stadium (High Point, NC)",110,MBA,2025
6301662,596698,Stonehill Skyhawks,596705,High Point Panthers,596705,2,bot,MURPHY grounded into double play ss to 2b to 1b3a MELTON out on the play.,15,2025-03-09T00:00:00-05:00,"Williard Stadium (High Point, NC)",110,MBA,2025
6301662,596698,Stonehill Skyhawks,596705,High Point Panthers,596698,3,top,Sengenberger singled up the middle.,16,2025-03-09T00:00:00-05:00,"Williard Stadium (High Point, NC)",110,MBA,2025
6301662,596698,Stonehill Skyhawks,596705,High Point Panthers,596698,3,top,"Newton,W grounded out to p, bunt, SAC3a Sengenberger advanced to second.",17,2025-03-09T00:00:00-05:00,"Williard Stadium (High Point, NC)",110,MBA,2025
6301662,596698,Stonehill Skyhawks,596705,High Point Panthers,596698,3,top,"LeClair,R homered to left field, 2 RBI3a Sengenberger scored.",18,2025-03-09T00:00:00-05:00,"Williard Stadium (High Point, NC)",110,MBA,2025
6301662,596698,Stonehill Skyhawks,596705,High Point Panthers,596698,3,top,"Parks,S struck out swinging, out at first c to 1b.",19,2025-03-09T00:00:00-05:00,"Williard Stadium (High Point, NC)",110,MBA,2025
6301662,596698,Stonehill Skyhawks,596705,High Point Panthers,596698,3,top,"McGee,S struck out swinging.",20,2025-03-09T00:00:00-05:00,"Williard Stadium (High Point, NC)",110,MBA,2025
6301662,596698,Stonehill Skyhawks,596705,High Point Panthers,596705,3,bot,"SMITH, C. doubled down the rf line.",21,2025-03-09T00:00:00-05:00,"Williard Stadium (High Point, NC)",110,MBA,2025
6301662,596698,Stonehill Skyhawks,596705,High Point Panthers,596705,3,bot,McCARTER flied out to rf.,22,2025-03-09T00:00:00-05:00,"Williard Stadium (High Point, NC)",110,MBA,2025
6301662,596698,Stonehill Skyhawks,596705,High Point Panthers,596705,3,bot,"DURSCHLAG flied out to cf3a SMITH, C. advanced to third.",23,2025-03-09T00:00:00-05:00,"Williard Stadium (High Point, NC)",110,MBA,2025
6301662,596698,Stonehill Skyhawks,596705,High Point Panthers,596705,3,bot,ECHAZARETTA flied out to rf.,24,2025-03-09T00:00:00-05:00,"Williard Stadium (High Point, NC)",110,MBA,2025
6301662,596698,Stonehill Skyhawks,596705,High Point Panthers,596698,4,top,"Cohall,A singled up the middle.",25,2025-03-09T00:00:00-05:00,"Williard Stadium (High Point, NC)",110,MBA,2025
6301662,596698,Stonehill Skyhawks,596705,High Point Panthers,596698,4,top,"Thorbahn,J walked3a Cohall,A advanced to second.",26,2025-03-09T00:00:00-05:00,"Williard Stadium (High Point, NC)",110,MBA,2025
6301662,596698,Stonehill Skyhawks,596705,High Point Panthers,596698,4,top,"Gaspar,T singled, bunt3a Thorbahn,J advanced to second3a Cohall,A advanced to third.",27,2025-03-09T00:00:00-05:00,"Williard Stadium (High Point, NC)",110,MBA,2025
6301662,596698,Stonehill Skyhawks,596705,High Point Panthers,596698,4,top,"Sparr,G singled through the left side, advanced to second on the throw, 2 RBI3a Gaspar,T advanced to third3a Thorbahn,J scored3a Cohall,A scored.",28,2025-03-09T00:00:00-05:00,"Williard Stadium (High Point, NC)",110,MBA,2025
6301662,596698,Stonehill Skyhawks,596705,High Point Panthers,596698,4,top,"Sengenberger flied out to cf, SF, RBI3a Sparr,G advanced to third3a Gaspar,T scored.",29,2025-03-09T00:00:00-05:00,"Williard Stadium (High Point, NC)",110,MBA,2025
6301662,596698,Stonehill Skyhawks,596705,High Point Panthers,596698,4,top,"Newton,W doubled down the lf line, RBI3a Sparr,G scored.",30,2025-03-09T00:00:00-05:00,"Williard Stadium (High Point, NC)",110,MBA,2025
6301662,596698,Stonehill Skyhawks,596705,High Point Panthers,596698,4,top,TUTTOILMONDO to p for HITT.,31,2025-03-09T00:00:00-05:00,"Williard Stadium (High Point, NC)",110,MBA,2025
6301662,596698,Stonehill Skyhawks,596705,High Point Panthers,596698,4,top,"LeClair,R singled3a Newton,W advanced to third on a fielding error by ss.",32,2025-03-09T00:00:00-05:00,"Williard Stadium (High Point, NC)",110,MBA,2025
6301662,596698,Stonehill Skyhawks,596705,High Point Panthers,596698,4,top,"LeClair,R stole second.",33,2025-03-09T00:00:00-05:00,"Williard Stadium (High Point, NC)",110,MBA,2025
6301662,596698,Stonehill Skyhawks,596705,High Point Panthers,596698,4,top,"Parks,S fouled out to 3b.",34,2025-03-09T00:00:00-05:00,"Williard Stadium (High Point, NC)",110,MBA,2025
6301662,596698,Stonehill Skyhawks,596705,High Point Panthers,596698,4,top,"McGee,S struck out swinging, grounded out to c unassisted.",35,2025-03-09T00:00:00-05:00,"Williard Stadium (High Point, NC)",110,MBA,2025
6301662,596698,Stonehill Skyhawks,596705,High Point Panthers,596705,4,bot,JOHNSON fouled out to 3b.,36,2025-03-09T00:00:00-05:00,"Williard Stadium (High Point, NC)",110,MBA,2025
6301662,596698,Stonehill Skyhawks,596705,High Point Panthers,596705,4,bot,SIMPSON singled through the left side.,37,2025-03-09T00:00:00-05:00,"Williard Stadium (High Point, NC)",110,MBA,2025
6301662,596698,Stonehill Skyhawks,596705,High Point Panthers,596705,4,bot,HILLER walked3a SIMPSON advanced to second.,38,2025-03-09T00:00:00-05:00,"Williard Stadium (High Point, NC)",110,MBA,2025
6301662,596698,Stonehill Skyhawks,596705,High Point Panthers,596705,4,bot,MELTON popped up to 2b.,39,2025-03-09T00:00:00-05:00,"Williard Stadium (High Point, NC)",110,MBA,2025
6301662,596698,Stonehill Skyhawks,596705,High Point Panthers,596705,4,bot,MURPHY reached on a fielder's choice3a HILLER out at second ss to 2b.,40,2025-03-09T00:00:00-05:00,"Williard Stadium (High Point, NC)",110,MBA,2025
6301662,596698,Stonehill Skyhawks,596705,High Point Panthers,596698,5,top,"Cohall,A grounded out to 2b.",41,2025-03-09T00:00:00-05:00,"Williard Stadium (High Point, NC)",110,MBA,2025
6301662,596698,Stonehill Skyhawks,596705,High Point Panthers,596698,5,top,"Thorbahn,J struck out swinging.",42,2025-03-09T00:00:00-05:00,"Williard Stadium (High Point, NC)",110,MBA,2025
6301662,596698,Stonehill Skyhawks,596705,High Point Panthers,596698,5,top,"Gaspar,T struck out swinging.",43,2025-03-09T00:00:00-05:00,"Williard Stadium (High Point, NC)",110,MBA,2025
6301662,596698,Stonehill Skyhawks,596705,High Point Panthers,596705,5,bot,"SMITH, C. walked.",44,2025-03-09T00:00:00-05:00,"Williard Stadium (High Point, NC)",110,MBA,2025
6301662,596698,Stonehill Skyhawks,596705,High Point Panthers,596705,5,bot,"McCARTER homered to center field, 2 RBI3a SMITH, C. scored.",45,2025-03-09T00:00:00-05:00,"Williard Stadium (High Point, NC)",110,MBA,2025
6301662,596698,Stonehill Skyhawks,596705,High Point Panthers,596705,5,bot,DURSCHLAG walked.,46,2025-03-09T00:00:00-05:00,"Williard Stadium (High Point, NC)",110,MBA,2025
6301662,596698,Stonehill Skyhawks,596705,High Point Panthers,596705,5,bot,ECHAZARETTA struck out swinging.,47,2025-03-09T00:00:00-05:00,"Williard Stadium (High Point, NC)",110,MBA,2025
6301662,596698,Stonehill Skyhawks,596705,High Point Panthers,596705,5,bot,JOHNSON doubled down the rf line3a DURSCHLAG advanced to third.,48,2025-03-09T00:00:00-05:00,"Williard Stadium (High Point, NC)",110,MBA,2025
6301662,596698,Stonehill Skyhawks,596705,High Point Panthers,596705,5,bot,"Martin,A to p for Gilleran,J.",49,2025-03-09T00:00:00-05:00,"Williard Stadium (High Point, NC)",110,MBA,2025
6301662,596698,Stonehill Skyhawks,596705,High Point Panthers,596705,5,bot,SIMPSON reached on a fielder's choice3a DURSCHLAG out at home 3b to c.,50,2025-03-09T00:00:00-05:00,"Williard Stadium (High Point, NC)",110,MBA,2025
6301662,596698,Stonehill Skyhawks,596705,High Point Panthers,596705,5,bot,HILLER grounded out to 2b.,51,2025-03-09T00:00:00-05:00,"Williard Stadium (High Point, NC)",110,MBA,2025
6301662,596698,Stonehill Skyhawks,596705,High Point Panthers,596698,6,top,"Sparr,G struck out looking.",52,2025-03-09T00:00:00-05:00,"Williard Stadium (High Point, NC)",110,MBA,2025
6301662,596698,Stonehill Skyhawks,596705,High Point Panthers,596698,6,top,Sengenberger struck out swinging.,53,2025-03-09T00:00:00-05:00,"Williard Stadium (High Point, NC)",110,MBA,2025
6301662,596698,Stonehill Skyhawks,596705,High Point Panthers,596698,6,top,"Newton,W grounded out to 3b.",54,2025-03-09T00:00:00-05:00,"Williard Stadium (High Point, NC)",110,MBA,2025
6301662,596698,Stonehill Skyhawks,596705,High Point Panthers,596705,6,bot,MELTON doubled down the rf line.,55,2025-03-09T00:00:00-05:00,"Williard Stadium (High Point, NC)",110,MBA,2025
6301662,596698,Stonehill Skyhawks,596705,High Point Panthers,596705,6,bot,MURPHY struck out looking.,56,2025-03-09T00:00:00-05:00,"Williard Stadium (High Point, NC)",110,MBA,2025
6301662,596698,Stonehill Skyhawks,596705,High Point Panthers,596705,6,bot,"SMITH, C. struck out swinging.",57,2025-03-09T00:00:00-05:00,"Williard Stadium (High Point, NC)",110,MBA,2025
6301662,596698,Stonehill Skyhawks,596705,High Point Panthers,596705,6,bot,McCARTER lined out to 3b.,58,2025-03-09T00:00:00-05:00,"Williard Stadium (High Point, NC)",110,MBA,2025
6301662,596698,Stonehill Skyhawks,596705,High Point Panthers,596698,7,top,GRINTZ to p for TUTTOILMONDO.,59,2025-03-09T00:00:00-05:00,"Williard Stadium (High Point, NC)",110,MBA,2025
6301662,596698,Stonehill Skyhawks,596705,High Point Panthers,596698,7,top,"LeClair,R singled up the middle.",60,2025-03-09T00:00:00-05:00,"Williard Stadium (High Point, NC)",110,MBA,2025
6301662,596698,Stonehill Skyhawks,596705,High Point Panthers,596698,7,top,"Parks,S grounded out to p, SAC, bunt3a LeClair,R advanced to second.",61,2025-03-09T00:00:00-05:00,"Williard Stadium (High Point, NC)",110,MBA,2025
6301662,596698,Stonehill Skyhawks,596705,High Point Panthers,596698,7,top,"McGee,S struck out swinging.",62,2025-03-09T00:00:00-05:00,"Williard Stadium (High Point, NC)",110,MBA,2025
6301662,596698,Stonehill Skyhawks,596705,High Point Panthers,596698,7,top,"Cohall,A grounded out to 3b.",63,2025-03-09T00:00:00-05:00,"Williard Stadium (High Point, NC)",110,MBA,2025
6301662,596698,Stonehill Skyhawks,596705,High Point Panthers,596705,7,bot,DURSCHLAG lined out to cf.,64,2025-03-09T00:00:00-05:00,"Williard Stadium (High Point, NC)",110,MBA,2025
6301662,596698,Stonehill Skyhawks,596705,High Point Panthers,596705,7,bot,ECHAZARETTA walked.,65,2025-03-09T00:00:00-05:00,"Williard Stadium (High Point, NC)",110,MBA,2025
6301662,596698,Stonehill Skyhawks,596705,High Point Panthers,596705,7,bot,JOHNSON walked3a ECHAZARETTA advanced to second.,66,2025-03-09T00:00:00-05:00,"Williard Stadium (High Point, NC)",110,MBA,2025
6301662,596698,Stonehill Skyhawks,596705,High Point Panthers,596705,7,bot,"SIMPSON homered to center field, 3 RBI3a JOHNSON scored3a ECHAZARETTA scored.",67,2025-03-09T00:00:00-05:00,"Williard Stadium (High Point, NC)",110,MBA,2025
6301662,596698,Stonehill Skyhawks,596705,High Point Panthers,596705,7,bot,HILLER reached on a fielding error by 2b.,68,2025-03-09T00:00:00-05:00,"Williard Stadium (High Point, NC)",110,MBA,2025
6301662,596698,Stonehill Skyhawks,596705,High Point Panthers,596705,7,bot,MELTON singled to left field3a HILLER advanced to second.,69,2025-03-09T00:00:00-05:00,"Williard Stadium (High Point, NC)",110,MBA,2025
6301662,596698,Stonehill Skyhawks,596705,High Point Panthers,596705,7,bot,"Arzuaga,G to p for Martin,A.",70,2025-03-09T00:00:00-05:00,"Williard Stadium (High Point, NC)",110,MBA,2025
6301662,596698,Stonehill Skyhawks,596705,High Point Panthers,596705,7,bot,MURPHY walked3a MELTON advanced to second3a HILLER advanced to third.,71,2025-03-09T00:00:00-05:00,"Williard Stadium (High Point, NC)",110,MBA,2025
6301662,596698,Stonehill Skyhawks,596705,High Point Panthers,596705,7,bot,"SMITH, C. walked, RBI3a MURPHY advanced to second3a MELTON advanced to third3a HILLER scored, unearned.",72,2025-03-09T00:00:00-05:00,"Williard Stadium (High Point, NC)",110,MBA,2025
6301662,596698,Stonehill Skyhawks,596705,High Point Panthers,596705,7,bot,CLARK pinch hit for McCARTER.,73,2025-03-09T00:00:00-05:00,"Williard Stadium (High Point, NC)",110,MBA,2025
6301662,596698,Stonehill Skyhawks,596705,High Point Panthers,596705,7,bot,"CLARK hit by pitch, RBI3a SMITH, C. advanced to second3a MURPHY advanced to third3a MELTON scored.",74,2025-03-09T00:00:00-05:00,"Williard Stadium (High Point, NC)",110,MBA,2025
6301662,596698,Stonehill Skyhawks,596705,High Point Panthers,596705,7,bot,"Welsch,J to p for Arzuaga,G.",75,2025-03-09T00:00:00-05:00,"Williard Stadium (High Point, NC)",110,MBA,2025
6301662,596698,Stonehill Skyhawks,596705,High Point Panthers,596705,7,bot,"DURSCHLAG singled to left field, 2 RBI3a CLARK advanced to second3a SMITH, C. scored3a MURPHY scored.",76,2025-03-09T00:00:00-05:00,"Williard Stadium (High Point, NC)",110,MBA,2025
6301662,596698,Stonehill Skyhawks,596705,High Point Panthers,596705,7,bot,ECHAZARETTA lined into double play 2b to ss3a DURSCHLAG out on the play.,77,2025-03-09T00:00:00-05:00,"Williard Stadium (High Point, NC)",110,MBA,2025
6301662,596698,Stonehill Skyhawks,596705,High Point Panthers,596698,8,top,"Thorbahn,J singled to right center.",78,2025-03-09T00:00:00-05:00,"Williard Stadium (High Point, NC)",110,MBA,2025
6301662,596698,Stonehill Skyhawks,596705,High Point Panthers,596698,8,top,"Gaspar,T grounded into double play ss to 2b to 1b3a Thorbahn,J out on the play.",79,2025-03-09T00:00:00-05:00,"Williard Stadium (High Point, NC)",110,MBA,2025
6301662,596698,Stonehill Skyhawks,596705,High Point Panthers,596698,8,top,"Sparr,G struck out swinging.",80,2025-03-09T00:00:00-05:00,"Williard Stadium (High Point, NC)",110,MBA,2025
6301662,596698,Stonehill Skyhawks,596705,High Point Panthers,596705,8,bot,JOHNSON walked.,81,2025-03-09T00:00:00-05:00,"Williard Stadium (High Point, NC)",110,MBA,2025
6301662,596698,Stonehill Skyhawks,596705,High Point Panthers,596705,8,bot,SIMPSON walked3a JOHNSON advanced to second.,82,2025-03-09T00:00:00-05:00,"Williard Stadium (High Point, NC)",110,MBA,2025
6301662,596698,Stonehill Skyhawks,596705,High Point Panthers,596705,8,bot,HILLER grounded out to p3a SIMPSON advanced to second3a JOHNSON advanced to third.,83,2025-03-09T00:00:00-05:00,"Williard Stadium (High Point, NC)",110,MBA,2025
6301662,596698,Stonehill Skyhawks,596705,High Point Panthers,596705,8,bot,"MELTON singled through the right side, 2 RBI3a SIMPSON scored3a JOHNSON scored.",84,2025-03-09T00:00:00-05:00,"Williard Stadium (High Point, NC)",110,MBA,2025
6301662,596698,Stonehill Skyhawks,596705,High Point Panthers,596705,8,bot,MURPHY singled through the left side3a MELTON advanced to second.,85,2025-03-09T00:00:00-05:00,"Williard Stadium (High Point, NC)",110,MBA,2025
6301662,596698,Stonehill Skyhawks,596705,High Point Panthers,596705,8,bot,"MURPHY stole second3a MELTON out at third c to 3b, caught stealing.",86,2025-03-09T00:00:00-05:00,"Williard Stadium (High Point, NC)",110,MBA,2025
6301662,596698,Stonehill Skyhawks,596705,High Point Panthers,596705,8,bot,"SMITH, C. struck out swinging.",87,2025-03-09T00:00:00-05:00,"Williard Stadium (High Point, NC)",110,MBA,2025
6301662,596698,Stonehill Skyhawks,596705,High Point Panthers,596698,9,top,Sengenberger flied out to rf.,88,2025-03-09T00:00:00-05:00,"Williard Stadium (High Point, NC)",110,MBA,2025
6301662,596698,Stonehill Skyhawks,596705,High Point Panthers,596698,9,top,"Newton,W out at first 1b to p.",89,2025-03-09T00:00:00-05:00,"Williard Stadium (High Point, NC)",110,MBA,2025
6301662,596698,Stonehill Skyhawks,596705,High Point Panthers,596698,9,top,"LeClair,R grounded out to ss.",90,2025-03-09T00:00:00-05:00,"Williard Stadium (High Point, NC)",110,MBA,2025
