game_id,away_team_id,away_team_name,home_team_id,home_team_name,batting_team,inning,top_bot,event_text,event_num,game_datetime,stadium_name,attendance,sport_id,season
6302147,596660,Rutgers Scarlet Knights,596644,Oregon Ducks,596660,1,top,No play.,1,2025-03-21T00:00:00-04:00,"PK Park (Eugene, OR)",1675,MBA,2025
6302147,596660,Rutgers Scarlet Knights,596644,Oregon Ducks,596660,1,top,T. Cohen doubled through the right side (1-0 B).,2,2025-03-21T00:00:00-04:00,"PK Park (Eugene, OR)",1675,MBA,2025
6302147,596660,Rutgers Scarlet Knights,596644,Oregon Ducks,596660,1,top,P. Bonds struck out looking (1-2 FBKFK).,3,2025-03-21T00:00:00-04:00,"PK Park (Eugene, OR)",1675,MBA,2025
6302147,596660,Rutgers Scarlet Knights,596644,Oregon Ducks,596660,1,top,T. Doucette flied out to cf to right center (0-0).,4,2025-03-21T00:00:00-04:00,"PK Park (Eugene, OR)",1675,MBA,2025
6302147,596660,Rutgers Scarlet Knights,596644,Oregon Ducks,596660,1,top,J. Sweeney struck out swinging (2-2 BSFBFS).,5,2025-03-21T00:00:00-04:00,"PK Park (Eugene, OR)",1675,MBA,2025
6302147,596660,Rutgers Scarlet Knights,596644,Oregon Ducks,596644,1,bot,"Neville, M flied out to cf (0-0).",6,2025-03-21T00:00:00-04:00,"PK Park (Eugene, OR)",1675,MBA,2025
6302147,596660,Rutgers Scarlet Knights,596644,Oregon Ducks,596644,1,bot,"Meggers, C singled to left field (2-2 BBKF).",7,2025-03-21T00:00:00-04:00,"PK Park (Eugene, OR)",1675,MBA,2025
6302147,596660,Rutgers Scarlet Knights,596644,Oregon Ducks,596644,1,bot,"Aroz, A flied out to lf (2-2 BKBF).",8,2025-03-21T00:00:00-04:00,"PK Park (Eugene, OR)",1675,MBA,2025
6302147,596660,Rutgers Scarlet Knights,596644,Oregon Ducks,596644,1,bot,"Walsh, J popped up to ss (1-0 B).",9,2025-03-21T00:00:00-04:00,"PK Park (Eugene, OR)",1675,MBA,2025
6302147,596660,Rutgers Scarlet Knights,596644,Oregon Ducks,596660,2,top,RJ Johnson struck out swinging (1-2 BSSS).,10,2025-03-21T00:00:00-04:00,"PK Park (Eugene, OR)",1675,MBA,2025
6302147,596660,Rutgers Scarlet Knights,596644,Oregon Ducks,596660,2,top,P. Santos grounded out to ss (3-2 BFBBK).,11,2025-03-21T00:00:00-04:00,"PK Park (Eugene, OR)",1675,MBA,2025
6302147,596660,Rutgers Scarlet Knights,596644,Oregon Ducks,596660,2,top,JT Thompson grounded out to 2b (0-1 F).,12,2025-03-21T00:00:00-04:00,"PK Park (Eugene, OR)",1675,MBA,2025
6302147,596660,Rutgers Scarlet Knights,596644,Oregon Ducks,596644,2,bot,"Heard, J grounded out to 2b (3-2 KKBBFB).",13,2025-03-21T00:00:00-04:00,"PK Park (Eugene, OR)",1675,MBA,2025
6302147,596660,Rutgers Scarlet Knights,596644,Oregon Ducks,596644,2,bot,"Molony, M singled to left field (1-1 BS).",14,2025-03-21T00:00:00-04:00,"PK Park (Eugene, OR)",1675,MBA,2025
6302147,596660,Rutgers Scarlet Knights,596644,Oregon Ducks,596644,2,bot,"Mabeus, B grounded into double play 2b to ss to 1b (0-0)3a Molony, M out on the play.",15,2025-03-21T00:00:00-04:00,"PK Park (Eugene, OR)",1675,MBA,2025
6302147,596660,Rutgers Scarlet Knights,596644,Oregon Ducks,596660,3,top,JD Jones struck out looking (2-2 KBFBK).,16,2025-03-21T00:00:00-04:00,"PK Park (Eugene, OR)",1675,MBA,2025
6302147,596660,Rutgers Scarlet Knights,596644,Oregon Ducks,596660,3,top,Y. Carreras singled to right center (0-0).,17,2025-03-21T00:00:00-04:00,"PK Park (Eugene, OR)",1675,MBA,2025
6302147,596660,Rutgers Scarlet Knights,596644,Oregon Ducks,596660,3,top,T. Cohen singled through the left side (3-1 BBKB)3a Y. Carreras advanced to second.,18,2025-03-21T00:00:00-04:00,"PK Park (Eugene, OR)",1675,MBA,2025
6302147,596660,Rutgers Scarlet Knights,596644,Oregon Ducks,596660,3,top,"P. Bonds singled to center field, RBI (0-1 F)3a T. Cohen advanced to second3a Y. Carreras scored.",19,2025-03-21T00:00:00-04:00,"PK Park (Eugene, OR)",1675,MBA,2025
6302147,596660,Rutgers Scarlet Knights,596644,Oregon Ducks,596660,3,top,"T. Doucette doubled to right field, RBI (0-1 F)3a P. Bonds advanced to third3a T. Cohen scored.",20,2025-03-21T00:00:00-04:00,"PK Park (Eugene, OR)",1675,MBA,2025
6302147,596660,Rutgers Scarlet Knights,596644,Oregon Ducks,596660,3,top,J. Sweeney reached on a fielder's choice (0-1 K)3a P. Bonds out at home 3b to c.,21,2025-03-21T00:00:00-04:00,"PK Park (Eugene, OR)",1675,MBA,2025
6302147,596660,Rutgers Scarlet Knights,596644,Oregon Ducks,596660,3,top,RJ Johnson struck out swinging (2-2 BKFBS).,22,2025-03-21T00:00:00-04:00,"PK Park (Eugene, OR)",1675,MBA,2025
6302147,596660,Rutgers Scarlet Knights,596644,Oregon Ducks,596644,3,bot,"Cooney, R flied out to cf (1-1 KB).",23,2025-03-21T00:00:00-04:00,"PK Park (Eugene, OR)",1675,MBA,2025
6302147,596660,Rutgers Scarlet Knights,596644,Oregon Ducks,596644,3,bot,"Garate, C struck out swinging (1-2 KFBS).",24,2025-03-21T00:00:00-04:00,"PK Park (Eugene, OR)",1675,MBA,2025
6302147,596660,Rutgers Scarlet Knights,596644,Oregon Ducks,596644,3,bot,"Neville, M homered to left field, RBI (2-0 BB).",25,2025-03-21T00:00:00-04:00,"PK Park (Eugene, OR)",1675,MBA,2025
6302147,596660,Rutgers Scarlet Knights,596644,Oregon Ducks,596644,3,bot,"Meggers, C grounded out to 3b (2-2 BFFFFBF).",26,2025-03-21T00:00:00-04:00,"PK Park (Eugene, OR)",1675,MBA,2025
6302147,596660,Rutgers Scarlet Knights,596644,Oregon Ducks,596660,4,top,P. Santos grounded out to 3b (1-0 B).,27,2025-03-21T00:00:00-04:00,"PK Park (Eugene, OR)",1675,MBA,2025
6302147,596660,Rutgers Scarlet Knights,596644,Oregon Ducks,596660,4,top,JT Thompson walked (3-2 KBFBBB).,28,2025-03-21T00:00:00-04:00,"PK Park (Eugene, OR)",1675,MBA,2025
6302147,596660,Rutgers Scarlet Knights,596644,Oregon Ducks,596660,4,top,"JT Thompson out at second p to 1b to 2b, caught stealing, picked off.",29,2025-03-21T00:00:00-04:00,"PK Park (Eugene, OR)",1675,MBA,2025
6302147,596660,Rutgers Scarlet Knights,596644,Oregon Ducks,596660,4,top,JD Jones lined out to ss (3-2 BFBSBFF).,30,2025-03-21T00:00:00-04:00,"PK Park (Eugene, OR)",1675,MBA,2025
6302147,596660,Rutgers Scarlet Knights,596644,Oregon Ducks,596644,4,bot,"Aroz, A grounded out to 1b unassisted (3-2 BFBBKF).",31,2025-03-21T00:00:00-04:00,"PK Park (Eugene, OR)",1675,MBA,2025
6302147,596660,Rutgers Scarlet Knights,596644,Oregon Ducks,596644,4,bot,"Walsh, J walked (3-2 KBBBFB).",32,2025-03-21T00:00:00-04:00,"PK Park (Eugene, OR)",1675,MBA,2025
6302147,596660,Rutgers Scarlet Knights,596644,Oregon Ducks,596644,4,bot,"Heard, J flied out to lf (3-1 BFBB).",33,2025-03-21T00:00:00-04:00,"PK Park (Eugene, OR)",1675,MBA,2025
6302147,596660,Rutgers Scarlet Knights,596644,Oregon Ducks,596644,4,bot,"Molony, M struck out swinging (2-2 KSFFFBFBS).",34,2025-03-21T00:00:00-04:00,"PK Park (Eugene, OR)",1675,MBA,2025
6302147,596660,Rutgers Scarlet Knights,596644,Oregon Ducks,596660,5,top,Y. Carreras doubled down the rf line (0-2 KFFF).,35,2025-03-21T00:00:00-04:00,"PK Park (Eugene, OR)",1675,MBA,2025
6302147,596660,Rutgers Scarlet Knights,596644,Oregon Ducks,596660,5,top,T. Cohen struck out swinging (1-2 KBKFS).,36,2025-03-21T00:00:00-04:00,"PK Park (Eugene, OR)",1675,MBA,2025
6302147,596660,Rutgers Scarlet Knights,596644,Oregon Ducks,596660,5,top,P. Bonds struck out swinging (0-2 FSS).,37,2025-03-21T00:00:00-04:00,"PK Park (Eugene, OR)",1675,MBA,2025
6302147,596660,Rutgers Scarlet Knights,596644,Oregon Ducks,596660,5,top,T. Doucette flied out to lf (0-0).,38,2025-03-21T00:00:00-04:00,"PK Park (Eugene, OR)",1675,MBA,2025
6302147,596660,Rutgers Scarlet Knights,596644,Oregon Ducks,596644,5,bot,"Mabeus, B singled up the middle (2-1 BBK).",39,2025-03-21T00:00:00-04:00,"PK Park (Eugene, OR)",1675,MBA,2025
6302147,596660,Rutgers Scarlet Knights,596644,Oregon Ducks,596644,5,bot,"Mabeus, B out at second c to ss, caught stealing.",40,2025-03-21T00:00:00-04:00,"PK Park (Eugene, OR)",1675,MBA,2025
6302147,596660,Rutgers Scarlet Knights,596644,Oregon Ducks,596644,5,bot,"Cooney, R flied out to lf (2-1 KBB).",41,2025-03-21T00:00:00-04:00,"PK Park (Eugene, OR)",1675,MBA,2025
6302147,596660,Rutgers Scarlet Knights,596644,Oregon Ducks,596644,5,bot,"Garate, C grounded out to ss (1-1 BK).",42,2025-03-21T00:00:00-04:00,"PK Park (Eugene, OR)",1675,MBA,2025
6302147,596660,Rutgers Scarlet Knights,596644,Oregon Ducks,596660,6,top,J. Sweeney struck out swinging (2-2 SBBKFS).,43,2025-03-21T00:00:00-04:00,"PK Park (Eugene, OR)",1675,MBA,2025
6302147,596660,Rutgers Scarlet Knights,596644,Oregon Ducks,596660,6,top,RJ Johnson singled to center field (1-0 B).,44,2025-03-21T00:00:00-04:00,"PK Park (Eugene, OR)",1675,MBA,2025
6302147,596660,Rutgers Scarlet Knights,596644,Oregon Ducks,596660,6,top,P. Santos grounded into double play ss to 2b to 1b (1-0 B)3a RJ Johnson out on the play.,45,2025-03-21T00:00:00-04:00,"PK Park (Eugene, OR)",1675,MBA,2025
6302147,596660,Rutgers Scarlet Knights,596644,Oregon Ducks,596644,6,bot,J. Mazza to p for J. Shadek.,46,2025-03-21T00:00:00-04:00,"PK Park (Eugene, OR)",1675,MBA,2025
6302147,596660,Rutgers Scarlet Knights,596644,Oregon Ducks,596644,6,bot,"Neville, M struck out swinging (1-2 KKBS).",47,2025-03-21T00:00:00-04:00,"PK Park (Eugene, OR)",1675,MBA,2025
6302147,596660,Rutgers Scarlet Knights,596644,Oregon Ducks,596644,6,bot,"Meggers, C singled up the middle (0-0).",48,2025-03-21T00:00:00-04:00,"PK Park (Eugene, OR)",1675,MBA,2025
6302147,596660,Rutgers Scarlet Knights,596644,Oregon Ducks,596644,6,bot,"Aroz, A doubled down the lf line (2-2 BFFFB)3a Meggers, C advanced to third.",49,2025-03-21T00:00:00-04:00,"PK Park (Eugene, OR)",1675,MBA,2025
6302147,596660,Rutgers Scarlet Knights,596644,Oregon Ducks,596644,6,bot,"Walsh, J singled through the left side, 2 RBI, advanced to second on the throw (0-2 KF)3a Aroz, A scored3a Meggers, C scored.",50,2025-03-21T00:00:00-04:00,"PK Park (Eugene, OR)",1675,MBA,2025
6302147,596660,Rutgers Scarlet Knights,596644,Oregon Ducks,596644,6,bot,"Heard, J struck out swinging (3-2 BBBKKS).",51,2025-03-21T00:00:00-04:00,"PK Park (Eugene, OR)",1675,MBA,2025
6302147,596660,Rutgers Scarlet Knights,596644,Oregon Ducks,596644,6,bot,"Molony, M popped up to 1b (0-0).",52,2025-03-21T00:00:00-04:00,"PK Park (Eugene, OR)",1675,MBA,2025
6302147,596660,Rutgers Scarlet Knights,596644,Oregon Ducks,596660,7,top,"Brooks, J to rf for Heard, J.",53,2025-03-21T00:00:00-04:00,"PK Park (Eugene, OR)",1675,MBA,2025
6302147,596660,Rutgers Scarlet Knights,596644,Oregon Ducks,596660,7,top,JT Thompson grounded out to ss (2-1 FBB).,54,2025-03-21T00:00:00-04:00,"PK Park (Eugene, OR)",1675,MBA,2025
6302147,596660,Rutgers Scarlet Knights,596644,Oregon Ducks,596660,7,top,JD Jones walked (3-1 BBKBB).,55,2025-03-21T00:00:00-04:00,"PK Park (Eugene, OR)",1675,MBA,2025
6302147,596660,Rutgers Scarlet Knights,596644,Oregon Ducks,596660,7,top,Y. Carreras reached on a dropped fly by rf (0-1 K)3a JD Jones advanced to second.,56,2025-03-21T00:00:00-04:00,"PK Park (Eugene, OR)",1675,MBA,2025
6302147,596660,Rutgers Scarlet Knights,596644,Oregon Ducks,596660,7,top,"Garcia, S to p for Grinsell, G.",57,2025-03-21T00:00:00-04:00,"PK Park (Eugene, OR)",1675,MBA,2025
6302147,596660,Rutgers Scarlet Knights,596644,Oregon Ducks,596660,7,top,Y. Carreras advanced to second on a wild pitch3a JD Jones advanced to third on a wild pitch.,58,2025-03-21T00:00:00-04:00,"PK Park (Eugene, OR)",1675,MBA,2025
6302147,596660,Rutgers Scarlet Knights,596644,Oregon Ducks,596660,7,top,T. Cohen walked (3-2 SKBBFBB).,59,2025-03-21T00:00:00-04:00,"PK Park (Eugene, OR)",1675,MBA,2025
6302147,596660,Rutgers Scarlet Knights,596644,Oregon Ducks,596660,7,top,"T. Cohen advanced to second on a wild pitch3a Y. Carreras advanced to third on a wild pitch3a JD Jones scored on a wild pitch, unearned.",60,2025-03-21T00:00:00-04:00,"PK Park (Eugene, OR)",1675,MBA,2025
6302147,596660,Rutgers Scarlet Knights,596644,Oregon Ducks,596660,7,top,P. Bonds struck out swinging (2-2 BFFBS).,61,2025-03-21T00:00:00-04:00,"PK Park (Eugene, OR)",1675,MBA,2025
6302147,596660,Rutgers Scarlet Knights,596644,Oregon Ducks,596660,7,top,T. Doucette fouled out to ss (2-2 SFBB).,62,2025-03-21T00:00:00-04:00,"PK Park (Eugene, OR)",1675,MBA,2025
6302147,596660,Rutgers Scarlet Knights,596644,Oregon Ducks,596644,7,bot,"Mabeus, B struck out swinging (2-2 BSSBS).",63,2025-03-21T00:00:00-04:00,"PK Park (Eugene, OR)",1675,MBA,2025
6302147,596660,Rutgers Scarlet Knights,596644,Oregon Ducks,596644,7,bot,"Cooney, R grounded out to 2b (1-0 B).",64,2025-03-21T00:00:00-04:00,"PK Park (Eugene, OR)",1675,MBA,2025
6302147,596660,Rutgers Scarlet Knights,596644,Oregon Ducks,596644,7,bot,"Garate, C grounded out to 2b (1-2 FFBF).",65,2025-03-21T00:00:00-04:00,"PK Park (Eugene, OR)",1675,MBA,2025
6302147,596660,Rutgers Scarlet Knights,596644,Oregon Ducks,596660,8,top,B. Hyde pinch hit for J. Sweeney.,66,2025-03-21T00:00:00-04:00,"PK Park (Eugene, OR)",1675,MBA,2025
6302147,596660,Rutgers Scarlet Knights,596644,Oregon Ducks,596660,8,top,B. Hyde flied out to cf (1-0 B).,67,2025-03-21T00:00:00-04:00,"PK Park (Eugene, OR)",1675,MBA,2025
6302147,596660,Rutgers Scarlet Knights,596644,Oregon Ducks,596660,8,top,RJ Johnson flied out to cf (3-1 BKBB).,68,2025-03-21T00:00:00-04:00,"PK Park (Eugene, OR)",1675,MBA,2025
6302147,596660,Rutgers Scarlet Knights,596644,Oregon Ducks,596660,8,top,P. Santos struck out looking (2-2 BBKFK).,69,2025-03-21T00:00:00-04:00,"PK Park (Eugene, OR)",1675,MBA,2025
6302147,596660,Rutgers Scarlet Knights,596644,Oregon Ducks,596644,8,bot,"Neville, M grounded out to 1b unassisted (0-0).",70,2025-03-21T00:00:00-04:00,"PK Park (Eugene, OR)",1675,MBA,2025
6302147,596660,Rutgers Scarlet Knights,596644,Oregon Ducks,596644,8,bot,"Meggers, C singled to right center (1-1 FB).",71,2025-03-21T00:00:00-04:00,"PK Park (Eugene, OR)",1675,MBA,2025
6302147,596660,Rutgers Scarlet Knights,596644,Oregon Ducks,596644,8,bot,"Gimenez, J pinch ran for Meggers, C.",72,2025-03-21T00:00:00-04:00,"PK Park (Eugene, OR)",1675,MBA,2025
6302147,596660,Rutgers Scarlet Knights,596644,Oregon Ducks,596644,8,bot,"Aroz, A fouled out to 1b (0-0).",73,2025-03-21T00:00:00-04:00,"PK Park (Eugene, OR)",1675,MBA,2025
6302147,596660,Rutgers Scarlet Knights,596644,Oregon Ducks,596644,8,bot,"Gimenez, J out at second p to 1b to ss, caught stealing, picked off.",74,2025-03-21T00:00:00-04:00,"PK Park (Eugene, OR)",1675,MBA,2025
6302147,596660,Rutgers Scarlet Knights,596644,Oregon Ducks,596660,9,top,"Gimenez, J to rf.",75,2025-03-21T00:00:00-04:00,"PK Park (Eugene, OR)",1675,MBA,2025
6302147,596660,Rutgers Scarlet Knights,596644,Oregon Ducks,596660,9,top,"Aroz, A to c.",76,2025-03-21T00:00:00-04:00,"PK Park (Eugene, OR)",1675,MBA,2025
6302147,596660,Rutgers Scarlet Knights,596644,Oregon Ducks,596660,9,top,"Brooks, J to lf.",77,2025-03-21T00:00:00-04:00,"PK Park (Eugene, OR)",1675,MBA,2025
6302147,596660,Rutgers Scarlet Knights,596644,Oregon Ducks,596660,9,top,"Jordan, J to p for Garcia, S.",78,2025-03-21T00:00:00-04:00,"PK Park (Eugene, OR)",1675,MBA,2025
6302147,596660,Rutgers Scarlet Knights,596644,Oregon Ducks,596660,9,top,N. Tomasetto pinch hit for JT Thompson.,79,2025-03-21T00:00:00-04:00,"PK Park (Eugene, OR)",1675,MBA,2025
6302147,596660,Rutgers Scarlet Knights,596644,Oregon Ducks,596660,9,top,N. Tomasetto fouled out to 1b (0-1 F).,80,2025-03-21T00:00:00-04:00,"PK Park (Eugene, OR)",1675,MBA,2025
6302147,596660,Rutgers Scarlet Knights,596644,Oregon Ducks,596660,9,top,JD Jones struck out looking (1-2 BKKK).,81,2025-03-21T00:00:00-04:00,"PK Park (Eugene, OR)",1675,MBA,2025
6302147,596660,Rutgers Scarlet Knights,596644,Oregon Ducks,596660,9,top,Y. Carreras hit by pitch (1-0 B).,82,2025-03-21T00:00:00-04:00,"PK Park (Eugene, OR)",1675,MBA,2025
6302147,596660,Rutgers Scarlet Knights,596644,Oregon Ducks,596660,9,top,T. Cohen walked (3-1 BBSBB)3a Y. Carreras advanced to second.,83,2025-03-21T00:00:00-04:00,"PK Park (Eugene, OR)",1675,MBA,2025
6302147,596660,Rutgers Scarlet Knights,596644,Oregon Ducks,596660,9,top,"Stokes, C to p for Jordan, J.",84,2025-03-21T00:00:00-04:00,"PK Park (Eugene, OR)",1675,MBA,2025
6302147,596660,Rutgers Scarlet Knights,596644,Oregon Ducks,596660,9,top,P. Bonds hit by pitch (0-1 F)3a T. Cohen advanced to second3a Y. Carreras advanced to third.,85,2025-03-21T00:00:00-04:00,"PK Park (Eugene, OR)",1675,MBA,2025
6302147,596660,Rutgers Scarlet Knights,596644,Oregon Ducks,596660,9,top,T. Doucette fouled out to 3b (0-1 K).,86,2025-03-21T00:00:00-04:00,"PK Park (Eugene, OR)",1675,MBA,2025
6302147,596660,Rutgers Scarlet Knights,596644,Oregon Ducks,596644,9,bot,N. Tomasetto to 2b.,87,2025-03-21T00:00:00-04:00,"PK Park (Eugene, OR)",1675,MBA,2025
6302147,596660,Rutgers Scarlet Knights,596644,Oregon Ducks,596644,9,bot,"Walsh, J hit by pitch (1-1 BS).",88,2025-03-21T00:00:00-04:00,"PK Park (Eugene, OR)",1675,MBA,2025
6302147,596660,Rutgers Scarlet Knights,596644,Oregon Ducks,596644,9,bot,"Brooks, J reached on a fielder's choice, bunt (1-1 KB)3a Walsh, J out at second 1b to ss.",89,2025-03-21T00:00:00-04:00,"PK Park (Eugene, OR)",1675,MBA,2025
6302147,596660,Rutgers Scarlet Knights,596644,Oregon Ducks,596644,9,bot,"Molony, M doubled to left field (2-1 BFB)3a Brooks, J advanced to third.",90,2025-03-21T00:00:00-04:00,"PK Park (Eugene, OR)",1675,MBA,2025
6302147,596660,Rutgers Scarlet Knights,596644,Oregon Ducks,596644,9,bot,"Niclai, C pinch hit for Mabeus, B.",91,2025-03-21T00:00:00-04:00,"PK Park (Eugene, OR)",1675,MBA,2025
6302147,596660,Rutgers Scarlet Knights,596644,Oregon Ducks,596644,9,bot,Q. Berglin to p for J. Mazza.,92,2025-03-21T00:00:00-04:00,"PK Park (Eugene, OR)",1675,MBA,2025
6302147,596660,Rutgers Scarlet Knights,596644,Oregon Ducks,596644,9,bot,"Stinson, P pinch hit for Niclai, C.",93,2025-03-21T00:00:00-04:00,"PK Park (Eugene, OR)",1675,MBA,2025
6302147,596660,Rutgers Scarlet Knights,596644,Oregon Ducks,596644,9,bot,"Stinson, P flied out to lf, SF, RBI (2-2 KBSB)3a Brooks, J scored.",94,2025-03-21T00:00:00-04:00,"PK Park (Eugene, OR)",1675,MBA,2025
