game_id,away_team_id,away_team_name,home_team_id,home_team_name,batting_team,inning,top_bot,event_text,event_num,game_datetime,stadium_name,attendance,sport_id,season
6302493,596720,Stetson Hatters,596947,West Ga. Wolves,596720,1,top,"Barkett, I grounded out to p.",1,2025-03-28T00:00:00-04:00,"Cole Field (Carrollton, GA)",262,MBA,2025
6302493,596720,Stetson Hatters,596947,West Ga. Wolves,596720,1,top,"Apple, F struck out swinging.",2,2025-03-28T00:00:00-04:00,"Cole Field (Carrollton, GA)",262,MBA,2025
6302493,596720,Stetson Hatters,596947,West Ga. Wolves,596720,1,top,"Meola ,L reached on an error by 3b.",3,2025-03-28T00:00:00-04:00,"Cole Field (Carrollton, GA)",262,MBA,2025
6302493,596720,Stetson Hatters,596947,West Ga. Wolves,596720,1,top,"Moran, L singled to right field3a Meola ,L advanced to third.",4,2025-03-28T00:00:00-04:00,"Cole Field (Carrollton, GA)",262,MBA,2025
6302493,596720,Stetson Hatters,596947,West Ga. Wolves,596720,1,top,"Moran, L stole second.",5,2025-03-28T00:00:00-04:00,"Cole Field (Carrollton, GA)",262,MBA,2025
6302493,596720,Stetson Hatters,596947,West Ga. Wolves,596720,1,top,"Russell, L tripled to center field, 2 RBI3a Moran, L scored, unearned3a Meola ,L scored, unearned.",6,2025-03-28T00:00:00-04:00,"Cole Field (Carrollton, GA)",262,MBA,2025
6302493,596720,Stetson Hatters,596947,West Ga. Wolves,596720,1,top,"Taylor, J grounded out to ss.",7,2025-03-28T00:00:00-04:00,"Cole Field (Carrollton, GA)",262,MBA,2025
6302493,596720,Stetson Hatters,596947,West Ga. Wolves,596947,1,bot,C. Prince doubled to center field.,8,2025-03-28T00:00:00-04:00,"Cole Field (Carrollton, GA)",262,MBA,2025
6302493,596720,Stetson Hatters,596947,West Ga. Wolves,596947,1,bot,"B. McDevitt singled, bunt3a C. Prince advanced to third.",9,2025-03-28T00:00:00-04:00,"Cole Field (Carrollton, GA)",262,MBA,2025
6302493,596720,Stetson Hatters,596947,West Ga. Wolves,596947,1,bot,C. Dierdorf struck out looking.,10,2025-03-28T00:00:00-04:00,"Cole Field (Carrollton, GA)",262,MBA,2025
6302493,596720,Stetson Hatters,596947,West Ga. Wolves,596947,1,bot,B. McDevitt advanced to second on a passed ball.,11,2025-03-28T00:00:00-04:00,"Cole Field (Carrollton, GA)",262,MBA,2025
6302493,596720,Stetson Hatters,596947,West Ga. Wolves,596947,1,bot,"McCullough tripled to center field, 2 RBI3a B. McDevitt scored3a C. Prince scored.",12,2025-03-28T00:00:00-04:00,"Cole Field (Carrollton, GA)",262,MBA,2025
6302493,596720,Stetson Hatters,596947,West Ga. Wolves,596947,1,bot,"L. Weidner grounded out to 2b, RBI3a McCullough scored.",13,2025-03-28T00:00:00-04:00,"Cole Field (Carrollton, GA)",262,MBA,2025
6302493,596720,Stetson Hatters,596947,West Ga. Wolves,596947,1,bot,J. Witmer grounded out to 2b.,14,2025-03-28T00:00:00-04:00,"Cole Field (Carrollton, GA)",262,MBA,2025
6302493,596720,Stetson Hatters,596947,West Ga. Wolves,596720,2,top,"Hylton, J struck out swinging.",15,2025-03-28T00:00:00-04:00,"Cole Field (Carrollton, GA)",262,MBA,2025
6302493,596720,Stetson Hatters,596947,West Ga. Wolves,596720,2,top,"Gonzalez, A doubled to left field.",16,2025-03-28T00:00:00-04:00,"Cole Field (Carrollton, GA)",262,MBA,2025
6302493,596720,Stetson Hatters,596947,West Ga. Wolves,596720,2,top,"De La Cruz,J homered, 2 RBI3a Gonzalez, A scored.",17,2025-03-28T00:00:00-04:00,"Cole Field (Carrollton, GA)",262,MBA,2025
6302493,596720,Stetson Hatters,596947,West Ga. Wolves,596720,2,top,"Barkett, I doubled down the lf line.",18,2025-03-28T00:00:00-04:00,"Cole Field (Carrollton, GA)",262,MBA,2025
6302493,596720,Stetson Hatters,596947,West Ga. Wolves,596720,2,top,"Apple, F reached on an error by 2b3a Barkett, I scored, unearned.",19,2025-03-28T00:00:00-04:00,"Cole Field (Carrollton, GA)",262,MBA,2025
6302493,596720,Stetson Hatters,596947,West Ga. Wolves,596720,2,top,"Meola ,L walked3a Apple, F advanced to second.",20,2025-03-28T00:00:00-04:00,"Cole Field (Carrollton, GA)",262,MBA,2025
6302493,596720,Stetson Hatters,596947,West Ga. Wolves,596720,2,top,"Moran, L flied out to cf.",21,2025-03-28T00:00:00-04:00,"Cole Field (Carrollton, GA)",262,MBA,2025
6302493,596720,Stetson Hatters,596947,West Ga. Wolves,596720,2,top,"Russell, L reached on a fielder's choice3a Meola ,L out at second ss to 2b3a Apple, F advanced to third.",22,2025-03-28T00:00:00-04:00,"Cole Field (Carrollton, GA)",262,MBA,2025
6302493,596720,Stetson Hatters,596947,West Ga. Wolves,596947,2,bot,M. Cooper struck out swinging.,23,2025-03-28T00:00:00-04:00,"Cole Field (Carrollton, GA)",262,MBA,2025
6302493,596720,Stetson Hatters,596947,West Ga. Wolves,596947,2,bot,J. Bowman grounded out to ss.,24,2025-03-28T00:00:00-04:00,"Cole Field (Carrollton, GA)",262,MBA,2025
6302493,596720,Stetson Hatters,596947,West Ga. Wolves,596947,2,bot,B. Bradford struck out swinging.,25,2025-03-28T00:00:00-04:00,"Cole Field (Carrollton, GA)",262,MBA,2025
6302493,596720,Stetson Hatters,596947,West Ga. Wolves,596720,3,top,"Taylor, J doubled to center field.",26,2025-03-28T00:00:00-04:00,"Cole Field (Carrollton, GA)",262,MBA,2025
6302493,596720,Stetson Hatters,596947,West Ga. Wolves,596720,3,top,"Hylton, J grounded out to p, SAC3a Taylor, J advanced to third.",27,2025-03-28T00:00:00-04:00,"Cole Field (Carrollton, GA)",262,MBA,2025
6302493,596720,Stetson Hatters,596947,West Ga. Wolves,596720,3,top,"Gonzalez, A reached on a fielder's choice3a Taylor, J out at home 1b to c.",28,2025-03-28T00:00:00-04:00,"Cole Field (Carrollton, GA)",262,MBA,2025
6302493,596720,Stetson Hatters,596947,West Ga. Wolves,596720,3,top,"Gonzalez, A advanced to second on a passed ball.",29,2025-03-28T00:00:00-04:00,"Cole Field (Carrollton, GA)",262,MBA,2025
6302493,596720,Stetson Hatters,596947,West Ga. Wolves,596720,3,top,"De La Cruz,J walked.",30,2025-03-28T00:00:00-04:00,"Cole Field (Carrollton, GA)",262,MBA,2025
6302493,596720,Stetson Hatters,596947,West Ga. Wolves,596720,3,top,"Barkett, I flied out to cf.",31,2025-03-28T00:00:00-04:00,"Cole Field (Carrollton, GA)",262,MBA,2025
6302493,596720,Stetson Hatters,596947,West Ga. Wolves,596947,3,bot,C. Prince flied out to lf.,32,2025-03-28T00:00:00-04:00,"Cole Field (Carrollton, GA)",262,MBA,2025
6302493,596720,Stetson Hatters,596947,West Ga. Wolves,596947,3,bot,B. McDevitt grounded out to ss.,33,2025-03-28T00:00:00-04:00,"Cole Field (Carrollton, GA)",262,MBA,2025
6302493,596720,Stetson Hatters,596947,West Ga. Wolves,596947,3,bot,C. Dierdorf walked.,34,2025-03-28T00:00:00-04:00,"Cole Field (Carrollton, GA)",262,MBA,2025
6302493,596720,Stetson Hatters,596947,West Ga. Wolves,596947,3,bot,McCullough singled through the right side3a C. Dierdorf advanced to third.,35,2025-03-28T00:00:00-04:00,"Cole Field (Carrollton, GA)",262,MBA,2025
6302493,596720,Stetson Hatters,596947,West Ga. Wolves,596947,3,bot,"Phillips, E to p for Hays, J.",36,2025-03-28T00:00:00-04:00,"Cole Field (Carrollton, GA)",262,MBA,2025
6302493,596720,Stetson Hatters,596947,West Ga. Wolves,596947,3,bot,L. Weidner hit by pitch3a McCullough advanced to second.,37,2025-03-28T00:00:00-04:00,"Cole Field (Carrollton, GA)",262,MBA,2025
6302493,596720,Stetson Hatters,596947,West Ga. Wolves,596947,3,bot,J. Witmer reached on a fielder's choice3a L. Weidner out at second ss to 2b.,38,2025-03-28T00:00:00-04:00,"Cole Field (Carrollton, GA)",262,MBA,2025
6302493,596720,Stetson Hatters,596947,West Ga. Wolves,596720,4,top,"Apple, F grounded out to ss.",39,2025-03-28T00:00:00-04:00,"Cole Field (Carrollton, GA)",262,MBA,2025
6302493,596720,Stetson Hatters,596947,West Ga. Wolves,596720,4,top,"Meola ,L flied out to cf.",40,2025-03-28T00:00:00-04:00,"Cole Field (Carrollton, GA)",262,MBA,2025
6302493,596720,Stetson Hatters,596947,West Ga. Wolves,596720,4,top,"Moran, L popped up to 2b.",41,2025-03-28T00:00:00-04:00,"Cole Field (Carrollton, GA)",262,MBA,2025
6302493,596720,Stetson Hatters,596947,West Ga. Wolves,596947,4,bot,M. Cooper walked.,42,2025-03-28T00:00:00-04:00,"Cole Field (Carrollton, GA)",262,MBA,2025
6302493,596720,Stetson Hatters,596947,West Ga. Wolves,596947,4,bot,"J. Bowman grounded out to p, SAC3a M. Cooper advanced to second.",43,2025-03-28T00:00:00-04:00,"Cole Field (Carrollton, GA)",262,MBA,2025
6302493,596720,Stetson Hatters,596947,West Ga. Wolves,596947,4,bot,B. Bradford struck out swinging.,44,2025-03-28T00:00:00-04:00,"Cole Field (Carrollton, GA)",262,MBA,2025
6302493,596720,Stetson Hatters,596947,West Ga. Wolves,596947,4,bot,C. Prince walked.,45,2025-03-28T00:00:00-04:00,"Cole Field (Carrollton, GA)",262,MBA,2025
6302493,596720,Stetson Hatters,596947,West Ga. Wolves,596947,4,bot,C. Prince advanced to second on a passed ball3a M. Cooper advanced to third on a passed ball.,46,2025-03-28T00:00:00-04:00,"Cole Field (Carrollton, GA)",262,MBA,2025
6302493,596720,Stetson Hatters,596947,West Ga. Wolves,596947,4,bot,"B. McDevitt singled to center field, 2 RBI3a C. Prince scored3a M. Cooper scored.",47,2025-03-28T00:00:00-04:00,"Cole Field (Carrollton, GA)",262,MBA,2025
6302493,596720,Stetson Hatters,596947,West Ga. Wolves,596947,4,bot,C. Dierdorf grounded out to 2b.,48,2025-03-28T00:00:00-04:00,"Cole Field (Carrollton, GA)",262,MBA,2025
6302493,596720,Stetson Hatters,596947,West Ga. Wolves,596720,5,top,"Russell, L struck out swinging.",49,2025-03-28T00:00:00-04:00,"Cole Field (Carrollton, GA)",262,MBA,2025
6302493,596720,Stetson Hatters,596947,West Ga. Wolves,596720,5,top,"Taylor, J grounded out to 3b.",50,2025-03-28T00:00:00-04:00,"Cole Field (Carrollton, GA)",262,MBA,2025
6302493,596720,Stetson Hatters,596947,West Ga. Wolves,596720,5,top,"Hylton, J struck out looking.",51,2025-03-28T00:00:00-04:00,"Cole Field (Carrollton, GA)",262,MBA,2025
6302493,596720,Stetson Hatters,596947,West Ga. Wolves,596947,5,bot,"Gorelick, J to p for Phillips, E.",52,2025-03-28T00:00:00-04:00,"Cole Field (Carrollton, GA)",262,MBA,2025
6302493,596720,Stetson Hatters,596947,West Ga. Wolves,596947,5,bot,McCullough grounded out to ss.,53,2025-03-28T00:00:00-04:00,"Cole Field (Carrollton, GA)",262,MBA,2025
6302493,596720,Stetson Hatters,596947,West Ga. Wolves,596947,5,bot,L. Weidner singled through the left side.,54,2025-03-28T00:00:00-04:00,"Cole Field (Carrollton, GA)",262,MBA,2025
6302493,596720,Stetson Hatters,596947,West Ga. Wolves,596947,5,bot,J. Witmer singled to left field3a L. Weidner advanced to second.,55,2025-03-28T00:00:00-04:00,"Cole Field (Carrollton, GA)",262,MBA,2025
6302493,596720,Stetson Hatters,596947,West Ga. Wolves,596947,5,bot,"L. Weidner out at third c to 3b, caught stealing.",56,2025-03-28T00:00:00-04:00,"Cole Field (Carrollton, GA)",262,MBA,2025
6302493,596720,Stetson Hatters,596947,West Ga. Wolves,596947,5,bot,M. Cooper reached on a fielder's choice3a J. Witmer out at second ss to 2b.,57,2025-03-28T00:00:00-04:00,"Cole Field (Carrollton, GA)",262,MBA,2025
6302493,596720,Stetson Hatters,596947,West Ga. Wolves,596720,6,top,"Gonzalez, A struck out swinging.",58,2025-03-28T00:00:00-04:00,"Cole Field (Carrollton, GA)",262,MBA,2025
6302493,596720,Stetson Hatters,596947,West Ga. Wolves,596720,6,top,"De La Cruz,J singled to left field.",59,2025-03-28T00:00:00-04:00,"Cole Field (Carrollton, GA)",262,MBA,2025
6302493,596720,Stetson Hatters,596947,West Ga. Wolves,596720,6,top,"De La Cruz,J stole second.",60,2025-03-28T00:00:00-04:00,"Cole Field (Carrollton, GA)",262,MBA,2025
6302493,596720,Stetson Hatters,596947,West Ga. Wolves,596720,6,top,"Barkett, I flied out to cf.",61,2025-03-28T00:00:00-04:00,"Cole Field (Carrollton, GA)",262,MBA,2025
6302493,596720,Stetson Hatters,596947,West Ga. Wolves,596720,6,top,"Apple, F singled through the left side, RBI3a De La Cruz,J scored.",62,2025-03-28T00:00:00-04:00,"Cole Field (Carrollton, GA)",262,MBA,2025
6302493,596720,Stetson Hatters,596947,West Ga. Wolves,596720,6,top,B. Parks to p for L. Pearson.,63,2025-03-28T00:00:00-04:00,"Cole Field (Carrollton, GA)",262,MBA,2025
6302493,596720,Stetson Hatters,596947,West Ga. Wolves,596720,6,top,"Meola ,L popped up to 2b.",64,2025-03-28T00:00:00-04:00,"Cole Field (Carrollton, GA)",262,MBA,2025
6302493,596720,Stetson Hatters,596947,West Ga. Wolves,596947,6,bot,J. Bowman struck out looking.,65,2025-03-28T00:00:00-04:00,"Cole Field (Carrollton, GA)",262,MBA,2025
6302493,596720,Stetson Hatters,596947,West Ga. Wolves,596947,6,bot,T. Presnell pinch hit for B. Bradford.,66,2025-03-28T00:00:00-04:00,"Cole Field (Carrollton, GA)",262,MBA,2025
6302493,596720,Stetson Hatters,596947,West Ga. Wolves,596947,6,bot,T. Presnell grounded out to 2b.,67,2025-03-28T00:00:00-04:00,"Cole Field (Carrollton, GA)",262,MBA,2025
6302493,596720,Stetson Hatters,596947,West Ga. Wolves,596947,6,bot,C. Prince grounded out to 2b.,68,2025-03-28T00:00:00-04:00,"Cole Field (Carrollton, GA)",262,MBA,2025
6302493,596720,Stetson Hatters,596947,West Ga. Wolves,596720,7,top,L. Johnson to 3b for T. Presnell.,69,2025-03-28T00:00:00-04:00,"Cole Field (Carrollton, GA)",262,MBA,2025
6302493,596720,Stetson Hatters,596947,West Ga. Wolves,596720,7,top,"Moran, L struck out swinging.",70,2025-03-28T00:00:00-04:00,"Cole Field (Carrollton, GA)",262,MBA,2025
6302493,596720,Stetson Hatters,596947,West Ga. Wolves,596720,7,top,"Russell, L struck out looking.",71,2025-03-28T00:00:00-04:00,"Cole Field (Carrollton, GA)",262,MBA,2025
6302493,596720,Stetson Hatters,596947,West Ga. Wolves,596720,7,top,"Taylor, J walked.",72,2025-03-28T00:00:00-04:00,"Cole Field (Carrollton, GA)",262,MBA,2025
6302493,596720,Stetson Hatters,596947,West Ga. Wolves,596720,7,top,"Taylor, J stole second.",73,2025-03-28T00:00:00-04:00,"Cole Field (Carrollton, GA)",262,MBA,2025
6302493,596720,Stetson Hatters,596947,West Ga. Wolves,596720,7,top,"Hylton, J struck out swinging.",74,2025-03-28T00:00:00-04:00,"Cole Field (Carrollton, GA)",262,MBA,2025
6302493,596720,Stetson Hatters,596947,West Ga. Wolves,596947,7,bot,B. McDevitt flied out to rf.,75,2025-03-28T00:00:00-04:00,"Cole Field (Carrollton, GA)",262,MBA,2025
6302493,596720,Stetson Hatters,596947,West Ga. Wolves,596947,7,bot,C. Dierdorf doubled to left field.,76,2025-03-28T00:00:00-04:00,"Cole Field (Carrollton, GA)",262,MBA,2025
6302493,596720,Stetson Hatters,596947,West Ga. Wolves,596947,7,bot,"Van Dyke, T to p for Gorelick, J.",77,2025-03-28T00:00:00-04:00,"Cole Field (Carrollton, GA)",262,MBA,2025
6302493,596720,Stetson Hatters,596947,West Ga. Wolves,596947,7,bot,McCullough struck out looking.,78,2025-03-28T00:00:00-04:00,"Cole Field (Carrollton, GA)",262,MBA,2025
6302493,596720,Stetson Hatters,596947,West Ga. Wolves,596947,7,bot,C. Dierdorf advanced to third on a passed ball.,79,2025-03-28T00:00:00-04:00,"Cole Field (Carrollton, GA)",262,MBA,2025
6302493,596720,Stetson Hatters,596947,West Ga. Wolves,596947,7,bot,"L. Weidner reached on an error by 2b3a C. Dierdorf scored, unearned.",80,2025-03-28T00:00:00-04:00,"Cole Field (Carrollton, GA)",262,MBA,2025
6302493,596720,Stetson Hatters,596947,West Ga. Wolves,596947,7,bot,J. Witmer struck out looking.,81,2025-03-28T00:00:00-04:00,"Cole Field (Carrollton, GA)",262,MBA,2025
6302493,596720,Stetson Hatters,596947,West Ga. Wolves,596720,8,top,"Griffis, E pinch hit for Gonzalez, A.",82,2025-03-28T00:00:00-04:00,"Cole Field (Carrollton, GA)",262,MBA,2025
6302493,596720,Stetson Hatters,596947,West Ga. Wolves,596720,8,top,"Griffis, E walked.",83,2025-03-28T00:00:00-04:00,"Cole Field (Carrollton, GA)",262,MBA,2025
6302493,596720,Stetson Hatters,596947,West Ga. Wolves,596720,8,top,"De La Cruz,J walked3a Griffis, E advanced to second.",84,2025-03-28T00:00:00-04:00,"Cole Field (Carrollton, GA)",262,MBA,2025
6302493,596720,Stetson Hatters,596947,West Ga. Wolves,596720,8,top,"Griffis, E stole third.",85,2025-03-28T00:00:00-04:00,"Cole Field (Carrollton, GA)",262,MBA,2025
6302493,596720,Stetson Hatters,596947,West Ga. Wolves,596720,8,top,"Barkett, I flied out to rf, SAC, RBI3a Griffis, E scored.",86,2025-03-28T00:00:00-04:00,"Cole Field (Carrollton, GA)",262,MBA,2025
6302493,596720,Stetson Hatters,596947,West Ga. Wolves,596720,8,top,D. Drakeford to p for B. Parks.,87,2025-03-28T00:00:00-04:00,"Cole Field (Carrollton, GA)",262,MBA,2025
6302493,596720,Stetson Hatters,596947,West Ga. Wolves,596720,8,top,"De La Cruz,J stole second.",88,2025-03-28T00:00:00-04:00,"Cole Field (Carrollton, GA)",262,MBA,2025
6302493,596720,Stetson Hatters,596947,West Ga. Wolves,596720,8,top,"Apple, F singled through the left side, RBI3a De La Cruz,J scored.",89,2025-03-28T00:00:00-04:00,"Cole Field (Carrollton, GA)",262,MBA,2025
6302493,596720,Stetson Hatters,596947,West Ga. Wolves,596720,8,top,"Meola ,L flied out to lf.",90,2025-03-28T00:00:00-04:00,"Cole Field (Carrollton, GA)",262,MBA,2025
6302493,596720,Stetson Hatters,596947,West Ga. Wolves,596720,8,top,"Moran, L flied out to cf.",91,2025-03-28T00:00:00-04:00,"Cole Field (Carrollton, GA)",262,MBA,2025
6302493,596720,Stetson Hatters,596947,West Ga. Wolves,596947,8,bot,"Alvarez, S to c for Griffis, E.",92,2025-03-28T00:00:00-04:00,"Cole Field (Carrollton, GA)",262,MBA,2025
6302493,596720,Stetson Hatters,596947,West Ga. Wolves,596947,8,bot,H. Smith pinch hit for M. Cooper.,93,2025-03-28T00:00:00-04:00,"Cole Field (Carrollton, GA)",262,MBA,2025
6302493,596720,Stetson Hatters,596947,West Ga. Wolves,596947,8,bot,H. Smith struck out swinging.,94,2025-03-28T00:00:00-04:00,"Cole Field (Carrollton, GA)",262,MBA,2025
6302493,596720,Stetson Hatters,596947,West Ga. Wolves,596947,8,bot,J. Bowman struck out swinging.,95,2025-03-28T00:00:00-04:00,"Cole Field (Carrollton, GA)",262,MBA,2025
6302493,596720,Stetson Hatters,596947,West Ga. Wolves,596947,8,bot,L. Johnson popped up to 3b.,96,2025-03-28T00:00:00-04:00,"Cole Field (Carrollton, GA)",262,MBA,2025
6302493,596720,Stetson Hatters,596947,West Ga. Wolves,596720,9,top,H. Smith to c.,97,2025-03-28T00:00:00-04:00,"Cole Field (Carrollton, GA)",262,MBA,2025
6302493,596720,Stetson Hatters,596947,West Ga. Wolves,596720,9,top,"Russell, L flied out to cf.",98,2025-03-28T00:00:00-04:00,"Cole Field (Carrollton, GA)",262,MBA,2025
6302493,596720,Stetson Hatters,596947,West Ga. Wolves,596720,9,top,"Taylor, J flied out to cf.",99,2025-03-28T00:00:00-04:00,"Cole Field (Carrollton, GA)",262,MBA,2025
6302493,596720,Stetson Hatters,596947,West Ga. Wolves,596720,9,top,"Hylton, J singled through the left side.",100,2025-03-28T00:00:00-04:00,"Cole Field (Carrollton, GA)",262,MBA,2025
6302493,596720,Stetson Hatters,596947,West Ga. Wolves,596720,9,top,"Downey, S pinch ran for Hylton, J.",101,2025-03-28T00:00:00-04:00,"Cole Field (Carrollton, GA)",262,MBA,2025
6302493,596720,Stetson Hatters,596947,West Ga. Wolves,596720,9,top,"Alvarez, S grounded out to ss.",102,2025-03-28T00:00:00-04:00,"Cole Field (Carrollton, GA)",262,MBA,2025
6302493,596720,Stetson Hatters,596947,West Ga. Wolves,596947,9,bot,C. Prince flied out to lf.,103,2025-03-28T00:00:00-04:00,"Cole Field (Carrollton, GA)",262,MBA,2025
6302493,596720,Stetson Hatters,596947,West Ga. Wolves,596947,9,bot,B. McDevitt struck out swinging.,104,2025-03-28T00:00:00-04:00,"Cole Field (Carrollton, GA)",262,MBA,2025
6302493,596720,Stetson Hatters,596947,West Ga. Wolves,596947,9,bot,C. Dierdorf struck out swinging.,105,2025-03-28T00:00:00-04:00,"Cole Field (Carrollton, GA)",262,MBA,2025
