game_id,away_team_id,away_team_name,home_team_id,home_team_name,batting_team,inning,top_bot,event_text,event_num,game_datetime,stadium_name,attendance,sport_id,season
6302302,596589,Manhattan Jaspers,596661,Sacred Heart Pioneers,596589,1,top,A. Taclas walked.,1,2025-03-23T00:00:00-04:00,"Veterans Park (Fairfield, CT)",231,MBA,2025
6302302,596589,Manhattan Jaspers,596661,Sacred Heart Pioneers,596589,1,top,"G. Salva grounded out to c, bunt, SAC3a A. Taclas advanced to second.",2,2025-03-23T00:00:00-04:00,"Veterans Park (Fairfield, CT)",231,MBA,2025
6302302,596589,Manhattan Jaspers,596661,Sacred Heart Pioneers,596589,1,top,A. Lewis reached first on an error by ss.,3,2025-03-23T00:00:00-04:00,"Veterans Park (Fairfield, CT)",231,MBA,2025
6302302,596589,Manhattan Jaspers,596661,Sacred Heart Pioneers,596589,1,top,"R. Lordier singled to second base, RBI3a A. Lewis advanced to second3a A. Taclas scored.",4,2025-03-23T00:00:00-04:00,"Veterans Park (Fairfield, CT)",231,MBA,2025
6302302,596589,Manhattan Jaspers,596661,Sacred Heart Pioneers,596589,1,top,J. Hatch pinch ran for A. Lewis.,5,2025-03-23T00:00:00-04:00,"Veterans Park (Fairfield, CT)",231,MBA,2025
6302302,596589,Manhattan Jaspers,596661,Sacred Heart Pioneers,596589,1,top,C. Basehore walked3a R. Lordier advanced to second3a J. Hatch advanced to third.,6,2025-03-23T00:00:00-04:00,"Veterans Park (Fairfield, CT)",231,MBA,2025
6302302,596589,Manhattan Jaspers,596661,Sacred Heart Pioneers,596589,1,top,"H. Sute homered, 4 RBI3a C. Basehore scored3a R. Lordier scored3a J. Hatch scored, unearned.",7,2025-03-23T00:00:00-04:00,"Veterans Park (Fairfield, CT)",231,MBA,2025
6302302,596589,Manhattan Jaspers,596661,Sacred Heart Pioneers,596589,1,top,T. Hansen grounded out to ss.,8,2025-03-23T00:00:00-04:00,"Veterans Park (Fairfield, CT)",231,MBA,2025
6302302,596589,Manhattan Jaspers,596661,Sacred Heart Pioneers,596589,1,top,T. Galletti flied out to rf.,9,2025-03-23T00:00:00-04:00,"Veterans Park (Fairfield, CT)",231,MBA,2025
6302302,596589,Manhattan Jaspers,596661,Sacred Heart Pioneers,596661,1,bot,J. Hatch to dh.,10,2025-03-23T00:00:00-04:00,"Veterans Park (Fairfield, CT)",231,MBA,2025
6302302,596589,Manhattan Jaspers,596661,Sacred Heart Pioneers,596661,1,bot,H. Sute to c.,11,2025-03-23T00:00:00-04:00,"Veterans Park (Fairfield, CT)",231,MBA,2025
6302302,596589,Manhattan Jaspers,596661,Sacred Heart Pioneers,596661,1,bot,"G. Donohue homered, RBI.",12,2025-03-23T00:00:00-04:00,"Veterans Park (Fairfield, CT)",231,MBA,2025
6302302,596589,Manhattan Jaspers,596661,Sacred Heart Pioneers,596661,1,bot,A. Ungar struck out swinging.,13,2025-03-23T00:00:00-04:00,"Veterans Park (Fairfield, CT)",231,MBA,2025
6302302,596589,Manhattan Jaspers,596661,Sacred Heart Pioneers,596661,1,bot,D. D'Amore walked.,14,2025-03-23T00:00:00-04:00,"Veterans Park (Fairfield, CT)",231,MBA,2025
6302302,596589,Manhattan Jaspers,596661,Sacred Heart Pioneers,596661,1,bot,D. D'Amore advanced to second on a wild pitch.,15,2025-03-23T00:00:00-04:00,"Veterans Park (Fairfield, CT)",231,MBA,2025
6302302,596589,Manhattan Jaspers,596661,Sacred Heart Pioneers,596661,1,bot,P. Link walked.,16,2025-03-23T00:00:00-04:00,"Veterans Park (Fairfield, CT)",231,MBA,2025
6302302,596589,Manhattan Jaspers,596661,Sacred Heart Pioneers,596661,1,bot,S. Newman popped up to 1b.,17,2025-03-23T00:00:00-04:00,"Veterans Park (Fairfield, CT)",231,MBA,2025
6302302,596589,Manhattan Jaspers,596661,Sacred Heart Pioneers,596661,1,bot,T. McGuire walked3a P. Link advanced to second3a D. D'Amore advanced to third.,18,2025-03-23T00:00:00-04:00,"Veterans Park (Fairfield, CT)",231,MBA,2025
6302302,596589,Manhattan Jaspers,596661,Sacred Heart Pioneers,596661,1,bot,C. Tallman grounded out to 1b unassisted.,19,2025-03-23T00:00:00-04:00,"Veterans Park (Fairfield, CT)",231,MBA,2025
6302302,596589,Manhattan Jaspers,596661,Sacred Heart Pioneers,596589,2,top,/  for J. Craska.,20,2025-03-23T00:00:00-04:00,"Veterans Park (Fairfield, CT)",231,MBA,2025
6302302,596589,Manhattan Jaspers,596661,Sacred Heart Pioneers,596589,2,top,J. Craska to p for J. Hatch.,21,2025-03-23T00:00:00-04:00,"Veterans Park (Fairfield, CT)",231,MBA,2025
6302302,596589,Manhattan Jaspers,596661,Sacred Heart Pioneers,596589,2,top,A. Katzman grounded out to p.,22,2025-03-23T00:00:00-04:00,"Veterans Park (Fairfield, CT)",231,MBA,2025
6302302,596589,Manhattan Jaspers,596661,Sacred Heart Pioneers,596589,2,top,A. Taclas singled to second base.,23,2025-03-23T00:00:00-04:00,"Veterans Park (Fairfield, CT)",231,MBA,2025
6302302,596589,Manhattan Jaspers,596661,Sacred Heart Pioneers,596589,2,top,G. Salva singled to shortstop3a A. Taclas advanced to third.,24,2025-03-23T00:00:00-04:00,"Veterans Park (Fairfield, CT)",231,MBA,2025
6302302,596589,Manhattan Jaspers,596661,Sacred Heart Pioneers,596589,2,top,"J. Craska singled, bunt, RBI3a G. Salva advanced to second3a A. Taclas scored.",25,2025-03-23T00:00:00-04:00,"Veterans Park (Fairfield, CT)",231,MBA,2025
6302302,596589,Manhattan Jaspers,596661,Sacred Heart Pioneers,596589,2,top,P. Rogan to p for R. Parker.,26,2025-03-23T00:00:00-04:00,"Veterans Park (Fairfield, CT)",231,MBA,2025
6302302,596589,Manhattan Jaspers,596661,Sacred Heart Pioneers,596589,2,top,R. Lordier hit by pitch3a J. Craska advanced to second3a G. Salva advanced to third.,27,2025-03-23T00:00:00-04:00,"Veterans Park (Fairfield, CT)",231,MBA,2025
6302302,596589,Manhattan Jaspers,596661,Sacred Heart Pioneers,596589,2,top,"C. Basehore singled up the middle, 2 RBI3a R. Lordier advanced to second3a J. Craska scored3a G. Salva scored.",28,2025-03-23T00:00:00-04:00,"Veterans Park (Fairfield, CT)",231,MBA,2025
6302302,596589,Manhattan Jaspers,596661,Sacred Heart Pioneers,596589,2,top,H. Sute reached first on an error by p3a C. Basehore advanced to second3a R. Lordier advanced to third.,29,2025-03-23T00:00:00-04:00,"Veterans Park (Fairfield, CT)",231,MBA,2025
6302302,596589,Manhattan Jaspers,596661,Sacred Heart Pioneers,596589,2,top,T. Hansen struck out swinging.,30,2025-03-23T00:00:00-04:00,"Veterans Park (Fairfield, CT)",231,MBA,2025
6302302,596589,Manhattan Jaspers,596661,Sacred Heart Pioneers,596589,2,top,T. Galletti grounded out to ss.,31,2025-03-23T00:00:00-04:00,"Veterans Park (Fairfield, CT)",231,MBA,2025
6302302,596589,Manhattan Jaspers,596661,Sacred Heart Pioneers,596661,2,bot,J. Cilea grounded out to 1b unassisted.,32,2025-03-23T00:00:00-04:00,"Veterans Park (Fairfield, CT)",231,MBA,2025
6302302,596589,Manhattan Jaspers,596661,Sacred Heart Pioneers,596661,2,bot,Z. Kovalchik hit by pitch.,33,2025-03-23T00:00:00-04:00,"Veterans Park (Fairfield, CT)",231,MBA,2025
6302302,596589,Manhattan Jaspers,596661,Sacred Heart Pioneers,596661,2,bot,G. Donohue singled to second base3a Z. Kovalchik advanced to second.,34,2025-03-23T00:00:00-04:00,"Veterans Park (Fairfield, CT)",231,MBA,2025
6302302,596589,Manhattan Jaspers,596661,Sacred Heart Pioneers,596661,2,bot,G. Donohue stole second3a Z. Kovalchik stole third.,35,2025-03-23T00:00:00-04:00,"Veterans Park (Fairfield, CT)",231,MBA,2025
6302302,596589,Manhattan Jaspers,596661,Sacred Heart Pioneers,596661,2,bot,A. Ungar hit by pitch.,36,2025-03-23T00:00:00-04:00,"Veterans Park (Fairfield, CT)",231,MBA,2025
6302302,596589,Manhattan Jaspers,596661,Sacred Heart Pioneers,596661,2,bot,"D. D'Amore singled to center field, RBI3a A. Ungar advanced to second3a G. Donohue advanced to third3a Z. Kovalchik scored.",37,2025-03-23T00:00:00-04:00,"Veterans Park (Fairfield, CT)",231,MBA,2025
6302302,596589,Manhattan Jaspers,596661,Sacred Heart Pioneers,596661,2,bot,"P. Link walked, RBI3a D. D'Amore advanced to second3a A. Ungar advanced to third3a G. Donohue scored.",38,2025-03-23T00:00:00-04:00,"Veterans Park (Fairfield, CT)",231,MBA,2025
6302302,596589,Manhattan Jaspers,596661,Sacred Heart Pioneers,596661,2,bot,"S. Newman flied out to lf, SAC, RBI3a A. Ungar scored.",39,2025-03-23T00:00:00-04:00,"Veterans Park (Fairfield, CT)",231,MBA,2025
6302302,596589,Manhattan Jaspers,596661,Sacred Heart Pioneers,596661,2,bot,T. McGuire grounded out to 2b.,40,2025-03-23T00:00:00-04:00,"Veterans Park (Fairfield, CT)",231,MBA,2025
6302302,596589,Manhattan Jaspers,596661,Sacred Heart Pioneers,596589,3,top,A. Katzman singled to shortstop.,41,2025-03-23T00:00:00-04:00,"Veterans Park (Fairfield, CT)",231,MBA,2025
6302302,596589,Manhattan Jaspers,596661,Sacred Heart Pioneers,596589,3,top,A. Taclas popped up to 2b.,42,2025-03-23T00:00:00-04:00,"Veterans Park (Fairfield, CT)",231,MBA,2025
6302302,596589,Manhattan Jaspers,596661,Sacred Heart Pioneers,596589,3,top,"A. Katzman out at second c to ss, caught stealing.",43,2025-03-23T00:00:00-04:00,"Veterans Park (Fairfield, CT)",231,MBA,2025
6302302,596589,Manhattan Jaspers,596661,Sacred Heart Pioneers,596589,3,top,G. Salva hit by pitch.,44,2025-03-23T00:00:00-04:00,"Veterans Park (Fairfield, CT)",231,MBA,2025
6302302,596589,Manhattan Jaspers,596661,Sacred Heart Pioneers,596589,3,top,D. Mayer pinch hit for J. Craska.,45,2025-03-23T00:00:00-04:00,"Veterans Park (Fairfield, CT)",231,MBA,2025
6302302,596589,Manhattan Jaspers,596661,Sacred Heart Pioneers,596589,3,top,D. Mayer grounded out to 2b.,46,2025-03-23T00:00:00-04:00,"Veterans Park (Fairfield, CT)",231,MBA,2025
6302302,596589,Manhattan Jaspers,596661,Sacred Heart Pioneers,596661,3,bot,A. Brown to p for D. Mayer.,47,2025-03-23T00:00:00-04:00,"Veterans Park (Fairfield, CT)",231,MBA,2025
6302302,596589,Manhattan Jaspers,596661,Sacred Heart Pioneers,596661,3,bot,C. Tallman grounded out to ss.,48,2025-03-23T00:00:00-04:00,"Veterans Park (Fairfield, CT)",231,MBA,2025
6302302,596589,Manhattan Jaspers,596661,Sacred Heart Pioneers,596661,3,bot,J. Cilea doubled down the rf line.,49,2025-03-23T00:00:00-04:00,"Veterans Park (Fairfield, CT)",231,MBA,2025
6302302,596589,Manhattan Jaspers,596661,Sacred Heart Pioneers,596661,3,bot,Z. Kovalchik grounded out to ss3a J. Cilea advanced to third.,50,2025-03-23T00:00:00-04:00,"Veterans Park (Fairfield, CT)",231,MBA,2025
6302302,596589,Manhattan Jaspers,596661,Sacred Heart Pioneers,596661,3,bot,G. Donohue flied out to cf.,51,2025-03-23T00:00:00-04:00,"Veterans Park (Fairfield, CT)",231,MBA,2025
6302302,596589,Manhattan Jaspers,596661,Sacred Heart Pioneers,596589,4,top,R. Lordier struck out looking.,52,2025-03-23T00:00:00-04:00,"Veterans Park (Fairfield, CT)",231,MBA,2025
6302302,596589,Manhattan Jaspers,596661,Sacred Heart Pioneers,596589,4,top,C. Basehore flied out to cf.,53,2025-03-23T00:00:00-04:00,"Veterans Park (Fairfield, CT)",231,MBA,2025
6302302,596589,Manhattan Jaspers,596661,Sacred Heart Pioneers,596589,4,top,H. Sute walked.,54,2025-03-23T00:00:00-04:00,"Veterans Park (Fairfield, CT)",231,MBA,2025
6302302,596589,Manhattan Jaspers,596661,Sacred Heart Pioneers,596589,4,top,"H. Sute out at second c to 1b to 2b to 1b to 2b, caught stealing.",55,2025-03-23T00:00:00-04:00,"Veterans Park (Fairfield, CT)",231,MBA,2025
6302302,596589,Manhattan Jaspers,596661,Sacred Heart Pioneers,596661,4,bot,A. Ungar flied out to cf.,56,2025-03-23T00:00:00-04:00,"Veterans Park (Fairfield, CT)",231,MBA,2025
6302302,596589,Manhattan Jaspers,596661,Sacred Heart Pioneers,596661,4,bot,D. D'Amore lined out to 3b.,57,2025-03-23T00:00:00-04:00,"Veterans Park (Fairfield, CT)",231,MBA,2025
6302302,596589,Manhattan Jaspers,596661,Sacred Heart Pioneers,596661,4,bot,P. Link doubled down the lf line.,58,2025-03-23T00:00:00-04:00,"Veterans Park (Fairfield, CT)",231,MBA,2025
6302302,596589,Manhattan Jaspers,596661,Sacred Heart Pioneers,596661,4,bot,S. Newman hit by pitch.,59,2025-03-23T00:00:00-04:00,"Veterans Park (Fairfield, CT)",231,MBA,2025
6302302,596589,Manhattan Jaspers,596661,Sacred Heart Pioneers,596661,4,bot,T. McGuire singled to pitcher3a S. Newman advanced to second3a P. Link advanced to third.,60,2025-03-23T00:00:00-04:00,"Veterans Park (Fairfield, CT)",231,MBA,2025
6302302,596589,Manhattan Jaspers,596661,Sacred Heart Pioneers,596661,4,bot,C. Tallman reached on a fielder's choice3a T. McGuire out at second ss to 2b.,61,2025-03-23T00:00:00-04:00,"Veterans Park (Fairfield, CT)",231,MBA,2025
6302302,596589,Manhattan Jaspers,596661,Sacred Heart Pioneers,596589,5,top,T. Hansen reached first on a throwing error by ss.,62,2025-03-23T00:00:00-04:00,"Veterans Park (Fairfield, CT)",231,MBA,2025
6302302,596589,Manhattan Jaspers,596661,Sacred Heart Pioneers,596589,5,top,T. Galletti grounded into double play 2b to ss to 1b3a T. Hansen out on the play.,63,2025-03-23T00:00:00-04:00,"Veterans Park (Fairfield, CT)",231,MBA,2025
6302302,596589,Manhattan Jaspers,596661,Sacred Heart Pioneers,596589,5,top,A. Katzman singled to center field.,64,2025-03-23T00:00:00-04:00,"Veterans Park (Fairfield, CT)",231,MBA,2025
6302302,596589,Manhattan Jaspers,596661,Sacred Heart Pioneers,596589,5,top,A. Taclas struck out swinging.,65,2025-03-23T00:00:00-04:00,"Veterans Park (Fairfield, CT)",231,MBA,2025
6302302,596589,Manhattan Jaspers,596661,Sacred Heart Pioneers,596661,5,bot,J. Cilea grounded out to 2b.,66,2025-03-23T00:00:00-04:00,"Veterans Park (Fairfield, CT)",231,MBA,2025
6302302,596589,Manhattan Jaspers,596661,Sacred Heart Pioneers,596661,5,bot,Z. Kovalchik singled to left field.,67,2025-03-23T00:00:00-04:00,"Veterans Park (Fairfield, CT)",231,MBA,2025
6302302,596589,Manhattan Jaspers,596661,Sacred Heart Pioneers,596661,5,bot,Z. Kovalchik stole second.,68,2025-03-23T00:00:00-04:00,"Veterans Park (Fairfield, CT)",231,MBA,2025
6302302,596589,Manhattan Jaspers,596661,Sacred Heart Pioneers,596661,5,bot,"G. Donohue doubled down the lf line3a Z. Kovalchik advanced to third, out at home 3b to c.",69,2025-03-23T00:00:00-04:00,"Veterans Park (Fairfield, CT)",231,MBA,2025
6302302,596589,Manhattan Jaspers,596661,Sacred Heart Pioneers,596661,5,bot,A. Ungar reached first on an error by 3b3a G. Donohue advanced to third.,70,2025-03-23T00:00:00-04:00,"Veterans Park (Fairfield, CT)",231,MBA,2025
6302302,596589,Manhattan Jaspers,596661,Sacred Heart Pioneers,596661,5,bot,A. Ungar advanced to second on a wild pitch.,71,2025-03-23T00:00:00-04:00,"Veterans Park (Fairfield, CT)",231,MBA,2025
6302302,596589,Manhattan Jaspers,596661,Sacred Heart Pioneers,596661,5,bot,D. D'Amore flied out to lf.,72,2025-03-23T00:00:00-04:00,"Veterans Park (Fairfield, CT)",231,MBA,2025
6302302,596589,Manhattan Jaspers,596661,Sacred Heart Pioneers,596589,6,top,G. Salva singled to left field.,73,2025-03-23T00:00:00-04:00,"Veterans Park (Fairfield, CT)",231,MBA,2025
6302302,596589,Manhattan Jaspers,596661,Sacred Heart Pioneers,596589,6,top,"A. Brown grounded out to p, bunt, SAC3a G. Salva advanced to second.",74,2025-03-23T00:00:00-04:00,"Veterans Park (Fairfield, CT)",231,MBA,2025
6302302,596589,Manhattan Jaspers,596661,Sacred Heart Pioneers,596589,6,top,R. Lordier singled to shortstop.,75,2025-03-23T00:00:00-04:00,"Veterans Park (Fairfield, CT)",231,MBA,2025
6302302,596589,Manhattan Jaspers,596661,Sacred Heart Pioneers,596589,6,top,C. Basehore hit by pitch3a R. Lordier advanced to second3a G. Salva advanced to third.,76,2025-03-23T00:00:00-04:00,"Veterans Park (Fairfield, CT)",231,MBA,2025
6302302,596589,Manhattan Jaspers,596661,Sacred Heart Pioneers,596589,6,top,"H. Sute flied out to cf, SAC, RBI3a G. Salva scored.",77,2025-03-23T00:00:00-04:00,"Veterans Park (Fairfield, CT)",231,MBA,2025
6302302,596589,Manhattan Jaspers,596661,Sacred Heart Pioneers,596589,6,top,T. Hansen flied out to cf.,78,2025-03-23T00:00:00-04:00,"Veterans Park (Fairfield, CT)",231,MBA,2025
6302302,596589,Manhattan Jaspers,596661,Sacred Heart Pioneers,596661,6,bot,P. Link singled up the middle.,79,2025-03-23T00:00:00-04:00,"Veterans Park (Fairfield, CT)",231,MBA,2025
6302302,596589,Manhattan Jaspers,596661,Sacred Heart Pioneers,596661,6,bot,S. Newman struck out swinging.,80,2025-03-23T00:00:00-04:00,"Veterans Park (Fairfield, CT)",231,MBA,2025
6302302,596589,Manhattan Jaspers,596661,Sacred Heart Pioneers,596661,6,bot,T. McGuire reached on a fielder's choice3a P. Link out at second 3b to 2b.,81,2025-03-23T00:00:00-04:00,"Veterans Park (Fairfield, CT)",231,MBA,2025
6302302,596589,Manhattan Jaspers,596661,Sacred Heart Pioneers,596661,6,bot,N. Ryhlick to p for A. Brown.,82,2025-03-23T00:00:00-04:00,"Veterans Park (Fairfield, CT)",231,MBA,2025
6302302,596589,Manhattan Jaspers,596661,Sacred Heart Pioneers,596661,6,bot,C. Tallman struck out swinging.,83,2025-03-23T00:00:00-04:00,"Veterans Park (Fairfield, CT)",231,MBA,2025
6302302,596589,Manhattan Jaspers,596661,Sacred Heart Pioneers,596589,7,top,R. Redmond to p for P. Rogan.,84,2025-03-23T00:00:00-04:00,"Veterans Park (Fairfield, CT)",231,MBA,2025
6302302,596589,Manhattan Jaspers,596661,Sacred Heart Pioneers,596589,7,top,T. Galletti flied out to lf.,85,2025-03-23T00:00:00-04:00,"Veterans Park (Fairfield, CT)",231,MBA,2025
6302302,596589,Manhattan Jaspers,596661,Sacred Heart Pioneers,596589,7,top,A. Katzman flied out to rf.,86,2025-03-23T00:00:00-04:00,"Veterans Park (Fairfield, CT)",231,MBA,2025
6302302,596589,Manhattan Jaspers,596661,Sacred Heart Pioneers,596589,7,top,"A. Taclas homered, RBI.",87,2025-03-23T00:00:00-04:00,"Veterans Park (Fairfield, CT)",231,MBA,2025
6302302,596589,Manhattan Jaspers,596661,Sacred Heart Pioneers,596589,7,top,G. Salva flied out to lf.,88,2025-03-23T00:00:00-04:00,"Veterans Park (Fairfield, CT)",231,MBA,2025
6302302,596589,Manhattan Jaspers,596661,Sacred Heart Pioneers,596661,7,bot,J. Cilea walked.,89,2025-03-23T00:00:00-04:00,"Veterans Park (Fairfield, CT)",231,MBA,2025
6302302,596589,Manhattan Jaspers,596661,Sacred Heart Pioneers,596661,7,bot,Z. Kovalchik singled to left field3a J. Cilea advanced to second.,90,2025-03-23T00:00:00-04:00,"Veterans Park (Fairfield, CT)",231,MBA,2025
6302302,596589,Manhattan Jaspers,596661,Sacred Heart Pioneers,596661,7,bot,G. Donohue singled to left center3a Z. Kovalchik advanced to second3a J. Cilea advanced to third.,91,2025-03-23T00:00:00-04:00,"Veterans Park (Fairfield, CT)",231,MBA,2025
6302302,596589,Manhattan Jaspers,596661,Sacred Heart Pioneers,596661,7,bot,"A. Ungar singled to right field, RBI3a G. Donohue advanced to second3a Z. Kovalchik advanced to third3a J. Cilea scored.",92,2025-03-23T00:00:00-04:00,"Veterans Park (Fairfield, CT)",231,MBA,2025
6302302,596589,Manhattan Jaspers,596661,Sacred Heart Pioneers,596661,7,bot,B. Romero to p for N. Ryhlick.,93,2025-03-23T00:00:00-04:00,"Veterans Park (Fairfield, CT)",231,MBA,2025
6302302,596589,Manhattan Jaspers,596661,Sacred Heart Pioneers,596661,7,bot,D. D'Amore struck out looking.,94,2025-03-23T00:00:00-04:00,"Veterans Park (Fairfield, CT)",231,MBA,2025
6302302,596589,Manhattan Jaspers,596661,Sacred Heart Pioneers,596661,7,bot,"P. Link walked, RBI3a A. Ungar advanced to second3a G. Donohue advanced to third3a Z. Kovalchik scored.",95,2025-03-23T00:00:00-04:00,"Veterans Park (Fairfield, CT)",231,MBA,2025
6302302,596589,Manhattan Jaspers,596661,Sacred Heart Pioneers,596661,7,bot,"S. Newman doubled up the middle, 2 RBI3a P. Link advanced to third3a A. Ungar scored3a G. Donohue scored.",96,2025-03-23T00:00:00-04:00,"Veterans Park (Fairfield, CT)",231,MBA,2025
6302302,596589,Manhattan Jaspers,596661,Sacred Heart Pioneers,596661,7,bot,J. Fitzgeral pinch ran for S. Newman.,97,2025-03-23T00:00:00-04:00,"Veterans Park (Fairfield, CT)",231,MBA,2025
6302302,596589,Manhattan Jaspers,596661,Sacred Heart Pioneers,596661,7,bot,T. McGuire struck out looking.,98,2025-03-23T00:00:00-04:00,"Veterans Park (Fairfield, CT)",231,MBA,2025
6302302,596589,Manhattan Jaspers,596661,Sacred Heart Pioneers,596661,7,bot,C. Nolan pinch hit for C. Tallman.,99,2025-03-23T00:00:00-04:00,"Veterans Park (Fairfield, CT)",231,MBA,2025
6302302,596589,Manhattan Jaspers,596661,Sacred Heart Pioneers,596661,7,bot,C. Nolan struck out swinging.,100,2025-03-23T00:00:00-04:00,"Veterans Park (Fairfield, CT)",231,MBA,2025
6302302,596589,Manhattan Jaspers,596661,Sacred Heart Pioneers,596589,8,top,C. Nolan to 2b.,101,2025-03-23T00:00:00-04:00,"Veterans Park (Fairfield, CT)",231,MBA,2025
6302302,596589,Manhattan Jaspers,596661,Sacred Heart Pioneers,596589,8,top,B. Romero struck out looking.,102,2025-03-23T00:00:00-04:00,"Veterans Park (Fairfield, CT)",231,MBA,2025
6302302,596589,Manhattan Jaspers,596661,Sacred Heart Pioneers,596589,8,top,R. Lordier singled to center field.,103,2025-03-23T00:00:00-04:00,"Veterans Park (Fairfield, CT)",231,MBA,2025
6302302,596589,Manhattan Jaspers,596661,Sacred Heart Pioneers,596589,8,top,C. Basehore struck out swinging.,104,2025-03-23T00:00:00-04:00,"Veterans Park (Fairfield, CT)",231,MBA,2025
6302302,596589,Manhattan Jaspers,596661,Sacred Heart Pioneers,596589,8,top,R. Lordier advanced to second on a passed ball.,105,2025-03-23T00:00:00-04:00,"Veterans Park (Fairfield, CT)",231,MBA,2025
6302302,596589,Manhattan Jaspers,596661,Sacred Heart Pioneers,596589,8,top,H. Sute walked.,106,2025-03-23T00:00:00-04:00,"Veterans Park (Fairfield, CT)",231,MBA,2025
6302302,596589,Manhattan Jaspers,596661,Sacred Heart Pioneers,596589,8,top,"T. Hansen reached first on a throwing error by ss, RBI3a H. Sute advanced to third3a R. Lordier scored, unearned.",107,2025-03-23T00:00:00-04:00,"Veterans Park (Fairfield, CT)",231,MBA,2025
6302302,596589,Manhattan Jaspers,596661,Sacred Heart Pioneers,596589,8,top,T. Galletti struck out looking.,108,2025-03-23T00:00:00-04:00,"Veterans Park (Fairfield, CT)",231,MBA,2025
6302302,596589,Manhattan Jaspers,596661,Sacred Heart Pioneers,596661,8,bot,J. Cilea struck out looking.,109,2025-03-23T00:00:00-04:00,"Veterans Park (Fairfield, CT)",231,MBA,2025
6302302,596589,Manhattan Jaspers,596661,Sacred Heart Pioneers,596661,8,bot,Z. Kovalchik lined out to 3b.,110,2025-03-23T00:00:00-04:00,"Veterans Park (Fairfield, CT)",231,MBA,2025
6302302,596589,Manhattan Jaspers,596661,Sacred Heart Pioneers,596661,8,bot,G. Donohue doubled to left center.,111,2025-03-23T00:00:00-04:00,"Veterans Park (Fairfield, CT)",231,MBA,2025
6302302,596589,Manhattan Jaspers,596661,Sacred Heart Pioneers,596661,8,bot,A. Ungar reached first on a throwing error by 3b3a G. Donohue advanced to third on the error.,112,2025-03-23T00:00:00-04:00,"Veterans Park (Fairfield, CT)",231,MBA,2025
6302302,596589,Manhattan Jaspers,596661,Sacred Heart Pioneers,596661,8,bot,D. D'Amore hit by pitch3a A. Ungar advanced to second.,113,2025-03-23T00:00:00-04:00,"Veterans Park (Fairfield, CT)",231,MBA,2025
6302302,596589,Manhattan Jaspers,596661,Sacred Heart Pioneers,596661,8,bot,D. Martin pinch ran for D. D'Amore.,114,2025-03-23T00:00:00-04:00,"Veterans Park (Fairfield, CT)",231,MBA,2025
6302302,596589,Manhattan Jaspers,596661,Sacred Heart Pioneers,596661,8,bot,C. Fidanza to p for B. Romero.,115,2025-03-23T00:00:00-04:00,"Veterans Park (Fairfield, CT)",231,MBA,2025
6302302,596589,Manhattan Jaspers,596661,Sacred Heart Pioneers,596661,8,bot,P. Link reached on a fielder's choice3a D. Martin out at second ss to 2b.,116,2025-03-23T00:00:00-04:00,"Veterans Park (Fairfield, CT)",231,MBA,2025
6302302,596589,Manhattan Jaspers,596661,Sacred Heart Pioneers,596589,9,top,C. Costello to p for R. Redmond.,117,2025-03-23T00:00:00-04:00,"Veterans Park (Fairfield, CT)",231,MBA,2025
6302302,596589,Manhattan Jaspers,596661,Sacred Heart Pioneers,596589,9,top,D. Martin to lf for D. D'Amore.,118,2025-03-23T00:00:00-04:00,"Veterans Park (Fairfield, CT)",231,MBA,2025
6302302,596589,Manhattan Jaspers,596661,Sacred Heart Pioneers,596589,9,top,P. Link to 1b.,119,2025-03-23T00:00:00-04:00,"Veterans Park (Fairfield, CT)",231,MBA,2025
6302302,596589,Manhattan Jaspers,596661,Sacred Heart Pioneers,596589,9,top,A. Katzman grounded out to 3b.,120,2025-03-23T00:00:00-04:00,"Veterans Park (Fairfield, CT)",231,MBA,2025
6302302,596589,Manhattan Jaspers,596661,Sacred Heart Pioneers,596589,9,top,A. Taclas flied out to cf.,121,2025-03-23T00:00:00-04:00,"Veterans Park (Fairfield, CT)",231,MBA,2025
6302302,596589,Manhattan Jaspers,596661,Sacred Heart Pioneers,596589,9,top,G. Salva flied out to cf.,122,2025-03-23T00:00:00-04:00,"Veterans Park (Fairfield, CT)",231,MBA,2025
6302302,596589,Manhattan Jaspers,596661,Sacred Heart Pioneers,596661,9,bot,C. Fidanza to p for B. Romero.,123,2025-03-23T00:00:00-04:00,"Veterans Park (Fairfield, CT)",231,MBA,2025
6302302,596589,Manhattan Jaspers,596661,Sacred Heart Pioneers,596661,9,bot,J. Fitzgeral struck out swinging.,124,2025-03-23T00:00:00-04:00,"Veterans Park (Fairfield, CT)",231,MBA,2025
6302302,596589,Manhattan Jaspers,596661,Sacred Heart Pioneers,596661,9,bot,T. McGuire flied out to lf.,125,2025-03-23T00:00:00-04:00,"Veterans Park (Fairfield, CT)",231,MBA,2025
6302302,596589,Manhattan Jaspers,596661,Sacred Heart Pioneers,596661,9,bot,R. Donohue pinch hit for C. Nolan.,126,2025-03-23T00:00:00-04:00,"Veterans Park (Fairfield, CT)",231,MBA,2025
6302302,596589,Manhattan Jaspers,596661,Sacred Heart Pioneers,596661,9,bot,R. Donohue struck out looking.,127,2025-03-23T00:00:00-04:00,"Veterans Park (Fairfield, CT)",231,MBA,2025
