game_id,away_team_id,away_team_name,home_team_id,home_team_name,batting_team,inning,top_bot,event_text,event_num,game_datetime,stadium_name,attendance,sport_id,season
6303535,596516,Campbell Fighting Camels,596450,William & Mary Tribe,596516,1,top,"PARKER, D. singled to first base, bunt.",1,2025-04-19T00:00:00-04:00,"Plumeri Park (Williamsburg, VA)",715,MBA,2025
6303535,596516,Campbell Fighting Camels,596450,William & Mary Tribe,596516,1,top,"PARKER, D. advanced to second on a balk.",2,2025-04-19T00:00:00-04:00,"Plumeri Park (Williamsburg, VA)",715,MBA,2025
6303535,596516,Campbell Fighting Camels,596450,William & Mary Tribe,596516,1,top,"THOMPSON, D doubled down the lf line, RBI (1-2 FFFB)3a PARKER, D. scored.",3,2025-04-19T00:00:00-04:00,"Plumeri Park (Williamsburg, VA)",715,MBA,2025
6303535,596516,Campbell Fighting Camels,596450,William & Mary Tribe,596516,1,top,"MEGLIO, C. walked (3-1 KBBBB).",4,2025-04-19T00:00:00-04:00,"Plumeri Park (Williamsburg, VA)",715,MBA,2025
6303535,596516,Campbell Fighting Camels,596450,William & Mary Tribe,596516,1,top,"SCHULDT, A. infield fly to ss (1-0 B).",5,2025-04-19T00:00:00-04:00,"Plumeri Park (Williamsburg, VA)",715,MBA,2025
6303535,596516,Campbell Fighting Camels,596450,William & Mary Tribe,596516,1,top,"MORTON, J. homered to center field, 3 RBI (0-1 K)3a MEGLIO, C. scored3a THOMPSON, D scored.",6,2025-04-19T00:00:00-04:00,"Plumeri Park (Williamsburg, VA)",715,MBA,2025
6303535,596516,Campbell Fighting Camels,596450,William & Mary Tribe,596516,1,top,"MUSIC, J. struck out swinging (1-2 FSBS).",7,2025-04-19T00:00:00-04:00,"Plumeri Park (Williamsburg, VA)",715,MBA,2025
6303535,596516,Campbell Fighting Camels,596450,William & Mary Tribe,596516,1,top,"SIMPSON, J. struck out swinging (1-2 SSBS).",8,2025-04-19T00:00:00-04:00,"Plumeri Park (Williamsburg, VA)",715,MBA,2025
6303535,596516,Campbell Fighting Camels,596450,William & Mary Tribe,596450,1,bot,B. Parker grounded out to 3b (0-0).,9,2025-04-19T00:00:00-04:00,"Plumeri Park (Williamsburg, VA)",715,MBA,2025
6303535,596516,Campbell Fighting Camels,596450,William & Mary Tribe,596450,1,bot,L. Carmichae grounded out to 1b unassisted (1-0 B).,10,2025-04-19T00:00:00-04:00,"Plumeri Park (Williamsburg, VA)",715,MBA,2025
6303535,596516,Campbell Fighting Camels,596450,William & Mary Tribe,596450,1,bot,C. Rush singled to second base (2-2 BBFF).,11,2025-04-19T00:00:00-04:00,"Plumeri Park (Williamsburg, VA)",715,MBA,2025
6303535,596516,Campbell Fighting Camels,596450,William & Mary Tribe,596450,1,bot,J. Laskofski doubled to right center (1-0 B)3a C. Rush advanced to third.,12,2025-04-19T00:00:00-04:00,"Plumeri Park (Williamsburg, VA)",715,MBA,2025
6303535,596516,Campbell Fighting Camels,596450,William & Mary Tribe,596450,1,bot,D. Holmes grounded out to 3b (2-2 BSKBF).,13,2025-04-19T00:00:00-04:00,"Plumeri Park (Williamsburg, VA)",715,MBA,2025
6303535,596516,Campbell Fighting Camels,596450,William & Mary Tribe,596516,2,top,"KELLER, A. popped up to ss (0-0).",14,2025-04-19T00:00:00-04:00,"Plumeri Park (Williamsburg, VA)",715,MBA,2025
6303535,596516,Campbell Fighting Camels,596450,William & Mary Tribe,596516,2,top,"SCHRAMM, L. grounded out to p (0-0).",15,2025-04-19T00:00:00-04:00,"Plumeri Park (Williamsburg, VA)",715,MBA,2025
6303535,596516,Campbell Fighting Camels,596450,William & Mary Tribe,596516,2,top,"PARKER, D. grounded out to ss (0-0).",16,2025-04-19T00:00:00-04:00,"Plumeri Park (Williamsburg, VA)",715,MBA,2025
6303535,596516,Campbell Fighting Camels,596450,William & Mary Tribe,596450,2,bot,"A. Greco homered to right field, RBI (0-0).",17,2025-04-19T00:00:00-04:00,"Plumeri Park (Williamsburg, VA)",715,MBA,2025
6303535,596516,Campbell Fighting Camels,596450,William & Mary Tribe,596450,2,bot,C. Iriotakis grounded out to ss (1-2 BFK).,18,2025-04-19T00:00:00-04:00,"Plumeri Park (Williamsburg, VA)",715,MBA,2025
6303535,596516,Campbell Fighting Camels,596450,William & Mary Tribe,596450,2,bot,C. Felmlee grounded out to 3b (2-2 KSBB).,19,2025-04-19T00:00:00-04:00,"Plumeri Park (Williamsburg, VA)",715,MBA,2025
6303535,596516,Campbell Fighting Camels,596450,William & Mary Tribe,596450,2,bot,O. Wilson struck out swinging (1-2 SSFBS).,20,2025-04-19T00:00:00-04:00,"Plumeri Park (Williamsburg, VA)",715,MBA,2025
6303535,596516,Campbell Fighting Camels,596450,William & Mary Tribe,596516,3,top,"THOMPSON, D grounded out to 3b (2-1 FBB).",21,2025-04-19T00:00:00-04:00,"Plumeri Park (Williamsburg, VA)",715,MBA,2025
6303535,596516,Campbell Fighting Camels,596450,William & Mary Tribe,596516,3,top,"MEGLIO, C. singled to left field (0-0).",22,2025-04-19T00:00:00-04:00,"Plumeri Park (Williamsburg, VA)",715,MBA,2025
6303535,596516,Campbell Fighting Camels,596450,William & Mary Tribe,596516,3,top,"SCHULDT, A. struck out swinging (2-2 KKBBFS)3a MEGLIO, C. stole second.",23,2025-04-19T00:00:00-04:00,"Plumeri Park (Williamsburg, VA)",715,MBA,2025
6303535,596516,Campbell Fighting Camels,596450,William & Mary Tribe,596516,3,top,"MORTON, J. popped up to 3b (0-0).",24,2025-04-19T00:00:00-04:00,"Plumeri Park (Williamsburg, VA)",715,MBA,2025
6303535,596516,Campbell Fighting Camels,596450,William & Mary Tribe,596450,3,bot,B. Parker doubled to right center (1-0 B).,25,2025-04-19T00:00:00-04:00,"Plumeri Park (Williamsburg, VA)",715,MBA,2025
6303535,596516,Campbell Fighting Camels,596450,William & Mary Tribe,596450,3,bot,L. Carmichae popped up to ss (3-0 BBB).,26,2025-04-19T00:00:00-04:00,"Plumeri Park (Williamsburg, VA)",715,MBA,2025
6303535,596516,Campbell Fighting Camels,596450,William & Mary Tribe,596450,3,bot,C. Rush grounded out to 2b (1-1 KB)3a B. Parker advanced to third.,27,2025-04-19T00:00:00-04:00,"Plumeri Park (Williamsburg, VA)",715,MBA,2025
6303535,596516,Campbell Fighting Camels,596450,William & Mary Tribe,596450,3,bot,"J. Laskofski doubled down the rf line, RBI (1-2 BKK)3a B. Parker scored.",28,2025-04-19T00:00:00-04:00,"Plumeri Park (Williamsburg, VA)",715,MBA,2025
6303535,596516,Campbell Fighting Camels,596450,William & Mary Tribe,596450,3,bot,D. Holmes grounded out to 2b (1-0 B).,29,2025-04-19T00:00:00-04:00,"Plumeri Park (Williamsburg, VA)",715,MBA,2025
6303535,596516,Campbell Fighting Camels,596450,William & Mary Tribe,596516,4,top,"MUSIC, J. flied out to cf (1-0 B).",30,2025-04-19T00:00:00-04:00,"Plumeri Park (Williamsburg, VA)",715,MBA,2025
6303535,596516,Campbell Fighting Camels,596450,William & Mary Tribe,596516,4,top,"SIMPSON, J. grounded out to 3b (1-1 KB).",31,2025-04-19T00:00:00-04:00,"Plumeri Park (Williamsburg, VA)",715,MBA,2025
6303535,596516,Campbell Fighting Camels,596450,William & Mary Tribe,596516,4,top,"KELLER, A. homered to right center, RBI (0-1 K).",32,2025-04-19T00:00:00-04:00,"Plumeri Park (Williamsburg, VA)",715,MBA,2025
6303535,596516,Campbell Fighting Camels,596450,William & Mary Tribe,596516,4,top,"SCHRAMM, L. struck out swinging (0-2 KFS).",33,2025-04-19T00:00:00-04:00,"Plumeri Park (Williamsburg, VA)",715,MBA,2025
6303535,596516,Campbell Fighting Camels,596450,William & Mary Tribe,596450,4,bot,A. Greco singled to right field (1-0 B).,34,2025-04-19T00:00:00-04:00,"Plumeri Park (Williamsburg, VA)",715,MBA,2025
6303535,596516,Campbell Fighting Camels,596450,William & Mary Tribe,596450,4,bot,C. Iriotakis struck out swinging (3-2 KBKBBFS).,35,2025-04-19T00:00:00-04:00,"Plumeri Park (Williamsburg, VA)",715,MBA,2025
6303535,596516,Campbell Fighting Camels,596450,William & Mary Tribe,596450,4,bot,C. Felmlee walked (3-0 BBBB)3a A. Greco advanced to second.,36,2025-04-19T00:00:00-04:00,"Plumeri Park (Williamsburg, VA)",715,MBA,2025
6303535,596516,Campbell Fighting Camels,596450,William & Mary Tribe,596450,4,bot,"SMITH, M. to p for HENDRICKS, E.",37,2025-04-19T00:00:00-04:00,"Plumeri Park (Williamsburg, VA)",715,MBA,2025
6303535,596516,Campbell Fighting Camels,596450,William & Mary Tribe,596450,4,bot,O. Wilson grounded out to 3b (2-2 BBKK)3a C. Felmlee advanced to second3a A. Greco advanced to third.,38,2025-04-19T00:00:00-04:00,"Plumeri Park (Williamsburg, VA)",715,MBA,2025
6303535,596516,Campbell Fighting Camels,596450,William & Mary Tribe,596450,4,bot,"B. Parker singled through the right side, 2 RBI (1-1 BS)3a C. Felmlee scored3a A. Greco scored.",39,2025-04-19T00:00:00-04:00,"Plumeri Park (Williamsburg, VA)",715,MBA,2025
6303535,596516,Campbell Fighting Camels,596450,William & Mary Tribe,596450,4,bot,L. Carmichae fouled out to 3b (0-0).,40,2025-04-19T00:00:00-04:00,"Plumeri Park (Williamsburg, VA)",715,MBA,2025
6303535,596516,Campbell Fighting Camels,596450,William & Mary Tribe,596516,5,top,N. Lottchea to p for Z. Boyd.,41,2025-04-19T00:00:00-04:00,"Plumeri Park (Williamsburg, VA)",715,MBA,2025
6303535,596516,Campbell Fighting Camels,596450,William & Mary Tribe,596516,5,top,"PARKER, D. walked (3-2 KBBBKB).",42,2025-04-19T00:00:00-04:00,"Plumeri Park (Williamsburg, VA)",715,MBA,2025
6303535,596516,Campbell Fighting Camels,596450,William & Mary Tribe,596516,5,top,"THOMPSON, D singled up the middle (1-0 B)3a PARKER, D. advanced to second.",43,2025-04-19T00:00:00-04:00,"Plumeri Park (Williamsburg, VA)",715,MBA,2025
6303535,596516,Campbell Fighting Camels,596450,William & Mary Tribe,596516,5,top,"MEGLIO, C. lined into double play ss to 2b (2-1 FBB)3a PARKER, D. out on the play.",44,2025-04-19T00:00:00-04:00,"Plumeri Park (Williamsburg, VA)",715,MBA,2025
6303535,596516,Campbell Fighting Camels,596450,William & Mary Tribe,596516,5,top,"SCHULDT, A. struck out looking (2-2 BKKBK).",45,2025-04-19T00:00:00-04:00,"Plumeri Park (Williamsburg, VA)",715,MBA,2025
6303535,596516,Campbell Fighting Camels,596450,William & Mary Tribe,596450,5,bot,C. Rush struck out swinging (1-2 BFSS).,46,2025-04-19T00:00:00-04:00,"Plumeri Park (Williamsburg, VA)",715,MBA,2025
6303535,596516,Campbell Fighting Camels,596450,William & Mary Tribe,596450,5,bot,"J. Laskofski homered to right center, RBI (3-2 BKBBK).",47,2025-04-19T00:00:00-04:00,"Plumeri Park (Williamsburg, VA)",715,MBA,2025
6303535,596516,Campbell Fighting Camels,596450,William & Mary Tribe,596450,5,bot,D. Holmes grounded out to 3b (3-2 BBBKK).,48,2025-04-19T00:00:00-04:00,"Plumeri Park (Williamsburg, VA)",715,MBA,2025
6303535,596516,Campbell Fighting Camels,596450,William & Mary Tribe,596450,5,bot,A. Greco struck out swinging (0-2 KSS).,49,2025-04-19T00:00:00-04:00,"Plumeri Park (Williamsburg, VA)",715,MBA,2025
6303535,596516,Campbell Fighting Camels,596450,William & Mary Tribe,596516,6,top,"MORTON, J. grounded out to ss (1-2 KKBF).",50,2025-04-19T00:00:00-04:00,"Plumeri Park (Williamsburg, VA)",715,MBA,2025
6303535,596516,Campbell Fighting Camels,596450,William & Mary Tribe,596516,6,top,"MUSIC, J. reached on a fielding error by ss (0-2 KK).",51,2025-04-19T00:00:00-04:00,"Plumeri Park (Williamsburg, VA)",715,MBA,2025
6303535,596516,Campbell Fighting Camels,596450,William & Mary Tribe,596516,6,top,"SIMPSON, J. popped up to 3b (0-0).",52,2025-04-19T00:00:00-04:00,"Plumeri Park (Williamsburg, VA)",715,MBA,2025
6303535,596516,Campbell Fighting Camels,596450,William & Mary Tribe,596516,6,top,"KELLER, A. grounded out to 2b (0-0).",53,2025-04-19T00:00:00-04:00,"Plumeri Park (Williamsburg, VA)",715,MBA,2025
6303535,596516,Campbell Fighting Camels,596450,William & Mary Tribe,596450,6,bot,C. Iriotakis singled through the right side (1-1 BF).,54,2025-04-19T00:00:00-04:00,"Plumeri Park (Williamsburg, VA)",715,MBA,2025
6303535,596516,Campbell Fighting Camels,596450,William & Mary Tribe,596450,6,bot,"C. Felmlee grounded out to p, SAC, bunt (2-1 BKB)3a C. Iriotakis advanced to second.",55,2025-04-19T00:00:00-04:00,"Plumeri Park (Williamsburg, VA)",715,MBA,2025
6303535,596516,Campbell Fighting Camels,596450,William & Mary Tribe,596450,6,bot,O. Wilson walked (3-1 BBKBB).,56,2025-04-19T00:00:00-04:00,"Plumeri Park (Williamsburg, VA)",715,MBA,2025
6303535,596516,Campbell Fighting Camels,596450,William & Mary Tribe,596450,6,bot,"ROSSOW, D. to p for SMITH, M..",57,2025-04-19T00:00:00-04:00,"Plumeri Park (Williamsburg, VA)",715,MBA,2025
6303535,596516,Campbell Fighting Camels,596450,William & Mary Tribe,596450,6,bot,B. Parker walked (3-0 BBBB)3a O. Wilson advanced to second3a C. Iriotakis advanced to third.,58,2025-04-19T00:00:00-04:00,"Plumeri Park (Williamsburg, VA)",715,MBA,2025
6303535,596516,Campbell Fighting Camels,596450,William & Mary Tribe,596450,6,bot,B. Parker advanced to second on a wild pitch3a O. Wilson advanced to third on a wild pitch3a C. Iriotakis scored on a wild pitch.,59,2025-04-19T00:00:00-04:00,"Plumeri Park (Williamsburg, VA)",715,MBA,2025
6303535,596516,Campbell Fighting Camels,596450,William & Mary Tribe,596450,6,bot,B. Parker advanced to third on a wild pitch3a O. Wilson scored on a wild pitch.,60,2025-04-19T00:00:00-04:00,"Plumeri Park (Williamsburg, VA)",715,MBA,2025
6303535,596516,Campbell Fighting Camels,596450,William & Mary Tribe,596450,6,bot,B. Parker scored on a wild pitch.,61,2025-04-19T00:00:00-04:00,"Plumeri Park (Williamsburg, VA)",715,MBA,2025
6303535,596516,Campbell Fighting Camels,596450,William & Mary Tribe,596450,6,bot,L. Carmichae walked (3-0 BBBB).,62,2025-04-19T00:00:00-04:00,"Plumeri Park (Williamsburg, VA)",715,MBA,2025
6303535,596516,Campbell Fighting Camels,596450,William & Mary Tribe,596450,6,bot,"BIASI, N. to p for ROSSOW, D..",63,2025-04-19T00:00:00-04:00,"Plumeri Park (Williamsburg, VA)",715,MBA,2025
6303535,596516,Campbell Fighting Camels,596450,William & Mary Tribe,596450,6,bot,C. Rush hit by pitch (0-0)3a L. Carmichae advanced to second.,64,2025-04-19T00:00:00-04:00,"Plumeri Park (Williamsburg, VA)",715,MBA,2025
6303535,596516,Campbell Fighting Camels,596450,William & Mary Tribe,596450,6,bot,J. Laskofski flied out to rf (0-0)3a L. Carmichae advanced to third.,65,2025-04-19T00:00:00-04:00,"Plumeri Park (Williamsburg, VA)",715,MBA,2025
6303535,596516,Campbell Fighting Camels,596450,William & Mary Tribe,596450,6,bot,D. Holmes walked (3-2 BBFKFBB)3a C. Rush advanced to second.,66,2025-04-19T00:00:00-04:00,"Plumeri Park (Williamsburg, VA)",715,MBA,2025
6303535,596516,Campbell Fighting Camels,596450,William & Mary Tribe,596450,6,bot,A. Greco grounded out to 1b unassisted (0-1 S).,67,2025-04-19T00:00:00-04:00,"Plumeri Park (Williamsburg, VA)",715,MBA,2025
6303535,596516,Campbell Fighting Camels,596450,William & Mary Tribe,596516,7,top,C. Lovasz to p for N. Lottchea.,68,2025-04-19T00:00:00-04:00,"Plumeri Park (Williamsburg, VA)",715,MBA,2025
6303535,596516,Campbell Fighting Camels,596450,William & Mary Tribe,596516,7,top,"THOMPSON, J. pinch hit for SCHRAMM, L..",69,2025-04-19T00:00:00-04:00,"Plumeri Park (Williamsburg, VA)",715,MBA,2025
6303535,596516,Campbell Fighting Camels,596450,William & Mary Tribe,596516,7,top,"THOMPSON, J. walked (3-2 BKKFBBFB).",70,2025-04-19T00:00:00-04:00,"Plumeri Park (Williamsburg, VA)",715,MBA,2025
6303535,596516,Campbell Fighting Camels,596450,William & Mary Tribe,596516,7,top,"FARNI, S. pinch ran for THOMPSON, J..",71,2025-04-19T00:00:00-04:00,"Plumeri Park (Williamsburg, VA)",715,MBA,2025
6303535,596516,Campbell Fighting Camels,596450,William & Mary Tribe,596516,7,top,"PARKER, D. hit by pitch (1-1 FB)3a FARNI, S. advanced to second.",72,2025-04-19T00:00:00-04:00,"Plumeri Park (Williamsburg, VA)",715,MBA,2025
6303535,596516,Campbell Fighting Camels,596450,William & Mary Tribe,596516,7,top,"THOMPSON, D flied out to rf (0-2 KFF).",73,2025-04-19T00:00:00-04:00,"Plumeri Park (Williamsburg, VA)",715,MBA,2025
6303535,596516,Campbell Fighting Camels,596450,William & Mary Tribe,596516,7,top,"MEGLIO, C. struck out looking (2-2 BBKSK).",74,2025-04-19T00:00:00-04:00,"Plumeri Park (Williamsburg, VA)",715,MBA,2025
6303535,596516,Campbell Fighting Camels,596450,William & Mary Tribe,596516,7,top,"SCHULDT, A. walked (3-2 SFBBBB)3a PARKER, D. advanced to second3a FARNI, S. advanced to third.",75,2025-04-19T00:00:00-04:00,"Plumeri Park (Williamsburg, VA)",715,MBA,2025
6303535,596516,Campbell Fighting Camels,596450,William & Mary Tribe,596516,7,top,"MORTON, J. flied out to lf (2-1 BBF).",76,2025-04-19T00:00:00-04:00,"Plumeri Park (Williamsburg, VA)",715,MBA,2025
6303535,596516,Campbell Fighting Camels,596450,William & Mary Tribe,596450,7,bot,"FARNI, S. to rf.",77,2025-04-19T00:00:00-04:00,"Plumeri Park (Williamsburg, VA)",715,MBA,2025
6303535,596516,Campbell Fighting Camels,596450,William & Mary Tribe,596450,7,bot,C. Iriotakis struck out swinging (2-2 FKBBFS).,78,2025-04-19T00:00:00-04:00,"Plumeri Park (Williamsburg, VA)",715,MBA,2025
6303535,596516,Campbell Fighting Camels,596450,William & Mary Tribe,596450,7,bot,"SIEGNER, D. to p for BIASI, N..",79,2025-04-19T00:00:00-04:00,"Plumeri Park (Williamsburg, VA)",715,MBA,2025
6303535,596516,Campbell Fighting Camels,596450,William & Mary Tribe,596450,7,bot,C. Felmlee flied out to lf (1-1 KB).,80,2025-04-19T00:00:00-04:00,"Plumeri Park (Williamsburg, VA)",715,MBA,2025
6303535,596516,Campbell Fighting Camels,596450,William & Mary Tribe,596450,7,bot,O. Wilson singled to center field (1-1 FB).,81,2025-04-19T00:00:00-04:00,"Plumeri Park (Williamsburg, VA)",715,MBA,2025
6303535,596516,Campbell Fighting Camels,596450,William & Mary Tribe,596450,7,bot,B. Parker doubled to left field (1-0 B)3a O. Wilson advanced to third.,82,2025-04-19T00:00:00-04:00,"Plumeri Park (Williamsburg, VA)",715,MBA,2025
6303535,596516,Campbell Fighting Camels,596450,William & Mary Tribe,596450,7,bot,L. Carmichae flied out to cf (0-1 S).,83,2025-04-19T00:00:00-04:00,"Plumeri Park (Williamsburg, VA)",715,MBA,2025
6303535,596516,Campbell Fighting Camels,596450,William & Mary Tribe,596516,8,top,"MUSIC, J. grounded out to ss (3-1 BBBK).",84,2025-04-19T00:00:00-04:00,"Plumeri Park (Williamsburg, VA)",715,MBA,2025
6303535,596516,Campbell Fighting Camels,596450,William & Mary Tribe,596516,8,top,"SIMPSON, J. struck out swinging (0-2 KKS).",85,2025-04-19T00:00:00-04:00,"Plumeri Park (Williamsburg, VA)",715,MBA,2025
6303535,596516,Campbell Fighting Camels,596450,William & Mary Tribe,596516,8,top,"KELLER, A. struck out looking (0-2 KFK).",86,2025-04-19T00:00:00-04:00,"Plumeri Park (Williamsburg, VA)",715,MBA,2025
6303535,596516,Campbell Fighting Camels,596450,William & Mary Tribe,596450,8,bot,C. Rush singled to center field.,87,2025-04-19T00:00:00-04:00,"Plumeri Park (Williamsburg, VA)",715,MBA,2025
6303535,596516,Campbell Fighting Camels,596450,William & Mary Tribe,596450,8,bot,J. Laskofski grounded into double play 1b to ss (3-1 BSBB)3a C. Rush out on the play.,88,2025-04-19T00:00:00-04:00,"Plumeri Park (Williamsburg, VA)",715,MBA,2025
6303535,596516,Campbell Fighting Camels,596450,William & Mary Tribe,596450,8,bot,D. Holmes flied out to rf.,89,2025-04-19T00:00:00-04:00,"Plumeri Park (Williamsburg, VA)",715,MBA,2025
6303535,596516,Campbell Fighting Camels,596450,William & Mary Tribe,596516,9,top,"FARNI, S. singled to left field (1-2 BKK).",90,2025-04-19T00:00:00-04:00,"Plumeri Park (Williamsburg, VA)",715,MBA,2025
6303535,596516,Campbell Fighting Camels,596450,William & Mary Tribe,596516,9,top,"PARKER, D. lined into double play 1b unassisted (1-1 BK)3a FARNI, S. out on the play.",91,2025-04-19T00:00:00-04:00,"Plumeri Park (Williamsburg, VA)",715,MBA,2025
6303535,596516,Campbell Fighting Camels,596450,William & Mary Tribe,596516,9,top,"THOMPSON, D grounded out to ss (0-2 SS).",92,2025-04-19T00:00:00-04:00,"Plumeri Park (Williamsburg, VA)",715,MBA,2025
