game_id,away_team_id,away_team_name,home_team_id,home_team_name,batting_team,inning,top_bot,event_text,event_num,game_datetime,stadium_name,attendance,sport_id,season
6303238,596428,Towson Tigers,596460,Elon Phoenix,596428,1,top,J. Peyton flied out to cf (0-1 K).,1,2025-04-13T00:00:00-04:00,"Latham Park (Elon, NC)",304,MBA,2025
6303238,596428,Towson Tigers,596460,Elon Phoenix,596428,1,top,B. Ahalt doubled to left center (1-0 B).,2,2025-04-13T00:00:00-04:00,"Latham Park (Elon, NC)",304,MBA,2025
6303238,596428,Towson Tigers,596460,Elon Phoenix,596428,1,top,M.D'Alessand struck out swinging (2-2 BKBFS).,3,2025-04-13T00:00:00-04:00,"Latham Park (Elon, NC)",304,MBA,2025
6303238,596428,Towson Tigers,596460,Elon Phoenix,596428,1,top,"B. Heckelman singled to right center, RBI (0-0)3a B. Ahalt scored.",4,2025-04-13T00:00:00-04:00,"Latham Park (Elon, NC)",304,MBA,2025
6303238,596428,Towson Tigers,596460,Elon Phoenix,596428,1,top,T. Robinson lined out to rf (0-0).,5,2025-04-13T00:00:00-04:00,"Latham Park (Elon, NC)",304,MBA,2025
6303238,596428,Towson Tigers,596460,Elon Phoenix,596460,1,bot,Alford flied out to rf (2-2 FFBBF).,6,2025-04-13T00:00:00-04:00,"Latham Park (Elon, NC)",304,MBA,2025
6303238,596428,Towson Tigers,596460,Elon Phoenix,596460,1,bot,Granatell flied out to lf to left center (0-2 KF).,7,2025-04-13T00:00:00-04:00,"Latham Park (Elon, NC)",304,MBA,2025
6303238,596428,Towson Tigers,596460,Elon Phoenix,596460,1,bot,"Sprock homered to left field, RBI (2-1 BBS).",8,2025-04-13T00:00:00-04:00,"Latham Park (Elon, NC)",304,MBA,2025
6303238,596428,Towson Tigers,596460,Elon Phoenix,596460,1,bot,Duffey walked (3-1 BBKBB).,9,2025-04-13T00:00:00-04:00,"Latham Park (Elon, NC)",304,MBA,2025
6303238,596428,Towson Tigers,596460,Elon Phoenix,596460,1,bot,"Fattore doubled to left center, RBI (2-0 BB)3a Duffey scored.",10,2025-04-13T00:00:00-04:00,"Latham Park (Elon, NC)",304,MBA,2025
6303238,596428,Towson Tigers,596460,Elon Phoenix,596460,1,bot,Mallory Jr. grounded out to ss (0-2 KF).,11,2025-04-13T00:00:00-04:00,"Latham Park (Elon, NC)",304,MBA,2025
6303238,596428,Towson Tigers,596460,Elon Phoenix,596428,2,top,B. Nathison singled through the left side (0-1 K).,12,2025-04-13T00:00:00-04:00,"Latham Park (Elon, NC)",304,MBA,2025
6303238,596428,Towson Tigers,596460,Elon Phoenix,596428,2,top,E. Brand struck out swinging (2-2 KFBBS).,13,2025-04-13T00:00:00-04:00,"Latham Park (Elon, NC)",304,MBA,2025
6303238,596428,Towson Tigers,596460,Elon Phoenix,596428,2,top,J. Janove struck out swinging (2-2 BFBFFS).,14,2025-04-13T00:00:00-04:00,"Latham Park (Elon, NC)",304,MBA,2025
6303238,596428,Towson Tigers,596460,Elon Phoenix,596428,2,top,"C. Bishop singled to pitcher, bunt (1-1 KB)3a B. Nathison advanced to second.",15,2025-04-13T00:00:00-04:00,"Latham Park (Elon, NC)",304,MBA,2025
6303238,596428,Towson Tigers,596460,Elon Phoenix,596428,2,top,J. Peyton lined out to 2b (0-0).,16,2025-04-13T00:00:00-04:00,"Latham Park (Elon, NC)",304,MBA,2025
6303238,596428,Towson Tigers,596460,Elon Phoenix,596460,2,bot,Vergantino grounded out to 3b (1-1 BK).,17,2025-04-13T00:00:00-04:00,"Latham Park (Elon, NC)",304,MBA,2025
6303238,596428,Towson Tigers,596460,Elon Phoenix,596460,2,bot,Szestowicki flied out to cf (2-0 BB).,18,2025-04-13T00:00:00-04:00,"Latham Park (Elon, NC)",304,MBA,2025
6303238,596428,Towson Tigers,596460,Elon Phoenix,596460,2,bot,Yaghoubi grounded out to 2b (2-1 BKB).,19,2025-04-13T00:00:00-04:00,"Latham Park (Elon, NC)",304,MBA,2025
6303238,596428,Towson Tigers,596460,Elon Phoenix,596428,3,top,B. Ahalt flied out to cf (0-2 KF).,20,2025-04-13T00:00:00-04:00,"Latham Park (Elon, NC)",304,MBA,2025
6303238,596428,Towson Tigers,596460,Elon Phoenix,596428,3,top,M.D'Alessand flied out to lf (2-0 BB).,21,2025-04-13T00:00:00-04:00,"Latham Park (Elon, NC)",304,MBA,2025
6303238,596428,Towson Tigers,596460,Elon Phoenix,596428,3,top,B. Heckelman singled to shortstop (1-1 KB).,22,2025-04-13T00:00:00-04:00,"Latham Park (Elon, NC)",304,MBA,2025
6303238,596428,Towson Tigers,596460,Elon Phoenix,596428,3,top,T. Robinson popped up to ss (0-2 KFF).,23,2025-04-13T00:00:00-04:00,"Latham Park (Elon, NC)",304,MBA,2025
6303238,596428,Towson Tigers,596460,Elon Phoenix,596460,3,bot,Alford singled to left field (3-2 BKBFB).,24,2025-04-13T00:00:00-04:00,"Latham Park (Elon, NC)",304,MBA,2025
6303238,596428,Towson Tigers,596460,Elon Phoenix,596460,3,bot,"Granatell grounded out to c unassisted, interference (1-2 KBS).",25,2025-04-13T00:00:00-04:00,"Latham Park (Elon, NC)",304,MBA,2025
6303238,596428,Towson Tigers,596460,Elon Phoenix,596460,3,bot,Sprock hit by pitch (0-2 FF)3a Alford advanced to second.,26,2025-04-13T00:00:00-04:00,"Latham Park (Elon, NC)",304,MBA,2025
6303238,596428,Towson Tigers,596460,Elon Phoenix,596460,3,bot,"Duffey singled to right center, RBI (1-0 B)3a Sprock advanced to third3a Alford scored.",27,2025-04-13T00:00:00-04:00,"Latham Park (Elon, NC)",304,MBA,2025
6303238,596428,Towson Tigers,596460,Elon Phoenix,596460,3,bot,"Fattore reached on a fielder's choice, RBI (1-1 BS)3a Duffey out at second 3b to 2b3a Sprock scored.",28,2025-04-13T00:00:00-04:00,"Latham Park (Elon, NC)",304,MBA,2025
6303238,596428,Towson Tigers,596460,Elon Phoenix,596460,3,bot,Mallory Jr. reached on a fielder's choice (1-2 KKBF)3a Fattore out at second ss unassisted.,29,2025-04-13T00:00:00-04:00,"Latham Park (Elon, NC)",304,MBA,2025
6303238,596428,Towson Tigers,596460,Elon Phoenix,596428,4,top,B. Nathison grounded out to 3b (0-2 KK).,30,2025-04-13T00:00:00-04:00,"Latham Park (Elon, NC)",304,MBA,2025
6303238,596428,Towson Tigers,596460,Elon Phoenix,596428,4,top,E. Brand walked (3-1 BKBBB).,31,2025-04-13T00:00:00-04:00,"Latham Park (Elon, NC)",304,MBA,2025
6303238,596428,Towson Tigers,596460,Elon Phoenix,596428,4,top,J. Janove singled to left field (0-1 S)3a E. Brand advanced to second.,32,2025-04-13T00:00:00-04:00,"Latham Park (Elon, NC)",304,MBA,2025
6303238,596428,Towson Tigers,596460,Elon Phoenix,596428,4,top,"C. Bishop doubled down the lf line, advanced to third on the throw, 2 RBI (0-1 F)3a J. Janove scored3a E. Brand scored.",33,2025-04-13T00:00:00-04:00,"Latham Park (Elon, NC)",304,MBA,2025
6303238,596428,Towson Tigers,596460,Elon Phoenix,596428,4,top,"J. Peyton singled to right center, RBI (1-0 B)3a C. Bishop scored.",34,2025-04-13T00:00:00-04:00,"Latham Park (Elon, NC)",304,MBA,2025
6303238,596428,Towson Tigers,596460,Elon Phoenix,596428,4,top,B. Ahalt flied out to lf (0-0).,35,2025-04-13T00:00:00-04:00,"Latham Park (Elon, NC)",304,MBA,2025
6303238,596428,Towson Tigers,596460,Elon Phoenix,596428,4,top,M.D'Alessand hit by pitch (0-2 KFF)3a J. Peyton advanced to second.,36,2025-04-13T00:00:00-04:00,"Latham Park (Elon, NC)",304,MBA,2025
6303238,596428,Towson Tigers,596460,Elon Phoenix,596428,4,top,B. Heckelman flied out to cf (0-0).,37,2025-04-13T00:00:00-04:00,"Latham Park (Elon, NC)",304,MBA,2025
6303238,596428,Towson Tigers,596460,Elon Phoenix,596460,4,bot,N. Nabholz to p for D.DeProspero.,38,2025-04-13T00:00:00-04:00,"Latham Park (Elon, NC)",304,MBA,2025
6303238,596428,Towson Tigers,596460,Elon Phoenix,596460,4,bot,Vergantino grounded out to ss (2-0 BB).,39,2025-04-13T00:00:00-04:00,"Latham Park (Elon, NC)",304,MBA,2025
6303238,596428,Towson Tigers,596460,Elon Phoenix,596460,4,bot,Szestowicki out at first 1b to p (3-2 BBFBFFF).,40,2025-04-13T00:00:00-04:00,"Latham Park (Elon, NC)",304,MBA,2025
6303238,596428,Towson Tigers,596460,Elon Phoenix,596460,4,bot,Yaghoubi flied out to cf (1-0 B).,41,2025-04-13T00:00:00-04:00,"Latham Park (Elon, NC)",304,MBA,2025
6303238,596428,Towson Tigers,596460,Elon Phoenix,596428,5,top,T. Robinson grounded out to 2b (1-0 B).,42,2025-04-13T00:00:00-04:00,"Latham Park (Elon, NC)",304,MBA,2025
6303238,596428,Towson Tigers,596460,Elon Phoenix,596428,5,top,B. Nathison flied out to cf (0-1 S).,43,2025-04-13T00:00:00-04:00,"Latham Park (Elon, NC)",304,MBA,2025
6303238,596428,Towson Tigers,596460,Elon Phoenix,596428,5,top,E. Brand struck out swinging (2-2 KBFFBS).,44,2025-04-13T00:00:00-04:00,"Latham Park (Elon, NC)",304,MBA,2025
6303238,596428,Towson Tigers,596460,Elon Phoenix,596460,5,bot,Alford flied out to rf (2-0 BB).,45,2025-04-13T00:00:00-04:00,"Latham Park (Elon, NC)",304,MBA,2025
6303238,596428,Towson Tigers,596460,Elon Phoenix,596460,5,bot,Granatell grounded out to ss (0-1 K).,46,2025-04-13T00:00:00-04:00,"Latham Park (Elon, NC)",304,MBA,2025
6303238,596428,Towson Tigers,596460,Elon Phoenix,596460,5,bot,Sprock grounded out to 3b (2-0 BB).,47,2025-04-13T00:00:00-04:00,"Latham Park (Elon, NC)",304,MBA,2025
6303238,596428,Towson Tigers,596460,Elon Phoenix,596428,6,top,J. Janove struck out swinging (0-2 KFS).,48,2025-04-13T00:00:00-04:00,"Latham Park (Elon, NC)",304,MBA,2025
6303238,596428,Towson Tigers,596460,Elon Phoenix,596428,6,top,C. Bishop singled to shortstop (0-0).,49,2025-04-13T00:00:00-04:00,"Latham Park (Elon, NC)",304,MBA,2025
6303238,596428,Towson Tigers,596460,Elon Phoenix,596428,6,top,J. Peyton flied out to cf (0-1 F).,50,2025-04-13T00:00:00-04:00,"Latham Park (Elon, NC)",304,MBA,2025
6303238,596428,Towson Tigers,596460,Elon Phoenix,596428,6,top,"C. Bishop out at second p to 1b to ss, picked off.",51,2025-04-13T00:00:00-04:00,"Latham Park (Elon, NC)",304,MBA,2025
6303238,596428,Towson Tigers,596460,Elon Phoenix,596460,6,bot,Duffey grounded out to ss (2-0 BB).,52,2025-04-13T00:00:00-04:00,"Latham Park (Elon, NC)",304,MBA,2025
6303238,596428,Towson Tigers,596460,Elon Phoenix,596460,6,bot,Fattore struck out swinging (0-2 KSS).,53,2025-04-13T00:00:00-04:00,"Latham Park (Elon, NC)",304,MBA,2025
6303238,596428,Towson Tigers,596460,Elon Phoenix,596460,6,bot,Mallory Jr. flied out to rf to right center (3-2 FFBFBFBF).,54,2025-04-13T00:00:00-04:00,"Latham Park (Elon, NC)",304,MBA,2025
6303238,596428,Towson Tigers,596460,Elon Phoenix,596428,7,top,B. Ahalt doubled to left center (0-2 FS).,55,2025-04-13T00:00:00-04:00,"Latham Park (Elon, NC)",304,MBA,2025
6303238,596428,Towson Tigers,596460,Elon Phoenix,596428,7,top,M.D'Alessand grounded out to 3b (0-1 F).,56,2025-04-13T00:00:00-04:00,"Latham Park (Elon, NC)",304,MBA,2025
6303238,596428,Towson Tigers,596460,Elon Phoenix,596428,7,top,B. Heckelman popped up to 2b (1-0 B).,57,2025-04-13T00:00:00-04:00,"Latham Park (Elon, NC)",304,MBA,2025
6303238,596428,Towson Tigers,596460,Elon Phoenix,596428,7,top,B. Ahalt stole third.,58,2025-04-13T00:00:00-04:00,"Latham Park (Elon, NC)",304,MBA,2025
6303238,596428,Towson Tigers,596460,Elon Phoenix,596428,7,top,T. Robinson lined out to lf (2-2 SBFBF).,59,2025-04-13T00:00:00-04:00,"Latham Park (Elon, NC)",304,MBA,2025
6303238,596428,Towson Tigers,596460,Elon Phoenix,596460,7,bot,Vergantino flied out to lf (2-2 BBKK).,60,2025-04-13T00:00:00-04:00,"Latham Park (Elon, NC)",304,MBA,2025
6303238,596428,Towson Tigers,596460,Elon Phoenix,596460,7,bot,Szestowicki grounded out to ss (2-2 KBFB).,61,2025-04-13T00:00:00-04:00,"Latham Park (Elon, NC)",304,MBA,2025
6303238,596428,Towson Tigers,596460,Elon Phoenix,596460,7,bot,Yaghoubi singled to center field (2-1 BFB).,62,2025-04-13T00:00:00-04:00,"Latham Park (Elon, NC)",304,MBA,2025
6303238,596428,Towson Tigers,596460,Elon Phoenix,596460,7,bot,Yaghoubi stole second.,63,2025-04-13T00:00:00-04:00,"Latham Park (Elon, NC)",304,MBA,2025
6303238,596428,Towson Tigers,596460,Elon Phoenix,596460,7,bot,Alford grounded out to 1b unassisted (2-2 BKBKF).,64,2025-04-13T00:00:00-04:00,"Latham Park (Elon, NC)",304,MBA,2025
6303238,596428,Towson Tigers,596460,Elon Phoenix,596428,8,top,Nomura to p for Lavelle.,65,2025-04-13T00:00:00-04:00,"Latham Park (Elon, NC)",304,MBA,2025
6303238,596428,Towson Tigers,596460,Elon Phoenix,596428,8,top,B. Nathison grounded out to 3b (1-2 FFB).,66,2025-04-13T00:00:00-04:00,"Latham Park (Elon, NC)",304,MBA,2025
6303238,596428,Towson Tigers,596460,Elon Phoenix,596428,8,top,E. Brand grounded out to 3b (1-0 B).,67,2025-04-13T00:00:00-04:00,"Latham Park (Elon, NC)",304,MBA,2025
6303238,596428,Towson Tigers,596460,Elon Phoenix,596428,8,top,J. Janove grounded out to 3b (0-2 SF).,68,2025-04-13T00:00:00-04:00,"Latham Park (Elon, NC)",304,MBA,2025
6303238,596428,Towson Tigers,596460,Elon Phoenix,596460,8,bot,K. Emmons to p for N. Nabholz.,69,2025-04-13T00:00:00-04:00,"Latham Park (Elon, NC)",304,MBA,2025
6303238,596428,Towson Tigers,596460,Elon Phoenix,596460,8,bot,Granatell struck out swinging (1-2 KBFS).,70,2025-04-13T00:00:00-04:00,"Latham Park (Elon, NC)",304,MBA,2025
6303238,596428,Towson Tigers,596460,Elon Phoenix,596460,8,bot,Sprock singled to left field (0-0).,71,2025-04-13T00:00:00-04:00,"Latham Park (Elon, NC)",304,MBA,2025
6303238,596428,Towson Tigers,596460,Elon Phoenix,596460,8,bot,Duffey doubled to left center (3-2 BFBBKFF)3a Sprock advanced to third.,72,2025-04-13T00:00:00-04:00,"Latham Park (Elon, NC)",304,MBA,2025
6303238,596428,Towson Tigers,596460,Elon Phoenix,596460,8,bot,Fattore fouled out to 1b (0-1 K).,73,2025-04-13T00:00:00-04:00,"Latham Park (Elon, NC)",304,MBA,2025
6303238,596428,Towson Tigers,596460,Elon Phoenix,596460,8,bot,Duffey advanced to third3a Sprock scored on a wild pitch.,74,2025-04-13T00:00:00-04:00,"Latham Park (Elon, NC)",304,MBA,2025
6303238,596428,Towson Tigers,596460,Elon Phoenix,596460,8,bot,Mallory Jr. walked (3-2 BKFBBFB).,75,2025-04-13T00:00:00-04:00,"Latham Park (Elon, NC)",304,MBA,2025
6303238,596428,Towson Tigers,596460,Elon Phoenix,596460,8,bot,"Vergantino doubled to left center, RBI (0-0)3a Mallory Jr. advanced to third3a Duffey scored.",76,2025-04-13T00:00:00-04:00,"Latham Park (Elon, NC)",304,MBA,2025
6303238,596428,Towson Tigers,596460,Elon Phoenix,596460,8,bot,Szestowicki popped up to ss (1-2 BFF).,77,2025-04-13T00:00:00-04:00,"Latham Park (Elon, NC)",304,MBA,2025
6303238,596428,Towson Tigers,596460,Elon Phoenix,596428,9,top,Sprock to p.,78,2025-04-13T00:00:00-04:00,"Latham Park (Elon, NC)",304,MBA,2025
6303238,596428,Towson Tigers,596460,Elon Phoenix,596428,9,top,/  for Nomura.,79,2025-04-13T00:00:00-04:00,"Latham Park (Elon, NC)",304,MBA,2025
6303238,596428,Towson Tigers,596460,Elon Phoenix,596428,9,top,Alford to lf.,80,2025-04-13T00:00:00-04:00,"Latham Park (Elon, NC)",304,MBA,2025
6303238,596428,Towson Tigers,596460,Elon Phoenix,596428,9,top,Hajdu to ss for Granatell.,81,2025-04-13T00:00:00-04:00,"Latham Park (Elon, NC)",304,MBA,2025
6303238,596428,Towson Tigers,596460,Elon Phoenix,596428,9,top,Vergantino to 2b.,82,2025-04-13T00:00:00-04:00,"Latham Park (Elon, NC)",304,MBA,2025
6303238,596428,Towson Tigers,596460,Elon Phoenix,596428,9,top,C. Bishop struck out looking (3-2 KBBBFK).,83,2025-04-13T00:00:00-04:00,"Latham Park (Elon, NC)",304,MBA,2025
6303238,596428,Towson Tigers,596460,Elon Phoenix,596428,9,top,J. Peyton grounded out to 3b (0-0).,84,2025-04-13T00:00:00-04:00,"Latham Park (Elon, NC)",304,MBA,2025
6303238,596428,Towson Tigers,596460,Elon Phoenix,596428,9,top,B. Ahalt flied out to lf (0-2 KF).,85,2025-04-13T00:00:00-04:00,"Latham Park (Elon, NC)",304,MBA,2025
