game_id,away_team_id,away_team_name,home_team_id,home_team_name,batting_team,inning,top_bot,event_text,event_num,game_datetime,stadium_name,attendance,sport_id,season
6304659,596479,Alabama St. Hornets,596651,Prairie View Panthers,596479,1,top,K. Agosto struck out swinging (3-2).,1,2025-05-16T00:00:00-04:00,"Tankersley Field (Prairie View, TX)",116,MBA,2025
6304659,596479,Alabama St. Hornets,596651,Prairie View Panthers,596479,1,top,Juan Cruz struck out swinging (1-2).,2,2025-05-16T00:00:00-04:00,"Tankersley Field (Prairie View, TX)",116,MBA,2025
6304659,596479,Alabama St. Hornets,596651,Prairie View Panthers,596479,1,top,"K. Douglas homered, RBI.",3,2025-05-16T00:00:00-04:00,"Tankersley Field (Prairie View, TX)",116,MBA,2025
6304659,596479,Alabama St. Hornets,596651,Prairie View Panthers,596479,1,top,W. Espinal walked (3-0).,4,2025-05-16T00:00:00-04:00,"Tankersley Field (Prairie View, TX)",116,MBA,2025
6304659,596479,Alabama St. Hornets,596651,Prairie View Panthers,596479,1,top,A.Espaillat struck out swinging (3-2).,5,2025-05-16T00:00:00-04:00,"Tankersley Field (Prairie View, TX)",116,MBA,2025
6304659,596479,Alabama St. Hornets,596651,Prairie View Panthers,596651,1,bot,"A. Donatto homered, RBI (2-2).",6,2025-05-16T00:00:00-04:00,"Tankersley Field (Prairie View, TX)",116,MBA,2025
6304659,596479,Alabama St. Hornets,596651,Prairie View Panthers,596651,1,bot,J. Williams doubled down the lf line (2-2).,7,2025-05-16T00:00:00-04:00,"Tankersley Field (Prairie View, TX)",116,MBA,2025
6304659,596479,Alabama St. Hornets,596651,Prairie View Panthers,596651,1,bot,L. Williams flied out to rf (3-2).,8,2025-05-16T00:00:00-04:00,"Tankersley Field (Prairie View, TX)",116,MBA,2025
6304659,596479,Alabama St. Hornets,596651,Prairie View Panthers,596651,1,bot,B. Johnson grounded out to 3b (1-0)3a J. Williams advanced to third.,9,2025-05-16T00:00:00-04:00,"Tankersley Field (Prairie View, TX)",116,MBA,2025
6304659,596479,Alabama St. Hornets,596651,Prairie View Panthers,596651,1,bot,M. Bowie walked (3-2).,10,2025-05-16T00:00:00-04:00,"Tankersley Field (Prairie View, TX)",116,MBA,2025
6304659,596479,Alabama St. Hornets,596651,Prairie View Panthers,596651,1,bot,M. Jonas reached on a fielder's choice3a M. Bowie out at second ss to 2b.,11,2025-05-16T00:00:00-04:00,"Tankersley Field (Prairie View, TX)",116,MBA,2025
6304659,596479,Alabama St. Hornets,596651,Prairie View Panthers,596479,2,top,K. McIntosh struck out looking (3-2).,12,2025-05-16T00:00:00-04:00,"Tankersley Field (Prairie View, TX)",116,MBA,2025
6304659,596479,Alabama St. Hornets,596651,Prairie View Panthers,596479,2,top,D. Smiley grounded out to 1b unassisted (3-2).,13,2025-05-16T00:00:00-04:00,"Tankersley Field (Prairie View, TX)",116,MBA,2025
6304659,596479,Alabama St. Hornets,596651,Prairie View Panthers,596479,2,top,Parmentier walked (3-1).,14,2025-05-16T00:00:00-04:00,"Tankersley Field (Prairie View, TX)",116,MBA,2025
6304659,596479,Alabama St. Hornets,596651,Prairie View Panthers,596479,2,top,I. Landry singled to left field (2-2)3a Parmentier advanced to second.,15,2025-05-16T00:00:00-04:00,"Tankersley Field (Prairie View, TX)",116,MBA,2025
6304659,596479,Alabama St. Hornets,596651,Prairie View Panthers,596479,2,top,K. Agosto walked (3-2)3a I. Landry advanced to second3a Parmentier advanced to third.,16,2025-05-16T00:00:00-04:00,"Tankersley Field (Prairie View, TX)",116,MBA,2025
6304659,596479,Alabama St. Hornets,596651,Prairie View Panthers,596479,2,top,Juan Cruz reached on a fielder's choice (0-0)3a K. Agosto out at second ss to 2b.,17,2025-05-16T00:00:00-04:00,"Tankersley Field (Prairie View, TX)",116,MBA,2025
6304659,596479,Alabama St. Hornets,596651,Prairie View Panthers,596651,2,bot,M. Burroughs singled to right field (0-0).,18,2025-05-16T00:00:00-04:00,"Tankersley Field (Prairie View, TX)",116,MBA,2025
6304659,596479,Alabama St. Hornets,596651,Prairie View Panthers,596651,2,bot,"M. Heiskell grounded out to 1b unassisted, SAC (0-1)3a M. Burroughs advanced to second.",19,2025-05-16T00:00:00-04:00,"Tankersley Field (Prairie View, TX)",116,MBA,2025
6304659,596479,Alabama St. Hornets,596651,Prairie View Panthers,596651,2,bot,L. Allen flied out to rf (1-0)3a M. Burroughs advanced to third.,20,2025-05-16T00:00:00-04:00,"Tankersley Field (Prairie View, TX)",116,MBA,2025
6304659,596479,Alabama St. Hornets,596651,Prairie View Panthers,596651,2,bot,A. Donatto grounded out to ss (1-2).,21,2025-05-16T00:00:00-04:00,"Tankersley Field (Prairie View, TX)",116,MBA,2025
6304659,596479,Alabama St. Hornets,596651,Prairie View Panthers,596479,3,top,K. Douglas lined out to ss (1-2).,22,2025-05-16T00:00:00-04:00,"Tankersley Field (Prairie View, TX)",116,MBA,2025
6304659,596479,Alabama St. Hornets,596651,Prairie View Panthers,596479,3,top,W. Espinal singled to second base (2-1).,23,2025-05-16T00:00:00-04:00,"Tankersley Field (Prairie View, TX)",116,MBA,2025
6304659,596479,Alabama St. Hornets,596651,Prairie View Panthers,596479,3,top,W. Espinal advanced to second on an error by 2b.,24,2025-05-16T00:00:00-04:00,"Tankersley Field (Prairie View, TX)",116,MBA,2025
6304659,596479,Alabama St. Hornets,596651,Prairie View Panthers,596479,3,top,A.Espaillat walked (3-2).,25,2025-05-16T00:00:00-04:00,"Tankersley Field (Prairie View, TX)",116,MBA,2025
6304659,596479,Alabama St. Hornets,596651,Prairie View Panthers,596479,3,top,"K. McIntosh singled down the lf line, RBI (0-0)3a A.Espaillat advanced to third3a W. Espinal scored, unearned.",26,2025-05-16T00:00:00-04:00,"Tankersley Field (Prairie View, TX)",116,MBA,2025
6304659,596479,Alabama St. Hornets,596651,Prairie View Panthers,596479,3,top,"K. McIntosh out at second c to ss, caught stealing.",27,2025-05-16T00:00:00-04:00,"Tankersley Field (Prairie View, TX)",116,MBA,2025
6304659,596479,Alabama St. Hornets,596651,Prairie View Panthers,596479,3,top,"D. Smiley singled to center field, RBI (2-0)3a A.Espaillat scored.",28,2025-05-16T00:00:00-04:00,"Tankersley Field (Prairie View, TX)",116,MBA,2025
6304659,596479,Alabama St. Hornets,596651,Prairie View Panthers,596479,3,top,Parmentier lined out to 3b (1-2).,29,2025-05-16T00:00:00-04:00,"Tankersley Field (Prairie View, TX)",116,MBA,2025
6304659,596479,Alabama St. Hornets,596651,Prairie View Panthers,596651,3,bot,J. Williams hit by pitch (1-0).,30,2025-05-16T00:00:00-04:00,"Tankersley Field (Prairie View, TX)",116,MBA,2025
6304659,596479,Alabama St. Hornets,596651,Prairie View Panthers,596651,3,bot,"L. Williams tripled to center field, RBI (3-1)3a J. Williams scored.",31,2025-05-16T00:00:00-04:00,"Tankersley Field (Prairie View, TX)",116,MBA,2025
6304659,596479,Alabama St. Hornets,596651,Prairie View Panthers,596651,3,bot,"B. Johnson grounded out to ss, RBI (0-2)3a L. Williams scored.",32,2025-05-16T00:00:00-04:00,"Tankersley Field (Prairie View, TX)",116,MBA,2025
6304659,596479,Alabama St. Hornets,596651,Prairie View Panthers,596651,3,bot,M. Bowie out at first 1b to p (0-1).,33,2025-05-16T00:00:00-04:00,"Tankersley Field (Prairie View, TX)",116,MBA,2025
6304659,596479,Alabama St. Hornets,596651,Prairie View Panthers,596651,3,bot,M. Jonas walked (3-2).,34,2025-05-16T00:00:00-04:00,"Tankersley Field (Prairie View, TX)",116,MBA,2025
6304659,596479,Alabama St. Hornets,596651,Prairie View Panthers,596651,3,bot,Will Smith to p for Esaid Pena.,35,2025-05-16T00:00:00-04:00,"Tankersley Field (Prairie View, TX)",116,MBA,2025
6304659,596479,Alabama St. Hornets,596651,Prairie View Panthers,596651,3,bot,M. Jonas stole second.,36,2025-05-16T00:00:00-04:00,"Tankersley Field (Prairie View, TX)",116,MBA,2025
6304659,596479,Alabama St. Hornets,596651,Prairie View Panthers,596651,3,bot,"M. Jonas out at third c to 3b, caught stealing.",37,2025-05-16T00:00:00-04:00,"Tankersley Field (Prairie View, TX)",116,MBA,2025
6304659,596479,Alabama St. Hornets,596651,Prairie View Panthers,596479,4,top,I. Landry grounded out to 3b (1-2).,38,2025-05-16T00:00:00-04:00,"Tankersley Field (Prairie View, TX)",116,MBA,2025
6304659,596479,Alabama St. Hornets,596651,Prairie View Panthers,596479,4,top,K. Agosto singled to second base (3-2).,39,2025-05-16T00:00:00-04:00,"Tankersley Field (Prairie View, TX)",116,MBA,2025
6304659,596479,Alabama St. Hornets,596651,Prairie View Panthers,596479,4,top,"Juan Cruz homered, RBI (1-2)3a K. Agosto scored.",40,2025-05-16T00:00:00-04:00,"Tankersley Field (Prairie View, TX)",116,MBA,2025
6304659,596479,Alabama St. Hornets,596651,Prairie View Panthers,596479,4,top,K. Douglas walked (3-2).,41,2025-05-16T00:00:00-04:00,"Tankersley Field (Prairie View, TX)",116,MBA,2025
6304659,596479,Alabama St. Hornets,596651,Prairie View Panthers,596479,4,top,W. Espinal flied out to ss (0-1).,42,2025-05-16T00:00:00-04:00,"Tankersley Field (Prairie View, TX)",116,MBA,2025
6304659,596479,Alabama St. Hornets,596651,Prairie View Panthers,596479,4,top,A.Espaillat grounded out to 3b (3-2).,43,2025-05-16T00:00:00-04:00,"Tankersley Field (Prairie View, TX)",116,MBA,2025
6304659,596479,Alabama St. Hornets,596651,Prairie View Panthers,596651,4,bot,M. Burroughs flied out to 2b (0-0).,44,2025-05-16T00:00:00-04:00,"Tankersley Field (Prairie View, TX)",116,MBA,2025
6304659,596479,Alabama St. Hornets,596651,Prairie View Panthers,596651,4,bot,M. Heiskell struck out swinging (1-2).,45,2025-05-16T00:00:00-04:00,"Tankersley Field (Prairie View, TX)",116,MBA,2025
6304659,596479,Alabama St. Hornets,596651,Prairie View Panthers,596651,4,bot,L. Allen singled up the middle (0-2).,46,2025-05-16T00:00:00-04:00,"Tankersley Field (Prairie View, TX)",116,MBA,2025
6304659,596479,Alabama St. Hornets,596651,Prairie View Panthers,596651,4,bot,"L. Allen out at second c to 2b, caught stealing.",47,2025-05-16T00:00:00-04:00,"Tankersley Field (Prairie View, TX)",116,MBA,2025
6304659,596479,Alabama St. Hornets,596651,Prairie View Panthers,596479,5,top,B. Beaty to p for L. Bravo.,48,2025-05-16T00:00:00-04:00,"Tankersley Field (Prairie View, TX)",116,MBA,2025
6304659,596479,Alabama St. Hornets,596651,Prairie View Panthers,596479,5,top,K. McIntosh grounded out to 3b.,49,2025-05-16T00:00:00-04:00,"Tankersley Field (Prairie View, TX)",116,MBA,2025
6304659,596479,Alabama St. Hornets,596651,Prairie View Panthers,596479,5,top,D. Smiley singled to center field (3-1).,50,2025-05-16T00:00:00-04:00,"Tankersley Field (Prairie View, TX)",116,MBA,2025
6304659,596479,Alabama St. Hornets,596651,Prairie View Panthers,596479,5,top,Parmentier hit into double play ss to 2b to 1b (1-1)3a D. Smiley out on the play.,51,2025-05-16T00:00:00-04:00,"Tankersley Field (Prairie View, TX)",116,MBA,2025
6304659,596479,Alabama St. Hornets,596651,Prairie View Panthers,596651,5,bot,A. Donatto struck out swinging (2-2).,52,2025-05-16T00:00:00-04:00,"Tankersley Field (Prairie View, TX)",116,MBA,2025
6304659,596479,Alabama St. Hornets,596651,Prairie View Panthers,596651,5,bot,J. Williams walked (3-1).,53,2025-05-16T00:00:00-04:00,"Tankersley Field (Prairie View, TX)",116,MBA,2025
6304659,596479,Alabama St. Hornets,596651,Prairie View Panthers,596651,5,bot,L. Williams doubled to center field (0-1)3a J. Williams advanced to third.,54,2025-05-16T00:00:00-04:00,"Tankersley Field (Prairie View, TX)",116,MBA,2025
6304659,596479,Alabama St. Hornets,596651,Prairie View Panthers,596651,5,bot,B. Johnson singled to shortstop (0-0).,55,2025-05-16T00:00:00-04:00,"Tankersley Field (Prairie View, TX)",116,MBA,2025
6304659,596479,Alabama St. Hornets,596651,Prairie View Panthers,596651,5,bot,M. Bowie popped up to ss.,56,2025-05-16T00:00:00-04:00,"Tankersley Field (Prairie View, TX)",116,MBA,2025
6304659,596479,Alabama St. Hornets,596651,Prairie View Panthers,596651,5,bot,"M. Jonas singled up the middle, 2 RBI (1-2)3a B. Johnson advanced to second3a L. Williams scored3a J. Williams scored.",57,2025-05-16T00:00:00-04:00,"Tankersley Field (Prairie View, TX)",116,MBA,2025
6304659,596479,Alabama St. Hornets,596651,Prairie View Panthers,596651,5,bot,M. Jonas advanced to second on a wild pitch3a B. Johnson advanced to third.,58,2025-05-16T00:00:00-04:00,"Tankersley Field (Prairie View, TX)",116,MBA,2025
6304659,596479,Alabama St. Hornets,596651,Prairie View Panthers,596651,5,bot,M. Burroughs intentionally walked (2-0).,59,2025-05-16T00:00:00-04:00,"Tankersley Field (Prairie View, TX)",116,MBA,2025
6304659,596479,Alabama St. Hornets,596651,Prairie View Panthers,596651,5,bot,M. Heiskell flied out to cf (2-1).,60,2025-05-16T00:00:00-04:00,"Tankersley Field (Prairie View, TX)",116,MBA,2025
6304659,596479,Alabama St. Hornets,596651,Prairie View Panthers,596479,6,top,I. Landry singled down the lf line (0-0).,61,2025-05-16T00:00:00-04:00,"Tankersley Field (Prairie View, TX)",116,MBA,2025
6304659,596479,Alabama St. Hornets,596651,Prairie View Panthers,596479,6,top,K. Agosto doubled to right center (0-0)3a I. Landry advanced to third.,62,2025-05-16T00:00:00-04:00,"Tankersley Field (Prairie View, TX)",116,MBA,2025
6304659,596479,Alabama St. Hornets,596651,Prairie View Panthers,596479,6,top,"Juan Cruz flied out to rf, SAC, RBI (0-0)3a K. Agosto advanced to third3a I. Landry scored.",63,2025-05-16T00:00:00-04:00,"Tankersley Field (Prairie View, TX)",116,MBA,2025
6304659,596479,Alabama St. Hornets,596651,Prairie View Panthers,596479,6,top,K. Douglas walked (3-2).,64,2025-05-16T00:00:00-04:00,"Tankersley Field (Prairie View, TX)",116,MBA,2025
6304659,596479,Alabama St. Hornets,596651,Prairie View Panthers,596479,6,top,W. Espinal hit into double play 2b to ss to 1b (1-0)3a K. Douglas out on the play.,65,2025-05-16T00:00:00-04:00,"Tankersley Field (Prairie View, TX)",116,MBA,2025
6304659,596479,Alabama St. Hornets,596651,Prairie View Panthers,596651,6,bot,Will Larson to p for Will Smith.,66,2025-05-16T00:00:00-04:00,"Tankersley Field (Prairie View, TX)",116,MBA,2025
6304659,596479,Alabama St. Hornets,596651,Prairie View Panthers,596651,6,bot,L. Allen struck out swinging (3-2).,67,2025-05-16T00:00:00-04:00,"Tankersley Field (Prairie View, TX)",116,MBA,2025
6304659,596479,Alabama St. Hornets,596651,Prairie View Panthers,596651,6,bot,A. Donatto walked (3-2).,68,2025-05-16T00:00:00-04:00,"Tankersley Field (Prairie View, TX)",116,MBA,2025
6304659,596479,Alabama St. Hornets,596651,Prairie View Panthers,596651,6,bot,J. Williams flied out to lf (1-2)3a A. Donatto advanced to second.,69,2025-05-16T00:00:00-04:00,"Tankersley Field (Prairie View, TX)",116,MBA,2025
6304659,596479,Alabama St. Hornets,596651,Prairie View Panthers,596651,6,bot,"L. Williams homered, 2 RBI3a A. Donatto scored.",70,2025-05-16T00:00:00-04:00,"Tankersley Field (Prairie View, TX)",116,MBA,2025
6304659,596479,Alabama St. Hornets,596651,Prairie View Panthers,596651,6,bot,C. Sanders to p for Will Larson.,71,2025-05-16T00:00:00-04:00,"Tankersley Field (Prairie View, TX)",116,MBA,2025
6304659,596479,Alabama St. Hornets,596651,Prairie View Panthers,596651,6,bot,B. Johnson singled up the middle (1-1).,72,2025-05-16T00:00:00-04:00,"Tankersley Field (Prairie View, TX)",116,MBA,2025
6304659,596479,Alabama St. Hornets,596651,Prairie View Panthers,596651,6,bot,"M. Bowie struck out swinging, out at first c to 1b (1-2).",73,2025-05-16T00:00:00-04:00,"Tankersley Field (Prairie View, TX)",116,MBA,2025
6304659,596479,Alabama St. Hornets,596651,Prairie View Panthers,596479,7,top,A.Espaillat walked (3-2).,74,2025-05-16T00:00:00-04:00,"Tankersley Field (Prairie View, TX)",116,MBA,2025
6304659,596479,Alabama St. Hornets,596651,Prairie View Panthers,596479,7,top,A.Espaillat advanced to second on a passed ball.,75,2025-05-16T00:00:00-04:00,"Tankersley Field (Prairie View, TX)",116,MBA,2025
6304659,596479,Alabama St. Hornets,596651,Prairie View Panthers,596479,7,top,"K. McIntosh grounded out to p, SAC, bunt (1-2)3a A.Espaillat advanced to third.",76,2025-05-16T00:00:00-04:00,"Tankersley Field (Prairie View, TX)",116,MBA,2025
6304659,596479,Alabama St. Hornets,596651,Prairie View Panthers,596479,7,top,"D. Smiley doubled to center field, RBI (1-0)3a A.Espaillat scored.",77,2025-05-16T00:00:00-04:00,"Tankersley Field (Prairie View, TX)",116,MBA,2025
6304659,596479,Alabama St. Hornets,596651,Prairie View Panthers,596479,7,top,"Parmentier singled to center field, RBI (1-0)3a D. Smiley scored.",78,2025-05-16T00:00:00-04:00,"Tankersley Field (Prairie View, TX)",116,MBA,2025
6304659,596479,Alabama St. Hornets,596651,Prairie View Panthers,596479,7,top,I. Landry reached on an error by p (0-1)3a Parmentier advanced to second.,79,2025-05-16T00:00:00-04:00,"Tankersley Field (Prairie View, TX)",116,MBA,2025
6304659,596479,Alabama St. Hornets,596651,Prairie View Panthers,596479,7,top,K. Agosto walked (3-1)3a I. Landry advanced to second3a Parmentier advanced to third.,80,2025-05-16T00:00:00-04:00,"Tankersley Field (Prairie View, TX)",116,MBA,2025
6304659,596479,Alabama St. Hornets,596651,Prairie View Panthers,596479,7,top,"Juan Cruz tripled to right center, 3 RBI (0-0)3a K. Agosto scored3a I. Landry scored, unearned3a Parmentier scored.",81,2025-05-16T00:00:00-04:00,"Tankersley Field (Prairie View, TX)",116,MBA,2025
6304659,596479,Alabama St. Hornets,596651,Prairie View Panthers,596479,7,top,D. Thompson to p for B. Beaty.,82,2025-05-16T00:00:00-04:00,"Tankersley Field (Prairie View, TX)",116,MBA,2025
6304659,596479,Alabama St. Hornets,596651,Prairie View Panthers,596479,7,top,"K. Douglas singled to left field, RBI (3-2)3a Juan Cruz scored.",83,2025-05-16T00:00:00-04:00,"Tankersley Field (Prairie View, TX)",116,MBA,2025
6304659,596479,Alabama St. Hornets,596651,Prairie View Panthers,596479,7,top,W. Espinal singled to right field (1-1)3a K. Douglas advanced to second.,84,2025-05-16T00:00:00-04:00,"Tankersley Field (Prairie View, TX)",116,MBA,2025
6304659,596479,Alabama St. Hornets,596651,Prairie View Panthers,596479,7,top,A.Espaillat singled to right field (0-0)3a W. Espinal advanced to second3a K. Douglas advanced to third.,85,2025-05-16T00:00:00-04:00,"Tankersley Field (Prairie View, TX)",116,MBA,2025
6304659,596479,Alabama St. Hornets,596651,Prairie View Panthers,596479,7,top,K. McIntosh struck out swinging (0-2).,86,2025-05-16T00:00:00-04:00,"Tankersley Field (Prairie View, TX)",116,MBA,2025
6304659,596479,Alabama St. Hornets,596651,Prairie View Panthers,596479,7,top,"D. Smiley walked, RBI (3-2)3a A.Espaillat advanced to second3a W. Espinal advanced to third3a K. Douglas scored.",87,2025-05-16T00:00:00-04:00,"Tankersley Field (Prairie View, TX)",116,MBA,2025
6304659,596479,Alabama St. Hornets,596651,Prairie View Panthers,596479,7,top,"Parmentier walked, RBI (3-0)3a D. Smiley advanced to second3a A.Espaillat advanced to third3a W. Espinal scored.",88,2025-05-16T00:00:00-04:00,"Tankersley Field (Prairie View, TX)",116,MBA,2025
6304659,596479,Alabama St. Hornets,596651,Prairie View Panthers,596479,7,top,S. Medrano to p for D. Thompson.,89,2025-05-16T00:00:00-04:00,"Tankersley Field (Prairie View, TX)",116,MBA,2025
6304659,596479,Alabama St. Hornets,596651,Prairie View Panthers,596479,7,top,I. Landry struck out swinging (3-2).,90,2025-05-16T00:00:00-04:00,"Tankersley Field (Prairie View, TX)",116,MBA,2025
6304659,596479,Alabama St. Hornets,596651,Prairie View Panthers,596651,7,bot,M. Jonas walked (3-2).,91,2025-05-16T00:00:00-04:00,"Tankersley Field (Prairie View, TX)",116,MBA,2025
6304659,596479,Alabama St. Hornets,596651,Prairie View Panthers,596651,7,bot,M. Burroughs struck out swinging (1-2).,92,2025-05-16T00:00:00-04:00,"Tankersley Field (Prairie View, TX)",116,MBA,2025
6304659,596479,Alabama St. Hornets,596651,Prairie View Panthers,596651,7,bot,M. Heiskell reached on a fielder's choice (1-1)3a M. Jonas out at first 3b to 1b.,93,2025-05-16T00:00:00-04:00,"Tankersley Field (Prairie View, TX)",116,MBA,2025
6304659,596479,Alabama St. Hornets,596651,Prairie View Panthers,596651,7,bot,"L. Allen singled to right center, RBI (1-1)3a M. Heiskell scored.",94,2025-05-16T00:00:00-04:00,"Tankersley Field (Prairie View, TX)",116,MBA,2025
6304659,596479,Alabama St. Hornets,596651,Prairie View Panthers,596651,7,bot,L. Allen stole second.,95,2025-05-16T00:00:00-04:00,"Tankersley Field (Prairie View, TX)",116,MBA,2025
6304659,596479,Alabama St. Hornets,596651,Prairie View Panthers,596651,7,bot,A. Donatto grounded out to 2b (3-2).,96,2025-05-16T00:00:00-04:00,"Tankersley Field (Prairie View, TX)",116,MBA,2025
6304659,596479,Alabama St. Hornets,596651,Prairie View Panthers,596479,8,top,K. Agosto flied out to rf (3-1).,97,2025-05-16T00:00:00-04:00,"Tankersley Field (Prairie View, TX)",116,MBA,2025
6304659,596479,Alabama St. Hornets,596651,Prairie View Panthers,596479,8,top,Juan Cruz doubled to left center (0-0).,98,2025-05-16T00:00:00-04:00,"Tankersley Field (Prairie View, TX)",116,MBA,2025
6304659,596479,Alabama St. Hornets,596651,Prairie View Panthers,596479,8,top,K. Douglas lined into double play ss to 2b (3-2)3a Juan Cruz out on the play.,99,2025-05-16T00:00:00-04:00,"Tankersley Field (Prairie View, TX)",116,MBA,2025
6304659,596479,Alabama St. Hornets,596651,Prairie View Panthers,596651,8,bot,J. Williams struck out swinging (3-2).,100,2025-05-16T00:00:00-04:00,"Tankersley Field (Prairie View, TX)",116,MBA,2025
6304659,596479,Alabama St. Hornets,596651,Prairie View Panthers,596651,8,bot,L. Williams walked (3-2).,101,2025-05-16T00:00:00-04:00,"Tankersley Field (Prairie View, TX)",116,MBA,2025
6304659,596479,Alabama St. Hornets,596651,Prairie View Panthers,596651,8,bot,B. Johnson struck out swinging (1-2).,102,2025-05-16T00:00:00-04:00,"Tankersley Field (Prairie View, TX)",116,MBA,2025
6304659,596479,Alabama St. Hornets,596651,Prairie View Panthers,596651,8,bot,L. Williams advanced to second on a passed ball.,103,2025-05-16T00:00:00-04:00,"Tankersley Field (Prairie View, TX)",116,MBA,2025
6304659,596479,Alabama St. Hornets,596651,Prairie View Panthers,596651,8,bot,M. Bowie struck out swinging (1-2).,104,2025-05-16T00:00:00-04:00,"Tankersley Field (Prairie View, TX)",116,MBA,2025
6304659,596479,Alabama St. Hornets,596651,Prairie View Panthers,596479,9,top,W. Espinal walked (3-2).,105,2025-05-16T00:00:00-04:00,"Tankersley Field (Prairie View, TX)",116,MBA,2025
6304659,596479,Alabama St. Hornets,596651,Prairie View Panthers,596479,9,top,Z. Smith pinch ran for W. Espinal.,106,2025-05-16T00:00:00-04:00,"Tankersley Field (Prairie View, TX)",116,MBA,2025
6304659,596479,Alabama St. Hornets,596651,Prairie View Panthers,596479,9,top,A.Espaillat hit into double play ss to 2b to 1b (3-2)3a Z. Smith out on the play.,107,2025-05-16T00:00:00-04:00,"Tankersley Field (Prairie View, TX)",116,MBA,2025
6304659,596479,Alabama St. Hornets,596651,Prairie View Panthers,596479,9,top,K. McIntosh doubled to left field (0-0).,108,2025-05-16T00:00:00-04:00,"Tankersley Field (Prairie View, TX)",116,MBA,2025
6304659,596479,Alabama St. Hornets,596651,Prairie View Panthers,596479,9,top,D. Smiley grounded out to 2b (1-2).,109,2025-05-16T00:00:00-04:00,"Tankersley Field (Prairie View, TX)",116,MBA,2025
6304659,596479,Alabama St. Hornets,596651,Prairie View Panthers,596651,9,bot,J. Martinez to p for C. Sanders.,110,2025-05-16T00:00:00-04:00,"Tankersley Field (Prairie View, TX)",116,MBA,2025
6304659,596479,Alabama St. Hornets,596651,Prairie View Panthers,596651,9,bot,M. Jonas flied out to cf (3-1).,111,2025-05-16T00:00:00-04:00,"Tankersley Field (Prairie View, TX)",116,MBA,2025
6304659,596479,Alabama St. Hornets,596651,Prairie View Panthers,596651,9,bot,M. Burroughs grounded out to 1b unassisted (1-1).,112,2025-05-16T00:00:00-04:00,"Tankersley Field (Prairie View, TX)",116,MBA,2025
6304659,596479,Alabama St. Hornets,596651,Prairie View Panthers,596651,9,bot,M. Heiskell grounded out to 3b (0-0).,113,2025-05-16T00:00:00-04:00,"Tankersley Field (Prairie View, TX)",116,MBA,2025
