game_id,away_team_id,away_team_name,home_team_id,home_team_name,batting_team,inning,top_bot,event_text,event_num,game_datetime,stadium_name,attendance,sport_id,season
6304264,596631,Northeastern Huskies,596450,William & Mary Tribe,596631,1,top,Gerety singled up the middle (2-1 KBB).,1,2025-05-09T00:00:00-04:00,"Plumeri Park (Williamsburg, VA)",589,MBA,2025
6304264,596631,Northeastern Huskies,596450,William & Mary Tribe,596631,1,top,Maldonado struck out swinging (1-2 BKFS).,2,2025-05-09T00:00:00-04:00,"Plumeri Park (Williamsburg, VA)",589,MBA,2025
6304264,596631,Northeastern Huskies,596450,William & Mary Tribe,596631,1,top,Feinberg struck out looking (1-2 KBSK).,3,2025-05-09T00:00:00-04:00,"Plumeri Park (Williamsburg, VA)",589,MBA,2025
6304264,596631,Northeastern Huskies,596450,William & Mary Tribe,596631,1,top,J. Goodman fouled out to 1b (1-2 FKB).,4,2025-05-09T00:00:00-04:00,"Plumeri Park (Williamsburg, VA)",589,MBA,2025
6304264,596631,Northeastern Huskies,596450,William & Mary Tribe,596450,1,bot,B. Parker flied out to cf (1-0 B).,5,2025-05-09T00:00:00-04:00,"Plumeri Park (Williamsburg, VA)",589,MBA,2025
6304264,596631,Northeastern Huskies,596450,William & Mary Tribe,596450,1,bot,J. Laskofski struck out swinging (3-2 KBFBBS).,6,2025-05-09T00:00:00-04:00,"Plumeri Park (Williamsburg, VA)",589,MBA,2025
6304264,596631,Northeastern Huskies,596450,William & Mary Tribe,596450,1,bot,H. Jackson struck out swinging (1-2 KFBFFS).,7,2025-05-09T00:00:00-04:00,"Plumeri Park (Williamsburg, VA)",589,MBA,2025
6304264,596631,Northeastern Huskies,596450,William & Mary Tribe,596631,2,top,Musacchia singled to left field (0-1 S).,8,2025-05-09T00:00:00-04:00,"Plumeri Park (Williamsburg, VA)",589,MBA,2025
6304264,596631,Northeastern Huskies,596450,William & Mary Tribe,596631,2,top,Brinker flied out to cf (1-2 KFB).,9,2025-05-09T00:00:00-04:00,"Plumeri Park (Williamsburg, VA)",589,MBA,2025
6304264,596631,Northeastern Huskies,596450,William & Mary Tribe,596631,2,top,A. Lane fouled out to 1b (1-2 BKS).,10,2025-05-09T00:00:00-04:00,"Plumeri Park (Williamsburg, VA)",589,MBA,2025
6304264,596631,Northeastern Huskies,596450,William & Mary Tribe,596631,2,top,Fosberg singled to center field (2-1 BBK)3a Musacchia advanced to third.,11,2025-05-09T00:00:00-04:00,"Plumeri Park (Williamsburg, VA)",589,MBA,2025
6304264,596631,Northeastern Huskies,596450,William & Mary Tribe,596631,2,top,Chr. Walsh reached on a fielder's choice (1-0 B)3a Fosberg out at second ss to 2b.,12,2025-05-09T00:00:00-04:00,"Plumeri Park (Williamsburg, VA)",589,MBA,2025
6304264,596631,Northeastern Huskies,596450,William & Mary Tribe,596450,2,bot,L. Carmichae flied out to cf (2-2 KKFFFBB).,13,2025-05-09T00:00:00-04:00,"Plumeri Park (Williamsburg, VA)",589,MBA,2025
6304264,596631,Northeastern Huskies,596450,William & Mary Tribe,596450,2,bot,C. Rush singled down the rf line (2-2 FFBFFB).,14,2025-05-09T00:00:00-04:00,"Plumeri Park (Williamsburg, VA)",589,MBA,2025
6304264,596631,Northeastern Huskies,596450,William & Mary Tribe,596450,2,bot,D. Holmes grounded into double play 2b to ss to 1b (0-2 KK)3a C. Rush out on the play.,15,2025-05-09T00:00:00-04:00,"Plumeri Park (Williamsburg, VA)",589,MBA,2025
6304264,596631,Northeastern Huskies,596450,William & Mary Tribe,596631,3,top,Gerety fouled out to rf (0-0).,16,2025-05-09T00:00:00-04:00,"Plumeri Park (Williamsburg, VA)",589,MBA,2025
6304264,596631,Northeastern Huskies,596450,William & Mary Tribe,596631,3,top,Maldonado singled to left field (1-1 KB).,17,2025-05-09T00:00:00-04:00,"Plumeri Park (Williamsburg, VA)",589,MBA,2025
6304264,596631,Northeastern Huskies,596450,William & Mary Tribe,596631,3,top,Feinberg singled to left field (1-0 B)3a Maldonado advanced to second.,18,2025-05-09T00:00:00-04:00,"Plumeri Park (Williamsburg, VA)",589,MBA,2025
6304264,596631,Northeastern Huskies,596450,William & Mary Tribe,596631,3,top,J. Goodman flied out to cf (1-1 KB)3a Maldonado advanced to third.,19,2025-05-09T00:00:00-04:00,"Plumeri Park (Williamsburg, VA)",589,MBA,2025
6304264,596631,Northeastern Huskies,596450,William & Mary Tribe,596631,3,top,"Maldonado out at third p to 1b to c to 3b, caught stealing.",20,2025-05-09T00:00:00-04:00,"Plumeri Park (Williamsburg, VA)",589,MBA,2025
6304264,596631,Northeastern Huskies,596450,William & Mary Tribe,596450,3,bot,A. Greco struck out swinging (1-2 KBSS).,21,2025-05-09T00:00:00-04:00,"Plumeri Park (Williamsburg, VA)",589,MBA,2025
6304264,596631,Northeastern Huskies,596450,William & Mary Tribe,596450,3,bot,J. Barnes grounded out to ss (0-1 K).,22,2025-05-09T00:00:00-04:00,"Plumeri Park (Williamsburg, VA)",589,MBA,2025
6304264,596631,Northeastern Huskies,596450,William & Mary Tribe,596450,3,bot,O. Wilson flied out to rf (0-2 KKFF).,23,2025-05-09T00:00:00-04:00,"Plumeri Park (Williamsburg, VA)",589,MBA,2025
6304264,596631,Northeastern Huskies,596450,William & Mary Tribe,596631,4,top,Musacchia grounded out to 3b (0-0).,24,2025-05-09T00:00:00-04:00,"Plumeri Park (Williamsburg, VA)",589,MBA,2025
6304264,596631,Northeastern Huskies,596450,William & Mary Tribe,596631,4,top,Brinker struck out swinging (1-2 FBFFFFFS).,25,2025-05-09T00:00:00-04:00,"Plumeri Park (Williamsburg, VA)",589,MBA,2025
6304264,596631,Northeastern Huskies,596450,William & Mary Tribe,596631,4,top,A. Lane struck out swinging (2-2 BBSSS).,26,2025-05-09T00:00:00-04:00,"Plumeri Park (Williamsburg, VA)",589,MBA,2025
6304264,596631,Northeastern Huskies,596450,William & Mary Tribe,596450,4,bot,B. Parker flied out to cf (2-0 BB).,27,2025-05-09T00:00:00-04:00,"Plumeri Park (Williamsburg, VA)",589,MBA,2025
6304264,596631,Northeastern Huskies,596450,William & Mary Tribe,596450,4,bot,J. Laskofski grounded out to 2b (0-2 SK).,28,2025-05-09T00:00:00-04:00,"Plumeri Park (Williamsburg, VA)",589,MBA,2025
6304264,596631,Northeastern Huskies,596450,William & Mary Tribe,596450,4,bot,H. Jackson flied out to rf (2-2 KBBK).,29,2025-05-09T00:00:00-04:00,"Plumeri Park (Williamsburg, VA)",589,MBA,2025
6304264,596631,Northeastern Huskies,596450,William & Mary Tribe,596631,5,top,Fosberg grounded out to 2b (1-2 SFB).,30,2025-05-09T00:00:00-04:00,"Plumeri Park (Williamsburg, VA)",589,MBA,2025
6304264,596631,Northeastern Huskies,596450,William & Mary Tribe,596631,5,top,Chr. Walsh struck out swinging (1-2 FFFBS).,31,2025-05-09T00:00:00-04:00,"Plumeri Park (Williamsburg, VA)",589,MBA,2025
6304264,596631,Northeastern Huskies,596450,William & Mary Tribe,596631,5,top,Gerety grounded out to 2b (0-1 K).,32,2025-05-09T00:00:00-04:00,"Plumeri Park (Williamsburg, VA)",589,MBA,2025
6304264,596631,Northeastern Huskies,596450,William & Mary Tribe,596450,5,bot,L. Carmichae hit by pitch (3-0 BBB).,33,2025-05-09T00:00:00-04:00,"Plumeri Park (Williamsburg, VA)",589,MBA,2025
6304264,596631,Northeastern Huskies,596450,William & Mary Tribe,596450,5,bot,"C. Rush reached on a fielder's choice, bunt (3-1 BBBK)3a L. Carmichae out at second 2b to ss.",34,2025-05-09T00:00:00-04:00,"Plumeri Park (Williamsburg, VA)",589,MBA,2025
6304264,596631,Northeastern Huskies,596450,William & Mary Tribe,596450,5,bot,D. Holmes grounded out to 1b unassisted (0-1 K)3a C. Rush advanced to second.,35,2025-05-09T00:00:00-04:00,"Plumeri Park (Williamsburg, VA)",589,MBA,2025
6304264,596631,Northeastern Huskies,596450,William & Mary Tribe,596450,5,bot,A. Greco struck out swinging (2-2 BSKBS).,36,2025-05-09T00:00:00-04:00,"Plumeri Park (Williamsburg, VA)",589,MBA,2025
6304264,596631,Northeastern Huskies,596450,William & Mary Tribe,596631,6,top,J. Weight to p for N. Lottchea.,37,2025-05-09T00:00:00-04:00,"Plumeri Park (Williamsburg, VA)",589,MBA,2025
6304264,596631,Northeastern Huskies,596450,William & Mary Tribe,596631,6,top,Maldonado hit by pitch (1-1 FB).,38,2025-05-09T00:00:00-04:00,"Plumeri Park (Williamsburg, VA)",589,MBA,2025
6304264,596631,Northeastern Huskies,596450,William & Mary Tribe,596631,6,top,Maldonado advanced to second on a wild pitch.,39,2025-05-09T00:00:00-04:00,"Plumeri Park (Williamsburg, VA)",589,MBA,2025
6304264,596631,Northeastern Huskies,596450,William & Mary Tribe,596631,6,top,Maldonado advanced to third on a wild pitch.,40,2025-05-09T00:00:00-04:00,"Plumeri Park (Williamsburg, VA)",589,MBA,2025
6304264,596631,Northeastern Huskies,596450,William & Mary Tribe,596631,6,top,Feinberg struck out swinging (3-2 BBKBSFS).,41,2025-05-09T00:00:00-04:00,"Plumeri Park (Williamsburg, VA)",589,MBA,2025
6304264,596631,Northeastern Huskies,596450,William & Mary Tribe,596631,6,top,J. Goodman walked (3-2 BKSBBB).,42,2025-05-09T00:00:00-04:00,"Plumeri Park (Williamsburg, VA)",589,MBA,2025
6304264,596631,Northeastern Huskies,596450,William & Mary Tribe,596631,6,top,D. Lingle to p for J. Weight.,43,2025-05-09T00:00:00-04:00,"Plumeri Park (Williamsburg, VA)",589,MBA,2025
6304264,596631,Northeastern Huskies,596450,William & Mary Tribe,596631,6,top,Musacchia struck out looking (1-2 BFFK).,44,2025-05-09T00:00:00-04:00,"Plumeri Park (Williamsburg, VA)",589,MBA,2025
6304264,596631,Northeastern Huskies,596450,William & Mary Tribe,596631,6,top,J. Goodman stole second.,45,2025-05-09T00:00:00-04:00,"Plumeri Park (Williamsburg, VA)",589,MBA,2025
6304264,596631,Northeastern Huskies,596450,William & Mary Tribe,596631,6,top,Brinker fouled out to 3b (3-2 FBBKBFF).,46,2025-05-09T00:00:00-04:00,"Plumeri Park (Williamsburg, VA)",589,MBA,2025
6304264,596631,Northeastern Huskies,596450,William & Mary Tribe,596450,6,bot,J. Barnes struck out swinging (1-2 KBKS).,47,2025-05-09T00:00:00-04:00,"Plumeri Park (Williamsburg, VA)",589,MBA,2025
6304264,596631,Northeastern Huskies,596450,William & Mary Tribe,596450,6,bot,O. Wilson fouled out to 1b (0-2 KK).,48,2025-05-09T00:00:00-04:00,"Plumeri Park (Williamsburg, VA)",589,MBA,2025
6304264,596631,Northeastern Huskies,596450,William & Mary Tribe,596450,6,bot,B. Parker flied out to rf (1-1 FB).,49,2025-05-09T00:00:00-04:00,"Plumeri Park (Williamsburg, VA)",589,MBA,2025
6304264,596631,Northeastern Huskies,596450,William & Mary Tribe,596631,7,top,C. Lovasz to p for D. Lingle.,50,2025-05-09T00:00:00-04:00,"Plumeri Park (Williamsburg, VA)",589,MBA,2025
6304264,596631,Northeastern Huskies,596450,William & Mary Tribe,596631,7,top,A. Lane grounded out to 2b (3-1 BBFB).,51,2025-05-09T00:00:00-04:00,"Plumeri Park (Williamsburg, VA)",589,MBA,2025
6304264,596631,Northeastern Huskies,596450,William & Mary Tribe,596631,7,top,Fosberg struck out swinging (1-2 KSBS).,52,2025-05-09T00:00:00-04:00,"Plumeri Park (Williamsburg, VA)",589,MBA,2025
6304264,596631,Northeastern Huskies,596450,William & Mary Tribe,596631,7,top,Chr. Walsh walked (3-2 KBBKFBB).,53,2025-05-09T00:00:00-04:00,"Plumeri Park (Williamsburg, VA)",589,MBA,2025
6304264,596631,Northeastern Huskies,596450,William & Mary Tribe,596631,7,top,"Chr. Walsh out at first p to 1b, picked off.",54,2025-05-09T00:00:00-04:00,"Plumeri Park (Williamsburg, VA)",589,MBA,2025
6304264,596631,Northeastern Huskies,596450,William & Mary Tribe,596450,7,bot,J. Laskofski struck out swinging (0-2 SFS).,55,2025-05-09T00:00:00-04:00,"Plumeri Park (Williamsburg, VA)",589,MBA,2025
6304264,596631,Northeastern Huskies,596450,William & Mary Tribe,596450,7,bot,"H. Jackson struck out swinging, out at first c to 1b (0-2 KFS).",56,2025-05-09T00:00:00-04:00,"Plumeri Park (Williamsburg, VA)",589,MBA,2025
6304264,596631,Northeastern Huskies,596450,William & Mary Tribe,596450,7,bot,L. Carmichae singled to right field.,57,2025-05-09T00:00:00-04:00,"Plumeri Park (Williamsburg, VA)",589,MBA,2025
6304264,596631,Northeastern Huskies,596450,William & Mary Tribe,596450,7,bot,C. Walker to p for W. Jones.,58,2025-05-09T00:00:00-04:00,"Plumeri Park (Williamsburg, VA)",589,MBA,2025
6304264,596631,Northeastern Huskies,596450,William & Mary Tribe,596450,7,bot,C. Rush struck out swinging (2-2 FBKBS).,59,2025-05-09T00:00:00-04:00,"Plumeri Park (Williamsburg, VA)",589,MBA,2025
6304264,596631,Northeastern Huskies,596450,William & Mary Tribe,596631,8,top,Gerety struck out looking (0-2 FSK).,60,2025-05-09T00:00:00-04:00,"Plumeri Park (Williamsburg, VA)",589,MBA,2025
6304264,596631,Northeastern Huskies,596450,William & Mary Tribe,596631,8,top,Maldonado struck out looking (1-2 KKBK).,61,2025-05-09T00:00:00-04:00,"Plumeri Park (Williamsburg, VA)",589,MBA,2025
6304264,596631,Northeastern Huskies,596450,William & Mary Tribe,596631,8,top,Feinberg grounded out to 2b.,62,2025-05-09T00:00:00-04:00,"Plumeri Park (Williamsburg, VA)",589,MBA,2025
6304264,596631,Northeastern Huskies,596450,William & Mary Tribe,596450,8,bot,D. Holmes struck out swinging (0-2 SFS).,63,2025-05-09T00:00:00-04:00,"Plumeri Park (Williamsburg, VA)",589,MBA,2025
6304264,596631,Northeastern Huskies,596450,William & Mary Tribe,596450,8,bot,"A. Greco struck out swinging, out at first c to 1b (1-2 KKBS).",64,2025-05-09T00:00:00-04:00,"Plumeri Park (Williamsburg, VA)",589,MBA,2025
6304264,596631,Northeastern Huskies,596450,William & Mary Tribe,596450,8,bot,J. Barnes popped up to 2b (1-2 KKB).,65,2025-05-09T00:00:00-04:00,"Plumeri Park (Williamsburg, VA)",589,MBA,2025
6304264,596631,Northeastern Huskies,596450,William & Mary Tribe,596631,9,top,J. Goodman singled up the middle.,66,2025-05-09T00:00:00-04:00,"Plumeri Park (Williamsburg, VA)",589,MBA,2025
6304264,596631,Northeastern Huskies,596450,William & Mary Tribe,596631,9,top,Musacchia flied out to lf.,67,2025-05-09T00:00:00-04:00,"Plumeri Park (Williamsburg, VA)",589,MBA,2025
6304264,596631,Northeastern Huskies,596450,William & Mary Tribe,596631,9,top,"J. Goodman advanced to second on a wild pitch, advanced to third.",68,2025-05-09T00:00:00-04:00,"Plumeri Park (Williamsburg, VA)",589,MBA,2025
6304264,596631,Northeastern Huskies,596450,William & Mary Tribe,596631,9,top,Brinker struck out swinging (1-2 KKBS).,69,2025-05-09T00:00:00-04:00,"Plumeri Park (Williamsburg, VA)",589,MBA,2025
6304264,596631,Northeastern Huskies,596450,William & Mary Tribe,596631,9,top,"A. Lane singled through the left side, RBI (1-1 SB)3a J. Goodman scored.",70,2025-05-09T00:00:00-04:00,"Plumeri Park (Williamsburg, VA)",589,MBA,2025
6304264,596631,Northeastern Huskies,596450,William & Mary Tribe,596631,9,top,Fosberg walked (3-2 BBBKFB)3a A. Lane advanced to second.,71,2025-05-09T00:00:00-04:00,"Plumeri Park (Williamsburg, VA)",589,MBA,2025
6304264,596631,Northeastern Huskies,596450,William & Mary Tribe,596631,9,top,Chr. Walsh struck out looking (1-2 KKBFFK).,72,2025-05-09T00:00:00-04:00,"Plumeri Park (Williamsburg, VA)",589,MBA,2025
6304264,596631,Northeastern Huskies,596450,William & Mary Tribe,596450,9,bot,O. Wilson struck out swinging (0-2 KFS).,73,2025-05-09T00:00:00-04:00,"Plumeri Park (Williamsburg, VA)",589,MBA,2025
6304264,596631,Northeastern Huskies,596450,William & Mary Tribe,596450,9,bot,B. Parker grounded out to ss.,74,2025-05-09T00:00:00-04:00,"Plumeri Park (Williamsburg, VA)",589,MBA,2025
6304264,596631,Northeastern Huskies,596450,William & Mary Tribe,596450,9,bot,J. Laskofski singled to left field (3-2 BSBKB).,75,2025-05-09T00:00:00-04:00,"Plumeri Park (Williamsburg, VA)",589,MBA,2025
6304264,596631,Northeastern Huskies,596450,William & Mary Tribe,596450,9,bot,H. Jackson singled through the right side (1-2 BKS)3a J. Laskofski advanced to third.,76,2025-05-09T00:00:00-04:00,"Plumeri Park (Williamsburg, VA)",589,MBA,2025
6304264,596631,Northeastern Huskies,596450,William & Mary Tribe,596450,9,bot,H. Jackson stole second.,77,2025-05-09T00:00:00-04:00,"Plumeri Park (Williamsburg, VA)",589,MBA,2025
6304264,596631,Northeastern Huskies,596450,William & Mary Tribe,596450,9,bot,L. Carmichae intentionally walked (1-1 BK).,78,2025-05-09T00:00:00-04:00,"Plumeri Park (Williamsburg, VA)",589,MBA,2025
6304264,596631,Northeastern Huskies,596450,William & Mary Tribe,596450,9,bot,C. Iriotakis pinch hit for C. Rush.,79,2025-05-09T00:00:00-04:00,"Plumeri Park (Williamsburg, VA)",589,MBA,2025
6304264,596631,Northeastern Huskies,596450,William & Mary Tribe,596450,9,bot,C. Iriotakis flied out to rf (0-2 FFF).,80,2025-05-09T00:00:00-04:00,"Plumeri Park (Williamsburg, VA)",589,MBA,2025
