game_id,away_team_id,away_team_name,home_team_id,home_team_name,batting_team,inning,top_bot,event_text,event_num,game_datetime,stadium_name,attendance,sport_id,season
6307809,596668,Samford Bulldogs,596489,Auburn Tigers,596668,1,top,Ince walked (3-2).,1,2025-02-25T00:00:00-05:00,"Plainsman Park (Auburn, AL)",5262,MBA,2025
6307809,596668,Samford Bulldogs,596489,Auburn Tigers,596668,1,top,"Gandy reached on a fielder's choice, advanced to second (0-1); Ince advanced to second on an error by 3b, advanced to third.",2,2025-02-25T00:00:00-05:00,"Plainsman Park (Auburn, AL)",5262,MBA,2025
6307809,596668,Samford Bulldogs,596489,Auburn Tigers,596668,1,top,"Carr singled through the right side, 2 RBI (1-0); Gandy scored, unearned; Ince scored, unearned.",3,2025-02-25T00:00:00-05:00,"Plainsman Park (Auburn, AL)",5262,MBA,2025
6307809,596668,Samford Bulldogs,596489,Auburn Tigers,596668,1,top,Higgins reached on a fielder's choice (2-2); Carr out at second ss unassisted.,4,2025-02-25T00:00:00-05:00,"Plainsman Park (Auburn, AL)",5262,MBA,2025
6307809,596668,Samford Bulldogs,596489,Auburn Tigers,596668,1,top,Harris reached on a fielder's choice (1-1); Higgins out at second 3b to ss.,5,2025-02-25T00:00:00-05:00,"Plainsman Park (Auburn, AL)",5262,MBA,2025
6307809,596668,Samford Bulldogs,596489,Auburn Tigers,596668,1,top,Harris advanced to second on a wild pitch.,6,2025-02-25T00:00:00-05:00,"Plainsman Park (Auburn, AL)",5262,MBA,2025
6307809,596668,Samford Bulldogs,596489,Auburn Tigers,596668,1,top,Souders grounded out to ss (3-2).,7,2025-02-25T00:00:00-05:00,"Plainsman Park (Auburn, AL)",5262,MBA,2025
6307809,596668,Samford Bulldogs,596489,Auburn Tigers,596489,1,bot,"Snow, E. flied out to lf (1-1).",8,2025-02-25T00:00:00-05:00,"Plainsman Park (Auburn, AL)",5262,MBA,2025
6307809,596668,Samford Bulldogs,596489,Auburn Tigers,596489,1,bot,"Belyeu, C. popped up to 1b (1-0).",9,2025-02-25T00:00:00-05:00,"Plainsman Park (Auburn, AL)",5262,MBA,2025
6307809,596668,Samford Bulldogs,596489,Auburn Tigers,596489,1,bot,"Irish, I. grounded out to ss (0-1).",10,2025-02-25T00:00:00-05:00,"Plainsman Park (Auburn, AL)",5262,MBA,2025
6307809,596668,Samford Bulldogs,596489,Auburn Tigers,596668,2,top,McDonald hit by pitch (2-2).,11,2025-02-25T00:00:00-05:00,"Plainsman Park (Auburn, AL)",5262,MBA,2025
6307809,596668,Samford Bulldogs,596489,Auburn Tigers,596668,2,top,Perry struck out swinging (0-2).,12,2025-02-25T00:00:00-05:00,"Plainsman Park (Auburn, AL)",5262,MBA,2025
6307809,596668,Samford Bulldogs,596489,Auburn Tigers,596668,2,top,Gupton struck out looking (1-2).,13,2025-02-25T00:00:00-05:00,"Plainsman Park (Auburn, AL)",5262,MBA,2025
6307809,596668,Samford Bulldogs,596489,Auburn Tigers,596668,2,top,"McDonald out at second c to ss, caught stealing.",14,2025-02-25T00:00:00-05:00,"Plainsman Park (Auburn, AL)",5262,MBA,2025
6307809,596668,Samford Bulldogs,596489,Auburn Tigers,596489,2,bot,"McMurray, C. homered down the rf line, RBI (3-2).",15,2025-02-25T00:00:00-05:00,"Plainsman Park (Auburn, AL)",5262,MBA,2025
6307809,596668,Samford Bulldogs,596489,Auburn Tigers,596489,2,bot,"Fabian, D. flied out to lf (0-2).",16,2025-02-25T00:00:00-05:00,"Plainsman Park (Auburn, AL)",5262,MBA,2025
6307809,596668,Samford Bulldogs,596489,Auburn Tigers,596489,2,bot,"Terrell, B. walked (3-2).",17,2025-02-25T00:00:00-05:00,"Plainsman Park (Auburn, AL)",5262,MBA,2025
6307809,596668,Samford Bulldogs,596489,Auburn Tigers,596489,2,bot,"Fralick, C. doubled down the rf line (0-1); Terrell, B. advanced to third.",18,2025-02-25T00:00:00-05:00,"Plainsman Park (Auburn, AL)",5262,MBA,2025
6307809,596668,Samford Bulldogs,596489,Auburn Tigers,596489,2,bot,"Steele, L. singled to right center, RBI (1-0); Fralick, C. advanced to third; Terrell, B. scored.",19,2025-02-25T00:00:00-05:00,"Plainsman Park (Auburn, AL)",5262,MBA,2025
6307809,596668,Samford Bulldogs,596489,Auburn Tigers,596489,2,bot,"Rembert, C. homered to center field, 3 RBI (0-0); Steele, L. scored; Fralick, C. scored.",20,2025-02-25T00:00:00-05:00,"Plainsman Park (Auburn, AL)",5262,MBA,2025
6307809,596668,Samford Bulldogs,596489,Auburn Tigers,596489,2,bot,Steckmesser to p for Rice.,21,2025-02-25T00:00:00-05:00,"Plainsman Park (Auburn, AL)",5262,MBA,2025
6307809,596668,Samford Bulldogs,596489,Auburn Tigers,596489,2,bot,"Snow, E. singled through the right side (0-0).",22,2025-02-25T00:00:00-05:00,"Plainsman Park (Auburn, AL)",5262,MBA,2025
6307809,596668,Samford Bulldogs,596489,Auburn Tigers,596489,2,bot,"Belyeu, C. struck out swinging (1-2).",23,2025-02-25T00:00:00-05:00,"Plainsman Park (Auburn, AL)",5262,MBA,2025
6307809,596668,Samford Bulldogs,596489,Auburn Tigers,596489,2,bot,"Irish, I. struck out swinging (0-2).",24,2025-02-25T00:00:00-05:00,"Plainsman Park (Auburn, AL)",5262,MBA,2025
6307809,596668,Samford Bulldogs,596489,Auburn Tigers,596668,3,top,Ince grounded out to ss (2-2).,25,2025-02-25T00:00:00-05:00,"Plainsman Park (Auburn, AL)",5262,MBA,2025
6307809,596668,Samford Bulldogs,596489,Auburn Tigers,596668,3,top,"Gandy grounded out to p, bunt (1-0).",26,2025-02-25T00:00:00-05:00,"Plainsman Park (Auburn, AL)",5262,MBA,2025
6307809,596668,Samford Bulldogs,596489,Auburn Tigers,596668,3,top,"Carr struck out swinging, out at first c to 1b (1-2).",27,2025-02-25T00:00:00-05:00,"Plainsman Park (Auburn, AL)",5262,MBA,2025
6307809,596668,Samford Bulldogs,596489,Auburn Tigers,596489,3,bot,"McMurray, C. grounded out to c, bunt (0-0).",28,2025-02-25T00:00:00-05:00,"Plainsman Park (Auburn, AL)",5262,MBA,2025
6307809,596668,Samford Bulldogs,596489,Auburn Tigers,596489,3,bot,"Fabian, D. singled through the right side (1-1).",29,2025-02-25T00:00:00-05:00,"Plainsman Park (Auburn, AL)",5262,MBA,2025
6307809,596668,Samford Bulldogs,596489,Auburn Tigers,596489,3,bot,"Terrell, B. homered to right field, 2 RBI (0-0); Fabian, D. scored.",30,2025-02-25T00:00:00-05:00,"Plainsman Park (Auburn, AL)",5262,MBA,2025
6307809,596668,Samford Bulldogs,596489,Auburn Tigers,596489,3,bot,"Fralick, C. struck out swinging (1-2).",31,2025-02-25T00:00:00-05:00,"Plainsman Park (Auburn, AL)",5262,MBA,2025
6307809,596668,Samford Bulldogs,596489,Auburn Tigers,596489,3,bot,"Steele, L. hit by pitch (1-0).",32,2025-02-25T00:00:00-05:00,"Plainsman Park (Auburn, AL)",5262,MBA,2025
6307809,596668,Samford Bulldogs,596489,Auburn Tigers,596489,3,bot,"Rembert, C. lined out to rf (0-1).",33,2025-02-25T00:00:00-05:00,"Plainsman Park (Auburn, AL)",5262,MBA,2025
6307809,596668,Samford Bulldogs,596489,Auburn Tigers,596668,4,top,Higgins doubled to left center (1-2).,34,2025-02-25T00:00:00-05:00,"Plainsman Park (Auburn, AL)",5262,MBA,2025
6307809,596668,Samford Bulldogs,596489,Auburn Tigers,596668,4,top,Higgins advanced to third on a wild pitch.,35,2025-02-25T00:00:00-05:00,"Plainsman Park (Auburn, AL)",5262,MBA,2025
6307809,596668,Samford Bulldogs,596489,Auburn Tigers,596668,4,top,"Harris singled to shortstop, RBI (1-1); Higgins scored.",36,2025-02-25T00:00:00-05:00,"Plainsman Park (Auburn, AL)",5262,MBA,2025
6307809,596668,Samford Bulldogs,596489,Auburn Tigers,596668,4,top,Souders grounded out to 3b (2-2); Harris advanced to second.,37,2025-02-25T00:00:00-05:00,"Plainsman Park (Auburn, AL)",5262,MBA,2025
6307809,596668,Samford Bulldogs,596489,Auburn Tigers,596668,4,top,"McDonald singled to right field, advanced to second on the throw (3-2); Harris advanced to third.",38,2025-02-25T00:00:00-05:00,"Plainsman Park (Auburn, AL)",5262,MBA,2025
6307809,596668,Samford Bulldogs,596489,Auburn Tigers,596668,4,top,"Armstrong, J to p for Alvarez, A..",39,2025-02-25T00:00:00-05:00,"Plainsman Park (Auburn, AL)",5262,MBA,2025
6307809,596668,Samford Bulldogs,596489,Auburn Tigers,596668,4,top,"Perry singled through the right side, 2 RBI (1-0); McDonald scored; Harris scored.",40,2025-02-25T00:00:00-05:00,"Plainsman Park (Auburn, AL)",5262,MBA,2025
6307809,596668,Samford Bulldogs,596489,Auburn Tigers,596668,4,top,Gupton singled up the middle (0-1); Perry advanced to second.,41,2025-02-25T00:00:00-05:00,"Plainsman Park (Auburn, AL)",5262,MBA,2025
6307809,596668,Samford Bulldogs,596489,Auburn Tigers,596668,4,top,Ince grounded out to 2b (1-2); Gupton advanced to second; Perry advanced to third.,42,2025-02-25T00:00:00-05:00,"Plainsman Park (Auburn, AL)",5262,MBA,2025
6307809,596668,Samford Bulldogs,596489,Auburn Tigers,596668,4,top,Gandy hit by pitch (1-0).,43,2025-02-25T00:00:00-05:00,"Plainsman Park (Auburn, AL)",5262,MBA,2025
6307809,596668,Samford Bulldogs,596489,Auburn Tigers,596668,4,top,"Carr doubled down the rf line, 2 RBI (0-0); Gandy advanced to third; Gupton scored; Perry scored.",44,2025-02-25T00:00:00-05:00,"Plainsman Park (Auburn, AL)",5262,MBA,2025
6307809,596668,Samford Bulldogs,596489,Auburn Tigers,596668,4,top,"Carlson, P. to p for Armstrong, J.",45,2025-02-25T00:00:00-05:00,"Plainsman Park (Auburn, AL)",5262,MBA,2025
6307809,596668,Samford Bulldogs,596489,Auburn Tigers,596668,4,top,Higgins struck out swinging (1-2).,46,2025-02-25T00:00:00-05:00,"Plainsman Park (Auburn, AL)",5262,MBA,2025
6307809,596668,Samford Bulldogs,596489,Auburn Tigers,596489,4,bot,Horowicz to p for Steckmesser.,47,2025-02-25T00:00:00-05:00,"Plainsman Park (Auburn, AL)",5262,MBA,2025
6307809,596668,Samford Bulldogs,596489,Auburn Tigers,596489,4,bot,"Snow, E. homered to right center, RBI (1-2).",48,2025-02-25T00:00:00-05:00,"Plainsman Park (Auburn, AL)",5262,MBA,2025
6307809,596668,Samford Bulldogs,596489,Auburn Tigers,596489,4,bot,"Belyeu, C. hit by pitch (1-2).",49,2025-02-25T00:00:00-05:00,"Plainsman Park (Auburn, AL)",5262,MBA,2025
6307809,596668,Samford Bulldogs,596489,Auburn Tigers,596489,4,bot,"Irish, I. reached on a fielder's choice (0-2); Belyeu, C. out at second 3b to 2b.",50,2025-02-25T00:00:00-05:00,"Plainsman Park (Auburn, AL)",5262,MBA,2025
6307809,596668,Samford Bulldogs,596489,Auburn Tigers,596489,4,bot,"McMurray, C. walked (3-2); Irish, I. advanced to second.",51,2025-02-25T00:00:00-05:00,"Plainsman Park (Auburn, AL)",5262,MBA,2025
6307809,596668,Samford Bulldogs,596489,Auburn Tigers,596489,4,bot,Tommasini to p for Horowicz.,52,2025-02-25T00:00:00-05:00,"Plainsman Park (Auburn, AL)",5262,MBA,2025
6307809,596668,Samford Bulldogs,596489,Auburn Tigers,596489,4,bot,"Fabian, D. grounded into double play 3b to 2b to 1b (2-0); McMurray, C. out on the play.",53,2025-02-25T00:00:00-05:00,"Plainsman Park (Auburn, AL)",5262,MBA,2025
6307809,596668,Samford Bulldogs,596489,Auburn Tigers,596668,5,top,Harris singled up the middle (1-2).,54,2025-02-25T00:00:00-05:00,"Plainsman Park (Auburn, AL)",5262,MBA,2025
6307809,596668,Samford Bulldogs,596489,Auburn Tigers,596668,5,top,Souders struck out swinging (0-2).,55,2025-02-25T00:00:00-05:00,"Plainsman Park (Auburn, AL)",5262,MBA,2025
6307809,596668,Samford Bulldogs,596489,Auburn Tigers,596668,5,top,McDonald grounded out to ss (0-0); Harris advanced to second.,56,2025-02-25T00:00:00-05:00,"Plainsman Park (Auburn, AL)",5262,MBA,2025
6307809,596668,Samford Bulldogs,596489,Auburn Tigers,596668,5,top,Perry grounded out to 2b (0-0).,57,2025-02-25T00:00:00-05:00,"Plainsman Park (Auburn, AL)",5262,MBA,2025
6307809,596668,Samford Bulldogs,596489,Auburn Tigers,596489,5,bot,"Terrell, B. lined out to lf (1-2).",58,2025-02-25T00:00:00-05:00,"Plainsman Park (Auburn, AL)",5262,MBA,2025
6307809,596668,Samford Bulldogs,596489,Auburn Tigers,596489,5,bot,"Fralick, C. walked (3-1).",59,2025-02-25T00:00:00-05:00,"Plainsman Park (Auburn, AL)",5262,MBA,2025
6307809,596668,Samford Bulldogs,596489,Auburn Tigers,596489,5,bot,"Steele, L. singled to left field (3-2); Fralick, C. advanced to second.",60,2025-02-25T00:00:00-05:00,"Plainsman Park (Auburn, AL)",5262,MBA,2025
6307809,596668,Samford Bulldogs,596489,Auburn Tigers,596489,5,bot,"Rembert, C. doubled down the lf line, RBI (0-2); Steele, L. advanced to third; Fralick, C. scored.",61,2025-02-25T00:00:00-05:00,"Plainsman Park (Auburn, AL)",5262,MBA,2025
6307809,596668,Samford Bulldogs,596489,Auburn Tigers,596489,5,bot,Lee to p for Tommasini.,62,2025-02-25T00:00:00-05:00,"Plainsman Park (Auburn, AL)",5262,MBA,2025
6307809,596668,Samford Bulldogs,596489,Auburn Tigers,596489,5,bot,"Snow, E. doubled to left center, 2 RBI (0-1); Rembert, C. scored; Steele, L. scored.",63,2025-02-25T00:00:00-05:00,"Plainsman Park (Auburn, AL)",5262,MBA,2025
6307809,596668,Samford Bulldogs,596489,Auburn Tigers,596489,5,bot,"Belyeu, C. doubled down the lf line (3-2); Snow, E. advanced to third.",64,2025-02-25T00:00:00-05:00,"Plainsman Park (Auburn, AL)",5262,MBA,2025
6307809,596668,Samford Bulldogs,596489,Auburn Tigers,596489,5,bot,"Irish, I. grounded out to 1b unassisted, RBI (2-0); Belyeu, C. advanced to third; Snow, E. scored.",65,2025-02-25T00:00:00-05:00,"Plainsman Park (Auburn, AL)",5262,MBA,2025
6307809,596668,Samford Bulldogs,596489,Auburn Tigers,596489,5,bot,"McMurray, C. lined out to ss (1-2).",66,2025-02-25T00:00:00-05:00,"Plainsman Park (Auburn, AL)",5262,MBA,2025
6307809,596668,Samford Bulldogs,596489,Auburn Tigers,596668,6,top,Gupton lined out to ss (0-1).,67,2025-02-25T00:00:00-05:00,"Plainsman Park (Auburn, AL)",5262,MBA,2025
6307809,596668,Samford Bulldogs,596489,Auburn Tigers,596668,6,top,Ince struck out swinging (2-2).,68,2025-02-25T00:00:00-05:00,"Plainsman Park (Auburn, AL)",5262,MBA,2025
6307809,596668,Samford Bulldogs,596489,Auburn Tigers,596668,6,top,Gandy grounded out to 2b (0-0).,69,2025-02-25T00:00:00-05:00,"Plainsman Park (Auburn, AL)",5262,MBA,2025
6307809,596668,Samford Bulldogs,596489,Auburn Tigers,596489,6,bot,Whitney to p for Lee.,70,2025-02-25T00:00:00-05:00,"Plainsman Park (Auburn, AL)",5262,MBA,2025
6307809,596668,Samford Bulldogs,596489,Auburn Tigers,596489,6,bot,"Fabian, D. walked (3-2).",71,2025-02-25T00:00:00-05:00,"Plainsman Park (Auburn, AL)",5262,MBA,2025
6307809,596668,Samford Bulldogs,596489,Auburn Tigers,596489,6,bot,"Terrell, B. hit by pitch (0-1); Fabian, D. advanced to second.",72,2025-02-25T00:00:00-05:00,"Plainsman Park (Auburn, AL)",5262,MBA,2025
6307809,596668,Samford Bulldogs,596489,Auburn Tigers,596489,6,bot,"Fralick, C. walked (3-1); Terrell, B. advanced to second; Fabian, D. advanced to third.",73,2025-02-25T00:00:00-05:00,"Plainsman Park (Auburn, AL)",5262,MBA,2025
6307809,596668,Samford Bulldogs,596489,Auburn Tigers,596489,6,bot,Blasche to p for Whitney.,74,2025-02-25T00:00:00-05:00,"Plainsman Park (Auburn, AL)",5262,MBA,2025
6307809,596668,Samford Bulldogs,596489,Auburn Tigers,596489,6,bot,"Steele, L. reached on a fielder's choice, RBI (2-1); Fralick, C. advanced to second; Terrell, B. out at third 3b unassisted; Fabian, D. scored.",75,2025-02-25T00:00:00-05:00,"Plainsman Park (Auburn, AL)",5262,MBA,2025
6307809,596668,Samford Bulldogs,596489,Auburn Tigers,596489,6,bot,"Rembert, C. walked (3-2); Steele, L. advanced to second; Fralick, C. advanced to third.",76,2025-02-25T00:00:00-05:00,"Plainsman Park (Auburn, AL)",5262,MBA,2025
6307809,596668,Samford Bulldogs,596489,Auburn Tigers,596489,6,bot,"Snow, E. grounded into double play ss to 2b to 1b (1-1); Rembert, C. out on the play.",77,2025-02-25T00:00:00-05:00,"Plainsman Park (Auburn, AL)",5262,MBA,2025
6307809,596668,Samford Bulldogs,596489,Auburn Tigers,596668,7,top,Carr grounded out to ss (1-2).,78,2025-02-25T00:00:00-05:00,"Plainsman Park (Auburn, AL)",5262,MBA,2025
6307809,596668,Samford Bulldogs,596489,Auburn Tigers,596668,7,top,Higgins singled to center field (2-2).,79,2025-02-25T00:00:00-05:00,"Plainsman Park (Auburn, AL)",5262,MBA,2025
6307809,596668,Samford Bulldogs,596489,Auburn Tigers,596668,7,top,"Sanders, J. to p for Carlson, P..",80,2025-02-25T00:00:00-05:00,"Plainsman Park (Auburn, AL)",5262,MBA,2025
6307809,596668,Samford Bulldogs,596489,Auburn Tigers,596668,7,top,Harris grounded out to ss (0-0); Higgins advanced to second.,81,2025-02-25T00:00:00-05:00,"Plainsman Park (Auburn, AL)",5262,MBA,2025
6307809,596668,Samford Bulldogs,596489,Auburn Tigers,596668,7,top,"Souders doubled to center field, RBI (0-0); Higgins scored.",82,2025-02-25T00:00:00-05:00,"Plainsman Park (Auburn, AL)",5262,MBA,2025
6307809,596668,Samford Bulldogs,596489,Auburn Tigers,596668,7,top,Souders stole third.,83,2025-02-25T00:00:00-05:00,"Plainsman Park (Auburn, AL)",5262,MBA,2025
6307809,596668,Samford Bulldogs,596489,Auburn Tigers,596668,7,top,McDonald grounded out to p (3-2).,84,2025-02-25T00:00:00-05:00,"Plainsman Park (Auburn, AL)",5262,MBA,2025
6307809,596668,Samford Bulldogs,596489,Auburn Tigers,596489,7,bot,Sanders to p for Blasche.,85,2025-02-25T00:00:00-05:00,"Plainsman Park (Auburn, AL)",5262,MBA,2025
6307809,596668,Samford Bulldogs,596489,Auburn Tigers,596489,7,bot,"Belyeu, C. walked (3-0).",86,2025-02-25T00:00:00-05:00,"Plainsman Park (Auburn, AL)",5262,MBA,2025
6307809,596668,Samford Bulldogs,596489,Auburn Tigers,596489,7,bot,"Irish, I. struck out swinging (0-2).",87,2025-02-25T00:00:00-05:00,"Plainsman Park (Auburn, AL)",5262,MBA,2025
6307809,596668,Samford Bulldogs,596489,Auburn Tigers,596489,7,bot,"McMurray, C. doubled to left field (1-1); Belyeu, C. advanced to third.",88,2025-02-25T00:00:00-05:00,"Plainsman Park (Auburn, AL)",5262,MBA,2025
6307809,596668,Samford Bulldogs,596489,Auburn Tigers,596489,7,bot,"McMurray, C. advanced to third on a wild pitch; Belyeu, C. scored on a wild pitch.",89,2025-02-25T00:00:00-05:00,"Plainsman Park (Auburn, AL)",5262,MBA,2025
6307809,596668,Samford Bulldogs,596489,Auburn Tigers,596489,7,bot,"Dropped foul ball, E3.",90,2025-02-25T00:00:00-05:00,"Plainsman Park (Auburn, AL)",5262,MBA,2025
6307809,596668,Samford Bulldogs,596489,Auburn Tigers,596489,7,bot,"Fabian, D. flied out to lf to left center, SF, RBI (2-2); McMurray, C. scored, unearned.",91,2025-02-25T00:00:00-05:00,"Plainsman Park (Auburn, AL)",5262,MBA,2025
6307809,596668,Samford Bulldogs,596489,Auburn Tigers,596489,7,bot,"Terrell, B. struck out swinging (1-2).",92,2025-02-25T00:00:00-05:00,"Plainsman Park (Auburn, AL)",5262,MBA,2025
6307809,596668,Samford Bulldogs,596489,Auburn Tigers,596668,8,top,"Watts, D. to p for Sanders, J..",93,2025-02-25T00:00:00-05:00,"Plainsman Park (Auburn, AL)",5262,MBA,2025
6307809,596668,Samford Bulldogs,596489,Auburn Tigers,596668,8,top,Perry struck out swinging (1-2).,94,2025-02-25T00:00:00-05:00,"Plainsman Park (Auburn, AL)",5262,MBA,2025
6307809,596668,Samford Bulldogs,596489,Auburn Tigers,596668,8,top,Gupton struck out swinging (0-2).,95,2025-02-25T00:00:00-05:00,"Plainsman Park (Auburn, AL)",5262,MBA,2025
6307809,596668,Samford Bulldogs,596489,Auburn Tigers,596668,8,top,Ince grounded out to ss (0-2).,96,2025-02-25T00:00:00-05:00,"Plainsman Park (Auburn, AL)",5262,MBA,2025
6307809,596668,Samford Bulldogs,596489,Auburn Tigers,596489,8,bot,Druckenmille to p for Sanders.,97,2025-02-25T00:00:00-05:00,"Plainsman Park (Auburn, AL)",5262,MBA,2025
6307809,596668,Samford Bulldogs,596489,Auburn Tigers,596489,8,bot,"Fralick, C. walked (3-1).",98,2025-02-25T00:00:00-05:00,"Plainsman Park (Auburn, AL)",5262,MBA,2025
6307809,596668,Samford Bulldogs,596489,Auburn Tigers,596489,8,bot,"Steele, L. grounded out to 2b (2-0); Fralick, C. advanced to second.",99,2025-02-25T00:00:00-05:00,"Plainsman Park (Auburn, AL)",5262,MBA,2025
6307809,596668,Samford Bulldogs,596489,Auburn Tigers,596489,8,bot,"Rembert, C. struck out swinging (1-2).",100,2025-02-25T00:00:00-05:00,"Plainsman Park (Auburn, AL)",5262,MBA,2025
6307809,596668,Samford Bulldogs,596489,Auburn Tigers,596489,8,bot,"Snow, E. grounded out to ss (2-1).",101,2025-02-25T00:00:00-05:00,"Plainsman Park (Auburn, AL)",5262,MBA,2025
6307809,596668,Samford Bulldogs,596489,Auburn Tigers,596668,9,top,Pitts pinch hit for Gandy.,102,2025-02-25T00:00:00-05:00,"Plainsman Park (Auburn, AL)",5262,MBA,2025
6307809,596668,Samford Bulldogs,596489,Auburn Tigers,596668,9,top,Pitts singled up the middle (1-1).,103,2025-02-25T00:00:00-05:00,"Plainsman Park (Auburn, AL)",5262,MBA,2025
6307809,596668,Samford Bulldogs,596489,Auburn Tigers,596668,9,top,Bozeman pinch hit for Carr.,104,2025-02-25T00:00:00-05:00,"Plainsman Park (Auburn, AL)",5262,MBA,2025
6307809,596668,Samford Bulldogs,596489,Auburn Tigers,596668,9,top,Pitts advanced to second on a wild pitch.,105,2025-02-25T00:00:00-05:00,"Plainsman Park (Auburn, AL)",5262,MBA,2025
6307809,596668,Samford Bulldogs,596489,Auburn Tigers,596668,9,top,Bozeman struck out swinging (1-2).,106,2025-02-25T00:00:00-05:00,"Plainsman Park (Auburn, AL)",5262,MBA,2025
6307809,596668,Samford Bulldogs,596489,Auburn Tigers,596668,9,top,Truett pinch hit for Higgins.,107,2025-02-25T00:00:00-05:00,"Plainsman Park (Auburn, AL)",5262,MBA,2025
6307809,596668,Samford Bulldogs,596489,Auburn Tigers,596668,9,top,Truett struck out swinging (0-2).,108,2025-02-25T00:00:00-05:00,"Plainsman Park (Auburn, AL)",5262,MBA,2025
6307809,596668,Samford Bulldogs,596489,Auburn Tigers,596668,9,top,Prieto pinch hit for Harris.,109,2025-02-25T00:00:00-05:00,"Plainsman Park (Auburn, AL)",5262,MBA,2025
6307809,596668,Samford Bulldogs,596489,Auburn Tigers,596668,9,top,Pitts advanced to third on a balk.,110,2025-02-25T00:00:00-05:00,"Plainsman Park (Auburn, AL)",5262,MBA,2025
6307809,596668,Samford Bulldogs,596489,Auburn Tigers,596668,9,top,Prieto struck out swinging (1-2).,111,2025-02-25T00:00:00-05:00,"Plainsman Park (Auburn, AL)",5262,MBA,2025
