game_id,away_team_id,away_team_name,home_team_id,home_team_name,batting_team,inning,top_bot,event_text,event_num,game_datetime,stadium_name,attendance,sport_id,season
6308051,596706,Arizona Wildcats,596657,Rice Owls,596706,1,top,Summerhill tripled to right center (2-2).,1,2025-02-26T00:00:00-05:00,"Reckling Park (Houston, TX)",1660,MBA,2025
6308051,596706,Arizona Wildcats,596657,Rice Owls,596706,1,top,"Walton, A. singled to second base, RBI (0-1); Summerhill scored.",2,2025-02-26T00:00:00-05:00,"Reckling Park (Houston, TX)",1660,MBA,2025
6308051,596706,Arizona Wildcats,596657,Rice Owls,596706,1,top,"Walton, A. advanced to second on an error by p, out at third 2b to 3b.",3,2025-02-26T00:00:00-05:00,"Reckling Park (Houston, TX)",1660,MBA,2025
6308051,596706,Arizona Wildcats,596657,Rice Owls,596706,1,top,"White, M. struck out swinging (3-2).",4,2025-02-26T00:00:00-05:00,"Reckling Park (Houston, TX)",1660,MBA,2025
6308051,596706,Arizona Wildcats,596657,Rice Owls,596706,1,top,"Caulfield, G grounded out to 3b (1-1).",5,2025-02-26T00:00:00-05:00,"Reckling Park (Houston, TX)",1660,MBA,2025
6308051,596706,Arizona Wildcats,596657,Rice Owls,596657,1,bot,Rank struck out swinging (2-2).,6,2025-02-26T00:00:00-05:00,"Reckling Park (Houston, TX)",1660,MBA,2025
6308051,596706,Arizona Wildcats,596657,Rice Owls,596657,1,bot,Motley singled to center field (0-0).,7,2025-02-26T00:00:00-05:00,"Reckling Park (Houston, TX)",1660,MBA,2025
6308051,596706,Arizona Wildcats,596657,Rice Owls,596657,1,bot,"West, L flied out to rf (1-2).",8,2025-02-26T00:00:00-05:00,"Reckling Park (Houston, TX)",1660,MBA,2025
6308051,596706,Arizona Wildcats,596657,Rice Owls,596657,1,bot,Brown struck out swinging (1-2).,9,2025-02-26T00:00:00-05:00,"Reckling Park (Houston, TX)",1660,MBA,2025
6308051,596706,Arizona Wildcats,596657,Rice Owls,596706,2,top,"Mihalakis, M doubled to right center (3-2).",10,2025-02-26T00:00:00-05:00,"Reckling Park (Houston, TX)",1660,MBA,2025
6308051,596706,Arizona Wildcats,596657,Rice Owls,596706,2,top,"Mihalakis, M advanced to third on a wild pitch.",11,2025-02-26T00:00:00-05:00,"Reckling Park (Houston, TX)",1660,MBA,2025
6308051,596706,Arizona Wildcats,596657,Rice Owls,596706,2,top,"Cain, A. lined out to 1b (1-1).",12,2025-02-26T00:00:00-05:00,"Reckling Park (Houston, TX)",1660,MBA,2025
6308051,596706,Arizona Wildcats,596657,Rice Owls,596706,2,top,"Guzman, A. homered down the rf line, 2 RBI (1-1); Mihalakis, M scored.",13,2025-02-26T00:00:00-05:00,"Reckling Park (Houston, TX)",1660,MBA,2025
6308051,596706,Arizona Wildcats,596657,Rice Owls,596706,2,top,"Breyfogle, E grounded out to 2b (2-2).",14,2025-02-26T00:00:00-05:00,"Reckling Park (Houston, TX)",1660,MBA,2025
6308051,596706,Arizona Wildcats,596657,Rice Owls,596706,2,top,"Morales, R. struck out swinging (3-2).",15,2025-02-26T00:00:00-05:00,"Reckling Park (Houston, TX)",1660,MBA,2025
6308051,596706,Arizona Wildcats,596657,Rice Owls,596657,2,bot,"Elarton, K. to p for Berg, J..",16,2025-02-26T00:00:00-05:00,"Reckling Park (Houston, TX)",1660,MBA,2025
6308051,596706,Arizona Wildcats,596657,Rice Owls,596657,2,bot,Eldridge doubled to left center (0-0).,17,2025-02-26T00:00:00-05:00,"Reckling Park (Houston, TX)",1660,MBA,2025
6308051,596706,Arizona Wildcats,596657,Rice Owls,596657,2,bot,"Carlson singled to right field, RBI (0-0); Eldridge scored.",18,2025-02-26T00:00:00-05:00,"Reckling Park (Houston, TX)",1660,MBA,2025
6308051,596706,Arizona Wildcats,596657,Rice Owls,596657,2,bot,Duffield struck out swinging (0-2).,19,2025-02-26T00:00:00-05:00,"Reckling Park (Houston, TX)",1660,MBA,2025
6308051,596706,Arizona Wildcats,596657,Rice Owls,596657,2,bot,Carlson advanced to second on a wild pitch.,20,2025-02-26T00:00:00-05:00,"Reckling Park (Houston, TX)",1660,MBA,2025
6308051,596706,Arizona Wildcats,596657,Rice Owls,596657,2,bot,Zito grounded out to ss (2-1).,21,2025-02-26T00:00:00-05:00,"Reckling Park (Houston, TX)",1660,MBA,2025
6308051,596706,Arizona Wildcats,596657,Rice Owls,596657,2,bot,Bocachica grounded out to 2b (0-0).,22,2025-02-26T00:00:00-05:00,"Reckling Park (Houston, TX)",1660,MBA,2025
6308051,596706,Arizona Wildcats,596657,Rice Owls,596706,3,top,Alch to p for Keo.,23,2025-02-26T00:00:00-05:00,"Reckling Park (Houston, TX)",1660,MBA,2025
6308051,596706,Arizona Wildcats,596657,Rice Owls,596706,3,top,Summerhill grounded out to 2b (2-1).,24,2025-02-26T00:00:00-05:00,"Reckling Park (Houston, TX)",1660,MBA,2025
6308051,596706,Arizona Wildcats,596657,Rice Owls,596706,3,top,"Walton, A. doubled down the lf line (1-1).",25,2025-02-26T00:00:00-05:00,"Reckling Park (Houston, TX)",1660,MBA,2025
6308051,596706,Arizona Wildcats,596657,Rice Owls,596706,3,top,"White, M. out at first 1b to p (3-2); Walton, A. advanced to third.",26,2025-02-26T00:00:00-05:00,"Reckling Park (Houston, TX)",1660,MBA,2025
6308051,596706,Arizona Wildcats,596657,Rice Owls,596706,3,top,"Caulfield, G doubled down the rf line, RBI (0-2); Walton, A. scored.",27,2025-02-26T00:00:00-05:00,"Reckling Park (Houston, TX)",1660,MBA,2025
6308051,596706,Arizona Wildcats,596657,Rice Owls,596706,3,top,"Mihalakis, M struck out swinging (2-2).",28,2025-02-26T00:00:00-05:00,"Reckling Park (Houston, TX)",1660,MBA,2025
6308051,596706,Arizona Wildcats,596657,Rice Owls,596657,3,bot,Rank grounded out to 3b (0-1).,29,2025-02-26T00:00:00-05:00,"Reckling Park (Houston, TX)",1660,MBA,2025
6308051,596706,Arizona Wildcats,596657,Rice Owls,596657,3,bot,Motley singled to shortstop (1-2).,30,2025-02-26T00:00:00-05:00,"Reckling Park (Houston, TX)",1660,MBA,2025
6308051,596706,Arizona Wildcats,596657,Rice Owls,596657,3,bot,"West, L hit by pitch (0-1); Motley advanced to second.",31,2025-02-26T00:00:00-05:00,"Reckling Park (Houston, TX)",1660,MBA,2025
6308051,596706,Arizona Wildcats,596657,Rice Owls,596657,3,bot,"Brown reached on a fielder's choice (0-2); West, L out at second 2b to ss.",32,2025-02-26T00:00:00-05:00,"Reckling Park (Houston, TX)",1660,MBA,2025
6308051,596706,Arizona Wildcats,596657,Rice Owls,596657,3,bot,"Eldridge homered to left field, 3 RBI (0-1); Brown scored; Motley scored.",33,2025-02-26T00:00:00-05:00,"Reckling Park (Houston, TX)",1660,MBA,2025
6308051,596706,Arizona Wildcats,596657,Rice Owls,596657,3,bot,Carlson lined out to rf (1-0).,34,2025-02-26T00:00:00-05:00,"Reckling Park (Houston, TX)",1660,MBA,2025
6308051,596706,Arizona Wildcats,596657,Rice Owls,596706,4,top,"Cain, A. grounded out to ss (3-1).",35,2025-02-26T00:00:00-05:00,"Reckling Park (Houston, TX)",1660,MBA,2025
6308051,596706,Arizona Wildcats,596657,Rice Owls,596706,4,top,"Guzman, A. grounded out to 3b (0-1).",36,2025-02-26T00:00:00-05:00,"Reckling Park (Houston, TX)",1660,MBA,2025
6308051,596706,Arizona Wildcats,596657,Rice Owls,596706,4,top,"Breyfogle, E reached on an error by 2b (3-2).",37,2025-02-26T00:00:00-05:00,"Reckling Park (Houston, TX)",1660,MBA,2025
6308051,596706,Arizona Wildcats,596657,Rice Owls,596706,4,top,"Breyfogle, E out at second c to 2b, caught stealing.",38,2025-02-26T00:00:00-05:00,"Reckling Park (Houston, TX)",1660,MBA,2025
6308051,596706,Arizona Wildcats,596657,Rice Owls,596657,4,bot,Duffield singled to left center (1-2).,39,2025-02-26T00:00:00-05:00,"Reckling Park (Houston, TX)",1660,MBA,2025
6308051,596706,Arizona Wildcats,596657,Rice Owls,596657,4,bot,"Duffield out at second c to 2b, caught stealing.",40,2025-02-26T00:00:00-05:00,"Reckling Park (Houston, TX)",1660,MBA,2025
6308051,596706,Arizona Wildcats,596657,Rice Owls,596657,4,bot,Zito singled to left field (0-2).,41,2025-02-26T00:00:00-05:00,"Reckling Park (Houston, TX)",1660,MBA,2025
6308051,596706,Arizona Wildcats,596657,Rice Owls,596657,4,bot,Bocachica walked (3-2); Zito advanced to second.,42,2025-02-26T00:00:00-05:00,"Reckling Park (Houston, TX)",1660,MBA,2025
6308051,596706,Arizona Wildcats,596657,Rice Owls,596657,4,bot,"Pluta, T. to p for Elarton, K..",43,2025-02-26T00:00:00-05:00,"Reckling Park (Houston, TX)",1660,MBA,2025
6308051,596706,Arizona Wildcats,596657,Rice Owls,596657,4,bot,Rank flied out to cf (0-0); Zito advanced to third.,44,2025-02-26T00:00:00-05:00,"Reckling Park (Houston, TX)",1660,MBA,2025
6308051,596706,Arizona Wildcats,596657,Rice Owls,596657,4,bot,"Motley singled to right field, RBI (0-0); Bocachica advanced to third; Zito scored.",45,2025-02-26T00:00:00-05:00,"Reckling Park (Houston, TX)",1660,MBA,2025
6308051,596706,Arizona Wildcats,596657,Rice Owls,596657,4,bot,"West, L grounded out to ss.",46,2025-02-26T00:00:00-05:00,"Reckling Park (Houston, TX)",1660,MBA,2025
6308051,596706,Arizona Wildcats,596657,Rice Owls,596706,5,top,"Morales, R. grounded out to 1b unassisted (0-0).",47,2025-02-26T00:00:00-05:00,"Reckling Park (Houston, TX)",1660,MBA,2025
6308051,596706,Arizona Wildcats,596657,Rice Owls,596706,5,top,Summerhill singled to center field (1-2).,48,2025-02-26T00:00:00-05:00,"Reckling Park (Houston, TX)",1660,MBA,2025
6308051,596706,Arizona Wildcats,596657,Rice Owls,596706,5,top,"Walton, A. hit by pitch (0-1); Summerhill advanced to second.",49,2025-02-26T00:00:00-05:00,"Reckling Park (Houston, TX)",1660,MBA,2025
6308051,596706,Arizona Wildcats,596657,Rice Owls,596706,5,top,"White, M. flied out to cf (1-1); Walton, A. advanced to second; Summerhill advanced to third.",50,2025-02-26T00:00:00-05:00,"Reckling Park (Houston, TX)",1660,MBA,2025
6308051,596706,Arizona Wildcats,596657,Rice Owls,596706,5,top,"Caulfield, G flied out to 1b (2-1).",51,2025-02-26T00:00:00-05:00,"Reckling Park (Houston, TX)",1660,MBA,2025
6308051,596706,Arizona Wildcats,596657,Rice Owls,596657,5,bot,Brown struck out swinging (1-2).,52,2025-02-26T00:00:00-05:00,"Reckling Park (Houston, TX)",1660,MBA,2025
6308051,596706,Arizona Wildcats,596657,Rice Owls,596657,5,bot,Eldridge struck out swinging (1-2).,53,2025-02-26T00:00:00-05:00,"Reckling Park (Houston, TX)",1660,MBA,2025
6308051,596706,Arizona Wildcats,596657,Rice Owls,596657,5,bot,Carlson struck out swinging (1-2).,54,2025-02-26T00:00:00-05:00,"Reckling Park (Houston, TX)",1660,MBA,2025
6308051,596706,Arizona Wildcats,596657,Rice Owls,596706,6,top,"Mihalakis, M grounded out to 1b unassisted (1-0).",55,2025-02-26T00:00:00-05:00,"Reckling Park (Houston, TX)",1660,MBA,2025
6308051,596706,Arizona Wildcats,596657,Rice Owls,596706,6,top,"Cain, A. singled to right field (0-1).",56,2025-02-26T00:00:00-05:00,"Reckling Park (Houston, TX)",1660,MBA,2025
6308051,596706,Arizona Wildcats,596657,Rice Owls,596706,6,top,"Guzman, A. hit by pitch (1-0); Cain, A. advanced to second.",57,2025-02-26T00:00:00-05:00,"Reckling Park (Houston, TX)",1660,MBA,2025
6308051,596706,Arizona Wildcats,596657,Rice Owls,596706,6,top,"Breyfogle, E lined out to cf (1-1).",58,2025-02-26T00:00:00-05:00,"Reckling Park (Houston, TX)",1660,MBA,2025
6308051,596706,Arizona Wildcats,596657,Rice Owls,596706,6,top,"Morales, R. singled to right field, RBI (1-0); Guzman, A. advanced to third; Cain, A. scored.",59,2025-02-26T00:00:00-05:00,"Reckling Park (Houston, TX)",1660,MBA,2025
6308051,596706,Arizona Wildcats,596657,Rice Owls,596706,6,top,Stratton to p for Alch.,60,2025-02-26T00:00:00-05:00,"Reckling Park (Houston, TX)",1660,MBA,2025
6308051,596706,Arizona Wildcats,596657,Rice Owls,596706,6,top,Summerhill flied out to cf (1-0).,61,2025-02-26T00:00:00-05:00,"Reckling Park (Houston, TX)",1660,MBA,2025
6308051,596706,Arizona Wildcats,596657,Rice Owls,596657,6,bot,"Alberini, H. to p for Pluta, T..",62,2025-02-26T00:00:00-05:00,"Reckling Park (Houston, TX)",1660,MBA,2025
6308051,596706,Arizona Wildcats,596657,Rice Owls,596657,6,bot,Duffield struck out swinging (1-2).,63,2025-02-26T00:00:00-05:00,"Reckling Park (Houston, TX)",1660,MBA,2025
6308051,596706,Arizona Wildcats,596657,Rice Owls,596657,6,bot,Zito singled to shortstop (0-0).,64,2025-02-26T00:00:00-05:00,"Reckling Park (Houston, TX)",1660,MBA,2025
6308051,596706,Arizona Wildcats,596657,Rice Owls,596657,6,bot,Bocachica singled to right field (0-0); Zito advanced to second.,65,2025-02-26T00:00:00-05:00,"Reckling Park (Houston, TX)",1660,MBA,2025
6308051,596706,Arizona Wildcats,596657,Rice Owls,596657,6,bot,Bocachica advanced to second on a wild pitch; Zito advanced to third.,66,2025-02-26T00:00:00-05:00,"Reckling Park (Houston, TX)",1660,MBA,2025
6308051,596706,Arizona Wildcats,596657,Rice Owls,596657,6,bot,"Rank singled to center field, 2 RBI (1-1); Bocachica scored; Zito scored.",67,2025-02-26T00:00:00-05:00,"Reckling Park (Houston, TX)",1660,MBA,2025
6308051,596706,Arizona Wildcats,596657,Rice Owls,596657,6,bot,Motley grounded into double play ss to 2b to 1b (2-2); Rank out on the play.,68,2025-02-26T00:00:00-05:00,"Reckling Park (Houston, TX)",1660,MBA,2025
6308051,596706,Arizona Wildcats,596657,Rice Owls,596706,7,top,Blank to p for Stratton.,69,2025-02-26T00:00:00-05:00,"Reckling Park (Houston, TX)",1660,MBA,2025
6308051,596706,Arizona Wildcats,596657,Rice Owls,596706,7,top,"Walton, A. singled to left field (3-1).",70,2025-02-26T00:00:00-05:00,"Reckling Park (Houston, TX)",1660,MBA,2025
6308051,596706,Arizona Wildcats,596657,Rice Owls,596706,7,top,"Walton, A. advanced to second on an error by p.",71,2025-02-26T00:00:00-05:00,"Reckling Park (Houston, TX)",1660,MBA,2025
6308051,596706,Arizona Wildcats,596657,Rice Owls,596706,7,top,"White, M. struck out looking (3-2).",72,2025-02-26T00:00:00-05:00,"Reckling Park (Houston, TX)",1660,MBA,2025
6308051,596706,Arizona Wildcats,596657,Rice Owls,596706,7,top,"Caulfield, G walked (3-1).",73,2025-02-26T00:00:00-05:00,"Reckling Park (Houston, TX)",1660,MBA,2025
6308051,596706,Arizona Wildcats,596657,Rice Owls,596706,7,top,Zatopek to p for Blank.,74,2025-02-26T00:00:00-05:00,"Reckling Park (Houston, TX)",1660,MBA,2025
6308051,596706,Arizona Wildcats,596657,Rice Owls,596706,7,top,"Mihalakis, M walked (3-1); Caulfield, G advanced to second; Walton, A. advanced to third.",75,2025-02-26T00:00:00-05:00,"Reckling Park (Houston, TX)",1660,MBA,2025
6308051,596706,Arizona Wildcats,596657,Rice Owls,596706,7,top,"Cain, A. reached on a fielder's choice (2-1); Mihalakis, M advanced to second; Caulfield, G advanced to third; Walton, A. out at home 1b to c.",76,2025-02-26T00:00:00-05:00,"Reckling Park (Houston, TX)",1660,MBA,2025
6308051,596706,Arizona Wildcats,596657,Rice Owls,596706,7,top,"Guzman, A. doubled to right center, 3 RBI (3-2); Cain, A. scored; Mihalakis, M scored; Caulfield, G scored.",77,2025-02-26T00:00:00-05:00,"Reckling Park (Houston, TX)",1660,MBA,2025
6308051,596706,Arizona Wildcats,596657,Rice Owls,596706,7,top,"Breyfogle, E walked (3-2).",78,2025-02-26T00:00:00-05:00,"Reckling Park (Houston, TX)",1660,MBA,2025
6308051,596706,Arizona Wildcats,596657,Rice Owls,596706,7,top,Gallant to p for Zatopek.,79,2025-02-26T00:00:00-05:00,"Reckling Park (Houston, TX)",1660,MBA,2025
6308051,596706,Arizona Wildcats,596657,Rice Owls,596706,7,top,"Morales, R. walked (3-1); Breyfogle, E advanced to second; Guzman, A. advanced to third.",80,2025-02-26T00:00:00-05:00,"Reckling Park (Houston, TX)",1660,MBA,2025
6308051,596706,Arizona Wildcats,596657,Rice Owls,596706,7,top,"Summerhill doubled down the lf line, 2 RBI (3-1); Morales, R. advanced to third, out at home lf to c; Breyfogle, E scored; Guzman, A. scored.",81,2025-02-26T00:00:00-05:00,"Reckling Park (Houston, TX)",1660,MBA,2025
6308051,596706,Arizona Wildcats,596657,Rice Owls,596657,7,bot,"Hicks, G. to p for Alberini, H..",82,2025-02-26T00:00:00-05:00,"Reckling Park (Houston, TX)",1660,MBA,2025
6308051,596706,Arizona Wildcats,596657,Rice Owls,596657,7,bot,"West, L struck out swinging (1-2).",83,2025-02-26T00:00:00-05:00,"Reckling Park (Houston, TX)",1660,MBA,2025
6308051,596706,Arizona Wildcats,596657,Rice Owls,596657,7,bot,Brown grounded out to c (0-1).,84,2025-02-26T00:00:00-05:00,"Reckling Park (Houston, TX)",1660,MBA,2025
6308051,596706,Arizona Wildcats,596657,Rice Owls,596657,7,bot,"Eldridge struck out swinging, out at first c to 1b (0-2).",85,2025-02-26T00:00:00-05:00,"Reckling Park (Houston, TX)",1660,MBA,2025
6308051,596706,Arizona Wildcats,596657,Rice Owls,596706,8,top,Atchley to p for Gallant.,86,2025-02-26T00:00:00-05:00,"Reckling Park (Houston, TX)",1660,MBA,2025
6308051,596706,Arizona Wildcats,596657,Rice Owls,596706,8,top,"Walton, A. walked (3-1).",87,2025-02-26T00:00:00-05:00,"Reckling Park (Houston, TX)",1660,MBA,2025
6308051,596706,Arizona Wildcats,596657,Rice Owls,596706,8,top,"Walton, A. stole second.",88,2025-02-26T00:00:00-05:00,"Reckling Park (Houston, TX)",1660,MBA,2025
6308051,596706,Arizona Wildcats,596657,Rice Owls,596706,8,top,"White, M. walked (3-2).",89,2025-02-26T00:00:00-05:00,"Reckling Park (Houston, TX)",1660,MBA,2025
6308051,596706,Arizona Wildcats,596657,Rice Owls,596706,8,top,"Caulfield, G singled to first base, bunt; White, M. advanced to second; Walton, A. advanced to third.",90,2025-02-26T00:00:00-05:00,"Reckling Park (Houston, TX)",1660,MBA,2025
6308051,596706,Arizona Wildcats,596657,Rice Owls,596706,8,top,"Mihalakis, M struck out swinging (1-2).",91,2025-02-26T00:00:00-05:00,"Reckling Park (Houston, TX)",1660,MBA,2025
6308051,596706,Arizona Wildcats,596657,Rice Owls,596706,8,top,"Cain, A. flied out to cf, SF, RBI (3-2); White, M. advanced to third; Walton, A. scored.",92,2025-02-26T00:00:00-05:00,"Reckling Park (Houston, TX)",1660,MBA,2025
6308051,596706,Arizona Wildcats,596657,Rice Owls,596706,8,top,"Guzman, A. hit by pitch (0-0); Caulfield, G advanced to second.",93,2025-02-26T00:00:00-05:00,"Reckling Park (Houston, TX)",1660,MBA,2025
6308051,596706,Arizona Wildcats,596657,Rice Owls,596706,8,top,Ben-Shoshan to p for Atchley.,94,2025-02-26T00:00:00-05:00,"Reckling Park (Houston, TX)",1660,MBA,2025
6308051,596706,Arizona Wildcats,596657,Rice Owls,596706,8,top,"Breyfogle, E struck out swinging (1-2).",95,2025-02-26T00:00:00-05:00,"Reckling Park (Houston, TX)",1660,MBA,2025
6308051,596706,Arizona Wildcats,596657,Rice Owls,596657,8,bot,Carlson flied out to rf (0-1).,96,2025-02-26T00:00:00-05:00,"Reckling Park (Houston, TX)",1660,MBA,2025
6308051,596706,Arizona Wildcats,596657,Rice Owls,596657,8,bot,Duffield struck out swinging (1-2).,97,2025-02-26T00:00:00-05:00,"Reckling Park (Houston, TX)",1660,MBA,2025
6308051,596706,Arizona Wildcats,596657,Rice Owls,596657,8,bot,Zito singled to shortstop (1-2).,98,2025-02-26T00:00:00-05:00,"Reckling Park (Houston, TX)",1660,MBA,2025
6308051,596706,Arizona Wildcats,596657,Rice Owls,596657,8,bot,Bocachica walked (3-0); Zito advanced to second.,99,2025-02-26T00:00:00-05:00,"Reckling Park (Houston, TX)",1660,MBA,2025
6308051,596706,Arizona Wildcats,596657,Rice Owls,596657,8,bot,Bocachica advanced to second; Zito advanced to third on an error by c.,100,2025-02-26T00:00:00-05:00,"Reckling Park (Houston, TX)",1660,MBA,2025
6308051,596706,Arizona Wildcats,596657,Rice Owls,596657,8,bot,Rank flied out to cf (3-2).,101,2025-02-26T00:00:00-05:00,"Reckling Park (Houston, TX)",1660,MBA,2025
6308051,596706,Arizona Wildcats,596657,Rice Owls,596706,9,top,"Morales, R. flied out to cf (2-0).",102,2025-02-26T00:00:00-05:00,"Reckling Park (Houston, TX)",1660,MBA,2025
6308051,596706,Arizona Wildcats,596657,Rice Owls,596706,9,top,Summerhill struck out looking (3-2).,103,2025-02-26T00:00:00-05:00,"Reckling Park (Houston, TX)",1660,MBA,2025
6308051,596706,Arizona Wildcats,596657,Rice Owls,596706,9,top,"Walton, A. flied out to 2b (1-1).",104,2025-02-26T00:00:00-05:00,"Reckling Park (Houston, TX)",1660,MBA,2025
6308051,596706,Arizona Wildcats,596657,Rice Owls,596657,9,bot,"Tonghini, J. to p for Hicks, G..",105,2025-02-26T00:00:00-05:00,"Reckling Park (Houston, TX)",1660,MBA,2025
6308051,596706,Arizona Wildcats,596657,Rice Owls,596657,9,bot,Motley singled to pitcher (2-1).,106,2025-02-26T00:00:00-05:00,"Reckling Park (Houston, TX)",1660,MBA,2025
6308051,596706,Arizona Wildcats,596657,Rice Owls,596657,9,bot,"West, L struck out looking (1-2).",107,2025-02-26T00:00:00-05:00,"Reckling Park (Houston, TX)",1660,MBA,2025
6308051,596706,Arizona Wildcats,596657,Rice Owls,596657,9,bot,Brown singled to center field (1-2); Motley advanced to third.,108,2025-02-26T00:00:00-05:00,"Reckling Park (Houston, TX)",1660,MBA,2025
6308051,596706,Arizona Wildcats,596657,Rice Owls,596657,9,bot,Brown advanced to second; Motley scored on a wild pitch.,109,2025-02-26T00:00:00-05:00,"Reckling Park (Houston, TX)",1660,MBA,2025
6308051,596706,Arizona Wildcats,596657,Rice Owls,596657,9,bot,Eldridge struck out swinging (1-2).,110,2025-02-26T00:00:00-05:00,"Reckling Park (Houston, TX)",1660,MBA,2025
6308051,596706,Arizona Wildcats,596657,Rice Owls,596657,9,bot,Brown advanced to third on a passed ball.,111,2025-02-26T00:00:00-05:00,"Reckling Park (Houston, TX)",1660,MBA,2025
6308051,596706,Arizona Wildcats,596657,Rice Owls,596657,9,bot,Carlson walked (3-2).,112,2025-02-26T00:00:00-05:00,"Reckling Park (Houston, TX)",1660,MBA,2025
6308051,596706,Arizona Wildcats,596657,Rice Owls,596657,9,bot,Duffield struck out swinging (2-2).,113,2025-02-26T00:00:00-05:00,"Reckling Park (Houston, TX)",1660,MBA,2025
