game_id,away_team_id,away_team_name,home_team_id,home_team_name,batting_team,inning,top_bot,event_text,event_num,game_datetime,stadium_name,attendance,sport_id,season
6310548,596679,South Fla. Bulls,596449,Wichita St. Shockers,596679,1,top,"PRUITT, R. struck out swinging (1-2 KKBS).",1,2025-04-26T00:00:00-04:00,"Eck Stadium (Wichita, KS)",1537,MBA,2025
6310548,596679,South Fla. Bulls,596449,Wichita St. Shockers,596679,1,top,"JACOME, C. grounded out to 3b (0-0).",2,2025-04-26T00:00:00-04:00,"Eck Stadium (Wichita, KS)",1537,MBA,2025
6310548,596679,South Fla. Bulls,596449,Wichita St. Shockers,596679,1,top,"GREICO, S. struck out swinging (1-2 BSFS).",3,2025-04-26T00:00:00-04:00,"Eck Stadium (Wichita, KS)",1537,MBA,2025
6310548,596679,South Fla. Bulls,596449,Wichita St. Shockers,596449,1,bot,Durnin struck out looking (1-2 KFBFK).,4,2025-04-26T00:00:00-04:00,"Eck Stadium (Wichita, KS)",1537,MBA,2025
6310548,596679,South Fla. Bulls,596449,Wichita St. Shockers,596449,1,bot,"Johnson, C. grounded out to 2b (1-2 BKF).",5,2025-04-26T00:00:00-04:00,"Eck Stadium (Wichita, KS)",1537,MBA,2025
6310548,596679,South Fla. Bulls,596449,Wichita St. Shockers,596449,1,bot,"Rogers, J. hit by pitch (0-0).",6,2025-04-26T00:00:00-04:00,"Eck Stadium (Wichita, KS)",1537,MBA,2025
6310548,596679,South Fla. Bulls,596449,Wichita St. Shockers,596449,1,bot,"Rogers, J. stole second, advanced to third on a throwing error by c.",7,2025-04-26T00:00:00-04:00,"Eck Stadium (Wichita, KS)",1537,MBA,2025
6310548,596679,South Fla. Bulls,596449,Wichita St. Shockers,596449,1,bot,"Livingston doubled to center field, RBI (1-1 KB)3a Rogers, J. scored.",8,2025-04-26T00:00:00-04:00,"Eck Stadium (Wichita, KS)",1537,MBA,2025
6310548,596679,South Fla. Bulls,596449,Wichita St. Shockers,596449,1,bot,Millan grounded out to 1b unassisted (1-2 KKB).,9,2025-04-26T00:00:00-04:00,"Eck Stadium (Wichita, KS)",1537,MBA,2025
6310548,596679,South Fla. Bulls,596449,Wichita St. Shockers,596679,2,top,"BRODIL, M. struck out looking (2-2 FFBBK).",10,2025-04-26T00:00:00-04:00,"Eck Stadium (Wichita, KS)",1537,MBA,2025
6310548,596679,South Fla. Bulls,596449,Wichita St. Shockers,596679,2,top,"ROSE, M. grounded out to 2b (1-0 B).",11,2025-04-26T00:00:00-04:00,"Eck Stadium (Wichita, KS)",1537,MBA,2025
6310548,596679,South Fla. Bulls,596449,Wichita St. Shockers,596679,2,top,"BETANCOURT,R grounded out to 2b (3-2 KBBFBF).",12,2025-04-26T00:00:00-04:00,"Eck Stadium (Wichita, KS)",1537,MBA,2025
6310548,596679,South Fla. Bulls,596449,Wichita St. Shockers,596449,2,bot,"Gustafson singled to right field, advanced to third on an error by rf (2-0 BB).",13,2025-04-26T00:00:00-04:00,"Eck Stadium (Wichita, KS)",1537,MBA,2025
6310548,596679,South Fla. Bulls,596449,Wichita St. Shockers,596449,2,bot,"Callahan singled through the right side, RBI (1-0 B)3a Gustafson scored, unearned.",14,2025-04-26T00:00:00-04:00,"Eck Stadium (Wichita, KS)",1537,MBA,2025
6310548,596679,South Fla. Bulls,596449,Wichita St. Shockers,596449,2,bot,Duncan struck out looking (0-2 KFK).,15,2025-04-26T00:00:00-04:00,"Eck Stadium (Wichita, KS)",1537,MBA,2025
6310548,596679,South Fla. Bulls,596449,Wichita St. Shockers,596449,2,bot,"Henry, Z. struck out swinging (0-2 FSS).",16,2025-04-26T00:00:00-04:00,"Eck Stadium (Wichita, KS)",1537,MBA,2025
6310548,596679,South Fla. Bulls,596449,Wichita St. Shockers,596449,2,bot,Durnin flied out to cf (0-0).,17,2025-04-26T00:00:00-04:00,"Eck Stadium (Wichita, KS)",1537,MBA,2025
6310548,596679,South Fla. Bulls,596449,Wichita St. Shockers,596679,3,top,"TRIPPEL, L. singled to third base (0-0).",18,2025-04-26T00:00:00-04:00,"Eck Stadium (Wichita, KS)",1537,MBA,2025
6310548,596679,South Fla. Bulls,596449,Wichita St. Shockers,596679,3,top,"MAYO, J. reached on a fielder's choice (0-1 S)3a TRIPPEL, L. out at second 2b to ss.",19,2025-04-26T00:00:00-04:00,"Eck Stadium (Wichita, KS)",1537,MBA,2025
6310548,596679,South Fla. Bulls,596449,Wichita St. Shockers,596679,3,top,"LOHRY, B. doubled to left center, RBI (0-0)3a MAYO, J. scored.",20,2025-04-26T00:00:00-04:00,"Eck Stadium (Wichita, KS)",1537,MBA,2025
6310548,596679,South Fla. Bulls,596449,Wichita St. Shockers,596679,3,top,"PRUITT, R. struck out swinging (1-2 FFFBFFS).",21,2025-04-26T00:00:00-04:00,"Eck Stadium (Wichita, KS)",1537,MBA,2025
6310548,596679,South Fla. Bulls,596449,Wichita St. Shockers,596679,3,top,"JACOME, C. singled to center field, RBI (1-2 BKS)3a LOHRY, B. scored.",22,2025-04-26T00:00:00-04:00,"Eck Stadium (Wichita, KS)",1537,MBA,2025
6310548,596679,South Fla. Bulls,596449,Wichita St. Shockers,596679,3,top,"JACOME, C. out at first p to 1b, picked off.",23,2025-04-26T00:00:00-04:00,"Eck Stadium (Wichita, KS)",1537,MBA,2025
6310548,596679,South Fla. Bulls,596449,Wichita St. Shockers,596449,3,bot,"Johnson, C. flied out to lf (1-2 KBK).",24,2025-04-26T00:00:00-04:00,"Eck Stadium (Wichita, KS)",1537,MBA,2025
6310548,596679,South Fla. Bulls,596449,Wichita St. Shockers,596449,3,bot,"Rogers, J. struck out swinging (3-2 BBKKBS).",25,2025-04-26T00:00:00-04:00,"Eck Stadium (Wichita, KS)",1537,MBA,2025
6310548,596679,South Fla. Bulls,596449,Wichita St. Shockers,596449,3,bot,Livingston flied out to 2b (2-2 KFFBFB).,26,2025-04-26T00:00:00-04:00,"Eck Stadium (Wichita, KS)",1537,MBA,2025
6310548,596679,South Fla. Bulls,596449,Wichita St. Shockers,596679,4,top,"GREICO, S. grounded out to 1b unassisted (2-2 BSFB).",27,2025-04-26T00:00:00-04:00,"Eck Stadium (Wichita, KS)",1537,MBA,2025
6310548,596679,South Fla. Bulls,596449,Wichita St. Shockers,596679,4,top,"BRODIL, M. flied out to cf (2-2 SBBF).",28,2025-04-26T00:00:00-04:00,"Eck Stadium (Wichita, KS)",1537,MBA,2025
6310548,596679,South Fla. Bulls,596449,Wichita St. Shockers,596679,4,top,"ROSE, M. lined out to cf (3-2 BBBKKF).",29,2025-04-26T00:00:00-04:00,"Eck Stadium (Wichita, KS)",1537,MBA,2025
6310548,596679,South Fla. Bulls,596449,Wichita St. Shockers,596449,4,bot,Millan grounded out to ss (2-1 BKB).,30,2025-04-26T00:00:00-04:00,"Eck Stadium (Wichita, KS)",1537,MBA,2025
6310548,596679,South Fla. Bulls,596449,Wichita St. Shockers,596449,4,bot,Gustafson lined out to cf (1-1 BK).,31,2025-04-26T00:00:00-04:00,"Eck Stadium (Wichita, KS)",1537,MBA,2025
6310548,596679,South Fla. Bulls,596449,Wichita St. Shockers,596449,4,bot,Callahan lined out to cf (2-2 FKBFB).,32,2025-04-26T00:00:00-04:00,"Eck Stadium (Wichita, KS)",1537,MBA,2025
6310548,596679,South Fla. Bulls,596449,Wichita St. Shockers,596679,5,top,"BETANCOURT,R struck out swinging (3-2 BKFBFBS).",33,2025-04-26T00:00:00-04:00,"Eck Stadium (Wichita, KS)",1537,MBA,2025
6310548,596679,South Fla. Bulls,596449,Wichita St. Shockers,596679,5,top,"TRIPPEL, L. walked (3-2 BBBKSB).",34,2025-04-26T00:00:00-04:00,"Eck Stadium (Wichita, KS)",1537,MBA,2025
6310548,596679,South Fla. Bulls,596449,Wichita St. Shockers,596679,5,top,"MAYO, J. flied out to lf (1-2 KSBF).",35,2025-04-26T00:00:00-04:00,"Eck Stadium (Wichita, KS)",1537,MBA,2025
6310548,596679,South Fla. Bulls,596449,Wichita St. Shockers,596679,5,top,"LOHRY, B. fouled out to 1b (1-2 KSB).",36,2025-04-26T00:00:00-04:00,"Eck Stadium (Wichita, KS)",1537,MBA,2025
6310548,596679,South Fla. Bulls,596449,Wichita St. Shockers,596449,5,bot,Duncan struck out swinging (1-2 SBFS).,37,2025-04-26T00:00:00-04:00,"Eck Stadium (Wichita, KS)",1537,MBA,2025
6310548,596679,South Fla. Bulls,596449,Wichita St. Shockers,596449,5,bot,"Henry, Z. singled to center field (0-1 F).",38,2025-04-26T00:00:00-04:00,"Eck Stadium (Wichita, KS)",1537,MBA,2025
6310548,596679,South Fla. Bulls,596449,Wichita St. Shockers,596449,5,bot,"Durnin singled to right field (0-0)3a Henry, Z. advanced to second.",39,2025-04-26T00:00:00-04:00,"Eck Stadium (Wichita, KS)",1537,MBA,2025
6310548,596679,South Fla. Bulls,596449,Wichita St. Shockers,596449,5,bot,"Johnson, C. homered down the lf line, 3 RBI (3-2 BBBKF)3a Durnin scored3a Henry, Z. scored.",40,2025-04-26T00:00:00-04:00,"Eck Stadium (Wichita, KS)",1537,MBA,2025
6310548,596679,South Fla. Bulls,596449,Wichita St. Shockers,596449,5,bot,"Rogers, J. flied out to lf (0-1 K).",41,2025-04-26T00:00:00-04:00,"Eck Stadium (Wichita, KS)",1537,MBA,2025
6310548,596679,South Fla. Bulls,596449,Wichita St. Shockers,596449,5,bot,"DeCARDENAS,J to p for NEWTON, A..",42,2025-04-26T00:00:00-04:00,"Eck Stadium (Wichita, KS)",1537,MBA,2025
6310548,596679,South Fla. Bulls,596449,Wichita St. Shockers,596449,5,bot,Livingston struck out swinging (1-2 SFFBFFS).,43,2025-04-26T00:00:00-04:00,"Eck Stadium (Wichita, KS)",1537,MBA,2025
6310548,596679,South Fla. Bulls,596449,Wichita St. Shockers,596679,6,top,"PRUITT, R. flied out to lf (2-2 BFKB).",44,2025-04-26T00:00:00-04:00,"Eck Stadium (Wichita, KS)",1537,MBA,2025
6310548,596679,South Fla. Bulls,596449,Wichita St. Shockers,596679,6,top,"JACOME, C. struck out swinging (1-2 KKBS).",45,2025-04-26T00:00:00-04:00,"Eck Stadium (Wichita, KS)",1537,MBA,2025
6310548,596679,South Fla. Bulls,596449,Wichita St. Shockers,596679,6,top,"GREICO, S. grounded out to p, bunt.",46,2025-04-26T00:00:00-04:00,"Eck Stadium (Wichita, KS)",1537,MBA,2025
6310548,596679,South Fla. Bulls,596449,Wichita St. Shockers,596449,6,bot,Millan singled up the middle (3-2 KFBBFBFF).,47,2025-04-26T00:00:00-04:00,"Eck Stadium (Wichita, KS)",1537,MBA,2025
6310548,596679,South Fla. Bulls,596449,Wichita St. Shockers,596449,6,bot,Millan advanced to second on a wild pitch.,48,2025-04-26T00:00:00-04:00,"Eck Stadium (Wichita, KS)",1537,MBA,2025
6310548,596679,South Fla. Bulls,596449,Wichita St. Shockers,596449,6,bot,Gustafson grounded out to 2b (1-2 FFBF)3a Millan advanced to third.,49,2025-04-26T00:00:00-04:00,"Eck Stadium (Wichita, KS)",1537,MBA,2025
6310548,596679,South Fla. Bulls,596449,Wichita St. Shockers,596449,6,bot,"Callahan grounded out to 2b, RBI (2-0 BB)3a Millan scored.",50,2025-04-26T00:00:00-04:00,"Eck Stadium (Wichita, KS)",1537,MBA,2025
6310548,596679,South Fla. Bulls,596449,Wichita St. Shockers,596449,6,bot,Duncan struck out swinging (1-2 BKFS).,51,2025-04-26T00:00:00-04:00,"Eck Stadium (Wichita, KS)",1537,MBA,2025
6310548,596679,South Fla. Bulls,596449,Wichita St. Shockers,596679,7,top,"BRODIL, M. struck out swinging (2-2 BFKBS).",52,2025-04-26T00:00:00-04:00,"Eck Stadium (Wichita, KS)",1537,MBA,2025
6310548,596679,South Fla. Bulls,596449,Wichita St. Shockers,596679,7,top,"ROSE, M. grounded out to 3b (0-1 F).",53,2025-04-26T00:00:00-04:00,"Eck Stadium (Wichita, KS)",1537,MBA,2025
6310548,596679,South Fla. Bulls,596449,Wichita St. Shockers,596679,7,top,"BETANCOURT,R grounded out to ss (1-1 KB).",54,2025-04-26T00:00:00-04:00,"Eck Stadium (Wichita, KS)",1537,MBA,2025
6310548,596679,South Fla. Bulls,596449,Wichita St. Shockers,596449,7,bot,"Henry, Z. walked (3-1 BKBBB).",55,2025-04-26T00:00:00-04:00,"Eck Stadium (Wichita, KS)",1537,MBA,2025
6310548,596679,South Fla. Bulls,596449,Wichita St. Shockers,596449,7,bot,Durnin struck out swinging (2-2 KBBFS).,56,2025-04-26T00:00:00-04:00,"Eck Stadium (Wichita, KS)",1537,MBA,2025
6310548,596679,South Fla. Bulls,596449,Wichita St. Shockers,596449,7,bot,"Johnson, C. lined into double play ss to 1b (1-1 BF)3a Henry, Z. out on the play.",57,2025-04-26T00:00:00-04:00,"Eck Stadium (Wichita, KS)",1537,MBA,2025
6310548,596679,South Fla. Bulls,596449,Wichita St. Shockers,596679,8,top,"TRIPPEL, L. struck out swinging, reached first on a wild pitch (0-2 FKS).",58,2025-04-26T00:00:00-04:00,"Eck Stadium (Wichita, KS)",1537,MBA,2025
6310548,596679,South Fla. Bulls,596449,Wichita St. Shockers,596679,8,top,"MAYO, J. flied out to rf (0-2 FS).",59,2025-04-26T00:00:00-04:00,"Eck Stadium (Wichita, KS)",1537,MBA,2025
6310548,596679,South Fla. Bulls,596449,Wichita St. Shockers,596679,8,top,"TRIPPEL, L. stole second.",60,2025-04-26T00:00:00-04:00,"Eck Stadium (Wichita, KS)",1537,MBA,2025
6310548,596679,South Fla. Bulls,596449,Wichita St. Shockers,596679,8,top,"LOHRY, B. flied out to ss (1-2 KSB).",61,2025-04-26T00:00:00-04:00,"Eck Stadium (Wichita, KS)",1537,MBA,2025
6310548,596679,South Fla. Bulls,596449,Wichita St. Shockers,596679,8,top,"PRUITT, R. doubled to left field, RBI (0-1 K)3a TRIPPEL, L. scored.",62,2025-04-26T00:00:00-04:00,"Eck Stadium (Wichita, KS)",1537,MBA,2025
6310548,596679,South Fla. Bulls,596449,Wichita St. Shockers,596679,8,top,"Potter to p for Hamilton, B..",63,2025-04-26T00:00:00-04:00,"Eck Stadium (Wichita, KS)",1537,MBA,2025
6310548,596679,South Fla. Bulls,596449,Wichita St. Shockers,596679,8,top,"JACOME, C. grounded out to 3b (0-2 FF).",64,2025-04-26T00:00:00-04:00,"Eck Stadium (Wichita, KS)",1537,MBA,2025
6310548,596679,South Fla. Bulls,596449,Wichita St. Shockers,596449,8,bot,"Rogers, J. homered to left field, RBI (2-1 BKB).",65,2025-04-26T00:00:00-04:00,"Eck Stadium (Wichita, KS)",1537,MBA,2025
6310548,596679,South Fla. Bulls,596449,Wichita St. Shockers,596449,8,bot,Livingston grounded out to 2b (0-1 K).,66,2025-04-26T00:00:00-04:00,"Eck Stadium (Wichita, KS)",1537,MBA,2025
6310548,596679,South Fla. Bulls,596449,Wichita St. Shockers,596449,8,bot,Millan walked (3-2 BKFBFBB).,67,2025-04-26T00:00:00-04:00,"Eck Stadium (Wichita, KS)",1537,MBA,2025
6310548,596679,South Fla. Bulls,596449,Wichita St. Shockers,596449,8,bot,Gustafson popped up to ss (1-2 BFF).,68,2025-04-26T00:00:00-04:00,"Eck Stadium (Wichita, KS)",1537,MBA,2025
6310548,596679,South Fla. Bulls,596449,Wichita St. Shockers,596449,8,bot,Millan advanced to second on a wild pitch.,69,2025-04-26T00:00:00-04:00,"Eck Stadium (Wichita, KS)",1537,MBA,2025
6310548,596679,South Fla. Bulls,596449,Wichita St. Shockers,596449,8,bot,Callahan lined out to lf (3-2 BBSBFF).,70,2025-04-26T00:00:00-04:00,"Eck Stadium (Wichita, KS)",1537,MBA,2025
6310548,596679,South Fla. Bulls,596449,Wichita St. Shockers,596679,9,top,"GREICO, S. walked (3-2 BFKBBB).",71,2025-04-26T00:00:00-04:00,"Eck Stadium (Wichita, KS)",1537,MBA,2025
6310548,596679,South Fla. Bulls,596449,Wichita St. Shockers,596679,9,top,"BRODIL, M. doubled to left center (2-1 BBK)3a GREICO, S. advanced to third.",72,2025-04-26T00:00:00-04:00,"Eck Stadium (Wichita, KS)",1537,MBA,2025
6310548,596679,South Fla. Bulls,596449,Wichita St. Shockers,596679,9,top,Haworth to lf for Gustafson.,73,2025-04-26T00:00:00-04:00,"Eck Stadium (Wichita, KS)",1537,MBA,2025
6310548,596679,South Fla. Bulls,596449,Wichita St. Shockers,596679,9,top,"ROSE, M. grounded out to 2b, RBI (0-2 SS)3a BRODIL, M. advanced to third3a GREICO, S. scored.",74,2025-04-26T00:00:00-04:00,"Eck Stadium (Wichita, KS)",1537,MBA,2025
6310548,596679,South Fla. Bulls,596449,Wichita St. Shockers,596679,9,top,Arnold to p for Potter.,75,2025-04-26T00:00:00-04:00,"Eck Stadium (Wichita, KS)",1537,MBA,2025
6310548,596679,South Fla. Bulls,596449,Wichita St. Shockers,596679,9,top,"BETANCOURT,R grounded out to 2b, RBI (1-0 B)3a BRODIL, M. scored.",76,2025-04-26T00:00:00-04:00,"Eck Stadium (Wichita, KS)",1537,MBA,2025
6310548,596679,South Fla. Bulls,596449,Wichita St. Shockers,596679,9,top,"TRIPPEL, L. struck out looking (2-2 BKFBK).",77,2025-04-26T00:00:00-04:00,"Eck Stadium (Wichita, KS)",1537,MBA,2025
