game_id,away_team_id,away_team_name,home_team_id,home_team_name,batting_team,inning,top_bot,event_text,event_num,game_datetime,stadium_name,attendance,sport_id,season
6310576,596515,UC Riverside Highlanders,596505,CSU Bakersfield Roadrunners,596515,1,top,"PITTS, R struck out swinging.",1,2025-04-04T00:00:00-04:00,"Hardt Field (Bakersfield, CA)",277,MBA,2025
6310576,596515,UC Riverside Highlanders,596505,CSU Bakersfield Roadrunners,596515,1,top,"HERNANDEZ, I struck out swinging.",2,2025-04-04T00:00:00-04:00,"Hardt Field (Bakersfield, CA)",277,MBA,2025
6310576,596515,UC Riverside Highlanders,596505,CSU Bakersfield Roadrunners,596515,1,top,"NUNES, L singled to right field.",3,2025-04-04T00:00:00-04:00,"Hardt Field (Bakersfield, CA)",277,MBA,2025
6310576,596515,UC Riverside Highlanders,596505,CSU Bakersfield Roadrunners,596515,1,top,"LOPEZ, J flied out to lf.",4,2025-04-04T00:00:00-04:00,"Hardt Field (Bakersfield, CA)",277,MBA,2025
6310576,596515,UC Riverside Highlanders,596505,CSU Bakersfield Roadrunners,596505,1,bot,Alvarez grounded out to 2b.,5,2025-04-04T00:00:00-04:00,"Hardt Field (Bakersfield, CA)",277,MBA,2025
6310576,596515,UC Riverside Highlanders,596505,CSU Bakersfield Roadrunners,596505,1,bot,Cloyd singled to center field.,6,2025-04-04T00:00:00-04:00,"Hardt Field (Bakersfield, CA)",277,MBA,2025
6310576,596515,UC Riverside Highlanders,596505,CSU Bakersfield Roadrunners,596505,1,bot,Mascaro reached on a fielder's choice; Cloyd out at second ss to 2b.,7,2025-04-04T00:00:00-04:00,"Hardt Field (Bakersfield, CA)",277,MBA,2025
6310576,596515,UC Riverside Highlanders,596505,CSU Bakersfield Roadrunners,596505,1,bot,Hendriks flied out to rf.,8,2025-04-04T00:00:00-04:00,"Hardt Field (Bakersfield, CA)",277,MBA,2025
6310576,596515,UC Riverside Highlanders,596505,CSU Bakersfield Roadrunners,596515,2,top,"CHAPMAN, M singled to center field.",9,2025-04-04T00:00:00-04:00,"Hardt Field (Bakersfield, CA)",277,MBA,2025
6310576,596515,UC Riverside Highlanders,596505,CSU Bakersfield Roadrunners,596515,2,top,"GORDON, T flied out to lf.",10,2025-04-04T00:00:00-04:00,"Hardt Field (Bakersfield, CA)",277,MBA,2025
6310576,596515,UC Riverside Highlanders,596505,CSU Bakersfield Roadrunners,596515,2,top,"RIVAS, A grounded out to 2b; CHAPMAN, M advanced to second.",11,2025-04-04T00:00:00-04:00,"Hardt Field (Bakersfield, CA)",277,MBA,2025
6310576,596515,UC Riverside Highlanders,596505,CSU Bakersfield Roadrunners,596515,2,top,"GIBBS, D fouled out to 3b.",12,2025-04-04T00:00:00-04:00,"Hardt Field (Bakersfield, CA)",277,MBA,2025
6310576,596515,UC Riverside Highlanders,596505,CSU Bakersfield Roadrunners,596505,2,bot,Leroy struck out looking.,13,2025-04-04T00:00:00-04:00,"Hardt Field (Bakersfield, CA)",277,MBA,2025
6310576,596515,UC Riverside Highlanders,596505,CSU Bakersfield Roadrunners,596505,2,bot,"Pelayo singled to first base, bunt.",14,2025-04-04T00:00:00-04:00,"Hardt Field (Bakersfield, CA)",277,MBA,2025
6310576,596515,UC Riverside Highlanders,596505,CSU Bakersfield Roadrunners,596505,2,bot,"Johnson, T hit by pitch; Pelayo advanced to second.",15,2025-04-04T00:00:00-04:00,"Hardt Field (Bakersfield, CA)",277,MBA,2025
6310576,596515,UC Riverside Highlanders,596505,CSU Bakersfield Roadrunners,596505,2,bot,"Johnson, T advanced to second; Pelayo out at third c to 3b, caught stealing.",16,2025-04-04T00:00:00-04:00,"Hardt Field (Bakersfield, CA)",277,MBA,2025
6310576,596515,UC Riverside Highlanders,596505,CSU Bakersfield Roadrunners,596505,2,bot,Zulaica walked.,17,2025-04-04T00:00:00-04:00,"Hardt Field (Bakersfield, CA)",277,MBA,2025
6310576,596515,UC Riverside Highlanders,596505,CSU Bakersfield Roadrunners,596505,2,bot,Pollard grounded out to 1b unassisted.,18,2025-04-04T00:00:00-04:00,"Hardt Field (Bakersfield, CA)",277,MBA,2025
6310576,596515,UC Riverside Highlanders,596505,CSU Bakersfield Roadrunners,596515,3,top,"WHITTLE, D struck out swinging.",19,2025-04-04T00:00:00-04:00,"Hardt Field (Bakersfield, CA)",277,MBA,2025
6310576,596515,UC Riverside Highlanders,596505,CSU Bakersfield Roadrunners,596515,3,top,"PITTS, R struck out looking.",20,2025-04-04T00:00:00-04:00,"Hardt Field (Bakersfield, CA)",277,MBA,2025
6310576,596515,UC Riverside Highlanders,596505,CSU Bakersfield Roadrunners,596515,3,top,"HERNANDEZ, I struck out swinging.",21,2025-04-04T00:00:00-04:00,"Hardt Field (Bakersfield, CA)",277,MBA,2025
6310576,596515,UC Riverside Highlanders,596505,CSU Bakersfield Roadrunners,596505,3,bot,Alvarez struck out looking.,22,2025-04-04T00:00:00-04:00,"Hardt Field (Bakersfield, CA)",277,MBA,2025
6310576,596515,UC Riverside Highlanders,596505,CSU Bakersfield Roadrunners,596505,3,bot,Cloyd singled to left field.,23,2025-04-04T00:00:00-04:00,"Hardt Field (Bakersfield, CA)",277,MBA,2025
6310576,596515,UC Riverside Highlanders,596505,CSU Bakersfield Roadrunners,596505,3,bot,Mascaro lined out to lf.,24,2025-04-04T00:00:00-04:00,"Hardt Field (Bakersfield, CA)",277,MBA,2025
6310576,596515,UC Riverside Highlanders,596505,CSU Bakersfield Roadrunners,596505,3,bot,Hendriks flied out to rf.,25,2025-04-04T00:00:00-04:00,"Hardt Field (Bakersfield, CA)",277,MBA,2025
6310576,596515,UC Riverside Highlanders,596505,CSU Bakersfield Roadrunners,596515,4,top,"NUNES, L singled to right field.",26,2025-04-04T00:00:00-04:00,"Hardt Field (Bakersfield, CA)",277,MBA,2025
6310576,596515,UC Riverside Highlanders,596505,CSU Bakersfield Roadrunners,596515,4,top,"LOPEZ, J struck out looking.",27,2025-04-04T00:00:00-04:00,"Hardt Field (Bakersfield, CA)",277,MBA,2025
6310576,596515,UC Riverside Highlanders,596505,CSU Bakersfield Roadrunners,596515,4,top,"CHAPMAN, M reached on a fielder's choice; NUNES, L out at second 3b to 2b.",28,2025-04-04T00:00:00-04:00,"Hardt Field (Bakersfield, CA)",277,MBA,2025
6310576,596515,UC Riverside Highlanders,596505,CSU Bakersfield Roadrunners,596515,4,top,"GORDON, T struck out swinging.",29,2025-04-04T00:00:00-04:00,"Hardt Field (Bakersfield, CA)",277,MBA,2025
6310576,596515,UC Riverside Highlanders,596505,CSU Bakersfield Roadrunners,596505,4,bot,Leroy singled to center field.,30,2025-04-04T00:00:00-04:00,"Hardt Field (Bakersfield, CA)",277,MBA,2025
6310576,596515,UC Riverside Highlanders,596505,CSU Bakersfield Roadrunners,596505,4,bot,Pelayo struck out swinging.,31,2025-04-04T00:00:00-04:00,"Hardt Field (Bakersfield, CA)",277,MBA,2025
6310576,596515,UC Riverside Highlanders,596505,CSU Bakersfield Roadrunners,596505,4,bot,"Johnson, T struck out looking.",32,2025-04-04T00:00:00-04:00,"Hardt Field (Bakersfield, CA)",277,MBA,2025
6310576,596515,UC Riverside Highlanders,596505,CSU Bakersfield Roadrunners,596505,4,bot,Zulaica struck out looking.,33,2025-04-04T00:00:00-04:00,"Hardt Field (Bakersfield, CA)",277,MBA,2025
6310576,596515,UC Riverside Highlanders,596505,CSU Bakersfield Roadrunners,596515,5,top,"RIVAS, A doubled down the rf line.",34,2025-04-04T00:00:00-04:00,"Hardt Field (Bakersfield, CA)",277,MBA,2025
6310576,596515,UC Riverside Highlanders,596505,CSU Bakersfield Roadrunners,596515,5,top,"GIBBS, D grounded out to c, SAC, bunt; RIVAS, A advanced to third.",35,2025-04-04T00:00:00-04:00,"Hardt Field (Bakersfield, CA)",277,MBA,2025
6310576,596515,UC Riverside Highlanders,596505,CSU Bakersfield Roadrunners,596515,5,top,"WHITTLE, D struck out swinging.",36,2025-04-04T00:00:00-04:00,"Hardt Field (Bakersfield, CA)",277,MBA,2025
6310576,596515,UC Riverside Highlanders,596505,CSU Bakersfield Roadrunners,596515,5,top,"PITTS, R singled to left field, RBI; RIVAS, A scored.",37,2025-04-04T00:00:00-04:00,"Hardt Field (Bakersfield, CA)",277,MBA,2025
6310576,596515,UC Riverside Highlanders,596505,CSU Bakersfield Roadrunners,596515,5,top,"PITTS, R stole second, advanced to third on a throwing error by c.",38,2025-04-04T00:00:00-04:00,"Hardt Field (Bakersfield, CA)",277,MBA,2025
6310576,596515,UC Riverside Highlanders,596505,CSU Bakersfield Roadrunners,596515,5,top,"REIS, T pinch hit for WALTON, T.",39,2025-04-04T00:00:00-04:00,"Hardt Field (Bakersfield, CA)",277,MBA,2025
6310576,596515,UC Riverside Highlanders,596505,CSU Bakersfield Roadrunners,596515,5,top,"REIS, T singled to center field, RBI; PITTS, R scored, unearned.",40,2025-04-04T00:00:00-04:00,"Hardt Field (Bakersfield, CA)",277,MBA,2025
6310576,596515,UC Riverside Highlanders,596505,CSU Bakersfield Roadrunners,596515,5,top,"NUNES, L struck out swinging.",41,2025-04-04T00:00:00-04:00,"Hardt Field (Bakersfield, CA)",277,MBA,2025
6310576,596515,UC Riverside Highlanders,596505,CSU Bakersfield Roadrunners,596505,5,bot,"BYRD, J to lf for REIS, T.",42,2025-04-04T00:00:00-04:00,"Hardt Field (Bakersfield, CA)",277,MBA,2025
6310576,596515,UC Riverside Highlanders,596505,CSU Bakersfield Roadrunners,596505,5,bot,"MARTON, K to p for MARTINEZ, J.",43,2025-04-04T00:00:00-04:00,"Hardt Field (Bakersfield, CA)",277,MBA,2025
6310576,596515,UC Riverside Highlanders,596505,CSU Bakersfield Roadrunners,596505,5,bot,Pollard flied out to cf.,44,2025-04-04T00:00:00-04:00,"Hardt Field (Bakersfield, CA)",277,MBA,2025
6310576,596515,UC Riverside Highlanders,596505,CSU Bakersfield Roadrunners,596505,5,bot,Alvarez out at first 1b to p.,45,2025-04-04T00:00:00-04:00,"Hardt Field (Bakersfield, CA)",277,MBA,2025
6310576,596515,UC Riverside Highlanders,596505,CSU Bakersfield Roadrunners,596505,5,bot,Cloyd struck out looking.,46,2025-04-04T00:00:00-04:00,"Hardt Field (Bakersfield, CA)",277,MBA,2025
6310576,596515,UC Riverside Highlanders,596505,CSU Bakersfield Roadrunners,596515,6,top,"LOPEZ, J flied out to cf.",47,2025-04-04T00:00:00-04:00,"Hardt Field (Bakersfield, CA)",277,MBA,2025
6310576,596515,UC Riverside Highlanders,596505,CSU Bakersfield Roadrunners,596515,6,top,"CHAPMAN, M struck out swinging.",48,2025-04-04T00:00:00-04:00,"Hardt Field (Bakersfield, CA)",277,MBA,2025
6310576,596515,UC Riverside Highlanders,596505,CSU Bakersfield Roadrunners,596515,6,top,"GORDON, T grounded out to ss.",49,2025-04-04T00:00:00-04:00,"Hardt Field (Bakersfield, CA)",277,MBA,2025
6310576,596515,UC Riverside Highlanders,596505,CSU Bakersfield Roadrunners,596505,6,bot,Mascaro struck out swinging.,50,2025-04-04T00:00:00-04:00,"Hardt Field (Bakersfield, CA)",277,MBA,2025
6310576,596515,UC Riverside Highlanders,596505,CSU Bakersfield Roadrunners,596505,6,bot,Hendriks flied out to rf.,51,2025-04-04T00:00:00-04:00,"Hardt Field (Bakersfield, CA)",277,MBA,2025
6310576,596515,UC Riverside Highlanders,596505,CSU Bakersfield Roadrunners,596505,6,bot,"Leroy struck out swinging, out at first c to 1b.",52,2025-04-04T00:00:00-04:00,"Hardt Field (Bakersfield, CA)",277,MBA,2025
6310576,596515,UC Riverside Highlanders,596505,CSU Bakersfield Roadrunners,596515,7,top,"Brown, C to p for King.",53,2025-04-04T00:00:00-04:00,"Hardt Field (Bakersfield, CA)",277,MBA,2025
6310576,596515,UC Riverside Highlanders,596505,CSU Bakersfield Roadrunners,596515,7,top,"RIVAS, A grounded out to ss.",54,2025-04-04T00:00:00-04:00,"Hardt Field (Bakersfield, CA)",277,MBA,2025
6310576,596515,UC Riverside Highlanders,596505,CSU Bakersfield Roadrunners,596515,7,top,"GIBBS, D popped up to ss.",55,2025-04-04T00:00:00-04:00,"Hardt Field (Bakersfield, CA)",277,MBA,2025
6310576,596515,UC Riverside Highlanders,596505,CSU Bakersfield Roadrunners,596515,7,top,"WHITTLE, D struck out swinging.",56,2025-04-04T00:00:00-04:00,"Hardt Field (Bakersfield, CA)",277,MBA,2025
6310576,596515,UC Riverside Highlanders,596505,CSU Bakersfield Roadrunners,596505,7,bot,Pelayo struck out swinging.,57,2025-04-04T00:00:00-04:00,"Hardt Field (Bakersfield, CA)",277,MBA,2025
6310576,596515,UC Riverside Highlanders,596505,CSU Bakersfield Roadrunners,596505,7,bot,"Ruch pinch hit for Johnson, T.",58,2025-04-04T00:00:00-04:00,"Hardt Field (Bakersfield, CA)",277,MBA,2025
6310576,596515,UC Riverside Highlanders,596505,CSU Bakersfield Roadrunners,596505,7,bot,Ruch struck out swinging.,59,2025-04-04T00:00:00-04:00,"Hardt Field (Bakersfield, CA)",277,MBA,2025
6310576,596515,UC Riverside Highlanders,596505,CSU Bakersfield Roadrunners,596505,7,bot,Salazar pinch hit for Zulaica.,60,2025-04-04T00:00:00-04:00,"Hardt Field (Bakersfield, CA)",277,MBA,2025
6310576,596515,UC Riverside Highlanders,596505,CSU Bakersfield Roadrunners,596505,7,bot,Salazar doubled down the rf line.,61,2025-04-04T00:00:00-04:00,"Hardt Field (Bakersfield, CA)",277,MBA,2025
6310576,596515,UC Riverside Highlanders,596505,CSU Bakersfield Roadrunners,596505,7,bot,BujandaMcCon pinch hit for Pollard.,62,2025-04-04T00:00:00-04:00,"Hardt Field (Bakersfield, CA)",277,MBA,2025
6310576,596515,UC Riverside Highlanders,596505,CSU Bakersfield Roadrunners,596505,7,bot,"BujandaMcCon singled to right field, RBI; Salazar scored.",63,2025-04-04T00:00:00-04:00,"Hardt Field (Bakersfield, CA)",277,MBA,2025
6310576,596515,UC Riverside Highlanders,596505,CSU Bakersfield Roadrunners,596505,7,bot,"HUDSON, M to p for MARTON, K.",64,2025-04-04T00:00:00-04:00,"Hardt Field (Bakersfield, CA)",277,MBA,2025
6310576,596515,UC Riverside Highlanders,596505,CSU Bakersfield Roadrunners,596505,7,bot,"Alvarez tripled to right center, RBI; BujandaMcCon scored.",65,2025-04-04T00:00:00-04:00,"Hardt Field (Bakersfield, CA)",277,MBA,2025
6310576,596515,UC Riverside Highlanders,596505,CSU Bakersfield Roadrunners,596505,7,bot,"Cloyd doubled to center field, RBI; Alvarez scored.",66,2025-04-04T00:00:00-04:00,"Hardt Field (Bakersfield, CA)",277,MBA,2025
6310576,596515,UC Riverside Highlanders,596505,CSU Bakersfield Roadrunners,596505,7,bot,Mascaro intentionally walked.,67,2025-04-04T00:00:00-04:00,"Hardt Field (Bakersfield, CA)",277,MBA,2025
6310576,596515,UC Riverside Highlanders,596505,CSU Bakersfield Roadrunners,596505,7,bot,"Hendriks singled to right field, RBI; Mascaro advanced to second; Cloyd scored.",68,2025-04-04T00:00:00-04:00,"Hardt Field (Bakersfield, CA)",277,MBA,2025
6310576,596515,UC Riverside Highlanders,596505,CSU Bakersfield Roadrunners,596505,7,bot,"Leroy singled to left field, advanced to second, RBI; Hendriks advanced to third; Mascaro scored.",69,2025-04-04T00:00:00-04:00,"Hardt Field (Bakersfield, CA)",277,MBA,2025
6310576,596515,UC Riverside Highlanders,596505,CSU Bakersfield Roadrunners,596505,7,bot,"DiGIROLA, M to p for HUDSON, M.",70,2025-04-04T00:00:00-04:00,"Hardt Field (Bakersfield, CA)",277,MBA,2025
6310576,596515,UC Riverside Highlanders,596505,CSU Bakersfield Roadrunners,596505,7,bot,"Pelayo singled to center field, advanced to second on the throw, 2 RBI; Leroy scored; Hendriks scored.",71,2025-04-04T00:00:00-04:00,"Hardt Field (Bakersfield, CA)",277,MBA,2025
6310576,596515,UC Riverside Highlanders,596505,CSU Bakersfield Roadrunners,596505,7,bot,Ruch struck out swinging.,72,2025-04-04T00:00:00-04:00,"Hardt Field (Bakersfield, CA)",277,MBA,2025
6310576,596515,UC Riverside Highlanders,596505,CSU Bakersfield Roadrunners,596515,8,top,Ruch to dh.,73,2025-04-04T00:00:00-04:00,"Hardt Field (Bakersfield, CA)",277,MBA,2025
6310576,596515,UC Riverside Highlanders,596505,CSU Bakersfield Roadrunners,596515,8,top,Barnum V to 2b for Salazar.,74,2025-04-04T00:00:00-04:00,"Hardt Field (Bakersfield, CA)",277,MBA,2025
6310576,596515,UC Riverside Highlanders,596505,CSU Bakersfield Roadrunners,596515,8,top,BujandaMcCon to lf.,75,2025-04-04T00:00:00-04:00,"Hardt Field (Bakersfield, CA)",277,MBA,2025
6310576,596515,UC Riverside Highlanders,596505,CSU Bakersfield Roadrunners,596515,8,top,"PITTS, R lined out to p.",76,2025-04-04T00:00:00-04:00,"Hardt Field (Bakersfield, CA)",277,MBA,2025
6310576,596515,UC Riverside Highlanders,596505,CSU Bakersfield Roadrunners,596515,8,top,"BYRD, J singled to left field.",77,2025-04-04T00:00:00-04:00,"Hardt Field (Bakersfield, CA)",277,MBA,2025
6310576,596515,UC Riverside Highlanders,596505,CSU Bakersfield Roadrunners,596515,8,top,"NUNES, L flied out to lf.",78,2025-04-04T00:00:00-04:00,"Hardt Field (Bakersfield, CA)",277,MBA,2025
6310576,596515,UC Riverside Highlanders,596505,CSU Bakersfield Roadrunners,596515,8,top,"LOPEZ, J struck out looking.",79,2025-04-04T00:00:00-04:00,"Hardt Field (Bakersfield, CA)",277,MBA,2025
6310576,596515,UC Riverside Highlanders,596505,CSU Bakersfield Roadrunners,596505,8,bot,"GODINA, B to p for DiGIROLA, M.",80,2025-04-04T00:00:00-04:00,"Hardt Field (Bakersfield, CA)",277,MBA,2025
6310576,596515,UC Riverside Highlanders,596505,CSU Bakersfield Roadrunners,596505,8,bot,Barnum V hit by pitch.,81,2025-04-04T00:00:00-04:00,"Hardt Field (Bakersfield, CA)",277,MBA,2025
6310576,596515,UC Riverside Highlanders,596505,CSU Bakersfield Roadrunners,596505,8,bot,Barnum V stole second.,82,2025-04-04T00:00:00-04:00,"Hardt Field (Bakersfield, CA)",277,MBA,2025
6310576,596515,UC Riverside Highlanders,596505,CSU Bakersfield Roadrunners,596505,8,bot,BujandaMcCon flied out to lf.,83,2025-04-04T00:00:00-04:00,"Hardt Field (Bakersfield, CA)",277,MBA,2025
6310576,596515,UC Riverside Highlanders,596505,CSU Bakersfield Roadrunners,596505,8,bot,Alvarez struck out swinging.,84,2025-04-04T00:00:00-04:00,"Hardt Field (Bakersfield, CA)",277,MBA,2025
6310576,596515,UC Riverside Highlanders,596505,CSU Bakersfield Roadrunners,596505,8,bot,Cloyd hit by pitch.,85,2025-04-04T00:00:00-04:00,"Hardt Field (Bakersfield, CA)",277,MBA,2025
6310576,596515,UC Riverside Highlanders,596505,CSU Bakersfield Roadrunners,596505,8,bot,Mascaro walked; Cloyd advanced to second; Barnum V advanced to third.,86,2025-04-04T00:00:00-04:00,"Hardt Field (Bakersfield, CA)",277,MBA,2025
6310576,596515,UC Riverside Highlanders,596505,CSU Bakersfield Roadrunners,596505,8,bot,Hendriks flied out to lf.,87,2025-04-04T00:00:00-04:00,"Hardt Field (Bakersfield, CA)",277,MBA,2025
6310576,596515,UC Riverside Highlanders,596505,CSU Bakersfield Roadrunners,596515,9,top,"Morisaki to p for Brown, C.",88,2025-04-04T00:00:00-04:00,"Hardt Field (Bakersfield, CA)",277,MBA,2025
6310576,596515,UC Riverside Highlanders,596505,CSU Bakersfield Roadrunners,596515,9,top,"CHAPMAN, M singled to center field.",89,2025-04-04T00:00:00-04:00,"Hardt Field (Bakersfield, CA)",277,MBA,2025
6310576,596515,UC Riverside Highlanders,596505,CSU Bakersfield Roadrunners,596515,9,top,"CHAPMAN, M advanced to second on a wild pitch.",90,2025-04-04T00:00:00-04:00,"Hardt Field (Bakersfield, CA)",277,MBA,2025
6310576,596515,UC Riverside Highlanders,596505,CSU Bakersfield Roadrunners,596515,9,top,"GORDON, T lined out to p.",91,2025-04-04T00:00:00-04:00,"Hardt Field (Bakersfield, CA)",277,MBA,2025
6310576,596515,UC Riverside Highlanders,596505,CSU Bakersfield Roadrunners,596515,9,top,"RIVAS, A struck out looking.",92,2025-04-04T00:00:00-04:00,"Hardt Field (Bakersfield, CA)",277,MBA,2025
6310576,596515,UC Riverside Highlanders,596505,CSU Bakersfield Roadrunners,596515,9,top,"GIBBS, D walked.",93,2025-04-04T00:00:00-04:00,"Hardt Field (Bakersfield, CA)",277,MBA,2025
6310576,596515,UC Riverside Highlanders,596505,CSU Bakersfield Roadrunners,596515,9,top,"BERGAN, E pinch hit for WHITTLE, D.",94,2025-04-04T00:00:00-04:00,"Hardt Field (Bakersfield, CA)",277,MBA,2025
6310576,596515,UC Riverside Highlanders,596505,CSU Bakersfield Roadrunners,596515,9,top,"BERGAN, E struck out swinging.",95,2025-04-04T00:00:00-04:00,"Hardt Field (Bakersfield, CA)",277,MBA,2025
