game_id,away_team_id,away_team_name,home_team_id,home_team_name,batting_team,inning,top_bot,event_text,event_num,game_datetime,stadium_name,attendance,sport_id,season
6317949,596624,New Orleans Privateers,596947,West Ga. Wolves,596624,1,top,D. Villescas grounded out to ss.,1,2025-02-15T00:00:00-05:00,"Cole Field (Carrollton, GA)",227,MBA,2025
6317949,596624,New Orleans Privateers,596947,West Ga. Wolves,596624,1,top,A. Saunier fouled out to c.,2,2025-02-15T00:00:00-05:00,"Cole Field (Carrollton, GA)",227,MBA,2025
6317949,596624,New Orleans Privateers,596947,West Ga. Wolves,596624,1,top,B. Loriga flied out to cf.,3,2025-02-15T00:00:00-05:00,"Cole Field (Carrollton, GA)",227,MBA,2025
6317949,596624,New Orleans Privateers,596947,West Ga. Wolves,596947,1,bot,C. Prince tripled to right field.,4,2025-02-15T00:00:00-05:00,"Cole Field (Carrollton, GA)",227,MBA,2025
6317949,596624,New Orleans Privateers,596947,West Ga. Wolves,596947,1,bot,C. Dierdorf struck out swinging.,5,2025-02-15T00:00:00-05:00,"Cole Field (Carrollton, GA)",227,MBA,2025
6317949,596624,New Orleans Privateers,596947,West Ga. Wolves,596947,1,bot,"McCullough singled through the right side, RBI3a C. Prince scored.",6,2025-02-15T00:00:00-05:00,"Cole Field (Carrollton, GA)",227,MBA,2025
6317949,596624,New Orleans Privateers,596947,West Ga. Wolves,596947,1,bot,"McCullough out at second c to 2b, caught stealing.",7,2025-02-15T00:00:00-05:00,"Cole Field (Carrollton, GA)",227,MBA,2025
6317949,596624,New Orleans Privateers,596947,West Ga. Wolves,596947,1,bot,N. Darden grounded out to 3b.,8,2025-02-15T00:00:00-05:00,"Cole Field (Carrollton, GA)",227,MBA,2025
6317949,596624,New Orleans Privateers,596947,West Ga. Wolves,596624,2,top,T. Moore hit by pitch.,9,2025-02-15T00:00:00-05:00,"Cole Field (Carrollton, GA)",227,MBA,2025
6317949,596624,New Orleans Privateers,596947,West Ga. Wolves,596624,2,top,B. Calloway doubled to center field3a T. Moore advanced to third.,10,2025-02-15T00:00:00-05:00,"Cole Field (Carrollton, GA)",227,MBA,2025
6317949,596624,New Orleans Privateers,596947,West Ga. Wolves,596624,2,top,C. Husser popped up to 2b.,11,2025-02-15T00:00:00-05:00,"Cole Field (Carrollton, GA)",227,MBA,2025
6317949,596624,New Orleans Privateers,596947,West Ga. Wolves,596624,2,top,K. Evans struck out looking.,12,2025-02-15T00:00:00-05:00,"Cole Field (Carrollton, GA)",227,MBA,2025
6317949,596624,New Orleans Privateers,596947,West Ga. Wolves,596624,2,top,J. D'Altrui popped up to rf.,13,2025-02-15T00:00:00-05:00,"Cole Field (Carrollton, GA)",227,MBA,2025
6317949,596624,New Orleans Privateers,596947,West Ga. Wolves,596947,2,bot,L. Weidner flied out to cf.,14,2025-02-15T00:00:00-05:00,"Cole Field (Carrollton, GA)",227,MBA,2025
6317949,596624,New Orleans Privateers,596947,West Ga. Wolves,596947,2,bot,B. Bradford struck out swinging.,15,2025-02-15T00:00:00-05:00,"Cole Field (Carrollton, GA)",227,MBA,2025
6317949,596624,New Orleans Privateers,596947,West Ga. Wolves,596947,2,bot,H. Smith flied out to rf.,16,2025-02-15T00:00:00-05:00,"Cole Field (Carrollton, GA)",227,MBA,2025
6317949,596624,New Orleans Privateers,596947,West Ga. Wolves,596624,3,top,J. Best struck out swinging.,17,2025-02-15T00:00:00-05:00,"Cole Field (Carrollton, GA)",227,MBA,2025
6317949,596624,New Orleans Privateers,596947,West Ga. Wolves,596624,3,top,D. Villescas singled to shortstop.,18,2025-02-15T00:00:00-05:00,"Cole Field (Carrollton, GA)",227,MBA,2025
6317949,596624,New Orleans Privateers,596947,West Ga. Wolves,596624,3,top,A. Saunier flied out to rf3a D. Villescas advanced to second.,19,2025-02-15T00:00:00-05:00,"Cole Field (Carrollton, GA)",227,MBA,2025
6317949,596624,New Orleans Privateers,596947,West Ga. Wolves,596624,3,top,D. Villescas advanced to third on a wild pitch.,20,2025-02-15T00:00:00-05:00,"Cole Field (Carrollton, GA)",227,MBA,2025
6317949,596624,New Orleans Privateers,596947,West Ga. Wolves,596624,3,top,B. Loriga struck out swinging.,21,2025-02-15T00:00:00-05:00,"Cole Field (Carrollton, GA)",227,MBA,2025
6317949,596624,New Orleans Privateers,596947,West Ga. Wolves,596947,3,bot,J. Witmer singled through the right side.,22,2025-02-15T00:00:00-05:00,"Cole Field (Carrollton, GA)",227,MBA,2025
6317949,596624,New Orleans Privateers,596947,West Ga. Wolves,596947,3,bot,J. Witmer stole second.,23,2025-02-15T00:00:00-05:00,"Cole Field (Carrollton, GA)",227,MBA,2025
6317949,596624,New Orleans Privateers,596947,West Ga. Wolves,596947,3,bot,"W. McConnell grounded out to 3b, SAC3a J. Witmer advanced to third.",24,2025-02-15T00:00:00-05:00,"Cole Field (Carrollton, GA)",227,MBA,2025
6317949,596624,New Orleans Privateers,596947,West Ga. Wolves,596947,3,bot,J. Witmer scored on a wild pitch.,25,2025-02-15T00:00:00-05:00,"Cole Field (Carrollton, GA)",227,MBA,2025
6317949,596624,New Orleans Privateers,596947,West Ga. Wolves,596947,3,bot,C. Prince walked.,26,2025-02-15T00:00:00-05:00,"Cole Field (Carrollton, GA)",227,MBA,2025
6317949,596624,New Orleans Privateers,596947,West Ga. Wolves,596947,3,bot,C. Dierdorf walked3a C. Prince advanced to second.,27,2025-02-15T00:00:00-05:00,"Cole Field (Carrollton, GA)",227,MBA,2025
6317949,596624,New Orleans Privateers,596947,West Ga. Wolves,596947,3,bot,"McCullough singled to right field3a C. Dierdorf advanced to second3a C. Prince advanced to third, out at home rf to c.",28,2025-02-15T00:00:00-05:00,"Cole Field (Carrollton, GA)",227,MBA,2025
6317949,596624,New Orleans Privateers,596947,West Ga. Wolves,596947,3,bot,N. Darden grounded out to ss.,29,2025-02-15T00:00:00-05:00,"Cole Field (Carrollton, GA)",227,MBA,2025
6317949,596624,New Orleans Privateers,596947,West Ga. Wolves,596624,4,top,T. Moore grounded out to 1b unassisted.,30,2025-02-15T00:00:00-05:00,"Cole Field (Carrollton, GA)",227,MBA,2025
6317949,596624,New Orleans Privateers,596947,West Ga. Wolves,596624,4,top,B. Calloway popped up to rf.,31,2025-02-15T00:00:00-05:00,"Cole Field (Carrollton, GA)",227,MBA,2025
6317949,596624,New Orleans Privateers,596947,West Ga. Wolves,596624,4,top,C. Husser doubled through the left side.,32,2025-02-15T00:00:00-05:00,"Cole Field (Carrollton, GA)",227,MBA,2025
6317949,596624,New Orleans Privateers,596947,West Ga. Wolves,596624,4,top,K. Evans grounded out to ss.,33,2025-02-15T00:00:00-05:00,"Cole Field (Carrollton, GA)",227,MBA,2025
6317949,596624,New Orleans Privateers,596947,West Ga. Wolves,596947,4,bot,L. Weidner popped up to 2b.,34,2025-02-15T00:00:00-05:00,"Cole Field (Carrollton, GA)",227,MBA,2025
6317949,596624,New Orleans Privateers,596947,West Ga. Wolves,596947,4,bot,B. Bradford struck out swinging.,35,2025-02-15T00:00:00-05:00,"Cole Field (Carrollton, GA)",227,MBA,2025
6317949,596624,New Orleans Privateers,596947,West Ga. Wolves,596947,4,bot,H. Smith grounded out to 2b.,36,2025-02-15T00:00:00-05:00,"Cole Field (Carrollton, GA)",227,MBA,2025
6317949,596624,New Orleans Privateers,596947,West Ga. Wolves,596624,5,top,J. D'Altrui walked.,37,2025-02-15T00:00:00-05:00,"Cole Field (Carrollton, GA)",227,MBA,2025
6317949,596624,New Orleans Privateers,596947,West Ga. Wolves,596624,5,top,J. Best singled to right field3a J. D'Altrui advanced to third.,38,2025-02-15T00:00:00-05:00,"Cole Field (Carrollton, GA)",227,MBA,2025
6317949,596624,New Orleans Privateers,596947,West Ga. Wolves,596624,5,top,D. Villescas walked3a J. Best advanced to second.,39,2025-02-15T00:00:00-05:00,"Cole Field (Carrollton, GA)",227,MBA,2025
6317949,596624,New Orleans Privateers,596947,West Ga. Wolves,596624,5,top,D. Villescas advanced to second on a wild pitch3a J. Best advanced to third on a wild pitch3a J. D'Altrui out at home c to p.,40,2025-02-15T00:00:00-05:00,"Cole Field (Carrollton, GA)",227,MBA,2025
6317949,596624,New Orleans Privateers,596947,West Ga. Wolves,596624,5,top,A. Saunier hit by pitch.,41,2025-02-15T00:00:00-05:00,"Cole Field (Carrollton, GA)",227,MBA,2025
6317949,596624,New Orleans Privateers,596947,West Ga. Wolves,596624,5,top,"B. Loriga popped up to 3b, SAC, RBI3a A. Saunier advanced to second3a D. Villescas advanced to third3a J. Best scored.",42,2025-02-15T00:00:00-05:00,"Cole Field (Carrollton, GA)",227,MBA,2025
6317949,596624,New Orleans Privateers,596947,West Ga. Wolves,596624,5,top,T. Moore flied out to cf.,43,2025-02-15T00:00:00-05:00,"Cole Field (Carrollton, GA)",227,MBA,2025
6317949,596624,New Orleans Privateers,596947,West Ga. Wolves,596947,5,bot,J. Witmer popped up to cf.,44,2025-02-15T00:00:00-05:00,"Cole Field (Carrollton, GA)",227,MBA,2025
6317949,596624,New Orleans Privateers,596947,West Ga. Wolves,596947,5,bot,W. McConnell grounded out to ss.,45,2025-02-15T00:00:00-05:00,"Cole Field (Carrollton, GA)",227,MBA,2025
6317949,596624,New Orleans Privateers,596947,West Ga. Wolves,596947,5,bot,C. Prince singled to right field.,46,2025-02-15T00:00:00-05:00,"Cole Field (Carrollton, GA)",227,MBA,2025
6317949,596624,New Orleans Privateers,596947,West Ga. Wolves,596947,5,bot,C. Dierdorf walked3a C. Prince advanced to second.,47,2025-02-15T00:00:00-05:00,"Cole Field (Carrollton, GA)",227,MBA,2025
6317949,596624,New Orleans Privateers,596947,West Ga. Wolves,596947,5,bot,M. Green to p for Z. Longshore.,48,2025-02-15T00:00:00-05:00,"Cole Field (Carrollton, GA)",227,MBA,2025
6317949,596624,New Orleans Privateers,596947,West Ga. Wolves,596947,5,bot,McCullough walked3a C. Dierdorf advanced to second3a C. Prince advanced to third.,49,2025-02-15T00:00:00-05:00,"Cole Field (Carrollton, GA)",227,MBA,2025
6317949,596624,New Orleans Privateers,596947,West Ga. Wolves,596947,5,bot,"N. Darden homered to right field, 4 RBI3a McCullough scored3a C. Dierdorf scored3a C. Prince scored.",50,2025-02-15T00:00:00-05:00,"Cole Field (Carrollton, GA)",227,MBA,2025
6317949,596624,New Orleans Privateers,596947,West Ga. Wolves,596947,5,bot,L. Weidner flied out to cf.,51,2025-02-15T00:00:00-05:00,"Cole Field (Carrollton, GA)",227,MBA,2025
6317949,596624,New Orleans Privateers,596947,West Ga. Wolves,596624,6,top,B. Gomez to p for S. Cole.,52,2025-02-15T00:00:00-05:00,"Cole Field (Carrollton, GA)",227,MBA,2025
6317949,596624,New Orleans Privateers,596947,West Ga. Wolves,596624,6,top,"B. Calloway homered, RBI.",53,2025-02-15T00:00:00-05:00,"Cole Field (Carrollton, GA)",227,MBA,2025
6317949,596624,New Orleans Privateers,596947,West Ga. Wolves,596624,6,top,C. Husser reached on an error by ss.,54,2025-02-15T00:00:00-05:00,"Cole Field (Carrollton, GA)",227,MBA,2025
6317949,596624,New Orleans Privateers,596947,West Ga. Wolves,596624,6,top,K. Evans walked3a C. Husser advanced to second.,55,2025-02-15T00:00:00-05:00,"Cole Field (Carrollton, GA)",227,MBA,2025
6317949,596624,New Orleans Privateers,596947,West Ga. Wolves,596624,6,top,K. Evans advanced to second on a wild pitch3a C. Husser advanced to third on a wild pitch.,56,2025-02-15T00:00:00-05:00,"Cole Field (Carrollton, GA)",227,MBA,2025
6317949,596624,New Orleans Privateers,596947,West Ga. Wolves,596624,6,top,"J. D'Altrui flied out to rf, SAC, RBI3a K. Evans advanced to third3a C. Husser scored.",57,2025-02-15T00:00:00-05:00,"Cole Field (Carrollton, GA)",227,MBA,2025
6317949,596624,New Orleans Privateers,596947,West Ga. Wolves,596624,6,top,J. Best singled.,58,2025-02-15T00:00:00-05:00,"Cole Field (Carrollton, GA)",227,MBA,2025
6317949,596624,New Orleans Privateers,596947,West Ga. Wolves,596624,6,top,"D. Villescas flied out to cf, SF, RBI3a K. Evans scored, unearned.",59,2025-02-15T00:00:00-05:00,"Cole Field (Carrollton, GA)",227,MBA,2025
6317949,596624,New Orleans Privateers,596947,West Ga. Wolves,596624,6,top,"J. Best stole second, advanced to third on a throwing error by c.",60,2025-02-15T00:00:00-05:00,"Cole Field (Carrollton, GA)",227,MBA,2025
6317949,596624,New Orleans Privateers,596947,West Ga. Wolves,596624,6,top,A. Saunier grounded out to 2b.,61,2025-02-15T00:00:00-05:00,"Cole Field (Carrollton, GA)",227,MBA,2025
6317949,596624,New Orleans Privateers,596947,West Ga. Wolves,596947,6,bot,T. Velino to p for M. Green.,62,2025-02-15T00:00:00-05:00,"Cole Field (Carrollton, GA)",227,MBA,2025
6317949,596624,New Orleans Privateers,596947,West Ga. Wolves,596947,6,bot,"B. Bradford homered to right field, RBI.",63,2025-02-15T00:00:00-05:00,"Cole Field (Carrollton, GA)",227,MBA,2025
6317949,596624,New Orleans Privateers,596947,West Ga. Wolves,596947,6,bot,H. Smith struck out looking.,64,2025-02-15T00:00:00-05:00,"Cole Field (Carrollton, GA)",227,MBA,2025
6317949,596624,New Orleans Privateers,596947,West Ga. Wolves,596947,6,bot,J. Witmer reached on an error by p.,65,2025-02-15T00:00:00-05:00,"Cole Field (Carrollton, GA)",227,MBA,2025
6317949,596624,New Orleans Privateers,596947,West Ga. Wolves,596947,6,bot,W. McConnell struck out swinging.,66,2025-02-15T00:00:00-05:00,"Cole Field (Carrollton, GA)",227,MBA,2025
6317949,596624,New Orleans Privateers,596947,West Ga. Wolves,596947,6,bot,C. Prince flied out to rf.,67,2025-02-15T00:00:00-05:00,"Cole Field (Carrollton, GA)",227,MBA,2025
6317949,596624,New Orleans Privateers,596947,West Ga. Wolves,596624,7,top,"B. Loriga homered to left field, RBI.",68,2025-02-15T00:00:00-05:00,"Cole Field (Carrollton, GA)",227,MBA,2025
6317949,596624,New Orleans Privateers,596947,West Ga. Wolves,596624,7,top,D. Williams to p for B. Gomez.,69,2025-02-15T00:00:00-05:00,"Cole Field (Carrollton, GA)",227,MBA,2025
6317949,596624,New Orleans Privateers,596947,West Ga. Wolves,596624,7,top,"T. Moore homered to right field, RBI.",70,2025-02-15T00:00:00-05:00,"Cole Field (Carrollton, GA)",227,MBA,2025
6317949,596624,New Orleans Privateers,596947,West Ga. Wolves,596624,7,top,"B. Calloway homered to left field, RBI.",71,2025-02-15T00:00:00-05:00,"Cole Field (Carrollton, GA)",227,MBA,2025
6317949,596624,New Orleans Privateers,596947,West Ga. Wolves,596624,7,top,C. Husser struck out looking.,72,2025-02-15T00:00:00-05:00,"Cole Field (Carrollton, GA)",227,MBA,2025
6317949,596624,New Orleans Privateers,596947,West Ga. Wolves,596624,7,top,K. Evans struck out swinging.,73,2025-02-15T00:00:00-05:00,"Cole Field (Carrollton, GA)",227,MBA,2025
6317949,596624,New Orleans Privateers,596947,West Ga. Wolves,596624,7,top,J. D'Altrui singled through the left side.,74,2025-02-15T00:00:00-05:00,"Cole Field (Carrollton, GA)",227,MBA,2025
6317949,596624,New Orleans Privateers,596947,West Ga. Wolves,596624,7,top,J. Rogers pinch hit for J. Best.,75,2025-02-15T00:00:00-05:00,"Cole Field (Carrollton, GA)",227,MBA,2025
6317949,596624,New Orleans Privateers,596947,West Ga. Wolves,596624,7,top,J. Rogers grounded out to ss.,76,2025-02-15T00:00:00-05:00,"Cole Field (Carrollton, GA)",227,MBA,2025
6317949,596624,New Orleans Privateers,596947,West Ga. Wolves,596947,7,bot,J. Best to rf for J. Rogers.,77,2025-02-15T00:00:00-05:00,"Cole Field (Carrollton, GA)",227,MBA,2025
6317949,596624,New Orleans Privateers,596947,West Ga. Wolves,596947,7,bot,C. Syversen to p for T. Velino.,78,2025-02-15T00:00:00-05:00,"Cole Field (Carrollton, GA)",227,MBA,2025
6317949,596624,New Orleans Privateers,596947,West Ga. Wolves,596947,7,bot,"C. Dierdorf homered to left field, RBI.",79,2025-02-15T00:00:00-05:00,"Cole Field (Carrollton, GA)",227,MBA,2025
6317949,596624,New Orleans Privateers,596947,West Ga. Wolves,596947,7,bot,McCullough grounded out to 1b unassisted.,80,2025-02-15T00:00:00-05:00,"Cole Field (Carrollton, GA)",227,MBA,2025
6317949,596624,New Orleans Privateers,596947,West Ga. Wolves,596947,7,bot,N. Darden singled.,81,2025-02-15T00:00:00-05:00,"Cole Field (Carrollton, GA)",227,MBA,2025
6317949,596624,New Orleans Privateers,596947,West Ga. Wolves,596947,7,bot,L. Weidner walked3a N. Darden advanced to second.,82,2025-02-15T00:00:00-05:00,"Cole Field (Carrollton, GA)",227,MBA,2025
6317949,596624,New Orleans Privateers,596947,West Ga. Wolves,596947,7,bot,I. Austin to p for C. Syversen.,83,2025-02-15T00:00:00-05:00,"Cole Field (Carrollton, GA)",227,MBA,2025
6317949,596624,New Orleans Privateers,596947,West Ga. Wolves,596947,7,bot,B. Bradford hit into double play 1b unassisted3a L. Weidner out on the play.,84,2025-02-15T00:00:00-05:00,"Cole Field (Carrollton, GA)",227,MBA,2025
6317949,596624,New Orleans Privateers,596947,West Ga. Wolves,596624,8,top,D. Drakeford to p for D. Williams.,85,2025-02-15T00:00:00-05:00,"Cole Field (Carrollton, GA)",227,MBA,2025
6317949,596624,New Orleans Privateers,596947,West Ga. Wolves,596624,8,top,D. Villescas fouled out to 1b.,86,2025-02-15T00:00:00-05:00,"Cole Field (Carrollton, GA)",227,MBA,2025
6317949,596624,New Orleans Privateers,596947,West Ga. Wolves,596624,8,top,A. Saunier walked.,87,2025-02-15T00:00:00-05:00,"Cole Field (Carrollton, GA)",227,MBA,2025
6317949,596624,New Orleans Privateers,596947,West Ga. Wolves,596624,8,top,B. Loriga flied out to cf.,88,2025-02-15T00:00:00-05:00,"Cole Field (Carrollton, GA)",227,MBA,2025
6317949,596624,New Orleans Privateers,596947,West Ga. Wolves,596624,8,top,"T. Moore homered through the left side, 2 RBI3a A. Saunier scored.",89,2025-02-15T00:00:00-05:00,"Cole Field (Carrollton, GA)",227,MBA,2025
6317949,596624,New Orleans Privateers,596947,West Ga. Wolves,596624,8,top,B. Calloway singled to center field.,90,2025-02-15T00:00:00-05:00,"Cole Field (Carrollton, GA)",227,MBA,2025
6317949,596624,New Orleans Privateers,596947,West Ga. Wolves,596624,8,top,"C. Husser doubled through the right side, RBI3a B. Calloway scored.",91,2025-02-15T00:00:00-05:00,"Cole Field (Carrollton, GA)",227,MBA,2025
6317949,596624,New Orleans Privateers,596947,West Ga. Wolves,596624,8,top,K. Evans walked.,92,2025-02-15T00:00:00-05:00,"Cole Field (Carrollton, GA)",227,MBA,2025
6317949,596624,New Orleans Privateers,596947,West Ga. Wolves,596624,8,top,J. D'Altrui grounded out to ss.,93,2025-02-15T00:00:00-05:00,"Cole Field (Carrollton, GA)",227,MBA,2025
6317949,596624,New Orleans Privateers,596947,West Ga. Wolves,596947,8,bot,M. Cooper to c for H. Smith.,94,2025-02-15T00:00:00-05:00,"Cole Field (Carrollton, GA)",227,MBA,2025
6317949,596624,New Orleans Privateers,596947,West Ga. Wolves,596947,8,bot,M. Cooper walked.,95,2025-02-15T00:00:00-05:00,"Cole Field (Carrollton, GA)",227,MBA,2025
6317949,596624,New Orleans Privateers,596947,West Ga. Wolves,596947,8,bot,J. Witmer singled through the right side3a M. Cooper advanced to second.,96,2025-02-15T00:00:00-05:00,"Cole Field (Carrollton, GA)",227,MBA,2025
6317949,596624,New Orleans Privateers,596947,West Ga. Wolves,596947,8,bot,W. McConnell walked3a J. Witmer advanced to second3a M. Cooper advanced to third.,97,2025-02-15T00:00:00-05:00,"Cole Field (Carrollton, GA)",227,MBA,2025
6317949,596624,New Orleans Privateers,596947,West Ga. Wolves,596947,8,bot,C. Prince fouled out to 3b.,98,2025-02-15T00:00:00-05:00,"Cole Field (Carrollton, GA)",227,MBA,2025
6317949,596624,New Orleans Privateers,596947,West Ga. Wolves,596947,8,bot,"C. Dierdorf reached on a fielder's choice, RBI3a W. McConnell out at second ss to 2b3a J. Witmer advanced to third3a M. Cooper scored.",99,2025-02-15T00:00:00-05:00,"Cole Field (Carrollton, GA)",227,MBA,2025
6317949,596624,New Orleans Privateers,596947,West Ga. Wolves,596947,8,bot,"McCullough singled through the right side, RBI3a C. Dierdorf advanced to second3a J. Witmer scored.",100,2025-02-15T00:00:00-05:00,"Cole Field (Carrollton, GA)",227,MBA,2025
6317949,596624,New Orleans Privateers,596947,West Ga. Wolves,596947,8,bot,N. Darden walked3a McCullough advanced to second3a C. Dierdorf advanced to third.,101,2025-02-15T00:00:00-05:00,"Cole Field (Carrollton, GA)",227,MBA,2025
6317949,596624,New Orleans Privateers,596947,West Ga. Wolves,596947,8,bot,B. McDevitt pinch hit for L. Weidner.,102,2025-02-15T00:00:00-05:00,"Cole Field (Carrollton, GA)",227,MBA,2025
6317949,596624,New Orleans Privateers,596947,West Ga. Wolves,596947,8,bot,A. Torrez to p for I. Austin.,103,2025-02-15T00:00:00-05:00,"Cole Field (Carrollton, GA)",227,MBA,2025
6317949,596624,New Orleans Privateers,596947,West Ga. Wolves,596947,8,bot,B. McDevitt grounded out to c.,104,2025-02-15T00:00:00-05:00,"Cole Field (Carrollton, GA)",227,MBA,2025
6317949,596624,New Orleans Privateers,596947,West Ga. Wolves,596624,9,top,L. Weidner to rf for B. McDevitt.,105,2025-02-15T00:00:00-05:00,"Cole Field (Carrollton, GA)",227,MBA,2025
6317949,596624,New Orleans Privateers,596947,West Ga. Wolves,596624,9,top,G. Mask to p for D. Drakeford.,106,2025-02-15T00:00:00-05:00,"Cole Field (Carrollton, GA)",227,MBA,2025
6317949,596624,New Orleans Privateers,596947,West Ga. Wolves,596624,9,top,J. Rogers pinch hit for J. Best.,107,2025-02-15T00:00:00-05:00,"Cole Field (Carrollton, GA)",227,MBA,2025
6317949,596624,New Orleans Privateers,596947,West Ga. Wolves,596624,9,top,J. Rogers flied out to cf.,108,2025-02-15T00:00:00-05:00,"Cole Field (Carrollton, GA)",227,MBA,2025
6317949,596624,New Orleans Privateers,596947,West Ga. Wolves,596624,9,top,D. Villescas popped up to 2b.,109,2025-02-15T00:00:00-05:00,"Cole Field (Carrollton, GA)",227,MBA,2025
6317949,596624,New Orleans Privateers,596947,West Ga. Wolves,596624,9,top,A. Saunier popped up to cf.,110,2025-02-15T00:00:00-05:00,"Cole Field (Carrollton, GA)",227,MBA,2025
6317949,596624,New Orleans Privateers,596947,West Ga. Wolves,596947,9,bot,J. Best to rf for J. Rogers.,111,2025-02-15T00:00:00-05:00,"Cole Field (Carrollton, GA)",227,MBA,2025
6317949,596624,New Orleans Privateers,596947,West Ga. Wolves,596947,9,bot,B. Bradford walked.,112,2025-02-15T00:00:00-05:00,"Cole Field (Carrollton, GA)",227,MBA,2025
6317949,596624,New Orleans Privateers,596947,West Ga. Wolves,596947,9,bot,M. Cooper walked3a B. Bradford advanced to second.,113,2025-02-15T00:00:00-05:00,"Cole Field (Carrollton, GA)",227,MBA,2025
6317949,596624,New Orleans Privateers,596947,West Ga. Wolves,596947,9,bot,C. Kimball to p for A. Torrez.,114,2025-02-15T00:00:00-05:00,"Cole Field (Carrollton, GA)",227,MBA,2025
6317949,596624,New Orleans Privateers,596947,West Ga. Wolves,596947,9,bot,J. Witmer singled3a M. Cooper advanced to second3a B. Bradford advanced to third.,115,2025-02-15T00:00:00-05:00,"Cole Field (Carrollton, GA)",227,MBA,2025
6317949,596624,New Orleans Privateers,596947,West Ga. Wolves,596947,9,bot,T. Presnell pinch hit for W. McConnell.,116,2025-02-15T00:00:00-05:00,"Cole Field (Carrollton, GA)",227,MBA,2025
6317949,596624,New Orleans Privateers,596947,West Ga. Wolves,596947,9,bot,T. Presnell struck out swinging.,117,2025-02-15T00:00:00-05:00,"Cole Field (Carrollton, GA)",227,MBA,2025
6317949,596624,New Orleans Privateers,596947,West Ga. Wolves,596947,9,bot,"C. Prince flied out to cf, SF, RBI3a J. Witmer advanced to second3a M. Cooper advanced to third3a B. Bradford scored.",118,2025-02-15T00:00:00-05:00,"Cole Field (Carrollton, GA)",227,MBA,2025
