game_id,away_team_id,away_team_name,home_team_id,home_team_name,batting_team,inning,top_bot,event_text,event_num,game_datetime,stadium_name,attendance,sport_id,season
6339634,596926,Quincy Hawks,596735,Lincoln Memorial Railsplitters,596926,1,top,D. Broughton flied out to rf.,1,2025-02-09T00:00:00-05:00,"Hennon Field (Harrogate, TN)",0,MBA,2025
6339634,596926,Quincy Hawks,596735,Lincoln Memorial Railsplitters,596926,1,top,M. Mateo struck out swinging.,2,2025-02-09T00:00:00-05:00,"Hennon Field (Harrogate, TN)",0,MBA,2025
6339634,596926,Quincy Hawks,596735,Lincoln Memorial Railsplitters,596926,1,top,J. Huffman struck out looking.,3,2025-02-09T00:00:00-05:00,"Hennon Field (Harrogate, TN)",0,MBA,2025
6339634,596926,Quincy Hawks,596735,Lincoln Memorial Railsplitters,596735,1,bot,C. Hall struck out swinging.,4,2025-02-09T00:00:00-05:00,"Hennon Field (Harrogate, TN)",0,MBA,2025
6339634,596926,Quincy Hawks,596735,Lincoln Memorial Railsplitters,596735,1,bot,K. Harvey grounded out to ss.,5,2025-02-09T00:00:00-05:00,"Hennon Field (Harrogate, TN)",0,MBA,2025
6339634,596926,Quincy Hawks,596735,Lincoln Memorial Railsplitters,596735,1,bot,A. Kowalski walked.,6,2025-02-09T00:00:00-05:00,"Hennon Field (Harrogate, TN)",0,MBA,2025
6339634,596926,Quincy Hawks,596735,Lincoln Memorial Railsplitters,596735,1,bot,"S. Mast singled to left field, RBI3a A. Kowalski scored.",7,2025-02-09T00:00:00-05:00,"Hennon Field (Harrogate, TN)",0,MBA,2025
6339634,596926,Quincy Hawks,596735,Lincoln Memorial Railsplitters,596735,1,bot,S. Mast stole second.,8,2025-02-09T00:00:00-05:00,"Hennon Field (Harrogate, TN)",0,MBA,2025
6339634,596926,Quincy Hawks,596735,Lincoln Memorial Railsplitters,596735,1,bot,S. Mast stole third.,9,2025-02-09T00:00:00-05:00,"Hennon Field (Harrogate, TN)",0,MBA,2025
6339634,596926,Quincy Hawks,596735,Lincoln Memorial Railsplitters,596735,1,bot,T. Simmons struck out looking.,10,2025-02-09T00:00:00-05:00,"Hennon Field (Harrogate, TN)",0,MBA,2025
6339634,596926,Quincy Hawks,596735,Lincoln Memorial Railsplitters,596926,2,top,J. Ortiz flied out to rf.,11,2025-02-09T00:00:00-05:00,"Hennon Field (Harrogate, TN)",0,MBA,2025
6339634,596926,Quincy Hawks,596735,Lincoln Memorial Railsplitters,596926,2,top,C. Moreno struck out swinging.,12,2025-02-09T00:00:00-05:00,"Hennon Field (Harrogate, TN)",0,MBA,2025
6339634,596926,Quincy Hawks,596735,Lincoln Memorial Railsplitters,596926,2,top,I. Fudge flied out to lf.,13,2025-02-09T00:00:00-05:00,"Hennon Field (Harrogate, TN)",0,MBA,2025
6339634,596926,Quincy Hawks,596735,Lincoln Memorial Railsplitters,596735,2,bot,F. Hallock flied out to rf.,14,2025-02-09T00:00:00-05:00,"Hennon Field (Harrogate, TN)",0,MBA,2025
6339634,596926,Quincy Hawks,596735,Lincoln Memorial Railsplitters,596735,2,bot,A. Wong-Shas grounded out to 2b.,15,2025-02-09T00:00:00-05:00,"Hennon Field (Harrogate, TN)",0,MBA,2025
6339634,596926,Quincy Hawks,596735,Lincoln Memorial Railsplitters,596735,2,bot,C. Dugan struck out swinging.,16,2025-02-09T00:00:00-05:00,"Hennon Field (Harrogate, TN)",0,MBA,2025
6339634,596926,Quincy Hawks,596735,Lincoln Memorial Railsplitters,596926,3,top,J. Nisbet singled.,17,2025-02-09T00:00:00-05:00,"Hennon Field (Harrogate, TN)",0,MBA,2025
6339634,596926,Quincy Hawks,596735,Lincoln Memorial Railsplitters,596926,3,top,J. Vitale hit by pitch3a J. Nisbet advanced to second.,18,2025-02-09T00:00:00-05:00,"Hennon Field (Harrogate, TN)",0,MBA,2025
6339634,596926,Quincy Hawks,596735,Lincoln Memorial Railsplitters,596926,3,top,B. Dahlof flied out to cf.,19,2025-02-09T00:00:00-05:00,"Hennon Field (Harrogate, TN)",0,MBA,2025
6339634,596926,Quincy Hawks,596735,Lincoln Memorial Railsplitters,596926,3,top,D. Broughton flied out to rf3a J. Nisbet advanced to third.,20,2025-02-09T00:00:00-05:00,"Hennon Field (Harrogate, TN)",0,MBA,2025
6339634,596926,Quincy Hawks,596735,Lincoln Memorial Railsplitters,596926,3,top,J. Vitale stole second.,21,2025-02-09T00:00:00-05:00,"Hennon Field (Harrogate, TN)",0,MBA,2025
6339634,596926,Quincy Hawks,596735,Lincoln Memorial Railsplitters,596926,3,top,"M. Mateo singled, RBI3a J. Nisbet scored.",22,2025-02-09T00:00:00-05:00,"Hennon Field (Harrogate, TN)",0,MBA,2025
6339634,596926,Quincy Hawks,596735,Lincoln Memorial Railsplitters,596926,3,top,"J. Vitale advanced to third on an error by c, J. Vitale, unearned.",23,2025-02-09T00:00:00-05:00,"Hennon Field (Harrogate, TN)",0,MBA,2025
6339634,596926,Quincy Hawks,596735,Lincoln Memorial Railsplitters,596926,3,top,M. Mateo stole second.,24,2025-02-09T00:00:00-05:00,"Hennon Field (Harrogate, TN)",0,MBA,2025
6339634,596926,Quincy Hawks,596735,Lincoln Memorial Railsplitters,596926,3,top,J. Huffman walked.,25,2025-02-09T00:00:00-05:00,"Hennon Field (Harrogate, TN)",0,MBA,2025
6339634,596926,Quincy Hawks,596735,Lincoln Memorial Railsplitters,596926,3,top,J. Ortiz singled3a J. Huffman advanced to second3a M. Mateo advanced to third.,26,2025-02-09T00:00:00-05:00,"Hennon Field (Harrogate, TN)",0,MBA,2025
6339634,596926,Quincy Hawks,596735,Lincoln Memorial Railsplitters,596926,3,top,"C. Moreno doubled, 2 RBI3a J. Ortiz advanced to third3a J. Huffman scored3a M. Mateo scored.",27,2025-02-09T00:00:00-05:00,"Hennon Field (Harrogate, TN)",0,MBA,2025
6339634,596926,Quincy Hawks,596735,Lincoln Memorial Railsplitters,596926,3,top,I. Fudge struck out looking.,28,2025-02-09T00:00:00-05:00,"Hennon Field (Harrogate, TN)",0,MBA,2025
6339634,596926,Quincy Hawks,596735,Lincoln Memorial Railsplitters,596735,3,bot,C. Elkins struck out swinging.,29,2025-02-09T00:00:00-05:00,"Hennon Field (Harrogate, TN)",0,MBA,2025
6339634,596926,Quincy Hawks,596735,Lincoln Memorial Railsplitters,596735,3,bot,"C. Hall homered to right field, RBI.",30,2025-02-09T00:00:00-05:00,"Hennon Field (Harrogate, TN)",0,MBA,2025
6339634,596926,Quincy Hawks,596735,Lincoln Memorial Railsplitters,596735,3,bot,K. Harvey walked.,31,2025-02-09T00:00:00-05:00,"Hennon Field (Harrogate, TN)",0,MBA,2025
6339634,596926,Quincy Hawks,596735,Lincoln Memorial Railsplitters,596735,3,bot,A. Kowalski lined out to 3b.,32,2025-02-09T00:00:00-05:00,"Hennon Field (Harrogate, TN)",0,MBA,2025
6339634,596926,Quincy Hawks,596735,Lincoln Memorial Railsplitters,596735,3,bot,S. Mast struck out swinging.,33,2025-02-09T00:00:00-05:00,"Hennon Field (Harrogate, TN)",0,MBA,2025
6339634,596926,Quincy Hawks,596735,Lincoln Memorial Railsplitters,596926,4,top,J. Nisbet struck out swinging.,34,2025-02-09T00:00:00-05:00,"Hennon Field (Harrogate, TN)",0,MBA,2025
6339634,596926,Quincy Hawks,596735,Lincoln Memorial Railsplitters,596926,4,top,J. Vitale singled.,35,2025-02-09T00:00:00-05:00,"Hennon Field (Harrogate, TN)",0,MBA,2025
6339634,596926,Quincy Hawks,596735,Lincoln Memorial Railsplitters,596926,4,top,B. Dahlof singled3a J. Vitale advanced to third.,36,2025-02-09T00:00:00-05:00,"Hennon Field (Harrogate, TN)",0,MBA,2025
6339634,596926,Quincy Hawks,596735,Lincoln Memorial Railsplitters,596926,4,top,"B. Dahlof out at first c to 1b, picked off.",37,2025-02-09T00:00:00-05:00,"Hennon Field (Harrogate, TN)",0,MBA,2025
6339634,596926,Quincy Hawks,596735,Lincoln Memorial Railsplitters,596926,4,top,"D. Broughton doubled, RBI3a J. Vitale scored.",38,2025-02-09T00:00:00-05:00,"Hennon Field (Harrogate, TN)",0,MBA,2025
6339634,596926,Quincy Hawks,596735,Lincoln Memorial Railsplitters,596926,4,top,M. Mateo grounded out to ss.,39,2025-02-09T00:00:00-05:00,"Hennon Field (Harrogate, TN)",0,MBA,2025
6339634,596926,Quincy Hawks,596735,Lincoln Memorial Railsplitters,596735,4,bot,T. Simmons singled to center field.,40,2025-02-09T00:00:00-05:00,"Hennon Field (Harrogate, TN)",0,MBA,2025
6339634,596926,Quincy Hawks,596735,Lincoln Memorial Railsplitters,596735,4,bot,F. Hallock flied out to lf.,41,2025-02-09T00:00:00-05:00,"Hennon Field (Harrogate, TN)",0,MBA,2025
6339634,596926,Quincy Hawks,596735,Lincoln Memorial Railsplitters,596735,4,bot,A. Wong-Shas flied out to rf.,42,2025-02-09T00:00:00-05:00,"Hennon Field (Harrogate, TN)",0,MBA,2025
6339634,596926,Quincy Hawks,596735,Lincoln Memorial Railsplitters,596735,4,bot,C. Dugan grounded out to 3b.,43,2025-02-09T00:00:00-05:00,"Hennon Field (Harrogate, TN)",0,MBA,2025
6339634,596926,Quincy Hawks,596735,Lincoln Memorial Railsplitters,596926,5,top,J. Huffman struck out swinging.,44,2025-02-09T00:00:00-05:00,"Hennon Field (Harrogate, TN)",0,MBA,2025
6339634,596926,Quincy Hawks,596735,Lincoln Memorial Railsplitters,596926,5,top,J. Ortiz flied out to cf.,45,2025-02-09T00:00:00-05:00,"Hennon Field (Harrogate, TN)",0,MBA,2025
6339634,596926,Quincy Hawks,596735,Lincoln Memorial Railsplitters,596926,5,top,C. Moreno lined out to ss.,46,2025-02-09T00:00:00-05:00,"Hennon Field (Harrogate, TN)",0,MBA,2025
6339634,596926,Quincy Hawks,596735,Lincoln Memorial Railsplitters,596735,5,bot,C. Elkins walked.,47,2025-02-09T00:00:00-05:00,"Hennon Field (Harrogate, TN)",0,MBA,2025
6339634,596926,Quincy Hawks,596735,Lincoln Memorial Railsplitters,596735,5,bot,C. Hall struck out looking.,48,2025-02-09T00:00:00-05:00,"Hennon Field (Harrogate, TN)",0,MBA,2025
6339634,596926,Quincy Hawks,596735,Lincoln Memorial Railsplitters,596735,5,bot,K. Harvey popped up to 2b.,49,2025-02-09T00:00:00-05:00,"Hennon Field (Harrogate, TN)",0,MBA,2025
6339634,596926,Quincy Hawks,596735,Lincoln Memorial Railsplitters,596735,5,bot,"C. Elkins out at first p to 1b, picked off.",50,2025-02-09T00:00:00-05:00,"Hennon Field (Harrogate, TN)",0,MBA,2025
6339634,596926,Quincy Hawks,596735,Lincoln Memorial Railsplitters,596926,6,top,P. Armour to p for C. Murphy.,51,2025-02-09T00:00:00-05:00,"Hennon Field (Harrogate, TN)",0,MBA,2025
6339634,596926,Quincy Hawks,596735,Lincoln Memorial Railsplitters,596926,6,top,I. Fudge doubled to center field.,52,2025-02-09T00:00:00-05:00,"Hennon Field (Harrogate, TN)",0,MBA,2025
6339634,596926,Quincy Hawks,596735,Lincoln Memorial Railsplitters,596926,6,top,J. Nisbet struck out looking.,53,2025-02-09T00:00:00-05:00,"Hennon Field (Harrogate, TN)",0,MBA,2025
6339634,596926,Quincy Hawks,596735,Lincoln Memorial Railsplitters,596926,6,top,J. Vitale struck out looking.,54,2025-02-09T00:00:00-05:00,"Hennon Field (Harrogate, TN)",0,MBA,2025
6339634,596926,Quincy Hawks,596735,Lincoln Memorial Railsplitters,596926,6,top,B. Dahlof struck out swinging.,55,2025-02-09T00:00:00-05:00,"Hennon Field (Harrogate, TN)",0,MBA,2025
6339634,596926,Quincy Hawks,596735,Lincoln Memorial Railsplitters,596735,6,bot,L. Mueller to p for B. Draeger.,56,2025-02-09T00:00:00-05:00,"Hennon Field (Harrogate, TN)",0,MBA,2025
6339634,596926,Quincy Hawks,596735,Lincoln Memorial Railsplitters,596735,6,bot,A. Kowalski hit by pitch.,57,2025-02-09T00:00:00-05:00,"Hennon Field (Harrogate, TN)",0,MBA,2025
6339634,596926,Quincy Hawks,596735,Lincoln Memorial Railsplitters,596735,6,bot,A. Kowalski stole second.,58,2025-02-09T00:00:00-05:00,"Hennon Field (Harrogate, TN)",0,MBA,2025
6339634,596926,Quincy Hawks,596735,Lincoln Memorial Railsplitters,596735,6,bot,S. Mast struck out looking.,59,2025-02-09T00:00:00-05:00,"Hennon Field (Harrogate, TN)",0,MBA,2025
6339634,596926,Quincy Hawks,596735,Lincoln Memorial Railsplitters,596735,6,bot,A. Kowalski stole third.,60,2025-02-09T00:00:00-05:00,"Hennon Field (Harrogate, TN)",0,MBA,2025
6339634,596926,Quincy Hawks,596735,Lincoln Memorial Railsplitters,596735,6,bot,T. Simmons struck out swinging.,61,2025-02-09T00:00:00-05:00,"Hennon Field (Harrogate, TN)",0,MBA,2025
6339634,596926,Quincy Hawks,596735,Lincoln Memorial Railsplitters,596735,6,bot,F. Hallock flied out to rf.,62,2025-02-09T00:00:00-05:00,"Hennon Field (Harrogate, TN)",0,MBA,2025
6339634,596926,Quincy Hawks,596735,Lincoln Memorial Railsplitters,596926,7,top,D. Broughton grounded out to 3b.,63,2025-02-09T00:00:00-05:00,"Hennon Field (Harrogate, TN)",0,MBA,2025
6339634,596926,Quincy Hawks,596735,Lincoln Memorial Railsplitters,596926,7,top,"M. Mateo homered, RBI.",64,2025-02-09T00:00:00-05:00,"Hennon Field (Harrogate, TN)",0,MBA,2025
6339634,596926,Quincy Hawks,596735,Lincoln Memorial Railsplitters,596926,7,top,J. Huffman struck out looking.,65,2025-02-09T00:00:00-05:00,"Hennon Field (Harrogate, TN)",0,MBA,2025
6339634,596926,Quincy Hawks,596735,Lincoln Memorial Railsplitters,596926,7,top,J. Ortiz struck out looking.,66,2025-02-09T00:00:00-05:00,"Hennon Field (Harrogate, TN)",0,MBA,2025
6339634,596926,Quincy Hawks,596735,Lincoln Memorial Railsplitters,596735,7,bot,C. Golden to p for L. Mueller.,67,2025-02-09T00:00:00-05:00,"Hennon Field (Harrogate, TN)",0,MBA,2025
6339634,596926,Quincy Hawks,596735,Lincoln Memorial Railsplitters,596735,7,bot,A. Wong-Shas walked.,68,2025-02-09T00:00:00-05:00,"Hennon Field (Harrogate, TN)",0,MBA,2025
6339634,596926,Quincy Hawks,596735,Lincoln Memorial Railsplitters,596735,7,bot,K. Fernandez pinch hit for C. Dugan.,69,2025-02-09T00:00:00-05:00,"Hennon Field (Harrogate, TN)",0,MBA,2025
6339634,596926,Quincy Hawks,596735,Lincoln Memorial Railsplitters,596735,7,bot,A. Wong-Shas stole second.,70,2025-02-09T00:00:00-05:00,"Hennon Field (Harrogate, TN)",0,MBA,2025
6339634,596926,Quincy Hawks,596735,Lincoln Memorial Railsplitters,596735,7,bot,K. Fernandez walked.,71,2025-02-09T00:00:00-05:00,"Hennon Field (Harrogate, TN)",0,MBA,2025
6339634,596926,Quincy Hawks,596735,Lincoln Memorial Railsplitters,596735,7,bot,D. Kelliher to p for C. Golden.,72,2025-02-09T00:00:00-05:00,"Hennon Field (Harrogate, TN)",0,MBA,2025
6339634,596926,Quincy Hawks,596735,Lincoln Memorial Railsplitters,596735,7,bot,C. Elkins struck out looking.,73,2025-02-09T00:00:00-05:00,"Hennon Field (Harrogate, TN)",0,MBA,2025
6339634,596926,Quincy Hawks,596735,Lincoln Memorial Railsplitters,596735,7,bot,C. Hall grounded into double play 2b to ss to 1b3a K. Fernandez out on the play.,74,2025-02-09T00:00:00-05:00,"Hennon Field (Harrogate, TN)",0,MBA,2025
6339634,596926,Quincy Hawks,596735,Lincoln Memorial Railsplitters,596926,8,top,K. Fernandez to cf.,75,2025-02-09T00:00:00-05:00,"Hennon Field (Harrogate, TN)",0,MBA,2025
6339634,596926,Quincy Hawks,596735,Lincoln Memorial Railsplitters,596926,8,top,C. White to p for P. Armour.,76,2025-02-09T00:00:00-05:00,"Hennon Field (Harrogate, TN)",0,MBA,2025
6339634,596926,Quincy Hawks,596735,Lincoln Memorial Railsplitters,596926,8,top,B. Hagedorn to 3b for C. Elkins.,77,2025-02-09T00:00:00-05:00,"Hennon Field (Harrogate, TN)",0,MBA,2025
6339634,596926,Quincy Hawks,596735,Lincoln Memorial Railsplitters,596926,8,top,C. Moreno struck out swinging.,78,2025-02-09T00:00:00-05:00,"Hennon Field (Harrogate, TN)",0,MBA,2025
6339634,596926,Quincy Hawks,596735,Lincoln Memorial Railsplitters,596926,8,top,I. Fudge struck out swinging.,79,2025-02-09T00:00:00-05:00,"Hennon Field (Harrogate, TN)",0,MBA,2025
6339634,596926,Quincy Hawks,596735,Lincoln Memorial Railsplitters,596926,8,top,J. Nisbet walked.,80,2025-02-09T00:00:00-05:00,"Hennon Field (Harrogate, TN)",0,MBA,2025
6339634,596926,Quincy Hawks,596735,Lincoln Memorial Railsplitters,596926,8,top,J. Vitale flied out to lf.,81,2025-02-09T00:00:00-05:00,"Hennon Field (Harrogate, TN)",0,MBA,2025
6339634,596926,Quincy Hawks,596735,Lincoln Memorial Railsplitters,596735,8,bot,K. Harvey doubled to left field.,82,2025-02-09T00:00:00-05:00,"Hennon Field (Harrogate, TN)",0,MBA,2025
6339634,596926,Quincy Hawks,596735,Lincoln Memorial Railsplitters,596735,8,bot,A. Kowalski popped up to 1b.,83,2025-02-09T00:00:00-05:00,"Hennon Field (Harrogate, TN)",0,MBA,2025
6339634,596926,Quincy Hawks,596735,Lincoln Memorial Railsplitters,596735,8,bot,S. Mast struck out swinging.,84,2025-02-09T00:00:00-05:00,"Hennon Field (Harrogate, TN)",0,MBA,2025
6339634,596926,Quincy Hawks,596735,Lincoln Memorial Railsplitters,596735,8,bot,"T. Simmons singled to right field, RBI3a K. Harvey scored.",85,2025-02-09T00:00:00-05:00,"Hennon Field (Harrogate, TN)",0,MBA,2025
6339634,596926,Quincy Hawks,596735,Lincoln Memorial Railsplitters,596735,8,bot,F. Hallock struck out swinging.,86,2025-02-09T00:00:00-05:00,"Hennon Field (Harrogate, TN)",0,MBA,2025
6339634,596926,Quincy Hawks,596735,Lincoln Memorial Railsplitters,596926,9,top,B. Dahlof popped up to 2b.,87,2025-02-09T00:00:00-05:00,"Hennon Field (Harrogate, TN)",0,MBA,2025
6339634,596926,Quincy Hawks,596735,Lincoln Memorial Railsplitters,596926,9,top,D. Broughton struck out looking.,88,2025-02-09T00:00:00-05:00,"Hennon Field (Harrogate, TN)",0,MBA,2025
6339634,596926,Quincy Hawks,596735,Lincoln Memorial Railsplitters,596926,9,top,M. Mateo singled to right field.,89,2025-02-09T00:00:00-05:00,"Hennon Field (Harrogate, TN)",0,MBA,2025
6339634,596926,Quincy Hawks,596735,Lincoln Memorial Railsplitters,596926,9,top,J. Huffman grounded out to ss.,90,2025-02-09T00:00:00-05:00,"Hennon Field (Harrogate, TN)",0,MBA,2025
6339634,596926,Quincy Hawks,596735,Lincoln Memorial Railsplitters,596735,9,bot,A. Collins to p for D. Kelliher.,91,2025-02-09T00:00:00-05:00,"Hennon Field (Harrogate, TN)",0,MBA,2025
6339634,596926,Quincy Hawks,596735,Lincoln Memorial Railsplitters,596735,9,bot,J. Haggard to rf for M. Mateo.,92,2025-02-09T00:00:00-05:00,"Hennon Field (Harrogate, TN)",0,MBA,2025
6339634,596926,Quincy Hawks,596735,Lincoln Memorial Railsplitters,596735,9,bot,A. Wong-Shas popped up to p.,93,2025-02-09T00:00:00-05:00,"Hennon Field (Harrogate, TN)",0,MBA,2025
6339634,596926,Quincy Hawks,596735,Lincoln Memorial Railsplitters,596735,9,bot,K. Fernandez struck out swinging.,94,2025-02-09T00:00:00-05:00,"Hennon Field (Harrogate, TN)",0,MBA,2025
6339634,596926,Quincy Hawks,596735,Lincoln Memorial Railsplitters,596735,9,bot,B. Hagedorn walked.,95,2025-02-09T00:00:00-05:00,"Hennon Field (Harrogate, TN)",0,MBA,2025
6339634,596926,Quincy Hawks,596735,Lincoln Memorial Railsplitters,596735,9,bot,C. Hall singled to right field3a B. Hagedorn advanced to second.,96,2025-02-09T00:00:00-05:00,"Hennon Field (Harrogate, TN)",0,MBA,2025
6339634,596926,Quincy Hawks,596735,Lincoln Memorial Railsplitters,596735,9,bot,K. Harvey walked3a C. Hall advanced to second3a B. Hagedorn advanced to third.,97,2025-02-09T00:00:00-05:00,"Hennon Field (Harrogate, TN)",0,MBA,2025
6339634,596926,Quincy Hawks,596735,Lincoln Memorial Railsplitters,596735,9,bot,K. Manship to p for A. Collins.,98,2025-02-09T00:00:00-05:00,"Hennon Field (Harrogate, TN)",0,MBA,2025
6339634,596926,Quincy Hawks,596735,Lincoln Memorial Railsplitters,596735,9,bot,C. Hall advanced to third3a B. Hagedorn scored on a wild pitch.,99,2025-02-09T00:00:00-05:00,"Hennon Field (Harrogate, TN)",0,MBA,2025
6339634,596926,Quincy Hawks,596735,Lincoln Memorial Railsplitters,596735,9,bot,K. Harvey stole second.,100,2025-02-09T00:00:00-05:00,"Hennon Field (Harrogate, TN)",0,MBA,2025
6339634,596926,Quincy Hawks,596735,Lincoln Memorial Railsplitters,596735,9,bot,K. Harvey advanced to third3a C. Hall scored on a wild pitch.,101,2025-02-09T00:00:00-05:00,"Hennon Field (Harrogate, TN)",0,MBA,2025
6339634,596926,Quincy Hawks,596735,Lincoln Memorial Railsplitters,596735,9,bot,A. Kowalski struck out swinging.,102,2025-02-09T00:00:00-05:00,"Hennon Field (Harrogate, TN)",0,MBA,2025
