game_id,away_team_id,away_team_name,home_team_id,home_team_name,batting_team,inning,top_bot,event_text,event_num,game_datetime,stadium_name,attendance,sport_id,season
6339903,596956,Cameron Aggies,596746,St. Edward's Hilltoppers,596956,1,top,D. Villarrea walked.,1,2025-02-15T00:00:00-05:00,"Lucian-Hamilton Field (Austin, TX)",95,MBA,2025
6339903,596956,Cameron Aggies,596746,St. Edward's Hilltoppers,596956,1,top,K. Bigford reached on a fielder's choice; D. Villarrea out at second 2b to ss.,2,2025-02-15T00:00:00-05:00,"Lucian-Hamilton Field (Austin, TX)",95,MBA,2025
6339903,596956,Cameron Aggies,596746,St. Edward's Hilltoppers,596956,1,top,L. Barnett struck out swinging.,3,2025-02-15T00:00:00-05:00,"Lucian-Hamilton Field (Austin, TX)",95,MBA,2025
6339903,596956,Cameron Aggies,596746,St. Edward's Hilltoppers,596956,1,top,W. Henriquez flied out to lf.,4,2025-02-15T00:00:00-05:00,"Lucian-Hamilton Field (Austin, TX)",95,MBA,2025
6339903,596956,Cameron Aggies,596746,St. Edward's Hilltoppers,596746,1,bot,T. Sebek struck out looking.,5,2025-02-15T00:00:00-05:00,"Lucian-Hamilton Field (Austin, TX)",95,MBA,2025
6339903,596956,Cameron Aggies,596746,St. Edward's Hilltoppers,596746,1,bot,"T. Chestnut grounded out to 3b, bunt.",6,2025-02-15T00:00:00-05:00,"Lucian-Hamilton Field (Austin, TX)",95,MBA,2025
6339903,596956,Cameron Aggies,596746,St. Edward's Hilltoppers,596746,1,bot,C. Cox singled up the middle.,7,2025-02-15T00:00:00-05:00,"Lucian-Hamilton Field (Austin, TX)",95,MBA,2025
6339903,596956,Cameron Aggies,596746,St. Edward's Hilltoppers,596746,1,bot,"C. Figueroa homered to right field, 2 RBI; C. Cox scored.",8,2025-02-15T00:00:00-05:00,"Lucian-Hamilton Field (Austin, TX)",95,MBA,2025
6339903,596956,Cameron Aggies,596746,St. Edward's Hilltoppers,596746,1,bot,M. Barrera flied out to cf.,9,2025-02-15T00:00:00-05:00,"Lucian-Hamilton Field (Austin, TX)",95,MBA,2025
6339903,596956,Cameron Aggies,596746,St. Edward's Hilltoppers,596956,2,top,W. Cunningha flied out to cf.,10,2025-02-15T00:00:00-05:00,"Lucian-Hamilton Field (Austin, TX)",95,MBA,2025
6339903,596956,Cameron Aggies,596746,St. Edward's Hilltoppers,596956,2,top,Z. Roos struck out swinging.,11,2025-02-15T00:00:00-05:00,"Lucian-Hamilton Field (Austin, TX)",95,MBA,2025
6339903,596956,Cameron Aggies,596746,St. Edward's Hilltoppers,596956,2,top,D. Borg struck out looking.,12,2025-02-15T00:00:00-05:00,"Lucian-Hamilton Field (Austin, TX)",95,MBA,2025
6339903,596956,Cameron Aggies,596746,St. Edward's Hilltoppers,596746,2,bot,D. Tate struck out swinging.,13,2025-02-15T00:00:00-05:00,"Lucian-Hamilton Field (Austin, TX)",95,MBA,2025
6339903,596956,Cameron Aggies,596746,St. Edward's Hilltoppers,596746,2,bot,K. Blakney grounded out to ss.,14,2025-02-15T00:00:00-05:00,"Lucian-Hamilton Field (Austin, TX)",95,MBA,2025
6339903,596956,Cameron Aggies,596746,St. Edward's Hilltoppers,596746,2,bot,N. Anderson singled to left field.,15,2025-02-15T00:00:00-05:00,"Lucian-Hamilton Field (Austin, TX)",95,MBA,2025
6339903,596956,Cameron Aggies,596746,St. Edward's Hilltoppers,596746,2,bot,G. Thallman reached on a fielder's choice; N. Anderson out at second ss to 2b.,16,2025-02-15T00:00:00-05:00,"Lucian-Hamilton Field (Austin, TX)",95,MBA,2025
6339903,596956,Cameron Aggies,596746,St. Edward's Hilltoppers,596956,3,top,B. Harper grounded out to ss.,17,2025-02-15T00:00:00-05:00,"Lucian-Hamilton Field (Austin, TX)",95,MBA,2025
6339903,596956,Cameron Aggies,596746,St. Edward's Hilltoppers,596956,3,top,O. Rice struck out swinging.,18,2025-02-15T00:00:00-05:00,"Lucian-Hamilton Field (Austin, TX)",95,MBA,2025
6339903,596956,Cameron Aggies,596746,St. Edward's Hilltoppers,596956,3,top,D. Villarrea struck out looking.,19,2025-02-15T00:00:00-05:00,"Lucian-Hamilton Field (Austin, TX)",95,MBA,2025
6339903,596956,Cameron Aggies,596746,St. Edward's Hilltoppers,596746,3,bot,T. Sebek flied out to lf.,20,2025-02-15T00:00:00-05:00,"Lucian-Hamilton Field (Austin, TX)",95,MBA,2025
6339903,596956,Cameron Aggies,596746,St. Edward's Hilltoppers,596746,3,bot,T. Chestnut singled to shortstop.,21,2025-02-15T00:00:00-05:00,"Lucian-Hamilton Field (Austin, TX)",95,MBA,2025
6339903,596956,Cameron Aggies,596746,St. Edward's Hilltoppers,596746,3,bot,C. Cox singled to right center; T. Chestnut advanced to third.,22,2025-02-15T00:00:00-05:00,"Lucian-Hamilton Field (Austin, TX)",95,MBA,2025
6339903,596956,Cameron Aggies,596746,St. Edward's Hilltoppers,596746,3,bot,C. Figueroa popped up to 1b.,23,2025-02-15T00:00:00-05:00,"Lucian-Hamilton Field (Austin, TX)",95,MBA,2025
6339903,596956,Cameron Aggies,596746,St. Edward's Hilltoppers,596746,3,bot,M. Barrera flied out to lf.,24,2025-02-15T00:00:00-05:00,"Lucian-Hamilton Field (Austin, TX)",95,MBA,2025
6339903,596956,Cameron Aggies,596746,St. Edward's Hilltoppers,596956,4,top,K. Bigford popped up to lf.,25,2025-02-15T00:00:00-05:00,"Lucian-Hamilton Field (Austin, TX)",95,MBA,2025
6339903,596956,Cameron Aggies,596746,St. Edward's Hilltoppers,596956,4,top,L. Barnett walked.,26,2025-02-15T00:00:00-05:00,"Lucian-Hamilton Field (Austin, TX)",95,MBA,2025
6339903,596956,Cameron Aggies,596746,St. Edward's Hilltoppers,596956,4,top,W. Henriquez struck out looking.,27,2025-02-15T00:00:00-05:00,"Lucian-Hamilton Field (Austin, TX)",95,MBA,2025
6339903,596956,Cameron Aggies,596746,St. Edward's Hilltoppers,596956,4,top,W. Cunningha singled to right field; L. Barnett advanced to second.,28,2025-02-15T00:00:00-05:00,"Lucian-Hamilton Field (Austin, TX)",95,MBA,2025
6339903,596956,Cameron Aggies,596746,St. Edward's Hilltoppers,596956,4,top,"Z. Roos tripled, 2 RBI; W. Cunningha scored; L. Barnett scored.",29,2025-02-15T00:00:00-05:00,"Lucian-Hamilton Field (Austin, TX)",95,MBA,2025
6339903,596956,Cameron Aggies,596746,St. Edward's Hilltoppers,596956,4,top,D. Borg struck out swinging.,30,2025-02-15T00:00:00-05:00,"Lucian-Hamilton Field (Austin, TX)",95,MBA,2025
6339903,596956,Cameron Aggies,596746,St. Edward's Hilltoppers,596746,4,bot,D. Tate walked.,31,2025-02-15T00:00:00-05:00,"Lucian-Hamilton Field (Austin, TX)",95,MBA,2025
6339903,596956,Cameron Aggies,596746,St. Edward's Hilltoppers,596746,4,bot,"K. Blakney grounded out to 3b, SAC, bunt; D. Tate advanced to second.",32,2025-02-15T00:00:00-05:00,"Lucian-Hamilton Field (Austin, TX)",95,MBA,2025
6339903,596956,Cameron Aggies,596746,St. Edward's Hilltoppers,596746,4,bot,N. Anderson flied out to lf.,33,2025-02-15T00:00:00-05:00,"Lucian-Hamilton Field (Austin, TX)",95,MBA,2025
6339903,596956,Cameron Aggies,596746,St. Edward's Hilltoppers,596746,4,bot,G. Thallman grounded out to 2b.,34,2025-02-15T00:00:00-05:00,"Lucian-Hamilton Field (Austin, TX)",95,MBA,2025
6339903,596956,Cameron Aggies,596746,St. Edward's Hilltoppers,596956,5,top,B. Harper struck out swinging.,35,2025-02-15T00:00:00-05:00,"Lucian-Hamilton Field (Austin, TX)",95,MBA,2025
6339903,596956,Cameron Aggies,596746,St. Edward's Hilltoppers,596956,5,top,"O. Rice struck out swinging, out at first c to 1b.",36,2025-02-15T00:00:00-05:00,"Lucian-Hamilton Field (Austin, TX)",95,MBA,2025
6339903,596956,Cameron Aggies,596746,St. Edward's Hilltoppers,596956,5,top,D. Villarrea grounded out to ss.,37,2025-02-15T00:00:00-05:00,"Lucian-Hamilton Field (Austin, TX)",95,MBA,2025
6339903,596956,Cameron Aggies,596746,St. Edward's Hilltoppers,596746,5,bot,T. Sebek tripled down the rf line.,38,2025-02-15T00:00:00-05:00,"Lucian-Hamilton Field (Austin, TX)",95,MBA,2025
6339903,596956,Cameron Aggies,596746,St. Edward's Hilltoppers,596746,5,bot,T. Chestnut hit by pitch.,39,2025-02-15T00:00:00-05:00,"Lucian-Hamilton Field (Austin, TX)",95,MBA,2025
6339903,596956,Cameron Aggies,596746,St. Edward's Hilltoppers,596746,5,bot,"C. Cox doubled to left center, 2 RBI; T. Chestnut scored; T. Sebek scored.",40,2025-02-15T00:00:00-05:00,"Lucian-Hamilton Field (Austin, TX)",95,MBA,2025
6339903,596956,Cameron Aggies,596746,St. Edward's Hilltoppers,596746,5,bot,C. Figueroa grounded out to 3b; C. Cox advanced to third.,41,2025-02-15T00:00:00-05:00,"Lucian-Hamilton Field (Austin, TX)",95,MBA,2025
6339903,596956,Cameron Aggies,596746,St. Edward's Hilltoppers,596746,5,bot,J. Martinez to p for V. Munoz.,42,2025-02-15T00:00:00-05:00,"Lucian-Hamilton Field (Austin, TX)",95,MBA,2025
6339903,596956,Cameron Aggies,596746,St. Edward's Hilltoppers,596746,5,bot,M. Barrera hit by pitch.,43,2025-02-15T00:00:00-05:00,"Lucian-Hamilton Field (Austin, TX)",95,MBA,2025
6339903,596956,Cameron Aggies,596746,St. Edward's Hilltoppers,596746,5,bot,M. Barrera advanced to second on a wild pitch.,44,2025-02-15T00:00:00-05:00,"Lucian-Hamilton Field (Austin, TX)",95,MBA,2025
6339903,596956,Cameron Aggies,596746,St. Edward's Hilltoppers,596746,5,bot,"D. Tate singled up the middle, 2 RBI; M. Barrera scored; C. Cox scored.",45,2025-02-15T00:00:00-05:00,"Lucian-Hamilton Field (Austin, TX)",95,MBA,2025
6339903,596956,Cameron Aggies,596746,St. Edward's Hilltoppers,596746,5,bot,K. Blakney grounded out to 3b; D. Tate advanced to second.,46,2025-02-15T00:00:00-05:00,"Lucian-Hamilton Field (Austin, TX)",95,MBA,2025
6339903,596956,Cameron Aggies,596746,St. Edward's Hilltoppers,596746,5,bot,"N. Anderson doubled to left field, RBI; D. Tate scored.",47,2025-02-15T00:00:00-05:00,"Lucian-Hamilton Field (Austin, TX)",95,MBA,2025
6339903,596956,Cameron Aggies,596746,St. Edward's Hilltoppers,596746,5,bot,"G. Thallman singled to left field, RBI; N. Anderson scored.",48,2025-02-15T00:00:00-05:00,"Lucian-Hamilton Field (Austin, TX)",95,MBA,2025
6339903,596956,Cameron Aggies,596746,St. Edward's Hilltoppers,596746,5,bot,G. Thallman stole second.,49,2025-02-15T00:00:00-05:00,"Lucian-Hamilton Field (Austin, TX)",95,MBA,2025
6339903,596956,Cameron Aggies,596746,St. Edward's Hilltoppers,596746,5,bot,T. Sebek struck out looking.,50,2025-02-15T00:00:00-05:00,"Lucian-Hamilton Field (Austin, TX)",95,MBA,2025
6339903,596956,Cameron Aggies,596746,St. Edward's Hilltoppers,596956,6,top,K. Bigford lined out to rf.,51,2025-02-15T00:00:00-05:00,"Lucian-Hamilton Field (Austin, TX)",95,MBA,2025
6339903,596956,Cameron Aggies,596746,St. Edward's Hilltoppers,596956,6,top,L. Barnett reached first on a throwing error by 3b.,52,2025-02-15T00:00:00-05:00,"Lucian-Hamilton Field (Austin, TX)",95,MBA,2025
6339903,596956,Cameron Aggies,596746,St. Edward's Hilltoppers,596956,6,top,W. Henriquez struck out looking.,53,2025-02-15T00:00:00-05:00,"Lucian-Hamilton Field (Austin, TX)",95,MBA,2025
6339903,596956,Cameron Aggies,596746,St. Edward's Hilltoppers,596956,6,top,W. Cunningha grounded out to 2b.,54,2025-02-15T00:00:00-05:00,"Lucian-Hamilton Field (Austin, TX)",95,MBA,2025
6339903,596956,Cameron Aggies,596746,St. Edward's Hilltoppers,596746,6,bot,B. Smith to p for J. Martinez.,55,2025-02-15T00:00:00-05:00,"Lucian-Hamilton Field (Austin, TX)",95,MBA,2025
6339903,596956,Cameron Aggies,596746,St. Edward's Hilltoppers,596746,6,bot,T. Chestnut singled through the left side.,56,2025-02-15T00:00:00-05:00,"Lucian-Hamilton Field (Austin, TX)",95,MBA,2025
6339903,596956,Cameron Aggies,596746,St. Edward's Hilltoppers,596746,6,bot,T. Chestnut stole second.,57,2025-02-15T00:00:00-05:00,"Lucian-Hamilton Field (Austin, TX)",95,MBA,2025
6339903,596956,Cameron Aggies,596746,St. Edward's Hilltoppers,596746,6,bot,"C. Cox struck out swinging, reached first on a wild pitch; T. Chestnut stole third.",58,2025-02-15T00:00:00-05:00,"Lucian-Hamilton Field (Austin, TX)",95,MBA,2025
6339903,596956,Cameron Aggies,596746,St. Edward's Hilltoppers,596746,6,bot,C. Cox advanced to second on a throwing error by p; T. Chestnut stole home.,59,2025-02-15T00:00:00-05:00,"Lucian-Hamilton Field (Austin, TX)",95,MBA,2025
6339903,596956,Cameron Aggies,596746,St. Edward's Hilltoppers,596746,6,bot,C. Figueroa struck out looking.,60,2025-02-15T00:00:00-05:00,"Lucian-Hamilton Field (Austin, TX)",95,MBA,2025
6339903,596956,Cameron Aggies,596746,St. Edward's Hilltoppers,596746,6,bot,M. Barrera fouled out to 1b.,61,2025-02-15T00:00:00-05:00,"Lucian-Hamilton Field (Austin, TX)",95,MBA,2025
6339903,596956,Cameron Aggies,596746,St. Edward's Hilltoppers,596746,6,bot,D. Tate popped up to p.,62,2025-02-15T00:00:00-05:00,"Lucian-Hamilton Field (Austin, TX)",95,MBA,2025
6339903,596956,Cameron Aggies,596746,St. Edward's Hilltoppers,596956,7,top,Z. Roos grounded out to 3b.,63,2025-02-15T00:00:00-05:00,"Lucian-Hamilton Field (Austin, TX)",95,MBA,2025
6339903,596956,Cameron Aggies,596746,St. Edward's Hilltoppers,596956,7,top,D. Borg struck out swinging.,64,2025-02-15T00:00:00-05:00,"Lucian-Hamilton Field (Austin, TX)",95,MBA,2025
6339903,596956,Cameron Aggies,596746,St. Edward's Hilltoppers,596956,7,top,B. Harper fouled out to 3b.,65,2025-02-15T00:00:00-05:00,"Lucian-Hamilton Field (Austin, TX)",95,MBA,2025
