game_id,away_team_id,away_team_name,home_team_id,home_team_name,batting_team,inning,top_bot,event_text,event_num,game_datetime,stadium_name,attendance,sport_id,season
6340102,596833,Okla. Christian Eagles,596831,Lubbock Christian Chaparrals,596833,1,top,Cason Gregor walked.,1,2025-02-16T00:00:00-05:00,"Hays Field (Lubbock, TX)",221,MBA,2025
6340102,596833,Okla. Christian Eagles,596831,Lubbock Christian Chaparrals,596833,1,top,Sloan Laird singled to center field3a Cason Gregor advanced to third.,2,2025-02-16T00:00:00-05:00,"Hays Field (Lubbock, TX)",221,MBA,2025
6340102,596833,Okla. Christian Eagles,596831,Lubbock Christian Chaparrals,596833,1,top,"Elijah Laus flied out to cf, SAC, RBI3a Cason Gregor scored.",3,2025-02-16T00:00:00-05:00,"Hays Field (Lubbock, TX)",221,MBA,2025
6340102,596833,Okla. Christian Eagles,596831,Lubbock Christian Chaparrals,596833,1,top,Hunter Jones hit by pitch3a Sloan Laird advanced to second.,4,2025-02-16T00:00:00-05:00,"Hays Field (Lubbock, TX)",221,MBA,2025
6340102,596833,Okla. Christian Eagles,596831,Lubbock Christian Chaparrals,596833,1,top,"Jontae Henne doubled down the rf line, RBI3a Hunter Jones advanced to third3a Sloan Laird scored.",5,2025-02-16T00:00:00-05:00,"Hays Field (Lubbock, TX)",221,MBA,2025
6340102,596833,Okla. Christian Eagles,596831,Lubbock Christian Chaparrals,596833,1,top,"Michael Adai singled to center field, 2 RBI3a Jontae Henne scored3a Hunter Jones scored.",6,2025-02-16T00:00:00-05:00,"Hays Field (Lubbock, TX)",221,MBA,2025
6340102,596833,Okla. Christian Eagles,596831,Lubbock Christian Chaparrals,596833,1,top,K. Dunn to p for T. Thompson.,7,2025-02-16T00:00:00-05:00,"Hays Field (Lubbock, TX)",221,MBA,2025
6340102,596833,Okla. Christian Eagles,596831,Lubbock Christian Chaparrals,596833,1,top,Reed Thomas singled to center field3a Michael Adai advanced to second.,8,2025-02-16T00:00:00-05:00,"Hays Field (Lubbock, TX)",221,MBA,2025
6340102,596833,Okla. Christian Eagles,596831,Lubbock Christian Chaparrals,596833,1,top,Justin Spenc walked3a Reed Thomas advanced to second3a Michael Adai advanced to third.,9,2025-02-16T00:00:00-05:00,"Hays Field (Lubbock, TX)",221,MBA,2025
6340102,596833,Okla. Christian Eagles,596831,Lubbock Christian Chaparrals,596833,1,top,"Trey Migl lined out to lf, SAC, RBI3a Michael Adai scored.",10,2025-02-16T00:00:00-05:00,"Hays Field (Lubbock, TX)",221,MBA,2025
6340102,596833,Okla. Christian Eagles,596831,Lubbock Christian Chaparrals,596833,1,top,"Cason Gregor singled to right field, RBI3a Justin Spenc advanced to second3a Reed Thomas scored.",11,2025-02-16T00:00:00-05:00,"Hays Field (Lubbock, TX)",221,MBA,2025
6340102,596833,Okla. Christian Eagles,596831,Lubbock Christian Chaparrals,596833,1,top,Cason Gregor stole second3a Justin Spenc stole third.,12,2025-02-16T00:00:00-05:00,"Hays Field (Lubbock, TX)",221,MBA,2025
6340102,596833,Okla. Christian Eagles,596831,Lubbock Christian Chaparrals,596833,1,top,Cason Gregor advanced to third3a Justin Spenc scored on a wild pitch.,13,2025-02-16T00:00:00-05:00,"Hays Field (Lubbock, TX)",221,MBA,2025
6340102,596833,Okla. Christian Eagles,596831,Lubbock Christian Chaparrals,596833,1,top,Sloan Laird walked.,14,2025-02-16T00:00:00-05:00,"Hays Field (Lubbock, TX)",221,MBA,2025
6340102,596833,Okla. Christian Eagles,596831,Lubbock Christian Chaparrals,596833,1,top,"Elijah Laus walked, RBI3a Sloan Laird advanced to second.",15,2025-02-16T00:00:00-05:00,"Hays Field (Lubbock, TX)",221,MBA,2025
6340102,596833,Okla. Christian Eagles,596831,Lubbock Christian Chaparrals,596833,1,top,A. Duran to p for K. Dunn.,16,2025-02-16T00:00:00-05:00,"Hays Field (Lubbock, TX)",221,MBA,2025
6340102,596833,Okla. Christian Eagles,596831,Lubbock Christian Chaparrals,596833,1,top,"Hunter Jones singled to right field, RBI3a Elijah Laus advanced to second3a Sloan Laird advanced to third3a Cason Gregor scored.",17,2025-02-16T00:00:00-05:00,"Hays Field (Lubbock, TX)",221,MBA,2025
6340102,596833,Okla. Christian Eagles,596831,Lubbock Christian Chaparrals,596833,1,top,"Jontae Henne singled to third base, RBI3a Hunter Jones advanced to second3a Elijah Laus advanced to third3a Sloan Laird scored.",18,2025-02-16T00:00:00-05:00,"Hays Field (Lubbock, TX)",221,MBA,2025
6340102,596833,Okla. Christian Eagles,596831,Lubbock Christian Chaparrals,596833,1,top,"Michael Adai singled to shortstop, RBI3a Jontae Henne advanced to second3a Hunter Jones advanced to third3a Elijah Laus scored.",19,2025-02-16T00:00:00-05:00,"Hays Field (Lubbock, TX)",221,MBA,2025
6340102,596833,Okla. Christian Eagles,596831,Lubbock Christian Chaparrals,596833,1,top,Michael Adai advanced to second3a Jontae Henne advanced to third3a Hunter Jones scored on a wild pitch.,20,2025-02-16T00:00:00-05:00,"Hays Field (Lubbock, TX)",221,MBA,2025
6340102,596833,Okla. Christian Eagles,596831,Lubbock Christian Chaparrals,596833,1,top,Reed Thomas struck out swinging.,21,2025-02-16T00:00:00-05:00,"Hays Field (Lubbock, TX)",221,MBA,2025
6340102,596833,Okla. Christian Eagles,596831,Lubbock Christian Chaparrals,596831,1,bot,K. York doubled to left field.,22,2025-02-16T00:00:00-05:00,"Hays Field (Lubbock, TX)",221,MBA,2025
6340102,596833,Okla. Christian Eagles,596831,Lubbock Christian Chaparrals,596831,1,bot,"S. Bowen singled up the middle, RBI3a K. York scored.",23,2025-02-16T00:00:00-05:00,"Hays Field (Lubbock, TX)",221,MBA,2025
6340102,596833,Okla. Christian Eagles,596831,Lubbock Christian Chaparrals,596831,1,bot,B. McCool walked3a S. Bowen advanced to second.,24,2025-02-16T00:00:00-05:00,"Hays Field (Lubbock, TX)",221,MBA,2025
6340102,596833,Okla. Christian Eagles,596831,Lubbock Christian Chaparrals,596831,1,bot,N. Baumbach walked3a B. McCool advanced to second3a S. Bowen advanced to third.,25,2025-02-16T00:00:00-05:00,"Hays Field (Lubbock, TX)",221,MBA,2025
6340102,596833,Okla. Christian Eagles,596831,Lubbock Christian Chaparrals,596831,1,bot,"J. Gutierrez singled, out at second lf to ss to 2b, 2 RBI3a N. Baumbach advanced to third3a B. McCool scored3a S. Bowen scored.",26,2025-02-16T00:00:00-05:00,"Hays Field (Lubbock, TX)",221,MBA,2025
6340102,596833,Okla. Christian Eagles,596831,Lubbock Christian Chaparrals,596831,1,bot,"B. Tijerina grounded out to 2b, RBI3a N. Baumbach scored.",27,2025-02-16T00:00:00-05:00,"Hays Field (Lubbock, TX)",221,MBA,2025
6340102,596833,Okla. Christian Eagles,596831,Lubbock Christian Chaparrals,596831,1,bot,R. Blackwell walked.,28,2025-02-16T00:00:00-05:00,"Hays Field (Lubbock, TX)",221,MBA,2025
6340102,596833,Okla. Christian Eagles,596831,Lubbock Christian Chaparrals,596831,1,bot,K. Lewis singled to shortstop3a R. Blackwell advanced to second.,29,2025-02-16T00:00:00-05:00,"Hays Field (Lubbock, TX)",221,MBA,2025
6340102,596833,Okla. Christian Eagles,596831,Lubbock Christian Chaparrals,596831,1,bot,F. Chavez flied out to cf.,30,2025-02-16T00:00:00-05:00,"Hays Field (Lubbock, TX)",221,MBA,2025
6340102,596833,Okla. Christian Eagles,596831,Lubbock Christian Chaparrals,596833,2,top,Justin Spenc struck out swinging.,31,2025-02-16T00:00:00-05:00,"Hays Field (Lubbock, TX)",221,MBA,2025
6340102,596833,Okla. Christian Eagles,596831,Lubbock Christian Chaparrals,596833,2,top,Trey Migl flied out to cf to left center.,32,2025-02-16T00:00:00-05:00,"Hays Field (Lubbock, TX)",221,MBA,2025
6340102,596833,Okla. Christian Eagles,596831,Lubbock Christian Chaparrals,596833,2,top,Cason Gregor walked.,33,2025-02-16T00:00:00-05:00,"Hays Field (Lubbock, TX)",221,MBA,2025
6340102,596833,Okla. Christian Eagles,596831,Lubbock Christian Chaparrals,596833,2,top,"Sloan Laird singled to left center, advanced to second on the throw, RBI3a Cason Gregor scored.",34,2025-02-16T00:00:00-05:00,"Hays Field (Lubbock, TX)",221,MBA,2025
6340102,596833,Okla. Christian Eagles,596831,Lubbock Christian Chaparrals,596833,2,top,Elijah Laus grounded out to p.,35,2025-02-16T00:00:00-05:00,"Hays Field (Lubbock, TX)",221,MBA,2025
6340102,596833,Okla. Christian Eagles,596831,Lubbock Christian Chaparrals,596831,2,bot,K. York struck out swinging.,36,2025-02-16T00:00:00-05:00,"Hays Field (Lubbock, TX)",221,MBA,2025
6340102,596833,Okla. Christian Eagles,596831,Lubbock Christian Chaparrals,596831,2,bot,S. Bowen lined out to ss.,37,2025-02-16T00:00:00-05:00,"Hays Field (Lubbock, TX)",221,MBA,2025
6340102,596833,Okla. Christian Eagles,596831,Lubbock Christian Chaparrals,596831,2,bot,B. McCool walked.,38,2025-02-16T00:00:00-05:00,"Hays Field (Lubbock, TX)",221,MBA,2025
6340102,596833,Okla. Christian Eagles,596831,Lubbock Christian Chaparrals,596831,2,bot,N. Baumbach flied out to lf.,39,2025-02-16T00:00:00-05:00,"Hays Field (Lubbock, TX)",221,MBA,2025
6340102,596833,Okla. Christian Eagles,596831,Lubbock Christian Chaparrals,596833,3,top,Hunter Jones doubled to left center.,40,2025-02-16T00:00:00-05:00,"Hays Field (Lubbock, TX)",221,MBA,2025
6340102,596833,Okla. Christian Eagles,596831,Lubbock Christian Chaparrals,596833,3,top,Jontae Henne flied out to cf.,41,2025-02-16T00:00:00-05:00,"Hays Field (Lubbock, TX)",221,MBA,2025
6340102,596833,Okla. Christian Eagles,596831,Lubbock Christian Chaparrals,596833,3,top,"Michael Adai doubled through the left side, RBI3a Hunter Jones scored.",42,2025-02-16T00:00:00-05:00,"Hays Field (Lubbock, TX)",221,MBA,2025
6340102,596833,Okla. Christian Eagles,596831,Lubbock Christian Chaparrals,596833,3,top,Reed Thomas grounded out to ss3a Michael Adai advanced to third.,43,2025-02-16T00:00:00-05:00,"Hays Field (Lubbock, TX)",221,MBA,2025
6340102,596833,Okla. Christian Eagles,596831,Lubbock Christian Chaparrals,596833,3,top,Justin Spenc flied out to cf to right center.,44,2025-02-16T00:00:00-05:00,"Hays Field (Lubbock, TX)",221,MBA,2025
6340102,596833,Okla. Christian Eagles,596831,Lubbock Christian Chaparrals,596831,3,bot,J. Gutierrez grounded out to ss.,45,2025-02-16T00:00:00-05:00,"Hays Field (Lubbock, TX)",221,MBA,2025
6340102,596833,Okla. Christian Eagles,596831,Lubbock Christian Chaparrals,596831,3,bot,B. Tijerina doubled to left center.,46,2025-02-16T00:00:00-05:00,"Hays Field (Lubbock, TX)",221,MBA,2025
6340102,596833,Okla. Christian Eagles,596831,Lubbock Christian Chaparrals,596831,3,bot,R. Blackwell hit by pitch.,47,2025-02-16T00:00:00-05:00,"Hays Field (Lubbock, TX)",221,MBA,2025
6340102,596833,Okla. Christian Eagles,596831,Lubbock Christian Chaparrals,596831,3,bot,"K. Lewis doubled down the lf line, RBI3a R. Blackwell advanced to third3a B. Tijerina scored.",48,2025-02-16T00:00:00-05:00,"Hays Field (Lubbock, TX)",221,MBA,2025
6340102,596833,Okla. Christian Eagles,596831,Lubbock Christian Chaparrals,596831,3,bot,"F. Chavez grounded out to ss, RBI3a R. Blackwell scored.",49,2025-02-16T00:00:00-05:00,"Hays Field (Lubbock, TX)",221,MBA,2025
6340102,596833,Okla. Christian Eagles,596831,Lubbock Christian Chaparrals,596831,3,bot,K. York hit by pitch.,50,2025-02-16T00:00:00-05:00,"Hays Field (Lubbock, TX)",221,MBA,2025
6340102,596833,Okla. Christian Eagles,596831,Lubbock Christian Chaparrals,596831,3,bot,K. York stole second3a K. Lewis stole third.,51,2025-02-16T00:00:00-05:00,"Hays Field (Lubbock, TX)",221,MBA,2025
6340102,596833,Okla. Christian Eagles,596831,Lubbock Christian Chaparrals,596831,3,bot,K. Lewis stole home.,52,2025-02-16T00:00:00-05:00,"Hays Field (Lubbock, TX)",221,MBA,2025
6340102,596833,Okla. Christian Eagles,596831,Lubbock Christian Chaparrals,596831,3,bot,S. Bowen grounded out to p.,53,2025-02-16T00:00:00-05:00,"Hays Field (Lubbock, TX)",221,MBA,2025
6340102,596833,Okla. Christian Eagles,596831,Lubbock Christian Chaparrals,596833,4,top,Trey Migl singled up the middle.,54,2025-02-16T00:00:00-05:00,"Hays Field (Lubbock, TX)",221,MBA,2025
6340102,596833,Okla. Christian Eagles,596831,Lubbock Christian Chaparrals,596833,4,top,Cason Gregor singled through the left side3a Trey Migl advanced to second.,55,2025-02-16T00:00:00-05:00,"Hays Field (Lubbock, TX)",221,MBA,2025
6340102,596833,Okla. Christian Eagles,596831,Lubbock Christian Chaparrals,596833,4,top,C. Everett to p for A. Duran.,56,2025-02-16T00:00:00-05:00,"Hays Field (Lubbock, TX)",221,MBA,2025
6340102,596833,Okla. Christian Eagles,596831,Lubbock Christian Chaparrals,596833,4,top,"Sloan Laird singled to pitcher, bunt3a Cason Gregor advanced to second3a Trey Migl advanced to third.",57,2025-02-16T00:00:00-05:00,"Hays Field (Lubbock, TX)",221,MBA,2025
6340102,596833,Okla. Christian Eagles,596831,Lubbock Christian Chaparrals,596833,4,top,Elijah Laus struck out swinging.,58,2025-02-16T00:00:00-05:00,"Hays Field (Lubbock, TX)",221,MBA,2025
6340102,596833,Okla. Christian Eagles,596831,Lubbock Christian Chaparrals,596833,4,top,"Hunter Jones flied out to cf to left center, SAC, RBI3a Cason Gregor advanced to third3a Trey Migl scored.",59,2025-02-16T00:00:00-05:00,"Hays Field (Lubbock, TX)",221,MBA,2025
6340102,596833,Okla. Christian Eagles,596831,Lubbock Christian Chaparrals,596833,4,top,Sloan Laird stole second.,60,2025-02-16T00:00:00-05:00,"Hays Field (Lubbock, TX)",221,MBA,2025
6340102,596833,Okla. Christian Eagles,596831,Lubbock Christian Chaparrals,596833,4,top,"Jontae Henne singled to right field, RBI3a Sloan Laird advanced to third, out at home rf to c3a Cason Gregor scored.",61,2025-02-16T00:00:00-05:00,"Hays Field (Lubbock, TX)",221,MBA,2025
6340102,596833,Okla. Christian Eagles,596831,Lubbock Christian Chaparrals,596831,4,bot,B. McCool flied out to cf.,62,2025-02-16T00:00:00-05:00,"Hays Field (Lubbock, TX)",221,MBA,2025
6340102,596833,Okla. Christian Eagles,596831,Lubbock Christian Chaparrals,596831,4,bot,N. Baumbach singled up the middle.,63,2025-02-16T00:00:00-05:00,"Hays Field (Lubbock, TX)",221,MBA,2025
6340102,596833,Okla. Christian Eagles,596831,Lubbock Christian Chaparrals,596831,4,bot,J. Gutierrez grounded out to 2b3a N. Baumbach advanced to second.,64,2025-02-16T00:00:00-05:00,"Hays Field (Lubbock, TX)",221,MBA,2025
6340102,596833,Okla. Christian Eagles,596831,Lubbock Christian Chaparrals,596831,4,bot,B. Tijerina struck out looking.,65,2025-02-16T00:00:00-05:00,"Hays Field (Lubbock, TX)",221,MBA,2025
6340102,596833,Okla. Christian Eagles,596831,Lubbock Christian Chaparrals,596833,5,top,Michael Adai lined out to 3b.,66,2025-02-16T00:00:00-05:00,"Hays Field (Lubbock, TX)",221,MBA,2025
6340102,596833,Okla. Christian Eagles,596831,Lubbock Christian Chaparrals,596833,5,top,Reed Thomas popped up to 2b.,67,2025-02-16T00:00:00-05:00,"Hays Field (Lubbock, TX)",221,MBA,2025
6340102,596833,Okla. Christian Eagles,596831,Lubbock Christian Chaparrals,596833,5,top,Justin Spenc singled to left center.,68,2025-02-16T00:00:00-05:00,"Hays Field (Lubbock, TX)",221,MBA,2025
6340102,596833,Okla. Christian Eagles,596831,Lubbock Christian Chaparrals,596833,5,top,Trey Migl grounded out to 2b.,69,2025-02-16T00:00:00-05:00,"Hays Field (Lubbock, TX)",221,MBA,2025
6340102,596833,Okla. Christian Eagles,596831,Lubbock Christian Chaparrals,596831,5,bot,R. Blackwell doubled down the lf line.,70,2025-02-16T00:00:00-05:00,"Hays Field (Lubbock, TX)",221,MBA,2025
6340102,596833,Okla. Christian Eagles,596831,Lubbock Christian Chaparrals,596831,5,bot,R. Blackwell advanced to third on a wild pitch.,71,2025-02-16T00:00:00-05:00,"Hays Field (Lubbock, TX)",221,MBA,2025
6340102,596833,Okla. Christian Eagles,596831,Lubbock Christian Chaparrals,596831,5,bot,K. Lewis grounded out to p.,72,2025-02-16T00:00:00-05:00,"Hays Field (Lubbock, TX)",221,MBA,2025
6340102,596833,Okla. Christian Eagles,596831,Lubbock Christian Chaparrals,596831,5,bot,F. Chavez walked.,73,2025-02-16T00:00:00-05:00,"Hays Field (Lubbock, TX)",221,MBA,2025
6340102,596833,Okla. Christian Eagles,596831,Lubbock Christian Chaparrals,596831,5,bot,"K. York reached on a fielder's choice, RBI3a F. Chavez advanced to second on a fielding error by 2b, advanced to third3a R. Blackwell scored.",74,2025-02-16T00:00:00-05:00,"Hays Field (Lubbock, TX)",221,MBA,2025
6340102,596833,Okla. Christian Eagles,596831,Lubbock Christian Chaparrals,596831,5,bot,"S. Bowen flied out to cf, SAC, RBI3a F. Chavez scored, unearned.",75,2025-02-16T00:00:00-05:00,"Hays Field (Lubbock, TX)",221,MBA,2025
6340102,596833,Okla. Christian Eagles,596831,Lubbock Christian Chaparrals,596831,5,bot,B. McCool grounded out to ss.,76,2025-02-16T00:00:00-05:00,"Hays Field (Lubbock, TX)",221,MBA,2025
6340102,596833,Okla. Christian Eagles,596831,Lubbock Christian Chaparrals,596833,6,top,Cason Gregor flied out to rf.,77,2025-02-16T00:00:00-05:00,"Hays Field (Lubbock, TX)",221,MBA,2025
6340102,596833,Okla. Christian Eagles,596831,Lubbock Christian Chaparrals,596833,6,top,Sloan Laird singled to center field.,78,2025-02-16T00:00:00-05:00,"Hays Field (Lubbock, TX)",221,MBA,2025
6340102,596833,Okla. Christian Eagles,596831,Lubbock Christian Chaparrals,596833,6,top,Elijah Laus walked3a Sloan Laird advanced to second.,79,2025-02-16T00:00:00-05:00,"Hays Field (Lubbock, TX)",221,MBA,2025
6340102,596833,Okla. Christian Eagles,596831,Lubbock Christian Chaparrals,596833,6,top,Hunter Jones reached on an error by cf3a Elijah Laus advanced to second3a Sloan Laird advanced to third.,80,2025-02-16T00:00:00-05:00,"Hays Field (Lubbock, TX)",221,MBA,2025
6340102,596833,Okla. Christian Eagles,596831,Lubbock Christian Chaparrals,596833,6,top,"Jontae Henne walked, RBI3a Hunter Jones advanced to second3a Elijah Laus advanced to third3a Sloan Laird scored.",81,2025-02-16T00:00:00-05:00,"Hays Field (Lubbock, TX)",221,MBA,2025
6340102,596833,Okla. Christian Eagles,596831,Lubbock Christian Chaparrals,596833,6,top,Michael Adai lined into double play 1b unassisted3a Jontae Henne out on the play.,82,2025-02-16T00:00:00-05:00,"Hays Field (Lubbock, TX)",221,MBA,2025
6340102,596833,Okla. Christian Eagles,596831,Lubbock Christian Chaparrals,596831,6,bot,Alex Ronk to p for Tyler Wilcox.,83,2025-02-16T00:00:00-05:00,"Hays Field (Lubbock, TX)",221,MBA,2025
6340102,596833,Okla. Christian Eagles,596831,Lubbock Christian Chaparrals,596831,6,bot,N. Baumbach grounded out to ss.,84,2025-02-16T00:00:00-05:00,"Hays Field (Lubbock, TX)",221,MBA,2025
6340102,596833,Okla. Christian Eagles,596831,Lubbock Christian Chaparrals,596831,6,bot,J. Gutierrez singled through the right side.,85,2025-02-16T00:00:00-05:00,"Hays Field (Lubbock, TX)",221,MBA,2025
6340102,596833,Okla. Christian Eagles,596831,Lubbock Christian Chaparrals,596831,6,bot,B. Tijerina singled to second base3a J. Gutierrez advanced to third.,86,2025-02-16T00:00:00-05:00,"Hays Field (Lubbock, TX)",221,MBA,2025
6340102,596833,Okla. Christian Eagles,596831,Lubbock Christian Chaparrals,596831,6,bot,R. Blackwell grounded into double play ss to 2b to 1b3a B. Tijerina out on the play.,87,2025-02-16T00:00:00-05:00,"Hays Field (Lubbock, TX)",221,MBA,2025
6340102,596833,Okla. Christian Eagles,596831,Lubbock Christian Chaparrals,596833,7,top,K. Carpenter to p for C. Everett.,88,2025-02-16T00:00:00-05:00,"Hays Field (Lubbock, TX)",221,MBA,2025
6340102,596833,Okla. Christian Eagles,596831,Lubbock Christian Chaparrals,596833,7,top,Reed Thomas grounded out to 3b.,89,2025-02-16T00:00:00-05:00,"Hays Field (Lubbock, TX)",221,MBA,2025
6340102,596833,Okla. Christian Eagles,596831,Lubbock Christian Chaparrals,596833,7,top,Justin Spenc singled to center field.,90,2025-02-16T00:00:00-05:00,"Hays Field (Lubbock, TX)",221,MBA,2025
6340102,596833,Okla. Christian Eagles,596831,Lubbock Christian Chaparrals,596833,7,top,Trey Migl grounded into double play 2b to ss to 1b3a Justin Spenc out on the play.,91,2025-02-16T00:00:00-05:00,"Hays Field (Lubbock, TX)",221,MBA,2025
6340102,596833,Okla. Christian Eagles,596831,Lubbock Christian Chaparrals,596831,7,bot,Chris Jones to p for Alex Ronk.,92,2025-02-16T00:00:00-05:00,"Hays Field (Lubbock, TX)",221,MBA,2025
6340102,596833,Okla. Christian Eagles,596831,Lubbock Christian Chaparrals,596831,7,bot,K. Lewis walked.,93,2025-02-16T00:00:00-05:00,"Hays Field (Lubbock, TX)",221,MBA,2025
6340102,596833,Okla. Christian Eagles,596831,Lubbock Christian Chaparrals,596831,7,bot,F. Chavez grounded into double play 3b to 2b to 1b3a K. Lewis out on the play.,94,2025-02-16T00:00:00-05:00,"Hays Field (Lubbock, TX)",221,MBA,2025
6340102,596833,Okla. Christian Eagles,596831,Lubbock Christian Chaparrals,596831,7,bot,"K. York reached on an error by 3b, advanced to second.",95,2025-02-16T00:00:00-05:00,"Hays Field (Lubbock, TX)",221,MBA,2025
6340102,596833,Okla. Christian Eagles,596831,Lubbock Christian Chaparrals,596831,7,bot,"S. Bowen singled up the middle, RBI3a K. York scored, unearned.",96,2025-02-16T00:00:00-05:00,"Hays Field (Lubbock, TX)",221,MBA,2025
6340102,596833,Okla. Christian Eagles,596831,Lubbock Christian Chaparrals,596831,7,bot,"B. McCool homered to left field, 2 RBI, unearned3a S. Bowen scored, unearned.",97,2025-02-16T00:00:00-05:00,"Hays Field (Lubbock, TX)",221,MBA,2025
6340102,596833,Okla. Christian Eagles,596831,Lubbock Christian Chaparrals,596831,7,bot,N. Baumbach singled to right center.,98,2025-02-16T00:00:00-05:00,"Hays Field (Lubbock, TX)",221,MBA,2025
6340102,596833,Okla. Christian Eagles,596831,Lubbock Christian Chaparrals,596831,7,bot,J. Gutierrez doubled to right center3a N. Baumbach advanced to third.,99,2025-02-16T00:00:00-05:00,"Hays Field (Lubbock, TX)",221,MBA,2025
6340102,596833,Okla. Christian Eagles,596831,Lubbock Christian Chaparrals,596831,7,bot,"J. Gutierrez advanced to third3a N. Baumbach scored on a wild pitch, unearned.",100,2025-02-16T00:00:00-05:00,"Hays Field (Lubbock, TX)",221,MBA,2025
6340102,596833,Okla. Christian Eagles,596831,Lubbock Christian Chaparrals,596831,7,bot,B. Tijerina struck out swinging.,101,2025-02-16T00:00:00-05:00,"Hays Field (Lubbock, TX)",221,MBA,2025
6340102,596833,Okla. Christian Eagles,596831,Lubbock Christian Chaparrals,596833,8,top,Cason Gregor singled to center field.,102,2025-02-16T00:00:00-05:00,"Hays Field (Lubbock, TX)",221,MBA,2025
6340102,596833,Okla. Christian Eagles,596831,Lubbock Christian Chaparrals,596833,8,top,"Cason Gregor out at second c to ss, caught stealing.",103,2025-02-16T00:00:00-05:00,"Hays Field (Lubbock, TX)",221,MBA,2025
6340102,596833,Okla. Christian Eagles,596831,Lubbock Christian Chaparrals,596833,8,top,Sloan Laird grounded out to 2b.,104,2025-02-16T00:00:00-05:00,"Hays Field (Lubbock, TX)",221,MBA,2025
6340102,596833,Okla. Christian Eagles,596831,Lubbock Christian Chaparrals,596833,8,top,Elijah Laus struck out swinging.,105,2025-02-16T00:00:00-05:00,"Hays Field (Lubbock, TX)",221,MBA,2025
6340102,596833,Okla. Christian Eagles,596831,Lubbock Christian Chaparrals,596831,8,bot,Ira Clifton to p for Chris Jones.,106,2025-02-16T00:00:00-05:00,"Hays Field (Lubbock, TX)",221,MBA,2025
6340102,596833,Okla. Christian Eagles,596831,Lubbock Christian Chaparrals,596831,8,bot,R. Blackwell popped up to 2b.,107,2025-02-16T00:00:00-05:00,"Hays Field (Lubbock, TX)",221,MBA,2025
6340102,596833,Okla. Christian Eagles,596831,Lubbock Christian Chaparrals,596831,8,bot,K. Lewis flied out to cf to left center.,108,2025-02-16T00:00:00-05:00,"Hays Field (Lubbock, TX)",221,MBA,2025
6340102,596833,Okla. Christian Eagles,596831,Lubbock Christian Chaparrals,596831,8,bot,F. Chavez singled down the rf line.,109,2025-02-16T00:00:00-05:00,"Hays Field (Lubbock, TX)",221,MBA,2025
6340102,596833,Okla. Christian Eagles,596831,Lubbock Christian Chaparrals,596831,8,bot,K. York popped up to ss.,110,2025-02-16T00:00:00-05:00,"Hays Field (Lubbock, TX)",221,MBA,2025
6340102,596833,Okla. Christian Eagles,596831,Lubbock Christian Chaparrals,596833,9,top,Hunter Jones struck out looking.,111,2025-02-16T00:00:00-05:00,"Hays Field (Lubbock, TX)",221,MBA,2025
6340102,596833,Okla. Christian Eagles,596831,Lubbock Christian Chaparrals,596833,9,top,Jontae Henne struck out swinging.,112,2025-02-16T00:00:00-05:00,"Hays Field (Lubbock, TX)",221,MBA,2025
6340102,596833,Okla. Christian Eagles,596831,Lubbock Christian Chaparrals,596833,9,top,Michael Adai singled to shortstop.,113,2025-02-16T00:00:00-05:00,"Hays Field (Lubbock, TX)",221,MBA,2025
6340102,596833,Okla. Christian Eagles,596831,Lubbock Christian Chaparrals,596833,9,top,Reed Thomas lined out to ss up the middle.,114,2025-02-16T00:00:00-05:00,"Hays Field (Lubbock, TX)",221,MBA,2025
6340102,596833,Okla. Christian Eagles,596831,Lubbock Christian Chaparrals,596831,9,bot,S. Bowen singled to pitcher.,115,2025-02-16T00:00:00-05:00,"Hays Field (Lubbock, TX)",221,MBA,2025
6340102,596833,Okla. Christian Eagles,596831,Lubbock Christian Chaparrals,596831,9,bot,S. Bowen advanced to second on a passed ball.,116,2025-02-16T00:00:00-05:00,"Hays Field (Lubbock, TX)",221,MBA,2025
6340102,596833,Okla. Christian Eagles,596831,Lubbock Christian Chaparrals,596831,9,bot,B. McCool reached on an error by ss3a S. Bowen advanced to third.,117,2025-02-16T00:00:00-05:00,"Hays Field (Lubbock, TX)",221,MBA,2025
6340102,596833,Okla. Christian Eagles,596831,Lubbock Christian Chaparrals,596831,9,bot,"N. Baumbach grounded out to p, RBI3a B. McCool advanced to second3a S. Bowen scored.",118,2025-02-16T00:00:00-05:00,"Hays Field (Lubbock, TX)",221,MBA,2025
6340102,596833,Okla. Christian Eagles,596831,Lubbock Christian Chaparrals,596831,9,bot,"J. Gutierrez singled up the middle, RBI3a B. McCool scored, unearned.",119,2025-02-16T00:00:00-05:00,"Hays Field (Lubbock, TX)",221,MBA,2025
6340102,596833,Okla. Christian Eagles,596831,Lubbock Christian Chaparrals,596831,9,bot,B. Tijerina grounded into double play ss to 2b to 1b3a J. Gutierrez out on the play.,120,2025-02-16T00:00:00-05:00,"Hays Field (Lubbock, TX)",221,MBA,2025
