game_id,away_team_id,away_team_name,home_team_id,home_team_name,batting_team,inning,top_bot,event_text,event_num,game_datetime,stadium_name,attendance,sport_id,season
6340644,596998,Otterbein Cardinals,597037,Sewanee Tigers,596998,1,top,M. McCann reached first on a fielding error by ss.,1,2025-02-23T00:00:00-05:00,"Montgomery Field (Sewanee, TN)",0,MBA,2025
6340644,596998,Otterbein Cardinals,597037,Sewanee Tigers,596998,1,top,J. Perebzak flied out to cf.,2,2025-02-23T00:00:00-05:00,"Montgomery Field (Sewanee, TN)",0,MBA,2025
6340644,596998,Otterbein Cardinals,597037,Sewanee Tigers,596998,1,top,L. Ullom flied out to cf to left center.,3,2025-02-23T00:00:00-05:00,"Montgomery Field (Sewanee, TN)",0,MBA,2025
6340644,596998,Otterbein Cardinals,597037,Sewanee Tigers,596998,1,top,"M. McCann out at second c to ss, caught stealing.",4,2025-02-23T00:00:00-05:00,"Montgomery Field (Sewanee, TN)",0,MBA,2025
6340644,596998,Otterbein Cardinals,597037,Sewanee Tigers,597037,1,bot,S. Leinberge fouled out to 1b.,5,2025-02-23T00:00:00-05:00,"Montgomery Field (Sewanee, TN)",0,MBA,2025
6340644,596998,Otterbein Cardinals,597037,Sewanee Tigers,597037,1,bot,B. Pou grounded out to p unassisted.,6,2025-02-23T00:00:00-05:00,"Montgomery Field (Sewanee, TN)",0,MBA,2025
6340644,596998,Otterbein Cardinals,597037,Sewanee Tigers,597037,1,bot,C. Teel grounded out to ss up the middle.,7,2025-02-23T00:00:00-05:00,"Montgomery Field (Sewanee, TN)",0,MBA,2025
6340644,596998,Otterbein Cardinals,597037,Sewanee Tigers,596998,2,top,J. Gels popped up to ss.,8,2025-02-23T00:00:00-05:00,"Montgomery Field (Sewanee, TN)",0,MBA,2025
6340644,596998,Otterbein Cardinals,597037,Sewanee Tigers,596998,2,top,Z. Taylor grounded out to 3b.,9,2025-02-23T00:00:00-05:00,"Montgomery Field (Sewanee, TN)",0,MBA,2025
6340644,596998,Otterbein Cardinals,597037,Sewanee Tigers,596998,2,top,L. Preston popped up to 2b.,10,2025-02-23T00:00:00-05:00,"Montgomery Field (Sewanee, TN)",0,MBA,2025
6340644,596998,Otterbein Cardinals,597037,Sewanee Tigers,597037,2,bot,O. Andress walked.,11,2025-02-23T00:00:00-05:00,"Montgomery Field (Sewanee, TN)",0,MBA,2025
6340644,596998,Otterbein Cardinals,597037,Sewanee Tigers,597037,2,bot,"W. Jennewein singled to first base, bunt3a O. Andress advanced to second.",12,2025-02-23T00:00:00-05:00,"Montgomery Field (Sewanee, TN)",0,MBA,2025
6340644,596998,Otterbein Cardinals,597037,Sewanee Tigers,597037,2,bot,"O. Andress out at second c to ss, picked off.",13,2025-02-23T00:00:00-05:00,"Montgomery Field (Sewanee, TN)",0,MBA,2025
6340644,596998,Otterbein Cardinals,597037,Sewanee Tigers,597037,2,bot,W. Jennewein stole second.,14,2025-02-23T00:00:00-05:00,"Montgomery Field (Sewanee, TN)",0,MBA,2025
6340644,596998,Otterbein Cardinals,597037,Sewanee Tigers,597037,2,bot,J. Bagwell flied out to lf.,15,2025-02-23T00:00:00-05:00,"Montgomery Field (Sewanee, TN)",0,MBA,2025
6340644,596998,Otterbein Cardinals,597037,Sewanee Tigers,597037,2,bot,"T. Pinson singled through the left side, RBI3a W. Jennewein scored.",16,2025-02-23T00:00:00-05:00,"Montgomery Field (Sewanee, TN)",0,MBA,2025
6340644,596998,Otterbein Cardinals,597037,Sewanee Tigers,597037,2,bot,W. Irvin flied out to cf.,17,2025-02-23T00:00:00-05:00,"Montgomery Field (Sewanee, TN)",0,MBA,2025
6340644,596998,Otterbein Cardinals,597037,Sewanee Tigers,596998,3,top,C. Mabry struck out swinging.,18,2025-02-23T00:00:00-05:00,"Montgomery Field (Sewanee, TN)",0,MBA,2025
6340644,596998,Otterbein Cardinals,597037,Sewanee Tigers,596998,3,top,S. Monokandi singled through the left side.,19,2025-02-23T00:00:00-05:00,"Montgomery Field (Sewanee, TN)",0,MBA,2025
6340644,596998,Otterbein Cardinals,597037,Sewanee Tigers,596998,3,top,S. Monokandi stole second.,20,2025-02-23T00:00:00-05:00,"Montgomery Field (Sewanee, TN)",0,MBA,2025
6340644,596998,Otterbein Cardinals,597037,Sewanee Tigers,596998,3,top,D. Uhl struck out swinging.,21,2025-02-23T00:00:00-05:00,"Montgomery Field (Sewanee, TN)",0,MBA,2025
6340644,596998,Otterbein Cardinals,597037,Sewanee Tigers,596998,3,top,M. McCann struck out swinging.,22,2025-02-23T00:00:00-05:00,"Montgomery Field (Sewanee, TN)",0,MBA,2025
6340644,596998,Otterbein Cardinals,597037,Sewanee Tigers,597037,3,bot,L. Short walked.,23,2025-02-23T00:00:00-05:00,"Montgomery Field (Sewanee, TN)",0,MBA,2025
6340644,596998,Otterbein Cardinals,597037,Sewanee Tigers,597037,3,bot,"S. Leinberge grounded out to p, SAC, bunt3a L. Short advanced to second.",24,2025-02-23T00:00:00-05:00,"Montgomery Field (Sewanee, TN)",0,MBA,2025
6340644,596998,Otterbein Cardinals,597037,Sewanee Tigers,597037,3,bot,"B. Pou doubled down the rf line, RBI3a L. Short scored.",25,2025-02-23T00:00:00-05:00,"Montgomery Field (Sewanee, TN)",0,MBA,2025
6340644,596998,Otterbein Cardinals,597037,Sewanee Tigers,597037,3,bot,C. Teel grounded out to 3b.,26,2025-02-23T00:00:00-05:00,"Montgomery Field (Sewanee, TN)",0,MBA,2025
6340644,596998,Otterbein Cardinals,597037,Sewanee Tigers,597037,3,bot,O. Andress popped up to 1b.,27,2025-02-23T00:00:00-05:00,"Montgomery Field (Sewanee, TN)",0,MBA,2025
6340644,596998,Otterbein Cardinals,597037,Sewanee Tigers,596998,4,top,"J. Perebzak grounded out to p, bunt.",28,2025-02-23T00:00:00-05:00,"Montgomery Field (Sewanee, TN)",0,MBA,2025
6340644,596998,Otterbein Cardinals,597037,Sewanee Tigers,596998,4,top,L. Ullom singled to right center.,29,2025-02-23T00:00:00-05:00,"Montgomery Field (Sewanee, TN)",0,MBA,2025
6340644,596998,Otterbein Cardinals,597037,Sewanee Tigers,596998,4,top,J. Gels flied out to lf.,30,2025-02-23T00:00:00-05:00,"Montgomery Field (Sewanee, TN)",0,MBA,2025
6340644,596998,Otterbein Cardinals,597037,Sewanee Tigers,596998,4,top,Z. Taylor walked3a L. Ullom advanced to second.,31,2025-02-23T00:00:00-05:00,"Montgomery Field (Sewanee, TN)",0,MBA,2025
6340644,596998,Otterbein Cardinals,597037,Sewanee Tigers,596998,4,top,L. Preston out at first 1b to p.,32,2025-02-23T00:00:00-05:00,"Montgomery Field (Sewanee, TN)",0,MBA,2025
6340644,596998,Otterbein Cardinals,597037,Sewanee Tigers,597037,4,bot,W. Jennewein walked.,33,2025-02-23T00:00:00-05:00,"Montgomery Field (Sewanee, TN)",0,MBA,2025
6340644,596998,Otterbein Cardinals,597037,Sewanee Tigers,597037,4,bot,J. Bagwell singled to left field3a W. Jennewein advanced to second.,34,2025-02-23T00:00:00-05:00,"Montgomery Field (Sewanee, TN)",0,MBA,2025
6340644,596998,Otterbein Cardinals,597037,Sewanee Tigers,597037,4,bot,T. Pinson reached on a fielder's choice to second base3a J. Bagwell out at second 2b to ss3a W. Jennewein advanced to third.,35,2025-02-23T00:00:00-05:00,"Montgomery Field (Sewanee, TN)",0,MBA,2025
6340644,596998,Otterbein Cardinals,597037,Sewanee Tigers,597037,4,bot,W. Irvin grounded into double play ss to 1b3a T. Pinson out on the play.,36,2025-02-23T00:00:00-05:00,"Montgomery Field (Sewanee, TN)",0,MBA,2025
6340644,596998,Otterbein Cardinals,597037,Sewanee Tigers,596998,5,top,"C. Mabry reached first on a throwing error by 3b, advanced to second.",37,2025-02-23T00:00:00-05:00,"Montgomery Field (Sewanee, TN)",0,MBA,2025
6340644,596998,Otterbein Cardinals,597037,Sewanee Tigers,596998,5,top,S. Monokandi struck out swinging.,38,2025-02-23T00:00:00-05:00,"Montgomery Field (Sewanee, TN)",0,MBA,2025
6340644,596998,Otterbein Cardinals,597037,Sewanee Tigers,596998,5,top,D. Uhl lined out to rf3a C. Mabry advanced to third.,39,2025-02-23T00:00:00-05:00,"Montgomery Field (Sewanee, TN)",0,MBA,2025
6340644,596998,Otterbein Cardinals,597037,Sewanee Tigers,596998,5,top,M. McCann grounded out to ss.,40,2025-02-23T00:00:00-05:00,"Montgomery Field (Sewanee, TN)",0,MBA,2025
6340644,596998,Otterbein Cardinals,597037,Sewanee Tigers,597037,5,bot,M. Rabe to p for B. Bell.,41,2025-02-23T00:00:00-05:00,"Montgomery Field (Sewanee, TN)",0,MBA,2025
6340644,596998,Otterbein Cardinals,597037,Sewanee Tigers,597037,5,bot,L. Short struck out swinging.,42,2025-02-23T00:00:00-05:00,"Montgomery Field (Sewanee, TN)",0,MBA,2025
6340644,596998,Otterbein Cardinals,597037,Sewanee Tigers,597037,5,bot,S. Leinberge walked.,43,2025-02-23T00:00:00-05:00,"Montgomery Field (Sewanee, TN)",0,MBA,2025
6340644,596998,Otterbein Cardinals,597037,Sewanee Tigers,597037,5,bot,B. Pou flied out to lf.,44,2025-02-23T00:00:00-05:00,"Montgomery Field (Sewanee, TN)",0,MBA,2025
6340644,596998,Otterbein Cardinals,597037,Sewanee Tigers,597037,5,bot,C. Teel singled through the left side3a S. Leinberge advanced to second.,45,2025-02-23T00:00:00-05:00,"Montgomery Field (Sewanee, TN)",0,MBA,2025
6340644,596998,Otterbein Cardinals,597037,Sewanee Tigers,597037,5,bot,O. Andress singled to third base3a C. Teel advanced to second3a S. Leinberge advanced to third.,46,2025-02-23T00:00:00-05:00,"Montgomery Field (Sewanee, TN)",0,MBA,2025
6340644,596998,Otterbein Cardinals,597037,Sewanee Tigers,597037,5,bot,O. Andress advanced to second3a C. Teel advanced to third3a S. Leinberge scored on a wild pitch.,47,2025-02-23T00:00:00-05:00,"Montgomery Field (Sewanee, TN)",0,MBA,2025
6340644,596998,Otterbein Cardinals,597037,Sewanee Tigers,597037,5,bot,"W. Jennewein singled to left center, 2 RBI3a O. Andress scored3a C. Teel scored.",48,2025-02-23T00:00:00-05:00,"Montgomery Field (Sewanee, TN)",0,MBA,2025
6340644,596998,Otterbein Cardinals,597037,Sewanee Tigers,597037,5,bot,"W. Jennewein out at second c to 2b, caught stealing.",49,2025-02-23T00:00:00-05:00,"Montgomery Field (Sewanee, TN)",0,MBA,2025
6340644,596998,Otterbein Cardinals,597037,Sewanee Tigers,596998,6,top,J. Perebzak singled to left field.,50,2025-02-23T00:00:00-05:00,"Montgomery Field (Sewanee, TN)",0,MBA,2025
6340644,596998,Otterbein Cardinals,597037,Sewanee Tigers,596998,6,top,L. Ullom singled to right field3a J. Perebzak advanced to second.,51,2025-02-23T00:00:00-05:00,"Montgomery Field (Sewanee, TN)",0,MBA,2025
6340644,596998,Otterbein Cardinals,597037,Sewanee Tigers,596998,6,top,J. Gels walked3a L. Ullom advanced to second3a J. Perebzak advanced to third.,52,2025-02-23T00:00:00-05:00,"Montgomery Field (Sewanee, TN)",0,MBA,2025
6340644,596998,Otterbein Cardinals,597037,Sewanee Tigers,596998,6,top,H. Phillips to p for J. Nevle.,53,2025-02-23T00:00:00-05:00,"Montgomery Field (Sewanee, TN)",0,MBA,2025
6340644,596998,Otterbein Cardinals,597037,Sewanee Tigers,596998,6,top,"Z. Taylor flied out to cf, SAC, RBI3a L. Ullom advanced to third3a J. Perebzak scored.",54,2025-02-23T00:00:00-05:00,"Montgomery Field (Sewanee, TN)",0,MBA,2025
6340644,596998,Otterbein Cardinals,597037,Sewanee Tigers,596998,6,top,J. Brown pinch hit for L. Preston.,55,2025-02-23T00:00:00-05:00,"Montgomery Field (Sewanee, TN)",0,MBA,2025
6340644,596998,Otterbein Cardinals,597037,Sewanee Tigers,596998,6,top,"J. Brown flied out to cf, SAC, RBI3a L. Ullom scored.",56,2025-02-23T00:00:00-05:00,"Montgomery Field (Sewanee, TN)",0,MBA,2025
6340644,596998,Otterbein Cardinals,597037,Sewanee Tigers,596998,6,top,C. Mabry singled to left field3a J. Gels advanced to second.,57,2025-02-23T00:00:00-05:00,"Montgomery Field (Sewanee, TN)",0,MBA,2025
6340644,596998,Otterbein Cardinals,597037,Sewanee Tigers,596998,6,top,S. Monokandi fouled out to 1b.,58,2025-02-23T00:00:00-05:00,"Montgomery Field (Sewanee, TN)",0,MBA,2025
6340644,596998,Otterbein Cardinals,597037,Sewanee Tigers,597037,6,bot,C. Kirker to cf for J. Brown.,59,2025-02-23T00:00:00-05:00,"Montgomery Field (Sewanee, TN)",0,MBA,2025
6340644,596998,Otterbein Cardinals,597037,Sewanee Tigers,597037,6,bot,C. Mabry to rf.,60,2025-02-23T00:00:00-05:00,"Montgomery Field (Sewanee, TN)",0,MBA,2025
6340644,596998,Otterbein Cardinals,597037,Sewanee Tigers,597037,6,bot,J. Bagwell walked.,61,2025-02-23T00:00:00-05:00,"Montgomery Field (Sewanee, TN)",0,MBA,2025
6340644,596998,Otterbein Cardinals,597037,Sewanee Tigers,597037,6,bot,"J. Bagwell out at second c to 2b, caught stealing.",62,2025-02-23T00:00:00-05:00,"Montgomery Field (Sewanee, TN)",0,MBA,2025
6340644,596998,Otterbein Cardinals,597037,Sewanee Tigers,597037,6,bot,T. Pinson singled to center field.,63,2025-02-23T00:00:00-05:00,"Montgomery Field (Sewanee, TN)",0,MBA,2025
6340644,596998,Otterbein Cardinals,597037,Sewanee Tigers,597037,6,bot,J. Lard pinch ran for T. Pinson.,64,2025-02-23T00:00:00-05:00,"Montgomery Field (Sewanee, TN)",0,MBA,2025
6340644,596998,Otterbein Cardinals,597037,Sewanee Tigers,597037,6,bot,"W. Irvin homered to left field, 2 RBI3a J. Lard scored.",65,2025-02-23T00:00:00-05:00,"Montgomery Field (Sewanee, TN)",0,MBA,2025
6340644,596998,Otterbein Cardinals,597037,Sewanee Tigers,597037,6,bot,B. Gantt pinch hit for L. Short.,66,2025-02-23T00:00:00-05:00,"Montgomery Field (Sewanee, TN)",0,MBA,2025
6340644,596998,Otterbein Cardinals,597037,Sewanee Tigers,597037,6,bot,B. Gantt grounded out to 2b.,67,2025-02-23T00:00:00-05:00,"Montgomery Field (Sewanee, TN)",0,MBA,2025
6340644,596998,Otterbein Cardinals,597037,Sewanee Tigers,597037,6,bot,S. Leinberge grounded out to ss.,68,2025-02-23T00:00:00-05:00,"Montgomery Field (Sewanee, TN)",0,MBA,2025
6340644,596998,Otterbein Cardinals,597037,Sewanee Tigers,596998,7,top,Z. Fortman to ss for B. Gantt.,69,2025-02-23T00:00:00-05:00,"Montgomery Field (Sewanee, TN)",0,MBA,2025
6340644,596998,Otterbein Cardinals,597037,Sewanee Tigers,596998,7,top,D. Uhl struck out swinging.,70,2025-02-23T00:00:00-05:00,"Montgomery Field (Sewanee, TN)",0,MBA,2025
6340644,596998,Otterbein Cardinals,597037,Sewanee Tigers,596998,7,top,M. McCann grounded out to 3b.,71,2025-02-23T00:00:00-05:00,"Montgomery Field (Sewanee, TN)",0,MBA,2025
6340644,596998,Otterbein Cardinals,597037,Sewanee Tigers,596998,7,top,J. Perebzak hit by pitch.,72,2025-02-23T00:00:00-05:00,"Montgomery Field (Sewanee, TN)",0,MBA,2025
6340644,596998,Otterbein Cardinals,597037,Sewanee Tigers,596998,7,top,L. Ullom reached on a fielder's choice to shortstop3a J. Perebzak out at second ss to 2b.,73,2025-02-23T00:00:00-05:00,"Montgomery Field (Sewanee, TN)",0,MBA,2025
6340644,596998,Otterbein Cardinals,597037,Sewanee Tigers,597037,7,bot,N. Gruver to p for M. Rabe.,74,2025-02-23T00:00:00-05:00,"Montgomery Field (Sewanee, TN)",0,MBA,2025
6340644,596998,Otterbein Cardinals,597037,Sewanee Tigers,597037,7,bot,B. Pou walked.,75,2025-02-23T00:00:00-05:00,"Montgomery Field (Sewanee, TN)",0,MBA,2025
6340644,596998,Otterbein Cardinals,597037,Sewanee Tigers,597037,7,bot,"C. Teel reached on a fielder's choice to pitcher, bunt3a B. Pou out at second p to ss.",76,2025-02-23T00:00:00-05:00,"Montgomery Field (Sewanee, TN)",0,MBA,2025
6340644,596998,Otterbein Cardinals,597037,Sewanee Tigers,597037,7,bot,O. Andress flied out to cf.,77,2025-02-23T00:00:00-05:00,"Montgomery Field (Sewanee, TN)",0,MBA,2025
6340644,596998,Otterbein Cardinals,597037,Sewanee Tigers,597037,7,bot,"C. Teel out at second c to ss, caught stealing.",78,2025-02-23T00:00:00-05:00,"Montgomery Field (Sewanee, TN)",0,MBA,2025
6340644,596998,Otterbein Cardinals,597037,Sewanee Tigers,596998,8,top,A. Graber to p for H. Phillips.,79,2025-02-23T00:00:00-05:00,"Montgomery Field (Sewanee, TN)",0,MBA,2025
6340644,596998,Otterbein Cardinals,597037,Sewanee Tigers,596998,8,top,J. Gels flied out to lf.,80,2025-02-23T00:00:00-05:00,"Montgomery Field (Sewanee, TN)",0,MBA,2025
6340644,596998,Otterbein Cardinals,597037,Sewanee Tigers,596998,8,top,Z. Taylor flied out to rf.,81,2025-02-23T00:00:00-05:00,"Montgomery Field (Sewanee, TN)",0,MBA,2025
6340644,596998,Otterbein Cardinals,597037,Sewanee Tigers,596998,8,top,N. James pinch hit for C. Kirker.,82,2025-02-23T00:00:00-05:00,"Montgomery Field (Sewanee, TN)",0,MBA,2025
6340644,596998,Otterbein Cardinals,597037,Sewanee Tigers,596998,8,top,N. James doubled to center field.,83,2025-02-23T00:00:00-05:00,"Montgomery Field (Sewanee, TN)",0,MBA,2025
6340644,596998,Otterbein Cardinals,597037,Sewanee Tigers,596998,8,top,C. Mabry struck out swinging.,84,2025-02-23T00:00:00-05:00,"Montgomery Field (Sewanee, TN)",0,MBA,2025
6340644,596998,Otterbein Cardinals,597037,Sewanee Tigers,597037,8,bot,C. Bond to cf for N. James.,85,2025-02-23T00:00:00-05:00,"Montgomery Field (Sewanee, TN)",0,MBA,2025
6340644,596998,Otterbein Cardinals,597037,Sewanee Tigers,597037,8,bot,W. Jennewein grounded out to ss up the middle.,86,2025-02-23T00:00:00-05:00,"Montgomery Field (Sewanee, TN)",0,MBA,2025
6340644,596998,Otterbein Cardinals,597037,Sewanee Tigers,597037,8,bot,J. Bagwell out at first 1b to p.,87,2025-02-23T00:00:00-05:00,"Montgomery Field (Sewanee, TN)",0,MBA,2025
6340644,596998,Otterbein Cardinals,597037,Sewanee Tigers,597037,8,bot,J. Glover pinch hit for J. Lard.,88,2025-02-23T00:00:00-05:00,"Montgomery Field (Sewanee, TN)",0,MBA,2025
6340644,596998,Otterbein Cardinals,597037,Sewanee Tigers,597037,8,bot,J. Glover struck out swinging.,89,2025-02-23T00:00:00-05:00,"Montgomery Field (Sewanee, TN)",0,MBA,2025
6340644,596998,Otterbein Cardinals,597037,Sewanee Tigers,596998,9,top,D. Firchau pinch hit for S. Monokandi.,90,2025-02-23T00:00:00-05:00,"Montgomery Field (Sewanee, TN)",0,MBA,2025
6340644,596998,Otterbein Cardinals,597037,Sewanee Tigers,596998,9,top,D. Firchau grounded out to 2b.,91,2025-02-23T00:00:00-05:00,"Montgomery Field (Sewanee, TN)",0,MBA,2025
6340644,596998,Otterbein Cardinals,597037,Sewanee Tigers,596998,9,top,C. Greenlief pinch hit for D. Uhl.,92,2025-02-23T00:00:00-05:00,"Montgomery Field (Sewanee, TN)",0,MBA,2025
6340644,596998,Otterbein Cardinals,597037,Sewanee Tigers,596998,9,top,C. Greenlief grounded out to 1b unassisted.,93,2025-02-23T00:00:00-05:00,"Montgomery Field (Sewanee, TN)",0,MBA,2025
6340644,596998,Otterbein Cardinals,597037,Sewanee Tigers,596998,9,top,M. McCann singled to right field.,94,2025-02-23T00:00:00-05:00,"Montgomery Field (Sewanee, TN)",0,MBA,2025
6340644,596998,Otterbein Cardinals,597037,Sewanee Tigers,596998,9,top,J. Perebzak reached first on a throwing error by 3b3a M. McCann advanced to second.,95,2025-02-23T00:00:00-05:00,"Montgomery Field (Sewanee, TN)",0,MBA,2025
6340644,596998,Otterbein Cardinals,597037,Sewanee Tigers,596998,9,top,L. Ullom walked3a J. Perebzak advanced to second3a M. McCann advanced to third.,96,2025-02-23T00:00:00-05:00,"Montgomery Field (Sewanee, TN)",0,MBA,2025
6340644,596998,Otterbein Cardinals,597037,Sewanee Tigers,596998,9,top,J. Gels grounded out to 2b.,97,2025-02-23T00:00:00-05:00,"Montgomery Field (Sewanee, TN)",0,MBA,2025
