game_id,away_team_id,away_team_name,home_team_id,home_team_name,batting_team,inning,top_bot,event_text,event_num,game_datetime,stadium_name,attendance,sport_id,season
6341656,597009,Rensselaer Engineers,597344,MUW Owls,597009,1,top,"Lebenson, Michael flied out to lf.",1,2025-03-05T00:00:00-05:00,"Jackson, MS",120,MBA,2025
6341656,597009,Rensselaer Engineers,597344,MUW Owls,597009,1,top,"Oehlschlaeger, Ian walked.",2,2025-03-05T00:00:00-05:00,"Jackson, MS",120,MBA,2025
6341656,597009,Rensselaer Engineers,597344,MUW Owls,597009,1,top,"Primerano, Jon flied out to rf.",3,2025-03-05T00:00:00-05:00,"Jackson, MS",120,MBA,2025
6341656,597009,Rensselaer Engineers,597344,MUW Owls,597009,1,top,"Hicks, Aidan reached on a fielder's choice; Oehlschlaeger, Ian out at second ss to 2b.",4,2025-03-05T00:00:00-05:00,"Jackson, MS",120,MBA,2025
6341656,597009,Rensselaer Engineers,597344,MUW Owls,597344,1,bot,T. Estabr lined out to 3b.,5,2025-03-05T00:00:00-05:00,"Jackson, MS",120,MBA,2025
6341656,597009,Rensselaer Engineers,597344,MUW Owls,597344,1,bot,M. Wind singled to second base.,6,2025-03-05T00:00:00-05:00,"Jackson, MS",120,MBA,2025
6341656,597009,Rensselaer Engineers,597344,MUW Owls,597344,1,bot,A. Benson grounded out to p unassisted; M. Wind advanced to second.,7,2025-03-05T00:00:00-05:00,"Jackson, MS",120,MBA,2025
6341656,597009,Rensselaer Engineers,597344,MUW Owls,597344,1,bot,Z. Johnson flied out to rf.,8,2025-03-05T00:00:00-05:00,"Jackson, MS",120,MBA,2025
6341656,597009,Rensselaer Engineers,597344,MUW Owls,597009,2,top,"Scarpa, Julian singled to right field.",9,2025-03-05T00:00:00-05:00,"Jackson, MS",120,MBA,2025
6341656,597009,Rensselaer Engineers,597344,MUW Owls,597009,2,top,"Krishnappa, Ayush singled through the left side; Scarpa, Julian advanced to third.",10,2025-03-05T00:00:00-05:00,"Jackson, MS",120,MBA,2025
6341656,597009,Rensselaer Engineers,597344,MUW Owls,597009,2,top,"Levesque, Kameron grounded into double play ss to 2b to 1b; Krishnappa, Ayush out on the play.",11,2025-03-05T00:00:00-05:00,"Jackson, MS",120,MBA,2025
6341656,597009,Rensselaer Engineers,597344,MUW Owls,597009,2,top,"Lapp, Charlie hit by pitch.",12,2025-03-05T00:00:00-05:00,"Jackson, MS",120,MBA,2025
6341656,597009,Rensselaer Engineers,597344,MUW Owls,597009,2,top,"Lapp, Charlie stole second.",13,2025-03-05T00:00:00-05:00,"Jackson, MS",120,MBA,2025
6341656,597009,Rensselaer Engineers,597344,MUW Owls,597009,2,top,"Mullins, Jack walked.",14,2025-03-05T00:00:00-05:00,"Jackson, MS",120,MBA,2025
6341656,597009,Rensselaer Engineers,597344,MUW Owls,597009,2,top,"Lebenson, Michael hit by pitch, RBI; Mullins, Jack advanced to second; Lapp, Charlie advanced to third; Scarpa, Julian scored.",15,2025-03-05T00:00:00-05:00,"Jackson, MS",120,MBA,2025
6341656,597009,Rensselaer Engineers,597344,MUW Owls,597009,2,top,"Oehlschlaeger, Ian hit by pitch, RBI; Lebenson, Michael advanced to second; Mullins, Jack advanced to third; Lapp, Charlie scored.",16,2025-03-05T00:00:00-05:00,"Jackson, MS",120,MBA,2025
6341656,597009,Rensselaer Engineers,597344,MUW Owls,597009,2,top,"Primerano, Jon singled through the left side, RBI; Oehlschlaeger, Ian advanced to third; Lebenson, Michael advanced to third, out at home lf to c; Mullins, Jack scored.",17,2025-03-05T00:00:00-05:00,"Jackson, MS",120,MBA,2025
6341656,597009,Rensselaer Engineers,597344,MUW Owls,597344,2,bot,L. Clark singled up the middle.,18,2025-03-05T00:00:00-05:00,"Jackson, MS",120,MBA,2025
6341656,597009,Rensselaer Engineers,597344,MUW Owls,597344,2,bot,B. Brack flied out to cf.,19,2025-03-05T00:00:00-05:00,"Jackson, MS",120,MBA,2025
6341656,597009,Rensselaer Engineers,597344,MUW Owls,597344,2,bot,"Z. Egan singled down the rf line, out at second rf to 2b; L. Clark advanced to third.",20,2025-03-05T00:00:00-05:00,"Jackson, MS",120,MBA,2025
6341656,597009,Rensselaer Engineers,597344,MUW Owls,597344,2,bot,J. Setch struck out swinging.,21,2025-03-05T00:00:00-05:00,"Jackson, MS",120,MBA,2025
6341656,597009,Rensselaer Engineers,597344,MUW Owls,597009,3,top,"Hicks, Aidan lined out to ss.",22,2025-03-05T00:00:00-05:00,"Jackson, MS",120,MBA,2025
6341656,597009,Rensselaer Engineers,597344,MUW Owls,597009,3,top,"Scarpa, Julian singled through the left side.",23,2025-03-05T00:00:00-05:00,"Jackson, MS",120,MBA,2025
6341656,597009,Rensselaer Engineers,597344,MUW Owls,597009,3,top,"Krishnappa, Ayush singled to center field; Scarpa, Julian advanced to second.",24,2025-03-05T00:00:00-05:00,"Jackson, MS",120,MBA,2025
6341656,597009,Rensselaer Engineers,597344,MUW Owls,597009,3,top,"Levesque, Kameron flied out to rf to right center.",25,2025-03-05T00:00:00-05:00,"Jackson, MS",120,MBA,2025
6341656,597009,Rensselaer Engineers,597344,MUW Owls,597009,3,top,"Lapp, Charlie reached on a fielder's choice; Krishnappa, Ayush advanced to second; Scarpa, Julian out at third 3b unassisted.",26,2025-03-05T00:00:00-05:00,"Jackson, MS",120,MBA,2025
6341656,597009,Rensselaer Engineers,597344,MUW Owls,597344,3,bot,S. Rikar grounded out to p.,27,2025-03-05T00:00:00-05:00,"Jackson, MS",120,MBA,2025
6341656,597009,Rensselaer Engineers,597344,MUW Owls,597344,3,bot,T. Estabr grounded out to 3b.,28,2025-03-05T00:00:00-05:00,"Jackson, MS",120,MBA,2025
6341656,597009,Rensselaer Engineers,597344,MUW Owls,597344,3,bot,M. Wind walked.,29,2025-03-05T00:00:00-05:00,"Jackson, MS",120,MBA,2025
6341656,597009,Rensselaer Engineers,597344,MUW Owls,597344,3,bot,A. Benson flied out to rf to right center.,30,2025-03-05T00:00:00-05:00,"Jackson, MS",120,MBA,2025
6341656,597009,Rensselaer Engineers,597344,MUW Owls,597009,4,top,E. LeBlan to p for J. Gant.,31,2025-03-05T00:00:00-05:00,"Jackson, MS",120,MBA,2025
6341656,597009,Rensselaer Engineers,597344,MUW Owls,597009,4,top,"Mullins, Jack grounded out to 2b.",32,2025-03-05T00:00:00-05:00,"Jackson, MS",120,MBA,2025
6341656,597009,Rensselaer Engineers,597344,MUW Owls,597009,4,top,"Lebenson, Michael reached first on an error by ss.",33,2025-03-05T00:00:00-05:00,"Jackson, MS",120,MBA,2025
6341656,597009,Rensselaer Engineers,597344,MUW Owls,597009,4,top,"Oehlschlaeger, Ian singled through the left side; Lebenson, Michael advanced to second.",34,2025-03-05T00:00:00-05:00,"Jackson, MS",120,MBA,2025
6341656,597009,Rensselaer Engineers,597344,MUW Owls,597009,4,top,"Oehlschlaeger, Ian stole second; Lebenson, Michael stole third.",35,2025-03-05T00:00:00-05:00,"Jackson, MS",120,MBA,2025
6341656,597009,Rensselaer Engineers,597344,MUW Owls,597009,4,top,"Primerano, Jon singled to pitcher, RBI; Oehlschlaeger, Ian advanced to third; Lebenson, Michael scored, unearned.",36,2025-03-05T00:00:00-05:00,"Jackson, MS",120,MBA,2025
6341656,597009,Rensselaer Engineers,597344,MUW Owls,597009,4,top,"Primerano, Jon stole second.",37,2025-03-05T00:00:00-05:00,"Jackson, MS",120,MBA,2025
6341656,597009,Rensselaer Engineers,597344,MUW Owls,597009,4,top,"Hicks, Aidan struck out looking.",38,2025-03-05T00:00:00-05:00,"Jackson, MS",120,MBA,2025
6341656,597009,Rensselaer Engineers,597344,MUW Owls,597009,4,top,"Scarpa, Julian flied out to cf.",39,2025-03-05T00:00:00-05:00,"Jackson, MS",120,MBA,2025
6341656,597009,Rensselaer Engineers,597344,MUW Owls,597344,4,bot,Z. Johnson doubled to left field.,40,2025-03-05T00:00:00-05:00,"Jackson, MS",120,MBA,2025
6341656,597009,Rensselaer Engineers,597344,MUW Owls,597344,4,bot,L. Clark hit by pitch.,41,2025-03-05T00:00:00-05:00,"Jackson, MS",120,MBA,2025
6341656,597009,Rensselaer Engineers,597344,MUW Owls,597344,4,bot,B. Brack singled through the right side; L. Clark advanced to second; Z. Johnson advanced to third.,42,2025-03-05T00:00:00-05:00,"Jackson, MS",120,MBA,2025
6341656,597009,Rensselaer Engineers,597344,MUW Owls,597344,4,bot,Z. Egan reached on a fielder's choice; B. Brack advanced to second; L. Clark advanced to third; Z. Johnson out at home p to c.,43,2025-03-05T00:00:00-05:00,"Jackson, MS",120,MBA,2025
6341656,597009,Rensselaer Engineers,597344,MUW Owls,597344,4,bot,J. Setch grounded into double play 2b unassisted; Z. Egan out on the play.,44,2025-03-05T00:00:00-05:00,"Jackson, MS",120,MBA,2025
6341656,597009,Rensselaer Engineers,597344,MUW Owls,597009,5,top,"Krishnappa, Ayush grounded out to ss.",45,2025-03-05T00:00:00-05:00,"Jackson, MS",120,MBA,2025
6341656,597009,Rensselaer Engineers,597344,MUW Owls,597009,5,top,"Levesque, Kameron flied out to cf.",46,2025-03-05T00:00:00-05:00,"Jackson, MS",120,MBA,2025
6341656,597009,Rensselaer Engineers,597344,MUW Owls,597009,5,top,"Lapp, Charlie grounded out to ss.",47,2025-03-05T00:00:00-05:00,"Jackson, MS",120,MBA,2025
6341656,597009,Rensselaer Engineers,597344,MUW Owls,597344,5,bot,S. Rikar grounded out to 2b.,48,2025-03-05T00:00:00-05:00,"Jackson, MS",120,MBA,2025
6341656,597009,Rensselaer Engineers,597344,MUW Owls,597344,5,bot,T. Estabr walked.,49,2025-03-05T00:00:00-05:00,"Jackson, MS",120,MBA,2025
6341656,597009,Rensselaer Engineers,597344,MUW Owls,597344,5,bot,M. Wind reached on a fielder's choice; T. Estabr out at second 3b to 2b.,50,2025-03-05T00:00:00-05:00,"Jackson, MS",120,MBA,2025
6341656,597009,Rensselaer Engineers,597344,MUW Owls,597344,5,bot,A. Benson grounded out to ss.,51,2025-03-05T00:00:00-05:00,"Jackson, MS",120,MBA,2025
6341656,597009,Rensselaer Engineers,597344,MUW Owls,597009,6,top,"Mullins, Jack reached first on an error by 3b.",52,2025-03-05T00:00:00-05:00,"Jackson, MS",120,MBA,2025
6341656,597009,Rensselaer Engineers,597344,MUW Owls,597009,6,top,"Lebenson, Michael grounded into double play ss to 2b to 1b; Mullins, Jack out on the play.",53,2025-03-05T00:00:00-05:00,"Jackson, MS",120,MBA,2025
6341656,597009,Rensselaer Engineers,597344,MUW Owls,597009,6,top,"Oehlschlaeger, Ian grounded out to 1b unassisted.",54,2025-03-05T00:00:00-05:00,"Jackson, MS",120,MBA,2025
6341656,597009,Rensselaer Engineers,597344,MUW Owls,597344,6,bot,Z. Johnson singled to shortstop.,55,2025-03-05T00:00:00-05:00,"Jackson, MS",120,MBA,2025
6341656,597009,Rensselaer Engineers,597344,MUW Owls,597344,6,bot,L. Clark singled down the lf line; Z. Johnson advanced to third.,56,2025-03-05T00:00:00-05:00,"Jackson, MS",120,MBA,2025
6341656,597009,Rensselaer Engineers,597344,MUW Owls,597344,6,bot,B. Brack grounded into double play ss unassisted; L. Clark out on the play; Z. Johnson scored.,57,2025-03-05T00:00:00-05:00,"Jackson, MS",120,MBA,2025
6341656,597009,Rensselaer Engineers,597344,MUW Owls,597344,6,bot,Z. Egan grounded out p to 2b to 1b.,58,2025-03-05T00:00:00-05:00,"Jackson, MS",120,MBA,2025
6341656,597009,Rensselaer Engineers,597344,MUW Owls,597009,7,top,J. Mackey to p for E. LeBlan.,59,2025-03-05T00:00:00-05:00,"Jackson, MS",120,MBA,2025
6341656,597009,Rensselaer Engineers,597344,MUW Owls,597009,7,top,"Primerano, Jon grounded out to 3b.",60,2025-03-05T00:00:00-05:00,"Jackson, MS",120,MBA,2025
6341656,597009,Rensselaer Engineers,597344,MUW Owls,597009,7,top,"Hicks, Aidan grounded out to ss.",61,2025-03-05T00:00:00-05:00,"Jackson, MS",120,MBA,2025
6341656,597009,Rensselaer Engineers,597344,MUW Owls,597009,7,top,"Scarpa, Julian grounded out to 2b.",62,2025-03-05T00:00:00-05:00,"Jackson, MS",120,MBA,2025
6341656,597009,Rensselaer Engineers,597344,MUW Owls,597344,7,bot,"Kuss, Sam to p for Nelson, Mike.",63,2025-03-05T00:00:00-05:00,"Jackson, MS",120,MBA,2025
6341656,597009,Rensselaer Engineers,597344,MUW Owls,597344,7,bot,J. Setch grounded out to 3b.,64,2025-03-05T00:00:00-05:00,"Jackson, MS",120,MBA,2025
6341656,597009,Rensselaer Engineers,597344,MUW Owls,597344,7,bot,S. Rikar grounded out to 1b unassisted.,65,2025-03-05T00:00:00-05:00,"Jackson, MS",120,MBA,2025
6341656,597009,Rensselaer Engineers,597344,MUW Owls,597344,7,bot,T. Estabr reached first on an error by ss.,66,2025-03-05T00:00:00-05:00,"Jackson, MS",120,MBA,2025
6341656,597009,Rensselaer Engineers,597344,MUW Owls,597344,7,bot,M. Wind singled through the right side; T. Estabr advanced to second.,67,2025-03-05T00:00:00-05:00,"Jackson, MS",120,MBA,2025
6341656,597009,Rensselaer Engineers,597344,MUW Owls,597344,7,bot,"A. Benson singled to left center, RBI; M. Wind advanced to third; T. Estabr scored, unearned.",68,2025-03-05T00:00:00-05:00,"Jackson, MS",120,MBA,2025
6341656,597009,Rensselaer Engineers,597344,MUW Owls,597344,7,bot,"Z. Johnson singled to center field, RBI; A. Benson advanced to second; M. Wind scored, unearned.",69,2025-03-05T00:00:00-05:00,"Jackson, MS",120,MBA,2025
6341656,597009,Rensselaer Engineers,597344,MUW Owls,597344,7,bot,"L. Clark singled to right center, RBI; Z. Johnson advanced to third; A. Benson scored, unearned.",70,2025-03-05T00:00:00-05:00,"Jackson, MS",120,MBA,2025
6341656,597009,Rensselaer Engineers,597344,MUW Owls,597344,7,bot,B. Brack grounded out to 2b.,71,2025-03-05T00:00:00-05:00,"Jackson, MS",120,MBA,2025
6341656,597009,Rensselaer Engineers,597344,MUW Owls,597009,8,top,"Krishnappa, Ayush hit by pitch.",72,2025-03-05T00:00:00-05:00,"Jackson, MS",120,MBA,2025
6341656,597009,Rensselaer Engineers,597344,MUW Owls,597009,8,top,"Bounds, Charlie pinch ran for Krishnappa, Ayush.",73,2025-03-05T00:00:00-05:00,"Jackson, MS",120,MBA,2025
6341656,597009,Rensselaer Engineers,597344,MUW Owls,597009,8,top,"Levesque, Kameron reached on a fielder's choice; Bounds, Charlie out at second cf to ss.",74,2025-03-05T00:00:00-05:00,"Jackson, MS",120,MBA,2025
6341656,597009,Rensselaer Engineers,597344,MUW Owls,597009,8,top,"Lapp, Charlie flied out to cf to right center.",75,2025-03-05T00:00:00-05:00,"Jackson, MS",120,MBA,2025
6341656,597009,Rensselaer Engineers,597344,MUW Owls,597009,8,top,"Mullins, Jack singled to shortstop; Levesque, Kameron advanced to second.",76,2025-03-05T00:00:00-05:00,"Jackson, MS",120,MBA,2025
6341656,597009,Rensselaer Engineers,597344,MUW Owls,597009,8,top,"Lebenson, Michael reached on a fielder's choice; Mullins, Jack out at second ss to 2b.",77,2025-03-05T00:00:00-05:00,"Jackson, MS",120,MBA,2025
6341656,597009,Rensselaer Engineers,597344,MUW Owls,597344,8,bot,"Hamilton, Dutch to p for Kuss, Sam.",78,2025-03-05T00:00:00-05:00,"Jackson, MS",120,MBA,2025
6341656,597009,Rensselaer Engineers,597344,MUW Owls,597344,8,bot,Z. Egan grounded out to ss.,79,2025-03-05T00:00:00-05:00,"Jackson, MS",120,MBA,2025
6341656,597009,Rensselaer Engineers,597344,MUW Owls,597344,8,bot,J. Setch singled to left field.,80,2025-03-05T00:00:00-05:00,"Jackson, MS",120,MBA,2025
6341656,597009,Rensselaer Engineers,597344,MUW Owls,597344,8,bot,G. Full pinch ran for J. Setch.,81,2025-03-05T00:00:00-05:00,"Jackson, MS",120,MBA,2025
6341656,597009,Rensselaer Engineers,597344,MUW Owls,597344,8,bot,S. Rikar singled through the left side; G. Full advanced to second.,82,2025-03-05T00:00:00-05:00,"Jackson, MS",120,MBA,2025
6341656,597009,Rensselaer Engineers,597344,MUW Owls,597344,8,bot,T. Estabr hit by pitch; S. Rikar advanced to second; G. Full advanced to third.,83,2025-03-05T00:00:00-05:00,"Jackson, MS",120,MBA,2025
6341656,597009,Rensselaer Engineers,597344,MUW Owls,597344,8,bot,M. Wind struck out looking.,84,2025-03-05T00:00:00-05:00,"Jackson, MS",120,MBA,2025
6341656,597009,Rensselaer Engineers,597344,MUW Owls,597344,8,bot,"Gallo, Kyle to p for Hamilton, Dutch.",85,2025-03-05T00:00:00-05:00,"Jackson, MS",120,MBA,2025
6341656,597009,Rensselaer Engineers,597344,MUW Owls,597344,8,bot,"A. Benson hit by pitch, RBI; T. Estabr advanced to second; S. Rikar advanced to third; G. Full scored.",86,2025-03-05T00:00:00-05:00,"Jackson, MS",120,MBA,2025
6341656,597009,Rensselaer Engineers,597344,MUW Owls,597344,8,bot,Z. Johnson popped up to 2b to right field.,87,2025-03-05T00:00:00-05:00,"Jackson, MS",120,MBA,2025
6341656,597009,Rensselaer Engineers,597344,MUW Owls,597009,9,top,G. Full to rf.,88,2025-03-05T00:00:00-05:00,"Jackson, MS",120,MBA,2025
6341656,597009,Rensselaer Engineers,597344,MUW Owls,597009,9,top,L. Cox to p for J. Mackey.,89,2025-03-05T00:00:00-05:00,"Jackson, MS",120,MBA,2025
6341656,597009,Rensselaer Engineers,597344,MUW Owls,597009,9,top,"Oehlschlaeger, Ian singled to center field.",90,2025-03-05T00:00:00-05:00,"Jackson, MS",120,MBA,2025
6341656,597009,Rensselaer Engineers,597344,MUW Owls,597009,9,top,"Primerano, Jon popped up to c.",91,2025-03-05T00:00:00-05:00,"Jackson, MS",120,MBA,2025
6341656,597009,Rensselaer Engineers,597344,MUW Owls,597009,9,top,"Hicks, Aidan walked; Oehlschlaeger, Ian advanced to second.",92,2025-03-05T00:00:00-05:00,"Jackson, MS",120,MBA,2025
6341656,597009,Rensselaer Engineers,597344,MUW Owls,597009,9,top,"Scarpa, Julian struck out swinging.",93,2025-03-05T00:00:00-05:00,"Jackson, MS",120,MBA,2025
6341656,597009,Rensselaer Engineers,597344,MUW Owls,597009,9,top,"Abdallah, Walker pinch hit for Bounds, Charlie.",94,2025-03-05T00:00:00-05:00,"Jackson, MS",120,MBA,2025
6341656,597009,Rensselaer Engineers,597344,MUW Owls,597009,9,top,"Abdallah, Walker grounded out to ss.",95,2025-03-05T00:00:00-05:00,"Jackson, MS",120,MBA,2025
