game_id,away_team_id,away_team_name,home_team_id,home_team_name,batting_team,inning,top_bot,event_text,event_num,game_datetime,stadium_name,attendance,sport_id,season
6341861,596759,Wingate Bulldogs,596736,Mars Hill Lions,596759,1,top,Gavin Groppuso to 3b for Collin McDougall.,1,2025-03-07T00:00:00-05:00,"Henderson Field (Mars Hill, NC)",100,MBA,2025
6341861,596759,Wingate Bulldogs,596736,Mars Hill Lions,596759,1,top,Jake Courville singled to center field.,2,2025-03-07T00:00:00-05:00,"Henderson Field (Mars Hill, NC)",100,MBA,2025
6341861,596759,Wingate Bulldogs,596736,Mars Hill Lions,596759,1,top,Gavin Groppuso walked; Jake Courville advanced to second.,3,2025-03-07T00:00:00-05:00,"Henderson Field (Mars Hill, NC)",100,MBA,2025
6341861,596759,Wingate Bulldogs,596736,Mars Hill Lions,596759,1,top,Sean Sullivan struck out swinging.,4,2025-03-07T00:00:00-05:00,"Henderson Field (Mars Hill, NC)",100,MBA,2025
6341861,596759,Wingate Bulldogs,596736,Mars Hill Lions,596759,1,top,"Breon Ishmael singled to left field, RBI; Gavin Groppuso advanced to second; Jake Courville scored.",5,2025-03-07T00:00:00-05:00,"Henderson Field (Mars Hill, NC)",100,MBA,2025
6341861,596759,Wingate Bulldogs,596736,Mars Hill Lions,596759,1,top,Eli Weisner hit by pitch; Breon Ishmael advanced to second; Gavin Groppuso advanced to third.,6,2025-03-07T00:00:00-05:00,"Henderson Field (Mars Hill, NC)",100,MBA,2025
6341861,596759,Wingate Bulldogs,596736,Mars Hill Lions,596759,1,top,Cam Harris to 2b for Tyler Novik.,7,2025-03-07T00:00:00-05:00,"Henderson Field (Mars Hill, NC)",100,MBA,2025
6341861,596759,Wingate Bulldogs,596736,Mars Hill Lions,596759,1,top,"Cam Harris reached on a fielder's choice, RBI; Eli Weisner out at second ss to 2b; Breon Ishmael advanced to third; Gavin Groppuso scored.",8,2025-03-07T00:00:00-05:00,"Henderson Field (Mars Hill, NC)",100,MBA,2025
6341861,596759,Wingate Bulldogs,596736,Mars Hill Lions,596759,1,top,Wyatt Hoffman grounded out to ss.,9,2025-03-07T00:00:00-05:00,"Henderson Field (Mars Hill, NC)",100,MBA,2025
6341861,596759,Wingate Bulldogs,596736,Mars Hill Lions,596736,1,bot,Elec Yount walked.,10,2025-03-07T00:00:00-05:00,"Henderson Field (Mars Hill, NC)",100,MBA,2025
6341861,596759,Wingate Bulldogs,596736,Mars Hill Lions,596736,1,bot,Elec Yount advanced to second on a wild pitch.,11,2025-03-07T00:00:00-05:00,"Henderson Field (Mars Hill, NC)",100,MBA,2025
6341861,596759,Wingate Bulldogs,596736,Mars Hill Lions,596736,1,bot,Walker Fox flied out to lf; Elec Yount advanced to third.,12,2025-03-07T00:00:00-05:00,"Henderson Field (Mars Hill, NC)",100,MBA,2025
6341861,596759,Wingate Bulldogs,596736,Mars Hill Lions,596736,1,bot,Carter Potts struck out swinging.,13,2025-03-07T00:00:00-05:00,"Henderson Field (Mars Hill, NC)",100,MBA,2025
6341861,596759,Wingate Bulldogs,596736,Mars Hill Lions,596736,1,bot,Peyton Starkey grounded out to 3b.,14,2025-03-07T00:00:00-05:00,"Henderson Field (Mars Hill, NC)",100,MBA,2025
6341861,596759,Wingate Bulldogs,596736,Mars Hill Lions,596759,2,top,Owen Crevelt struck out swinging.,15,2025-03-07T00:00:00-05:00,"Henderson Field (Mars Hill, NC)",100,MBA,2025
6341861,596759,Wingate Bulldogs,596736,Mars Hill Lions,596759,2,top,Evan Barefoot grounded out to 3b.,16,2025-03-07T00:00:00-05:00,"Henderson Field (Mars Hill, NC)",100,MBA,2025
6341861,596759,Wingate Bulldogs,596736,Mars Hill Lions,596759,2,top,Jake Courville popped up to 1b.,17,2025-03-07T00:00:00-05:00,"Henderson Field (Mars Hill, NC)",100,MBA,2025
6341861,596759,Wingate Bulldogs,596736,Mars Hill Lions,596736,2,bot,Terick Bumgarner grounded out to ss.,18,2025-03-07T00:00:00-05:00,"Henderson Field (Mars Hill, NC)",100,MBA,2025
6341861,596759,Wingate Bulldogs,596736,Mars Hill Lions,596736,2,bot,Max LaLime struck out swinging.,19,2025-03-07T00:00:00-05:00,"Henderson Field (Mars Hill, NC)",100,MBA,2025
6341861,596759,Wingate Bulldogs,596736,Mars Hill Lions,596736,2,bot,Jackson Jones grounded out to 2b.,20,2025-03-07T00:00:00-05:00,"Henderson Field (Mars Hill, NC)",100,MBA,2025
6341861,596759,Wingate Bulldogs,596736,Mars Hill Lions,596759,3,top,Gavin Groppuso doubled to right field.,21,2025-03-07T00:00:00-05:00,"Henderson Field (Mars Hill, NC)",100,MBA,2025
6341861,596759,Wingate Bulldogs,596736,Mars Hill Lions,596759,3,top,"Sean Sullivan tripled to right field, RBI; Gavin Groppuso scored.",22,2025-03-07T00:00:00-05:00,"Henderson Field (Mars Hill, NC)",100,MBA,2025
6341861,596759,Wingate Bulldogs,596736,Mars Hill Lions,596759,3,top,Breon Ishmael struck out looking.,23,2025-03-07T00:00:00-05:00,"Henderson Field (Mars Hill, NC)",100,MBA,2025
6341861,596759,Wingate Bulldogs,596736,Mars Hill Lions,596759,3,top,"Eli Weisner homered to left field, 2 RBI; Sean Sullivan scored.",24,2025-03-07T00:00:00-05:00,"Henderson Field (Mars Hill, NC)",100,MBA,2025
6341861,596759,Wingate Bulldogs,596736,Mars Hill Lions,596759,3,top,Cam Harris struck out looking.,25,2025-03-07T00:00:00-05:00,"Henderson Field (Mars Hill, NC)",100,MBA,2025
6341861,596759,Wingate Bulldogs,596736,Mars Hill Lions,596759,3,top,Wyatt Hoffman struck out swinging.,26,2025-03-07T00:00:00-05:00,"Henderson Field (Mars Hill, NC)",100,MBA,2025
6341861,596759,Wingate Bulldogs,596736,Mars Hill Lions,596736,3,bot,Chapel Matson struck out looking.,27,2025-03-07T00:00:00-05:00,"Henderson Field (Mars Hill, NC)",100,MBA,2025
6341861,596759,Wingate Bulldogs,596736,Mars Hill Lions,596736,3,bot,Dawson Anderson struck out swinging.,28,2025-03-07T00:00:00-05:00,"Henderson Field (Mars Hill, NC)",100,MBA,2025
6341861,596759,Wingate Bulldogs,596736,Mars Hill Lions,596736,3,bot,Elec Yount walked.,29,2025-03-07T00:00:00-05:00,"Henderson Field (Mars Hill, NC)",100,MBA,2025
6341861,596759,Wingate Bulldogs,596736,Mars Hill Lions,596736,3,bot,Walker Fox walked; Elec Yount advanced to second.,30,2025-03-07T00:00:00-05:00,"Henderson Field (Mars Hill, NC)",100,MBA,2025
6341861,596759,Wingate Bulldogs,596736,Mars Hill Lions,596736,3,bot,Carter Potts grounded out to ss.,31,2025-03-07T00:00:00-05:00,"Henderson Field (Mars Hill, NC)",100,MBA,2025
6341861,596759,Wingate Bulldogs,596736,Mars Hill Lions,596759,4,top,Owen Crevelt hit by pitch.,32,2025-03-07T00:00:00-05:00,"Henderson Field (Mars Hill, NC)",100,MBA,2025
6341861,596759,Wingate Bulldogs,596736,Mars Hill Lions,596759,4,top,Evan Barefoot singled to right field; Owen Crevelt advanced to third.,33,2025-03-07T00:00:00-05:00,"Henderson Field (Mars Hill, NC)",100,MBA,2025
6341861,596759,Wingate Bulldogs,596736,Mars Hill Lions,596759,4,top,"Jake Courville doubled to left center, RBI; Evan Barefoot advanced to third; Owen Crevelt scored.",34,2025-03-07T00:00:00-05:00,"Henderson Field (Mars Hill, NC)",100,MBA,2025
6341861,596759,Wingate Bulldogs,596736,Mars Hill Lions,596759,4,top,"Gavin Groppuso grounded out to 2b, RBI; Jake Courville advanced to third; Evan Barefoot scored.",35,2025-03-07T00:00:00-05:00,"Henderson Field (Mars Hill, NC)",100,MBA,2025
6341861,596759,Wingate Bulldogs,596736,Mars Hill Lions,596759,4,top,"Sean Sullivan reached first on an error by ss, RBI; Jake Courville scored, unearned.",36,2025-03-07T00:00:00-05:00,"Henderson Field (Mars Hill, NC)",100,MBA,2025
6341861,596759,Wingate Bulldogs,596736,Mars Hill Lions,596759,4,top,Breon Ishmael lined out to ss.,37,2025-03-07T00:00:00-05:00,"Henderson Field (Mars Hill, NC)",100,MBA,2025
6341861,596759,Wingate Bulldogs,596736,Mars Hill Lions,596759,4,top,Eli Weisner doubled to left field; Sean Sullivan advanced to third.,38,2025-03-07T00:00:00-05:00,"Henderson Field (Mars Hill, NC)",100,MBA,2025
6341861,596759,Wingate Bulldogs,596736,Mars Hill Lions,596759,4,top,"Cam Harris singled, advanced to second on a fielding error by lf, 2 RBI; Eli Weisner scored, unearned; Sean Sullivan scored, unearned.",39,2025-03-07T00:00:00-05:00,"Henderson Field (Mars Hill, NC)",100,MBA,2025
6341861,596759,Wingate Bulldogs,596736,Mars Hill Lions,596759,4,top,"Wyatt Hoffman singled to right field, RBI; Cam Harris scored, unearned.",40,2025-03-07T00:00:00-05:00,"Henderson Field (Mars Hill, NC)",100,MBA,2025
6341861,596759,Wingate Bulldogs,596736,Mars Hill Lions,596759,4,top,Wyatt Hoffman advanced to second on a passed ball.,41,2025-03-07T00:00:00-05:00,"Henderson Field (Mars Hill, NC)",100,MBA,2025
6341861,596759,Wingate Bulldogs,596736,Mars Hill Lions,596759,4,top,Owen Crevelt grounded out to 3b.,42,2025-03-07T00:00:00-05:00,"Henderson Field (Mars Hill, NC)",100,MBA,2025
6341861,596759,Wingate Bulldogs,596736,Mars Hill Lions,596736,4,bot,Peyton Starkey flied out to rf.,43,2025-03-07T00:00:00-05:00,"Henderson Field (Mars Hill, NC)",100,MBA,2025
6341861,596759,Wingate Bulldogs,596736,Mars Hill Lions,596736,4,bot,Terick Bumgarner flied out to cf.,44,2025-03-07T00:00:00-05:00,"Henderson Field (Mars Hill, NC)",100,MBA,2025
6341861,596759,Wingate Bulldogs,596736,Mars Hill Lions,596736,4,bot,Max LaLime flied out to cf.,45,2025-03-07T00:00:00-05:00,"Henderson Field (Mars Hill, NC)",100,MBA,2025
6341861,596759,Wingate Bulldogs,596736,Mars Hill Lions,596759,5,top,Quentin Graves to p for Dylan Vega.,46,2025-03-07T00:00:00-05:00,"Henderson Field (Mars Hill, NC)",100,MBA,2025
6341861,596759,Wingate Bulldogs,596736,Mars Hill Lions,596759,5,top,Evan Barefoot grounded out to 2b.,47,2025-03-07T00:00:00-05:00,"Henderson Field (Mars Hill, NC)",100,MBA,2025
6341861,596759,Wingate Bulldogs,596736,Mars Hill Lions,596759,5,top,Jake Courville walked.,48,2025-03-07T00:00:00-05:00,"Henderson Field (Mars Hill, NC)",100,MBA,2025
6341861,596759,Wingate Bulldogs,596736,Mars Hill Lions,596759,5,top,Gavin Groppuso hit by pitch; Jake Courville advanced to second.,49,2025-03-07T00:00:00-05:00,"Henderson Field (Mars Hill, NC)",100,MBA,2025
6341861,596759,Wingate Bulldogs,596736,Mars Hill Lions,596759,5,top,"Sean Sullivan singled up the middle, RBI; Gavin Groppuso advanced to second; Jake Courville scored.",50,2025-03-07T00:00:00-05:00,"Henderson Field (Mars Hill, NC)",100,MBA,2025
6341861,596759,Wingate Bulldogs,596736,Mars Hill Lions,596759,5,top,Breon Ishmael singled up the middle; Sean Sullivan advanced to second; Gavin Groppuso advanced to third.,51,2025-03-07T00:00:00-05:00,"Henderson Field (Mars Hill, NC)",100,MBA,2025
6341861,596759,Wingate Bulldogs,596736,Mars Hill Lions,596759,5,top,"Eli Weisner flied out to cf, SAC, RBI; Breon Ishmael advanced to second; Sean Sullivan advanced to third; Gavin Groppuso scored.",52,2025-03-07T00:00:00-05:00,"Henderson Field (Mars Hill, NC)",100,MBA,2025
6341861,596759,Wingate Bulldogs,596736,Mars Hill Lions,596759,5,top,"Cam Harris singled to center field, 2 RBI; Breon Ishmael scored; Sean Sullivan scored.",53,2025-03-07T00:00:00-05:00,"Henderson Field (Mars Hill, NC)",100,MBA,2025
6341861,596759,Wingate Bulldogs,596736,Mars Hill Lions,596759,5,top,Wyatt Hoffman struck out swinging.,54,2025-03-07T00:00:00-05:00,"Henderson Field (Mars Hill, NC)",100,MBA,2025
6341861,596759,Wingate Bulldogs,596736,Mars Hill Lions,596736,5,bot,Elec Yount to ss for Evan Grant.,55,2025-03-07T00:00:00-05:00,"Henderson Field (Mars Hill, NC)",100,MBA,2025
6341861,596759,Wingate Bulldogs,596736,Mars Hill Lions,596736,5,bot,Evan Grant pinch hit for Jackson Jones.,56,2025-03-07T00:00:00-05:00,"Henderson Field (Mars Hill, NC)",100,MBA,2025
6341861,596759,Wingate Bulldogs,596736,Mars Hill Lions,596736,5,bot,Evan Grant singled to center field.,57,2025-03-07T00:00:00-05:00,"Henderson Field (Mars Hill, NC)",100,MBA,2025
6341861,596759,Wingate Bulldogs,596736,Mars Hill Lions,596736,5,bot,Alejandro Aguilar pinch hit for Chapel Matson.,58,2025-03-07T00:00:00-05:00,"Henderson Field (Mars Hill, NC)",100,MBA,2025
6341861,596759,Wingate Bulldogs,596736,Mars Hill Lions,596736,5,bot,Alejandro Aguilar singled to center field; Evan Grant advanced to second.,59,2025-03-07T00:00:00-05:00,"Henderson Field (Mars Hill, NC)",100,MBA,2025
6341861,596759,Wingate Bulldogs,596736,Mars Hill Lions,596736,5,bot,"Dawson Anderson doubled to right field, RBI; Alejandro Aguilar advanced to third; Evan Grant scored.",60,2025-03-07T00:00:00-05:00,"Henderson Field (Mars Hill, NC)",100,MBA,2025
6341861,596759,Wingate Bulldogs,596736,Mars Hill Lions,596736,5,bot,Caleb Smith pinch hit for Elec Yount.,61,2025-03-07T00:00:00-05:00,"Henderson Field (Mars Hill, NC)",100,MBA,2025
6341861,596759,Wingate Bulldogs,596736,Mars Hill Lions,596736,5,bot,Caleb Smith struck out looking.,62,2025-03-07T00:00:00-05:00,"Henderson Field (Mars Hill, NC)",100,MBA,2025
6341861,596759,Wingate Bulldogs,596736,Mars Hill Lions,596736,5,bot,Walker Fox walked.,63,2025-03-07T00:00:00-05:00,"Henderson Field (Mars Hill, NC)",100,MBA,2025
6341861,596759,Wingate Bulldogs,596736,Mars Hill Lions,596736,5,bot,Blake Russell pinch hit for Carter Potts.,64,2025-03-07T00:00:00-05:00,"Henderson Field (Mars Hill, NC)",100,MBA,2025
6341861,596759,Wingate Bulldogs,596736,Mars Hill Lions,596736,5,bot,Blake Russell struck out swinging.,65,2025-03-07T00:00:00-05:00,"Henderson Field (Mars Hill, NC)",100,MBA,2025
6341861,596759,Wingate Bulldogs,596736,Mars Hill Lions,596736,5,bot,Peyton Starkey fouled out to 1b.,66,2025-03-07T00:00:00-05:00,"Henderson Field (Mars Hill, NC)",100,MBA,2025
6341861,596759,Wingate Bulldogs,596736,Mars Hill Lions,596759,6,top,Caleb Smith to 3b.,67,2025-03-07T00:00:00-05:00,"Henderson Field (Mars Hill, NC)",100,MBA,2025
6341861,596759,Wingate Bulldogs,596736,Mars Hill Lions,596759,6,top,Blake Russell to 2b.,68,2025-03-07T00:00:00-05:00,"Henderson Field (Mars Hill, NC)",100,MBA,2025
6341861,596759,Wingate Bulldogs,596736,Mars Hill Lions,596759,6,top,Peyton Starkey to ss.,69,2025-03-07T00:00:00-05:00,"Henderson Field (Mars Hill, NC)",100,MBA,2025
6341861,596759,Wingate Bulldogs,596736,Mars Hill Lions,596759,6,top,Z. Cimino to lf for Max LaLime.,70,2025-03-07T00:00:00-05:00,"Henderson Field (Mars Hill, NC)",100,MBA,2025
6341861,596759,Wingate Bulldogs,596736,Mars Hill Lions,596759,6,top,Evan Grant to cf.,71,2025-03-07T00:00:00-05:00,"Henderson Field (Mars Hill, NC)",100,MBA,2025
6341861,596759,Wingate Bulldogs,596736,Mars Hill Lions,596759,6,top,Alejandro Aguilar to 1b.,72,2025-03-07T00:00:00-05:00,"Henderson Field (Mars Hill, NC)",100,MBA,2025
6341861,596759,Wingate Bulldogs,596736,Mars Hill Lions,596759,6,top,Jimmy Kelly to p for Quentin Graves.,73,2025-03-07T00:00:00-05:00,"Henderson Field (Mars Hill, NC)",100,MBA,2025
6341861,596759,Wingate Bulldogs,596736,Mars Hill Lions,596759,6,top,Owen Crevelt singled to center field.,74,2025-03-07T00:00:00-05:00,"Henderson Field (Mars Hill, NC)",100,MBA,2025
6341861,596759,Wingate Bulldogs,596736,Mars Hill Lions,596759,6,top,Evan Barefoot flied out to lf.,75,2025-03-07T00:00:00-05:00,"Henderson Field (Mars Hill, NC)",100,MBA,2025
6341861,596759,Wingate Bulldogs,596736,Mars Hill Lions,596759,6,top,Jake Courville walked; Owen Crevelt advanced to second.,76,2025-03-07T00:00:00-05:00,"Henderson Field (Mars Hill, NC)",100,MBA,2025
6341861,596759,Wingate Bulldogs,596736,Mars Hill Lions,596759,6,top,Gavin Groppuso flied out to lf.,77,2025-03-07T00:00:00-05:00,"Henderson Field (Mars Hill, NC)",100,MBA,2025
6341861,596759,Wingate Bulldogs,596736,Mars Hill Lions,596759,6,top,Will Farrell pinch hit for Sean Sullivan.,78,2025-03-07T00:00:00-05:00,"Henderson Field (Mars Hill, NC)",100,MBA,2025
6341861,596759,Wingate Bulldogs,596736,Mars Hill Lions,596759,6,top,Will Farrell walked; Jake Courville advanced to second; Owen Crevelt advanced to third.,79,2025-03-07T00:00:00-05:00,"Henderson Field (Mars Hill, NC)",100,MBA,2025
6341861,596759,Wingate Bulldogs,596736,Mars Hill Lions,596759,6,top,David Sessoms pinch hit.,80,2025-03-07T00:00:00-05:00,"Henderson Field (Mars Hill, NC)",100,MBA,2025
6341861,596759,Wingate Bulldogs,596736,Mars Hill Lions,596759,6,top,David Sessoms flied out to lf.,81,2025-03-07T00:00:00-05:00,"Henderson Field (Mars Hill, NC)",100,MBA,2025
6341861,596759,Wingate Bulldogs,596736,Mars Hill Lions,596736,6,bot,Will Farrell to lf.,82,2025-03-07T00:00:00-05:00,"Henderson Field (Mars Hill, NC)",100,MBA,2025
6341861,596759,Wingate Bulldogs,596736,Mars Hill Lions,596736,6,bot,David Sessoms to rf.,83,2025-03-07T00:00:00-05:00,"Henderson Field (Mars Hill, NC)",100,MBA,2025
6341861,596759,Wingate Bulldogs,596736,Mars Hill Lions,596736,6,bot,Davis Anders pinch hit for Terick Bumgarner.,84,2025-03-07T00:00:00-05:00,"Henderson Field (Mars Hill, NC)",100,MBA,2025
6341861,596759,Wingate Bulldogs,596736,Mars Hill Lions,596736,6,bot,Davis Anders struck out looking.,85,2025-03-07T00:00:00-05:00,"Henderson Field (Mars Hill, NC)",100,MBA,2025
6341861,596759,Wingate Bulldogs,596736,Mars Hill Lions,596736,6,bot,Z. Cimino singled through the right side.,86,2025-03-07T00:00:00-05:00,"Henderson Field (Mars Hill, NC)",100,MBA,2025
6341861,596759,Wingate Bulldogs,596736,Mars Hill Lions,596736,6,bot,Evan Grant singled to center field; Z. Cimino advanced to second.,87,2025-03-07T00:00:00-05:00,"Henderson Field (Mars Hill, NC)",100,MBA,2025
6341861,596759,Wingate Bulldogs,596736,Mars Hill Lions,596736,6,bot,"Alejandro Aguilar doubled to right field, RBI; Evan Grant advanced to third; Z. Cimino scored.",88,2025-03-07T00:00:00-05:00,"Henderson Field (Mars Hill, NC)",100,MBA,2025
6341861,596759,Wingate Bulldogs,596736,Mars Hill Lions,596736,6,bot,Dawson Anderson struck out swinging.,89,2025-03-07T00:00:00-05:00,"Henderson Field (Mars Hill, NC)",100,MBA,2025
6341861,596759,Wingate Bulldogs,596736,Mars Hill Lions,596736,6,bot,Caleb Smith struck out looking.,90,2025-03-07T00:00:00-05:00,"Henderson Field (Mars Hill, NC)",100,MBA,2025
6341861,596759,Wingate Bulldogs,596736,Mars Hill Lions,596759,7,top,Nolan Jamison to p for Jimmy Kelly.,91,2025-03-07T00:00:00-05:00,"Henderson Field (Mars Hill, NC)",100,MBA,2025
6341861,596759,Wingate Bulldogs,596736,Mars Hill Lions,596759,7,top,Davis Anders to dh.,92,2025-03-07T00:00:00-05:00,"Henderson Field (Mars Hill, NC)",100,MBA,2025
6341861,596759,Wingate Bulldogs,596736,Mars Hill Lions,596759,7,top,Jordan Dixon pinch hit for Eli Weisner.,93,2025-03-07T00:00:00-05:00,"Henderson Field (Mars Hill, NC)",100,MBA,2025
6341861,596759,Wingate Bulldogs,596736,Mars Hill Lions,596759,7,top,Jordan Dixon walked.,94,2025-03-07T00:00:00-05:00,"Henderson Field (Mars Hill, NC)",100,MBA,2025
6341861,596759,Wingate Bulldogs,596736,Mars Hill Lions,596759,7,top,Cam Harris flied out to rf.,95,2025-03-07T00:00:00-05:00,"Henderson Field (Mars Hill, NC)",100,MBA,2025
6341861,596759,Wingate Bulldogs,596736,Mars Hill Lions,596759,7,top,Josh Haggerty pinch hit for Wyatt Hoffman.,96,2025-03-07T00:00:00-05:00,"Henderson Field (Mars Hill, NC)",100,MBA,2025
6341861,596759,Wingate Bulldogs,596736,Mars Hill Lions,596759,7,top,Josh Haggerty walked; Jordan Dixon advanced to second.,97,2025-03-07T00:00:00-05:00,"Henderson Field (Mars Hill, NC)",100,MBA,2025
6341861,596759,Wingate Bulldogs,596736,Mars Hill Lions,596759,7,top,Justin Barham pinch hit for Owen Crevelt.,98,2025-03-07T00:00:00-05:00,"Henderson Field (Mars Hill, NC)",100,MBA,2025
6341861,596759,Wingate Bulldogs,596736,Mars Hill Lions,596759,7,top,Justin Barham walked; Josh Haggerty advanced to second; Jordan Dixon advanced to third.,99,2025-03-07T00:00:00-05:00,"Henderson Field (Mars Hill, NC)",100,MBA,2025
6341861,596759,Wingate Bulldogs,596736,Mars Hill Lions,596759,7,top,Brady Stephens to p for Nolan Jamison.,100,2025-03-07T00:00:00-05:00,"Henderson Field (Mars Hill, NC)",100,MBA,2025
6341861,596759,Wingate Bulldogs,596736,Mars Hill Lions,596759,7,top,"Evan Barefoot reached on a fielder's choice, RBI; Justin Barham out at second ss unassisted; Josh Haggerty advanced to third; Jordan Dixon scored.",101,2025-03-07T00:00:00-05:00,"Henderson Field (Mars Hill, NC)",100,MBA,2025
6341861,596759,Wingate Bulldogs,596736,Mars Hill Lions,596759,7,top,"Evan Barefoot advanced to second; Josh Haggerty scored on a passed ball, unearned.",102,2025-03-07T00:00:00-05:00,"Henderson Field (Mars Hill, NC)",100,MBA,2025
6341861,596759,Wingate Bulldogs,596736,Mars Hill Lions,596759,7,top,Jake Courville walked.,103,2025-03-07T00:00:00-05:00,"Henderson Field (Mars Hill, NC)",100,MBA,2025
6341861,596759,Wingate Bulldogs,596736,Mars Hill Lions,596759,7,top,Jalen Evans pinch hit for Gavin Groppuso.,104,2025-03-07T00:00:00-05:00,"Henderson Field (Mars Hill, NC)",100,MBA,2025
6341861,596759,Wingate Bulldogs,596736,Mars Hill Lions,596759,7,top,Jalen Evans walked; Jake Courville advanced to second; Evan Barefoot advanced to third.,105,2025-03-07T00:00:00-05:00,"Henderson Field (Mars Hill, NC)",100,MBA,2025
6341861,596759,Wingate Bulldogs,596736,Mars Hill Lions,596759,7,top,Will Farrell struck out looking.,106,2025-03-07T00:00:00-05:00,"Henderson Field (Mars Hill, NC)",100,MBA,2025
6341861,596759,Wingate Bulldogs,596736,Mars Hill Lions,596736,7,bot,Jalen Evans to 3b.,107,2025-03-07T00:00:00-05:00,"Henderson Field (Mars Hill, NC)",100,MBA,2025
6341861,596759,Wingate Bulldogs,596736,Mars Hill Lions,596736,7,bot,Jordan Dixon to dh.,108,2025-03-07T00:00:00-05:00,"Henderson Field (Mars Hill, NC)",100,MBA,2025
6341861,596759,Wingate Bulldogs,596736,Mars Hill Lions,596736,7,bot,Cam Harris to 2b for Tyler Novik.,109,2025-03-07T00:00:00-05:00,"Henderson Field (Mars Hill, NC)",100,MBA,2025
6341861,596759,Wingate Bulldogs,596736,Mars Hill Lions,596736,7,bot,Josh Haggerty to c.,110,2025-03-07T00:00:00-05:00,"Henderson Field (Mars Hill, NC)",100,MBA,2025
6341861,596759,Wingate Bulldogs,596736,Mars Hill Lions,596736,7,bot,Justin Barham to 1b.,111,2025-03-07T00:00:00-05:00,"Henderson Field (Mars Hill, NC)",100,MBA,2025
6341861,596759,Wingate Bulldogs,596736,Mars Hill Lions,596736,7,bot,Tyler Novik to p for Kelan Hoover.,112,2025-03-07T00:00:00-05:00,"Henderson Field (Mars Hill, NC)",100,MBA,2025
6341861,596759,Wingate Bulldogs,596736,Mars Hill Lions,596736,7,bot,Walker Fox lined out to p.,113,2025-03-07T00:00:00-05:00,"Henderson Field (Mars Hill, NC)",100,MBA,2025
6341861,596759,Wingate Bulldogs,596736,Mars Hill Lions,596736,7,bot,Blake Russell grounded out to ss.,114,2025-03-07T00:00:00-05:00,"Henderson Field (Mars Hill, NC)",100,MBA,2025
6341861,596759,Wingate Bulldogs,596736,Mars Hill Lions,596736,7,bot,Quinn Rembert pinch hit for Peyton Starkey.,115,2025-03-07T00:00:00-05:00,"Henderson Field (Mars Hill, NC)",100,MBA,2025
6341861,596759,Wingate Bulldogs,596736,Mars Hill Lions,596736,7,bot,Quinn Rembert doubled to center field.,116,2025-03-07T00:00:00-05:00,"Henderson Field (Mars Hill, NC)",100,MBA,2025
6341861,596759,Wingate Bulldogs,596736,Mars Hill Lions,596736,7,bot,"Davis Anders singled through the right side, RBI; Quinn Rembert scored.",117,2025-03-07T00:00:00-05:00,"Henderson Field (Mars Hill, NC)",100,MBA,2025
6341861,596759,Wingate Bulldogs,596736,Mars Hill Lions,596736,7,bot,Z. Cimino reached on a fielder's choice; Davis Anders out at second ss to 2b.,118,2025-03-07T00:00:00-05:00,"Henderson Field (Mars Hill, NC)",100,MBA,2025
