game_id,away_team_id,away_team_name,home_team_id,home_team_name,batting_team,inning,top_bot,event_text,event_num,game_datetime,stadium_name,attendance,sport_id,season
6341118,596921,Pace Setters,596849,D'Youville Saints,596921,1,top,J. Miller flied out to lf.,1,2025-03-01T00:00:00-05:00,"Cary, NC",0,MBA,2025
6341118,596921,Pace Setters,596849,D'Youville Saints,596921,1,top,M. Baronian reached first on a fielding error by 1b.,2,2025-03-01T00:00:00-05:00,"Cary, NC",0,MBA,2025
6341118,596921,Pace Setters,596849,D'Youville Saints,596921,1,top,A. Labita grounded out to 1b unassisted3a M. Baronian advanced to second.,3,2025-03-01T00:00:00-05:00,"Cary, NC",0,MBA,2025
6341118,596921,Pace Setters,596849,D'Youville Saints,596921,1,top,M. Franco grounded out to ss.,4,2025-03-01T00:00:00-05:00,"Cary, NC",0,MBA,2025
6341118,596921,Pace Setters,596849,D'Youville Saints,596849,1,bot,K. Vecchio grounded out to 3b.,5,2025-03-01T00:00:00-05:00,"Cary, NC",0,MBA,2025
6341118,596921,Pace Setters,596849,D'Youville Saints,596849,1,bot,J. Hollins flied out to cf.,6,2025-03-01T00:00:00-05:00,"Cary, NC",0,MBA,2025
6341118,596921,Pace Setters,596849,D'Youville Saints,596849,1,bot,B. Morris grounded out to ss.,7,2025-03-01T00:00:00-05:00,"Cary, NC",0,MBA,2025
6341118,596921,Pace Setters,596849,D'Youville Saints,596921,2,top,A. Heppner grounded out to 3b.,8,2025-03-01T00:00:00-05:00,"Cary, NC",0,MBA,2025
6341118,596921,Pace Setters,596849,D'Youville Saints,596921,2,top,D. Rivara flied out to cf.,9,2025-03-01T00:00:00-05:00,"Cary, NC",0,MBA,2025
6341118,596921,Pace Setters,596849,D'Youville Saints,596921,2,top,C. Resetar struck out swinging.,10,2025-03-01T00:00:00-05:00,"Cary, NC",0,MBA,2025
6341118,596921,Pace Setters,596849,D'Youville Saints,596849,2,bot,A. Boucher grounded out to ss.,11,2025-03-01T00:00:00-05:00,"Cary, NC",0,MBA,2025
6341118,596921,Pace Setters,596849,D'Youville Saints,596849,2,bot,B. Kolbert doubled to left field.,12,2025-03-01T00:00:00-05:00,"Cary, NC",0,MBA,2025
6341118,596921,Pace Setters,596849,D'Youville Saints,596849,2,bot,"C. Cefaratti singled to center field, RBI3a B. Kolbert scored.",13,2025-03-01T00:00:00-05:00,"Cary, NC",0,MBA,2025
6341118,596921,Pace Setters,596849,D'Youville Saints,596849,2,bot,D. Onevelo struck out looking.,14,2025-03-01T00:00:00-05:00,"Cary, NC",0,MBA,2025
6341118,596921,Pace Setters,596849,D'Youville Saints,596849,2,bot,J. Cooper struck out swinging.,15,2025-03-01T00:00:00-05:00,"Cary, NC",0,MBA,2025
6341118,596921,Pace Setters,596849,D'Youville Saints,596921,3,top,L. Rivara flied out to rf.,16,2025-03-01T00:00:00-05:00,"Cary, NC",0,MBA,2025
6341118,596921,Pace Setters,596849,D'Youville Saints,596921,3,top,B. Tullo walked.,17,2025-03-01T00:00:00-05:00,"Cary, NC",0,MBA,2025
6341118,596921,Pace Setters,596849,D'Youville Saints,596921,3,top,J. Miller singled to left field3a B. Tullo advanced to second.,18,2025-03-01T00:00:00-05:00,"Cary, NC",0,MBA,2025
6341118,596921,Pace Setters,596849,D'Youville Saints,596921,3,top,M. Baronian grounded into double play ss to 2b to 1b3a J. Miller out on the play.,19,2025-03-01T00:00:00-05:00,"Cary, NC",0,MBA,2025
6341118,596921,Pace Setters,596849,D'Youville Saints,596849,3,bot,D. Crook grounded out to ss.,20,2025-03-01T00:00:00-05:00,"Cary, NC",0,MBA,2025
6341118,596921,Pace Setters,596849,D'Youville Saints,596849,3,bot,K. Vecchio walked.,21,2025-03-01T00:00:00-05:00,"Cary, NC",0,MBA,2025
6341118,596921,Pace Setters,596849,D'Youville Saints,596849,3,bot,J. Hollins struck out swinging.,22,2025-03-01T00:00:00-05:00,"Cary, NC",0,MBA,2025
6341118,596921,Pace Setters,596849,D'Youville Saints,596849,3,bot,B. Morris singled up the middle3a K. Vecchio advanced to third.,23,2025-03-01T00:00:00-05:00,"Cary, NC",0,MBA,2025
6341118,596921,Pace Setters,596849,D'Youville Saints,596849,3,bot,A. Boucher flied out to cf.,24,2025-03-01T00:00:00-05:00,"Cary, NC",0,MBA,2025
6341118,596921,Pace Setters,596849,D'Youville Saints,596921,4,top,A. Labita flied out to lf.,25,2025-03-01T00:00:00-05:00,"Cary, NC",0,MBA,2025
6341118,596921,Pace Setters,596849,D'Youville Saints,596921,4,top,M. Franco flied out to cf.,26,2025-03-01T00:00:00-05:00,"Cary, NC",0,MBA,2025
6341118,596921,Pace Setters,596849,D'Youville Saints,596921,4,top,A. Heppner grounded out to 2b.,27,2025-03-01T00:00:00-05:00,"Cary, NC",0,MBA,2025
6341118,596921,Pace Setters,596849,D'Youville Saints,596849,4,bot,B. Kolbert struck out swinging.,28,2025-03-01T00:00:00-05:00,"Cary, NC",0,MBA,2025
6341118,596921,Pace Setters,596849,D'Youville Saints,596849,4,bot,C. Cefaratti flied out to lf.,29,2025-03-01T00:00:00-05:00,"Cary, NC",0,MBA,2025
6341118,596921,Pace Setters,596849,D'Youville Saints,596849,4,bot,"D. Onevelo struck out swinging, out at first c to 1b.",30,2025-03-01T00:00:00-05:00,"Cary, NC",0,MBA,2025
6341118,596921,Pace Setters,596849,D'Youville Saints,596921,5,top,D. Rivara grounded out to 3b.,31,2025-03-01T00:00:00-05:00,"Cary, NC",0,MBA,2025
6341118,596921,Pace Setters,596849,D'Youville Saints,596921,5,top,C. Resetar struck out swinging.,32,2025-03-01T00:00:00-05:00,"Cary, NC",0,MBA,2025
6341118,596921,Pace Setters,596849,D'Youville Saints,596921,5,top,L. Rivara flied out to cf.,33,2025-03-01T00:00:00-05:00,"Cary, NC",0,MBA,2025
6341118,596921,Pace Setters,596849,D'Youville Saints,596849,5,bot,J. Cooper singled to left field.,34,2025-03-01T00:00:00-05:00,"Cary, NC",0,MBA,2025
6341118,596921,Pace Setters,596849,D'Youville Saints,596849,5,bot,"D. Crook grounded out to p, SAC, bunt3a J. Cooper advanced to second.",35,2025-03-01T00:00:00-05:00,"Cary, NC",0,MBA,2025
6341118,596921,Pace Setters,596849,D'Youville Saints,596849,5,bot,K. Vecchio struck out swinging.,36,2025-03-01T00:00:00-05:00,"Cary, NC",0,MBA,2025
6341118,596921,Pace Setters,596849,D'Youville Saints,596849,5,bot,"J. Hollins singled to left center, RBI3a J. Cooper scored.",37,2025-03-01T00:00:00-05:00,"Cary, NC",0,MBA,2025
6341118,596921,Pace Setters,596849,D'Youville Saints,596849,5,bot,"J. Hollins picked off, out at first p to 1b to ss.",38,2025-03-01T00:00:00-05:00,"Cary, NC",0,MBA,2025
6341118,596921,Pace Setters,596849,D'Youville Saints,596921,6,top,B. Tullo grounded out to ss.,39,2025-03-01T00:00:00-05:00,"Cary, NC",0,MBA,2025
6341118,596921,Pace Setters,596849,D'Youville Saints,596921,6,top,J. Miller grounded out to 2b.,40,2025-03-01T00:00:00-05:00,"Cary, NC",0,MBA,2025
6341118,596921,Pace Setters,596849,D'Youville Saints,596921,6,top,M. Baronian grounded out to ss.,41,2025-03-01T00:00:00-05:00,"Cary, NC",0,MBA,2025
6341118,596921,Pace Setters,596849,D'Youville Saints,596849,6,bot,J. Dressler to p for A. Kempf.,42,2025-03-01T00:00:00-05:00,"Cary, NC",0,MBA,2025
6341118,596921,Pace Setters,596849,D'Youville Saints,596849,6,bot,B. Morris hit by pitch.,43,2025-03-01T00:00:00-05:00,"Cary, NC",0,MBA,2025
6341118,596921,Pace Setters,596849,D'Youville Saints,596849,6,bot,A. Boucher walked3a B. Morris advanced to second.,44,2025-03-01T00:00:00-05:00,"Cary, NC",0,MBA,2025
6341118,596921,Pace Setters,596849,D'Youville Saints,596849,6,bot,A. Boucher advanced to second3a B. Morris advanced to third on a wild pitch.,45,2025-03-01T00:00:00-05:00,"Cary, NC",0,MBA,2025
6341118,596921,Pace Setters,596849,D'Youville Saints,596849,6,bot,B. Kolbert grounded out to p.,46,2025-03-01T00:00:00-05:00,"Cary, NC",0,MBA,2025
6341118,596921,Pace Setters,596849,D'Youville Saints,596849,6,bot,C. Cefaratti lined out to 2b.,47,2025-03-01T00:00:00-05:00,"Cary, NC",0,MBA,2025
6341118,596921,Pace Setters,596849,D'Youville Saints,596849,6,bot,G. Wilson pinch hit for D. Onevelo.,48,2025-03-01T00:00:00-05:00,"Cary, NC",0,MBA,2025
6341118,596921,Pace Setters,596849,D'Youville Saints,596849,6,bot,G. Wilson struck out swinging.,49,2025-03-01T00:00:00-05:00,"Cary, NC",0,MBA,2025
6341118,596921,Pace Setters,596849,D'Youville Saints,596921,7,top,Huff II to c for G. Wilson.,50,2025-03-01T00:00:00-05:00,"Cary, NC",0,MBA,2025
6341118,596921,Pace Setters,596849,D'Youville Saints,596921,7,top,A. Labita grounded out to p.,51,2025-03-01T00:00:00-05:00,"Cary, NC",0,MBA,2025
6341118,596921,Pace Setters,596849,D'Youville Saints,596921,7,top,M. Franco grounded out to 3b.,52,2025-03-01T00:00:00-05:00,"Cary, NC",0,MBA,2025
6341118,596921,Pace Setters,596849,D'Youville Saints,596921,7,top,A. Heppner lined out to 1b.,53,2025-03-01T00:00:00-05:00,"Cary, NC",0,MBA,2025
6341118,596921,Pace Setters,596849,D'Youville Saints,596849,7,bot,J. Cooper struck out looking.,54,2025-03-01T00:00:00-05:00,"Cary, NC",0,MBA,2025
6341118,596921,Pace Setters,596849,D'Youville Saints,596849,7,bot,D. Crook singled to third base.,55,2025-03-01T00:00:00-05:00,"Cary, NC",0,MBA,2025
6341118,596921,Pace Setters,596849,D'Youville Saints,596849,7,bot,K. Vecchio walked3a D. Crook advanced to second.,56,2025-03-01T00:00:00-05:00,"Cary, NC",0,MBA,2025
6341118,596921,Pace Setters,596849,D'Youville Saints,596849,7,bot,K. Vecchio advanced to second3a D. Crook advanced to third on a passed ball.,57,2025-03-01T00:00:00-05:00,"Cary, NC",0,MBA,2025
6341118,596921,Pace Setters,596849,D'Youville Saints,596849,7,bot,"J. Hollins singled down the rf line, 2 RBI3a K. Vecchio scored3a D. Crook scored.",58,2025-03-01T00:00:00-05:00,"Cary, NC",0,MBA,2025
6341118,596921,Pace Setters,596849,D'Youville Saints,596849,7,bot,N. Huchro to p for J. Dressler.,59,2025-03-01T00:00:00-05:00,"Cary, NC",0,MBA,2025
6341118,596921,Pace Setters,596849,D'Youville Saints,596849,7,bot,B. Morris singled to center field3a J. Hollins advanced to second.,60,2025-03-01T00:00:00-05:00,"Cary, NC",0,MBA,2025
6341118,596921,Pace Setters,596849,D'Youville Saints,596849,7,bot,A. Boucher walked3a B. Morris advanced to second3a J. Hollins advanced to third.,61,2025-03-01T00:00:00-05:00,"Cary, NC",0,MBA,2025
6341118,596921,Pace Setters,596849,D'Youville Saints,596849,7,bot,B. Kolbert grounded into double play 2b to ss to 1b3a A. Boucher out on the play.,62,2025-03-01T00:00:00-05:00,"Cary, NC",0,MBA,2025
6341118,596921,Pace Setters,596849,D'Youville Saints,596921,8,top,D. Rivara flied out to rf.,63,2025-03-01T00:00:00-05:00,"Cary, NC",0,MBA,2025
6341118,596921,Pace Setters,596849,D'Youville Saints,596921,8,top,R. Caffrey pinch hit for C. Resetar.,64,2025-03-01T00:00:00-05:00,"Cary, NC",0,MBA,2025
6341118,596921,Pace Setters,596849,D'Youville Saints,596921,8,top,R. Caffrey grounded out to 1b unassisted.,65,2025-03-01T00:00:00-05:00,"Cary, NC",0,MBA,2025
6341118,596921,Pace Setters,596849,D'Youville Saints,596921,8,top,L. Rivara singled to center field.,66,2025-03-01T00:00:00-05:00,"Cary, NC",0,MBA,2025
6341118,596921,Pace Setters,596849,D'Youville Saints,596921,8,top,B. Tullo grounded out to 2b.,67,2025-03-01T00:00:00-05:00,"Cary, NC",0,MBA,2025
6341118,596921,Pace Setters,596849,D'Youville Saints,596849,8,bot,C. Cefaratti singled to center field.,68,2025-03-01T00:00:00-05:00,"Cary, NC",0,MBA,2025
6341118,596921,Pace Setters,596849,D'Youville Saints,596849,8,bot,"Huff II grounded out to p, SAC, bunt3a C. Cefaratti advanced to second.",69,2025-03-01T00:00:00-05:00,"Cary, NC",0,MBA,2025
6341118,596921,Pace Setters,596849,D'Youville Saints,596849,8,bot,C. Cefaratti advanced to third on a wild pitch.,70,2025-03-01T00:00:00-05:00,"Cary, NC",0,MBA,2025
6341118,596921,Pace Setters,596849,D'Youville Saints,596849,8,bot,"J. Cooper doubled down the lf line, RBI3a C. Cefaratti scored.",71,2025-03-01T00:00:00-05:00,"Cary, NC",0,MBA,2025
6341118,596921,Pace Setters,596849,D'Youville Saints,596849,8,bot,"D. Crook tripled to right center, RBI3a J. Cooper scored.",72,2025-03-01T00:00:00-05:00,"Cary, NC",0,MBA,2025
6341118,596921,Pace Setters,596849,D'Youville Saints,596849,8,bot,"K. Vecchio singled to right center, RBI3a D. Crook scored.",73,2025-03-01T00:00:00-05:00,"Cary, NC",0,MBA,2025
6341118,596921,Pace Setters,596849,D'Youville Saints,596849,8,bot,J. Hollins flied out to lf.,74,2025-03-01T00:00:00-05:00,"Cary, NC",0,MBA,2025
6341118,596921,Pace Setters,596849,D'Youville Saints,596849,8,bot,K. Vecchio stole second.,75,2025-03-01T00:00:00-05:00,"Cary, NC",0,MBA,2025
6341118,596921,Pace Setters,596849,D'Youville Saints,596849,8,bot,B. Morris struck out looking.,76,2025-03-01T00:00:00-05:00,"Cary, NC",0,MBA,2025
6341118,596921,Pace Setters,596849,D'Youville Saints,596921,9,top,J. Miller walked.,77,2025-03-01T00:00:00-05:00,"Cary, NC",0,MBA,2025
6341118,596921,Pace Setters,596849,D'Youville Saints,596921,9,top,M. Baronian grounded into double play ss to 2b to 1b3a J. Miller out on the play.,78,2025-03-01T00:00:00-05:00,"Cary, NC",0,MBA,2025
6341118,596921,Pace Setters,596849,D'Youville Saints,596921,9,top,A. Labita grounded out p to 2b to 1b.,79,2025-03-01T00:00:00-05:00,"Cary, NC",0,MBA,2025
