game_id,away_team_id,away_team_name,home_team_id,home_team_name,batting_team,inning,top_bot,event_text,event_num,game_datetime,stadium_name,attendance,sport_id,season
6342635,597310,Kean Cougars,597245,Catholic Cardinals,597310,1,top,J. Teixeira flied out to lf.,1,2025-03-12T00:00:00-04:00,"Talbot Field (Washington, DC)",126,MBA,2025
6342635,597310,Kean Cougars,597245,Catholic Cardinals,597310,1,top,K. Adorno singled through the right side.,2,2025-03-12T00:00:00-04:00,"Talbot Field (Washington, DC)",126,MBA,2025
6342635,597310,Kean Cougars,597245,Catholic Cardinals,597310,1,top,M. sol struck out swinging; K. Adorno stole second.,3,2025-03-12T00:00:00-04:00,"Talbot Field (Washington, DC)",126,MBA,2025
6342635,597310,Kean Cougars,597245,Catholic Cardinals,597310,1,top,C. Tomalavag struck out looking.,4,2025-03-12T00:00:00-04:00,"Talbot Field (Washington, DC)",126,MBA,2025
6342635,597310,Kean Cougars,597245,Catholic Cardinals,597245,1,bot,S. Thomas walked.,5,2025-03-12T00:00:00-04:00,"Talbot Field (Washington, DC)",126,MBA,2025
6342635,597310,Kean Cougars,597245,Catholic Cardinals,597245,1,bot,"S. Burman reached on a fielder's choice, advanced to second on an error by 2b; S. Thomas advanced to third.",6,2025-03-12T00:00:00-04:00,"Talbot Field (Washington, DC)",126,MBA,2025
6342635,597310,Kean Cougars,597245,Catholic Cardinals,597245,1,bot,M. Johnson struck out swinging.,7,2025-03-12T00:00:00-04:00,"Talbot Field (Washington, DC)",126,MBA,2025
6342635,597310,Kean Cougars,597245,Catholic Cardinals,597245,1,bot,Lo. Eilbache walked.,8,2025-03-12T00:00:00-04:00,"Talbot Field (Washington, DC)",126,MBA,2025
6342635,597310,Kean Cougars,597245,Catholic Cardinals,597245,1,bot,"J. Marini singled through the right side, 2 RBI; Lo. Eilbache advanced to second, advanced to third on the throw; S. Burman scored; S. Thomas scored, unearned.",9,2025-03-12T00:00:00-04:00,"Talbot Field (Washington, DC)",126,MBA,2025
6342635,597310,Kean Cougars,597245,Catholic Cardinals,597245,1,bot,"D. Pozzi flied out to rf, sacrifice fly, RBI; J. Marini advanced to second on the throw; Lo. Eilbache scored, unearned.",10,2025-03-12T00:00:00-04:00,"Talbot Field (Washington, DC)",126,MBA,2025
6342635,597310,Kean Cougars,597245,Catholic Cardinals,597245,1,bot,M. Fisher flied out to rf.,11,2025-03-12T00:00:00-04:00,"Talbot Field (Washington, DC)",126,MBA,2025
6342635,597310,Kean Cougars,597245,Catholic Cardinals,597310,2,top,T. Stone walked.,12,2025-03-12T00:00:00-04:00,"Talbot Field (Washington, DC)",126,MBA,2025
6342635,597310,Kean Cougars,597245,Catholic Cardinals,597310,2,top,B. Hilsheime grounded into double play ss to 2b to 1b; T. Stone out on the play.,13,2025-03-12T00:00:00-04:00,"Talbot Field (Washington, DC)",126,MBA,2025
6342635,597310,Kean Cougars,597245,Catholic Cardinals,597310,2,top,S. Petrosh flied out to rf.,14,2025-03-12T00:00:00-04:00,"Talbot Field (Washington, DC)",126,MBA,2025
6342635,597310,Kean Cougars,597245,Catholic Cardinals,597245,2,bot,J. Bateman flied out to rf.,15,2025-03-12T00:00:00-04:00,"Talbot Field (Washington, DC)",126,MBA,2025
6342635,597310,Kean Cougars,597245,Catholic Cardinals,597245,2,bot,M. Perlin popped up to 2b.,16,2025-03-12T00:00:00-04:00,"Talbot Field (Washington, DC)",126,MBA,2025
6342635,597310,Kean Cougars,597245,Catholic Cardinals,597245,2,bot,S. Thomas fouled out to 1b.,17,2025-03-12T00:00:00-04:00,"Talbot Field (Washington, DC)",126,MBA,2025
6342635,597310,Kean Cougars,597245,Catholic Cardinals,597310,3,top,D. Reistle hit by pitch.,18,2025-03-12T00:00:00-04:00,"Talbot Field (Washington, DC)",126,MBA,2025
6342635,597310,Kean Cougars,597245,Catholic Cardinals,597310,3,top,D. Masino reached on a fielder's choice; D. Reistle out at second p to 2b.,19,2025-03-12T00:00:00-04:00,"Talbot Field (Washington, DC)",126,MBA,2025
6342635,597310,Kean Cougars,597245,Catholic Cardinals,597310,3,top,"D. Masino out at second c to ss, caught stealing.",20,2025-03-12T00:00:00-04:00,"Talbot Field (Washington, DC)",126,MBA,2025
6342635,597310,Kean Cougars,597245,Catholic Cardinals,597310,3,top,J. Teixeira lined out to 3b.,21,2025-03-12T00:00:00-04:00,"Talbot Field (Washington, DC)",126,MBA,2025
6342635,597310,Kean Cougars,597245,Catholic Cardinals,597245,3,bot,S. Burman doubled to left center.,22,2025-03-12T00:00:00-04:00,"Talbot Field (Washington, DC)",126,MBA,2025
6342635,597310,Kean Cougars,597245,Catholic Cardinals,597245,3,bot,S. Burman advanced to third on a wild pitch.,23,2025-03-12T00:00:00-04:00,"Talbot Field (Washington, DC)",126,MBA,2025
6342635,597310,Kean Cougars,597245,Catholic Cardinals,597245,3,bot,M. Johnson walked.,24,2025-03-12T00:00:00-04:00,"Talbot Field (Washington, DC)",126,MBA,2025
6342635,597310,Kean Cougars,597245,Catholic Cardinals,597245,3,bot,"Lo. Eilbache singled up the middle, RBI; M. Johnson advanced to second; S. Burman scored.",25,2025-03-12T00:00:00-04:00,"Talbot Field (Washington, DC)",126,MBA,2025
6342635,597310,Kean Cougars,597245,Catholic Cardinals,597245,3,bot,J. Marini struck out looking.,26,2025-03-12T00:00:00-04:00,"Talbot Field (Washington, DC)",126,MBA,2025
6342635,597310,Kean Cougars,597245,Catholic Cardinals,597245,3,bot,D. Pozzi flied out to rf.,27,2025-03-12T00:00:00-04:00,"Talbot Field (Washington, DC)",126,MBA,2025
6342635,597310,Kean Cougars,597245,Catholic Cardinals,597245,3,bot,M. Fisher flied out to rf.,28,2025-03-12T00:00:00-04:00,"Talbot Field (Washington, DC)",126,MBA,2025
6342635,597310,Kean Cougars,597245,Catholic Cardinals,597310,4,top,K. Adorno singled to right field.,29,2025-03-12T00:00:00-04:00,"Talbot Field (Washington, DC)",126,MBA,2025
6342635,597310,Kean Cougars,597245,Catholic Cardinals,597310,4,top,M. sol doubled to left field; K. Adorno advanced to third.,30,2025-03-12T00:00:00-04:00,"Talbot Field (Washington, DC)",126,MBA,2025
6342635,597310,Kean Cougars,597245,Catholic Cardinals,597310,4,top,C. Tomalavag walked.,31,2025-03-12T00:00:00-04:00,"Talbot Field (Washington, DC)",126,MBA,2025
6342635,597310,Kean Cougars,597245,Catholic Cardinals,597310,4,top,"T. Stone reached on a fielder's choice; C. Tomalavag advanced to third; M. sol advanced to third, scored on an error by c; K. Adorno out at home p to c.",32,2025-03-12T00:00:00-04:00,"Talbot Field (Washington, DC)",126,MBA,2025
6342635,597310,Kean Cougars,597245,Catholic Cardinals,597310,4,top,"B. Hilsheime singled down the rf line, RBI; T. Stone advanced to second, out at third rf to 3b; C. Tomalavag scored.",33,2025-03-12T00:00:00-04:00,"Talbot Field (Washington, DC)",126,MBA,2025
6342635,597310,Kean Cougars,597245,Catholic Cardinals,597310,4,top,L. Cardman to p for J. Scholz.,34,2025-03-12T00:00:00-04:00,"Talbot Field (Washington, DC)",126,MBA,2025
6342635,597310,Kean Cougars,597245,Catholic Cardinals,597310,4,top,S. Petrosh struck out swinging.,35,2025-03-12T00:00:00-04:00,"Talbot Field (Washington, DC)",126,MBA,2025
6342635,597310,Kean Cougars,597245,Catholic Cardinals,597245,4,bot,J. Bateman singled to left field.,36,2025-03-12T00:00:00-04:00,"Talbot Field (Washington, DC)",126,MBA,2025
6342635,597310,Kean Cougars,597245,Catholic Cardinals,597245,4,bot,"M. Perlin reached first on an error by p, SAC, bunt; J. Bateman advanced to second.",37,2025-03-12T00:00:00-04:00,"Talbot Field (Washington, DC)",126,MBA,2025
6342635,597310,Kean Cougars,597245,Catholic Cardinals,597245,4,bot,S. Thomas reached on a fielder's choice; M. Perlin advanced to second; J. Bateman out at third p to 3b.,38,2025-03-12T00:00:00-04:00,"Talbot Field (Washington, DC)",126,MBA,2025
6342635,597310,Kean Cougars,597245,Catholic Cardinals,597245,4,bot,S. Thomas advanced to second on a wild pitch; M. Perlin advanced to third on a wild pitch.,39,2025-03-12T00:00:00-04:00,"Talbot Field (Washington, DC)",126,MBA,2025
6342635,597310,Kean Cougars,597245,Catholic Cardinals,597245,4,bot,"S. Thomas advanced to third on a balk; M. Perlin scored on a balk, unearned.",40,2025-03-12T00:00:00-04:00,"Talbot Field (Washington, DC)",126,MBA,2025
6342635,597310,Kean Cougars,597245,Catholic Cardinals,597245,4,bot,A. Pigna to p for M. Goods-Min.,41,2025-03-12T00:00:00-04:00,"Talbot Field (Washington, DC)",126,MBA,2025
6342635,597310,Kean Cougars,597245,Catholic Cardinals,597245,4,bot,"S. Burman singled up the middle, RBI; S. Thomas scored.",42,2025-03-12T00:00:00-04:00,"Talbot Field (Washington, DC)",126,MBA,2025
6342635,597310,Kean Cougars,597245,Catholic Cardinals,597245,4,bot,S. Burman advanced to second on a passed ball.,43,2025-03-12T00:00:00-04:00,"Talbot Field (Washington, DC)",126,MBA,2025
6342635,597310,Kean Cougars,597245,Catholic Cardinals,597245,4,bot,M. Johnson was intentionally walked.,44,2025-03-12T00:00:00-04:00,"Talbot Field (Washington, DC)",126,MBA,2025
6342635,597310,Kean Cougars,597245,Catholic Cardinals,597245,4,bot,"Lo. Eilbache doubled down the lf line, out at third lf to 3b to c to 3b, RBI; M. Johnson advanced to third, out at home lf to 3b to c; S. Burman scored.",45,2025-03-12T00:00:00-04:00,"Talbot Field (Washington, DC)",126,MBA,2025
6342635,597310,Kean Cougars,597245,Catholic Cardinals,597310,5,top,D. Reistle lined out to 3b.,46,2025-03-12T00:00:00-04:00,"Talbot Field (Washington, DC)",126,MBA,2025
6342635,597310,Kean Cougars,597245,Catholic Cardinals,597310,5,top,D. Masino hit by pitch.,47,2025-03-12T00:00:00-04:00,"Talbot Field (Washington, DC)",126,MBA,2025
6342635,597310,Kean Cougars,597245,Catholic Cardinals,597310,5,top,"J. Teixeira homered to right field, 2 RBI; D. Masino scored.",48,2025-03-12T00:00:00-04:00,"Talbot Field (Washington, DC)",126,MBA,2025
6342635,597310,Kean Cougars,597245,Catholic Cardinals,597310,5,top,K. Adorno doubled to right center.,49,2025-03-12T00:00:00-04:00,"Talbot Field (Washington, DC)",126,MBA,2025
6342635,597310,Kean Cougars,597245,Catholic Cardinals,597310,5,top,M. sol hit by pitch.,50,2025-03-12T00:00:00-04:00,"Talbot Field (Washington, DC)",126,MBA,2025
6342635,597310,Kean Cougars,597245,Catholic Cardinals,597310,5,top,C. Tomalavag struck out swinging.,51,2025-03-12T00:00:00-04:00,"Talbot Field (Washington, DC)",126,MBA,2025
6342635,597310,Kean Cougars,597245,Catholic Cardinals,597310,5,top,"T. Stone homered to left field, 3 RBI; M. sol scored; K. Adorno scored.",52,2025-03-12T00:00:00-04:00,"Talbot Field (Washington, DC)",126,MBA,2025
6342635,597310,Kean Cougars,597245,Catholic Cardinals,597310,5,top,L. Penney to p for L. Cardman.,53,2025-03-12T00:00:00-04:00,"Talbot Field (Washington, DC)",126,MBA,2025
6342635,597310,Kean Cougars,597245,Catholic Cardinals,597310,5,top,B. Hilsheime singled to right field.,54,2025-03-12T00:00:00-04:00,"Talbot Field (Washington, DC)",126,MBA,2025
6342635,597310,Kean Cougars,597245,Catholic Cardinals,597310,5,top,S. Petrosh reached on a fielder's choice; B. Hilsheime out at second ss to 2b.,55,2025-03-12T00:00:00-04:00,"Talbot Field (Washington, DC)",126,MBA,2025
6342635,597310,Kean Cougars,597245,Catholic Cardinals,597245,5,bot,J. Marini singled up the middle.,56,2025-03-12T00:00:00-04:00,"Talbot Field (Washington, DC)",126,MBA,2025
6342635,597310,Kean Cougars,597245,Catholic Cardinals,597245,5,bot,D. Pozzi hit by pitch; J. Marini advanced to second.,57,2025-03-12T00:00:00-04:00,"Talbot Field (Washington, DC)",126,MBA,2025
6342635,597310,Kean Cougars,597245,Catholic Cardinals,597245,5,bot,D. Pozzi advanced to second on a wild pitch; J. Marini advanced to third on a wild pitch.,58,2025-03-12T00:00:00-04:00,"Talbot Field (Washington, DC)",126,MBA,2025
6342635,597310,Kean Cougars,597245,Catholic Cardinals,597245,5,bot,J. Basilicat to p for A. Pigna.,59,2025-03-12T00:00:00-04:00,"Talbot Field (Washington, DC)",126,MBA,2025
6342635,597310,Kean Cougars,597245,Catholic Cardinals,597245,5,bot,M. Fisher walked.,60,2025-03-12T00:00:00-04:00,"Talbot Field (Washington, DC)",126,MBA,2025
6342635,597310,Kean Cougars,597245,Catholic Cardinals,597245,5,bot,J. Bateman struck out swinging.,61,2025-03-12T00:00:00-04:00,"Talbot Field (Washington, DC)",126,MBA,2025
6342635,597310,Kean Cougars,597245,Catholic Cardinals,597245,5,bot,J. Elwell pinch hit for M. Perlin.,62,2025-03-12T00:00:00-04:00,"Talbot Field (Washington, DC)",126,MBA,2025
6342635,597310,Kean Cougars,597245,Catholic Cardinals,597245,5,bot,J. Elwell struck out looking.,63,2025-03-12T00:00:00-04:00,"Talbot Field (Washington, DC)",126,MBA,2025
6342635,597310,Kean Cougars,597245,Catholic Cardinals,597245,5,bot,S. Thomas grounded out to 1b unassisted.,64,2025-03-12T00:00:00-04:00,"Talbot Field (Washington, DC)",126,MBA,2025
6342635,597310,Kean Cougars,597245,Catholic Cardinals,597310,6,top,J. McCarthy to 2b for J. Elwell.,65,2025-03-12T00:00:00-04:00,"Talbot Field (Washington, DC)",126,MBA,2025
6342635,597310,Kean Cougars,597245,Catholic Cardinals,597310,6,top,D. Reistle singled to center field.,66,2025-03-12T00:00:00-04:00,"Talbot Field (Washington, DC)",126,MBA,2025
6342635,597310,Kean Cougars,597245,Catholic Cardinals,597310,6,top,D. Masino grounded into double play 3b to 2b to 1b; D. Reistle out on the play.,67,2025-03-12T00:00:00-04:00,"Talbot Field (Washington, DC)",126,MBA,2025
6342635,597310,Kean Cougars,597245,Catholic Cardinals,597310,6,top,J. Teixeira reached first on an error by ss.,68,2025-03-12T00:00:00-04:00,"Talbot Field (Washington, DC)",126,MBA,2025
6342635,597310,Kean Cougars,597245,Catholic Cardinals,597310,6,top,"J. Teixeira out at first p to 1b to 2b, picked off.",69,2025-03-12T00:00:00-04:00,"Talbot Field (Washington, DC)",126,MBA,2025
6342635,597310,Kean Cougars,597245,Catholic Cardinals,597245,6,bot,S. Burman walked.,70,2025-03-12T00:00:00-04:00,"Talbot Field (Washington, DC)",126,MBA,2025
6342635,597310,Kean Cougars,597245,Catholic Cardinals,597245,6,bot,M. Johnson grounded into double play ss to 2b to 1b; S. Burman out on the play.,71,2025-03-12T00:00:00-04:00,"Talbot Field (Washington, DC)",126,MBA,2025
6342635,597310,Kean Cougars,597245,Catholic Cardinals,597245,6,bot,Lo. Eilbache struck out looking.,72,2025-03-12T00:00:00-04:00,"Talbot Field (Washington, DC)",126,MBA,2025
6342635,597310,Kean Cougars,597245,Catholic Cardinals,597310,7,top,J. Kenney to p for L. Penney.,73,2025-03-12T00:00:00-04:00,"Talbot Field (Washington, DC)",126,MBA,2025
6342635,597310,Kean Cougars,597245,Catholic Cardinals,597310,7,top,K. Adorno walked.,74,2025-03-12T00:00:00-04:00,"Talbot Field (Washington, DC)",126,MBA,2025
6342635,597310,Kean Cougars,597245,Catholic Cardinals,597310,7,top,M. sol walked; K. Adorno advanced to second.,75,2025-03-12T00:00:00-04:00,"Talbot Field (Washington, DC)",126,MBA,2025
6342635,597310,Kean Cougars,597245,Catholic Cardinals,597310,7,top,N. Sellari pinch ran for M. sol.,76,2025-03-12T00:00:00-04:00,"Talbot Field (Washington, DC)",126,MBA,2025
6342635,597310,Kean Cougars,597245,Catholic Cardinals,597310,7,top,C. Tomalavag struck out swinging.,77,2025-03-12T00:00:00-04:00,"Talbot Field (Washington, DC)",126,MBA,2025
6342635,597310,Kean Cougars,597245,Catholic Cardinals,597310,7,top,T. Stone flied out to lf.,78,2025-03-12T00:00:00-04:00,"Talbot Field (Washington, DC)",126,MBA,2025
6342635,597310,Kean Cougars,597245,Catholic Cardinals,597310,7,top,B. Hilsheime lined out to 3b.,79,2025-03-12T00:00:00-04:00,"Talbot Field (Washington, DC)",126,MBA,2025
6342635,597310,Kean Cougars,597245,Catholic Cardinals,597245,7,bot,N. Sellari to 2b.,80,2025-03-12T00:00:00-04:00,"Talbot Field (Washington, DC)",126,MBA,2025
6342635,597310,Kean Cougars,597245,Catholic Cardinals,597245,7,bot,J. Marini grounded out to 2b.,81,2025-03-12T00:00:00-04:00,"Talbot Field (Washington, DC)",126,MBA,2025
6342635,597310,Kean Cougars,597245,Catholic Cardinals,597245,7,bot,D. Pozzi struck out swinging.,82,2025-03-12T00:00:00-04:00,"Talbot Field (Washington, DC)",126,MBA,2025
6342635,597310,Kean Cougars,597245,Catholic Cardinals,597245,7,bot,M. Fisher singled through the left side.,83,2025-03-12T00:00:00-04:00,"Talbot Field (Washington, DC)",126,MBA,2025
6342635,597310,Kean Cougars,597245,Catholic Cardinals,597245,7,bot,J. Bateman struck out swinging.,84,2025-03-12T00:00:00-04:00,"Talbot Field (Washington, DC)",126,MBA,2025
6342635,597310,Kean Cougars,597245,Catholic Cardinals,597310,8,top,S. Petrosh singled through the left side.,85,2025-03-12T00:00:00-04:00,"Talbot Field (Washington, DC)",126,MBA,2025
6342635,597310,Kean Cougars,597245,Catholic Cardinals,597310,8,top,D. Reistle flied out to lf.,86,2025-03-12T00:00:00-04:00,"Talbot Field (Washington, DC)",126,MBA,2025
6342635,597310,Kean Cougars,597245,Catholic Cardinals,597310,8,top,D. Masino reached first on an error by ss; S. Petrosh advanced to third.,87,2025-03-12T00:00:00-04:00,"Talbot Field (Washington, DC)",126,MBA,2025
6342635,597310,Kean Cougars,597245,Catholic Cardinals,597310,8,top,"J. Teixeira reached on a fielder's choice, RBI; D. Masino out at second 2b to ss; S. Petrosh scored, unearned.",88,2025-03-12T00:00:00-04:00,"Talbot Field (Washington, DC)",126,MBA,2025
6342635,597310,Kean Cougars,597245,Catholic Cardinals,597310,8,top,K. Adorno walked; J. Teixeira advanced to second.,89,2025-03-12T00:00:00-04:00,"Talbot Field (Washington, DC)",126,MBA,2025
6342635,597310,Kean Cougars,597245,Catholic Cardinals,597310,8,top,M. Meara to p for J. Kenney.,90,2025-03-12T00:00:00-04:00,"Talbot Field (Washington, DC)",126,MBA,2025
6342635,597310,Kean Cougars,597245,Catholic Cardinals,597310,8,top,N. Sellari struck out swinging.,91,2025-03-12T00:00:00-04:00,"Talbot Field (Washington, DC)",126,MBA,2025
6342635,597310,Kean Cougars,597245,Catholic Cardinals,597245,8,bot,J. Lacefield to 2b for J. McCarthy.,92,2025-03-12T00:00:00-04:00,"Talbot Field (Washington, DC)",126,MBA,2025
6342635,597310,Kean Cougars,597245,Catholic Cardinals,597245,8,bot,J. Lacefield struck out swinging.,93,2025-03-12T00:00:00-04:00,"Talbot Field (Washington, DC)",126,MBA,2025
6342635,597310,Kean Cougars,597245,Catholic Cardinals,597245,8,bot,S. Thomas flied out to rf.,94,2025-03-12T00:00:00-04:00,"Talbot Field (Washington, DC)",126,MBA,2025
6342635,597310,Kean Cougars,597245,Catholic Cardinals,597245,8,bot,S. Burman grounded out to 3b.,95,2025-03-12T00:00:00-04:00,"Talbot Field (Washington, DC)",126,MBA,2025
6342635,597310,Kean Cougars,597245,Catholic Cardinals,597310,9,top,J. Bateman to 2b.,96,2025-03-12T00:00:00-04:00,"Talbot Field (Washington, DC)",126,MBA,2025
6342635,597310,Kean Cougars,597245,Catholic Cardinals,597310,9,top,J. Lacefield to 3b.,97,2025-03-12T00:00:00-04:00,"Talbot Field (Washington, DC)",126,MBA,2025
6342635,597310,Kean Cougars,597245,Catholic Cardinals,597310,9,top,C. Tomalavag struck out swinging.,98,2025-03-12T00:00:00-04:00,"Talbot Field (Washington, DC)",126,MBA,2025
6342635,597310,Kean Cougars,597245,Catholic Cardinals,597310,9,top,T. Stone grounded out to 2b.,99,2025-03-12T00:00:00-04:00,"Talbot Field (Washington, DC)",126,MBA,2025
6342635,597310,Kean Cougars,597245,Catholic Cardinals,597310,9,top,B. Hilsheime flied out to rf.,100,2025-03-12T00:00:00-04:00,"Talbot Field (Washington, DC)",126,MBA,2025
6342635,597310,Kean Cougars,597245,Catholic Cardinals,597245,9,bot,J. Chiusano to c for C. Tomalavag.,101,2025-03-12T00:00:00-04:00,"Talbot Field (Washington, DC)",126,MBA,2025
6342635,597310,Kean Cougars,597245,Catholic Cardinals,597245,9,bot,M. Johnson walked.,102,2025-03-12T00:00:00-04:00,"Talbot Field (Washington, DC)",126,MBA,2025
6342635,597310,Kean Cougars,597245,Catholic Cardinals,597245,9,bot,La. Eilbache pinch ran for M. Johnson.,103,2025-03-12T00:00:00-04:00,"Talbot Field (Washington, DC)",126,MBA,2025
6342635,597310,Kean Cougars,597245,Catholic Cardinals,597245,9,bot,Lo. Eilbache struck out looking.,104,2025-03-12T00:00:00-04:00,"Talbot Field (Washington, DC)",126,MBA,2025
6342635,597310,Kean Cougars,597245,Catholic Cardinals,597245,9,bot,J. Marini walked; La. Eilbache advanced to second.,105,2025-03-12T00:00:00-04:00,"Talbot Field (Washington, DC)",126,MBA,2025
6342635,597310,Kean Cougars,597245,Catholic Cardinals,597245,9,bot,M. Villanuev pinch ran for J. Marini.,106,2025-03-12T00:00:00-04:00,"Talbot Field (Washington, DC)",126,MBA,2025
6342635,597310,Kean Cougars,597245,Catholic Cardinals,597245,9,bot,D. Pozzi grounded into double play 2b to ss to 1b; M. Villanuev out on the play.,107,2025-03-12T00:00:00-04:00,"Talbot Field (Washington, DC)",126,MBA,2025
