game_id,away_team_id,away_team_name,home_team_id,home_team_name,batting_team,inning,top_bot,event_text,event_num,game_datetime,stadium_name,attendance,sport_id,season
6342084,596759,Wingate Bulldogs,596736,Mars Hill Lions,596759,1,top,Jake Courville walked.,1,2025-03-08T00:00:00-05:00,"Henderson Field (Mars Hill, NC)",0,MBA,2025
6342084,596759,Wingate Bulldogs,596736,Mars Hill Lions,596759,1,top,Gavin Groppuso struck out looking.,2,2025-03-08T00:00:00-05:00,"Henderson Field (Mars Hill, NC)",0,MBA,2025
6342084,596759,Wingate Bulldogs,596736,Mars Hill Lions,596759,1,top,"Sean Sullivan homered to center field, 2 RBI; Jake Courville scored.",3,2025-03-08T00:00:00-05:00,"Henderson Field (Mars Hill, NC)",0,MBA,2025
6342084,596759,Wingate Bulldogs,596736,Mars Hill Lions,596759,1,top,Breon Ishmael grounded out to ss.,4,2025-03-08T00:00:00-05:00,"Henderson Field (Mars Hill, NC)",0,MBA,2025
6342084,596759,Wingate Bulldogs,596736,Mars Hill Lions,596759,1,top,Eli Weisner struck out swinging.,5,2025-03-08T00:00:00-05:00,"Henderson Field (Mars Hill, NC)",0,MBA,2025
6342084,596759,Wingate Bulldogs,596736,Mars Hill Lions,596736,1,bot,Elec Yount grounded out to 2b.,6,2025-03-08T00:00:00-05:00,"Henderson Field (Mars Hill, NC)",0,MBA,2025
6342084,596759,Wingate Bulldogs,596736,Mars Hill Lions,596736,1,bot,Peyton Starkey reached first on a fielding error by 3b.,7,2025-03-08T00:00:00-05:00,"Henderson Field (Mars Hill, NC)",0,MBA,2025
6342084,596759,Wingate Bulldogs,596736,Mars Hill Lions,596736,1,bot,Walker Fox struck out looking.,8,2025-03-08T00:00:00-05:00,"Henderson Field (Mars Hill, NC)",0,MBA,2025
6342084,596759,Wingate Bulldogs,596736,Mars Hill Lions,596736,1,bot,Terick Bumgarner reached on a fielder's choice; Peyton Starkey out at second ss to 2b.,9,2025-03-08T00:00:00-05:00,"Henderson Field (Mars Hill, NC)",0,MBA,2025
6342084,596759,Wingate Bulldogs,596736,Mars Hill Lions,596759,2,top,Cam Harris grounded out to p.,10,2025-03-08T00:00:00-05:00,"Henderson Field (Mars Hill, NC)",0,MBA,2025
6342084,596759,Wingate Bulldogs,596736,Mars Hill Lions,596759,2,top,Wyatt Hoffman grounded out to 3b.,11,2025-03-08T00:00:00-05:00,"Henderson Field (Mars Hill, NC)",0,MBA,2025
6342084,596759,Wingate Bulldogs,596736,Mars Hill Lions,596759,2,top,Owen Crevelt grounded out to c.,12,2025-03-08T00:00:00-05:00,"Henderson Field (Mars Hill, NC)",0,MBA,2025
6342084,596759,Wingate Bulldogs,596736,Mars Hill Lions,596736,2,bot,Alejandro Aguilar struck out swinging.,13,2025-03-08T00:00:00-05:00,"Henderson Field (Mars Hill, NC)",0,MBA,2025
6342084,596759,Wingate Bulldogs,596736,Mars Hill Lions,596736,2,bot,Carter Potts struck out looking.,14,2025-03-08T00:00:00-05:00,"Henderson Field (Mars Hill, NC)",0,MBA,2025
6342084,596759,Wingate Bulldogs,596736,Mars Hill Lions,596736,2,bot,Evan Grant walked.,15,2025-03-08T00:00:00-05:00,"Henderson Field (Mars Hill, NC)",0,MBA,2025
6342084,596759,Wingate Bulldogs,596736,Mars Hill Lions,596736,2,bot,"Evan Grant picked off, out at first p to 1b.",16,2025-03-08T00:00:00-05:00,"Henderson Field (Mars Hill, NC)",0,MBA,2025
6342084,596759,Wingate Bulldogs,596736,Mars Hill Lions,596759,3,top,Evan Barefoot doubled down the rf line.,17,2025-03-08T00:00:00-05:00,"Henderson Field (Mars Hill, NC)",0,MBA,2025
6342084,596759,Wingate Bulldogs,596736,Mars Hill Lions,596759,3,top,Evan Barefoot advanced to third on a wild pitch.,18,2025-03-08T00:00:00-05:00,"Henderson Field (Mars Hill, NC)",0,MBA,2025
6342084,596759,Wingate Bulldogs,596736,Mars Hill Lions,596759,3,top,"Jake Courville grounded out to rf unassisted, SAC, RBI; Evan Barefoot scored.",19,2025-03-08T00:00:00-05:00,"Henderson Field (Mars Hill, NC)",0,MBA,2025
6342084,596759,Wingate Bulldogs,596736,Mars Hill Lions,596759,3,top,Gavin Groppuso grounded out to 2b.,20,2025-03-08T00:00:00-05:00,"Henderson Field (Mars Hill, NC)",0,MBA,2025
6342084,596759,Wingate Bulldogs,596736,Mars Hill Lions,596759,3,top,Sean Sullivan flied out to rf.,21,2025-03-08T00:00:00-05:00,"Henderson Field (Mars Hill, NC)",0,MBA,2025
6342084,596759,Wingate Bulldogs,596736,Mars Hill Lions,596736,3,bot,Blake Russell hit by pitch.,22,2025-03-08T00:00:00-05:00,"Henderson Field (Mars Hill, NC)",0,MBA,2025
6342084,596759,Wingate Bulldogs,596736,Mars Hill Lions,596736,3,bot,Dawson Anderson struck out looking.,23,2025-03-08T00:00:00-05:00,"Henderson Field (Mars Hill, NC)",0,MBA,2025
6342084,596759,Wingate Bulldogs,596736,Mars Hill Lions,596736,3,bot,Elec Yount grounded into double play ss to 2b to 1b; Blake Russell out on the play.,24,2025-03-08T00:00:00-05:00,"Henderson Field (Mars Hill, NC)",0,MBA,2025
6342084,596759,Wingate Bulldogs,596736,Mars Hill Lions,596759,4,top,Breon Ishmael singled up the middle.,25,2025-03-08T00:00:00-05:00,"Henderson Field (Mars Hill, NC)",0,MBA,2025
6342084,596759,Wingate Bulldogs,596736,Mars Hill Lions,596759,4,top,Jake Wagoner to p for Dustin Dunlap.,26,2025-03-08T00:00:00-05:00,"Henderson Field (Mars Hill, NC)",0,MBA,2025
6342084,596759,Wingate Bulldogs,596736,Mars Hill Lions,596759,4,top,Eli Weisner doubled to right field; Breon Ishmael advanced to third.,27,2025-03-08T00:00:00-05:00,"Henderson Field (Mars Hill, NC)",0,MBA,2025
6342084,596759,Wingate Bulldogs,596736,Mars Hill Lions,596759,4,top,"Cam Harris grounded out to ss, RBI; Eli Weisner advanced to third; Breon Ishmael scored.",28,2025-03-08T00:00:00-05:00,"Henderson Field (Mars Hill, NC)",0,MBA,2025
6342084,596759,Wingate Bulldogs,596736,Mars Hill Lions,596759,4,top,"Wyatt Hoffman singled up the middle, RBI; Eli Weisner scored.",29,2025-03-08T00:00:00-05:00,"Henderson Field (Mars Hill, NC)",0,MBA,2025
6342084,596759,Wingate Bulldogs,596736,Mars Hill Lions,596759,4,top,Owen Crevelt walked; Wyatt Hoffman advanced to second.,30,2025-03-08T00:00:00-05:00,"Henderson Field (Mars Hill, NC)",0,MBA,2025
6342084,596759,Wingate Bulldogs,596736,Mars Hill Lions,596759,4,top,Evan Barefoot struck out swinging.,31,2025-03-08T00:00:00-05:00,"Henderson Field (Mars Hill, NC)",0,MBA,2025
6342084,596759,Wingate Bulldogs,596736,Mars Hill Lions,596759,4,top,Jake Courville grounded out to 3b.,32,2025-03-08T00:00:00-05:00,"Henderson Field (Mars Hill, NC)",0,MBA,2025
6342084,596759,Wingate Bulldogs,596736,Mars Hill Lions,596736,4,bot,Peyton Starkey flied out to rf.,33,2025-03-08T00:00:00-05:00,"Henderson Field (Mars Hill, NC)",0,MBA,2025
6342084,596759,Wingate Bulldogs,596736,Mars Hill Lions,596736,4,bot,Walker Fox grounded out to 2b.,34,2025-03-08T00:00:00-05:00,"Henderson Field (Mars Hill, NC)",0,MBA,2025
6342084,596759,Wingate Bulldogs,596736,Mars Hill Lions,596736,4,bot,Terick Bumgarner hit by pitch.,35,2025-03-08T00:00:00-05:00,"Henderson Field (Mars Hill, NC)",0,MBA,2025
6342084,596759,Wingate Bulldogs,596736,Mars Hill Lions,596736,4,bot,Alejandro Aguilar singled to left field; Terick Bumgarner advanced to second.,36,2025-03-08T00:00:00-05:00,"Henderson Field (Mars Hill, NC)",0,MBA,2025
6342084,596759,Wingate Bulldogs,596736,Mars Hill Lions,596736,4,bot,Carter Potts lined out to 2b.,37,2025-03-08T00:00:00-05:00,"Henderson Field (Mars Hill, NC)",0,MBA,2025
6342084,596759,Wingate Bulldogs,596736,Mars Hill Lions,596759,5,top,Gavin Groppuso walked.,38,2025-03-08T00:00:00-05:00,"Henderson Field (Mars Hill, NC)",0,MBA,2025
6342084,596759,Wingate Bulldogs,596736,Mars Hill Lions,596759,5,top,Sean Sullivan reached first on a throwing error by 1b; Gavin Groppuso out at second ss to 2b.,39,2025-03-08T00:00:00-05:00,"Henderson Field (Mars Hill, NC)",0,MBA,2025
6342084,596759,Wingate Bulldogs,596736,Mars Hill Lions,596759,5,top,Sean Sullivan advanced to second on a passed ball.,40,2025-03-08T00:00:00-05:00,"Henderson Field (Mars Hill, NC)",0,MBA,2025
6342084,596759,Wingate Bulldogs,596736,Mars Hill Lions,596759,5,top,"Breon Ishmael singled to right field, RBI; Sean Sullivan scored.",41,2025-03-08T00:00:00-05:00,"Henderson Field (Mars Hill, NC)",0,MBA,2025
6342084,596759,Wingate Bulldogs,596736,Mars Hill Lions,596759,5,top,Eli Weisner flied out to cf.,42,2025-03-08T00:00:00-05:00,"Henderson Field (Mars Hill, NC)",0,MBA,2025
6342084,596759,Wingate Bulldogs,596736,Mars Hill Lions,596759,5,top,"Breon Ishmael advanced to second on a wild pitch, advanced to third on a throwing error by c.",43,2025-03-08T00:00:00-05:00,"Henderson Field (Mars Hill, NC)",0,MBA,2025
6342084,596759,Wingate Bulldogs,596736,Mars Hill Lions,596759,5,top,"Cam Harris homered to right field, 2 RBI; Breon Ishmael scored, unearned.",44,2025-03-08T00:00:00-05:00,"Henderson Field (Mars Hill, NC)",0,MBA,2025
6342084,596759,Wingate Bulldogs,596736,Mars Hill Lions,596759,5,top,Owen Bynum to p for Jake Wagoner.,45,2025-03-08T00:00:00-05:00,"Henderson Field (Mars Hill, NC)",0,MBA,2025
6342084,596759,Wingate Bulldogs,596736,Mars Hill Lions,596759,5,top,Wyatt Hoffman hit by pitch.,46,2025-03-08T00:00:00-05:00,"Henderson Field (Mars Hill, NC)",0,MBA,2025
6342084,596759,Wingate Bulldogs,596736,Mars Hill Lions,596759,5,top,Owen Crevelt walked; Wyatt Hoffman advanced to second.,47,2025-03-08T00:00:00-05:00,"Henderson Field (Mars Hill, NC)",0,MBA,2025
6342084,596759,Wingate Bulldogs,596736,Mars Hill Lions,596759,5,top,"Evan Barefoot singled to center field, advanced to second on the throw, RBI; Owen Crevelt advanced to third; Wyatt Hoffman scored.",48,2025-03-08T00:00:00-05:00,"Henderson Field (Mars Hill, NC)",0,MBA,2025
6342084,596759,Wingate Bulldogs,596736,Mars Hill Lions,596759,5,top,"Jake Courville singled up the middle, 2 RBI; Evan Barefoot scored; Owen Crevelt scored.",49,2025-03-08T00:00:00-05:00,"Henderson Field (Mars Hill, NC)",0,MBA,2025
6342084,596759,Wingate Bulldogs,596736,Mars Hill Lions,596759,5,top,JD Lewis to p for Owen Bynum.,50,2025-03-08T00:00:00-05:00,"Henderson Field (Mars Hill, NC)",0,MBA,2025
6342084,596759,Wingate Bulldogs,596736,Mars Hill Lions,596759,5,top,Gavin Groppuso singled to left field; Jake Courville advanced to second.,51,2025-03-08T00:00:00-05:00,"Henderson Field (Mars Hill, NC)",0,MBA,2025
6342084,596759,Wingate Bulldogs,596736,Mars Hill Lions,596759,5,top,Sean Sullivan struck out swinging.,52,2025-03-08T00:00:00-05:00,"Henderson Field (Mars Hill, NC)",0,MBA,2025
6342084,596759,Wingate Bulldogs,596736,Mars Hill Lions,596736,5,bot,Evan Grant struck out swinging.,53,2025-03-08T00:00:00-05:00,"Henderson Field (Mars Hill, NC)",0,MBA,2025
6342084,596759,Wingate Bulldogs,596736,Mars Hill Lions,596736,5,bot,Blake Russell grounded out to c.,54,2025-03-08T00:00:00-05:00,"Henderson Field (Mars Hill, NC)",0,MBA,2025
6342084,596759,Wingate Bulldogs,596736,Mars Hill Lions,596736,5,bot,Dawson Anderson struck out swinging.,55,2025-03-08T00:00:00-05:00,"Henderson Field (Mars Hill, NC)",0,MBA,2025
6342084,596759,Wingate Bulldogs,596736,Mars Hill Lions,596759,6,top,Breon Ishmael struck out swinging.,56,2025-03-08T00:00:00-05:00,"Henderson Field (Mars Hill, NC)",0,MBA,2025
6342084,596759,Wingate Bulldogs,596736,Mars Hill Lions,596759,6,top,Eli Weisner hit by pitch.,57,2025-03-08T00:00:00-05:00,"Henderson Field (Mars Hill, NC)",0,MBA,2025
6342084,596759,Wingate Bulldogs,596736,Mars Hill Lions,596759,6,top,Cam Harris fouled out to 3b.,58,2025-03-08T00:00:00-05:00,"Henderson Field (Mars Hill, NC)",0,MBA,2025
6342084,596759,Wingate Bulldogs,596736,Mars Hill Lions,596759,6,top,"Wyatt Hoffman singled, advanced to second on the throw; Eli Weisner advanced to third.",59,2025-03-08T00:00:00-05:00,"Henderson Field (Mars Hill, NC)",0,MBA,2025
6342084,596759,Wingate Bulldogs,596736,Mars Hill Lions,596759,6,top,Owen Crevelt grounded out to 3b.,60,2025-03-08T00:00:00-05:00,"Henderson Field (Mars Hill, NC)",0,MBA,2025
6342084,596759,Wingate Bulldogs,596736,Mars Hill Lions,596736,6,bot,Max LaLime pinch hit for Elec Yount.,61,2025-03-08T00:00:00-05:00,"Henderson Field (Mars Hill, NC)",0,MBA,2025
6342084,596759,Wingate Bulldogs,596736,Mars Hill Lions,596736,6,bot,Max LaLime grounded out to p.,62,2025-03-08T00:00:00-05:00,"Henderson Field (Mars Hill, NC)",0,MBA,2025
6342084,596759,Wingate Bulldogs,596736,Mars Hill Lions,596736,6,bot,Peyton Starkey grounded out to ss.,63,2025-03-08T00:00:00-05:00,"Henderson Field (Mars Hill, NC)",0,MBA,2025
6342084,596759,Wingate Bulldogs,596736,Mars Hill Lions,596736,6,bot,Walker Fox flied out to rf.,64,2025-03-08T00:00:00-05:00,"Henderson Field (Mars Hill, NC)",0,MBA,2025
6342084,596759,Wingate Bulldogs,596736,Mars Hill Lions,596759,7,top,Christian Galindo to p for JD Lewis.,65,2025-03-08T00:00:00-05:00,"Henderson Field (Mars Hill, NC)",0,MBA,2025
6342084,596759,Wingate Bulldogs,596736,Mars Hill Lions,596759,7,top,Max LaLime to lf.,66,2025-03-08T00:00:00-05:00,"Henderson Field (Mars Hill, NC)",0,MBA,2025
6342084,596759,Wingate Bulldogs,596736,Mars Hill Lions,596759,7,top,Peyton Starkey to ss.,67,2025-03-08T00:00:00-05:00,"Henderson Field (Mars Hill, NC)",0,MBA,2025
6342084,596759,Wingate Bulldogs,596736,Mars Hill Lions,596759,7,top,Blake Russell to 2b.,68,2025-03-08T00:00:00-05:00,"Henderson Field (Mars Hill, NC)",0,MBA,2025
6342084,596759,Wingate Bulldogs,596736,Mars Hill Lions,596759,7,top,Chapel Matson to 1b for Alejandro Aguilar.,69,2025-03-08T00:00:00-05:00,"Henderson Field (Mars Hill, NC)",0,MBA,2025
6342084,596759,Wingate Bulldogs,596736,Mars Hill Lions,596759,7,top,Evan Barefoot grounded out to ss.,70,2025-03-08T00:00:00-05:00,"Henderson Field (Mars Hill, NC)",0,MBA,2025
6342084,596759,Wingate Bulldogs,596736,Mars Hill Lions,596759,7,top,Jake Courville grounded out to 1b unassisted.,71,2025-03-08T00:00:00-05:00,"Henderson Field (Mars Hill, NC)",0,MBA,2025
6342084,596759,Wingate Bulldogs,596736,Mars Hill Lions,596759,7,top,Gavin Groppuso walked.,72,2025-03-08T00:00:00-05:00,"Henderson Field (Mars Hill, NC)",0,MBA,2025
6342084,596759,Wingate Bulldogs,596736,Mars Hill Lions,596759,7,top,"Sean Sullivan homered to left field, 2 RBI; Gavin Groppuso scored.",73,2025-03-08T00:00:00-05:00,"Henderson Field (Mars Hill, NC)",0,MBA,2025
6342084,596759,Wingate Bulldogs,596736,Mars Hill Lions,596759,7,top,Breon Ishmael grounded out to p.,74,2025-03-08T00:00:00-05:00,"Henderson Field (Mars Hill, NC)",0,MBA,2025
6342084,596759,Wingate Bulldogs,596736,Mars Hill Lions,596736,7,bot,Terick Bumgarner struck out swinging.,75,2025-03-08T00:00:00-05:00,"Henderson Field (Mars Hill, NC)",0,MBA,2025
6342084,596759,Wingate Bulldogs,596736,Mars Hill Lions,596736,7,bot,Chapel Matson walked.,76,2025-03-08T00:00:00-05:00,"Henderson Field (Mars Hill, NC)",0,MBA,2025
6342084,596759,Wingate Bulldogs,596736,Mars Hill Lions,596736,7,bot,Carter Potts grounded into double play ss to 2b to 1b; Chapel Matson out on the play.,77,2025-03-08T00:00:00-05:00,"Henderson Field (Mars Hill, NC)",0,MBA,2025
