game_id,away_team_id,away_team_name,home_team_id,home_team_name,batting_team,inning,top_bot,event_text,event_num,game_datetime,stadium_name,attendance,sport_id,season
6342912,596727,Georgia College Bobcats,596728,Ga. Southwestern Hurricanes,596727,1,top,G. Wuerth grounded out to 2b.,1,2025-03-14T00:00:00-04:00,"Hurricane Stadium  (Americus, GA)",0,MBA,2025
6342912,596727,Georgia College Bobcats,596728,Ga. Southwestern Hurricanes,596727,1,top,B. Hamacher flied out to cf.,2,2025-03-14T00:00:00-04:00,"Hurricane Stadium  (Americus, GA)",0,MBA,2025
6342912,596727,Georgia College Bobcats,596728,Ga. Southwestern Hurricanes,596727,1,top,B. Smith flied out to rf.,3,2025-03-14T00:00:00-04:00,"Hurricane Stadium  (Americus, GA)",0,MBA,2025
6342912,596727,Georgia College Bobcats,596728,Ga. Southwestern Hurricanes,596728,1,bot,J. Jenkins flied out to cf.,4,2025-03-14T00:00:00-04:00,"Hurricane Stadium  (Americus, GA)",0,MBA,2025
6342912,596727,Georgia College Bobcats,596728,Ga. Southwestern Hurricanes,596728,1,bot,C. Lee walked.,5,2025-03-14T00:00:00-04:00,"Hurricane Stadium  (Americus, GA)",0,MBA,2025
6342912,596727,Georgia College Bobcats,596728,Ga. Southwestern Hurricanes,596728,1,bot,Dav. Hernand flied out to cf.,6,2025-03-14T00:00:00-04:00,"Hurricane Stadium  (Americus, GA)",0,MBA,2025
6342912,596727,Georgia College Bobcats,596728,Ga. Southwestern Hurricanes,596728,1,bot,B. Deerman flied out to cf.,7,2025-03-14T00:00:00-04:00,"Hurricane Stadium  (Americus, GA)",0,MBA,2025
6342912,596727,Georgia College Bobcats,596728,Ga. Southwestern Hurricanes,596727,2,top,M. Mebane singled up the middle.,8,2025-03-14T00:00:00-04:00,"Hurricane Stadium  (Americus, GA)",0,MBA,2025
6342912,596727,Georgia College Bobcats,596728,Ga. Southwestern Hurricanes,596727,2,top,H. Noonan fouled out to 1b.,9,2025-03-14T00:00:00-04:00,"Hurricane Stadium  (Americus, GA)",0,MBA,2025
6342912,596727,Georgia College Bobcats,596728,Ga. Southwestern Hurricanes,596727,2,top,E. Cowan reached on a fielder's choice; M. Mebane out at second ss to 2b.,10,2025-03-14T00:00:00-04:00,"Hurricane Stadium  (Americus, GA)",0,MBA,2025
6342912,596727,Georgia College Bobcats,596728,Ga. Southwestern Hurricanes,596727,2,top,K. Baxter flied out to 3b.,11,2025-03-14T00:00:00-04:00,"Hurricane Stadium  (Americus, GA)",0,MBA,2025
6342912,596727,Georgia College Bobcats,596728,Ga. Southwestern Hurricanes,596728,2,bot,Dan. Hernand singled to right center.,12,2025-03-14T00:00:00-04:00,"Hurricane Stadium  (Americus, GA)",0,MBA,2025
6342912,596727,Georgia College Bobcats,596728,Ga. Southwestern Hurricanes,596728,2,bot,M. Manuel grounded out to ss; Dan. Hernand advanced to second.,13,2025-03-14T00:00:00-04:00,"Hurricane Stadium  (Americus, GA)",0,MBA,2025
6342912,596727,Georgia College Bobcats,596728,Ga. Southwestern Hurricanes,596728,2,bot,"P. Hegeman singled to left center, RBI; Dan. Hernand scored.",14,2025-03-14T00:00:00-04:00,"Hurricane Stadium  (Americus, GA)",0,MBA,2025
6342912,596727,Georgia College Bobcats,596728,Ga. Southwestern Hurricanes,596728,2,bot,G. Davis grounded into double play 3b to 2b to 1b; P. Hegeman out on the play.,15,2025-03-14T00:00:00-04:00,"Hurricane Stadium  (Americus, GA)",0,MBA,2025
6342912,596727,Georgia College Bobcats,596728,Ga. Southwestern Hurricanes,596727,3,top,C. Phillips flied out to lf.,16,2025-03-14T00:00:00-04:00,"Hurricane Stadium  (Americus, GA)",0,MBA,2025
6342912,596727,Georgia College Bobcats,596728,Ga. Southwestern Hurricanes,596727,3,top,R. Besterman flied out to lf.,17,2025-03-14T00:00:00-04:00,"Hurricane Stadium  (Americus, GA)",0,MBA,2025
6342912,596727,Georgia College Bobcats,596728,Ga. Southwestern Hurricanes,596727,3,top,G. Wuerth grounded out to 2b.,18,2025-03-14T00:00:00-04:00,"Hurricane Stadium  (Americus, GA)",0,MBA,2025
6342912,596727,Georgia College Bobcats,596728,Ga. Southwestern Hurricanes,596728,3,bot,K. Henry singled to shortstop.,19,2025-03-14T00:00:00-04:00,"Hurricane Stadium  (Americus, GA)",0,MBA,2025
6342912,596727,Georgia College Bobcats,596728,Ga. Southwestern Hurricanes,596728,3,bot,J. Jenkins reached first on a fielding error by ss; K. Henry advanced to second.,20,2025-03-14T00:00:00-04:00,"Hurricane Stadium  (Americus, GA)",0,MBA,2025
6342912,596727,Georgia College Bobcats,596728,Ga. Southwestern Hurricanes,596728,3,bot,"K. Henry out at second p to 2b, picked off.",21,2025-03-14T00:00:00-04:00,"Hurricane Stadium  (Americus, GA)",0,MBA,2025
6342912,596727,Georgia College Bobcats,596728,Ga. Southwestern Hurricanes,596728,3,bot,C. Lee reached on a fielder's choice; J. Jenkins out at second ss to 2b.,22,2025-03-14T00:00:00-04:00,"Hurricane Stadium  (Americus, GA)",0,MBA,2025
6342912,596727,Georgia College Bobcats,596728,Ga. Southwestern Hurricanes,596728,3,bot,Dav. Hernand flied out to lf.,23,2025-03-14T00:00:00-04:00,"Hurricane Stadium  (Americus, GA)",0,MBA,2025
6342912,596727,Georgia College Bobcats,596728,Ga. Southwestern Hurricanes,596727,4,top,B. Hamacher struck out swinging.,24,2025-03-14T00:00:00-04:00,"Hurricane Stadium  (Americus, GA)",0,MBA,2025
6342912,596727,Georgia College Bobcats,596728,Ga. Southwestern Hurricanes,596727,4,top,B. Smith singled to left field.,25,2025-03-14T00:00:00-04:00,"Hurricane Stadium  (Americus, GA)",0,MBA,2025
6342912,596727,Georgia College Bobcats,596728,Ga. Southwestern Hurricanes,596727,4,top,M. Mebane flied out to lf.,26,2025-03-14T00:00:00-04:00,"Hurricane Stadium  (Americus, GA)",0,MBA,2025
6342912,596727,Georgia College Bobcats,596728,Ga. Southwestern Hurricanes,596727,4,top,H. Noonan grounded out to 3b.,27,2025-03-14T00:00:00-04:00,"Hurricane Stadium  (Americus, GA)",0,MBA,2025
6342912,596727,Georgia College Bobcats,596728,Ga. Southwestern Hurricanes,596728,4,bot,B. Deerman walked.,28,2025-03-14T00:00:00-04:00,"Hurricane Stadium  (Americus, GA)",0,MBA,2025
6342912,596727,Georgia College Bobcats,596728,Ga. Southwestern Hurricanes,596728,4,bot,Dan. Hernand singled to left center; B. Deerman advanced to third.,29,2025-03-14T00:00:00-04:00,"Hurricane Stadium  (Americus, GA)",0,MBA,2025
6342912,596727,Georgia College Bobcats,596728,Ga. Southwestern Hurricanes,596728,4,bot,M. Manuel struck out looking.,30,2025-03-14T00:00:00-04:00,"Hurricane Stadium  (Americus, GA)",0,MBA,2025
6342912,596727,Georgia College Bobcats,596728,Ga. Southwestern Hurricanes,596728,4,bot,"P. Hegeman singled to right field, RBI; Dan. Hernand advanced to second; B. Deerman scored.",31,2025-03-14T00:00:00-04:00,"Hurricane Stadium  (Americus, GA)",0,MBA,2025
6342912,596727,Georgia College Bobcats,596728,Ga. Southwestern Hurricanes,596728,4,bot,G. Davis singled to right field; P. Hegeman advanced to second; Dan. Hernand advanced to third.,32,2025-03-14T00:00:00-04:00,"Hurricane Stadium  (Americus, GA)",0,MBA,2025
6342912,596727,Georgia College Bobcats,596728,Ga. Southwestern Hurricanes,596728,4,bot,"K. Henry hit by pitch, RBI; G. Davis advanced to second; P. Hegeman advanced to third; Dan. Hernand scored.",33,2025-03-14T00:00:00-04:00,"Hurricane Stadium  (Americus, GA)",0,MBA,2025
6342912,596727,Georgia College Bobcats,596728,Ga. Southwestern Hurricanes,596728,4,bot,"J. Jenkins homered, 4 RBI; K. Henry scored; G. Davis scored; P. Hegeman scored.",34,2025-03-14T00:00:00-04:00,"Hurricane Stadium  (Americus, GA)",0,MBA,2025
6342912,596727,Georgia College Bobcats,596728,Ga. Southwestern Hurricanes,596728,4,bot,C. Lee struck out looking.,35,2025-03-14T00:00:00-04:00,"Hurricane Stadium  (Americus, GA)",0,MBA,2025
6342912,596727,Georgia College Bobcats,596728,Ga. Southwestern Hurricanes,596728,4,bot,Dav. Hernand singled to right center.,36,2025-03-14T00:00:00-04:00,"Hurricane Stadium  (Americus, GA)",0,MBA,2025
6342912,596727,Georgia College Bobcats,596728,Ga. Southwestern Hurricanes,596728,4,bot,B. Deerman singled to left center; Dav. Hernand advanced to second.,37,2025-03-14T00:00:00-04:00,"Hurricane Stadium  (Americus, GA)",0,MBA,2025
6342912,596727,Georgia College Bobcats,596728,Ga. Southwestern Hurricanes,596728,4,bot,Dan. Hernand hit by pitch; B. Deerman advanced to second; Dav. Hernand advanced to third.,38,2025-03-14T00:00:00-04:00,"Hurricane Stadium  (Americus, GA)",0,MBA,2025
6342912,596727,Georgia College Bobcats,596728,Ga. Southwestern Hurricanes,596728,4,bot,M. Manuel flied out to lf.,39,2025-03-14T00:00:00-04:00,"Hurricane Stadium  (Americus, GA)",0,MBA,2025
6342912,596727,Georgia College Bobcats,596728,Ga. Southwestern Hurricanes,596727,5,top,E. Cowan lined out to p.,40,2025-03-14T00:00:00-04:00,"Hurricane Stadium  (Americus, GA)",0,MBA,2025
6342912,596727,Georgia College Bobcats,596728,Ga. Southwestern Hurricanes,596727,5,top,K. Baxter flied out to lf.,41,2025-03-14T00:00:00-04:00,"Hurricane Stadium  (Americus, GA)",0,MBA,2025
6342912,596727,Georgia College Bobcats,596728,Ga. Southwestern Hurricanes,596727,5,top,C. Phillips singled to left field.,42,2025-03-14T00:00:00-04:00,"Hurricane Stadium  (Americus, GA)",0,MBA,2025
6342912,596727,Georgia College Bobcats,596728,Ga. Southwestern Hurricanes,596727,5,top,R. Besterman struck out swinging.,43,2025-03-14T00:00:00-04:00,"Hurricane Stadium  (Americus, GA)",0,MBA,2025
6342912,596727,Georgia College Bobcats,596728,Ga. Southwestern Hurricanes,596728,5,bot,T. Ringer to p for J. Glanton.,44,2025-03-14T00:00:00-04:00,"Hurricane Stadium  (Americus, GA)",0,MBA,2025
6342912,596727,Georgia College Bobcats,596728,Ga. Southwestern Hurricanes,596728,5,bot,P. Hegeman singled to center field.,45,2025-03-14T00:00:00-04:00,"Hurricane Stadium  (Americus, GA)",0,MBA,2025
6342912,596727,Georgia College Bobcats,596728,Ga. Southwestern Hurricanes,596728,5,bot,G. Davis hit by pitch; P. Hegeman advanced to second.,46,2025-03-14T00:00:00-04:00,"Hurricane Stadium  (Americus, GA)",0,MBA,2025
6342912,596727,Georgia College Bobcats,596728,Ga. Southwestern Hurricanes,596728,5,bot,K. Henry reached on a fielder's choice; G. Davis out at second ss to 2b; P. Hegeman advanced to third.,47,2025-03-14T00:00:00-04:00,"Hurricane Stadium  (Americus, GA)",0,MBA,2025
6342912,596727,Georgia College Bobcats,596728,Ga. Southwestern Hurricanes,596728,5,bot,"J. Jenkins singled up the middle, RBI; K. Henry advanced to second; P. Hegeman scored.",48,2025-03-14T00:00:00-04:00,"Hurricane Stadium  (Americus, GA)",0,MBA,2025
6342912,596727,Georgia College Bobcats,596728,Ga. Southwestern Hurricanes,596728,5,bot,C. Lee flied out to cf.,49,2025-03-14T00:00:00-04:00,"Hurricane Stadium  (Americus, GA)",0,MBA,2025
6342912,596727,Georgia College Bobcats,596728,Ga. Southwestern Hurricanes,596728,5,bot,"Dav. Hernand struck out swinging, out at first c to 1b.",50,2025-03-14T00:00:00-04:00,"Hurricane Stadium  (Americus, GA)",0,MBA,2025
6342912,596727,Georgia College Bobcats,596728,Ga. Southwestern Hurricanes,596727,6,top,G. Wuerth walked.,51,2025-03-14T00:00:00-04:00,"Hurricane Stadium  (Americus, GA)",0,MBA,2025
6342912,596727,Georgia College Bobcats,596728,Ga. Southwestern Hurricanes,596727,6,top,B. Hamacher flied out to cf.,52,2025-03-14T00:00:00-04:00,"Hurricane Stadium  (Americus, GA)",0,MBA,2025
6342912,596727,Georgia College Bobcats,596728,Ga. Southwestern Hurricanes,596727,6,top,B. Smith doubled; G. Wuerth advanced to third.,53,2025-03-14T00:00:00-04:00,"Hurricane Stadium  (Americus, GA)",0,MBA,2025
6342912,596727,Georgia College Bobcats,596728,Ga. Southwestern Hurricanes,596727,6,top,"M. Mebane singled to right field, RBI; B. Smith advanced to third; G. Wuerth scored.",54,2025-03-14T00:00:00-04:00,"Hurricane Stadium  (Americus, GA)",0,MBA,2025
6342912,596727,Georgia College Bobcats,596728,Ga. Southwestern Hurricanes,596727,6,top,H. Noonan popped up to 2b.,55,2025-03-14T00:00:00-04:00,"Hurricane Stadium  (Americus, GA)",0,MBA,2025
6342912,596727,Georgia College Bobcats,596728,Ga. Southwestern Hurricanes,596727,6,top,E. Cowan grounded out to 2b.,56,2025-03-14T00:00:00-04:00,"Hurricane Stadium  (Americus, GA)",0,MBA,2025
6342912,596727,Georgia College Bobcats,596728,Ga. Southwestern Hurricanes,596728,6,bot,B. Deerman grounded out to 2b.,57,2025-03-14T00:00:00-04:00,"Hurricane Stadium  (Americus, GA)",0,MBA,2025
6342912,596727,Georgia College Bobcats,596728,Ga. Southwestern Hurricanes,596728,6,bot,Dan. Hernand struck out looking.,58,2025-03-14T00:00:00-04:00,"Hurricane Stadium  (Americus, GA)",0,MBA,2025
6342912,596727,Georgia College Bobcats,596728,Ga. Southwestern Hurricanes,596728,6,bot,M. Manuel flied out to rf.,59,2025-03-14T00:00:00-04:00,"Hurricane Stadium  (Americus, GA)",0,MBA,2025
6342912,596727,Georgia College Bobcats,596728,Ga. Southwestern Hurricanes,596727,7,top,K. Baxter flied out to cf.,60,2025-03-14T00:00:00-04:00,"Hurricane Stadium  (Americus, GA)",0,MBA,2025
6342912,596727,Georgia College Bobcats,596728,Ga. Southwestern Hurricanes,596727,7,top,C. Phillips struck out swinging.,61,2025-03-14T00:00:00-04:00,"Hurricane Stadium  (Americus, GA)",0,MBA,2025
6342912,596727,Georgia College Bobcats,596728,Ga. Southwestern Hurricanes,596727,7,top,R. Besterman fouled out to ss.,62,2025-03-14T00:00:00-04:00,"Hurricane Stadium  (Americus, GA)",0,MBA,2025
6342912,596727,Georgia College Bobcats,596728,Ga. Southwestern Hurricanes,596728,7,bot,P. Hegeman grounded out 2b to ss to 1b.,63,2025-03-14T00:00:00-04:00,"Hurricane Stadium  (Americus, GA)",0,MBA,2025
6342912,596727,Georgia College Bobcats,596728,Ga. Southwestern Hurricanes,596728,7,bot,G. Davis flied out to cf.,64,2025-03-14T00:00:00-04:00,"Hurricane Stadium  (Americus, GA)",0,MBA,2025
6342912,596727,Georgia College Bobcats,596728,Ga. Southwestern Hurricanes,596728,7,bot,K. Henry doubled down the lf line.,65,2025-03-14T00:00:00-04:00,"Hurricane Stadium  (Americus, GA)",0,MBA,2025
6342912,596727,Georgia College Bobcats,596728,Ga. Southwestern Hurricanes,596728,7,bot,J. Jenkins grounded out to 3b.,66,2025-03-14T00:00:00-04:00,"Hurricane Stadium  (Americus, GA)",0,MBA,2025
6342912,596727,Georgia College Bobcats,596728,Ga. Southwestern Hurricanes,596727,8,top,G. Wuerth flied out to lf.,67,2025-03-14T00:00:00-04:00,"Hurricane Stadium  (Americus, GA)",0,MBA,2025
6342912,596727,Georgia College Bobcats,596728,Ga. Southwestern Hurricanes,596727,8,top,B. Hamacher popped up to 2b.,68,2025-03-14T00:00:00-04:00,"Hurricane Stadium  (Americus, GA)",0,MBA,2025
6342912,596727,Georgia College Bobcats,596728,Ga. Southwestern Hurricanes,596727,8,top,B. Smith struck out looking.,69,2025-03-14T00:00:00-04:00,"Hurricane Stadium  (Americus, GA)",0,MBA,2025
6342912,596727,Georgia College Bobcats,596728,Ga. Southwestern Hurricanes,596728,8,bot,B. Lowry to p for T. Ringer.,70,2025-03-14T00:00:00-04:00,"Hurricane Stadium  (Americus, GA)",0,MBA,2025
6342912,596727,Georgia College Bobcats,596728,Ga. Southwestern Hurricanes,596728,8,bot,C. Lee singled up the middle.,71,2025-03-14T00:00:00-04:00,"Hurricane Stadium  (Americus, GA)",0,MBA,2025
6342912,596727,Georgia College Bobcats,596728,Ga. Southwestern Hurricanes,596728,8,bot,Dav. Hernand flied out to rf.,72,2025-03-14T00:00:00-04:00,"Hurricane Stadium  (Americus, GA)",0,MBA,2025
6342912,596727,Georgia College Bobcats,596728,Ga. Southwestern Hurricanes,596728,8,bot,B. Deerman walked; C. Lee advanced to second.,73,2025-03-14T00:00:00-04:00,"Hurricane Stadium  (Americus, GA)",0,MBA,2025
6342912,596727,Georgia College Bobcats,596728,Ga. Southwestern Hurricanes,596728,8,bot,Dan. Hernand singled to right field; B. Deerman advanced to second; C. Lee advanced to third.,74,2025-03-14T00:00:00-04:00,"Hurricane Stadium  (Americus, GA)",0,MBA,2025
6342912,596727,Georgia College Bobcats,596728,Ga. Southwestern Hurricanes,596728,8,bot,"M. Manuel reached first on a throwing error by 2b, 2 RBI; Dan. Hernand out at second ss to 2b; B. Deerman scored, unearned; C. Lee scored, unearned.",75,2025-03-14T00:00:00-04:00,"Hurricane Stadium  (Americus, GA)",0,MBA,2025
6342912,596727,Georgia College Bobcats,596728,Ga. Southwestern Hurricanes,596728,8,bot,M. Manuel advanced to second on a passed ball.,76,2025-03-14T00:00:00-04:00,"Hurricane Stadium  (Americus, GA)",0,MBA,2025
6342912,596727,Georgia College Bobcats,596728,Ga. Southwestern Hurricanes,596728,8,bot,P. Hegeman flied out to rf.,77,2025-03-14T00:00:00-04:00,"Hurricane Stadium  (Americus, GA)",0,MBA,2025
6342912,596727,Georgia College Bobcats,596728,Ga. Southwestern Hurricanes,596727,9,top,M. Mebane singled to left field.,78,2025-03-14T00:00:00-04:00,"Hurricane Stadium  (Americus, GA)",0,MBA,2025
6342912,596727,Georgia College Bobcats,596728,Ga. Southwestern Hurricanes,596727,9,top,H. Noonan walked; M. Mebane advanced to second.,79,2025-03-14T00:00:00-04:00,"Hurricane Stadium  (Americus, GA)",0,MBA,2025
6342912,596727,Georgia College Bobcats,596728,Ga. Southwestern Hurricanes,596727,9,top,"E. Cowan doubled to center field, RBI; H. Noonan advanced to third; M. Mebane scored.",80,2025-03-14T00:00:00-04:00,"Hurricane Stadium  (Americus, GA)",0,MBA,2025
6342912,596727,Georgia College Bobcats,596728,Ga. Southwestern Hurricanes,596727,9,top,C. Sain to p for A. Geiger.,81,2025-03-14T00:00:00-04:00,"Hurricane Stadium  (Americus, GA)",0,MBA,2025
6342912,596727,Georgia College Bobcats,596728,Ga. Southwestern Hurricanes,596727,9,top,K. Baxter struck out looking.,82,2025-03-14T00:00:00-04:00,"Hurricane Stadium  (Americus, GA)",0,MBA,2025
6342912,596727,Georgia College Bobcats,596728,Ga. Southwestern Hurricanes,596727,9,top,C. Phillips walked.,83,2025-03-14T00:00:00-04:00,"Hurricane Stadium  (Americus, GA)",0,MBA,2025
6342912,596727,Georgia College Bobcats,596728,Ga. Southwestern Hurricanes,596727,9,top,M. Cowan pinch hit for R. Besterman.,84,2025-03-14T00:00:00-04:00,"Hurricane Stadium  (Americus, GA)",0,MBA,2025
6342912,596727,Georgia College Bobcats,596728,Ga. Southwestern Hurricanes,596727,9,top,"M. Cowan singled to left field, RBI; C. Phillips advanced to second; E. Cowan advanced to third; H. Noonan scored.",85,2025-03-14T00:00:00-04:00,"Hurricane Stadium  (Americus, GA)",0,MBA,2025
6342912,596727,Georgia College Bobcats,596728,Ga. Southwestern Hurricanes,596727,9,top,M. Cowan advanced to second; C. Phillips advanced to third; E. Cowan scored on a wild pitch.,86,2025-03-14T00:00:00-04:00,"Hurricane Stadium  (Americus, GA)",0,MBA,2025
6342912,596727,Georgia College Bobcats,596728,Ga. Southwestern Hurricanes,596727,9,top,"G. Wuerth flied out to lf, sacrifice fly, RBI; C. Phillips scored.",87,2025-03-14T00:00:00-04:00,"Hurricane Stadium  (Americus, GA)",0,MBA,2025
6342912,596727,Georgia College Bobcats,596728,Ga. Southwestern Hurricanes,596727,9,top,B. Hamacher grounded out to 3b.,88,2025-03-14T00:00:00-04:00,"Hurricane Stadium  (Americus, GA)",0,MBA,2025
