game_id,away_team_id,away_team_name,home_team_id,home_team_name,batting_team,inning,top_bot,event_text,event_num,game_datetime,stadium_name,attendance,sport_id,season
6343012,597134,Texas Lutheran Bulldogs,597103,Dallas Crusaders,597134,1,top,M. Goudeau walked.,1,2025-03-15T00:00:00-04:00,"Crusaders Field (Irving, TX)",145,MBA,2025
6343012,597134,Texas Lutheran Bulldogs,597103,Dallas Crusaders,597134,1,top,C. Bourgeois reached first on an error by 3b; M. Goudeau advanced to second.,2,2025-03-15T00:00:00-04:00,"Crusaders Field (Irving, TX)",145,MBA,2025
6343012,597134,Texas Lutheran Bulldogs,597103,Dallas Crusaders,597134,1,top,A. Peavy hit by pitch; C. Bourgeois advanced to second; M. Goudeau advanced to third.,3,2025-03-15T00:00:00-04:00,"Crusaders Field (Irving, TX)",145,MBA,2025
6343012,597134,Texas Lutheran Bulldogs,597103,Dallas Crusaders,597134,1,top,K. Durkin struck out swinging.,4,2025-03-15T00:00:00-04:00,"Crusaders Field (Irving, TX)",145,MBA,2025
6343012,597134,Texas Lutheran Bulldogs,597103,Dallas Crusaders,597134,1,top,B. Sprencel reached on a fielder's choice; A. Peavy advanced to second; C. Bourgeois advanced to third; M. Goudeau out at home p to c.,5,2025-03-15T00:00:00-04:00,"Crusaders Field (Irving, TX)",145,MBA,2025
6343012,597134,Texas Lutheran Bulldogs,597103,Dallas Crusaders,597134,1,top,T. Helpensti fouled out to 1b.,6,2025-03-15T00:00:00-04:00,"Crusaders Field (Irving, TX)",145,MBA,2025
6343012,597134,Texas Lutheran Bulldogs,597103,Dallas Crusaders,597103,1,bot,R. Morales walked.,7,2025-03-15T00:00:00-04:00,"Crusaders Field (Irving, TX)",145,MBA,2025
6343012,597134,Texas Lutheran Bulldogs,597103,Dallas Crusaders,597103,1,bot,"D. Goddard reached first on an error by 3b, advanced to third, RBI; R. Morales scored, unearned.",8,2025-03-15T00:00:00-04:00,"Crusaders Field (Irving, TX)",145,MBA,2025
6343012,597134,Texas Lutheran Bulldogs,597103,Dallas Crusaders,597103,1,bot,"Cal. Hohman homered to center field, 2 RBI; D. Goddard scored, unearned.",9,2025-03-15T00:00:00-04:00,"Crusaders Field (Irving, TX)",145,MBA,2025
6343012,597134,Texas Lutheran Bulldogs,597103,Dallas Crusaders,597103,1,bot,L. Gill singled to left field.,10,2025-03-15T00:00:00-04:00,"Crusaders Field (Irving, TX)",145,MBA,2025
6343012,597134,Texas Lutheran Bulldogs,597103,Dallas Crusaders,597103,1,bot,A. Gaspar lined out to cf.,11,2025-03-15T00:00:00-04:00,"Crusaders Field (Irving, TX)",145,MBA,2025
6343012,597134,Texas Lutheran Bulldogs,597103,Dallas Crusaders,597103,1,bot,N. Curtis grounded out to 1b unassisted; L. Gill out at second 1b to ss.,12,2025-03-15T00:00:00-04:00,"Crusaders Field (Irving, TX)",145,MBA,2025
6343012,597134,Texas Lutheran Bulldogs,597103,Dallas Crusaders,597134,2,top,A. Spires lined out to lf.,13,2025-03-15T00:00:00-04:00,"Crusaders Field (Irving, TX)",145,MBA,2025
6343012,597134,Texas Lutheran Bulldogs,597103,Dallas Crusaders,597134,2,top,C. Greene grounded out to 3b.,14,2025-03-15T00:00:00-04:00,"Crusaders Field (Irving, TX)",145,MBA,2025
6343012,597134,Texas Lutheran Bulldogs,597103,Dallas Crusaders,597134,2,top,C. Jen reached first on an error by p.,15,2025-03-15T00:00:00-04:00,"Crusaders Field (Irving, TX)",145,MBA,2025
6343012,597134,Texas Lutheran Bulldogs,597103,Dallas Crusaders,597134,2,top,M. Goudeau reached on a fielder's choice; C. Jen out at second 2b to ss.,16,2025-03-15T00:00:00-04:00,"Crusaders Field (Irving, TX)",145,MBA,2025
6343012,597134,Texas Lutheran Bulldogs,597103,Dallas Crusaders,597103,2,bot,C. Mize walked.,17,2025-03-15T00:00:00-04:00,"Crusaders Field (Irving, TX)",145,MBA,2025
6343012,597134,Texas Lutheran Bulldogs,597103,Dallas Crusaders,597103,2,bot,T. Espinosa hit by pitch; C. Mize advanced to second.,18,2025-03-15T00:00:00-04:00,"Crusaders Field (Irving, TX)",145,MBA,2025
6343012,597134,Texas Lutheran Bulldogs,597103,Dallas Crusaders,597103,2,bot,"D. Roscopf out at first p to 2b, SAC; T. Espinosa advanced to second; C. Mize advanced to third.",19,2025-03-15T00:00:00-04:00,"Crusaders Field (Irving, TX)",145,MBA,2025
6343012,597134,Texas Lutheran Bulldogs,597103,Dallas Crusaders,597103,2,bot,R. Morales lined out to ss.,20,2025-03-15T00:00:00-04:00,"Crusaders Field (Irving, TX)",145,MBA,2025
6343012,597134,Texas Lutheran Bulldogs,597103,Dallas Crusaders,597103,2,bot,D. Goddard flied out to lf.,21,2025-03-15T00:00:00-04:00,"Crusaders Field (Irving, TX)",145,MBA,2025
6343012,597134,Texas Lutheran Bulldogs,597103,Dallas Crusaders,597134,3,top,C. Bourgeois grounded out to ss.,22,2025-03-15T00:00:00-04:00,"Crusaders Field (Irving, TX)",145,MBA,2025
6343012,597134,Texas Lutheran Bulldogs,597103,Dallas Crusaders,597134,3,top,A. Peavy singled through the left side.,23,2025-03-15T00:00:00-04:00,"Crusaders Field (Irving, TX)",145,MBA,2025
6343012,597134,Texas Lutheran Bulldogs,597103,Dallas Crusaders,597134,3,top,K. Durkin flied out to rf.,24,2025-03-15T00:00:00-04:00,"Crusaders Field (Irving, TX)",145,MBA,2025
6343012,597134,Texas Lutheran Bulldogs,597103,Dallas Crusaders,597134,3,top,B. Sprencel grounded out to 2b.,25,2025-03-15T00:00:00-04:00,"Crusaders Field (Irving, TX)",145,MBA,2025
6343012,597134,Texas Lutheran Bulldogs,597103,Dallas Crusaders,597103,3,bot,Cal. Hohman singled to left field.,26,2025-03-15T00:00:00-04:00,"Crusaders Field (Irving, TX)",145,MBA,2025
6343012,597134,Texas Lutheran Bulldogs,597103,Dallas Crusaders,597103,3,bot,Cal. Hohman stole second.,27,2025-03-15T00:00:00-04:00,"Crusaders Field (Irving, TX)",145,MBA,2025
6343012,597134,Texas Lutheran Bulldogs,597103,Dallas Crusaders,597103,3,bot,L. Gill walked.,28,2025-03-15T00:00:00-04:00,"Crusaders Field (Irving, TX)",145,MBA,2025
6343012,597134,Texas Lutheran Bulldogs,597103,Dallas Crusaders,597103,3,bot,A. Gaspar flied out to rf.,29,2025-03-15T00:00:00-04:00,"Crusaders Field (Irving, TX)",145,MBA,2025
6343012,597134,Texas Lutheran Bulldogs,597103,Dallas Crusaders,597103,3,bot,N. Curtis walked; L. Gill advanced to second; Cal. Hohman advanced to third.,30,2025-03-15T00:00:00-04:00,"Crusaders Field (Irving, TX)",145,MBA,2025
6343012,597134,Texas Lutheran Bulldogs,597103,Dallas Crusaders,597103,3,bot,C. Hues to p for G. Nedd.,31,2025-03-15T00:00:00-04:00,"Crusaders Field (Irving, TX)",145,MBA,2025
6343012,597134,Texas Lutheran Bulldogs,597103,Dallas Crusaders,597103,3,bot,"C. Mize walked, RBI; N. Curtis advanced to second; L. Gill advanced to third; Cal. Hohman scored.",32,2025-03-15T00:00:00-04:00,"Crusaders Field (Irving, TX)",145,MBA,2025
6343012,597134,Texas Lutheran Bulldogs,597103,Dallas Crusaders,597103,3,bot,"T. Espinosa reached on a fielder's choice, advanced to second, RBI; C. Mize advanced to third; N. Curtis scored; L. Gill out at home 3b to c.",33,2025-03-15T00:00:00-04:00,"Crusaders Field (Irving, TX)",145,MBA,2025
6343012,597134,Texas Lutheran Bulldogs,597103,Dallas Crusaders,597103,3,bot,D. Roscopf walked.,34,2025-03-15T00:00:00-04:00,"Crusaders Field (Irving, TX)",145,MBA,2025
6343012,597134,Texas Lutheran Bulldogs,597103,Dallas Crusaders,597103,3,bot,R. Morales popped up to 2b.,35,2025-03-15T00:00:00-04:00,"Crusaders Field (Irving, TX)",145,MBA,2025
6343012,597134,Texas Lutheran Bulldogs,597103,Dallas Crusaders,597134,4,top,"T. Helpensti homered to left field, RBI.",36,2025-03-15T00:00:00-04:00,"Crusaders Field (Irving, TX)",145,MBA,2025
6343012,597134,Texas Lutheran Bulldogs,597103,Dallas Crusaders,597134,4,top,A. Spires grounded out to ss.,37,2025-03-15T00:00:00-04:00,"Crusaders Field (Irving, TX)",145,MBA,2025
6343012,597134,Texas Lutheran Bulldogs,597103,Dallas Crusaders,597134,4,top,C. Greene walked.,38,2025-03-15T00:00:00-04:00,"Crusaders Field (Irving, TX)",145,MBA,2025
6343012,597134,Texas Lutheran Bulldogs,597103,Dallas Crusaders,597134,4,top,C. Jen singled through the left side; C. Greene advanced to second.,39,2025-03-15T00:00:00-04:00,"Crusaders Field (Irving, TX)",145,MBA,2025
6343012,597134,Texas Lutheran Bulldogs,597103,Dallas Crusaders,597134,4,top,M. Goudeau struck out swinging.,40,2025-03-15T00:00:00-04:00,"Crusaders Field (Irving, TX)",145,MBA,2025
6343012,597134,Texas Lutheran Bulldogs,597103,Dallas Crusaders,597134,4,top,C. Bourgeois walked; C. Jen advanced to second; C. Greene advanced to third.,41,2025-03-15T00:00:00-04:00,"Crusaders Field (Irving, TX)",145,MBA,2025
6343012,597134,Texas Lutheran Bulldogs,597103,Dallas Crusaders,597134,4,top,"A. Peavy singled, 2 RBI; C. Bourgeois advanced to third; C. Jen scored; C. Greene scored.",42,2025-03-15T00:00:00-04:00,"Crusaders Field (Irving, TX)",145,MBA,2025
6343012,597134,Texas Lutheran Bulldogs,597103,Dallas Crusaders,597134,4,top,A. Peavy stole second.,43,2025-03-15T00:00:00-04:00,"Crusaders Field (Irving, TX)",145,MBA,2025
6343012,597134,Texas Lutheran Bulldogs,597103,Dallas Crusaders,597134,4,top,K. Durkin flied out to cf.,44,2025-03-15T00:00:00-04:00,"Crusaders Field (Irving, TX)",145,MBA,2025
6343012,597134,Texas Lutheran Bulldogs,597103,Dallas Crusaders,597103,4,bot,D. Goddard walked.,45,2025-03-15T00:00:00-04:00,"Crusaders Field (Irving, TX)",145,MBA,2025
6343012,597134,Texas Lutheran Bulldogs,597103,Dallas Crusaders,597103,4,bot,V. Prado to p for C. Hues.,46,2025-03-15T00:00:00-04:00,"Crusaders Field (Irving, TX)",145,MBA,2025
6343012,597134,Texas Lutheran Bulldogs,597103,Dallas Crusaders,597103,4,bot,Cal. Hohman flied out to cf; D. Goddard advanced to second.,47,2025-03-15T00:00:00-04:00,"Crusaders Field (Irving, TX)",145,MBA,2025
6343012,597134,Texas Lutheran Bulldogs,597103,Dallas Crusaders,597103,4,bot,L. Gill walked.,48,2025-03-15T00:00:00-04:00,"Crusaders Field (Irving, TX)",145,MBA,2025
6343012,597134,Texas Lutheran Bulldogs,597103,Dallas Crusaders,597103,4,bot,A. Gaspar flied out to rf; D. Goddard advanced to third.,49,2025-03-15T00:00:00-04:00,"Crusaders Field (Irving, TX)",145,MBA,2025
6343012,597134,Texas Lutheran Bulldogs,597103,Dallas Crusaders,597103,4,bot,L. Gill stole second.,50,2025-03-15T00:00:00-04:00,"Crusaders Field (Irving, TX)",145,MBA,2025
6343012,597134,Texas Lutheran Bulldogs,597103,Dallas Crusaders,597103,4,bot,N. Curtis struck out swinging.,51,2025-03-15T00:00:00-04:00,"Crusaders Field (Irving, TX)",145,MBA,2025
6343012,597134,Texas Lutheran Bulldogs,597103,Dallas Crusaders,597134,5,top,B. Sprencel grounded out to 2b.,52,2025-03-15T00:00:00-04:00,"Crusaders Field (Irving, TX)",145,MBA,2025
6343012,597134,Texas Lutheran Bulldogs,597103,Dallas Crusaders,597134,5,top,T. Helpensti struck out looking.,53,2025-03-15T00:00:00-04:00,"Crusaders Field (Irving, TX)",145,MBA,2025
6343012,597134,Texas Lutheran Bulldogs,597103,Dallas Crusaders,597134,5,top,A. Spires struck out swinging.,54,2025-03-15T00:00:00-04:00,"Crusaders Field (Irving, TX)",145,MBA,2025
6343012,597134,Texas Lutheran Bulldogs,597103,Dallas Crusaders,597103,5,bot,C. Mize singled to shortstop.,55,2025-03-15T00:00:00-04:00,"Crusaders Field (Irving, TX)",145,MBA,2025
6343012,597134,Texas Lutheran Bulldogs,597103,Dallas Crusaders,597103,5,bot,T. Espinosa singled to right field; C. Mize advanced to second.,56,2025-03-15T00:00:00-04:00,"Crusaders Field (Irving, TX)",145,MBA,2025
6343012,597134,Texas Lutheran Bulldogs,597103,Dallas Crusaders,597103,5,bot,D. Roscopf struck out looking.,57,2025-03-15T00:00:00-04:00,"Crusaders Field (Irving, TX)",145,MBA,2025
6343012,597134,Texas Lutheran Bulldogs,597103,Dallas Crusaders,597103,5,bot,R. Morales flied out to rf.,58,2025-03-15T00:00:00-04:00,"Crusaders Field (Irving, TX)",145,MBA,2025
6343012,597134,Texas Lutheran Bulldogs,597103,Dallas Crusaders,597103,5,bot,D. Goddard singled; T. Espinosa advanced to second; C. Mize advanced to third.,59,2025-03-15T00:00:00-04:00,"Crusaders Field (Irving, TX)",145,MBA,2025
6343012,597134,Texas Lutheran Bulldogs,597103,Dallas Crusaders,597103,5,bot,"Cal. Hohman walked, RBI; D. Goddard advanced to second; T. Espinosa advanced to third; C. Mize scored.",60,2025-03-15T00:00:00-04:00,"Crusaders Field (Irving, TX)",145,MBA,2025
6343012,597134,Texas Lutheran Bulldogs,597103,Dallas Crusaders,597103,5,bot,L. Gill popped up to ss.,61,2025-03-15T00:00:00-04:00,"Crusaders Field (Irving, TX)",145,MBA,2025
6343012,597134,Texas Lutheran Bulldogs,597103,Dallas Crusaders,597134,6,top,C. Greene struck out swinging.,62,2025-03-15T00:00:00-04:00,"Crusaders Field (Irving, TX)",145,MBA,2025
6343012,597134,Texas Lutheran Bulldogs,597103,Dallas Crusaders,597134,6,top,C. Jen doubled down the rf line.,63,2025-03-15T00:00:00-04:00,"Crusaders Field (Irving, TX)",145,MBA,2025
6343012,597134,Texas Lutheran Bulldogs,597103,Dallas Crusaders,597134,6,top,M. Goudeau flied out to cf.,64,2025-03-15T00:00:00-04:00,"Crusaders Field (Irving, TX)",145,MBA,2025
6343012,597134,Texas Lutheran Bulldogs,597103,Dallas Crusaders,597134,6,top,"C. Bourgeois tripled to right field, RBI; C. Jen scored.",65,2025-03-15T00:00:00-04:00,"Crusaders Field (Irving, TX)",145,MBA,2025
6343012,597134,Texas Lutheran Bulldogs,597103,Dallas Crusaders,597134,6,top,A. Peavy grounded out to 3b.,66,2025-03-15T00:00:00-04:00,"Crusaders Field (Irving, TX)",145,MBA,2025
6343012,597134,Texas Lutheran Bulldogs,597103,Dallas Crusaders,597103,6,bot,A. Gaspar grounded out to ss.,67,2025-03-15T00:00:00-04:00,"Crusaders Field (Irving, TX)",145,MBA,2025
6343012,597134,Texas Lutheran Bulldogs,597103,Dallas Crusaders,597103,6,bot,N. Curtis hit by pitch.,68,2025-03-15T00:00:00-04:00,"Crusaders Field (Irving, TX)",145,MBA,2025
6343012,597134,Texas Lutheran Bulldogs,597103,Dallas Crusaders,597103,6,bot,C. Mize lined out to 2b; N. Curtis out at second 2b to 1b.,69,2025-03-15T00:00:00-04:00,"Crusaders Field (Irving, TX)",145,MBA,2025
6343012,597134,Texas Lutheran Bulldogs,597103,Dallas Crusaders,597134,7,top,L. Aguirre to p for W. Mosley.,70,2025-03-15T00:00:00-04:00,"Crusaders Field (Irving, TX)",145,MBA,2025
6343012,597134,Texas Lutheran Bulldogs,597103,Dallas Crusaders,597134,7,top,K. Durkin singled up the middle.,71,2025-03-15T00:00:00-04:00,"Crusaders Field (Irving, TX)",145,MBA,2025
6343012,597134,Texas Lutheran Bulldogs,597103,Dallas Crusaders,597134,7,top,B. Sprencel struck out swinging.,72,2025-03-15T00:00:00-04:00,"Crusaders Field (Irving, TX)",145,MBA,2025
6343012,597134,Texas Lutheran Bulldogs,597103,Dallas Crusaders,597134,7,top,T. Helpensti flied out to lf.,73,2025-03-15T00:00:00-04:00,"Crusaders Field (Irving, TX)",145,MBA,2025
6343012,597134,Texas Lutheran Bulldogs,597103,Dallas Crusaders,597134,7,top,A. Spires popped up to 3b.,74,2025-03-15T00:00:00-04:00,"Crusaders Field (Irving, TX)",145,MBA,2025
6343012,597134,Texas Lutheran Bulldogs,597103,Dallas Crusaders,597103,7,bot,T. Espinosa flied out to lf.,75,2025-03-15T00:00:00-04:00,"Crusaders Field (Irving, TX)",145,MBA,2025
6343012,597134,Texas Lutheran Bulldogs,597103,Dallas Crusaders,597103,7,bot,D. Roscopf grounded out to ss.,76,2025-03-15T00:00:00-04:00,"Crusaders Field (Irving, TX)",145,MBA,2025
6343012,597134,Texas Lutheran Bulldogs,597103,Dallas Crusaders,597103,7,bot,R. Morales grounded out to 3b.,77,2025-03-15T00:00:00-04:00,"Crusaders Field (Irving, TX)",145,MBA,2025
6343012,597134,Texas Lutheran Bulldogs,597103,Dallas Crusaders,597134,8,top,C. Greene hit by pitch.,78,2025-03-15T00:00:00-04:00,"Crusaders Field (Irving, TX)",145,MBA,2025
6343012,597134,Texas Lutheran Bulldogs,597103,Dallas Crusaders,597134,8,top,C. Jen lined out to cf.,79,2025-03-15T00:00:00-04:00,"Crusaders Field (Irving, TX)",145,MBA,2025
6343012,597134,Texas Lutheran Bulldogs,597103,Dallas Crusaders,597134,8,top,M. Goudeau singled to center field; C. Greene advanced to third.,80,2025-03-15T00:00:00-04:00,"Crusaders Field (Irving, TX)",145,MBA,2025
6343012,597134,Texas Lutheran Bulldogs,597103,Dallas Crusaders,597134,8,top,M. Goudeau stole second.,81,2025-03-15T00:00:00-04:00,"Crusaders Field (Irving, TX)",145,MBA,2025
6343012,597134,Texas Lutheran Bulldogs,597103,Dallas Crusaders,597134,8,top,C. Bourgeois grounded out to 3b.,82,2025-03-15T00:00:00-04:00,"Crusaders Field (Irving, TX)",145,MBA,2025
6343012,597134,Texas Lutheran Bulldogs,597103,Dallas Crusaders,597134,8,top,"A. Peavy homered to left field, 3 RBI; M. Goudeau scored; C. Greene scored.",83,2025-03-15T00:00:00-04:00,"Crusaders Field (Irving, TX)",145,MBA,2025
6343012,597134,Texas Lutheran Bulldogs,597103,Dallas Crusaders,597134,8,top,K. Durkin grounded out to 3b.,84,2025-03-15T00:00:00-04:00,"Crusaders Field (Irving, TX)",145,MBA,2025
6343012,597134,Texas Lutheran Bulldogs,597103,Dallas Crusaders,597103,8,bot,D. Goddard singled to left field.,85,2025-03-15T00:00:00-04:00,"Crusaders Field (Irving, TX)",145,MBA,2025
6343012,597134,Texas Lutheran Bulldogs,597103,Dallas Crusaders,597103,8,bot,D. Goddard advanced to second on a wild pitch.,86,2025-03-15T00:00:00-04:00,"Crusaders Field (Irving, TX)",145,MBA,2025
6343012,597134,Texas Lutheran Bulldogs,597103,Dallas Crusaders,597103,8,bot,Cal. Hohman doubled to right field; D. Goddard advanced to third.,87,2025-03-15T00:00:00-04:00,"Crusaders Field (Irving, TX)",145,MBA,2025
6343012,597134,Texas Lutheran Bulldogs,597103,Dallas Crusaders,597103,8,bot,M. Elizondo to 3b for A. Peavy.,88,2025-03-15T00:00:00-04:00,"Crusaders Field (Irving, TX)",145,MBA,2025
6343012,597134,Texas Lutheran Bulldogs,597103,Dallas Crusaders,597103,8,bot,B. Sprencel to p.,89,2025-03-15T00:00:00-04:00,"Crusaders Field (Irving, TX)",145,MBA,2025
6343012,597134,Texas Lutheran Bulldogs,597103,Dallas Crusaders,597103,8,bot,V. Prado to dh.,90,2025-03-15T00:00:00-04:00,"Crusaders Field (Irving, TX)",145,MBA,2025
6343012,597134,Texas Lutheran Bulldogs,597103,Dallas Crusaders,597103,8,bot,L. Gill struck out looking.,91,2025-03-15T00:00:00-04:00,"Crusaders Field (Irving, TX)",145,MBA,2025
6343012,597134,Texas Lutheran Bulldogs,597103,Dallas Crusaders,597103,8,bot,"A. Gaspar grounded out to 2b, RBI; Cal. Hohman advanced to third; D. Goddard scored.",92,2025-03-15T00:00:00-04:00,"Crusaders Field (Irving, TX)",145,MBA,2025
6343012,597134,Texas Lutheran Bulldogs,597103,Dallas Crusaders,597103,8,bot,N. Curtis grounded out to ss.,93,2025-03-15T00:00:00-04:00,"Crusaders Field (Irving, TX)",145,MBA,2025
6343012,597134,Texas Lutheran Bulldogs,597103,Dallas Crusaders,597134,9,top,K. Shamburge to p for L. Aguirre.,94,2025-03-15T00:00:00-04:00,"Crusaders Field (Irving, TX)",145,MBA,2025
6343012,597134,Texas Lutheran Bulldogs,597103,Dallas Crusaders,597134,9,top,B. Sprencel walked.,95,2025-03-15T00:00:00-04:00,"Crusaders Field (Irving, TX)",145,MBA,2025
6343012,597134,Texas Lutheran Bulldogs,597103,Dallas Crusaders,597134,9,top,T. Helpensti doubled to right center; B. Sprencel advanced to third.,96,2025-03-15T00:00:00-04:00,"Crusaders Field (Irving, TX)",145,MBA,2025
6343012,597134,Texas Lutheran Bulldogs,597103,Dallas Crusaders,597134,9,top,A. Spires struck out swinging.,97,2025-03-15T00:00:00-04:00,"Crusaders Field (Irving, TX)",145,MBA,2025
6343012,597134,Texas Lutheran Bulldogs,597103,Dallas Crusaders,597134,9,top,"C. Greene flied out to cf, SAC, RBI; B. Sprencel scored.",98,2025-03-15T00:00:00-04:00,"Crusaders Field (Irving, TX)",145,MBA,2025
6343012,597134,Texas Lutheran Bulldogs,597103,Dallas Crusaders,597134,9,top,T. Helpensti advanced to third on a wild pitch.,99,2025-03-15T00:00:00-04:00,"Crusaders Field (Irving, TX)",145,MBA,2025
6343012,597134,Texas Lutheran Bulldogs,597103,Dallas Crusaders,597134,9,top,C. Jen struck out swinging.,100,2025-03-15T00:00:00-04:00,"Crusaders Field (Irving, TX)",145,MBA,2025
6343012,597134,Texas Lutheran Bulldogs,597103,Dallas Crusaders,597103,9,bot,C. Mize singled through the left side.,101,2025-03-15T00:00:00-04:00,"Crusaders Field (Irving, TX)",145,MBA,2025
6343012,597134,Texas Lutheran Bulldogs,597103,Dallas Crusaders,597103,9,bot,W. Alsobrook pinch ran for C. Mize.,102,2025-03-15T00:00:00-04:00,"Crusaders Field (Irving, TX)",145,MBA,2025
6343012,597134,Texas Lutheran Bulldogs,597103,Dallas Crusaders,597103,9,bot,W. Alsobrook out at second c to 2b.,103,2025-03-15T00:00:00-04:00,"Crusaders Field (Irving, TX)",145,MBA,2025
6343012,597134,Texas Lutheran Bulldogs,597103,Dallas Crusaders,597103,9,bot,T. Espinosa struck out swinging.,104,2025-03-15T00:00:00-04:00,"Crusaders Field (Irving, TX)",145,MBA,2025
6343012,597134,Texas Lutheran Bulldogs,597103,Dallas Crusaders,597103,9,bot,D. Roscopf flied out to cf.,105,2025-03-15T00:00:00-04:00,"Crusaders Field (Irving, TX)",145,MBA,2025
