game_id,away_team_id,away_team_name,home_team_id,home_team_name,batting_team,inning,top_bot,event_text,event_num,game_datetime,stadium_name,attendance,sport_id,season
6343501,597171,JWU (Providence) Wildcats,597051,Coast Guard Bears,597171,1,top,"J. Obert homered to right field, RBI.",1,2025-03-18T00:00:00-04:00,"Nitchman Field (New London, CT)",94,MBA,2025
6343501,597171,JWU (Providence) Wildcats,597051,Coast Guard Bears,597171,1,top,R. Ducey grounded out to 2b.,2,2025-03-18T00:00:00-04:00,"Nitchman Field (New London, CT)",94,MBA,2025
6343501,597171,JWU (Providence) Wildcats,597051,Coast Guard Bears,597171,1,top,J. Jimenez reached first on an error by 3b.,3,2025-03-18T00:00:00-04:00,"Nitchman Field (New London, CT)",94,MBA,2025
6343501,597171,JWU (Providence) Wildcats,597051,Coast Guard Bears,597171,1,top,T. Juan struck out looking.,4,2025-03-18T00:00:00-04:00,"Nitchman Field (New London, CT)",94,MBA,2025
6343501,597171,JWU (Providence) Wildcats,597051,Coast Guard Bears,597171,1,top,"J. Jimenez advanced to second on a wild pitch, advanced to third on an error by c.",5,2025-03-18T00:00:00-04:00,"Nitchman Field (New London, CT)",94,MBA,2025
6343501,597171,JWU (Providence) Wildcats,597051,Coast Guard Bears,597171,1,top,Z. Amero flied out to lf.,6,2025-03-18T00:00:00-04:00,"Nitchman Field (New London, CT)",94,MBA,2025
6343501,597171,JWU (Providence) Wildcats,597051,Coast Guard Bears,597051,1,bot,K. Godshalk fouled out to c.,7,2025-03-18T00:00:00-04:00,"Nitchman Field (New London, CT)",94,MBA,2025
6343501,597171,JWU (Providence) Wildcats,597051,Coast Guard Bears,597051,1,bot,C. Cho walked.,8,2025-03-18T00:00:00-04:00,"Nitchman Field (New London, CT)",94,MBA,2025
6343501,597171,JWU (Providence) Wildcats,597051,Coast Guard Bears,597051,1,bot,N. Stafford reached on a fielder's choice; C. Cho out at second 1b to ss.,9,2025-03-18T00:00:00-04:00,"Nitchman Field (New London, CT)",94,MBA,2025
6343501,597171,JWU (Providence) Wildcats,597051,Coast Guard Bears,597051,1,bot,P. Madden struck out swinging.,10,2025-03-18T00:00:00-04:00,"Nitchman Field (New London, CT)",94,MBA,2025
6343501,597171,JWU (Providence) Wildcats,597051,Coast Guard Bears,597171,2,top,O. Davis hit by pitch.,11,2025-03-18T00:00:00-04:00,"Nitchman Field (New London, CT)",94,MBA,2025
6343501,597171,JWU (Providence) Wildcats,597051,Coast Guard Bears,597171,2,top,X. Botelho lined out to lf.,12,2025-03-18T00:00:00-04:00,"Nitchman Field (New London, CT)",94,MBA,2025
6343501,597171,JWU (Providence) Wildcats,597051,Coast Guard Bears,597171,2,top,R. Jean walked; O. Davis advanced to second.,13,2025-03-18T00:00:00-04:00,"Nitchman Field (New London, CT)",94,MBA,2025
6343501,597171,JWU (Providence) Wildcats,597051,Coast Guard Bears,597171,2,top,Y. Diaz grounded into double play 3b to 2b to 1b; R. Jean out on the play.,14,2025-03-18T00:00:00-04:00,"Nitchman Field (New London, CT)",94,MBA,2025
6343501,597171,JWU (Providence) Wildcats,597051,Coast Guard Bears,597051,2,bot,R. Barkley lined out to ss.,15,2025-03-18T00:00:00-04:00,"Nitchman Field (New London, CT)",94,MBA,2025
6343501,597171,JWU (Providence) Wildcats,597051,Coast Guard Bears,597051,2,bot,W. Duthu struck out swinging.,16,2025-03-18T00:00:00-04:00,"Nitchman Field (New London, CT)",94,MBA,2025
6343501,597171,JWU (Providence) Wildcats,597051,Coast Guard Bears,597051,2,bot,A. Gurevich struck out swinging.,17,2025-03-18T00:00:00-04:00,"Nitchman Field (New London, CT)",94,MBA,2025
6343501,597171,JWU (Providence) Wildcats,597051,Coast Guard Bears,597171,3,top,J. Obert popped up to 1b.,18,2025-03-18T00:00:00-04:00,"Nitchman Field (New London, CT)",94,MBA,2025
6343501,597171,JWU (Providence) Wildcats,597051,Coast Guard Bears,597171,3,top,R. Ducey walked.,19,2025-03-18T00:00:00-04:00,"Nitchman Field (New London, CT)",94,MBA,2025
6343501,597171,JWU (Providence) Wildcats,597051,Coast Guard Bears,597171,3,top,"J. Jimenez singled to shortstop, advanced to second on an error by ss; R. Ducey advanced to third.",20,2025-03-18T00:00:00-04:00,"Nitchman Field (New London, CT)",94,MBA,2025
6343501,597171,JWU (Providence) Wildcats,597051,Coast Guard Bears,597171,3,top,"T. Juan singled to center field, 2 RBI; J. Jimenez scored, unearned; R. Ducey scored.",21,2025-03-18T00:00:00-04:00,"Nitchman Field (New London, CT)",94,MBA,2025
6343501,597171,JWU (Providence) Wildcats,597051,Coast Guard Bears,597171,3,top,Z. Amero grounded into double play 2b to ss to 1b; T. Juan out on the play.,22,2025-03-18T00:00:00-04:00,"Nitchman Field (New London, CT)",94,MBA,2025
6343501,597171,JWU (Providence) Wildcats,597051,Coast Guard Bears,597051,3,bot,B. Morin to p for A. Vining.,23,2025-03-18T00:00:00-04:00,"Nitchman Field (New London, CT)",94,MBA,2025
6343501,597171,JWU (Providence) Wildcats,597051,Coast Guard Bears,597051,3,bot,J. Steel flied out to cf.,24,2025-03-18T00:00:00-04:00,"Nitchman Field (New London, CT)",94,MBA,2025
6343501,597171,JWU (Providence) Wildcats,597051,Coast Guard Bears,597051,3,bot,L. Percifiel struck out swinging.,25,2025-03-18T00:00:00-04:00,"Nitchman Field (New London, CT)",94,MBA,2025
6343501,597171,JWU (Providence) Wildcats,597051,Coast Guard Bears,597051,3,bot,K. Godshalk grounded out to ss.,26,2025-03-18T00:00:00-04:00,"Nitchman Field (New London, CT)",94,MBA,2025
6343501,597171,JWU (Providence) Wildcats,597051,Coast Guard Bears,597171,4,top,O. Davis flied out to rf.,27,2025-03-18T00:00:00-04:00,"Nitchman Field (New London, CT)",94,MBA,2025
6343501,597171,JWU (Providence) Wildcats,597051,Coast Guard Bears,597171,4,top,X. Botelho singled to right field.,28,2025-03-18T00:00:00-04:00,"Nitchman Field (New London, CT)",94,MBA,2025
6343501,597171,JWU (Providence) Wildcats,597051,Coast Guard Bears,597171,4,top,"R. Jean struck out swinging; X. Botelho out at second c to 2b, caught stealing.",29,2025-03-18T00:00:00-04:00,"Nitchman Field (New London, CT)",94,MBA,2025
6343501,597171,JWU (Providence) Wildcats,597051,Coast Guard Bears,597051,4,bot,C. Cho grounded out to 2b.,30,2025-03-18T00:00:00-04:00,"Nitchman Field (New London, CT)",94,MBA,2025
6343501,597171,JWU (Providence) Wildcats,597051,Coast Guard Bears,597051,4,bot,N. Stafford hit by pitch.,31,2025-03-18T00:00:00-04:00,"Nitchman Field (New London, CT)",94,MBA,2025
6343501,597171,JWU (Providence) Wildcats,597051,Coast Guard Bears,597051,4,bot,N. Stafford advanced to second on a wild pitch.,32,2025-03-18T00:00:00-04:00,"Nitchman Field (New London, CT)",94,MBA,2025
6343501,597171,JWU (Providence) Wildcats,597051,Coast Guard Bears,597051,4,bot,P. Madden grounded out to ss; N. Stafford advanced to third.,33,2025-03-18T00:00:00-04:00,"Nitchman Field (New London, CT)",94,MBA,2025
6343501,597171,JWU (Providence) Wildcats,597051,Coast Guard Bears,597051,4,bot,R. Barkley struck out swinging.,34,2025-03-18T00:00:00-04:00,"Nitchman Field (New London, CT)",94,MBA,2025
6343501,597171,JWU (Providence) Wildcats,597051,Coast Guard Bears,597171,5,top,S. Rojas to p for H. Milbert.,35,2025-03-18T00:00:00-04:00,"Nitchman Field (New London, CT)",94,MBA,2025
6343501,597171,JWU (Providence) Wildcats,597051,Coast Guard Bears,597171,5,top,Y. Diaz singled to center field.,36,2025-03-18T00:00:00-04:00,"Nitchman Field (New London, CT)",94,MBA,2025
6343501,597171,JWU (Providence) Wildcats,597051,Coast Guard Bears,597171,5,top,"J. Obert struck out swinging; Y. Diaz out at second c to 2b, caught stealing.",37,2025-03-18T00:00:00-04:00,"Nitchman Field (New London, CT)",94,MBA,2025
6343501,597171,JWU (Providence) Wildcats,597051,Coast Guard Bears,597171,5,top,R. Ducey walked.,38,2025-03-18T00:00:00-04:00,"Nitchman Field (New London, CT)",94,MBA,2025
6343501,597171,JWU (Providence) Wildcats,597051,Coast Guard Bears,597171,5,top,J. Jimenez struck out looking.,39,2025-03-18T00:00:00-04:00,"Nitchman Field (New London, CT)",94,MBA,2025
6343501,597171,JWU (Providence) Wildcats,597051,Coast Guard Bears,597051,5,bot,E. Wells to p for B. Morin.,40,2025-03-18T00:00:00-04:00,"Nitchman Field (New London, CT)",94,MBA,2025
6343501,597171,JWU (Providence) Wildcats,597051,Coast Guard Bears,597051,5,bot,W. Duthu grounded out to 2b.,41,2025-03-18T00:00:00-04:00,"Nitchman Field (New London, CT)",94,MBA,2025
6343501,597171,JWU (Providence) Wildcats,597051,Coast Guard Bears,597051,5,bot,A. Gurevich walked.,42,2025-03-18T00:00:00-04:00,"Nitchman Field (New London, CT)",94,MBA,2025
6343501,597171,JWU (Providence) Wildcats,597051,Coast Guard Bears,597051,5,bot,J. Steel grounded into double play ss to 2b to 1b; A. Gurevich out on the play.,43,2025-03-18T00:00:00-04:00,"Nitchman Field (New London, CT)",94,MBA,2025
6343501,597171,JWU (Providence) Wildcats,597051,Coast Guard Bears,597171,6,top,T. Juan grounded out to 2b.,44,2025-03-18T00:00:00-04:00,"Nitchman Field (New London, CT)",94,MBA,2025
6343501,597171,JWU (Providence) Wildcats,597051,Coast Guard Bears,597171,6,top,Z. Amero struck out looking.,45,2025-03-18T00:00:00-04:00,"Nitchman Field (New London, CT)",94,MBA,2025
6343501,597171,JWU (Providence) Wildcats,597051,Coast Guard Bears,597171,6,top,O. Davis struck out swinging.,46,2025-03-18T00:00:00-04:00,"Nitchman Field (New London, CT)",94,MBA,2025
6343501,597171,JWU (Providence) Wildcats,597051,Coast Guard Bears,597051,6,bot,L. Percifiel grounded out to ss.,47,2025-03-18T00:00:00-04:00,"Nitchman Field (New London, CT)",94,MBA,2025
6343501,597171,JWU (Providence) Wildcats,597051,Coast Guard Bears,597051,6,bot,K. Godshalk grounded out to 3b.,48,2025-03-18T00:00:00-04:00,"Nitchman Field (New London, CT)",94,MBA,2025
6343501,597171,JWU (Providence) Wildcats,597051,Coast Guard Bears,597051,6,bot,C. Cho grounded out to 2b.,49,2025-03-18T00:00:00-04:00,"Nitchman Field (New London, CT)",94,MBA,2025
6343501,597171,JWU (Providence) Wildcats,597051,Coast Guard Bears,597171,7,top,X. Botelho singled to left field.,50,2025-03-18T00:00:00-04:00,"Nitchman Field (New London, CT)",94,MBA,2025
6343501,597171,JWU (Providence) Wildcats,597051,Coast Guard Bears,597171,7,top,R. Jean walked; X. Botelho advanced to second.,51,2025-03-18T00:00:00-04:00,"Nitchman Field (New London, CT)",94,MBA,2025
6343501,597171,JWU (Providence) Wildcats,597051,Coast Guard Bears,597171,7,top,"Y. Diaz grounded out to p, SAC; R. Jean advanced to second; X. Botelho advanced to third.",52,2025-03-18T00:00:00-04:00,"Nitchman Field (New London, CT)",94,MBA,2025
6343501,597171,JWU (Providence) Wildcats,597051,Coast Guard Bears,597171,7,top,C. Watts to p for S. Rojas.,53,2025-03-18T00:00:00-04:00,"Nitchman Field (New London, CT)",94,MBA,2025
6343501,597171,JWU (Providence) Wildcats,597051,Coast Guard Bears,597171,7,top,J. Obert walked.,54,2025-03-18T00:00:00-04:00,"Nitchman Field (New London, CT)",94,MBA,2025
6343501,597171,JWU (Providence) Wildcats,597051,Coast Guard Bears,597171,7,top,R. Ducey struck out swinging.,55,2025-03-18T00:00:00-04:00,"Nitchman Field (New London, CT)",94,MBA,2025
6343501,597171,JWU (Providence) Wildcats,597051,Coast Guard Bears,597171,7,top,"J. Jimenez singled to center field, 2 RBI; J. Obert advanced to second; R. Jean scored; X. Botelho scored.",56,2025-03-18T00:00:00-04:00,"Nitchman Field (New London, CT)",94,MBA,2025
6343501,597171,JWU (Providence) Wildcats,597051,Coast Guard Bears,597171,7,top,"T. Juan homered to left center, 3 RBI; J. Jimenez scored; J. Obert scored.",57,2025-03-18T00:00:00-04:00,"Nitchman Field (New London, CT)",94,MBA,2025
6343501,597171,JWU (Providence) Wildcats,597051,Coast Guard Bears,597171,7,top,Z. Amero grounded out to p.,58,2025-03-18T00:00:00-04:00,"Nitchman Field (New London, CT)",94,MBA,2025
6343501,597171,JWU (Providence) Wildcats,597051,Coast Guard Bears,597051,7,bot,G. Fusco to p for E. Wells.,59,2025-03-18T00:00:00-04:00,"Nitchman Field (New London, CT)",94,MBA,2025
6343501,597171,JWU (Providence) Wildcats,597051,Coast Guard Bears,597051,7,bot,N. Stafford popped up to ss.,60,2025-03-18T00:00:00-04:00,"Nitchman Field (New London, CT)",94,MBA,2025
6343501,597171,JWU (Providence) Wildcats,597051,Coast Guard Bears,597051,7,bot,P. Madden doubled to left center.,61,2025-03-18T00:00:00-04:00,"Nitchman Field (New London, CT)",94,MBA,2025
6343501,597171,JWU (Providence) Wildcats,597051,Coast Guard Bears,597051,7,bot,"R. Barkley doubled to left field, RBI; P. Madden scored.",62,2025-03-18T00:00:00-04:00,"Nitchman Field (New London, CT)",94,MBA,2025
6343501,597171,JWU (Providence) Wildcats,597051,Coast Guard Bears,597051,7,bot,R. Barkley advanced to third on a wild pitch.,63,2025-03-18T00:00:00-04:00,"Nitchman Field (New London, CT)",94,MBA,2025
6343501,597171,JWU (Providence) Wildcats,597051,Coast Guard Bears,597051,7,bot,W. Duthu fouled out to c.,64,2025-03-18T00:00:00-04:00,"Nitchman Field (New London, CT)",94,MBA,2025
6343501,597171,JWU (Providence) Wildcats,597051,Coast Guard Bears,597051,7,bot,D. Basque pinch hit for A. Gurevich.,65,2025-03-18T00:00:00-04:00,"Nitchman Field (New London, CT)",94,MBA,2025
6343501,597171,JWU (Providence) Wildcats,597051,Coast Guard Bears,597051,7,bot,D. Basque grounded out to 3b.,66,2025-03-18T00:00:00-04:00,"Nitchman Field (New London, CT)",94,MBA,2025
6343501,597171,JWU (Providence) Wildcats,597051,Coast Guard Bears,597171,8,top,A. Anderson to p for C. Watts.,67,2025-03-18T00:00:00-04:00,"Nitchman Field (New London, CT)",94,MBA,2025
6343501,597171,JWU (Providence) Wildcats,597051,Coast Guard Bears,597171,8,top,O. Davis struck out looking.,68,2025-03-18T00:00:00-04:00,"Nitchman Field (New London, CT)",94,MBA,2025
6343501,597171,JWU (Providence) Wildcats,597051,Coast Guard Bears,597171,8,top,X. Botelho flied out to lf.,69,2025-03-18T00:00:00-04:00,"Nitchman Field (New London, CT)",94,MBA,2025
6343501,597171,JWU (Providence) Wildcats,597051,Coast Guard Bears,597171,8,top,R. Jean struck out looking.,70,2025-03-18T00:00:00-04:00,"Nitchman Field (New London, CT)",94,MBA,2025
6343501,597171,JWU (Providence) Wildcats,597051,Coast Guard Bears,597051,8,bot,J. Steel popped up to rf.,71,2025-03-18T00:00:00-04:00,"Nitchman Field (New London, CT)",94,MBA,2025
6343501,597171,JWU (Providence) Wildcats,597051,Coast Guard Bears,597051,8,bot,L. Percifiel grounded out to ss.,72,2025-03-18T00:00:00-04:00,"Nitchman Field (New London, CT)",94,MBA,2025
6343501,597171,JWU (Providence) Wildcats,597051,Coast Guard Bears,597051,8,bot,K. Godshalk out at first 1b to p.,73,2025-03-18T00:00:00-04:00,"Nitchman Field (New London, CT)",94,MBA,2025
6343501,597171,JWU (Providence) Wildcats,597051,Coast Guard Bears,597171,9,top,B. Dykens to p for A. Anderson.,74,2025-03-18T00:00:00-04:00,"Nitchman Field (New London, CT)",94,MBA,2025
6343501,597171,JWU (Providence) Wildcats,597051,Coast Guard Bears,597171,9,top,I. Hobbs to c for P. Madden.,75,2025-03-18T00:00:00-04:00,"Nitchman Field (New London, CT)",94,MBA,2025
6343501,597171,JWU (Providence) Wildcats,597051,Coast Guard Bears,597171,9,top,Y. Diaz singled to center field.,76,2025-03-18T00:00:00-04:00,"Nitchman Field (New London, CT)",94,MBA,2025
6343501,597171,JWU (Providence) Wildcats,597051,Coast Guard Bears,597171,9,top,J. Obert walked; Y. Diaz advanced to second.,77,2025-03-18T00:00:00-04:00,"Nitchman Field (New London, CT)",94,MBA,2025
6343501,597171,JWU (Providence) Wildcats,597051,Coast Guard Bears,597171,9,top,Y. Diaz advanced to third on the throw.,78,2025-03-18T00:00:00-04:00,"Nitchman Field (New London, CT)",94,MBA,2025
6343501,597171,JWU (Providence) Wildcats,597051,Coast Guard Bears,597171,9,top,R. Ducey grounded into double play 2b to ss to 1b; J. Obert out on the play; Y. Diaz scored.,79,2025-03-18T00:00:00-04:00,"Nitchman Field (New London, CT)",94,MBA,2025
6343501,597171,JWU (Providence) Wildcats,597051,Coast Guard Bears,597171,9,top,J. Jimenez singled to left field.,80,2025-03-18T00:00:00-04:00,"Nitchman Field (New London, CT)",94,MBA,2025
6343501,597171,JWU (Providence) Wildcats,597051,Coast Guard Bears,597171,9,top,T. Juan singled to right field; J. Jimenez advanced to second.,81,2025-03-18T00:00:00-04:00,"Nitchman Field (New London, CT)",94,MBA,2025
6343501,597171,JWU (Providence) Wildcats,597051,Coast Guard Bears,597171,9,top,Z. Amero walked; T. Juan advanced to second; J. Jimenez advanced to third.,82,2025-03-18T00:00:00-04:00,"Nitchman Field (New London, CT)",94,MBA,2025
6343501,597171,JWU (Providence) Wildcats,597051,Coast Guard Bears,597171,9,top,O. Davis struck out swinging.,83,2025-03-18T00:00:00-04:00,"Nitchman Field (New London, CT)",94,MBA,2025
6343501,597171,JWU (Providence) Wildcats,597051,Coast Guard Bears,597051,9,bot,E. LaMothe to p for G. Fusco.,84,2025-03-18T00:00:00-04:00,"Nitchman Field (New London, CT)",94,MBA,2025
6343501,597171,JWU (Providence) Wildcats,597051,Coast Guard Bears,597051,9,bot,M. Phillips pinch hit for C. Cho.,85,2025-03-18T00:00:00-04:00,"Nitchman Field (New London, CT)",94,MBA,2025
6343501,597171,JWU (Providence) Wildcats,597051,Coast Guard Bears,597051,9,bot,M. Phillips grounded out to 2b.,86,2025-03-18T00:00:00-04:00,"Nitchman Field (New London, CT)",94,MBA,2025
6343501,597171,JWU (Providence) Wildcats,597051,Coast Guard Bears,597051,9,bot,C. Cilento pinch hit for N. Stafford.,87,2025-03-18T00:00:00-04:00,"Nitchman Field (New London, CT)",94,MBA,2025
6343501,597171,JWU (Providence) Wildcats,597051,Coast Guard Bears,597051,9,bot,C. Cilento struck out swinging.,88,2025-03-18T00:00:00-04:00,"Nitchman Field (New London, CT)",94,MBA,2025
6343501,597171,JWU (Providence) Wildcats,597051,Coast Guard Bears,597051,9,bot,I. Hobbs singled to right field.,89,2025-03-18T00:00:00-04:00,"Nitchman Field (New London, CT)",94,MBA,2025
6343501,597171,JWU (Providence) Wildcats,597051,Coast Guard Bears,597051,9,bot,T. Scherer pinch hit for R. Barkley.,90,2025-03-18T00:00:00-04:00,"Nitchman Field (New London, CT)",94,MBA,2025
6343501,597171,JWU (Providence) Wildcats,597051,Coast Guard Bears,597051,9,bot,T. Scherer grounded out to ss.,91,2025-03-18T00:00:00-04:00,"Nitchman Field (New London, CT)",94,MBA,2025
