game_id,away_team_id,away_team_name,home_team_id,home_team_name,batting_team,inning,top_bot,event_text,event_num,game_datetime,stadium_name,attendance,sport_id,season
6343024,597244,VTSU Castleton Spartans,597126,Neumann Knights,597244,1,top,T. Dubreuil doubled to center field.,1,2025-03-15T00:00:00-04:00,"Bruder Baseball Field (Aston, PA)",200,MBA,2025
6343024,597244,VTSU Castleton Spartans,597126,Neumann Knights,597244,1,top,J. Boyle popped up to 3b.,2,2025-03-15T00:00:00-04:00,"Bruder Baseball Field (Aston, PA)",200,MBA,2025
6343024,597244,VTSU Castleton Spartans,597126,Neumann Knights,597244,1,top,J. Cardozo struck out swinging.,3,2025-03-15T00:00:00-04:00,"Bruder Baseball Field (Aston, PA)",200,MBA,2025
6343024,597244,VTSU Castleton Spartans,597126,Neumann Knights,597244,1,top,T. McLain struck out swinging.,4,2025-03-15T00:00:00-04:00,"Bruder Baseball Field (Aston, PA)",200,MBA,2025
6343024,597244,VTSU Castleton Spartans,597126,Neumann Knights,597126,1,bot,D. Brooks grounded out to 2b.,5,2025-03-15T00:00:00-04:00,"Bruder Baseball Field (Aston, PA)",200,MBA,2025
6343024,597244,VTSU Castleton Spartans,597126,Neumann Knights,597126,1,bot,A. Nardo doubled through the right side.,6,2025-03-15T00:00:00-04:00,"Bruder Baseball Field (Aston, PA)",200,MBA,2025
6343024,597244,VTSU Castleton Spartans,597126,Neumann Knights,597126,1,bot,A. Rakotz walked.,7,2025-03-15T00:00:00-04:00,"Bruder Baseball Field (Aston, PA)",200,MBA,2025
6343024,597244,VTSU Castleton Spartans,597126,Neumann Knights,597126,1,bot,"J. Boccio doubled to right field, 2 RBI3a A. Rakotz scored3a A. Nardo scored.",8,2025-03-15T00:00:00-04:00,"Bruder Baseball Field (Aston, PA)",200,MBA,2025
6343024,597244,VTSU Castleton Spartans,597126,Neumann Knights,597126,1,bot,A. Brown flied out to cf.,9,2025-03-15T00:00:00-04:00,"Bruder Baseball Field (Aston, PA)",200,MBA,2025
6343024,597244,VTSU Castleton Spartans,597126,Neumann Knights,597126,1,bot,J. Finger grounded out to 3b.,10,2025-03-15T00:00:00-04:00,"Bruder Baseball Field (Aston, PA)",200,MBA,2025
6343024,597244,VTSU Castleton Spartans,597126,Neumann Knights,597244,2,top,T. Shaw flied out to lf.,11,2025-03-15T00:00:00-04:00,"Bruder Baseball Field (Aston, PA)",200,MBA,2025
6343024,597244,VTSU Castleton Spartans,597126,Neumann Knights,597244,2,top,B. Ramirez struck out swinging.,12,2025-03-15T00:00:00-04:00,"Bruder Baseball Field (Aston, PA)",200,MBA,2025
6343024,597244,VTSU Castleton Spartans,597126,Neumann Knights,597244,2,top,J. Maher reached first on a fielding error by 1b.,13,2025-03-15T00:00:00-04:00,"Bruder Baseball Field (Aston, PA)",200,MBA,2025
6343024,597244,VTSU Castleton Spartans,597126,Neumann Knights,597244,2,top,T. Clews flied out to rf.,14,2025-03-15T00:00:00-04:00,"Bruder Baseball Field (Aston, PA)",200,MBA,2025
6343024,597244,VTSU Castleton Spartans,597126,Neumann Knights,597126,2,bot,C. Balshuwei popped up to 1b.,15,2025-03-15T00:00:00-04:00,"Bruder Baseball Field (Aston, PA)",200,MBA,2025
6343024,597244,VTSU Castleton Spartans,597126,Neumann Knights,597126,2,bot,T. Carroll walked.,16,2025-03-15T00:00:00-04:00,"Bruder Baseball Field (Aston, PA)",200,MBA,2025
6343024,597244,VTSU Castleton Spartans,597126,Neumann Knights,597126,2,bot,"B. Colon doubled to left center, RBI3a T. Carroll scored.",17,2025-03-15T00:00:00-04:00,"Bruder Baseball Field (Aston, PA)",200,MBA,2025
6343024,597244,VTSU Castleton Spartans,597126,Neumann Knights,597126,2,bot,"B. Colon out at second c to ss, picked off.",18,2025-03-15T00:00:00-04:00,"Bruder Baseball Field (Aston, PA)",200,MBA,2025
6343024,597244,VTSU Castleton Spartans,597126,Neumann Knights,597126,2,bot,D. Brooks walked.,19,2025-03-15T00:00:00-04:00,"Bruder Baseball Field (Aston, PA)",200,MBA,2025
6343024,597244,VTSU Castleton Spartans,597126,Neumann Knights,597126,2,bot,D. Brooks stole second.,20,2025-03-15T00:00:00-04:00,"Bruder Baseball Field (Aston, PA)",200,MBA,2025
6343024,597244,VTSU Castleton Spartans,597126,Neumann Knights,597126,2,bot,D. Brooks stole third.,21,2025-03-15T00:00:00-04:00,"Bruder Baseball Field (Aston, PA)",200,MBA,2025
6343024,597244,VTSU Castleton Spartans,597126,Neumann Knights,597126,2,bot,A. Nardo struck out looking.,22,2025-03-15T00:00:00-04:00,"Bruder Baseball Field (Aston, PA)",200,MBA,2025
6343024,597244,VTSU Castleton Spartans,597126,Neumann Knights,597244,3,top,"Raby, Jr flied out to rf.",23,2025-03-15T00:00:00-04:00,"Bruder Baseball Field (Aston, PA)",200,MBA,2025
6343024,597244,VTSU Castleton Spartans,597126,Neumann Knights,597244,3,top,T. Dubreuil flied out to lf.,24,2025-03-15T00:00:00-04:00,"Bruder Baseball Field (Aston, PA)",200,MBA,2025
6343024,597244,VTSU Castleton Spartans,597126,Neumann Knights,597244,3,top,J. Boyle struck out looking.,25,2025-03-15T00:00:00-04:00,"Bruder Baseball Field (Aston, PA)",200,MBA,2025
6343024,597244,VTSU Castleton Spartans,597126,Neumann Knights,597126,3,bot,A. Rakotz grounded out to ss.,26,2025-03-15T00:00:00-04:00,"Bruder Baseball Field (Aston, PA)",200,MBA,2025
6343024,597244,VTSU Castleton Spartans,597126,Neumann Knights,597126,3,bot,J. Boccio grounded out to 2b.,27,2025-03-15T00:00:00-04:00,"Bruder Baseball Field (Aston, PA)",200,MBA,2025
6343024,597244,VTSU Castleton Spartans,597126,Neumann Knights,597126,3,bot,A. Brown reached first on a fielding error by ss.,28,2025-03-15T00:00:00-04:00,"Bruder Baseball Field (Aston, PA)",200,MBA,2025
6343024,597244,VTSU Castleton Spartans,597126,Neumann Knights,597126,3,bot,J. Finger reached first on a throwing error by 3b3a A. Brown advanced to third.,29,2025-03-15T00:00:00-04:00,"Bruder Baseball Field (Aston, PA)",200,MBA,2025
6343024,597244,VTSU Castleton Spartans,597126,Neumann Knights,597126,3,bot,J. Finger stole second.,30,2025-03-15T00:00:00-04:00,"Bruder Baseball Field (Aston, PA)",200,MBA,2025
6343024,597244,VTSU Castleton Spartans,597126,Neumann Knights,597126,3,bot,C. Balshuwei walked.,31,2025-03-15T00:00:00-04:00,"Bruder Baseball Field (Aston, PA)",200,MBA,2025
6343024,597244,VTSU Castleton Spartans,597126,Neumann Knights,597126,3,bot,T. Carroll flied out to cf.,32,2025-03-15T00:00:00-04:00,"Bruder Baseball Field (Aston, PA)",200,MBA,2025
6343024,597244,VTSU Castleton Spartans,597126,Neumann Knights,597244,4,top,J. Cardozo grounded out to ss.,33,2025-03-15T00:00:00-04:00,"Bruder Baseball Field (Aston, PA)",200,MBA,2025
6343024,597244,VTSU Castleton Spartans,597126,Neumann Knights,597244,4,top,T. McLain grounded out to ss.,34,2025-03-15T00:00:00-04:00,"Bruder Baseball Field (Aston, PA)",200,MBA,2025
6343024,597244,VTSU Castleton Spartans,597126,Neumann Knights,597244,4,top,T. Shaw flied out to lf.,35,2025-03-15T00:00:00-04:00,"Bruder Baseball Field (Aston, PA)",200,MBA,2025
6343024,597244,VTSU Castleton Spartans,597126,Neumann Knights,597126,4,bot,"B. Colon grounded out to c, bunt.",36,2025-03-15T00:00:00-04:00,"Bruder Baseball Field (Aston, PA)",200,MBA,2025
6343024,597244,VTSU Castleton Spartans,597126,Neumann Knights,597126,4,bot,D. Brooks grounded out to 3b.,37,2025-03-15T00:00:00-04:00,"Bruder Baseball Field (Aston, PA)",200,MBA,2025
6343024,597244,VTSU Castleton Spartans,597126,Neumann Knights,597126,4,bot,A. Nardo singled up the middle.,38,2025-03-15T00:00:00-04:00,"Bruder Baseball Field (Aston, PA)",200,MBA,2025
6343024,597244,VTSU Castleton Spartans,597126,Neumann Knights,597126,4,bot,A. Rakotz fouled out to c.,39,2025-03-15T00:00:00-04:00,"Bruder Baseball Field (Aston, PA)",200,MBA,2025
6343024,597244,VTSU Castleton Spartans,597126,Neumann Knights,597244,5,top,B. Ramirez grounded out to 2b.,40,2025-03-15T00:00:00-04:00,"Bruder Baseball Field (Aston, PA)",200,MBA,2025
6343024,597244,VTSU Castleton Spartans,597126,Neumann Knights,597244,5,top,J. Maher flied out to cf.,41,2025-03-15T00:00:00-04:00,"Bruder Baseball Field (Aston, PA)",200,MBA,2025
6343024,597244,VTSU Castleton Spartans,597126,Neumann Knights,597244,5,top,T. Clews flied out to lf.,42,2025-03-15T00:00:00-04:00,"Bruder Baseball Field (Aston, PA)",200,MBA,2025
6343024,597244,VTSU Castleton Spartans,597126,Neumann Knights,597126,5,bot,J. Boccio flied out to cf.,43,2025-03-15T00:00:00-04:00,"Bruder Baseball Field (Aston, PA)",200,MBA,2025
6343024,597244,VTSU Castleton Spartans,597126,Neumann Knights,597126,5,bot,A. Brown grounded out to 3b.,44,2025-03-15T00:00:00-04:00,"Bruder Baseball Field (Aston, PA)",200,MBA,2025
6343024,597244,VTSU Castleton Spartans,597126,Neumann Knights,597126,5,bot,J. Finger walked.,45,2025-03-15T00:00:00-04:00,"Bruder Baseball Field (Aston, PA)",200,MBA,2025
6343024,597244,VTSU Castleton Spartans,597126,Neumann Knights,597126,5,bot,C. Balshuwei reached on a fielder's choice to third base3a J. Finger advanced to second on a throwing error by 3b.,46,2025-03-15T00:00:00-04:00,"Bruder Baseball Field (Aston, PA)",200,MBA,2025
6343024,597244,VTSU Castleton Spartans,597126,Neumann Knights,597126,5,bot,T. Carroll grounded out to 1b unassisted.,47,2025-03-15T00:00:00-04:00,"Bruder Baseball Field (Aston, PA)",200,MBA,2025
6343024,597244,VTSU Castleton Spartans,597126,Neumann Knights,597244,6,top,J. Shuler to p for J. Valentine.,48,2025-03-15T00:00:00-04:00,"Bruder Baseball Field (Aston, PA)",200,MBA,2025
6343024,597244,VTSU Castleton Spartans,597126,Neumann Knights,597244,6,top,"Raby, Jr walked.",49,2025-03-15T00:00:00-04:00,"Bruder Baseball Field (Aston, PA)",200,MBA,2025
6343024,597244,VTSU Castleton Spartans,597126,Neumann Knights,597244,6,top,"T. Dubreuil hit by pitch3a Raby, Jr advanced to second.",50,2025-03-15T00:00:00-04:00,"Bruder Baseball Field (Aston, PA)",200,MBA,2025
6343024,597244,VTSU Castleton Spartans,597126,Neumann Knights,597244,6,top,J. Boyle struck out looking.,51,2025-03-15T00:00:00-04:00,"Bruder Baseball Field (Aston, PA)",200,MBA,2025
6343024,597244,VTSU Castleton Spartans,597126,Neumann Knights,597244,6,top,"J. Cardozo singled through the right side, RBI3a T. Dubreuil advanced to second, advanced to third on the throw3a Raby, Jr scored.",52,2025-03-15T00:00:00-04:00,"Bruder Baseball Field (Aston, PA)",200,MBA,2025
6343024,597244,VTSU Castleton Spartans,597126,Neumann Knights,597244,6,top,R. Carrier to p for J. Shuler.,53,2025-03-15T00:00:00-04:00,"Bruder Baseball Field (Aston, PA)",200,MBA,2025
6343024,597244,VTSU Castleton Spartans,597126,Neumann Knights,597244,6,top,T. McLain fouled out to 1b.,54,2025-03-15T00:00:00-04:00,"Bruder Baseball Field (Aston, PA)",200,MBA,2025
6343024,597244,VTSU Castleton Spartans,597126,Neumann Knights,597244,6,top,T. Shaw hit by pitch3a J. Cardozo advanced to second.,55,2025-03-15T00:00:00-04:00,"Bruder Baseball Field (Aston, PA)",200,MBA,2025
6343024,597244,VTSU Castleton Spartans,597126,Neumann Knights,597244,6,top,B. Ramirez struck out swinging.,56,2025-03-15T00:00:00-04:00,"Bruder Baseball Field (Aston, PA)",200,MBA,2025
6343024,597244,VTSU Castleton Spartans,597126,Neumann Knights,597126,6,bot,B. Shader to 3b for T. McLain.,57,2025-03-15T00:00:00-04:00,"Bruder Baseball Field (Aston, PA)",200,MBA,2025
6343024,597244,VTSU Castleton Spartans,597126,Neumann Knights,597126,6,bot,B. Colon grounded out to ss.,58,2025-03-15T00:00:00-04:00,"Bruder Baseball Field (Aston, PA)",200,MBA,2025
6343024,597244,VTSU Castleton Spartans,597126,Neumann Knights,597126,6,bot,D. Brooks popped up to ss.,59,2025-03-15T00:00:00-04:00,"Bruder Baseball Field (Aston, PA)",200,MBA,2025
6343024,597244,VTSU Castleton Spartans,597126,Neumann Knights,597126,6,bot,A. Nardo grounded out to ss.,60,2025-03-15T00:00:00-04:00,"Bruder Baseball Field (Aston, PA)",200,MBA,2025
6343024,597244,VTSU Castleton Spartans,597126,Neumann Knights,597244,7,top,J. Maher struck out looking.,61,2025-03-15T00:00:00-04:00,"Bruder Baseball Field (Aston, PA)",200,MBA,2025
6343024,597244,VTSU Castleton Spartans,597126,Neumann Knights,597244,7,top,T. Clews walked.,62,2025-03-15T00:00:00-04:00,"Bruder Baseball Field (Aston, PA)",200,MBA,2025
6343024,597244,VTSU Castleton Spartans,597126,Neumann Knights,597244,7,top,"Raby, Jr fouled out to ss3a T. Clews advanced to second.",63,2025-03-15T00:00:00-04:00,"Bruder Baseball Field (Aston, PA)",200,MBA,2025
6343024,597244,VTSU Castleton Spartans,597126,Neumann Knights,597244,7,top,"T. Dubreuil struck out swinging, out at first c to 1b.",64,2025-03-15T00:00:00-04:00,"Bruder Baseball Field (Aston, PA)",200,MBA,2025
