game_id,away_team_id,away_team_name,home_team_id,home_team_name,batting_team,inning,top_bot,event_text,event_num,game_datetime,stadium_name,attendance,sport_id,season
6343348,597217,Augsburg Auggies,597067,Wesleyan (CT) Cardinals,597217,1,top,S. Regguinti singled to right field.,1,2025-03-16T00:00:00-04:00,"Parade Stadium (Minneapolis, MN)",0,MBA,2025
6343348,597217,Augsburg Auggies,597067,Wesleyan (CT) Cardinals,597217,1,top,J. Sivoravon struck out swinging.,2,2025-03-16T00:00:00-04:00,"Parade Stadium (Minneapolis, MN)",0,MBA,2025
6343348,597217,Augsburg Auggies,597067,Wesleyan (CT) Cardinals,597217,1,top,S. Regguinti stole second.,3,2025-03-16T00:00:00-04:00,"Parade Stadium (Minneapolis, MN)",0,MBA,2025
6343348,597217,Augsburg Auggies,597067,Wesleyan (CT) Cardinals,597217,1,top,A. Vela struck out swinging.,4,2025-03-16T00:00:00-04:00,"Parade Stadium (Minneapolis, MN)",0,MBA,2025
6343348,597217,Augsburg Auggies,597067,Wesleyan (CT) Cardinals,597217,1,top,A. Marshall struck out swinging.,5,2025-03-16T00:00:00-04:00,"Parade Stadium (Minneapolis, MN)",0,MBA,2025
6343348,597217,Augsburg Auggies,597067,Wesleyan (CT) Cardinals,597067,1,bot,E. Little walked.,6,2025-03-16T00:00:00-04:00,"Parade Stadium (Minneapolis, MN)",0,MBA,2025
6343348,597217,Augsburg Auggies,597067,Wesleyan (CT) Cardinals,597067,1,bot,E. Little stole second.,7,2025-03-16T00:00:00-04:00,"Parade Stadium (Minneapolis, MN)",0,MBA,2025
6343348,597217,Augsburg Auggies,597067,Wesleyan (CT) Cardinals,597067,1,bot,J. Carpenter walked.,8,2025-03-16T00:00:00-04:00,"Parade Stadium (Minneapolis, MN)",0,MBA,2025
6343348,597217,Augsburg Auggies,597067,Wesleyan (CT) Cardinals,597067,1,bot,J. Carpenter stole second3a E. Little stole third.,9,2025-03-16T00:00:00-04:00,"Parade Stadium (Minneapolis, MN)",0,MBA,2025
6343348,597217,Augsburg Auggies,597067,Wesleyan (CT) Cardinals,597067,1,bot,E. Diaz popped up to ss.,10,2025-03-16T00:00:00-04:00,"Parade Stadium (Minneapolis, MN)",0,MBA,2025
6343348,597217,Augsburg Auggies,597067,Wesleyan (CT) Cardinals,597067,1,bot,"J. Timmons singled to center field, 2 RBI3a J. Carpenter scored3a E. Little scored.",11,2025-03-16T00:00:00-04:00,"Parade Stadium (Minneapolis, MN)",0,MBA,2025
6343348,597217,Augsburg Auggies,597067,Wesleyan (CT) Cardinals,597067,1,bot,J. Timmons Failed pickoff attempt.,12,2025-03-16T00:00:00-04:00,"Parade Stadium (Minneapolis, MN)",0,MBA,2025
6343348,597217,Augsburg Auggies,597067,Wesleyan (CT) Cardinals,597067,1,bot,"T. Ashkinos struck out swinging3a J. Timmons out at second c to 2b, caught stealing.",13,2025-03-16T00:00:00-04:00,"Parade Stadium (Minneapolis, MN)",0,MBA,2025
6343348,597217,Augsburg Auggies,597067,Wesleyan (CT) Cardinals,597217,2,top,J. Udelhofen flied out to rf.,14,2025-03-16T00:00:00-04:00,"Parade Stadium (Minneapolis, MN)",0,MBA,2025
6343348,597217,Augsburg Auggies,597067,Wesleyan (CT) Cardinals,597217,2,top,T. Lapoint struck out swinging.,15,2025-03-16T00:00:00-04:00,"Parade Stadium (Minneapolis, MN)",0,MBA,2025
6343348,597217,Augsburg Auggies,597067,Wesleyan (CT) Cardinals,597217,2,top,C. Schmidtz grounded out to ss.,16,2025-03-16T00:00:00-04:00,"Parade Stadium (Minneapolis, MN)",0,MBA,2025
6343348,597217,Augsburg Auggies,597067,Wesleyan (CT) Cardinals,597067,2,bot,L. LaSaracin popped up to c.,17,2025-03-16T00:00:00-04:00,"Parade Stadium (Minneapolis, MN)",0,MBA,2025
6343348,597217,Augsburg Auggies,597067,Wesleyan (CT) Cardinals,597067,2,bot,"J. Acker singled to catcher, advanced to second on an error by c.",18,2025-03-16T00:00:00-04:00,"Parade Stadium (Minneapolis, MN)",0,MBA,2025
6343348,597217,Augsburg Auggies,597067,Wesleyan (CT) Cardinals,597067,2,bot,"M. Jang singled to center field, RBI3a J. Acker scored.",19,2025-03-16T00:00:00-04:00,"Parade Stadium (Minneapolis, MN)",0,MBA,2025
6343348,597217,Augsburg Auggies,597067,Wesleyan (CT) Cardinals,597067,2,bot,J. Marsden grounded into double play lf to p3a M. Jang out on the play.,20,2025-03-16T00:00:00-04:00,"Parade Stadium (Minneapolis, MN)",0,MBA,2025
6343348,597217,Augsburg Auggies,597067,Wesleyan (CT) Cardinals,597217,3,top,D. Jenkins struck out swinging.,21,2025-03-16T00:00:00-04:00,"Parade Stadium (Minneapolis, MN)",0,MBA,2025
6343348,597217,Augsburg Auggies,597067,Wesleyan (CT) Cardinals,597217,3,top,"D. Wick singled to catcher, advanced to second on an error by c.",22,2025-03-16T00:00:00-04:00,"Parade Stadium (Minneapolis, MN)",0,MBA,2025
6343348,597217,Augsburg Auggies,597067,Wesleyan (CT) Cardinals,597217,3,top,S. Regguinti grounded out to 3b3a D. Wick advanced to third.,23,2025-03-16T00:00:00-04:00,"Parade Stadium (Minneapolis, MN)",0,MBA,2025
6343348,597217,Augsburg Auggies,597067,Wesleyan (CT) Cardinals,597217,3,top,J. Sivoravon struck out swinging.,24,2025-03-16T00:00:00-04:00,"Parade Stadium (Minneapolis, MN)",0,MBA,2025
6343348,597217,Augsburg Auggies,597067,Wesleyan (CT) Cardinals,597067,3,bot,E. Little flied out to cf.,25,2025-03-16T00:00:00-04:00,"Parade Stadium (Minneapolis, MN)",0,MBA,2025
6343348,597217,Augsburg Auggies,597067,Wesleyan (CT) Cardinals,597067,3,bot,J. Carpenter grounded out to 2b.,26,2025-03-16T00:00:00-04:00,"Parade Stadium (Minneapolis, MN)",0,MBA,2025
6343348,597217,Augsburg Auggies,597067,Wesleyan (CT) Cardinals,597067,3,bot,E. Diaz tripled to center field.,27,2025-03-16T00:00:00-04:00,"Parade Stadium (Minneapolis, MN)",0,MBA,2025
6343348,597217,Augsburg Auggies,597067,Wesleyan (CT) Cardinals,597067,3,bot,J. Timmons lined out to 2b.,28,2025-03-16T00:00:00-04:00,"Parade Stadium (Minneapolis, MN)",0,MBA,2025
6343348,597217,Augsburg Auggies,597067,Wesleyan (CT) Cardinals,597217,4,top,A. Vela walked.,29,2025-03-16T00:00:00-04:00,"Parade Stadium (Minneapolis, MN)",0,MBA,2025
6343348,597217,Augsburg Auggies,597067,Wesleyan (CT) Cardinals,597217,4,top,A. Marshall walked3a A. Vela advanced to second.,30,2025-03-16T00:00:00-04:00,"Parade Stadium (Minneapolis, MN)",0,MBA,2025
6343348,597217,Augsburg Auggies,597067,Wesleyan (CT) Cardinals,597217,4,top,A. Vela Failed pickoff attempt.,31,2025-03-16T00:00:00-04:00,"Parade Stadium (Minneapolis, MN)",0,MBA,2025
6343348,597217,Augsburg Auggies,597067,Wesleyan (CT) Cardinals,597217,4,top,J. Udelhofen walked3a A. Marshall advanced to second3a A. Vela advanced to third.,32,2025-03-16T00:00:00-04:00,"Parade Stadium (Minneapolis, MN)",0,MBA,2025
6343348,597217,Augsburg Auggies,597067,Wesleyan (CT) Cardinals,597217,4,top,T. Lapoint grounded into double play rf to 2b to 3b to ss to c3a A. Vela out on the play.,33,2025-03-16T00:00:00-04:00,"Parade Stadium (Minneapolis, MN)",0,MBA,2025
6343348,597217,Augsburg Auggies,597067,Wesleyan (CT) Cardinals,597217,4,top,J. Udelhofen advanced to second3a A. Marshall advanced to third.,34,2025-03-16T00:00:00-04:00,"Parade Stadium (Minneapolis, MN)",0,MBA,2025
6343348,597217,Augsburg Auggies,597067,Wesleyan (CT) Cardinals,597217,4,top,C. Schmidtz hit by pitch.,35,2025-03-16T00:00:00-04:00,"Parade Stadium (Minneapolis, MN)",0,MBA,2025
6343348,597217,Augsburg Auggies,597067,Wesleyan (CT) Cardinals,597217,4,top,D. Jenkins struck out swinging.,36,2025-03-16T00:00:00-04:00,"Parade Stadium (Minneapolis, MN)",0,MBA,2025
6343348,597217,Augsburg Auggies,597067,Wesleyan (CT) Cardinals,597067,4,bot,T. Ashkinos popped up to rf.,37,2025-03-16T00:00:00-04:00,"Parade Stadium (Minneapolis, MN)",0,MBA,2025
6343348,597217,Augsburg Auggies,597067,Wesleyan (CT) Cardinals,597067,4,bot,L. LaSaracin struck out swinging.,38,2025-03-16T00:00:00-04:00,"Parade Stadium (Minneapolis, MN)",0,MBA,2025
6343348,597217,Augsburg Auggies,597067,Wesleyan (CT) Cardinals,597067,4,bot,J. Acker singled to center field.,39,2025-03-16T00:00:00-04:00,"Parade Stadium (Minneapolis, MN)",0,MBA,2025
6343348,597217,Augsburg Auggies,597067,Wesleyan (CT) Cardinals,597067,4,bot,"M. Jang reached on a fielder's choice, out at second 2b to ss3a J. Acker advanced to second.",40,2025-03-16T00:00:00-04:00,"Parade Stadium (Minneapolis, MN)",0,MBA,2025
6343348,597217,Augsburg Auggies,597067,Wesleyan (CT) Cardinals,597217,5,top,L. Frattone to p for K. Brown.,41,2025-03-16T00:00:00-04:00,"Parade Stadium (Minneapolis, MN)",0,MBA,2025
6343348,597217,Augsburg Auggies,597067,Wesleyan (CT) Cardinals,597217,5,top,D. Wick singled to center field.,42,2025-03-16T00:00:00-04:00,"Parade Stadium (Minneapolis, MN)",0,MBA,2025
6343348,597217,Augsburg Auggies,597067,Wesleyan (CT) Cardinals,597217,5,top,S. Regguinti singled to left field3a D. Wick advanced to second.,43,2025-03-16T00:00:00-04:00,"Parade Stadium (Minneapolis, MN)",0,MBA,2025
6343348,597217,Augsburg Auggies,597067,Wesleyan (CT) Cardinals,597217,5,top,D. Wick Failed pickoff attempt.,44,2025-03-16T00:00:00-04:00,"Parade Stadium (Minneapolis, MN)",0,MBA,2025
6343348,597217,Augsburg Auggies,597067,Wesleyan (CT) Cardinals,597217,5,top,S. Regguinti advanced to second3a D. Wick advanced to third on a wild pitch.,45,2025-03-16T00:00:00-04:00,"Parade Stadium (Minneapolis, MN)",0,MBA,2025
6343348,597217,Augsburg Auggies,597067,Wesleyan (CT) Cardinals,597217,5,top,J. Sivoravon walked.,46,2025-03-16T00:00:00-04:00,"Parade Stadium (Minneapolis, MN)",0,MBA,2025
6343348,597217,Augsburg Auggies,597067,Wesleyan (CT) Cardinals,597217,5,top,"A. Vela lined out to cf, RBI3a D. Wick scored.",47,2025-03-16T00:00:00-04:00,"Parade Stadium (Minneapolis, MN)",0,MBA,2025
6343348,597217,Augsburg Auggies,597067,Wesleyan (CT) Cardinals,597217,5,top,A. Marshall struck out swinging.,48,2025-03-16T00:00:00-04:00,"Parade Stadium (Minneapolis, MN)",0,MBA,2025
6343348,597217,Augsburg Auggies,597067,Wesleyan (CT) Cardinals,597217,5,top,J. Sivoravon stole second3a S. Regguinti stole third.,49,2025-03-16T00:00:00-04:00,"Parade Stadium (Minneapolis, MN)",0,MBA,2025
6343348,597217,Augsburg Auggies,597067,Wesleyan (CT) Cardinals,597217,5,top,"J. Udelhofen reached first on an error by 3b, RBI3a S. Regguinti scored.",50,2025-03-16T00:00:00-04:00,"Parade Stadium (Minneapolis, MN)",0,MBA,2025
6343348,597217,Augsburg Auggies,597067,Wesleyan (CT) Cardinals,597217,5,top,T. Lapoint lined out to lf.,51,2025-03-16T00:00:00-04:00,"Parade Stadium (Minneapolis, MN)",0,MBA,2025
6343348,597217,Augsburg Auggies,597067,Wesleyan (CT) Cardinals,597067,5,bot,J. Marsden doubled to center field.,52,2025-03-16T00:00:00-04:00,"Parade Stadium (Minneapolis, MN)",0,MBA,2025
6343348,597217,Augsburg Auggies,597067,Wesleyan (CT) Cardinals,597067,5,bot,E. Little walked.,53,2025-03-16T00:00:00-04:00,"Parade Stadium (Minneapolis, MN)",0,MBA,2025
6343348,597217,Augsburg Auggies,597067,Wesleyan (CT) Cardinals,597067,5,bot,E. Little stole second3a J. Marsden stole third.,54,2025-03-16T00:00:00-04:00,"Parade Stadium (Minneapolis, MN)",0,MBA,2025
6343348,597217,Augsburg Auggies,597067,Wesleyan (CT) Cardinals,597067,5,bot,"J. Carpenter singled to right field, 2 RBI3a E. Little scored3a J. Marsden scored.",55,2025-03-16T00:00:00-04:00,"Parade Stadium (Minneapolis, MN)",0,MBA,2025
6343348,597217,Augsburg Auggies,597067,Wesleyan (CT) Cardinals,597067,5,bot,N. Allbee to p for D. Adams.,56,2025-03-16T00:00:00-04:00,"Parade Stadium (Minneapolis, MN)",0,MBA,2025
6343348,597217,Augsburg Auggies,597067,Wesleyan (CT) Cardinals,597067,5,bot,J. Carpenter Failed pickoff attempt.,57,2025-03-16T00:00:00-04:00,"Parade Stadium (Minneapolis, MN)",0,MBA,2025
6343348,597217,Augsburg Auggies,597067,Wesleyan (CT) Cardinals,597067,5,bot,"E. Diaz tripled to right field, RBI3a J. Carpenter scored.",58,2025-03-16T00:00:00-04:00,"Parade Stadium (Minneapolis, MN)",0,MBA,2025
6343348,597217,Augsburg Auggies,597067,Wesleyan (CT) Cardinals,597067,5,bot,"J. Timmons flied out to rf, sacrifice fly, RBI3a E. Diaz scored.",59,2025-03-16T00:00:00-04:00,"Parade Stadium (Minneapolis, MN)",0,MBA,2025
6343348,597217,Augsburg Auggies,597067,Wesleyan (CT) Cardinals,597067,5,bot,T. Ashkinos grounded out to c.,60,2025-03-16T00:00:00-04:00,"Parade Stadium (Minneapolis, MN)",0,MBA,2025
6343348,597217,Augsburg Auggies,597067,Wesleyan (CT) Cardinals,597067,5,bot,L. LaSaracin flied out to rf.,61,2025-03-16T00:00:00-04:00,"Parade Stadium (Minneapolis, MN)",0,MBA,2025
6343348,597217,Augsburg Auggies,597067,Wesleyan (CT) Cardinals,597217,6,top,C. Schmidtz struck out swinging.,62,2025-03-16T00:00:00-04:00,"Parade Stadium (Minneapolis, MN)",0,MBA,2025
6343348,597217,Augsburg Auggies,597067,Wesleyan (CT) Cardinals,597217,6,top,D. Jenkins grounded out to ss.,63,2025-03-16T00:00:00-04:00,"Parade Stadium (Minneapolis, MN)",0,MBA,2025
6343348,597217,Augsburg Auggies,597067,Wesleyan (CT) Cardinals,597217,6,top,D. Wick singled to center field.,64,2025-03-16T00:00:00-04:00,"Parade Stadium (Minneapolis, MN)",0,MBA,2025
6343348,597217,Augsburg Auggies,597067,Wesleyan (CT) Cardinals,597217,6,top,D. Wick advanced to second on a passed ball.,65,2025-03-16T00:00:00-04:00,"Parade Stadium (Minneapolis, MN)",0,MBA,2025
6343348,597217,Augsburg Auggies,597067,Wesleyan (CT) Cardinals,597217,6,top,S. Regguinti walked.,66,2025-03-16T00:00:00-04:00,"Parade Stadium (Minneapolis, MN)",0,MBA,2025
6343348,597217,Augsburg Auggies,597067,Wesleyan (CT) Cardinals,597217,6,top,S. Regguinti Failed pickoff attempt.,67,2025-03-16T00:00:00-04:00,"Parade Stadium (Minneapolis, MN)",0,MBA,2025
6343348,597217,Augsburg Auggies,597067,Wesleyan (CT) Cardinals,597217,6,top,J. Sivoravon walked3a S. Regguinti advanced to second3a D. Wick advanced to third.,68,2025-03-16T00:00:00-04:00,"Parade Stadium (Minneapolis, MN)",0,MBA,2025
6343348,597217,Augsburg Auggies,597067,Wesleyan (CT) Cardinals,597217,6,top,J. Rake to p for L. Frattone.,69,2025-03-16T00:00:00-04:00,"Parade Stadium (Minneapolis, MN)",0,MBA,2025
6343348,597217,Augsburg Auggies,597067,Wesleyan (CT) Cardinals,597217,6,top,A. Vela lined out to 2b.,70,2025-03-16T00:00:00-04:00,"Parade Stadium (Minneapolis, MN)",0,MBA,2025
6343348,597217,Augsburg Auggies,597067,Wesleyan (CT) Cardinals,597067,6,bot,J. Acker singled to catcher.,71,2025-03-16T00:00:00-04:00,"Parade Stadium (Minneapolis, MN)",0,MBA,2025
6343348,597217,Augsburg Auggies,597067,Wesleyan (CT) Cardinals,597067,6,bot,J. Acker Failed pickoff attempt.,72,2025-03-16T00:00:00-04:00,"Parade Stadium (Minneapolis, MN)",0,MBA,2025
6343348,597217,Augsburg Auggies,597067,Wesleyan (CT) Cardinals,597067,6,bot,M. Jang singled to left field3a J. Acker advanced to third.,73,2025-03-16T00:00:00-04:00,"Parade Stadium (Minneapolis, MN)",0,MBA,2025
6343348,597217,Augsburg Auggies,597067,Wesleyan (CT) Cardinals,597067,6,bot,"J. Marsden singled to second base, 2 RBI3a M. Jang scored3a J. Acker scored.",74,2025-03-16T00:00:00-04:00,"Parade Stadium (Minneapolis, MN)",0,MBA,2025
6343348,597217,Augsburg Auggies,597067,Wesleyan (CT) Cardinals,597067,6,bot,E. Little hit by pitch3a J. Marsden advanced to second.,75,2025-03-16T00:00:00-04:00,"Parade Stadium (Minneapolis, MN)",0,MBA,2025
6343348,597217,Augsburg Auggies,597067,Wesleyan (CT) Cardinals,597067,6,bot,E. Little stole second3a J. Marsden stole third.,76,2025-03-16T00:00:00-04:00,"Parade Stadium (Minneapolis, MN)",0,MBA,2025
6343348,597217,Augsburg Auggies,597067,Wesleyan (CT) Cardinals,597067,6,bot,J. Carpenter struck out swinging.,77,2025-03-16T00:00:00-04:00,"Parade Stadium (Minneapolis, MN)",0,MBA,2025
6343348,597217,Augsburg Auggies,597067,Wesleyan (CT) Cardinals,597067,6,bot,E. Diaz struck out swinging.,78,2025-03-16T00:00:00-04:00,"Parade Stadium (Minneapolis, MN)",0,MBA,2025
6343348,597217,Augsburg Auggies,597067,Wesleyan (CT) Cardinals,597067,6,bot,J. Timmons was intentionally walked.,79,2025-03-16T00:00:00-04:00,"Parade Stadium (Minneapolis, MN)",0,MBA,2025
6343348,597217,Augsburg Auggies,597067,Wesleyan (CT) Cardinals,597067,6,bot,T. Ashkinos flied out to lf.,80,2025-03-16T00:00:00-04:00,"Parade Stadium (Minneapolis, MN)",0,MBA,2025
6343348,597217,Augsburg Auggies,597067,Wesleyan (CT) Cardinals,597217,7,top,A. Marshall struck out swinging.,81,2025-03-16T00:00:00-04:00,"Parade Stadium (Minneapolis, MN)",0,MBA,2025
6343348,597217,Augsburg Auggies,597067,Wesleyan (CT) Cardinals,597217,7,top,J. Udelhofen popped up to rf.,82,2025-03-16T00:00:00-04:00,"Parade Stadium (Minneapolis, MN)",0,MBA,2025
6343348,597217,Augsburg Auggies,597067,Wesleyan (CT) Cardinals,597217,7,top,T. Lapoint doubled to left field.,83,2025-03-16T00:00:00-04:00,"Parade Stadium (Minneapolis, MN)",0,MBA,2025
6343348,597217,Augsburg Auggies,597067,Wesleyan (CT) Cardinals,597217,7,top,C. Schmidtz singled to left field3a T. Lapoint advanced to third.,84,2025-03-16T00:00:00-04:00,"Parade Stadium (Minneapolis, MN)",0,MBA,2025
6343348,597217,Augsburg Auggies,597067,Wesleyan (CT) Cardinals,597217,7,top,G. Boling pinch hit for D. Jenkins.,85,2025-03-16T00:00:00-04:00,"Parade Stadium (Minneapolis, MN)",0,MBA,2025
6343348,597217,Augsburg Auggies,597067,Wesleyan (CT) Cardinals,597217,7,top,G. Boling struck out swinging.,86,2025-03-16T00:00:00-04:00,"Parade Stadium (Minneapolis, MN)",0,MBA,2025
6343348,597217,Augsburg Auggies,597067,Wesleyan (CT) Cardinals,597067,7,bot,G. Boling to 2b.,87,2025-03-16T00:00:00-04:00,"Parade Stadium (Minneapolis, MN)",0,MBA,2025
6343348,597217,Augsburg Auggies,597067,Wesleyan (CT) Cardinals,597067,7,bot,L. LaSaracin singled to center field.,88,2025-03-16T00:00:00-04:00,"Parade Stadium (Minneapolis, MN)",0,MBA,2025
6343348,597217,Augsburg Auggies,597067,Wesleyan (CT) Cardinals,597067,7,bot,"L. LaSaracin advanced to second on an error by p, advanced to third.",89,2025-03-16T00:00:00-04:00,"Parade Stadium (Minneapolis, MN)",0,MBA,2025
6343348,597217,Augsburg Auggies,597067,Wesleyan (CT) Cardinals,597067,7,bot,J. Acker popped up to 2b.,90,2025-03-16T00:00:00-04:00,"Parade Stadium (Minneapolis, MN)",0,MBA,2025
6343348,597217,Augsburg Auggies,597067,Wesleyan (CT) Cardinals,597067,7,bot,M. Jang popped up to ss.,91,2025-03-16T00:00:00-04:00,"Parade Stadium (Minneapolis, MN)",0,MBA,2025
6343348,597217,Augsburg Auggies,597067,Wesleyan (CT) Cardinals,597067,7,bot,"J. Marsden singled to right field, RBI3a L. LaSaracin scored.",92,2025-03-16T00:00:00-04:00,"Parade Stadium (Minneapolis, MN)",0,MBA,2025
6343348,597217,Augsburg Auggies,597067,Wesleyan (CT) Cardinals,597067,7,bot,J. Marsden Failed pickoff attempt.,93,2025-03-16T00:00:00-04:00,"Parade Stadium (Minneapolis, MN)",0,MBA,2025
6343348,597217,Augsburg Auggies,597067,Wesleyan (CT) Cardinals,597067,7,bot,J. Marsden Failed pickoff attempt.,94,2025-03-16T00:00:00-04:00,"Parade Stadium (Minneapolis, MN)",0,MBA,2025
6343348,597217,Augsburg Auggies,597067,Wesleyan (CT) Cardinals,597067,7,bot,"E. Little doubled to right field, RBI3a J. Marsden scored.",95,2025-03-16T00:00:00-04:00,"Parade Stadium (Minneapolis, MN)",0,MBA,2025
6343348,597217,Augsburg Auggies,597067,Wesleyan (CT) Cardinals,597067,7,bot,J. Carpenter singled to shortstop3a E. Little advanced to third.,96,2025-03-16T00:00:00-04:00,"Parade Stadium (Minneapolis, MN)",0,MBA,2025
6343348,597217,Augsburg Auggies,597067,Wesleyan (CT) Cardinals,597067,7,bot,E. Diaz was intentionally walked3a J. Carpenter advanced to second.,97,2025-03-16T00:00:00-04:00,"Parade Stadium (Minneapolis, MN)",0,MBA,2025
6343348,597217,Augsburg Auggies,597067,Wesleyan (CT) Cardinals,597067,7,bot,J. Timmons grounded out to c.,98,2025-03-16T00:00:00-04:00,"Parade Stadium (Minneapolis, MN)",0,MBA,2025
6343348,597217,Augsburg Auggies,597067,Wesleyan (CT) Cardinals,597217,8,top,C. Boudreau to lf for T. Ashkinos.,99,2025-03-16T00:00:00-04:00,"Parade Stadium (Minneapolis, MN)",0,MBA,2025
6343348,597217,Augsburg Auggies,597067,Wesleyan (CT) Cardinals,597217,8,top,D. Wick singled to left field.,100,2025-03-16T00:00:00-04:00,"Parade Stadium (Minneapolis, MN)",0,MBA,2025
6343348,597217,Augsburg Auggies,597067,Wesleyan (CT) Cardinals,597217,8,top,S. Regguinti walked3a D. Wick advanced to second.,101,2025-03-16T00:00:00-04:00,"Parade Stadium (Minneapolis, MN)",0,MBA,2025
6343348,597217,Augsburg Auggies,597067,Wesleyan (CT) Cardinals,597217,8,top,C. Lautzenhe to p for J. Rake.,102,2025-03-16T00:00:00-04:00,"Parade Stadium (Minneapolis, MN)",0,MBA,2025
6343348,597217,Augsburg Auggies,597067,Wesleyan (CT) Cardinals,597217,8,top,"J. Sivoravon reached on a fielder's choice to shortstop3a S. Regguinti out at first ss to 2b, picked off3a D. Wick advanced to third.",103,2025-03-16T00:00:00-04:00,"Parade Stadium (Minneapolis, MN)",0,MBA,2025
6343348,597217,Augsburg Auggies,597067,Wesleyan (CT) Cardinals,597217,8,top,"A. Vela reached on a fielder's choice to second base, RBI3a J. Sivoravon out at first ss to 2b, picked off3a D. Wick scored.",104,2025-03-16T00:00:00-04:00,"Parade Stadium (Minneapolis, MN)",0,MBA,2025
6343348,597217,Augsburg Auggies,597067,Wesleyan (CT) Cardinals,597217,8,top,A. Marshall lined out to rf.,105,2025-03-16T00:00:00-04:00,"Parade Stadium (Minneapolis, MN)",0,MBA,2025
6343348,597217,Augsburg Auggies,597067,Wesleyan (CT) Cardinals,597067,8,bot,J. Henry to p for N. Allbee.,106,2025-03-16T00:00:00-04:00,"Parade Stadium (Minneapolis, MN)",0,MBA,2025
6343348,597217,Augsburg Auggies,597067,Wesleyan (CT) Cardinals,597067,8,bot,C. Boudreau flied out to cf.,107,2025-03-16T00:00:00-04:00,"Parade Stadium (Minneapolis, MN)",0,MBA,2025
6343348,597217,Augsburg Auggies,597067,Wesleyan (CT) Cardinals,597067,8,bot,L. LaSaracin out at first c to ss.,108,2025-03-16T00:00:00-04:00,"Parade Stadium (Minneapolis, MN)",0,MBA,2025
6343348,597217,Augsburg Auggies,597067,Wesleyan (CT) Cardinals,597067,8,bot,J. Acker walked.,109,2025-03-16T00:00:00-04:00,"Parade Stadium (Minneapolis, MN)",0,MBA,2025
6343348,597217,Augsburg Auggies,597067,Wesleyan (CT) Cardinals,597067,8,bot,M. Jang struck out looking.,110,2025-03-16T00:00:00-04:00,"Parade Stadium (Minneapolis, MN)",0,MBA,2025
6343348,597217,Augsburg Auggies,597067,Wesleyan (CT) Cardinals,597217,9,top,J. Udelhofen singled to left field.,111,2025-03-16T00:00:00-04:00,"Parade Stadium (Minneapolis, MN)",0,MBA,2025
6343348,597217,Augsburg Auggies,597067,Wesleyan (CT) Cardinals,597217,9,top,T. Lapoint struck out looking.,112,2025-03-16T00:00:00-04:00,"Parade Stadium (Minneapolis, MN)",0,MBA,2025
6343348,597217,Augsburg Auggies,597067,Wesleyan (CT) Cardinals,597217,9,top,J. Bradley pinch ran for J. Udelhofen.,113,2025-03-16T00:00:00-04:00,"Parade Stadium (Minneapolis, MN)",0,MBA,2025
6343348,597217,Augsburg Auggies,597067,Wesleyan (CT) Cardinals,597217,9,top,C. Schmidtz reached first on an error by ss3a J. Bradley advanced to second.,114,2025-03-16T00:00:00-04:00,"Parade Stadium (Minneapolis, MN)",0,MBA,2025
6343348,597217,Augsburg Auggies,597067,Wesleyan (CT) Cardinals,597217,9,top,G. Boling singled to left field3a C. Schmidtz advanced to second3a J. Bradley advanced to third.,115,2025-03-16T00:00:00-04:00,"Parade Stadium (Minneapolis, MN)",0,MBA,2025
6343348,597217,Augsburg Auggies,597067,Wesleyan (CT) Cardinals,597217,9,top,D. Wick struck out looking.,116,2025-03-16T00:00:00-04:00,"Parade Stadium (Minneapolis, MN)",0,MBA,2025
6343348,597217,Augsburg Auggies,597067,Wesleyan (CT) Cardinals,597217,9,top,"S. Regguinti hit by pitch, RBI3a G. Boling advanced to second3a C. Schmidtz advanced to third3a J. Bradley scored.",117,2025-03-16T00:00:00-04:00,"Parade Stadium (Minneapolis, MN)",0,MBA,2025
6343348,597217,Augsburg Auggies,597067,Wesleyan (CT) Cardinals,597217,9,top,J. Sivoravon struck out looking.,118,2025-03-16T00:00:00-04:00,"Parade Stadium (Minneapolis, MN)",0,MBA,2025
