game_id,away_team_id,away_team_name,home_team_id,home_team_name,batting_team,inning,top_bot,event_text,event_num,game_datetime,stadium_name,attendance,sport_id,season
6344842,597007,Randolph-Macon Yellow Jackets,597271,East. Mennonite Royals,597007,1,top,J. Bowles fouled out to c.,1,2025-03-29T00:00:00-04:00,"EMU Baseball Field (Harrisonburg, VA)",143,MBA,2025
6344842,597007,Randolph-Macon Yellow Jackets,597271,East. Mennonite Royals,597007,1,top,M. Bodnar flied out to cf.,2,2025-03-29T00:00:00-04:00,"EMU Baseball Field (Harrisonburg, VA)",143,MBA,2025
6344842,597007,Randolph-Macon Yellow Jackets,597271,East. Mennonite Royals,597007,1,top,C. Schmitt grounded out to p.,3,2025-03-29T00:00:00-04:00,"EMU Baseball Field (Harrisonburg, VA)",143,MBA,2025
6344842,597007,Randolph-Macon Yellow Jackets,597271,East. Mennonite Royals,597271,1,bot,N. Arnold flied out to cf.,4,2025-03-29T00:00:00-04:00,"EMU Baseball Field (Harrisonburg, VA)",143,MBA,2025
6344842,597007,Randolph-Macon Yellow Jackets,597271,East. Mennonite Royals,597271,1,bot,C. Polymerop flied out to rf.,5,2025-03-29T00:00:00-04:00,"EMU Baseball Field (Harrisonburg, VA)",143,MBA,2025
6344842,597007,Randolph-Macon Yellow Jackets,597271,East. Mennonite Royals,597271,1,bot,"D. McGinnis struck out swinging, out at first c to 1b.",6,2025-03-29T00:00:00-04:00,"EMU Baseball Field (Harrisonburg, VA)",143,MBA,2025
6344842,597007,Randolph-Macon Yellow Jackets,597271,East. Mennonite Royals,597007,2,top,A. Lautensch struck out swinging.,7,2025-03-29T00:00:00-04:00,"EMU Baseball Field (Harrisonburg, VA)",143,MBA,2025
6344842,597007,Randolph-Macon Yellow Jackets,597271,East. Mennonite Royals,597007,2,top,C. Harvey lined out to ss.,8,2025-03-29T00:00:00-04:00,"EMU Baseball Field (Harrisonburg, VA)",143,MBA,2025
6344842,597007,Randolph-Macon Yellow Jackets,597271,East. Mennonite Royals,597007,2,top,J. Quici singled through the right side.,9,2025-03-29T00:00:00-04:00,"EMU Baseball Field (Harrisonburg, VA)",143,MBA,2025
6344842,597007,Randolph-Macon Yellow Jackets,597271,East. Mennonite Royals,597007,2,top,L. Duff reached on a fielder's choice; J. Quici out at second 2b to ss.,10,2025-03-29T00:00:00-04:00,"EMU Baseball Field (Harrisonburg, VA)",143,MBA,2025
6344842,597007,Randolph-Macon Yellow Jackets,597271,East. Mennonite Royals,597271,2,bot,E. Wilkinson singled.,11,2025-03-29T00:00:00-04:00,"EMU Baseball Field (Harrisonburg, VA)",143,MBA,2025
6344842,597007,Randolph-Macon Yellow Jackets,597271,East. Mennonite Royals,597271,2,bot,D. Rocke struck out swinging.,12,2025-03-29T00:00:00-04:00,"EMU Baseball Field (Harrisonburg, VA)",143,MBA,2025
6344842,597007,Randolph-Macon Yellow Jackets,597271,East. Mennonite Royals,597271,2,bot,A. Miller flied out to cf.,13,2025-03-29T00:00:00-04:00,"EMU Baseball Field (Harrisonburg, VA)",143,MBA,2025
6344842,597007,Randolph-Macon Yellow Jackets,597271,East. Mennonite Royals,597271,2,bot,J. Cabanban singled to right field; E. Wilkinson advanced to third.,14,2025-03-29T00:00:00-04:00,"EMU Baseball Field (Harrisonburg, VA)",143,MBA,2025
6344842,597007,Randolph-Macon Yellow Jackets,597271,East. Mennonite Royals,597271,2,bot,N. Sanderson grounded out to 1b unassisted.,15,2025-03-29T00:00:00-04:00,"EMU Baseball Field (Harrisonburg, VA)",143,MBA,2025
6344842,597007,Randolph-Macon Yellow Jackets,597271,East. Mennonite Royals,597007,3,top,C. Chatterto singled to left center.,16,2025-03-29T00:00:00-04:00,"EMU Baseball Field (Harrisonburg, VA)",143,MBA,2025
6344842,597007,Randolph-Macon Yellow Jackets,597271,East. Mennonite Royals,597007,3,top,"J. Wright grounded out to p, bunt, SAC; C. Chatterto advanced to second.",17,2025-03-29T00:00:00-04:00,"EMU Baseball Field (Harrisonburg, VA)",143,MBA,2025
6344842,597007,Randolph-Macon Yellow Jackets,597271,East. Mennonite Royals,597007,3,top,J. Bowles hit by pitch.,18,2025-03-29T00:00:00-04:00,"EMU Baseball Field (Harrisonburg, VA)",143,MBA,2025
6344842,597007,Randolph-Macon Yellow Jackets,597271,East. Mennonite Royals,597007,3,top,J. Bowles advanced to second; C. Chatterto advanced to third on a wild pitch.,19,2025-03-29T00:00:00-04:00,"EMU Baseball Field (Harrisonburg, VA)",143,MBA,2025
6344842,597007,Randolph-Macon Yellow Jackets,597271,East. Mennonite Royals,597007,3,top,M. Bodnar walked.,20,2025-03-29T00:00:00-04:00,"EMU Baseball Field (Harrisonburg, VA)",143,MBA,2025
6344842,597007,Randolph-Macon Yellow Jackets,597271,East. Mennonite Royals,597007,3,top,"C. Schmitt doubled to right field, 2 RBI; M. Bodnar advanced to third; J. Bowles scored; C. Chatterto scored.",21,2025-03-29T00:00:00-04:00,"EMU Baseball Field (Harrisonburg, VA)",143,MBA,2025
6344842,597007,Randolph-Macon Yellow Jackets,597271,East. Mennonite Royals,597007,3,top,"A. Lautensch flied out to cf, sacrifice fly, RBI; C. Schmitt advanced to third; M. Bodnar scored.",22,2025-03-29T00:00:00-04:00,"EMU Baseball Field (Harrisonburg, VA)",143,MBA,2025
6344842,597007,Randolph-Macon Yellow Jackets,597271,East. Mennonite Royals,597007,3,top,C. Harvey flied out to lf.,23,2025-03-29T00:00:00-04:00,"EMU Baseball Field (Harrisonburg, VA)",143,MBA,2025
6344842,597007,Randolph-Macon Yellow Jackets,597271,East. Mennonite Royals,597271,3,bot,D. Hall struck out swinging.,24,2025-03-29T00:00:00-04:00,"EMU Baseball Field (Harrisonburg, VA)",143,MBA,2025
6344842,597007,Randolph-Macon Yellow Jackets,597271,East. Mennonite Royals,597271,3,bot,N. Arnold flied out to cf.,25,2025-03-29T00:00:00-04:00,"EMU Baseball Field (Harrisonburg, VA)",143,MBA,2025
6344842,597007,Randolph-Macon Yellow Jackets,597271,East. Mennonite Royals,597271,3,bot,C. Polymerop struck out swinging.,26,2025-03-29T00:00:00-04:00,"EMU Baseball Field (Harrisonburg, VA)",143,MBA,2025
6344842,597007,Randolph-Macon Yellow Jackets,597271,East. Mennonite Royals,597007,4,top,J. Quici fouled out to 3b.,27,2025-03-29T00:00:00-04:00,"EMU Baseball Field (Harrisonburg, VA)",143,MBA,2025
6344842,597007,Randolph-Macon Yellow Jackets,597271,East. Mennonite Royals,597007,4,top,L. Duff flied out to rf.,28,2025-03-29T00:00:00-04:00,"EMU Baseball Field (Harrisonburg, VA)",143,MBA,2025
6344842,597007,Randolph-Macon Yellow Jackets,597271,East. Mennonite Royals,597007,4,top,C. Chatterto singled through the left side.,29,2025-03-29T00:00:00-04:00,"EMU Baseball Field (Harrisonburg, VA)",143,MBA,2025
6344842,597007,Randolph-Macon Yellow Jackets,597271,East. Mennonite Royals,597007,4,top,"C. Chatterto out at second c to 2b, caught stealing.",30,2025-03-29T00:00:00-04:00,"EMU Baseball Field (Harrisonburg, VA)",143,MBA,2025
6344842,597007,Randolph-Macon Yellow Jackets,597271,East. Mennonite Royals,597271,4,bot,D. McGinnis flied out to rf.,31,2025-03-29T00:00:00-04:00,"EMU Baseball Field (Harrisonburg, VA)",143,MBA,2025
6344842,597007,Randolph-Macon Yellow Jackets,597271,East. Mennonite Royals,597271,4,bot,E. Wilkinson flied out to cf.,32,2025-03-29T00:00:00-04:00,"EMU Baseball Field (Harrisonburg, VA)",143,MBA,2025
6344842,597007,Randolph-Macon Yellow Jackets,597271,East. Mennonite Royals,597271,4,bot,D. Rocke singled through the left side.,33,2025-03-29T00:00:00-04:00,"EMU Baseball Field (Harrisonburg, VA)",143,MBA,2025
6344842,597007,Randolph-Macon Yellow Jackets,597271,East. Mennonite Royals,597271,4,bot,A. Miller singled; D. Rocke advanced to second.,34,2025-03-29T00:00:00-04:00,"EMU Baseball Field (Harrisonburg, VA)",143,MBA,2025
6344842,597007,Randolph-Macon Yellow Jackets,597271,East. Mennonite Royals,597271,4,bot,"J. Cabanban reached on a fielder's choice; A. Miller advanced to second; D. Rocke advanced to third, out at home 2b to c.",35,2025-03-29T00:00:00-04:00,"EMU Baseball Field (Harrisonburg, VA)",143,MBA,2025
6344842,597007,Randolph-Macon Yellow Jackets,597271,East. Mennonite Royals,597007,5,top,J. Wright grounded out to ss.,36,2025-03-29T00:00:00-04:00,"EMU Baseball Field (Harrisonburg, VA)",143,MBA,2025
6344842,597007,Randolph-Macon Yellow Jackets,597271,East. Mennonite Royals,597007,5,top,J. Bowles out at first 1b to p.,37,2025-03-29T00:00:00-04:00,"EMU Baseball Field (Harrisonburg, VA)",143,MBA,2025
6344842,597007,Randolph-Macon Yellow Jackets,597271,East. Mennonite Royals,597007,5,top,M. Bodnar struck out swinging.,38,2025-03-29T00:00:00-04:00,"EMU Baseball Field (Harrisonburg, VA)",143,MBA,2025
6344842,597007,Randolph-Macon Yellow Jackets,597271,East. Mennonite Royals,597271,5,bot,N. Sanderson flied out to lf.,39,2025-03-29T00:00:00-04:00,"EMU Baseball Field (Harrisonburg, VA)",143,MBA,2025
6344842,597007,Randolph-Macon Yellow Jackets,597271,East. Mennonite Royals,597271,5,bot,D. Hall singled to left center.,40,2025-03-29T00:00:00-04:00,"EMU Baseball Field (Harrisonburg, VA)",143,MBA,2025
6344842,597007,Randolph-Macon Yellow Jackets,597271,East. Mennonite Royals,597271,5,bot,N. Arnold walked; D. Hall advanced to second.,41,2025-03-29T00:00:00-04:00,"EMU Baseball Field (Harrisonburg, VA)",143,MBA,2025
6344842,597007,Randolph-Macon Yellow Jackets,597271,East. Mennonite Royals,597271,5,bot,"N. Arnold stole second, advanced to third; D. Hall stole third, scored on a throwing error by c.",42,2025-03-29T00:00:00-04:00,"EMU Baseball Field (Harrisonburg, VA)",143,MBA,2025
6344842,597007,Randolph-Macon Yellow Jackets,597271,East. Mennonite Royals,597271,5,bot,"C. Polymerop flied out to lf, sacrifice fly, RBI; N. Arnold scored, unearned.",43,2025-03-29T00:00:00-04:00,"EMU Baseball Field (Harrisonburg, VA)",143,MBA,2025
6344842,597007,Randolph-Macon Yellow Jackets,597271,East. Mennonite Royals,597271,5,bot,D. McGinnis flied out to cf.,44,2025-03-29T00:00:00-04:00,"EMU Baseball Field (Harrisonburg, VA)",143,MBA,2025
6344842,597007,Randolph-Macon Yellow Jackets,597271,East. Mennonite Royals,597007,6,top,C. Schmitt hit by pitch.,45,2025-03-29T00:00:00-04:00,"EMU Baseball Field (Harrisonburg, VA)",143,MBA,2025
6344842,597007,Randolph-Macon Yellow Jackets,597271,East. Mennonite Royals,597007,6,top,A. Lautensch walked; C. Schmitt advanced to second.,46,2025-03-29T00:00:00-04:00,"EMU Baseball Field (Harrisonburg, VA)",143,MBA,2025
6344842,597007,Randolph-Macon Yellow Jackets,597271,East. Mennonite Royals,597007,6,top,C. Harvey walked; A. Lautensch advanced to second; C. Schmitt advanced to third.,47,2025-03-29T00:00:00-04:00,"EMU Baseball Field (Harrisonburg, VA)",143,MBA,2025
6344842,597007,Randolph-Macon Yellow Jackets,597271,East. Mennonite Royals,597007,6,top,J. Quici grounded into double play p to c to 1b; C. Harvey advanced to second; A. Lautensch advanced to third; C. Schmitt out on the play.,48,2025-03-29T00:00:00-04:00,"EMU Baseball Field (Harrisonburg, VA)",143,MBA,2025
6344842,597007,Randolph-Macon Yellow Jackets,597271,East. Mennonite Royals,597007,6,top,L. Duff popped up to 1b.,49,2025-03-29T00:00:00-04:00,"EMU Baseball Field (Harrisonburg, VA)",143,MBA,2025
6344842,597007,Randolph-Macon Yellow Jackets,597271,East. Mennonite Royals,597271,6,bot,E. Wilkinson flied out to cf.,50,2025-03-29T00:00:00-04:00,"EMU Baseball Field (Harrisonburg, VA)",143,MBA,2025
6344842,597007,Randolph-Macon Yellow Jackets,597271,East. Mennonite Royals,597271,6,bot,D. Rocke struck out swinging.,51,2025-03-29T00:00:00-04:00,"EMU Baseball Field (Harrisonburg, VA)",143,MBA,2025
6344842,597007,Randolph-Macon Yellow Jackets,597271,East. Mennonite Royals,597271,6,bot,A. Miller singled to left center.,52,2025-03-29T00:00:00-04:00,"EMU Baseball Field (Harrisonburg, VA)",143,MBA,2025
6344842,597007,Randolph-Macon Yellow Jackets,597271,East. Mennonite Royals,597271,6,bot,A. Miller stole second.,53,2025-03-29T00:00:00-04:00,"EMU Baseball Field (Harrisonburg, VA)",143,MBA,2025
6344842,597007,Randolph-Macon Yellow Jackets,597271,East. Mennonite Royals,597271,6,bot,"J. Cabanban doubled to right field, RBI; A. Miller scored.",54,2025-03-29T00:00:00-04:00,"EMU Baseball Field (Harrisonburg, VA)",143,MBA,2025
6344842,597007,Randolph-Macon Yellow Jackets,597271,East. Mennonite Royals,597271,6,bot,"N. Sanderson singled to right center, RBI; J. Cabanban scored.",55,2025-03-29T00:00:00-04:00,"EMU Baseball Field (Harrisonburg, VA)",143,MBA,2025
6344842,597007,Randolph-Macon Yellow Jackets,597271,East. Mennonite Royals,597271,6,bot,D. Hall flied out to rf.,56,2025-03-29T00:00:00-04:00,"EMU Baseball Field (Harrisonburg, VA)",143,MBA,2025
6344842,597007,Randolph-Macon Yellow Jackets,597271,East. Mennonite Royals,597007,7,top,D. McClellan to p for J. Gjormand.,57,2025-03-29T00:00:00-04:00,"EMU Baseball Field (Harrisonburg, VA)",143,MBA,2025
6344842,597007,Randolph-Macon Yellow Jackets,597271,East. Mennonite Royals,597007,7,top,C. Chatterto flied out to cf.,58,2025-03-29T00:00:00-04:00,"EMU Baseball Field (Harrisonburg, VA)",143,MBA,2025
6344842,597007,Randolph-Macon Yellow Jackets,597271,East. Mennonite Royals,597007,7,top,J. Wright grounded out to 3b.,59,2025-03-29T00:00:00-04:00,"EMU Baseball Field (Harrisonburg, VA)",143,MBA,2025
6344842,597007,Randolph-Macon Yellow Jackets,597271,East. Mennonite Royals,597007,7,top,J. Bowles walked.,60,2025-03-29T00:00:00-04:00,"EMU Baseball Field (Harrisonburg, VA)",143,MBA,2025
6344842,597007,Randolph-Macon Yellow Jackets,597271,East. Mennonite Royals,597007,7,top,"M. Bodnar doubled to left center, RBI; J. Bowles scored.",61,2025-03-29T00:00:00-04:00,"EMU Baseball Field (Harrisonburg, VA)",143,MBA,2025
6344842,597007,Randolph-Macon Yellow Jackets,597271,East. Mennonite Royals,597007,7,top,C. Schmitt walked.,62,2025-03-29T00:00:00-04:00,"EMU Baseball Field (Harrisonburg, VA)",143,MBA,2025
6344842,597007,Randolph-Macon Yellow Jackets,597271,East. Mennonite Royals,597007,7,top,S. Gwathmey to p for D. McClellan.,63,2025-03-29T00:00:00-04:00,"EMU Baseball Field (Harrisonburg, VA)",143,MBA,2025
6344842,597007,Randolph-Macon Yellow Jackets,597271,East. Mennonite Royals,597007,7,top,A. Lautensch flied out to rf.,64,2025-03-29T00:00:00-04:00,"EMU Baseball Field (Harrisonburg, VA)",143,MBA,2025
6344842,597007,Randolph-Macon Yellow Jackets,597271,East. Mennonite Royals,597271,7,bot,C. McAuley to p for B. Bauers.,65,2025-03-29T00:00:00-04:00,"EMU Baseball Field (Harrisonburg, VA)",143,MBA,2025
6344842,597007,Randolph-Macon Yellow Jackets,597271,East. Mennonite Royals,597271,7,bot,A. Hagerich to 2b for J. Wright.,66,2025-03-29T00:00:00-04:00,"EMU Baseball Field (Harrisonburg, VA)",143,MBA,2025
6344842,597007,Randolph-Macon Yellow Jackets,597271,East. Mennonite Royals,597271,7,bot,"N. Arnold struck out swinging, out at first c to 1b.",67,2025-03-29T00:00:00-04:00,"EMU Baseball Field (Harrisonburg, VA)",143,MBA,2025
6344842,597007,Randolph-Macon Yellow Jackets,597271,East. Mennonite Royals,597271,7,bot,C. Polymerop struck out swinging.,68,2025-03-29T00:00:00-04:00,"EMU Baseball Field (Harrisonburg, VA)",143,MBA,2025
6344842,597007,Randolph-Macon Yellow Jackets,597271,East. Mennonite Royals,597271,7,bot,D. McGinnis grounded out to ss.,69,2025-03-29T00:00:00-04:00,"EMU Baseball Field (Harrisonburg, VA)",143,MBA,2025
6344842,597007,Randolph-Macon Yellow Jackets,597271,East. Mennonite Royals,597007,8,top,C. Harvey doubled to left center.,70,2025-03-29T00:00:00-04:00,"EMU Baseball Field (Harrisonburg, VA)",143,MBA,2025
6344842,597007,Randolph-Macon Yellow Jackets,597271,East. Mennonite Royals,597007,8,top,J. Quici struck out swinging.,71,2025-03-29T00:00:00-04:00,"EMU Baseball Field (Harrisonburg, VA)",143,MBA,2025
6344842,597007,Randolph-Macon Yellow Jackets,597271,East. Mennonite Royals,597007,8,top,L. Duff grounded out to ss.,72,2025-03-29T00:00:00-04:00,"EMU Baseball Field (Harrisonburg, VA)",143,MBA,2025
6344842,597007,Randolph-Macon Yellow Jackets,597271,East. Mennonite Royals,597007,8,top,C. Harvey advanced to third on a wild pitch.,73,2025-03-29T00:00:00-04:00,"EMU Baseball Field (Harrisonburg, VA)",143,MBA,2025
6344842,597007,Randolph-Macon Yellow Jackets,597271,East. Mennonite Royals,597007,8,top,C. Chatterto walked.,74,2025-03-29T00:00:00-04:00,"EMU Baseball Field (Harrisonburg, VA)",143,MBA,2025
6344842,597007,Randolph-Macon Yellow Jackets,597271,East. Mennonite Royals,597007,8,top,C. Eidson to p for S. Gwathmey.,75,2025-03-29T00:00:00-04:00,"EMU Baseball Field (Harrisonburg, VA)",143,MBA,2025
6344842,597007,Randolph-Macon Yellow Jackets,597271,East. Mennonite Royals,597007,8,top,C. Chatterto stole second.,76,2025-03-29T00:00:00-04:00,"EMU Baseball Field (Harrisonburg, VA)",143,MBA,2025
6344842,597007,Randolph-Macon Yellow Jackets,597271,East. Mennonite Royals,597007,8,top,A. Hagerich grounded out to 2b.,77,2025-03-29T00:00:00-04:00,"EMU Baseball Field (Harrisonburg, VA)",143,MBA,2025
6344842,597007,Randolph-Macon Yellow Jackets,597271,East. Mennonite Royals,597271,8,bot,E. Wilkinson grounded out to 1b unassisted.,78,2025-03-29T00:00:00-04:00,"EMU Baseball Field (Harrisonburg, VA)",143,MBA,2025
6344842,597007,Randolph-Macon Yellow Jackets,597271,East. Mennonite Royals,597271,8,bot,D. Rocke walked.,79,2025-03-29T00:00:00-04:00,"EMU Baseball Field (Harrisonburg, VA)",143,MBA,2025
6344842,597007,Randolph-Macon Yellow Jackets,597271,East. Mennonite Royals,597271,8,bot,A. Miller hit by pitch; D. Rocke advanced to second.,80,2025-03-29T00:00:00-04:00,"EMU Baseball Field (Harrisonburg, VA)",143,MBA,2025
6344842,597007,Randolph-Macon Yellow Jackets,597271,East. Mennonite Royals,597271,8,bot,J. Cabanban struck out swinging.,81,2025-03-29T00:00:00-04:00,"EMU Baseball Field (Harrisonburg, VA)",143,MBA,2025
6344842,597007,Randolph-Macon Yellow Jackets,597271,East. Mennonite Royals,597271,8,bot,N. Sanderson struck out swinging.,82,2025-03-29T00:00:00-04:00,"EMU Baseball Field (Harrisonburg, VA)",143,MBA,2025
6344842,597007,Randolph-Macon Yellow Jackets,597271,East. Mennonite Royals,597007,9,top,J. Bowles flied out to cf.,83,2025-03-29T00:00:00-04:00,"EMU Baseball Field (Harrisonburg, VA)",143,MBA,2025
6344842,597007,Randolph-Macon Yellow Jackets,597271,East. Mennonite Royals,597007,9,top,M. Bodnar grounded out to ss.,84,2025-03-29T00:00:00-04:00,"EMU Baseball Field (Harrisonburg, VA)",143,MBA,2025
6344842,597007,Randolph-Macon Yellow Jackets,597271,East. Mennonite Royals,597007,9,top,C. Schmitt struck out swinging.,85,2025-03-29T00:00:00-04:00,"EMU Baseball Field (Harrisonburg, VA)",143,MBA,2025
6344842,597007,Randolph-Macon Yellow Jackets,597271,East. Mennonite Royals,597271,9,bot,J. Bowles to lf.,86,2025-03-29T00:00:00-04:00,"EMU Baseball Field (Harrisonburg, VA)",143,MBA,2025
6344842,597007,Randolph-Macon Yellow Jackets,597271,East. Mennonite Royals,597271,9,bot,E. Brooks to rf for C. Schmitt.,87,2025-03-29T00:00:00-04:00,"EMU Baseball Field (Harrisonburg, VA)",143,MBA,2025
6344842,597007,Randolph-Macon Yellow Jackets,597271,East. Mennonite Royals,597271,9,bot,D. Hall singled to center field.,88,2025-03-29T00:00:00-04:00,"EMU Baseball Field (Harrisonburg, VA)",143,MBA,2025
6344842,597007,Randolph-Macon Yellow Jackets,597271,East. Mennonite Royals,597271,9,bot,"N. Arnold homered to left field, 2 RBI; D. Hall scored.",89,2025-03-29T00:00:00-04:00,"EMU Baseball Field (Harrisonburg, VA)",143,MBA,2025
