game_id,away_team_id,away_team_name,home_team_id,home_team_name,batting_team,inning,top_bot,event_text,event_num,game_datetime,stadium_name,attendance,sport_id,season
6344467,597264,Delaware Valley Aggies,597129,Cairn Highlanders,597264,1,top,R. Hackett singled to right center.,1,2025-03-26T00:00:00-04:00,"Stillman Athletic Complex (Langhorne, PA)",0,MBA,2025
6344467,597264,Delaware Valley Aggies,597129,Cairn Highlanders,597264,1,top,"P. Higgins grounded out to p, SAC, bunt; R. Hackett advanced to second.",2,2025-03-26T00:00:00-04:00,"Stillman Athletic Complex (Langhorne, PA)",0,MBA,2025
6344467,597264,Delaware Valley Aggies,597129,Cairn Highlanders,597264,1,top,"L. Martin tripled to right field, RBI; R. Hackett scored.",3,2025-03-26T00:00:00-04:00,"Stillman Athletic Complex (Langhorne, PA)",0,MBA,2025
6344467,597264,Delaware Valley Aggies,597129,Cairn Highlanders,597264,1,top,B. Ramos struck out looking.,4,2025-03-26T00:00:00-04:00,"Stillman Athletic Complex (Langhorne, PA)",0,MBA,2025
6344467,597264,Delaware Valley Aggies,597129,Cairn Highlanders,597264,1,top,N. Ludwick walked.,5,2025-03-26T00:00:00-04:00,"Stillman Athletic Complex (Langhorne, PA)",0,MBA,2025
6344467,597264,Delaware Valley Aggies,597129,Cairn Highlanders,597264,1,top,D. Murphy fouled out to 1b.,6,2025-03-26T00:00:00-04:00,"Stillman Athletic Complex (Langhorne, PA)",0,MBA,2025
6344467,597264,Delaware Valley Aggies,597129,Cairn Highlanders,597129,1,bot,D. Jackson struck out swinging.,7,2025-03-26T00:00:00-04:00,"Stillman Athletic Complex (Langhorne, PA)",0,MBA,2025
6344467,597264,Delaware Valley Aggies,597129,Cairn Highlanders,597129,1,bot,W. Wikner flied out to lf.,8,2025-03-26T00:00:00-04:00,"Stillman Athletic Complex (Langhorne, PA)",0,MBA,2025
6344467,597264,Delaware Valley Aggies,597129,Cairn Highlanders,597129,1,bot,T. Warr flied out to cf.,9,2025-03-26T00:00:00-04:00,"Stillman Athletic Complex (Langhorne, PA)",0,MBA,2025
6344467,597264,Delaware Valley Aggies,597129,Cairn Highlanders,597264,2,top,J. Miskanic singled to third base.,10,2025-03-26T00:00:00-04:00,"Stillman Athletic Complex (Langhorne, PA)",0,MBA,2025
6344467,597264,Delaware Valley Aggies,597129,Cairn Highlanders,597264,2,top,T. Gossel struck out swinging.,11,2025-03-26T00:00:00-04:00,"Stillman Athletic Complex (Langhorne, PA)",0,MBA,2025
6344467,597264,Delaware Valley Aggies,597129,Cairn Highlanders,597264,2,top,G. Migliori flied out to rf.,12,2025-03-26T00:00:00-04:00,"Stillman Athletic Complex (Langhorne, PA)",0,MBA,2025
6344467,597264,Delaware Valley Aggies,597129,Cairn Highlanders,597264,2,top,R. Hackett struck out swinging.,13,2025-03-26T00:00:00-04:00,"Stillman Athletic Complex (Langhorne, PA)",0,MBA,2025
6344467,597264,Delaware Valley Aggies,597129,Cairn Highlanders,597129,2,bot,Z. Bauers walked.,14,2025-03-26T00:00:00-04:00,"Stillman Athletic Complex (Langhorne, PA)",0,MBA,2025
6344467,597264,Delaware Valley Aggies,597129,Cairn Highlanders,597129,2,bot,A. Holt singled to center field; Z. Bauers advanced to third.,15,2025-03-26T00:00:00-04:00,"Stillman Athletic Complex (Langhorne, PA)",0,MBA,2025
6344467,597264,Delaware Valley Aggies,597129,Cairn Highlanders,597129,2,bot,"B. Gagnon reached on a fielder's choice, RBI; A. Holt out at second ss to 2b; Z. Bauers scored.",16,2025-03-26T00:00:00-04:00,"Stillman Athletic Complex (Langhorne, PA)",0,MBA,2025
6344467,597264,Delaware Valley Aggies,597129,Cairn Highlanders,597129,2,bot,N. Schurga singled to right field; B. Gagnon advanced to second.,17,2025-03-26T00:00:00-04:00,"Stillman Athletic Complex (Langhorne, PA)",0,MBA,2025
6344467,597264,Delaware Valley Aggies,597129,Cairn Highlanders,597129,2,bot,D. Carafa struck out looking.,18,2025-03-26T00:00:00-04:00,"Stillman Athletic Complex (Langhorne, PA)",0,MBA,2025
6344467,597264,Delaware Valley Aggies,597129,Cairn Highlanders,597129,2,bot,N. Rush walked; N. Schurga advanced to second; B. Gagnon advanced to third.,19,2025-03-26T00:00:00-04:00,"Stillman Athletic Complex (Langhorne, PA)",0,MBA,2025
6344467,597264,Delaware Valley Aggies,597129,Cairn Highlanders,597129,2,bot,"D. Jackson walked, RBI; N. Rush advanced to second; N. Schurga advanced to third; B. Gagnon scored.",20,2025-03-26T00:00:00-04:00,"Stillman Athletic Complex (Langhorne, PA)",0,MBA,2025
6344467,597264,Delaware Valley Aggies,597129,Cairn Highlanders,597129,2,bot,N. Schurga out at home c to p.,21,2025-03-26T00:00:00-04:00,"Stillman Athletic Complex (Langhorne, PA)",0,MBA,2025
6344467,597264,Delaware Valley Aggies,597129,Cairn Highlanders,597264,3,top,E. Hughes to p for J. Battaglia.,22,2025-03-26T00:00:00-04:00,"Stillman Athletic Complex (Langhorne, PA)",0,MBA,2025
6344467,597264,Delaware Valley Aggies,597129,Cairn Highlanders,597264,3,top,P. Higgins walked.,23,2025-03-26T00:00:00-04:00,"Stillman Athletic Complex (Langhorne, PA)",0,MBA,2025
6344467,597264,Delaware Valley Aggies,597129,Cairn Highlanders,597264,3,top,L. Martin struck out swinging.,24,2025-03-26T00:00:00-04:00,"Stillman Athletic Complex (Langhorne, PA)",0,MBA,2025
6344467,597264,Delaware Valley Aggies,597129,Cairn Highlanders,597264,3,top,B. Ramos hit by pitch; P. Higgins advanced to second.,25,2025-03-26T00:00:00-04:00,"Stillman Athletic Complex (Langhorne, PA)",0,MBA,2025
6344467,597264,Delaware Valley Aggies,597129,Cairn Highlanders,597264,3,top,N. Ludwick struck out looking.,26,2025-03-26T00:00:00-04:00,"Stillman Athletic Complex (Langhorne, PA)",0,MBA,2025
6344467,597264,Delaware Valley Aggies,597129,Cairn Highlanders,597264,3,top,D. Murphy hit by pitch; B. Ramos advanced to second; P. Higgins advanced to third.,27,2025-03-26T00:00:00-04:00,"Stillman Athletic Complex (Langhorne, PA)",0,MBA,2025
6344467,597264,Delaware Valley Aggies,597129,Cairn Highlanders,597264,3,top,J. Miskanic grounded out to p.,28,2025-03-26T00:00:00-04:00,"Stillman Athletic Complex (Langhorne, PA)",0,MBA,2025
6344467,597264,Delaware Valley Aggies,597129,Cairn Highlanders,597129,3,bot,W. Wikner singled to center field.,29,2025-03-26T00:00:00-04:00,"Stillman Athletic Complex (Langhorne, PA)",0,MBA,2025
6344467,597264,Delaware Valley Aggies,597129,Cairn Highlanders,597129,3,bot,T. Warr popped up to 2b.,30,2025-03-26T00:00:00-04:00,"Stillman Athletic Complex (Langhorne, PA)",0,MBA,2025
6344467,597264,Delaware Valley Aggies,597129,Cairn Highlanders,597129,3,bot,Z. Bauers singled through the right side; W. Wikner advanced to second.,31,2025-03-26T00:00:00-04:00,"Stillman Athletic Complex (Langhorne, PA)",0,MBA,2025
6344467,597264,Delaware Valley Aggies,597129,Cairn Highlanders,597129,3,bot,C. Foley to p for L. Santise.,32,2025-03-26T00:00:00-04:00,"Stillman Athletic Complex (Langhorne, PA)",0,MBA,2025
6344467,597264,Delaware Valley Aggies,597129,Cairn Highlanders,597129,3,bot,Z. Bauers advanced to second; W. Wikner advanced to third on a wild pitch.,33,2025-03-26T00:00:00-04:00,"Stillman Athletic Complex (Langhorne, PA)",0,MBA,2025
6344467,597264,Delaware Valley Aggies,597129,Cairn Highlanders,597129,3,bot,A. Holt walked.,34,2025-03-26T00:00:00-04:00,"Stillman Athletic Complex (Langhorne, PA)",0,MBA,2025
6344467,597264,Delaware Valley Aggies,597129,Cairn Highlanders,597129,3,bot,"B. Gagnon singled through the left side, 2 RBI; A. Holt advanced to second; Z. Bauers scored; W. Wikner scored.",35,2025-03-26T00:00:00-04:00,"Stillman Athletic Complex (Langhorne, PA)",0,MBA,2025
6344467,597264,Delaware Valley Aggies,597129,Cairn Highlanders,597129,3,bot,N. Schurga walked; B. Gagnon advanced to second; A. Holt advanced to third.,36,2025-03-26T00:00:00-04:00,"Stillman Athletic Complex (Langhorne, PA)",0,MBA,2025
6344467,597264,Delaware Valley Aggies,597129,Cairn Highlanders,597129,3,bot,N. Schurga advanced to second; B. Gagnon advanced to third; A. Holt scored on a wild pitch.,37,2025-03-26T00:00:00-04:00,"Stillman Athletic Complex (Langhorne, PA)",0,MBA,2025
6344467,597264,Delaware Valley Aggies,597129,Cairn Highlanders,597129,3,bot,D. Carafa struck out looking.,38,2025-03-26T00:00:00-04:00,"Stillman Athletic Complex (Langhorne, PA)",0,MBA,2025
6344467,597264,Delaware Valley Aggies,597129,Cairn Highlanders,597129,3,bot,N. Rush struck out swinging.,39,2025-03-26T00:00:00-04:00,"Stillman Athletic Complex (Langhorne, PA)",0,MBA,2025
6344467,597264,Delaware Valley Aggies,597129,Cairn Highlanders,597264,4,top,T. Gossel fouled out to 3b.,40,2025-03-26T00:00:00-04:00,"Stillman Athletic Complex (Langhorne, PA)",0,MBA,2025
6344467,597264,Delaware Valley Aggies,597129,Cairn Highlanders,597264,4,top,G. Migliori walked.,41,2025-03-26T00:00:00-04:00,"Stillman Athletic Complex (Langhorne, PA)",0,MBA,2025
6344467,597264,Delaware Valley Aggies,597129,Cairn Highlanders,597264,4,top,G. Migliori stole second.,42,2025-03-26T00:00:00-04:00,"Stillman Athletic Complex (Langhorne, PA)",0,MBA,2025
6344467,597264,Delaware Valley Aggies,597129,Cairn Highlanders,597264,4,top,G. Migliori advanced to third on a wild pitch.,43,2025-03-26T00:00:00-04:00,"Stillman Athletic Complex (Langhorne, PA)",0,MBA,2025
6344467,597264,Delaware Valley Aggies,597129,Cairn Highlanders,597264,4,top,R. Hackett struck out looking.,44,2025-03-26T00:00:00-04:00,"Stillman Athletic Complex (Langhorne, PA)",0,MBA,2025
6344467,597264,Delaware Valley Aggies,597129,Cairn Highlanders,597264,4,top,G. Migliori scored on a passed ball.,45,2025-03-26T00:00:00-04:00,"Stillman Athletic Complex (Langhorne, PA)",0,MBA,2025
6344467,597264,Delaware Valley Aggies,597129,Cairn Highlanders,597264,4,top,P. Higgins singled to right field.,46,2025-03-26T00:00:00-04:00,"Stillman Athletic Complex (Langhorne, PA)",0,MBA,2025
6344467,597264,Delaware Valley Aggies,597129,Cairn Highlanders,597264,4,top,L. Martin walked; P. Higgins advanced to second.,47,2025-03-26T00:00:00-04:00,"Stillman Athletic Complex (Langhorne, PA)",0,MBA,2025
6344467,597264,Delaware Valley Aggies,597129,Cairn Highlanders,597264,4,top,B. Ramos reached on a fielder's choice; L. Martin advanced to second; P. Higgins out at third ss to 3b.,48,2025-03-26T00:00:00-04:00,"Stillman Athletic Complex (Langhorne, PA)",0,MBA,2025
6344467,597264,Delaware Valley Aggies,597129,Cairn Highlanders,597129,4,bot,D. Jackson doubled to right field.,49,2025-03-26T00:00:00-04:00,"Stillman Athletic Complex (Langhorne, PA)",0,MBA,2025
6344467,597264,Delaware Valley Aggies,597129,Cairn Highlanders,597129,4,bot,"W. Wikner singled through the left side, RBI; D. Jackson scored.",50,2025-03-26T00:00:00-04:00,"Stillman Athletic Complex (Langhorne, PA)",0,MBA,2025
6344467,597264,Delaware Valley Aggies,597129,Cairn Highlanders,597129,4,bot,J. Farrell to p for C. Foley.,51,2025-03-26T00:00:00-04:00,"Stillman Athletic Complex (Langhorne, PA)",0,MBA,2025
6344467,597264,Delaware Valley Aggies,597129,Cairn Highlanders,597129,4,bot,T. Warr singled to left field; W. Wikner advanced to second.,52,2025-03-26T00:00:00-04:00,"Stillman Athletic Complex (Langhorne, PA)",0,MBA,2025
6344467,597264,Delaware Valley Aggies,597129,Cairn Highlanders,597129,4,bot,"Z. Bauers singled, bunt; T. Warr advanced to second; W. Wikner advanced to third.",53,2025-03-26T00:00:00-04:00,"Stillman Athletic Complex (Langhorne, PA)",0,MBA,2025
6344467,597264,Delaware Valley Aggies,597129,Cairn Highlanders,597129,4,bot,"A. Holt tripled to right field, 3 RBI; Z. Bauers scored; T. Warr scored; W. Wikner scored.",54,2025-03-26T00:00:00-04:00,"Stillman Athletic Complex (Langhorne, PA)",0,MBA,2025
6344467,597264,Delaware Valley Aggies,597129,Cairn Highlanders,597129,4,bot,"B. Gagnon reached first on a throwing error by ss, RBI; A. Holt scored.",55,2025-03-26T00:00:00-04:00,"Stillman Athletic Complex (Langhorne, PA)",0,MBA,2025
6344467,597264,Delaware Valley Aggies,597129,Cairn Highlanders,597129,4,bot,B. Gagnon advanced to second on a wild pitch.,56,2025-03-26T00:00:00-04:00,"Stillman Athletic Complex (Langhorne, PA)",0,MBA,2025
6344467,597264,Delaware Valley Aggies,597129,Cairn Highlanders,597129,4,bot,N. Schurga grounded out to 2b; B. Gagnon advanced to third.,57,2025-03-26T00:00:00-04:00,"Stillman Athletic Complex (Langhorne, PA)",0,MBA,2025
6344467,597264,Delaware Valley Aggies,597129,Cairn Highlanders,597129,4,bot,D. Carafa walked.,58,2025-03-26T00:00:00-04:00,"Stillman Athletic Complex (Langhorne, PA)",0,MBA,2025
6344467,597264,Delaware Valley Aggies,597129,Cairn Highlanders,597129,4,bot,D. Carafa stole second.,59,2025-03-26T00:00:00-04:00,"Stillman Athletic Complex (Langhorne, PA)",0,MBA,2025
6344467,597264,Delaware Valley Aggies,597129,Cairn Highlanders,597129,4,bot,"N. Rush tripled to right field, 2 RBI; D. Carafa scored; B. Gagnon scored, unearned.",60,2025-03-26T00:00:00-04:00,"Stillman Athletic Complex (Langhorne, PA)",0,MBA,2025
6344467,597264,Delaware Valley Aggies,597129,Cairn Highlanders,597129,4,bot,"D. Jackson flied out to cf, sacrifice fly, RBI; N. Rush scored, unearned.",61,2025-03-26T00:00:00-04:00,"Stillman Athletic Complex (Langhorne, PA)",0,MBA,2025
6344467,597264,Delaware Valley Aggies,597129,Cairn Highlanders,597129,4,bot,W. Wikner flied out to lf.,62,2025-03-26T00:00:00-04:00,"Stillman Athletic Complex (Langhorne, PA)",0,MBA,2025
6344467,597264,Delaware Valley Aggies,597129,Cairn Highlanders,597264,5,top,N. Ludwick struck out looking.,63,2025-03-26T00:00:00-04:00,"Stillman Athletic Complex (Langhorne, PA)",0,MBA,2025
6344467,597264,Delaware Valley Aggies,597129,Cairn Highlanders,597264,5,top,D. Murphy walked.,64,2025-03-26T00:00:00-04:00,"Stillman Athletic Complex (Langhorne, PA)",0,MBA,2025
6344467,597264,Delaware Valley Aggies,597129,Cairn Highlanders,597264,5,top,D. Murphy advanced to second on a wild pitch.,65,2025-03-26T00:00:00-04:00,"Stillman Athletic Complex (Langhorne, PA)",0,MBA,2025
6344467,597264,Delaware Valley Aggies,597129,Cairn Highlanders,597264,5,top,J. Miskanic walked.,66,2025-03-26T00:00:00-04:00,"Stillman Athletic Complex (Langhorne, PA)",0,MBA,2025
6344467,597264,Delaware Valley Aggies,597129,Cairn Highlanders,597264,5,top,T. Gossel struck out swinging.,67,2025-03-26T00:00:00-04:00,"Stillman Athletic Complex (Langhorne, PA)",0,MBA,2025
6344467,597264,Delaware Valley Aggies,597129,Cairn Highlanders,597264,5,top,"G. Migliori singled through the left side, RBI; J. Miskanic advanced to second; D. Murphy scored.",68,2025-03-26T00:00:00-04:00,"Stillman Athletic Complex (Langhorne, PA)",0,MBA,2025
6344467,597264,Delaware Valley Aggies,597129,Cairn Highlanders,597264,5,top,R. Hackett walked; G. Migliori advanced to second; J. Miskanic advanced to third.,69,2025-03-26T00:00:00-04:00,"Stillman Athletic Complex (Langhorne, PA)",0,MBA,2025
6344467,597264,Delaware Valley Aggies,597129,Cairn Highlanders,597264,5,top,J. Wright to p for E. Hughes.,70,2025-03-26T00:00:00-04:00,"Stillman Athletic Complex (Langhorne, PA)",0,MBA,2025
6344467,597264,Delaware Valley Aggies,597129,Cairn Highlanders,597264,5,top,"P. Higgins walked, RBI; R. Hackett advanced to second; G. Migliori advanced to third; J. Miskanic scored.",71,2025-03-26T00:00:00-04:00,"Stillman Athletic Complex (Langhorne, PA)",0,MBA,2025
6344467,597264,Delaware Valley Aggies,597129,Cairn Highlanders,597264,5,top,"L. Martin singled to shortstop, RBI; P. Higgins advanced to second; R. Hackett advanced to third; G. Migliori scored.",72,2025-03-26T00:00:00-04:00,"Stillman Athletic Complex (Langhorne, PA)",0,MBA,2025
6344467,597264,Delaware Valley Aggies,597129,Cairn Highlanders,597264,5,top,B. Ramos flied out to cf.,73,2025-03-26T00:00:00-04:00,"Stillman Athletic Complex (Langhorne, PA)",0,MBA,2025
6344467,597264,Delaware Valley Aggies,597129,Cairn Highlanders,597129,5,bot,T. Warr walked.,74,2025-03-26T00:00:00-04:00,"Stillman Athletic Complex (Langhorne, PA)",0,MBA,2025
6344467,597264,Delaware Valley Aggies,597129,Cairn Highlanders,597129,5,bot,Z. Bauers flied out to cf.,75,2025-03-26T00:00:00-04:00,"Stillman Athletic Complex (Langhorne, PA)",0,MBA,2025
6344467,597264,Delaware Valley Aggies,597129,Cairn Highlanders,597129,5,bot,T. Warr stole second.,76,2025-03-26T00:00:00-04:00,"Stillman Athletic Complex (Langhorne, PA)",0,MBA,2025
6344467,597264,Delaware Valley Aggies,597129,Cairn Highlanders,597129,5,bot,A. Holt flied out to cf.,77,2025-03-26T00:00:00-04:00,"Stillman Athletic Complex (Langhorne, PA)",0,MBA,2025
6344467,597264,Delaware Valley Aggies,597129,Cairn Highlanders,597129,5,bot,"B. Gagnon singled up the middle, RBI; T. Warr scored.",78,2025-03-26T00:00:00-04:00,"Stillman Athletic Complex (Langhorne, PA)",0,MBA,2025
6344467,597264,Delaware Valley Aggies,597129,Cairn Highlanders,597129,5,bot,"N. Schurga tripled to right field, RBI; B. Gagnon scored.",79,2025-03-26T00:00:00-04:00,"Stillman Athletic Complex (Langhorne, PA)",0,MBA,2025
6344467,597264,Delaware Valley Aggies,597129,Cairn Highlanders,597129,5,bot,D. Carafa grounded out to 2b.,80,2025-03-26T00:00:00-04:00,"Stillman Athletic Complex (Langhorne, PA)",0,MBA,2025
6344467,597264,Delaware Valley Aggies,597129,Cairn Highlanders,597264,6,top,N. Ludwick struck out looking.,81,2025-03-26T00:00:00-04:00,"Stillman Athletic Complex (Langhorne, PA)",0,MBA,2025
6344467,597264,Delaware Valley Aggies,597129,Cairn Highlanders,597264,6,top,D. Murphy singled down the rf line.,82,2025-03-26T00:00:00-04:00,"Stillman Athletic Complex (Langhorne, PA)",0,MBA,2025
6344467,597264,Delaware Valley Aggies,597129,Cairn Highlanders,597264,6,top,J. Miskanic flied out to rf.,83,2025-03-26T00:00:00-04:00,"Stillman Athletic Complex (Langhorne, PA)",0,MBA,2025
6344467,597264,Delaware Valley Aggies,597129,Cairn Highlanders,597264,6,top,T. Gossel singled through the left side; D. Murphy advanced to second.,84,2025-03-26T00:00:00-04:00,"Stillman Athletic Complex (Langhorne, PA)",0,MBA,2025
6344467,597264,Delaware Valley Aggies,597129,Cairn Highlanders,597264,6,top,G. Migliori flied out to rf.,85,2025-03-26T00:00:00-04:00,"Stillman Athletic Complex (Langhorne, PA)",0,MBA,2025
6344467,597264,Delaware Valley Aggies,597129,Cairn Highlanders,597129,6,bot,C. Newman to p for J. Farrell.,86,2025-03-26T00:00:00-04:00,"Stillman Athletic Complex (Langhorne, PA)",0,MBA,2025
6344467,597264,Delaware Valley Aggies,597129,Cairn Highlanders,597129,6,bot,N. Rush struck out looking.,87,2025-03-26T00:00:00-04:00,"Stillman Athletic Complex (Langhorne, PA)",0,MBA,2025
6344467,597264,Delaware Valley Aggies,597129,Cairn Highlanders,597129,6,bot,D. Jackson flied out to cf to right center.,88,2025-03-26T00:00:00-04:00,"Stillman Athletic Complex (Langhorne, PA)",0,MBA,2025
6344467,597264,Delaware Valley Aggies,597129,Cairn Highlanders,597129,6,bot,W. Wikner singled to right field.,89,2025-03-26T00:00:00-04:00,"Stillman Athletic Complex (Langhorne, PA)",0,MBA,2025
6344467,597264,Delaware Valley Aggies,597129,Cairn Highlanders,597129,6,bot,S. Persiani pinch ran for W. Wikner.,90,2025-03-26T00:00:00-04:00,"Stillman Athletic Complex (Langhorne, PA)",0,MBA,2025
6344467,597264,Delaware Valley Aggies,597129,Cairn Highlanders,597129,6,bot,S. Persiani advanced to second on a wild pitch.,91,2025-03-26T00:00:00-04:00,"Stillman Athletic Complex (Langhorne, PA)",0,MBA,2025
6344467,597264,Delaware Valley Aggies,597129,Cairn Highlanders,597129,6,bot,"T. Warr reached first on a throwing error by ss; S. Persiani scored, unearned.",92,2025-03-26T00:00:00-04:00,"Stillman Athletic Complex (Langhorne, PA)",0,MBA,2025
6344467,597264,Delaware Valley Aggies,597129,Cairn Highlanders,597129,6,bot,N. Brittin pinch hit for Z. Bauers.,93,2025-03-26T00:00:00-04:00,"Stillman Athletic Complex (Langhorne, PA)",0,MBA,2025
6344467,597264,Delaware Valley Aggies,597129,Cairn Highlanders,597129,6,bot,T. Warr advanced to second on a wild pitch.,94,2025-03-26T00:00:00-04:00,"Stillman Athletic Complex (Langhorne, PA)",0,MBA,2025
6344467,597264,Delaware Valley Aggies,597129,Cairn Highlanders,597129,6,bot,N. Brittin grounded out to ss.,95,2025-03-26T00:00:00-04:00,"Stillman Athletic Complex (Langhorne, PA)",0,MBA,2025
6344467,597264,Delaware Valley Aggies,597129,Cairn Highlanders,597264,7,top,J. Wtulich to rf for D. Jackson.,96,2025-03-26T00:00:00-04:00,"Stillman Athletic Complex (Langhorne, PA)",0,MBA,2025
6344467,597264,Delaware Valley Aggies,597129,Cairn Highlanders,597264,7,top,S. Persiani to cf.,97,2025-03-26T00:00:00-04:00,"Stillman Athletic Complex (Langhorne, PA)",0,MBA,2025
6344467,597264,Delaware Valley Aggies,597129,Cairn Highlanders,597264,7,top,N. Brittin to c.,98,2025-03-26T00:00:00-04:00,"Stillman Athletic Complex (Langhorne, PA)",0,MBA,2025
6344467,597264,Delaware Valley Aggies,597129,Cairn Highlanders,597264,7,top,Z. Dennis to p for J. Wright.,99,2025-03-26T00:00:00-04:00,"Stillman Athletic Complex (Langhorne, PA)",0,MBA,2025
6344467,597264,Delaware Valley Aggies,597129,Cairn Highlanders,597264,7,top,R. Hackett singled up the middle.,100,2025-03-26T00:00:00-04:00,"Stillman Athletic Complex (Langhorne, PA)",0,MBA,2025
6344467,597264,Delaware Valley Aggies,597129,Cairn Highlanders,597264,7,top,J. Koenig pinch hit for P. Higgins.,101,2025-03-26T00:00:00-04:00,"Stillman Athletic Complex (Langhorne, PA)",0,MBA,2025
6344467,597264,Delaware Valley Aggies,597129,Cairn Highlanders,597264,7,top,R. Hackett advanced to second on a passed ball.,102,2025-03-26T00:00:00-04:00,"Stillman Athletic Complex (Langhorne, PA)",0,MBA,2025
6344467,597264,Delaware Valley Aggies,597129,Cairn Highlanders,597264,7,top,J. Koenig struck out swinging.,103,2025-03-26T00:00:00-04:00,"Stillman Athletic Complex (Langhorne, PA)",0,MBA,2025
6344467,597264,Delaware Valley Aggies,597129,Cairn Highlanders,597264,7,top,R. Hackett advanced to third on a passed ball.,104,2025-03-26T00:00:00-04:00,"Stillman Athletic Complex (Langhorne, PA)",0,MBA,2025
6344467,597264,Delaware Valley Aggies,597129,Cairn Highlanders,597264,7,top,L. Martin lined out to ss.,105,2025-03-26T00:00:00-04:00,"Stillman Athletic Complex (Langhorne, PA)",0,MBA,2025
6344467,597264,Delaware Valley Aggies,597129,Cairn Highlanders,597264,7,top,A. Schneider pinch hit for B. Ramos.,106,2025-03-26T00:00:00-04:00,"Stillman Athletic Complex (Langhorne, PA)",0,MBA,2025
6344467,597264,Delaware Valley Aggies,597129,Cairn Highlanders,597264,7,top,A. Schneider flied out to lf.,107,2025-03-26T00:00:00-04:00,"Stillman Athletic Complex (Langhorne, PA)",0,MBA,2025
6344467,597264,Delaware Valley Aggies,597129,Cairn Highlanders,597129,7,bot,J. Dzielawa to 1b for N. Ludwick.,108,2025-03-26T00:00:00-04:00,"Stillman Athletic Complex (Langhorne, PA)",0,MBA,2025
6344467,597264,Delaware Valley Aggies,597129,Cairn Highlanders,597129,7,bot,J. Seibert to ss for J. Miskanic.,109,2025-03-26T00:00:00-04:00,"Stillman Athletic Complex (Langhorne, PA)",0,MBA,2025
6344467,597264,Delaware Valley Aggies,597129,Cairn Highlanders,597129,7,bot,J. Koenig to 2b.,110,2025-03-26T00:00:00-04:00,"Stillman Athletic Complex (Langhorne, PA)",0,MBA,2025
6344467,597264,Delaware Valley Aggies,597129,Cairn Highlanders,597129,7,bot,J. Dehaven to p for C. Newman.,111,2025-03-26T00:00:00-04:00,"Stillman Athletic Complex (Langhorne, PA)",0,MBA,2025
6344467,597264,Delaware Valley Aggies,597129,Cairn Highlanders,597129,7,bot,J. Ecenroad to 3b for D. Murphy.,112,2025-03-26T00:00:00-04:00,"Stillman Athletic Complex (Langhorne, PA)",0,MBA,2025
6344467,597264,Delaware Valley Aggies,597129,Cairn Highlanders,597129,7,bot,J. Esbenshad pinch hit for A. Holt.,113,2025-03-26T00:00:00-04:00,"Stillman Athletic Complex (Langhorne, PA)",0,MBA,2025
6344467,597264,Delaware Valley Aggies,597129,Cairn Highlanders,597129,7,bot,J. Esbenshad hit by pitch.,114,2025-03-26T00:00:00-04:00,"Stillman Athletic Complex (Langhorne, PA)",0,MBA,2025
6344467,597264,Delaware Valley Aggies,597129,Cairn Highlanders,597129,7,bot,T. Harris pinch hit for B. Gagnon.,115,2025-03-26T00:00:00-04:00,"Stillman Athletic Complex (Langhorne, PA)",0,MBA,2025
6344467,597264,Delaware Valley Aggies,597129,Cairn Highlanders,597129,7,bot,T. Harris walked; J. Esbenshad advanced to second.,116,2025-03-26T00:00:00-04:00,"Stillman Athletic Complex (Langhorne, PA)",0,MBA,2025
6344467,597264,Delaware Valley Aggies,597129,Cairn Highlanders,597129,7,bot,J. Alley pinch hit for N. Schurga.,117,2025-03-26T00:00:00-04:00,"Stillman Athletic Complex (Langhorne, PA)",0,MBA,2025
6344467,597264,Delaware Valley Aggies,597129,Cairn Highlanders,597129,7,bot,J. Alley struck out looking.,118,2025-03-26T00:00:00-04:00,"Stillman Athletic Complex (Langhorne, PA)",0,MBA,2025
6344467,597264,Delaware Valley Aggies,597129,Cairn Highlanders,597129,7,bot,D. Carafa struck out looking.,119,2025-03-26T00:00:00-04:00,"Stillman Athletic Complex (Langhorne, PA)",0,MBA,2025
6344467,597264,Delaware Valley Aggies,597129,Cairn Highlanders,597129,7,bot,T. Harris advanced to second; J. Esbenshad advanced to third on a wild pitch.,120,2025-03-26T00:00:00-04:00,"Stillman Athletic Complex (Langhorne, PA)",0,MBA,2025
6344467,597264,Delaware Valley Aggies,597129,Cairn Highlanders,597129,7,bot,N. Rush struck out swinging.,121,2025-03-26T00:00:00-04:00,"Stillman Athletic Complex (Langhorne, PA)",0,MBA,2025
6344467,597264,Delaware Valley Aggies,597129,Cairn Highlanders,597264,8,top,G. Villegas to 2b for J. Esbenshad.,122,2025-03-26T00:00:00-04:00,"Stillman Athletic Complex (Langhorne, PA)",0,MBA,2025
6344467,597264,Delaware Valley Aggies,597129,Cairn Highlanders,597264,8,top,J. Alley to ss.,123,2025-03-26T00:00:00-04:00,"Stillman Athletic Complex (Langhorne, PA)",0,MBA,2025
6344467,597264,Delaware Valley Aggies,597129,Cairn Highlanders,597264,8,top,C. Ferguson to p for Z. Dennis.,124,2025-03-26T00:00:00-04:00,"Stillman Athletic Complex (Langhorne, PA)",0,MBA,2025
6344467,597264,Delaware Valley Aggies,597129,Cairn Highlanders,597264,8,top,J. Dzielawa struck out looking.,125,2025-03-26T00:00:00-04:00,"Stillman Athletic Complex (Langhorne, PA)",0,MBA,2025
6344467,597264,Delaware Valley Aggies,597129,Cairn Highlanders,597264,8,top,J. Ecenroad grounded out to ss.,126,2025-03-26T00:00:00-04:00,"Stillman Athletic Complex (Langhorne, PA)",0,MBA,2025
