game_id,away_team_id,away_team_name,home_team_id,home_team_name,batting_team,inning,top_bot,event_text,event_num,game_datetime,stadium_name,attendance,sport_id,season
6344998,596881,East Stroudsburg Warriors,596863,Bloomsburg Huskies,596881,1,top,D. Pierce walked (3-0 BBBB).,1,2025-03-29T00:00:00-04:00,"Danny Litwhiler Field (Bloomsburg, PA)",147,MBA,2025
6344998,596881,East Stroudsburg Warriors,596863,Bloomsburg Huskies,596881,1,top,S. Wall singled to left field (2-1 BBK)3a D. Pierce advanced to second.,2,2025-03-29T00:00:00-04:00,"Danny Litwhiler Field (Bloomsburg, PA)",147,MBA,2025
6344998,596881,East Stroudsburg Warriors,596863,Bloomsburg Huskies,596881,1,top,C. Albus struck out swinging (1-2 FBFS).,3,2025-03-29T00:00:00-04:00,"Danny Litwhiler Field (Bloomsburg, PA)",147,MBA,2025
6344998,596881,East Stroudsburg Warriors,596863,Bloomsburg Huskies,596881,1,top,"Rothenhausle homered to right center, 3 RBI (1-2 KKBFF)3a S. Wall scored3a D. Pierce scored.",4,2025-03-29T00:00:00-04:00,"Danny Litwhiler Field (Bloomsburg, PA)",147,MBA,2025
6344998,596881,East Stroudsburg Warriors,596863,Bloomsburg Huskies,596881,1,top,P. Frey walked (3-1 BBBKB).,5,2025-03-29T00:00:00-04:00,"Danny Litwhiler Field (Bloomsburg, PA)",147,MBA,2025
6344998,596881,East Stroudsburg Warriors,596863,Bloomsburg Huskies,596881,1,top,W. Zampella walked (3-1 BBFBB)3a P. Frey advanced to second.,6,2025-03-29T00:00:00-04:00,"Danny Litwhiler Field (Bloomsburg, PA)",147,MBA,2025
6344998,596881,East Stroudsburg Warriors,596863,Bloomsburg Huskies,596881,1,top,J. Bonner flied out to rf (0-2 KS).,7,2025-03-29T00:00:00-04:00,"Danny Litwhiler Field (Bloomsburg, PA)",147,MBA,2025
6344998,596881,East Stroudsburg Warriors,596863,Bloomsburg Huskies,596881,1,top,C. Reilly grounded out to ss (1-1 BF).,8,2025-03-29T00:00:00-04:00,"Danny Litwhiler Field (Bloomsburg, PA)",147,MBA,2025
6344998,596881,East Stroudsburg Warriors,596863,Bloomsburg Huskies,596863,1,bot,C. Daniels walked (3-2 BKBBKFB).,9,2025-03-29T00:00:00-04:00,"Danny Litwhiler Field (Bloomsburg, PA)",147,MBA,2025
6344998,596881,East Stroudsburg Warriors,596863,Bloomsburg Huskies,596863,1,bot,J. Reifer hit by pitch (0-1 K)3a C. Daniels advanced to second.,10,2025-03-29T00:00:00-04:00,"Danny Litwhiler Field (Bloomsburg, PA)",147,MBA,2025
6344998,596881,East Stroudsburg Warriors,596863,Bloomsburg Huskies,596863,1,bot,G. Cristino struck out swinging (1-2 BFSS).,11,2025-03-29T00:00:00-04:00,"Danny Litwhiler Field (Bloomsburg, PA)",147,MBA,2025
6344998,596881,East Stroudsburg Warriors,596863,Bloomsburg Huskies,596863,1,bot,"J. Wilson singled to right field (1-0 B)3a J. Reifer advanced to second, out at third rf to 1b to ss to 3b3a C. Daniels advanced to third.",12,2025-03-29T00:00:00-04:00,"Danny Litwhiler Field (Bloomsburg, PA)",147,MBA,2025
6344998,596881,East Stroudsburg Warriors,596863,Bloomsburg Huskies,596863,1,bot,M. Miller walked (3-1 SBBBB)3a J. Wilson advanced to second.,13,2025-03-29T00:00:00-04:00,"Danny Litwhiler Field (Bloomsburg, PA)",147,MBA,2025
6344998,596881,East Stroudsburg Warriors,596863,Bloomsburg Huskies,596863,1,bot,B. Ebbert grounded out to 2b (1-2 FSFB).,14,2025-03-29T00:00:00-04:00,"Danny Litwhiler Field (Bloomsburg, PA)",147,MBA,2025
6344998,596881,East Stroudsburg Warriors,596863,Bloomsburg Huskies,596881,2,top,F. Taveras walked (3-1 BBKBB).,15,2025-03-29T00:00:00-04:00,"Danny Litwhiler Field (Bloomsburg, PA)",147,MBA,2025
6344998,596881,East Stroudsburg Warriors,596863,Bloomsburg Huskies,596881,2,top,"F. Taveras out at second c to 2b, caught stealing.",16,2025-03-29T00:00:00-04:00,"Danny Litwhiler Field (Bloomsburg, PA)",147,MBA,2025
6344998,596881,East Stroudsburg Warriors,596863,Bloomsburg Huskies,596881,2,top,D. Pierce flied out to cf (2-2 BBSFF).,17,2025-03-29T00:00:00-04:00,"Danny Litwhiler Field (Bloomsburg, PA)",147,MBA,2025
6344998,596881,East Stroudsburg Warriors,596863,Bloomsburg Huskies,596881,2,top,S. Wall walked (3-0 BBBB).,18,2025-03-29T00:00:00-04:00,"Danny Litwhiler Field (Bloomsburg, PA)",147,MBA,2025
6344998,596881,East Stroudsburg Warriors,596863,Bloomsburg Huskies,596881,2,top,S. Gilbert to p for B. Hammaker.,19,2025-03-29T00:00:00-04:00,"Danny Litwhiler Field (Bloomsburg, PA)",147,MBA,2025
6344998,596881,East Stroudsburg Warriors,596863,Bloomsburg Huskies,596881,2,top,C. Albus struck out swinging (3-2 BKSBBS).,20,2025-03-29T00:00:00-04:00,"Danny Litwhiler Field (Bloomsburg, PA)",147,MBA,2025
6344998,596881,East Stroudsburg Warriors,596863,Bloomsburg Huskies,596863,2,bot,D.Balestrini struck out looking (1-2 FKBK).,21,2025-03-29T00:00:00-04:00,"Danny Litwhiler Field (Bloomsburg, PA)",147,MBA,2025
6344998,596881,East Stroudsburg Warriors,596863,Bloomsburg Huskies,596863,2,bot,"J. Miller homered to left center, RBI (3-1 BBBK).",22,2025-03-29T00:00:00-04:00,"Danny Litwhiler Field (Bloomsburg, PA)",147,MBA,2025
6344998,596881,East Stroudsburg Warriors,596863,Bloomsburg Huskies,596863,2,bot,J. Levis flied out to rf down the lf line (3-2 BKBKFB).,23,2025-03-29T00:00:00-04:00,"Danny Litwhiler Field (Bloomsburg, PA)",147,MBA,2025
6344998,596881,East Stroudsburg Warriors,596863,Bloomsburg Huskies,596863,2,bot,C. Daniels grounded out to ss (0-0).,24,2025-03-29T00:00:00-04:00,"Danny Litwhiler Field (Bloomsburg, PA)",147,MBA,2025
6344998,596881,East Stroudsburg Warriors,596863,Bloomsburg Huskies,596881,3,top,"Rothenhausle homered to left field, RBI (1-1 KB).",25,2025-03-29T00:00:00-04:00,"Danny Litwhiler Field (Bloomsburg, PA)",147,MBA,2025
6344998,596881,East Stroudsburg Warriors,596863,Bloomsburg Huskies,596881,3,top,P. Frey doubled to right field (0-1 K).,26,2025-03-29T00:00:00-04:00,"Danny Litwhiler Field (Bloomsburg, PA)",147,MBA,2025
6344998,596881,East Stroudsburg Warriors,596863,Bloomsburg Huskies,596881,3,top,W. Zampella walked (3-1 BFBBB).,27,2025-03-29T00:00:00-04:00,"Danny Litwhiler Field (Bloomsburg, PA)",147,MBA,2025
6344998,596881,East Stroudsburg Warriors,596863,Bloomsburg Huskies,596881,3,top,J. Bonner popped up to ss (3-2 BBFBS).,28,2025-03-29T00:00:00-04:00,"Danny Litwhiler Field (Bloomsburg, PA)",147,MBA,2025
6344998,596881,East Stroudsburg Warriors,596863,Bloomsburg Huskies,596881,3,top,"C. Reilly singled through the left side, RBI (0-2 KK)3a W. Zampella advanced to second3a P. Frey scored.",29,2025-03-29T00:00:00-04:00,"Danny Litwhiler Field (Bloomsburg, PA)",147,MBA,2025
6344998,596881,East Stroudsburg Warriors,596863,Bloomsburg Huskies,596881,3,top,E. Albert pinch hit for F. Taveras.,30,2025-03-29T00:00:00-04:00,"Danny Litwhiler Field (Bloomsburg, PA)",147,MBA,2025
6344998,596881,East Stroudsburg Warriors,596863,Bloomsburg Huskies,596881,3,top,E. Albert popped up to 2b (2-1 BBK).,31,2025-03-29T00:00:00-04:00,"Danny Litwhiler Field (Bloomsburg, PA)",147,MBA,2025
6344998,596881,East Stroudsburg Warriors,596863,Bloomsburg Huskies,596881,3,top,"D. Pierce homered to center field, 3 RBI (2-1 BBF)3a C. Reilly scored3a W. Zampella scored.",32,2025-03-29T00:00:00-04:00,"Danny Litwhiler Field (Bloomsburg, PA)",147,MBA,2025
6344998,596881,East Stroudsburg Warriors,596863,Bloomsburg Huskies,596881,3,top,M. Marsten to p for S. Gilbert.,33,2025-03-29T00:00:00-04:00,"Danny Litwhiler Field (Bloomsburg, PA)",147,MBA,2025
6344998,596881,East Stroudsburg Warriors,596863,Bloomsburg Huskies,596881,3,top,S. Wall popped up to ss (1-0 B).,34,2025-03-29T00:00:00-04:00,"Danny Litwhiler Field (Bloomsburg, PA)",147,MBA,2025
6344998,596881,East Stroudsburg Warriors,596863,Bloomsburg Huskies,596863,3,bot,E. Albert to ss.,35,2025-03-29T00:00:00-04:00,"Danny Litwhiler Field (Bloomsburg, PA)",147,MBA,2025
6344998,596881,East Stroudsburg Warriors,596863,Bloomsburg Huskies,596863,3,bot,J. Reifer singled through the left side (0-2 SK).,36,2025-03-29T00:00:00-04:00,"Danny Litwhiler Field (Bloomsburg, PA)",147,MBA,2025
6344998,596881,East Stroudsburg Warriors,596863,Bloomsburg Huskies,596863,3,bot,G. Cristino grounded into double play 3b to 2b to 1b (0-1 K)3a J. Reifer out on the play.,37,2025-03-29T00:00:00-04:00,"Danny Litwhiler Field (Bloomsburg, PA)",147,MBA,2025
6344998,596881,East Stroudsburg Warriors,596863,Bloomsburg Huskies,596863,3,bot,J. Wilson flied out to cf (2-0 BB).,38,2025-03-29T00:00:00-04:00,"Danny Litwhiler Field (Bloomsburg, PA)",147,MBA,2025
6344998,596881,East Stroudsburg Warriors,596863,Bloomsburg Huskies,596881,4,top,C. Albus walked (3-2 BBKKBB).,39,2025-03-29T00:00:00-04:00,"Danny Litwhiler Field (Bloomsburg, PA)",147,MBA,2025
6344998,596881,East Stroudsburg Warriors,596863,Bloomsburg Huskies,596881,4,top,C. Albus advanced to second on a wild pitch.,40,2025-03-29T00:00:00-04:00,"Danny Litwhiler Field (Bloomsburg, PA)",147,MBA,2025
6344998,596881,East Stroudsburg Warriors,596863,Bloomsburg Huskies,596881,4,top,Rothenhausle walked (3-0 BBBB).,41,2025-03-29T00:00:00-04:00,"Danny Litwhiler Field (Bloomsburg, PA)",147,MBA,2025
6344998,596881,East Stroudsburg Warriors,596863,Bloomsburg Huskies,596881,4,top,"P. Frey homered to right field, 3 RBI (0-0)3a Rothenhausle scored3a C. Albus scored.",42,2025-03-29T00:00:00-04:00,"Danny Litwhiler Field (Bloomsburg, PA)",147,MBA,2025
6344998,596881,East Stroudsburg Warriors,596863,Bloomsburg Huskies,596881,4,top,W. Zampella walked (3-1 BSBBB).,43,2025-03-29T00:00:00-04:00,"Danny Litwhiler Field (Bloomsburg, PA)",147,MBA,2025
6344998,596881,East Stroudsburg Warriors,596863,Bloomsburg Huskies,596881,4,top,R. Manning pinch hit for J. Bonner.,44,2025-03-29T00:00:00-04:00,"Danny Litwhiler Field (Bloomsburg, PA)",147,MBA,2025
6344998,596881,East Stroudsburg Warriors,596863,Bloomsburg Huskies,596881,4,top,W. Zampella advanced to second on a wild pitch.,45,2025-03-29T00:00:00-04:00,"Danny Litwhiler Field (Bloomsburg, PA)",147,MBA,2025
6344998,596881,East Stroudsburg Warriors,596863,Bloomsburg Huskies,596881,4,top,R. Manning singled to right field (0-0)3a W. Zampella advanced to third.,46,2025-03-29T00:00:00-04:00,"Danny Litwhiler Field (Bloomsburg, PA)",147,MBA,2025
6344998,596881,East Stroudsburg Warriors,596863,Bloomsburg Huskies,596881,4,top,"C. Reilly grounded into double play ss to 2b to 1b, RBI (3-2 KBBKFB)3a R. Manning out on the play3a W. Zampella scored.",47,2025-03-29T00:00:00-04:00,"Danny Litwhiler Field (Bloomsburg, PA)",147,MBA,2025
6344998,596881,East Stroudsburg Warriors,596863,Bloomsburg Huskies,596881,4,top,E. Albert struck out looking (0-2 FKK).,48,2025-03-29T00:00:00-04:00,"Danny Litwhiler Field (Bloomsburg, PA)",147,MBA,2025
6344998,596881,East Stroudsburg Warriors,596863,Bloomsburg Huskies,596863,4,bot,R. Manning to lf.,49,2025-03-29T00:00:00-04:00,"Danny Litwhiler Field (Bloomsburg, PA)",147,MBA,2025
6344998,596881,East Stroudsburg Warriors,596863,Bloomsburg Huskies,596863,4,bot,M. Miller grounded out to ss (2-2 KBKFB).,50,2025-03-29T00:00:00-04:00,"Danny Litwhiler Field (Bloomsburg, PA)",147,MBA,2025
6344998,596881,East Stroudsburg Warriors,596863,Bloomsburg Huskies,596863,4,bot,B. Ebbert struck out looking (0-2 SSK).,51,2025-03-29T00:00:00-04:00,"Danny Litwhiler Field (Bloomsburg, PA)",147,MBA,2025
6344998,596881,East Stroudsburg Warriors,596863,Bloomsburg Huskies,596863,4,bot,D.Balestrini singled through the right side (3-2 BFBBK).,52,2025-03-29T00:00:00-04:00,"Danny Litwhiler Field (Bloomsburg, PA)",147,MBA,2025
6344998,596881,East Stroudsburg Warriors,596863,Bloomsburg Huskies,596863,4,bot,J. Miller singled to left center (1-1 KB)3a D.Balestrini advanced to second.,53,2025-03-29T00:00:00-04:00,"Danny Litwhiler Field (Bloomsburg, PA)",147,MBA,2025
6344998,596881,East Stroudsburg Warriors,596863,Bloomsburg Huskies,596863,4,bot,J. Stine pinch hit for J. Levis.,54,2025-03-29T00:00:00-04:00,"Danny Litwhiler Field (Bloomsburg, PA)",147,MBA,2025
6344998,596881,East Stroudsburg Warriors,596863,Bloomsburg Huskies,596863,4,bot,J. Stine flied out to lf (0-0).,55,2025-03-29T00:00:00-04:00,"Danny Litwhiler Field (Bloomsburg, PA)",147,MBA,2025
6344998,596881,East Stroudsburg Warriors,596863,Bloomsburg Huskies,596881,5,top,D.Balestrini to c.,56,2025-03-29T00:00:00-04:00,"Danny Litwhiler Field (Bloomsburg, PA)",147,MBA,2025
6344998,596881,East Stroudsburg Warriors,596863,Bloomsburg Huskies,596881,5,top,J. Stine to lf.,57,2025-03-29T00:00:00-04:00,"Danny Litwhiler Field (Bloomsburg, PA)",147,MBA,2025
6344998,596881,East Stroudsburg Warriors,596863,Bloomsburg Huskies,596881,5,top,B. Walsh to p for M. Marsten.,58,2025-03-29T00:00:00-04:00,"Danny Litwhiler Field (Bloomsburg, PA)",147,MBA,2025
6344998,596881,East Stroudsburg Warriors,596863,Bloomsburg Huskies,596881,5,top,D. Pierce walked (3-2 BBKBKB).,59,2025-03-29T00:00:00-04:00,"Danny Litwhiler Field (Bloomsburg, PA)",147,MBA,2025
6344998,596881,East Stroudsburg Warriors,596863,Bloomsburg Huskies,596881,5,top,T. Davis pinch ran for D. Pierce.,60,2025-03-29T00:00:00-04:00,"Danny Litwhiler Field (Bloomsburg, PA)",147,MBA,2025
6344998,596881,East Stroudsburg Warriors,596863,Bloomsburg Huskies,596881,5,top,S. Wall walked (3-1 BBSBB)3a T. Davis advanced to second.,61,2025-03-29T00:00:00-04:00,"Danny Litwhiler Field (Bloomsburg, PA)",147,MBA,2025
6344998,596881,East Stroudsburg Warriors,596863,Bloomsburg Huskies,596881,5,top,C. Albus popped up to ss (1-1 BK).,62,2025-03-29T00:00:00-04:00,"Danny Litwhiler Field (Bloomsburg, PA)",147,MBA,2025
6344998,596881,East Stroudsburg Warriors,596863,Bloomsburg Huskies,596881,5,top,Rothenhausle singled to left field (2-0 BB)3a S. Wall advanced to second3a T. Davis advanced to third.,63,2025-03-29T00:00:00-04:00,"Danny Litwhiler Field (Bloomsburg, PA)",147,MBA,2025
6344998,596881,East Stroudsburg Warriors,596863,Bloomsburg Huskies,596881,5,top,P. Frey popped up to ss (3-2 KBBFBFF).,64,2025-03-29T00:00:00-04:00,"Danny Litwhiler Field (Bloomsburg, PA)",147,MBA,2025
6344998,596881,East Stroudsburg Warriors,596863,Bloomsburg Huskies,596881,5,top,B. D'Amico pinch hit for W. Zampella.,65,2025-03-29T00:00:00-04:00,"Danny Litwhiler Field (Bloomsburg, PA)",147,MBA,2025
6344998,596881,East Stroudsburg Warriors,596863,Bloomsburg Huskies,596881,5,top,B. D'Amico struck out swinging (2-2 BKBSS).,66,2025-03-29T00:00:00-04:00,"Danny Litwhiler Field (Bloomsburg, PA)",147,MBA,2025
6344998,596881,East Stroudsburg Warriors,596863,Bloomsburg Huskies,596863,5,bot,T. Davis to rf.,67,2025-03-29T00:00:00-04:00,"Danny Litwhiler Field (Bloomsburg, PA)",147,MBA,2025
6344998,596881,East Stroudsburg Warriors,596863,Bloomsburg Huskies,596863,5,bot,B. D'Amico to 2b.,68,2025-03-29T00:00:00-04:00,"Danny Litwhiler Field (Bloomsburg, PA)",147,MBA,2025
6344998,596881,East Stroudsburg Warriors,596863,Bloomsburg Huskies,596863,5,bot,C. Daniels walked (3-2 FFFBBBB).,69,2025-03-29T00:00:00-04:00,"Danny Litwhiler Field (Bloomsburg, PA)",147,MBA,2025
6344998,596881,East Stroudsburg Warriors,596863,Bloomsburg Huskies,596863,5,bot,"J. Reifer doubled to left center, RBI (0-1 K)3a C. Daniels scored.",70,2025-03-29T00:00:00-04:00,"Danny Litwhiler Field (Bloomsburg, PA)",147,MBA,2025
6344998,596881,East Stroudsburg Warriors,596863,Bloomsburg Huskies,596863,5,bot,G. Cristino flied out to lf (0-1 F).,71,2025-03-29T00:00:00-04:00,"Danny Litwhiler Field (Bloomsburg, PA)",147,MBA,2025
6344998,596881,East Stroudsburg Warriors,596863,Bloomsburg Huskies,596863,5,bot,J. Wilson singled to center field (1-0 B)3a J. Reifer advanced to third.,72,2025-03-29T00:00:00-04:00,"Danny Litwhiler Field (Bloomsburg, PA)",147,MBA,2025
6344998,596881,East Stroudsburg Warriors,596863,Bloomsburg Huskies,596863,5,bot,"M. Miller homered to left center, 3 RBI (2-0 BB)3a J. Wilson scored3a J. Reifer scored.",73,2025-03-29T00:00:00-04:00,"Danny Litwhiler Field (Bloomsburg, PA)",147,MBA,2025
6344998,596881,East Stroudsburg Warriors,596863,Bloomsburg Huskies,596863,5,bot,B. Ebbert walked (3-2 KBBFBB).,74,2025-03-29T00:00:00-04:00,"Danny Litwhiler Field (Bloomsburg, PA)",147,MBA,2025
6344998,596881,East Stroudsburg Warriors,596863,Bloomsburg Huskies,596863,5,bot,D.Balestrini popped up to 3b (1-0 B).,75,2025-03-29T00:00:00-04:00,"Danny Litwhiler Field (Bloomsburg, PA)",147,MBA,2025
6344998,596881,East Stroudsburg Warriors,596863,Bloomsburg Huskies,596863,5,bot,J. Miller walked (3-2 BKBSBB)3a B. Ebbert advanced to second.,76,2025-03-29T00:00:00-04:00,"Danny Litwhiler Field (Bloomsburg, PA)",147,MBA,2025
6344998,596881,East Stroudsburg Warriors,596863,Bloomsburg Huskies,596863,5,bot,G. Norris to p for P. Brannock.,77,2025-03-29T00:00:00-04:00,"Danny Litwhiler Field (Bloomsburg, PA)",147,MBA,2025
6344998,596881,East Stroudsburg Warriors,596863,Bloomsburg Huskies,596863,5,bot,J. Stine flied out to rf (2-2 KBBKFFF).,78,2025-03-29T00:00:00-04:00,"Danny Litwhiler Field (Bloomsburg, PA)",147,MBA,2025
6344998,596881,East Stroudsburg Warriors,596863,Bloomsburg Huskies,596881,6,top,R. Manning lined out to 3b (2-2 BFBF).,79,2025-03-29T00:00:00-04:00,"Danny Litwhiler Field (Bloomsburg, PA)",147,MBA,2025
6344998,596881,East Stroudsburg Warriors,596863,Bloomsburg Huskies,596881,6,top,C. Reilly hit by pitch (1-0 B).,80,2025-03-29T00:00:00-04:00,"Danny Litwhiler Field (Bloomsburg, PA)",147,MBA,2025
6344998,596881,East Stroudsburg Warriors,596863,Bloomsburg Huskies,596881,6,top,C. Reilly stole second.,81,2025-03-29T00:00:00-04:00,"Danny Litwhiler Field (Bloomsburg, PA)",147,MBA,2025
6344998,596881,East Stroudsburg Warriors,596863,Bloomsburg Huskies,596881,6,top,E. Albert struck out swinging (2-2 FBKBS).,82,2025-03-29T00:00:00-04:00,"Danny Litwhiler Field (Bloomsburg, PA)",147,MBA,2025
6344998,596881,East Stroudsburg Warriors,596863,Bloomsburg Huskies,596881,6,top,T. Davis grounded out to ss (0-1 K).,83,2025-03-29T00:00:00-04:00,"Danny Litwhiler Field (Bloomsburg, PA)",147,MBA,2025
6344998,596881,East Stroudsburg Warriors,596863,Bloomsburg Huskies,596863,6,bot,C. Daniels grounded out to ss (1-1 BK).,84,2025-03-29T00:00:00-04:00,"Danny Litwhiler Field (Bloomsburg, PA)",147,MBA,2025
6344998,596881,East Stroudsburg Warriors,596863,Bloomsburg Huskies,596863,6,bot,J. Reifer flied out to lf (3-2 KKBBB).,85,2025-03-29T00:00:00-04:00,"Danny Litwhiler Field (Bloomsburg, PA)",147,MBA,2025
6344998,596881,East Stroudsburg Warriors,596863,Bloomsburg Huskies,596863,6,bot,G. Cristino struck out swinging (1-2 FBFS).,86,2025-03-29T00:00:00-04:00,"Danny Litwhiler Field (Bloomsburg, PA)",147,MBA,2025
6344998,596881,East Stroudsburg Warriors,596863,Bloomsburg Huskies,596881,7,top,S. Wall flied out to cf (0-0).,87,2025-03-29T00:00:00-04:00,"Danny Litwhiler Field (Bloomsburg, PA)",147,MBA,2025
6344998,596881,East Stroudsburg Warriors,596863,Bloomsburg Huskies,596881,7,top,C. Albus reached on an error by ss (0-0).,88,2025-03-29T00:00:00-04:00,"Danny Litwhiler Field (Bloomsburg, PA)",147,MBA,2025
6344998,596881,East Stroudsburg Warriors,596863,Bloomsburg Huskies,596881,7,top,Rothenhausle hit by pitch (0-0)3a C. Albus advanced to second.,89,2025-03-29T00:00:00-04:00,"Danny Litwhiler Field (Bloomsburg, PA)",147,MBA,2025
6344998,596881,East Stroudsburg Warriors,596863,Bloomsburg Huskies,596881,7,top,"P. Frey singled through the right side, advanced to second on the throw, RBI (1-0 B)3a Rothenhausle advanced to third3a C. Albus scored, unearned.",90,2025-03-29T00:00:00-04:00,"Danny Litwhiler Field (Bloomsburg, PA)",147,MBA,2025
6344998,596881,East Stroudsburg Warriors,596863,Bloomsburg Huskies,596881,7,top,T. Peden to p for B. Walsh.,91,2025-03-29T00:00:00-04:00,"Danny Litwhiler Field (Bloomsburg, PA)",147,MBA,2025
6344998,596881,East Stroudsburg Warriors,596863,Bloomsburg Huskies,596881,7,top,"B. D'Amico singled through the left side, RBI (3-1 BBKB)3a P. Frey advanced to third3a Rothenhausle scored.",92,2025-03-29T00:00:00-04:00,"Danny Litwhiler Field (Bloomsburg, PA)",147,MBA,2025
6344998,596881,East Stroudsburg Warriors,596863,Bloomsburg Huskies,596881,7,top,"R. Manning doubled down the rf line, RBI (1-2 KKFB)3a B. D'Amico advanced to third3a P. Frey scored.",93,2025-03-29T00:00:00-04:00,"Danny Litwhiler Field (Bloomsburg, PA)",147,MBA,2025
6344998,596881,East Stroudsburg Warriors,596863,Bloomsburg Huskies,596881,7,top,"C. Reilly singled up the middle, RBI (3-2 KSBBB)3a R. Manning advanced to third3a B. D'Amico scored.",94,2025-03-29T00:00:00-04:00,"Danny Litwhiler Field (Bloomsburg, PA)",147,MBA,2025
6344998,596881,East Stroudsburg Warriors,596863,Bloomsburg Huskies,596881,7,top,"E. Albert flied out to rf, SF, RBI (0-0)3a R. Manning scored.",95,2025-03-29T00:00:00-04:00,"Danny Litwhiler Field (Bloomsburg, PA)",147,MBA,2025
6344998,596881,East Stroudsburg Warriors,596863,Bloomsburg Huskies,596881,7,top,C. Reilly advanced to second on a wild pitch.,96,2025-03-29T00:00:00-04:00,"Danny Litwhiler Field (Bloomsburg, PA)",147,MBA,2025
6344998,596881,East Stroudsburg Warriors,596863,Bloomsburg Huskies,596881,7,top,T. Davis reached on an error by ss (3-2 BBKKBF)3a C. Reilly advanced to third.,97,2025-03-29T00:00:00-04:00,"Danny Litwhiler Field (Bloomsburg, PA)",147,MBA,2025
6344998,596881,East Stroudsburg Warriors,596863,Bloomsburg Huskies,596881,7,top,T. Davis advanced to second on a wild pitch.,98,2025-03-29T00:00:00-04:00,"Danny Litwhiler Field (Bloomsburg, PA)",147,MBA,2025
6344998,596881,East Stroudsburg Warriors,596863,Bloomsburg Huskies,596881,7,top,S. Wall flied out to rf (1-2 KBF).,99,2025-03-29T00:00:00-04:00,"Danny Litwhiler Field (Bloomsburg, PA)",147,MBA,2025
6344998,596881,East Stroudsburg Warriors,596863,Bloomsburg Huskies,596863,7,bot,J. Wilson singled up the middle (0-1 S).,100,2025-03-29T00:00:00-04:00,"Danny Litwhiler Field (Bloomsburg, PA)",147,MBA,2025
6344998,596881,East Stroudsburg Warriors,596863,Bloomsburg Huskies,596863,7,bot,M. Miller doubled to right field (1-1 BK)3a J. Wilson advanced to third.,101,2025-03-29T00:00:00-04:00,"Danny Litwhiler Field (Bloomsburg, PA)",147,MBA,2025
6344998,596881,East Stroudsburg Warriors,596863,Bloomsburg Huskies,596863,7,bot,B. Ebbert fouled out to 3b (2-2 FBKB).,102,2025-03-29T00:00:00-04:00,"Danny Litwhiler Field (Bloomsburg, PA)",147,MBA,2025
6344998,596881,East Stroudsburg Warriors,596863,Bloomsburg Huskies,596863,7,bot,D.Balestrini walked (3-1 FBBBB).,103,2025-03-29T00:00:00-04:00,"Danny Litwhiler Field (Bloomsburg, PA)",147,MBA,2025
6344998,596881,East Stroudsburg Warriors,596863,Bloomsburg Huskies,596863,7,bot,B. Junker to p for G. Norris.,104,2025-03-29T00:00:00-04:00,"Danny Litwhiler Field (Bloomsburg, PA)",147,MBA,2025
6344998,596881,East Stroudsburg Warriors,596863,Bloomsburg Huskies,596863,7,bot,"J. Miller homered to center field, 4 RBI (2-1 BFB)3a D.Balestrini scored3a M. Miller scored3a J. Wilson scored.",105,2025-03-29T00:00:00-04:00,"Danny Litwhiler Field (Bloomsburg, PA)",147,MBA,2025
6344998,596881,East Stroudsburg Warriors,596863,Bloomsburg Huskies,596863,7,bot,"J. Stine homered to right field, RBI (0-0).",106,2025-03-29T00:00:00-04:00,"Danny Litwhiler Field (Bloomsburg, PA)",147,MBA,2025
6344998,596881,East Stroudsburg Warriors,596863,Bloomsburg Huskies,596863,7,bot,C. Daniels flied out to cf (0-0).,107,2025-03-29T00:00:00-04:00,"Danny Litwhiler Field (Bloomsburg, PA)",147,MBA,2025
6344998,596881,East Stroudsburg Warriors,596863,Bloomsburg Huskies,596863,7,bot,J. Reifer hit by pitch (0-1 F).,108,2025-03-29T00:00:00-04:00,"Danny Litwhiler Field (Bloomsburg, PA)",147,MBA,2025
6344998,596881,East Stroudsburg Warriors,596863,Bloomsburg Huskies,596863,7,bot,G. Cristino reached on a fielder's choice (0-0)3a J. Reifer out at second ss to 2b.,109,2025-03-29T00:00:00-04:00,"Danny Litwhiler Field (Bloomsburg, PA)",147,MBA,2025
