game_id,away_team_id,away_team_name,home_team_id,home_team_name,batting_team,inning,top_bot,event_text,event_num,game_datetime,stadium_name,attendance,sport_id,season
6344233,596969,Thomas More Saints,596855,Ashland Eagles,596969,1,top,G. Vogelgesa popped up to 3b.,1,2025-03-23T00:00:00-04:00,"Donges Field (Ashland, OH)",71,MBA,2025
6344233,596969,Thomas More Saints,596855,Ashland Eagles,596969,1,top,T. Cunningha singled to left field.,2,2025-03-23T00:00:00-04:00,"Donges Field (Ashland, OH)",71,MBA,2025
6344233,596969,Thomas More Saints,596855,Ashland Eagles,596969,1,top,M. Correa walked; T. Cunningha advanced to second.,3,2025-03-23T00:00:00-04:00,"Donges Field (Ashland, OH)",71,MBA,2025
6344233,596969,Thomas More Saints,596855,Ashland Eagles,596969,1,top,G. Kalkhoff struck out swinging.,4,2025-03-23T00:00:00-04:00,"Donges Field (Ashland, OH)",71,MBA,2025
6344233,596969,Thomas More Saints,596855,Ashland Eagles,596969,1,top,"N. McCarty singled to left field, RBI; M. Correa advanced to third; T. Cunningha scored.",5,2025-03-23T00:00:00-04:00,"Donges Field (Ashland, OH)",71,MBA,2025
6344233,596969,Thomas More Saints,596855,Ashland Eagles,596969,1,top,B. Schnierer struck out swinging.,6,2025-03-23T00:00:00-04:00,"Donges Field (Ashland, OH)",71,MBA,2025
6344233,596969,Thomas More Saints,596855,Ashland Eagles,596855,1,bot,B. Howard lined out to 1b.,7,2025-03-23T00:00:00-04:00,"Donges Field (Ashland, OH)",71,MBA,2025
6344233,596969,Thomas More Saints,596855,Ashland Eagles,596855,1,bot,Krueckeberg reached on a throwing error by ss.,8,2025-03-23T00:00:00-04:00,"Donges Field (Ashland, OH)",71,MBA,2025
6344233,596969,Thomas More Saints,596855,Ashland Eagles,596855,1,bot,"M. Caron singled to center field; Krueckeberg advanced to second, advanced to third on a fielding error by cf.",9,2025-03-23T00:00:00-04:00,"Donges Field (Ashland, OH)",71,MBA,2025
6344233,596969,Thomas More Saints,596855,Ashland Eagles,596855,1,bot,C. Overholt walked; M. Caron advanced to second.,10,2025-03-23T00:00:00-04:00,"Donges Field (Ashland, OH)",71,MBA,2025
6344233,596969,Thomas More Saints,596855,Ashland Eagles,596855,1,bot,C. Weaver infield fly to 3b.,11,2025-03-23T00:00:00-04:00,"Donges Field (Ashland, OH)",71,MBA,2025
6344233,596969,Thomas More Saints,596855,Ashland Eagles,596855,1,bot,C. Franks grounded out to 2b.,12,2025-03-23T00:00:00-04:00,"Donges Field (Ashland, OH)",71,MBA,2025
6344233,596969,Thomas More Saints,596855,Ashland Eagles,596969,2,top,R. Poston struck out swinging.,13,2025-03-23T00:00:00-04:00,"Donges Field (Ashland, OH)",71,MBA,2025
6344233,596969,Thomas More Saints,596855,Ashland Eagles,596969,2,top,C. Atchley struck out swinging.,14,2025-03-23T00:00:00-04:00,"Donges Field (Ashland, OH)",71,MBA,2025
6344233,596969,Thomas More Saints,596855,Ashland Eagles,596969,2,top,B. Duncan grounded out to p.,15,2025-03-23T00:00:00-04:00,"Donges Field (Ashland, OH)",71,MBA,2025
6344233,596969,Thomas More Saints,596855,Ashland Eagles,596855,2,bot,J. Cangelosi flied out to cf.,16,2025-03-23T00:00:00-04:00,"Donges Field (Ashland, OH)",71,MBA,2025
6344233,596969,Thomas More Saints,596855,Ashland Eagles,596855,2,bot,B. Peltz flied out to cf.,17,2025-03-23T00:00:00-04:00,"Donges Field (Ashland, OH)",71,MBA,2025
6344233,596969,Thomas More Saints,596855,Ashland Eagles,596855,2,bot,G. Dobbels walked.,18,2025-03-23T00:00:00-04:00,"Donges Field (Ashland, OH)",71,MBA,2025
6344233,596969,Thomas More Saints,596855,Ashland Eagles,596855,2,bot,G. Dobbels stole second.,19,2025-03-23T00:00:00-04:00,"Donges Field (Ashland, OH)",71,MBA,2025
6344233,596969,Thomas More Saints,596855,Ashland Eagles,596855,2,bot,B. Howard walked.,20,2025-03-23T00:00:00-04:00,"Donges Field (Ashland, OH)",71,MBA,2025
6344233,596969,Thomas More Saints,596855,Ashland Eagles,596855,2,bot,"Krueckeberg doubled to left center, 2 RBI; B. Howard scored; G. Dobbels scored.",21,2025-03-23T00:00:00-04:00,"Donges Field (Ashland, OH)",71,MBA,2025
6344233,596969,Thomas More Saints,596855,Ashland Eagles,596855,2,bot,M. Caron fouled out to 3b.,22,2025-03-23T00:00:00-04:00,"Donges Field (Ashland, OH)",71,MBA,2025
6344233,596969,Thomas More Saints,596855,Ashland Eagles,596969,3,top,G. Vogelgesa walked.,23,2025-03-23T00:00:00-04:00,"Donges Field (Ashland, OH)",71,MBA,2025
6344233,596969,Thomas More Saints,596855,Ashland Eagles,596969,3,top,"T. Cunningha fouled out to c, bunt.",24,2025-03-23T00:00:00-04:00,"Donges Field (Ashland, OH)",71,MBA,2025
6344233,596969,Thomas More Saints,596855,Ashland Eagles,596969,3,top,M. Correa reached on a fielder's choice; G. Vogelgesa out at second p to 2b.,25,2025-03-23T00:00:00-04:00,"Donges Field (Ashland, OH)",71,MBA,2025
6344233,596969,Thomas More Saints,596855,Ashland Eagles,596969,3,top,M. Correa stole second.,26,2025-03-23T00:00:00-04:00,"Donges Field (Ashland, OH)",71,MBA,2025
6344233,596969,Thomas More Saints,596855,Ashland Eagles,596969,3,top,G. Kalkhoff flied out to rf.,27,2025-03-23T00:00:00-04:00,"Donges Field (Ashland, OH)",71,MBA,2025
6344233,596969,Thomas More Saints,596855,Ashland Eagles,596855,3,bot,J. Perdue to p for N. Krekeler.,28,2025-03-23T00:00:00-04:00,"Donges Field (Ashland, OH)",71,MBA,2025
6344233,596969,Thomas More Saints,596855,Ashland Eagles,596855,3,bot,C. Overholt singled to right center.,29,2025-03-23T00:00:00-04:00,"Donges Field (Ashland, OH)",71,MBA,2025
6344233,596969,Thomas More Saints,596855,Ashland Eagles,596855,3,bot,C. Weaver walked; C. Overholt advanced to second.,30,2025-03-23T00:00:00-04:00,"Donges Field (Ashland, OH)",71,MBA,2025
6344233,596969,Thomas More Saints,596855,Ashland Eagles,596855,3,bot,C. Franks grounded out to 1b unassisted; C. Weaver advanced to second; C. Overholt advanced to third.,31,2025-03-23T00:00:00-04:00,"Donges Field (Ashland, OH)",71,MBA,2025
6344233,596969,Thomas More Saints,596855,Ashland Eagles,596855,3,bot,J. Cangelosi popped up to 2b.,32,2025-03-23T00:00:00-04:00,"Donges Field (Ashland, OH)",71,MBA,2025
6344233,596969,Thomas More Saints,596855,Ashland Eagles,596855,3,bot,B. Peltz flied out to cf.,33,2025-03-23T00:00:00-04:00,"Donges Field (Ashland, OH)",71,MBA,2025
6344233,596969,Thomas More Saints,596855,Ashland Eagles,596969,4,top,N. McCarty flied out to cf to left center.,34,2025-03-23T00:00:00-04:00,"Donges Field (Ashland, OH)",71,MBA,2025
6344233,596969,Thomas More Saints,596855,Ashland Eagles,596969,4,top,B. Schnierer grounded out to 3b.,35,2025-03-23T00:00:00-04:00,"Donges Field (Ashland, OH)",71,MBA,2025
6344233,596969,Thomas More Saints,596855,Ashland Eagles,596969,4,top,R. Poston out at first 1b to p.,36,2025-03-23T00:00:00-04:00,"Donges Field (Ashland, OH)",71,MBA,2025
6344233,596969,Thomas More Saints,596855,Ashland Eagles,596855,4,bot,G. Dobbels flied out to lf to left center.,37,2025-03-23T00:00:00-04:00,"Donges Field (Ashland, OH)",71,MBA,2025
6344233,596969,Thomas More Saints,596855,Ashland Eagles,596855,4,bot,B. Howard singled to third base.,38,2025-03-23T00:00:00-04:00,"Donges Field (Ashland, OH)",71,MBA,2025
6344233,596969,Thomas More Saints,596855,Ashland Eagles,596855,4,bot,Krueckeberg reached on a fielder's choice; B. Howard out at second 1b to ss.,39,2025-03-23T00:00:00-04:00,"Donges Field (Ashland, OH)",71,MBA,2025
6344233,596969,Thomas More Saints,596855,Ashland Eagles,596855,4,bot,M. Caron doubled to right field; Krueckeberg advanced to third.,40,2025-03-23T00:00:00-04:00,"Donges Field (Ashland, OH)",71,MBA,2025
6344233,596969,Thomas More Saints,596855,Ashland Eagles,596855,4,bot,C. Overholt grounded out to 1b unassisted.,41,2025-03-23T00:00:00-04:00,"Donges Field (Ashland, OH)",71,MBA,2025
6344233,596969,Thomas More Saints,596855,Ashland Eagles,596969,5,top,C. Atchley grounded out to 3b.,42,2025-03-23T00:00:00-04:00,"Donges Field (Ashland, OH)",71,MBA,2025
6344233,596969,Thomas More Saints,596855,Ashland Eagles,596969,5,top,B. Duncan struck out swinging.,43,2025-03-23T00:00:00-04:00,"Donges Field (Ashland, OH)",71,MBA,2025
6344233,596969,Thomas More Saints,596855,Ashland Eagles,596969,5,top,G. Vogelgesa singled to left field.,44,2025-03-23T00:00:00-04:00,"Donges Field (Ashland, OH)",71,MBA,2025
6344233,596969,Thomas More Saints,596855,Ashland Eagles,596969,5,top,T. Cunningha walked; G. Vogelgesa advanced to second.,45,2025-03-23T00:00:00-04:00,"Donges Field (Ashland, OH)",71,MBA,2025
6344233,596969,Thomas More Saints,596855,Ashland Eagles,596969,5,top,M. Correa struck out swinging.,46,2025-03-23T00:00:00-04:00,"Donges Field (Ashland, OH)",71,MBA,2025
6344233,596969,Thomas More Saints,596855,Ashland Eagles,596855,5,bot,C. Weaver flied out to rf.,47,2025-03-23T00:00:00-04:00,"Donges Field (Ashland, OH)",71,MBA,2025
6344233,596969,Thomas More Saints,596855,Ashland Eagles,596855,5,bot,C. Franks grounded out to 1b unassisted.,48,2025-03-23T00:00:00-04:00,"Donges Field (Ashland, OH)",71,MBA,2025
6344233,596969,Thomas More Saints,596855,Ashland Eagles,596855,5,bot,J. Cangelosi singled to center field.,49,2025-03-23T00:00:00-04:00,"Donges Field (Ashland, OH)",71,MBA,2025
6344233,596969,Thomas More Saints,596855,Ashland Eagles,596855,5,bot,B. Peltz flied out to lf.,50,2025-03-23T00:00:00-04:00,"Donges Field (Ashland, OH)",71,MBA,2025
6344233,596969,Thomas More Saints,596855,Ashland Eagles,596969,6,top,G. Kalkhoff grounded out to ss.,51,2025-03-23T00:00:00-04:00,"Donges Field (Ashland, OH)",71,MBA,2025
6344233,596969,Thomas More Saints,596855,Ashland Eagles,596969,6,top,N. McCarty struck out swinging.,52,2025-03-23T00:00:00-04:00,"Donges Field (Ashland, OH)",71,MBA,2025
6344233,596969,Thomas More Saints,596855,Ashland Eagles,596969,6,top,B. Schnierer struck out swinging.,53,2025-03-23T00:00:00-04:00,"Donges Field (Ashland, OH)",71,MBA,2025
6344233,596969,Thomas More Saints,596855,Ashland Eagles,596855,6,bot,C. Snider to p for J. Perdue.,54,2025-03-23T00:00:00-04:00,"Donges Field (Ashland, OH)",71,MBA,2025
6344233,596969,Thomas More Saints,596855,Ashland Eagles,596855,6,bot,G. Dobbels grounded out to p.,55,2025-03-23T00:00:00-04:00,"Donges Field (Ashland, OH)",71,MBA,2025
6344233,596969,Thomas More Saints,596855,Ashland Eagles,596855,6,bot,"B. Howard struck out swinging, out at first c to 1b.",56,2025-03-23T00:00:00-04:00,"Donges Field (Ashland, OH)",71,MBA,2025
6344233,596969,Thomas More Saints,596855,Ashland Eagles,596855,6,bot,Krueckeberg walked.,57,2025-03-23T00:00:00-04:00,"Donges Field (Ashland, OH)",71,MBA,2025
6344233,596969,Thomas More Saints,596855,Ashland Eagles,596855,6,bot,Krueckeberg stole second.,58,2025-03-23T00:00:00-04:00,"Donges Field (Ashland, OH)",71,MBA,2025
6344233,596969,Thomas More Saints,596855,Ashland Eagles,596855,6,bot,M. Caron walked.,59,2025-03-23T00:00:00-04:00,"Donges Field (Ashland, OH)",71,MBA,2025
6344233,596969,Thomas More Saints,596855,Ashland Eagles,596855,6,bot,"C. Overholt doubled to right center, 2 RBI; M. Caron scored; Krueckeberg scored.",60,2025-03-23T00:00:00-04:00,"Donges Field (Ashland, OH)",71,MBA,2025
6344233,596969,Thomas More Saints,596855,Ashland Eagles,596855,6,bot,"C. Weaver singled to right center, RBI; C. Overholt scored.",61,2025-03-23T00:00:00-04:00,"Donges Field (Ashland, OH)",71,MBA,2025
6344233,596969,Thomas More Saints,596855,Ashland Eagles,596855,6,bot,"C. Weaver out at second c to ss, caught stealing.",62,2025-03-23T00:00:00-04:00,"Donges Field (Ashland, OH)",71,MBA,2025
6344233,596969,Thomas More Saints,596855,Ashland Eagles,596969,7,top,Se. Witt to p for C. Scott.,63,2025-03-23T00:00:00-04:00,"Donges Field (Ashland, OH)",71,MBA,2025
6344233,596969,Thomas More Saints,596855,Ashland Eagles,596969,7,top,R. Poston flied out to cf.,64,2025-03-23T00:00:00-04:00,"Donges Field (Ashland, OH)",71,MBA,2025
6344233,596969,Thomas More Saints,596855,Ashland Eagles,596969,7,top,C. Atchley singled to center field.,65,2025-03-23T00:00:00-04:00,"Donges Field (Ashland, OH)",71,MBA,2025
6344233,596969,Thomas More Saints,596855,Ashland Eagles,596969,7,top,B. Duncan singled to right field; C. Atchley advanced to second.,66,2025-03-23T00:00:00-04:00,"Donges Field (Ashland, OH)",71,MBA,2025
6344233,596969,Thomas More Saints,596855,Ashland Eagles,596969,7,top,Ta. Gray pinch ran for C. Atchley.,67,2025-03-23T00:00:00-04:00,"Donges Field (Ashland, OH)",71,MBA,2025
6344233,596969,Thomas More Saints,596855,Ashland Eagles,596969,7,top,G. Vogelgesa walked; B. Duncan advanced to second; Ta. Gray advanced to third.,68,2025-03-23T00:00:00-04:00,"Donges Field (Ashland, OH)",71,MBA,2025
6344233,596969,Thomas More Saints,596855,Ashland Eagles,596969,7,top,C. Carter to p for Se. Witt.,69,2025-03-23T00:00:00-04:00,"Donges Field (Ashland, OH)",71,MBA,2025
6344233,596969,Thomas More Saints,596855,Ashland Eagles,596969,7,top,T. Cunningha struck out swinging.,70,2025-03-23T00:00:00-04:00,"Donges Field (Ashland, OH)",71,MBA,2025
6344233,596969,Thomas More Saints,596855,Ashland Eagles,596969,7,top,M. Correa grounded out to ss.,71,2025-03-23T00:00:00-04:00,"Donges Field (Ashland, OH)",71,MBA,2025
6344233,596969,Thomas More Saints,596855,Ashland Eagles,596855,7,bot,D. Barth to c for Ta. Gray.,72,2025-03-23T00:00:00-04:00,"Donges Field (Ashland, OH)",71,MBA,2025
6344233,596969,Thomas More Saints,596855,Ashland Eagles,596855,7,bot,G. Donohoe to p for C. Snider.,73,2025-03-23T00:00:00-04:00,"Donges Field (Ashland, OH)",71,MBA,2025
6344233,596969,Thomas More Saints,596855,Ashland Eagles,596855,7,bot,C. Franks flied out to rf.,74,2025-03-23T00:00:00-04:00,"Donges Field (Ashland, OH)",71,MBA,2025
6344233,596969,Thomas More Saints,596855,Ashland Eagles,596855,7,bot,J. Cangelosi flied out to rf to right center.,75,2025-03-23T00:00:00-04:00,"Donges Field (Ashland, OH)",71,MBA,2025
6344233,596969,Thomas More Saints,596855,Ashland Eagles,596855,7,bot,B. Peltz grounded out to 2b.,76,2025-03-23T00:00:00-04:00,"Donges Field (Ashland, OH)",71,MBA,2025
6344233,596969,Thomas More Saints,596855,Ashland Eagles,596969,8,top,G. Kalkhoff walked.,77,2025-03-23T00:00:00-04:00,"Donges Field (Ashland, OH)",71,MBA,2025
6344233,596969,Thomas More Saints,596855,Ashland Eagles,596969,8,top,N. McCarty struck out swinging.,78,2025-03-23T00:00:00-04:00,"Donges Field (Ashland, OH)",71,MBA,2025
6344233,596969,Thomas More Saints,596855,Ashland Eagles,596969,8,top,A. Hess pinch hit for B. Schnierer.,79,2025-03-23T00:00:00-04:00,"Donges Field (Ashland, OH)",71,MBA,2025
6344233,596969,Thomas More Saints,596855,Ashland Eagles,596969,8,top,A. Hess singled to left field; G. Kalkhoff advanced to second.,80,2025-03-23T00:00:00-04:00,"Donges Field (Ashland, OH)",71,MBA,2025
6344233,596969,Thomas More Saints,596855,Ashland Eagles,596969,8,top,M. Resing pinch ran for A. Hess.,81,2025-03-23T00:00:00-04:00,"Donges Field (Ashland, OH)",71,MBA,2025
6344233,596969,Thomas More Saints,596855,Ashland Eagles,596969,8,top,R. Poston grounded into double play 2b to ss to 1b; M. Resing out on the play; G. Kalkhoff advanced to third.,82,2025-03-23T00:00:00-04:00,"Donges Field (Ashland, OH)",71,MBA,2025
6344233,596969,Thomas More Saints,596855,Ashland Eagles,596855,8,bot,M. Resing to rf.,83,2025-03-23T00:00:00-04:00,"Donges Field (Ashland, OH)",71,MBA,2025
6344233,596969,Thomas More Saints,596855,Ashland Eagles,596855,8,bot,G. Dobbels singled to right field.,84,2025-03-23T00:00:00-04:00,"Donges Field (Ashland, OH)",71,MBA,2025
6344233,596969,Thomas More Saints,596855,Ashland Eagles,596855,8,bot,"B. Howard grounded out to p, SAC, bunt; G. Dobbels advanced to second.",85,2025-03-23T00:00:00-04:00,"Donges Field (Ashland, OH)",71,MBA,2025
6344233,596969,Thomas More Saints,596855,Ashland Eagles,596855,8,bot,Krueckeberg singled to center field; G. Dobbels advanced to third.,86,2025-03-23T00:00:00-04:00,"Donges Field (Ashland, OH)",71,MBA,2025
6344233,596969,Thomas More Saints,596855,Ashland Eagles,596855,8,bot,"M. Caron doubled to right field, 2 RBI; Krueckeberg scored; G. Dobbels scored.",87,2025-03-23T00:00:00-04:00,"Donges Field (Ashland, OH)",71,MBA,2025
6344233,596969,Thomas More Saints,596855,Ashland Eagles,596855,8,bot,C. Overholt popped up to 3b.,88,2025-03-23T00:00:00-04:00,"Donges Field (Ashland, OH)",71,MBA,2025
6344233,596969,Thomas More Saints,596855,Ashland Eagles,596855,8,bot,C. Weaver hit by pitch.,89,2025-03-23T00:00:00-04:00,"Donges Field (Ashland, OH)",71,MBA,2025
6344233,596969,Thomas More Saints,596855,Ashland Eagles,596855,8,bot,C. Franks grounded out to 2b.,90,2025-03-23T00:00:00-04:00,"Donges Field (Ashland, OH)",71,MBA,2025
6344233,596969,Thomas More Saints,596855,Ashland Eagles,596969,9,top,D. Barth struck out swinging.,91,2025-03-23T00:00:00-04:00,"Donges Field (Ashland, OH)",71,MBA,2025
6344233,596969,Thomas More Saints,596855,Ashland Eagles,596969,9,top,B. Duncan out at first 1b to p.,92,2025-03-23T00:00:00-04:00,"Donges Field (Ashland, OH)",71,MBA,2025
6344233,596969,Thomas More Saints,596855,Ashland Eagles,596969,9,top,G. Vogelgesa grounded out to 3b.,93,2025-03-23T00:00:00-04:00,"Donges Field (Ashland, OH)",71,MBA,2025
