game_id,away_team_id,away_team_name,home_team_id,home_team_name,batting_team,inning,top_bot,event_text,event_num,game_datetime,stadium_name,attendance,sport_id,season
6344675,596759,Wingate Bulldogs,596791,Anderson (SC) Trojans,596759,1,top,Jake Courville grounded out to 3b.,1,2025-03-28T00:00:00-04:00,"Anderson Memorial Stadium (Anderson, SC)",157,MBA,2025
6344675,596759,Wingate Bulldogs,596791,Anderson (SC) Trojans,596759,1,top,Gavin Groppuso singled to center field.,2,2025-03-28T00:00:00-04:00,"Anderson Memorial Stadium (Anderson, SC)",157,MBA,2025
6344675,596759,Wingate Bulldogs,596791,Anderson (SC) Trojans,596759,1,top,"Gavin Groppuso advanced to second on a throwing error by p, failed pickoff attempt.",3,2025-03-28T00:00:00-04:00,"Anderson Memorial Stadium (Anderson, SC)",157,MBA,2025
6344675,596759,Wingate Bulldogs,596791,Anderson (SC) Trojans,596759,1,top,Breon Ishmael reached first on an error by 2b3a Gavin Groppuso advanced to third.,4,2025-03-28T00:00:00-04:00,"Anderson Memorial Stadium (Anderson, SC)",157,MBA,2025
6344675,596759,Wingate Bulldogs,596791,Anderson (SC) Trojans,596759,1,top,"Jordan Dixon singled through the right side, RBI3a Breon Ishmael advanced to second3a Gavin Groppuso scored.",5,2025-03-28T00:00:00-04:00,"Anderson Memorial Stadium (Anderson, SC)",157,MBA,2025
6344675,596759,Wingate Bulldogs,596791,Anderson (SC) Trojans,596759,1,top,Wyatt Hoffman struck out looking.,6,2025-03-28T00:00:00-04:00,"Anderson Memorial Stadium (Anderson, SC)",157,MBA,2025
6344675,596759,Wingate Bulldogs,596791,Anderson (SC) Trojans,596759,1,top,Landon Meyer grounded out p to 2b to 1b.,7,2025-03-28T00:00:00-04:00,"Anderson Memorial Stadium (Anderson, SC)",157,MBA,2025
6344675,596759,Wingate Bulldogs,596791,Anderson (SC) Trojans,596791,1,bot,Braeden Harrison flied out to lf.,8,2025-03-28T00:00:00-04:00,"Anderson Memorial Stadium (Anderson, SC)",157,MBA,2025
6344675,596759,Wingate Bulldogs,596791,Anderson (SC) Trojans,596791,1,bot,Kyle Caccamise tripled to right center.,9,2025-03-28T00:00:00-04:00,"Anderson Memorial Stadium (Anderson, SC)",157,MBA,2025
6344675,596759,Wingate Bulldogs,596791,Anderson (SC) Trojans,596791,1,bot,Zach Stover struck out swinging.,10,2025-03-28T00:00:00-04:00,"Anderson Memorial Stadium (Anderson, SC)",157,MBA,2025
6344675,596759,Wingate Bulldogs,596791,Anderson (SC) Trojans,596791,1,bot,Brooks Mauro walked.,11,2025-03-28T00:00:00-04:00,"Anderson Memorial Stadium (Anderson, SC)",157,MBA,2025
6344675,596759,Wingate Bulldogs,596791,Anderson (SC) Trojans,596791,1,bot,Ben Bullard lined out to 2b.,12,2025-03-28T00:00:00-04:00,"Anderson Memorial Stadium (Anderson, SC)",157,MBA,2025
6344675,596759,Wingate Bulldogs,596791,Anderson (SC) Trojans,596759,2,top,Will Farrell hit by pitch.,13,2025-03-28T00:00:00-04:00,"Anderson Memorial Stadium (Anderson, SC)",157,MBA,2025
6344675,596759,Wingate Bulldogs,596791,Anderson (SC) Trojans,596759,2,top,Evan Barefoot flied out to cf to left center.,14,2025-03-28T00:00:00-04:00,"Anderson Memorial Stadium (Anderson, SC)",157,MBA,2025
6344675,596759,Wingate Bulldogs,596791,Anderson (SC) Trojans,596759,2,top,Jalen Evans grounded into double play 3b to 2b to 1b3a Will Farrell out on the play.,15,2025-03-28T00:00:00-04:00,"Anderson Memorial Stadium (Anderson, SC)",157,MBA,2025
6344675,596759,Wingate Bulldogs,596791,Anderson (SC) Trojans,596791,2,bot,Dom Bello flied out to lf.,16,2025-03-28T00:00:00-04:00,"Anderson Memorial Stadium (Anderson, SC)",157,MBA,2025
6344675,596759,Wingate Bulldogs,596791,Anderson (SC) Trojans,596791,2,bot,Gray Wells grounded out to ss.,17,2025-03-28T00:00:00-04:00,"Anderson Memorial Stadium (Anderson, SC)",157,MBA,2025
6344675,596759,Wingate Bulldogs,596791,Anderson (SC) Trojans,596791,2,bot,Shane Thomas struck out swinging.,18,2025-03-28T00:00:00-04:00,"Anderson Memorial Stadium (Anderson, SC)",157,MBA,2025
6344675,596759,Wingate Bulldogs,596791,Anderson (SC) Trojans,596759,3,top,Jake Courville struck out swinging.,19,2025-03-28T00:00:00-04:00,"Anderson Memorial Stadium (Anderson, SC)",157,MBA,2025
6344675,596759,Wingate Bulldogs,596791,Anderson (SC) Trojans,596759,3,top,Gavin Groppuso flied out to lf.,20,2025-03-28T00:00:00-04:00,"Anderson Memorial Stadium (Anderson, SC)",157,MBA,2025
6344675,596759,Wingate Bulldogs,596791,Anderson (SC) Trojans,596759,3,top,Breon Ishmael grounded out to 3b.,21,2025-03-28T00:00:00-04:00,"Anderson Memorial Stadium (Anderson, SC)",157,MBA,2025
6344675,596759,Wingate Bulldogs,596791,Anderson (SC) Trojans,596791,3,bot,Carson Molinaroli struck out looking.,22,2025-03-28T00:00:00-04:00,"Anderson Memorial Stadium (Anderson, SC)",157,MBA,2025
6344675,596759,Wingate Bulldogs,596791,Anderson (SC) Trojans,596791,3,bot,"Braeden Harrison homered to left center, RBI.",23,2025-03-28T00:00:00-04:00,"Anderson Memorial Stadium (Anderson, SC)",157,MBA,2025
6344675,596759,Wingate Bulldogs,596791,Anderson (SC) Trojans,596791,3,bot,Kyle Caccamise walked.,24,2025-03-28T00:00:00-04:00,"Anderson Memorial Stadium (Anderson, SC)",157,MBA,2025
6344675,596759,Wingate Bulldogs,596791,Anderson (SC) Trojans,596791,3,bot,Zach Stover lined out to lf.,25,2025-03-28T00:00:00-04:00,"Anderson Memorial Stadium (Anderson, SC)",157,MBA,2025
6344675,596759,Wingate Bulldogs,596791,Anderson (SC) Trojans,596791,3,bot,Brooks Mauro flied out to cf to left center.,26,2025-03-28T00:00:00-04:00,"Anderson Memorial Stadium (Anderson, SC)",157,MBA,2025
6344675,596759,Wingate Bulldogs,596791,Anderson (SC) Trojans,596759,4,top,Jordan Dixon singled through the right side.,27,2025-03-28T00:00:00-04:00,"Anderson Memorial Stadium (Anderson, SC)",157,MBA,2025
6344675,596759,Wingate Bulldogs,596791,Anderson (SC) Trojans,596759,4,top,Wyatt Hoffman reached on a fielder's choice to shortstop3a Jordan Dixon out at second ss to 2b.,28,2025-03-28T00:00:00-04:00,"Anderson Memorial Stadium (Anderson, SC)",157,MBA,2025
6344675,596759,Wingate Bulldogs,596791,Anderson (SC) Trojans,596759,4,top,Landon Meyer flied out to cf to right center.,29,2025-03-28T00:00:00-04:00,"Anderson Memorial Stadium (Anderson, SC)",157,MBA,2025
6344675,596759,Wingate Bulldogs,596791,Anderson (SC) Trojans,596759,4,top,"Wyatt Hoffman out at second c to ss, caught stealing.",30,2025-03-28T00:00:00-04:00,"Anderson Memorial Stadium (Anderson, SC)",157,MBA,2025
6344675,596759,Wingate Bulldogs,596791,Anderson (SC) Trojans,596791,4,bot,Ben Bullard struck out swinging.,31,2025-03-28T00:00:00-04:00,"Anderson Memorial Stadium (Anderson, SC)",157,MBA,2025
6344675,596759,Wingate Bulldogs,596791,Anderson (SC) Trojans,596791,4,bot,Dom Bello singled to left field.,32,2025-03-28T00:00:00-04:00,"Anderson Memorial Stadium (Anderson, SC)",157,MBA,2025
6344675,596759,Wingate Bulldogs,596791,Anderson (SC) Trojans,596791,4,bot,Gray Wells grounded into double play ss to 2b to 1b3a Dom Bello out on the play.,33,2025-03-28T00:00:00-04:00,"Anderson Memorial Stadium (Anderson, SC)",157,MBA,2025
6344675,596759,Wingate Bulldogs,596791,Anderson (SC) Trojans,596759,5,top,Will Farrell struck out swinging.,34,2025-03-28T00:00:00-04:00,"Anderson Memorial Stadium (Anderson, SC)",157,MBA,2025
6344675,596759,Wingate Bulldogs,596791,Anderson (SC) Trojans,596759,5,top,Evan Barefoot grounded out to 2b.,35,2025-03-28T00:00:00-04:00,"Anderson Memorial Stadium (Anderson, SC)",157,MBA,2025
6344675,596759,Wingate Bulldogs,596791,Anderson (SC) Trojans,596759,5,top,Jalen Evans popped up to rf.,36,2025-03-28T00:00:00-04:00,"Anderson Memorial Stadium (Anderson, SC)",157,MBA,2025
6344675,596759,Wingate Bulldogs,596791,Anderson (SC) Trojans,596791,5,bot,Shane Thomas grounded out to ss.,37,2025-03-28T00:00:00-04:00,"Anderson Memorial Stadium (Anderson, SC)",157,MBA,2025
6344675,596759,Wingate Bulldogs,596791,Anderson (SC) Trojans,596791,5,bot,Carson Molinaroli grounded out to ss.,38,2025-03-28T00:00:00-04:00,"Anderson Memorial Stadium (Anderson, SC)",157,MBA,2025
6344675,596759,Wingate Bulldogs,596791,Anderson (SC) Trojans,596791,5,bot,Braeden Harrison popped up to 2b to left center.,39,2025-03-28T00:00:00-04:00,"Anderson Memorial Stadium (Anderson, SC)",157,MBA,2025
6344675,596759,Wingate Bulldogs,596791,Anderson (SC) Trojans,596759,6,top,Jake Courville struck out swinging.,40,2025-03-28T00:00:00-04:00,"Anderson Memorial Stadium (Anderson, SC)",157,MBA,2025
6344675,596759,Wingate Bulldogs,596791,Anderson (SC) Trojans,596759,6,top,Gavin Groppuso walked.,41,2025-03-28T00:00:00-04:00,"Anderson Memorial Stadium (Anderson, SC)",157,MBA,2025
6344675,596759,Wingate Bulldogs,596791,Anderson (SC) Trojans,596759,6,top,Breon Ishmael hit by pitch3a Gavin Groppuso advanced to second.,42,2025-03-28T00:00:00-04:00,"Anderson Memorial Stadium (Anderson, SC)",157,MBA,2025
6344675,596759,Wingate Bulldogs,596791,Anderson (SC) Trojans,596759,6,top,Jordan Dixon flied out to lf.,43,2025-03-28T00:00:00-04:00,"Anderson Memorial Stadium (Anderson, SC)",157,MBA,2025
6344675,596759,Wingate Bulldogs,596791,Anderson (SC) Trojans,596759,6,top,Breon Ishmael stole second3a Gavin Groppuso stole third.,44,2025-03-28T00:00:00-04:00,"Anderson Memorial Stadium (Anderson, SC)",157,MBA,2025
6344675,596759,Wingate Bulldogs,596791,Anderson (SC) Trojans,596759,6,top,Wyatt Hoffman struck out swinging.,45,2025-03-28T00:00:00-04:00,"Anderson Memorial Stadium (Anderson, SC)",157,MBA,2025
6344675,596759,Wingate Bulldogs,596791,Anderson (SC) Trojans,596791,6,bot,Kyle Caccamise flied out to rf.,46,2025-03-28T00:00:00-04:00,"Anderson Memorial Stadium (Anderson, SC)",157,MBA,2025
6344675,596759,Wingate Bulldogs,596791,Anderson (SC) Trojans,596791,6,bot,Zach Stover singled to shortstop.,47,2025-03-28T00:00:00-04:00,"Anderson Memorial Stadium (Anderson, SC)",157,MBA,2025
6344675,596759,Wingate Bulldogs,596791,Anderson (SC) Trojans,596791,6,bot,Zach Stover stole second.,48,2025-03-28T00:00:00-04:00,"Anderson Memorial Stadium (Anderson, SC)",157,MBA,2025
6344675,596759,Wingate Bulldogs,596791,Anderson (SC) Trojans,596791,6,bot,Brooks Mauro singled to center field3a Zach Stover advanced to third.,49,2025-03-28T00:00:00-04:00,"Anderson Memorial Stadium (Anderson, SC)",157,MBA,2025
6344675,596759,Wingate Bulldogs,596791,Anderson (SC) Trojans,596791,6,bot,"Ben Bullard singled to right field, RBI3a Brooks Mauro advanced to third3a Zach Stover scored.",50,2025-03-28T00:00:00-04:00,"Anderson Memorial Stadium (Anderson, SC)",157,MBA,2025
6344675,596759,Wingate Bulldogs,596791,Anderson (SC) Trojans,596791,6,bot,Brian Boone to p for Kelan Hoover.,51,2025-03-28T00:00:00-04:00,"Anderson Memorial Stadium (Anderson, SC)",157,MBA,2025
6344675,596759,Wingate Bulldogs,596791,Anderson (SC) Trojans,596791,6,bot,Dom Bello struck out swinging.,52,2025-03-28T00:00:00-04:00,"Anderson Memorial Stadium (Anderson, SC)",157,MBA,2025
6344675,596759,Wingate Bulldogs,596791,Anderson (SC) Trojans,596791,6,bot,Gray Wells flied out to rf.,53,2025-03-28T00:00:00-04:00,"Anderson Memorial Stadium (Anderson, SC)",157,MBA,2025
6344675,596759,Wingate Bulldogs,596791,Anderson (SC) Trojans,596759,7,top,Landon Meyer singled to center field.,54,2025-03-28T00:00:00-04:00,"Anderson Memorial Stadium (Anderson, SC)",157,MBA,2025
6344675,596759,Wingate Bulldogs,596791,Anderson (SC) Trojans,596759,7,top,"Will Farrell grounded out to p, SAC, bunt3a Landon Meyer advanced to second.",55,2025-03-28T00:00:00-04:00,"Anderson Memorial Stadium (Anderson, SC)",157,MBA,2025
6344675,596759,Wingate Bulldogs,596791,Anderson (SC) Trojans,596759,7,top,Landon Meyer advanced to third on a wild pitch.,56,2025-03-28T00:00:00-04:00,"Anderson Memorial Stadium (Anderson, SC)",157,MBA,2025
6344675,596759,Wingate Bulldogs,596791,Anderson (SC) Trojans,596759,7,top,Evan Barefoot walked.,57,2025-03-28T00:00:00-04:00,"Anderson Memorial Stadium (Anderson, SC)",157,MBA,2025
6344675,596759,Wingate Bulldogs,596791,Anderson (SC) Trojans,596759,7,top,"Jalen Evans singled to third base, bunt, RBI3a Evan Barefoot advanced to second, advanced to third on a throwing error by 3b3a Landon Meyer scored.",58,2025-03-28T00:00:00-04:00,"Anderson Memorial Stadium (Anderson, SC)",157,MBA,2025
6344675,596759,Wingate Bulldogs,596791,Anderson (SC) Trojans,596759,7,top,Corben Childers to p for Walker Noland.,59,2025-03-28T00:00:00-04:00,"Anderson Memorial Stadium (Anderson, SC)",157,MBA,2025
6344675,596759,Wingate Bulldogs,596791,Anderson (SC) Trojans,596759,7,top,Jake Courville struck out looking.,60,2025-03-28T00:00:00-04:00,"Anderson Memorial Stadium (Anderson, SC)",157,MBA,2025
6344675,596759,Wingate Bulldogs,596791,Anderson (SC) Trojans,596759,7,top,"Jalen Evans out at second c to ss, caught stealing.",61,2025-03-28T00:00:00-04:00,"Anderson Memorial Stadium (Anderson, SC)",157,MBA,2025
6344675,596759,Wingate Bulldogs,596791,Anderson (SC) Trojans,596791,7,bot,Shane Thomas reached first on a throwing error by ss.,62,2025-03-28T00:00:00-04:00,"Anderson Memorial Stadium (Anderson, SC)",157,MBA,2025
6344675,596759,Wingate Bulldogs,596791,Anderson (SC) Trojans,596791,7,bot,"Carson Molinaroli grounded out to p, SAC, bunt3a Shane Thomas advanced to second.",63,2025-03-28T00:00:00-04:00,"Anderson Memorial Stadium (Anderson, SC)",157,MBA,2025
6344675,596759,Wingate Bulldogs,596791,Anderson (SC) Trojans,596791,7,bot,"Braeden Harrison tripled down the lf line, RBI3a Shane Thomas scored, unearned.",64,2025-03-28T00:00:00-04:00,"Anderson Memorial Stadium (Anderson, SC)",157,MBA,2025
6344675,596759,Wingate Bulldogs,596791,Anderson (SC) Trojans,596791,7,bot,Kyle Caccamise reached on a fielder's choice to second base3a Braeden Harrison out at home 2b to c.,65,2025-03-28T00:00:00-04:00,"Anderson Memorial Stadium (Anderson, SC)",157,MBA,2025
6344675,596759,Wingate Bulldogs,596791,Anderson (SC) Trojans,596791,7,bot,Kyle Caccamise advanced to second on a wild pitch.,66,2025-03-28T00:00:00-04:00,"Anderson Memorial Stadium (Anderson, SC)",157,MBA,2025
6344675,596759,Wingate Bulldogs,596791,Anderson (SC) Trojans,596791,7,bot,Zach Stover flied out to cf.,67,2025-03-28T00:00:00-04:00,"Anderson Memorial Stadium (Anderson, SC)",157,MBA,2025
6344675,596759,Wingate Bulldogs,596791,Anderson (SC) Trojans,596759,8,top,Gavin Groppuso struck out looking.,68,2025-03-28T00:00:00-04:00,"Anderson Memorial Stadium (Anderson, SC)",157,MBA,2025
6344675,596759,Wingate Bulldogs,596791,Anderson (SC) Trojans,596759,8,top,Breon Ishmael struck out swinging.,69,2025-03-28T00:00:00-04:00,"Anderson Memorial Stadium (Anderson, SC)",157,MBA,2025
6344675,596759,Wingate Bulldogs,596791,Anderson (SC) Trojans,596759,8,top,Jordan Dixon doubled to left center.,70,2025-03-28T00:00:00-04:00,"Anderson Memorial Stadium (Anderson, SC)",157,MBA,2025
6344675,596759,Wingate Bulldogs,596791,Anderson (SC) Trojans,596759,8,top,Cam Harris pinch hit for Wyatt Hoffman.,71,2025-03-28T00:00:00-04:00,"Anderson Memorial Stadium (Anderson, SC)",157,MBA,2025
6344675,596759,Wingate Bulldogs,596791,Anderson (SC) Trojans,596759,8,top,Alex Naylor pinch ran for Jordan Dixon.,72,2025-03-28T00:00:00-04:00,"Anderson Memorial Stadium (Anderson, SC)",157,MBA,2025
6344675,596759,Wingate Bulldogs,596791,Anderson (SC) Trojans,596759,8,top,Cam Harris flied out to cf.,73,2025-03-28T00:00:00-04:00,"Anderson Memorial Stadium (Anderson, SC)",157,MBA,2025
6344675,596759,Wingate Bulldogs,596791,Anderson (SC) Trojans,596791,8,bot,Alex Naylor to dh.,74,2025-03-28T00:00:00-04:00,"Anderson Memorial Stadium (Anderson, SC)",157,MBA,2025
6344675,596759,Wingate Bulldogs,596791,Anderson (SC) Trojans,596791,8,bot,Joe Scheffler to c for Cam Harris.,75,2025-03-28T00:00:00-04:00,"Anderson Memorial Stadium (Anderson, SC)",157,MBA,2025
6344675,596759,Wingate Bulldogs,596791,Anderson (SC) Trojans,596791,8,bot,Brooks Mauro flied out to lf.,76,2025-03-28T00:00:00-04:00,"Anderson Memorial Stadium (Anderson, SC)",157,MBA,2025
6344675,596759,Wingate Bulldogs,596791,Anderson (SC) Trojans,596791,8,bot,Ben Bullard singled to third base.,77,2025-03-28T00:00:00-04:00,"Anderson Memorial Stadium (Anderson, SC)",157,MBA,2025
6344675,596759,Wingate Bulldogs,596791,Anderson (SC) Trojans,596791,8,bot,Dom Bello walked3a Ben Bullard advanced to second.,78,2025-03-28T00:00:00-04:00,"Anderson Memorial Stadium (Anderson, SC)",157,MBA,2025
6344675,596759,Wingate Bulldogs,596791,Anderson (SC) Trojans,596791,8,bot,Gray Wells singled to second base3a Dom Bello advanced to second3a Ben Bullard advanced to third.,79,2025-03-28T00:00:00-04:00,"Anderson Memorial Stadium (Anderson, SC)",157,MBA,2025
6344675,596759,Wingate Bulldogs,596791,Anderson (SC) Trojans,596791,8,bot,Shane Thomas reached on a fielder's choice3a Gray Wells advanced to second3a Dom Bello advanced to third3a Ben Bullard out at home c unassisted.,80,2025-03-28T00:00:00-04:00,"Anderson Memorial Stadium (Anderson, SC)",157,MBA,2025
6344675,596759,Wingate Bulldogs,596791,Anderson (SC) Trojans,596791,8,bot,"Carson Molinaroli singled to center field, advanced to second on the throw, 2 RBI3a Shane Thomas advanced to third3a Gray Wells scored3a Dom Bello scored.",81,2025-03-28T00:00:00-04:00,"Anderson Memorial Stadium (Anderson, SC)",157,MBA,2025
6344675,596759,Wingate Bulldogs,596791,Anderson (SC) Trojans,596791,8,bot,Tyler Novik to p for Brian Boone.,82,2025-03-28T00:00:00-04:00,"Anderson Memorial Stadium (Anderson, SC)",157,MBA,2025
6344675,596759,Wingate Bulldogs,596791,Anderson (SC) Trojans,596791,8,bot,"Braeden Harrison singled to left field, 2 RBI3a Carson Molinaroli scored3a Shane Thomas scored.",83,2025-03-28T00:00:00-04:00,"Anderson Memorial Stadium (Anderson, SC)",157,MBA,2025
6344675,596759,Wingate Bulldogs,596791,Anderson (SC) Trojans,596791,8,bot,Kyle Caccamise singled through the right side3a Braeden Harrison advanced to third.,84,2025-03-28T00:00:00-04:00,"Anderson Memorial Stadium (Anderson, SC)",157,MBA,2025
6344675,596759,Wingate Bulldogs,596791,Anderson (SC) Trojans,596791,8,bot,"Zach Stover doubled to right center, 2 RBI3a Kyle Caccamise scored3a Braeden Harrison scored.",85,2025-03-28T00:00:00-04:00,"Anderson Memorial Stadium (Anderson, SC)",157,MBA,2025
6344675,596759,Wingate Bulldogs,596791,Anderson (SC) Trojans,596791,8,bot,Zach Stover advanced to third on a wild pitch.,86,2025-03-28T00:00:00-04:00,"Anderson Memorial Stadium (Anderson, SC)",157,MBA,2025
6344675,596759,Wingate Bulldogs,596791,Anderson (SC) Trojans,596791,8,bot,Brooks Mauro hit by pitch.,87,2025-03-28T00:00:00-04:00,"Anderson Memorial Stadium (Anderson, SC)",157,MBA,2025
6344675,596759,Wingate Bulldogs,596791,Anderson (SC) Trojans,596791,8,bot,Bryce Helms pinch hit for Ben Bullard.,88,2025-03-28T00:00:00-04:00,"Anderson Memorial Stadium (Anderson, SC)",157,MBA,2025
6344675,596759,Wingate Bulldogs,596791,Anderson (SC) Trojans,596791,8,bot,Carson Starnes to p for Tyler Novik.,89,2025-03-28T00:00:00-04:00,"Anderson Memorial Stadium (Anderson, SC)",157,MBA,2025
6344675,596759,Wingate Bulldogs,596791,Anderson (SC) Trojans,596791,8,bot,"Bryce Helms singled through the left side, RBI3a Brooks Mauro advanced to second3a Zach Stover scored.",90,2025-03-28T00:00:00-04:00,"Anderson Memorial Stadium (Anderson, SC)",157,MBA,2025
6344675,596759,Wingate Bulldogs,596791,Anderson (SC) Trojans,596791,8,bot,"Dom Bello singled through the left side, RBI3a Bryce Helms advanced to second3a Brooks Mauro scored.",91,2025-03-28T00:00:00-04:00,"Anderson Memorial Stadium (Anderson, SC)",157,MBA,2025
6344675,596759,Wingate Bulldogs,596791,Anderson (SC) Trojans,596791,8,bot,Gray Wells struck out looking.,92,2025-03-28T00:00:00-04:00,"Anderson Memorial Stadium (Anderson, SC)",157,MBA,2025
6344675,596759,Wingate Bulldogs,596791,Anderson (SC) Trojans,596759,9,top,Landon Meyer walked.,93,2025-03-28T00:00:00-04:00,"Anderson Memorial Stadium (Anderson, SC)",157,MBA,2025
6344675,596759,Wingate Bulldogs,596791,Anderson (SC) Trojans,596759,9,top,Will Farrell reached on a fielder's choice to shortstop3a Landon Meyer out at second ss to 2b.,94,2025-03-28T00:00:00-04:00,"Anderson Memorial Stadium (Anderson, SC)",157,MBA,2025
6344675,596759,Wingate Bulldogs,596791,Anderson (SC) Trojans,596759,9,top,David Sessoms pinch hit for Evan Barefoot.,95,2025-03-28T00:00:00-04:00,"Anderson Memorial Stadium (Anderson, SC)",157,MBA,2025
6344675,596759,Wingate Bulldogs,596791,Anderson (SC) Trojans,596759,9,top,David Sessoms singled through the left side3a Will Farrell advanced to second.,96,2025-03-28T00:00:00-04:00,"Anderson Memorial Stadium (Anderson, SC)",157,MBA,2025
6344675,596759,Wingate Bulldogs,596791,Anderson (SC) Trojans,596759,9,top,Justin Barham pinch hit for Jalen Evans.,97,2025-03-28T00:00:00-04:00,"Anderson Memorial Stadium (Anderson, SC)",157,MBA,2025
6344675,596759,Wingate Bulldogs,596791,Anderson (SC) Trojans,596759,9,top,Justin Barham struck out looking.,98,2025-03-28T00:00:00-04:00,"Anderson Memorial Stadium (Anderson, SC)",157,MBA,2025
6344675,596759,Wingate Bulldogs,596791,Anderson (SC) Trojans,596759,9,top,Bradley Hart pinch hit for Jake Courville.,99,2025-03-28T00:00:00-04:00,"Anderson Memorial Stadium (Anderson, SC)",157,MBA,2025
6344675,596759,Wingate Bulldogs,596791,Anderson (SC) Trojans,596759,9,top,"Bradley Hart singled to right field, RBI3a David Sessoms advanced to second3a Will Farrell scored.",100,2025-03-28T00:00:00-04:00,"Anderson Memorial Stadium (Anderson, SC)",157,MBA,2025
6344675,596759,Wingate Bulldogs,596791,Anderson (SC) Trojans,596759,9,top,Gavin Groppuso reached on a fielder's choice to shortstop3a Bradley Hart advanced to second3a David Sessoms out at third ss to 3b.,101,2025-03-28T00:00:00-04:00,"Anderson Memorial Stadium (Anderson, SC)",157,MBA,2025
