game_id,away_team_id,away_team_name,home_team_id,home_team_name,batting_team,inning,top_bot,event_text,event_num,game_datetime,stadium_name,attendance,sport_id,season
6344211,597107,Edgewood Eagles,597083,Wis.-Platteville Pioneers,597107,1,top,T. jr flied out to lf.,1,2025-05-05T00:00:00-04:00,"Kendall Murray Field (Platteville, WI)",72,MBA,2025
6344211,597107,Edgewood Eagles,597083,Wis.-Platteville Pioneers,597107,1,top,H. Hellenbra flied out to cf.,2,2025-05-05T00:00:00-04:00,"Kendall Murray Field (Platteville, WI)",72,MBA,2025
6344211,597107,Edgewood Eagles,597083,Wis.-Platteville Pioneers,597107,1,top,J. Carney singled up the middle.,3,2025-05-05T00:00:00-04:00,"Kendall Murray Field (Platteville, WI)",72,MBA,2025
6344211,597107,Edgewood Eagles,597083,Wis.-Platteville Pioneers,597107,1,top,K. Prindle lined out to lf.,4,2025-05-05T00:00:00-04:00,"Kendall Murray Field (Platteville, WI)",72,MBA,2025
6344211,597107,Edgewood Eagles,597083,Wis.-Platteville Pioneers,597083,1,bot,T. Beland singled through the left side.,5,2025-05-05T00:00:00-04:00,"Kendall Murray Field (Platteville, WI)",72,MBA,2025
6344211,597107,Edgewood Eagles,597083,Wis.-Platteville Pioneers,597083,1,bot,C. Parker singled to right field; T. Beland advanced to second.,6,2025-05-05T00:00:00-04:00,"Kendall Murray Field (Platteville, WI)",72,MBA,2025
6344211,597107,Edgewood Eagles,597083,Wis.-Platteville Pioneers,597083,1,bot,A. Massa reached on a fielder's choice to shortstop; C. Parker out at second ss to 2b; T. Beland out at third 2b to 3b.,7,2025-05-05T00:00:00-04:00,"Kendall Murray Field (Platteville, WI)",72,MBA,2025
6344211,597107,Edgewood Eagles,597083,Wis.-Platteville Pioneers,597083,1,bot,S. Meidenbau struck out looking.,8,2025-05-05T00:00:00-04:00,"Kendall Murray Field (Platteville, WI)",72,MBA,2025
6344211,597107,Edgewood Eagles,597083,Wis.-Platteville Pioneers,597107,2,top,B. Brisack singled to shortstop.,9,2025-05-05T00:00:00-04:00,"Kendall Murray Field (Platteville, WI)",72,MBA,2025
6344211,597107,Edgewood Eagles,597083,Wis.-Platteville Pioneers,597107,2,top,B. Brisack advanced to second on a balk.,10,2025-05-05T00:00:00-04:00,"Kendall Murray Field (Platteville, WI)",72,MBA,2025
6344211,597107,Edgewood Eagles,597083,Wis.-Platteville Pioneers,597107,2,top,D. Bentivegn walked.,11,2025-05-05T00:00:00-04:00,"Kendall Murray Field (Platteville, WI)",72,MBA,2025
6344211,597107,Edgewood Eagles,597083,Wis.-Platteville Pioneers,597107,2,top,D. Lee grounded into double play 2b to ss to 1b; D. Bentivegn out on the play; B. Brisack advanced to third.,12,2025-05-05T00:00:00-04:00,"Kendall Murray Field (Platteville, WI)",72,MBA,2025
6344211,597107,Edgewood Eagles,597083,Wis.-Platteville Pioneers,597107,2,top,R. Harris walked.,13,2025-05-05T00:00:00-04:00,"Kendall Murray Field (Platteville, WI)",72,MBA,2025
6344211,597107,Edgewood Eagles,597083,Wis.-Platteville Pioneers,597107,2,top,C. Kelley grounded out to 3b.,14,2025-05-05T00:00:00-04:00,"Kendall Murray Field (Platteville, WI)",72,MBA,2025
6344211,597107,Edgewood Eagles,597083,Wis.-Platteville Pioneers,597083,2,bot,J. Wegner flied out to rf.,15,2025-05-05T00:00:00-04:00,"Kendall Murray Field (Platteville, WI)",72,MBA,2025
6344211,597107,Edgewood Eagles,597083,Wis.-Platteville Pioneers,597083,2,bot,J. Fago popped up to 1b.,16,2025-05-05T00:00:00-04:00,"Kendall Murray Field (Platteville, WI)",72,MBA,2025
6344211,597107,Edgewood Eagles,597083,Wis.-Platteville Pioneers,597083,2,bot,C. Gresens struck out swinging.,17,2025-05-05T00:00:00-04:00,"Kendall Murray Field (Platteville, WI)",72,MBA,2025
6344211,597107,Edgewood Eagles,597083,Wis.-Platteville Pioneers,597107,3,top,T. jr flied out to lf.,18,2025-05-05T00:00:00-04:00,"Kendall Murray Field (Platteville, WI)",72,MBA,2025
6344211,597107,Edgewood Eagles,597083,Wis.-Platteville Pioneers,597107,3,top,H. Hellenbra fouled out to 1b.,19,2025-05-05T00:00:00-04:00,"Kendall Murray Field (Platteville, WI)",72,MBA,2025
6344211,597107,Edgewood Eagles,597083,Wis.-Platteville Pioneers,597107,3,top,"J. Carney homered to left field, RBI.",20,2025-05-05T00:00:00-04:00,"Kendall Murray Field (Platteville, WI)",72,MBA,2025
6344211,597107,Edgewood Eagles,597083,Wis.-Platteville Pioneers,597107,3,top,K. Prindle grounded out to p.,21,2025-05-05T00:00:00-04:00,"Kendall Murray Field (Platteville, WI)",72,MBA,2025
6344211,597107,Edgewood Eagles,597083,Wis.-Platteville Pioneers,597083,3,bot,M. Molitor singled to center field.,22,2025-05-05T00:00:00-04:00,"Kendall Murray Field (Platteville, WI)",72,MBA,2025
6344211,597107,Edgewood Eagles,597083,Wis.-Platteville Pioneers,597083,3,bot,"S. Higa grounded out to 3b, SAC, bunt; M. Molitor advanced to second.",23,2025-05-05T00:00:00-04:00,"Kendall Murray Field (Platteville, WI)",72,MBA,2025
6344211,597107,Edgewood Eagles,597083,Wis.-Platteville Pioneers,597083,3,bot,"T. Beland doubled to left field, RBI; M. Molitor scored.",24,2025-05-05T00:00:00-04:00,"Kendall Murray Field (Platteville, WI)",72,MBA,2025
6344211,597107,Edgewood Eagles,597083,Wis.-Platteville Pioneers,597083,3,bot,C. Parker singled to right field; T. Beland advanced to third.,25,2025-05-05T00:00:00-04:00,"Kendall Murray Field (Platteville, WI)",72,MBA,2025
6344211,597107,Edgewood Eagles,597083,Wis.-Platteville Pioneers,597083,3,bot,"A. Massa reached first on a throwing error by 3b, advanced to third, RBI; C. Parker advanced to third, scored on a throwing error by 1b, unearned; T. Beland scored.",26,2025-05-05T00:00:00-04:00,"Kendall Murray Field (Platteville, WI)",72,MBA,2025
6344211,597107,Edgewood Eagles,597083,Wis.-Platteville Pioneers,597083,3,bot,S. Meidenbau walked.,27,2025-05-05T00:00:00-04:00,"Kendall Murray Field (Platteville, WI)",72,MBA,2025
6344211,597107,Edgewood Eagles,597083,Wis.-Platteville Pioneers,597083,3,bot,C. Jones to p for A. Zdziarski.,28,2025-05-05T00:00:00-04:00,"Kendall Murray Field (Platteville, WI)",72,MBA,2025
6344211,597107,Edgewood Eagles,597083,Wis.-Platteville Pioneers,597083,3,bot,J. Wegner walked; S. Meidenbau advanced to second.,29,2025-05-05T00:00:00-04:00,"Kendall Murray Field (Platteville, WI)",72,MBA,2025
6344211,597107,Edgewood Eagles,597083,Wis.-Platteville Pioneers,597083,3,bot,"J. Fago flied out to cf, sacrifice fly, RBI; S. Meidenbau advanced to third; A. Massa scored, unearned.",30,2025-05-05T00:00:00-04:00,"Kendall Murray Field (Platteville, WI)",72,MBA,2025
6344211,597107,Edgewood Eagles,597083,Wis.-Platteville Pioneers,597083,3,bot,C. Gresens popped up to 2b.,31,2025-05-05T00:00:00-04:00,"Kendall Murray Field (Platteville, WI)",72,MBA,2025
6344211,597107,Edgewood Eagles,597083,Wis.-Platteville Pioneers,597107,4,top,W. Fischer to p for T. Beland.,32,2025-05-05T00:00:00-04:00,"Kendall Murray Field (Platteville, WI)",72,MBA,2025
6344211,597107,Edgewood Eagles,597083,Wis.-Platteville Pioneers,597107,4,top,B. Brisack singled to left field.,33,2025-05-05T00:00:00-04:00,"Kendall Murray Field (Platteville, WI)",72,MBA,2025
6344211,597107,Edgewood Eagles,597083,Wis.-Platteville Pioneers,597107,4,top,B. Brisack stole second.,34,2025-05-05T00:00:00-04:00,"Kendall Murray Field (Platteville, WI)",72,MBA,2025
6344211,597107,Edgewood Eagles,597083,Wis.-Platteville Pioneers,597107,4,top,D. Bentivegn walked.,35,2025-05-05T00:00:00-04:00,"Kendall Murray Field (Platteville, WI)",72,MBA,2025
6344211,597107,Edgewood Eagles,597083,Wis.-Platteville Pioneers,597107,4,top,D. Lee lined out to lf.,36,2025-05-05T00:00:00-04:00,"Kendall Murray Field (Platteville, WI)",72,MBA,2025
6344211,597107,Edgewood Eagles,597083,Wis.-Platteville Pioneers,597107,4,top,D. Bentivegn stole second; B. Brisack stole third.,37,2025-05-05T00:00:00-04:00,"Kendall Murray Field (Platteville, WI)",72,MBA,2025
6344211,597107,Edgewood Eagles,597083,Wis.-Platteville Pioneers,597107,4,top,R. Harris grounded out to 3b.,38,2025-05-05T00:00:00-04:00,"Kendall Murray Field (Platteville, WI)",72,MBA,2025
6344211,597107,Edgewood Eagles,597083,Wis.-Platteville Pioneers,597107,4,top,C. Kelley struck out swinging.,39,2025-05-05T00:00:00-04:00,"Kendall Murray Field (Platteville, WI)",72,MBA,2025
6344211,597107,Edgewood Eagles,597083,Wis.-Platteville Pioneers,597083,4,bot,M. Molitor singled to right center.,40,2025-05-05T00:00:00-04:00,"Kendall Murray Field (Platteville, WI)",72,MBA,2025
6344211,597107,Edgewood Eagles,597083,Wis.-Platteville Pioneers,597083,4,bot,S. Higa struck out swinging.,41,2025-05-05T00:00:00-04:00,"Kendall Murray Field (Platteville, WI)",72,MBA,2025
6344211,597107,Edgewood Eagles,597083,Wis.-Platteville Pioneers,597083,4,bot,T. Beland flied out to cf.,42,2025-05-05T00:00:00-04:00,"Kendall Murray Field (Platteville, WI)",72,MBA,2025
6344211,597107,Edgewood Eagles,597083,Wis.-Platteville Pioneers,597083,4,bot,C. Parker walked; M. Molitor advanced to second.,43,2025-05-05T00:00:00-04:00,"Kendall Murray Field (Platteville, WI)",72,MBA,2025
6344211,597107,Edgewood Eagles,597083,Wis.-Platteville Pioneers,597083,4,bot,"A. Massa reached on a fielder's choice to third base; C. Parker advanced to second, advanced to third on a throwing error by 3b; M. Molitor scored, unearned.",44,2025-05-05T00:00:00-04:00,"Kendall Murray Field (Platteville, WI)",72,MBA,2025
6344211,597107,Edgewood Eagles,597083,Wis.-Platteville Pioneers,597083,4,bot,"S. Meidenbau doubled to right center, advanced to third, 2 RBI; A. Massa scored, unearned; C. Parker scored, unearned.",45,2025-05-05T00:00:00-04:00,"Kendall Murray Field (Platteville, WI)",72,MBA,2025
6344211,597107,Edgewood Eagles,597083,Wis.-Platteville Pioneers,597083,4,bot,J. Wegner walked.,46,2025-05-05T00:00:00-04:00,"Kendall Murray Field (Platteville, WI)",72,MBA,2025
6344211,597107,Edgewood Eagles,597083,Wis.-Platteville Pioneers,597083,4,bot,J. Fago struck out looking.,47,2025-05-05T00:00:00-04:00,"Kendall Murray Field (Platteville, WI)",72,MBA,2025
6344211,597107,Edgewood Eagles,597083,Wis.-Platteville Pioneers,597107,5,top,T. jr struck out swinging.,48,2025-05-05T00:00:00-04:00,"Kendall Murray Field (Platteville, WI)",72,MBA,2025
6344211,597107,Edgewood Eagles,597083,Wis.-Platteville Pioneers,597107,5,top,H. Hellenbra flied out to rf.,49,2025-05-05T00:00:00-04:00,"Kendall Murray Field (Platteville, WI)",72,MBA,2025
6344211,597107,Edgewood Eagles,597083,Wis.-Platteville Pioneers,597107,5,top,J. Carney lined out to ss.,50,2025-05-05T00:00:00-04:00,"Kendall Murray Field (Platteville, WI)",72,MBA,2025
6344211,597107,Edgewood Eagles,597083,Wis.-Platteville Pioneers,597083,5,bot,C. Gresens grounded out to 1b unassisted.,51,2025-05-05T00:00:00-04:00,"Kendall Murray Field (Platteville, WI)",72,MBA,2025
6344211,597107,Edgewood Eagles,597083,Wis.-Platteville Pioneers,597083,5,bot,M. Molitor lined out to cf.,52,2025-05-05T00:00:00-04:00,"Kendall Murray Field (Platteville, WI)",72,MBA,2025
6344211,597107,Edgewood Eagles,597083,Wis.-Platteville Pioneers,597083,5,bot,S. Higa hit by pitch.,53,2025-05-05T00:00:00-04:00,"Kendall Murray Field (Platteville, WI)",72,MBA,2025
6344211,597107,Edgewood Eagles,597083,Wis.-Platteville Pioneers,597083,5,bot,T. Beland reached on a fielder's choice to shortstop; S. Higa out at second ss unassisted.,54,2025-05-05T00:00:00-04:00,"Kendall Murray Field (Platteville, WI)",72,MBA,2025
6344211,597107,Edgewood Eagles,597083,Wis.-Platteville Pioneers,597107,6,top,B. Katterhag to c for C. Gresens.,55,2025-05-05T00:00:00-04:00,"Kendall Murray Field (Platteville, WI)",72,MBA,2025
6344211,597107,Edgewood Eagles,597083,Wis.-Platteville Pioneers,597107,6,top,K. Prindle flied out to lf.,56,2025-05-05T00:00:00-04:00,"Kendall Murray Field (Platteville, WI)",72,MBA,2025
6344211,597107,Edgewood Eagles,597083,Wis.-Platteville Pioneers,597107,6,top,B. Brisack walked.,57,2025-05-05T00:00:00-04:00,"Kendall Murray Field (Platteville, WI)",72,MBA,2025
6344211,597107,Edgewood Eagles,597083,Wis.-Platteville Pioneers,597107,6,top,D. Bentivegn struck out swinging.,58,2025-05-05T00:00:00-04:00,"Kendall Murray Field (Platteville, WI)",72,MBA,2025
6344211,597107,Edgewood Eagles,597083,Wis.-Platteville Pioneers,597107,6,top,D. Lee struck out looking.,59,2025-05-05T00:00:00-04:00,"Kendall Murray Field (Platteville, WI)",72,MBA,2025
6344211,597107,Edgewood Eagles,597083,Wis.-Platteville Pioneers,597083,6,bot,R. Ambrosy to 2b for D. Bentivegn.,60,2025-05-05T00:00:00-04:00,"Kendall Murray Field (Platteville, WI)",72,MBA,2025
6344211,597107,Edgewood Eagles,597083,Wis.-Platteville Pioneers,597083,6,bot,C. Parker struck out swinging.,61,2025-05-05T00:00:00-04:00,"Kendall Murray Field (Platteville, WI)",72,MBA,2025
6344211,597107,Edgewood Eagles,597083,Wis.-Platteville Pioneers,597083,6,bot,A. Massa grounded out to 2b.,62,2025-05-05T00:00:00-04:00,"Kendall Murray Field (Platteville, WI)",72,MBA,2025
6344211,597107,Edgewood Eagles,597083,Wis.-Platteville Pioneers,597083,6,bot,S. Meidenbau grounded out to 3b.,63,2025-05-05T00:00:00-04:00,"Kendall Murray Field (Platteville, WI)",72,MBA,2025
6344211,597107,Edgewood Eagles,597083,Wis.-Platteville Pioneers,597107,7,top,B. Schimmel to p for W. Fischer.,64,2025-05-05T00:00:00-04:00,"Kendall Murray Field (Platteville, WI)",72,MBA,2025
6344211,597107,Edgewood Eagles,597083,Wis.-Platteville Pioneers,597107,7,top,R. Harris struck out looking.,65,2025-05-05T00:00:00-04:00,"Kendall Murray Field (Platteville, WI)",72,MBA,2025
6344211,597107,Edgewood Eagles,597083,Wis.-Platteville Pioneers,597107,7,top,C. Kelley flied out to lf.,66,2025-05-05T00:00:00-04:00,"Kendall Murray Field (Platteville, WI)",72,MBA,2025
6344211,597107,Edgewood Eagles,597083,Wis.-Platteville Pioneers,597107,7,top,T. jr grounded out to 1b unassisted.,67,2025-05-05T00:00:00-04:00,"Kendall Murray Field (Platteville, WI)",72,MBA,2025
6344211,597107,Edgewood Eagles,597083,Wis.-Platteville Pioneers,597083,7,bot,J. Wegner fouled out to 1b.,68,2025-05-05T00:00:00-04:00,"Kendall Murray Field (Platteville, WI)",72,MBA,2025
6344211,597107,Edgewood Eagles,597083,Wis.-Platteville Pioneers,597083,7,bot,J. Fago flied out to rf.,69,2025-05-05T00:00:00-04:00,"Kendall Murray Field (Platteville, WI)",72,MBA,2025
6344211,597107,Edgewood Eagles,597083,Wis.-Platteville Pioneers,597083,7,bot,B. Katterhag singled to left field.,70,2025-05-05T00:00:00-04:00,"Kendall Murray Field (Platteville, WI)",72,MBA,2025
6344211,597107,Edgewood Eagles,597083,Wis.-Platteville Pioneers,597083,7,bot,M. Molitor hit by pitch; B. Katterhag advanced to second.,71,2025-05-05T00:00:00-04:00,"Kendall Murray Field (Platteville, WI)",72,MBA,2025
6344211,597107,Edgewood Eagles,597083,Wis.-Platteville Pioneers,597083,7,bot,M. Molitor advanced to second on a wild pitch; B. Katterhag stole third.,72,2025-05-05T00:00:00-04:00,"Kendall Murray Field (Platteville, WI)",72,MBA,2025
6344211,597107,Edgewood Eagles,597083,Wis.-Platteville Pioneers,597083,7,bot,J. Hamann pinch hit for S. Higa.,73,2025-05-05T00:00:00-04:00,"Kendall Murray Field (Platteville, WI)",72,MBA,2025
6344211,597107,Edgewood Eagles,597083,Wis.-Platteville Pioneers,597083,7,bot,J. Hamann grounded out to ss.,74,2025-05-05T00:00:00-04:00,"Kendall Murray Field (Platteville, WI)",72,MBA,2025
6344211,597107,Edgewood Eagles,597083,Wis.-Platteville Pioneers,597107,8,top,J. Hamann to 2b for R. Dutton.,75,2025-05-05T00:00:00-04:00,"Kendall Murray Field (Platteville, WI)",72,MBA,2025
6344211,597107,Edgewood Eagles,597083,Wis.-Platteville Pioneers,597107,8,top,H. Hellenbra struck out swinging.,76,2025-05-05T00:00:00-04:00,"Kendall Murray Field (Platteville, WI)",72,MBA,2025
6344211,597107,Edgewood Eagles,597083,Wis.-Platteville Pioneers,597107,8,top,"J. Carney struck out swinging, out at first c to 1b.",77,2025-05-05T00:00:00-04:00,"Kendall Murray Field (Platteville, WI)",72,MBA,2025
6344211,597107,Edgewood Eagles,597083,Wis.-Platteville Pioneers,597107,8,top,K. Prindle walked.,78,2025-05-05T00:00:00-04:00,"Kendall Murray Field (Platteville, WI)",72,MBA,2025
6344211,597107,Edgewood Eagles,597083,Wis.-Platteville Pioneers,597107,8,top,B. Brisack reached on a fielder's choice to shortstop; K. Prindle out at second ss to 2b.,79,2025-05-05T00:00:00-04:00,"Kendall Murray Field (Platteville, WI)",72,MBA,2025
6344211,597107,Edgewood Eagles,597083,Wis.-Platteville Pioneers,597083,8,bot,N. Bacskai to p for C. Jones.,80,2025-05-05T00:00:00-04:00,"Kendall Murray Field (Platteville, WI)",72,MBA,2025
6344211,597107,Edgewood Eagles,597083,Wis.-Platteville Pioneers,597083,8,bot,G. Bossert pinch hit for T. Beland.,81,2025-05-05T00:00:00-04:00,"Kendall Murray Field (Platteville, WI)",72,MBA,2025
6344211,597107,Edgewood Eagles,597083,Wis.-Platteville Pioneers,597083,8,bot,G. Bossert grounded out to 3b.,82,2025-05-05T00:00:00-04:00,"Kendall Murray Field (Platteville, WI)",72,MBA,2025
6344211,597107,Edgewood Eagles,597083,Wis.-Platteville Pioneers,597083,8,bot,R. Dutton pinch hit for C. Parker.,83,2025-05-05T00:00:00-04:00,"Kendall Murray Field (Platteville, WI)",72,MBA,2025
6344211,597107,Edgewood Eagles,597083,Wis.-Platteville Pioneers,597083,8,bot,R. Dutton walked.,84,2025-05-05T00:00:00-04:00,"Kendall Murray Field (Platteville, WI)",72,MBA,2025
6344211,597107,Edgewood Eagles,597083,Wis.-Platteville Pioneers,597083,8,bot,X. Lara pinch hit for A. Massa.,85,2025-05-05T00:00:00-04:00,"Kendall Murray Field (Platteville, WI)",72,MBA,2025
6344211,597107,Edgewood Eagles,597083,Wis.-Platteville Pioneers,597083,8,bot,"X. Lara struck out swinging; R. Dutton out at second c to ss, caught stealing.",86,2025-05-05T00:00:00-04:00,"Kendall Murray Field (Platteville, WI)",72,MBA,2025
6344211,597107,Edgewood Eagles,597083,Wis.-Platteville Pioneers,597107,9,top,G. Bossert to cf.,87,2025-05-05T00:00:00-04:00,"Kendall Murray Field (Platteville, WI)",72,MBA,2025
6344211,597107,Edgewood Eagles,597083,Wis.-Platteville Pioneers,597107,9,top,R. Dutton to 2b.,88,2025-05-05T00:00:00-04:00,"Kendall Murray Field (Platteville, WI)",72,MBA,2025
6344211,597107,Edgewood Eagles,597083,Wis.-Platteville Pioneers,597107,9,top,E. Bohr to 3b for X. Lara.,89,2025-05-05T00:00:00-04:00,"Kendall Murray Field (Platteville, WI)",72,MBA,2025
6344211,597107,Edgewood Eagles,597083,Wis.-Platteville Pioneers,597107,9,top,J. Hamann to ss for R. Dutton.,90,2025-05-05T00:00:00-04:00,"Kendall Murray Field (Platteville, WI)",72,MBA,2025
6344211,597107,Edgewood Eagles,597083,Wis.-Platteville Pioneers,597107,9,top,R. Ambrosy popped up to 2b.,91,2025-05-05T00:00:00-04:00,"Kendall Murray Field (Platteville, WI)",72,MBA,2025
6344211,597107,Edgewood Eagles,597083,Wis.-Platteville Pioneers,597107,9,top,D. Lee flied out to cf.,92,2025-05-05T00:00:00-04:00,"Kendall Murray Field (Platteville, WI)",72,MBA,2025
6344211,597107,Edgewood Eagles,597083,Wis.-Platteville Pioneers,597107,9,top,C. Mirocha pinch hit for R. Harris.,93,2025-05-05T00:00:00-04:00,"Kendall Murray Field (Platteville, WI)",72,MBA,2025
6344211,597107,Edgewood Eagles,597083,Wis.-Platteville Pioneers,597107,9,top,C. Mirocha hit by pitch.,94,2025-05-05T00:00:00-04:00,"Kendall Murray Field (Platteville, WI)",72,MBA,2025
6344211,597107,Edgewood Eagles,597083,Wis.-Platteville Pioneers,597107,9,top,C. Kelley struck out swinging.,95,2025-05-05T00:00:00-04:00,"Kendall Murray Field (Platteville, WI)",72,MBA,2025
