game_id,away_team_id,away_team_name,home_team_id,home_team_name,batting_team,inning,top_bot,event_text,event_num,game_datetime,stadium_name,attendance,sport_id,season
6344467,597264,Delaware Valley Aggies,597129,Cairn Highlanders,597264,8,top,J. Seibert grounded out to 2b.,127,2025-03-26T00:00:00-04:00,"Stillman Athletic Complex (Langhorne, PA)",0,MBA,2025
6344467,597264,Delaware Valley Aggies,597129,Cairn Highlanders,597129,8,bot,C. Esbenshad to p for J. Dehaven.,128,2025-03-26T00:00:00-04:00,"Stillman Athletic Complex (Langhorne, PA)",0,MBA,2025
6344467,597264,Delaware Valley Aggies,597129,Cairn Highlanders,597129,8,bot,J. Wtulich walked.,129,2025-03-26T00:00:00-04:00,"Stillman Athletic Complex (Langhorne, PA)",0,MBA,2025
6344467,597264,Delaware Valley Aggies,597129,Cairn Highlanders,597129,8,bot,S. Persiani flied out to lf.,130,2025-03-26T00:00:00-04:00,"Stillman Athletic Complex (Langhorne, PA)",0,MBA,2025
6344467,597264,Delaware Valley Aggies,597129,Cairn Highlanders,597129,8,bot,"T. Warr doubled, RBI; J. Wtulich scored.",131,2025-03-26T00:00:00-04:00,"Stillman Athletic Complex (Langhorne, PA)",0,MBA,2025
6344467,597264,Delaware Valley Aggies,597129,Cairn Highlanders,597129,8,bot,C. Hill pinch ran for T. Warr.,132,2025-03-26T00:00:00-04:00,"Stillman Athletic Complex (Langhorne, PA)",0,MBA,2025
6344467,597264,Delaware Valley Aggies,597129,Cairn Highlanders,597129,8,bot,N. Brittin struck out swinging.,133,2025-03-26T00:00:00-04:00,"Stillman Athletic Complex (Langhorne, PA)",0,MBA,2025
6344467,597264,Delaware Valley Aggies,597129,Cairn Highlanders,597129,8,bot,G. Villegas struck out swinging.,134,2025-03-26T00:00:00-04:00,"Stillman Athletic Complex (Langhorne, PA)",0,MBA,2025
6344467,597264,Delaware Valley Aggies,597129,Cairn Highlanders,597264,9,top,C. Spadea to 1b for C. Hill.,135,2025-03-26T00:00:00-04:00,"Stillman Athletic Complex (Langhorne, PA)",0,MBA,2025
6344467,597264,Delaware Valley Aggies,597129,Cairn Highlanders,597264,9,top,C. Valenzuel to p for C. Ferguson.,136,2025-03-26T00:00:00-04:00,"Stillman Athletic Complex (Langhorne, PA)",0,MBA,2025
6344467,597264,Delaware Valley Aggies,597129,Cairn Highlanders,597264,9,top,"T. Gossel singled to third base, advanced to second on an error by 3b.",137,2025-03-26T00:00:00-04:00,"Stillman Athletic Complex (Langhorne, PA)",0,MBA,2025
6344467,597264,Delaware Valley Aggies,597129,Cairn Highlanders,597264,9,top,M. Brunelli pinch hit for G. Migliori.,138,2025-03-26T00:00:00-04:00,"Stillman Athletic Complex (Langhorne, PA)",0,MBA,2025
6344467,597264,Delaware Valley Aggies,597129,Cairn Highlanders,597264,9,top,T. Gossel stole third.,139,2025-03-26T00:00:00-04:00,"Stillman Athletic Complex (Langhorne, PA)",0,MBA,2025
6344467,597264,Delaware Valley Aggies,597129,Cairn Highlanders,597264,9,top,M. Brunelli walked.,140,2025-03-26T00:00:00-04:00,"Stillman Athletic Complex (Langhorne, PA)",0,MBA,2025
6344467,597264,Delaware Valley Aggies,597129,Cairn Highlanders,597264,9,top,K. Boyer pinch hit for R. Hackett.,141,2025-03-26T00:00:00-04:00,"Stillman Athletic Complex (Langhorne, PA)",0,MBA,2025
6344467,597264,Delaware Valley Aggies,597129,Cairn Highlanders,597264,9,top,"K. Boyer flied out to cf, sacrifice fly, RBI; T. Gossel scored.",142,2025-03-26T00:00:00-04:00,"Stillman Athletic Complex (Langhorne, PA)",0,MBA,2025
6344467,597264,Delaware Valley Aggies,597129,Cairn Highlanders,597264,9,top,M. Brunelli advanced to second on a wild pitch.,143,2025-03-26T00:00:00-04:00,"Stillman Athletic Complex (Langhorne, PA)",0,MBA,2025
6344467,597264,Delaware Valley Aggies,597129,Cairn Highlanders,597264,9,top,"J. Koenig struck out swinging, reached first on a wild pitch; M. Brunelli advanced to third.",144,2025-03-26T00:00:00-04:00,"Stillman Athletic Complex (Langhorne, PA)",0,MBA,2025
6344467,597264,Delaware Valley Aggies,597129,Cairn Highlanders,597264,9,top,"L. Martin grounded out to 1b unassisted, RBI; J. Koenig advanced to second; M. Brunelli scored.",145,2025-03-26T00:00:00-04:00,"Stillman Athletic Complex (Langhorne, PA)",0,MBA,2025
6344467,597264,Delaware Valley Aggies,597129,Cairn Highlanders,597264,9,top,A. Schneider struck out swinging.,146,2025-03-26T00:00:00-04:00,"Stillman Athletic Complex (Langhorne, PA)",0,MBA,2025
