game_id,away_team_id,away_team_name,home_team_id,home_team_name,batting_team,inning,top_bot,event_text,event_num,game_datetime,stadium_name,attendance,sport_id,season
6345419,597155,Wis. Lutheran Warriors,597122,Maranatha Baptist Sabercats,597155,1,top,O. Lopeztell grounded out to 2b.,1,2025-04-04T00:00:00-04:00,"Washington Park (Watertown, WI)",32,MBA,2025
6345419,597155,Wis. Lutheran Warriors,597122,Maranatha Baptist Sabercats,597155,1,top,A. Montgomer struck out swinging.,2,2025-04-04T00:00:00-04:00,"Washington Park (Watertown, WI)",32,MBA,2025
6345419,597155,Wis. Lutheran Warriors,597122,Maranatha Baptist Sabercats,597155,1,top,N. Hodgins walked.,3,2025-04-04T00:00:00-04:00,"Washington Park (Watertown, WI)",32,MBA,2025
6345419,597155,Wis. Lutheran Warriors,597122,Maranatha Baptist Sabercats,597155,1,top,I. Rintelman grounded out to 3b.,4,2025-04-04T00:00:00-04:00,"Washington Park (Watertown, WI)",32,MBA,2025
6345419,597155,Wis. Lutheran Warriors,597122,Maranatha Baptist Sabercats,597122,1,bot,C. Curcuro flied out to rf.,5,2025-04-04T00:00:00-04:00,"Washington Park (Watertown, WI)",32,MBA,2025
6345419,597155,Wis. Lutheran Warriors,597122,Maranatha Baptist Sabercats,597122,1,bot,J. Anderson walked.,6,2025-04-04T00:00:00-04:00,"Washington Park (Watertown, WI)",32,MBA,2025
6345419,597155,Wis. Lutheran Warriors,597122,Maranatha Baptist Sabercats,597122,1,bot,J. Jeske walked3a J. Anderson advanced to second.,7,2025-04-04T00:00:00-04:00,"Washington Park (Watertown, WI)",32,MBA,2025
6345419,597155,Wis. Lutheran Warriors,597122,Maranatha Baptist Sabercats,597122,1,bot,"T. Haugen singled through the left side, RBI3a J. Jeske advanced to second3a J. Anderson scored.",8,2025-04-04T00:00:00-04:00,"Washington Park (Watertown, WI)",32,MBA,2025
6345419,597155,Wis. Lutheran Warriors,597122,Maranatha Baptist Sabercats,597122,1,bot,D. Wheeler popped up to p.,9,2025-04-04T00:00:00-04:00,"Washington Park (Watertown, WI)",32,MBA,2025
6345419,597155,Wis. Lutheran Warriors,597122,Maranatha Baptist Sabercats,597122,1,bot,E. Pease reached on a fielder's choice3a T. Haugen out at second ss to 2b.,10,2025-04-04T00:00:00-04:00,"Washington Park (Watertown, WI)",32,MBA,2025
6345419,597155,Wis. Lutheran Warriors,597122,Maranatha Baptist Sabercats,597155,2,top,N. Zaccanti walked.,11,2025-04-04T00:00:00-04:00,"Washington Park (Watertown, WI)",32,MBA,2025
6345419,597155,Wis. Lutheran Warriors,597122,Maranatha Baptist Sabercats,597155,2,top,N. Zaccanti advanced to second on a wild pitch.,12,2025-04-04T00:00:00-04:00,"Washington Park (Watertown, WI)",32,MBA,2025
6345419,597155,Wis. Lutheran Warriors,597122,Maranatha Baptist Sabercats,597155,2,top,J. Lorbecki grounded out to 3b.,13,2025-04-04T00:00:00-04:00,"Washington Park (Watertown, WI)",32,MBA,2025
6345419,597155,Wis. Lutheran Warriors,597122,Maranatha Baptist Sabercats,597155,2,top,E. Shevey singled to right field3a N. Zaccanti advanced to third.,14,2025-04-04T00:00:00-04:00,"Washington Park (Watertown, WI)",32,MBA,2025
6345419,597155,Wis. Lutheran Warriors,597122,Maranatha Baptist Sabercats,597155,2,top,"E. Shevey out at first p to 1b to ss, picked off.",15,2025-04-04T00:00:00-04:00,"Washington Park (Watertown, WI)",32,MBA,2025
6345419,597155,Wis. Lutheran Warriors,597122,Maranatha Baptist Sabercats,597155,2,top,C. Zorn struck out swinging.,16,2025-04-04T00:00:00-04:00,"Washington Park (Watertown, WI)",32,MBA,2025
6345419,597155,Wis. Lutheran Warriors,597122,Maranatha Baptist Sabercats,597122,2,bot,T. Nickels struck out looking.,17,2025-04-04T00:00:00-04:00,"Washington Park (Watertown, WI)",32,MBA,2025
6345419,597155,Wis. Lutheran Warriors,597122,Maranatha Baptist Sabercats,597122,2,bot,J. Martin singled to second base.,18,2025-04-04T00:00:00-04:00,"Washington Park (Watertown, WI)",32,MBA,2025
6345419,597155,Wis. Lutheran Warriors,597122,Maranatha Baptist Sabercats,597122,2,bot,C. Pittsenba reached on a fielder's choice3a J. Martin out at second p to ss.,19,2025-04-04T00:00:00-04:00,"Washington Park (Watertown, WI)",32,MBA,2025
6345419,597155,Wis. Lutheran Warriors,597122,Maranatha Baptist Sabercats,597122,2,bot,C. Curcuro struck out looking.,20,2025-04-04T00:00:00-04:00,"Washington Park (Watertown, WI)",32,MBA,2025
6345419,597155,Wis. Lutheran Warriors,597122,Maranatha Baptist Sabercats,597155,3,top,N. Dudek singled to center field.,21,2025-04-04T00:00:00-04:00,"Washington Park (Watertown, WI)",32,MBA,2025
6345419,597155,Wis. Lutheran Warriors,597122,Maranatha Baptist Sabercats,597155,3,top,"O. Lopeztell singled to third base, bunt3a N. Dudek advanced to second.",22,2025-04-04T00:00:00-04:00,"Washington Park (Watertown, WI)",32,MBA,2025
6345419,597155,Wis. Lutheran Warriors,597122,Maranatha Baptist Sabercats,597155,3,top,A. Montgomer flied out to cf.,23,2025-04-04T00:00:00-04:00,"Washington Park (Watertown, WI)",32,MBA,2025
6345419,597155,Wis. Lutheran Warriors,597122,Maranatha Baptist Sabercats,597155,3,top,"N. Hodgins doubled to center field, RBI3a O. Lopeztell advanced to third3a N. Dudek scored.",24,2025-04-04T00:00:00-04:00,"Washington Park (Watertown, WI)",32,MBA,2025
6345419,597155,Wis. Lutheran Warriors,597122,Maranatha Baptist Sabercats,597155,3,top,"I. Rintelman singled to left field, 2 RBI3a N. Hodgins scored3a O. Lopeztell scored.",25,2025-04-04T00:00:00-04:00,"Washington Park (Watertown, WI)",32,MBA,2025
6345419,597155,Wis. Lutheran Warriors,597122,Maranatha Baptist Sabercats,597155,3,top,N. Zaccanti reached first on an error by ss3a I. Rintelman advanced to third.,26,2025-04-04T00:00:00-04:00,"Washington Park (Watertown, WI)",32,MBA,2025
6345419,597155,Wis. Lutheran Warriors,597122,Maranatha Baptist Sabercats,597155,3,top,J. Lorbecki walked3a N. Zaccanti advanced to second.,27,2025-04-04T00:00:00-04:00,"Washington Park (Watertown, WI)",32,MBA,2025
6345419,597155,Wis. Lutheran Warriors,597122,Maranatha Baptist Sabercats,597155,3,top,"E. Shevey singled to center field, RBI3a J. Lorbecki advanced to second3a N. Zaccanti advanced to third3a I. Rintelman scored.",28,2025-04-04T00:00:00-04:00,"Washington Park (Watertown, WI)",32,MBA,2025
6345419,597155,Wis. Lutheran Warriors,597122,Maranatha Baptist Sabercats,597155,3,top,"C. Zorn reached first on an error by 1b, RBI3a E. Shevey advanced to second3a J. Lorbecki scored, unearned3a N. Zaccanti scored, unearned.",29,2025-04-04T00:00:00-04:00,"Washington Park (Watertown, WI)",32,MBA,2025
6345419,597155,Wis. Lutheran Warriors,597122,Maranatha Baptist Sabercats,597155,3,top,N. Dudek lined out to cf.,30,2025-04-04T00:00:00-04:00,"Washington Park (Watertown, WI)",32,MBA,2025
6345419,597155,Wis. Lutheran Warriors,597122,Maranatha Baptist Sabercats,597155,3,top,C. Zorn advanced to second on a passed ball3a E. Shevey advanced to third.,31,2025-04-04T00:00:00-04:00,"Washington Park (Watertown, WI)",32,MBA,2025
6345419,597155,Wis. Lutheran Warriors,597122,Maranatha Baptist Sabercats,597155,3,top,O. Lopeztell popped up to ss.,32,2025-04-04T00:00:00-04:00,"Washington Park (Watertown, WI)",32,MBA,2025
6345419,597155,Wis. Lutheran Warriors,597122,Maranatha Baptist Sabercats,597122,3,bot,J. Anderson struck out swinging.,33,2025-04-04T00:00:00-04:00,"Washington Park (Watertown, WI)",32,MBA,2025
6345419,597155,Wis. Lutheran Warriors,597122,Maranatha Baptist Sabercats,597122,3,bot,J. Jeske grounded out to 2b.,34,2025-04-04T00:00:00-04:00,"Washington Park (Watertown, WI)",32,MBA,2025
6345419,597155,Wis. Lutheran Warriors,597122,Maranatha Baptist Sabercats,597122,3,bot,T. Haugen struck out swinging.,35,2025-04-04T00:00:00-04:00,"Washington Park (Watertown, WI)",32,MBA,2025
6345419,597155,Wis. Lutheran Warriors,597122,Maranatha Baptist Sabercats,597155,4,top,S. Martin to p for J. Martin.,36,2025-04-04T00:00:00-04:00,"Washington Park (Watertown, WI)",32,MBA,2025
6345419,597155,Wis. Lutheran Warriors,597122,Maranatha Baptist Sabercats,597155,4,top,A. Montgomer grounded out to ss.,37,2025-04-04T00:00:00-04:00,"Washington Park (Watertown, WI)",32,MBA,2025
6345419,597155,Wis. Lutheran Warriors,597122,Maranatha Baptist Sabercats,597155,4,top,J. Martin to dh.,38,2025-04-04T00:00:00-04:00,"Washington Park (Watertown, WI)",32,MBA,2025
6345419,597155,Wis. Lutheran Warriors,597122,Maranatha Baptist Sabercats,597155,4,top,N. Hodgins flied out to lf.,39,2025-04-04T00:00:00-04:00,"Washington Park (Watertown, WI)",32,MBA,2025
6345419,597155,Wis. Lutheran Warriors,597122,Maranatha Baptist Sabercats,597155,4,top,"I. Rintelman singled up the middle, advanced to second on an error by cf.",40,2025-04-04T00:00:00-04:00,"Washington Park (Watertown, WI)",32,MBA,2025
6345419,597155,Wis. Lutheran Warriors,597122,Maranatha Baptist Sabercats,597155,4,top,N. Zaccanti singled to pitcher3a I. Rintelman advanced to third.,41,2025-04-04T00:00:00-04:00,"Washington Park (Watertown, WI)",32,MBA,2025
6345419,597155,Wis. Lutheran Warriors,597122,Maranatha Baptist Sabercats,597155,4,top,N. Zaccanti stole second.,42,2025-04-04T00:00:00-04:00,"Washington Park (Watertown, WI)",32,MBA,2025
6345419,597155,Wis. Lutheran Warriors,597122,Maranatha Baptist Sabercats,597155,4,top,J. Lorbecki walked.,43,2025-04-04T00:00:00-04:00,"Washington Park (Watertown, WI)",32,MBA,2025
6345419,597155,Wis. Lutheran Warriors,597122,Maranatha Baptist Sabercats,597155,4,top,"E. Shevey singled to left field, 2 RBI, advanced to second on the throw3a J. Lorbecki advanced to third3a N. Zaccanti scored3a I. Rintelman scored, unearned.",44,2025-04-04T00:00:00-04:00,"Washington Park (Watertown, WI)",32,MBA,2025
6345419,597155,Wis. Lutheran Warriors,597122,Maranatha Baptist Sabercats,597155,4,top,C. Zorn grounded out to ss.,45,2025-04-04T00:00:00-04:00,"Washington Park (Watertown, WI)",32,MBA,2025
6345419,597155,Wis. Lutheran Warriors,597122,Maranatha Baptist Sabercats,597122,4,bot,D. Wheeler grounded out to ss.,46,2025-04-04T00:00:00-04:00,"Washington Park (Watertown, WI)",32,MBA,2025
6345419,597155,Wis. Lutheran Warriors,597122,Maranatha Baptist Sabercats,597122,4,bot,E. Pease reached first on an error by 3b.,47,2025-04-04T00:00:00-04:00,"Washington Park (Watertown, WI)",32,MBA,2025
6345419,597155,Wis. Lutheran Warriors,597122,Maranatha Baptist Sabercats,597122,4,bot,T. Nickels grounded out to p3a E. Pease advanced to second.,48,2025-04-04T00:00:00-04:00,"Washington Park (Watertown, WI)",32,MBA,2025
6345419,597155,Wis. Lutheran Warriors,597122,Maranatha Baptist Sabercats,597122,4,bot,S. Martin to p for J. Martin.,49,2025-04-04T00:00:00-04:00,"Washington Park (Watertown, WI)",32,MBA,2025
6345419,597155,Wis. Lutheran Warriors,597122,Maranatha Baptist Sabercats,597122,4,bot,J. Martin to dh for S. Martin.,50,2025-04-04T00:00:00-04:00,"Washington Park (Watertown, WI)",32,MBA,2025
6345419,597155,Wis. Lutheran Warriors,597122,Maranatha Baptist Sabercats,597122,4,bot,J. Martin walked.,51,2025-04-04T00:00:00-04:00,"Washington Park (Watertown, WI)",32,MBA,2025
6345419,597155,Wis. Lutheran Warriors,597122,Maranatha Baptist Sabercats,597122,4,bot,C. Pittsenba lined out to p.,52,2025-04-04T00:00:00-04:00,"Washington Park (Watertown, WI)",32,MBA,2025
6345419,597155,Wis. Lutheran Warriors,597122,Maranatha Baptist Sabercats,597155,5,top,N. Dudek popped up to ss.,53,2025-04-04T00:00:00-04:00,"Washington Park (Watertown, WI)",32,MBA,2025
6345419,597155,Wis. Lutheran Warriors,597122,Maranatha Baptist Sabercats,597155,5,top,O. Lopeztell walked.,54,2025-04-04T00:00:00-04:00,"Washington Park (Watertown, WI)",32,MBA,2025
6345419,597155,Wis. Lutheran Warriors,597122,Maranatha Baptist Sabercats,597155,5,top,A. Montgomer singled to left field3a O. Lopeztell advanced to second.,55,2025-04-04T00:00:00-04:00,"Washington Park (Watertown, WI)",32,MBA,2025
6345419,597155,Wis. Lutheran Warriors,597122,Maranatha Baptist Sabercats,597155,5,top,N. Hodgins reached on a fielder's choice3a A. Montgomer out at second 1b to ss3a O. Lopeztell advanced to third.,56,2025-04-04T00:00:00-04:00,"Washington Park (Watertown, WI)",32,MBA,2025
6345419,597155,Wis. Lutheran Warriors,597122,Maranatha Baptist Sabercats,597155,5,top,I. Rintelman flied out to cf.,57,2025-04-04T00:00:00-04:00,"Washington Park (Watertown, WI)",32,MBA,2025
6345419,597155,Wis. Lutheran Warriors,597122,Maranatha Baptist Sabercats,597122,5,bot,A. Meier to p for C. Fredrick.,58,2025-04-04T00:00:00-04:00,"Washington Park (Watertown, WI)",32,MBA,2025
6345419,597155,Wis. Lutheran Warriors,597122,Maranatha Baptist Sabercats,597122,5,bot,C. Curcuro hit by pitch.,59,2025-04-04T00:00:00-04:00,"Washington Park (Watertown, WI)",32,MBA,2025
6345419,597155,Wis. Lutheran Warriors,597122,Maranatha Baptist Sabercats,597122,5,bot,"J. Anderson reached first on a throwing error by p, advanced to third3a C. Curcuro scored, unearned.",60,2025-04-04T00:00:00-04:00,"Washington Park (Watertown, WI)",32,MBA,2025
6345419,597155,Wis. Lutheran Warriors,597122,Maranatha Baptist Sabercats,597122,5,bot,"J. Jeske grounded out to 2b, RBI3a J. Anderson scored, unearned.",61,2025-04-04T00:00:00-04:00,"Washington Park (Watertown, WI)",32,MBA,2025
6345419,597155,Wis. Lutheran Warriors,597122,Maranatha Baptist Sabercats,597122,5,bot,T. Haugen struck out looking.,62,2025-04-04T00:00:00-04:00,"Washington Park (Watertown, WI)",32,MBA,2025
6345419,597155,Wis. Lutheran Warriors,597122,Maranatha Baptist Sabercats,597122,5,bot,D. Wheeler grounded out to 3b.,63,2025-04-04T00:00:00-04:00,"Washington Park (Watertown, WI)",32,MBA,2025
6345419,597155,Wis. Lutheran Warriors,597122,Maranatha Baptist Sabercats,597155,6,top,N. Zaccanti singled through the left side.,64,2025-04-04T00:00:00-04:00,"Washington Park (Watertown, WI)",32,MBA,2025
6345419,597155,Wis. Lutheran Warriors,597122,Maranatha Baptist Sabercats,597155,6,top,J. Lorbecki walked3a N. Zaccanti advanced to second.,65,2025-04-04T00:00:00-04:00,"Washington Park (Watertown, WI)",32,MBA,2025
6345419,597155,Wis. Lutheran Warriors,597122,Maranatha Baptist Sabercats,597155,6,top,"E. Shevey singled to left field, advanced to second on the throw, RBI3a J. Lorbecki advanced to third3a N. Zaccanti scored.",66,2025-04-04T00:00:00-04:00,"Washington Park (Watertown, WI)",32,MBA,2025
6345419,597155,Wis. Lutheran Warriors,597122,Maranatha Baptist Sabercats,597155,6,top,"C. Zorn grounded out to ss, RBI3a E. Shevey advanced to third3a J. Lorbecki scored.",67,2025-04-04T00:00:00-04:00,"Washington Park (Watertown, WI)",32,MBA,2025
6345419,597155,Wis. Lutheran Warriors,597122,Maranatha Baptist Sabercats,597155,6,top,A. Harrell to p for S. Martin.,68,2025-04-04T00:00:00-04:00,"Washington Park (Watertown, WI)",32,MBA,2025
6345419,597155,Wis. Lutheran Warriors,597122,Maranatha Baptist Sabercats,597155,6,top,"N. Dudek singled to shortstop, RBI3a E. Shevey scored.",69,2025-04-04T00:00:00-04:00,"Washington Park (Watertown, WI)",32,MBA,2025
6345419,597155,Wis. Lutheran Warriors,597122,Maranatha Baptist Sabercats,597155,6,top,O. Lopeztell walked3a N. Dudek advanced to second.,70,2025-04-04T00:00:00-04:00,"Washington Park (Watertown, WI)",32,MBA,2025
6345419,597155,Wis. Lutheran Warriors,597122,Maranatha Baptist Sabercats,597155,6,top,A. Montgomer flied out to lf.,71,2025-04-04T00:00:00-04:00,"Washington Park (Watertown, WI)",32,MBA,2025
6345419,597155,Wis. Lutheran Warriors,597122,Maranatha Baptist Sabercats,597155,6,top,N. Hodgins hit by pitch3a O. Lopeztell advanced to second3a N. Dudek advanced to third.,72,2025-04-04T00:00:00-04:00,"Washington Park (Watertown, WI)",32,MBA,2025
6345419,597155,Wis. Lutheran Warriors,597122,Maranatha Baptist Sabercats,597155,6,top,"I. Rintelman walked, RBI3a N. Hodgins advanced to second3a O. Lopeztell advanced to third3a N. Dudek scored.",73,2025-04-04T00:00:00-04:00,"Washington Park (Watertown, WI)",32,MBA,2025
6345419,597155,Wis. Lutheran Warriors,597122,Maranatha Baptist Sabercats,597155,6,top,"N. Zaccanti singled to shortstop, RBI3a I. Rintelman advanced to second3a N. Hodgins advanced to third3a O. Lopeztell scored.",74,2025-04-04T00:00:00-04:00,"Washington Park (Watertown, WI)",32,MBA,2025
6345419,597155,Wis. Lutheran Warriors,597122,Maranatha Baptist Sabercats,597155,6,top,"J. Lorbecki walked, RBI3a N. Zaccanti advanced to second3a I. Rintelman advanced to third3a N. Hodgins scored.",75,2025-04-04T00:00:00-04:00,"Washington Park (Watertown, WI)",32,MBA,2025
6345419,597155,Wis. Lutheran Warriors,597122,Maranatha Baptist Sabercats,597155,6,top,E. Shevey flied out to cf.,76,2025-04-04T00:00:00-04:00,"Washington Park (Watertown, WI)",32,MBA,2025
6345419,597155,Wis. Lutheran Warriors,597122,Maranatha Baptist Sabercats,597122,6,bot,E. Pease singled to center field.,77,2025-04-04T00:00:00-04:00,"Washington Park (Watertown, WI)",32,MBA,2025
6345419,597155,Wis. Lutheran Warriors,597122,Maranatha Baptist Sabercats,597122,6,bot,T. Nickels struck out swinging.,78,2025-04-04T00:00:00-04:00,"Washington Park (Watertown, WI)",32,MBA,2025
6345419,597155,Wis. Lutheran Warriors,597122,Maranatha Baptist Sabercats,597122,6,bot,"E. Pease out at second c to 2b, caught stealing.",79,2025-04-04T00:00:00-04:00,"Washington Park (Watertown, WI)",32,MBA,2025
6345419,597155,Wis. Lutheran Warriors,597122,Maranatha Baptist Sabercats,597122,6,bot,J. Martin struck out swinging.,80,2025-04-04T00:00:00-04:00,"Washington Park (Watertown, WI)",32,MBA,2025
6345419,597155,Wis. Lutheran Warriors,597122,Maranatha Baptist Sabercats,597155,7,top,S. Spencer to p for A. Harrell.,81,2025-04-04T00:00:00-04:00,"Washington Park (Watertown, WI)",32,MBA,2025
6345419,597155,Wis. Lutheran Warriors,597122,Maranatha Baptist Sabercats,597155,7,top,C. Zorn walked.,82,2025-04-04T00:00:00-04:00,"Washington Park (Watertown, WI)",32,MBA,2025
6345419,597155,Wis. Lutheran Warriors,597122,Maranatha Baptist Sabercats,597155,7,top,C. Zorn advanced to second on a wild pitch.,83,2025-04-04T00:00:00-04:00,"Washington Park (Watertown, WI)",32,MBA,2025
6345419,597155,Wis. Lutheran Warriors,597122,Maranatha Baptist Sabercats,597155,7,top,C. Zorn advanced to third on a throwing error by c.,84,2025-04-04T00:00:00-04:00,"Washington Park (Watertown, WI)",32,MBA,2025
6345419,597155,Wis. Lutheran Warriors,597122,Maranatha Baptist Sabercats,597155,7,top,N. Dudek popped up to 2b.,85,2025-04-04T00:00:00-04:00,"Washington Park (Watertown, WI)",32,MBA,2025
6345419,597155,Wis. Lutheran Warriors,597122,Maranatha Baptist Sabercats,597155,7,top,O. Lopeztell walked.,86,2025-04-04T00:00:00-04:00,"Washington Park (Watertown, WI)",32,MBA,2025
6345419,597155,Wis. Lutheran Warriors,597122,Maranatha Baptist Sabercats,597155,7,top,A. Montgomer hit by pitch3a O. Lopeztell advanced to second.,87,2025-04-04T00:00:00-04:00,"Washington Park (Watertown, WI)",32,MBA,2025
6345419,597155,Wis. Lutheran Warriors,597122,Maranatha Baptist Sabercats,597155,7,top,A. Montgomer advanced to second on a wild pitch3a O. Lopeztell advanced to third3a C. Zorn scored.,88,2025-04-04T00:00:00-04:00,"Washington Park (Watertown, WI)",32,MBA,2025
6345419,597155,Wis. Lutheran Warriors,597122,Maranatha Baptist Sabercats,597155,7,top,"N. Hodgins doubled to right center, 2 RBI3a A. Montgomer scored3a O. Lopeztell scored.",89,2025-04-04T00:00:00-04:00,"Washington Park (Watertown, WI)",32,MBA,2025
6345419,597155,Wis. Lutheran Warriors,597122,Maranatha Baptist Sabercats,597155,7,top,I. Rintelman singled to center field3a N. Hodgins advanced to third.,90,2025-04-04T00:00:00-04:00,"Washington Park (Watertown, WI)",32,MBA,2025
6345419,597155,Wis. Lutheran Warriors,597122,Maranatha Baptist Sabercats,597155,7,top,I. Bramlett pinch hit for N. Zaccanti.,91,2025-04-04T00:00:00-04:00,"Washington Park (Watertown, WI)",32,MBA,2025
6345419,597155,Wis. Lutheran Warriors,597122,Maranatha Baptist Sabercats,597155,7,top,I. Bramlett walked3a I. Rintelman advanced to second.,92,2025-04-04T00:00:00-04:00,"Washington Park (Watertown, WI)",32,MBA,2025
6345419,597155,Wis. Lutheran Warriors,597122,Maranatha Baptist Sabercats,597155,7,top,R. Martin to p for S. Spencer.,93,2025-04-04T00:00:00-04:00,"Washington Park (Watertown, WI)",32,MBA,2025
6345419,597155,Wis. Lutheran Warriors,597122,Maranatha Baptist Sabercats,597155,7,top,"J. Lorbecki walked, RBI3a I. Bramlett advanced to second3a I. Rintelman advanced to third3a N. Hodgins scored.",94,2025-04-04T00:00:00-04:00,"Washington Park (Watertown, WI)",32,MBA,2025
6345419,597155,Wis. Lutheran Warriors,597122,Maranatha Baptist Sabercats,597155,7,top,"E. Shevey hit by pitch, RBI3a J. Lorbecki advanced to second3a I. Bramlett advanced to third3a I. Rintelman scored.",95,2025-04-04T00:00:00-04:00,"Washington Park (Watertown, WI)",32,MBA,2025
6345419,597155,Wis. Lutheran Warriors,597122,Maranatha Baptist Sabercats,597155,7,top,C. Zorn popped up to 2b.,96,2025-04-04T00:00:00-04:00,"Washington Park (Watertown, WI)",32,MBA,2025
6345419,597155,Wis. Lutheran Warriors,597122,Maranatha Baptist Sabercats,597155,7,top,E. Shevey advanced to second on a wild pitch3a J. Lorbecki advanced to third3a I. Bramlett scored.,97,2025-04-04T00:00:00-04:00,"Washington Park (Watertown, WI)",32,MBA,2025
6345419,597155,Wis. Lutheran Warriors,597122,Maranatha Baptist Sabercats,597155,7,top,N. Dudek grounded out to 3b.,98,2025-04-04T00:00:00-04:00,"Washington Park (Watertown, WI)",32,MBA,2025
6345419,597155,Wis. Lutheran Warriors,597122,Maranatha Baptist Sabercats,597122,7,bot,I. Bramlett to c.,99,2025-04-04T00:00:00-04:00,"Washington Park (Watertown, WI)",32,MBA,2025
6345419,597155,Wis. Lutheran Warriors,597122,Maranatha Baptist Sabercats,597122,7,bot,L. Paea to p for A. Meier.,100,2025-04-04T00:00:00-04:00,"Washington Park (Watertown, WI)",32,MBA,2025
6345419,597155,Wis. Lutheran Warriors,597122,Maranatha Baptist Sabercats,597122,7,bot,S. Hangen pinch hit for C. Pittsenba.,101,2025-04-04T00:00:00-04:00,"Washington Park (Watertown, WI)",32,MBA,2025
6345419,597155,Wis. Lutheran Warriors,597122,Maranatha Baptist Sabercats,597122,7,bot,S. Hangen struck out swinging.,102,2025-04-04T00:00:00-04:00,"Washington Park (Watertown, WI)",32,MBA,2025
6345419,597155,Wis. Lutheran Warriors,597122,Maranatha Baptist Sabercats,597122,7,bot,E. Bachorik pinch hit for C. Curcuro.,103,2025-04-04T00:00:00-04:00,"Washington Park (Watertown, WI)",32,MBA,2025
6345419,597155,Wis. Lutheran Warriors,597122,Maranatha Baptist Sabercats,597122,7,bot,E. Bachorik struck out swinging.,104,2025-04-04T00:00:00-04:00,"Washington Park (Watertown, WI)",32,MBA,2025
6345419,597155,Wis. Lutheran Warriors,597122,Maranatha Baptist Sabercats,597122,7,bot,B. Werner pinch hit for J. Anderson.,105,2025-04-04T00:00:00-04:00,"Washington Park (Watertown, WI)",32,MBA,2025
6345419,597155,Wis. Lutheran Warriors,597122,Maranatha Baptist Sabercats,597122,7,bot,"B. Werner struck out swinging, out at first c to 1b.",106,2025-04-04T00:00:00-04:00,"Washington Park (Watertown, WI)",32,MBA,2025
