game_id,away_team_id,away_team_name,home_team_id,home_team_name,batting_team,inning,top_bot,event_text,event_num,game_datetime,stadium_name,attendance,sport_id,season
6346447,597326,Marymount (VA) Saints,597126,Neumann Knights,597326,1,top,Q. Via struck out swinging.,1,2025-04-15T00:00:00-04:00,"Captial One Park (Arlington, VA)",89,MBA,2025
6346447,597326,Marymount (VA) Saints,597126,Neumann Knights,597326,1,top,B. Leitzel grounded out to 3b.,2,2025-04-15T00:00:00-04:00,"Captial One Park (Arlington, VA)",89,MBA,2025
6346447,597326,Marymount (VA) Saints,597126,Neumann Knights,597326,1,top,A. Schaeb singled down the rf line.,3,2025-04-15T00:00:00-04:00,"Captial One Park (Arlington, VA)",89,MBA,2025
6346447,597326,Marymount (VA) Saints,597126,Neumann Knights,597326,1,top,J. McCarthy singled to third base3a A. Schaeb advanced to second.,4,2025-04-15T00:00:00-04:00,"Captial One Park (Arlington, VA)",89,MBA,2025
6346447,597326,Marymount (VA) Saints,597126,Neumann Knights,597326,1,top,R. Cuadros flied out to rf.,5,2025-04-15T00:00:00-04:00,"Captial One Park (Arlington, VA)",89,MBA,2025
6346447,597326,Marymount (VA) Saints,597126,Neumann Knights,597126,1,bot,A. Rakotz singled to left center.,6,2025-04-15T00:00:00-04:00,"Captial One Park (Arlington, VA)",89,MBA,2025
6346447,597326,Marymount (VA) Saints,597126,Neumann Knights,597126,1,bot,B. Colon singled to center field3a A. Rakotz advanced to second.,7,2025-04-15T00:00:00-04:00,"Captial One Park (Arlington, VA)",89,MBA,2025
6346447,597326,Marymount (VA) Saints,597126,Neumann Knights,597126,1,bot,"T. Carroll reached first on a throwing error by c, SAC, bunt3a B. Colon advanced to third3a A. Rakotz scored.",8,2025-04-15T00:00:00-04:00,"Captial One Park (Arlington, VA)",89,MBA,2025
6346447,597326,Marymount (VA) Saints,597126,Neumann Knights,597126,1,bot,T. Carroll stole second.,9,2025-04-15T00:00:00-04:00,"Captial One Park (Arlington, VA)",89,MBA,2025
6346447,597326,Marymount (VA) Saints,597126,Neumann Knights,597126,1,bot,T. Carroll advanced to third on a balk3a B. Colon scored.,10,2025-04-15T00:00:00-04:00,"Captial One Park (Arlington, VA)",89,MBA,2025
6346447,597326,Marymount (VA) Saints,597126,Neumann Knights,597126,1,bot,"J. Boccio singled up the middle, RBI3a T. Carroll scored, unearned.",11,2025-04-15T00:00:00-04:00,"Captial One Park (Arlington, VA)",89,MBA,2025
6346447,597326,Marymount (VA) Saints,597126,Neumann Knights,597126,1,bot,A. Brown struck out swinging.,12,2025-04-15T00:00:00-04:00,"Captial One Park (Arlington, VA)",89,MBA,2025
6346447,597326,Marymount (VA) Saints,597126,Neumann Knights,597126,1,bot,J. Boccio advanced to second on a wild pitch.,13,2025-04-15T00:00:00-04:00,"Captial One Park (Arlington, VA)",89,MBA,2025
6346447,597326,Marymount (VA) Saints,597126,Neumann Knights,597126,1,bot,T. Kilmer flied out to rf.,14,2025-04-15T00:00:00-04:00,"Captial One Park (Arlington, VA)",89,MBA,2025
6346447,597326,Marymount (VA) Saints,597126,Neumann Knights,597126,1,bot,J. Shuler grounded out to 3b.,15,2025-04-15T00:00:00-04:00,"Captial One Park (Arlington, VA)",89,MBA,2025
6346447,597326,Marymount (VA) Saints,597126,Neumann Knights,597326,2,top,J. McMath grounded out to 1b unassisted.,16,2025-04-15T00:00:00-04:00,"Captial One Park (Arlington, VA)",89,MBA,2025
6346447,597326,Marymount (VA) Saints,597126,Neumann Knights,597326,2,top,"K. Knoess struck out swinging, out at first c to 1b.",17,2025-04-15T00:00:00-04:00,"Captial One Park (Arlington, VA)",89,MBA,2025
6346447,597326,Marymount (VA) Saints,597126,Neumann Knights,597326,2,top,D. Fernandez singled to second base.,18,2025-04-15T00:00:00-04:00,"Captial One Park (Arlington, VA)",89,MBA,2025
6346447,597326,Marymount (VA) Saints,597126,Neumann Knights,597326,2,top,J. Dickson singled to center field3a D. Fernandez advanced to third.,19,2025-04-15T00:00:00-04:00,"Captial One Park (Arlington, VA)",89,MBA,2025
6346447,597326,Marymount (VA) Saints,597126,Neumann Knights,597326,2,top,Q. Via walked3a J. Dickson advanced to second.,20,2025-04-15T00:00:00-04:00,"Captial One Park (Arlington, VA)",89,MBA,2025
6346447,597326,Marymount (VA) Saints,597126,Neumann Knights,597326,2,top,"B. Leitzel singled to right field, 2 RBI3a Q. Via advanced to second, advanced to third on a fielding error by rf3a J. Dickson scored3a D. Fernandez scored.",21,2025-04-15T00:00:00-04:00,"Captial One Park (Arlington, VA)",89,MBA,2025
6346447,597326,Marymount (VA) Saints,597126,Neumann Knights,597326,2,top,A. Schaeb popped up to 1b.,22,2025-04-15T00:00:00-04:00,"Captial One Park (Arlington, VA)",89,MBA,2025
6346447,597326,Marymount (VA) Saints,597126,Neumann Knights,597126,2,bot,J. Finger grounded out to 2b.,23,2025-04-15T00:00:00-04:00,"Captial One Park (Arlington, VA)",89,MBA,2025
6346447,597326,Marymount (VA) Saints,597126,Neumann Knights,597126,2,bot,D. Brooks grounded out to 2b.,24,2025-04-15T00:00:00-04:00,"Captial One Park (Arlington, VA)",89,MBA,2025
6346447,597326,Marymount (VA) Saints,597126,Neumann Knights,597126,2,bot,A. Rakotz singled to shortstop.,25,2025-04-15T00:00:00-04:00,"Captial One Park (Arlington, VA)",89,MBA,2025
6346447,597326,Marymount (VA) Saints,597126,Neumann Knights,597126,2,bot,B. Colon lined out to rf.,26,2025-04-15T00:00:00-04:00,"Captial One Park (Arlington, VA)",89,MBA,2025
6346447,597326,Marymount (VA) Saints,597126,Neumann Knights,597326,3,top,"J. McCarthy homered to left field, RBI.",27,2025-04-15T00:00:00-04:00,"Captial One Park (Arlington, VA)",89,MBA,2025
6346447,597326,Marymount (VA) Saints,597126,Neumann Knights,597326,3,top,R. Cuadros singled to right field.,28,2025-04-15T00:00:00-04:00,"Captial One Park (Arlington, VA)",89,MBA,2025
6346447,597326,Marymount (VA) Saints,597126,Neumann Knights,597326,3,top,J. McMath walked3a R. Cuadros advanced to second.,29,2025-04-15T00:00:00-04:00,"Captial One Park (Arlington, VA)",89,MBA,2025
6346447,597326,Marymount (VA) Saints,597126,Neumann Knights,597326,3,top,K. Knoess lined out to rf3a R. Cuadros advanced to third.,30,2025-04-15T00:00:00-04:00,"Captial One Park (Arlington, VA)",89,MBA,2025
6346447,597326,Marymount (VA) Saints,597126,Neumann Knights,597326,3,top,"D. Fernandez grounded out to p, SAC, bunt, RBI3a J. McMath advanced to second3a R. Cuadros scored.",31,2025-04-15T00:00:00-04:00,"Captial One Park (Arlington, VA)",89,MBA,2025
6346447,597326,Marymount (VA) Saints,597126,Neumann Knights,597326,3,top,J. Dickson lined out to lf.,32,2025-04-15T00:00:00-04:00,"Captial One Park (Arlington, VA)",89,MBA,2025
6346447,597326,Marymount (VA) Saints,597126,Neumann Knights,597126,3,bot,T. Carroll grounded out to 2b.,33,2025-04-15T00:00:00-04:00,"Captial One Park (Arlington, VA)",89,MBA,2025
6346447,597326,Marymount (VA) Saints,597126,Neumann Knights,597126,3,bot,"J. Boccio homered to left field, RBI.",34,2025-04-15T00:00:00-04:00,"Captial One Park (Arlington, VA)",89,MBA,2025
6346447,597326,Marymount (VA) Saints,597126,Neumann Knights,597126,3,bot,A. Brown lined out to cf.,35,2025-04-15T00:00:00-04:00,"Captial One Park (Arlington, VA)",89,MBA,2025
6346447,597326,Marymount (VA) Saints,597126,Neumann Knights,597126,3,bot,T. Kilmer walked.,36,2025-04-15T00:00:00-04:00,"Captial One Park (Arlington, VA)",89,MBA,2025
6346447,597326,Marymount (VA) Saints,597126,Neumann Knights,597126,3,bot,J. Shuler struck out swinging.,37,2025-04-15T00:00:00-04:00,"Captial One Park (Arlington, VA)",89,MBA,2025
6346447,597326,Marymount (VA) Saints,597126,Neumann Knights,597326,4,top,"Q. Via homered to left field, RBI.",38,2025-04-15T00:00:00-04:00,"Captial One Park (Arlington, VA)",89,MBA,2025
6346447,597326,Marymount (VA) Saints,597126,Neumann Knights,597326,4,top,B. Leitzel walked.,39,2025-04-15T00:00:00-04:00,"Captial One Park (Arlington, VA)",89,MBA,2025
6346447,597326,Marymount (VA) Saints,597126,Neumann Knights,597326,4,top,A. Schaeb flied out to rf.,40,2025-04-15T00:00:00-04:00,"Captial One Park (Arlington, VA)",89,MBA,2025
6346447,597326,Marymount (VA) Saints,597126,Neumann Knights,597326,4,top,J. McCarthy popped up to 3b.,41,2025-04-15T00:00:00-04:00,"Captial One Park (Arlington, VA)",89,MBA,2025
6346447,597326,Marymount (VA) Saints,597126,Neumann Knights,597326,4,top,"R. Cuadros singled to left center, RBI3a B. Leitzel scored.",42,2025-04-15T00:00:00-04:00,"Captial One Park (Arlington, VA)",89,MBA,2025
6346447,597326,Marymount (VA) Saints,597126,Neumann Knights,597326,4,top,J. McMath grounded out to 1b unassisted.,43,2025-04-15T00:00:00-04:00,"Captial One Park (Arlington, VA)",89,MBA,2025
6346447,597326,Marymount (VA) Saints,597126,Neumann Knights,597126,4,bot,J. Finger lined out to rf.,44,2025-04-15T00:00:00-04:00,"Captial One Park (Arlington, VA)",89,MBA,2025
6346447,597326,Marymount (VA) Saints,597126,Neumann Knights,597126,4,bot,D. Brooks grounded out to 1b unassisted.,45,2025-04-15T00:00:00-04:00,"Captial One Park (Arlington, VA)",89,MBA,2025
6346447,597326,Marymount (VA) Saints,597126,Neumann Knights,597126,4,bot,A. Rakotz lined out to 2b.,46,2025-04-15T00:00:00-04:00,"Captial One Park (Arlington, VA)",89,MBA,2025
6346447,597326,Marymount (VA) Saints,597126,Neumann Knights,597326,5,top,K. Knoess lined out to rf.,47,2025-04-15T00:00:00-04:00,"Captial One Park (Arlington, VA)",89,MBA,2025
6346447,597326,Marymount (VA) Saints,597126,Neumann Knights,597326,5,top,D. Fernandez flied out to rf.,48,2025-04-15T00:00:00-04:00,"Captial One Park (Arlington, VA)",89,MBA,2025
6346447,597326,Marymount (VA) Saints,597126,Neumann Knights,597326,5,top,J. Dickson flied out to cf.,49,2025-04-15T00:00:00-04:00,"Captial One Park (Arlington, VA)",89,MBA,2025
6346447,597326,Marymount (VA) Saints,597126,Neumann Knights,597126,5,bot,B. Colon grounded out to ss.,50,2025-04-15T00:00:00-04:00,"Captial One Park (Arlington, VA)",89,MBA,2025
6346447,597326,Marymount (VA) Saints,597126,Neumann Knights,597126,5,bot,T. Carroll doubled to right field.,51,2025-04-15T00:00:00-04:00,"Captial One Park (Arlington, VA)",89,MBA,2025
6346447,597326,Marymount (VA) Saints,597126,Neumann Knights,597126,5,bot,J. Boccio flied out to rf3a T. Carroll advanced to third.,52,2025-04-15T00:00:00-04:00,"Captial One Park (Arlington, VA)",89,MBA,2025
6346447,597326,Marymount (VA) Saints,597126,Neumann Knights,597126,5,bot,"A. Brown singled through the right side, RBI3a T. Carroll scored.",53,2025-04-15T00:00:00-04:00,"Captial One Park (Arlington, VA)",89,MBA,2025
6346447,597326,Marymount (VA) Saints,597126,Neumann Knights,597126,5,bot,T. Kilmer lined out to rf.,54,2025-04-15T00:00:00-04:00,"Captial One Park (Arlington, VA)",89,MBA,2025
6346447,597326,Marymount (VA) Saints,597126,Neumann Knights,597326,6,top,C. Balshuwei to p for J. Valentine.,55,2025-04-15T00:00:00-04:00,"Captial One Park (Arlington, VA)",89,MBA,2025
6346447,597326,Marymount (VA) Saints,597126,Neumann Knights,597326,6,top,Q. Via popped up to 3b.,56,2025-04-15T00:00:00-04:00,"Captial One Park (Arlington, VA)",89,MBA,2025
6346447,597326,Marymount (VA) Saints,597126,Neumann Knights,597326,6,top,B. Leitzel singled to center field.,57,2025-04-15T00:00:00-04:00,"Captial One Park (Arlington, VA)",89,MBA,2025
6346447,597326,Marymount (VA) Saints,597126,Neumann Knights,597326,6,top,B. Leitzel stole second.,58,2025-04-15T00:00:00-04:00,"Captial One Park (Arlington, VA)",89,MBA,2025
6346447,597326,Marymount (VA) Saints,597126,Neumann Knights,597326,6,top,A. Schaeb singled to left field3a B. Leitzel advanced to third.,59,2025-04-15T00:00:00-04:00,"Captial One Park (Arlington, VA)",89,MBA,2025
6346447,597326,Marymount (VA) Saints,597126,Neumann Knights,597326,6,top,"J. McCarthy flied out to rf, sacrifice fly, RBI3a A. Schaeb advanced to second3a B. Leitzel scored.",60,2025-04-15T00:00:00-04:00,"Captial One Park (Arlington, VA)",89,MBA,2025
6346447,597326,Marymount (VA) Saints,597126,Neumann Knights,597326,6,top,R. Cuadros grounded out to ss.,61,2025-04-15T00:00:00-04:00,"Captial One Park (Arlington, VA)",89,MBA,2025
6346447,597326,Marymount (VA) Saints,597126,Neumann Knights,597126,6,bot,M. Arce to p for J. Murray.,62,2025-04-15T00:00:00-04:00,"Captial One Park (Arlington, VA)",89,MBA,2025
6346447,597326,Marymount (VA) Saints,597126,Neumann Knights,597126,6,bot,J. Shuler singled through the right side.,63,2025-04-15T00:00:00-04:00,"Captial One Park (Arlington, VA)",89,MBA,2025
6346447,597326,Marymount (VA) Saints,597126,Neumann Knights,597126,6,bot,"J. Finger grounded into double play ss to 2b3a J. Shuler out on the play, interference.",64,2025-04-15T00:00:00-04:00,"Captial One Park (Arlington, VA)",89,MBA,2025
6346447,597326,Marymount (VA) Saints,597126,Neumann Knights,597126,6,bot,D. Brooks walked.,65,2025-04-15T00:00:00-04:00,"Captial One Park (Arlington, VA)",89,MBA,2025
6346447,597326,Marymount (VA) Saints,597126,Neumann Knights,597126,6,bot,D. Brooks stole second.,66,2025-04-15T00:00:00-04:00,"Captial One Park (Arlington, VA)",89,MBA,2025
6346447,597326,Marymount (VA) Saints,597126,Neumann Knights,597126,6,bot,A. Rakotz struck out swinging.,67,2025-04-15T00:00:00-04:00,"Captial One Park (Arlington, VA)",89,MBA,2025
6346447,597326,Marymount (VA) Saints,597126,Neumann Knights,597326,7,top,J. McMath popped up to ss.,68,2025-04-15T00:00:00-04:00,"Captial One Park (Arlington, VA)",89,MBA,2025
6346447,597326,Marymount (VA) Saints,597126,Neumann Knights,597326,7,top,K. Knoess struck out swinging.,69,2025-04-15T00:00:00-04:00,"Captial One Park (Arlington, VA)",89,MBA,2025
6346447,597326,Marymount (VA) Saints,597126,Neumann Knights,597326,7,top,D. Fernandez singled to center field.,70,2025-04-15T00:00:00-04:00,"Captial One Park (Arlington, VA)",89,MBA,2025
6346447,597326,Marymount (VA) Saints,597126,Neumann Knights,597326,7,top,J. Dickson singled through the right side3a D. Fernandez advanced to second.,71,2025-04-15T00:00:00-04:00,"Captial One Park (Arlington, VA)",89,MBA,2025
6346447,597326,Marymount (VA) Saints,597126,Neumann Knights,597326,7,top,Q. Via flied out to cf.,72,2025-04-15T00:00:00-04:00,"Captial One Park (Arlington, VA)",89,MBA,2025
6346447,597326,Marymount (VA) Saints,597126,Neumann Knights,597126,7,bot,B. Colon singled up the middle.,73,2025-04-15T00:00:00-04:00,"Captial One Park (Arlington, VA)",89,MBA,2025
6346447,597326,Marymount (VA) Saints,597126,Neumann Knights,597126,7,bot,T. Carroll flied out to lf.,74,2025-04-15T00:00:00-04:00,"Captial One Park (Arlington, VA)",89,MBA,2025
6346447,597326,Marymount (VA) Saints,597126,Neumann Knights,597126,7,bot,J. Boccio grounded into double play 1b to ss to 1b3a B. Colon out on the play.,75,2025-04-15T00:00:00-04:00,"Captial One Park (Arlington, VA)",89,MBA,2025
6346447,597326,Marymount (VA) Saints,597126,Neumann Knights,597326,8,top,B. Leitzel flied out to cf.,76,2025-04-15T00:00:00-04:00,"Captial One Park (Arlington, VA)",89,MBA,2025
6346447,597326,Marymount (VA) Saints,597126,Neumann Knights,597326,8,top,A. Schaeb flied out to lf.,77,2025-04-15T00:00:00-04:00,"Captial One Park (Arlington, VA)",89,MBA,2025
6346447,597326,Marymount (VA) Saints,597126,Neumann Knights,597326,8,top,J. McCarthy popped up to 1b.,78,2025-04-15T00:00:00-04:00,"Captial One Park (Arlington, VA)",89,MBA,2025
6346447,597326,Marymount (VA) Saints,597126,Neumann Knights,597126,8,bot,A. Brown grounded out to ss.,79,2025-04-15T00:00:00-04:00,"Captial One Park (Arlington, VA)",89,MBA,2025
6346447,597326,Marymount (VA) Saints,597126,Neumann Knights,597126,8,bot,T. Kilmer walked.,80,2025-04-15T00:00:00-04:00,"Captial One Park (Arlington, VA)",89,MBA,2025
6346447,597326,Marymount (VA) Saints,597126,Neumann Knights,597126,8,bot,A. Nardo pinch hit for J. Shuler.,81,2025-04-15T00:00:00-04:00,"Captial One Park (Arlington, VA)",89,MBA,2025
6346447,597326,Marymount (VA) Saints,597126,Neumann Knights,597126,8,bot,"T. Kilmer advanced to second on a throwing error by p, failed pickoff attempt.",82,2025-04-15T00:00:00-04:00,"Captial One Park (Arlington, VA)",89,MBA,2025
6346447,597326,Marymount (VA) Saints,597126,Neumann Knights,597126,8,bot,"A. Nardo singled to right center, RBI3a T. Kilmer scored.",83,2025-04-15T00:00:00-04:00,"Captial One Park (Arlington, VA)",89,MBA,2025
6346447,597326,Marymount (VA) Saints,597126,Neumann Knights,597126,8,bot,"J. Finger singled, advanced to second3a A. Nardo advanced to second, advanced to third on a fielding error by ss.",84,2025-04-15T00:00:00-04:00,"Captial One Park (Arlington, VA)",89,MBA,2025
6346447,597326,Marymount (VA) Saints,597126,Neumann Knights,597126,8,bot,D. Brooks walked.,85,2025-04-15T00:00:00-04:00,"Captial One Park (Arlington, VA)",89,MBA,2025
6346447,597326,Marymount (VA) Saints,597126,Neumann Knights,597126,8,bot,"A. Rakotz singled through the left side, 2 RBI3a D. Brooks advanced to second3a J. Finger scored3a A. Nardo scored.",86,2025-04-15T00:00:00-04:00,"Captial One Park (Arlington, VA)",89,MBA,2025
6346447,597326,Marymount (VA) Saints,597126,Neumann Knights,597126,8,bot,B. Colon flied out to rf3a D. Brooks advanced to third.,87,2025-04-15T00:00:00-04:00,"Captial One Park (Arlington, VA)",89,MBA,2025
6346447,597326,Marymount (VA) Saints,597126,Neumann Knights,597126,8,bot,A. Rakotz stole second.,88,2025-04-15T00:00:00-04:00,"Captial One Park (Arlington, VA)",89,MBA,2025
6346447,597326,Marymount (VA) Saints,597126,Neumann Knights,597126,8,bot,"T. Carroll tripled down the rf line, 2 RBI3a A. Rakotz scored3a D. Brooks scored.",89,2025-04-15T00:00:00-04:00,"Captial One Park (Arlington, VA)",89,MBA,2025
6346447,597326,Marymount (VA) Saints,597126,Neumann Knights,597126,8,bot,J. Stiff to p for M. Arce.,90,2025-04-15T00:00:00-04:00,"Captial One Park (Arlington, VA)",89,MBA,2025
6346447,597326,Marymount (VA) Saints,597126,Neumann Knights,597126,8,bot,J. Boccio lined out to cf.,91,2025-04-15T00:00:00-04:00,"Captial One Park (Arlington, VA)",89,MBA,2025
6346447,597326,Marymount (VA) Saints,597126,Neumann Knights,597326,9,top,A. Nardo to lf.,92,2025-04-15T00:00:00-04:00,"Captial One Park (Arlington, VA)",89,MBA,2025
6346447,597326,Marymount (VA) Saints,597126,Neumann Knights,597326,9,top,R. Cuadros grounded out to ss.,93,2025-04-15T00:00:00-04:00,"Captial One Park (Arlington, VA)",89,MBA,2025
6346447,597326,Marymount (VA) Saints,597126,Neumann Knights,597326,9,top,"J. McMath homered to center field, RBI.",94,2025-04-15T00:00:00-04:00,"Captial One Park (Arlington, VA)",89,MBA,2025
6346447,597326,Marymount (VA) Saints,597126,Neumann Knights,597326,9,top,K. Knoess singled through the left side.,95,2025-04-15T00:00:00-04:00,"Captial One Park (Arlington, VA)",89,MBA,2025
6346447,597326,Marymount (VA) Saints,597126,Neumann Knights,597326,9,top,A. Farmakide pinch hit for D. Fernandez.,96,2025-04-15T00:00:00-04:00,"Captial One Park (Arlington, VA)",89,MBA,2025
6346447,597326,Marymount (VA) Saints,597126,Neumann Knights,597326,9,top,A. Farmakide doubled to left field3a K. Knoess advanced to third.,97,2025-04-15T00:00:00-04:00,"Captial One Park (Arlington, VA)",89,MBA,2025
6346447,597326,Marymount (VA) Saints,597126,Neumann Knights,597326,9,top,J. Carbonell pinch ran for A. Farmakide.,98,2025-04-15T00:00:00-04:00,"Captial One Park (Arlington, VA)",89,MBA,2025
6346447,597326,Marymount (VA) Saints,597126,Neumann Knights,597326,9,top,J. Dickson struck out swinging.,99,2025-04-15T00:00:00-04:00,"Captial One Park (Arlington, VA)",89,MBA,2025
6346447,597326,Marymount (VA) Saints,597126,Neumann Knights,597326,9,top,Q. Via lined out to lf.,100,2025-04-15T00:00:00-04:00,"Captial One Park (Arlington, VA)",89,MBA,2025
