game_id,away_team_id,away_team_name,home_team_id,home_team_name,batting_team,inning,top_bot,event_text,event_num,game_datetime,stadium_name,attendance,sport_id,season
6346115,597253,Clark (MA) Cougars,597032,Salve Regina Seahawks,597253,1,top,C. Doran grounded out to 2b.,1,2025-04-08T00:00:00-04:00,"Brother Reynolds Field (Newport, RI)",211,MBA,2025
6346115,597253,Clark (MA) Cougars,597032,Salve Regina Seahawks,597253,1,top,B. Sullivan grounded out to 2b.,2,2025-04-08T00:00:00-04:00,"Brother Reynolds Field (Newport, RI)",211,MBA,2025
6346115,597253,Clark (MA) Cougars,597032,Salve Regina Seahawks,597253,1,top,M. Soares struck out swinging.,3,2025-04-08T00:00:00-04:00,"Brother Reynolds Field (Newport, RI)",211,MBA,2025
6346115,597253,Clark (MA) Cougars,597032,Salve Regina Seahawks,597032,1,bot,B. Grover flied out to cf.,4,2025-04-08T00:00:00-04:00,"Brother Reynolds Field (Newport, RI)",211,MBA,2025
6346115,597253,Clark (MA) Cougars,597032,Salve Regina Seahawks,597032,1,bot,M. Neal grounded out to 2b.,5,2025-04-08T00:00:00-04:00,"Brother Reynolds Field (Newport, RI)",211,MBA,2025
6346115,597253,Clark (MA) Cougars,597032,Salve Regina Seahawks,597032,1,bot,S. Williams hit by pitch.,6,2025-04-08T00:00:00-04:00,"Brother Reynolds Field (Newport, RI)",211,MBA,2025
6346115,597253,Clark (MA) Cougars,597032,Salve Regina Seahawks,597032,1,bot,"E. O'Rourke struck out swinging, out at first c to 1b.",7,2025-04-08T00:00:00-04:00,"Brother Reynolds Field (Newport, RI)",211,MBA,2025
6346115,597253,Clark (MA) Cougars,597032,Salve Regina Seahawks,597253,2,top,D. Mariani struck out swinging.,8,2025-04-08T00:00:00-04:00,"Brother Reynolds Field (Newport, RI)",211,MBA,2025
6346115,597253,Clark (MA) Cougars,597032,Salve Regina Seahawks,597253,2,top,R. Caulfield flied out to lf.,9,2025-04-08T00:00:00-04:00,"Brother Reynolds Field (Newport, RI)",211,MBA,2025
6346115,597253,Clark (MA) Cougars,597032,Salve Regina Seahawks,597253,2,top,B. Hollinrak struck out swinging.,10,2025-04-08T00:00:00-04:00,"Brother Reynolds Field (Newport, RI)",211,MBA,2025
6346115,597253,Clark (MA) Cougars,597032,Salve Regina Seahawks,597032,2,bot,H. Yaworski fouled out to 3b.,11,2025-04-08T00:00:00-04:00,"Brother Reynolds Field (Newport, RI)",211,MBA,2025
6346115,597253,Clark (MA) Cougars,597032,Salve Regina Seahawks,597032,2,bot,C. Homa flied out to lf.,12,2025-04-08T00:00:00-04:00,"Brother Reynolds Field (Newport, RI)",211,MBA,2025
6346115,597253,Clark (MA) Cougars,597032,Salve Regina Seahawks,597032,2,bot,S. Donovan grounded out to 2b.,13,2025-04-08T00:00:00-04:00,"Brother Reynolds Field (Newport, RI)",211,MBA,2025
6346115,597253,Clark (MA) Cougars,597032,Salve Regina Seahawks,597253,3,top,A. Locasto struck out swinging.,14,2025-04-08T00:00:00-04:00,"Brother Reynolds Field (Newport, RI)",211,MBA,2025
6346115,597253,Clark (MA) Cougars,597032,Salve Regina Seahawks,597253,3,top,A. Jalil reached first on an error by 3b.,15,2025-04-08T00:00:00-04:00,"Brother Reynolds Field (Newport, RI)",211,MBA,2025
6346115,597253,Clark (MA) Cougars,597032,Salve Regina Seahawks,597253,3,top,M. Salzillo struck out swinging.,16,2025-04-08T00:00:00-04:00,"Brother Reynolds Field (Newport, RI)",211,MBA,2025
6346115,597253,Clark (MA) Cougars,597032,Salve Regina Seahawks,597253,3,top,C. Doran singled to center field; A. Jalil advanced to second.,17,2025-04-08T00:00:00-04:00,"Brother Reynolds Field (Newport, RI)",211,MBA,2025
6346115,597253,Clark (MA) Cougars,597032,Salve Regina Seahawks,597253,3,top,B. Sullivan singled to center field; C. Doran advanced to second; A. Jalil advanced to third.,18,2025-04-08T00:00:00-04:00,"Brother Reynolds Field (Newport, RI)",211,MBA,2025
6346115,597253,Clark (MA) Cougars,597032,Salve Regina Seahawks,597253,3,top,"M. Soares reached first on an error by 1b; B. Sullivan advanced to third; C. Doran scored, unearned; A. Jalil scored, unearned.",19,2025-04-08T00:00:00-04:00,"Brother Reynolds Field (Newport, RI)",211,MBA,2025
6346115,597253,Clark (MA) Cougars,597032,Salve Regina Seahawks,597253,3,top,"D. Mariani doubled to right center, 2 RBI; M. Soares scored, unearned; B. Sullivan scored, unearned.",20,2025-04-08T00:00:00-04:00,"Brother Reynolds Field (Newport, RI)",211,MBA,2025
6346115,597253,Clark (MA) Cougars,597032,Salve Regina Seahawks,597253,3,top,R. Caulfield popped up to 2b.,21,2025-04-08T00:00:00-04:00,"Brother Reynolds Field (Newport, RI)",211,MBA,2025
6346115,597253,Clark (MA) Cougars,597032,Salve Regina Seahawks,597032,3,bot,T. Petrosino flied out to lf.,22,2025-04-08T00:00:00-04:00,"Brother Reynolds Field (Newport, RI)",211,MBA,2025
6346115,597253,Clark (MA) Cougars,597032,Salve Regina Seahawks,597032,3,bot,N. Ruehs walked.,23,2025-04-08T00:00:00-04:00,"Brother Reynolds Field (Newport, RI)",211,MBA,2025
6346115,597253,Clark (MA) Cougars,597032,Salve Regina Seahawks,597032,3,bot,B. Grover walked; N. Ruehs advanced to second.,24,2025-04-08T00:00:00-04:00,"Brother Reynolds Field (Newport, RI)",211,MBA,2025
6346115,597253,Clark (MA) Cougars,597032,Salve Regina Seahawks,597032,3,bot,"M. Neal doubled to right center, 2 RBI; B. Grover scored; N. Ruehs scored.",25,2025-04-08T00:00:00-04:00,"Brother Reynolds Field (Newport, RI)",211,MBA,2025
6346115,597253,Clark (MA) Cougars,597032,Salve Regina Seahawks,597032,3,bot,S. Williams grounded out to 2b; M. Neal advanced to third.,26,2025-04-08T00:00:00-04:00,"Brother Reynolds Field (Newport, RI)",211,MBA,2025
6346115,597253,Clark (MA) Cougars,597032,Salve Regina Seahawks,597032,3,bot,E. O'Rourke grounded out to 2b.,27,2025-04-08T00:00:00-04:00,"Brother Reynolds Field (Newport, RI)",211,MBA,2025
6346115,597253,Clark (MA) Cougars,597032,Salve Regina Seahawks,597253,4,top,B. Hollinrak singled to pitcher.,28,2025-04-08T00:00:00-04:00,"Brother Reynolds Field (Newport, RI)",211,MBA,2025
6346115,597253,Clark (MA) Cougars,597032,Salve Regina Seahawks,597253,4,top,A. Locasto flied out to rf.,29,2025-04-08T00:00:00-04:00,"Brother Reynolds Field (Newport, RI)",211,MBA,2025
6346115,597253,Clark (MA) Cougars,597032,Salve Regina Seahawks,597253,4,top,A. Jalil singled to left field; B. Hollinrak advanced to second.,30,2025-04-08T00:00:00-04:00,"Brother Reynolds Field (Newport, RI)",211,MBA,2025
6346115,597253,Clark (MA) Cougars,597032,Salve Regina Seahawks,597253,4,top,"M. Salzillo doubled down the lf line, RBI; A. Jalil advanced to third; B. Hollinrak scored.",31,2025-04-08T00:00:00-04:00,"Brother Reynolds Field (Newport, RI)",211,MBA,2025
6346115,597253,Clark (MA) Cougars,597032,Salve Regina Seahawks,597253,4,top,"C. Doran singled to right center, advanced to second on the throw, RBI; M. Salzillo scored; A. Jalil scored.",32,2025-04-08T00:00:00-04:00,"Brother Reynolds Field (Newport, RI)",211,MBA,2025
6346115,597253,Clark (MA) Cougars,597032,Salve Regina Seahawks,597253,4,top,N. Romanowsk to p for J. DeRienzo.,33,2025-04-08T00:00:00-04:00,"Brother Reynolds Field (Newport, RI)",211,MBA,2025
6346115,597253,Clark (MA) Cougars,597032,Salve Regina Seahawks,597253,4,top,B. Sullivan was intentionally walked.,34,2025-04-08T00:00:00-04:00,"Brother Reynolds Field (Newport, RI)",211,MBA,2025
6346115,597253,Clark (MA) Cougars,597032,Salve Regina Seahawks,597253,4,top,M. Soares singled to right center; B. Sullivan advanced to second; C. Doran advanced to third.,35,2025-04-08T00:00:00-04:00,"Brother Reynolds Field (Newport, RI)",211,MBA,2025
6346115,597253,Clark (MA) Cougars,597032,Salve Regina Seahawks,597253,4,top,D. Mariani struck out swinging.,36,2025-04-08T00:00:00-04:00,"Brother Reynolds Field (Newport, RI)",211,MBA,2025
6346115,597253,Clark (MA) Cougars,597032,Salve Regina Seahawks,597253,4,top,R. Caulfield lined out to lf.,37,2025-04-08T00:00:00-04:00,"Brother Reynolds Field (Newport, RI)",211,MBA,2025
6346115,597253,Clark (MA) Cougars,597032,Salve Regina Seahawks,597032,4,bot,T. Flaherty to p for R. Roth.,38,2025-04-08T00:00:00-04:00,"Brother Reynolds Field (Newport, RI)",211,MBA,2025
6346115,597253,Clark (MA) Cougars,597032,Salve Regina Seahawks,597032,4,bot,H. Yaworski hit by pitch.,39,2025-04-08T00:00:00-04:00,"Brother Reynolds Field (Newport, RI)",211,MBA,2025
6346115,597253,Clark (MA) Cougars,597032,Salve Regina Seahawks,597032,4,bot,H. Yaworski advanced to second on a wild pitch.,40,2025-04-08T00:00:00-04:00,"Brother Reynolds Field (Newport, RI)",211,MBA,2025
6346115,597253,Clark (MA) Cougars,597032,Salve Regina Seahawks,597032,4,bot,C. Homa popped up to ss.,41,2025-04-08T00:00:00-04:00,"Brother Reynolds Field (Newport, RI)",211,MBA,2025
6346115,597253,Clark (MA) Cougars,597032,Salve Regina Seahawks,597032,4,bot,S. Donovan singled to left field; H. Yaworski advanced to third.,42,2025-04-08T00:00:00-04:00,"Brother Reynolds Field (Newport, RI)",211,MBA,2025
6346115,597253,Clark (MA) Cougars,597032,Salve Regina Seahawks,597032,4,bot,T. Petrosino walked; S. Donovan advanced to second.,43,2025-04-08T00:00:00-04:00,"Brother Reynolds Field (Newport, RI)",211,MBA,2025
6346115,597253,Clark (MA) Cougars,597032,Salve Regina Seahawks,597032,4,bot,N. Ruehs struck out swinging.,44,2025-04-08T00:00:00-04:00,"Brother Reynolds Field (Newport, RI)",211,MBA,2025
6346115,597253,Clark (MA) Cougars,597032,Salve Regina Seahawks,597032,4,bot,B. Grover flied out to cf.,45,2025-04-08T00:00:00-04:00,"Brother Reynolds Field (Newport, RI)",211,MBA,2025
6346115,597253,Clark (MA) Cougars,597032,Salve Regina Seahawks,597253,5,top,B. Hollinrak grounded out to 3b.,46,2025-04-08T00:00:00-04:00,"Brother Reynolds Field (Newport, RI)",211,MBA,2025
6346115,597253,Clark (MA) Cougars,597032,Salve Regina Seahawks,597253,5,top,A. Locasto singled to right field.,47,2025-04-08T00:00:00-04:00,"Brother Reynolds Field (Newport, RI)",211,MBA,2025
6346115,597253,Clark (MA) Cougars,597032,Salve Regina Seahawks,597253,5,top,A. Jalil struck out swinging.,48,2025-04-08T00:00:00-04:00,"Brother Reynolds Field (Newport, RI)",211,MBA,2025
6346115,597253,Clark (MA) Cougars,597032,Salve Regina Seahawks,597253,5,top,M. Salzillo struck out looking.,49,2025-04-08T00:00:00-04:00,"Brother Reynolds Field (Newport, RI)",211,MBA,2025
6346115,597253,Clark (MA) Cougars,597032,Salve Regina Seahawks,597032,5,bot,M. Neal struck out swinging.,50,2025-04-08T00:00:00-04:00,"Brother Reynolds Field (Newport, RI)",211,MBA,2025
6346115,597253,Clark (MA) Cougars,597032,Salve Regina Seahawks,597032,5,bot,S. Williams flied out to lf.,51,2025-04-08T00:00:00-04:00,"Brother Reynolds Field (Newport, RI)",211,MBA,2025
6346115,597253,Clark (MA) Cougars,597032,Salve Regina Seahawks,597032,5,bot,"E. O'Rourke homered, RBI.",52,2025-04-08T00:00:00-04:00,"Brother Reynolds Field (Newport, RI)",211,MBA,2025
6346115,597253,Clark (MA) Cougars,597032,Salve Regina Seahawks,597032,5,bot,H. Yaworski singled through the left side.,53,2025-04-08T00:00:00-04:00,"Brother Reynolds Field (Newport, RI)",211,MBA,2025
6346115,597253,Clark (MA) Cougars,597032,Salve Regina Seahawks,597032,5,bot,C. Homa grounded out to 2b.,54,2025-04-08T00:00:00-04:00,"Brother Reynolds Field (Newport, RI)",211,MBA,2025
6346115,597253,Clark (MA) Cougars,597032,Salve Regina Seahawks,597253,6,top,C. Doran grounded out to p.,55,2025-04-08T00:00:00-04:00,"Brother Reynolds Field (Newport, RI)",211,MBA,2025
6346115,597253,Clark (MA) Cougars,597032,Salve Regina Seahawks,597253,6,top,"B. Sullivan struck out swinging, out at first c to 1b.",56,2025-04-08T00:00:00-04:00,"Brother Reynolds Field (Newport, RI)",211,MBA,2025
6346115,597253,Clark (MA) Cougars,597032,Salve Regina Seahawks,597253,6,top,M. Soares grounded out to p.,57,2025-04-08T00:00:00-04:00,"Brother Reynolds Field (Newport, RI)",211,MBA,2025
6346115,597253,Clark (MA) Cougars,597032,Salve Regina Seahawks,597032,6,bot,S. Donovan singled to center field.,58,2025-04-08T00:00:00-04:00,"Brother Reynolds Field (Newport, RI)",211,MBA,2025
6346115,597253,Clark (MA) Cougars,597032,Salve Regina Seahawks,597032,6,bot,T. Petrosino singled to left field; S. Donovan advanced to second.,59,2025-04-08T00:00:00-04:00,"Brother Reynolds Field (Newport, RI)",211,MBA,2025
6346115,597253,Clark (MA) Cougars,597032,Salve Regina Seahawks,597032,6,bot,N. Ruehs walked; T. Petrosino advanced to second; S. Donovan advanced to third.,60,2025-04-08T00:00:00-04:00,"Brother Reynolds Field (Newport, RI)",211,MBA,2025
6346115,597253,Clark (MA) Cougars,597032,Salve Regina Seahawks,597032,6,bot,B. Grover popped up to 3b.,61,2025-04-08T00:00:00-04:00,"Brother Reynolds Field (Newport, RI)",211,MBA,2025
6346115,597253,Clark (MA) Cougars,597032,Salve Regina Seahawks,597032,6,bot,"M. Neal reached first on an error by ss, RBI; N. Ruehs advanced to second; T. Petrosino advanced to third; S. Donovan scored.",62,2025-04-08T00:00:00-04:00,"Brother Reynolds Field (Newport, RI)",211,MBA,2025
6346115,597253,Clark (MA) Cougars,597032,Salve Regina Seahawks,597032,6,bot,"S. Williams flied out to cf, RBI; N. Ruehs advanced to third; T. Petrosino scored, unearned.",63,2025-04-08T00:00:00-04:00,"Brother Reynolds Field (Newport, RI)",211,MBA,2025
6346115,597253,Clark (MA) Cougars,597032,Salve Regina Seahawks,597032,6,bot,E. O'Rourke struck out swinging.,64,2025-04-08T00:00:00-04:00,"Brother Reynolds Field (Newport, RI)",211,MBA,2025
6346115,597253,Clark (MA) Cougars,597032,Salve Regina Seahawks,597253,7,top,D. Mariani flied out to cf.,65,2025-04-08T00:00:00-04:00,"Brother Reynolds Field (Newport, RI)",211,MBA,2025
6346115,597253,Clark (MA) Cougars,597032,Salve Regina Seahawks,597253,7,top,R. Caulfield out at first 1b to p.,66,2025-04-08T00:00:00-04:00,"Brother Reynolds Field (Newport, RI)",211,MBA,2025
6346115,597253,Clark (MA) Cougars,597032,Salve Regina Seahawks,597253,7,top,B. Hollinrak doubled to right field.,67,2025-04-08T00:00:00-04:00,"Brother Reynolds Field (Newport, RI)",211,MBA,2025
6346115,597253,Clark (MA) Cougars,597032,Salve Regina Seahawks,597253,7,top,A. Locasto walked.,68,2025-04-08T00:00:00-04:00,"Brother Reynolds Field (Newport, RI)",211,MBA,2025
6346115,597253,Clark (MA) Cougars,597032,Salve Regina Seahawks,597253,7,top,T. Jones pinch hit for A. Jalil.,69,2025-04-08T00:00:00-04:00,"Brother Reynolds Field (Newport, RI)",211,MBA,2025
6346115,597253,Clark (MA) Cougars,597032,Salve Regina Seahawks,597253,7,top,T. Jones lined out to rf.,70,2025-04-08T00:00:00-04:00,"Brother Reynolds Field (Newport, RI)",211,MBA,2025
6346115,597253,Clark (MA) Cougars,597032,Salve Regina Seahawks,597032,7,bot,T. Jones to ss.,71,2025-04-08T00:00:00-04:00,"Brother Reynolds Field (Newport, RI)",211,MBA,2025
6346115,597253,Clark (MA) Cougars,597032,Salve Regina Seahawks,597032,7,bot,B. Spencer to p for T. Flaherty.,72,2025-04-08T00:00:00-04:00,"Brother Reynolds Field (Newport, RI)",211,MBA,2025
6346115,597253,Clark (MA) Cougars,597032,Salve Regina Seahawks,597032,7,bot,H. Yaworski flied out to lf.,73,2025-04-08T00:00:00-04:00,"Brother Reynolds Field (Newport, RI)",211,MBA,2025
6346115,597253,Clark (MA) Cougars,597032,Salve Regina Seahawks,597032,7,bot,C. Homa grounded out to ss.,74,2025-04-08T00:00:00-04:00,"Brother Reynolds Field (Newport, RI)",211,MBA,2025
6346115,597253,Clark (MA) Cougars,597032,Salve Regina Seahawks,597032,7,bot,S. Donovan singled to right field.,75,2025-04-08T00:00:00-04:00,"Brother Reynolds Field (Newport, RI)",211,MBA,2025
6346115,597253,Clark (MA) Cougars,597032,Salve Regina Seahawks,597032,7,bot,T. Petrosino struck out looking.,76,2025-04-08T00:00:00-04:00,"Brother Reynolds Field (Newport, RI)",211,MBA,2025
6346115,597253,Clark (MA) Cougars,597032,Salve Regina Seahawks,597253,8,top,N. Callano to p for N. Romanowsk.,77,2025-04-08T00:00:00-04:00,"Brother Reynolds Field (Newport, RI)",211,MBA,2025
6346115,597253,Clark (MA) Cougars,597032,Salve Regina Seahawks,597253,8,top,M. Salzillo walked.,78,2025-04-08T00:00:00-04:00,"Brother Reynolds Field (Newport, RI)",211,MBA,2025
6346115,597253,Clark (MA) Cougars,597032,Salve Regina Seahawks,597253,8,top,C. Doran struck out swinging; M. Salzillo stole second.,79,2025-04-08T00:00:00-04:00,"Brother Reynolds Field (Newport, RI)",211,MBA,2025
6346115,597253,Clark (MA) Cougars,597032,Salve Regina Seahawks,597253,8,top,B. Sullivan struck out swinging.,80,2025-04-08T00:00:00-04:00,"Brother Reynolds Field (Newport, RI)",211,MBA,2025
6346115,597253,Clark (MA) Cougars,597032,Salve Regina Seahawks,597253,8,top,M. Soares walked.,81,2025-04-08T00:00:00-04:00,"Brother Reynolds Field (Newport, RI)",211,MBA,2025
6346115,597253,Clark (MA) Cougars,597032,Salve Regina Seahawks,597253,8,top,A. Wertz to p for N. Callano.,82,2025-04-08T00:00:00-04:00,"Brother Reynolds Field (Newport, RI)",211,MBA,2025
6346115,597253,Clark (MA) Cougars,597032,Salve Regina Seahawks,597253,8,top,"D. Mariani doubled to right center, 2 RBI; M. Soares scored; M. Salzillo scored.",83,2025-04-08T00:00:00-04:00,"Brother Reynolds Field (Newport, RI)",211,MBA,2025
6346115,597253,Clark (MA) Cougars,597032,Salve Regina Seahawks,597253,8,top,R. Caulfield popped up to ss.,84,2025-04-08T00:00:00-04:00,"Brother Reynolds Field (Newport, RI)",211,MBA,2025
6346115,597253,Clark (MA) Cougars,597032,Salve Regina Seahawks,597032,8,bot,D. Cimini pinch hit for N. Ruehs.,85,2025-04-08T00:00:00-04:00,"Brother Reynolds Field (Newport, RI)",211,MBA,2025
6346115,597253,Clark (MA) Cougars,597032,Salve Regina Seahawks,597032,8,bot,D. Cimini grounded out to p unassisted.,86,2025-04-08T00:00:00-04:00,"Brother Reynolds Field (Newport, RI)",211,MBA,2025
6346115,597253,Clark (MA) Cougars,597032,Salve Regina Seahawks,597032,8,bot,B. Grover hit by pitch.,87,2025-04-08T00:00:00-04:00,"Brother Reynolds Field (Newport, RI)",211,MBA,2025
6346115,597253,Clark (MA) Cougars,597032,Salve Regina Seahawks,597032,8,bot,M. Neal flied out to rf.,88,2025-04-08T00:00:00-04:00,"Brother Reynolds Field (Newport, RI)",211,MBA,2025
6346115,597253,Clark (MA) Cougars,597032,Salve Regina Seahawks,597032,8,bot,B. Grover advanced to second on a wild pitch.,89,2025-04-08T00:00:00-04:00,"Brother Reynolds Field (Newport, RI)",211,MBA,2025
6346115,597253,Clark (MA) Cougars,597032,Salve Regina Seahawks,597032,8,bot,S. Williams grounded out to ss.,90,2025-04-08T00:00:00-04:00,"Brother Reynolds Field (Newport, RI)",211,MBA,2025
6346115,597253,Clark (MA) Cougars,597032,Salve Regina Seahawks,597253,9,top,G. Schopps pinch hit for D. Cimini.,91,2025-04-08T00:00:00-04:00,"Brother Reynolds Field (Newport, RI)",211,MBA,2025
6346115,597253,Clark (MA) Cougars,597032,Salve Regina Seahawks,597253,9,top,G. Schopps to ss.,92,2025-04-08T00:00:00-04:00,"Brother Reynolds Field (Newport, RI)",211,MBA,2025
6346115,597253,Clark (MA) Cougars,597032,Salve Regina Seahawks,597253,9,top,C. Toriello to p for A. Wertz.,93,2025-04-08T00:00:00-04:00,"Brother Reynolds Field (Newport, RI)",211,MBA,2025
6346115,597253,Clark (MA) Cougars,597032,Salve Regina Seahawks,597253,9,top,B. Hollinrak singled to right field.,94,2025-04-08T00:00:00-04:00,"Brother Reynolds Field (Newport, RI)",211,MBA,2025
6346115,597253,Clark (MA) Cougars,597032,Salve Regina Seahawks,597253,9,top,B. Andreola pinch ran for B. Hollinrak.,95,2025-04-08T00:00:00-04:00,"Brother Reynolds Field (Newport, RI)",211,MBA,2025
6346115,597253,Clark (MA) Cougars,597032,Salve Regina Seahawks,597253,9,top,"A. Locasto grounded out to p, SAC; B. Andreola advanced to second.",96,2025-04-08T00:00:00-04:00,"Brother Reynolds Field (Newport, RI)",211,MBA,2025
6346115,597253,Clark (MA) Cougars,597032,Salve Regina Seahawks,597253,9,top,T. Jones flied out to lf.,97,2025-04-08T00:00:00-04:00,"Brother Reynolds Field (Newport, RI)",211,MBA,2025
6346115,597253,Clark (MA) Cougars,597032,Salve Regina Seahawks,597253,9,top,B. Andreola advanced to third on a passed ball.,98,2025-04-08T00:00:00-04:00,"Brother Reynolds Field (Newport, RI)",211,MBA,2025
6346115,597253,Clark (MA) Cougars,597032,Salve Regina Seahawks,597253,9,top,M. Salzillo walked.,99,2025-04-08T00:00:00-04:00,"Brother Reynolds Field (Newport, RI)",211,MBA,2025
6346115,597253,Clark (MA) Cougars,597032,Salve Regina Seahawks,597253,9,top,L. Ortiz to p for C. Toriello.,100,2025-04-08T00:00:00-04:00,"Brother Reynolds Field (Newport, RI)",211,MBA,2025
6346115,597253,Clark (MA) Cougars,597032,Salve Regina Seahawks,597253,9,top,C. Doran hit by pitch; M. Salzillo advanced to second.,101,2025-04-08T00:00:00-04:00,"Brother Reynolds Field (Newport, RI)",211,MBA,2025
6346115,597253,Clark (MA) Cougars,597032,Salve Regina Seahawks,597253,9,top,B. Sullivan lined out to 1b.,102,2025-04-08T00:00:00-04:00,"Brother Reynolds Field (Newport, RI)",211,MBA,2025
6346115,597253,Clark (MA) Cougars,597032,Salve Regina Seahawks,597032,9,bot,B. Hewett to 1b for B. Andreola.,103,2025-04-08T00:00:00-04:00,"Brother Reynolds Field (Newport, RI)",211,MBA,2025
6346115,597253,Clark (MA) Cougars,597032,Salve Regina Seahawks,597032,9,bot,E. O'Rourke flied out to cf.,104,2025-04-08T00:00:00-04:00,"Brother Reynolds Field (Newport, RI)",211,MBA,2025
6346115,597253,Clark (MA) Cougars,597032,Salve Regina Seahawks,597032,9,bot,H. Yaworski doubled to right field.,105,2025-04-08T00:00:00-04:00,"Brother Reynolds Field (Newport, RI)",211,MBA,2025
6346115,597253,Clark (MA) Cougars,597032,Salve Regina Seahawks,597032,9,bot,R. Mulhern pinch ran for H. Yaworski.,106,2025-04-08T00:00:00-04:00,"Brother Reynolds Field (Newport, RI)",211,MBA,2025
6346115,597253,Clark (MA) Cougars,597032,Salve Regina Seahawks,597032,9,bot,C. Homa walked.,107,2025-04-08T00:00:00-04:00,"Brother Reynolds Field (Newport, RI)",211,MBA,2025
6346115,597253,Clark (MA) Cougars,597032,Salve Regina Seahawks,597032,9,bot,S. Donovan struck out looking.,108,2025-04-08T00:00:00-04:00,"Brother Reynolds Field (Newport, RI)",211,MBA,2025
6346115,597253,Clark (MA) Cougars,597032,Salve Regina Seahawks,597032,9,bot,T. Petrosino walked; C. Homa advanced to second; R. Mulhern advanced to third.,109,2025-04-08T00:00:00-04:00,"Brother Reynolds Field (Newport, RI)",211,MBA,2025
6346115,597253,Clark (MA) Cougars,597032,Salve Regina Seahawks,597032,9,bot,T. Whitlock pinch hit for G. Schopps.,110,2025-04-08T00:00:00-04:00,"Brother Reynolds Field (Newport, RI)",211,MBA,2025
6346115,597253,Clark (MA) Cougars,597032,Salve Regina Seahawks,597032,9,bot,"T. Whitlock singled to shortstop, RBI; T. Petrosino advanced to third; C. Homa scored; R. Mulhern scored.",111,2025-04-08T00:00:00-04:00,"Brother Reynolds Field (Newport, RI)",211,MBA,2025
6346115,597253,Clark (MA) Cougars,597032,Salve Regina Seahawks,597032,9,bot,M. Stokes pinch ran for T. Whitlock.,112,2025-04-08T00:00:00-04:00,"Brother Reynolds Field (Newport, RI)",211,MBA,2025
6346115,597253,Clark (MA) Cougars,597032,Salve Regina Seahawks,597032,9,bot,B. Grover walked; M. Stokes advanced to second.,113,2025-04-08T00:00:00-04:00,"Brother Reynolds Field (Newport, RI)",211,MBA,2025
6346115,597253,Clark (MA) Cougars,597032,Salve Regina Seahawks,597032,9,bot,M. Neal reached on a fielder's choice; B. Grover out at second ss to 2b.,114,2025-04-08T00:00:00-04:00,"Brother Reynolds Field (Newport, RI)",211,MBA,2025
