game_id,away_team_id,away_team_name,home_team_id,home_team_name,batting_team,inning,top_bot,event_text,event_num,game_datetime,stadium_name,attendance,sport_id,season
6346199,596790,Tusculum Pioneers,596800,Lee Flames,596790,1,top,C. Webster walked (3-0 BBBB).,1,2025-04-08T00:00:00-04:00,"Olympic Field (Cleveland, TN)",167,MBA,2025
6346199,596790,Tusculum Pioneers,596800,Lee Flames,596790,1,top,Sawyer Pace flied out to lf (2-2 BBKK).,2,2025-04-08T00:00:00-04:00,"Olympic Field (Cleveland, TN)",167,MBA,2025
6346199,596790,Tusculum Pioneers,596800,Lee Flames,596790,1,top,C. Webster stole second.,3,2025-04-08T00:00:00-04:00,"Olympic Field (Cleveland, TN)",167,MBA,2025
6346199,596790,Tusculum Pioneers,596800,Lee Flames,596790,1,top,O. Carreras walked (3-2 BBKFBFB).,4,2025-04-08T00:00:00-04:00,"Olympic Field (Cleveland, TN)",167,MBA,2025
6346199,596790,Tusculum Pioneers,596800,Lee Flames,596790,1,top,Jude Morton grounded into double play 3b to 1b (3-1 BBSB); O. Carreras advanced to second; C. Webster out on the play.,5,2025-04-08T00:00:00-04:00,"Olympic Field (Cleveland, TN)",167,MBA,2025
6346199,596790,Tusculum Pioneers,596800,Lee Flames,596800,1,bot,JJ Williams grounded out to 3b (1-2 SFB).,6,2025-04-08T00:00:00-04:00,"Olympic Field (Cleveland, TN)",167,MBA,2025
6346199,596790,Tusculum Pioneers,596800,Lee Flames,596800,1,bot,L. Collier popped up to 2b to center field (0-0).,7,2025-04-08T00:00:00-04:00,"Olympic Field (Cleveland, TN)",167,MBA,2025
6346199,596790,Tusculum Pioneers,596800,Lee Flames,596800,1,bot,Doughman flied out to rf (1-1 BK).,8,2025-04-08T00:00:00-04:00,"Olympic Field (Cleveland, TN)",167,MBA,2025
6346199,596790,Tusculum Pioneers,596800,Lee Flames,596790,2,top,Ryan Ortega walked (3-0 BBBB).,9,2025-04-08T00:00:00-04:00,"Olympic Field (Cleveland, TN)",167,MBA,2025
6346199,596790,Tusculum Pioneers,596800,Lee Flames,596790,2,top,"Ty Smith homered to left field, 2 RBI (0-0); Ryan Ortega scored.",10,2025-04-08T00:00:00-04:00,"Olympic Field (Cleveland, TN)",167,MBA,2025
6346199,596790,Tusculum Pioneers,596800,Lee Flames,596790,2,top,Mound Visit - Coach.,11,2025-04-08T00:00:00-04:00,"Olympic Field (Cleveland, TN)",167,MBA,2025
6346199,596790,Tusculum Pioneers,596800,Lee Flames,596790,2,top,C. Mulcahy grounded out to ss (2-2 BBFF).,12,2025-04-08T00:00:00-04:00,"Olympic Field (Cleveland, TN)",167,MBA,2025
6346199,596790,Tusculum Pioneers,596800,Lee Flames,596790,2,top,J. Singleton singled to right field (0-0).,13,2025-04-08T00:00:00-04:00,"Olympic Field (Cleveland, TN)",167,MBA,2025
6346199,596790,Tusculum Pioneers,596800,Lee Flames,596790,2,top,A. Collins struck out swinging (1-2 FKBS).,14,2025-04-08T00:00:00-04:00,"Olympic Field (Cleveland, TN)",167,MBA,2025
6346199,596790,Tusculum Pioneers,596800,Lee Flames,596790,2,top,J. Singleton advanced to second on a wild pitch.,15,2025-04-08T00:00:00-04:00,"Olympic Field (Cleveland, TN)",167,MBA,2025
6346199,596790,Tusculum Pioneers,596800,Lee Flames,596790,2,top,C. Webster reached on a fielder's choice to shortstop (3-2 BBKKB); J. Singleton out at third ss to 2b to 3b.,16,2025-04-08T00:00:00-04:00,"Olympic Field (Cleveland, TN)",167,MBA,2025
6346199,596790,Tusculum Pioneers,596800,Lee Flames,596800,2,bot,B. Sisson struck out looking (2-2 KBBFK).,17,2025-04-08T00:00:00-04:00,"Olympic Field (Cleveland, TN)",167,MBA,2025
6346199,596790,Tusculum Pioneers,596800,Lee Flames,596800,2,bot,M. Cloud reached on a throwing error by 3b (1-1 KB).,18,2025-04-08T00:00:00-04:00,"Olympic Field (Cleveland, TN)",167,MBA,2025
6346199,596790,Tusculum Pioneers,596800,Lee Flames,596800,2,bot,M. Cloud stole second.,19,2025-04-08T00:00:00-04:00,"Olympic Field (Cleveland, TN)",167,MBA,2025
6346199,596790,Tusculum Pioneers,596800,Lee Flames,596800,2,bot,J. Miller walked (3-1 BBFBB).,20,2025-04-08T00:00:00-04:00,"Olympic Field (Cleveland, TN)",167,MBA,2025
6346199,596790,Tusculum Pioneers,596800,Lee Flames,596800,2,bot,J. Miller stole second; M. Cloud stole third.,21,2025-04-08T00:00:00-04:00,"Olympic Field (Cleveland, TN)",167,MBA,2025
6346199,596790,Tusculum Pioneers,596800,Lee Flames,596800,2,bot,L. Cloud struck out looking (0-2 FKK).,22,2025-04-08T00:00:00-04:00,"Olympic Field (Cleveland, TN)",167,MBA,2025
6346199,596790,Tusculum Pioneers,596800,Lee Flames,596800,2,bot,R. Valdes grounded out to 3b (0-0).,23,2025-04-08T00:00:00-04:00,"Olympic Field (Cleveland, TN)",167,MBA,2025
6346199,596790,Tusculum Pioneers,596800,Lee Flames,596790,3,top,M. Delph to p for Van Meeteren.,24,2025-04-08T00:00:00-04:00,"Olympic Field (Cleveland, TN)",167,MBA,2025
6346199,596790,Tusculum Pioneers,596800,Lee Flames,596790,3,top,Sawyer Pace grounded out to 3b (0-2 KK).,25,2025-04-08T00:00:00-04:00,"Olympic Field (Cleveland, TN)",167,MBA,2025
6346199,596790,Tusculum Pioneers,596800,Lee Flames,596790,3,top,"O. Carreras homered to left field, RBI (1-0 B).",26,2025-04-08T00:00:00-04:00,"Olympic Field (Cleveland, TN)",167,MBA,2025
6346199,596790,Tusculum Pioneers,596800,Lee Flames,596790,3,top,Jude Morton struck out swinging (2-2 KBBFS).,27,2025-04-08T00:00:00-04:00,"Olympic Field (Cleveland, TN)",167,MBA,2025
6346199,596790,Tusculum Pioneers,596800,Lee Flames,596790,3,top,Ryan Ortega flied out to rf (1-0 B).,28,2025-04-08T00:00:00-04:00,"Olympic Field (Cleveland, TN)",167,MBA,2025
6346199,596790,Tusculum Pioneers,596800,Lee Flames,596800,3,bot,Ayden Moore to p for Cooper Emery.,29,2025-04-08T00:00:00-04:00,"Olympic Field (Cleveland, TN)",167,MBA,2025
6346199,596790,Tusculum Pioneers,596800,Lee Flames,596800,3,bot,A. Simmons grounded out to 3b (1-1 SB).,30,2025-04-08T00:00:00-04:00,"Olympic Field (Cleveland, TN)",167,MBA,2025
6346199,596790,Tusculum Pioneers,596800,Lee Flames,596800,3,bot,JJ Williams flied out to cf (2-1 BKB).,31,2025-04-08T00:00:00-04:00,"Olympic Field (Cleveland, TN)",167,MBA,2025
6346199,596790,Tusculum Pioneers,596800,Lee Flames,596800,3,bot,L. Collier singled to center field (0-2 SK).,32,2025-04-08T00:00:00-04:00,"Olympic Field (Cleveland, TN)",167,MBA,2025
6346199,596790,Tusculum Pioneers,596800,Lee Flames,596800,3,bot,Doughman singled up the middle (2-2 BBKF); L. Collier advanced to third.,33,2025-04-08T00:00:00-04:00,"Olympic Field (Cleveland, TN)",167,MBA,2025
6346199,596790,Tusculum Pioneers,596800,Lee Flames,596800,3,bot,"B. Sisson singled to shortstop, RBI (1-1 BK); Doughman advanced to second; L. Collier scored.",34,2025-04-08T00:00:00-04:00,"Olympic Field (Cleveland, TN)",167,MBA,2025
6346199,596790,Tusculum Pioneers,596800,Lee Flames,596800,3,bot,M. Cloud flied out to cf (0-0).,35,2025-04-08T00:00:00-04:00,"Olympic Field (Cleveland, TN)",167,MBA,2025
6346199,596790,Tusculum Pioneers,596800,Lee Flames,596790,4,top,Ty Smith grounded out to 1b unassisted (1-1 BK).,36,2025-04-08T00:00:00-04:00,"Olympic Field (Cleveland, TN)",167,MBA,2025
6346199,596790,Tusculum Pioneers,596800,Lee Flames,596790,4,top,C. Mulcahy walked (3-2 BSBFBB).,37,2025-04-08T00:00:00-04:00,"Olympic Field (Cleveland, TN)",167,MBA,2025
6346199,596790,Tusculum Pioneers,596800,Lee Flames,596790,4,top,J. Singleton struck out swinging (2-2 BSFBFS).,38,2025-04-08T00:00:00-04:00,"Olympic Field (Cleveland, TN)",167,MBA,2025
6346199,596790,Tusculum Pioneers,596800,Lee Flames,596790,4,top,A. Collins grounded out to 2b (0-0).,39,2025-04-08T00:00:00-04:00,"Olympic Field (Cleveland, TN)",167,MBA,2025
6346199,596790,Tusculum Pioneers,596800,Lee Flames,596800,4,bot,J. Miller struck out swinging (3-2 KBBBKS).,40,2025-04-08T00:00:00-04:00,"Olympic Field (Cleveland, TN)",167,MBA,2025
6346199,596790,Tusculum Pioneers,596800,Lee Flames,596800,4,bot,L. Cloud struck out swinging (2-2 BFFBS).,41,2025-04-08T00:00:00-04:00,"Olympic Field (Cleveland, TN)",167,MBA,2025
6346199,596790,Tusculum Pioneers,596800,Lee Flames,596800,4,bot,R. Valdes grounded out to 3b (1-1 KB).,42,2025-04-08T00:00:00-04:00,"Olympic Field (Cleveland, TN)",167,MBA,2025
6346199,596790,Tusculum Pioneers,596800,Lee Flames,596790,5,top,T. Platt to 1b for L. Cloud.,43,2025-04-08T00:00:00-04:00,"Olympic Field (Cleveland, TN)",167,MBA,2025
6346199,596790,Tusculum Pioneers,596800,Lee Flames,596790,5,top,"C. Webster struck out swinging, out at first c to 1b (1-2 FKBS).",44,2025-04-08T00:00:00-04:00,"Olympic Field (Cleveland, TN)",167,MBA,2025
6346199,596790,Tusculum Pioneers,596800,Lee Flames,596790,5,top,Sawyer Pace singled to first base (1-1 BK).,45,2025-04-08T00:00:00-04:00,"Olympic Field (Cleveland, TN)",167,MBA,2025
6346199,596790,Tusculum Pioneers,596800,Lee Flames,596790,5,top,O. Carreras flied out to cf (0-0).,46,2025-04-08T00:00:00-04:00,"Olympic Field (Cleveland, TN)",167,MBA,2025
6346199,596790,Tusculum Pioneers,596800,Lee Flames,596790,5,top,Jude Morton singled to center field (1-1 BK); Sawyer Pace advanced to second.,47,2025-04-08T00:00:00-04:00,"Olympic Field (Cleveland, TN)",167,MBA,2025
6346199,596790,Tusculum Pioneers,596800,Lee Flames,596790,5,top,Ryan Ortega singled to shortstop (0-1 K); Jude Morton advanced to second; Sawyer Pace advanced to third.,48,2025-04-08T00:00:00-04:00,"Olympic Field (Cleveland, TN)",167,MBA,2025
6346199,596790,Tusculum Pioneers,596800,Lee Flames,596790,5,top,Ty Smith struck out swinging (1-2 BSSS).,49,2025-04-08T00:00:00-04:00,"Olympic Field (Cleveland, TN)",167,MBA,2025
6346199,596790,Tusculum Pioneers,596800,Lee Flames,596800,5,bot,Scout Martin to p for Ayden Moore.,50,2025-04-08T00:00:00-04:00,"Olympic Field (Cleveland, TN)",167,MBA,2025
6346199,596790,Tusculum Pioneers,596800,Lee Flames,596800,5,bot,A. Simmons flied out to cf (1-1 KB).,51,2025-04-08T00:00:00-04:00,"Olympic Field (Cleveland, TN)",167,MBA,2025
6346199,596790,Tusculum Pioneers,596800,Lee Flames,596800,5,bot,JJ Williams grounded out to ss (0-1 F).,52,2025-04-08T00:00:00-04:00,"Olympic Field (Cleveland, TN)",167,MBA,2025
6346199,596790,Tusculum Pioneers,596800,Lee Flames,596800,5,bot,L. Collier flied out to cf (0-0).,53,2025-04-08T00:00:00-04:00,"Olympic Field (Cleveland, TN)",167,MBA,2025
6346199,596790,Tusculum Pioneers,596800,Lee Flames,596790,6,top,E. Bloomer to p for M. Delph.,54,2025-04-08T00:00:00-04:00,"Olympic Field (Cleveland, TN)",167,MBA,2025
6346199,596790,Tusculum Pioneers,596800,Lee Flames,596790,6,top,C. Mulcahy flied out to rf (0-0).,55,2025-04-08T00:00:00-04:00,"Olympic Field (Cleveland, TN)",167,MBA,2025
6346199,596790,Tusculum Pioneers,596800,Lee Flames,596790,6,top,J. Singleton hit by pitch (1-1 FB).,56,2025-04-08T00:00:00-04:00,"Olympic Field (Cleveland, TN)",167,MBA,2025
6346199,596790,Tusculum Pioneers,596800,Lee Flames,596790,6,top,A. Collins grounded out to p unassisted down the 1b line (0-1 F); J. Singleton advanced to second.,57,2025-04-08T00:00:00-04:00,"Olympic Field (Cleveland, TN)",167,MBA,2025
6346199,596790,Tusculum Pioneers,596800,Lee Flames,596790,6,top,"C. Webster singled up the middle, RBI (2-2 KSBB); J. Singleton scored.",58,2025-04-08T00:00:00-04:00,"Olympic Field (Cleveland, TN)",167,MBA,2025
6346199,596790,Tusculum Pioneers,596800,Lee Flames,596790,6,top,Sawyer Pace flied out to lf (0-2 KF).,59,2025-04-08T00:00:00-04:00,"Olympic Field (Cleveland, TN)",167,MBA,2025
6346199,596790,Tusculum Pioneers,596800,Lee Flames,596800,6,bot,Doughman flied out to lf (0-1 K).,60,2025-04-08T00:00:00-04:00,"Olympic Field (Cleveland, TN)",167,MBA,2025
6346199,596790,Tusculum Pioneers,596800,Lee Flames,596800,6,bot,B. Sisson struck out swinging (1-2 KBFS).,61,2025-04-08T00:00:00-04:00,"Olympic Field (Cleveland, TN)",167,MBA,2025
6346199,596790,Tusculum Pioneers,596800,Lee Flames,596800,6,bot,"M. Cloud homered to left center, RBI (1-1 BF).",62,2025-04-08T00:00:00-04:00,"Olympic Field (Cleveland, TN)",167,MBA,2025
6346199,596790,Tusculum Pioneers,596800,Lee Flames,596800,6,bot,J. Miller flied out to cf to right center (3-2 BBBKK).,63,2025-04-08T00:00:00-04:00,"Olympic Field (Cleveland, TN)",167,MBA,2025
6346199,596790,Tusculum Pioneers,596800,Lee Flames,596790,7,top,O. Carreras flied out to rf (0-0).,64,2025-04-08T00:00:00-04:00,"Olympic Field (Cleveland, TN)",167,MBA,2025
6346199,596790,Tusculum Pioneers,596800,Lee Flames,596790,7,top,Jude Morton lined out to 2b (2-2 BBKK).,65,2025-04-08T00:00:00-04:00,"Olympic Field (Cleveland, TN)",167,MBA,2025
6346199,596790,Tusculum Pioneers,596800,Lee Flames,596790,7,top,Ryan Ortega grounded out to ss (0-1 K).,66,2025-04-08T00:00:00-04:00,"Olympic Field (Cleveland, TN)",167,MBA,2025
6346199,596790,Tusculum Pioneers,596800,Lee Flames,596800,7,bot,Brice Anders to p for Scout Martin.,67,2025-04-08T00:00:00-04:00,"Olympic Field (Cleveland, TN)",167,MBA,2025
6346199,596790,Tusculum Pioneers,596800,Lee Flames,596800,7,bot,T. Platt struck out swinging (1-2 KFBS).,68,2025-04-08T00:00:00-04:00,"Olympic Field (Cleveland, TN)",167,MBA,2025
6346199,596790,Tusculum Pioneers,596800,Lee Flames,596800,7,bot,R. Valdes walked (3-0 BBBB).,69,2025-04-08T00:00:00-04:00,"Olympic Field (Cleveland, TN)",167,MBA,2025
6346199,596790,Tusculum Pioneers,596800,Lee Flames,596800,7,bot,Mound Visit - Catcher.,70,2025-04-08T00:00:00-04:00,"Olympic Field (Cleveland, TN)",167,MBA,2025
6346199,596790,Tusculum Pioneers,596800,Lee Flames,596800,7,bot,A. Simmons hit by pitch (3-2 BBKBKFF); R. Valdes advanced to second.,71,2025-04-08T00:00:00-04:00,"Olympic Field (Cleveland, TN)",167,MBA,2025
6346199,596790,Tusculum Pioneers,596800,Lee Flames,596800,7,bot,JJ Williams reached on a fielder's choice to shortstop (0-0); A. Simmons advanced to second; R. Valdes out at third ss to 3b.,72,2025-04-08T00:00:00-04:00,"Olympic Field (Cleveland, TN)",167,MBA,2025
6346199,596790,Tusculum Pioneers,596800,Lee Flames,596800,7,bot,JJ Williams advanced to second on a wild pitch; A. Simmons advanced to third on a wild pitch.,73,2025-04-08T00:00:00-04:00,"Olympic Field (Cleveland, TN)",167,MBA,2025
6346199,596790,Tusculum Pioneers,596800,Lee Flames,596800,7,bot,L. Collier grounded out to ss (1-2 SBS).,74,2025-04-08T00:00:00-04:00,"Olympic Field (Cleveland, TN)",167,MBA,2025
6346199,596790,Tusculum Pioneers,596800,Lee Flames,596790,8,top,N. Smith to p for E. Bloomer.,75,2025-04-08T00:00:00-04:00,"Olympic Field (Cleveland, TN)",167,MBA,2025
6346199,596790,Tusculum Pioneers,596800,Lee Flames,596790,8,top,Ty Smith hit by pitch (0-1 K).,76,2025-04-08T00:00:00-04:00,"Olympic Field (Cleveland, TN)",167,MBA,2025
6346199,596790,Tusculum Pioneers,596800,Lee Flames,596790,8,top,C. Mulcahy singled through the left side (1-0 B); Ty Smith advanced to second.,77,2025-04-08T00:00:00-04:00,"Olympic Field (Cleveland, TN)",167,MBA,2025
6346199,596790,Tusculum Pioneers,596800,Lee Flames,596790,8,top,C. Mulcahy advanced to second on a wild pitch; Ty Smith advanced to third on a wild pitch.,78,2025-04-08T00:00:00-04:00,"Olympic Field (Cleveland, TN)",167,MBA,2025
6346199,596790,Tusculum Pioneers,596800,Lee Flames,596790,8,top,Infield In.,79,2025-04-08T00:00:00-04:00,"Olympic Field (Cleveland, TN)",167,MBA,2025
6346199,596790,Tusculum Pioneers,596800,Lee Flames,596790,8,top,J. Singleton grounded out to ss (3-2 BKBFBF).,80,2025-04-08T00:00:00-04:00,"Olympic Field (Cleveland, TN)",167,MBA,2025
6346199,596790,Tusculum Pioneers,596800,Lee Flames,596790,8,top,Infield In.,81,2025-04-08T00:00:00-04:00,"Olympic Field (Cleveland, TN)",167,MBA,2025
6346199,596790,Tusculum Pioneers,596800,Lee Flames,596790,8,top,"A. Collins doubled to right field, RBI (0-1 K); C. Mulcahy advanced to third; Ty Smith scored.",82,2025-04-08T00:00:00-04:00,"Olympic Field (Cleveland, TN)",167,MBA,2025
6346199,596790,Tusculum Pioneers,596800,Lee Flames,596790,8,top,Mound Visit - Catcher.,83,2025-04-08T00:00:00-04:00,"Olympic Field (Cleveland, TN)",167,MBA,2025
6346199,596790,Tusculum Pioneers,596800,Lee Flames,596790,8,top,D. White to p for N. Smith.,84,2025-04-08T00:00:00-04:00,"Olympic Field (Cleveland, TN)",167,MBA,2025
6346199,596790,Tusculum Pioneers,596800,Lee Flames,596790,8,top,Infield In.,85,2025-04-08T00:00:00-04:00,"Olympic Field (Cleveland, TN)",167,MBA,2025
6346199,596790,Tusculum Pioneers,596800,Lee Flames,596790,8,top,C. Webster struck out looking (2-2 BBKSFK).,86,2025-04-08T00:00:00-04:00,"Olympic Field (Cleveland, TN)",167,MBA,2025
6346199,596790,Tusculum Pioneers,596800,Lee Flames,596790,8,top,"Sawyer Pace doubled to left center, 2 RBI (1-2 SBS); A. Collins scored; C. Mulcahy scored.",87,2025-04-08T00:00:00-04:00,"Olympic Field (Cleveland, TN)",167,MBA,2025
6346199,596790,Tusculum Pioneers,596800,Lee Flames,596790,8,top,"Sawyer Pace out at third c to 3b, caught stealing.",88,2025-04-08T00:00:00-04:00,"Olympic Field (Cleveland, TN)",167,MBA,2025
6346199,596790,Tusculum Pioneers,596800,Lee Flames,596800,8,bot,Luis Reyes to cf for Ty Smith.,89,2025-04-08T00:00:00-04:00,"Olympic Field (Cleveland, TN)",167,MBA,2025
6346199,596790,Tusculum Pioneers,596800,Lee Flames,596800,8,bot,Caid Sanders to p for Brice Anders.,90,2025-04-08T00:00:00-04:00,"Olympic Field (Cleveland, TN)",167,MBA,2025
6346199,596790,Tusculum Pioneers,596800,Lee Flames,596800,8,bot,Doughman struck out swinging (1-2 BKFS).,91,2025-04-08T00:00:00-04:00,"Olympic Field (Cleveland, TN)",167,MBA,2025
6346199,596790,Tusculum Pioneers,596800,Lee Flames,596800,8,bot,B. Sisson popped up to ss to left field (1-1 KB).,92,2025-04-08T00:00:00-04:00,"Olympic Field (Cleveland, TN)",167,MBA,2025
6346199,596790,Tusculum Pioneers,596800,Lee Flames,596800,8,bot,M. Cloud struck out swinging (1-2 SKBS).,93,2025-04-08T00:00:00-04:00,"Olympic Field (Cleveland, TN)",167,MBA,2025
6346199,596790,Tusculum Pioneers,596800,Lee Flames,596790,9,top,J. Howard to p for D. White.,94,2025-04-08T00:00:00-04:00,"Olympic Field (Cleveland, TN)",167,MBA,2025
6346199,596790,Tusculum Pioneers,596800,Lee Flames,596790,9,top,O. Carreras doubled to left field (1-1 BK).,95,2025-04-08T00:00:00-04:00,"Olympic Field (Cleveland, TN)",167,MBA,2025
6346199,596790,Tusculum Pioneers,596800,Lee Flames,596790,9,top,Jude Morton struck out swinging (0-2 KFS).,96,2025-04-08T00:00:00-04:00,"Olympic Field (Cleveland, TN)",167,MBA,2025
6346199,596790,Tusculum Pioneers,596800,Lee Flames,596790,9,top,Ryan Ortega walked (3-1 BBBKB).,97,2025-04-08T00:00:00-04:00,"Olympic Field (Cleveland, TN)",167,MBA,2025
6346199,596790,Tusculum Pioneers,596800,Lee Flames,596790,9,top,Luis Reyes struck out swinging (1-2 SSFBS).,98,2025-04-08T00:00:00-04:00,"Olympic Field (Cleveland, TN)",167,MBA,2025
6346199,596790,Tusculum Pioneers,596800,Lee Flames,596790,9,top,C. Mulcahy struck out swinging (1-2 KBSS).,99,2025-04-08T00:00:00-04:00,"Olympic Field (Cleveland, TN)",167,MBA,2025
6346199,596790,Tusculum Pioneers,596800,Lee Flames,596800,9,bot,J. Miller flied out to lf (0-0).,100,2025-04-08T00:00:00-04:00,"Olympic Field (Cleveland, TN)",167,MBA,2025
6346199,596790,Tusculum Pioneers,596800,Lee Flames,596800,9,bot,"T. Platt struck out swinging, out at first c to 1b (1-2 KBKS).",101,2025-04-08T00:00:00-04:00,"Olympic Field (Cleveland, TN)",167,MBA,2025
6346199,596790,Tusculum Pioneers,596800,Lee Flames,596800,9,bot,Jack Gagen to c for A. Collins.,102,2025-04-08T00:00:00-04:00,"Olympic Field (Cleveland, TN)",167,MBA,2025
6346199,596790,Tusculum Pioneers,596800,Lee Flames,596800,9,bot,R. Valdes out at first 1b to p (2-2 BBFF).,103,2025-04-08T00:00:00-04:00,"Olympic Field (Cleveland, TN)",167,MBA,2025
