game_id,away_team_id,away_team_name,home_team_id,home_team_name,batting_team,inning,top_bot,event_text,event_num,game_datetime,stadium_name,attendance,sport_id,season
6347594,597336,Millsaps Majors,597100,Berry Vikings,597336,1,top,G. Berry struck out swinging.,1,2025-04-19T00:00:00-04:00,"William R. Bowdoin (Rome, GA)",125,MBA,2025
6347594,597336,Millsaps Majors,597100,Berry Vikings,597336,1,top,B. Pelle struck out swinging.,2,2025-04-19T00:00:00-04:00,"William R. Bowdoin (Rome, GA)",125,MBA,2025
6347594,597336,Millsaps Majors,597100,Berry Vikings,597336,1,top,C. Page grounded out to ss.,3,2025-04-19T00:00:00-04:00,"William R. Bowdoin (Rome, GA)",125,MBA,2025
6347594,597336,Millsaps Majors,597100,Berry Vikings,597100,1,bot,J. Garcia grounded out to 2b.,4,2025-04-19T00:00:00-04:00,"William R. Bowdoin (Rome, GA)",125,MBA,2025
6347594,597336,Millsaps Majors,597100,Berry Vikings,597100,1,bot,N. Brunswick grounded out to ss.,5,2025-04-19T00:00:00-04:00,"William R. Bowdoin (Rome, GA)",125,MBA,2025
6347594,597336,Millsaps Majors,597100,Berry Vikings,597100,1,bot,A. Pendleton grounded out to ss.,6,2025-04-19T00:00:00-04:00,"William R. Bowdoin (Rome, GA)",125,MBA,2025
6347594,597336,Millsaps Majors,597100,Berry Vikings,597336,2,top,E. Scott doubled to left field.,7,2025-04-19T00:00:00-04:00,"William R. Bowdoin (Rome, GA)",125,MBA,2025
6347594,597336,Millsaps Majors,597100,Berry Vikings,597336,2,top,E. Ousley struck out swinging.,8,2025-04-19T00:00:00-04:00,"William R. Bowdoin (Rome, GA)",125,MBA,2025
6347594,597336,Millsaps Majors,597100,Berry Vikings,597336,2,top,M. Morgan flied out to rf3a E. Scott advanced to third.,9,2025-04-19T00:00:00-04:00,"William R. Bowdoin (Rome, GA)",125,MBA,2025
6347594,597336,Millsaps Majors,597100,Berry Vikings,597336,2,top,J. Ware walked.,10,2025-04-19T00:00:00-04:00,"William R. Bowdoin (Rome, GA)",125,MBA,2025
6347594,597336,Millsaps Majors,597100,Berry Vikings,597336,2,top,B. Bounds reached on a fielder's choice3a J. Ware out at second ss to 2b.,11,2025-04-19T00:00:00-04:00,"William R. Bowdoin (Rome, GA)",125,MBA,2025
6347594,597336,Millsaps Majors,597100,Berry Vikings,597100,2,bot,R. Uhls singled up the middle.,12,2025-04-19T00:00:00-04:00,"William R. Bowdoin (Rome, GA)",125,MBA,2025
6347594,597336,Millsaps Majors,597100,Berry Vikings,597100,2,bot,"R. Uhls out at second c to 2b, caught stealing.",13,2025-04-19T00:00:00-04:00,"William R. Bowdoin (Rome, GA)",125,MBA,2025
6347594,597336,Millsaps Majors,597100,Berry Vikings,597100,2,bot,C. Pulaski doubled to right center.,14,2025-04-19T00:00:00-04:00,"William R. Bowdoin (Rome, GA)",125,MBA,2025
6347594,597336,Millsaps Majors,597100,Berry Vikings,597100,2,bot,C. Spikes walked.,15,2025-04-19T00:00:00-04:00,"William R. Bowdoin (Rome, GA)",125,MBA,2025
6347594,597336,Millsaps Majors,597100,Berry Vikings,597100,2,bot,T. Mukono struck out swinging.,16,2025-04-19T00:00:00-04:00,"William R. Bowdoin (Rome, GA)",125,MBA,2025
6347594,597336,Millsaps Majors,597100,Berry Vikings,597100,2,bot,A. Cloud flied out to rf.,17,2025-04-19T00:00:00-04:00,"William R. Bowdoin (Rome, GA)",125,MBA,2025
6347594,597336,Millsaps Majors,597100,Berry Vikings,597336,3,top,B. Greene to p for A. Moraitaki.,18,2025-04-19T00:00:00-04:00,"William R. Bowdoin (Rome, GA)",125,MBA,2025
6347594,597336,Millsaps Majors,597100,Berry Vikings,597336,3,top,D. Abbadessa grounded out to p.,19,2025-04-19T00:00:00-04:00,"William R. Bowdoin (Rome, GA)",125,MBA,2025
6347594,597336,Millsaps Majors,597100,Berry Vikings,597336,3,top,G. Berry singled through the right side.,20,2025-04-19T00:00:00-04:00,"William R. Bowdoin (Rome, GA)",125,MBA,2025
6347594,597336,Millsaps Majors,597100,Berry Vikings,597336,3,top,B. Pelle singled to left field3a G. Berry advanced to second.,21,2025-04-19T00:00:00-04:00,"William R. Bowdoin (Rome, GA)",125,MBA,2025
6347594,597336,Millsaps Majors,597100,Berry Vikings,597336,3,top,B. Pelle stole second3a G. Berry stole third.,22,2025-04-19T00:00:00-04:00,"William R. Bowdoin (Rome, GA)",125,MBA,2025
6347594,597336,Millsaps Majors,597100,Berry Vikings,597336,3,top,C. Page struck out looking.,23,2025-04-19T00:00:00-04:00,"William R. Bowdoin (Rome, GA)",125,MBA,2025
6347594,597336,Millsaps Majors,597100,Berry Vikings,597336,3,top,E. Scott flied out to cf.,24,2025-04-19T00:00:00-04:00,"William R. Bowdoin (Rome, GA)",125,MBA,2025
6347594,597336,Millsaps Majors,597100,Berry Vikings,597100,3,bot,G. Lang struck out swinging.,25,2025-04-19T00:00:00-04:00,"William R. Bowdoin (Rome, GA)",125,MBA,2025
6347594,597336,Millsaps Majors,597100,Berry Vikings,597100,3,bot,J. Garcia singled to center field.,26,2025-04-19T00:00:00-04:00,"William R. Bowdoin (Rome, GA)",125,MBA,2025
6347594,597336,Millsaps Majors,597100,Berry Vikings,597100,3,bot,N. Brunswick walked3a J. Garcia advanced to second.,27,2025-04-19T00:00:00-04:00,"William R. Bowdoin (Rome, GA)",125,MBA,2025
6347594,597336,Millsaps Majors,597100,Berry Vikings,597100,3,bot,"N. Brunswick advanced to second on the error3a J. Garcia advanced to third on an error by p, failed pickoff attempt.",28,2025-04-19T00:00:00-04:00,"William R. Bowdoin (Rome, GA)",125,MBA,2025
6347594,597336,Millsaps Majors,597100,Berry Vikings,597100,3,bot,A. Pendleton struck out swinging.,29,2025-04-19T00:00:00-04:00,"William R. Bowdoin (Rome, GA)",125,MBA,2025
6347594,597336,Millsaps Majors,597100,Berry Vikings,597100,3,bot,"R. Uhls singled through the right side, 2 RBI3a N. Brunswick scored, unearned3a J. Garcia scored.",30,2025-04-19T00:00:00-04:00,"William R. Bowdoin (Rome, GA)",125,MBA,2025
6347594,597336,Millsaps Majors,597100,Berry Vikings,597100,3,bot,R. Uhls advanced to second on a wild pitch.,31,2025-04-19T00:00:00-04:00,"William R. Bowdoin (Rome, GA)",125,MBA,2025
6347594,597336,Millsaps Majors,597100,Berry Vikings,597100,3,bot,C. Pulaski walked.,32,2025-04-19T00:00:00-04:00,"William R. Bowdoin (Rome, GA)",125,MBA,2025
6347594,597336,Millsaps Majors,597100,Berry Vikings,597100,3,bot,C. Spikes flied out to cf.,33,2025-04-19T00:00:00-04:00,"William R. Bowdoin (Rome, GA)",125,MBA,2025
6347594,597336,Millsaps Majors,597100,Berry Vikings,597336,4,top,E. Ousley struck out swinging.,34,2025-04-19T00:00:00-04:00,"William R. Bowdoin (Rome, GA)",125,MBA,2025
6347594,597336,Millsaps Majors,597100,Berry Vikings,597336,4,top,M. Morgan doubled down the lf line.,35,2025-04-19T00:00:00-04:00,"William R. Bowdoin (Rome, GA)",125,MBA,2025
6347594,597336,Millsaps Majors,597100,Berry Vikings,597336,4,top,J. Ware walked3a M. Morgan advanced to third on a wild pitch.,36,2025-04-19T00:00:00-04:00,"William R. Bowdoin (Rome, GA)",125,MBA,2025
6347594,597336,Millsaps Majors,597100,Berry Vikings,597336,4,top,"B. Bounds homered to left field, 3 RBI3a J. Ware scored3a M. Morgan scored.",37,2025-04-19T00:00:00-04:00,"William R. Bowdoin (Rome, GA)",125,MBA,2025
6347594,597336,Millsaps Majors,597100,Berry Vikings,597336,4,top,D. Abbadessa flied out to cf.,38,2025-04-19T00:00:00-04:00,"William R. Bowdoin (Rome, GA)",125,MBA,2025
6347594,597336,Millsaps Majors,597100,Berry Vikings,597336,4,top,G. Berry grounded out to 3b.,39,2025-04-19T00:00:00-04:00,"William R. Bowdoin (Rome, GA)",125,MBA,2025
6347594,597336,Millsaps Majors,597100,Berry Vikings,597100,4,bot,T. Mukono struck out swinging.,40,2025-04-19T00:00:00-04:00,"William R. Bowdoin (Rome, GA)",125,MBA,2025
6347594,597336,Millsaps Majors,597100,Berry Vikings,597100,4,bot,A. Cloud lined out to rf.,41,2025-04-19T00:00:00-04:00,"William R. Bowdoin (Rome, GA)",125,MBA,2025
6347594,597336,Millsaps Majors,597100,Berry Vikings,597100,4,bot,G. Lang flied out to rf.,42,2025-04-19T00:00:00-04:00,"William R. Bowdoin (Rome, GA)",125,MBA,2025
6347594,597336,Millsaps Majors,597100,Berry Vikings,597336,5,top,C. Porter to p for B. Greene.,43,2025-04-19T00:00:00-04:00,"William R. Bowdoin (Rome, GA)",125,MBA,2025
6347594,597336,Millsaps Majors,597100,Berry Vikings,597336,5,top,B. Pelle flied out to lf.,44,2025-04-19T00:00:00-04:00,"William R. Bowdoin (Rome, GA)",125,MBA,2025
6347594,597336,Millsaps Majors,597100,Berry Vikings,597336,5,top,C. Page grounded out to 2b.,45,2025-04-19T00:00:00-04:00,"William R. Bowdoin (Rome, GA)",125,MBA,2025
6347594,597336,Millsaps Majors,597100,Berry Vikings,597336,5,top,E. Scott flied out to lf.,46,2025-04-19T00:00:00-04:00,"William R. Bowdoin (Rome, GA)",125,MBA,2025
6347594,597336,Millsaps Majors,597100,Berry Vikings,597100,5,bot,J. Garcia grounded out to ss.,47,2025-04-19T00:00:00-04:00,"William R. Bowdoin (Rome, GA)",125,MBA,2025
6347594,597336,Millsaps Majors,597100,Berry Vikings,597100,5,bot,N. Brunswick doubled to left field.,48,2025-04-19T00:00:00-04:00,"William R. Bowdoin (Rome, GA)",125,MBA,2025
6347594,597336,Millsaps Majors,597100,Berry Vikings,597100,5,bot,A. Pendleton flied out to cf.,49,2025-04-19T00:00:00-04:00,"William R. Bowdoin (Rome, GA)",125,MBA,2025
6347594,597336,Millsaps Majors,597100,Berry Vikings,597100,5,bot,R. Uhls was intentionally walked.,50,2025-04-19T00:00:00-04:00,"William R. Bowdoin (Rome, GA)",125,MBA,2025
6347594,597336,Millsaps Majors,597100,Berry Vikings,597100,5,bot,C. Pulaski walked3a R. Uhls advanced to second3a N. Brunswick advanced to third.,51,2025-04-19T00:00:00-04:00,"William R. Bowdoin (Rome, GA)",125,MBA,2025
6347594,597336,Millsaps Majors,597100,Berry Vikings,597100,5,bot,S. Thomas to p for S. Bonnecaze.,52,2025-04-19T00:00:00-04:00,"William R. Bowdoin (Rome, GA)",125,MBA,2025
6347594,597336,Millsaps Majors,597100,Berry Vikings,597100,5,bot,"C. Spikes hit by pitch, RBI3a C. Pulaski advanced to second3a R. Uhls advanced to third3a N. Brunswick scored.",53,2025-04-19T00:00:00-04:00,"William R. Bowdoin (Rome, GA)",125,MBA,2025
6347594,597336,Millsaps Majors,597100,Berry Vikings,597100,5,bot,C. Edmonds pinch hit for T. Mukono.,54,2025-04-19T00:00:00-04:00,"William R. Bowdoin (Rome, GA)",125,MBA,2025
6347594,597336,Millsaps Majors,597100,Berry Vikings,597100,5,bot,C. Edmonds grounded out to 2b.,55,2025-04-19T00:00:00-04:00,"William R. Bowdoin (Rome, GA)",125,MBA,2025
6347594,597336,Millsaps Majors,597100,Berry Vikings,597336,6,top,N. Brunswick to cf.,56,2025-04-19T00:00:00-04:00,"William R. Bowdoin (Rome, GA)",125,MBA,2025
6347594,597336,Millsaps Majors,597100,Berry Vikings,597336,6,top,J. Bridges to rf for C. Edmonds.,57,2025-04-19T00:00:00-04:00,"William R. Bowdoin (Rome, GA)",125,MBA,2025
6347594,597336,Millsaps Majors,597100,Berry Vikings,597336,6,top,E. Ousley singled to right field.,58,2025-04-19T00:00:00-04:00,"William R. Bowdoin (Rome, GA)",125,MBA,2025
6347594,597336,Millsaps Majors,597100,Berry Vikings,597336,6,top,"M. Morgan grounded out to 3b, SAC, bunt3a E. Ousley advanced to second.",59,2025-04-19T00:00:00-04:00,"William R. Bowdoin (Rome, GA)",125,MBA,2025
6347594,597336,Millsaps Majors,597100,Berry Vikings,597336,6,top,J. Ware singled to center field3a E. Ousley advanced to third.,60,2025-04-19T00:00:00-04:00,"William R. Bowdoin (Rome, GA)",125,MBA,2025
6347594,597336,Millsaps Majors,597100,Berry Vikings,597336,6,top,B. Bounds hit by pitch3a J. Ware advanced to second.,61,2025-04-19T00:00:00-04:00,"William R. Bowdoin (Rome, GA)",125,MBA,2025
6347594,597336,Millsaps Majors,597100,Berry Vikings,597336,6,top,D. Abbadessa struck out swinging.,62,2025-04-19T00:00:00-04:00,"William R. Bowdoin (Rome, GA)",125,MBA,2025
6347594,597336,Millsaps Majors,597100,Berry Vikings,597336,6,top,G. Berry flied out to cf.,63,2025-04-19T00:00:00-04:00,"William R. Bowdoin (Rome, GA)",125,MBA,2025
6347594,597336,Millsaps Majors,597100,Berry Vikings,597100,6,bot,A. Cloud flied out to rf.,64,2025-04-19T00:00:00-04:00,"William R. Bowdoin (Rome, GA)",125,MBA,2025
6347594,597336,Millsaps Majors,597100,Berry Vikings,597100,6,bot,G. Lang lined out to rf.,65,2025-04-19T00:00:00-04:00,"William R. Bowdoin (Rome, GA)",125,MBA,2025
6347594,597336,Millsaps Majors,597100,Berry Vikings,597100,6,bot,J. Garcia flied out to cf.,66,2025-04-19T00:00:00-04:00,"William R. Bowdoin (Rome, GA)",125,MBA,2025
6347594,597336,Millsaps Majors,597100,Berry Vikings,597336,7,top,T. Cassidy to p for C. Porter.,67,2025-04-19T00:00:00-04:00,"William R. Bowdoin (Rome, GA)",125,MBA,2025
6347594,597336,Millsaps Majors,597100,Berry Vikings,597336,7,top,B. Pelle singled up the middle.,68,2025-04-19T00:00:00-04:00,"William R. Bowdoin (Rome, GA)",125,MBA,2025
6347594,597336,Millsaps Majors,597100,Berry Vikings,597336,7,top,C. Page grounded out ss to 2b to 1b3a B. Pelle advanced to second.,69,2025-04-19T00:00:00-04:00,"William R. Bowdoin (Rome, GA)",125,MBA,2025
6347594,597336,Millsaps Majors,597100,Berry Vikings,597336,7,top,E. Scott walked.,70,2025-04-19T00:00:00-04:00,"William R. Bowdoin (Rome, GA)",125,MBA,2025
6347594,597336,Millsaps Majors,597100,Berry Vikings,597336,7,top,E. Ousley grounded into double play 2b to ss to 1b3a E. Scott out on the play.,71,2025-04-19T00:00:00-04:00,"William R. Bowdoin (Rome, GA)",125,MBA,2025
6347594,597336,Millsaps Majors,597100,Berry Vikings,597100,7,bot,"N. Brunswick homered to right center, RBI.",72,2025-04-19T00:00:00-04:00,"William R. Bowdoin (Rome, GA)",125,MBA,2025
6347594,597336,Millsaps Majors,597100,Berry Vikings,597100,7,bot,A. Pendleton flied out to cf.,73,2025-04-19T00:00:00-04:00,"William R. Bowdoin (Rome, GA)",125,MBA,2025
6347594,597336,Millsaps Majors,597100,Berry Vikings,597100,7,bot,R. Uhls grounded out to ss.,74,2025-04-19T00:00:00-04:00,"William R. Bowdoin (Rome, GA)",125,MBA,2025
6347594,597336,Millsaps Majors,597100,Berry Vikings,597100,7,bot,C. Pulaski struck out looking.,75,2025-04-19T00:00:00-04:00,"William R. Bowdoin (Rome, GA)",125,MBA,2025
6347594,597336,Millsaps Majors,597100,Berry Vikings,597336,8,top,M. Morgan walked.,76,2025-04-19T00:00:00-04:00,"William R. Bowdoin (Rome, GA)",125,MBA,2025
6347594,597336,Millsaps Majors,597100,Berry Vikings,597336,8,top,J. Ware walked3a M. Morgan advanced to second.,77,2025-04-19T00:00:00-04:00,"William R. Bowdoin (Rome, GA)",125,MBA,2025
6347594,597336,Millsaps Majors,597100,Berry Vikings,597336,8,top,B. Bounds flied out to rf3a M. Morgan advanced to third.,78,2025-04-19T00:00:00-04:00,"William R. Bowdoin (Rome, GA)",125,MBA,2025
6347594,597336,Millsaps Majors,597100,Berry Vikings,597336,8,top,"D. Abbadessa reached on a fielder's choice to first base, bunt, RBI3a J. Ware advanced to second3a M. Morgan scored.",79,2025-04-19T00:00:00-04:00,"William R. Bowdoin (Rome, GA)",125,MBA,2025
6347594,597336,Millsaps Majors,597100,Berry Vikings,597336,8,top,G. Berry flied out to lf.,80,2025-04-19T00:00:00-04:00,"William R. Bowdoin (Rome, GA)",125,MBA,2025
6347594,597336,Millsaps Majors,597100,Berry Vikings,597336,8,top,B. Pelle grounded out to 2b.,81,2025-04-19T00:00:00-04:00,"William R. Bowdoin (Rome, GA)",125,MBA,2025
6347594,597336,Millsaps Majors,597100,Berry Vikings,597100,8,bot,C. Spikes popped up to 2b.,82,2025-04-19T00:00:00-04:00,"William R. Bowdoin (Rome, GA)",125,MBA,2025
6347594,597336,Millsaps Majors,597100,Berry Vikings,597100,8,bot,J. Bridges singled through the left side.,83,2025-04-19T00:00:00-04:00,"William R. Bowdoin (Rome, GA)",125,MBA,2025
6347594,597336,Millsaps Majors,597100,Berry Vikings,597100,8,bot,E. Finch pinch hit for A. Cloud.,84,2025-04-19T00:00:00-04:00,"William R. Bowdoin (Rome, GA)",125,MBA,2025
6347594,597336,Millsaps Majors,597100,Berry Vikings,597100,8,bot,E. Finch singled through the right side3a J. Bridges advanced to third.,85,2025-04-19T00:00:00-04:00,"William R. Bowdoin (Rome, GA)",125,MBA,2025
6347594,597336,Millsaps Majors,597100,Berry Vikings,597100,8,bot,E. Finch stole second.,86,2025-04-19T00:00:00-04:00,"William R. Bowdoin (Rome, GA)",125,MBA,2025
6347594,597336,Millsaps Majors,597100,Berry Vikings,597100,8,bot,G. Lang struck out looking.,87,2025-04-19T00:00:00-04:00,"William R. Bowdoin (Rome, GA)",125,MBA,2025
6347594,597336,Millsaps Majors,597100,Berry Vikings,597100,8,bot,F. Fields to p for S. Thomas.,88,2025-04-19T00:00:00-04:00,"William R. Bowdoin (Rome, GA)",125,MBA,2025
6347594,597336,Millsaps Majors,597100,Berry Vikings,597100,8,bot,J. Garcia fouled out to rf.,89,2025-04-19T00:00:00-04:00,"William R. Bowdoin (Rome, GA)",125,MBA,2025
6347594,597336,Millsaps Majors,597100,Berry Vikings,597336,9,top,E. Finch to 3b.,90,2025-04-19T00:00:00-04:00,"William R. Bowdoin (Rome, GA)",125,MBA,2025
6347594,597336,Millsaps Majors,597100,Berry Vikings,597336,9,top,N. Angelakos to p for T. Cassidy.,91,2025-04-19T00:00:00-04:00,"William R. Bowdoin (Rome, GA)",125,MBA,2025
6347594,597336,Millsaps Majors,597100,Berry Vikings,597336,9,top,C. Page struck out swinging.,92,2025-04-19T00:00:00-04:00,"William R. Bowdoin (Rome, GA)",125,MBA,2025
6347594,597336,Millsaps Majors,597100,Berry Vikings,597336,9,top,E. Scott walked.,93,2025-04-19T00:00:00-04:00,"William R. Bowdoin (Rome, GA)",125,MBA,2025
6347594,597336,Millsaps Majors,597100,Berry Vikings,597336,9,top,W. Grant pinch ran for E. Scott.,94,2025-04-19T00:00:00-04:00,"William R. Bowdoin (Rome, GA)",125,MBA,2025
6347594,597336,Millsaps Majors,597100,Berry Vikings,597336,9,top,E. Ousley walked3a W. Grant advanced to second.,95,2025-04-19T00:00:00-04:00,"William R. Bowdoin (Rome, GA)",125,MBA,2025
6347594,597336,Millsaps Majors,597100,Berry Vikings,597336,9,top,J. Strydom to p for N. Angelakos.,96,2025-04-19T00:00:00-04:00,"William R. Bowdoin (Rome, GA)",125,MBA,2025
6347594,597336,Millsaps Majors,597100,Berry Vikings,597336,9,top,"M. Morgan singled to left field, RBI3a E. Ousley advanced to second3a W. Grant scored.",97,2025-04-19T00:00:00-04:00,"William R. Bowdoin (Rome, GA)",125,MBA,2025
6347594,597336,Millsaps Majors,597100,Berry Vikings,597336,9,top,M. Morgan advanced to second3a E. Ousley advanced to third on a wild pitch.,98,2025-04-19T00:00:00-04:00,"William R. Bowdoin (Rome, GA)",125,MBA,2025
6347594,597336,Millsaps Majors,597100,Berry Vikings,597336,9,top,"J. Ware flied out to rf, sacrifice fly, RBI3a M. Morgan advanced to third3a E. Ousley scored.",99,2025-04-19T00:00:00-04:00,"William R. Bowdoin (Rome, GA)",125,MBA,2025
6347594,597336,Millsaps Majors,597100,Berry Vikings,597336,9,top,B. Bounds struck out swinging.,100,2025-04-19T00:00:00-04:00,"William R. Bowdoin (Rome, GA)",125,MBA,2025
6347594,597336,Millsaps Majors,597100,Berry Vikings,597100,9,bot,N. Brunswick singled up the middle.,101,2025-04-19T00:00:00-04:00,"William R. Bowdoin (Rome, GA)",125,MBA,2025
6347594,597336,Millsaps Majors,597100,Berry Vikings,597100,9,bot,A. Pendleton grounded into double play 2b to ss to 1b3a N. Brunswick out on the play.,102,2025-04-19T00:00:00-04:00,"William R. Bowdoin (Rome, GA)",125,MBA,2025
6347594,597336,Millsaps Majors,597100,Berry Vikings,597100,9,bot,R. Uhls grounded out to ss.,103,2025-04-19T00:00:00-04:00,"William R. Bowdoin (Rome, GA)",125,MBA,2025
