game_id,away_team_id,away_team_name,home_team_id,home_team_name,batting_team,inning,top_bot,event_text,event_num,game_datetime,stadium_name,attendance,sport_id,season
6347138,597173,Texas-Dallas Comets,597293,Hardin-Simmons Cowboys,597173,1,top,A. Garza grounded out to 2b (2-2 KBFB).,1,2025-04-16T00:00:00-04:00,"Hunter Field  (Abilene, TX)",121,MBA,2025
6347138,597173,Texas-Dallas Comets,597293,Hardin-Simmons Cowboys,597173,1,top,Rexin doubled to right field (1-1 KB).,2,2025-04-16T00:00:00-04:00,"Hunter Field  (Abilene, TX)",121,MBA,2025
6347138,597173,Texas-Dallas Comets,597293,Hardin-Simmons Cowboys,597173,1,top,McCown grounded out to p (2-2 BKBS)3a Rexin advanced to third.,3,2025-04-16T00:00:00-04:00,"Hunter Field  (Abilene, TX)",121,MBA,2025
6347138,597173,Texas-Dallas Comets,597293,Hardin-Simmons Cowboys,597173,1,top,Kinnison grounded out to ss (2-2 KKBB).,4,2025-04-16T00:00:00-04:00,"Hunter Field  (Abilene, TX)",121,MBA,2025
6347138,597173,Texas-Dallas Comets,597293,Hardin-Simmons Cowboys,597293,1,bot,McGraw tripled to right center (1-1 KB).,5,2025-04-16T00:00:00-04:00,"Hunter Field  (Abilene, TX)",121,MBA,2025
6347138,597173,Texas-Dallas Comets,597293,Hardin-Simmons Cowboys,597293,1,bot,"Vaughan grounded out to 2b, RBI (1-0 B)3a McGraw scored.",6,2025-04-16T00:00:00-04:00,"Hunter Field  (Abilene, TX)",121,MBA,2025
6347138,597173,Texas-Dallas Comets,597293,Hardin-Simmons Cowboys,597293,1,bot,"Calvillo singled to left field, advanced to second on a throwing error by lf (2-0 BB).",7,2025-04-16T00:00:00-04:00,"Hunter Field  (Abilene, TX)",121,MBA,2025
6347138,597173,Texas-Dallas Comets,597293,Hardin-Simmons Cowboys,597293,1,bot,Blancaflor fouled out to 1b (0-0).,8,2025-04-16T00:00:00-04:00,"Hunter Field  (Abilene, TX)",121,MBA,2025
6347138,597173,Texas-Dallas Comets,597293,Hardin-Simmons Cowboys,597293,1,bot,Hollingswort grounded out to ss (1-0 B).,9,2025-04-16T00:00:00-04:00,"Hunter Field  (Abilene, TX)",121,MBA,2025
6347138,597173,Texas-Dallas Comets,597293,Hardin-Simmons Cowboys,597173,2,top,N. Fernandez flied out to cf (0-2 FK).,10,2025-04-16T00:00:00-04:00,"Hunter Field  (Abilene, TX)",121,MBA,2025
6347138,597173,Texas-Dallas Comets,597293,Hardin-Simmons Cowboys,597173,2,top,Wallace out at first 1b to p (0-0).,11,2025-04-16T00:00:00-04:00,"Hunter Field  (Abilene, TX)",121,MBA,2025
6347138,597173,Texas-Dallas Comets,597293,Hardin-Simmons Cowboys,597173,2,top,Chatman grounded out to 3b (3-2 FBBFBF).,12,2025-04-16T00:00:00-04:00,"Hunter Field  (Abilene, TX)",121,MBA,2025
6347138,597173,Texas-Dallas Comets,597293,Hardin-Simmons Cowboys,597293,2,bot,Trapani walked (3-0 BBBB).,13,2025-04-16T00:00:00-04:00,"Hunter Field  (Abilene, TX)",121,MBA,2025
6347138,597173,Texas-Dallas Comets,597293,Hardin-Simmons Cowboys,597293,2,bot,Negron singled through the left side (0-0)3a Trapani advanced to second.,14,2025-04-16T00:00:00-04:00,"Hunter Field  (Abilene, TX)",121,MBA,2025
6347138,597173,Texas-Dallas Comets,597293,Hardin-Simmons Cowboys,597293,2,bot,Negron advanced to second on a wild pitch3a Trapani advanced to third on a wild pitch.,15,2025-04-16T00:00:00-04:00,"Hunter Field  (Abilene, TX)",121,MBA,2025
6347138,597173,Texas-Dallas Comets,597293,Hardin-Simmons Cowboys,597293,2,bot,"White reached on a fielding error by 3b, RBI (2-2 BKBK)3a Negron advanced to third3a Trapani scored.",16,2025-04-16T00:00:00-04:00,"Hunter Field  (Abilene, TX)",121,MBA,2025
6347138,597173,Texas-Dallas Comets,597293,Hardin-Simmons Cowboys,597293,2,bot,"Kirkbride grounded into double play ss to 2b to 1b (3-2 BBFBF)3a White out on the play3a Negron scored, unearned.",17,2025-04-16T00:00:00-04:00,"Hunter Field  (Abilene, TX)",121,MBA,2025
6347138,597173,Texas-Dallas Comets,597293,Hardin-Simmons Cowboys,597293,2,bot,McGraw lined out to 3b (0-0).,18,2025-04-16T00:00:00-04:00,"Hunter Field  (Abilene, TX)",121,MBA,2025
6347138,597173,Texas-Dallas Comets,597293,Hardin-Simmons Cowboys,597173,3,top,Montee lined out to lf (1-2 KBF).,19,2025-04-16T00:00:00-04:00,"Hunter Field  (Abilene, TX)",121,MBA,2025
6347138,597173,Texas-Dallas Comets,597293,Hardin-Simmons Cowboys,597173,3,top,Soto out at first p to 2b to 1b (3-1 BKBB).,20,2025-04-16T00:00:00-04:00,"Hunter Field  (Abilene, TX)",121,MBA,2025
6347138,597173,Texas-Dallas Comets,597293,Hardin-Simmons Cowboys,597173,3,top,A. Garza grounded out to 1b unassisted (1-2 KBK).,21,2025-04-16T00:00:00-04:00,"Hunter Field  (Abilene, TX)",121,MBA,2025
6347138,597173,Texas-Dallas Comets,597293,Hardin-Simmons Cowboys,597293,3,bot,Vaughan grounded out to ss (0-1 F).,22,2025-04-16T00:00:00-04:00,"Hunter Field  (Abilene, TX)",121,MBA,2025
6347138,597173,Texas-Dallas Comets,597293,Hardin-Simmons Cowboys,597293,3,bot,Calvillo out at first 1b to p (0-1 K).,23,2025-04-16T00:00:00-04:00,"Hunter Field  (Abilene, TX)",121,MBA,2025
6347138,597173,Texas-Dallas Comets,597293,Hardin-Simmons Cowboys,597293,3,bot,Blancaflor singled up the middle (0-1 K).,24,2025-04-16T00:00:00-04:00,"Hunter Field  (Abilene, TX)",121,MBA,2025
6347138,597173,Texas-Dallas Comets,597293,Hardin-Simmons Cowboys,597293,3,bot,Blancaflor stole second.,25,2025-04-16T00:00:00-04:00,"Hunter Field  (Abilene, TX)",121,MBA,2025
6347138,597173,Texas-Dallas Comets,597293,Hardin-Simmons Cowboys,597293,3,bot,Hollingswort flied out to rf (0-0).,26,2025-04-16T00:00:00-04:00,"Hunter Field  (Abilene, TX)",121,MBA,2025
6347138,597173,Texas-Dallas Comets,597293,Hardin-Simmons Cowboys,597173,4,top,Rexin grounded out to 3b (0-1 F).,27,2025-04-16T00:00:00-04:00,"Hunter Field  (Abilene, TX)",121,MBA,2025
6347138,597173,Texas-Dallas Comets,597293,Hardin-Simmons Cowboys,597173,4,top,McCown singled to left field (0-1 K).,28,2025-04-16T00:00:00-04:00,"Hunter Field  (Abilene, TX)",121,MBA,2025
6347138,597173,Texas-Dallas Comets,597293,Hardin-Simmons Cowboys,597173,4,top,"Kinnison reached on a throwing error by 3b, advanced to second (1-1 BF)3a McCown advanced to third.",29,2025-04-16T00:00:00-04:00,"Hunter Field  (Abilene, TX)",121,MBA,2025
6347138,597173,Texas-Dallas Comets,597293,Hardin-Simmons Cowboys,597173,4,top,"N. Fernandez grounded out to 1b unassisted, RBI (2-1 BBS)3a Kinnison advanced to third3a McCown scored, unearned.",30,2025-04-16T00:00:00-04:00,"Hunter Field  (Abilene, TX)",121,MBA,2025
6347138,597173,Texas-Dallas Comets,597293,Hardin-Simmons Cowboys,597173,4,top,Wallace lined out to 2b (0-0).,31,2025-04-16T00:00:00-04:00,"Hunter Field  (Abilene, TX)",121,MBA,2025
6347138,597173,Texas-Dallas Comets,597293,Hardin-Simmons Cowboys,597293,4,bot,Trapani grounded out to 3b (2-1 FBB).,32,2025-04-16T00:00:00-04:00,"Hunter Field  (Abilene, TX)",121,MBA,2025
6347138,597173,Texas-Dallas Comets,597293,Hardin-Simmons Cowboys,597293,4,bot,Negron grounded out to 3b (0-0).,33,2025-04-16T00:00:00-04:00,"Hunter Field  (Abilene, TX)",121,MBA,2025
6347138,597173,Texas-Dallas Comets,597293,Hardin-Simmons Cowboys,597293,4,bot,White singled through the left side (1-1 KB).,34,2025-04-16T00:00:00-04:00,"Hunter Field  (Abilene, TX)",121,MBA,2025
6347138,597173,Texas-Dallas Comets,597293,Hardin-Simmons Cowboys,597293,4,bot,Kirkbride grounded out to ss (0-1 K).,35,2025-04-16T00:00:00-04:00,"Hunter Field  (Abilene, TX)",121,MBA,2025
6347138,597173,Texas-Dallas Comets,597293,Hardin-Simmons Cowboys,597173,5,top,Chatman walked (3-1 KBBBB).,36,2025-04-16T00:00:00-04:00,"Hunter Field  (Abilene, TX)",121,MBA,2025
6347138,597173,Texas-Dallas Comets,597293,Hardin-Simmons Cowboys,597173,5,top,Montee popped up to p (2-2 KBBK).,37,2025-04-16T00:00:00-04:00,"Hunter Field  (Abilene, TX)",121,MBA,2025
6347138,597173,Texas-Dallas Comets,597293,Hardin-Simmons Cowboys,597173,5,top,"Soto tripled to right center, RBI (2-0 BB)3a Chatman scored.",38,2025-04-16T00:00:00-04:00,"Hunter Field  (Abilene, TX)",121,MBA,2025
6347138,597173,Texas-Dallas Comets,597293,Hardin-Simmons Cowboys,597173,5,top,"A. Garza grounded out to 2b, RBI3a Soto scored.",39,2025-04-16T00:00:00-04:00,"Hunter Field  (Abilene, TX)",121,MBA,2025
6347138,597173,Texas-Dallas Comets,597293,Hardin-Simmons Cowboys,597173,5,top,Rexin grounded out to ss (0-0).,40,2025-04-16T00:00:00-04:00,"Hunter Field  (Abilene, TX)",121,MBA,2025
6347138,597173,Texas-Dallas Comets,597293,Hardin-Simmons Cowboys,597293,5,bot,McGraw struck out looking (2-2 BKFBK).,41,2025-04-16T00:00:00-04:00,"Hunter Field  (Abilene, TX)",121,MBA,2025
6347138,597173,Texas-Dallas Comets,597293,Hardin-Simmons Cowboys,597293,5,bot,Vaughan singled to third base (0-0).,42,2025-04-16T00:00:00-04:00,"Hunter Field  (Abilene, TX)",121,MBA,2025
6347138,597173,Texas-Dallas Comets,597293,Hardin-Simmons Cowboys,597293,5,bot,Calvillo doubled to left center3a Vaughan advanced to third.,43,2025-04-16T00:00:00-04:00,"Hunter Field  (Abilene, TX)",121,MBA,2025
6347138,597173,Texas-Dallas Comets,597293,Hardin-Simmons Cowboys,597293,5,bot,"Blancaflor homered to right center, 3 RBI (0-0)3a Calvillo scored3a Vaughan scored.",44,2025-04-16T00:00:00-04:00,"Hunter Field  (Abilene, TX)",121,MBA,2025
6347138,597173,Texas-Dallas Comets,597293,Hardin-Simmons Cowboys,597293,5,bot,Hollingswort grounded out to ss (0-1 F).,45,2025-04-16T00:00:00-04:00,"Hunter Field  (Abilene, TX)",121,MBA,2025
6347138,597173,Texas-Dallas Comets,597293,Hardin-Simmons Cowboys,597293,5,bot,Trapani singled to right center (0-0).,46,2025-04-16T00:00:00-04:00,"Hunter Field  (Abilene, TX)",121,MBA,2025
6347138,597173,Texas-Dallas Comets,597293,Hardin-Simmons Cowboys,597293,5,bot,Negron hit by pitch (1-0 B)3a Trapani advanced to second.,47,2025-04-16T00:00:00-04:00,"Hunter Field  (Abilene, TX)",121,MBA,2025
6347138,597173,Texas-Dallas Comets,597293,Hardin-Simmons Cowboys,597293,5,bot,White flied out to cf (0-1 K).,48,2025-04-16T00:00:00-04:00,"Hunter Field  (Abilene, TX)",121,MBA,2025
6347138,597173,Texas-Dallas Comets,597293,Hardin-Simmons Cowboys,597173,6,top,"McCown homered to left field, RBI (0-0).",49,2025-04-16T00:00:00-04:00,"Hunter Field  (Abilene, TX)",121,MBA,2025
6347138,597173,Texas-Dallas Comets,597293,Hardin-Simmons Cowboys,597173,6,top,Kinnison doubled to right center (1-2 KBFF).,50,2025-04-16T00:00:00-04:00,"Hunter Field  (Abilene, TX)",121,MBA,2025
6347138,597173,Texas-Dallas Comets,597293,Hardin-Simmons Cowboys,597173,6,top,N. Fernandez fouled out to 3b (3-1 BKBB).,51,2025-04-16T00:00:00-04:00,"Hunter Field  (Abilene, TX)",121,MBA,2025
6347138,597173,Texas-Dallas Comets,597293,Hardin-Simmons Cowboys,597173,6,top,Wallace struck out swinging (2-2 FFBBS).,52,2025-04-16T00:00:00-04:00,"Hunter Field  (Abilene, TX)",121,MBA,2025
6347138,597173,Texas-Dallas Comets,597293,Hardin-Simmons Cowboys,597173,6,top,Chatman walked (3-1 SBBBB).,53,2025-04-16T00:00:00-04:00,"Hunter Field  (Abilene, TX)",121,MBA,2025
6347138,597173,Texas-Dallas Comets,597293,Hardin-Simmons Cowboys,597173,6,top,Posey to p for Jack Kimsey.,54,2025-04-16T00:00:00-04:00,"Hunter Field  (Abilene, TX)",121,MBA,2025
6347138,597173,Texas-Dallas Comets,597293,Hardin-Simmons Cowboys,597173,6,top,Montee hit by pitch (0-0)3a Chatman advanced to second3a Kinnison advanced to third.,55,2025-04-16T00:00:00-04:00,"Hunter Field  (Abilene, TX)",121,MBA,2025
6347138,597173,Texas-Dallas Comets,597293,Hardin-Simmons Cowboys,597173,6,top,Soto lined out to cf (1-1 BK).,56,2025-04-16T00:00:00-04:00,"Hunter Field  (Abilene, TX)",121,MBA,2025
6347138,597173,Texas-Dallas Comets,597293,Hardin-Simmons Cowboys,597293,6,bot,Kirkbride grounded out to ss (0-0).,57,2025-04-16T00:00:00-04:00,"Hunter Field  (Abilene, TX)",121,MBA,2025
6347138,597173,Texas-Dallas Comets,597293,Hardin-Simmons Cowboys,597293,6,bot,McGraw lined out to cf (1-2 KSB).,58,2025-04-16T00:00:00-04:00,"Hunter Field  (Abilene, TX)",121,MBA,2025
6347138,597173,Texas-Dallas Comets,597293,Hardin-Simmons Cowboys,597293,6,bot,Vaughan grounded out to ss (3-2 BKSBBF).,59,2025-04-16T00:00:00-04:00,"Hunter Field  (Abilene, TX)",121,MBA,2025
6347138,597173,Texas-Dallas Comets,597293,Hardin-Simmons Cowboys,597173,7,top,A. Garza doubled down the rf line (1-0 B).,60,2025-04-16T00:00:00-04:00,"Hunter Field  (Abilene, TX)",121,MBA,2025
6347138,597173,Texas-Dallas Comets,597293,Hardin-Simmons Cowboys,597173,7,top,Rexin grounded out to 3b (3-2 SBBSB).,61,2025-04-16T00:00:00-04:00,"Hunter Field  (Abilene, TX)",121,MBA,2025
6347138,597173,Texas-Dallas Comets,597293,Hardin-Simmons Cowboys,597173,7,top,McCown intentionally walked.,62,2025-04-16T00:00:00-04:00,"Hunter Field  (Abilene, TX)",121,MBA,2025
6347138,597173,Texas-Dallas Comets,597293,Hardin-Simmons Cowboys,597173,7,top,"Kinnison doubled down the rf line, RBI (0-0)3a McCown advanced to third3a A. Garza scored.",63,2025-04-16T00:00:00-04:00,"Hunter Field  (Abilene, TX)",121,MBA,2025
6347138,597173,Texas-Dallas Comets,597293,Hardin-Simmons Cowboys,597173,7,top,"N. Fernandez doubled to right center, 2 RBI (1-1 BK)3a Kinnison scored3a McCown scored.",64,2025-04-16T00:00:00-04:00,"Hunter Field  (Abilene, TX)",121,MBA,2025
6347138,597173,Texas-Dallas Comets,597293,Hardin-Simmons Cowboys,597173,7,top,Zoolkoski to p for Posey.,65,2025-04-16T00:00:00-04:00,"Hunter Field  (Abilene, TX)",121,MBA,2025
6347138,597173,Texas-Dallas Comets,597293,Hardin-Simmons Cowboys,597173,7,top,Wallace grounded out to 3b (0-1 K).,66,2025-04-16T00:00:00-04:00,"Hunter Field  (Abilene, TX)",121,MBA,2025
6347138,597173,Texas-Dallas Comets,597293,Hardin-Simmons Cowboys,597173,7,top,Chatman struck out looking (2-2 KBSBK).,67,2025-04-16T00:00:00-04:00,"Hunter Field  (Abilene, TX)",121,MBA,2025
6347138,597173,Texas-Dallas Comets,597293,Hardin-Simmons Cowboys,597293,7,bot,Calvillo flied out to cf (1-1 BK).,68,2025-04-16T00:00:00-04:00,"Hunter Field  (Abilene, TX)",121,MBA,2025
6347138,597173,Texas-Dallas Comets,597293,Hardin-Simmons Cowboys,597293,7,bot,Blancaflor grounded out to 3b (2-1 FBB).,69,2025-04-16T00:00:00-04:00,"Hunter Field  (Abilene, TX)",121,MBA,2025
6347138,597173,Texas-Dallas Comets,597293,Hardin-Simmons Cowboys,597293,7,bot,Hollingswort lined out to cf (0-0).,70,2025-04-16T00:00:00-04:00,"Hunter Field  (Abilene, TX)",121,MBA,2025
6347138,597173,Texas-Dallas Comets,597293,Hardin-Simmons Cowboys,597173,8,top,Montee doubled to right field (3-2 BBBKF).,71,2025-04-16T00:00:00-04:00,"Hunter Field  (Abilene, TX)",121,MBA,2025
6347138,597173,Texas-Dallas Comets,597293,Hardin-Simmons Cowboys,597173,8,top,"Soto grounded out to p, SAC, bunt (2-1 BKB)3a Montee advanced to third.",72,2025-04-16T00:00:00-04:00,"Hunter Field  (Abilene, TX)",121,MBA,2025
6347138,597173,Texas-Dallas Comets,597293,Hardin-Simmons Cowboys,597173,8,top,"A. Garza singled to right field, RBI (0-0)3a Montee scored.",73,2025-04-16T00:00:00-04:00,"Hunter Field  (Abilene, TX)",121,MBA,2025
6347138,597173,Texas-Dallas Comets,597293,Hardin-Simmons Cowboys,597173,8,top,Rexin reached on a fielder's choice (0-0)3a A. Garza out at second 3b to 2b.,74,2025-04-16T00:00:00-04:00,"Hunter Field  (Abilene, TX)",121,MBA,2025
6347138,597173,Texas-Dallas Comets,597293,Hardin-Simmons Cowboys,597173,8,top,McCown walked (3-1 BFBBB)3a Rexin advanced to second.,75,2025-04-16T00:00:00-04:00,"Hunter Field  (Abilene, TX)",121,MBA,2025
6347138,597173,Texas-Dallas Comets,597293,Hardin-Simmons Cowboys,597173,8,top,"Kinnison doubled down the lf line, RBI (3-1 BBBF)3a McCown advanced to third3a Rexin scored.",76,2025-04-16T00:00:00-04:00,"Hunter Field  (Abilene, TX)",121,MBA,2025
6347138,597173,Texas-Dallas Comets,597293,Hardin-Simmons Cowboys,597173,8,top,Bennett to p for Zoolkoski.,77,2025-04-16T00:00:00-04:00,"Hunter Field  (Abilene, TX)",121,MBA,2025
6347138,597173,Texas-Dallas Comets,597293,Hardin-Simmons Cowboys,597173,8,top,N. Fernandez walked (3-1 BFBBB).,78,2025-04-16T00:00:00-04:00,"Hunter Field  (Abilene, TX)",121,MBA,2025
6347138,597173,Texas-Dallas Comets,597293,Hardin-Simmons Cowboys,597173,8,top,Wallace flied out to cf (2-2 KBBF).,79,2025-04-16T00:00:00-04:00,"Hunter Field  (Abilene, TX)",121,MBA,2025
6347138,597173,Texas-Dallas Comets,597293,Hardin-Simmons Cowboys,597293,8,bot,Vandament to p for Collins.,80,2025-04-16T00:00:00-04:00,"Hunter Field  (Abilene, TX)",121,MBA,2025
6347138,597173,Texas-Dallas Comets,597293,Hardin-Simmons Cowboys,597293,8,bot,Trapani walked (3-0 BBBB).,81,2025-04-16T00:00:00-04:00,"Hunter Field  (Abilene, TX)",121,MBA,2025
6347138,597173,Texas-Dallas Comets,597293,Hardin-Simmons Cowboys,597293,8,bot,Negron popped up to ss (0-1 F).,82,2025-04-16T00:00:00-04:00,"Hunter Field  (Abilene, TX)",121,MBA,2025
6347138,597173,Texas-Dallas Comets,597293,Hardin-Simmons Cowboys,597293,8,bot,White hit by pitch (2-2 BKSB)3a Trapani advanced to second.,83,2025-04-16T00:00:00-04:00,"Hunter Field  (Abilene, TX)",121,MBA,2025
6347138,597173,Texas-Dallas Comets,597293,Hardin-Simmons Cowboys,597293,8,bot,Trojacek pinch hit for Kirkbride.,84,2025-04-16T00:00:00-04:00,"Hunter Field  (Abilene, TX)",121,MBA,2025
6347138,597173,Texas-Dallas Comets,597293,Hardin-Simmons Cowboys,597293,8,bot,Trojacek grounded into double play 2b to ss to 1b3a White out on the play.,85,2025-04-16T00:00:00-04:00,"Hunter Field  (Abilene, TX)",121,MBA,2025
6347138,597173,Texas-Dallas Comets,597293,Hardin-Simmons Cowboys,597173,9,top,Fielder to ss for Trojacek.,86,2025-04-16T00:00:00-04:00,"Hunter Field  (Abilene, TX)",121,MBA,2025
6347138,597173,Texas-Dallas Comets,597293,Hardin-Simmons Cowboys,597173,9,top,Chatman struck out looking (2-2 SSFBBK).,87,2025-04-16T00:00:00-04:00,"Hunter Field  (Abilene, TX)",121,MBA,2025
6347138,597173,Texas-Dallas Comets,597293,Hardin-Simmons Cowboys,597173,9,top,Montee lined out to lf (0-0).,88,2025-04-16T00:00:00-04:00,"Hunter Field  (Abilene, TX)",121,MBA,2025
6347138,597173,Texas-Dallas Comets,597293,Hardin-Simmons Cowboys,597173,9,top,Soto hit by pitch (2-0 BB).,89,2025-04-16T00:00:00-04:00,"Hunter Field  (Abilene, TX)",121,MBA,2025
6347138,597173,Texas-Dallas Comets,597293,Hardin-Simmons Cowboys,597173,9,top,"Soto out at second c to ss, caught stealing.",90,2025-04-16T00:00:00-04:00,"Hunter Field  (Abilene, TX)",121,MBA,2025
6347138,597173,Texas-Dallas Comets,597293,Hardin-Simmons Cowboys,597293,9,bot,Jennings to p for Vandament.,91,2025-04-16T00:00:00-04:00,"Hunter Field  (Abilene, TX)",121,MBA,2025
6347138,597173,Texas-Dallas Comets,597293,Hardin-Simmons Cowboys,597293,9,bot,McGraw struck out swinging (1-2 KBKFS).,92,2025-04-16T00:00:00-04:00,"Hunter Field  (Abilene, TX)",121,MBA,2025
6347138,597173,Texas-Dallas Comets,597293,Hardin-Simmons Cowboys,597293,9,bot,Vaughan lined out to cf (0-1 S).,93,2025-04-16T00:00:00-04:00,"Hunter Field  (Abilene, TX)",121,MBA,2025
6347138,597173,Texas-Dallas Comets,597293,Hardin-Simmons Cowboys,597293,9,bot,Calvillo lined out to rf (1-2 FFB).,94,2025-04-16T00:00:00-04:00,"Hunter Field  (Abilene, TX)",121,MBA,2025
