game_id,away_team_id,away_team_name,home_team_id,home_team_name,batting_team,inning,top_bot,event_text,event_num,game_datetime,stadium_name,attendance,sport_id,season
6347122,596792,Barton Bulldogs,596733,Lenoir-Rhyne Bears,596792,1,top,"E. Harding homered to left field, RBI.",1,2025-04-15T00:00:00-04:00,"Durham Field (Hickory, NC)",77,MBA,2025
6347122,596792,Barton Bulldogs,596733,Lenoir-Rhyne Bears,596792,1,top,"M. Staz singled, bunt.",2,2025-04-15T00:00:00-04:00,"Durham Field (Hickory, NC)",77,MBA,2025
6347122,596792,Barton Bulldogs,596733,Lenoir-Rhyne Bears,596792,1,top,"L. Sauri grounded out to 2b, SAC, bunt3a M. Staz advanced to second.",3,2025-04-15T00:00:00-04:00,"Durham Field (Hickory, NC)",77,MBA,2025
6347122,596792,Barton Bulldogs,596733,Lenoir-Rhyne Bears,596792,1,top,"Y. Diaz homered to left field, 2 RBI3a M. Staz scored.",4,2025-04-15T00:00:00-04:00,"Durham Field (Hickory, NC)",77,MBA,2025
6347122,596792,Barton Bulldogs,596733,Lenoir-Rhyne Bears,596792,1,top,C. Waddell grounded out to 2b.,5,2025-04-15T00:00:00-04:00,"Durham Field (Hickory, NC)",77,MBA,2025
6347122,596792,Barton Bulldogs,596733,Lenoir-Rhyne Bears,596792,1,top,G. Gilmore singled to left field.,6,2025-04-15T00:00:00-04:00,"Durham Field (Hickory, NC)",77,MBA,2025
6347122,596792,Barton Bulldogs,596733,Lenoir-Rhyne Bears,596792,1,top,S. Laimo struck out looking.,7,2025-04-15T00:00:00-04:00,"Durham Field (Hickory, NC)",77,MBA,2025
6347122,596792,Barton Bulldogs,596733,Lenoir-Rhyne Bears,596733,1,bot,M. Wainwrigh singled up the middle.,8,2025-04-15T00:00:00-04:00,"Durham Field (Hickory, NC)",77,MBA,2025
6347122,596792,Barton Bulldogs,596733,Lenoir-Rhyne Bears,596733,1,bot,A. Stillinge grounded into double play ss to 1b3a M. Wainwrigh out on the play.,9,2025-04-15T00:00:00-04:00,"Durham Field (Hickory, NC)",77,MBA,2025
6347122,596792,Barton Bulldogs,596733,Lenoir-Rhyne Bears,596733,1,bot,C. Laskowski doubled to right center.,10,2025-04-15T00:00:00-04:00,"Durham Field (Hickory, NC)",77,MBA,2025
6347122,596792,Barton Bulldogs,596733,Lenoir-Rhyne Bears,596733,1,bot,S. Carricato popped up to 1b.,11,2025-04-15T00:00:00-04:00,"Durham Field (Hickory, NC)",77,MBA,2025
6347122,596792,Barton Bulldogs,596733,Lenoir-Rhyne Bears,596792,2,top,J. Marvel reached first on an error by 3b.,12,2025-04-15T00:00:00-04:00,"Durham Field (Hickory, NC)",77,MBA,2025
6347122,596792,Barton Bulldogs,596733,Lenoir-Rhyne Bears,596792,2,top,"J. Guzman tripled to right center, RBI3a J. Marvel scored, unearned.",13,2025-04-15T00:00:00-04:00,"Durham Field (Hickory, NC)",77,MBA,2025
6347122,596792,Barton Bulldogs,596733,Lenoir-Rhyne Bears,596792,2,top,E. Harding struck out swinging.,14,2025-04-15T00:00:00-04:00,"Durham Field (Hickory, NC)",77,MBA,2025
6347122,596792,Barton Bulldogs,596733,Lenoir-Rhyne Bears,596792,2,top,"M. Staz singled to center field, RBI3a J. Guzman scored.",15,2025-04-15T00:00:00-04:00,"Durham Field (Hickory, NC)",77,MBA,2025
6347122,596792,Barton Bulldogs,596733,Lenoir-Rhyne Bears,596792,2,top,L. Sauri singled to right field3a M. Staz advanced to second.,16,2025-04-15T00:00:00-04:00,"Durham Field (Hickory, NC)",77,MBA,2025
6347122,596792,Barton Bulldogs,596733,Lenoir-Rhyne Bears,596792,2,top,P. Drebes to p for P. Schofield.,17,2025-04-15T00:00:00-04:00,"Durham Field (Hickory, NC)",77,MBA,2025
6347122,596792,Barton Bulldogs,596733,Lenoir-Rhyne Bears,596792,2,top,Y. Diaz hit by pitch3a L. Sauri advanced to second3a M. Staz advanced to third.,18,2025-04-15T00:00:00-04:00,"Durham Field (Hickory, NC)",77,MBA,2025
6347122,596792,Barton Bulldogs,596733,Lenoir-Rhyne Bears,596792,2,top,"C. Waddell doubled, ground-rule, 2 RBI3a Y. Diaz advanced to third3a L. Sauri scored3a M. Staz scored.",19,2025-04-15T00:00:00-04:00,"Durham Field (Hickory, NC)",77,MBA,2025
6347122,596792,Barton Bulldogs,596733,Lenoir-Rhyne Bears,596792,2,top,"G. Gilmore singled to center field, 2 RBI3a C. Waddell scored3a Y. Diaz scored.",20,2025-04-15T00:00:00-04:00,"Durham Field (Hickory, NC)",77,MBA,2025
6347122,596792,Barton Bulldogs,596733,Lenoir-Rhyne Bears,596792,2,top,S. Laimo popped up to lf.,21,2025-04-15T00:00:00-04:00,"Durham Field (Hickory, NC)",77,MBA,2025
6347122,596792,Barton Bulldogs,596733,Lenoir-Rhyne Bears,596792,2,top,J. Marvel singled to right field3a G. Gilmore advanced to second.,22,2025-04-15T00:00:00-04:00,"Durham Field (Hickory, NC)",77,MBA,2025
6347122,596792,Barton Bulldogs,596733,Lenoir-Rhyne Bears,596792,2,top,J. Marvel advanced to second on a wild pitch3a G. Gilmore advanced to third on a wild pitch.,23,2025-04-15T00:00:00-04:00,"Durham Field (Hickory, NC)",77,MBA,2025
6347122,596792,Barton Bulldogs,596733,Lenoir-Rhyne Bears,596792,2,top,J. Guzman walked.,24,2025-04-15T00:00:00-04:00,"Durham Field (Hickory, NC)",77,MBA,2025
6347122,596792,Barton Bulldogs,596733,Lenoir-Rhyne Bears,596792,2,top,E. Harding reached on a fielder's choice3a J. Guzman out at second ss to 2b.,25,2025-04-15T00:00:00-04:00,"Durham Field (Hickory, NC)",77,MBA,2025
6347122,596792,Barton Bulldogs,596733,Lenoir-Rhyne Bears,596733,2,bot,O. Blackledg walked.,26,2025-04-15T00:00:00-04:00,"Durham Field (Hickory, NC)",77,MBA,2025
6347122,596792,Barton Bulldogs,596733,Lenoir-Rhyne Bears,596733,2,bot,M. Logan doubled to left center3a O. Blackledg advanced to third.,27,2025-04-15T00:00:00-04:00,"Durham Field (Hickory, NC)",77,MBA,2025
6347122,596792,Barton Bulldogs,596733,Lenoir-Rhyne Bears,596733,2,bot,"E. Willen singled, advanced to second on the throw, 2 RBI3a M. Logan scored3a O. Blackledg scored.",28,2025-04-15T00:00:00-04:00,"Durham Field (Hickory, NC)",77,MBA,2025
6347122,596792,Barton Bulldogs,596733,Lenoir-Rhyne Bears,596733,2,bot,N. Kidder struck out looking.,29,2025-04-15T00:00:00-04:00,"Durham Field (Hickory, NC)",77,MBA,2025
6347122,596792,Barton Bulldogs,596733,Lenoir-Rhyne Bears,596733,2,bot,A. Khan struck out swinging.,30,2025-04-15T00:00:00-04:00,"Durham Field (Hickory, NC)",77,MBA,2025
6347122,596792,Barton Bulldogs,596733,Lenoir-Rhyne Bears,596733,2,bot,M. Wainwrigh grounded out to 3b.,31,2025-04-15T00:00:00-04:00,"Durham Field (Hickory, NC)",77,MBA,2025
6347122,596792,Barton Bulldogs,596733,Lenoir-Rhyne Bears,596792,3,top,K. Gradisar to p for P. Drebes.,32,2025-04-15T00:00:00-04:00,"Durham Field (Hickory, NC)",77,MBA,2025
6347122,596792,Barton Bulldogs,596733,Lenoir-Rhyne Bears,596792,3,top,M. Staz walked.,33,2025-04-15T00:00:00-04:00,"Durham Field (Hickory, NC)",77,MBA,2025
6347122,596792,Barton Bulldogs,596733,Lenoir-Rhyne Bears,596792,3,top,L. Sauri struck out swinging.,34,2025-04-15T00:00:00-04:00,"Durham Field (Hickory, NC)",77,MBA,2025
6347122,596792,Barton Bulldogs,596733,Lenoir-Rhyne Bears,596792,3,top,Y. Diaz lined out to ss.,35,2025-04-15T00:00:00-04:00,"Durham Field (Hickory, NC)",77,MBA,2025
6347122,596792,Barton Bulldogs,596733,Lenoir-Rhyne Bears,596792,3,top,M. Staz stole second.,36,2025-04-15T00:00:00-04:00,"Durham Field (Hickory, NC)",77,MBA,2025
6347122,596792,Barton Bulldogs,596733,Lenoir-Rhyne Bears,596792,3,top,C. Waddell flied out to cf.,37,2025-04-15T00:00:00-04:00,"Durham Field (Hickory, NC)",77,MBA,2025
6347122,596792,Barton Bulldogs,596733,Lenoir-Rhyne Bears,596733,3,bot,B. Arthur to p for B. Dunlop.,38,2025-04-15T00:00:00-04:00,"Durham Field (Hickory, NC)",77,MBA,2025
6347122,596792,Barton Bulldogs,596733,Lenoir-Rhyne Bears,596733,3,bot,A. Stillinge flied out to lf.,39,2025-04-15T00:00:00-04:00,"Durham Field (Hickory, NC)",77,MBA,2025
6347122,596792,Barton Bulldogs,596733,Lenoir-Rhyne Bears,596733,3,bot,C. Laskowski singled to left field.,40,2025-04-15T00:00:00-04:00,"Durham Field (Hickory, NC)",77,MBA,2025
6347122,596792,Barton Bulldogs,596733,Lenoir-Rhyne Bears,596733,3,bot,C. Laskowski advanced to second on a wild pitch.,41,2025-04-15T00:00:00-04:00,"Durham Field (Hickory, NC)",77,MBA,2025
6347122,596792,Barton Bulldogs,596733,Lenoir-Rhyne Bears,596733,3,bot,"S. Carricato doubled to right field, RBI3a C. Laskowski scored.",42,2025-04-15T00:00:00-04:00,"Durham Field (Hickory, NC)",77,MBA,2025
6347122,596792,Barton Bulldogs,596733,Lenoir-Rhyne Bears,596733,3,bot,O. Blackledg singled to right field3a S. Carricato advanced to third.,43,2025-04-15T00:00:00-04:00,"Durham Field (Hickory, NC)",77,MBA,2025
6347122,596792,Barton Bulldogs,596733,Lenoir-Rhyne Bears,596733,3,bot,"M. Logan homered to right field, 3 RBI3a O. Blackledg scored3a S. Carricato scored.",44,2025-04-15T00:00:00-04:00,"Durham Field (Hickory, NC)",77,MBA,2025
6347122,596792,Barton Bulldogs,596733,Lenoir-Rhyne Bears,596733,3,bot,J. Cabaniss to p for B. Arthur.,45,2025-04-15T00:00:00-04:00,"Durham Field (Hickory, NC)",77,MBA,2025
6347122,596792,Barton Bulldogs,596733,Lenoir-Rhyne Bears,596733,3,bot,E. Willen grounded out to 2b.,46,2025-04-15T00:00:00-04:00,"Durham Field (Hickory, NC)",77,MBA,2025
6347122,596792,Barton Bulldogs,596733,Lenoir-Rhyne Bears,596733,3,bot,N. Kidder walked.,47,2025-04-15T00:00:00-04:00,"Durham Field (Hickory, NC)",77,MBA,2025
6347122,596792,Barton Bulldogs,596733,Lenoir-Rhyne Bears,596733,3,bot,"N. Kidder out at second c to ss, caught stealing.",48,2025-04-15T00:00:00-04:00,"Durham Field (Hickory, NC)",77,MBA,2025
6347122,596792,Barton Bulldogs,596733,Lenoir-Rhyne Bears,596792,4,top,G. Gilmore walked.,49,2025-04-15T00:00:00-04:00,"Durham Field (Hickory, NC)",77,MBA,2025
6347122,596792,Barton Bulldogs,596733,Lenoir-Rhyne Bears,596792,4,top,S. Laimo singled to center field3a G. Gilmore advanced to second.,50,2025-04-15T00:00:00-04:00,"Durham Field (Hickory, NC)",77,MBA,2025
6347122,596792,Barton Bulldogs,596733,Lenoir-Rhyne Bears,596792,4,top,J. Marvel walked3a S. Laimo advanced to second3a G. Gilmore advanced to third.,51,2025-04-15T00:00:00-04:00,"Durham Field (Hickory, NC)",77,MBA,2025
6347122,596792,Barton Bulldogs,596733,Lenoir-Rhyne Bears,596792,4,top,W. Girardi to p for K. Gradisar.,52,2025-04-15T00:00:00-04:00,"Durham Field (Hickory, NC)",77,MBA,2025
6347122,596792,Barton Bulldogs,596733,Lenoir-Rhyne Bears,596792,4,top,"J. Guzman doubled, ground-rule, 2 RBI3a J. Marvel advanced to third3a S. Laimo scored3a G. Gilmore scored.",53,2025-04-15T00:00:00-04:00,"Durham Field (Hickory, NC)",77,MBA,2025
6347122,596792,Barton Bulldogs,596733,Lenoir-Rhyne Bears,596792,4,top,"E. Harding homered to left field, 3 RBI3a J. Guzman scored3a J. Marvel scored.",54,2025-04-15T00:00:00-04:00,"Durham Field (Hickory, NC)",77,MBA,2025
6347122,596792,Barton Bulldogs,596733,Lenoir-Rhyne Bears,596792,4,top,M. Staz walked.,55,2025-04-15T00:00:00-04:00,"Durham Field (Hickory, NC)",77,MBA,2025
6347122,596792,Barton Bulldogs,596733,Lenoir-Rhyne Bears,596792,4,top,L. Sauri popped up to ss.,56,2025-04-15T00:00:00-04:00,"Durham Field (Hickory, NC)",77,MBA,2025
6347122,596792,Barton Bulldogs,596733,Lenoir-Rhyne Bears,596792,4,top,Y. Diaz grounded into double play ss to 2b to 1b3a M. Staz out on the play.,57,2025-04-15T00:00:00-04:00,"Durham Field (Hickory, NC)",77,MBA,2025
6347122,596792,Barton Bulldogs,596733,Lenoir-Rhyne Bears,596733,4,bot,A. Khan flied out to cf.,58,2025-04-15T00:00:00-04:00,"Durham Field (Hickory, NC)",77,MBA,2025
6347122,596792,Barton Bulldogs,596733,Lenoir-Rhyne Bears,596733,4,bot,M. Wainwrigh grounded out to 3b.,59,2025-04-15T00:00:00-04:00,"Durham Field (Hickory, NC)",77,MBA,2025
6347122,596792,Barton Bulldogs,596733,Lenoir-Rhyne Bears,596733,4,bot,A. Stillinge grounded out to 2b.,60,2025-04-15T00:00:00-04:00,"Durham Field (Hickory, NC)",77,MBA,2025
6347122,596792,Barton Bulldogs,596733,Lenoir-Rhyne Bears,596792,5,top,M. Wainwrigh to p for W. Girardi.,61,2025-04-15T00:00:00-04:00,"Durham Field (Hickory, NC)",77,MBA,2025
6347122,596792,Barton Bulldogs,596733,Lenoir-Rhyne Bears,596792,5,top,C. Waddell grounded out to 1b unassisted.,62,2025-04-15T00:00:00-04:00,"Durham Field (Hickory, NC)",77,MBA,2025
6347122,596792,Barton Bulldogs,596733,Lenoir-Rhyne Bears,596792,5,top,G. Gilmore grounded out to ss.,63,2025-04-15T00:00:00-04:00,"Durham Field (Hickory, NC)",77,MBA,2025
6347122,596792,Barton Bulldogs,596733,Lenoir-Rhyne Bears,596792,5,top,S. Laimo popped up to cf.,64,2025-04-15T00:00:00-04:00,"Durham Field (Hickory, NC)",77,MBA,2025
6347122,596792,Barton Bulldogs,596733,Lenoir-Rhyne Bears,596733,5,bot,C. Laskowski flied out to lf.,65,2025-04-15T00:00:00-04:00,"Durham Field (Hickory, NC)",77,MBA,2025
6347122,596792,Barton Bulldogs,596733,Lenoir-Rhyne Bears,596733,5,bot,S. Carricato singled to left field.,66,2025-04-15T00:00:00-04:00,"Durham Field (Hickory, NC)",77,MBA,2025
6347122,596792,Barton Bulldogs,596733,Lenoir-Rhyne Bears,596733,5,bot,O. Blackledg reached on a fielder's choice3a S. Carricato out at second 3b to 2b.,67,2025-04-15T00:00:00-04:00,"Durham Field (Hickory, NC)",77,MBA,2025
6347122,596792,Barton Bulldogs,596733,Lenoir-Rhyne Bears,596733,5,bot,O. Blackledg advanced to second on a wild pitch.,68,2025-04-15T00:00:00-04:00,"Durham Field (Hickory, NC)",77,MBA,2025
6347122,596792,Barton Bulldogs,596733,Lenoir-Rhyne Bears,596733,5,bot,O. Blackledg stole third.,69,2025-04-15T00:00:00-04:00,"Durham Field (Hickory, NC)",77,MBA,2025
6347122,596792,Barton Bulldogs,596733,Lenoir-Rhyne Bears,596733,5,bot,M. Logan flied out to cf.,70,2025-04-15T00:00:00-04:00,"Durham Field (Hickory, NC)",77,MBA,2025
6347122,596792,Barton Bulldogs,596733,Lenoir-Rhyne Bears,596792,6,top,J. Marvel singled to center field.,71,2025-04-15T00:00:00-04:00,"Durham Field (Hickory, NC)",77,MBA,2025
6347122,596792,Barton Bulldogs,596733,Lenoir-Rhyne Bears,596792,6,top,J. Guzman singled to center field3a J. Marvel advanced to second.,72,2025-04-15T00:00:00-04:00,"Durham Field (Hickory, NC)",77,MBA,2025
6347122,596792,Barton Bulldogs,596733,Lenoir-Rhyne Bears,596792,6,top,E. Harding flied out to cf.,73,2025-04-15T00:00:00-04:00,"Durham Field (Hickory, NC)",77,MBA,2025
6347122,596792,Barton Bulldogs,596733,Lenoir-Rhyne Bears,596792,6,top,M. Staz struck out swinging.,74,2025-04-15T00:00:00-04:00,"Durham Field (Hickory, NC)",77,MBA,2025
6347122,596792,Barton Bulldogs,596733,Lenoir-Rhyne Bears,596792,6,top,"L. Sauri singled, advanced to second on the throw, RBI3a J. Guzman advanced to third3a J. Marvel scored.",75,2025-04-15T00:00:00-04:00,"Durham Field (Hickory, NC)",77,MBA,2025
6347122,596792,Barton Bulldogs,596733,Lenoir-Rhyne Bears,596792,6,top,Y. Diaz struck out swinging.,76,2025-04-15T00:00:00-04:00,"Durham Field (Hickory, NC)",77,MBA,2025
6347122,596792,Barton Bulldogs,596733,Lenoir-Rhyne Bears,596733,6,bot,"E. Willen homered to right field, RBI.",77,2025-04-15T00:00:00-04:00,"Durham Field (Hickory, NC)",77,MBA,2025
6347122,596792,Barton Bulldogs,596733,Lenoir-Rhyne Bears,596733,6,bot,"N. Kidder singled, bunt.",78,2025-04-15T00:00:00-04:00,"Durham Field (Hickory, NC)",77,MBA,2025
6347122,596792,Barton Bulldogs,596733,Lenoir-Rhyne Bears,596733,6,bot,A. Khan grounded out to 3b3a N. Kidder advanced to second.,79,2025-04-15T00:00:00-04:00,"Durham Field (Hickory, NC)",77,MBA,2025
6347122,596792,Barton Bulldogs,596733,Lenoir-Rhyne Bears,596733,6,bot,D. Onorato to p for J. Cabaniss.,80,2025-04-15T00:00:00-04:00,"Durham Field (Hickory, NC)",77,MBA,2025
6347122,596792,Barton Bulldogs,596733,Lenoir-Rhyne Bears,596733,6,bot,"M. Wainwrigh singled to second base, out at second 1b to 2b, RBI3a N. Kidder scored.",81,2025-04-15T00:00:00-04:00,"Durham Field (Hickory, NC)",77,MBA,2025
6347122,596792,Barton Bulldogs,596733,Lenoir-Rhyne Bears,596733,6,bot,A. Stillinge reached first on an error by ss.,82,2025-04-15T00:00:00-04:00,"Durham Field (Hickory, NC)",77,MBA,2025
6347122,596792,Barton Bulldogs,596733,Lenoir-Rhyne Bears,596733,6,bot,A. Stillinge advanced to second on a wild pitch.,83,2025-04-15T00:00:00-04:00,"Durham Field (Hickory, NC)",77,MBA,2025
6347122,596792,Barton Bulldogs,596733,Lenoir-Rhyne Bears,596733,6,bot,C. Laskowski flied out to cf.,84,2025-04-15T00:00:00-04:00,"Durham Field (Hickory, NC)",77,MBA,2025
6347122,596792,Barton Bulldogs,596733,Lenoir-Rhyne Bears,596792,7,top,S. Floyd to p for M. Wainwrigh.,85,2025-04-15T00:00:00-04:00,"Durham Field (Hickory, NC)",77,MBA,2025
6347122,596792,Barton Bulldogs,596733,Lenoir-Rhyne Bears,596792,7,top,C. Waddell doubled to right center.,86,2025-04-15T00:00:00-04:00,"Durham Field (Hickory, NC)",77,MBA,2025
6347122,596792,Barton Bulldogs,596733,Lenoir-Rhyne Bears,596792,7,top,G. Gilmore singled to right field3a C. Waddell advanced to third.,87,2025-04-15T00:00:00-04:00,"Durham Field (Hickory, NC)",77,MBA,2025
6347122,596792,Barton Bulldogs,596733,Lenoir-Rhyne Bears,596792,7,top,"S. Laimo struck out looking3a G. Gilmore stole second3a C. Waddell scored on a throwing error by c, unearned.",88,2025-04-15T00:00:00-04:00,"Durham Field (Hickory, NC)",77,MBA,2025
6347122,596792,Barton Bulldogs,596733,Lenoir-Rhyne Bears,596792,7,top,J. Marvel fouled out to c.,89,2025-04-15T00:00:00-04:00,"Durham Field (Hickory, NC)",77,MBA,2025
6347122,596792,Barton Bulldogs,596733,Lenoir-Rhyne Bears,596792,7,top,J. Guzman fouled out to c.,90,2025-04-15T00:00:00-04:00,"Durham Field (Hickory, NC)",77,MBA,2025
6347122,596792,Barton Bulldogs,596733,Lenoir-Rhyne Bears,596733,7,bot,S. Carricato walked.,91,2025-04-15T00:00:00-04:00,"Durham Field (Hickory, NC)",77,MBA,2025
6347122,596792,Barton Bulldogs,596733,Lenoir-Rhyne Bears,596733,7,bot,O. Blackledg flied out to rf.,92,2025-04-15T00:00:00-04:00,"Durham Field (Hickory, NC)",77,MBA,2025
6347122,596792,Barton Bulldogs,596733,Lenoir-Rhyne Bears,596733,7,bot,M. Logan flied out to cf.,93,2025-04-15T00:00:00-04:00,"Durham Field (Hickory, NC)",77,MBA,2025
6347122,596792,Barton Bulldogs,596733,Lenoir-Rhyne Bears,596733,7,bot,E. Willen struck out swinging.,94,2025-04-15T00:00:00-04:00,"Durham Field (Hickory, NC)",77,MBA,2025
6347122,596792,Barton Bulldogs,596733,Lenoir-Rhyne Bears,596792,8,top,C. Bates to p for S. Floyd.,95,2025-04-15T00:00:00-04:00,"Durham Field (Hickory, NC)",77,MBA,2025
6347122,596792,Barton Bulldogs,596733,Lenoir-Rhyne Bears,596792,8,top,E. Harding doubled down the lf line.,96,2025-04-15T00:00:00-04:00,"Durham Field (Hickory, NC)",77,MBA,2025
6347122,596792,Barton Bulldogs,596733,Lenoir-Rhyne Bears,596792,8,top,M. Staz walked.,97,2025-04-15T00:00:00-04:00,"Durham Field (Hickory, NC)",77,MBA,2025
6347122,596792,Barton Bulldogs,596733,Lenoir-Rhyne Bears,596792,8,top,L. Sauri struck out swinging.,98,2025-04-15T00:00:00-04:00,"Durham Field (Hickory, NC)",77,MBA,2025
6347122,596792,Barton Bulldogs,596733,Lenoir-Rhyne Bears,596792,8,top,Y. Diaz struck out swinging.,99,2025-04-15T00:00:00-04:00,"Durham Field (Hickory, NC)",77,MBA,2025
6347122,596792,Barton Bulldogs,596733,Lenoir-Rhyne Bears,596792,8,top,P. Schofield to p for C. Bates.,100,2025-04-15T00:00:00-04:00,"Durham Field (Hickory, NC)",77,MBA,2025
6347122,596792,Barton Bulldogs,596733,Lenoir-Rhyne Bears,596792,8,top,M. Staz advanced to second on a wild pitch3a E. Harding advanced to third on a wild pitch.,101,2025-04-15T00:00:00-04:00,"Durham Field (Hickory, NC)",77,MBA,2025
6347122,596792,Barton Bulldogs,596733,Lenoir-Rhyne Bears,596792,8,top,C. Waddell walked.,102,2025-04-15T00:00:00-04:00,"Durham Field (Hickory, NC)",77,MBA,2025
6347122,596792,Barton Bulldogs,596733,Lenoir-Rhyne Bears,596792,8,top,C. Waddell advanced to second on a wild pitch3a M. Staz advanced to third on a wild pitch3a E. Harding scored on a wild pitch.,103,2025-04-15T00:00:00-04:00,"Durham Field (Hickory, NC)",77,MBA,2025
6347122,596792,Barton Bulldogs,596733,Lenoir-Rhyne Bears,596792,8,top,G. Gilmore grounded out to ss.,104,2025-04-15T00:00:00-04:00,"Durham Field (Hickory, NC)",77,MBA,2025
6347122,596792,Barton Bulldogs,596733,Lenoir-Rhyne Bears,596733,8,bot,N. Kidder struck out swinging.,105,2025-04-15T00:00:00-04:00,"Durham Field (Hickory, NC)",77,MBA,2025
6347122,596792,Barton Bulldogs,596733,Lenoir-Rhyne Bears,596733,8,bot,A. Khan lined out to rf.,106,2025-04-15T00:00:00-04:00,"Durham Field (Hickory, NC)",77,MBA,2025
6347122,596792,Barton Bulldogs,596733,Lenoir-Rhyne Bears,596733,8,bot,M. Wainwrigh struck out swinging.,107,2025-04-15T00:00:00-04:00,"Durham Field (Hickory, NC)",77,MBA,2025
6347122,596792,Barton Bulldogs,596733,Lenoir-Rhyne Bears,596792,9,top,S. Floyd to p for P. Schofield.,108,2025-04-15T00:00:00-04:00,"Durham Field (Hickory, NC)",77,MBA,2025
6347122,596792,Barton Bulldogs,596733,Lenoir-Rhyne Bears,596792,9,top,S. Laimo walked.,109,2025-04-15T00:00:00-04:00,"Durham Field (Hickory, NC)",77,MBA,2025
6347122,596792,Barton Bulldogs,596733,Lenoir-Rhyne Bears,596792,9,top,J. Marvel struck out swinging.,110,2025-04-15T00:00:00-04:00,"Durham Field (Hickory, NC)",77,MBA,2025
6347122,596792,Barton Bulldogs,596733,Lenoir-Rhyne Bears,596792,9,top,J. Guzman flied out to cf.,111,2025-04-15T00:00:00-04:00,"Durham Field (Hickory, NC)",77,MBA,2025
6347122,596792,Barton Bulldogs,596733,Lenoir-Rhyne Bears,596792,9,top,E. Harding walked3a S. Laimo advanced to second.,112,2025-04-15T00:00:00-04:00,"Durham Field (Hickory, NC)",77,MBA,2025
6347122,596792,Barton Bulldogs,596733,Lenoir-Rhyne Bears,596792,9,top,M. Staz walked3a E. Harding advanced to second3a S. Laimo advanced to third.,113,2025-04-15T00:00:00-04:00,"Durham Field (Hickory, NC)",77,MBA,2025
6347122,596792,Barton Bulldogs,596733,Lenoir-Rhyne Bears,596792,9,top,"L. Sauri reached on a fielder's choice, RBI3a M. Staz advanced to second on an error by 2b3a E. Harding advanced to third3a S. Laimo scored, unearned.",114,2025-04-15T00:00:00-04:00,"Durham Field (Hickory, NC)",77,MBA,2025
6347122,596792,Barton Bulldogs,596733,Lenoir-Rhyne Bears,596792,9,top,"Y. Diaz doubled to right field, 3 RBI3a L. Sauri scored, unearned3a M. Staz scored, unearned3a E. Harding scored, unearned.",115,2025-04-15T00:00:00-04:00,"Durham Field (Hickory, NC)",77,MBA,2025
6347122,596792,Barton Bulldogs,596733,Lenoir-Rhyne Bears,596792,9,top,C. Waddell grounded out to 1b unassisted.,116,2025-04-15T00:00:00-04:00,"Durham Field (Hickory, NC)",77,MBA,2025
6347122,596792,Barton Bulldogs,596733,Lenoir-Rhyne Bears,596733,9,bot,A. Rich pinch hit for W. Girardi.,117,2025-04-15T00:00:00-04:00,"Durham Field (Hickory, NC)",77,MBA,2025
6347122,596792,Barton Bulldogs,596733,Lenoir-Rhyne Bears,596733,9,bot,A. Rich struck out swinging.,118,2025-04-15T00:00:00-04:00,"Durham Field (Hickory, NC)",77,MBA,2025
6347122,596792,Barton Bulldogs,596733,Lenoir-Rhyne Bears,596733,9,bot,H. Stallings pinch hit for T. Bradley.,119,2025-04-15T00:00:00-04:00,"Durham Field (Hickory, NC)",77,MBA,2025
6347122,596792,Barton Bulldogs,596733,Lenoir-Rhyne Bears,596733,9,bot,H. Stallings singled to right field.,120,2025-04-15T00:00:00-04:00,"Durham Field (Hickory, NC)",77,MBA,2025
6347122,596792,Barton Bulldogs,596733,Lenoir-Rhyne Bears,596733,9,bot,W. Girardi pinch hit for S. Carricato.,121,2025-04-15T00:00:00-04:00,"Durham Field (Hickory, NC)",77,MBA,2025
6347122,596792,Barton Bulldogs,596733,Lenoir-Rhyne Bears,596733,9,bot,W. Girardi flied out to cf.,122,2025-04-15T00:00:00-04:00,"Durham Field (Hickory, NC)",77,MBA,2025
6347122,596792,Barton Bulldogs,596733,Lenoir-Rhyne Bears,596733,9,bot,X. Mann pinch hit for O. Blackledg.,123,2025-04-15T00:00:00-04:00,"Durham Field (Hickory, NC)",77,MBA,2025
6347122,596792,Barton Bulldogs,596733,Lenoir-Rhyne Bears,596733,9,bot,X. Mann struck out swinging.,124,2025-04-15T00:00:00-04:00,"Durham Field (Hickory, NC)",77,MBA,2025
