game_id,away_team_id,away_team_name,home_team_id,home_team_name,batting_team,inning,top_bot,event_text,event_num,game_datetime,stadium_name,attendance,sport_id,season
6347477,597282,Franklin & Marshall Diplomats,597062,Washington Col. Shoremen,597282,1,top,N. McCloskey grounded out to 2b.,1,2025-04-18T00:00:00-04:00,"Athey Park (Chestertown, MD)",146,MBA,2025
6347477,597282,Franklin & Marshall Diplomats,597062,Washington Col. Shoremen,597282,1,top,A. Desautels grounded out to 2b.,2,2025-04-18T00:00:00-04:00,"Athey Park (Chestertown, MD)",146,MBA,2025
6347477,597282,Franklin & Marshall Diplomats,597062,Washington Col. Shoremen,597282,1,top,B. Falese singled to left center.,3,2025-04-18T00:00:00-04:00,"Athey Park (Chestertown, MD)",146,MBA,2025
6347477,597282,Franklin & Marshall Diplomats,597062,Washington Col. Shoremen,597282,1,top,"T. Wolpert homered to right center, 2 RBI3a B. Falese scored.",4,2025-04-18T00:00:00-04:00,"Athey Park (Chestertown, MD)",146,MBA,2025
6347477,597282,Franklin & Marshall Diplomats,597062,Washington Col. Shoremen,597282,1,top,M. Hollender struck out swinging.,5,2025-04-18T00:00:00-04:00,"Athey Park (Chestertown, MD)",146,MBA,2025
6347477,597282,Franklin & Marshall Diplomats,597062,Washington Col. Shoremen,597062,1,bot,T. Everitt reached first on a fielding error by 2b.,6,2025-04-18T00:00:00-04:00,"Athey Park (Chestertown, MD)",146,MBA,2025
6347477,597282,Franklin & Marshall Diplomats,597062,Washington Col. Shoremen,597062,1,bot,W. Turner hit by pitch3a T. Everitt advanced to second.,7,2025-04-18T00:00:00-04:00,"Athey Park (Chestertown, MD)",146,MBA,2025
6347477,597282,Franklin & Marshall Diplomats,597062,Washington Col. Shoremen,597062,1,bot,D. Kinsey reached on a fielder's choice to shortstop3a W. Turner out at second ss to 2b3a T. Everitt advanced to third.,8,2025-04-18T00:00:00-04:00,"Athey Park (Chestertown, MD)",146,MBA,2025
6347477,597282,Franklin & Marshall Diplomats,597062,Washington Col. Shoremen,597062,1,bot,C. Ruppel struck out looking.,9,2025-04-18T00:00:00-04:00,"Athey Park (Chestertown, MD)",146,MBA,2025
6347477,597282,Franklin & Marshall Diplomats,597062,Washington Col. Shoremen,597062,1,bot,D. Kinsey stole second.,10,2025-04-18T00:00:00-04:00,"Athey Park (Chestertown, MD)",146,MBA,2025
6347477,597282,Franklin & Marshall Diplomats,597062,Washington Col. Shoremen,597062,1,bot,"Z. Stolze singled through the left side, 2 RBI3a D. Kinsey scored, unearned3a T. Everitt scored, unearned.",11,2025-04-18T00:00:00-04:00,"Athey Park (Chestertown, MD)",146,MBA,2025
6347477,597282,Franklin & Marshall Diplomats,597062,Washington Col. Shoremen,597062,1,bot,A. Dardaris struck out swinging.,12,2025-04-18T00:00:00-04:00,"Athey Park (Chestertown, MD)",146,MBA,2025
6347477,597282,Franklin & Marshall Diplomats,597062,Washington Col. Shoremen,597282,2,top,N. Lorenzo singled up the middle.,13,2025-04-18T00:00:00-04:00,"Athey Park (Chestertown, MD)",146,MBA,2025
6347477,597282,Franklin & Marshall Diplomats,597062,Washington Col. Shoremen,597282,2,top,N. Lorenzo advanced to second on a passed ball.,14,2025-04-18T00:00:00-04:00,"Athey Park (Chestertown, MD)",146,MBA,2025
6347477,597282,Franklin & Marshall Diplomats,597062,Washington Col. Shoremen,597282,2,top,A. Filippell singled through the left side3a N. Lorenzo advanced to third.,15,2025-04-18T00:00:00-04:00,"Athey Park (Chestertown, MD)",146,MBA,2025
6347477,597282,Franklin & Marshall Diplomats,597062,Washington Col. Shoremen,597282,2,top,A. Filippell advanced to second on a wild pitch.,16,2025-04-18T00:00:00-04:00,"Athey Park (Chestertown, MD)",146,MBA,2025
6347477,597282,Franklin & Marshall Diplomats,597062,Washington Col. Shoremen,597282,2,top,N. Digiacomo walked.,17,2025-04-18T00:00:00-04:00,"Athey Park (Chestertown, MD)",146,MBA,2025
6347477,597282,Franklin & Marshall Diplomats,597062,Washington Col. Shoremen,597282,2,top,"C. Mackenzie reached on a fielder's choice to shortstop, RBI3a N. Digiacomo out at second ss to 2b3a A. Filippell advanced to third3a N. Lorenzo scored.",18,2025-04-18T00:00:00-04:00,"Athey Park (Chestertown, MD)",146,MBA,2025
6347477,597282,Franklin & Marshall Diplomats,597062,Washington Col. Shoremen,597282,2,top,C. Mackenzie stole second.,19,2025-04-18T00:00:00-04:00,"Athey Park (Chestertown, MD)",146,MBA,2025
6347477,597282,Franklin & Marshall Diplomats,597062,Washington Col. Shoremen,597282,2,top,"N. McCloskey singled to shortstop3a C. Mackenzie out at third ss unassisted, interference.",20,2025-04-18T00:00:00-04:00,"Athey Park (Chestertown, MD)",146,MBA,2025
6347477,597282,Franklin & Marshall Diplomats,597062,Washington Col. Shoremen,597282,2,top,A. Desautels lined out to ss.,21,2025-04-18T00:00:00-04:00,"Athey Park (Chestertown, MD)",146,MBA,2025
6347477,597282,Franklin & Marshall Diplomats,597062,Washington Col. Shoremen,597062,2,bot,R. Hirsh struck out swinging.,22,2025-04-18T00:00:00-04:00,"Athey Park (Chestertown, MD)",146,MBA,2025
6347477,597282,Franklin & Marshall Diplomats,597062,Washington Col. Shoremen,597062,2,bot,S. SanFilipp walked.,23,2025-04-18T00:00:00-04:00,"Athey Park (Chestertown, MD)",146,MBA,2025
6347477,597282,Franklin & Marshall Diplomats,597062,Washington Col. Shoremen,597062,2,bot,"M. O'Connor grounded out to 1b unassisted3a S. SanFilipp advanced to third, out at home ss unassisted.",24,2025-04-18T00:00:00-04:00,"Athey Park (Chestertown, MD)",146,MBA,2025
6347477,597282,Franklin & Marshall Diplomats,597062,Washington Col. Shoremen,597282,3,top,B. Spurgeon to p for M. Corda.,25,2025-04-18T00:00:00-04:00,"Athey Park (Chestertown, MD)",146,MBA,2025
6347477,597282,Franklin & Marshall Diplomats,597062,Washington Col. Shoremen,597282,3,top,B. Falese flied out to cf.,26,2025-04-18T00:00:00-04:00,"Athey Park (Chestertown, MD)",146,MBA,2025
6347477,597282,Franklin & Marshall Diplomats,597062,Washington Col. Shoremen,597282,3,top,T. Wolpert grounded out to 3b.,27,2025-04-18T00:00:00-04:00,"Athey Park (Chestertown, MD)",146,MBA,2025
6347477,597282,Franklin & Marshall Diplomats,597062,Washington Col. Shoremen,597282,3,top,M. Hollender grounded out to 3b.,28,2025-04-18T00:00:00-04:00,"Athey Park (Chestertown, MD)",146,MBA,2025
6347477,597282,Franklin & Marshall Diplomats,597062,Washington Col. Shoremen,597062,3,bot,T. Everitt walked.,29,2025-04-18T00:00:00-04:00,"Athey Park (Chestertown, MD)",146,MBA,2025
6347477,597282,Franklin & Marshall Diplomats,597062,Washington Col. Shoremen,597062,3,bot,T. Everitt stole second.,30,2025-04-18T00:00:00-04:00,"Athey Park (Chestertown, MD)",146,MBA,2025
6347477,597282,Franklin & Marshall Diplomats,597062,Washington Col. Shoremen,597062,3,bot,W. Turner popped up to 1b.,31,2025-04-18T00:00:00-04:00,"Athey Park (Chestertown, MD)",146,MBA,2025
6347477,597282,Franklin & Marshall Diplomats,597062,Washington Col. Shoremen,597062,3,bot,T. Everitt stole third.,32,2025-04-18T00:00:00-04:00,"Athey Park (Chestertown, MD)",146,MBA,2025
6347477,597282,Franklin & Marshall Diplomats,597062,Washington Col. Shoremen,597062,3,bot,D. Kinsey walked.,33,2025-04-18T00:00:00-04:00,"Athey Park (Chestertown, MD)",146,MBA,2025
6347477,597282,Franklin & Marshall Diplomats,597062,Washington Col. Shoremen,597062,3,bot,D. Kinsey stole second.,34,2025-04-18T00:00:00-04:00,"Athey Park (Chestertown, MD)",146,MBA,2025
6347477,597282,Franklin & Marshall Diplomats,597062,Washington Col. Shoremen,597062,3,bot,C. Ruppel struck out swinging.,35,2025-04-18T00:00:00-04:00,"Athey Park (Chestertown, MD)",146,MBA,2025
6347477,597282,Franklin & Marshall Diplomats,597062,Washington Col. Shoremen,597062,3,bot,Z. Stolze grounded out to p.,36,2025-04-18T00:00:00-04:00,"Athey Park (Chestertown, MD)",146,MBA,2025
6347477,597282,Franklin & Marshall Diplomats,597062,Washington Col. Shoremen,597282,4,top,N. Lorenzo flied out to lf to left center.,37,2025-04-18T00:00:00-04:00,"Athey Park (Chestertown, MD)",146,MBA,2025
6347477,597282,Franklin & Marshall Diplomats,597062,Washington Col. Shoremen,597282,4,top,A. Filippell flied out to lf to left center.,38,2025-04-18T00:00:00-04:00,"Athey Park (Chestertown, MD)",146,MBA,2025
6347477,597282,Franklin & Marshall Diplomats,597062,Washington Col. Shoremen,597282,4,top,N. Digiacomo struck out swinging.,39,2025-04-18T00:00:00-04:00,"Athey Park (Chestertown, MD)",146,MBA,2025
6347477,597282,Franklin & Marshall Diplomats,597062,Washington Col. Shoremen,597062,4,bot,A. Dardaris walked.,40,2025-04-18T00:00:00-04:00,"Athey Park (Chestertown, MD)",146,MBA,2025
6347477,597282,Franklin & Marshall Diplomats,597062,Washington Col. Shoremen,597062,4,bot,"R. Hirsh reached first on a throwing error by 2b, advanced to second on the error3a A. Dardaris advanced to second, advanced to third on the error.",41,2025-04-18T00:00:00-04:00,"Athey Park (Chestertown, MD)",146,MBA,2025
6347477,597282,Franklin & Marshall Diplomats,597062,Washington Col. Shoremen,597062,4,bot,S. SanFilipp struck out looking.,42,2025-04-18T00:00:00-04:00,"Athey Park (Chestertown, MD)",146,MBA,2025
6347477,597282,Franklin & Marshall Diplomats,597062,Washington Col. Shoremen,597062,4,bot,"M. O'Connor popped up to p, bunt.",43,2025-04-18T00:00:00-04:00,"Athey Park (Chestertown, MD)",146,MBA,2025
6347477,597282,Franklin & Marshall Diplomats,597062,Washington Col. Shoremen,597062,4,bot,T. Everitt walked.,44,2025-04-18T00:00:00-04:00,"Athey Park (Chestertown, MD)",146,MBA,2025
6347477,597282,Franklin & Marshall Diplomats,597062,Washington Col. Shoremen,597062,4,bot,W. Turner flied out to cf to right center.,45,2025-04-18T00:00:00-04:00,"Athey Park (Chestertown, MD)",146,MBA,2025
6347477,597282,Franklin & Marshall Diplomats,597062,Washington Col. Shoremen,597282,5,top,C. Mackenzie struck out looking.,46,2025-04-18T00:00:00-04:00,"Athey Park (Chestertown, MD)",146,MBA,2025
6347477,597282,Franklin & Marshall Diplomats,597062,Washington Col. Shoremen,597282,5,top,N. McCloskey doubled down the lf line.,47,2025-04-18T00:00:00-04:00,"Athey Park (Chestertown, MD)",146,MBA,2025
6347477,597282,Franklin & Marshall Diplomats,597062,Washington Col. Shoremen,597282,5,top,"A. Desautels singled up the middle, RBI3a N. McCloskey scored.",48,2025-04-18T00:00:00-04:00,"Athey Park (Chestertown, MD)",146,MBA,2025
6347477,597282,Franklin & Marshall Diplomats,597062,Washington Col. Shoremen,597282,5,top,B. Falese singled to left center3a A. Desautels advanced to second.,49,2025-04-18T00:00:00-04:00,"Athey Park (Chestertown, MD)",146,MBA,2025
6347477,597282,Franklin & Marshall Diplomats,597062,Washington Col. Shoremen,597282,5,top,"T. Wolpert flied out to cf to left center3a A. Desautels advanced to third, out at home cf to ss to c.",50,2025-04-18T00:00:00-04:00,"Athey Park (Chestertown, MD)",146,MBA,2025
6347477,597282,Franklin & Marshall Diplomats,597062,Washington Col. Shoremen,597062,5,bot,D. McGeorge to p for P. Mullen.,51,2025-04-18T00:00:00-04:00,"Athey Park (Chestertown, MD)",146,MBA,2025
6347477,597282,Franklin & Marshall Diplomats,597062,Washington Col. Shoremen,597062,5,bot,"D. Kinsey homered to left field, RBI.",52,2025-04-18T00:00:00-04:00,"Athey Park (Chestertown, MD)",146,MBA,2025
6347477,597282,Franklin & Marshall Diplomats,597062,Washington Col. Shoremen,597062,5,bot,C. Ruppel popped up to cf to left center.,53,2025-04-18T00:00:00-04:00,"Athey Park (Chestertown, MD)",146,MBA,2025
6347477,597282,Franklin & Marshall Diplomats,597062,Washington Col. Shoremen,597062,5,bot,"Z. Stolze homered to left center, RBI.",54,2025-04-18T00:00:00-04:00,"Athey Park (Chestertown, MD)",146,MBA,2025
6347477,597282,Franklin & Marshall Diplomats,597062,Washington Col. Shoremen,597062,5,bot,A. Dardaris struck out swinging.,55,2025-04-18T00:00:00-04:00,"Athey Park (Chestertown, MD)",146,MBA,2025
6347477,597282,Franklin & Marshall Diplomats,597062,Washington Col. Shoremen,597062,5,bot,R. Hirsh singled to left center.,56,2025-04-18T00:00:00-04:00,"Athey Park (Chestertown, MD)",146,MBA,2025
6347477,597282,Franklin & Marshall Diplomats,597062,Washington Col. Shoremen,597062,5,bot,S. SanFilipp reached on a fielder's choice to shortstop3a R. Hirsh out at second ss to 2b.,57,2025-04-18T00:00:00-04:00,"Athey Park (Chestertown, MD)",146,MBA,2025
6347477,597282,Franklin & Marshall Diplomats,597062,Washington Col. Shoremen,597282,6,top,M. Hollender walked.,58,2025-04-18T00:00:00-04:00,"Athey Park (Chestertown, MD)",146,MBA,2025
6347477,597282,Franklin & Marshall Diplomats,597062,Washington Col. Shoremen,597282,6,top,N. Lorenzo grounded out to 2b3a M. Hollender advanced to second.,59,2025-04-18T00:00:00-04:00,"Athey Park (Chestertown, MD)",146,MBA,2025
6347477,597282,Franklin & Marshall Diplomats,597062,Washington Col. Shoremen,597282,6,top,A. Filippell flied out to lf.,60,2025-04-18T00:00:00-04:00,"Athey Park (Chestertown, MD)",146,MBA,2025
6347477,597282,Franklin & Marshall Diplomats,597062,Washington Col. Shoremen,597282,6,top,N. Digiacomo walked.,61,2025-04-18T00:00:00-04:00,"Athey Park (Chestertown, MD)",146,MBA,2025
6347477,597282,Franklin & Marshall Diplomats,597062,Washington Col. Shoremen,597282,6,top,T. Titus to p for B. Spurgeon.,62,2025-04-18T00:00:00-04:00,"Athey Park (Chestertown, MD)",146,MBA,2025
6347477,597282,Franklin & Marshall Diplomats,597062,Washington Col. Shoremen,597282,6,top,C. Mackenzie flied out to rf.,63,2025-04-18T00:00:00-04:00,"Athey Park (Chestertown, MD)",146,MBA,2025
6347477,597282,Franklin & Marshall Diplomats,597062,Washington Col. Shoremen,597062,6,bot,M. O'Connor doubled down the lf line.,64,2025-04-18T00:00:00-04:00,"Athey Park (Chestertown, MD)",146,MBA,2025
6347477,597282,Franklin & Marshall Diplomats,597062,Washington Col. Shoremen,597062,6,bot,T. Everitt flied out to lf down the lf line.,65,2025-04-18T00:00:00-04:00,"Athey Park (Chestertown, MD)",146,MBA,2025
6347477,597282,Franklin & Marshall Diplomats,597062,Washington Col. Shoremen,597062,6,bot,W. Turner struck out swinging.,66,2025-04-18T00:00:00-04:00,"Athey Park (Chestertown, MD)",146,MBA,2025
6347477,597282,Franklin & Marshall Diplomats,597062,Washington Col. Shoremen,597062,6,bot,D. Kinsey flied out to rf.,67,2025-04-18T00:00:00-04:00,"Athey Park (Chestertown, MD)",146,MBA,2025
6347477,597282,Franklin & Marshall Diplomats,597062,Washington Col. Shoremen,597282,7,top,E. Philiposi to p for T. Titus.,68,2025-04-18T00:00:00-04:00,"Athey Park (Chestertown, MD)",146,MBA,2025
6347477,597282,Franklin & Marshall Diplomats,597062,Washington Col. Shoremen,597282,7,top,N. McCloskey flied out to cf to left center.,69,2025-04-18T00:00:00-04:00,"Athey Park (Chestertown, MD)",146,MBA,2025
6347477,597282,Franklin & Marshall Diplomats,597062,Washington Col. Shoremen,597282,7,top,A. Desautels grounded out to ss.,70,2025-04-18T00:00:00-04:00,"Athey Park (Chestertown, MD)",146,MBA,2025
6347477,597282,Franklin & Marshall Diplomats,597062,Washington Col. Shoremen,597282,7,top,B. Falese flied out to cf.,71,2025-04-18T00:00:00-04:00,"Athey Park (Chestertown, MD)",146,MBA,2025
6347477,597282,Franklin & Marshall Diplomats,597062,Washington Col. Shoremen,597062,7,bot,C. Ruppel hit by pitch.,72,2025-04-18T00:00:00-04:00,"Athey Park (Chestertown, MD)",146,MBA,2025
6347477,597282,Franklin & Marshall Diplomats,597062,Washington Col. Shoremen,597062,7,bot,Z. Stolze struck out swinging.,73,2025-04-18T00:00:00-04:00,"Athey Park (Chestertown, MD)",146,MBA,2025
6347477,597282,Franklin & Marshall Diplomats,597062,Washington Col. Shoremen,597062,7,bot,A. Dardaris flied out to rf down the rf line.,74,2025-04-18T00:00:00-04:00,"Athey Park (Chestertown, MD)",146,MBA,2025
6347477,597282,Franklin & Marshall Diplomats,597062,Washington Col. Shoremen,597062,7,bot,R. Hirsh hit by pitch3a C. Ruppel advanced to second.,75,2025-04-18T00:00:00-04:00,"Athey Park (Chestertown, MD)",146,MBA,2025
6347477,597282,Franklin & Marshall Diplomats,597062,Washington Col. Shoremen,597062,7,bot,S. SanFilipp flied out to lf.,76,2025-04-18T00:00:00-04:00,"Athey Park (Chestertown, MD)",146,MBA,2025
6347477,597282,Franklin & Marshall Diplomats,597062,Washington Col. Shoremen,597282,8,top,T. Wolpert struck out swinging.,77,2025-04-18T00:00:00-04:00,"Athey Park (Chestertown, MD)",146,MBA,2025
6347477,597282,Franklin & Marshall Diplomats,597062,Washington Col. Shoremen,597282,8,top,M. Hollender hit by pitch.,78,2025-04-18T00:00:00-04:00,"Athey Park (Chestertown, MD)",146,MBA,2025
6347477,597282,Franklin & Marshall Diplomats,597062,Washington Col. Shoremen,597282,8,top,T. Repaci pinch ran for M. Hollender.,79,2025-04-18T00:00:00-04:00,"Athey Park (Chestertown, MD)",146,MBA,2025
6347477,597282,Franklin & Marshall Diplomats,597062,Washington Col. Shoremen,597282,8,top,T. Repaci stole second.,80,2025-04-18T00:00:00-04:00,"Athey Park (Chestertown, MD)",146,MBA,2025
6347477,597282,Franklin & Marshall Diplomats,597062,Washington Col. Shoremen,597282,8,top,"N. Lorenzo singled through the right side, RBI, advanced to second on a fielding error by rf, advanced to third3a T. Repaci scored.",81,2025-04-18T00:00:00-04:00,"Athey Park (Chestertown, MD)",146,MBA,2025
6347477,597282,Franklin & Marshall Diplomats,597062,Washington Col. Shoremen,597282,8,top,"A. Filippell singled through the left side, RBI3a N. Lorenzo scored, unearned.",82,2025-04-18T00:00:00-04:00,"Athey Park (Chestertown, MD)",146,MBA,2025
6347477,597282,Franklin & Marshall Diplomats,597062,Washington Col. Shoremen,597282,8,top,G. Halfpenny to p for E. Philiposi.,83,2025-04-18T00:00:00-04:00,"Athey Park (Chestertown, MD)",146,MBA,2025
6347477,597282,Franklin & Marshall Diplomats,597062,Washington Col. Shoremen,597282,8,top,N. Digiacomo struck out looking.,84,2025-04-18T00:00:00-04:00,"Athey Park (Chestertown, MD)",146,MBA,2025
6347477,597282,Franklin & Marshall Diplomats,597062,Washington Col. Shoremen,597282,8,top,C. Mackenzie out at first 1b to p.,85,2025-04-18T00:00:00-04:00,"Athey Park (Chestertown, MD)",146,MBA,2025
6347477,597282,Franklin & Marshall Diplomats,597062,Washington Col. Shoremen,597062,8,bot,G. Schwartz to c for T. Repaci.,86,2025-04-18T00:00:00-04:00,"Athey Park (Chestertown, MD)",146,MBA,2025
6347477,597282,Franklin & Marshall Diplomats,597062,Washington Col. Shoremen,597062,8,bot,L. Marshall to p for D. McGeorge.,87,2025-04-18T00:00:00-04:00,"Athey Park (Chestertown, MD)",146,MBA,2025
6347477,597282,Franklin & Marshall Diplomats,597062,Washington Col. Shoremen,597062,8,bot,M. O'Connor singled to right field.,88,2025-04-18T00:00:00-04:00,"Athey Park (Chestertown, MD)",146,MBA,2025
6347477,597282,Franklin & Marshall Diplomats,597062,Washington Col. Shoremen,597062,8,bot,T. Everitt grounded out to ss3a M. O'Connor advanced to second.,89,2025-04-18T00:00:00-04:00,"Athey Park (Chestertown, MD)",146,MBA,2025
6347477,597282,Franklin & Marshall Diplomats,597062,Washington Col. Shoremen,597062,8,bot,"W. Turner singled up the middle, RBI3a M. O'Connor scored.",90,2025-04-18T00:00:00-04:00,"Athey Park (Chestertown, MD)",146,MBA,2025
6347477,597282,Franklin & Marshall Diplomats,597062,Washington Col. Shoremen,597062,8,bot,S. Holl to p for L. Marshall.,91,2025-04-18T00:00:00-04:00,"Athey Park (Chestertown, MD)",146,MBA,2025
6347477,597282,Franklin & Marshall Diplomats,597062,Washington Col. Shoremen,597062,8,bot,D. Kinsey struck out looking.,92,2025-04-18T00:00:00-04:00,"Athey Park (Chestertown, MD)",146,MBA,2025
6347477,597282,Franklin & Marshall Diplomats,597062,Washington Col. Shoremen,597062,8,bot,C. Ruppel popped up to cf.,93,2025-04-18T00:00:00-04:00,"Athey Park (Chestertown, MD)",146,MBA,2025
6347477,597282,Franklin & Marshall Diplomats,597062,Washington Col. Shoremen,597282,9,top,N. McCloskey walked.,94,2025-04-18T00:00:00-04:00,"Athey Park (Chestertown, MD)",146,MBA,2025
6347477,597282,Franklin & Marshall Diplomats,597062,Washington Col. Shoremen,597282,9,top,N. McCloskey stole second.,95,2025-04-18T00:00:00-04:00,"Athey Park (Chestertown, MD)",146,MBA,2025
6347477,597282,Franklin & Marshall Diplomats,597062,Washington Col. Shoremen,597282,9,top,A. Desautels out at first 1b to p3a N. McCloskey advanced to third.,96,2025-04-18T00:00:00-04:00,"Athey Park (Chestertown, MD)",146,MBA,2025
6347477,597282,Franklin & Marshall Diplomats,597062,Washington Col. Shoremen,597282,9,top,B. Falese was intentionally walked.,97,2025-04-18T00:00:00-04:00,"Athey Park (Chestertown, MD)",146,MBA,2025
6347477,597282,Franklin & Marshall Diplomats,597062,Washington Col. Shoremen,597282,9,top,L. Girillo to p for G. Halfpenny.,98,2025-04-18T00:00:00-04:00,"Athey Park (Chestertown, MD)",146,MBA,2025
6347477,597282,Franklin & Marshall Diplomats,597062,Washington Col. Shoremen,597282,9,top,"T. Wolpert singled to right field, RBI3a B. Falese advanced to second3a N. McCloskey scored.",99,2025-04-18T00:00:00-04:00,"Athey Park (Chestertown, MD)",146,MBA,2025
6347477,597282,Franklin & Marshall Diplomats,597062,Washington Col. Shoremen,597282,9,top,"G. Schwartz reached on a fielder's choice to third base3a T. Wolpert advanced to second, advanced to third on a throwing error by 3b3a B. Falese out at third 3b unassisted.",100,2025-04-18T00:00:00-04:00,"Athey Park (Chestertown, MD)",146,MBA,2025
6347477,597282,Franklin & Marshall Diplomats,597062,Washington Col. Shoremen,597282,9,top,G. Schwartz stole second.,101,2025-04-18T00:00:00-04:00,"Athey Park (Chestertown, MD)",146,MBA,2025
6347477,597282,Franklin & Marshall Diplomats,597062,Washington Col. Shoremen,597282,9,top,N. Lorenzo popped up to ss.,102,2025-04-18T00:00:00-04:00,"Athey Park (Chestertown, MD)",146,MBA,2025
6347477,597282,Franklin & Marshall Diplomats,597062,Washington Col. Shoremen,597062,9,bot,B. Anvar to p for S. Holl.,103,2025-04-18T00:00:00-04:00,"Athey Park (Chestertown, MD)",146,MBA,2025
6347477,597282,Franklin & Marshall Diplomats,597062,Washington Col. Shoremen,597062,9,bot,Z. Stolze struck out swinging.,104,2025-04-18T00:00:00-04:00,"Athey Park (Chestertown, MD)",146,MBA,2025
6347477,597282,Franklin & Marshall Diplomats,597062,Washington Col. Shoremen,597062,9,bot,A. Dardaris walked.,105,2025-04-18T00:00:00-04:00,"Athey Park (Chestertown, MD)",146,MBA,2025
6347477,597282,Franklin & Marshall Diplomats,597062,Washington Col. Shoremen,597062,9,bot,M. Lewis pinch ran for A. Dardaris.,106,2025-04-18T00:00:00-04:00,"Athey Park (Chestertown, MD)",146,MBA,2025
6347477,597282,Franklin & Marshall Diplomats,597062,Washington Col. Shoremen,597062,9,bot,R. Hirsh struck out swinging3a M. Lewis advanced to second on a wild pitch.,107,2025-04-18T00:00:00-04:00,"Athey Park (Chestertown, MD)",146,MBA,2025
6347477,597282,Franklin & Marshall Diplomats,597062,Washington Col. Shoremen,597062,9,bot,S. SanFilipp flied out to cf.,108,2025-04-18T00:00:00-04:00,"Athey Park (Chestertown, MD)",146,MBA,2025
