game_id,away_team_id,away_team_name,home_team_id,home_team_name,batting_team,inning,top_bot,event_text,event_num,game_datetime,stadium_name,attendance,sport_id,season
6349256,596846,UT Tyler Patriots,596831,Lubbock Christian Chaparrals,596846,1,top,M. Hammonds struck out looking.,1,2025-02-01T00:00:00-05:00,"Hays Field (Lubbock, TX)",345,MBA,2025
6349256,596846,UT Tyler Patriots,596831,Lubbock Christian Chaparrals,596846,1,top,C. Conway lined out to ss.,2,2025-02-01T00:00:00-05:00,"Hays Field (Lubbock, TX)",345,MBA,2025
6349256,596846,UT Tyler Patriots,596831,Lubbock Christian Chaparrals,596846,1,top,K. Mason struck out swinging.,3,2025-02-01T00:00:00-05:00,"Hays Field (Lubbock, TX)",345,MBA,2025
6349256,596846,UT Tyler Patriots,596831,Lubbock Christian Chaparrals,596831,1,bot,K. York walked.,4,2025-02-01T00:00:00-05:00,"Hays Field (Lubbock, TX)",345,MBA,2025
6349256,596846,UT Tyler Patriots,596831,Lubbock Christian Chaparrals,596831,1,bot,S. Bowen struck out swinging.,5,2025-02-01T00:00:00-05:00,"Hays Field (Lubbock, TX)",345,MBA,2025
6349256,596846,UT Tyler Patriots,596831,Lubbock Christian Chaparrals,596831,1,bot,J. Gutierrez singled through the left side3a K. York advanced to second.,6,2025-02-01T00:00:00-05:00,"Hays Field (Lubbock, TX)",345,MBA,2025
6349256,596846,UT Tyler Patriots,596831,Lubbock Christian Chaparrals,596831,1,bot,N. Baumbach grounded into double play 2b to ss to 1b3a J. Gutierrez out on the play.,7,2025-02-01T00:00:00-05:00,"Hays Field (Lubbock, TX)",345,MBA,2025
6349256,596846,UT Tyler Patriots,596831,Lubbock Christian Chaparrals,596846,2,top,"E. Menard homered to right field, RBI.",8,2025-02-01T00:00:00-05:00,"Hays Field (Lubbock, TX)",345,MBA,2025
6349256,596846,UT Tyler Patriots,596831,Lubbock Christian Chaparrals,596846,2,top,B. Willis popped up to 2b down the rf line.,9,2025-02-01T00:00:00-05:00,"Hays Field (Lubbock, TX)",345,MBA,2025
6349256,596846,UT Tyler Patriots,596831,Lubbock Christian Chaparrals,596846,2,top,"K. Atkinson homered to center field, RBI.",10,2025-02-01T00:00:00-05:00,"Hays Field (Lubbock, TX)",345,MBA,2025
6349256,596846,UT Tyler Patriots,596831,Lubbock Christian Chaparrals,596846,2,top,C. Clark grounded out to ss.,11,2025-02-01T00:00:00-05:00,"Hays Field (Lubbock, TX)",345,MBA,2025
6349256,596846,UT Tyler Patriots,596831,Lubbock Christian Chaparrals,596846,2,top,T. Hornback hit by pitch.,12,2025-02-01T00:00:00-05:00,"Hays Field (Lubbock, TX)",345,MBA,2025
6349256,596846,UT Tyler Patriots,596831,Lubbock Christian Chaparrals,596846,2,top,T. Hornback stole second.,13,2025-02-01T00:00:00-05:00,"Hays Field (Lubbock, TX)",345,MBA,2025
6349256,596846,UT Tyler Patriots,596831,Lubbock Christian Chaparrals,596846,2,top,D. Schmidt walked.,14,2025-02-01T00:00:00-05:00,"Hays Field (Lubbock, TX)",345,MBA,2025
6349256,596846,UT Tyler Patriots,596831,Lubbock Christian Chaparrals,596846,2,top,D. Schmidt advanced to second3a T. Hornback advanced to third on a wild pitch.,15,2025-02-01T00:00:00-05:00,"Hays Field (Lubbock, TX)",345,MBA,2025
6349256,596846,UT Tyler Patriots,596831,Lubbock Christian Chaparrals,596846,2,top,M. Hammonds flied out to lf.,16,2025-02-01T00:00:00-05:00,"Hays Field (Lubbock, TX)",345,MBA,2025
6349256,596846,UT Tyler Patriots,596831,Lubbock Christian Chaparrals,596831,2,bot,"B. McCool homered to left field, RBI.",17,2025-02-01T00:00:00-05:00,"Hays Field (Lubbock, TX)",345,MBA,2025
6349256,596846,UT Tyler Patriots,596831,Lubbock Christian Chaparrals,596831,2,bot,E. Arreola grounded out to ss.,18,2025-02-01T00:00:00-05:00,"Hays Field (Lubbock, TX)",345,MBA,2025
6349256,596846,UT Tyler Patriots,596831,Lubbock Christian Chaparrals,596831,2,bot,R. Blackwell struck out looking.,19,2025-02-01T00:00:00-05:00,"Hays Field (Lubbock, TX)",345,MBA,2025
6349256,596846,UT Tyler Patriots,596831,Lubbock Christian Chaparrals,596831,2,bot,K. Lewis grounded out to 3b.,20,2025-02-01T00:00:00-05:00,"Hays Field (Lubbock, TX)",345,MBA,2025
6349256,596846,UT Tyler Patriots,596831,Lubbock Christian Chaparrals,596846,3,top,C. Conway flied out to cf.,21,2025-02-01T00:00:00-05:00,"Hays Field (Lubbock, TX)",345,MBA,2025
6349256,596846,UT Tyler Patriots,596831,Lubbock Christian Chaparrals,596846,3,top,K. Mason grounded out to p.,22,2025-02-01T00:00:00-05:00,"Hays Field (Lubbock, TX)",345,MBA,2025
6349256,596846,UT Tyler Patriots,596831,Lubbock Christian Chaparrals,596846,3,top,E. Menard singled to left field.,23,2025-02-01T00:00:00-05:00,"Hays Field (Lubbock, TX)",345,MBA,2025
6349256,596846,UT Tyler Patriots,596831,Lubbock Christian Chaparrals,596846,3,top,E. Menard advanced to second on a wild pitch.,24,2025-02-01T00:00:00-05:00,"Hays Field (Lubbock, TX)",345,MBA,2025
6349256,596846,UT Tyler Patriots,596831,Lubbock Christian Chaparrals,596846,3,top,"B. Willis tripled to right field, RBI3a E. Menard scored.",25,2025-02-01T00:00:00-05:00,"Hays Field (Lubbock, TX)",345,MBA,2025
6349256,596846,UT Tyler Patriots,596831,Lubbock Christian Chaparrals,596846,3,top,K. Atkinson walked.,26,2025-02-01T00:00:00-05:00,"Hays Field (Lubbock, TX)",345,MBA,2025
6349256,596846,UT Tyler Patriots,596831,Lubbock Christian Chaparrals,596846,3,top,"C. Clark singled to left center, advanced to second on an error by lf, RBI3a K. Atkinson advanced to third3a B. Willis scored.",27,2025-02-01T00:00:00-05:00,"Hays Field (Lubbock, TX)",345,MBA,2025
6349256,596846,UT Tyler Patriots,596831,Lubbock Christian Chaparrals,596846,3,top,"T. Hornback doubled to left center, 2 RBI3a C. Clark scored3a K. Atkinson scored.",28,2025-02-01T00:00:00-05:00,"Hays Field (Lubbock, TX)",345,MBA,2025
6349256,596846,UT Tyler Patriots,596831,Lubbock Christian Chaparrals,596846,3,top,B. Nall to p for E. Roach.,29,2025-02-01T00:00:00-05:00,"Hays Field (Lubbock, TX)",345,MBA,2025
6349256,596846,UT Tyler Patriots,596831,Lubbock Christian Chaparrals,596846,3,top,"D. Schmidt tripled to center field, RBI3a T. Hornback scored.",30,2025-02-01T00:00:00-05:00,"Hays Field (Lubbock, TX)",345,MBA,2025
6349256,596846,UT Tyler Patriots,596831,Lubbock Christian Chaparrals,596846,3,top,M. Hammonds grounded out to ss.,31,2025-02-01T00:00:00-05:00,"Hays Field (Lubbock, TX)",345,MBA,2025
6349256,596846,UT Tyler Patriots,596831,Lubbock Christian Chaparrals,596831,3,bot,C. Shield grounded out to p.,32,2025-02-01T00:00:00-05:00,"Hays Field (Lubbock, TX)",345,MBA,2025
6349256,596846,UT Tyler Patriots,596831,Lubbock Christian Chaparrals,596831,3,bot,K. York flied out to rf.,33,2025-02-01T00:00:00-05:00,"Hays Field (Lubbock, TX)",345,MBA,2025
6349256,596846,UT Tyler Patriots,596831,Lubbock Christian Chaparrals,596831,3,bot,S. Bowen singled to right field.,34,2025-02-01T00:00:00-05:00,"Hays Field (Lubbock, TX)",345,MBA,2025
6349256,596846,UT Tyler Patriots,596831,Lubbock Christian Chaparrals,596831,3,bot,J. Gutierrez grounded out to 3b.,35,2025-02-01T00:00:00-05:00,"Hays Field (Lubbock, TX)",345,MBA,2025
6349256,596846,UT Tyler Patriots,596831,Lubbock Christian Chaparrals,596846,4,top,C. Conway doubled to left center.,36,2025-02-01T00:00:00-05:00,"Hays Field (Lubbock, TX)",345,MBA,2025
6349256,596846,UT Tyler Patriots,596831,Lubbock Christian Chaparrals,596846,4,top,K. Dunn to p for B. Nall.,37,2025-02-01T00:00:00-05:00,"Hays Field (Lubbock, TX)",345,MBA,2025
6349256,596846,UT Tyler Patriots,596831,Lubbock Christian Chaparrals,596846,4,top,K. Mason walked.,38,2025-02-01T00:00:00-05:00,"Hays Field (Lubbock, TX)",345,MBA,2025
6349256,596846,UT Tyler Patriots,596831,Lubbock Christian Chaparrals,596846,4,top,"E. Menard reached on an error by ss, advanced to second3a K. Mason advanced to third3a C. Conway scored, unearned.",39,2025-02-01T00:00:00-05:00,"Hays Field (Lubbock, TX)",345,MBA,2025
6349256,596846,UT Tyler Patriots,596831,Lubbock Christian Chaparrals,596846,4,top,"B. Willis reached on an error by 3b, RBI3a K. Mason scored, unearned.",40,2025-02-01T00:00:00-05:00,"Hays Field (Lubbock, TX)",345,MBA,2025
6349256,596846,UT Tyler Patriots,596831,Lubbock Christian Chaparrals,596846,4,top,K. Atkinson popped up to ss.,41,2025-02-01T00:00:00-05:00,"Hays Field (Lubbock, TX)",345,MBA,2025
6349256,596846,UT Tyler Patriots,596831,Lubbock Christian Chaparrals,596846,4,top,C. Clark walked3a B. Willis advanced to second3a E. Menard advanced to third.,42,2025-02-01T00:00:00-05:00,"Hays Field (Lubbock, TX)",345,MBA,2025
6349256,596846,UT Tyler Patriots,596831,Lubbock Christian Chaparrals,596846,4,top,"T. Hornback flied out to rf, SAC, RBI3a C. Clark advanced to second3a B. Willis advanced to third3a E. Menard scored, unearned.",43,2025-02-01T00:00:00-05:00,"Hays Field (Lubbock, TX)",345,MBA,2025
6349256,596846,UT Tyler Patriots,596831,Lubbock Christian Chaparrals,596846,4,top,"D. Schmidt doubled to center field, 2 RBI3a C. Clark scored3a B. Willis scored, unearned.",44,2025-02-01T00:00:00-05:00,"Hays Field (Lubbock, TX)",345,MBA,2025
6349256,596846,UT Tyler Patriots,596831,Lubbock Christian Chaparrals,596846,4,top,"M. Hammonds doubled to left field, RBI3a D. Schmidt scored.",45,2025-02-01T00:00:00-05:00,"Hays Field (Lubbock, TX)",345,MBA,2025
6349256,596846,UT Tyler Patriots,596831,Lubbock Christian Chaparrals,596846,4,top,C. Conway grounded out to 2b.,46,2025-02-01T00:00:00-05:00,"Hays Field (Lubbock, TX)",345,MBA,2025
6349256,596846,UT Tyler Patriots,596831,Lubbock Christian Chaparrals,596831,4,bot,N. Baumbach struck out swinging.,47,2025-02-01T00:00:00-05:00,"Hays Field (Lubbock, TX)",345,MBA,2025
6349256,596846,UT Tyler Patriots,596831,Lubbock Christian Chaparrals,596831,4,bot,B. McCool grounded out to 3b.,48,2025-02-01T00:00:00-05:00,"Hays Field (Lubbock, TX)",345,MBA,2025
6349256,596846,UT Tyler Patriots,596831,Lubbock Christian Chaparrals,596831,4,bot,E. Arreola tripled to left center.,49,2025-02-01T00:00:00-05:00,"Hays Field (Lubbock, TX)",345,MBA,2025
6349256,596846,UT Tyler Patriots,596831,Lubbock Christian Chaparrals,596831,4,bot,"R. Blackwell singled through the right side, RBI3a E. Arreola scored.",50,2025-02-01T00:00:00-05:00,"Hays Field (Lubbock, TX)",345,MBA,2025
6349256,596846,UT Tyler Patriots,596831,Lubbock Christian Chaparrals,596831,4,bot,K. Lewis singled to right field3a R. Blackwell advanced to third.,51,2025-02-01T00:00:00-05:00,"Hays Field (Lubbock, TX)",345,MBA,2025
6349256,596846,UT Tyler Patriots,596831,Lubbock Christian Chaparrals,596831,4,bot,J. Gomez III pinch hit for C. Shield.,52,2025-02-01T00:00:00-05:00,"Hays Field (Lubbock, TX)",345,MBA,2025
6349256,596846,UT Tyler Patriots,596831,Lubbock Christian Chaparrals,596831,4,bot,"J. Gomez III singled to center field, RBI3a K. Lewis advanced to third3a R. Blackwell scored.",53,2025-02-01T00:00:00-05:00,"Hays Field (Lubbock, TX)",345,MBA,2025
6349256,596846,UT Tyler Patriots,596831,Lubbock Christian Chaparrals,596831,4,bot,"K. York doubled to right center, RBI3a J. Gomez III advanced to third3a K. Lewis scored.",54,2025-02-01T00:00:00-05:00,"Hays Field (Lubbock, TX)",345,MBA,2025
6349256,596846,UT Tyler Patriots,596831,Lubbock Christian Chaparrals,596831,4,bot,S. Bowen struck out looking.,55,2025-02-01T00:00:00-05:00,"Hays Field (Lubbock, TX)",345,MBA,2025
6349256,596846,UT Tyler Patriots,596831,Lubbock Christian Chaparrals,596846,5,top,J. Gutierrez to 1b.,56,2025-02-01T00:00:00-05:00,"Hays Field (Lubbock, TX)",345,MBA,2025
6349256,596846,UT Tyler Patriots,596831,Lubbock Christian Chaparrals,596846,5,top,B. McCool to 2b.,57,2025-02-01T00:00:00-05:00,"Hays Field (Lubbock, TX)",345,MBA,2025
6349256,596846,UT Tyler Patriots,596831,Lubbock Christian Chaparrals,596846,5,top,J. Gutierrez to rf.,58,2025-02-01T00:00:00-05:00,"Hays Field (Lubbock, TX)",345,MBA,2025
6349256,596846,UT Tyler Patriots,596831,Lubbock Christian Chaparrals,596846,5,top,J. Gomez III to 1b.,59,2025-02-01T00:00:00-05:00,"Hays Field (Lubbock, TX)",345,MBA,2025
6349256,596846,UT Tyler Patriots,596831,Lubbock Christian Chaparrals,596846,5,top,K. Mason grounded out to 2b.,60,2025-02-01T00:00:00-05:00,"Hays Field (Lubbock, TX)",345,MBA,2025
6349256,596846,UT Tyler Patriots,596831,Lubbock Christian Chaparrals,596846,5,top,E. Menard doubled to left center.,61,2025-02-01T00:00:00-05:00,"Hays Field (Lubbock, TX)",345,MBA,2025
6349256,596846,UT Tyler Patriots,596831,Lubbock Christian Chaparrals,596846,5,top,B. Willis grounded out to 2b.,62,2025-02-01T00:00:00-05:00,"Hays Field (Lubbock, TX)",345,MBA,2025
6349256,596846,UT Tyler Patriots,596831,Lubbock Christian Chaparrals,596846,5,top,K. Atkinson struck out swinging.,63,2025-02-01T00:00:00-05:00,"Hays Field (Lubbock, TX)",345,MBA,2025
6349256,596846,UT Tyler Patriots,596831,Lubbock Christian Chaparrals,596831,5,bot,J. Gutierrez singled to right field.,64,2025-02-01T00:00:00-05:00,"Hays Field (Lubbock, TX)",345,MBA,2025
6349256,596846,UT Tyler Patriots,596831,Lubbock Christian Chaparrals,596831,5,bot,N. Baumbach flied out to cf.,65,2025-02-01T00:00:00-05:00,"Hays Field (Lubbock, TX)",345,MBA,2025
6349256,596846,UT Tyler Patriots,596831,Lubbock Christian Chaparrals,596831,5,bot,B. McCool flied out to lf.,66,2025-02-01T00:00:00-05:00,"Hays Field (Lubbock, TX)",345,MBA,2025
6349256,596846,UT Tyler Patriots,596831,Lubbock Christian Chaparrals,596831,5,bot,E. Arreola grounded out to p.,67,2025-02-01T00:00:00-05:00,"Hays Field (Lubbock, TX)",345,MBA,2025
6349256,596846,UT Tyler Patriots,596831,Lubbock Christian Chaparrals,596846,6,top,C. Clark singled up the middle.,68,2025-02-01T00:00:00-05:00,"Hays Field (Lubbock, TX)",345,MBA,2025
6349256,596846,UT Tyler Patriots,596831,Lubbock Christian Chaparrals,596846,6,top,T. Hornback singled to center field3a C. Clark advanced to third.,69,2025-02-01T00:00:00-05:00,"Hays Field (Lubbock, TX)",345,MBA,2025
6349256,596846,UT Tyler Patriots,596831,Lubbock Christian Chaparrals,596846,6,top,T. Hornback advanced to second on a wild pitch.,70,2025-02-01T00:00:00-05:00,"Hays Field (Lubbock, TX)",345,MBA,2025
6349256,596846,UT Tyler Patriots,596831,Lubbock Christian Chaparrals,596846,6,top,"D. Schmidt doubled to right center, 2 RBI3a T. Hornback scored3a C. Clark scored.",71,2025-02-01T00:00:00-05:00,"Hays Field (Lubbock, TX)",345,MBA,2025
6349256,596846,UT Tyler Patriots,596831,Lubbock Christian Chaparrals,596846,6,top,M. Hammonds hit by pitch.,72,2025-02-01T00:00:00-05:00,"Hays Field (Lubbock, TX)",345,MBA,2025
6349256,596846,UT Tyler Patriots,596831,Lubbock Christian Chaparrals,596846,6,top,B. Jewell pinch ran for M. Hammonds.,73,2025-02-01T00:00:00-05:00,"Hays Field (Lubbock, TX)",345,MBA,2025
6349256,596846,UT Tyler Patriots,596831,Lubbock Christian Chaparrals,596846,6,top,C. Conway singled to left center3a B. Jewell advanced to second3a D. Schmidt advanced to third.,74,2025-02-01T00:00:00-05:00,"Hays Field (Lubbock, TX)",345,MBA,2025
6349256,596846,UT Tyler Patriots,596831,Lubbock Christian Chaparrals,596846,6,top,L. Moore to p for K. Dunn.,75,2025-02-01T00:00:00-05:00,"Hays Field (Lubbock, TX)",345,MBA,2025
6349256,596846,UT Tyler Patriots,596831,Lubbock Christian Chaparrals,596846,6,top,K. Mason struck out swinging.,76,2025-02-01T00:00:00-05:00,"Hays Field (Lubbock, TX)",345,MBA,2025
6349256,596846,UT Tyler Patriots,596831,Lubbock Christian Chaparrals,596846,6,top,E. Menard grounded into double play ss to 2b to 1b3a C. Conway out on the play.,77,2025-02-01T00:00:00-05:00,"Hays Field (Lubbock, TX)",345,MBA,2025
6349256,596846,UT Tyler Patriots,596831,Lubbock Christian Chaparrals,596831,6,bot,N. Niebur to p for D. Blomquist.,78,2025-02-01T00:00:00-05:00,"Hays Field (Lubbock, TX)",345,MBA,2025
6349256,596846,UT Tyler Patriots,596831,Lubbock Christian Chaparrals,596831,6,bot,B. Jewell to 3b.,79,2025-02-01T00:00:00-05:00,"Hays Field (Lubbock, TX)",345,MBA,2025
6349256,596846,UT Tyler Patriots,596831,Lubbock Christian Chaparrals,596831,6,bot,R. Blackwell grounded out to 3b.,80,2025-02-01T00:00:00-05:00,"Hays Field (Lubbock, TX)",345,MBA,2025
6349256,596846,UT Tyler Patriots,596831,Lubbock Christian Chaparrals,596831,6,bot,K. Lewis out at first 1b to p.,81,2025-02-01T00:00:00-05:00,"Hays Field (Lubbock, TX)",345,MBA,2025
6349256,596846,UT Tyler Patriots,596831,Lubbock Christian Chaparrals,596831,6,bot,J. Gomez III singled to center field.,82,2025-02-01T00:00:00-05:00,"Hays Field (Lubbock, TX)",345,MBA,2025
6349256,596846,UT Tyler Patriots,596831,Lubbock Christian Chaparrals,596831,6,bot,K. York flied out to cf to left center.,83,2025-02-01T00:00:00-05:00,"Hays Field (Lubbock, TX)",345,MBA,2025
6349256,596846,UT Tyler Patriots,596831,Lubbock Christian Chaparrals,596846,7,top,W. Cooper to p for L. Moore.,84,2025-02-01T00:00:00-05:00,"Hays Field (Lubbock, TX)",345,MBA,2025
6349256,596846,UT Tyler Patriots,596831,Lubbock Christian Chaparrals,596846,7,top,B. Willis struck out swinging.,85,2025-02-01T00:00:00-05:00,"Hays Field (Lubbock, TX)",345,MBA,2025
6349256,596846,UT Tyler Patriots,596831,Lubbock Christian Chaparrals,596846,7,top,K. Atkinson walked.,86,2025-02-01T00:00:00-05:00,"Hays Field (Lubbock, TX)",345,MBA,2025
6349256,596846,UT Tyler Patriots,596831,Lubbock Christian Chaparrals,596846,7,top,R. Walker pinch hit for C. Clark.,87,2025-02-01T00:00:00-05:00,"Hays Field (Lubbock, TX)",345,MBA,2025
6349256,596846,UT Tyler Patriots,596831,Lubbock Christian Chaparrals,596846,7,top,R. Walker hit by pitch3a K. Atkinson advanced to second.,88,2025-02-01T00:00:00-05:00,"Hays Field (Lubbock, TX)",345,MBA,2025
6349256,596846,UT Tyler Patriots,596831,Lubbock Christian Chaparrals,596846,7,top,T. Hornback walked3a R. Walker advanced to second3a K. Atkinson advanced to third.,89,2025-02-01T00:00:00-05:00,"Hays Field (Lubbock, TX)",345,MBA,2025
6349256,596846,UT Tyler Patriots,596831,Lubbock Christian Chaparrals,596846,7,top,"D. Schmidt reached on a fielder's choice, RBI3a T. Hornback out at second 3b to 2b3a R. Walker advanced to third3a K. Atkinson scored.",90,2025-02-01T00:00:00-05:00,"Hays Field (Lubbock, TX)",345,MBA,2025
6349256,596846,UT Tyler Patriots,596831,Lubbock Christian Chaparrals,596846,7,top,B. Jewell popped up to 2b.,91,2025-02-01T00:00:00-05:00,"Hays Field (Lubbock, TX)",345,MBA,2025
6349256,596846,UT Tyler Patriots,596831,Lubbock Christian Chaparrals,596831,7,bot,J. Garcia to p for N. Niebur.,92,2025-02-01T00:00:00-05:00,"Hays Field (Lubbock, TX)",345,MBA,2025
6349256,596846,UT Tyler Patriots,596831,Lubbock Christian Chaparrals,596831,7,bot,B. Bearden to cf.,93,2025-02-01T00:00:00-05:00,"Hays Field (Lubbock, TX)",345,MBA,2025
6349256,596846,UT Tyler Patriots,596831,Lubbock Christian Chaparrals,596831,7,bot,R. Walker to lf.,94,2025-02-01T00:00:00-05:00,"Hays Field (Lubbock, TX)",345,MBA,2025
6349256,596846,UT Tyler Patriots,596831,Lubbock Christian Chaparrals,596831,7,bot,S. Bowen doubled to right center.,95,2025-02-01T00:00:00-05:00,"Hays Field (Lubbock, TX)",345,MBA,2025
6349256,596846,UT Tyler Patriots,596831,Lubbock Christian Chaparrals,596831,7,bot,S. Bowen advanced to third on a wild pitch.,96,2025-02-01T00:00:00-05:00,"Hays Field (Lubbock, TX)",345,MBA,2025
6349256,596846,UT Tyler Patriots,596831,Lubbock Christian Chaparrals,596831,7,bot,J. Gutierrez struck out swinging.,97,2025-02-01T00:00:00-05:00,"Hays Field (Lubbock, TX)",345,MBA,2025
6349256,596846,UT Tyler Patriots,596831,Lubbock Christian Chaparrals,596831,7,bot,N. Baumbach struck out swinging.,98,2025-02-01T00:00:00-05:00,"Hays Field (Lubbock, TX)",345,MBA,2025
6349256,596846,UT Tyler Patriots,596831,Lubbock Christian Chaparrals,596831,7,bot,B. McCool flied out to rf.,99,2025-02-01T00:00:00-05:00,"Hays Field (Lubbock, TX)",345,MBA,2025
