game_id,away_team_id,away_team_name,home_team_id,home_team_name,batting_team,inning,top_bot,event_text,event_num,game_datetime,stadium_name,attendance,sport_id,season
6349043,597252,Claremont-M-S Stags,597237,Cal Lutheran Kingsmen,597252,1,top,N. Seluga doubled down the lf line.,1,2025-05-03T00:00:00-04:00,"Ullman Stadium (Thousand Oaks, CA)",142,MBA,2025
6349043,597252,Claremont-M-S Stags,597237,Cal Lutheran Kingsmen,597252,1,top,D. Martin struck out looking.,2,2025-05-03T00:00:00-04:00,"Ullman Stadium (Thousand Oaks, CA)",142,MBA,2025
6349043,597252,Claremont-M-S Stags,597237,Cal Lutheran Kingsmen,597252,1,top,A. Henderson singled to left field3a N. Seluga advanced to third.,3,2025-05-03T00:00:00-04:00,"Ullman Stadium (Thousand Oaks, CA)",142,MBA,2025
6349043,597252,Claremont-M-S Stags,597237,Cal Lutheran Kingsmen,597252,1,top,"A. Mazzone flied out to lf, sacrifice fly, RBI3a N. Seluga scored.",4,2025-05-03T00:00:00-04:00,"Ullman Stadium (Thousand Oaks, CA)",142,MBA,2025
6349043,597252,Claremont-M-S Stags,597237,Cal Lutheran Kingsmen,597252,1,top,B. Didrickso grounded out to 2b.,5,2025-05-03T00:00:00-04:00,"Ullman Stadium (Thousand Oaks, CA)",142,MBA,2025
6349043,597252,Claremont-M-S Stags,597237,Cal Lutheran Kingsmen,597237,1,bot,J. Dawson grounded out to 2b.,6,2025-05-03T00:00:00-04:00,"Ullman Stadium (Thousand Oaks, CA)",142,MBA,2025
6349043,597252,Claremont-M-S Stags,597237,Cal Lutheran Kingsmen,597237,1,bot,N. Matsumoto struck out looking.,7,2025-05-03T00:00:00-04:00,"Ullman Stadium (Thousand Oaks, CA)",142,MBA,2025
6349043,597252,Claremont-M-S Stags,597237,Cal Lutheran Kingsmen,597237,1,bot,A. Garcia doubled down the rf line.,8,2025-05-03T00:00:00-04:00,"Ullman Stadium (Thousand Oaks, CA)",142,MBA,2025
6349043,597252,Claremont-M-S Stags,597237,Cal Lutheran Kingsmen,597237,1,bot,L. Danielewi struck out swinging.,9,2025-05-03T00:00:00-04:00,"Ullman Stadium (Thousand Oaks, CA)",142,MBA,2025
6349043,597252,Claremont-M-S Stags,597237,Cal Lutheran Kingsmen,597252,2,top,B. Heher struck out swinging.,10,2025-05-03T00:00:00-04:00,"Ullman Stadium (Thousand Oaks, CA)",142,MBA,2025
6349043,597252,Claremont-M-S Stags,597237,Cal Lutheran Kingsmen,597252,2,top,C. Bennett fouled out to 3b.,11,2025-05-03T00:00:00-04:00,"Ullman Stadium (Thousand Oaks, CA)",142,MBA,2025
6349043,597252,Claremont-M-S Stags,597237,Cal Lutheran Kingsmen,597252,2,top,R. Gordon flied out to cf.,12,2025-05-03T00:00:00-04:00,"Ullman Stadium (Thousand Oaks, CA)",142,MBA,2025
6349043,597252,Claremont-M-S Stags,597237,Cal Lutheran Kingsmen,597237,2,bot,J. Quinn fouled out to 1b.,13,2025-05-03T00:00:00-04:00,"Ullman Stadium (Thousand Oaks, CA)",142,MBA,2025
6349043,597252,Claremont-M-S Stags,597237,Cal Lutheran Kingsmen,597237,2,bot,K. Caranto grounded out to ss.,14,2025-05-03T00:00:00-04:00,"Ullman Stadium (Thousand Oaks, CA)",142,MBA,2025
6349043,597252,Claremont-M-S Stags,597237,Cal Lutheran Kingsmen,597237,2,bot,T. Anderson struck out looking.,15,2025-05-03T00:00:00-04:00,"Ullman Stadium (Thousand Oaks, CA)",142,MBA,2025
6349043,597252,Claremont-M-S Stags,597237,Cal Lutheran Kingsmen,597252,3,top,M. Pemberton struck out swinging.,16,2025-05-03T00:00:00-04:00,"Ullman Stadium (Thousand Oaks, CA)",142,MBA,2025
6349043,597252,Claremont-M-S Stags,597237,Cal Lutheran Kingsmen,597252,3,top,"N. Seluga struck out looking, out at first c to 1b.",17,2025-05-03T00:00:00-04:00,"Ullman Stadium (Thousand Oaks, CA)",142,MBA,2025
6349043,597252,Claremont-M-S Stags,597237,Cal Lutheran Kingsmen,597252,3,top,D. Martin tripled down the lf line.,18,2025-05-03T00:00:00-04:00,"Ullman Stadium (Thousand Oaks, CA)",142,MBA,2025
6349043,597252,Claremont-M-S Stags,597237,Cal Lutheran Kingsmen,597252,3,top,A. Henderson flied out to lf.,19,2025-05-03T00:00:00-04:00,"Ullman Stadium (Thousand Oaks, CA)",142,MBA,2025
6349043,597252,Claremont-M-S Stags,597237,Cal Lutheran Kingsmen,597237,3,bot,C. Vega struck out swinging.,20,2025-05-03T00:00:00-04:00,"Ullman Stadium (Thousand Oaks, CA)",142,MBA,2025
6349043,597252,Claremont-M-S Stags,597237,Cal Lutheran Kingsmen,597237,3,bot,E. Gonzalez grounded out to 3b.,21,2025-05-03T00:00:00-04:00,"Ullman Stadium (Thousand Oaks, CA)",142,MBA,2025
6349043,597252,Claremont-M-S Stags,597237,Cal Lutheran Kingsmen,597237,3,bot,J. Dawson singled through the left side.,22,2025-05-03T00:00:00-04:00,"Ullman Stadium (Thousand Oaks, CA)",142,MBA,2025
6349043,597252,Claremont-M-S Stags,597237,Cal Lutheran Kingsmen,597237,3,bot,N. Matsumoto popped up to ss.,23,2025-05-03T00:00:00-04:00,"Ullman Stadium (Thousand Oaks, CA)",142,MBA,2025
6349043,597252,Claremont-M-S Stags,597237,Cal Lutheran Kingsmen,597252,4,top,A. Mazzone flied out to cf.,24,2025-05-03T00:00:00-04:00,"Ullman Stadium (Thousand Oaks, CA)",142,MBA,2025
6349043,597252,Claremont-M-S Stags,597237,Cal Lutheran Kingsmen,597252,4,top,B. Didrickso lined out to lf.,25,2025-05-03T00:00:00-04:00,"Ullman Stadium (Thousand Oaks, CA)",142,MBA,2025
6349043,597252,Claremont-M-S Stags,597237,Cal Lutheran Kingsmen,597252,4,top,B. Heher grounded out to ss.,26,2025-05-03T00:00:00-04:00,"Ullman Stadium (Thousand Oaks, CA)",142,MBA,2025
6349043,597252,Claremont-M-S Stags,597237,Cal Lutheran Kingsmen,597237,4,bot,A. Garcia lined out to lf.,27,2025-05-03T00:00:00-04:00,"Ullman Stadium (Thousand Oaks, CA)",142,MBA,2025
6349043,597252,Claremont-M-S Stags,597237,Cal Lutheran Kingsmen,597237,4,bot,L. Danielewi grounded out to p.,28,2025-05-03T00:00:00-04:00,"Ullman Stadium (Thousand Oaks, CA)",142,MBA,2025
6349043,597252,Claremont-M-S Stags,597237,Cal Lutheran Kingsmen,597237,4,bot,J. Quinn struck out swinging.,29,2025-05-03T00:00:00-04:00,"Ullman Stadium (Thousand Oaks, CA)",142,MBA,2025
6349043,597252,Claremont-M-S Stags,597237,Cal Lutheran Kingsmen,597252,5,top,C. Bennett struck out looking.,30,2025-05-03T00:00:00-04:00,"Ullman Stadium (Thousand Oaks, CA)",142,MBA,2025
6349043,597252,Claremont-M-S Stags,597237,Cal Lutheran Kingsmen,597252,5,top,R. Gordon singled through the right side.,31,2025-05-03T00:00:00-04:00,"Ullman Stadium (Thousand Oaks, CA)",142,MBA,2025
6349043,597252,Claremont-M-S Stags,597237,Cal Lutheran Kingsmen,597252,5,top,M. Pemberton struck out swinging.,32,2025-05-03T00:00:00-04:00,"Ullman Stadium (Thousand Oaks, CA)",142,MBA,2025
6349043,597252,Claremont-M-S Stags,597237,Cal Lutheran Kingsmen,597252,5,top,N. Seluga singled to right field3a R. Gordon advanced to third.,33,2025-05-03T00:00:00-04:00,"Ullman Stadium (Thousand Oaks, CA)",142,MBA,2025
6349043,597252,Claremont-M-S Stags,597237,Cal Lutheran Kingsmen,597252,5,top,D. Martin flied out to rf.,34,2025-05-03T00:00:00-04:00,"Ullman Stadium (Thousand Oaks, CA)",142,MBA,2025
6349043,597252,Claremont-M-S Stags,597237,Cal Lutheran Kingsmen,597237,5,bot,K. Caranto singled to right field.,35,2025-05-03T00:00:00-04:00,"Ullman Stadium (Thousand Oaks, CA)",142,MBA,2025
6349043,597252,Claremont-M-S Stags,597237,Cal Lutheran Kingsmen,597237,5,bot,T. Anderson struck out swinging.,36,2025-05-03T00:00:00-04:00,"Ullman Stadium (Thousand Oaks, CA)",142,MBA,2025
6349043,597252,Claremont-M-S Stags,597237,Cal Lutheran Kingsmen,597237,5,bot,C. Vega flied out to lf.,37,2025-05-03T00:00:00-04:00,"Ullman Stadium (Thousand Oaks, CA)",142,MBA,2025
6349043,597252,Claremont-M-S Stags,597237,Cal Lutheran Kingsmen,597237,5,bot,E. Gonzalez struck out looking.,38,2025-05-03T00:00:00-04:00,"Ullman Stadium (Thousand Oaks, CA)",142,MBA,2025
6349043,597252,Claremont-M-S Stags,597237,Cal Lutheran Kingsmen,597252,6,top,A. Henderson struck out swinging.,39,2025-05-03T00:00:00-04:00,"Ullman Stadium (Thousand Oaks, CA)",142,MBA,2025
6349043,597252,Claremont-M-S Stags,597237,Cal Lutheran Kingsmen,597252,6,top,A. Mazzone lined out to lf.,40,2025-05-03T00:00:00-04:00,"Ullman Stadium (Thousand Oaks, CA)",142,MBA,2025
6349043,597252,Claremont-M-S Stags,597237,Cal Lutheran Kingsmen,597252,6,top,B. Didrickso flied out to cf.,41,2025-05-03T00:00:00-04:00,"Ullman Stadium (Thousand Oaks, CA)",142,MBA,2025
6349043,597252,Claremont-M-S Stags,597237,Cal Lutheran Kingsmen,597237,6,bot,J. Dawson singled to left field.,42,2025-05-03T00:00:00-04:00,"Ullman Stadium (Thousand Oaks, CA)",142,MBA,2025
6349043,597252,Claremont-M-S Stags,597237,Cal Lutheran Kingsmen,597237,6,bot,N. Matsumoto grounded out to 1b unassisted3a J. Dawson advanced to second.,43,2025-05-03T00:00:00-04:00,"Ullman Stadium (Thousand Oaks, CA)",142,MBA,2025
6349043,597252,Claremont-M-S Stags,597237,Cal Lutheran Kingsmen,597237,6,bot,A. Garcia grounded out to 2b3a J. Dawson advanced to third.,44,2025-05-03T00:00:00-04:00,"Ullman Stadium (Thousand Oaks, CA)",142,MBA,2025
6349043,597252,Claremont-M-S Stags,597237,Cal Lutheran Kingsmen,597237,6,bot,L. Danielewi grounded out to 2b.,45,2025-05-03T00:00:00-04:00,"Ullman Stadium (Thousand Oaks, CA)",142,MBA,2025
6349043,597252,Claremont-M-S Stags,597237,Cal Lutheran Kingsmen,597252,7,top,B. Heher grounded out to 1b unassisted.,46,2025-05-03T00:00:00-04:00,"Ullman Stadium (Thousand Oaks, CA)",142,MBA,2025
6349043,597252,Claremont-M-S Stags,597237,Cal Lutheran Kingsmen,597252,7,top,C. Bennett flied out to rf.,47,2025-05-03T00:00:00-04:00,"Ullman Stadium (Thousand Oaks, CA)",142,MBA,2025
6349043,597252,Claremont-M-S Stags,597237,Cal Lutheran Kingsmen,597252,7,top,R. Gordon flied out to ss.,48,2025-05-03T00:00:00-04:00,"Ullman Stadium (Thousand Oaks, CA)",142,MBA,2025
6349043,597252,Claremont-M-S Stags,597237,Cal Lutheran Kingsmen,597237,7,bot,J. Quinn fouled out to 3b.,49,2025-05-03T00:00:00-04:00,"Ullman Stadium (Thousand Oaks, CA)",142,MBA,2025
6349043,597252,Claremont-M-S Stags,597237,Cal Lutheran Kingsmen,597237,7,bot,K. Caranto singled down the lf line.,50,2025-05-03T00:00:00-04:00,"Ullman Stadium (Thousand Oaks, CA)",142,MBA,2025
6349043,597252,Claremont-M-S Stags,597237,Cal Lutheran Kingsmen,597237,7,bot,K. Caranto advanced to second on a wild pitch.,51,2025-05-03T00:00:00-04:00,"Ullman Stadium (Thousand Oaks, CA)",142,MBA,2025
6349043,597252,Claremont-M-S Stags,597237,Cal Lutheran Kingsmen,597237,7,bot,T. Anderson popped up to 2b.,52,2025-05-03T00:00:00-04:00,"Ullman Stadium (Thousand Oaks, CA)",142,MBA,2025
6349043,597252,Claremont-M-S Stags,597237,Cal Lutheran Kingsmen,597237,7,bot,C. Vega grounded out to ss.,53,2025-05-03T00:00:00-04:00,"Ullman Stadium (Thousand Oaks, CA)",142,MBA,2025
6349043,597252,Claremont-M-S Stags,597237,Cal Lutheran Kingsmen,597252,8,top,M. Pemberton flied out to lf.,54,2025-05-03T00:00:00-04:00,"Ullman Stadium (Thousand Oaks, CA)",142,MBA,2025
6349043,597252,Claremont-M-S Stags,597237,Cal Lutheran Kingsmen,597252,8,top,N. Seluga flied out to lf.,55,2025-05-03T00:00:00-04:00,"Ullman Stadium (Thousand Oaks, CA)",142,MBA,2025
6349043,597252,Claremont-M-S Stags,597237,Cal Lutheran Kingsmen,597252,8,top,D. Martin grounded out to ss.,56,2025-05-03T00:00:00-04:00,"Ullman Stadium (Thousand Oaks, CA)",142,MBA,2025
6349043,597252,Claremont-M-S Stags,597237,Cal Lutheran Kingsmen,597237,8,bot,P. McGraw to p for M. Bergan.,57,2025-05-03T00:00:00-04:00,"Ullman Stadium (Thousand Oaks, CA)",142,MBA,2025
6349043,597252,Claremont-M-S Stags,597237,Cal Lutheran Kingsmen,597237,8,bot,D. Orozco pinch hit for E. Gonzalez.,58,2025-05-03T00:00:00-04:00,"Ullman Stadium (Thousand Oaks, CA)",142,MBA,2025
6349043,597252,Claremont-M-S Stags,597237,Cal Lutheran Kingsmen,597237,8,bot,D. Orozco grounded out to 2b.,59,2025-05-03T00:00:00-04:00,"Ullman Stadium (Thousand Oaks, CA)",142,MBA,2025
6349043,597252,Claremont-M-S Stags,597237,Cal Lutheran Kingsmen,597237,8,bot,J. Dawson flied out to rf.,60,2025-05-03T00:00:00-04:00,"Ullman Stadium (Thousand Oaks, CA)",142,MBA,2025
6349043,597252,Claremont-M-S Stags,597237,Cal Lutheran Kingsmen,597237,8,bot,N. Matsumoto singled through the right side.,61,2025-05-03T00:00:00-04:00,"Ullman Stadium (Thousand Oaks, CA)",142,MBA,2025
6349043,597252,Claremont-M-S Stags,597237,Cal Lutheran Kingsmen,597237,8,bot,W. Crosby pinch ran for N. Matsumoto.,62,2025-05-03T00:00:00-04:00,"Ullman Stadium (Thousand Oaks, CA)",142,MBA,2025
6349043,597252,Claremont-M-S Stags,597237,Cal Lutheran Kingsmen,597237,8,bot,A. Garcia lined out to 2b.,63,2025-05-03T00:00:00-04:00,"Ullman Stadium (Thousand Oaks, CA)",142,MBA,2025
6349043,597252,Claremont-M-S Stags,597237,Cal Lutheran Kingsmen,597252,9,top,G. Zitko to c for D. Orozco.,64,2025-05-03T00:00:00-04:00,"Ullman Stadium (Thousand Oaks, CA)",142,MBA,2025
6349043,597252,Claremont-M-S Stags,597237,Cal Lutheran Kingsmen,597252,9,top,A. Henderson flied out to cf.,65,2025-05-03T00:00:00-04:00,"Ullman Stadium (Thousand Oaks, CA)",142,MBA,2025
6349043,597252,Claremont-M-S Stags,597237,Cal Lutheran Kingsmen,597252,9,top,A. Mazzone hit by pitch.,66,2025-05-03T00:00:00-04:00,"Ullman Stadium (Thousand Oaks, CA)",142,MBA,2025
6349043,597252,Claremont-M-S Stags,597237,Cal Lutheran Kingsmen,597252,9,top,C. Kalil pinch ran for A. Mazzone.,67,2025-05-03T00:00:00-04:00,"Ullman Stadium (Thousand Oaks, CA)",142,MBA,2025
6349043,597252,Claremont-M-S Stags,597237,Cal Lutheran Kingsmen,597252,9,top,"B. Didrickso doubled down the lf line, RBI3a C. Kalil scored.",68,2025-05-03T00:00:00-04:00,"Ullman Stadium (Thousand Oaks, CA)",142,MBA,2025
6349043,597252,Claremont-M-S Stags,597237,Cal Lutheran Kingsmen,597252,9,top,O. Lopez to p for L. Bristow.,69,2025-05-03T00:00:00-04:00,"Ullman Stadium (Thousand Oaks, CA)",142,MBA,2025
6349043,597252,Claremont-M-S Stags,597237,Cal Lutheran Kingsmen,597252,9,top,B. Heher struck out swinging.,70,2025-05-03T00:00:00-04:00,"Ullman Stadium (Thousand Oaks, CA)",142,MBA,2025
6349043,597252,Claremont-M-S Stags,597237,Cal Lutheran Kingsmen,597252,9,top,C. Bennett walked.,71,2025-05-03T00:00:00-04:00,"Ullman Stadium (Thousand Oaks, CA)",142,MBA,2025
6349043,597252,Claremont-M-S Stags,597237,Cal Lutheran Kingsmen,597252,9,top,R. Gordon reached on a fielder's choice3a C. Bennett out at second ss to 2b.,72,2025-05-03T00:00:00-04:00,"Ullman Stadium (Thousand Oaks, CA)",142,MBA,2025
6349043,597252,Claremont-M-S Stags,597237,Cal Lutheran Kingsmen,597237,9,bot,L. Danielewi singled to right field.,73,2025-05-03T00:00:00-04:00,"Ullman Stadium (Thousand Oaks, CA)",142,MBA,2025
6349043,597252,Claremont-M-S Stags,597237,Cal Lutheran Kingsmen,597237,9,bot,J. Quinn struck out swinging.,74,2025-05-03T00:00:00-04:00,"Ullman Stadium (Thousand Oaks, CA)",142,MBA,2025
6349043,597252,Claremont-M-S Stags,597237,Cal Lutheran Kingsmen,597237,9,bot,K. Caranto reached on a fielder's choice3a L. Danielewi out at second ss unassisted.,75,2025-05-03T00:00:00-04:00,"Ullman Stadium (Thousand Oaks, CA)",142,MBA,2025
6349043,597252,Claremont-M-S Stags,597237,Cal Lutheran Kingsmen,597237,9,bot,R. Farr pinch hit for T. Anderson.,76,2025-05-03T00:00:00-04:00,"Ullman Stadium (Thousand Oaks, CA)",142,MBA,2025
6349043,597252,Claremont-M-S Stags,597237,Cal Lutheran Kingsmen,597237,9,bot,K. Caranto advanced to second on a wild pitch.,77,2025-05-03T00:00:00-04:00,"Ullman Stadium (Thousand Oaks, CA)",142,MBA,2025
6349043,597252,Claremont-M-S Stags,597237,Cal Lutheran Kingsmen,597237,9,bot,R. Farr struck out swinging.,78,2025-05-03T00:00:00-04:00,"Ullman Stadium (Thousand Oaks, CA)",142,MBA,2025
