game_id,away_team_id,away_team_name,home_team_id,home_team_name,batting_team,inning,top_bot,event_text,event_num,game_datetime,stadium_name,attendance,sport_id,season
6350183,596894,Ky. Wesleyan Panthers,596724,Fairmont St. Falcons,596894,1,top,L. Hutson flied out to cf.,1,2025-03-08T00:00:00-05:00,"Bridgeport Recreation Complex (Bridgeport, WV)",36,MBA,2025
6350183,596894,Ky. Wesleyan Panthers,596724,Fairmont St. Falcons,596894,1,top,C. Perry singled to left field.,2,2025-03-08T00:00:00-05:00,"Bridgeport Recreation Complex (Bridgeport, WV)",36,MBA,2025
6350183,596894,Ky. Wesleyan Panthers,596724,Fairmont St. Falcons,596894,1,top,J. Mizell popped up to 2b.,3,2025-03-08T00:00:00-05:00,"Bridgeport Recreation Complex (Bridgeport, WV)",36,MBA,2025
6350183,596894,Ky. Wesleyan Panthers,596724,Fairmont St. Falcons,596894,1,top,R. Dysholm grounded out to 2b.,4,2025-03-08T00:00:00-05:00,"Bridgeport Recreation Complex (Bridgeport, WV)",36,MBA,2025
6350183,596894,Ky. Wesleyan Panthers,596724,Fairmont St. Falcons,596724,1,bot,C. Bailey singled up the middle.,5,2025-03-08T00:00:00-05:00,"Bridgeport Recreation Complex (Bridgeport, WV)",36,MBA,2025
6350183,596894,Ky. Wesleyan Panthers,596724,Fairmont St. Falcons,596724,1,bot,Q. Smith singled to left field3a C. Bailey advanced to second.,6,2025-03-08T00:00:00-05:00,"Bridgeport Recreation Complex (Bridgeport, WV)",36,MBA,2025
6350183,596894,Ky. Wesleyan Panthers,596724,Fairmont St. Falcons,596724,1,bot,N. Canterbur singled to right field3a Q. Smith advanced to second3a C. Bailey advanced to third.,7,2025-03-08T00:00:00-05:00,"Bridgeport Recreation Complex (Bridgeport, WV)",36,MBA,2025
6350183,596894,Ky. Wesleyan Panthers,596724,Fairmont St. Falcons,596724,1,bot,"Z. Brennan walked, RBI3a N. Canterbur advanced to second3a Q. Smith advanced to third3a C. Bailey scored.",8,2025-03-08T00:00:00-05:00,"Bridgeport Recreation Complex (Bridgeport, WV)",36,MBA,2025
6350183,596894,Ky. Wesleyan Panthers,596724,Fairmont St. Falcons,596724,1,bot,"Q. Reep flied out to cf, sacrifice fly, RBI3a N. Canterbur advanced to third3a Q. Smith scored.",9,2025-03-08T00:00:00-05:00,"Bridgeport Recreation Complex (Bridgeport, WV)",36,MBA,2025
6350183,596894,Ky. Wesleyan Panthers,596724,Fairmont St. Falcons,596724,1,bot,"R. Goff singled through the left side, RBI3a Z. Brennan advanced to second3a N. Canterbur scored.",10,2025-03-08T00:00:00-05:00,"Bridgeport Recreation Complex (Bridgeport, WV)",36,MBA,2025
6350183,596894,Ky. Wesleyan Panthers,596724,Fairmont St. Falcons,596724,1,bot,R. Goff advanced to second3a Z. Brennan advanced to third on a wild pitch.,11,2025-03-08T00:00:00-05:00,"Bridgeport Recreation Complex (Bridgeport, WV)",36,MBA,2025
6350183,596894,Ky. Wesleyan Panthers,596724,Fairmont St. Falcons,596724,1,bot,M. Johnston struck out swinging.,12,2025-03-08T00:00:00-05:00,"Bridgeport Recreation Complex (Bridgeport, WV)",36,MBA,2025
6350183,596894,Ky. Wesleyan Panthers,596724,Fairmont St. Falcons,596724,1,bot,G. Bibey walked.,13,2025-03-08T00:00:00-05:00,"Bridgeport Recreation Complex (Bridgeport, WV)",36,MBA,2025
6350183,596894,Ky. Wesleyan Panthers,596724,Fairmont St. Falcons,596724,1,bot,"K. Sutton singled down the rf line, 2 RBI3a G. Bibey advanced to third3a R. Goff scored3a Z. Brennan scored.",14,2025-03-08T00:00:00-05:00,"Bridgeport Recreation Complex (Bridgeport, WV)",36,MBA,2025
6350183,596894,Ky. Wesleyan Panthers,596724,Fairmont St. Falcons,596724,1,bot,C. Harlan to p for E. Ell.,15,2025-03-08T00:00:00-05:00,"Bridgeport Recreation Complex (Bridgeport, WV)",36,MBA,2025
6350183,596894,Ky. Wesleyan Panthers,596724,Fairmont St. Falcons,596724,1,bot,C. Bailey walked3a K. Sutton advanced to second.,16,2025-03-08T00:00:00-05:00,"Bridgeport Recreation Complex (Bridgeport, WV)",36,MBA,2025
6350183,596894,Ky. Wesleyan Panthers,596724,Fairmont St. Falcons,596724,1,bot,"Q. Smith singled to center field, 2 RBI3a C. Bailey advanced to second3a K. Sutton scored3a G. Bibey scored.",17,2025-03-08T00:00:00-05:00,"Bridgeport Recreation Complex (Bridgeport, WV)",36,MBA,2025
6350183,596894,Ky. Wesleyan Panthers,596724,Fairmont St. Falcons,596724,1,bot,N. Canterbur struck out swinging.,18,2025-03-08T00:00:00-05:00,"Bridgeport Recreation Complex (Bridgeport, WV)",36,MBA,2025
6350183,596894,Ky. Wesleyan Panthers,596724,Fairmont St. Falcons,596894,2,top,T. VanHooser singled through the left side.,19,2025-03-08T00:00:00-05:00,"Bridgeport Recreation Complex (Bridgeport, WV)",36,MBA,2025
6350183,596894,Ky. Wesleyan Panthers,596724,Fairmont St. Falcons,596894,2,top,R. Davis hit by pitch3a T. VanHooser advanced to second.,20,2025-03-08T00:00:00-05:00,"Bridgeport Recreation Complex (Bridgeport, WV)",36,MBA,2025
6350183,596894,Ky. Wesleyan Panthers,596724,Fairmont St. Falcons,596894,2,top,E. Stockton struck out looking.,21,2025-03-08T00:00:00-05:00,"Bridgeport Recreation Complex (Bridgeport, WV)",36,MBA,2025
6350183,596894,Ky. Wesleyan Panthers,596724,Fairmont St. Falcons,596894,2,top,C. Gudalis fouled out to 1b.,22,2025-03-08T00:00:00-05:00,"Bridgeport Recreation Complex (Bridgeport, WV)",36,MBA,2025
6350183,596894,Ky. Wesleyan Panthers,596724,Fairmont St. Falcons,596894,2,top,L. Molnar grounded out to 2b.,23,2025-03-08T00:00:00-05:00,"Bridgeport Recreation Complex (Bridgeport, WV)",36,MBA,2025
6350183,596894,Ky. Wesleyan Panthers,596724,Fairmont St. Falcons,596724,2,bot,D. Yates to ss for L. Molnar.,24,2025-03-08T00:00:00-05:00,"Bridgeport Recreation Complex (Bridgeport, WV)",36,MBA,2025
6350183,596894,Ky. Wesleyan Panthers,596724,Fairmont St. Falcons,596724,2,bot,Z. Brennan struck out swinging.,25,2025-03-08T00:00:00-05:00,"Bridgeport Recreation Complex (Bridgeport, WV)",36,MBA,2025
6350183,596894,Ky. Wesleyan Panthers,596724,Fairmont St. Falcons,596724,2,bot,Q. Reep reached first on a throwing error by ss.,26,2025-03-08T00:00:00-05:00,"Bridgeport Recreation Complex (Bridgeport, WV)",36,MBA,2025
6350183,596894,Ky. Wesleyan Panthers,596724,Fairmont St. Falcons,596724,2,bot,R. Goff singled through the left side3a Q. Reep advanced to second.,27,2025-03-08T00:00:00-05:00,"Bridgeport Recreation Complex (Bridgeport, WV)",36,MBA,2025
6350183,596894,Ky. Wesleyan Panthers,596724,Fairmont St. Falcons,596724,2,bot,M. Johnston grounded into double play 2b to ss to 1b3a R. Goff out on the play.,28,2025-03-08T00:00:00-05:00,"Bridgeport Recreation Complex (Bridgeport, WV)",36,MBA,2025
6350183,596894,Ky. Wesleyan Panthers,596724,Fairmont St. Falcons,596894,3,top,L. Hutson singled through the left side.,29,2025-03-08T00:00:00-05:00,"Bridgeport Recreation Complex (Bridgeport, WV)",36,MBA,2025
6350183,596894,Ky. Wesleyan Panthers,596724,Fairmont St. Falcons,596894,3,top,C. Perry flied out to cf.,30,2025-03-08T00:00:00-05:00,"Bridgeport Recreation Complex (Bridgeport, WV)",36,MBA,2025
6350183,596894,Ky. Wesleyan Panthers,596724,Fairmont St. Falcons,596894,3,top,J. Mizell grounded into double play ss to 1b3a L. Hutson out on the play.,31,2025-03-08T00:00:00-05:00,"Bridgeport Recreation Complex (Bridgeport, WV)",36,MBA,2025
6350183,596894,Ky. Wesleyan Panthers,596724,Fairmont St. Falcons,596724,3,bot,G. Bibey singled to center field.,32,2025-03-08T00:00:00-05:00,"Bridgeport Recreation Complex (Bridgeport, WV)",36,MBA,2025
6350183,596894,Ky. Wesleyan Panthers,596724,Fairmont St. Falcons,596724,3,bot,K. Sutton grounded into double play 3b to 2b to 1b3a G. Bibey out on the play.,33,2025-03-08T00:00:00-05:00,"Bridgeport Recreation Complex (Bridgeport, WV)",36,MBA,2025
6350183,596894,Ky. Wesleyan Panthers,596724,Fairmont St. Falcons,596724,3,bot,C. Bailey grounded out to ss.,34,2025-03-08T00:00:00-05:00,"Bridgeport Recreation Complex (Bridgeport, WV)",36,MBA,2025
6350183,596894,Ky. Wesleyan Panthers,596724,Fairmont St. Falcons,596894,4,top,R. Dysholm grounded out to ss.,35,2025-03-08T00:00:00-05:00,"Bridgeport Recreation Complex (Bridgeport, WV)",36,MBA,2025
6350183,596894,Ky. Wesleyan Panthers,596724,Fairmont St. Falcons,596894,4,top,T. VanHooser flied out to rf.,36,2025-03-08T00:00:00-05:00,"Bridgeport Recreation Complex (Bridgeport, WV)",36,MBA,2025
6350183,596894,Ky. Wesleyan Panthers,596724,Fairmont St. Falcons,596894,4,top,R. Davis struck out swinging.,37,2025-03-08T00:00:00-05:00,"Bridgeport Recreation Complex (Bridgeport, WV)",36,MBA,2025
6350183,596894,Ky. Wesleyan Panthers,596724,Fairmont St. Falcons,596724,4,bot,Q. Smith flied out to cf.,38,2025-03-08T00:00:00-05:00,"Bridgeport Recreation Complex (Bridgeport, WV)",36,MBA,2025
6350183,596894,Ky. Wesleyan Panthers,596724,Fairmont St. Falcons,596724,4,bot,N. Canterbur singled through the right side.,39,2025-03-08T00:00:00-05:00,"Bridgeport Recreation Complex (Bridgeport, WV)",36,MBA,2025
6350183,596894,Ky. Wesleyan Panthers,596724,Fairmont St. Falcons,596724,4,bot,Z. Brennan flied out to cf.,40,2025-03-08T00:00:00-05:00,"Bridgeport Recreation Complex (Bridgeport, WV)",36,MBA,2025
6350183,596894,Ky. Wesleyan Panthers,596724,Fairmont St. Falcons,596724,4,bot,Q. Reep flied out to rf.,41,2025-03-08T00:00:00-05:00,"Bridgeport Recreation Complex (Bridgeport, WV)",36,MBA,2025
6350183,596894,Ky. Wesleyan Panthers,596724,Fairmont St. Falcons,596894,5,top,E. Stockton grounded out to 2b.,42,2025-03-08T00:00:00-05:00,"Bridgeport Recreation Complex (Bridgeport, WV)",36,MBA,2025
6350183,596894,Ky. Wesleyan Panthers,596724,Fairmont St. Falcons,596894,5,top,C. Gudalis hit by pitch.,43,2025-03-08T00:00:00-05:00,"Bridgeport Recreation Complex (Bridgeport, WV)",36,MBA,2025
6350183,596894,Ky. Wesleyan Panthers,596724,Fairmont St. Falcons,596894,5,top,D. Yates singled to left field3a C. Gudalis advanced to second.,44,2025-03-08T00:00:00-05:00,"Bridgeport Recreation Complex (Bridgeport, WV)",36,MBA,2025
6350183,596894,Ky. Wesleyan Panthers,596724,Fairmont St. Falcons,596894,5,top,O. Stevenson pinch ran for C. Gudalis.,45,2025-03-08T00:00:00-05:00,"Bridgeport Recreation Complex (Bridgeport, WV)",36,MBA,2025
6350183,596894,Ky. Wesleyan Panthers,596724,Fairmont St. Falcons,596894,5,top,"L. Hutson tripled to right center, 2 RBI3a D. Yates scored3a O. Stevenson scored.",46,2025-03-08T00:00:00-05:00,"Bridgeport Recreation Complex (Bridgeport, WV)",36,MBA,2025
6350183,596894,Ky. Wesleyan Panthers,596724,Fairmont St. Falcons,596894,5,top,"C. Perry singled to right field, RBI3a L. Hutson scored.",47,2025-03-08T00:00:00-05:00,"Bridgeport Recreation Complex (Bridgeport, WV)",36,MBA,2025
6350183,596894,Ky. Wesleyan Panthers,596724,Fairmont St. Falcons,596894,5,top,J. Mizell flied out to cf.,48,2025-03-08T00:00:00-05:00,"Bridgeport Recreation Complex (Bridgeport, WV)",36,MBA,2025
6350183,596894,Ky. Wesleyan Panthers,596724,Fairmont St. Falcons,596894,5,top,R. Dysholm grounded out to 3b.,49,2025-03-08T00:00:00-05:00,"Bridgeport Recreation Complex (Bridgeport, WV)",36,MBA,2025
6350183,596894,Ky. Wesleyan Panthers,596724,Fairmont St. Falcons,596724,5,bot,O. Stevenson to 2b.,50,2025-03-08T00:00:00-05:00,"Bridgeport Recreation Complex (Bridgeport, WV)",36,MBA,2025
6350183,596894,Ky. Wesleyan Panthers,596724,Fairmont St. Falcons,596724,5,bot,R. Goff struck out looking.,51,2025-03-08T00:00:00-05:00,"Bridgeport Recreation Complex (Bridgeport, WV)",36,MBA,2025
6350183,596894,Ky. Wesleyan Panthers,596724,Fairmont St. Falcons,596724,5,bot,M. Johnston walked.,52,2025-03-08T00:00:00-05:00,"Bridgeport Recreation Complex (Bridgeport, WV)",36,MBA,2025
6350183,596894,Ky. Wesleyan Panthers,596724,Fairmont St. Falcons,596724,5,bot,G. Bibey singled through the left side3a M. Johnston advanced to second.,53,2025-03-08T00:00:00-05:00,"Bridgeport Recreation Complex (Bridgeport, WV)",36,MBA,2025
6350183,596894,Ky. Wesleyan Panthers,596724,Fairmont St. Falcons,596724,5,bot,K. Sutton grounded out to 2b3a G. Bibey advanced to second3a M. Johnston advanced to third.,54,2025-03-08T00:00:00-05:00,"Bridgeport Recreation Complex (Bridgeport, WV)",36,MBA,2025
6350183,596894,Ky. Wesleyan Panthers,596724,Fairmont St. Falcons,596724,5,bot,"C. Bailey doubled to right center, 2 RBI3a G. Bibey scored3a M. Johnston scored.",55,2025-03-08T00:00:00-05:00,"Bridgeport Recreation Complex (Bridgeport, WV)",36,MBA,2025
6350183,596894,Ky. Wesleyan Panthers,596724,Fairmont St. Falcons,596724,5,bot,Q. Smith flied out to lf.,56,2025-03-08T00:00:00-05:00,"Bridgeport Recreation Complex (Bridgeport, WV)",36,MBA,2025
6350183,596894,Ky. Wesleyan Panthers,596724,Fairmont St. Falcons,596894,6,top,"T. VanHooser homered to left field, RBI.",57,2025-03-08T00:00:00-05:00,"Bridgeport Recreation Complex (Bridgeport, WV)",36,MBA,2025
6350183,596894,Ky. Wesleyan Panthers,596724,Fairmont St. Falcons,596894,6,top,R. Davis doubled to left field.,58,2025-03-08T00:00:00-05:00,"Bridgeport Recreation Complex (Bridgeport, WV)",36,MBA,2025
6350183,596894,Ky. Wesleyan Panthers,596724,Fairmont St. Falcons,596894,6,top,"E. Stockton singled up the middle, RBI3a R. Davis scored.",59,2025-03-08T00:00:00-05:00,"Bridgeport Recreation Complex (Bridgeport, WV)",36,MBA,2025
6350183,596894,Ky. Wesleyan Panthers,596724,Fairmont St. Falcons,596894,6,top,M. Schnur to p for N. George.,60,2025-03-08T00:00:00-05:00,"Bridgeport Recreation Complex (Bridgeport, WV)",36,MBA,2025
6350183,596894,Ky. Wesleyan Panthers,596724,Fairmont St. Falcons,596894,6,top,O. Stevenson grounded into double play 3b to 2b to 1b3a E. Stockton out on the play.,61,2025-03-08T00:00:00-05:00,"Bridgeport Recreation Complex (Bridgeport, WV)",36,MBA,2025
6350183,596894,Ky. Wesleyan Panthers,596724,Fairmont St. Falcons,596894,6,top,D. Yates singled to third base.,62,2025-03-08T00:00:00-05:00,"Bridgeport Recreation Complex (Bridgeport, WV)",36,MBA,2025
6350183,596894,Ky. Wesleyan Panthers,596724,Fairmont St. Falcons,596894,6,top,L. Hutson singled to right field3a D. Yates advanced to second.,63,2025-03-08T00:00:00-05:00,"Bridgeport Recreation Complex (Bridgeport, WV)",36,MBA,2025
6350183,596894,Ky. Wesleyan Panthers,596724,Fairmont St. Falcons,596894,6,top,"C. Perry singled to shortstop3a L. Hutson advanced to second3a D. Yates advanced to third, out at home ss to c.",64,2025-03-08T00:00:00-05:00,"Bridgeport Recreation Complex (Bridgeport, WV)",36,MBA,2025
6350183,596894,Ky. Wesleyan Panthers,596724,Fairmont St. Falcons,596724,6,bot,G. Simpkins to p for C. Harlan.,65,2025-03-08T00:00:00-05:00,"Bridgeport Recreation Complex (Bridgeport, WV)",36,MBA,2025
6350183,596894,Ky. Wesleyan Panthers,596724,Fairmont St. Falcons,596724,6,bot,"N. Canterbur homered to right field, RBI.",66,2025-03-08T00:00:00-05:00,"Bridgeport Recreation Complex (Bridgeport, WV)",36,MBA,2025
6350183,596894,Ky. Wesleyan Panthers,596724,Fairmont St. Falcons,596724,6,bot,Z. Brennan struck out swinging.,67,2025-03-08T00:00:00-05:00,"Bridgeport Recreation Complex (Bridgeport, WV)",36,MBA,2025
6350183,596894,Ky. Wesleyan Panthers,596724,Fairmont St. Falcons,596724,6,bot,"Q. Reep homered to center field, RBI.",68,2025-03-08T00:00:00-05:00,"Bridgeport Recreation Complex (Bridgeport, WV)",36,MBA,2025
6350183,596894,Ky. Wesleyan Panthers,596724,Fairmont St. Falcons,596724,6,bot,R. Goff singled to left field.,69,2025-03-08T00:00:00-05:00,"Bridgeport Recreation Complex (Bridgeport, WV)",36,MBA,2025
6350183,596894,Ky. Wesleyan Panthers,596724,Fairmont St. Falcons,596724,6,bot,M. Johnston singled to right field3a R. Goff advanced to second.,70,2025-03-08T00:00:00-05:00,"Bridgeport Recreation Complex (Bridgeport, WV)",36,MBA,2025
6350183,596894,Ky. Wesleyan Panthers,596724,Fairmont St. Falcons,596724,6,bot,G. Bibey grounded out to 2b3a M. Johnston advanced to second3a R. Goff advanced to third.,71,2025-03-08T00:00:00-05:00,"Bridgeport Recreation Complex (Bridgeport, WV)",36,MBA,2025
6350183,596894,Ky. Wesleyan Panthers,596724,Fairmont St. Falcons,596724,6,bot,"K. Sutton singled to right field, 2 RBI3a M. Johnston scored3a R. Goff scored.",72,2025-03-08T00:00:00-05:00,"Bridgeport Recreation Complex (Bridgeport, WV)",36,MBA,2025
6350183,596894,Ky. Wesleyan Panthers,596724,Fairmont St. Falcons,596724,6,bot,C. Bailey singled through the right side3a K. Sutton advanced to second.,73,2025-03-08T00:00:00-05:00,"Bridgeport Recreation Complex (Bridgeport, WV)",36,MBA,2025
6350183,596894,Ky. Wesleyan Panthers,596724,Fairmont St. Falcons,596724,6,bot,Q. Smith reached on a fielder's choice3a C. Bailey out at second ss unassisted.,74,2025-03-08T00:00:00-05:00,"Bridgeport Recreation Complex (Bridgeport, WV)",36,MBA,2025
6350183,596894,Ky. Wesleyan Panthers,596724,Fairmont St. Falcons,596894,7,top,J. Mizell flied out to lf.,75,2025-03-08T00:00:00-05:00,"Bridgeport Recreation Complex (Bridgeport, WV)",36,MBA,2025
6350183,596894,Ky. Wesleyan Panthers,596724,Fairmont St. Falcons,596894,7,top,B. Brombaugh pinch hit for R. Dysholm.,76,2025-03-08T00:00:00-05:00,"Bridgeport Recreation Complex (Bridgeport, WV)",36,MBA,2025
6350183,596894,Ky. Wesleyan Panthers,596724,Fairmont St. Falcons,596894,7,top,B. Brombaugh struck out swinging.,77,2025-03-08T00:00:00-05:00,"Bridgeport Recreation Complex (Bridgeport, WV)",36,MBA,2025
6350183,596894,Ky. Wesleyan Panthers,596724,Fairmont St. Falcons,596894,7,top,T. VanHooser struck out swinging.,78,2025-03-08T00:00:00-05:00,"Bridgeport Recreation Complex (Bridgeport, WV)",36,MBA,2025
