game_id,away_team_id,away_team_name,home_team_id,home_team_name,batting_team,inning,top_bot,event_text,event_num,game_datetime,stadium_name,attendance,sport_id,season
6350564,596815,Ohio Dominican Panthers,596753,Tiffin Dragons,596815,9,top,B. Reed struck out swinging.,131,2025-03-18T00:00:00-04:00,"Heminger Field (Tiffin, OH)",92,MBA,2025
6350564,596815,Ohio Dominican Panthers,596753,Tiffin Dragons,596815,9,top,T. Flint pinch hit for J. Scherette.,132,2025-03-18T00:00:00-04:00,"Heminger Field (Tiffin, OH)",92,MBA,2025
6350564,596815,Ohio Dominican Panthers,596753,Tiffin Dragons,596815,9,top,T. Flint singled through the left side.,133,2025-03-18T00:00:00-04:00,"Heminger Field (Tiffin, OH)",92,MBA,2025
6350564,596815,Ohio Dominican Panthers,596753,Tiffin Dragons,596815,9,top,J. Daniels flied out to cf.,134,2025-03-18T00:00:00-04:00,"Heminger Field (Tiffin, OH)",92,MBA,2025
6350564,596815,Ohio Dominican Panthers,596753,Tiffin Dragons,596815,9,top,D. Emerson flied out to rf.,135,2025-03-18T00:00:00-04:00,"Heminger Field (Tiffin, OH)",92,MBA,2025
