game_id,away_team_id,away_team_name,home_team_id,home_team_name,batting_team,inning,top_bot,event_text,event_num,game_datetime,stadium_name,attendance,sport_id,season
6350564,596815,Ohio Dominican Panthers,596753,Tiffin Dragons,596815,1,top,D. Emerson grounded out to p.,1,2025-03-18T00:00:00-04:00,"Heminger Field (Tiffin, OH)",92,MBA,2025
6350564,596815,Ohio Dominican Panthers,596753,Tiffin Dragons,596815,1,top,P. Jelenic grounded out to p.,2,2025-03-18T00:00:00-04:00,"Heminger Field (Tiffin, OH)",92,MBA,2025
6350564,596815,Ohio Dominican Panthers,596753,Tiffin Dragons,596815,1,top,J. Adams grounded out to c unassisted.,3,2025-03-18T00:00:00-04:00,"Heminger Field (Tiffin, OH)",92,MBA,2025
6350564,596815,Ohio Dominican Panthers,596753,Tiffin Dragons,596753,1,bot,A. Deitschel struck out swinging.,4,2025-03-18T00:00:00-04:00,"Heminger Field (Tiffin, OH)",92,MBA,2025
6350564,596815,Ohio Dominican Panthers,596753,Tiffin Dragons,596753,1,bot,T. Hatfield struck out looking.,5,2025-03-18T00:00:00-04:00,"Heminger Field (Tiffin, OH)",92,MBA,2025
6350564,596815,Ohio Dominican Panthers,596753,Tiffin Dragons,596753,1,bot,A. Fairbroth struck out swinging.,6,2025-03-18T00:00:00-04:00,"Heminger Field (Tiffin, OH)",92,MBA,2025
6350564,596815,Ohio Dominican Panthers,596753,Tiffin Dragons,596815,2,top,G. Passarell flied out to cf.,7,2025-03-18T00:00:00-04:00,"Heminger Field (Tiffin, OH)",92,MBA,2025
6350564,596815,Ohio Dominican Panthers,596753,Tiffin Dragons,596815,2,top,C. Dean reached first on a dropped fly by 1b.,8,2025-03-18T00:00:00-04:00,"Heminger Field (Tiffin, OH)",92,MBA,2025
6350564,596815,Ohio Dominican Panthers,596753,Tiffin Dragons,596815,2,top,M. Kurtz reached on a fielder's choice to second base; C. Dean advanced to second on a throwing error by 2b.,9,2025-03-18T00:00:00-04:00,"Heminger Field (Tiffin, OH)",92,MBA,2025
6350564,596815,Ohio Dominican Panthers,596753,Tiffin Dragons,596815,2,top,S. Battles popped up to ss.,10,2025-03-18T00:00:00-04:00,"Heminger Field (Tiffin, OH)",92,MBA,2025
6350564,596815,Ohio Dominican Panthers,596753,Tiffin Dragons,596815,2,top,"J. Scherette tripled to right center, 2 RBI; M. Kurtz scored, unearned; C. Dean scored, unearned.",11,2025-03-18T00:00:00-04:00,"Heminger Field (Tiffin, OH)",92,MBA,2025
6350564,596815,Ohio Dominican Panthers,596753,Tiffin Dragons,596815,2,top,J. Daniels struck out looking.,12,2025-03-18T00:00:00-04:00,"Heminger Field (Tiffin, OH)",92,MBA,2025
6350564,596815,Ohio Dominican Panthers,596753,Tiffin Dragons,596753,2,bot,G. Cady singled to right center.,13,2025-03-18T00:00:00-04:00,"Heminger Field (Tiffin, OH)",92,MBA,2025
6350564,596815,Ohio Dominican Panthers,596753,Tiffin Dragons,596753,2,bot,"J. Hernandez singled to third base, bunt; G. Cady advanced to second.",14,2025-03-18T00:00:00-04:00,"Heminger Field (Tiffin, OH)",92,MBA,2025
6350564,596815,Ohio Dominican Panthers,596753,Tiffin Dragons,596753,2,bot,"A. Grabowski reached first on a throwing error by p, SAC, bunt, advanced to second; J. Hernandez advanced to third, scored on a throwing error by 2b, unearned; G. Cady advanced to third, scored on the error.",15,2025-03-18T00:00:00-04:00,"Heminger Field (Tiffin, OH)",92,MBA,2025
6350564,596815,Ohio Dominican Panthers,596753,Tiffin Dragons,596753,2,bot,A. Grabowski advanced to third on a wild pitch.,16,2025-03-18T00:00:00-04:00,"Heminger Field (Tiffin, OH)",92,MBA,2025
6350564,596815,Ohio Dominican Panthers,596753,Tiffin Dragons,596753,2,bot,N. Adelman struck out looking.,17,2025-03-18T00:00:00-04:00,"Heminger Field (Tiffin, OH)",92,MBA,2025
6350564,596815,Ohio Dominican Panthers,596753,Tiffin Dragons,596753,2,bot,H. DeLaPaz walked.,18,2025-03-18T00:00:00-04:00,"Heminger Field (Tiffin, OH)",92,MBA,2025
6350564,596815,Ohio Dominican Panthers,596753,Tiffin Dragons,596753,2,bot,"L. Westerman grounded out to p, SAC, bunt, RBI; H. DeLaPaz advanced to second; A. Grabowski scored, unearned.",19,2025-03-18T00:00:00-04:00,"Heminger Field (Tiffin, OH)",92,MBA,2025
6350564,596815,Ohio Dominican Panthers,596753,Tiffin Dragons,596753,2,bot,"A. Deitschel grounded out to 1b, bunt unassisted.",20,2025-03-18T00:00:00-04:00,"Heminger Field (Tiffin, OH)",92,MBA,2025
6350564,596815,Ohio Dominican Panthers,596753,Tiffin Dragons,596815,3,top,B. Clark to 1b for N. Adelman.,21,2025-03-18T00:00:00-04:00,"Heminger Field (Tiffin, OH)",92,MBA,2025
6350564,596815,Ohio Dominican Panthers,596753,Tiffin Dragons,596815,3,top,D. Emerson singled to right field.,22,2025-03-18T00:00:00-04:00,"Heminger Field (Tiffin, OH)",92,MBA,2025
6350564,596815,Ohio Dominican Panthers,596753,Tiffin Dragons,596815,3,top,P. Jelenic struck out swinging.,23,2025-03-18T00:00:00-04:00,"Heminger Field (Tiffin, OH)",92,MBA,2025
6350564,596815,Ohio Dominican Panthers,596753,Tiffin Dragons,596815,3,top,J. Adams walked; D. Emerson advanced to second.,24,2025-03-18T00:00:00-04:00,"Heminger Field (Tiffin, OH)",92,MBA,2025
6350564,596815,Ohio Dominican Panthers,596753,Tiffin Dragons,596815,3,top,G. Passarell flied out to cf to left center; D. Emerson advanced to third.,25,2025-03-18T00:00:00-04:00,"Heminger Field (Tiffin, OH)",92,MBA,2025
6350564,596815,Ohio Dominican Panthers,596753,Tiffin Dragons,596815,3,top,J. Adams advanced to second on a wild pitch.,26,2025-03-18T00:00:00-04:00,"Heminger Field (Tiffin, OH)",92,MBA,2025
6350564,596815,Ohio Dominican Panthers,596753,Tiffin Dragons,596815,3,top,C. Dean walked.,27,2025-03-18T00:00:00-04:00,"Heminger Field (Tiffin, OH)",92,MBA,2025
6350564,596815,Ohio Dominican Panthers,596753,Tiffin Dragons,596815,3,top,M. Kurtz struck out swinging.,28,2025-03-18T00:00:00-04:00,"Heminger Field (Tiffin, OH)",92,MBA,2025
6350564,596815,Ohio Dominican Panthers,596753,Tiffin Dragons,596753,3,bot,T. Hatfield singled to center field.,29,2025-03-18T00:00:00-04:00,"Heminger Field (Tiffin, OH)",92,MBA,2025
6350564,596815,Ohio Dominican Panthers,596753,Tiffin Dragons,596753,3,bot,A. Fairbroth walked; T. Hatfield advanced to second.,30,2025-03-18T00:00:00-04:00,"Heminger Field (Tiffin, OH)",92,MBA,2025
6350564,596815,Ohio Dominican Panthers,596753,Tiffin Dragons,596753,3,bot,G. Cady hit by pitch; A. Fairbroth advanced to second; T. Hatfield advanced to third.,31,2025-03-18T00:00:00-04:00,"Heminger Field (Tiffin, OH)",92,MBA,2025
6350564,596815,Ohio Dominican Panthers,596753,Tiffin Dragons,596753,3,bot,"J. Hernandez walked, RBI; G. Cady advanced to second; A. Fairbroth advanced to third; T. Hatfield scored.",32,2025-03-18T00:00:00-04:00,"Heminger Field (Tiffin, OH)",92,MBA,2025
6350564,596815,Ohio Dominican Panthers,596753,Tiffin Dragons,596753,3,bot,"A. Grabowski walked, RBI; J. Hernandez advanced to second; G. Cady advanced to third; A. Fairbroth scored.",33,2025-03-18T00:00:00-04:00,"Heminger Field (Tiffin, OH)",92,MBA,2025
6350564,596815,Ohio Dominican Panthers,596753,Tiffin Dragons,596753,3,bot,"B. Clark hit by pitch, RBI; A. Grabowski advanced to second; J. Hernandez advanced to third; G. Cady scored.",34,2025-03-18T00:00:00-04:00,"Heminger Field (Tiffin, OH)",92,MBA,2025
6350564,596815,Ohio Dominican Panthers,596753,Tiffin Dragons,596753,3,bot,G. Mangus to p for C. Hunt.,35,2025-03-18T00:00:00-04:00,"Heminger Field (Tiffin, OH)",92,MBA,2025
6350564,596815,Ohio Dominican Panthers,596753,Tiffin Dragons,596753,3,bot,"H. DeLaPaz singled to right field, RBI; B. Clark advanced to second; A. Grabowski advanced to third; J. Hernandez scored.",36,2025-03-18T00:00:00-04:00,"Heminger Field (Tiffin, OH)",92,MBA,2025
6350564,596815,Ohio Dominican Panthers,596753,Tiffin Dragons,596753,3,bot,L. Westerman struck out swinging.,37,2025-03-18T00:00:00-04:00,"Heminger Field (Tiffin, OH)",92,MBA,2025
6350564,596815,Ohio Dominican Panthers,596753,Tiffin Dragons,596753,3,bot,"A. Deitschel singled through the right side, 2 RBI; H. DeLaPaz advanced to third; B. Clark scored; A. Grabowski scored.",38,2025-03-18T00:00:00-04:00,"Heminger Field (Tiffin, OH)",92,MBA,2025
6350564,596815,Ohio Dominican Panthers,596753,Tiffin Dragons,596753,3,bot,"T. Hatfield singled to left field, RBI; A. Deitschel advanced to second; H. DeLaPaz scored.",39,2025-03-18T00:00:00-04:00,"Heminger Field (Tiffin, OH)",92,MBA,2025
6350564,596815,Ohio Dominican Panthers,596753,Tiffin Dragons,596753,3,bot,A. Fairbroth grounded out to ss; T. Hatfield advanced to second; A. Deitschel advanced to third.,40,2025-03-18T00:00:00-04:00,"Heminger Field (Tiffin, OH)",92,MBA,2025
6350564,596815,Ohio Dominican Panthers,596753,Tiffin Dragons,596753,3,bot,G. Cady flied out to cf.,41,2025-03-18T00:00:00-04:00,"Heminger Field (Tiffin, OH)",92,MBA,2025
6350564,596815,Ohio Dominican Panthers,596753,Tiffin Dragons,596815,4,top,S. Battles flied out to cf.,42,2025-03-18T00:00:00-04:00,"Heminger Field (Tiffin, OH)",92,MBA,2025
6350564,596815,Ohio Dominican Panthers,596753,Tiffin Dragons,596815,4,top,J. Scherette grounded out to 2b.,43,2025-03-18T00:00:00-04:00,"Heminger Field (Tiffin, OH)",92,MBA,2025
6350564,596815,Ohio Dominican Panthers,596753,Tiffin Dragons,596815,4,top,J. Daniels walked.,44,2025-03-18T00:00:00-04:00,"Heminger Field (Tiffin, OH)",92,MBA,2025
6350564,596815,Ohio Dominican Panthers,596753,Tiffin Dragons,596815,4,top,J. Daniels stole second.,45,2025-03-18T00:00:00-04:00,"Heminger Field (Tiffin, OH)",92,MBA,2025
6350564,596815,Ohio Dominican Panthers,596753,Tiffin Dragons,596815,4,top,J. Daniels stole third.,46,2025-03-18T00:00:00-04:00,"Heminger Field (Tiffin, OH)",92,MBA,2025
6350564,596815,Ohio Dominican Panthers,596753,Tiffin Dragons,596815,4,top,"D. Emerson singled to right center, RBI; J. Daniels scored.",47,2025-03-18T00:00:00-04:00,"Heminger Field (Tiffin, OH)",92,MBA,2025
6350564,596815,Ohio Dominican Panthers,596753,Tiffin Dragons,596815,4,top,P. Jelenic singled to right field; D. Emerson advanced to second.,48,2025-03-18T00:00:00-04:00,"Heminger Field (Tiffin, OH)",92,MBA,2025
6350564,596815,Ohio Dominican Panthers,596753,Tiffin Dragons,596815,4,top,J. Adams walked; P. Jelenic advanced to second; D. Emerson advanced to third.,49,2025-03-18T00:00:00-04:00,"Heminger Field (Tiffin, OH)",92,MBA,2025
6350564,596815,Ohio Dominican Panthers,596753,Tiffin Dragons,596815,4,top,A. Baileys to p for K. Phillips.,50,2025-03-18T00:00:00-04:00,"Heminger Field (Tiffin, OH)",92,MBA,2025
6350564,596815,Ohio Dominican Panthers,596753,Tiffin Dragons,596815,4,top,G. Passarell fouled out to 3b.,51,2025-03-18T00:00:00-04:00,"Heminger Field (Tiffin, OH)",92,MBA,2025
6350564,596815,Ohio Dominican Panthers,596753,Tiffin Dragons,596753,4,bot,A. Mouch to p for G. Mangus.,52,2025-03-18T00:00:00-04:00,"Heminger Field (Tiffin, OH)",92,MBA,2025
6350564,596815,Ohio Dominican Panthers,596753,Tiffin Dragons,596753,4,bot,J. Hernandez struck out looking.,53,2025-03-18T00:00:00-04:00,"Heminger Field (Tiffin, OH)",92,MBA,2025
6350564,596815,Ohio Dominican Panthers,596753,Tiffin Dragons,596753,4,bot,A. Grabowski flied out to cf to left center.,54,2025-03-18T00:00:00-04:00,"Heminger Field (Tiffin, OH)",92,MBA,2025
6350564,596815,Ohio Dominican Panthers,596753,Tiffin Dragons,596753,4,bot,B. Clark walked.,55,2025-03-18T00:00:00-04:00,"Heminger Field (Tiffin, OH)",92,MBA,2025
6350564,596815,Ohio Dominican Panthers,596753,Tiffin Dragons,596753,4,bot,H. DeLaPaz reached on a fielder's choice to shortstop; B. Clark out at second ss to 2b.,56,2025-03-18T00:00:00-04:00,"Heminger Field (Tiffin, OH)",92,MBA,2025
6350564,596815,Ohio Dominican Panthers,596753,Tiffin Dragons,596815,5,top,C. Dean doubled to center field.,57,2025-03-18T00:00:00-04:00,"Heminger Field (Tiffin, OH)",92,MBA,2025
6350564,596815,Ohio Dominican Panthers,596753,Tiffin Dragons,596815,5,top,M. Kurtz walked.,58,2025-03-18T00:00:00-04:00,"Heminger Field (Tiffin, OH)",92,MBA,2025
6350564,596815,Ohio Dominican Panthers,596753,Tiffin Dragons,596815,5,top,S. Battles walked; M. Kurtz advanced to second; C. Dean advanced to third.,59,2025-03-18T00:00:00-04:00,"Heminger Field (Tiffin, OH)",92,MBA,2025
6350564,596815,Ohio Dominican Panthers,596753,Tiffin Dragons,596815,5,top,"J. Scherette reached on a fielder's choice to second base, RBI; S. Battles out at second 2b to ss; M. Kurtz advanced to third; C. Dean scored.",60,2025-03-18T00:00:00-04:00,"Heminger Field (Tiffin, OH)",92,MBA,2025
6350564,596815,Ohio Dominican Panthers,596753,Tiffin Dragons,596815,5,top,J. Daniels fouled out to 1b.,61,2025-03-18T00:00:00-04:00,"Heminger Field (Tiffin, OH)",92,MBA,2025
6350564,596815,Ohio Dominican Panthers,596753,Tiffin Dragons,596815,5,top,D. Emerson flied out to cf.,62,2025-03-18T00:00:00-04:00,"Heminger Field (Tiffin, OH)",92,MBA,2025
6350564,596815,Ohio Dominican Panthers,596753,Tiffin Dragons,596753,5,bot,L. Westerman doubled to left center.,63,2025-03-18T00:00:00-04:00,"Heminger Field (Tiffin, OH)",92,MBA,2025
6350564,596815,Ohio Dominican Panthers,596753,Tiffin Dragons,596753,5,bot,"A. Deitschel grounded out to 3b, SAC, bunt; L. Westerman advanced to third.",64,2025-03-18T00:00:00-04:00,"Heminger Field (Tiffin, OH)",92,MBA,2025
6350564,596815,Ohio Dominican Panthers,596753,Tiffin Dragons,596753,5,bot,"T. Hatfield singled to left field, RBI; L. Westerman scored.",65,2025-03-18T00:00:00-04:00,"Heminger Field (Tiffin, OH)",92,MBA,2025
6350564,596815,Ohio Dominican Panthers,596753,Tiffin Dragons,596753,5,bot,"A. Fairbroth homered to left field, 2 RBI; T. Hatfield scored.",66,2025-03-18T00:00:00-04:00,"Heminger Field (Tiffin, OH)",92,MBA,2025
6350564,596815,Ohio Dominican Panthers,596753,Tiffin Dragons,596753,5,bot,G. Cady popped up to ss.,67,2025-03-18T00:00:00-04:00,"Heminger Field (Tiffin, OH)",92,MBA,2025
6350564,596815,Ohio Dominican Panthers,596753,Tiffin Dragons,596753,5,bot,J. Hernandez lined out to cf.,68,2025-03-18T00:00:00-04:00,"Heminger Field (Tiffin, OH)",92,MBA,2025
6350564,596815,Ohio Dominican Panthers,596753,Tiffin Dragons,596815,6,top,P. Jelenic hit by pitch.,69,2025-03-18T00:00:00-04:00,"Heminger Field (Tiffin, OH)",92,MBA,2025
6350564,596815,Ohio Dominican Panthers,596753,Tiffin Dragons,596815,6,top,P. Jelenic advanced to second on a wild pitch.,70,2025-03-18T00:00:00-04:00,"Heminger Field (Tiffin, OH)",92,MBA,2025
6350564,596815,Ohio Dominican Panthers,596753,Tiffin Dragons,596815,6,top,J. Adams walked.,71,2025-03-18T00:00:00-04:00,"Heminger Field (Tiffin, OH)",92,MBA,2025
6350564,596815,Ohio Dominican Panthers,596753,Tiffin Dragons,596815,6,top,G. Passarell singled to third base; J. Adams advanced to second; P. Jelenic advanced to third.,72,2025-03-18T00:00:00-04:00,"Heminger Field (Tiffin, OH)",92,MBA,2025
6350564,596815,Ohio Dominican Panthers,596753,Tiffin Dragons,596815,6,top,"C. Dean walked, RBI; G. Passarell advanced to second; J. Adams advanced to third; P. Jelenic scored.",73,2025-03-18T00:00:00-04:00,"Heminger Field (Tiffin, OH)",92,MBA,2025
6350564,596815,Ohio Dominican Panthers,596753,Tiffin Dragons,596815,6,top,N. Feasel to p for A. Baileys.,74,2025-03-18T00:00:00-04:00,"Heminger Field (Tiffin, OH)",92,MBA,2025
6350564,596815,Ohio Dominican Panthers,596753,Tiffin Dragons,596815,6,top,"M. Kurtz singled to center field, RBI; C. Dean advanced to second; G. Passarell advanced to third; J. Adams scored.",75,2025-03-18T00:00:00-04:00,"Heminger Field (Tiffin, OH)",92,MBA,2025
6350564,596815,Ohio Dominican Panthers,596753,Tiffin Dragons,596815,6,top,"S. Battles walked, RBI; M. Kurtz advanced to second; C. Dean advanced to third; G. Passarell scored.",76,2025-03-18T00:00:00-04:00,"Heminger Field (Tiffin, OH)",92,MBA,2025
6350564,596815,Ohio Dominican Panthers,596753,Tiffin Dragons,596815,6,top,J. Scherette struck out swinging.,77,2025-03-18T00:00:00-04:00,"Heminger Field (Tiffin, OH)",92,MBA,2025
6350564,596815,Ohio Dominican Panthers,596753,Tiffin Dragons,596815,6,top,J. Daniels infield fly to 2b.,78,2025-03-18T00:00:00-04:00,"Heminger Field (Tiffin, OH)",92,MBA,2025
6350564,596815,Ohio Dominican Panthers,596753,Tiffin Dragons,596815,6,top,"D. Emerson reached first on a fielding error by 1b; S. Battles advanced to second; M. Kurtz advanced to third; C. Dean scored, unearned.",79,2025-03-18T00:00:00-04:00,"Heminger Field (Tiffin, OH)",92,MBA,2025
6350564,596815,Ohio Dominican Panthers,596753,Tiffin Dragons,596815,6,top,"P. Jelenic singled to right center, 3 RBI; D. Emerson scored, unearned; S. Battles scored, unearned; M. Kurtz scored, unearned.",80,2025-03-18T00:00:00-04:00,"Heminger Field (Tiffin, OH)",92,MBA,2025
6350564,596815,Ohio Dominican Panthers,596753,Tiffin Dragons,596815,6,top,J. Adams struck out looking.,81,2025-03-18T00:00:00-04:00,"Heminger Field (Tiffin, OH)",92,MBA,2025
6350564,596815,Ohio Dominican Panthers,596753,Tiffin Dragons,596753,6,bot,A. Grabowski flied out to lf down the lf line.,82,2025-03-18T00:00:00-04:00,"Heminger Field (Tiffin, OH)",92,MBA,2025
6350564,596815,Ohio Dominican Panthers,596753,Tiffin Dragons,596753,6,bot,J. Soha pinch hit for B. Clark.,83,2025-03-18T00:00:00-04:00,"Heminger Field (Tiffin, OH)",92,MBA,2025
6350564,596815,Ohio Dominican Panthers,596753,Tiffin Dragons,596753,6,bot,J. Soha flied out to rf.,84,2025-03-18T00:00:00-04:00,"Heminger Field (Tiffin, OH)",92,MBA,2025
6350564,596815,Ohio Dominican Panthers,596753,Tiffin Dragons,596753,6,bot,H. DeLaPaz singled to center field.,85,2025-03-18T00:00:00-04:00,"Heminger Field (Tiffin, OH)",92,MBA,2025
6350564,596815,Ohio Dominican Panthers,596753,Tiffin Dragons,596753,6,bot,L. Westerman walked; H. DeLaPaz advanced to second.,86,2025-03-18T00:00:00-04:00,"Heminger Field (Tiffin, OH)",92,MBA,2025
6350564,596815,Ohio Dominican Panthers,596753,Tiffin Dragons,596753,6,bot,A. Deitschel flied out to cf to left center.,87,2025-03-18T00:00:00-04:00,"Heminger Field (Tiffin, OH)",92,MBA,2025
6350564,596815,Ohio Dominican Panthers,596753,Tiffin Dragons,596815,7,top,J. Soha to 1b.,88,2025-03-18T00:00:00-04:00,"Heminger Field (Tiffin, OH)",92,MBA,2025
6350564,596815,Ohio Dominican Panthers,596753,Tiffin Dragons,596815,7,top,G. Passarell fouled out to ss.,89,2025-03-18T00:00:00-04:00,"Heminger Field (Tiffin, OH)",92,MBA,2025
6350564,596815,Ohio Dominican Panthers,596753,Tiffin Dragons,596815,7,top,"C. Dean struck out swinging, out at first c to 1b.",90,2025-03-18T00:00:00-04:00,"Heminger Field (Tiffin, OH)",92,MBA,2025
6350564,596815,Ohio Dominican Panthers,596753,Tiffin Dragons,596815,7,top,M. Kurtz doubled down the rf line.,91,2025-03-18T00:00:00-04:00,"Heminger Field (Tiffin, OH)",92,MBA,2025
6350564,596815,Ohio Dominican Panthers,596753,Tiffin Dragons,596815,7,top,S. Battles popped up to 2b.,92,2025-03-18T00:00:00-04:00,"Heminger Field (Tiffin, OH)",92,MBA,2025
6350564,596815,Ohio Dominican Panthers,596753,Tiffin Dragons,596753,7,bot,"T. Hatfield reached first on a fielding error by 2b, advanced to second.",93,2025-03-18T00:00:00-04:00,"Heminger Field (Tiffin, OH)",92,MBA,2025
6350564,596815,Ohio Dominican Panthers,596753,Tiffin Dragons,596753,7,bot,"A. Fairbroth singled through the left side; T. Hatfield advanced to third, scored on a fielding error by lf, unearned.",94,2025-03-18T00:00:00-04:00,"Heminger Field (Tiffin, OH)",92,MBA,2025
6350564,596815,Ohio Dominican Panthers,596753,Tiffin Dragons,596753,7,bot,G. Cady singled through the left side; A. Fairbroth advanced to second.,95,2025-03-18T00:00:00-04:00,"Heminger Field (Tiffin, OH)",92,MBA,2025
6350564,596815,Ohio Dominican Panthers,596753,Tiffin Dragons,596753,7,bot,"J. Hernandez homered down the lf line, 3 RBI; G. Cady scored; A. Fairbroth scored.",96,2025-03-18T00:00:00-04:00,"Heminger Field (Tiffin, OH)",92,MBA,2025
6350564,596815,Ohio Dominican Panthers,596753,Tiffin Dragons,596753,7,bot,"A. Grabowski homered to left field, RBI.",97,2025-03-18T00:00:00-04:00,"Heminger Field (Tiffin, OH)",92,MBA,2025
6350564,596815,Ohio Dominican Panthers,596753,Tiffin Dragons,596753,7,bot,J. Ramirez to p for A. Mouch.,98,2025-03-18T00:00:00-04:00,"Heminger Field (Tiffin, OH)",92,MBA,2025
6350564,596815,Ohio Dominican Panthers,596753,Tiffin Dragons,596753,7,bot,J. Soha walked.,99,2025-03-18T00:00:00-04:00,"Heminger Field (Tiffin, OH)",92,MBA,2025
6350564,596815,Ohio Dominican Panthers,596753,Tiffin Dragons,596753,7,bot,H. DeLaPaz singled to right center; J. Soha advanced to second.,100,2025-03-18T00:00:00-04:00,"Heminger Field (Tiffin, OH)",92,MBA,2025
6350564,596815,Ohio Dominican Panthers,596753,Tiffin Dragons,596753,7,bot,L. Westerman grounded out to 3b; H. DeLaPaz advanced to second; J. Soha advanced to third.,101,2025-03-18T00:00:00-04:00,"Heminger Field (Tiffin, OH)",92,MBA,2025
6350564,596815,Ohio Dominican Panthers,596753,Tiffin Dragons,596753,7,bot,A. Deitschel grounded out to 2b.,102,2025-03-18T00:00:00-04:00,"Heminger Field (Tiffin, OH)",92,MBA,2025
6350564,596815,Ohio Dominican Panthers,596753,Tiffin Dragons,596753,7,bot,"T. Hatfield doubled to right center, 2 RBI; H. DeLaPaz scored, unearned; J. Soha scored, unearned.",103,2025-03-18T00:00:00-04:00,"Heminger Field (Tiffin, OH)",92,MBA,2025
6350564,596815,Ohio Dominican Panthers,596753,Tiffin Dragons,596753,7,bot,A. Fairbroth walked.,104,2025-03-18T00:00:00-04:00,"Heminger Field (Tiffin, OH)",92,MBA,2025
6350564,596815,Ohio Dominican Panthers,596753,Tiffin Dragons,596753,7,bot,G. Cady grounded out to p.,105,2025-03-18T00:00:00-04:00,"Heminger Field (Tiffin, OH)",92,MBA,2025
6350564,596815,Ohio Dominican Panthers,596753,Tiffin Dragons,596815,8,top,J. Scherette flied out to lf.,106,2025-03-18T00:00:00-04:00,"Heminger Field (Tiffin, OH)",92,MBA,2025
6350564,596815,Ohio Dominican Panthers,596753,Tiffin Dragons,596815,8,top,J. Daniels walked.,107,2025-03-18T00:00:00-04:00,"Heminger Field (Tiffin, OH)",92,MBA,2025
6350564,596815,Ohio Dominican Panthers,596753,Tiffin Dragons,596815,8,top,T. Hedges to p for N. Feasel.,108,2025-03-18T00:00:00-04:00,"Heminger Field (Tiffin, OH)",92,MBA,2025
6350564,596815,Ohio Dominican Panthers,596753,Tiffin Dragons,596815,8,top,D. Emerson singled through the left side; J. Daniels advanced to second.,109,2025-03-18T00:00:00-04:00,"Heminger Field (Tiffin, OH)",92,MBA,2025
6350564,596815,Ohio Dominican Panthers,596753,Tiffin Dragons,596815,8,top,"P. Jelenic singled up the middle, RBI; D. Emerson advanced to second; J. Daniels scored.",110,2025-03-18T00:00:00-04:00,"Heminger Field (Tiffin, OH)",92,MBA,2025
6350564,596815,Ohio Dominican Panthers,596753,Tiffin Dragons,596815,8,top,J. Adams reached on a fielder's choice to second base; P. Jelenic out at second 2b to ss; D. Emerson advanced to third.,111,2025-03-18T00:00:00-04:00,"Heminger Field (Tiffin, OH)",92,MBA,2025
6350564,596815,Ohio Dominican Panthers,596753,Tiffin Dragons,596815,8,top,"G. Passarell singled to left center, RBI; J. Adams advanced to second; D. Emerson scored.",112,2025-03-18T00:00:00-04:00,"Heminger Field (Tiffin, OH)",92,MBA,2025
6350564,596815,Ohio Dominican Panthers,596753,Tiffin Dragons,596815,8,top,L. Brockman pinch ran for G. Passarell.,113,2025-03-18T00:00:00-04:00,"Heminger Field (Tiffin, OH)",92,MBA,2025
6350564,596815,Ohio Dominican Panthers,596753,Tiffin Dragons,596815,8,top,"C. Dean homered to center field, 3 RBI; L. Brockman scored; J. Adams scored.",114,2025-03-18T00:00:00-04:00,"Heminger Field (Tiffin, OH)",92,MBA,2025
6350564,596815,Ohio Dominican Panthers,596753,Tiffin Dragons,596815,8,top,M. Kurtz grounded out to 3b.,115,2025-03-18T00:00:00-04:00,"Heminger Field (Tiffin, OH)",92,MBA,2025
6350564,596815,Ohio Dominican Panthers,596753,Tiffin Dragons,596753,8,bot,T. Mercer to p for J. Ramirez.,116,2025-03-18T00:00:00-04:00,"Heminger Field (Tiffin, OH)",92,MBA,2025
6350564,596815,Ohio Dominican Panthers,596753,Tiffin Dragons,596753,8,bot,J. Hernandez singled to left field.,117,2025-03-18T00:00:00-04:00,"Heminger Field (Tiffin, OH)",92,MBA,2025
6350564,596815,Ohio Dominican Panthers,596753,Tiffin Dragons,596753,8,bot,A. Grabowski singled through the left side; J. Hernandez advanced to second.,118,2025-03-18T00:00:00-04:00,"Heminger Field (Tiffin, OH)",92,MBA,2025
6350564,596815,Ohio Dominican Panthers,596753,Tiffin Dragons,596753,8,bot,A. Grabowski stole second; J. Hernandez stole third.,119,2025-03-18T00:00:00-04:00,"Heminger Field (Tiffin, OH)",92,MBA,2025
6350564,596815,Ohio Dominican Panthers,596753,Tiffin Dragons,596753,8,bot,J. Soha grounded out to p.,120,2025-03-18T00:00:00-04:00,"Heminger Field (Tiffin, OH)",92,MBA,2025
6350564,596815,Ohio Dominican Panthers,596753,Tiffin Dragons,596753,8,bot,J. Clancy pinch hit for H. DeLaPaz.,121,2025-03-18T00:00:00-04:00,"Heminger Field (Tiffin, OH)",92,MBA,2025
6350564,596815,Ohio Dominican Panthers,596753,Tiffin Dragons,596753,8,bot,J. Clancy struck out looking.,122,2025-03-18T00:00:00-04:00,"Heminger Field (Tiffin, OH)",92,MBA,2025
6350564,596815,Ohio Dominican Panthers,596753,Tiffin Dragons,596753,8,bot,L. Westerman grounded out to ss.,123,2025-03-18T00:00:00-04:00,"Heminger Field (Tiffin, OH)",92,MBA,2025
6350564,596815,Ohio Dominican Panthers,596753,Tiffin Dragons,596815,9,top,A. Deitschel to rf.,124,2025-03-18T00:00:00-04:00,"Heminger Field (Tiffin, OH)",92,MBA,2025
6350564,596815,Ohio Dominican Panthers,596753,Tiffin Dragons,596815,9,top,T. Hatfield to 2b.,125,2025-03-18T00:00:00-04:00,"Heminger Field (Tiffin, OH)",92,MBA,2025
6350564,596815,Ohio Dominican Panthers,596753,Tiffin Dragons,596815,9,top,T. Hatfield to 2b.,126,2025-03-18T00:00:00-04:00,"Heminger Field (Tiffin, OH)",92,MBA,2025
6350564,596815,Ohio Dominican Panthers,596753,Tiffin Dragons,596815,9,top,C. Crisenber to cf for J. Hernandez.,127,2025-03-18T00:00:00-04:00,"Heminger Field (Tiffin, OH)",92,MBA,2025
6350564,596815,Ohio Dominican Panthers,596753,Tiffin Dragons,596815,9,top,C. Conceicao to c for J. Clancy.,128,2025-03-18T00:00:00-04:00,"Heminger Field (Tiffin, OH)",92,MBA,2025
6350564,596815,Ohio Dominican Panthers,596753,Tiffin Dragons,596815,9,top,C. Conceicao to c for J. Clancy.,129,2025-03-18T00:00:00-04:00,"Heminger Field (Tiffin, OH)",92,MBA,2025
6350564,596815,Ohio Dominican Panthers,596753,Tiffin Dragons,596815,9,top,B. Reed pinch hit for S. Battles.,130,2025-03-18T00:00:00-04:00,"Heminger Field (Tiffin, OH)",92,MBA,2025
