game_id,away_team_id,away_team_name,home_team_id,home_team_name,batting_team,inning,top_bot,event_text,event_num,game_datetime,stadium_name,attendance,sport_id,season
6350967,597064,Webster Gorloks,597344,MUW Owls,597064,1,top,J. Theodore grounded out to ss.,1,2025-03-26T00:00:00-04:00,"CCA Field (Columbus, MS)",100,MBA,2025
6350967,597064,Webster Gorloks,597344,MUW Owls,597064,1,top,"K. Peters singled to third base, bunt.",2,2025-03-26T00:00:00-04:00,"CCA Field (Columbus, MS)",100,MBA,2025
6350967,597064,Webster Gorloks,597344,MUW Owls,597064,1,top,E. Evola popped up to ss3a K. Peters advanced to second on a throwing error by ss.,3,2025-03-26T00:00:00-04:00,"CCA Field (Columbus, MS)",100,MBA,2025
6350967,597064,Webster Gorloks,597344,MUW Owls,597064,1,top,C. McBride hit by pitch.,4,2025-03-26T00:00:00-04:00,"CCA Field (Columbus, MS)",100,MBA,2025
6350967,597064,Webster Gorloks,597344,MUW Owls,597064,1,top,R. LaRocco walked3a C. McBride advanced to second3a K. Peters advanced to third.,5,2025-03-26T00:00:00-04:00,"CCA Field (Columbus, MS)",100,MBA,2025
6350967,597064,Webster Gorloks,597344,MUW Owls,597064,1,top,"R. Hartz singled, RBI3a R. LaRocco advanced to second3a C. McBride advanced to third, out at home cf to 2b to c3a K. Peters scored.",6,2025-03-26T00:00:00-04:00,"CCA Field (Columbus, MS)",100,MBA,2025
6350967,597064,Webster Gorloks,597344,MUW Owls,597344,1,bot,"L. Clark struck out swinging, out at first c unassisted.",7,2025-03-26T00:00:00-04:00,"CCA Field (Columbus, MS)",100,MBA,2025
6350967,597064,Webster Gorloks,597344,MUW Owls,597344,1,bot,M. Windham struck out swinging.,8,2025-03-26T00:00:00-04:00,"CCA Field (Columbus, MS)",100,MBA,2025
6350967,597064,Webster Gorloks,597344,MUW Owls,597344,1,bot,Z. Johnson popped up to 3b.,9,2025-03-26T00:00:00-04:00,"CCA Field (Columbus, MS)",100,MBA,2025
6350967,597064,Webster Gorloks,597344,MUW Owls,597064,2,top,C. Hailstone walked.,10,2025-03-26T00:00:00-04:00,"CCA Field (Columbus, MS)",100,MBA,2025
6350967,597064,Webster Gorloks,597344,MUW Owls,597064,2,top,N. Wrubluski reached on a fielder's choice3a C. Hailstone out at second 3b to 2b.,11,2025-03-26T00:00:00-04:00,"CCA Field (Columbus, MS)",100,MBA,2025
6350967,597064,Webster Gorloks,597344,MUW Owls,597064,2,top,B. Stedman flied out to cf.,12,2025-03-26T00:00:00-04:00,"CCA Field (Columbus, MS)",100,MBA,2025
6350967,597064,Webster Gorloks,597344,MUW Owls,597064,2,top,J. Theodore walked3a N. Wrubluski advanced to second.,13,2025-03-26T00:00:00-04:00,"CCA Field (Columbus, MS)",100,MBA,2025
6350967,597064,Webster Gorloks,597344,MUW Owls,597064,2,top,K. Peters struck out swinging.,14,2025-03-26T00:00:00-04:00,"CCA Field (Columbus, MS)",100,MBA,2025
6350967,597064,Webster Gorloks,597344,MUW Owls,597344,2,bot,"A. Benson homered to center field, RBI.",15,2025-03-26T00:00:00-04:00,"CCA Field (Columbus, MS)",100,MBA,2025
6350967,597064,Webster Gorloks,597344,MUW Owls,597344,2,bot,L. Cox doubled down the lf line.,16,2025-03-26T00:00:00-04:00,"CCA Field (Columbus, MS)",100,MBA,2025
6350967,597064,Webster Gorloks,597344,MUW Owls,597344,2,bot,B. Brack singled to first base3a L. Cox advanced to third.,17,2025-03-26T00:00:00-04:00,"CCA Field (Columbus, MS)",100,MBA,2025
6350967,597064,Webster Gorloks,597344,MUW Owls,597344,2,bot,Z. Egan hit by pitch3a B. Brack advanced to second.,18,2025-03-26T00:00:00-04:00,"CCA Field (Columbus, MS)",100,MBA,2025
6350967,597064,Webster Gorloks,597344,MUW Owls,597344,2,bot,"S. Rikard walked, RBI3a Z. Egan advanced to second3a B. Brack advanced to third3a L. Cox scored.",19,2025-03-26T00:00:00-04:00,"CCA Field (Columbus, MS)",100,MBA,2025
6350967,597064,Webster Gorloks,597344,MUW Owls,597344,2,bot,T. Estabrook grounded into double play ss to 2b to 1b3a S. Rikard out on the play3a Z. Egan advanced to third3a B. Brack scored.,20,2025-03-26T00:00:00-04:00,"CCA Field (Columbus, MS)",100,MBA,2025
6350967,597064,Webster Gorloks,597344,MUW Owls,597344,2,bot,L. Clark hit by pitch.,21,2025-03-26T00:00:00-04:00,"CCA Field (Columbus, MS)",100,MBA,2025
6350967,597064,Webster Gorloks,597344,MUW Owls,597344,2,bot,M. Windham struck out swinging.,22,2025-03-26T00:00:00-04:00,"CCA Field (Columbus, MS)",100,MBA,2025
6350967,597064,Webster Gorloks,597344,MUW Owls,597064,3,top,E. Evola out at first 3b to 2b.,23,2025-03-26T00:00:00-04:00,"CCA Field (Columbus, MS)",100,MBA,2025
6350967,597064,Webster Gorloks,597344,MUW Owls,597064,3,top,C. McBride grounded out to ss.,24,2025-03-26T00:00:00-04:00,"CCA Field (Columbus, MS)",100,MBA,2025
6350967,597064,Webster Gorloks,597344,MUW Owls,597064,3,top,R. LaRocco singled to left field.,25,2025-03-26T00:00:00-04:00,"CCA Field (Columbus, MS)",100,MBA,2025
6350967,597064,Webster Gorloks,597344,MUW Owls,597064,3,top,R. Hartz struck out swinging.,26,2025-03-26T00:00:00-04:00,"CCA Field (Columbus, MS)",100,MBA,2025
6350967,597064,Webster Gorloks,597344,MUW Owls,597344,3,bot,Z. Johnson singled through the left side.,27,2025-03-26T00:00:00-04:00,"CCA Field (Columbus, MS)",100,MBA,2025
6350967,597064,Webster Gorloks,597344,MUW Owls,597344,3,bot,E. Luzum to p for J. Miller.,28,2025-03-26T00:00:00-04:00,"CCA Field (Columbus, MS)",100,MBA,2025
6350967,597064,Webster Gorloks,597344,MUW Owls,597344,3,bot,"A. Benson singled, RBI3a Z. Johnson scored.",29,2025-03-26T00:00:00-04:00,"CCA Field (Columbus, MS)",100,MBA,2025
6350967,597064,Webster Gorloks,597344,MUW Owls,597344,3,bot,L. Cox popped up to ss.,30,2025-03-26T00:00:00-04:00,"CCA Field (Columbus, MS)",100,MBA,2025
6350967,597064,Webster Gorloks,597344,MUW Owls,597344,3,bot,B. Brack struck out swinging.,31,2025-03-26T00:00:00-04:00,"CCA Field (Columbus, MS)",100,MBA,2025
6350967,597064,Webster Gorloks,597344,MUW Owls,597344,3,bot,Z. Egan walked3a A. Benson advanced to second.,32,2025-03-26T00:00:00-04:00,"CCA Field (Columbus, MS)",100,MBA,2025
6350967,597064,Webster Gorloks,597344,MUW Owls,597344,3,bot,S. Rikard grounded out to p.,33,2025-03-26T00:00:00-04:00,"CCA Field (Columbus, MS)",100,MBA,2025
6350967,597064,Webster Gorloks,597344,MUW Owls,597064,4,top,C. Neal to 3b for Z. Egan.,34,2025-03-26T00:00:00-04:00,"CCA Field (Columbus, MS)",100,MBA,2025
6350967,597064,Webster Gorloks,597344,MUW Owls,597064,4,top,S. Rikard to ss.,35,2025-03-26T00:00:00-04:00,"CCA Field (Columbus, MS)",100,MBA,2025
6350967,597064,Webster Gorloks,597344,MUW Owls,597064,4,top,T. Estabrook to 2b.,36,2025-03-26T00:00:00-04:00,"CCA Field (Columbus, MS)",100,MBA,2025
6350967,597064,Webster Gorloks,597344,MUW Owls,597064,4,top,C. Hailstone grounded out to 3b.,37,2025-03-26T00:00:00-04:00,"CCA Field (Columbus, MS)",100,MBA,2025
6350967,597064,Webster Gorloks,597344,MUW Owls,597064,4,top,N. Wrubluski grounded out to 3b.,38,2025-03-26T00:00:00-04:00,"CCA Field (Columbus, MS)",100,MBA,2025
6350967,597064,Webster Gorloks,597344,MUW Owls,597064,4,top,B. Stedman grounded out to ss.,39,2025-03-26T00:00:00-04:00,"CCA Field (Columbus, MS)",100,MBA,2025
6350967,597064,Webster Gorloks,597344,MUW Owls,597344,4,bot,T. Estabrook popped up to 1b.,40,2025-03-26T00:00:00-04:00,"CCA Field (Columbus, MS)",100,MBA,2025
6350967,597064,Webster Gorloks,597344,MUW Owls,597344,4,bot,"L. Clark singled, advanced to second on a fielding error by lf.",41,2025-03-26T00:00:00-04:00,"CCA Field (Columbus, MS)",100,MBA,2025
6350967,597064,Webster Gorloks,597344,MUW Owls,597344,4,bot,J. Wilson to p for E. Luzum.,42,2025-03-26T00:00:00-04:00,"CCA Field (Columbus, MS)",100,MBA,2025
6350967,597064,Webster Gorloks,597344,MUW Owls,597344,4,bot,L. Clark stole third.,43,2025-03-26T00:00:00-04:00,"CCA Field (Columbus, MS)",100,MBA,2025
6350967,597064,Webster Gorloks,597344,MUW Owls,597344,4,bot,"M. Windham singled to right field, RBI3a L. Clark scored.",44,2025-03-26T00:00:00-04:00,"CCA Field (Columbus, MS)",100,MBA,2025
6350967,597064,Webster Gorloks,597344,MUW Owls,597344,4,bot,M. Windham stole second.,45,2025-03-26T00:00:00-04:00,"CCA Field (Columbus, MS)",100,MBA,2025
6350967,597064,Webster Gorloks,597344,MUW Owls,597344,4,bot,Z. Johnson grounded out to 2b3a M. Windham advanced to third.,46,2025-03-26T00:00:00-04:00,"CCA Field (Columbus, MS)",100,MBA,2025
6350967,597064,Webster Gorloks,597344,MUW Owls,597344,4,bot,A. Benson was intentionally walked.,47,2025-03-26T00:00:00-04:00,"CCA Field (Columbus, MS)",100,MBA,2025
6350967,597064,Webster Gorloks,597344,MUW Owls,597344,4,bot,L. Cox reached on a fielder's choice3a A. Benson out at second 2b to 1b.,48,2025-03-26T00:00:00-04:00,"CCA Field (Columbus, MS)",100,MBA,2025
6350967,597064,Webster Gorloks,597344,MUW Owls,597064,5,top,J. Theodore singled to right field.,49,2025-03-26T00:00:00-04:00,"CCA Field (Columbus, MS)",100,MBA,2025
6350967,597064,Webster Gorloks,597344,MUW Owls,597064,5,top,K. Peters flied out to cf.,50,2025-03-26T00:00:00-04:00,"CCA Field (Columbus, MS)",100,MBA,2025
6350967,597064,Webster Gorloks,597344,MUW Owls,597064,5,top,J. Theodore advanced to second on a wild pitch.,51,2025-03-26T00:00:00-04:00,"CCA Field (Columbus, MS)",100,MBA,2025
6350967,597064,Webster Gorloks,597344,MUW Owls,597064,5,top,E. Evola walked.,52,2025-03-26T00:00:00-04:00,"CCA Field (Columbus, MS)",100,MBA,2025
6350967,597064,Webster Gorloks,597344,MUW Owls,597064,5,top,C. McBride popped up to 2b.,53,2025-03-26T00:00:00-04:00,"CCA Field (Columbus, MS)",100,MBA,2025
6350967,597064,Webster Gorloks,597344,MUW Owls,597064,5,top,R. LaRocco flied out to lf.,54,2025-03-26T00:00:00-04:00,"CCA Field (Columbus, MS)",100,MBA,2025
6350967,597064,Webster Gorloks,597344,MUW Owls,597344,5,bot,B. Brack doubled down the rf line.,55,2025-03-26T00:00:00-04:00,"CCA Field (Columbus, MS)",100,MBA,2025
6350967,597064,Webster Gorloks,597344,MUW Owls,597344,5,bot,C. Neal grounded out to c unassisted.,56,2025-03-26T00:00:00-04:00,"CCA Field (Columbus, MS)",100,MBA,2025
6350967,597064,Webster Gorloks,597344,MUW Owls,597344,5,bot,Z. Mevert to p for J. Wilson.,57,2025-03-26T00:00:00-04:00,"CCA Field (Columbus, MS)",100,MBA,2025
6350967,597064,Webster Gorloks,597344,MUW Owls,597344,5,bot,B. Brack advanced to third on a throwing error by p.,58,2025-03-26T00:00:00-04:00,"CCA Field (Columbus, MS)",100,MBA,2025
6350967,597064,Webster Gorloks,597344,MUW Owls,597344,5,bot,"S. Rikard reached first on a fielding error by p, SAC, bunt, RBI3a B. Brack scored, unearned.",59,2025-03-26T00:00:00-04:00,"CCA Field (Columbus, MS)",100,MBA,2025
6350967,597064,Webster Gorloks,597344,MUW Owls,597344,5,bot,J. Arsenault to p for Z. Mevert.,60,2025-03-26T00:00:00-04:00,"CCA Field (Columbus, MS)",100,MBA,2025
6350967,597064,Webster Gorloks,597344,MUW Owls,597344,5,bot,T. Estabrook flied out to rf.,61,2025-03-26T00:00:00-04:00,"CCA Field (Columbus, MS)",100,MBA,2025
6350967,597064,Webster Gorloks,597344,MUW Owls,597344,5,bot,S. Rikard advanced to second on a wild pitch.,62,2025-03-26T00:00:00-04:00,"CCA Field (Columbus, MS)",100,MBA,2025
6350967,597064,Webster Gorloks,597344,MUW Owls,597344,5,bot,L. Clark hit by pitch.,63,2025-03-26T00:00:00-04:00,"CCA Field (Columbus, MS)",100,MBA,2025
6350967,597064,Webster Gorloks,597344,MUW Owls,597344,5,bot,M. Windham reached on a fielder's choice3a L. Clark advanced to second3a S. Rikard out at third 3b unassisted.,64,2025-03-26T00:00:00-04:00,"CCA Field (Columbus, MS)",100,MBA,2025
6350967,597064,Webster Gorloks,597344,MUW Owls,597064,6,top,R. Hartz struck out swinging.,65,2025-03-26T00:00:00-04:00,"CCA Field (Columbus, MS)",100,MBA,2025
6350967,597064,Webster Gorloks,597344,MUW Owls,597064,6,top,C. Hailstone struck out swinging.,66,2025-03-26T00:00:00-04:00,"CCA Field (Columbus, MS)",100,MBA,2025
6350967,597064,Webster Gorloks,597344,MUW Owls,597064,6,top,N. Wrubluski flied out to cf.,67,2025-03-26T00:00:00-04:00,"CCA Field (Columbus, MS)",100,MBA,2025
6350967,597064,Webster Gorloks,597344,MUW Owls,597344,6,bot,Z. Johnson struck out swinging.,68,2025-03-26T00:00:00-04:00,"CCA Field (Columbus, MS)",100,MBA,2025
6350967,597064,Webster Gorloks,597344,MUW Owls,597344,6,bot,A. Benson struck out looking.,69,2025-03-26T00:00:00-04:00,"CCA Field (Columbus, MS)",100,MBA,2025
6350967,597064,Webster Gorloks,597344,MUW Owls,597344,6,bot,C. Jackson to p for J. Arsenault.,70,2025-03-26T00:00:00-04:00,"CCA Field (Columbus, MS)",100,MBA,2025
6350967,597064,Webster Gorloks,597344,MUW Owls,597344,6,bot,L. Cox struck out looking.,71,2025-03-26T00:00:00-04:00,"CCA Field (Columbus, MS)",100,MBA,2025
6350967,597064,Webster Gorloks,597344,MUW Owls,597064,7,top,C. McCl3auney to p for C. Ellis.,72,2025-03-26T00:00:00-04:00,"CCA Field (Columbus, MS)",100,MBA,2025
6350967,597064,Webster Gorloks,597344,MUW Owls,597064,7,top,B. Stedman grounded out to ss.,73,2025-03-26T00:00:00-04:00,"CCA Field (Columbus, MS)",100,MBA,2025
6350967,597064,Webster Gorloks,597344,MUW Owls,597064,7,top,J. Theodore lined out to cf.,74,2025-03-26T00:00:00-04:00,"CCA Field (Columbus, MS)",100,MBA,2025
6350967,597064,Webster Gorloks,597344,MUW Owls,597064,7,top,K. Peters grounded out to p.,75,2025-03-26T00:00:00-04:00,"CCA Field (Columbus, MS)",100,MBA,2025
6350967,597064,Webster Gorloks,597344,MUW Owls,597344,7,bot,B. Brack grounded out to 1b unassisted.,76,2025-03-26T00:00:00-04:00,"CCA Field (Columbus, MS)",100,MBA,2025
6350967,597064,Webster Gorloks,597344,MUW Owls,597344,7,bot,C. Neal grounded out to p.,77,2025-03-26T00:00:00-04:00,"CCA Field (Columbus, MS)",100,MBA,2025
6350967,597064,Webster Gorloks,597344,MUW Owls,597344,7,bot,"S. Rikard singled to right field, advanced to second on a fielding error by rf.",78,2025-03-26T00:00:00-04:00,"CCA Field (Columbus, MS)",100,MBA,2025
6350967,597064,Webster Gorloks,597344,MUW Owls,597344,7,bot,T. Estabrook flied out to rf.,79,2025-03-26T00:00:00-04:00,"CCA Field (Columbus, MS)",100,MBA,2025
6350967,597064,Webster Gorloks,597344,MUW Owls,597064,8,top,E. Evola lined out to cf.,80,2025-03-26T00:00:00-04:00,"CCA Field (Columbus, MS)",100,MBA,2025
6350967,597064,Webster Gorloks,597344,MUW Owls,597064,8,top,C. McBride struck out swinging.,81,2025-03-26T00:00:00-04:00,"CCA Field (Columbus, MS)",100,MBA,2025
6350967,597064,Webster Gorloks,597344,MUW Owls,597064,8,top,R. LaRocco grounded out to p.,82,2025-03-26T00:00:00-04:00,"CCA Field (Columbus, MS)",100,MBA,2025
6350967,597064,Webster Gorloks,597344,MUW Owls,597344,8,bot,C. Johnson to p for C. Jackson.,83,2025-03-26T00:00:00-04:00,"CCA Field (Columbus, MS)",100,MBA,2025
6350967,597064,Webster Gorloks,597344,MUW Owls,597344,8,bot,L. Clark walked.,84,2025-03-26T00:00:00-04:00,"CCA Field (Columbus, MS)",100,MBA,2025
6350967,597064,Webster Gorloks,597344,MUW Owls,597344,8,bot,"M. Windham out at first 1b to 2b, SAC3a L. Clark advanced to second.",85,2025-03-26T00:00:00-04:00,"CCA Field (Columbus, MS)",100,MBA,2025
6350967,597064,Webster Gorloks,597344,MUW Owls,597344,8,bot,Z. Johnson grounded out to ss.,86,2025-03-26T00:00:00-04:00,"CCA Field (Columbus, MS)",100,MBA,2025
6350967,597064,Webster Gorloks,597344,MUW Owls,597344,8,bot,A. Benson was intentionally walked.,87,2025-03-26T00:00:00-04:00,"CCA Field (Columbus, MS)",100,MBA,2025
6350967,597064,Webster Gorloks,597344,MUW Owls,597344,8,bot,A. Benson advanced to second3a L. Clark advanced to third on a wild pitch.,88,2025-03-26T00:00:00-04:00,"CCA Field (Columbus, MS)",100,MBA,2025
6350967,597064,Webster Gorloks,597344,MUW Owls,597344,8,bot,L. Cox grounded out to 3b.,89,2025-03-26T00:00:00-04:00,"CCA Field (Columbus, MS)",100,MBA,2025
6350967,597064,Webster Gorloks,597344,MUW Owls,597064,9,top,R. Hartz grounded out to p.,90,2025-03-26T00:00:00-04:00,"CCA Field (Columbus, MS)",100,MBA,2025
6350967,597064,Webster Gorloks,597344,MUW Owls,597064,9,top,N. Schumache pinch hit for C. Hailstone.,91,2025-03-26T00:00:00-04:00,"CCA Field (Columbus, MS)",100,MBA,2025
6350967,597064,Webster Gorloks,597344,MUW Owls,597064,9,top,"N. Schumache homered to center field, RBI.",92,2025-03-26T00:00:00-04:00,"CCA Field (Columbus, MS)",100,MBA,2025
6350967,597064,Webster Gorloks,597344,MUW Owls,597064,9,top,N. Wrubluski flied out to cf.,93,2025-03-26T00:00:00-04:00,"CCA Field (Columbus, MS)",100,MBA,2025
6350967,597064,Webster Gorloks,597344,MUW Owls,597064,9,top,B. Stedman doubled to right field.,94,2025-03-26T00:00:00-04:00,"CCA Field (Columbus, MS)",100,MBA,2025
6350967,597064,Webster Gorloks,597344,MUW Owls,597064,9,top,J. Theodore lined out to cf.,95,2025-03-26T00:00:00-04:00,"CCA Field (Columbus, MS)",100,MBA,2025
