game_id,away_team_id,away_team_name,home_team_id,home_team_name,batting_team,inning,top_bot,event_text,event_num,game_datetime,stadium_name,attendance,sport_id,season
6351995,596963,Coker Cobras,596791,Anderson (SC) Trojans,596963,1,top,Ick Cirino flied out to rf.,1,2025-04-12T00:00:00-04:00,"Anderson Memorial Stadium (Anderson, SC)",0,MBA,2025
6351995,596963,Coker Cobras,596791,Anderson (SC) Trojans,596963,1,top,Gabriel Santiago flied out to cf.,2,2025-04-12T00:00:00-04:00,"Anderson Memorial Stadium (Anderson, SC)",0,MBA,2025
6351995,596963,Coker Cobras,596791,Anderson (SC) Trojans,596963,1,top,Rocco Wojcik flied out to rf.,3,2025-04-12T00:00:00-04:00,"Anderson Memorial Stadium (Anderson, SC)",0,MBA,2025
6351995,596963,Coker Cobras,596791,Anderson (SC) Trojans,596791,1,bot,Braeden Harrison singled to right field.,4,2025-04-12T00:00:00-04:00,"Anderson Memorial Stadium (Anderson, SC)",0,MBA,2025
6351995,596963,Coker Cobras,596791,Anderson (SC) Trojans,596791,1,bot,Kyle Caccamise reached on a fielder's choice to shortstop3a Braeden Harrison out at second ss to 2b.,5,2025-04-12T00:00:00-04:00,"Anderson Memorial Stadium (Anderson, SC)",0,MBA,2025
6351995,596963,Coker Cobras,596791,Anderson (SC) Trojans,596791,1,bot,Zach Stover grounded out to 3b3a Kyle Caccamise advanced to second.,6,2025-04-12T00:00:00-04:00,"Anderson Memorial Stadium (Anderson, SC)",0,MBA,2025
6351995,596963,Coker Cobras,596791,Anderson (SC) Trojans,596791,1,bot,Brooks Mauro grounded out to 2b.,7,2025-04-12T00:00:00-04:00,"Anderson Memorial Stadium (Anderson, SC)",0,MBA,2025
6351995,596963,Coker Cobras,596791,Anderson (SC) Trojans,596963,2,top,Kyler Odom grounded out to ss.,8,2025-04-12T00:00:00-04:00,"Anderson Memorial Stadium (Anderson, SC)",0,MBA,2025
6351995,596963,Coker Cobras,596791,Anderson (SC) Trojans,596963,2,top,Jaylen Mack grounded out to p.,9,2025-04-12T00:00:00-04:00,"Anderson Memorial Stadium (Anderson, SC)",0,MBA,2025
6351995,596963,Coker Cobras,596791,Anderson (SC) Trojans,596963,2,top,Luke Alford singled through the right side.,10,2025-04-12T00:00:00-04:00,"Anderson Memorial Stadium (Anderson, SC)",0,MBA,2025
6351995,596963,Coker Cobras,596791,Anderson (SC) Trojans,596963,2,top,Alex Lazar grounded out to 3b.,11,2025-04-12T00:00:00-04:00,"Anderson Memorial Stadium (Anderson, SC)",0,MBA,2025
6351995,596963,Coker Cobras,596791,Anderson (SC) Trojans,596791,2,bot,Gray Wells flied out to cf.,12,2025-04-12T00:00:00-04:00,"Anderson Memorial Stadium (Anderson, SC)",0,MBA,2025
6351995,596963,Coker Cobras,596791,Anderson (SC) Trojans,596791,2,bot,Ben Bullard popped up to ss.,13,2025-04-12T00:00:00-04:00,"Anderson Memorial Stadium (Anderson, SC)",0,MBA,2025
6351995,596963,Coker Cobras,596791,Anderson (SC) Trojans,596791,2,bot,Dom Bello struck out swinging.,14,2025-04-12T00:00:00-04:00,"Anderson Memorial Stadium (Anderson, SC)",0,MBA,2025
6351995,596963,Coker Cobras,596791,Anderson (SC) Trojans,596963,3,top,Hunter Poole grounded out to ss.,15,2025-04-12T00:00:00-04:00,"Anderson Memorial Stadium (Anderson, SC)",0,MBA,2025
6351995,596963,Coker Cobras,596791,Anderson (SC) Trojans,596963,3,top,Adam Wilkerson singled up the middle.,16,2025-04-12T00:00:00-04:00,"Anderson Memorial Stadium (Anderson, SC)",0,MBA,2025
6351995,596963,Coker Cobras,596791,Anderson (SC) Trojans,596963,3,top,Ick Cirino doubled to left field3a Adam Wilkerson advanced to third.,17,2025-04-12T00:00:00-04:00,"Anderson Memorial Stadium (Anderson, SC)",0,MBA,2025
6351995,596963,Coker Cobras,596791,Anderson (SC) Trojans,596963,3,top,Gabriel Santiago flied out to cf.,18,2025-04-12T00:00:00-04:00,"Anderson Memorial Stadium (Anderson, SC)",0,MBA,2025
6351995,596963,Coker Cobras,596791,Anderson (SC) Trojans,596963,3,top,Rocco Wojcik grounded out to 2b.,19,2025-04-12T00:00:00-04:00,"Anderson Memorial Stadium (Anderson, SC)",0,MBA,2025
6351995,596963,Coker Cobras,596791,Anderson (SC) Trojans,596791,3,bot,Brayden Owens struck out looking.,20,2025-04-12T00:00:00-04:00,"Anderson Memorial Stadium (Anderson, SC)",0,MBA,2025
6351995,596963,Coker Cobras,596791,Anderson (SC) Trojans,596791,3,bot,Bryce Helms struck out swinging.,21,2025-04-12T00:00:00-04:00,"Anderson Memorial Stadium (Anderson, SC)",0,MBA,2025
6351995,596963,Coker Cobras,596791,Anderson (SC) Trojans,596791,3,bot,Braeden Harrison walked.,22,2025-04-12T00:00:00-04:00,"Anderson Memorial Stadium (Anderson, SC)",0,MBA,2025
6351995,596963,Coker Cobras,596791,Anderson (SC) Trojans,596791,3,bot,Kyle Caccamise singled through the left side3a Braeden Harrison advanced to third.,23,2025-04-12T00:00:00-04:00,"Anderson Memorial Stadium (Anderson, SC)",0,MBA,2025
6351995,596963,Coker Cobras,596791,Anderson (SC) Trojans,596791,3,bot,"Zach Stover singled to center field, RBI3a Kyle Caccamise advanced to third3a Braeden Harrison scored.",24,2025-04-12T00:00:00-04:00,"Anderson Memorial Stadium (Anderson, SC)",0,MBA,2025
6351995,596963,Coker Cobras,596791,Anderson (SC) Trojans,596791,3,bot,"Brooks Mauro homered to left field, 3 RBI3a Zach Stover scored3a Kyle Caccamise scored.",25,2025-04-12T00:00:00-04:00,"Anderson Memorial Stadium (Anderson, SC)",0,MBA,2025
6351995,596963,Coker Cobras,596791,Anderson (SC) Trojans,596791,3,bot,Gray Wells flied out to lf.,26,2025-04-12T00:00:00-04:00,"Anderson Memorial Stadium (Anderson, SC)",0,MBA,2025
6351995,596963,Coker Cobras,596791,Anderson (SC) Trojans,596963,4,top,Kyler Odom walked.,27,2025-04-12T00:00:00-04:00,"Anderson Memorial Stadium (Anderson, SC)",0,MBA,2025
6351995,596963,Coker Cobras,596791,Anderson (SC) Trojans,596963,4,top,Jaylen Mack singled through the left side3a Kyler Odom advanced to second.,28,2025-04-12T00:00:00-04:00,"Anderson Memorial Stadium (Anderson, SC)",0,MBA,2025
6351995,596963,Coker Cobras,596791,Anderson (SC) Trojans,596963,4,top,"Luke Alford reached first on a throwing error by c, SAC, bunt3a Jaylen Mack advanced to second3a Kyler Odom advanced to third, scored on the error, unearned.",29,2025-04-12T00:00:00-04:00,"Anderson Memorial Stadium (Anderson, SC)",0,MBA,2025
6351995,596963,Coker Cobras,596791,Anderson (SC) Trojans,596963,4,top,Alex Lazar fouled out to 1b.,30,2025-04-12T00:00:00-04:00,"Anderson Memorial Stadium (Anderson, SC)",0,MBA,2025
6351995,596963,Coker Cobras,596791,Anderson (SC) Trojans,596963,4,top,Hunter Poole popped up to ss.,31,2025-04-12T00:00:00-04:00,"Anderson Memorial Stadium (Anderson, SC)",0,MBA,2025
6351995,596963,Coker Cobras,596791,Anderson (SC) Trojans,596963,4,top,Adam Wilkerson grounded out to 2b.,32,2025-04-12T00:00:00-04:00,"Anderson Memorial Stadium (Anderson, SC)",0,MBA,2025
6351995,596963,Coker Cobras,596791,Anderson (SC) Trojans,596791,4,bot,Britton Adams to p for Cody Chapman.,33,2025-04-12T00:00:00-04:00,"Anderson Memorial Stadium (Anderson, SC)",0,MBA,2025
6351995,596963,Coker Cobras,596791,Anderson (SC) Trojans,596791,4,bot,Ben Bullard grounded out to 3b.,34,2025-04-12T00:00:00-04:00,"Anderson Memorial Stadium (Anderson, SC)",0,MBA,2025
6351995,596963,Coker Cobras,596791,Anderson (SC) Trojans,596791,4,bot,Dom Bello grounded out to p.,35,2025-04-12T00:00:00-04:00,"Anderson Memorial Stadium (Anderson, SC)",0,MBA,2025
6351995,596963,Coker Cobras,596791,Anderson (SC) Trojans,596791,4,bot,Brayden Owens grounded out to ss.,36,2025-04-12T00:00:00-04:00,"Anderson Memorial Stadium (Anderson, SC)",0,MBA,2025
6351995,596963,Coker Cobras,596791,Anderson (SC) Trojans,596963,5,top,Ick Cirino doubled down the lf line.,37,2025-04-12T00:00:00-04:00,"Anderson Memorial Stadium (Anderson, SC)",0,MBA,2025
6351995,596963,Coker Cobras,596791,Anderson (SC) Trojans,596963,5,top,Gabriel Santiago grounded out to 2b3a Ick Cirino advanced to third.,38,2025-04-12T00:00:00-04:00,"Anderson Memorial Stadium (Anderson, SC)",0,MBA,2025
6351995,596963,Coker Cobras,596791,Anderson (SC) Trojans,596963,5,top,Rocco Wojcik hit by pitch.,39,2025-04-12T00:00:00-04:00,"Anderson Memorial Stadium (Anderson, SC)",0,MBA,2025
6351995,596963,Coker Cobras,596791,Anderson (SC) Trojans,596963,5,top,George Massingill to p for Walker Case.,40,2025-04-12T00:00:00-04:00,"Anderson Memorial Stadium (Anderson, SC)",0,MBA,2025
6351995,596963,Coker Cobras,596791,Anderson (SC) Trojans,596963,5,top,"Kyler Odom grounded out to p, SAC, bunt, RBI3a Rocco Wojcik advanced to second3a Ick Cirino scored.",41,2025-04-12T00:00:00-04:00,"Anderson Memorial Stadium (Anderson, SC)",0,MBA,2025
6351995,596963,Coker Cobras,596791,Anderson (SC) Trojans,596963,5,top,"Jaylen Mack doubled down the lf line, RBI3a Rocco Wojcik scored.",42,2025-04-12T00:00:00-04:00,"Anderson Memorial Stadium (Anderson, SC)",0,MBA,2025
6351995,596963,Coker Cobras,596791,Anderson (SC) Trojans,596963,5,top,Luke Alford grounded out to 2b.,43,2025-04-12T00:00:00-04:00,"Anderson Memorial Stadium (Anderson, SC)",0,MBA,2025
6351995,596963,Coker Cobras,596791,Anderson (SC) Trojans,596791,5,bot,Bryce Helms popped up to ss.,44,2025-04-12T00:00:00-04:00,"Anderson Memorial Stadium (Anderson, SC)",0,MBA,2025
6351995,596963,Coker Cobras,596791,Anderson (SC) Trojans,596791,5,bot,"Braeden Harrison reached first on a throwing error by ss, advanced to second.",45,2025-04-12T00:00:00-04:00,"Anderson Memorial Stadium (Anderson, SC)",0,MBA,2025
6351995,596963,Coker Cobras,596791,Anderson (SC) Trojans,596791,5,bot,Kyle Caccamise grounded out to 2b3a Braeden Harrison advanced to third.,46,2025-04-12T00:00:00-04:00,"Anderson Memorial Stadium (Anderson, SC)",0,MBA,2025
6351995,596963,Coker Cobras,596791,Anderson (SC) Trojans,596791,5,bot,Zach Stover grounded out to 3b.,47,2025-04-12T00:00:00-04:00,"Anderson Memorial Stadium (Anderson, SC)",0,MBA,2025
6351995,596963,Coker Cobras,596791,Anderson (SC) Trojans,596963,6,top,Jacob Ingram to p for George Massingill.,48,2025-04-12T00:00:00-04:00,"Anderson Memorial Stadium (Anderson, SC)",0,MBA,2025
6351995,596963,Coker Cobras,596791,Anderson (SC) Trojans,596963,6,top,Hudson Wilson to c for Dom Bello.,49,2025-04-12T00:00:00-04:00,"Anderson Memorial Stadium (Anderson, SC)",0,MBA,2025
6351995,596963,Coker Cobras,596791,Anderson (SC) Trojans,596963,6,top,Alex Lazar walked.,50,2025-04-12T00:00:00-04:00,"Anderson Memorial Stadium (Anderson, SC)",0,MBA,2025
6351995,596963,Coker Cobras,596791,Anderson (SC) Trojans,596963,6,top,Alex Lazar advanced to second on a wild pitch.,51,2025-04-12T00:00:00-04:00,"Anderson Memorial Stadium (Anderson, SC)",0,MBA,2025
6351995,596963,Coker Cobras,596791,Anderson (SC) Trojans,596963,6,top,"Hunter Poole out at first p to 2b, SAC, bunt3a Alex Lazar advanced to third.",52,2025-04-12T00:00:00-04:00,"Anderson Memorial Stadium (Anderson, SC)",0,MBA,2025
6351995,596963,Coker Cobras,596791,Anderson (SC) Trojans,596963,6,top,"Adam Wilkerson flied out to cf, sacrifice fly, RBI3a Alex Lazar scored.",53,2025-04-12T00:00:00-04:00,"Anderson Memorial Stadium (Anderson, SC)",0,MBA,2025
6351995,596963,Coker Cobras,596791,Anderson (SC) Trojans,596963,6,top,Ick Cirino singled to center field.,54,2025-04-12T00:00:00-04:00,"Anderson Memorial Stadium (Anderson, SC)",0,MBA,2025
6351995,596963,Coker Cobras,596791,Anderson (SC) Trojans,596963,6,top,Corben Childers to p for Jacob Ingram.,55,2025-04-12T00:00:00-04:00,"Anderson Memorial Stadium (Anderson, SC)",0,MBA,2025
6351995,596963,Coker Cobras,596791,Anderson (SC) Trojans,596963,6,top,Gabriel Santiago walked3a Ick Cirino advanced to second.,56,2025-04-12T00:00:00-04:00,"Anderson Memorial Stadium (Anderson, SC)",0,MBA,2025
6351995,596963,Coker Cobras,596791,Anderson (SC) Trojans,596963,6,top,Rocco Wojcik grounded out to 2b.,57,2025-04-12T00:00:00-04:00,"Anderson Memorial Stadium (Anderson, SC)",0,MBA,2025
6351995,596963,Coker Cobras,596791,Anderson (SC) Trojans,596791,6,bot,Brooks Mauro struck out looking.,58,2025-04-12T00:00:00-04:00,"Anderson Memorial Stadium (Anderson, SC)",0,MBA,2025
6351995,596963,Coker Cobras,596791,Anderson (SC) Trojans,596791,6,bot,Gray Wells singled to left field.,59,2025-04-12T00:00:00-04:00,"Anderson Memorial Stadium (Anderson, SC)",0,MBA,2025
6351995,596963,Coker Cobras,596791,Anderson (SC) Trojans,596791,6,bot,Ben Bullard grounded into double play 2b to ss to 1b3a Gray Wells out on the play.,60,2025-04-12T00:00:00-04:00,"Anderson Memorial Stadium (Anderson, SC)",0,MBA,2025
6351995,596963,Coker Cobras,596791,Anderson (SC) Trojans,596963,7,top,Kyler Odom singled up the middle.,61,2025-04-12T00:00:00-04:00,"Anderson Memorial Stadium (Anderson, SC)",0,MBA,2025
6351995,596963,Coker Cobras,596791,Anderson (SC) Trojans,596963,7,top,Jacob Yarberry pinch ran for Kyler Odom.,62,2025-04-12T00:00:00-04:00,"Anderson Memorial Stadium (Anderson, SC)",0,MBA,2025
6351995,596963,Coker Cobras,596791,Anderson (SC) Trojans,596963,7,top,Jaylen Mack hit by pitch3a Jacob Yarberry advanced to second.,63,2025-04-12T00:00:00-04:00,"Anderson Memorial Stadium (Anderson, SC)",0,MBA,2025
6351995,596963,Coker Cobras,596791,Anderson (SC) Trojans,596963,7,top,Luke Alford walked3a Jaylen Mack advanced to second3a Jacob Yarberry advanced to third.,64,2025-04-12T00:00:00-04:00,"Anderson Memorial Stadium (Anderson, SC)",0,MBA,2025
6351995,596963,Coker Cobras,596791,Anderson (SC) Trojans,596963,7,top,Caleb Costa to p for Corben Childers.,65,2025-04-12T00:00:00-04:00,"Anderson Memorial Stadium (Anderson, SC)",0,MBA,2025
6351995,596963,Coker Cobras,596791,Anderson (SC) Trojans,596963,7,top,"Alex Lazar singled to right field, 2 RBI3a Luke Alford advanced to third3a Jaylen Mack scored3a Jacob Yarberry scored.",66,2025-04-12T00:00:00-04:00,"Anderson Memorial Stadium (Anderson, SC)",0,MBA,2025
6351995,596963,Coker Cobras,596791,Anderson (SC) Trojans,596963,7,top,Alex Lazar advanced to second.,67,2025-04-12T00:00:00-04:00,"Anderson Memorial Stadium (Anderson, SC)",0,MBA,2025
6351995,596963,Coker Cobras,596791,Anderson (SC) Trojans,596963,7,top,"Hunter Poole singled down the lf line, 2 RBI3a Alex Lazar scored3a Luke Alford scored.",68,2025-04-12T00:00:00-04:00,"Anderson Memorial Stadium (Anderson, SC)",0,MBA,2025
6351995,596963,Coker Cobras,596791,Anderson (SC) Trojans,596963,7,top,Adam Wilkerson reached on a fielder's choice to shortstop3a Hunter Poole advanced to second on a fielding error by ss.,69,2025-04-12T00:00:00-04:00,"Anderson Memorial Stadium (Anderson, SC)",0,MBA,2025
6351995,596963,Coker Cobras,596791,Anderson (SC) Trojans,596963,7,top,Adam Wilkerson advanced to second3a Hunter Poole advanced to third.,70,2025-04-12T00:00:00-04:00,"Anderson Memorial Stadium (Anderson, SC)",0,MBA,2025
6351995,596963,Coker Cobras,596791,Anderson (SC) Trojans,596963,7,top,"Ick Cirino doubled down the lf line, 2 RBI3a Adam Wilkerson scored3a Hunter Poole scored, unearned.",71,2025-04-12T00:00:00-04:00,"Anderson Memorial Stadium (Anderson, SC)",0,MBA,2025
6351995,596963,Coker Cobras,596791,Anderson (SC) Trojans,596963,7,top,Charlie Sauls to p for Caleb Costa.,72,2025-04-12T00:00:00-04:00,"Anderson Memorial Stadium (Anderson, SC)",0,MBA,2025
6351995,596963,Coker Cobras,596791,Anderson (SC) Trojans,596963,7,top,"Gabriel Santiago reached first on a throwing error by p, SAC, bunt, advanced to third on the error3a Ick Cirino scored.",73,2025-04-12T00:00:00-04:00,"Anderson Memorial Stadium (Anderson, SC)",0,MBA,2025
6351995,596963,Coker Cobras,596791,Anderson (SC) Trojans,596963,7,top,Rocco Wojcik walked.,74,2025-04-12T00:00:00-04:00,"Anderson Memorial Stadium (Anderson, SC)",0,MBA,2025
6351995,596963,Coker Cobras,596791,Anderson (SC) Trojans,596963,7,top,Jacob Yarberry to dh.,75,2025-04-12T00:00:00-04:00,"Anderson Memorial Stadium (Anderson, SC)",0,MBA,2025
6351995,596963,Coker Cobras,596791,Anderson (SC) Trojans,596963,7,top,Rocco Wojcik advanced to second.,76,2025-04-12T00:00:00-04:00,"Anderson Memorial Stadium (Anderson, SC)",0,MBA,2025
6351995,596963,Coker Cobras,596791,Anderson (SC) Trojans,596963,7,top,"Jacob Yarberry flied out to cf, sacrifice fly, RBI3a Rocco Wojcik advanced to third3a Gabriel Santiago scored, unearned.",77,2025-04-12T00:00:00-04:00,"Anderson Memorial Stadium (Anderson, SC)",0,MBA,2025
6351995,596963,Coker Cobras,596791,Anderson (SC) Trojans,596963,7,top,"Jaylen Mack singled to right field, RBI3a Rocco Wojcik scored, team unearned.",78,2025-04-12T00:00:00-04:00,"Anderson Memorial Stadium (Anderson, SC)",0,MBA,2025
6351995,596963,Coker Cobras,596791,Anderson (SC) Trojans,596963,7,top,Ashton Shackelford to p for Charlie Sauls.,79,2025-04-12T00:00:00-04:00,"Anderson Memorial Stadium (Anderson, SC)",0,MBA,2025
6351995,596963,Coker Cobras,596791,Anderson (SC) Trojans,596963,7,top,Luke Alford struck out swinging.,80,2025-04-12T00:00:00-04:00,"Anderson Memorial Stadium (Anderson, SC)",0,MBA,2025
6351995,596963,Coker Cobras,596791,Anderson (SC) Trojans,596963,7,top,Alex Lazar struck out swinging.,81,2025-04-12T00:00:00-04:00,"Anderson Memorial Stadium (Anderson, SC)",0,MBA,2025
6351995,596963,Coker Cobras,596791,Anderson (SC) Trojans,596791,7,bot,Hudson Wilson popped up to 3b.,82,2025-04-12T00:00:00-04:00,"Anderson Memorial Stadium (Anderson, SC)",0,MBA,2025
6351995,596963,Coker Cobras,596791,Anderson (SC) Trojans,596791,7,bot,Brayden Owens struck out swinging.,83,2025-04-12T00:00:00-04:00,"Anderson Memorial Stadium (Anderson, SC)",0,MBA,2025
6351995,596963,Coker Cobras,596791,Anderson (SC) Trojans,596791,7,bot,Bryce Helms popped up to 1b.,84,2025-04-12T00:00:00-04:00,"Anderson Memorial Stadium (Anderson, SC)",0,MBA,2025
