game_id,away_team_id,away_team_name,home_team_id,home_team_name,batting_team,inning,top_bot,event_text,event_num,game_datetime,stadium_name,attendance,sport_id,season
6351530,596821,Malone Pioneers,596894,Ky. Wesleyan Panthers,596821,1,top,Z. Flohr struck out looking.,1,2025-04-04T00:00:00-04:00,"Panther Park (Owensboro, KY)",43,MBA,2025
6351530,596821,Malone Pioneers,596894,Ky. Wesleyan Panthers,596821,1,top,A. Diaz singled to left field.,2,2025-04-04T00:00:00-04:00,"Panther Park (Owensboro, KY)",43,MBA,2025
6351530,596821,Malone Pioneers,596894,Ky. Wesleyan Panthers,596821,1,top,J. Stevens singled to right field3a A. Diaz advanced to second.,3,2025-04-04T00:00:00-04:00,"Panther Park (Owensboro, KY)",43,MBA,2025
6351530,596821,Malone Pioneers,596894,Ky. Wesleyan Panthers,596821,1,top,J. Barker grounded into double play ss to 2b to 1b3a J. Stevens out on the play.,4,2025-04-04T00:00:00-04:00,"Panther Park (Owensboro, KY)",43,MBA,2025
6351530,596821,Malone Pioneers,596894,Ky. Wesleyan Panthers,596894,1,bot,L. Hutson tripled down the rf line.,5,2025-04-04T00:00:00-04:00,"Panther Park (Owensboro, KY)",43,MBA,2025
6351530,596821,Malone Pioneers,596894,Ky. Wesleyan Panthers,596894,1,bot,"J. Mizell singled to center field, RBI3a L. Hutson scored.",6,2025-04-04T00:00:00-04:00,"Panther Park (Owensboro, KY)",43,MBA,2025
6351530,596821,Malone Pioneers,596894,Ky. Wesleyan Panthers,596894,1,bot,R. Dysholm lined out to lf.,7,2025-04-04T00:00:00-04:00,"Panther Park (Owensboro, KY)",43,MBA,2025
6351530,596821,Malone Pioneers,596894,Ky. Wesleyan Panthers,596894,1,bot,"R. Davis homered to left field, 2 RBI3a J. Mizell scored.",8,2025-04-04T00:00:00-04:00,"Panther Park (Owensboro, KY)",43,MBA,2025
6351530,596821,Malone Pioneers,596894,Ky. Wesleyan Panthers,596894,1,bot,T. VanHooser grounded out to 3b.,9,2025-04-04T00:00:00-04:00,"Panther Park (Owensboro, KY)",43,MBA,2025
6351530,596821,Malone Pioneers,596894,Ky. Wesleyan Panthers,596894,1,bot,C. Gudalis lined out to ss.,10,2025-04-04T00:00:00-04:00,"Panther Park (Owensboro, KY)",43,MBA,2025
6351530,596821,Malone Pioneers,596894,Ky. Wesleyan Panthers,596821,2,top,E. Petak hit by pitch.,11,2025-04-04T00:00:00-04:00,"Panther Park (Owensboro, KY)",43,MBA,2025
6351530,596821,Malone Pioneers,596894,Ky. Wesleyan Panthers,596821,2,top,R. Bonifay singled through the right side3a E. Petak advanced to third.,12,2025-04-04T00:00:00-04:00,"Panther Park (Owensboro, KY)",43,MBA,2025
6351530,596821,Malone Pioneers,596894,Ky. Wesleyan Panthers,596821,2,top,C. Munoz struck out swinging.,13,2025-04-04T00:00:00-04:00,"Panther Park (Owensboro, KY)",43,MBA,2025
6351530,596821,Malone Pioneers,596894,Ky. Wesleyan Panthers,596821,2,top,"R. Gumino grounded out to p, SAC, bunt, RBI3a R. Bonifay advanced to second3a E. Petak scored.",14,2025-04-04T00:00:00-04:00,"Panther Park (Owensboro, KY)",43,MBA,2025
6351530,596821,Malone Pioneers,596894,Ky. Wesleyan Panthers,596821,2,top,E. Baum struck out swinging.,15,2025-04-04T00:00:00-04:00,"Panther Park (Owensboro, KY)",43,MBA,2025
6351530,596821,Malone Pioneers,596894,Ky. Wesleyan Panthers,596894,2,bot,C. Perry grounded out to ss.,16,2025-04-04T00:00:00-04:00,"Panther Park (Owensboro, KY)",43,MBA,2025
6351530,596821,Malone Pioneers,596894,Ky. Wesleyan Panthers,596894,2,bot,E. Stockton flied out to rf.,17,2025-04-04T00:00:00-04:00,"Panther Park (Owensboro, KY)",43,MBA,2025
6351530,596821,Malone Pioneers,596894,Ky. Wesleyan Panthers,596894,2,bot,L. Molnar flied out to cf.,18,2025-04-04T00:00:00-04:00,"Panther Park (Owensboro, KY)",43,MBA,2025
6351530,596821,Malone Pioneers,596894,Ky. Wesleyan Panthers,596821,3,top,Z. Flohr hit by pitch.,19,2025-04-04T00:00:00-04:00,"Panther Park (Owensboro, KY)",43,MBA,2025
6351530,596821,Malone Pioneers,596894,Ky. Wesleyan Panthers,596821,3,top,A. Diaz singled through the left side3a Z. Flohr advanced to second.,20,2025-04-04T00:00:00-04:00,"Panther Park (Owensboro, KY)",43,MBA,2025
6351530,596821,Malone Pioneers,596894,Ky. Wesleyan Panthers,596821,3,top,"J. Stevens singled through the left side, RBI3a A. Diaz advanced to second3a Z. Flohr scored.",21,2025-04-04T00:00:00-04:00,"Panther Park (Owensboro, KY)",43,MBA,2025
6351530,596821,Malone Pioneers,596894,Ky. Wesleyan Panthers,596821,3,top,"J. Barker reached on a fielder's choice to shortstop, advanced to second3a J. Stevens out at second ss to 2b3a A. Diaz scored on a throwing error by 2b, unearned.",22,2025-04-04T00:00:00-04:00,"Panther Park (Owensboro, KY)",43,MBA,2025
6351530,596821,Malone Pioneers,596894,Ky. Wesleyan Panthers,596821,3,top,E. Petak struck out swinging.,23,2025-04-04T00:00:00-04:00,"Panther Park (Owensboro, KY)",43,MBA,2025
6351530,596821,Malone Pioneers,596894,Ky. Wesleyan Panthers,596821,3,top,R. Bonifay walked.,24,2025-04-04T00:00:00-04:00,"Panther Park (Owensboro, KY)",43,MBA,2025
6351530,596821,Malone Pioneers,596894,Ky. Wesleyan Panthers,596821,3,top,C. Munoz struck out looking.,25,2025-04-04T00:00:00-04:00,"Panther Park (Owensboro, KY)",43,MBA,2025
6351530,596821,Malone Pioneers,596894,Ky. Wesleyan Panthers,596894,3,bot,L. Hutson fouled out to rf.,26,2025-04-04T00:00:00-04:00,"Panther Park (Owensboro, KY)",43,MBA,2025
6351530,596821,Malone Pioneers,596894,Ky. Wesleyan Panthers,596894,3,bot,J. Mizell flied out to cf.,27,2025-04-04T00:00:00-04:00,"Panther Park (Owensboro, KY)",43,MBA,2025
6351530,596821,Malone Pioneers,596894,Ky. Wesleyan Panthers,596894,3,bot,R. Dysholm flied out to lf.,28,2025-04-04T00:00:00-04:00,"Panther Park (Owensboro, KY)",43,MBA,2025
6351530,596821,Malone Pioneers,596894,Ky. Wesleyan Panthers,596821,4,top,R. Gumino singled through the left side.,29,2025-04-04T00:00:00-04:00,"Panther Park (Owensboro, KY)",43,MBA,2025
6351530,596821,Malone Pioneers,596894,Ky. Wesleyan Panthers,596821,4,top,E. Baum reached on a fielder's choice to third base3a R. Gumino out at second 3b to 2b.,30,2025-04-04T00:00:00-04:00,"Panther Park (Owensboro, KY)",43,MBA,2025
6351530,596821,Malone Pioneers,596894,Ky. Wesleyan Panthers,596821,4,top,Z. Flohr singled to left field3a E. Baum advanced to third.,31,2025-04-04T00:00:00-04:00,"Panther Park (Owensboro, KY)",43,MBA,2025
6351530,596821,Malone Pioneers,596894,Ky. Wesleyan Panthers,596821,4,top,"A. Diaz grounded out to 1b unassisted, SAC, bunt, RBI3a Z. Flohr advanced to second3a E. Baum scored.",32,2025-04-04T00:00:00-04:00,"Panther Park (Owensboro, KY)",43,MBA,2025
6351530,596821,Malone Pioneers,596894,Ky. Wesleyan Panthers,596821,4,top,J. Stevens walked.,33,2025-04-04T00:00:00-04:00,"Panther Park (Owensboro, KY)",43,MBA,2025
6351530,596821,Malone Pioneers,596894,Ky. Wesleyan Panthers,596821,4,top,"J. Barker singled through the left side, RBI3a J. Stevens advanced to second3a Z. Flohr scored.",34,2025-04-04T00:00:00-04:00,"Panther Park (Owensboro, KY)",43,MBA,2025
6351530,596821,Malone Pioneers,596894,Ky. Wesleyan Panthers,596821,4,top,J. Tucker to p for N. Cook.,35,2025-04-04T00:00:00-04:00,"Panther Park (Owensboro, KY)",43,MBA,2025
6351530,596821,Malone Pioneers,596894,Ky. Wesleyan Panthers,596821,4,top,J. Barker stole second3a J. Stevens stole third.,36,2025-04-04T00:00:00-04:00,"Panther Park (Owensboro, KY)",43,MBA,2025
6351530,596821,Malone Pioneers,596894,Ky. Wesleyan Panthers,596821,4,top,E. Petak struck out swinging.,37,2025-04-04T00:00:00-04:00,"Panther Park (Owensboro, KY)",43,MBA,2025
6351530,596821,Malone Pioneers,596894,Ky. Wesleyan Panthers,596894,4,bot,R. Davis walked.,38,2025-04-04T00:00:00-04:00,"Panther Park (Owensboro, KY)",43,MBA,2025
6351530,596821,Malone Pioneers,596894,Ky. Wesleyan Panthers,596894,4,bot,T. VanHooser popped up to 2b.,39,2025-04-04T00:00:00-04:00,"Panther Park (Owensboro, KY)",43,MBA,2025
6351530,596821,Malone Pioneers,596894,Ky. Wesleyan Panthers,596894,4,bot,C. Gudalis reached on a fielder's choice to third base3a R. Davis out at second 3b to 2b.,40,2025-04-04T00:00:00-04:00,"Panther Park (Owensboro, KY)",43,MBA,2025
6351530,596821,Malone Pioneers,596894,Ky. Wesleyan Panthers,596894,4,bot,C. Perry reached on a fielder's choice to third base3a C. Gudalis out at second 3b to 2b.,41,2025-04-04T00:00:00-04:00,"Panther Park (Owensboro, KY)",43,MBA,2025
6351530,596821,Malone Pioneers,596894,Ky. Wesleyan Panthers,596821,5,top,R. Bonifay lined out to 3b.,42,2025-04-04T00:00:00-04:00,"Panther Park (Owensboro, KY)",43,MBA,2025
6351530,596821,Malone Pioneers,596894,Ky. Wesleyan Panthers,596821,5,top,C. Munoz struck out swinging.,43,2025-04-04T00:00:00-04:00,"Panther Park (Owensboro, KY)",43,MBA,2025
6351530,596821,Malone Pioneers,596894,Ky. Wesleyan Panthers,596821,5,top,R. Gumino struck out looking.,44,2025-04-04T00:00:00-04:00,"Panther Park (Owensboro, KY)",43,MBA,2025
6351530,596821,Malone Pioneers,596894,Ky. Wesleyan Panthers,596894,5,bot,E. Stockton doubled to right field.,45,2025-04-04T00:00:00-04:00,"Panther Park (Owensboro, KY)",43,MBA,2025
6351530,596821,Malone Pioneers,596894,Ky. Wesleyan Panthers,596894,5,bot,L. Molnar singled to center field3a E. Stockton advanced to third.,46,2025-04-04T00:00:00-04:00,"Panther Park (Owensboro, KY)",43,MBA,2025
6351530,596821,Malone Pioneers,596894,Ky. Wesleyan Panthers,596894,5,bot,"L. Molnar out at second c to ss, caught stealing.",47,2025-04-04T00:00:00-04:00,"Panther Park (Owensboro, KY)",43,MBA,2025
6351530,596821,Malone Pioneers,596894,Ky. Wesleyan Panthers,596894,5,bot,"L. Hutson singled to center field, RBI3a E. Stockton scored.",48,2025-04-04T00:00:00-04:00,"Panther Park (Owensboro, KY)",43,MBA,2025
6351530,596821,Malone Pioneers,596894,Ky. Wesleyan Panthers,596894,5,bot,J. Mizell flied out to cf.,49,2025-04-04T00:00:00-04:00,"Panther Park (Owensboro, KY)",43,MBA,2025
6351530,596821,Malone Pioneers,596894,Ky. Wesleyan Panthers,596894,5,bot,R. Dysholm singled to center field3a L. Hutson advanced to second.,50,2025-04-04T00:00:00-04:00,"Panther Park (Owensboro, KY)",43,MBA,2025
6351530,596821,Malone Pioneers,596894,Ky. Wesleyan Panthers,596894,5,bot,R. Davis reached on a fielder's choice to shortstop3a R. Dysholm out at second ss to 2b.,51,2025-04-04T00:00:00-04:00,"Panther Park (Owensboro, KY)",43,MBA,2025
6351530,596821,Malone Pioneers,596894,Ky. Wesleyan Panthers,596821,6,top,E. Baum struck out looking.,52,2025-04-04T00:00:00-04:00,"Panther Park (Owensboro, KY)",43,MBA,2025
6351530,596821,Malone Pioneers,596894,Ky. Wesleyan Panthers,596821,6,top,Z. Flohr singled to shortstop.,53,2025-04-04T00:00:00-04:00,"Panther Park (Owensboro, KY)",43,MBA,2025
6351530,596821,Malone Pioneers,596894,Ky. Wesleyan Panthers,596821,6,top,A. Diaz flied out to lf.,54,2025-04-04T00:00:00-04:00,"Panther Park (Owensboro, KY)",43,MBA,2025
6351530,596821,Malone Pioneers,596894,Ky. Wesleyan Panthers,596821,6,top,Z. Flohr stole second.,55,2025-04-04T00:00:00-04:00,"Panther Park (Owensboro, KY)",43,MBA,2025
6351530,596821,Malone Pioneers,596894,Ky. Wesleyan Panthers,596821,6,top,J. Stevens lined out to 2b.,56,2025-04-04T00:00:00-04:00,"Panther Park (Owensboro, KY)",43,MBA,2025
6351530,596821,Malone Pioneers,596894,Ky. Wesleyan Panthers,596894,6,bot,A. Ryan to c for C. Munoz.,57,2025-04-04T00:00:00-04:00,"Panther Park (Owensboro, KY)",43,MBA,2025
6351530,596821,Malone Pioneers,596894,Ky. Wesleyan Panthers,596894,6,bot,T. VanHooser grounded out to ss.,58,2025-04-04T00:00:00-04:00,"Panther Park (Owensboro, KY)",43,MBA,2025
6351530,596821,Malone Pioneers,596894,Ky. Wesleyan Panthers,596894,6,bot,C. Gudalis doubled down the lf line.,59,2025-04-04T00:00:00-04:00,"Panther Park (Owensboro, KY)",43,MBA,2025
6351530,596821,Malone Pioneers,596894,Ky. Wesleyan Panthers,596894,6,bot,C. Perry grounded out to 3b.,60,2025-04-04T00:00:00-04:00,"Panther Park (Owensboro, KY)",43,MBA,2025
6351530,596821,Malone Pioneers,596894,Ky. Wesleyan Panthers,596894,6,bot,E. Stockton lined out to lf.,61,2025-04-04T00:00:00-04:00,"Panther Park (Owensboro, KY)",43,MBA,2025
6351530,596821,Malone Pioneers,596894,Ky. Wesleyan Panthers,596821,7,top,J. Barker popped up to 2b.,62,2025-04-04T00:00:00-04:00,"Panther Park (Owensboro, KY)",43,MBA,2025
6351530,596821,Malone Pioneers,596894,Ky. Wesleyan Panthers,596821,7,top,E. Petak struck out looking.,63,2025-04-04T00:00:00-04:00,"Panther Park (Owensboro, KY)",43,MBA,2025
6351530,596821,Malone Pioneers,596894,Ky. Wesleyan Panthers,596821,7,top,R. Bonifay struck out swinging.,64,2025-04-04T00:00:00-04:00,"Panther Park (Owensboro, KY)",43,MBA,2025
6351530,596821,Malone Pioneers,596894,Ky. Wesleyan Panthers,596894,7,bot,J. Schwalbac to p for J. Rollyson.,65,2025-04-04T00:00:00-04:00,"Panther Park (Owensboro, KY)",43,MBA,2025
6351530,596821,Malone Pioneers,596894,Ky. Wesleyan Panthers,596894,7,bot,L. Molnar grounded out to 3b.,66,2025-04-04T00:00:00-04:00,"Panther Park (Owensboro, KY)",43,MBA,2025
6351530,596821,Malone Pioneers,596894,Ky. Wesleyan Panthers,596894,7,bot,L. Hutson walked.,67,2025-04-04T00:00:00-04:00,"Panther Park (Owensboro, KY)",43,MBA,2025
6351530,596821,Malone Pioneers,596894,Ky. Wesleyan Panthers,596894,7,bot,J. Mizell flied out to cf.,68,2025-04-04T00:00:00-04:00,"Panther Park (Owensboro, KY)",43,MBA,2025
6351530,596821,Malone Pioneers,596894,Ky. Wesleyan Panthers,596894,7,bot,R. Dysholm singled to center field3a L. Hutson advanced to third.,69,2025-04-04T00:00:00-04:00,"Panther Park (Owensboro, KY)",43,MBA,2025
6351530,596821,Malone Pioneers,596894,Ky. Wesleyan Panthers,596894,7,bot,R. Davis struck out looking.,70,2025-04-04T00:00:00-04:00,"Panther Park (Owensboro, KY)",43,MBA,2025
6351530,596821,Malone Pioneers,596894,Ky. Wesleyan Panthers,596821,8,top,A. Ryan walked.,71,2025-04-04T00:00:00-04:00,"Panther Park (Owensboro, KY)",43,MBA,2025
6351530,596821,Malone Pioneers,596894,Ky. Wesleyan Panthers,596821,8,top,R. Gumino singled to right field3a A. Ryan advanced to second.,72,2025-04-04T00:00:00-04:00,"Panther Park (Owensboro, KY)",43,MBA,2025
6351530,596821,Malone Pioneers,596894,Ky. Wesleyan Panthers,596821,8,top,E. Baum struck out swinging.,73,2025-04-04T00:00:00-04:00,"Panther Park (Owensboro, KY)",43,MBA,2025
6351530,596821,Malone Pioneers,596894,Ky. Wesleyan Panthers,596821,8,top,"Z. Flohr singled through the right side3a R. Gumino out at second 2b unassisted, interference.",74,2025-04-04T00:00:00-04:00,"Panther Park (Owensboro, KY)",43,MBA,2025
6351530,596821,Malone Pioneers,596894,Ky. Wesleyan Panthers,596821,8,top,A. Diaz flied out to rf.,75,2025-04-04T00:00:00-04:00,"Panther Park (Owensboro, KY)",43,MBA,2025
6351530,596821,Malone Pioneers,596894,Ky. Wesleyan Panthers,596894,8,bot,T. VanHooser flied out to lf.,76,2025-04-04T00:00:00-04:00,"Panther Park (Owensboro, KY)",43,MBA,2025
6351530,596821,Malone Pioneers,596894,Ky. Wesleyan Panthers,596894,8,bot,C. Gudalis singled to right field.,77,2025-04-04T00:00:00-04:00,"Panther Park (Owensboro, KY)",43,MBA,2025
6351530,596821,Malone Pioneers,596894,Ky. Wesleyan Panthers,596894,8,bot,C. Perry flied out to rf.,78,2025-04-04T00:00:00-04:00,"Panther Park (Owensboro, KY)",43,MBA,2025
6351530,596821,Malone Pioneers,596894,Ky. Wesleyan Panthers,596894,8,bot,C. Davies to p for J. Schwalbac.,79,2025-04-04T00:00:00-04:00,"Panther Park (Owensboro, KY)",43,MBA,2025
6351530,596821,Malone Pioneers,596894,Ky. Wesleyan Panthers,596894,8,bot,E. Stockton struck out swinging.,80,2025-04-04T00:00:00-04:00,"Panther Park (Owensboro, KY)",43,MBA,2025
6351530,596821,Malone Pioneers,596894,Ky. Wesleyan Panthers,596821,9,top,J. Stevens struck out looking.,81,2025-04-04T00:00:00-04:00,"Panther Park (Owensboro, KY)",43,MBA,2025
6351530,596821,Malone Pioneers,596894,Ky. Wesleyan Panthers,596821,9,top,J. Barker struck out swinging.,82,2025-04-04T00:00:00-04:00,"Panther Park (Owensboro, KY)",43,MBA,2025
6351530,596821,Malone Pioneers,596894,Ky. Wesleyan Panthers,596821,9,top,A. Bartiromo pinch hit for E. Petak.,83,2025-04-04T00:00:00-04:00,"Panther Park (Owensboro, KY)",43,MBA,2025
6351530,596821,Malone Pioneers,596894,Ky. Wesleyan Panthers,596821,9,top,"A. Bartiromo singled to third base, advanced to second on a throwing error by 3b.",84,2025-04-04T00:00:00-04:00,"Panther Park (Owensboro, KY)",43,MBA,2025
6351530,596821,Malone Pioneers,596894,Ky. Wesleyan Panthers,596821,9,top,"R. Bonifay doubled down the lf line, RBI3a A. Bartiromo scored, unearned.",85,2025-04-04T00:00:00-04:00,"Panther Park (Owensboro, KY)",43,MBA,2025
6351530,596821,Malone Pioneers,596894,Ky. Wesleyan Panthers,596821,9,top,A. Ryan grounded out to ss.,86,2025-04-04T00:00:00-04:00,"Panther Park (Owensboro, KY)",43,MBA,2025
6351530,596821,Malone Pioneers,596894,Ky. Wesleyan Panthers,596894,9,bot,L. Molnar grounded out to 3b.,87,2025-04-04T00:00:00-04:00,"Panther Park (Owensboro, KY)",43,MBA,2025
6351530,596821,Malone Pioneers,596894,Ky. Wesleyan Panthers,596894,9,bot,L. Hutson grounded out to 2b.,88,2025-04-04T00:00:00-04:00,"Panther Park (Owensboro, KY)",43,MBA,2025
6351530,596821,Malone Pioneers,596894,Ky. Wesleyan Panthers,596894,9,bot,J. Mizell singled up the middle.,89,2025-04-04T00:00:00-04:00,"Panther Park (Owensboro, KY)",43,MBA,2025
6351530,596821,Malone Pioneers,596894,Ky. Wesleyan Panthers,596894,9,bot,R. Dysholm hit by pitch3a J. Mizell advanced to second.,90,2025-04-04T00:00:00-04:00,"Panther Park (Owensboro, KY)",43,MBA,2025
6351530,596821,Malone Pioneers,596894,Ky. Wesleyan Panthers,596894,9,bot,B. Brombaugh pinch ran for R. Dysholm.,91,2025-04-04T00:00:00-04:00,"Panther Park (Owensboro, KY)",43,MBA,2025
6351530,596821,Malone Pioneers,596894,Ky. Wesleyan Panthers,596894,9,bot,R. Davis grounded out to 3b.,92,2025-04-04T00:00:00-04:00,"Panther Park (Owensboro, KY)",43,MBA,2025
