game_id,away_team_id,away_team_name,home_team_id,home_team_name,batting_team,inning,top_bot,event_text,event_num,game_datetime,stadium_name,attendance,sport_id,season
6352463,597098,Bard Raptors,597223,Bates Bobcats,597098,1,top,Sam Dumper flied out to rf.,1,2025-04-19T00:00:00-04:00,"Leahey Field (Lewiston, ME)",300,MBA,2025
6352463,597098,Bard Raptors,597223,Bates Bobcats,597098,1,top,Rob DeBello singled to left field.,2,2025-04-19T00:00:00-04:00,"Leahey Field (Lewiston, ME)",300,MBA,2025
6352463,597098,Bard Raptors,597223,Bates Bobcats,597098,1,top,Gavin Gonzalez singled to center field; Rob DeBello advanced to second.,3,2025-04-19T00:00:00-04:00,"Leahey Field (Lewiston, ME)",300,MBA,2025
6352463,597098,Bard Raptors,597223,Bates Bobcats,597098,1,top,"Kyle Palleschi doubled to center field, RBI; Gavin Gonzalez advanced to third; Rob DeBello scored.",4,2025-04-19T00:00:00-04:00,"Leahey Field (Lewiston, ME)",300,MBA,2025
6352463,597098,Bard Raptors,597223,Bates Bobcats,597098,1,top,"Jimmy Famularo grounded out to 1b unassisted, RBI; Kyle Palleschi advanced to third; Gavin Gonzalez scored.",5,2025-04-19T00:00:00-04:00,"Leahey Field (Lewiston, ME)",300,MBA,2025
6352463,597098,Bard Raptors,597223,Bates Bobcats,597098,1,top,Jamie Fryer hit by pitch; Kyle Palleschi did not advance.,6,2025-04-19T00:00:00-04:00,"Leahey Field (Lewiston, ME)",300,MBA,2025
6352463,597098,Bard Raptors,597223,Bates Bobcats,597098,1,top,"Jamie Fryer out at second c to 2b, caught stealing; Kyle Palleschi did not advance.",7,2025-04-19T00:00:00-04:00,"Leahey Field (Lewiston, ME)",300,MBA,2025
6352463,597098,Bard Raptors,597223,Bates Bobcats,597223,1,bot,K. Ryan grounded out to 2b.,8,2025-04-19T00:00:00-04:00,"Leahey Field (Lewiston, ME)",300,MBA,2025
6352463,597098,Bard Raptors,597223,Bates Bobcats,597223,1,bot,J. Margiloff struck out swinging.,9,2025-04-19T00:00:00-04:00,"Leahey Field (Lewiston, ME)",300,MBA,2025
6352463,597098,Bard Raptors,597223,Bates Bobcats,597223,1,bot,B. Genser grounded out to 3b.,10,2025-04-19T00:00:00-04:00,"Leahey Field (Lewiston, ME)",300,MBA,2025
6352463,597098,Bard Raptors,597223,Bates Bobcats,597098,2,top,Mike Lynch walked.,11,2025-04-19T00:00:00-04:00,"Leahey Field (Lewiston, ME)",300,MBA,2025
6352463,597098,Bard Raptors,597223,Bates Bobcats,597098,2,top,Johnny O'Connor struck out looking; Mike Lynch did not advance.,12,2025-04-19T00:00:00-04:00,"Leahey Field (Lewiston, ME)",300,MBA,2025
6352463,597098,Bard Raptors,597223,Bates Bobcats,597098,2,top,Avery Melton struck out looking; Mike Lynch did not advance.,13,2025-04-19T00:00:00-04:00,"Leahey Field (Lewiston, ME)",300,MBA,2025
6352463,597098,Bard Raptors,597223,Bates Bobcats,597098,2,top,Sam Dumper singled to right center; Mike Lynch advanced to third.,14,2025-04-19T00:00:00-04:00,"Leahey Field (Lewiston, ME)",300,MBA,2025
6352463,597098,Bard Raptors,597223,Bates Bobcats,597098,2,top,Rob DeBello reached on a fielder's choice; Sam Dumper out at second ss unassisted; Mike Lynch did not advance.,15,2025-04-19T00:00:00-04:00,"Leahey Field (Lewiston, ME)",300,MBA,2025
6352463,597098,Bard Raptors,597223,Bates Bobcats,597223,2,bot,D. Swift walked.,16,2025-04-19T00:00:00-04:00,"Leahey Field (Lewiston, ME)",300,MBA,2025
6352463,597098,Bard Raptors,597223,Bates Bobcats,597223,2,bot,G. Sullivan walked; D. Swift advanced to second.,17,2025-04-19T00:00:00-04:00,"Leahey Field (Lewiston, ME)",300,MBA,2025
6352463,597098,Bard Raptors,597223,Bates Bobcats,597223,2,bot,G. Sullivan advanced to second; D. Swift advanced to third on a wild pitch.,18,2025-04-19T00:00:00-04:00,"Leahey Field (Lewiston, ME)",300,MBA,2025
6352463,597098,Bard Raptors,597223,Bates Bobcats,597223,2,bot,B. Biggane walked; G. Sullivan did not advance; D. Swift did not advance.,19,2025-04-19T00:00:00-04:00,"Leahey Field (Lewiston, ME)",300,MBA,2025
6352463,597098,Bard Raptors,597223,Bates Bobcats,597223,2,bot,"M. Dushney walked, RBI; B. Biggane advanced to second; G. Sullivan advanced to third; D. Swift scored.",20,2025-04-19T00:00:00-04:00,"Leahey Field (Lewiston, ME)",300,MBA,2025
6352463,597098,Bard Raptors,597223,Bates Bobcats,597223,2,bot,Aidan Kiefer to p for Charlie Lehr.,21,2025-04-19T00:00:00-04:00,"Leahey Field (Lewiston, ME)",300,MBA,2025
6352463,597098,Bard Raptors,597223,Bates Bobcats,597223,2,bot,B. Gesmondi popped up to 2b; M. Dushney did not advance; B. Biggane did not advance; G. Sullivan did not advance.,22,2025-04-19T00:00:00-04:00,"Leahey Field (Lewiston, ME)",300,MBA,2025
6352463,597098,Bard Raptors,597223,Bates Bobcats,597223,2,bot,"J. Yoxall flied out to cf, sacrifice fly, RBI; M. Dushney did not advance; B. Biggane advanced to third; G. Sullivan scored.",23,2025-04-19T00:00:00-04:00,"Leahey Field (Lewiston, ME)",300,MBA,2025
6352463,597098,Bard Raptors,597223,Bates Bobcats,597223,2,bot,M. Dushney advanced to second; B. Biggane scored on a wild pitch.,24,2025-04-19T00:00:00-04:00,"Leahey Field (Lewiston, ME)",300,MBA,2025
6352463,597098,Bard Raptors,597223,Bates Bobcats,597223,2,bot,K. Ryan popped up to 2b; M. Dushney did not advance.,25,2025-04-19T00:00:00-04:00,"Leahey Field (Lewiston, ME)",300,MBA,2025
6352463,597098,Bard Raptors,597223,Bates Bobcats,597098,3,top,Gavin Gonzalez walked.,26,2025-04-19T00:00:00-04:00,"Leahey Field (Lewiston, ME)",300,MBA,2025
6352463,597098,Bard Raptors,597223,Bates Bobcats,597098,3,top,Kyle Palleschi singled to left field; Gavin Gonzalez advanced to second.,27,2025-04-19T00:00:00-04:00,"Leahey Field (Lewiston, ME)",300,MBA,2025
6352463,597098,Bard Raptors,597223,Bates Bobcats,597098,3,top,"Jimmy Famularo grounded out to 1b unassisted, SAC, bunt; Kyle Palleschi advanced to second; Gavin Gonzalez advanced to third.",28,2025-04-19T00:00:00-04:00,"Leahey Field (Lewiston, ME)",300,MBA,2025
6352463,597098,Bard Raptors,597223,Bates Bobcats,597098,3,top,Jamie Fryer flied out to cf; Kyle Palleschi did not advance; Gavin Gonzalez did not advance.,29,2025-04-19T00:00:00-04:00,"Leahey Field (Lewiston, ME)",300,MBA,2025
6352463,597098,Bard Raptors,597223,Bates Bobcats,597098,3,top,Mike Lynch hit by pitch; Kyle Palleschi did not advance; Gavin Gonzalez did not advance.,30,2025-04-19T00:00:00-04:00,"Leahey Field (Lewiston, ME)",300,MBA,2025
6352463,597098,Bard Raptors,597223,Bates Bobcats,597098,3,top,Johnny O'Connor flied out to cf; Mike Lynch did not advance; Kyle Palleschi did not advance; Gavin Gonzalez did not advance.,31,2025-04-19T00:00:00-04:00,"Leahey Field (Lewiston, ME)",300,MBA,2025
6352463,597098,Bard Raptors,597223,Bates Bobcats,597223,3,bot,J. Margiloff doubled to left center.,32,2025-04-19T00:00:00-04:00,"Leahey Field (Lewiston, ME)",300,MBA,2025
6352463,597098,Bard Raptors,597223,Bates Bobcats,597223,3,bot,B. Genser lined out to cf; J. Margiloff did not advance.,33,2025-04-19T00:00:00-04:00,"Leahey Field (Lewiston, ME)",300,MBA,2025
6352463,597098,Bard Raptors,597223,Bates Bobcats,597223,3,bot,J. Margiloff stole third.,34,2025-04-19T00:00:00-04:00,"Leahey Field (Lewiston, ME)",300,MBA,2025
6352463,597098,Bard Raptors,597223,Bates Bobcats,597223,3,bot,"D. Swift homered to left center, 2 RBI; J. Margiloff scored.",35,2025-04-19T00:00:00-04:00,"Leahey Field (Lewiston, ME)",300,MBA,2025
6352463,597098,Bard Raptors,597223,Bates Bobcats,597223,3,bot,G. Sullivan grounded out to ss.,36,2025-04-19T00:00:00-04:00,"Leahey Field (Lewiston, ME)",300,MBA,2025
6352463,597098,Bard Raptors,597223,Bates Bobcats,597223,3,bot,B. Biggane struck out looking.,37,2025-04-19T00:00:00-04:00,"Leahey Field (Lewiston, ME)",300,MBA,2025
6352463,597098,Bard Raptors,597223,Bates Bobcats,597098,4,top,Avery Melton popped up to ss.,38,2025-04-19T00:00:00-04:00,"Leahey Field (Lewiston, ME)",300,MBA,2025
6352463,597098,Bard Raptors,597223,Bates Bobcats,597098,4,top,Sam Dumper struck out swinging.,39,2025-04-19T00:00:00-04:00,"Leahey Field (Lewiston, ME)",300,MBA,2025
6352463,597098,Bard Raptors,597223,Bates Bobcats,597098,4,top,Rob DeBello grounded out to 2b.,40,2025-04-19T00:00:00-04:00,"Leahey Field (Lewiston, ME)",300,MBA,2025
6352463,597098,Bard Raptors,597223,Bates Bobcats,597223,4,bot,M. Dushney singled to left center.,41,2025-04-19T00:00:00-04:00,"Leahey Field (Lewiston, ME)",300,MBA,2025
6352463,597098,Bard Raptors,597223,Bates Bobcats,597223,4,bot,B. Gesmondi hit by pitch; M. Dushney advanced to second.,42,2025-04-19T00:00:00-04:00,"Leahey Field (Lewiston, ME)",300,MBA,2025
6352463,597098,Bard Raptors,597223,Bates Bobcats,597223,4,bot,Henry Hubner to p for Aidan Kiefer.,43,2025-04-19T00:00:00-04:00,"Leahey Field (Lewiston, ME)",300,MBA,2025
6352463,597098,Bard Raptors,597223,Bates Bobcats,597223,4,bot,"J. Yoxall singled to pitcher, bunt; B. Gesmondi advanced to second; M. Dushney advanced to third.",44,2025-04-19T00:00:00-04:00,"Leahey Field (Lewiston, ME)",300,MBA,2025
6352463,597098,Bard Raptors,597223,Bates Bobcats,597223,4,bot,K. Ryan struck out swinging; J. Yoxall did not advance; B. Gesmondi did not advance; M. Dushney did not advance.,45,2025-04-19T00:00:00-04:00,"Leahey Field (Lewiston, ME)",300,MBA,2025
6352463,597098,Bard Raptors,597223,Bates Bobcats,597223,4,bot,"J. Margiloff singled to left field, RBI; J. Yoxall advanced to second; B. Gesmondi advanced to third; M. Dushney scored.",46,2025-04-19T00:00:00-04:00,"Leahey Field (Lewiston, ME)",300,MBA,2025
6352463,597098,Bard Raptors,597223,Bates Bobcats,597223,4,bot,"B. Genser singled down the rf line, RBI; J. Margiloff advanced to second; J. Yoxall advanced to third; B. Gesmondi scored.",47,2025-04-19T00:00:00-04:00,"Leahey Field (Lewiston, ME)",300,MBA,2025
6352463,597098,Bard Raptors,597223,Bates Bobcats,597223,4,bot,"D. Swift walked, RBI; B. Genser advanced to second; J. Margiloff advanced to third; J. Yoxall scored.",48,2025-04-19T00:00:00-04:00,"Leahey Field (Lewiston, ME)",300,MBA,2025
6352463,597098,Bard Raptors,597223,Bates Bobcats,597223,4,bot,G. Sullivan popped up to 2b; D. Swift did not advance; B. Genser did not advance; J. Margiloff did not advance.,49,2025-04-19T00:00:00-04:00,"Leahey Field (Lewiston, ME)",300,MBA,2025
6352463,597098,Bard Raptors,597223,Bates Bobcats,597223,4,bot,B. Biggane reached on a fielder's choice; D. Swift out at second ss to 2b; B. Genser did not advance; J. Margiloff did not advance.,50,2025-04-19T00:00:00-04:00,"Leahey Field (Lewiston, ME)",300,MBA,2025
6352463,597098,Bard Raptors,597223,Bates Bobcats,597098,5,top,J. Federico to ss for G. Sullivan.,51,2025-04-19T00:00:00-04:00,"Leahey Field (Lewiston, ME)",300,MBA,2025
6352463,597098,Bard Raptors,597223,Bates Bobcats,597098,5,top,Gavin Gonzalez flied out to lf.,52,2025-04-19T00:00:00-04:00,"Leahey Field (Lewiston, ME)",300,MBA,2025
6352463,597098,Bard Raptors,597223,Bates Bobcats,597098,5,top,Kyle Palleschi hit by pitch.,53,2025-04-19T00:00:00-04:00,"Leahey Field (Lewiston, ME)",300,MBA,2025
6352463,597098,Bard Raptors,597223,Bates Bobcats,597098,5,top,Jimmy Famularo flied out to lf; Kyle Palleschi did not advance.,54,2025-04-19T00:00:00-04:00,"Leahey Field (Lewiston, ME)",300,MBA,2025
6352463,597098,Bard Raptors,597223,Bates Bobcats,597098,5,top,"Jamie Fryer doubled to left center, RBI; Kyle Palleschi scored.",55,2025-04-19T00:00:00-04:00,"Leahey Field (Lewiston, ME)",300,MBA,2025
6352463,597098,Bard Raptors,597223,Bates Bobcats,597098,5,top,Mike Lynch struck out swinging; Jamie Fryer did not advance.,56,2025-04-19T00:00:00-04:00,"Leahey Field (Lewiston, ME)",300,MBA,2025
6352463,597098,Bard Raptors,597223,Bates Bobcats,597223,5,bot,Dylan Conte to p for Henry Hubner.,57,2025-04-19T00:00:00-04:00,"Leahey Field (Lewiston, ME)",300,MBA,2025
6352463,597098,Bard Raptors,597223,Bates Bobcats,597223,5,bot,M. Dushney singled to left field.,58,2025-04-19T00:00:00-04:00,"Leahey Field (Lewiston, ME)",300,MBA,2025
6352463,597098,Bard Raptors,597223,Bates Bobcats,597223,5,bot,B. Gesmondi walked; M. Dushney advanced to second.,59,2025-04-19T00:00:00-04:00,"Leahey Field (Lewiston, ME)",300,MBA,2025
6352463,597098,Bard Raptors,597223,Bates Bobcats,597223,5,bot,J. Yoxall struck out looking; B. Gesmondi did not advance; M. Dushney did not advance.,60,2025-04-19T00:00:00-04:00,"Leahey Field (Lewiston, ME)",300,MBA,2025
6352463,597098,Bard Raptors,597223,Bates Bobcats,597223,5,bot,K. Ryan singled through the left side; B. Gesmondi advanced to second; M. Dushney advanced to third.,61,2025-04-19T00:00:00-04:00,"Leahey Field (Lewiston, ME)",300,MBA,2025
6352463,597098,Bard Raptors,597223,Bates Bobcats,597223,5,bot,"J. Margiloff singled to right field, RBI; K. Ryan advanced to second; B. Gesmondi advanced to third; M. Dushney scored.",62,2025-04-19T00:00:00-04:00,"Leahey Field (Lewiston, ME)",300,MBA,2025
6352463,597098,Bard Raptors,597223,Bates Bobcats,597223,5,bot,"B. Genser reached first on a throwing error by ss, advanced to second, RBI; J. Margiloff advanced to third; K. Ryan scored, unearned; B. Gesmondi scored.",63,2025-04-19T00:00:00-04:00,"Leahey Field (Lewiston, ME)",300,MBA,2025
6352463,597098,Bard Raptors,597223,Bates Bobcats,597223,5,bot,D. Swift popped up to ss; B. Genser did not advance; J. Margiloff did not advance.,64,2025-04-19T00:00:00-04:00,"Leahey Field (Lewiston, ME)",300,MBA,2025
6352463,597098,Bard Raptors,597223,Bates Bobcats,597223,5,bot,"J. Federico singled to right field, 2 RBI; B. Genser scored, unearned; J. Margiloff scored, unearned.",65,2025-04-19T00:00:00-04:00,"Leahey Field (Lewiston, ME)",300,MBA,2025
6352463,597098,Bard Raptors,597223,Bates Bobcats,597223,5,bot,B. Biggane singled to left field; J. Federico advanced to second.,66,2025-04-19T00:00:00-04:00,"Leahey Field (Lewiston, ME)",300,MBA,2025
6352463,597098,Bard Raptors,597223,Bates Bobcats,597223,5,bot,"M. Dushney singled up the middle, RBI; B. Biggane advanced to second; J. Federico scored, unearned.",67,2025-04-19T00:00:00-04:00,"Leahey Field (Lewiston, ME)",300,MBA,2025
6352463,597098,Bard Raptors,597223,Bates Bobcats,597223,5,bot,Tom Maxwell to p for Dylan Conte.,68,2025-04-19T00:00:00-04:00,"Leahey Field (Lewiston, ME)",300,MBA,2025
6352463,597098,Bard Raptors,597223,Bates Bobcats,597223,5,bot,B. Gesmondi popped up to 2b; M. Dushney did not advance; B. Biggane did not advance.,69,2025-04-19T00:00:00-04:00,"Leahey Field (Lewiston, ME)",300,MBA,2025
6352463,597098,Bard Raptors,597223,Bates Bobcats,597098,6,top,K. Carlisle to p for I. McAslan.,70,2025-04-19T00:00:00-04:00,"Leahey Field (Lewiston, ME)",300,MBA,2025
6352463,597098,Bard Raptors,597223,Bates Bobcats,597098,6,top,A. Fortunato to lf for J. Margiloff.,71,2025-04-19T00:00:00-04:00,"Leahey Field (Lewiston, ME)",300,MBA,2025
6352463,597098,Bard Raptors,597223,Bates Bobcats,597098,6,top,W. Thompson to 1b for D. Swift.,72,2025-04-19T00:00:00-04:00,"Leahey Field (Lewiston, ME)",300,MBA,2025
6352463,597098,Bard Raptors,597223,Bates Bobcats,597098,6,top,T. Tucker to 3b for B. Genser.,73,2025-04-19T00:00:00-04:00,"Leahey Field (Lewiston, ME)",300,MBA,2025
6352463,597098,Bard Raptors,597223,Bates Bobcats,597098,6,top,Johnny O'Connor doubled down the lf line.,74,2025-04-19T00:00:00-04:00,"Leahey Field (Lewiston, ME)",300,MBA,2025
6352463,597098,Bard Raptors,597223,Bates Bobcats,597098,6,top,Avery Melton struck out swinging; Johnny O'Connor did not advance.,75,2025-04-19T00:00:00-04:00,"Leahey Field (Lewiston, ME)",300,MBA,2025
6352463,597098,Bard Raptors,597223,Bates Bobcats,597098,6,top,Sam Dumper struck out swinging; Johnny O'Connor did not advance.,76,2025-04-19T00:00:00-04:00,"Leahey Field (Lewiston, ME)",300,MBA,2025
6352463,597098,Bard Raptors,597223,Bates Bobcats,597098,6,top,"Rob DeBello singled to right field, RBI; Johnny O'Connor scored.",77,2025-04-19T00:00:00-04:00,"Leahey Field (Lewiston, ME)",300,MBA,2025
6352463,597098,Bard Raptors,597223,Bates Bobcats,597098,6,top,Rob DeBello advanced to second on a wild pitch.,78,2025-04-19T00:00:00-04:00,"Leahey Field (Lewiston, ME)",300,MBA,2025
6352463,597098,Bard Raptors,597223,Bates Bobcats,597098,6,top,Gavin Gonzalez walked; Rob DeBello did not advance.,79,2025-04-19T00:00:00-04:00,"Leahey Field (Lewiston, ME)",300,MBA,2025
6352463,597098,Bard Raptors,597223,Bates Bobcats,597098,6,top,Kyle Palleschi struck out looking; Gavin Gonzalez did not advance; Rob DeBello did not advance.,80,2025-04-19T00:00:00-04:00,"Leahey Field (Lewiston, ME)",300,MBA,2025
6352463,597098,Bard Raptors,597223,Bates Bobcats,597223,6,bot,J. Yoxall walked.,81,2025-04-19T00:00:00-04:00,"Leahey Field (Lewiston, ME)",300,MBA,2025
6352463,597098,Bard Raptors,597223,Bates Bobcats,597223,6,bot,K. Ryan walked; J. Yoxall advanced to second.,82,2025-04-19T00:00:00-04:00,"Leahey Field (Lewiston, ME)",300,MBA,2025
6352463,597098,Bard Raptors,597223,Bates Bobcats,597223,6,bot,"A. Fortunato singled to right center, RBI; K. Ryan advanced to third; J. Yoxall scored.",83,2025-04-19T00:00:00-04:00,"Leahey Field (Lewiston, ME)",300,MBA,2025
6352463,597098,Bard Raptors,597223,Bates Bobcats,597223,6,bot,T. Tucker hit by pitch; A. Fortunato advanced to second; K. Ryan did not advance.,84,2025-04-19T00:00:00-04:00,"Leahey Field (Lewiston, ME)",300,MBA,2025
6352463,597098,Bard Raptors,597223,Bates Bobcats,597223,6,bot,"W. Thompson out at first 2b to p, RBI; T. Tucker advanced to second; A. Fortunato advanced to third; K. Ryan scored.",85,2025-04-19T00:00:00-04:00,"Leahey Field (Lewiston, ME)",300,MBA,2025
6352463,597098,Bard Raptors,597223,Bates Bobcats,597223,6,bot,"J. Federico reached first on a throwing error by ss, advanced to second, RBI; T. Tucker scored, unearned; A. Fortunato scored.",86,2025-04-19T00:00:00-04:00,"Leahey Field (Lewiston, ME)",300,MBA,2025
6352463,597098,Bard Raptors,597223,Bates Bobcats,597223,6,bot,T. Canna pinch hit for B. Biggane.,87,2025-04-19T00:00:00-04:00,"Leahey Field (Lewiston, ME)",300,MBA,2025
6352463,597098,Bard Raptors,597223,Bates Bobcats,597223,6,bot,J. Federico advanced to third on a wild pitch.,88,2025-04-19T00:00:00-04:00,"Leahey Field (Lewiston, ME)",300,MBA,2025
6352463,597098,Bard Raptors,597223,Bates Bobcats,597223,6,bot,"T. Canna grounded out to 2b, RBI; J. Federico scored, unearned.",89,2025-04-19T00:00:00-04:00,"Leahey Field (Lewiston, ME)",300,MBA,2025
6352463,597098,Bard Raptors,597223,Bates Bobcats,597223,6,bot,M. Dushney singled up the middle.,90,2025-04-19T00:00:00-04:00,"Leahey Field (Lewiston, ME)",300,MBA,2025
6352463,597098,Bard Raptors,597223,Bates Bobcats,597223,6,bot,B. Gesmondi hit by pitch; M. Dushney advanced to second.,91,2025-04-19T00:00:00-04:00,"Leahey Field (Lewiston, ME)",300,MBA,2025
6352463,597098,Bard Raptors,597223,Bates Bobcats,597223,6,bot,"J. Yoxall singled to right field, RBI; B. Gesmondi advanced to third; M. Dushney scored, unearned.",92,2025-04-19T00:00:00-04:00,"Leahey Field (Lewiston, ME)",300,MBA,2025
6352463,597098,Bard Raptors,597223,Bates Bobcats,597223,6,bot,Orlando Shin to p for Tom Maxwell.,93,2025-04-19T00:00:00-04:00,"Leahey Field (Lewiston, ME)",300,MBA,2025
6352463,597098,Bard Raptors,597223,Bates Bobcats,597223,6,bot,K. Ryan flied out to lf; J. Yoxall did not advance; B. Gesmondi did not advance.,94,2025-04-19T00:00:00-04:00,"Leahey Field (Lewiston, ME)",300,MBA,2025
6352463,597098,Bard Raptors,597223,Bates Bobcats,597098,7,top,M. Shrake to p for K. Carlisle.,95,2025-04-19T00:00:00-04:00,"Leahey Field (Lewiston, ME)",300,MBA,2025
6352463,597098,Bard Raptors,597223,Bates Bobcats,597098,7,top,Jimmy Famularo walked.,96,2025-04-19T00:00:00-04:00,"Leahey Field (Lewiston, ME)",300,MBA,2025
6352463,597098,Bard Raptors,597223,Bates Bobcats,597098,7,top,Charles Boucher pinch hit for Jamie Fryer.,97,2025-04-19T00:00:00-04:00,"Leahey Field (Lewiston, ME)",300,MBA,2025
6352463,597098,Bard Raptors,597223,Bates Bobcats,597098,7,top,Charles Boucher reached on a fielder's choice; Jimmy Famularo advanced to second on a throwing error by ss.,98,2025-04-19T00:00:00-04:00,"Leahey Field (Lewiston, ME)",300,MBA,2025
6352463,597098,Bard Raptors,597223,Bates Bobcats,597098,7,top,Mike Lynch reached on a fielder's choice; Charles Boucher advanced to second; Jimmy Famularo out at third ss to 3b.,99,2025-04-19T00:00:00-04:00,"Leahey Field (Lewiston, ME)",300,MBA,2025
6352463,597098,Bard Raptors,597223,Bates Bobcats,597098,7,top,Jack Burcell pinch hit for Johnny O'Connor.,100,2025-04-19T00:00:00-04:00,"Leahey Field (Lewiston, ME)",300,MBA,2025
6352463,597098,Bard Raptors,597223,Bates Bobcats,597098,7,top,"Jack Burcell doubled to left field, RBI; Mike Lynch advanced to third; Charles Boucher scored, unearned.",101,2025-04-19T00:00:00-04:00,"Leahey Field (Lewiston, ME)",300,MBA,2025
6352463,597098,Bard Raptors,597223,Bates Bobcats,597098,7,top,Emmett O'Brien pinch hit for Avery Melton.,102,2025-04-19T00:00:00-04:00,"Leahey Field (Lewiston, ME)",300,MBA,2025
6352463,597098,Bard Raptors,597223,Bates Bobcats,597098,7,top,"Emmett O'Brien doubled to left center, 2 RBI; Jack Burcell scored; Mike Lynch scored.",103,2025-04-19T00:00:00-04:00,"Leahey Field (Lewiston, ME)",300,MBA,2025
6352463,597098,Bard Raptors,597223,Bates Bobcats,597098,7,top,Sam Dumper popped up to 1b; Emmett O'Brien did not advance.,104,2025-04-19T00:00:00-04:00,"Leahey Field (Lewiston, ME)",300,MBA,2025
6352463,597098,Bard Raptors,597223,Bates Bobcats,597098,7,top,Rob DeBello grounded out to ss; Emmett O'Brien did not advance.,105,2025-04-19T00:00:00-04:00,"Leahey Field (Lewiston, ME)",300,MBA,2025
