game_id,away_team_id,away_team_name,home_team_id,home_team_name,batting_team,inning,top_bot,event_text,event_num,game_datetime,stadium_name,attendance,sport_id,season
6352367,597312,Kenyon Owls,597058,Wabash Little Giants,597312,1,top,N. Rosen struck out swinging.,1,2025-04-21T00:00:00-04:00,"Goodrich Ballpark (Crawfordsville, IN)",63,MBA,2025
6352367,597312,Kenyon Owls,597058,Wabash Little Giants,597312,1,top,P. Gibbons tripled down the rf line.,2,2025-04-21T00:00:00-04:00,"Goodrich Ballpark (Crawfordsville, IN)",63,MBA,2025
6352367,597312,Kenyon Owls,597058,Wabash Little Giants,597312,1,top,"D. Lee singled to pitcher, RBI; P. Gibbons scored.",3,2025-04-21T00:00:00-04:00,"Goodrich Ballpark (Crawfordsville, IN)",63,MBA,2025
6352367,597312,Kenyon Owls,597058,Wabash Little Giants,597312,1,top,L. Meister fouled out to 2b.,4,2025-04-21T00:00:00-04:00,"Goodrich Ballpark (Crawfordsville, IN)",63,MBA,2025
6352367,597312,Kenyon Owls,597058,Wabash Little Giants,597312,1,top,T. Nee singled through the left side; D. Lee advanced to second.,5,2025-04-21T00:00:00-04:00,"Goodrich Ballpark (Crawfordsville, IN)",63,MBA,2025
6352367,597312,Kenyon Owls,597058,Wabash Little Giants,597312,1,top,B. Resnick walked; T. Nee advanced to second; D. Lee advanced to third.,6,2025-04-21T00:00:00-04:00,"Goodrich Ballpark (Crawfordsville, IN)",63,MBA,2025
6352367,597312,Kenyon Owls,597058,Wabash Little Giants,597312,1,top,"W. Nelson singled up the middle, 2 RBI; B. Resnick advanced to third; T. Nee scored; D. Lee scored.",7,2025-04-21T00:00:00-04:00,"Goodrich Ballpark (Crawfordsville, IN)",63,MBA,2025
6352367,597312,Kenyon Owls,597058,Wabash Little Giants,597312,1,top,"B. Russell doubled to left field, RBI; W. Nelson advanced to third, out at home lf to ss to c; B. Resnick scored.",8,2025-04-21T00:00:00-04:00,"Goodrich Ballpark (Crawfordsville, IN)",63,MBA,2025
6352367,597312,Kenyon Owls,597058,Wabash Little Giants,597058,1,bot,W. Phillips hit by pitch.,9,2025-04-21T00:00:00-04:00,"Goodrich Ballpark (Crawfordsville, IN)",63,MBA,2025
6352367,597312,Kenyon Owls,597058,Wabash Little Giants,597058,1,bot,C. Scheidt flied out to cf.,10,2025-04-21T00:00:00-04:00,"Goodrich Ballpark (Crawfordsville, IN)",63,MBA,2025
6352367,597312,Kenyon Owls,597058,Wabash Little Giants,597058,1,bot,B. Henke flied out to cf to left center.,11,2025-04-21T00:00:00-04:00,"Goodrich Ballpark (Crawfordsville, IN)",63,MBA,2025
6352367,597312,Kenyon Owls,597058,Wabash Little Giants,597058,1,bot,W. Fremion flied out to rf.,12,2025-04-21T00:00:00-04:00,"Goodrich Ballpark (Crawfordsville, IN)",63,MBA,2025
6352367,597312,Kenyon Owls,597058,Wabash Little Giants,597312,2,top,N. Price singled to left field.,13,2025-04-21T00:00:00-04:00,"Goodrich Ballpark (Crawfordsville, IN)",63,MBA,2025
6352367,597312,Kenyon Owls,597058,Wabash Little Giants,597312,2,top,J. Woehr to p for G. Stratton.,14,2025-04-21T00:00:00-04:00,"Goodrich Ballpark (Crawfordsville, IN)",63,MBA,2025
6352367,597312,Kenyon Owls,597058,Wabash Little Giants,597312,2,top,N. Rosen flied out to lf.,15,2025-04-21T00:00:00-04:00,"Goodrich Ballpark (Crawfordsville, IN)",63,MBA,2025
6352367,597312,Kenyon Owls,597058,Wabash Little Giants,597312,2,top,P. Gibbons flied out to cf.,16,2025-04-21T00:00:00-04:00,"Goodrich Ballpark (Crawfordsville, IN)",63,MBA,2025
6352367,597312,Kenyon Owls,597058,Wabash Little Giants,597312,2,top,D. Lee lined out to cf.,17,2025-04-21T00:00:00-04:00,"Goodrich Ballpark (Crawfordsville, IN)",63,MBA,2025
6352367,597312,Kenyon Owls,597058,Wabash Little Giants,597058,2,bot,E. Neukam hit by pitch.,18,2025-04-21T00:00:00-04:00,"Goodrich Ballpark (Crawfordsville, IN)",63,MBA,2025
6352367,597312,Kenyon Owls,597058,Wabash Little Giants,597058,2,bot,M. Cvelbar lined into double play rf to 1b; E. Neukam out on the play.,19,2025-04-21T00:00:00-04:00,"Goodrich Ballpark (Crawfordsville, IN)",63,MBA,2025
6352367,597312,Kenyon Owls,597058,Wabash Little Giants,597058,2,bot,D. Mendez flied out to rf.,20,2025-04-21T00:00:00-04:00,"Goodrich Ballpark (Crawfordsville, IN)",63,MBA,2025
6352367,597312,Kenyon Owls,597058,Wabash Little Giants,597312,3,top,L. Meister grounded out to 3b.,21,2025-04-21T00:00:00-04:00,"Goodrich Ballpark (Crawfordsville, IN)",63,MBA,2025
6352367,597312,Kenyon Owls,597058,Wabash Little Giants,597312,3,top,T. Nee flied out to cf to right center.,22,2025-04-21T00:00:00-04:00,"Goodrich Ballpark (Crawfordsville, IN)",63,MBA,2025
6352367,597312,Kenyon Owls,597058,Wabash Little Giants,597312,3,top,B. Resnick flied out to 2b.,23,2025-04-21T00:00:00-04:00,"Goodrich Ballpark (Crawfordsville, IN)",63,MBA,2025
6352367,597312,Kenyon Owls,597058,Wabash Little Giants,597058,3,bot,R. Keating fouled out to c.,24,2025-04-21T00:00:00-04:00,"Goodrich Ballpark (Crawfordsville, IN)",63,MBA,2025
6352367,597312,Kenyon Owls,597058,Wabash Little Giants,597058,3,bot,C. Ellsperma walked.,25,2025-04-21T00:00:00-04:00,"Goodrich Ballpark (Crawfordsville, IN)",63,MBA,2025
6352367,597312,Kenyon Owls,597058,Wabash Little Giants,597058,3,bot,W. Phillips flied out to lf.,26,2025-04-21T00:00:00-04:00,"Goodrich Ballpark (Crawfordsville, IN)",63,MBA,2025
6352367,597312,Kenyon Owls,597058,Wabash Little Giants,597058,3,bot,C. Scheidt flied out to cf.,27,2025-04-21T00:00:00-04:00,"Goodrich Ballpark (Crawfordsville, IN)",63,MBA,2025
6352367,597312,Kenyon Owls,597058,Wabash Little Giants,597312,4,top,W. Nelson grounded out to 3b.,28,2025-04-21T00:00:00-04:00,"Goodrich Ballpark (Crawfordsville, IN)",63,MBA,2025
6352367,597312,Kenyon Owls,597058,Wabash Little Giants,597312,4,top,B. Russell flied out to lf.,29,2025-04-21T00:00:00-04:00,"Goodrich Ballpark (Crawfordsville, IN)",63,MBA,2025
6352367,597312,Kenyon Owls,597058,Wabash Little Giants,597312,4,top,N. Price fouled out to 1b.,30,2025-04-21T00:00:00-04:00,"Goodrich Ballpark (Crawfordsville, IN)",63,MBA,2025
6352367,597312,Kenyon Owls,597058,Wabash Little Giants,597058,4,bot,B. Henke lined out to p.,31,2025-04-21T00:00:00-04:00,"Goodrich Ballpark (Crawfordsville, IN)",63,MBA,2025
6352367,597312,Kenyon Owls,597058,Wabash Little Giants,597058,4,bot,W. Fremion flied out to rf.,32,2025-04-21T00:00:00-04:00,"Goodrich Ballpark (Crawfordsville, IN)",63,MBA,2025
6352367,597312,Kenyon Owls,597058,Wabash Little Giants,597058,4,bot,E. Neukam tripled to right center.,33,2025-04-21T00:00:00-04:00,"Goodrich Ballpark (Crawfordsville, IN)",63,MBA,2025
6352367,597312,Kenyon Owls,597058,Wabash Little Giants,597058,4,bot,M. Cvelbar grounded out p to ss to 1b.,34,2025-04-21T00:00:00-04:00,"Goodrich Ballpark (Crawfordsville, IN)",63,MBA,2025
6352367,597312,Kenyon Owls,597058,Wabash Little Giants,597312,5,top,N. Rosen doubled down the rf line.,35,2025-04-21T00:00:00-04:00,"Goodrich Ballpark (Crawfordsville, IN)",63,MBA,2025
6352367,597312,Kenyon Owls,597058,Wabash Little Giants,597312,5,top,P. Gibbons grounded out to 1b unassisted; N. Rosen advanced to third.,36,2025-04-21T00:00:00-04:00,"Goodrich Ballpark (Crawfordsville, IN)",63,MBA,2025
6352367,597312,Kenyon Owls,597058,Wabash Little Giants,597312,5,top,"D. Lee doubled to right center, RBI; N. Rosen scored.",37,2025-04-21T00:00:00-04:00,"Goodrich Ballpark (Crawfordsville, IN)",63,MBA,2025
6352367,597312,Kenyon Owls,597058,Wabash Little Giants,597312,5,top,L. Meister grounded out to 3b.,38,2025-04-21T00:00:00-04:00,"Goodrich Ballpark (Crawfordsville, IN)",63,MBA,2025
6352367,597312,Kenyon Owls,597058,Wabash Little Giants,597312,5,top,T. Nee flied out to lf.,39,2025-04-21T00:00:00-04:00,"Goodrich Ballpark (Crawfordsville, IN)",63,MBA,2025
6352367,597312,Kenyon Owls,597058,Wabash Little Giants,597058,5,bot,D. Mendez grounded out to ss.,40,2025-04-21T00:00:00-04:00,"Goodrich Ballpark (Crawfordsville, IN)",63,MBA,2025
6352367,597312,Kenyon Owls,597058,Wabash Little Giants,597058,5,bot,R. Keating walked.,41,2025-04-21T00:00:00-04:00,"Goodrich Ballpark (Crawfordsville, IN)",63,MBA,2025
6352367,597312,Kenyon Owls,597058,Wabash Little Giants,597058,5,bot,C. Ellsperma singled through the left side; R. Keating advanced to second.,42,2025-04-21T00:00:00-04:00,"Goodrich Ballpark (Crawfordsville, IN)",63,MBA,2025
6352367,597312,Kenyon Owls,597058,Wabash Little Giants,597058,5,bot,C. Ellsperma advanced to second on a wild pitch; R. Keating advanced to third.,43,2025-04-21T00:00:00-04:00,"Goodrich Ballpark (Crawfordsville, IN)",63,MBA,2025
6352367,597312,Kenyon Owls,597058,Wabash Little Giants,597058,5,bot,"W. Phillips flied out to rf, sacrifice fly, RBI; C. Ellsperma advanced to third; R. Keating scored.",44,2025-04-21T00:00:00-04:00,"Goodrich Ballpark (Crawfordsville, IN)",63,MBA,2025
6352367,597312,Kenyon Owls,597058,Wabash Little Giants,597058,5,bot,C. Harris to p for L. Cropper.,45,2025-04-21T00:00:00-04:00,"Goodrich Ballpark (Crawfordsville, IN)",63,MBA,2025
6352367,597312,Kenyon Owls,597058,Wabash Little Giants,597058,5,bot,C. Scheidt flied out to lf.,46,2025-04-21T00:00:00-04:00,"Goodrich Ballpark (Crawfordsville, IN)",63,MBA,2025
6352367,597312,Kenyon Owls,597058,Wabash Little Giants,597312,6,top,B. Resnick singled down the lf line.,47,2025-04-21T00:00:00-04:00,"Goodrich Ballpark (Crawfordsville, IN)",63,MBA,2025
6352367,597312,Kenyon Owls,597058,Wabash Little Giants,597312,6,top,R. Manuzzi to p for J. Woehr.,48,2025-04-21T00:00:00-04:00,"Goodrich Ballpark (Crawfordsville, IN)",63,MBA,2025
6352367,597312,Kenyon Owls,597058,Wabash Little Giants,597312,6,top,W. Nelson flied out to rf.,49,2025-04-21T00:00:00-04:00,"Goodrich Ballpark (Crawfordsville, IN)",63,MBA,2025
6352367,597312,Kenyon Owls,597058,Wabash Little Giants,597312,6,top,B. Russell struck out swinging.,50,2025-04-21T00:00:00-04:00,"Goodrich Ballpark (Crawfordsville, IN)",63,MBA,2025
6352367,597312,Kenyon Owls,597058,Wabash Little Giants,597312,6,top,N. Price grounded out to p.,51,2025-04-21T00:00:00-04:00,"Goodrich Ballpark (Crawfordsville, IN)",63,MBA,2025
6352367,597312,Kenyon Owls,597058,Wabash Little Giants,597058,6,bot,R. Coates to lf for W. Nelson.,52,2025-04-21T00:00:00-04:00,"Goodrich Ballpark (Crawfordsville, IN)",63,MBA,2025
6352367,597312,Kenyon Owls,597058,Wabash Little Giants,597058,6,bot,B. Henke flied out to rf.,53,2025-04-21T00:00:00-04:00,"Goodrich Ballpark (Crawfordsville, IN)",63,MBA,2025
6352367,597312,Kenyon Owls,597058,Wabash Little Giants,597058,6,bot,W. Fremion flied out to rf.,54,2025-04-21T00:00:00-04:00,"Goodrich Ballpark (Crawfordsville, IN)",63,MBA,2025
6352367,597312,Kenyon Owls,597058,Wabash Little Giants,597058,6,bot,E. Neukam tripled down the rf line.,55,2025-04-21T00:00:00-04:00,"Goodrich Ballpark (Crawfordsville, IN)",63,MBA,2025
6352367,597312,Kenyon Owls,597058,Wabash Little Giants,597058,6,bot,M. Cvelbar grounded out p to ss to 1b.,56,2025-04-21T00:00:00-04:00,"Goodrich Ballpark (Crawfordsville, IN)",63,MBA,2025
6352367,597312,Kenyon Owls,597058,Wabash Little Giants,597312,7,top,N. Rosen walked.,57,2025-04-21T00:00:00-04:00,"Goodrich Ballpark (Crawfordsville, IN)",63,MBA,2025
6352367,597312,Kenyon Owls,597058,Wabash Little Giants,597312,7,top,"P. Gibbons grounded out to p, SAC, bunt; N. Rosen advanced to second.",58,2025-04-21T00:00:00-04:00,"Goodrich Ballpark (Crawfordsville, IN)",63,MBA,2025
6352367,597312,Kenyon Owls,597058,Wabash Little Giants,597312,7,top,D. Lee flied out to cf; N. Rosen advanced to third.,59,2025-04-21T00:00:00-04:00,"Goodrich Ballpark (Crawfordsville, IN)",63,MBA,2025
6352367,597312,Kenyon Owls,597058,Wabash Little Giants,597312,7,top,L. Meister flied out to rf.,60,2025-04-21T00:00:00-04:00,"Goodrich Ballpark (Crawfordsville, IN)",63,MBA,2025
6352367,597312,Kenyon Owls,597058,Wabash Little Giants,597058,7,bot,D. Mendez struck out looking.,61,2025-04-21T00:00:00-04:00,"Goodrich Ballpark (Crawfordsville, IN)",63,MBA,2025
6352367,597312,Kenyon Owls,597058,Wabash Little Giants,597058,7,bot,R. Keating singled up the middle.,62,2025-04-21T00:00:00-04:00,"Goodrich Ballpark (Crawfordsville, IN)",63,MBA,2025
6352367,597312,Kenyon Owls,597058,Wabash Little Giants,597058,7,bot,R. Keating advanced to second on a wild pitch.,63,2025-04-21T00:00:00-04:00,"Goodrich Ballpark (Crawfordsville, IN)",63,MBA,2025
6352367,597312,Kenyon Owls,597058,Wabash Little Giants,597058,7,bot,C. Ellsperma flied out to lf.,64,2025-04-21T00:00:00-04:00,"Goodrich Ballpark (Crawfordsville, IN)",63,MBA,2025
6352367,597312,Kenyon Owls,597058,Wabash Little Giants,597058,7,bot,W. Phillips struck out looking.,65,2025-04-21T00:00:00-04:00,"Goodrich Ballpark (Crawfordsville, IN)",63,MBA,2025
6352367,597312,Kenyon Owls,597058,Wabash Little Giants,597312,8,top,D. Haslett to p for R. Manuzzi.,66,2025-04-21T00:00:00-04:00,"Goodrich Ballpark (Crawfordsville, IN)",63,MBA,2025
6352367,597312,Kenyon Owls,597058,Wabash Little Giants,597312,8,top,T. Nee lined out to cf.,67,2025-04-21T00:00:00-04:00,"Goodrich Ballpark (Crawfordsville, IN)",63,MBA,2025
6352367,597312,Kenyon Owls,597058,Wabash Little Giants,597312,8,top,B. Resnick struck out looking.,68,2025-04-21T00:00:00-04:00,"Goodrich Ballpark (Crawfordsville, IN)",63,MBA,2025
6352367,597312,Kenyon Owls,597058,Wabash Little Giants,597312,8,top,R. Coates singled to right field.,69,2025-04-21T00:00:00-04:00,"Goodrich Ballpark (Crawfordsville, IN)",63,MBA,2025
6352367,597312,Kenyon Owls,597058,Wabash Little Giants,597312,8,top,R. Coates stole second.,70,2025-04-21T00:00:00-04:00,"Goodrich Ballpark (Crawfordsville, IN)",63,MBA,2025
6352367,597312,Kenyon Owls,597058,Wabash Little Giants,597312,8,top,B. Russell struck out swinging.,71,2025-04-21T00:00:00-04:00,"Goodrich Ballpark (Crawfordsville, IN)",63,MBA,2025
6352367,597312,Kenyon Owls,597058,Wabash Little Giants,597058,8,bot,C. Scheidt flied out to cf to right center.,72,2025-04-21T00:00:00-04:00,"Goodrich Ballpark (Crawfordsville, IN)",63,MBA,2025
6352367,597312,Kenyon Owls,597058,Wabash Little Giants,597058,8,bot,B. Henke grounded out to ss.,73,2025-04-21T00:00:00-04:00,"Goodrich Ballpark (Crawfordsville, IN)",63,MBA,2025
6352367,597312,Kenyon Owls,597058,Wabash Little Giants,597058,8,bot,W. Fremion struck out swinging.,74,2025-04-21T00:00:00-04:00,"Goodrich Ballpark (Crawfordsville, IN)",63,MBA,2025
6352367,597312,Kenyon Owls,597058,Wabash Little Giants,597312,9,top,N. Price flied out to rf.,75,2025-04-21T00:00:00-04:00,"Goodrich Ballpark (Crawfordsville, IN)",63,MBA,2025
6352367,597312,Kenyon Owls,597058,Wabash Little Giants,597312,9,top,N. Rosen walked.,76,2025-04-21T00:00:00-04:00,"Goodrich Ballpark (Crawfordsville, IN)",63,MBA,2025
6352367,597312,Kenyon Owls,597058,Wabash Little Giants,597312,9,top,"P. Gibbons homered to right field, 2 RBI; N. Rosen scored.",77,2025-04-21T00:00:00-04:00,"Goodrich Ballpark (Crawfordsville, IN)",63,MBA,2025
6352367,597312,Kenyon Owls,597058,Wabash Little Giants,597312,9,top,D. Lee grounded out to ss.,78,2025-04-21T00:00:00-04:00,"Goodrich Ballpark (Crawfordsville, IN)",63,MBA,2025
6352367,597312,Kenyon Owls,597058,Wabash Little Giants,597312,9,top,L. Meister struck out swinging.,79,2025-04-21T00:00:00-04:00,"Goodrich Ballpark (Crawfordsville, IN)",63,MBA,2025
6352367,597312,Kenyon Owls,597058,Wabash Little Giants,597058,9,bot,E. Neukam singled to center field.,80,2025-04-21T00:00:00-04:00,"Goodrich Ballpark (Crawfordsville, IN)",63,MBA,2025
6352367,597312,Kenyon Owls,597058,Wabash Little Giants,597058,9,bot,M. Cvelbar flied out to cf.,81,2025-04-21T00:00:00-04:00,"Goodrich Ballpark (Crawfordsville, IN)",63,MBA,2025
6352367,597312,Kenyon Owls,597058,Wabash Little Giants,597058,9,bot,D. Mendez flied out to cf.,82,2025-04-21T00:00:00-04:00,"Goodrich Ballpark (Crawfordsville, IN)",63,MBA,2025
6352367,597312,Kenyon Owls,597058,Wabash Little Giants,597058,9,bot,R. Keating popped up to 1b.,83,2025-04-21T00:00:00-04:00,"Goodrich Ballpark (Crawfordsville, IN)",63,MBA,2025
