game_id,away_team_id,away_team_name,home_team_id,home_team_name,batting_team,inning,top_bot,event_text,event_num,game_datetime,stadium_name,attendance,sport_id,season
6353135,597160,Fontbonne Griffins,597064,Webster Gorloks,597160,1,top,E. Creech flied out to rf.,1,2025-05-04T00:00:00-04:00,"GCS Ballpark (Sauget, IL)",98,MBA,2025
6353135,597160,Fontbonne Griffins,597064,Webster Gorloks,597160,1,top,T. Kueper flied out to lf.,2,2025-05-04T00:00:00-04:00,"GCS Ballpark (Sauget, IL)",98,MBA,2025
6353135,597160,Fontbonne Griffins,597064,Webster Gorloks,597160,1,top,D. Smith grounded out to 1b unassisted.,3,2025-05-04T00:00:00-04:00,"GCS Ballpark (Sauget, IL)",98,MBA,2025
6353135,597160,Fontbonne Griffins,597064,Webster Gorloks,597064,1,bot,K. Peters doubled to third base.,4,2025-05-04T00:00:00-04:00,"GCS Ballpark (Sauget, IL)",98,MBA,2025
6353135,597160,Fontbonne Griffins,597064,Webster Gorloks,597064,1,bot,J. Theodore flied out to cf3a K. Peters advanced to third.,5,2025-05-04T00:00:00-04:00,"GCS Ballpark (Sauget, IL)",98,MBA,2025
6353135,597160,Fontbonne Griffins,597064,Webster Gorloks,597064,1,bot,"E. Evola doubled to right field, RBI3a K. Peters scored.",6,2025-05-04T00:00:00-04:00,"GCS Ballpark (Sauget, IL)",98,MBA,2025
6353135,597160,Fontbonne Griffins,597064,Webster Gorloks,597064,1,bot,"R. LaRocco singled to left field, advanced to second on an error by lf, RBI3a E. Evola scored.",7,2025-05-04T00:00:00-04:00,"GCS Ballpark (Sauget, IL)",98,MBA,2025
6353135,597160,Fontbonne Griffins,597064,Webster Gorloks,597064,1,bot,N. Schumache struck out swinging.,8,2025-05-04T00:00:00-04:00,"GCS Ballpark (Sauget, IL)",98,MBA,2025
6353135,597160,Fontbonne Griffins,597064,Webster Gorloks,597064,1,bot,R. Hartz grounded out to ss.,9,2025-05-04T00:00:00-04:00,"GCS Ballpark (Sauget, IL)",98,MBA,2025
6353135,597160,Fontbonne Griffins,597064,Webster Gorloks,597160,2,top,K. Brooks flied out to cf.,10,2025-05-04T00:00:00-04:00,"GCS Ballpark (Sauget, IL)",98,MBA,2025
6353135,597160,Fontbonne Griffins,597064,Webster Gorloks,597160,2,top,N. Pruneau out at first 1b to p.,11,2025-05-04T00:00:00-04:00,"GCS Ballpark (Sauget, IL)",98,MBA,2025
6353135,597160,Fontbonne Griffins,597064,Webster Gorloks,597160,2,top,B. Swift singled to right field.,12,2025-05-04T00:00:00-04:00,"GCS Ballpark (Sauget, IL)",98,MBA,2025
6353135,597160,Fontbonne Griffins,597064,Webster Gorloks,597160,2,top,"C. Arenz doubled to right center, RBI3a B. Swift scored.",13,2025-05-04T00:00:00-04:00,"GCS Ballpark (Sauget, IL)",98,MBA,2025
6353135,597160,Fontbonne Griffins,597064,Webster Gorloks,597160,2,top,"J. Reynolds doubled to left field, RBI3a C. Arenz scored.",14,2025-05-04T00:00:00-04:00,"GCS Ballpark (Sauget, IL)",98,MBA,2025
6353135,597160,Fontbonne Griffins,597064,Webster Gorloks,597160,2,top,J. Rhiney grounded out to p.,15,2025-05-04T00:00:00-04:00,"GCS Ballpark (Sauget, IL)",98,MBA,2025
6353135,597160,Fontbonne Griffins,597064,Webster Gorloks,597064,2,bot,B. Stedman singled to right center.,16,2025-05-04T00:00:00-04:00,"GCS Ballpark (Sauget, IL)",98,MBA,2025
6353135,597160,Fontbonne Griffins,597064,Webster Gorloks,597064,2,bot,N. Wrubluski singled to right field3a B. Stedman advanced to second.,17,2025-05-04T00:00:00-04:00,"GCS Ballpark (Sauget, IL)",98,MBA,2025
6353135,597160,Fontbonne Griffins,597064,Webster Gorloks,597064,2,bot,N. Wrubluski stole second3a B. Stedman stole third.,18,2025-05-04T00:00:00-04:00,"GCS Ballpark (Sauget, IL)",98,MBA,2025
6353135,597160,Fontbonne Griffins,597064,Webster Gorloks,597064,2,bot,"J. Charlson flied out to cf, SAC, RBI3a N. Wrubluski advanced to third3a B. Stedman scored.",19,2025-05-04T00:00:00-04:00,"GCS Ballpark (Sauget, IL)",98,MBA,2025
6353135,597160,Fontbonne Griffins,597064,Webster Gorloks,597064,2,bot,"K. Peters grounded out to ss, RBI3a N. Wrubluski scored.",20,2025-05-04T00:00:00-04:00,"GCS Ballpark (Sauget, IL)",98,MBA,2025
6353135,597160,Fontbonne Griffins,597064,Webster Gorloks,597064,2,bot,J. Theodore flied out to lf.,21,2025-05-04T00:00:00-04:00,"GCS Ballpark (Sauget, IL)",98,MBA,2025
6353135,597160,Fontbonne Griffins,597064,Webster Gorloks,597160,3,top,E. Creech struck out looking.,22,2025-05-04T00:00:00-04:00,"GCS Ballpark (Sauget, IL)",98,MBA,2025
6353135,597160,Fontbonne Griffins,597064,Webster Gorloks,597160,3,top,T. Kueper singled to left center.,23,2025-05-04T00:00:00-04:00,"GCS Ballpark (Sauget, IL)",98,MBA,2025
6353135,597160,Fontbonne Griffins,597064,Webster Gorloks,597160,3,top,D. Smith struck out looking.,24,2025-05-04T00:00:00-04:00,"GCS Ballpark (Sauget, IL)",98,MBA,2025
6353135,597160,Fontbonne Griffins,597064,Webster Gorloks,597160,3,top,K. Brooks struck out swinging.,25,2025-05-04T00:00:00-04:00,"GCS Ballpark (Sauget, IL)",98,MBA,2025
6353135,597160,Fontbonne Griffins,597064,Webster Gorloks,597064,3,bot,E. Evola popped up to 2b.,26,2025-05-04T00:00:00-04:00,"GCS Ballpark (Sauget, IL)",98,MBA,2025
6353135,597160,Fontbonne Griffins,597064,Webster Gorloks,597064,3,bot,R. LaRocco doubled to right center.,27,2025-05-04T00:00:00-04:00,"GCS Ballpark (Sauget, IL)",98,MBA,2025
6353135,597160,Fontbonne Griffins,597064,Webster Gorloks,597064,3,bot,N. Schumache walked3a R. LaRocco stole third.,28,2025-05-04T00:00:00-04:00,"GCS Ballpark (Sauget, IL)",98,MBA,2025
6353135,597160,Fontbonne Griffins,597064,Webster Gorloks,597064,3,bot,N. Schumache stole second.,29,2025-05-04T00:00:00-04:00,"GCS Ballpark (Sauget, IL)",98,MBA,2025
6353135,597160,Fontbonne Griffins,597064,Webster Gorloks,597064,3,bot,"R. Hartz flied out to rf, SAC, RBI3a R. LaRocco scored.",30,2025-05-04T00:00:00-04:00,"GCS Ballpark (Sauget, IL)",98,MBA,2025
6353135,597160,Fontbonne Griffins,597064,Webster Gorloks,597064,3,bot,B. Stedman flied out to cf.,31,2025-05-04T00:00:00-04:00,"GCS Ballpark (Sauget, IL)",98,MBA,2025
6353135,597160,Fontbonne Griffins,597064,Webster Gorloks,597160,4,top,N. Pruneau fouled out to 1b.,32,2025-05-04T00:00:00-04:00,"GCS Ballpark (Sauget, IL)",98,MBA,2025
6353135,597160,Fontbonne Griffins,597064,Webster Gorloks,597160,4,top,B. Swift lined out to rf.,33,2025-05-04T00:00:00-04:00,"GCS Ballpark (Sauget, IL)",98,MBA,2025
6353135,597160,Fontbonne Griffins,597064,Webster Gorloks,597160,4,top,C. Arenz struck out looking.,34,2025-05-04T00:00:00-04:00,"GCS Ballpark (Sauget, IL)",98,MBA,2025
6353135,597160,Fontbonne Griffins,597064,Webster Gorloks,597064,4,bot,N. Wrubluski singled through the left side.,35,2025-05-04T00:00:00-04:00,"GCS Ballpark (Sauget, IL)",98,MBA,2025
6353135,597160,Fontbonne Griffins,597064,Webster Gorloks,597064,4,bot,J. Charlson lined out to ss3a N. Wrubluski out at second ss to 1b.,36,2025-05-04T00:00:00-04:00,"GCS Ballpark (Sauget, IL)",98,MBA,2025
6353135,597160,Fontbonne Griffins,597064,Webster Gorloks,597064,4,bot,K. Peters popped up to ss.,37,2025-05-04T00:00:00-04:00,"GCS Ballpark (Sauget, IL)",98,MBA,2025
6353135,597160,Fontbonne Griffins,597064,Webster Gorloks,597160,5,top,J. Reynolds struck out looking.,38,2025-05-04T00:00:00-04:00,"GCS Ballpark (Sauget, IL)",98,MBA,2025
6353135,597160,Fontbonne Griffins,597064,Webster Gorloks,597160,5,top,J. Rhiney singled through the left side.,39,2025-05-04T00:00:00-04:00,"GCS Ballpark (Sauget, IL)",98,MBA,2025
6353135,597160,Fontbonne Griffins,597064,Webster Gorloks,597160,5,top,E. Creech flied out to cf.,40,2025-05-04T00:00:00-04:00,"GCS Ballpark (Sauget, IL)",98,MBA,2025
6353135,597160,Fontbonne Griffins,597064,Webster Gorloks,597160,5,top,T. Kueper grounded out to c.,41,2025-05-04T00:00:00-04:00,"GCS Ballpark (Sauget, IL)",98,MBA,2025
6353135,597160,Fontbonne Griffins,597064,Webster Gorloks,597064,5,bot,J. Theodore flied out to lf.,42,2025-05-04T00:00:00-04:00,"GCS Ballpark (Sauget, IL)",98,MBA,2025
6353135,597160,Fontbonne Griffins,597064,Webster Gorloks,597064,5,bot,E. Evola lined out to rf.,43,2025-05-04T00:00:00-04:00,"GCS Ballpark (Sauget, IL)",98,MBA,2025
6353135,597160,Fontbonne Griffins,597064,Webster Gorloks,597064,5,bot,R. LaRocco doubled to right field.,44,2025-05-04T00:00:00-04:00,"GCS Ballpark (Sauget, IL)",98,MBA,2025
6353135,597160,Fontbonne Griffins,597064,Webster Gorloks,597064,5,bot,N. Schumache popped up to 1b.,45,2025-05-04T00:00:00-04:00,"GCS Ballpark (Sauget, IL)",98,MBA,2025
6353135,597160,Fontbonne Griffins,597064,Webster Gorloks,597160,6,top,J. Miller to p for C. Hunt.,46,2025-05-04T00:00:00-04:00,"GCS Ballpark (Sauget, IL)",98,MBA,2025
6353135,597160,Fontbonne Griffins,597064,Webster Gorloks,597160,6,top,D. Smith walked.,47,2025-05-04T00:00:00-04:00,"GCS Ballpark (Sauget, IL)",98,MBA,2025
6353135,597160,Fontbonne Griffins,597064,Webster Gorloks,597160,6,top,K. Brooks grounded into double play ss to 2b to 1b3a D. Smith out on the play.,48,2025-05-04T00:00:00-04:00,"GCS Ballpark (Sauget, IL)",98,MBA,2025
6353135,597160,Fontbonne Griffins,597064,Webster Gorloks,597160,6,top,N. Pruneau hit by pitch.,49,2025-05-04T00:00:00-04:00,"GCS Ballpark (Sauget, IL)",98,MBA,2025
6353135,597160,Fontbonne Griffins,597064,Webster Gorloks,597160,6,top,B. Swift singled to right field3a N. Pruneau advanced to second.,50,2025-05-04T00:00:00-04:00,"GCS Ballpark (Sauget, IL)",98,MBA,2025
6353135,597160,Fontbonne Griffins,597064,Webster Gorloks,597160,6,top,C. Arenz walked3a B. Swift advanced to second3a N. Pruneau advanced to third.,51,2025-05-04T00:00:00-04:00,"GCS Ballpark (Sauget, IL)",98,MBA,2025
6353135,597160,Fontbonne Griffins,597064,Webster Gorloks,597160,6,top,J. Reynolds struck out looking.,52,2025-05-04T00:00:00-04:00,"GCS Ballpark (Sauget, IL)",98,MBA,2025
6353135,597160,Fontbonne Griffins,597064,Webster Gorloks,597064,6,bot,R. Hartz grounded out to p.,53,2025-05-04T00:00:00-04:00,"GCS Ballpark (Sauget, IL)",98,MBA,2025
6353135,597160,Fontbonne Griffins,597064,Webster Gorloks,597064,6,bot,B. Stedman doubled to right field.,54,2025-05-04T00:00:00-04:00,"GCS Ballpark (Sauget, IL)",98,MBA,2025
6353135,597160,Fontbonne Griffins,597064,Webster Gorloks,597064,6,bot,N. Wrubluski flied out to cf3a B. Stedman advanced to third.,55,2025-05-04T00:00:00-04:00,"GCS Ballpark (Sauget, IL)",98,MBA,2025
6353135,597160,Fontbonne Griffins,597064,Webster Gorloks,597064,6,bot,J. Charlson flied out to rf.,56,2025-05-04T00:00:00-04:00,"GCS Ballpark (Sauget, IL)",98,MBA,2025
6353135,597160,Fontbonne Griffins,597064,Webster Gorloks,597160,7,top,E. Rompala-M to p for J. Miller.,57,2025-05-04T00:00:00-04:00,"GCS Ballpark (Sauget, IL)",98,MBA,2025
6353135,597160,Fontbonne Griffins,597064,Webster Gorloks,597160,7,top,J. Rhiney grounded out to 3b.,58,2025-05-04T00:00:00-04:00,"GCS Ballpark (Sauget, IL)",98,MBA,2025
6353135,597160,Fontbonne Griffins,597064,Webster Gorloks,597160,7,top,E. Creech struck out looking.,59,2025-05-04T00:00:00-04:00,"GCS Ballpark (Sauget, IL)",98,MBA,2025
6353135,597160,Fontbonne Griffins,597064,Webster Gorloks,597160,7,top,T. Kueper grounded out to ss.,60,2025-05-04T00:00:00-04:00,"GCS Ballpark (Sauget, IL)",98,MBA,2025
6353135,597160,Fontbonne Griffins,597064,Webster Gorloks,597064,7,bot,K. Peters tripled to left center.,61,2025-05-04T00:00:00-04:00,"GCS Ballpark (Sauget, IL)",98,MBA,2025
6353135,597160,Fontbonne Griffins,597064,Webster Gorloks,597064,7,bot,J. Theodore flied out to rf.,62,2025-05-04T00:00:00-04:00,"GCS Ballpark (Sauget, IL)",98,MBA,2025
6353135,597160,Fontbonne Griffins,597064,Webster Gorloks,597064,7,bot,"E. Evola singled to left center, RBI3a K. Peters scored.",63,2025-05-04T00:00:00-04:00,"GCS Ballpark (Sauget, IL)",98,MBA,2025
6353135,597160,Fontbonne Griffins,597064,Webster Gorloks,597064,7,bot,R. LaRocco singled to left center3a E. Evola advanced to second.,64,2025-05-04T00:00:00-04:00,"GCS Ballpark (Sauget, IL)",98,MBA,2025
6353135,597160,Fontbonne Griffins,597064,Webster Gorloks,597064,7,bot,C. McBride pinch hit for N. Schumache.,65,2025-05-04T00:00:00-04:00,"GCS Ballpark (Sauget, IL)",98,MBA,2025
6353135,597160,Fontbonne Griffins,597064,Webster Gorloks,597064,7,bot,C. Coleman to p for D. Morgantha.,66,2025-05-04T00:00:00-04:00,"GCS Ballpark (Sauget, IL)",98,MBA,2025
6353135,597160,Fontbonne Griffins,597064,Webster Gorloks,597064,7,bot,C. McBride struck out swinging.,67,2025-05-04T00:00:00-04:00,"GCS Ballpark (Sauget, IL)",98,MBA,2025
6353135,597160,Fontbonne Griffins,597064,Webster Gorloks,597064,7,bot,"R. Hartz singled through the left side, RBI3a R. LaRocco advanced to second3a E. Evola scored.",68,2025-05-04T00:00:00-04:00,"GCS Ballpark (Sauget, IL)",98,MBA,2025
6353135,597160,Fontbonne Griffins,597064,Webster Gorloks,597064,7,bot,B. Stedman walked3a R. Hartz advanced to second3a R. LaRocco advanced to third.,69,2025-05-04T00:00:00-04:00,"GCS Ballpark (Sauget, IL)",98,MBA,2025
6353135,597160,Fontbonne Griffins,597064,Webster Gorloks,597064,7,bot,N. Wrubluski struck out swinging.,70,2025-05-04T00:00:00-04:00,"GCS Ballpark (Sauget, IL)",98,MBA,2025
6353135,597160,Fontbonne Griffins,597064,Webster Gorloks,597160,8,top,D. Smith struck out swinging.,71,2025-05-04T00:00:00-04:00,"GCS Ballpark (Sauget, IL)",98,MBA,2025
6353135,597160,Fontbonne Griffins,597064,Webster Gorloks,597160,8,top,K. Brooks singled to left field.,72,2025-05-04T00:00:00-04:00,"GCS Ballpark (Sauget, IL)",98,MBA,2025
6353135,597160,Fontbonne Griffins,597064,Webster Gorloks,597160,8,top,N. Pruneau grounded into double play 1b to ss to 1b3a K. Brooks out on the play.,73,2025-05-04T00:00:00-04:00,"GCS Ballpark (Sauget, IL)",98,MBA,2025
6353135,597160,Fontbonne Griffins,597064,Webster Gorloks,597064,8,bot,J. Charlson flied out to rf.,74,2025-05-04T00:00:00-04:00,"GCS Ballpark (Sauget, IL)",98,MBA,2025
6353135,597160,Fontbonne Griffins,597064,Webster Gorloks,597064,8,bot,K. Peters grounded out to ss.,75,2025-05-04T00:00:00-04:00,"GCS Ballpark (Sauget, IL)",98,MBA,2025
6353135,597160,Fontbonne Griffins,597064,Webster Gorloks,597064,8,bot,J. Theodore doubled to right field.,76,2025-05-04T00:00:00-04:00,"GCS Ballpark (Sauget, IL)",98,MBA,2025
6353135,597160,Fontbonne Griffins,597064,Webster Gorloks,597064,8,bot,"E. Evola doubled to right center, RBI3a J. Theodore scored.",77,2025-05-04T00:00:00-04:00,"GCS Ballpark (Sauget, IL)",98,MBA,2025
6353135,597160,Fontbonne Griffins,597064,Webster Gorloks,597064,8,bot,R. LaRocco flied out to cf.,78,2025-05-04T00:00:00-04:00,"GCS Ballpark (Sauget, IL)",98,MBA,2025
6353135,597160,Fontbonne Griffins,597064,Webster Gorloks,597160,9,top,J. Wilson to p for E. Rompala-M.,79,2025-05-04T00:00:00-04:00,"GCS Ballpark (Sauget, IL)",98,MBA,2025
6353135,597160,Fontbonne Griffins,597064,Webster Gorloks,597160,9,top,B. Swift singled up the middle.,80,2025-05-04T00:00:00-04:00,"GCS Ballpark (Sauget, IL)",98,MBA,2025
6353135,597160,Fontbonne Griffins,597064,Webster Gorloks,597160,9,top,C. Arenz flied out to cf.,81,2025-05-04T00:00:00-04:00,"GCS Ballpark (Sauget, IL)",98,MBA,2025
6353135,597160,Fontbonne Griffins,597064,Webster Gorloks,597160,9,top,J. Reynolds flied out to rf.,82,2025-05-04T00:00:00-04:00,"GCS Ballpark (Sauget, IL)",98,MBA,2025
6353135,597160,Fontbonne Griffins,597064,Webster Gorloks,597160,9,top,J. Rhiney struck out swinging.,83,2025-05-04T00:00:00-04:00,"GCS Ballpark (Sauget, IL)",98,MBA,2025
