game_id,away_team_id,away_team_name,home_team_id,home_team_name,batting_team,inning,top_bot,event_text,event_num,game_datetime,stadium_name,attendance,sport_id,season
6356896,596554,Georgia Bulldogs,596608,Missouri Tigers,596554,1,top,"McCarthy, N. flied out to rf (2-2 BFBK).",1,2025-05-03T00:00:00-04:00,"Taylor Stadium (Columbia, MO)",1794,MBA,2025
6356896,596554,Georgia Bulldogs,596608,Missouri Tigers,596554,1,top,"Alford, S. walked (3-2 KBBBFFB).",2,2025-05-03T00:00:00-04:00,"Taylor Stadium (Columbia, MO)",1794,MBA,2025
6356896,596554,Georgia Bulldogs,596608,Missouri Tigers,596554,1,top,"Burnett, Ro hit by pitch (0-1 F)3a Alford, S. advanced to second.",3,2025-05-03T00:00:00-04:00,"Taylor Stadium (Columbia, MO)",1794,MBA,2025
6356896,596554,Georgia Bulldogs,596608,Missouri Tigers,596554,1,top,"Branch, K. struck out looking (1-2 KFBK).",4,2025-05-03T00:00:00-04:00,"Taylor Stadium (Columbia, MO)",1794,MBA,2025
6356896,596554,Georgia Bulldogs,596608,Missouri Tigers,596554,1,top,"Adams, Chr. struck out swinging (1-2 KBKS).",5,2025-05-03T00:00:00-04:00,"Taylor Stadium (Columbia, MO)",1794,MBA,2025
6356896,596554,Georgia Bulldogs,596608,Missouri Tigers,596608,1,bot,J. Lovich popped up to ss (1-1 KB).,6,2025-05-03T00:00:00-04:00,"Taylor Stadium (Columbia, MO)",1794,MBA,2025
6356896,596554,Georgia Bulldogs,596608,Missouri Tigers,596608,1,bot,P. Seals struck out swinging (0-2 KSS).,7,2025-05-03T00:00:00-04:00,"Taylor Stadium (Columbia, MO)",1794,MBA,2025
6356896,596554,Georgia Bulldogs,596608,Missouri Tigers,596608,1,bot,K. Peer singled through the right side (3-2 BFBSB).,8,2025-05-03T00:00:00-04:00,"Taylor Stadium (Columbia, MO)",1794,MBA,2025
6356896,596554,Georgia Bulldogs,596608,Missouri Tigers,596608,1,bot,K. Peer stole second.,9,2025-05-03T00:00:00-04:00,"Taylor Stadium (Columbia, MO)",1794,MBA,2025
6356896,596554,Georgia Bulldogs,596608,Missouri Tigers,596608,1,bot,"C. Nicoletto homered to right center, 2 RBI (3-2 KBFBFBFF)3a K. Peer scored.",10,2025-05-03T00:00:00-04:00,"Taylor Stadium (Columbia, MO)",1794,MBA,2025
6356896,596554,Georgia Bulldogs,596608,Missouri Tigers,596608,1,bot,C. Patterson struck out swinging (1-2 BKSS).,11,2025-05-03T00:00:00-04:00,"Taylor Stadium (Columbia, MO)",1794,MBA,2025
6356896,596554,Georgia Bulldogs,596608,Missouri Tigers,596554,2,top,"Phelps, Tre hit by pitch (1-1 KB).",12,2025-05-03T00:00:00-04:00,"Taylor Stadium (Columbia, MO)",1794,MBA,2025
6356896,596554,Georgia Bulldogs,596608,Missouri Tigers,596554,2,top,"Jackson, Dan lined out to cf (1-2 BFF).",13,2025-05-03T00:00:00-04:00,"Taylor Stadium (Columbia, MO)",1794,MBA,2025
6356896,596554,Georgia Bulldogs,596608,Missouri Tigers,596554,2,top,Obee struck out swinging (3-2 KBKBBFS).,14,2025-05-03T00:00:00-04:00,"Taylor Stadium (Columbia, MO)",1794,MBA,2025
6356896,596554,Georgia Bulldogs,596608,Missouri Tigers,596554,2,top,"Hunter, H. grounded out to 2b (0-1 K).",15,2025-05-03T00:00:00-04:00,"Taylor Stadium (Columbia, MO)",1794,MBA,2025
6356896,596554,Georgia Bulldogs,596608,Missouri Tigers,596608,2,bot,K. Knutson fouled out to 1b (0-2 FKFF).,16,2025-05-03T00:00:00-04:00,"Taylor Stadium (Columbia, MO)",1794,MBA,2025
6356896,596554,Georgia Bulldogs,596608,Missouri Tigers,596608,2,bot,B. Daniels flied out to cf (3-2 KBBSFB).,17,2025-05-03T00:00:00-04:00,"Taylor Stadium (Columbia, MO)",1794,MBA,2025
6356896,596554,Georgia Bulldogs,596608,Missouri Tigers,596608,2,bot,M. Serna struck out looking (3-2 BFKBFBK).,18,2025-05-03T00:00:00-04:00,"Taylor Stadium (Columbia, MO)",1794,MBA,2025
6356896,596554,Georgia Bulldogs,596608,Missouri Tigers,596554,3,top,"McCarthy, N. reached on a throwing error by 3b (1-0 B).",19,2025-05-03T00:00:00-04:00,"Taylor Stadium (Columbia, MO)",1794,MBA,2025
6356896,596554,Georgia Bulldogs,596608,Missouri Tigers,596554,3,top,"Alford, S. struck out swinging (1-2 FBFS).",20,2025-05-03T00:00:00-04:00,"Taylor Stadium (Columbia, MO)",1794,MBA,2025
6356896,596554,Georgia Bulldogs,596608,Missouri Tigers,596554,3,top,"Burnett, Ro flied out to cf (0-1 K).",21,2025-05-03T00:00:00-04:00,"Taylor Stadium (Columbia, MO)",1794,MBA,2025
6356896,596554,Georgia Bulldogs,596608,Missouri Tigers,596554,3,top,"Branch, K. struck out swinging (1-2 BFFS).",22,2025-05-03T00:00:00-04:00,"Taylor Stadium (Columbia, MO)",1794,MBA,2025
6356896,596554,Georgia Bulldogs,596608,Missouri Tigers,596608,3,bot,I. Frost struck out swinging (2-2 SBFBS).,23,2025-05-03T00:00:00-04:00,"Taylor Stadium (Columbia, MO)",1794,MBA,2025
6356896,596554,Georgia Bulldogs,596608,Missouri Tigers,596608,3,bot,J. Lovich flied out to lf (1-2 BSF).,24,2025-05-03T00:00:00-04:00,"Taylor Stadium (Columbia, MO)",1794,MBA,2025
6356896,596554,Georgia Bulldogs,596608,Missouri Tigers,596608,3,bot,P. Seals grounded out to ss (1-0 B).,25,2025-05-03T00:00:00-04:00,"Taylor Stadium (Columbia, MO)",1794,MBA,2025
6356896,596554,Georgia Bulldogs,596608,Missouri Tigers,596554,4,top,T. Neubeck to p for S. Horn.,26,2025-05-03T00:00:00-04:00,"Taylor Stadium (Columbia, MO)",1794,MBA,2025
6356896,596554,Georgia Bulldogs,596608,Missouri Tigers,596554,4,top,"Adams, Chr. struck out swinging (1-2 SBKS).",27,2025-05-03T00:00:00-04:00,"Taylor Stadium (Columbia, MO)",1794,MBA,2025
6356896,596554,Georgia Bulldogs,596608,Missouri Tigers,596554,4,top,"Phelps, Tre singled through the left side (0-1 F).",28,2025-05-03T00:00:00-04:00,"Taylor Stadium (Columbia, MO)",1794,MBA,2025
6356896,596554,Georgia Bulldogs,596608,Missouri Tigers,596554,4,top,"Jackson, Dan reached on a fielder's choice (3-2 KFBBB)3a Phelps, Tre out at second p to ss to 2b.",29,2025-05-03T00:00:00-04:00,"Taylor Stadium (Columbia, MO)",1794,MBA,2025
6356896,596554,Georgia Bulldogs,596608,Missouri Tigers,596554,4,top,"Obee walked (3-2 SBBSBFB)3a Jackson, Dan advanced to second.",30,2025-05-03T00:00:00-04:00,"Taylor Stadium (Columbia, MO)",1794,MBA,2025
6356896,596554,Georgia Bulldogs,596608,Missouri Tigers,596554,4,top,"Hunter, H. struck out looking (1-2 BFSK).",31,2025-05-03T00:00:00-04:00,"Taylor Stadium (Columbia, MO)",1794,MBA,2025
6356896,596554,Georgia Bulldogs,596608,Missouri Tigers,596608,4,bot,K. Peer struck out swinging (0-2 FSS).,32,2025-05-03T00:00:00-04:00,"Taylor Stadium (Columbia, MO)",1794,MBA,2025
6356896,596554,Georgia Bulldogs,596608,Missouri Tigers,596608,4,bot,C. Nicoletto flied out to cf (0-2 KF).,33,2025-05-03T00:00:00-04:00,"Taylor Stadium (Columbia, MO)",1794,MBA,2025
6356896,596554,Georgia Bulldogs,596608,Missouri Tigers,596608,4,bot,C. Patterson struck out swinging (2-2 BSBFS).,34,2025-05-03T00:00:00-04:00,"Taylor Stadium (Columbia, MO)",1794,MBA,2025
6356896,596554,Georgia Bulldogs,596608,Missouri Tigers,596554,5,top,"McCarthy, N. doubled down the lf line (3-2 SBBSBF).",35,2025-05-03T00:00:00-04:00,"Taylor Stadium (Columbia, MO)",1794,MBA,2025
6356896,596554,Georgia Bulldogs,596608,Missouri Tigers,596554,5,top,"Alford, S. grounded out to 2b (0-0)3a McCarthy, N. advanced to third.",36,2025-05-03T00:00:00-04:00,"Taylor Stadium (Columbia, MO)",1794,MBA,2025
6356896,596554,Georgia Bulldogs,596608,Missouri Tigers,596554,5,top,"Burnett, Ro doubled down the rf line, RBI (1-0 B)3a McCarthy, N. scored.",37,2025-05-03T00:00:00-04:00,"Taylor Stadium (Columbia, MO)",1794,MBA,2025
6356896,596554,Georgia Bulldogs,596608,Missouri Tigers,596554,5,top,"Branch, K. grounded out to 3b (2-2 KKBBF).",38,2025-05-03T00:00:00-04:00,"Taylor Stadium (Columbia, MO)",1794,MBA,2025
6356896,596554,Georgia Bulldogs,596608,Missouri Tigers,596554,5,top,"Brown, Cade pinch hit for Adams, Chr..",39,2025-05-03T00:00:00-04:00,"Taylor Stadium (Columbia, MO)",1794,MBA,2025
6356896,596554,Georgia Bulldogs,596608,Missouri Tigers,596554,5,top,"Brown, Cade grounded out to 2b (0-0).",40,2025-05-03T00:00:00-04:00,"Taylor Stadium (Columbia, MO)",1794,MBA,2025
6356896,596554,Georgia Bulldogs,596608,Missouri Tigers,596608,5,bot,"Burnett, Ro to 2b.",41,2025-05-03T00:00:00-04:00,"Taylor Stadium (Columbia, MO)",1794,MBA,2025
6356896,596554,Georgia Bulldogs,596608,Missouri Tigers,596608,5,bot,"Brown, Cade to rf.",42,2025-05-03T00:00:00-04:00,"Taylor Stadium (Columbia, MO)",1794,MBA,2025
6356896,596554,Georgia Bulldogs,596608,Missouri Tigers,596608,5,bot,K. Knutson flied out to cf (1-1 KB).,43,2025-05-03T00:00:00-04:00,"Taylor Stadium (Columbia, MO)",1794,MBA,2025
6356896,596554,Georgia Bulldogs,596608,Missouri Tigers,596608,5,bot,B. Daniels grounded out to 3b (0-1 F).,44,2025-05-03T00:00:00-04:00,"Taylor Stadium (Columbia, MO)",1794,MBA,2025
6356896,596554,Georgia Bulldogs,596608,Missouri Tigers,596608,5,bot,M. Serna walked (3-0 BBBB).,45,2025-05-03T00:00:00-04:00,"Taylor Stadium (Columbia, MO)",1794,MBA,2025
6356896,596554,Georgia Bulldogs,596608,Missouri Tigers,596608,5,bot,I. Frost struck out swinging (2-2 KBFBS).,46,2025-05-03T00:00:00-04:00,"Taylor Stadium (Columbia, MO)",1794,MBA,2025
6356896,596554,Georgia Bulldogs,596608,Missouri Tigers,596554,6,top,"Phelps, Tre walked (3-2 BBBKFB).",47,2025-05-03T00:00:00-04:00,"Taylor Stadium (Columbia, MO)",1794,MBA,2025
6356896,596554,Georgia Bulldogs,596608,Missouri Tigers,596554,6,top,"Jackson, Dan homered to right center, 2 RBI (2-2 SBBF)3a Phelps, Tre scored.",48,2025-05-03T00:00:00-04:00,"Taylor Stadium (Columbia, MO)",1794,MBA,2025
6356896,596554,Georgia Bulldogs,596608,Missouri Tigers,596554,6,top,Obee walked (3-0 BBBB).,49,2025-05-03T00:00:00-04:00,"Taylor Stadium (Columbia, MO)",1794,MBA,2025
6356896,596554,Georgia Bulldogs,596608,Missouri Tigers,596554,6,top,"Hunter, H. popped up to 3b, bunt (0-1 F).",50,2025-05-03T00:00:00-04:00,"Taylor Stadium (Columbia, MO)",1794,MBA,2025
6356896,596554,Georgia Bulldogs,596608,Missouri Tigers,596554,6,top,P. Green to p for T. Neubeck.,51,2025-05-03T00:00:00-04:00,"Taylor Stadium (Columbia, MO)",1794,MBA,2025
6356896,596554,Georgia Bulldogs,596608,Missouri Tigers,596554,6,top,"McCarthy, N. hit by pitch (2-0 BB)3a Obee advanced to second.",52,2025-05-03T00:00:00-04:00,"Taylor Stadium (Columbia, MO)",1794,MBA,2025
6356896,596554,Georgia Bulldogs,596608,Missouri Tigers,596554,6,top,"Alford, S. walked (3-2 BBBKFB)3a McCarthy, N. advanced to second3a Obee advanced to third.",53,2025-05-03T00:00:00-04:00,"Taylor Stadium (Columbia, MO)",1794,MBA,2025
6356896,596554,Georgia Bulldogs,596608,Missouri Tigers,596554,6,top,"Burnett, Ro walked, RBI (3-2 BFBFBB)3a Alford, S. advanced to second3a McCarthy, N. advanced to third3a Obee scored.",54,2025-05-03T00:00:00-04:00,"Taylor Stadium (Columbia, MO)",1794,MBA,2025
6356896,596554,Georgia Bulldogs,596608,Missouri Tigers,596554,6,top,"Branch, K. flied out to rf (0-2 KK).",55,2025-05-03T00:00:00-04:00,"Taylor Stadium (Columbia, MO)",1794,MBA,2025
6356896,596554,Georgia Bulldogs,596608,Missouri Tigers,596554,6,top,"Brown, Cade walked, RBI (3-1 FBBBB)3a Burnett, Ro advanced to second3a Alford, S. advanced to third3a McCarthy, N. scored.",56,2025-05-03T00:00:00-04:00,"Taylor Stadium (Columbia, MO)",1794,MBA,2025
6356896,596554,Georgia Bulldogs,596608,Missouri Tigers,596554,6,top,B. Lucas to p for P. Green.,57,2025-05-03T00:00:00-04:00,"Taylor Stadium (Columbia, MO)",1794,MBA,2025
6356896,596554,Georgia Bulldogs,596608,Missouri Tigers,596554,6,top,"Phelps, Tre flied out to lf (3-1 BBBK).",58,2025-05-03T00:00:00-04:00,"Taylor Stadium (Columbia, MO)",1794,MBA,2025
6356896,596554,Georgia Bulldogs,596608,Missouri Tigers,596608,6,bot,J. Lovich walked (3-2 BBKFBFFB).,59,2025-05-03T00:00:00-04:00,"Taylor Stadium (Columbia, MO)",1794,MBA,2025
6356896,596554,Georgia Bulldogs,596608,Missouri Tigers,596608,6,bot,"Davis II to p for Smith, Kol..",60,2025-05-03T00:00:00-04:00,"Taylor Stadium (Columbia, MO)",1794,MBA,2025
6356896,596554,Georgia Bulldogs,596608,Missouri Tigers,596608,6,bot,J. Lovich advanced to second on a passed ball.,61,2025-05-03T00:00:00-04:00,"Taylor Stadium (Columbia, MO)",1794,MBA,2025
6356896,596554,Georgia Bulldogs,596608,Missouri Tigers,596608,6,bot,"P. Seals struck out swinging, out at first c to 1b (0-2 KSS).",62,2025-05-03T00:00:00-04:00,"Taylor Stadium (Columbia, MO)",1794,MBA,2025
6356896,596554,Georgia Bulldogs,596608,Missouri Tigers,596608,6,bot,"K. Peer singled through the left side, advanced to second on the throw (0-1 K)3a J. Lovich advanced to third, out at home lf to c.",63,2025-05-03T00:00:00-04:00,"Taylor Stadium (Columbia, MO)",1794,MBA,2025
6356896,596554,Georgia Bulldogs,596608,Missouri Tigers,596608,6,bot,C. Nicoletto struck out swinging (1-2 BKSS).,64,2025-05-03T00:00:00-04:00,"Taylor Stadium (Columbia, MO)",1794,MBA,2025
6356896,596554,Georgia Bulldogs,596608,Missouri Tigers,596554,7,top,"Jackson, Dan flied out to cf (0-1 K).",65,2025-05-03T00:00:00-04:00,"Taylor Stadium (Columbia, MO)",1794,MBA,2025
6356896,596554,Georgia Bulldogs,596608,Missouri Tigers,596554,7,top,Obee struck out swinging (1-2 KBSS).,66,2025-05-03T00:00:00-04:00,"Taylor Stadium (Columbia, MO)",1794,MBA,2025
6356896,596554,Georgia Bulldogs,596608,Missouri Tigers,596554,7,top,"Hunter, H. struck out swinging (0-2 FFS).",67,2025-05-03T00:00:00-04:00,"Taylor Stadium (Columbia, MO)",1794,MBA,2025
6356896,596554,Georgia Bulldogs,596608,Missouri Tigers,596608,7,bot,Quinn to p for Davis II.,68,2025-05-03T00:00:00-04:00,"Taylor Stadium (Columbia, MO)",1794,MBA,2025
6356896,596554,Georgia Bulldogs,596608,Missouri Tigers,596608,7,bot,C. Patterson struck out swinging (1-2 KSBS).,69,2025-05-03T00:00:00-04:00,"Taylor Stadium (Columbia, MO)",1794,MBA,2025
6356896,596554,Georgia Bulldogs,596608,Missouri Tigers,596608,7,bot,K. Knutson grounded out to ss (1-0 B).,70,2025-05-03T00:00:00-04:00,"Taylor Stadium (Columbia, MO)",1794,MBA,2025
6356896,596554,Georgia Bulldogs,596608,Missouri Tigers,596608,7,bot,B. Daniels grounded out to 3b (2-2 BKFB).,71,2025-05-03T00:00:00-04:00,"Taylor Stadium (Columbia, MO)",1794,MBA,2025
6356896,596554,Georgia Bulldogs,596608,Missouri Tigers,596554,8,top,"McCarthy, N. struck out swinging (0-2 KKS).",72,2025-05-03T00:00:00-04:00,"Taylor Stadium (Columbia, MO)",1794,MBA,2025
6356896,596554,Georgia Bulldogs,596608,Missouri Tigers,596554,8,top,"Alford, S. flied out to cf (2-0 BB).",73,2025-05-03T00:00:00-04:00,"Taylor Stadium (Columbia, MO)",1794,MBA,2025
6356896,596554,Georgia Bulldogs,596608,Missouri Tigers,596554,8,top,"Burnett, Ro grounded out to 1b unassisted (0-0).",74,2025-05-03T00:00:00-04:00,"Taylor Stadium (Columbia, MO)",1794,MBA,2025
6356896,596554,Georgia Bulldogs,596608,Missouri Tigers,596608,8,bot,M. Serna doubled to right center (1-2 BKF).,75,2025-05-03T00:00:00-04:00,"Taylor Stadium (Columbia, MO)",1794,MBA,2025
6356896,596554,Georgia Bulldogs,596608,Missouri Tigers,596608,8,bot,I. Frost struck out swinging (2-2 BBSKS).,76,2025-05-03T00:00:00-04:00,"Taylor Stadium (Columbia, MO)",1794,MBA,2025
6356896,596554,Georgia Bulldogs,596608,Missouri Tigers,596608,8,bot,J. Lovich grounded out to 2b (0-0)3a M. Serna advanced to third.,77,2025-05-03T00:00:00-04:00,"Taylor Stadium (Columbia, MO)",1794,MBA,2025
6356896,596554,Georgia Bulldogs,596608,Missouri Tigers,596608,8,bot,P. Seals struck out looking (1-2 KBKK).,78,2025-05-03T00:00:00-04:00,"Taylor Stadium (Columbia, MO)",1794,MBA,2025
6356896,596554,Georgia Bulldogs,596608,Missouri Tigers,596554,9,top,"Branch, K. struck out swinging (2-2 KKFBBS).",79,2025-05-03T00:00:00-04:00,"Taylor Stadium (Columbia, MO)",1794,MBA,2025
6356896,596554,Georgia Bulldogs,596608,Missouri Tigers,596554,9,top,"Brown, Cade struck out swinging (1-2 FBFS).",80,2025-05-03T00:00:00-04:00,"Taylor Stadium (Columbia, MO)",1794,MBA,2025
6356896,596554,Georgia Bulldogs,596608,Missouri Tigers,596554,9,top,"Phelps, Tre grounded out to 3b (3-2 KBBBK).",81,2025-05-03T00:00:00-04:00,"Taylor Stadium (Columbia, MO)",1794,MBA,2025
6356896,596554,Georgia Bulldogs,596608,Missouri Tigers,596608,9,bot,"Harris, Zach to p for Quinn.",82,2025-05-03T00:00:00-04:00,"Taylor Stadium (Columbia, MO)",1794,MBA,2025
6356896,596554,Georgia Bulldogs,596608,Missouri Tigers,596608,9,bot,K. Peer struck out swinging (2-2 KBKBS).,83,2025-05-03T00:00:00-04:00,"Taylor Stadium (Columbia, MO)",1794,MBA,2025
6356896,596554,Georgia Bulldogs,596608,Missouri Tigers,596608,9,bot,C. Nicoletto flied out to lf (0-2 FS).,84,2025-05-03T00:00:00-04:00,"Taylor Stadium (Columbia, MO)",1794,MBA,2025
6356896,596554,Georgia Bulldogs,596608,Missouri Tigers,596608,9,bot,C. Patterson struck out swinging (1-2 KBKS).,85,2025-05-03T00:00:00-04:00,"Taylor Stadium (Columbia, MO)",1794,MBA,2025
