game_id,away_team_id,away_team_name,home_team_id,home_team_name,batting_team,inning,top_bot,event_text,event_num,game_datetime,stadium_name,attendance,sport_id,season
6356748,596608,Missouri Tigers,596575,Kansas Jayhawks,596608,1,top,"Weather: Mostly Sunny, 66F, wind ENE 5-10 mph.",1,2025-04-29T00:00:00-04:00,"Hoglund Ballpark (Lawrence, KS)",2545,MBA,2025
6356748,596608,Missouri Tigers,596575,Kansas Jayhawks,596608,1,top,First Pitch: 6:06 pm.,2,2025-04-29T00:00:00-04:00,"Hoglund Ballpark (Lawrence, KS)",2545,MBA,2025
6356748,596608,Missouri Tigers,596575,Kansas Jayhawks,596608,1,top,J. Lovich grounded out to 3b (2-2 SBBFF).,3,2025-04-29T00:00:00-04:00,"Hoglund Ballpark (Lawrence, KS)",2545,MBA,2025
6356748,596608,Missouri Tigers,596575,Kansas Jayhawks,596608,1,top,"K. Peer homered down the rf line, RBI (2-2 KBSB).",4,2025-04-29T00:00:00-04:00,"Hoglund Ballpark (Lawrence, KS)",2545,MBA,2025
6356748,596608,Missouri Tigers,596575,Kansas Jayhawks,596608,1,top,P. Seals struck out swinging (2-2 BKBFS).,5,2025-04-29T00:00:00-04:00,"Hoglund Ballpark (Lawrence, KS)",2545,MBA,2025
6356748,596608,Missouri Tigers,596575,Kansas Jayhawks,596608,1,top,K. Knutson flied out to lf (1-2 KKBF).,6,2025-04-29T00:00:00-04:00,"Hoglund Ballpark (Lawrence, KS)",2545,MBA,2025
6356748,596608,Missouri Tigers,596575,Kansas Jayhawks,596575,1,bot,"Cerda, D. lined out to 1b (3-2 KBKBBF).",7,2025-04-29T00:00:00-04:00,"Hoglund Ballpark (Lawrence, KS)",2545,MBA,2025
6356748,596608,Missouri Tigers,596575,Kansas Jayhawks,596575,1,bot,"Ballinger, B singled to right field (2-2 KFBB).",8,2025-04-29T00:00:00-04:00,"Hoglund Ballpark (Lawrence, KS)",2545,MBA,2025
6356748,596608,Missouri Tigers,596575,Kansas Jayhawks,596575,1,bot,"Hauge, J. reached on a throwing error by p (3-1 BFBB); Ballinger, B advanced to second.",9,2025-04-29T00:00:00-04:00,"Hoglund Ballpark (Lawrence, KS)",2545,MBA,2025
6356748,596608,Missouri Tigers,596575,Kansas Jayhawks,596575,1,bot,"Counsell, B. homered to left center, 3 RBI (0-0); Hauge, J. scored, unearned; Ballinger, B scored.",10,2025-04-29T00:00:00-04:00,"Hoglund Ballpark (Lawrence, KS)",2545,MBA,2025
6356748,596608,Missouri Tigers,596575,Kansas Jayhawks,596575,1,bot,"Osoria, D. flied out to rf (2-2 KBKB).",11,2025-04-29T00:00:00-04:00,"Hoglund Ballpark (Lawrence, KS)",2545,MBA,2025
6356748,596608,Missouri Tigers,596575,Kansas Jayhawks,596575,1,bot,"Brooks, M. walked (3-0 BBBB).",12,2025-04-29T00:00:00-04:00,"Hoglund Ballpark (Lawrence, KS)",2545,MBA,2025
6356748,596608,Missouri Tigers,596575,Kansas Jayhawks,596575,1,bot,"Barth, T. popped up to 2b (1-1 BS).",13,2025-04-29T00:00:00-04:00,"Hoglund Ballpark (Lawrence, KS)",2545,MBA,2025
6356748,596608,Missouri Tigers,596575,Kansas Jayhawks,596608,2,top,C. Patterson singled to third base (1-2 KKBFF).,14,2025-04-29T00:00:00-04:00,"Hoglund Ballpark (Lawrence, KS)",2545,MBA,2025
6356748,596608,Missouri Tigers,596575,Kansas Jayhawks,596608,2,top,"C. Patterson out at first p to 1b, picked off.",15,2025-04-29T00:00:00-04:00,"Hoglund Ballpark (Lawrence, KS)",2545,MBA,2025
6356748,596608,Missouri Tigers,596575,Kansas Jayhawks,596608,2,top,M. Serna walked (3-2 KBBKBB).,16,2025-04-29T00:00:00-04:00,"Hoglund Ballpark (Lawrence, KS)",2545,MBA,2025
6356748,596608,Missouri Tigers,596575,Kansas Jayhawks,596608,2,top,B. Picarelli grounded out to p (1-1 BF); M. Serna advanced to second.,17,2025-04-29T00:00:00-04:00,"Hoglund Ballpark (Lawrence, KS)",2545,MBA,2025
6356748,596608,Missouri Tigers,596575,Kansas Jayhawks,596608,2,top,T. Lawrence struck out swinging (1-2 FBKS).,18,2025-04-29T00:00:00-04:00,"Hoglund Ballpark (Lawrence, KS)",2545,MBA,2025
6356748,596608,Missouri Tigers,596575,Kansas Jayhawks,596575,2,bot,"Smith, S. doubled down the lf line (1-2 KBS).",19,2025-04-29T00:00:00-04:00,"Hoglund Ballpark (Lawrence, KS)",2545,MBA,2025
6356748,596608,Missouri Tigers,596575,Kansas Jayhawks,596575,2,bot,"Francis, I. singled through the left side, RBI (3-2 BSBFB); Smith, S. scored.",20,2025-04-29T00:00:00-04:00,"Hoglund Ballpark (Lawrence, KS)",2545,MBA,2025
6356748,596608,Missouri Tigers,596575,Kansas Jayhawks,596575,2,bot,B. Lucas to p for J. Kirchhoff.,21,2025-04-29T00:00:00-04:00,"Hoglund Ballpark (Lawrence, KS)",2545,MBA,2025
6356748,596608,Missouri Tigers,596575,Kansas Jayhawks,596575,2,bot,B. Daniels to lf for B. Picarelli.,22,2025-04-29T00:00:00-04:00,"Hoglund Ballpark (Lawrence, KS)",2545,MBA,2025
6356748,596608,Missouri Tigers,596575,Kansas Jayhawks,596575,2,bot,"Cerda, D. walked (3-2 BKSBBB); Francis, I. advanced to second.",23,2025-04-29T00:00:00-04:00,"Hoglund Ballpark (Lawrence, KS)",2545,MBA,2025
6356748,596608,Missouri Tigers,596575,Kansas Jayhawks,596575,2,bot,"Ballinger, B flied into double play cf to 3b (0-0); Cerda, D. advanced to second; Francis, I. out on the play.",24,2025-04-29T00:00:00-04:00,"Hoglund Ballpark (Lawrence, KS)",2545,MBA,2025
6356748,596608,Missouri Tigers,596575,Kansas Jayhawks,596575,2,bot,"Hauge, J. grounded out to 2b (2-2 KBBK).",25,2025-04-29T00:00:00-04:00,"Hoglund Ballpark (Lawrence, KS)",2545,MBA,2025
6356748,596608,Missouri Tigers,596575,Kansas Jayhawks,596608,3,top,"Trumper, T. to p for Vetock, M..",26,2025-04-29T00:00:00-04:00,"Hoglund Ballpark (Lawrence, KS)",2545,MBA,2025
6356748,596608,Missouri Tigers,596575,Kansas Jayhawks,596608,3,top,G. Goldbeck flied out to lf (1-0 B).,27,2025-04-29T00:00:00-04:00,"Hoglund Ballpark (Lawrence, KS)",2545,MBA,2025
6356748,596608,Missouri Tigers,596575,Kansas Jayhawks,596608,3,top,J. Lovich walked (3-0 BBBB).,28,2025-04-29T00:00:00-04:00,"Hoglund Ballpark (Lawrence, KS)",2545,MBA,2025
6356748,596608,Missouri Tigers,596575,Kansas Jayhawks,596608,3,top,K. Peer struck out swinging (3-2 BBBKSS).,29,2025-04-29T00:00:00-04:00,"Hoglund Ballpark (Lawrence, KS)",2545,MBA,2025
6356748,596608,Missouri Tigers,596575,Kansas Jayhawks,596608,3,top,P. Seals walked (3-2 BBKBKB); J. Lovich advanced to second.,30,2025-04-29T00:00:00-04:00,"Hoglund Ballpark (Lawrence, KS)",2545,MBA,2025
6356748,596608,Missouri Tigers,596575,Kansas Jayhawks,596608,3,top,"P. Seals out at second c to 2b to 1b to ss to 2b; J. Lovich advanced to third on a wild pitch, scored.",31,2025-04-29T00:00:00-04:00,"Hoglund Ballpark (Lawrence, KS)",2545,MBA,2025
6356748,596608,Missouri Tigers,596575,Kansas Jayhawks,596575,3,bot,"Counsell, B. flied out to cf (0-0).",32,2025-04-29T00:00:00-04:00,"Hoglund Ballpark (Lawrence, KS)",2545,MBA,2025
6356748,596608,Missouri Tigers,596575,Kansas Jayhawks,596575,3,bot,"Osoria, D. lined out to cf (1-0 B).",33,2025-04-29T00:00:00-04:00,"Hoglund Ballpark (Lawrence, KS)",2545,MBA,2025
6356748,596608,Missouri Tigers,596575,Kansas Jayhawks,596575,3,bot,"Brooks, M. walked (3-2 KBKBBFFB).",34,2025-04-29T00:00:00-04:00,"Hoglund Ballpark (Lawrence, KS)",2545,MBA,2025
6356748,596608,Missouri Tigers,596575,Kansas Jayhawks,596575,3,bot,"Barth, T. singled to shortstop (1-1 FB); Brooks, M. advanced to second.",35,2025-04-29T00:00:00-04:00,"Hoglund Ballpark (Lawrence, KS)",2545,MBA,2025
6356748,596608,Missouri Tigers,596575,Kansas Jayhawks,596575,3,bot,"Smith, S. struck out swinging (3-2 FBFBFBFS).",36,2025-04-29T00:00:00-04:00,"Hoglund Ballpark (Lawrence, KS)",2545,MBA,2025
6356748,596608,Missouri Tigers,596575,Kansas Jayhawks,596608,4,top,"West, M. to p for Trumper, T..",37,2025-04-29T00:00:00-04:00,"Hoglund Ballpark (Lawrence, KS)",2545,MBA,2025
6356748,596608,Missouri Tigers,596575,Kansas Jayhawks,596608,4,top,K. Knutson grounded out to ss (1-0 B).,38,2025-04-29T00:00:00-04:00,"Hoglund Ballpark (Lawrence, KS)",2545,MBA,2025
6356748,596608,Missouri Tigers,596575,Kansas Jayhawks,596608,4,top,C. Patterson grounded out to 3b (0-0).,39,2025-04-29T00:00:00-04:00,"Hoglund Ballpark (Lawrence, KS)",2545,MBA,2025
6356748,596608,Missouri Tigers,596575,Kansas Jayhawks,596608,4,top,M. Serna flied out to lf (3-2 BSBSBF).,40,2025-04-29T00:00:00-04:00,"Hoglund Ballpark (Lawrence, KS)",2545,MBA,2025
6356748,596608,Missouri Tigers,596575,Kansas Jayhawks,596575,4,bot,X. Lovett to p for B. Lucas.,41,2025-04-29T00:00:00-04:00,"Hoglund Ballpark (Lawrence, KS)",2545,MBA,2025
6356748,596608,Missouri Tigers,596575,Kansas Jayhawks,596575,4,bot,"Francis, I. hit by pitch (3-1 BBKB).",42,2025-04-29T00:00:00-04:00,"Hoglund Ballpark (Lawrence, KS)",2545,MBA,2025
6356748,596608,Missouri Tigers,596575,Kansas Jayhawks,596575,4,bot,"Cerda, D. singled through the left side (1-1 FB); Francis, I. advanced to second.",43,2025-04-29T00:00:00-04:00,"Hoglund Ballpark (Lawrence, KS)",2545,MBA,2025
6356748,596608,Missouri Tigers,596575,Kansas Jayhawks,596575,4,bot,"Ballinger, B flied out to rf (0-2 SKF); Francis, I. advanced to third.",44,2025-04-29T00:00:00-04:00,"Hoglund Ballpark (Lawrence, KS)",2545,MBA,2025
6356748,596608,Missouri Tigers,596575,Kansas Jayhawks,596575,4,bot,"Hauge, J. struck out swinging (1-2 KBSS); Cerda, D. stole second.",45,2025-04-29T00:00:00-04:00,"Hoglund Ballpark (Lawrence, KS)",2545,MBA,2025
6356748,596608,Missouri Tigers,596575,Kansas Jayhawks,596575,4,bot,"Counsell, B. singled up the middle, 2 RBI (1-2 BSSFFF); Cerda, D. scored; Francis, I. scored.",46,2025-04-29T00:00:00-04:00,"Hoglund Ballpark (Lawrence, KS)",2545,MBA,2025
6356748,596608,Missouri Tigers,596575,Kansas Jayhawks,596575,4,bot,"Counsell, B. stole second.",47,2025-04-29T00:00:00-04:00,"Hoglund Ballpark (Lawrence, KS)",2545,MBA,2025
6356748,596608,Missouri Tigers,596575,Kansas Jayhawks,596575,4,bot,"Osoria, D. grounded out to ss (0-1 K).",48,2025-04-29T00:00:00-04:00,"Hoglund Ballpark (Lawrence, KS)",2545,MBA,2025
6356748,596608,Missouri Tigers,596575,Kansas Jayhawks,596608,5,top,B. Daniels grounded out to ss (3-1 BBKB).,49,2025-04-29T00:00:00-04:00,"Hoglund Ballpark (Lawrence, KS)",2545,MBA,2025
6356748,596608,Missouri Tigers,596575,Kansas Jayhawks,596608,5,top,T. Lawrence grounded out to 3b (3-2 BSBSB).,50,2025-04-29T00:00:00-04:00,"Hoglund Ballpark (Lawrence, KS)",2545,MBA,2025
6356748,596608,Missouri Tigers,596575,Kansas Jayhawks,596608,5,top,G. Goldbeck singled to center field (2-1 BBK).,51,2025-04-29T00:00:00-04:00,"Hoglund Ballpark (Lawrence, KS)",2545,MBA,2025
6356748,596608,Missouri Tigers,596575,Kansas Jayhawks,596608,5,top,G. Goldbeck advanced to second on a wild pitch.,52,2025-04-29T00:00:00-04:00,"Hoglund Ballpark (Lawrence, KS)",2545,MBA,2025
6356748,596608,Missouri Tigers,596575,Kansas Jayhawks,596608,5,top,J. Lovich singled to shortstop (3-2 FBFBB).,53,2025-04-29T00:00:00-04:00,"Hoglund Ballpark (Lawrence, KS)",2545,MBA,2025
6356748,596608,Missouri Tigers,596575,Kansas Jayhawks,596608,5,top,K. Peer flied out to lf (0-0).,54,2025-04-29T00:00:00-04:00,"Hoglund Ballpark (Lawrence, KS)",2545,MBA,2025
6356748,596608,Missouri Tigers,596575,Kansas Jayhawks,596575,5,bot,J. McDevitt to p for X. Lovett.,55,2025-04-29T00:00:00-04:00,"Hoglund Ballpark (Lawrence, KS)",2545,MBA,2025
6356748,596608,Missouri Tigers,596575,Kansas Jayhawks,596575,5,bot,"Brooks, M. flied out to cf (0-0).",56,2025-04-29T00:00:00-04:00,"Hoglund Ballpark (Lawrence, KS)",2545,MBA,2025
6356748,596608,Missouri Tigers,596575,Kansas Jayhawks,596575,5,bot,"Barth, T. walked (3-2 KBFBBB).",57,2025-04-29T00:00:00-04:00,"Hoglund Ballpark (Lawrence, KS)",2545,MBA,2025
6356748,596608,Missouri Tigers,596575,Kansas Jayhawks,596575,5,bot,"Smith, S. struck out looking (1-2 BFFK); Barth, T. stole second.",58,2025-04-29T00:00:00-04:00,"Hoglund Ballpark (Lawrence, KS)",2545,MBA,2025
6356748,596608,Missouri Tigers,596575,Kansas Jayhawks,596575,5,bot,"Francis, I. fouled out to 1b (0-0).",59,2025-04-29T00:00:00-04:00,"Hoglund Ballpark (Lawrence, KS)",2545,MBA,2025
6356748,596608,Missouri Tigers,596575,Kansas Jayhawks,596608,6,top,"Smith, D. to p for West, M..",60,2025-04-29T00:00:00-04:00,"Hoglund Ballpark (Lawrence, KS)",2545,MBA,2025
6356748,596608,Missouri Tigers,596575,Kansas Jayhawks,596608,6,top,P. Seals singled up the middle (1-2 KFB).,61,2025-04-29T00:00:00-04:00,"Hoglund Ballpark (Lawrence, KS)",2545,MBA,2025
6356748,596608,Missouri Tigers,596575,Kansas Jayhawks,596608,6,top,"K. Knutson grounded out to p, SAC, bunt (0-1 K); P. Seals advanced to second.",62,2025-04-29T00:00:00-04:00,"Hoglund Ballpark (Lawrence, KS)",2545,MBA,2025
6356748,596608,Missouri Tigers,596575,Kansas Jayhawks,596608,6,top,C. Patterson grounded out to 1b unassisted (1-0 B); P. Seals advanced to third.,63,2025-04-29T00:00:00-04:00,"Hoglund Ballpark (Lawrence, KS)",2545,MBA,2025
6356748,596608,Missouri Tigers,596575,Kansas Jayhawks,596608,6,top,M. Serna grounded out to 2b (1-0 B).,64,2025-04-29T00:00:00-04:00,"Hoglund Ballpark (Lawrence, KS)",2545,MBA,2025
6356748,596608,Missouri Tigers,596575,Kansas Jayhawks,596575,6,bot,P. Green to p for J. McDevitt.,65,2025-04-29T00:00:00-04:00,"Hoglund Ballpark (Lawrence, KS)",2545,MBA,2025
6356748,596608,Missouri Tigers,596575,Kansas Jayhawks,596575,6,bot,"Cerda, D. flied out to lf (1-2 FFB).",66,2025-04-29T00:00:00-04:00,"Hoglund Ballpark (Lawrence, KS)",2545,MBA,2025
6356748,596608,Missouri Tigers,596575,Kansas Jayhawks,596575,6,bot,"Ballinger, B singled to center field (2-0 BB).",67,2025-04-29T00:00:00-04:00,"Hoglund Ballpark (Lawrence, KS)",2545,MBA,2025
6356748,596608,Missouri Tigers,596575,Kansas Jayhawks,596575,6,bot,"Hauge, J. grounded out to p, SAC, bunt (0-1 F); Ballinger, B advanced to second.",68,2025-04-29T00:00:00-04:00,"Hoglund Ballpark (Lawrence, KS)",2545,MBA,2025
6356748,596608,Missouri Tigers,596575,Kansas Jayhawks,596575,6,bot,"Counsell, B. flied out to cf (1-2 BFS).",69,2025-04-29T00:00:00-04:00,"Hoglund Ballpark (Lawrence, KS)",2545,MBA,2025
6356748,596608,Missouri Tigers,596575,Kansas Jayhawks,596608,7,top,"Parker, B. to p for Smith, D..",70,2025-04-29T00:00:00-04:00,"Hoglund Ballpark (Lawrence, KS)",2545,MBA,2025
6356748,596608,Missouri Tigers,596575,Kansas Jayhawks,596608,7,top,T. Macon pinch hit for B. Daniels.,71,2025-04-29T00:00:00-04:00,"Hoglund Ballpark (Lawrence, KS)",2545,MBA,2025
6356748,596608,Missouri Tigers,596575,Kansas Jayhawks,596608,7,top,T. Macon reached on a throwing error by ss (0-2 SS).,72,2025-04-29T00:00:00-04:00,"Hoglund Ballpark (Lawrence, KS)",2545,MBA,2025
6356748,596608,Missouri Tigers,596575,Kansas Jayhawks,596608,7,top,T. Lawrence struck out looking (1-2 KFFBK); T. Macon advanced to second on a passed ball.,73,2025-04-29T00:00:00-04:00,"Hoglund Ballpark (Lawrence, KS)",2545,MBA,2025
6356748,596608,Missouri Tigers,596575,Kansas Jayhawks,596608,7,top,G. Goldbeck flied out to lf (0-2 FS).,74,2025-04-29T00:00:00-04:00,"Hoglund Ballpark (Lawrence, KS)",2545,MBA,2025
6356748,596608,Missouri Tigers,596575,Kansas Jayhawks,596608,7,top,"Breckheimer to p for Parker, B..",75,2025-04-29T00:00:00-04:00,"Hoglund Ballpark (Lawrence, KS)",2545,MBA,2025
6356748,596608,Missouri Tigers,596575,Kansas Jayhawks,596608,7,top,J. Lovich hit by pitch (0-0).,76,2025-04-29T00:00:00-04:00,"Hoglund Ballpark (Lawrence, KS)",2545,MBA,2025
6356748,596608,Missouri Tigers,596575,Kansas Jayhawks,596608,7,top,"K. Peer singled through the right side, RBI (1-1 KB); J. Lovich advanced to third; T. Macon scored, unearned.",77,2025-04-29T00:00:00-04:00,"Hoglund Ballpark (Lawrence, KS)",2545,MBA,2025
6356748,596608,Missouri Tigers,596575,Kansas Jayhawks,596608,7,top,P. Seals grounded out to 2b (0-1 K).,78,2025-04-29T00:00:00-04:00,"Hoglund Ballpark (Lawrence, KS)",2545,MBA,2025
6356748,596608,Missouri Tigers,596575,Kansas Jayhawks,596575,7,bot,T. Macon to lf.,79,2025-04-29T00:00:00-04:00,"Hoglund Ballpark (Lawrence, KS)",2545,MBA,2025
6356748,596608,Missouri Tigers,596575,Kansas Jayhawks,596575,7,bot,"Osoria, D. flied out to cf (1-1 BF).",80,2025-04-29T00:00:00-04:00,"Hoglund Ballpark (Lawrence, KS)",2545,MBA,2025
6356748,596608,Missouri Tigers,596575,Kansas Jayhawks,596575,7,bot,"Brooks, M. walked (3-1 FBBBB).",81,2025-04-29T00:00:00-04:00,"Hoglund Ballpark (Lawrence, KS)",2545,MBA,2025
6356748,596608,Missouri Tigers,596575,Kansas Jayhawks,596575,7,bot,"Brooks, M. stole second.",82,2025-04-29T00:00:00-04:00,"Hoglund Ballpark (Lawrence, KS)",2545,MBA,2025
6356748,596608,Missouri Tigers,596575,Kansas Jayhawks,596575,7,bot,"Barth, T. struck out looking (2-2 KBSBK).",83,2025-04-29T00:00:00-04:00,"Hoglund Ballpark (Lawrence, KS)",2545,MBA,2025
6356748,596608,Missouri Tigers,596575,Kansas Jayhawks,596575,7,bot,"Smith, S. doubled down the rf line, RBI (3-1 FBBB); Brooks, M. scored.",84,2025-04-29T00:00:00-04:00,"Hoglund Ballpark (Lawrence, KS)",2545,MBA,2025
6356748,596608,Missouri Tigers,596575,Kansas Jayhawks,596575,7,bot,"Francis, I. grounded out to 3b (1-0 B).",85,2025-04-29T00:00:00-04:00,"Hoglund Ballpark (Lawrence, KS)",2545,MBA,2025
6356748,596608,Missouri Tigers,596575,Kansas Jayhawks,596608,8,top,K. Knutson grounded out to 2b (0-1 K).,86,2025-04-29T00:00:00-04:00,"Hoglund Ballpark (Lawrence, KS)",2545,MBA,2025
6356748,596608,Missouri Tigers,596575,Kansas Jayhawks,596608,8,top,C. Patterson walked (3-1 BBBKB).,87,2025-04-29T00:00:00-04:00,"Hoglund Ballpark (Lawrence, KS)",2545,MBA,2025
6356748,596608,Missouri Tigers,596575,Kansas Jayhawks,596608,8,top,M. Serna struck out swinging (0-2 KKS).,88,2025-04-29T00:00:00-04:00,"Hoglund Ballpark (Lawrence, KS)",2545,MBA,2025
6356748,596608,Missouri Tigers,596575,Kansas Jayhawks,596608,8,top,T. Macon singled through the right side (1-1 BF); C. Patterson advanced to second.,89,2025-04-29T00:00:00-04:00,"Hoglund Ballpark (Lawrence, KS)",2545,MBA,2025
6356748,596608,Missouri Tigers,596575,Kansas Jayhawks,596608,8,top,C. Benson pinch hit for T. Lawrence.,90,2025-04-29T00:00:00-04:00,"Hoglund Ballpark (Lawrence, KS)",2545,MBA,2025
6356748,596608,Missouri Tigers,596575,Kansas Jayhawks,596608,8,top,C. Benson grounded out to 1b unassisted (1-2 BKS).,91,2025-04-29T00:00:00-04:00,"Hoglund Ballpark (Lawrence, KS)",2545,MBA,2025
6356748,596608,Missouri Tigers,596575,Kansas Jayhawks,596575,8,bot,P. Basler to 2b for C. Benson.,92,2025-04-29T00:00:00-04:00,"Hoglund Ballpark (Lawrence, KS)",2545,MBA,2025
6356748,596608,Missouri Tigers,596575,Kansas Jayhawks,596575,8,bot,B. Smith to p for P. Green.,93,2025-04-29T00:00:00-04:00,"Hoglund Ballpark (Lawrence, KS)",2545,MBA,2025
6356748,596608,Missouri Tigers,596575,Kansas Jayhawks,596575,8,bot,"Cerda, D. struck out swinging (2-2 BBFKS).",94,2025-04-29T00:00:00-04:00,"Hoglund Ballpark (Lawrence, KS)",2545,MBA,2025
6356748,596608,Missouri Tigers,596575,Kansas Jayhawks,596575,8,bot,"Ballinger, B walked (3-1 BBBKB).",95,2025-04-29T00:00:00-04:00,"Hoglund Ballpark (Lawrence, KS)",2545,MBA,2025
6356748,596608,Missouri Tigers,596575,Kansas Jayhawks,596575,8,bot,"Hauge, J. singled through the left side (0-2 KF); Ballinger, B advanced to second.",96,2025-04-29T00:00:00-04:00,"Hoglund Ballpark (Lawrence, KS)",2545,MBA,2025
6356748,596608,Missouri Tigers,596575,Kansas Jayhawks,596575,8,bot,"Williams, T. pinch ran for Hauge, J..",97,2025-04-29T00:00:00-04:00,"Hoglund Ballpark (Lawrence, KS)",2545,MBA,2025
6356748,596608,Missouri Tigers,596575,Kansas Jayhawks,596575,8,bot,"Counsell, B. walked (3-0 BBBB); Williams, T. advanced to second; Ballinger, B advanced to third.",98,2025-04-29T00:00:00-04:00,"Hoglund Ballpark (Lawrence, KS)",2545,MBA,2025
6356748,596608,Missouri Tigers,596575,Kansas Jayhawks,596575,8,bot,"Osoria, D. singled to left field, advanced to second on the error, RBI (0-0); Counsell, B. advanced to second, advanced to third on the error; Williams, T. advanced to third, scored on a throwing error by lf, unearned; Ballinger, B scored.",99,2025-04-29T00:00:00-04:00,"Hoglund Ballpark (Lawrence, KS)",2545,MBA,2025
6356748,596608,Missouri Tigers,596575,Kansas Jayhawks,596575,8,bot,"Ashton, K. pinch ran for Osoria, D..",100,2025-04-29T00:00:00-04:00,"Hoglund Ballpark (Lawrence, KS)",2545,MBA,2025
6356748,596608,Missouri Tigers,596575,Kansas Jayhawks,596575,8,bot,"Brooks, M. reached on a fielder's choice to pitcher (0-1 K); Ashton, K. advanced to third; Counsell, B. out at third p to c to 3b.",101,2025-04-29T00:00:00-04:00,"Hoglund Ballpark (Lawrence, KS)",2545,MBA,2025
6356748,596608,Missouri Tigers,596575,Kansas Jayhawks,596575,8,bot,"Barth, T. popped up to ss (0-1 K).",102,2025-04-29T00:00:00-04:00,"Hoglund Ballpark (Lawrence, KS)",2545,MBA,2025
6356748,596608,Missouri Tigers,596575,Kansas Jayhawks,596608,9,top,"Koszewski, M to rf for Williams, T..",103,2025-04-29T00:00:00-04:00,"Hoglund Ballpark (Lawrence, KS)",2545,MBA,2025
6356748,596608,Missouri Tigers,596575,Kansas Jayhawks,596608,9,top,"Diggins, C. to 2b for Counsell, B..",104,2025-04-29T00:00:00-04:00,"Hoglund Ballpark (Lawrence, KS)",2545,MBA,2025
6356748,596608,Missouri Tigers,596575,Kansas Jayhawks,596608,9,top,"Brooks, M. to 3b.",105,2025-04-29T00:00:00-04:00,"Hoglund Ballpark (Lawrence, KS)",2545,MBA,2025
6356748,596608,Missouri Tigers,596575,Kansas Jayhawks,596608,9,top,"Lin, E. to p for Breckheimer.",106,2025-04-29T00:00:00-04:00,"Hoglund Ballpark (Lawrence, KS)",2545,MBA,2025
6356748,596608,Missouri Tigers,596575,Kansas Jayhawks,596608,9,top,G. Goldbeck grounded out to 1b unassisted (1-1 BK).,107,2025-04-29T00:00:00-04:00,"Hoglund Ballpark (Lawrence, KS)",2545,MBA,2025
6356748,596608,Missouri Tigers,596575,Kansas Jayhawks,596608,9,top,J. Lovich singled to third base (0-1 S).,108,2025-04-29T00:00:00-04:00,"Hoglund Ballpark (Lawrence, KS)",2545,MBA,2025
6356748,596608,Missouri Tigers,596575,Kansas Jayhawks,596608,9,top,K. Peer struck out swinging (1-2 FBSS).,109,2025-04-29T00:00:00-04:00,"Hoglund Ballpark (Lawrence, KS)",2545,MBA,2025
6356748,596608,Missouri Tigers,596575,Kansas Jayhawks,596608,9,top,J. Lovich advanced to second.,110,2025-04-29T00:00:00-04:00,"Hoglund Ballpark (Lawrence, KS)",2545,MBA,2025
6356748,596608,Missouri Tigers,596575,Kansas Jayhawks,596608,9,top,J. Lovich advanced to third on a wild pitch.,111,2025-04-29T00:00:00-04:00,"Hoglund Ballpark (Lawrence, KS)",2545,MBA,2025
6356748,596608,Missouri Tigers,596575,Kansas Jayhawks,596608,9,top,P. Seals struck out swinging (2-2 KSBFBS).,112,2025-04-29T00:00:00-04:00,"Hoglund Ballpark (Lawrence, KS)",2545,MBA,2025
