game_id,away_team_id,away_team_name,home_team_id,home_team_name,batting_team,inning,top_bot,event_text,event_num,game_datetime,stadium_name,attendance,sport_id,season
6365103,597120,Linfield Wildcats,597242,Carthage Firebirds,597120,1,top,H. Klingelho walked.,1,2025-03-08T00:00:00-05:00,"Augie Schmidt Field (Kenosha, WI)",45,MBA,2025
6365103,597120,Linfield Wildcats,597242,Carthage Firebirds,597120,1,top,M. Lewis hit by pitch; H. Klingelho advanced to second.,2,2025-03-08T00:00:00-05:00,"Augie Schmidt Field (Kenosha, WI)",45,MBA,2025
6365103,597120,Linfield Wildcats,597242,Carthage Firebirds,597120,1,top,E. Maris struck out swinging.,3,2025-03-08T00:00:00-05:00,"Augie Schmidt Field (Kenosha, WI)",45,MBA,2025
6365103,597120,Linfield Wildcats,597242,Carthage Firebirds,597120,1,top,N. Holm struck out swinging.,4,2025-03-08T00:00:00-05:00,"Augie Schmidt Field (Kenosha, WI)",45,MBA,2025
6365103,597120,Linfield Wildcats,597242,Carthage Firebirds,597120,1,top,Porter hit by pitch; M. Lewis advanced to second; H. Klingelho advanced to third.,5,2025-03-08T00:00:00-05:00,"Augie Schmidt Field (Kenosha, WI)",45,MBA,2025
6365103,597120,Linfield Wildcats,597242,Carthage Firebirds,597120,1,top,T. Marr grounded out to 1b unassisted.,6,2025-03-08T00:00:00-05:00,"Augie Schmidt Field (Kenosha, WI)",45,MBA,2025
6365103,597120,Linfield Wildcats,597242,Carthage Firebirds,597242,1,bot,C. Callahan doubled to center field.,7,2025-03-08T00:00:00-05:00,"Augie Schmidt Field (Kenosha, WI)",45,MBA,2025
6365103,597120,Linfield Wildcats,597242,Carthage Firebirds,597242,1,bot,P. Moser hit by pitch.,8,2025-03-08T00:00:00-05:00,"Augie Schmidt Field (Kenosha, WI)",45,MBA,2025
6365103,597120,Linfield Wildcats,597242,Carthage Firebirds,597242,1,bot,M. Cairo struck out swinging.,9,2025-03-08T00:00:00-05:00,"Augie Schmidt Field (Kenosha, WI)",45,MBA,2025
6365103,597120,Linfield Wildcats,597242,Carthage Firebirds,597242,1,bot,J. Zuleger flied out to lf.,10,2025-03-08T00:00:00-05:00,"Augie Schmidt Field (Kenosha, WI)",45,MBA,2025
6365103,597120,Linfield Wildcats,597242,Carthage Firebirds,597242,1,bot,M. Felber grounded out to 1b unassisted.,11,2025-03-08T00:00:00-05:00,"Augie Schmidt Field (Kenosha, WI)",45,MBA,2025
6365103,597120,Linfield Wildcats,597242,Carthage Firebirds,597120,2,top,J. Mansur struck out swinging.,12,2025-03-08T00:00:00-05:00,"Augie Schmidt Field (Kenosha, WI)",45,MBA,2025
6365103,597120,Linfield Wildcats,597242,Carthage Firebirds,597120,2,top,T. Eisenhut doubled.,13,2025-03-08T00:00:00-05:00,"Augie Schmidt Field (Kenosha, WI)",45,MBA,2025
6365103,597120,Linfield Wildcats,597242,Carthage Firebirds,597120,2,top,R. Gullard struck out swinging.,14,2025-03-08T00:00:00-05:00,"Augie Schmidt Field (Kenosha, WI)",45,MBA,2025
6365103,597120,Linfield Wildcats,597242,Carthage Firebirds,597120,2,top,"T. Eisenhut out at second c to 3b, picked off.",15,2025-03-08T00:00:00-05:00,"Augie Schmidt Field (Kenosha, WI)",45,MBA,2025
6365103,597120,Linfield Wildcats,597242,Carthage Firebirds,597242,2,bot,Z. Tubbs singled up the middle.,16,2025-03-08T00:00:00-05:00,"Augie Schmidt Field (Kenosha, WI)",45,MBA,2025
6365103,597120,Linfield Wildcats,597242,Carthage Firebirds,597242,2,bot,A. Gaca struck out looking.,17,2025-03-08T00:00:00-05:00,"Augie Schmidt Field (Kenosha, WI)",45,MBA,2025
6365103,597120,Linfield Wildcats,597242,Carthage Firebirds,597242,2,bot,K. Krekling flied out to lf.,18,2025-03-08T00:00:00-05:00,"Augie Schmidt Field (Kenosha, WI)",45,MBA,2025
6365103,597120,Linfield Wildcats,597242,Carthage Firebirds,597242,2,bot,D. Knecht reached on a fielder's choice; Z. Tubbs out at second 2b to ss.,19,2025-03-08T00:00:00-05:00,"Augie Schmidt Field (Kenosha, WI)",45,MBA,2025
6365103,597120,Linfield Wildcats,597242,Carthage Firebirds,597120,3,top,H. Klingelho lined out to cf.,20,2025-03-08T00:00:00-05:00,"Augie Schmidt Field (Kenosha, WI)",45,MBA,2025
6365103,597120,Linfield Wildcats,597242,Carthage Firebirds,597120,3,top,M. Lewis struck out swinging.,21,2025-03-08T00:00:00-05:00,"Augie Schmidt Field (Kenosha, WI)",45,MBA,2025
6365103,597120,Linfield Wildcats,597242,Carthage Firebirds,597120,3,top,E. Maris flied out to rf.,22,2025-03-08T00:00:00-05:00,"Augie Schmidt Field (Kenosha, WI)",45,MBA,2025
6365103,597120,Linfield Wildcats,597242,Carthage Firebirds,597242,3,bot,C. Callahan walked.,23,2025-03-08T00:00:00-05:00,"Augie Schmidt Field (Kenosha, WI)",45,MBA,2025
6365103,597120,Linfield Wildcats,597242,Carthage Firebirds,597242,3,bot,P. Moser flied out to lf.,24,2025-03-08T00:00:00-05:00,"Augie Schmidt Field (Kenosha, WI)",45,MBA,2025
6365103,597120,Linfield Wildcats,597242,Carthage Firebirds,597242,3,bot,M. Cairo grounded into double play ss to 2b to 1b; C. Callahan out on the play.,25,2025-03-08T00:00:00-05:00,"Augie Schmidt Field (Kenosha, WI)",45,MBA,2025
6365103,597120,Linfield Wildcats,597242,Carthage Firebirds,597120,4,top,N. Holm walked.,26,2025-03-08T00:00:00-05:00,"Augie Schmidt Field (Kenosha, WI)",45,MBA,2025
6365103,597120,Linfield Wildcats,597242,Carthage Firebirds,597120,4,top,Porter fouled out to lf.,27,2025-03-08T00:00:00-05:00,"Augie Schmidt Field (Kenosha, WI)",45,MBA,2025
6365103,597120,Linfield Wildcats,597242,Carthage Firebirds,597120,4,top,T. Marr singled to left field; N. Holm advanced to third.,28,2025-03-08T00:00:00-05:00,"Augie Schmidt Field (Kenosha, WI)",45,MBA,2025
6365103,597120,Linfield Wildcats,597242,Carthage Firebirds,597120,4,top,T. Marr stole second.,29,2025-03-08T00:00:00-05:00,"Augie Schmidt Field (Kenosha, WI)",45,MBA,2025
6365103,597120,Linfield Wildcats,597242,Carthage Firebirds,597120,4,top,"J. Mansur singled to left field, RBI; T. Marr advanced to third; N. Holm scored.",30,2025-03-08T00:00:00-05:00,"Augie Schmidt Field (Kenosha, WI)",45,MBA,2025
6365103,597120,Linfield Wildcats,597242,Carthage Firebirds,597120,4,top,T. Eisenhut struck out swinging.,31,2025-03-08T00:00:00-05:00,"Augie Schmidt Field (Kenosha, WI)",45,MBA,2025
6365103,597120,Linfield Wildcats,597242,Carthage Firebirds,597120,4,top,R. Gullard walked; J. Mansur advanced to second.,32,2025-03-08T00:00:00-05:00,"Augie Schmidt Field (Kenosha, WI)",45,MBA,2025
6365103,597120,Linfield Wildcats,597242,Carthage Firebirds,597120,4,top,"H. Klingelho doubled to left field, 2 RBI; R. Gullard advanced to third; J. Mansur scored; T. Marr scored.",33,2025-03-08T00:00:00-05:00,"Augie Schmidt Field (Kenosha, WI)",45,MBA,2025
6365103,597120,Linfield Wildcats,597242,Carthage Firebirds,597120,4,top,M. Lewis grounded out to 1b unassisted.,34,2025-03-08T00:00:00-05:00,"Augie Schmidt Field (Kenosha, WI)",45,MBA,2025
6365103,597120,Linfield Wildcats,597242,Carthage Firebirds,597242,4,bot,J. Zuleger lined out to ss.,35,2025-03-08T00:00:00-05:00,"Augie Schmidt Field (Kenosha, WI)",45,MBA,2025
6365103,597120,Linfield Wildcats,597242,Carthage Firebirds,597242,4,bot,M. Felber struck out swinging.,36,2025-03-08T00:00:00-05:00,"Augie Schmidt Field (Kenosha, WI)",45,MBA,2025
6365103,597120,Linfield Wildcats,597242,Carthage Firebirds,597242,4,bot,Z. Tubbs reached first on an error by rf.,37,2025-03-08T00:00:00-05:00,"Augie Schmidt Field (Kenosha, WI)",45,MBA,2025
6365103,597120,Linfield Wildcats,597242,Carthage Firebirds,597242,4,bot,A. Gaca struck out swinging.,38,2025-03-08T00:00:00-05:00,"Augie Schmidt Field (Kenosha, WI)",45,MBA,2025
6365103,597120,Linfield Wildcats,597242,Carthage Firebirds,597120,5,top,E. Maris grounded out to p.,39,2025-03-08T00:00:00-05:00,"Augie Schmidt Field (Kenosha, WI)",45,MBA,2025
6365103,597120,Linfield Wildcats,597242,Carthage Firebirds,597120,5,top,N. Holm grounded out to ss.,40,2025-03-08T00:00:00-05:00,"Augie Schmidt Field (Kenosha, WI)",45,MBA,2025
6365103,597120,Linfield Wildcats,597242,Carthage Firebirds,597120,5,top,Porter struck out swinging.,41,2025-03-08T00:00:00-05:00,"Augie Schmidt Field (Kenosha, WI)",45,MBA,2025
6365103,597120,Linfield Wildcats,597242,Carthage Firebirds,597242,5,bot,K. Krekling lined out to cf.,42,2025-03-08T00:00:00-05:00,"Augie Schmidt Field (Kenosha, WI)",45,MBA,2025
6365103,597120,Linfield Wildcats,597242,Carthage Firebirds,597242,5,bot,"D. Knecht singled down the rf line, advanced to second on an error by 2b.",43,2025-03-08T00:00:00-05:00,"Augie Schmidt Field (Kenosha, WI)",45,MBA,2025
6365103,597120,Linfield Wildcats,597242,Carthage Firebirds,597242,5,bot,C. Callahan struck out swinging.,44,2025-03-08T00:00:00-05:00,"Augie Schmidt Field (Kenosha, WI)",45,MBA,2025
6365103,597120,Linfield Wildcats,597242,Carthage Firebirds,597242,5,bot,P. Moser struck out swinging.,45,2025-03-08T00:00:00-05:00,"Augie Schmidt Field (Kenosha, WI)",45,MBA,2025
6365103,597120,Linfield Wildcats,597242,Carthage Firebirds,597120,6,top,"T. Marr singled to left field, advanced to second on a throwing error by lf.",46,2025-03-08T00:00:00-05:00,"Augie Schmidt Field (Kenosha, WI)",45,MBA,2025
6365103,597120,Linfield Wildcats,597242,Carthage Firebirds,597120,6,top,J. Mansur reached first on an error by lf; T. Marr advanced to third.,47,2025-03-08T00:00:00-05:00,"Augie Schmidt Field (Kenosha, WI)",45,MBA,2025
6365103,597120,Linfield Wildcats,597242,Carthage Firebirds,597120,6,top,N. Kassler pinch hit for T. Eisenhut.,48,2025-03-08T00:00:00-05:00,"Augie Schmidt Field (Kenosha, WI)",45,MBA,2025
6365103,597120,Linfield Wildcats,597242,Carthage Firebirds,597120,6,top,"N. Kassler homered to right center, 3 RBI; J. Mansur scored; T. Marr scored, unearned.",49,2025-03-08T00:00:00-05:00,"Augie Schmidt Field (Kenosha, WI)",45,MBA,2025
6365103,597120,Linfield Wildcats,597242,Carthage Firebirds,597120,6,top,R. Gullard flied out to cf.,50,2025-03-08T00:00:00-05:00,"Augie Schmidt Field (Kenosha, WI)",45,MBA,2025
6365103,597120,Linfield Wildcats,597242,Carthage Firebirds,597120,6,top,H. Klingelho struck out swinging.,51,2025-03-08T00:00:00-05:00,"Augie Schmidt Field (Kenosha, WI)",45,MBA,2025
6365103,597120,Linfield Wildcats,597242,Carthage Firebirds,597120,6,top,J. Hartman to p for B. Schaum.,52,2025-03-08T00:00:00-05:00,"Augie Schmidt Field (Kenosha, WI)",45,MBA,2025
6365103,597120,Linfield Wildcats,597242,Carthage Firebirds,597120,6,top,M. Lewis struck out swinging.,53,2025-03-08T00:00:00-05:00,"Augie Schmidt Field (Kenosha, WI)",45,MBA,2025
6365103,597120,Linfield Wildcats,597242,Carthage Firebirds,597242,6,bot,N. Kassler to 2b.,54,2025-03-08T00:00:00-05:00,"Augie Schmidt Field (Kenosha, WI)",45,MBA,2025
6365103,597120,Linfield Wildcats,597242,Carthage Firebirds,597242,6,bot,M. Cairo struck out swinging.,55,2025-03-08T00:00:00-05:00,"Augie Schmidt Field (Kenosha, WI)",45,MBA,2025
6365103,597120,Linfield Wildcats,597242,Carthage Firebirds,597242,6,bot,J. Zuleger walked.,56,2025-03-08T00:00:00-05:00,"Augie Schmidt Field (Kenosha, WI)",45,MBA,2025
6365103,597120,Linfield Wildcats,597242,Carthage Firebirds,597242,6,bot,M. Felber struck out looking.,57,2025-03-08T00:00:00-05:00,"Augie Schmidt Field (Kenosha, WI)",45,MBA,2025
6365103,597120,Linfield Wildcats,597242,Carthage Firebirds,597242,6,bot,Z. Tubbs struck out swinging.,58,2025-03-08T00:00:00-05:00,"Augie Schmidt Field (Kenosha, WI)",45,MBA,2025
6365103,597120,Linfield Wildcats,597242,Carthage Firebirds,597120,7,top,J. Lindenmut to p for J. Hartman.,59,2025-03-08T00:00:00-05:00,"Augie Schmidt Field (Kenosha, WI)",45,MBA,2025
6365103,597120,Linfield Wildcats,597242,Carthage Firebirds,597120,7,top,E. Maris struck out swinging.,60,2025-03-08T00:00:00-05:00,"Augie Schmidt Field (Kenosha, WI)",45,MBA,2025
6365103,597120,Linfield Wildcats,597242,Carthage Firebirds,597120,7,top,N. Holm grounded out to 3b.,61,2025-03-08T00:00:00-05:00,"Augie Schmidt Field (Kenosha, WI)",45,MBA,2025
6365103,597120,Linfield Wildcats,597242,Carthage Firebirds,597120,7,top,Porter struck out swinging.,62,2025-03-08T00:00:00-05:00,"Augie Schmidt Field (Kenosha, WI)",45,MBA,2025
6365103,597120,Linfield Wildcats,597242,Carthage Firebirds,597242,7,bot,A. Gaca reached first on an error by 1b.,63,2025-03-08T00:00:00-05:00,"Augie Schmidt Field (Kenosha, WI)",45,MBA,2025
6365103,597120,Linfield Wildcats,597242,Carthage Firebirds,597242,7,bot,K. Krekling flied out to rf.,64,2025-03-08T00:00:00-05:00,"Augie Schmidt Field (Kenosha, WI)",45,MBA,2025
6365103,597120,Linfield Wildcats,597242,Carthage Firebirds,597242,7,bot,D. Knecht flied out to rf.,65,2025-03-08T00:00:00-05:00,"Augie Schmidt Field (Kenosha, WI)",45,MBA,2025
6365103,597120,Linfield Wildcats,597242,Carthage Firebirds,597242,7,bot,C. Callahan reached on a fielder's choice; A. Gaca out at second ss to 2b.,66,2025-03-08T00:00:00-05:00,"Augie Schmidt Field (Kenosha, WI)",45,MBA,2025
6365103,597120,Linfield Wildcats,597242,Carthage Firebirds,597120,8,top,T. Zastrow to p for J. Lindenmut.,67,2025-03-08T00:00:00-05:00,"Augie Schmidt Field (Kenosha, WI)",45,MBA,2025
6365103,597120,Linfield Wildcats,597242,Carthage Firebirds,597120,8,top,T. Marr doubled to left field.,68,2025-03-08T00:00:00-05:00,"Augie Schmidt Field (Kenosha, WI)",45,MBA,2025
6365103,597120,Linfield Wildcats,597242,Carthage Firebirds,597120,8,top,J. Mansur singled to left field; T. Marr advanced to third.,69,2025-03-08T00:00:00-05:00,"Augie Schmidt Field (Kenosha, WI)",45,MBA,2025
6365103,597120,Linfield Wildcats,597242,Carthage Firebirds,597120,8,top,N. Kassler struck out swinging; J. Mansur out at second 1b unassisted.,70,2025-03-08T00:00:00-05:00,"Augie Schmidt Field (Kenosha, WI)",45,MBA,2025
6365103,597120,Linfield Wildcats,597242,Carthage Firebirds,597120,8,top,R. Gullard struck out swinging.,71,2025-03-08T00:00:00-05:00,"Augie Schmidt Field (Kenosha, WI)",45,MBA,2025
6365103,597120,Linfield Wildcats,597242,Carthage Firebirds,597242,8,bot,Justice to p for J. Swenson.,72,2025-03-08T00:00:00-05:00,"Augie Schmidt Field (Kenosha, WI)",45,MBA,2025
6365103,597120,Linfield Wildcats,597242,Carthage Firebirds,597242,8,bot,P. Moser walked.,73,2025-03-08T00:00:00-05:00,"Augie Schmidt Field (Kenosha, WI)",45,MBA,2025
6365103,597120,Linfield Wildcats,597242,Carthage Firebirds,597242,8,bot,M. Cairo flied out to 2b.,74,2025-03-08T00:00:00-05:00,"Augie Schmidt Field (Kenosha, WI)",45,MBA,2025
6365103,597120,Linfield Wildcats,597242,Carthage Firebirds,597242,8,bot,J. Zuleger walked; P. Moser advanced to second.,75,2025-03-08T00:00:00-05:00,"Augie Schmidt Field (Kenosha, WI)",45,MBA,2025
6365103,597120,Linfield Wildcats,597242,Carthage Firebirds,597242,8,bot,M. Felber flied out to rf.,76,2025-03-08T00:00:00-05:00,"Augie Schmidt Field (Kenosha, WI)",45,MBA,2025
6365103,597120,Linfield Wildcats,597242,Carthage Firebirds,597242,8,bot,Z. Tubbs reached on a fielder's choice; J. Zuleger advanced to second; P. Moser out at third 3b unassisted.,77,2025-03-08T00:00:00-05:00,"Augie Schmidt Field (Kenosha, WI)",45,MBA,2025
6365103,597120,Linfield Wildcats,597242,Carthage Firebirds,597120,9,top,N. Caruso to p for T. Zastrow.,78,2025-03-08T00:00:00-05:00,"Augie Schmidt Field (Kenosha, WI)",45,MBA,2025
6365103,597120,Linfield Wildcats,597242,Carthage Firebirds,597120,9,top,H. Klingelho walked.,79,2025-03-08T00:00:00-05:00,"Augie Schmidt Field (Kenosha, WI)",45,MBA,2025
6365103,597120,Linfield Wildcats,597242,Carthage Firebirds,597120,9,top,J. Bui pinch hit for M. Lewis.,80,2025-03-08T00:00:00-05:00,"Augie Schmidt Field (Kenosha, WI)",45,MBA,2025
6365103,597120,Linfield Wildcats,597242,Carthage Firebirds,597120,9,top,H. Klingelho stole second.,81,2025-03-08T00:00:00-05:00,"Augie Schmidt Field (Kenosha, WI)",45,MBA,2025
6365103,597120,Linfield Wildcats,597242,Carthage Firebirds,597120,9,top,"H. Klingelho advanced to third on an error by p, failed pickoff attempt.",82,2025-03-08T00:00:00-05:00,"Augie Schmidt Field (Kenosha, WI)",45,MBA,2025
6365103,597120,Linfield Wildcats,597242,Carthage Firebirds,597120,9,top,H. Klingelho scored on a throwing error by cf.,83,2025-03-08T00:00:00-05:00,"Augie Schmidt Field (Kenosha, WI)",45,MBA,2025
6365103,597120,Linfield Wildcats,597242,Carthage Firebirds,597120,9,top,J. Bui walked.,84,2025-03-08T00:00:00-05:00,"Augie Schmidt Field (Kenosha, WI)",45,MBA,2025
6365103,597120,Linfield Wildcats,597242,Carthage Firebirds,597120,9,top,J. Bui stole second.,85,2025-03-08T00:00:00-05:00,"Augie Schmidt Field (Kenosha, WI)",45,MBA,2025
6365103,597120,Linfield Wildcats,597242,Carthage Firebirds,597120,9,top,E. Maris grounded out to ss; J. Bui advanced to third.,86,2025-03-08T00:00:00-05:00,"Augie Schmidt Field (Kenosha, WI)",45,MBA,2025
6365103,597120,Linfield Wildcats,597242,Carthage Firebirds,597120,9,top,N. Holm struck out swinging.,87,2025-03-08T00:00:00-05:00,"Augie Schmidt Field (Kenosha, WI)",45,MBA,2025
6365103,597120,Linfield Wildcats,597242,Carthage Firebirds,597120,9,top,Porter hit by pitch.,88,2025-03-08T00:00:00-05:00,"Augie Schmidt Field (Kenosha, WI)",45,MBA,2025
6365103,597120,Linfield Wildcats,597242,Carthage Firebirds,597120,9,top,"T. Marr singled to right field, RBI; Porter advanced to second; J. Bui scored.",89,2025-03-08T00:00:00-05:00,"Augie Schmidt Field (Kenosha, WI)",45,MBA,2025
6365103,597120,Linfield Wildcats,597242,Carthage Firebirds,597120,9,top,"J. Mansur singled down the lf line, RBI; T. Marr advanced to second; Porter scored.",90,2025-03-08T00:00:00-05:00,"Augie Schmidt Field (Kenosha, WI)",45,MBA,2025
6365103,597120,Linfield Wildcats,597242,Carthage Firebirds,597120,9,top,M. Santulli pinch hit for N. Kassler.,91,2025-03-08T00:00:00-05:00,"Augie Schmidt Field (Kenosha, WI)",45,MBA,2025
6365103,597120,Linfield Wildcats,597242,Carthage Firebirds,597120,9,top,"M. Santulli doubled down the lf line, 2 RBI; J. Mansur scored; T. Marr scored.",92,2025-03-08T00:00:00-05:00,"Augie Schmidt Field (Kenosha, WI)",45,MBA,2025
6365103,597120,Linfield Wildcats,597242,Carthage Firebirds,597120,9,top,K. Kokos to p for N. Caruso.,93,2025-03-08T00:00:00-05:00,"Augie Schmidt Field (Kenosha, WI)",45,MBA,2025
6365103,597120,Linfield Wildcats,597242,Carthage Firebirds,597120,9,top,"R. Gullard singled to left field, RBI; M. Santulli scored.",94,2025-03-08T00:00:00-05:00,"Augie Schmidt Field (Kenosha, WI)",45,MBA,2025
6365103,597120,Linfield Wildcats,597242,Carthage Firebirds,597120,9,top,"H. Klingelho doubled to center field, RBI; R. Gullard scored.",95,2025-03-08T00:00:00-05:00,"Augie Schmidt Field (Kenosha, WI)",45,MBA,2025
6365103,597120,Linfield Wildcats,597242,Carthage Firebirds,597120,9,top,"J. Bui singled to center field, out at second cf to 2b, RBI; H. Klingelho scored.",96,2025-03-08T00:00:00-05:00,"Augie Schmidt Field (Kenosha, WI)",45,MBA,2025
6365103,597120,Linfield Wildcats,597242,Carthage Firebirds,597242,9,bot,J. Bui to cf.,97,2025-03-08T00:00:00-05:00,"Augie Schmidt Field (Kenosha, WI)",45,MBA,2025
6365103,597120,Linfield Wildcats,597242,Carthage Firebirds,597242,9,bot,N. Alder to p for Justice.,98,2025-03-08T00:00:00-05:00,"Augie Schmidt Field (Kenosha, WI)",45,MBA,2025
6365103,597120,Linfield Wildcats,597242,Carthage Firebirds,597242,9,bot,M. Santulli to 2b.,99,2025-03-08T00:00:00-05:00,"Augie Schmidt Field (Kenosha, WI)",45,MBA,2025
6365103,597120,Linfield Wildcats,597242,Carthage Firebirds,597242,9,bot,A. Gaca struck out swinging.,100,2025-03-08T00:00:00-05:00,"Augie Schmidt Field (Kenosha, WI)",45,MBA,2025
6365103,597120,Linfield Wildcats,597242,Carthage Firebirds,597242,9,bot,C. Duarte pinch hit for K. Krekling.,101,2025-03-08T00:00:00-05:00,"Augie Schmidt Field (Kenosha, WI)",45,MBA,2025
6365103,597120,Linfield Wildcats,597242,Carthage Firebirds,597242,9,bot,C. Duarte walked.,102,2025-03-08T00:00:00-05:00,"Augie Schmidt Field (Kenosha, WI)",45,MBA,2025
6365103,597120,Linfield Wildcats,597242,Carthage Firebirds,597242,9,bot,M. Ciesla pinch hit for D. Knecht.,103,2025-03-08T00:00:00-05:00,"Augie Schmidt Field (Kenosha, WI)",45,MBA,2025
6365103,597120,Linfield Wildcats,597242,Carthage Firebirds,597242,9,bot,M. Ciesla hit by pitch; C. Duarte advanced to second.,104,2025-03-08T00:00:00-05:00,"Augie Schmidt Field (Kenosha, WI)",45,MBA,2025
6365103,597120,Linfield Wildcats,597242,Carthage Firebirds,597242,9,bot,E. Devine pinch hit for C. Callahan.,105,2025-03-08T00:00:00-05:00,"Augie Schmidt Field (Kenosha, WI)",45,MBA,2025
6365103,597120,Linfield Wildcats,597242,Carthage Firebirds,597242,9,bot,E. Devine struck out swinging.,106,2025-03-08T00:00:00-05:00,"Augie Schmidt Field (Kenosha, WI)",45,MBA,2025
6365103,597120,Linfield Wildcats,597242,Carthage Firebirds,597242,9,bot,J. Herget pinch hit for P. Moser.,107,2025-03-08T00:00:00-05:00,"Augie Schmidt Field (Kenosha, WI)",45,MBA,2025
6365103,597120,Linfield Wildcats,597242,Carthage Firebirds,597242,9,bot,J. Herget struck out swinging.,108,2025-03-08T00:00:00-05:00,"Augie Schmidt Field (Kenosha, WI)",45,MBA,2025
