game_id,away_team_id,away_team_name,home_team_id,home_team_name,batting_team,inning,top_bot,event_text,event_num,game_datetime,stadium_name,attendance,sport_id,season
6366254,596924,Pitt.-Johnstown Mountain Cats,596863,Bloomsburg Huskies,596924,1,top,Z. LeGars singled through the left side.,1,2025-03-14T00:00:00-04:00,"Danny Litwhiler Field (Bloomsburg, PA)",67,MBA,2025
6366254,596924,Pitt.-Johnstown Mountain Cats,596863,Bloomsburg Huskies,596924,1,top,B. Roberts singled through the left side3a Z. LeGars advanced to second.,2,2025-03-14T00:00:00-04:00,"Danny Litwhiler Field (Bloomsburg, PA)",67,MBA,2025
6366254,596924,Pitt.-Johnstown Mountain Cats,596863,Bloomsburg Huskies,596924,1,top,J. Turcovski infield fly to 3b.,3,2025-03-14T00:00:00-04:00,"Danny Litwhiler Field (Bloomsburg, PA)",67,MBA,2025
6366254,596924,Pitt.-Johnstown Mountain Cats,596863,Bloomsburg Huskies,596924,1,top,D. Boyles flied out to lf.,4,2025-03-14T00:00:00-04:00,"Danny Litwhiler Field (Bloomsburg, PA)",67,MBA,2025
6366254,596924,Pitt.-Johnstown Mountain Cats,596863,Bloomsburg Huskies,596924,1,top,"E. Rhodes singled to right field3a B. Roberts advanced to second3a Z. LeGars advanced to third, out at home rf to c.",5,2025-03-14T00:00:00-04:00,"Danny Litwhiler Field (Bloomsburg, PA)",67,MBA,2025
6366254,596924,Pitt.-Johnstown Mountain Cats,596863,Bloomsburg Huskies,596863,1,bot,C. Daniels flied out to rf.,6,2025-03-14T00:00:00-04:00,"Danny Litwhiler Field (Bloomsburg, PA)",67,MBA,2025
6366254,596924,Pitt.-Johnstown Mountain Cats,596863,Bloomsburg Huskies,596863,1,bot,B. Ebbert walked.,7,2025-03-14T00:00:00-04:00,"Danny Litwhiler Field (Bloomsburg, PA)",67,MBA,2025
6366254,596924,Pitt.-Johnstown Mountain Cats,596863,Bloomsburg Huskies,596863,1,bot,"G. Cristino doubled to left center, RBI3a B. Ebbert scored.",8,2025-03-14T00:00:00-04:00,"Danny Litwhiler Field (Bloomsburg, PA)",67,MBA,2025
6366254,596924,Pitt.-Johnstown Mountain Cats,596863,Bloomsburg Huskies,596863,1,bot,"G. Cristino advanced to third, failed pickoff attempt.",9,2025-03-14T00:00:00-04:00,"Danny Litwhiler Field (Bloomsburg, PA)",67,MBA,2025
6366254,596924,Pitt.-Johnstown Mountain Cats,596863,Bloomsburg Huskies,596863,1,bot,"B. Jones grounded out to ss, RBI3a G. Cristino scored.",10,2025-03-14T00:00:00-04:00,"Danny Litwhiler Field (Bloomsburg, PA)",67,MBA,2025
6366254,596924,Pitt.-Johnstown Mountain Cats,596863,Bloomsburg Huskies,596863,1,bot,"J. Wilson homered to left field, RBI.",11,2025-03-14T00:00:00-04:00,"Danny Litwhiler Field (Bloomsburg, PA)",67,MBA,2025
6366254,596924,Pitt.-Johnstown Mountain Cats,596863,Bloomsburg Huskies,596863,1,bot,J. Reifer flied out to lf.,12,2025-03-14T00:00:00-04:00,"Danny Litwhiler Field (Bloomsburg, PA)",67,MBA,2025
6366254,596924,Pitt.-Johnstown Mountain Cats,596863,Bloomsburg Huskies,596924,2,top,K. Reffner lined out to 2b.,13,2025-03-14T00:00:00-04:00,"Danny Litwhiler Field (Bloomsburg, PA)",67,MBA,2025
6366254,596924,Pitt.-Johnstown Mountain Cats,596863,Bloomsburg Huskies,596924,2,top,A. Steinbugl grounded out to 3b.,14,2025-03-14T00:00:00-04:00,"Danny Litwhiler Field (Bloomsburg, PA)",67,MBA,2025
6366254,596924,Pitt.-Johnstown Mountain Cats,596863,Bloomsburg Huskies,596924,2,top,J. Maun fouled out to c.,15,2025-03-14T00:00:00-04:00,"Danny Litwhiler Field (Bloomsburg, PA)",67,MBA,2025
6366254,596924,Pitt.-Johnstown Mountain Cats,596863,Bloomsburg Huskies,596863,2,bot,D.Balestrini walked.,16,2025-03-14T00:00:00-04:00,"Danny Litwhiler Field (Bloomsburg, PA)",67,MBA,2025
6366254,596924,Pitt.-Johnstown Mountain Cats,596863,Bloomsburg Huskies,596863,2,bot,C. O'Brien walked3a D.Balestrini advanced to second.,17,2025-03-14T00:00:00-04:00,"Danny Litwhiler Field (Bloomsburg, PA)",67,MBA,2025
6366254,596924,Pitt.-Johnstown Mountain Cats,596863,Bloomsburg Huskies,596863,2,bot,J. Levis grounded out to 2b3a C. O'Brien advanced to second3a D.Balestrini advanced to third.,18,2025-03-14T00:00:00-04:00,"Danny Litwhiler Field (Bloomsburg, PA)",67,MBA,2025
6366254,596924,Pitt.-Johnstown Mountain Cats,596863,Bloomsburg Huskies,596863,2,bot,C. O'Brien advanced to third3a D.Balestrini scored on a wild pitch.,19,2025-03-14T00:00:00-04:00,"Danny Litwhiler Field (Bloomsburg, PA)",67,MBA,2025
6366254,596924,Pitt.-Johnstown Mountain Cats,596863,Bloomsburg Huskies,596863,2,bot,C. Daniels lined into double play 3b unassisted3a C. O'Brien out on the play.,20,2025-03-14T00:00:00-04:00,"Danny Litwhiler Field (Bloomsburg, PA)",67,MBA,2025
6366254,596924,Pitt.-Johnstown Mountain Cats,596863,Bloomsburg Huskies,596924,3,top,C. Donaldson grounded out to 2b.,21,2025-03-14T00:00:00-04:00,"Danny Litwhiler Field (Bloomsburg, PA)",67,MBA,2025
6366254,596924,Pitt.-Johnstown Mountain Cats,596863,Bloomsburg Huskies,596924,3,top,Z. LeGars struck out swinging.,22,2025-03-14T00:00:00-04:00,"Danny Litwhiler Field (Bloomsburg, PA)",67,MBA,2025
6366254,596924,Pitt.-Johnstown Mountain Cats,596863,Bloomsburg Huskies,596924,3,top,B. Roberts grounded out to 2b.,23,2025-03-14T00:00:00-04:00,"Danny Litwhiler Field (Bloomsburg, PA)",67,MBA,2025
6366254,596924,Pitt.-Johnstown Mountain Cats,596863,Bloomsburg Huskies,596863,3,bot,B. Ebbert walked.,24,2025-03-14T00:00:00-04:00,"Danny Litwhiler Field (Bloomsburg, PA)",67,MBA,2025
6366254,596924,Pitt.-Johnstown Mountain Cats,596863,Bloomsburg Huskies,596863,3,bot,Z. Myers to p for S. Shuey.,25,2025-03-14T00:00:00-04:00,"Danny Litwhiler Field (Bloomsburg, PA)",67,MBA,2025
6366254,596924,Pitt.-Johnstown Mountain Cats,596863,Bloomsburg Huskies,596863,3,bot,"G. Cristino doubled to center field, RBI3a B. Ebbert scored.",26,2025-03-14T00:00:00-04:00,"Danny Litwhiler Field (Bloomsburg, PA)",67,MBA,2025
6366254,596924,Pitt.-Johnstown Mountain Cats,596863,Bloomsburg Huskies,596863,3,bot,"B. Jones homered to right center, 2 RBI3a G. Cristino scored.",27,2025-03-14T00:00:00-04:00,"Danny Litwhiler Field (Bloomsburg, PA)",67,MBA,2025
6366254,596924,Pitt.-Johnstown Mountain Cats,596863,Bloomsburg Huskies,596863,3,bot,J. Wilson flied out to rf.,28,2025-03-14T00:00:00-04:00,"Danny Litwhiler Field (Bloomsburg, PA)",67,MBA,2025
6366254,596924,Pitt.-Johnstown Mountain Cats,596863,Bloomsburg Huskies,596863,3,bot,J. Reifer flied out to lf.,29,2025-03-14T00:00:00-04:00,"Danny Litwhiler Field (Bloomsburg, PA)",67,MBA,2025
6366254,596924,Pitt.-Johnstown Mountain Cats,596863,Bloomsburg Huskies,596863,3,bot,D.Balestrini struck out swinging.,30,2025-03-14T00:00:00-04:00,"Danny Litwhiler Field (Bloomsburg, PA)",67,MBA,2025
6366254,596924,Pitt.-Johnstown Mountain Cats,596863,Bloomsburg Huskies,596924,4,top,J. Turcovski singled through the right side.,31,2025-03-14T00:00:00-04:00,"Danny Litwhiler Field (Bloomsburg, PA)",67,MBA,2025
6366254,596924,Pitt.-Johnstown Mountain Cats,596863,Bloomsburg Huskies,596924,4,top,D. Boyles flied out to rf to right center.,32,2025-03-14T00:00:00-04:00,"Danny Litwhiler Field (Bloomsburg, PA)",67,MBA,2025
6366254,596924,Pitt.-Johnstown Mountain Cats,596863,Bloomsburg Huskies,596924,4,top,E. Rhodes flied out to cf.,33,2025-03-14T00:00:00-04:00,"Danny Litwhiler Field (Bloomsburg, PA)",67,MBA,2025
6366254,596924,Pitt.-Johnstown Mountain Cats,596863,Bloomsburg Huskies,596924,4,top,J. Turcovski stole second.,34,2025-03-14T00:00:00-04:00,"Danny Litwhiler Field (Bloomsburg, PA)",67,MBA,2025
6366254,596924,Pitt.-Johnstown Mountain Cats,596863,Bloomsburg Huskies,596924,4,top,K. Reffner grounded out to 2b.,35,2025-03-14T00:00:00-04:00,"Danny Litwhiler Field (Bloomsburg, PA)",67,MBA,2025
6366254,596924,Pitt.-Johnstown Mountain Cats,596863,Bloomsburg Huskies,596863,4,bot,C. O'Brien walked.,36,2025-03-14T00:00:00-04:00,"Danny Litwhiler Field (Bloomsburg, PA)",67,MBA,2025
6366254,596924,Pitt.-Johnstown Mountain Cats,596863,Bloomsburg Huskies,596863,4,bot,J. Levis grounded out to ss3a C. O'Brien advanced to second.,37,2025-03-14T00:00:00-04:00,"Danny Litwhiler Field (Bloomsburg, PA)",67,MBA,2025
6366254,596924,Pitt.-Johnstown Mountain Cats,596863,Bloomsburg Huskies,596863,4,bot,C. Daniels grounded out to 2b3a C. O'Brien advanced to third.,38,2025-03-14T00:00:00-04:00,"Danny Litwhiler Field (Bloomsburg, PA)",67,MBA,2025
6366254,596924,Pitt.-Johnstown Mountain Cats,596863,Bloomsburg Huskies,596863,4,bot,B. Ebbert walked.,39,2025-03-14T00:00:00-04:00,"Danny Litwhiler Field (Bloomsburg, PA)",67,MBA,2025
6366254,596924,Pitt.-Johnstown Mountain Cats,596863,Bloomsburg Huskies,596863,4,bot,"G. Cristino singled through the right side, RBI3a B. Ebbert advanced to third3a C. O'Brien scored.",40,2025-03-14T00:00:00-04:00,"Danny Litwhiler Field (Bloomsburg, PA)",67,MBA,2025
6366254,596924,Pitt.-Johnstown Mountain Cats,596863,Bloomsburg Huskies,596863,4,bot,G. Cristino stole second.,41,2025-03-14T00:00:00-04:00,"Danny Litwhiler Field (Bloomsburg, PA)",67,MBA,2025
6366254,596924,Pitt.-Johnstown Mountain Cats,596863,Bloomsburg Huskies,596863,4,bot,B. Jones struck out swinging.,42,2025-03-14T00:00:00-04:00,"Danny Litwhiler Field (Bloomsburg, PA)",67,MBA,2025
6366254,596924,Pitt.-Johnstown Mountain Cats,596863,Bloomsburg Huskies,596924,5,top,A. Steinbugl grounded out to 2b.,43,2025-03-14T00:00:00-04:00,"Danny Litwhiler Field (Bloomsburg, PA)",67,MBA,2025
6366254,596924,Pitt.-Johnstown Mountain Cats,596863,Bloomsburg Huskies,596924,5,top,J. Maun struck out swinging.,44,2025-03-14T00:00:00-04:00,"Danny Litwhiler Field (Bloomsburg, PA)",67,MBA,2025
6366254,596924,Pitt.-Johnstown Mountain Cats,596863,Bloomsburg Huskies,596924,5,top,C. Donaldson singled to right field.,45,2025-03-14T00:00:00-04:00,"Danny Litwhiler Field (Bloomsburg, PA)",67,MBA,2025
6366254,596924,Pitt.-Johnstown Mountain Cats,596863,Bloomsburg Huskies,596924,5,top,Z. LeGars singled to third base3a C. Donaldson advanced to second.,46,2025-03-14T00:00:00-04:00,"Danny Litwhiler Field (Bloomsburg, PA)",67,MBA,2025
6366254,596924,Pitt.-Johnstown Mountain Cats,596863,Bloomsburg Huskies,596924,5,top,"B. Roberts singled to left center, RBI3a Z. LeGars advanced to third3a C. Donaldson scored.",47,2025-03-14T00:00:00-04:00,"Danny Litwhiler Field (Bloomsburg, PA)",67,MBA,2025
6366254,596924,Pitt.-Johnstown Mountain Cats,596863,Bloomsburg Huskies,596924,5,top,"J. Turcovski homered to center field, 3 RBI3a B. Roberts scored3a Z. LeGars scored.",48,2025-03-14T00:00:00-04:00,"Danny Litwhiler Field (Bloomsburg, PA)",67,MBA,2025
6366254,596924,Pitt.-Johnstown Mountain Cats,596863,Bloomsburg Huskies,596924,5,top,D. Boyles singled through the right side.,49,2025-03-14T00:00:00-04:00,"Danny Litwhiler Field (Bloomsburg, PA)",67,MBA,2025
6366254,596924,Pitt.-Johnstown Mountain Cats,596863,Bloomsburg Huskies,596924,5,top,E. Rhodes singled through the right side3a D. Boyles advanced to third.,50,2025-03-14T00:00:00-04:00,"Danny Litwhiler Field (Bloomsburg, PA)",67,MBA,2025
6366254,596924,Pitt.-Johnstown Mountain Cats,596863,Bloomsburg Huskies,596924,5,top,"K. Reffner doubled to right center, 2 RBI3a E. Rhodes scored3a D. Boyles scored.",51,2025-03-14T00:00:00-04:00,"Danny Litwhiler Field (Bloomsburg, PA)",67,MBA,2025
6366254,596924,Pitt.-Johnstown Mountain Cats,596863,Bloomsburg Huskies,596924,5,top,B. Hammaker to p for R. Powers.,52,2025-03-14T00:00:00-04:00,"Danny Litwhiler Field (Bloomsburg, PA)",67,MBA,2025
6366254,596924,Pitt.-Johnstown Mountain Cats,596863,Bloomsburg Huskies,596924,5,top,A. Steinbugl fouled out to p.,53,2025-03-14T00:00:00-04:00,"Danny Litwhiler Field (Bloomsburg, PA)",67,MBA,2025
6366254,596924,Pitt.-Johnstown Mountain Cats,596863,Bloomsburg Huskies,596863,5,bot,"J. Wilson homered to left field, RBI.",54,2025-03-14T00:00:00-04:00,"Danny Litwhiler Field (Bloomsburg, PA)",67,MBA,2025
6366254,596924,Pitt.-Johnstown Mountain Cats,596863,Bloomsburg Huskies,596863,5,bot,"J. Reifer homered to left field, RBI.",55,2025-03-14T00:00:00-04:00,"Danny Litwhiler Field (Bloomsburg, PA)",67,MBA,2025
6366254,596924,Pitt.-Johnstown Mountain Cats,596863,Bloomsburg Huskies,596863,5,bot,D.Balestrini walked.,56,2025-03-14T00:00:00-04:00,"Danny Litwhiler Field (Bloomsburg, PA)",67,MBA,2025
6366254,596924,Pitt.-Johnstown Mountain Cats,596863,Bloomsburg Huskies,596863,5,bot,M. Flinn to p for Z. Myers.,57,2025-03-14T00:00:00-04:00,"Danny Litwhiler Field (Bloomsburg, PA)",67,MBA,2025
6366254,596924,Pitt.-Johnstown Mountain Cats,596863,Bloomsburg Huskies,596863,5,bot,D.Balestrini advanced to second on a wild pitch.,58,2025-03-14T00:00:00-04:00,"Danny Litwhiler Field (Bloomsburg, PA)",67,MBA,2025
6366254,596924,Pitt.-Johnstown Mountain Cats,596863,Bloomsburg Huskies,596863,5,bot,C. O'Brien walked.,59,2025-03-14T00:00:00-04:00,"Danny Litwhiler Field (Bloomsburg, PA)",67,MBA,2025
6366254,596924,Pitt.-Johnstown Mountain Cats,596863,Bloomsburg Huskies,596863,5,bot,"J. Levis grounded out to p, SAC, bunt3a C. O'Brien advanced to second3a D.Balestrini advanced to third.",60,2025-03-14T00:00:00-04:00,"Danny Litwhiler Field (Bloomsburg, PA)",67,MBA,2025
6366254,596924,Pitt.-Johnstown Mountain Cats,596863,Bloomsburg Huskies,596863,5,bot,"C. Daniels flied out to lf, SF, RBI3a D.Balestrini scored.",61,2025-03-14T00:00:00-04:00,"Danny Litwhiler Field (Bloomsburg, PA)",67,MBA,2025
6366254,596924,Pitt.-Johnstown Mountain Cats,596863,Bloomsburg Huskies,596863,5,bot,C. O'Brien advanced to third on a wild pitch.,62,2025-03-14T00:00:00-04:00,"Danny Litwhiler Field (Bloomsburg, PA)",67,MBA,2025
6366254,596924,Pitt.-Johnstown Mountain Cats,596863,Bloomsburg Huskies,596863,5,bot,B. Ebbert walked.,63,2025-03-14T00:00:00-04:00,"Danny Litwhiler Field (Bloomsburg, PA)",67,MBA,2025
6366254,596924,Pitt.-Johnstown Mountain Cats,596863,Bloomsburg Huskies,596863,5,bot,G. Cristino popped up to ss.,64,2025-03-14T00:00:00-04:00,"Danny Litwhiler Field (Bloomsburg, PA)",67,MBA,2025
6366254,596924,Pitt.-Johnstown Mountain Cats,596863,Bloomsburg Huskies,596924,6,top,J. Maun flied out to cf.,65,2025-03-14T00:00:00-04:00,"Danny Litwhiler Field (Bloomsburg, PA)",67,MBA,2025
6366254,596924,Pitt.-Johnstown Mountain Cats,596863,Bloomsburg Huskies,596924,6,top,C. Donaldson struck out swinging.,66,2025-03-14T00:00:00-04:00,"Danny Litwhiler Field (Bloomsburg, PA)",67,MBA,2025
6366254,596924,Pitt.-Johnstown Mountain Cats,596863,Bloomsburg Huskies,596924,6,top,Z. LeGars flied out to cf.,67,2025-03-14T00:00:00-04:00,"Danny Litwhiler Field (Bloomsburg, PA)",67,MBA,2025
6366254,596924,Pitt.-Johnstown Mountain Cats,596863,Bloomsburg Huskies,596863,6,bot,Z. Freedman to p for M. Flinn.,68,2025-03-14T00:00:00-04:00,"Danny Litwhiler Field (Bloomsburg, PA)",67,MBA,2025
6366254,596924,Pitt.-Johnstown Mountain Cats,596863,Bloomsburg Huskies,596863,6,bot,B. Jones struck out looking.,69,2025-03-14T00:00:00-04:00,"Danny Litwhiler Field (Bloomsburg, PA)",67,MBA,2025
6366254,596924,Pitt.-Johnstown Mountain Cats,596863,Bloomsburg Huskies,596863,6,bot,J. Wilson flied out to 1b.,70,2025-03-14T00:00:00-04:00,"Danny Litwhiler Field (Bloomsburg, PA)",67,MBA,2025
6366254,596924,Pitt.-Johnstown Mountain Cats,596863,Bloomsburg Huskies,596863,6,bot,"J. Reifer homered to left field, RBI.",71,2025-03-14T00:00:00-04:00,"Danny Litwhiler Field (Bloomsburg, PA)",67,MBA,2025
6366254,596924,Pitt.-Johnstown Mountain Cats,596863,Bloomsburg Huskies,596863,6,bot,D.Balestrini walked.,72,2025-03-14T00:00:00-04:00,"Danny Litwhiler Field (Bloomsburg, PA)",67,MBA,2025
6366254,596924,Pitt.-Johnstown Mountain Cats,596863,Bloomsburg Huskies,596863,6,bot,D.Balestrini advanced to second on a wild pitch.,73,2025-03-14T00:00:00-04:00,"Danny Litwhiler Field (Bloomsburg, PA)",67,MBA,2025
6366254,596924,Pitt.-Johnstown Mountain Cats,596863,Bloomsburg Huskies,596863,6,bot,C. O'Brien struck out swinging.,74,2025-03-14T00:00:00-04:00,"Danny Litwhiler Field (Bloomsburg, PA)",67,MBA,2025
6366254,596924,Pitt.-Johnstown Mountain Cats,596863,Bloomsburg Huskies,596924,7,top,A. Trommer to lf for D.Balestrini.,75,2025-03-14T00:00:00-04:00,"Danny Litwhiler Field (Bloomsburg, PA)",67,MBA,2025
6366254,596924,Pitt.-Johnstown Mountain Cats,596863,Bloomsburg Huskies,596924,7,top,B. Roberts lined out to 1b.,76,2025-03-14T00:00:00-04:00,"Danny Litwhiler Field (Bloomsburg, PA)",67,MBA,2025
6366254,596924,Pitt.-Johnstown Mountain Cats,596863,Bloomsburg Huskies,596924,7,top,J. Turcovski flied out to cf.,77,2025-03-14T00:00:00-04:00,"Danny Litwhiler Field (Bloomsburg, PA)",67,MBA,2025
6366254,596924,Pitt.-Johnstown Mountain Cats,596863,Bloomsburg Huskies,596924,7,top,D. Boyles struck out swinging.,78,2025-03-14T00:00:00-04:00,"Danny Litwhiler Field (Bloomsburg, PA)",67,MBA,2025
