game_id,away_team_id,away_team_name,home_team_id,home_team_name,batting_team,inning,top_bot,event_text,event_num,game_datetime,stadium_name,attendance,sport_id,season
6368744,596682,Southern Ill. Salukis,596498,Bradley Braves,596682,1,top,J. Bach grounded out to 2b.,1,2025-03-29T00:00:00-04:00,"Dozer Park (Peoria, IL)",313,MBA,2025
6368744,596682,Southern Ill. Salukis,596498,Bradley Braves,596682,1,top,M. Schark singled to left field.,2,2025-03-29T00:00:00-04:00,"Dozer Park (Peoria, IL)",313,MBA,2025
6368744,596682,Southern Ill. Salukis,596498,Bradley Braves,596682,1,top,M. Schark advanced to second on a wild pitch.,3,2025-03-29T00:00:00-04:00,"Dozer Park (Peoria, IL)",313,MBA,2025
6368744,596682,Southern Ill. Salukis,596498,Bradley Braves,596682,1,top,G. Petrucell struck out looking.,4,2025-03-29T00:00:00-04:00,"Dozer Park (Peoria, IL)",313,MBA,2025
6368744,596682,Southern Ill. Salukis,596498,Bradley Braves,596682,1,top,J. Lemm struck out swinging.,5,2025-03-29T00:00:00-04:00,"Dozer Park (Peoria, IL)",313,MBA,2025
6368744,596682,Southern Ill. Salukis,596498,Bradley Braves,596498,1,bot,"J. Smith struck out swinging, out at first c to 1b.",6,2025-03-29T00:00:00-04:00,"Dozer Park (Peoria, IL)",313,MBA,2025
6368744,596682,Southern Ill. Salukis,596498,Bradley Braves,596498,1,bot,C. Smith singled up the middle.,7,2025-03-29T00:00:00-04:00,"Dozer Park (Peoria, IL)",313,MBA,2025
6368744,596682,Southern Ill. Salukis,596498,Bradley Braves,596498,1,bot,M. Breidenba flied out to lf.,8,2025-03-29T00:00:00-04:00,"Dozer Park (Peoria, IL)",313,MBA,2025
6368744,596682,Southern Ill. Salukis,596498,Bradley Braves,596498,1,bot,"B. Atkinson homered to right field, 2 RBI3a C. Smith scored.",9,2025-03-29T00:00:00-04:00,"Dozer Park (Peoria, IL)",313,MBA,2025
6368744,596682,Southern Ill. Salukis,596498,Bradley Braves,596498,1,bot,M. Ball grounded out to 3b.,10,2025-03-29T00:00:00-04:00,"Dozer Park (Peoria, IL)",313,MBA,2025
6368744,596682,Southern Ill. Salukis,596498,Bradley Braves,596682,2,top,M. Mylott popped out to 1b.,11,2025-03-29T00:00:00-04:00,"Dozer Park (Peoria, IL)",313,MBA,2025
6368744,596682,Southern Ill. Salukis,596498,Bradley Braves,596682,2,top,C. Lofton walked.,12,2025-03-29T00:00:00-04:00,"Dozer Park (Peoria, IL)",313,MBA,2025
6368744,596682,Southern Ill. Salukis,596498,Bradley Braves,596682,2,top,T. Simay singled through the right side3a C. Lofton advanced to third.,13,2025-03-29T00:00:00-04:00,"Dozer Park (Peoria, IL)",313,MBA,2025
6368744,596682,Southern Ill. Salukis,596498,Bradley Braves,596682,2,top,"M. Schwalbac singled to center field, RBI3a T. Simay advanced to third3a C. Lofton scored.",14,2025-03-29T00:00:00-04:00,"Dozer Park (Peoria, IL)",313,MBA,2025
6368744,596682,Southern Ill. Salukis,596498,Bradley Braves,596682,2,top,"J. Holder singled down the rf line, RBI3a M. Schwalbac advanced to third3a T. Simay scored.",15,2025-03-29T00:00:00-04:00,"Dozer Park (Peoria, IL)",313,MBA,2025
6368744,596682,Southern Ill. Salukis,596498,Bradley Braves,596682,2,top,"J. Bach singled to left field, RBI3a J. Holder advanced to third3a M. Schwalbac scored.",16,2025-03-29T00:00:00-04:00,"Dozer Park (Peoria, IL)",313,MBA,2025
6368744,596682,Southern Ill. Salukis,596498,Bradley Braves,596682,2,top,J. Bach stole second.,17,2025-03-29T00:00:00-04:00,"Dozer Park (Peoria, IL)",313,MBA,2025
6368744,596682,Southern Ill. Salukis,596498,Bradley Braves,596682,2,top,"M. Schark grounded out to ss, RBI3a J. Holder scored.",18,2025-03-29T00:00:00-04:00,"Dozer Park (Peoria, IL)",313,MBA,2025
6368744,596682,Southern Ill. Salukis,596498,Bradley Braves,596682,2,top,G. Petrucell hit by pitch.,19,2025-03-29T00:00:00-04:00,"Dozer Park (Peoria, IL)",313,MBA,2025
6368744,596682,Southern Ill. Salukis,596498,Bradley Braves,596682,2,top,J. Lemm popped up to 3b.,20,2025-03-29T00:00:00-04:00,"Dozer Park (Peoria, IL)",313,MBA,2025
6368744,596682,Southern Ill. Salukis,596498,Bradley Braves,596498,2,bot,B. Durbin grounded out to 1b unassisted.,21,2025-03-29T00:00:00-04:00,"Dozer Park (Peoria, IL)",313,MBA,2025
6368744,596682,Southern Ill. Salukis,596498,Bradley Braves,596498,2,bot,T. O'Brien flied out to cf.,22,2025-03-29T00:00:00-04:00,"Dozer Park (Peoria, IL)",313,MBA,2025
6368744,596682,Southern Ill. Salukis,596498,Bradley Braves,596498,2,bot,N. Hosie out at first 1b to p.,23,2025-03-29T00:00:00-04:00,"Dozer Park (Peoria, IL)",313,MBA,2025
6368744,596682,Southern Ill. Salukis,596498,Bradley Braves,596682,3,top,M. Mylott singled to first base.,24,2025-03-29T00:00:00-04:00,"Dozer Park (Peoria, IL)",313,MBA,2025
6368744,596682,Southern Ill. Salukis,596498,Bradley Braves,596682,3,top,C. Lofton walked3a M. Mylott advanced to second.,25,2025-03-29T00:00:00-04:00,"Dozer Park (Peoria, IL)",313,MBA,2025
6368744,596682,Southern Ill. Salukis,596498,Bradley Braves,596682,3,top,T. Simay grounded into double play 3b to 1b3a C. Lofton advanced to second3a M. Mylott out on the play.,26,2025-03-29T00:00:00-04:00,"Dozer Park (Peoria, IL)",313,MBA,2025
6368744,596682,Southern Ill. Salukis,596498,Bradley Braves,596682,3,top,"M. Schwalbac singled to right field, RBI3a C. Lofton scored.",27,2025-03-29T00:00:00-04:00,"Dozer Park (Peoria, IL)",313,MBA,2025
6368744,596682,Southern Ill. Salukis,596498,Bradley Braves,596682,3,top,J. Holder walked3a M. Schwalbac advanced to second.,28,2025-03-29T00:00:00-04:00,"Dozer Park (Peoria, IL)",313,MBA,2025
6368744,596682,Southern Ill. Salukis,596498,Bradley Braves,596682,3,top,J. Bach popped up to 2b.,29,2025-03-29T00:00:00-04:00,"Dozer Park (Peoria, IL)",313,MBA,2025
6368744,596682,Southern Ill. Salukis,596498,Bradley Braves,596498,3,bot,"N. Fleckenst singled to left field, advanced to second on a fielding error by lf.",30,2025-03-29T00:00:00-04:00,"Dozer Park (Peoria, IL)",313,MBA,2025
6368744,596682,Southern Ill. Salukis,596498,Bradley Braves,596498,3,bot,J. Smith flied out to cf.,31,2025-03-29T00:00:00-04:00,"Dozer Park (Peoria, IL)",313,MBA,2025
6368744,596682,Southern Ill. Salukis,596498,Bradley Braves,596498,3,bot,C. Smith walked.,32,2025-03-29T00:00:00-04:00,"Dozer Park (Peoria, IL)",313,MBA,2025
6368744,596682,Southern Ill. Salukis,596498,Bradley Braves,596498,3,bot,C. Smith advanced to second3a N. Fleckenst advanced to third on a wild pitch.,33,2025-03-29T00:00:00-04:00,"Dozer Park (Peoria, IL)",313,MBA,2025
6368744,596682,Southern Ill. Salukis,596498,Bradley Braves,596498,3,bot,M. Breidenba struck out looking.,34,2025-03-29T00:00:00-04:00,"Dozer Park (Peoria, IL)",313,MBA,2025
6368744,596682,Southern Ill. Salukis,596498,Bradley Braves,596498,3,bot,B. Atkinson struck out looking.,35,2025-03-29T00:00:00-04:00,"Dozer Park (Peoria, IL)",313,MBA,2025
6368744,596682,Southern Ill. Salukis,596498,Bradley Braves,596682,4,top,K. Unruh to rf for M. Breidenba.,36,2025-03-29T00:00:00-04:00,"Dozer Park (Peoria, IL)",313,MBA,2025
6368744,596682,Southern Ill. Salukis,596498,Bradley Braves,596682,4,top,M. Schark struck out looking.,37,2025-03-29T00:00:00-04:00,"Dozer Park (Peoria, IL)",313,MBA,2025
6368744,596682,Southern Ill. Salukis,596498,Bradley Braves,596682,4,top,G. Petrucell popped out to 3b.,38,2025-03-29T00:00:00-04:00,"Dozer Park (Peoria, IL)",313,MBA,2025
6368744,596682,Southern Ill. Salukis,596498,Bradley Braves,596682,4,top,J. Lemm grounded out to ss.,39,2025-03-29T00:00:00-04:00,"Dozer Park (Peoria, IL)",313,MBA,2025
6368744,596682,Southern Ill. Salukis,596498,Bradley Braves,596498,4,bot,M. Ball flied out to lf.,40,2025-03-29T00:00:00-04:00,"Dozer Park (Peoria, IL)",313,MBA,2025
6368744,596682,Southern Ill. Salukis,596498,Bradley Braves,596498,4,bot,B. Durbin struck out swinging.,41,2025-03-29T00:00:00-04:00,"Dozer Park (Peoria, IL)",313,MBA,2025
6368744,596682,Southern Ill. Salukis,596498,Bradley Braves,596498,4,bot,T. O'Brien grounded out to ss.,42,2025-03-29T00:00:00-04:00,"Dozer Park (Peoria, IL)",313,MBA,2025
6368744,596682,Southern Ill. Salukis,596498,Bradley Braves,596682,5,top,"M. Mylott doubled to center field, ground-rule.",43,2025-03-29T00:00:00-04:00,"Dozer Park (Peoria, IL)",313,MBA,2025
6368744,596682,Southern Ill. Salukis,596498,Bradley Braves,596682,5,top,C. Lofton grounded out to 1b unassisted3a M. Mylott advanced to third.,44,2025-03-29T00:00:00-04:00,"Dozer Park (Peoria, IL)",313,MBA,2025
6368744,596682,Southern Ill. Salukis,596498,Bradley Braves,596682,5,top,"T. Simay grounded out to 2b, RBI3a M. Mylott scored.",45,2025-03-29T00:00:00-04:00,"Dozer Park (Peoria, IL)",313,MBA,2025
6368744,596682,Southern Ill. Salukis,596498,Bradley Braves,596682,5,top,M. Schwalbac doubled to right field.,46,2025-03-29T00:00:00-04:00,"Dozer Park (Peoria, IL)",313,MBA,2025
6368744,596682,Southern Ill. Salukis,596498,Bradley Braves,596682,5,top,G. Thompson to p for J. Vaughn.,47,2025-03-29T00:00:00-04:00,"Dozer Park (Peoria, IL)",313,MBA,2025
6368744,596682,Southern Ill. Salukis,596498,Bradley Braves,596682,5,top,"J. Holder singled to left field, RBI3a M. Schwalbac scored.",48,2025-03-29T00:00:00-04:00,"Dozer Park (Peoria, IL)",313,MBA,2025
6368744,596682,Southern Ill. Salukis,596498,Bradley Braves,596682,5,top,J. Bach grounded out to 1b unassisted.,49,2025-03-29T00:00:00-04:00,"Dozer Park (Peoria, IL)",313,MBA,2025
6368744,596682,Southern Ill. Salukis,596498,Bradley Braves,596498,5,bot,N. Hosie flied out to cf.,50,2025-03-29T00:00:00-04:00,"Dozer Park (Peoria, IL)",313,MBA,2025
6368744,596682,Southern Ill. Salukis,596498,Bradley Braves,596498,5,bot,N. Fleckenst singled to first base.,51,2025-03-29T00:00:00-04:00,"Dozer Park (Peoria, IL)",313,MBA,2025
6368744,596682,Southern Ill. Salukis,596498,Bradley Braves,596498,5,bot,J. Smith popped up to ss.,52,2025-03-29T00:00:00-04:00,"Dozer Park (Peoria, IL)",313,MBA,2025
6368744,596682,Southern Ill. Salukis,596498,Bradley Braves,596498,5,bot,N. Fleckenst stole second.,53,2025-03-29T00:00:00-04:00,"Dozer Park (Peoria, IL)",313,MBA,2025
6368744,596682,Southern Ill. Salukis,596498,Bradley Braves,596498,5,bot,"C. Smith singled through the left side, advanced to second on the throw, RBI3a N. Fleckenst scored.",54,2025-03-29T00:00:00-04:00,"Dozer Park (Peoria, IL)",313,MBA,2025
6368744,596682,Southern Ill. Salukis,596498,Bradley Braves,596498,5,bot,K. Unruh grounded out to ss.,55,2025-03-29T00:00:00-04:00,"Dozer Park (Peoria, IL)",313,MBA,2025
6368744,596682,Southern Ill. Salukis,596498,Bradley Braves,596682,6,top,M. Schark grounded out to 3b.,56,2025-03-29T00:00:00-04:00,"Dozer Park (Peoria, IL)",313,MBA,2025
6368744,596682,Southern Ill. Salukis,596498,Bradley Braves,596682,6,top,G. Petrucell flied out to rf.,57,2025-03-29T00:00:00-04:00,"Dozer Park (Peoria, IL)",313,MBA,2025
6368744,596682,Southern Ill. Salukis,596498,Bradley Braves,596682,6,top,J. Lemm grounded out to 1b unassisted.,58,2025-03-29T00:00:00-04:00,"Dozer Park (Peoria, IL)",313,MBA,2025
6368744,596682,Southern Ill. Salukis,596498,Bradley Braves,596498,6,bot,D. Petrey to p for A. Nigut.,59,2025-03-29T00:00:00-04:00,"Dozer Park (Peoria, IL)",313,MBA,2025
6368744,596682,Southern Ill. Salukis,596498,Bradley Braves,596498,6,bot,B. Atkinson singled to right field.,60,2025-03-29T00:00:00-04:00,"Dozer Park (Peoria, IL)",313,MBA,2025
6368744,596682,Southern Ill. Salukis,596498,Bradley Braves,596498,6,bot,M. Ball lined into double play 3b to 1b3a B. Atkinson out on the play.,61,2025-03-29T00:00:00-04:00,"Dozer Park (Peoria, IL)",313,MBA,2025
6368744,596682,Southern Ill. Salukis,596498,Bradley Braves,596498,6,bot,B. Durbin flied out to cf.,62,2025-03-29T00:00:00-04:00,"Dozer Park (Peoria, IL)",313,MBA,2025
6368744,596682,Southern Ill. Salukis,596498,Bradley Braves,596682,7,top,M. Mylott grounded out to ss.,63,2025-03-29T00:00:00-04:00,"Dozer Park (Peoria, IL)",313,MBA,2025
6368744,596682,Southern Ill. Salukis,596498,Bradley Braves,596682,7,top,C. Lofton singled to shortstop.,64,2025-03-29T00:00:00-04:00,"Dozer Park (Peoria, IL)",313,MBA,2025
6368744,596682,Southern Ill. Salukis,596498,Bradley Braves,596682,7,top,"T. Simay singled to center field, advanced to second on the throw3a C. Lofton advanced to third.",65,2025-03-29T00:00:00-04:00,"Dozer Park (Peoria, IL)",313,MBA,2025
6368744,596682,Southern Ill. Salukis,596498,Bradley Braves,596682,7,top,"M. Schwalbac singled to pitcher, RBI3a T. Simay advanced to third3a C. Lofton scored.",66,2025-03-29T00:00:00-04:00,"Dozer Park (Peoria, IL)",313,MBA,2025
6368744,596682,Southern Ill. Salukis,596498,Bradley Braves,596682,7,top,M. Schwalbac stole second.,67,2025-03-29T00:00:00-04:00,"Dozer Park (Peoria, IL)",313,MBA,2025
6368744,596682,Southern Ill. Salukis,596498,Bradley Braves,596682,7,top,J. Holder walked.,68,2025-03-29T00:00:00-04:00,"Dozer Park (Peoria, IL)",313,MBA,2025
6368744,596682,Southern Ill. Salukis,596498,Bradley Braves,596682,7,top,J. Bach struck out looking.,69,2025-03-29T00:00:00-04:00,"Dozer Park (Peoria, IL)",313,MBA,2025
6368744,596682,Southern Ill. Salukis,596498,Bradley Braves,596682,7,top,"M. Schark homered to right field, 4 RBI3a J. Holder scored3a M. Schwalbac scored3a T. Simay scored.",70,2025-03-29T00:00:00-04:00,"Dozer Park (Peoria, IL)",313,MBA,2025
6368744,596682,Southern Ill. Salukis,596498,Bradley Braves,596682,7,top,G. Petrucell singled to center field.,71,2025-03-29T00:00:00-04:00,"Dozer Park (Peoria, IL)",313,MBA,2025
6368744,596682,Southern Ill. Salukis,596498,Bradley Braves,596682,7,top,J. Stellano to p for G. Thompson.,72,2025-03-29T00:00:00-04:00,"Dozer Park (Peoria, IL)",313,MBA,2025
6368744,596682,Southern Ill. Salukis,596498,Bradley Braves,596682,7,top,J. Lemm hit by pitch3a G. Petrucell advanced to second.,73,2025-03-29T00:00:00-04:00,"Dozer Park (Peoria, IL)",313,MBA,2025
6368744,596682,Southern Ill. Salukis,596498,Bradley Braves,596682,7,top,M. Mylott reached on a fielder's choice3a J. Lemm out at second 2b unassisted.,74,2025-03-29T00:00:00-04:00,"Dozer Park (Peoria, IL)",313,MBA,2025
6368744,596682,Southern Ill. Salukis,596498,Bradley Braves,596498,7,bot,M. Irvine to p for D. Petrey.,75,2025-03-29T00:00:00-04:00,"Dozer Park (Peoria, IL)",313,MBA,2025
6368744,596682,Southern Ill. Salukis,596498,Bradley Braves,596498,7,bot,K. Hall to rf for M. Mylott.,76,2025-03-29T00:00:00-04:00,"Dozer Park (Peoria, IL)",313,MBA,2025
6368744,596682,Southern Ill. Salukis,596498,Bradley Braves,596498,7,bot,J. Holder to lf.,77,2025-03-29T00:00:00-04:00,"Dozer Park (Peoria, IL)",313,MBA,2025
6368744,596682,Southern Ill. Salukis,596498,Bradley Braves,596498,7,bot,T. O'Brien grounded out to ss.,78,2025-03-29T00:00:00-04:00,"Dozer Park (Peoria, IL)",313,MBA,2025
6368744,596682,Southern Ill. Salukis,596498,Bradley Braves,596498,7,bot,J. Bogart pinch hit for N. Hosie.,79,2025-03-29T00:00:00-04:00,"Dozer Park (Peoria, IL)",313,MBA,2025
6368744,596682,Southern Ill. Salukis,596498,Bradley Braves,596498,7,bot,J. Bogart struck out swinging.,80,2025-03-29T00:00:00-04:00,"Dozer Park (Peoria, IL)",313,MBA,2025
6368744,596682,Southern Ill. Salukis,596498,Bradley Braves,596498,7,bot,N. Fleckenst grounded out to 3b.,81,2025-03-29T00:00:00-04:00,"Dozer Park (Peoria, IL)",313,MBA,2025
6368744,596682,Southern Ill. Salukis,596498,Bradley Braves,596682,8,top,J. Bogart to c.,82,2025-03-29T00:00:00-04:00,"Dozer Park (Peoria, IL)",313,MBA,2025
6368744,596682,Southern Ill. Salukis,596498,Bradley Braves,596682,8,top,C. Lofton struck out looking.,83,2025-03-29T00:00:00-04:00,"Dozer Park (Peoria, IL)",313,MBA,2025
6368744,596682,Southern Ill. Salukis,596498,Bradley Braves,596682,8,top,T. Simay walked.,84,2025-03-29T00:00:00-04:00,"Dozer Park (Peoria, IL)",313,MBA,2025
6368744,596682,Southern Ill. Salukis,596498,Bradley Braves,596682,8,top,T. Simay stole second.,85,2025-03-29T00:00:00-04:00,"Dozer Park (Peoria, IL)",313,MBA,2025
6368744,596682,Southern Ill. Salukis,596498,Bradley Braves,596682,8,top,M. Schwalbac walked.,86,2025-03-29T00:00:00-04:00,"Dozer Park (Peoria, IL)",313,MBA,2025
6368744,596682,Southern Ill. Salukis,596498,Bradley Braves,596682,8,top,J. Holder walked3a M. Schwalbac advanced to second3a T. Simay advanced to third.,87,2025-03-29T00:00:00-04:00,"Dozer Park (Peoria, IL)",313,MBA,2025
6368744,596682,Southern Ill. Salukis,596498,Bradley Braves,596682,8,top,"J. Bach walked, RBI3a J. Holder advanced to second3a M. Schwalbac advanced to third3a T. Simay scored.",88,2025-03-29T00:00:00-04:00,"Dozer Park (Peoria, IL)",313,MBA,2025
6368744,596682,Southern Ill. Salukis,596498,Bradley Braves,596682,8,top,M. Schark struck out swinging.,89,2025-03-29T00:00:00-04:00,"Dozer Park (Peoria, IL)",313,MBA,2025
6368744,596682,Southern Ill. Salukis,596498,Bradley Braves,596682,8,top,T. Lewis pinch hit for G. Petrucell.,90,2025-03-29T00:00:00-04:00,"Dozer Park (Peoria, IL)",313,MBA,2025
6368744,596682,Southern Ill. Salukis,596498,Bradley Braves,596682,8,top,T. Lewis struck out looking.,91,2025-03-29T00:00:00-04:00,"Dozer Park (Peoria, IL)",313,MBA,2025
6368744,596682,Southern Ill. Salukis,596498,Bradley Braves,596498,8,bot,M. Simay to 2b for T. Lewis.,92,2025-03-29T00:00:00-04:00,"Dozer Park (Peoria, IL)",313,MBA,2025
6368744,596682,Southern Ill. Salukis,596498,Bradley Braves,596498,8,bot,J. Smith out at first 1b to p.,93,2025-03-29T00:00:00-04:00,"Dozer Park (Peoria, IL)",313,MBA,2025
6368744,596682,Southern Ill. Salukis,596498,Bradley Braves,596498,8,bot,C. Smith grounded out to ss.,94,2025-03-29T00:00:00-04:00,"Dozer Park (Peoria, IL)",313,MBA,2025
6368744,596682,Southern Ill. Salukis,596498,Bradley Braves,596498,8,bot,K. Unruh walked.,95,2025-03-29T00:00:00-04:00,"Dozer Park (Peoria, IL)",313,MBA,2025
6368744,596682,Southern Ill. Salukis,596498,Bradley Braves,596498,8,bot,K. Unruh advanced to second on a wild pitch.,96,2025-03-29T00:00:00-04:00,"Dozer Park (Peoria, IL)",313,MBA,2025
6368744,596682,Southern Ill. Salukis,596498,Bradley Braves,596498,8,bot,"B. Atkinson singled through the right side, RBI3a K. Unruh scored.",97,2025-03-29T00:00:00-04:00,"Dozer Park (Peoria, IL)",313,MBA,2025
6368744,596682,Southern Ill. Salukis,596498,Bradley Braves,596498,8,bot,M. Ball walked3a B. Atkinson advanced to second.,98,2025-03-29T00:00:00-04:00,"Dozer Park (Peoria, IL)",313,MBA,2025
6368744,596682,Southern Ill. Salukis,596498,Bradley Braves,596498,8,bot,B. Durbin grounded out to ss.,99,2025-03-29T00:00:00-04:00,"Dozer Park (Peoria, IL)",313,MBA,2025
6368744,596682,Southern Ill. Salukis,596498,Bradley Braves,596682,9,top,J. Keuss pinch hit for J. Lemm.,100,2025-03-29T00:00:00-04:00,"Dozer Park (Peoria, IL)",313,MBA,2025
6368744,596682,Southern Ill. Salukis,596498,Bradley Braves,596682,9,top,J. Keuss doubled to left center.,101,2025-03-29T00:00:00-04:00,"Dozer Park (Peoria, IL)",313,MBA,2025
6368744,596682,Southern Ill. Salukis,596498,Bradley Braves,596682,9,top,K. Hall struck out looking.,102,2025-03-29T00:00:00-04:00,"Dozer Park (Peoria, IL)",313,MBA,2025
6368744,596682,Southern Ill. Salukis,596498,Bradley Braves,596682,9,top,C. Lofton popped up to 2b.,103,2025-03-29T00:00:00-04:00,"Dozer Park (Peoria, IL)",313,MBA,2025
6368744,596682,Southern Ill. Salukis,596498,Bradley Braves,596682,9,top,T. Simay walked.,104,2025-03-29T00:00:00-04:00,"Dozer Park (Peoria, IL)",313,MBA,2025
6368744,596682,Southern Ill. Salukis,596498,Bradley Braves,596682,9,top,M. Schwalbac reached on a fielder's choice3a T. Simay out at second ss unassisted.,105,2025-03-29T00:00:00-04:00,"Dozer Park (Peoria, IL)",313,MBA,2025
6368744,596682,Southern Ill. Salukis,596498,Bradley Braves,596498,9,bot,D. Anselmo pinch hit for T. O'Brien.,106,2025-03-29T00:00:00-04:00,"Dozer Park (Peoria, IL)",313,MBA,2025
6368744,596682,Southern Ill. Salukis,596498,Bradley Braves,596498,9,bot,D. Anselmo singled to left field.,107,2025-03-29T00:00:00-04:00,"Dozer Park (Peoria, IL)",313,MBA,2025
6368744,596682,Southern Ill. Salukis,596498,Bradley Braves,596498,9,bot,J. Bogart flied out to rf.,108,2025-03-29T00:00:00-04:00,"Dozer Park (Peoria, IL)",313,MBA,2025
6368744,596682,Southern Ill. Salukis,596498,Bradley Braves,596498,9,bot,D. Anselmo advanced to second on a wild pitch.,109,2025-03-29T00:00:00-04:00,"Dozer Park (Peoria, IL)",313,MBA,2025
6368744,596682,Southern Ill. Salukis,596498,Bradley Braves,596498,9,bot,N. Fleckenst flied out to rf.,110,2025-03-29T00:00:00-04:00,"Dozer Park (Peoria, IL)",313,MBA,2025
6368744,596682,Southern Ill. Salukis,596498,Bradley Braves,596498,9,bot,J. Smith walked.,111,2025-03-29T00:00:00-04:00,"Dozer Park (Peoria, IL)",313,MBA,2025
6368744,596682,Southern Ill. Salukis,596498,Bradley Braves,596498,9,bot,A. Yusypchuk to p for M. Irvine.,112,2025-03-29T00:00:00-04:00,"Dozer Park (Peoria, IL)",313,MBA,2025
6368744,596682,Southern Ill. Salukis,596498,Bradley Braves,596498,9,bot,C. Smith grounded out to ss.,113,2025-03-29T00:00:00-04:00,"Dozer Park (Peoria, IL)",313,MBA,2025
