game_id,away_team_id,away_team_name,home_team_id,home_team_name,batting_team,inning,top_bot,event_text,event_num,game_datetime,stadium_name,attendance,sport_id,season
6368670,596829,Union (TN) Bulldogs,596900,West Ala. Tigers,596829,1,top,Col. Davis struck out swinging.,1,2025-03-29T00:00:00-04:00,"Tartt Field (Livingston, AL)",96,MBA,2025
6368670,596829,Union (TN) Bulldogs,596900,West Ala. Tigers,596829,1,top,D. Barrett flied out to 2b.,2,2025-03-29T00:00:00-04:00,"Tartt Field (Livingston, AL)",96,MBA,2025
6368670,596829,Union (TN) Bulldogs,596900,West Ala. Tigers,596829,1,top,C. Chavies grounded out to 2b.,3,2025-03-29T00:00:00-04:00,"Tartt Field (Livingston, AL)",96,MBA,2025
6368670,596829,Union (TN) Bulldogs,596900,West Ala. Tigers,596900,1,bot,E. Burwash flied out to cf.,4,2025-03-29T00:00:00-04:00,"Tartt Field (Livingston, AL)",96,MBA,2025
6368670,596829,Union (TN) Bulldogs,596900,West Ala. Tigers,596900,1,bot,J. Watkins doubled to center field.,5,2025-03-29T00:00:00-04:00,"Tartt Field (Livingston, AL)",96,MBA,2025
6368670,596829,Union (TN) Bulldogs,596900,West Ala. Tigers,596900,1,bot,N. Wilson grounded out to ss.,6,2025-03-29T00:00:00-04:00,"Tartt Field (Livingston, AL)",96,MBA,2025
6368670,596829,Union (TN) Bulldogs,596900,West Ala. Tigers,596900,1,bot,B. Vineyard flied out to lf.,7,2025-03-29T00:00:00-04:00,"Tartt Field (Livingston, AL)",96,MBA,2025
6368670,596829,Union (TN) Bulldogs,596900,West Ala. Tigers,596829,2,top,G. Ross flied out to cf.,8,2025-03-29T00:00:00-04:00,"Tartt Field (Livingston, AL)",96,MBA,2025
6368670,596829,Union (TN) Bulldogs,596900,West Ala. Tigers,596829,2,top,J. Keyl singled to center field.,9,2025-03-29T00:00:00-04:00,"Tartt Field (Livingston, AL)",96,MBA,2025
6368670,596829,Union (TN) Bulldogs,596900,West Ala. Tigers,596829,2,top,Cal. Davis flied out to cf.,10,2025-03-29T00:00:00-04:00,"Tartt Field (Livingston, AL)",96,MBA,2025
6368670,596829,Union (TN) Bulldogs,596900,West Ala. Tigers,596829,2,top,"J. Keyl out at second c to 2b, caught stealing.",11,2025-03-29T00:00:00-04:00,"Tartt Field (Livingston, AL)",96,MBA,2025
6368670,596829,Union (TN) Bulldogs,596900,West Ala. Tigers,596900,2,bot,J. Goolsby flied out to lf.,12,2025-03-29T00:00:00-04:00,"Tartt Field (Livingston, AL)",96,MBA,2025
6368670,596829,Union (TN) Bulldogs,596900,West Ala. Tigers,596900,2,bot,C. Thompson struck out looking.,13,2025-03-29T00:00:00-04:00,"Tartt Field (Livingston, AL)",96,MBA,2025
6368670,596829,Union (TN) Bulldogs,596900,West Ala. Tigers,596900,2,bot,T. Jones grounded out to ss.,14,2025-03-29T00:00:00-04:00,"Tartt Field (Livingston, AL)",96,MBA,2025
6368670,596829,Union (TN) Bulldogs,596900,West Ala. Tigers,596829,3,top,C. Pace struck out looking.,15,2025-03-29T00:00:00-04:00,"Tartt Field (Livingston, AL)",96,MBA,2025
6368670,596829,Union (TN) Bulldogs,596900,West Ala. Tigers,596829,3,top,J Hufstedler struck out looking.,16,2025-03-29T00:00:00-04:00,"Tartt Field (Livingston, AL)",96,MBA,2025
6368670,596829,Union (TN) Bulldogs,596900,West Ala. Tigers,596829,3,top,K. Joyner singled to center field.,17,2025-03-29T00:00:00-04:00,"Tartt Field (Livingston, AL)",96,MBA,2025
6368670,596829,Union (TN) Bulldogs,596900,West Ala. Tigers,596829,3,top,Col. Davis out at first 1b to p.,18,2025-03-29T00:00:00-04:00,"Tartt Field (Livingston, AL)",96,MBA,2025
6368670,596829,Union (TN) Bulldogs,596900,West Ala. Tigers,596900,3,bot,B. Newman singled to shortstop.,19,2025-03-29T00:00:00-04:00,"Tartt Field (Livingston, AL)",96,MBA,2025
6368670,596829,Union (TN) Bulldogs,596900,West Ala. Tigers,596900,3,bot,T. Watson grounded into double play ss to 2b to 1b3a B. Newman out on the play.,20,2025-03-29T00:00:00-04:00,"Tartt Field (Livingston, AL)",96,MBA,2025
6368670,596829,Union (TN) Bulldogs,596900,West Ala. Tigers,596900,3,bot,E. Burwash singled to center field.,21,2025-03-29T00:00:00-04:00,"Tartt Field (Livingston, AL)",96,MBA,2025
6368670,596829,Union (TN) Bulldogs,596900,West Ala. Tigers,596900,3,bot,J. Watkins grounded out to 3b.,22,2025-03-29T00:00:00-04:00,"Tartt Field (Livingston, AL)",96,MBA,2025
6368670,596829,Union (TN) Bulldogs,596900,West Ala. Tigers,596829,4,top,D. Barrett lined out to rf.,23,2025-03-29T00:00:00-04:00,"Tartt Field (Livingston, AL)",96,MBA,2025
6368670,596829,Union (TN) Bulldogs,596900,West Ala. Tigers,596829,4,top,C. Chavies singled to center field.,24,2025-03-29T00:00:00-04:00,"Tartt Field (Livingston, AL)",96,MBA,2025
6368670,596829,Union (TN) Bulldogs,596900,West Ala. Tigers,596829,4,top,G. Ross singled to center field3a C. Chavies advanced to second.,25,2025-03-29T00:00:00-04:00,"Tartt Field (Livingston, AL)",96,MBA,2025
6368670,596829,Union (TN) Bulldogs,596900,West Ala. Tigers,596829,4,top,J. Keyl reached on a fielder's choice3a G. Ross out at second 3b to 2b3a C. Chavies advanced to third.,26,2025-03-29T00:00:00-04:00,"Tartt Field (Livingston, AL)",96,MBA,2025
6368670,596829,Union (TN) Bulldogs,596900,West Ala. Tigers,596829,4,top,Cal. Davis flied out to lf.,27,2025-03-29T00:00:00-04:00,"Tartt Field (Livingston, AL)",96,MBA,2025
6368670,596829,Union (TN) Bulldogs,596900,West Ala. Tigers,596900,4,bot,"N. Wilson reached on an error by ss, advanced to second.",28,2025-03-29T00:00:00-04:00,"Tartt Field (Livingston, AL)",96,MBA,2025
6368670,596829,Union (TN) Bulldogs,596900,West Ala. Tigers,596900,4,bot,"B. Vineyard reached on an error by 1b, SAC, bunt3a N. Wilson advanced to third.",29,2025-03-29T00:00:00-04:00,"Tartt Field (Livingston, AL)",96,MBA,2025
6368670,596829,Union (TN) Bulldogs,596900,West Ala. Tigers,596900,4,bot,B. Vineyard stole second.,30,2025-03-29T00:00:00-04:00,"Tartt Field (Livingston, AL)",96,MBA,2025
6368670,596829,Union (TN) Bulldogs,596900,West Ala. Tigers,596900,4,bot,J. Goolsby flied out to cf.,31,2025-03-29T00:00:00-04:00,"Tartt Field (Livingston, AL)",96,MBA,2025
6368670,596829,Union (TN) Bulldogs,596900,West Ala. Tigers,596900,4,bot,C. Thompson fouled out to 2b.,32,2025-03-29T00:00:00-04:00,"Tartt Field (Livingston, AL)",96,MBA,2025
6368670,596829,Union (TN) Bulldogs,596900,West Ala. Tigers,596900,4,bot,T. Jones walked.,33,2025-03-29T00:00:00-04:00,"Tartt Field (Livingston, AL)",96,MBA,2025
6368670,596829,Union (TN) Bulldogs,596900,West Ala. Tigers,596900,4,bot,L. Evans to p for N. Toney.,34,2025-03-29T00:00:00-04:00,"Tartt Field (Livingston, AL)",96,MBA,2025
6368670,596829,Union (TN) Bulldogs,596900,West Ala. Tigers,596900,4,bot,"B. Newman walked, RBI3a T. Jones advanced to second3a B. Vineyard advanced to third3a N. Wilson scored, unearned.",35,2025-03-29T00:00:00-04:00,"Tartt Field (Livingston, AL)",96,MBA,2025
6368670,596829,Union (TN) Bulldogs,596900,West Ala. Tigers,596900,4,bot,T. Watson reached on a fielder's choice3a B. Newman advanced to second3a T. Jones out at third 3b unassisted.,36,2025-03-29T00:00:00-04:00,"Tartt Field (Livingston, AL)",96,MBA,2025
6368670,596829,Union (TN) Bulldogs,596900,West Ala. Tigers,596829,5,top,C. Pace grounded out to ss.,37,2025-03-29T00:00:00-04:00,"Tartt Field (Livingston, AL)",96,MBA,2025
6368670,596829,Union (TN) Bulldogs,596900,West Ala. Tigers,596829,5,top,J Hufstedler grounded out to p.,38,2025-03-29T00:00:00-04:00,"Tartt Field (Livingston, AL)",96,MBA,2025
6368670,596829,Union (TN) Bulldogs,596900,West Ala. Tigers,596829,5,top,K. Joyner flied out to rf.,39,2025-03-29T00:00:00-04:00,"Tartt Field (Livingston, AL)",96,MBA,2025
6368670,596829,Union (TN) Bulldogs,596900,West Ala. Tigers,596900,5,bot,E. Burwash flied out to lf.,40,2025-03-29T00:00:00-04:00,"Tartt Field (Livingston, AL)",96,MBA,2025
6368670,596829,Union (TN) Bulldogs,596900,West Ala. Tigers,596900,5,bot,J. Watkins singled to shortstop.,41,2025-03-29T00:00:00-04:00,"Tartt Field (Livingston, AL)",96,MBA,2025
6368670,596829,Union (TN) Bulldogs,596900,West Ala. Tigers,596900,5,bot,N. Wilson singled to left field3a J. Watkins advanced to second.,42,2025-03-29T00:00:00-04:00,"Tartt Field (Livingston, AL)",96,MBA,2025
6368670,596829,Union (TN) Bulldogs,596900,West Ala. Tigers,596900,5,bot,"B. Vineyard doubled to left field, RBI3a N. Wilson advanced to third3a J. Watkins scored.",43,2025-03-29T00:00:00-04:00,"Tartt Field (Livingston, AL)",96,MBA,2025
6368670,596829,Union (TN) Bulldogs,596900,West Ala. Tigers,596900,5,bot,B. Bazydlo to p for L. Evans.,44,2025-03-29T00:00:00-04:00,"Tartt Field (Livingston, AL)",96,MBA,2025
6368670,596829,Union (TN) Bulldogs,596900,West Ala. Tigers,596900,5,bot,J. Goolsby grounded out to 1b unassisted.,45,2025-03-29T00:00:00-04:00,"Tartt Field (Livingston, AL)",96,MBA,2025
6368670,596829,Union (TN) Bulldogs,596900,West Ala. Tigers,596900,5,bot,C. Thompson walked.,46,2025-03-29T00:00:00-04:00,"Tartt Field (Livingston, AL)",96,MBA,2025
6368670,596829,Union (TN) Bulldogs,596900,West Ala. Tigers,596900,5,bot,"T. Jones doubled to right field, 2 RBI3a C. Thompson advanced to third3a B. Vineyard scored3a N. Wilson scored.",47,2025-03-29T00:00:00-04:00,"Tartt Field (Livingston, AL)",96,MBA,2025
6368670,596829,Union (TN) Bulldogs,596900,West Ala. Tigers,596900,5,bot,B. Newman flied out to lf.,48,2025-03-29T00:00:00-04:00,"Tartt Field (Livingston, AL)",96,MBA,2025
6368670,596829,Union (TN) Bulldogs,596900,West Ala. Tigers,596829,6,top,N. Phillips to p for B. Green.,49,2025-03-29T00:00:00-04:00,"Tartt Field (Livingston, AL)",96,MBA,2025
6368670,596829,Union (TN) Bulldogs,596900,West Ala. Tigers,596829,6,top,Col. Davis grounded out to 3b.,50,2025-03-29T00:00:00-04:00,"Tartt Field (Livingston, AL)",96,MBA,2025
6368670,596829,Union (TN) Bulldogs,596900,West Ala. Tigers,596829,6,top,D. Barrett grounded out to ss.,51,2025-03-29T00:00:00-04:00,"Tartt Field (Livingston, AL)",96,MBA,2025
6368670,596829,Union (TN) Bulldogs,596900,West Ala. Tigers,596829,6,top,C. Chavies struck out swinging.,52,2025-03-29T00:00:00-04:00,"Tartt Field (Livingston, AL)",96,MBA,2025
6368670,596829,Union (TN) Bulldogs,596900,West Ala. Tigers,596900,6,bot,T. Watson grounded out to 2b.,53,2025-03-29T00:00:00-04:00,"Tartt Field (Livingston, AL)",96,MBA,2025
6368670,596829,Union (TN) Bulldogs,596900,West Ala. Tigers,596900,6,bot,E. Burwash grounded out to ss.,54,2025-03-29T00:00:00-04:00,"Tartt Field (Livingston, AL)",96,MBA,2025
6368670,596829,Union (TN) Bulldogs,596900,West Ala. Tigers,596900,6,bot,J. Watkins doubled to left field.,55,2025-03-29T00:00:00-04:00,"Tartt Field (Livingston, AL)",96,MBA,2025
6368670,596829,Union (TN) Bulldogs,596900,West Ala. Tigers,596900,6,bot,J. Watkins advanced to third on a wild pitch.,56,2025-03-29T00:00:00-04:00,"Tartt Field (Livingston, AL)",96,MBA,2025
6368670,596829,Union (TN) Bulldogs,596900,West Ala. Tigers,596900,6,bot,N. Wilson walked.,57,2025-03-29T00:00:00-04:00,"Tartt Field (Livingston, AL)",96,MBA,2025
6368670,596829,Union (TN) Bulldogs,596900,West Ala. Tigers,596900,6,bot,B. Vineyard lined out to ss.,58,2025-03-29T00:00:00-04:00,"Tartt Field (Livingston, AL)",96,MBA,2025
6368670,596829,Union (TN) Bulldogs,596900,West Ala. Tigers,596829,7,top,G. Ross out at first 1b to p.,59,2025-03-29T00:00:00-04:00,"Tartt Field (Livingston, AL)",96,MBA,2025
6368670,596829,Union (TN) Bulldogs,596900,West Ala. Tigers,596829,7,top,J. Keyl struck out looking.,60,2025-03-29T00:00:00-04:00,"Tartt Field (Livingston, AL)",96,MBA,2025
6368670,596829,Union (TN) Bulldogs,596900,West Ala. Tigers,596829,7,top,Cal. Davis grounded out to 2b.,61,2025-03-29T00:00:00-04:00,"Tartt Field (Livingston, AL)",96,MBA,2025
6368670,596829,Union (TN) Bulldogs,596900,West Ala. Tigers,596900,7,bot,J. Goolsby grounded out to 2b.,62,2025-03-29T00:00:00-04:00,"Tartt Field (Livingston, AL)",96,MBA,2025
6368670,596829,Union (TN) Bulldogs,596900,West Ala. Tigers,596900,7,bot,C. Thompson struck out swinging.,63,2025-03-29T00:00:00-04:00,"Tartt Field (Livingston, AL)",96,MBA,2025
6368670,596829,Union (TN) Bulldogs,596900,West Ala. Tigers,596900,7,bot,T. Jones grounded out to ss.,64,2025-03-29T00:00:00-04:00,"Tartt Field (Livingston, AL)",96,MBA,2025
6368670,596829,Union (TN) Bulldogs,596900,West Ala. Tigers,596829,8,top,C. Pace grounded out to 2b.,65,2025-03-29T00:00:00-04:00,"Tartt Field (Livingston, AL)",96,MBA,2025
6368670,596829,Union (TN) Bulldogs,596900,West Ala. Tigers,596829,8,top,J Hufstedler walked.,66,2025-03-29T00:00:00-04:00,"Tartt Field (Livingston, AL)",96,MBA,2025
6368670,596829,Union (TN) Bulldogs,596900,West Ala. Tigers,596829,8,top,K. Joyner grounded out to p3a J Hufstedler advanced to second.,67,2025-03-29T00:00:00-04:00,"Tartt Field (Livingston, AL)",96,MBA,2025
6368670,596829,Union (TN) Bulldogs,596900,West Ala. Tigers,596829,8,top,Col. Davis singled to third base3a J Hufstedler advanced to third.,68,2025-03-29T00:00:00-04:00,"Tartt Field (Livingston, AL)",96,MBA,2025
6368670,596829,Union (TN) Bulldogs,596900,West Ala. Tigers,596829,8,top,D. Barrett flied out to rf.,69,2025-03-29T00:00:00-04:00,"Tartt Field (Livingston, AL)",96,MBA,2025
6368670,596829,Union (TN) Bulldogs,596900,West Ala. Tigers,596900,8,bot,B. Newman grounded out to 2b.,70,2025-03-29T00:00:00-04:00,"Tartt Field (Livingston, AL)",96,MBA,2025
6368670,596829,Union (TN) Bulldogs,596900,West Ala. Tigers,596900,8,bot,T. Watson flied out to rf.,71,2025-03-29T00:00:00-04:00,"Tartt Field (Livingston, AL)",96,MBA,2025
6368670,596829,Union (TN) Bulldogs,596900,West Ala. Tigers,596900,8,bot,E. Burwash grounded out to 3b.,72,2025-03-29T00:00:00-04:00,"Tartt Field (Livingston, AL)",96,MBA,2025
6368670,596829,Union (TN) Bulldogs,596900,West Ala. Tigers,596829,9,top,G. Pee to p for N. Phillips.,73,2025-03-29T00:00:00-04:00,"Tartt Field (Livingston, AL)",96,MBA,2025
6368670,596829,Union (TN) Bulldogs,596900,West Ala. Tigers,596829,9,top,W. Wood to lf for T. Watson.,74,2025-03-29T00:00:00-04:00,"Tartt Field (Livingston, AL)",96,MBA,2025
6368670,596829,Union (TN) Bulldogs,596900,West Ala. Tigers,596829,9,top,C. Chavies singled to right field.,75,2025-03-29T00:00:00-04:00,"Tartt Field (Livingston, AL)",96,MBA,2025
6368670,596829,Union (TN) Bulldogs,596900,West Ala. Tigers,596829,9,top,G. Ross flied out to lf.,76,2025-03-29T00:00:00-04:00,"Tartt Field (Livingston, AL)",96,MBA,2025
6368670,596829,Union (TN) Bulldogs,596900,West Ala. Tigers,596829,9,top,J. Keyl reached on a fielder's choice3a C. Chavies out at second 3b to 2b.,77,2025-03-29T00:00:00-04:00,"Tartt Field (Livingston, AL)",96,MBA,2025
6368670,596829,Union (TN) Bulldogs,596900,West Ala. Tigers,596829,9,top,Cal. Davis flied out to lf.,78,2025-03-29T00:00:00-04:00,"Tartt Field (Livingston, AL)",96,MBA,2025
