game_id,away_team_id,away_team_name,home_team_id,home_team_name,batting_team,inning,top_bot,event_text,event_num,game_datetime,stadium_name,attendance,sport_id,season
6382914,596964,Concord Mountain Lions,597522,Point Park Pioneers,596964,1,top,Nick DiSanti singled to left field.,1,2025-05-07T00:00:00-04:00,"GoMart Ballpark (Charleston, WV)",0,MBA,2025
6382914,596964,Concord Mountain Lions,597522,Point Park Pioneers,596964,1,top,Matthew DiSa hit by pitch3a Nick DiSanti advanced to second.,2,2025-05-07T00:00:00-04:00,"GoMart Ballpark (Charleston, WV)",0,MBA,2025
6382914,596964,Concord Mountain Lions,597522,Point Park Pioneers,596964,1,top,Kaden Swaim hit by pitch3a Matthew DiSa advanced to second3a Nick DiSanti advanced to third.,3,2025-05-07T00:00:00-04:00,"GoMart Ballpark (Charleston, WV)",0,MBA,2025
6382914,596964,Concord Mountain Lions,597522,Point Park Pioneers,596964,1,top,"Tyson Burke flied out to rf, SF, RBI3a Matthew DiSa advanced to third3a Nick DiSanti scored.",4,2025-05-07T00:00:00-04:00,"GoMart Ballpark (Charleston, WV)",0,MBA,2025
6382914,596964,Concord Mountain Lions,597522,Point Park Pioneers,596964,1,top,Korbin Bosti flied out to cf.,5,2025-05-07T00:00:00-04:00,"GoMart Ballpark (Charleston, WV)",0,MBA,2025
6382914,596964,Concord Mountain Lions,597522,Point Park Pioneers,596964,1,top,Kaden Swaim stole second.,6,2025-05-07T00:00:00-04:00,"GoMart Ballpark (Charleston, WV)",0,MBA,2025
6382914,596964,Concord Mountain Lions,597522,Point Park Pioneers,596964,1,top,MJ Hunter flied out to rf.,7,2025-05-07T00:00:00-04:00,"GoMart Ballpark (Charleston, WV)",0,MBA,2025
6382914,596964,Concord Mountain Lions,597522,Point Park Pioneers,597522,1,bot,Omar Morillo singled to center field.,8,2025-05-07T00:00:00-04:00,"GoMart Ballpark (Charleston, WV)",0,MBA,2025
6382914,596964,Concord Mountain Lions,597522,Point Park Pioneers,597522,1,bot,Isaac Santan struck out swinging.,9,2025-05-07T00:00:00-04:00,"GoMart Ballpark (Charleston, WV)",0,MBA,2025
6382914,596964,Concord Mountain Lions,597522,Point Park Pioneers,597522,1,bot,Jared Campbe singled to left field3a Omar Morillo advanced to second.,10,2025-05-07T00:00:00-04:00,"GoMart Ballpark (Charleston, WV)",0,MBA,2025
6382914,596964,Concord Mountain Lions,597522,Point Park Pioneers,597522,1,bot,Luis Gonzale struck out looking.,11,2025-05-07T00:00:00-04:00,"GoMart Ballpark (Charleston, WV)",0,MBA,2025
6382914,596964,Concord Mountain Lions,597522,Point Park Pioneers,597522,1,bot,"Trevor Jones singled to left field, RBI3a Jared Campbe advanced to second3a Omar Morillo scored.",12,2025-05-07T00:00:00-04:00,"GoMart Ballpark (Charleston, WV)",0,MBA,2025
6382914,596964,Concord Mountain Lions,597522,Point Park Pioneers,597522,1,bot,"Chris Willia doubled to left field, RBI3a Trevor Jones advanced to third3a Jared Campbe scored.",13,2025-05-07T00:00:00-04:00,"GoMart Ballpark (Charleston, WV)",0,MBA,2025
6382914,596964,Concord Mountain Lions,597522,Point Park Pioneers,597522,1,bot,Marcus Franc grounded out to 2b.,14,2025-05-07T00:00:00-04:00,"GoMart Ballpark (Charleston, WV)",0,MBA,2025
6382914,596964,Concord Mountain Lions,597522,Point Park Pioneers,596964,2,top,Demetri Jami struck out looking.,15,2025-05-07T00:00:00-04:00,"GoMart Ballpark (Charleston, WV)",0,MBA,2025
6382914,596964,Concord Mountain Lions,597522,Point Park Pioneers,596964,2,top,Brendan Brad popped up to 1b.,16,2025-05-07T00:00:00-04:00,"GoMart Ballpark (Charleston, WV)",0,MBA,2025
6382914,596964,Concord Mountain Lions,597522,Point Park Pioneers,596964,2,top,J Thompson struck out swinging.,17,2025-05-07T00:00:00-04:00,"GoMart Ballpark (Charleston, WV)",0,MBA,2025
6382914,596964,Concord Mountain Lions,597522,Point Park Pioneers,597522,2,bot,Blake Ewing struck out swinging.,18,2025-05-07T00:00:00-04:00,"GoMart Ballpark (Charleston, WV)",0,MBA,2025
6382914,596964,Concord Mountain Lions,597522,Point Park Pioneers,597522,2,bot,Jordon Campb grounded out to ss.,19,2025-05-07T00:00:00-04:00,"GoMart Ballpark (Charleston, WV)",0,MBA,2025
6382914,596964,Concord Mountain Lions,597522,Point Park Pioneers,597522,2,bot,Omar Morillo flied out to lf.,20,2025-05-07T00:00:00-04:00,"GoMart Ballpark (Charleston, WV)",0,MBA,2025
6382914,596964,Concord Mountain Lions,597522,Point Park Pioneers,596964,3,top,Nick DiSanti flied out to cf.,21,2025-05-07T00:00:00-04:00,"GoMart Ballpark (Charleston, WV)",0,MBA,2025
6382914,596964,Concord Mountain Lions,597522,Point Park Pioneers,596964,3,top,Matthew DiSa flied out to cf.,22,2025-05-07T00:00:00-04:00,"GoMart Ballpark (Charleston, WV)",0,MBA,2025
6382914,596964,Concord Mountain Lions,597522,Point Park Pioneers,596964,3,top,Kaden Swaim struck out looking.,23,2025-05-07T00:00:00-04:00,"GoMart Ballpark (Charleston, WV)",0,MBA,2025
6382914,596964,Concord Mountain Lions,597522,Point Park Pioneers,597522,3,bot,Isaac Santan struck out swinging.,24,2025-05-07T00:00:00-04:00,"GoMart Ballpark (Charleston, WV)",0,MBA,2025
6382914,596964,Concord Mountain Lions,597522,Point Park Pioneers,597522,3,bot,Jared Campbe struck out swinging.,25,2025-05-07T00:00:00-04:00,"GoMart Ballpark (Charleston, WV)",0,MBA,2025
6382914,596964,Concord Mountain Lions,597522,Point Park Pioneers,597522,3,bot,Luis Gonzale grounded out to 2b.,26,2025-05-07T00:00:00-04:00,"GoMart Ballpark (Charleston, WV)",0,MBA,2025
6382914,596964,Concord Mountain Lions,597522,Point Park Pioneers,596964,4,top,Tyson Burke grounded out to ss.,27,2025-05-07T00:00:00-04:00,"GoMart Ballpark (Charleston, WV)",0,MBA,2025
6382914,596964,Concord Mountain Lions,597522,Point Park Pioneers,596964,4,top,Korbin Bosti struck out swinging.,28,2025-05-07T00:00:00-04:00,"GoMart Ballpark (Charleston, WV)",0,MBA,2025
6382914,596964,Concord Mountain Lions,597522,Point Park Pioneers,596964,4,top,MJ Hunter grounded out to 2b.,29,2025-05-07T00:00:00-04:00,"GoMart Ballpark (Charleston, WV)",0,MBA,2025
6382914,596964,Concord Mountain Lions,597522,Point Park Pioneers,597522,4,bot,Trevor Jones struck out swinging.,30,2025-05-07T00:00:00-04:00,"GoMart Ballpark (Charleston, WV)",0,MBA,2025
6382914,596964,Concord Mountain Lions,597522,Point Park Pioneers,597522,4,bot,Chris Willia popped up to 1b.,31,2025-05-07T00:00:00-04:00,"GoMart Ballpark (Charleston, WV)",0,MBA,2025
6382914,596964,Concord Mountain Lions,597522,Point Park Pioneers,597522,4,bot,Marcus Franc struck out swinging.,32,2025-05-07T00:00:00-04:00,"GoMart Ballpark (Charleston, WV)",0,MBA,2025
6382914,596964,Concord Mountain Lions,597522,Point Park Pioneers,596964,5,top,Demetri Jami grounded out to 3b.,33,2025-05-07T00:00:00-04:00,"GoMart Ballpark (Charleston, WV)",0,MBA,2025
6382914,596964,Concord Mountain Lions,597522,Point Park Pioneers,596964,5,top,Brendan Brad singled to left field.,34,2025-05-07T00:00:00-04:00,"GoMart Ballpark (Charleston, WV)",0,MBA,2025
6382914,596964,Concord Mountain Lions,597522,Point Park Pioneers,596964,5,top,J Thompson struck out looking.,35,2025-05-07T00:00:00-04:00,"GoMart Ballpark (Charleston, WV)",0,MBA,2025
6382914,596964,Concord Mountain Lions,597522,Point Park Pioneers,596964,5,top,Brendan Brad stole second.,36,2025-05-07T00:00:00-04:00,"GoMart Ballpark (Charleston, WV)",0,MBA,2025
6382914,596964,Concord Mountain Lions,597522,Point Park Pioneers,596964,5,top,Nick DiSanti popped up to 2b.,37,2025-05-07T00:00:00-04:00,"GoMart Ballpark (Charleston, WV)",0,MBA,2025
6382914,596964,Concord Mountain Lions,597522,Point Park Pioneers,597522,5,bot,Blake Ewing struck out swinging.,38,2025-05-07T00:00:00-04:00,"GoMart Ballpark (Charleston, WV)",0,MBA,2025
6382914,596964,Concord Mountain Lions,597522,Point Park Pioneers,597522,5,bot,Jordon Campb walked.,39,2025-05-07T00:00:00-04:00,"GoMart Ballpark (Charleston, WV)",0,MBA,2025
6382914,596964,Concord Mountain Lions,597522,Point Park Pioneers,597522,5,bot,Omar Morillo flied out to cf.,40,2025-05-07T00:00:00-04:00,"GoMart Ballpark (Charleston, WV)",0,MBA,2025
6382914,596964,Concord Mountain Lions,597522,Point Park Pioneers,597522,5,bot,"Isaac Santan homered to right field, 2 RBI3a Jordon Campb scored.",41,2025-05-07T00:00:00-04:00,"GoMart Ballpark (Charleston, WV)",0,MBA,2025
6382914,596964,Concord Mountain Lions,597522,Point Park Pioneers,597522,5,bot,Jared Campbe hit by pitch.,42,2025-05-07T00:00:00-04:00,"GoMart Ballpark (Charleston, WV)",0,MBA,2025
6382914,596964,Concord Mountain Lions,597522,Point Park Pioneers,597522,5,bot,Jared Campbe advanced to second on a wild pitch.,43,2025-05-07T00:00:00-04:00,"GoMart Ballpark (Charleston, WV)",0,MBA,2025
6382914,596964,Concord Mountain Lions,597522,Point Park Pioneers,597522,5,bot,"Luis Gonzale singled to right field, RBI3a Jared Campbe scored.",44,2025-05-07T00:00:00-04:00,"GoMart Ballpark (Charleston, WV)",0,MBA,2025
6382914,596964,Concord Mountain Lions,597522,Point Park Pioneers,597522,5,bot,Trevor Jones singled to left field3a Luis Gonzale advanced to third.,45,2025-05-07T00:00:00-04:00,"GoMart Ballpark (Charleston, WV)",0,MBA,2025
6382914,596964,Concord Mountain Lions,597522,Point Park Pioneers,597522,5,bot,Braylen Bake to p for Logan Darrow.,46,2025-05-07T00:00:00-04:00,"GoMart Ballpark (Charleston, WV)",0,MBA,2025
6382914,596964,Concord Mountain Lions,597522,Point Park Pioneers,597522,5,bot,Chris Willia hit by pitch3a Trevor Jones advanced to second.,47,2025-05-07T00:00:00-04:00,"GoMart Ballpark (Charleston, WV)",0,MBA,2025
6382914,596964,Concord Mountain Lions,597522,Point Park Pioneers,597522,5,bot,"Marcus Franc singled to center field, 2 RBI3a Chris Willia advanced to third3a Trevor Jones scored3a Luis Gonzale scored.",48,2025-05-07T00:00:00-04:00,"GoMart Ballpark (Charleston, WV)",0,MBA,2025
6382914,596964,Concord Mountain Lions,597522,Point Park Pioneers,597522,5,bot,"Chris Willia out at third c to ss to 3b, caught stealing.",49,2025-05-07T00:00:00-04:00,"GoMart Ballpark (Charleston, WV)",0,MBA,2025
6382914,596964,Concord Mountain Lions,597522,Point Park Pioneers,596964,6,top,Matthew DiSa flied out to rf.,50,2025-05-07T00:00:00-04:00,"GoMart Ballpark (Charleston, WV)",0,MBA,2025
6382914,596964,Concord Mountain Lions,597522,Point Park Pioneers,596964,6,top,Kaden Swaim singled to left field.,51,2025-05-07T00:00:00-04:00,"GoMart Ballpark (Charleston, WV)",0,MBA,2025
6382914,596964,Concord Mountain Lions,597522,Point Park Pioneers,596964,6,top,Kaden Swaim advanced to second on a wild pitch.,52,2025-05-07T00:00:00-04:00,"GoMart Ballpark (Charleston, WV)",0,MBA,2025
6382914,596964,Concord Mountain Lions,597522,Point Park Pioneers,596964,6,top,Tyson Burke walked.,53,2025-05-07T00:00:00-04:00,"GoMart Ballpark (Charleston, WV)",0,MBA,2025
6382914,596964,Concord Mountain Lions,597522,Point Park Pioneers,596964,6,top,Korbin Bosti walked3a Tyson Burke advanced to second3a Kaden Swaim advanced to third.,54,2025-05-07T00:00:00-04:00,"GoMart Ballpark (Charleston, WV)",0,MBA,2025
6382914,596964,Concord Mountain Lions,597522,Point Park Pioneers,596964,6,top,Ethan Parker to p for Javier Cardo.,55,2025-05-07T00:00:00-04:00,"GoMart Ballpark (Charleston, WV)",0,MBA,2025
6382914,596964,Concord Mountain Lions,597522,Point Park Pioneers,596964,6,top,"MJ Hunter singled to left field, 2 RBI3a Korbin Bosti advanced to second3a Tyson Burke scored3a Kaden Swaim scored.",56,2025-05-07T00:00:00-04:00,"GoMart Ballpark (Charleston, WV)",0,MBA,2025
6382914,596964,Concord Mountain Lions,597522,Point Park Pioneers,596964,6,top,Demetri Jami grounded into double play 2b to ss to 1b3a MJ Hunter out on the play.,57,2025-05-07T00:00:00-04:00,"GoMart Ballpark (Charleston, WV)",0,MBA,2025
6382914,596964,Concord Mountain Lions,597522,Point Park Pioneers,597522,6,bot,"Blake Ewing homered to right field, RBI.",58,2025-05-07T00:00:00-04:00,"GoMart Ballpark (Charleston, WV)",0,MBA,2025
6382914,596964,Concord Mountain Lions,597522,Point Park Pioneers,597522,6,bot,Jordon Campb walked.,59,2025-05-07T00:00:00-04:00,"GoMart Ballpark (Charleston, WV)",0,MBA,2025
6382914,596964,Concord Mountain Lions,597522,Point Park Pioneers,597522,6,bot,"Omar Morillo singled to left field, advanced to second on a throwing error by lf3a Jordon Campb advanced to third.",60,2025-05-07T00:00:00-04:00,"GoMart Ballpark (Charleston, WV)",0,MBA,2025
6382914,596964,Concord Mountain Lions,597522,Point Park Pioneers,597522,6,bot,"Isaac Santan flied out to lf, SF, RBI3a Jordon Campb scored.",61,2025-05-07T00:00:00-04:00,"GoMart Ballpark (Charleston, WV)",0,MBA,2025
6382914,596964,Concord Mountain Lions,597522,Point Park Pioneers,597522,6,bot,Jared Campbe flied out to lf3a Omar Morillo advanced to third.,62,2025-05-07T00:00:00-04:00,"GoMart Ballpark (Charleston, WV)",0,MBA,2025
6382914,596964,Concord Mountain Lions,597522,Point Park Pioneers,597522,6,bot,Luis Gonzale flied out to rf.,63,2025-05-07T00:00:00-04:00,"GoMart Ballpark (Charleston, WV)",0,MBA,2025
6382914,596964,Concord Mountain Lions,597522,Point Park Pioneers,596964,7,top,Brendan Brad flied out to cf.,64,2025-05-07T00:00:00-04:00,"GoMart Ballpark (Charleston, WV)",0,MBA,2025
6382914,596964,Concord Mountain Lions,597522,Point Park Pioneers,596964,7,top,Alex Rodrigu pinch hit for J Thompson.,65,2025-05-07T00:00:00-04:00,"GoMart Ballpark (Charleston, WV)",0,MBA,2025
6382914,596964,Concord Mountain Lions,597522,Point Park Pioneers,596964,7,top,Alex Rodrigu flied out to lf.,66,2025-05-07T00:00:00-04:00,"GoMart Ballpark (Charleston, WV)",0,MBA,2025
6382914,596964,Concord Mountain Lions,597522,Point Park Pioneers,596964,7,top,Nick DiSanti walked.,67,2025-05-07T00:00:00-04:00,"GoMart Ballpark (Charleston, WV)",0,MBA,2025
6382914,596964,Concord Mountain Lions,597522,Point Park Pioneers,596964,7,top,"Matthew DiSa homered to left field, 2 RBI3a Nick DiSanti scored.",68,2025-05-07T00:00:00-04:00,"GoMart Ballpark (Charleston, WV)",0,MBA,2025
6382914,596964,Concord Mountain Lions,597522,Point Park Pioneers,596964,7,top,Kaden Swaim grounded out to 3b.,69,2025-05-07T00:00:00-04:00,"GoMart Ballpark (Charleston, WV)",0,MBA,2025
6382914,596964,Concord Mountain Lions,597522,Point Park Pioneers,597522,7,bot,Alex Rodrigu to cf.,70,2025-05-07T00:00:00-04:00,"GoMart Ballpark (Charleston, WV)",0,MBA,2025
6382914,596964,Concord Mountain Lions,597522,Point Park Pioneers,597522,7,bot,Connor Brize to p for Braylen Bake.,71,2025-05-07T00:00:00-04:00,"GoMart Ballpark (Charleston, WV)",0,MBA,2025
6382914,596964,Concord Mountain Lions,597522,Point Park Pioneers,597522,7,bot,Trevor Jones walked.,72,2025-05-07T00:00:00-04:00,"GoMart Ballpark (Charleston, WV)",0,MBA,2025
6382914,596964,Concord Mountain Lions,597522,Point Park Pioneers,597522,7,bot,Kerry Collin to p for Connor Brize.,73,2025-05-07T00:00:00-04:00,"GoMart Ballpark (Charleston, WV)",0,MBA,2025
6382914,596964,Concord Mountain Lions,597522,Point Park Pioneers,597522,7,bot,Chris Willia walked3a Trevor Jones advanced to second.,74,2025-05-07T00:00:00-04:00,"GoMart Ballpark (Charleston, WV)",0,MBA,2025
6382914,596964,Concord Mountain Lions,597522,Point Park Pioneers,597522,7,bot,Marcus Franc flied out to cf3a Chris Willia advanced to second3a Trevor Jones advanced to third.,75,2025-05-07T00:00:00-04:00,"GoMart Ballpark (Charleston, WV)",0,MBA,2025
6382914,596964,Concord Mountain Lions,597522,Point Park Pioneers,597522,7,bot,"Blake Ewing singled to right field, 2 RBI3a Chris Willia scored3a Trevor Jones scored.",76,2025-05-07T00:00:00-04:00,"GoMart Ballpark (Charleston, WV)",0,MBA,2025
6382914,596964,Concord Mountain Lions,597522,Point Park Pioneers,597522,7,bot,Jordon Campb struck out swinging.,77,2025-05-07T00:00:00-04:00,"GoMart Ballpark (Charleston, WV)",0,MBA,2025
6382914,596964,Concord Mountain Lions,597522,Point Park Pioneers,597522,7,bot,Omar Morillo singled to center field3a Blake Ewing advanced to second.,78,2025-05-07T00:00:00-04:00,"GoMart Ballpark (Charleston, WV)",0,MBA,2025
6382914,596964,Concord Mountain Lions,597522,Point Park Pioneers,597522,7,bot,"Isaac Santan doubled to center field, 2 RBI3a Omar Morillo scored3a Blake Ewing scored.",79,2025-05-07T00:00:00-04:00,"GoMart Ballpark (Charleston, WV)",0,MBA,2025
6382914,596964,Concord Mountain Lions,597522,Point Park Pioneers,597522,7,bot,"Jared Campbe homered to left field, 2 RBI3a Isaac Santan scored.",80,2025-05-07T00:00:00-04:00,"GoMart Ballpark (Charleston, WV)",0,MBA,2025
