game_id,away_team_id,away_team_name,home_team_id,home_team_name,batting_team,inning,top_bot,event_text,event_num,game_datetime,stadium_name,attendance,sport_id,season
6382218,596436,VCU Rams,596662,St. Bonaventure Bonnies,596436,1,top,"Flores, N. flied out to rf (0-0).",1,2025-05-02T00:00:00-04:00,"Saint Bonaventure, NY",205,MBA,2025
6382218,596436,VCU Rams,596662,St. Bonaventure Bonnies,596436,1,top,"Kleinman, C. popped up to ss (0-1 K).",2,2025-05-02T00:00:00-04:00,"Saint Bonaventure, NY",205,MBA,2025
6382218,596436,VCU Rams,596662,St. Bonaventure Bonnies,596436,1,top,"Lee, Jacob grounded out to 1b unassisted (0-1 K).",3,2025-05-02T00:00:00-04:00,"Saint Bonaventure, NY",205,MBA,2025
6382218,596436,VCU Rams,596662,St. Bonaventure Bonnies,596662,1,bot,"Tharnish homered to left field, RBI (1-2 KFFBFF).",4,2025-05-02T00:00:00-04:00,"Saint Bonaventure, NY",205,MBA,2025
6382218,596436,VCU Rams,596662,St. Bonaventure Bonnies,596662,1,bot,Marshall lined out to 2b (0-1 K).,5,2025-05-02T00:00:00-04:00,"Saint Bonaventure, NY",205,MBA,2025
6382218,596436,VCU Rams,596662,St. Bonaventure Bonnies,596662,1,bot,"Hoalcraft homered to left field, RBI (0-0).",6,2025-05-02T00:00:00-04:00,"Saint Bonaventure, NY",205,MBA,2025
6382218,596436,VCU Rams,596662,St. Bonaventure Bonnies,596662,1,bot,Kaufman hit by pitch (0-0).,7,2025-05-02T00:00:00-04:00,"Saint Bonaventure, NY",205,MBA,2025
6382218,596436,VCU Rams,596662,St. Bonaventure Bonnies,596662,1,bot,Vercollone singled through the right side (3-2 KFBFBFB)3a Kaufman advanced to second.,8,2025-05-02T00:00:00-04:00,"Saint Bonaventure, NY",205,MBA,2025
6382218,596436,VCU Rams,596662,St. Bonaventure Bonnies,596662,1,bot,Cordeiro struck out swinging (1-2 BFSS).,9,2025-05-02T00:00:00-04:00,"Saint Bonaventure, NY",205,MBA,2025
6382218,596436,VCU Rams,596662,St. Bonaventure Bonnies,596662,1,bot,"Little doubled down the rf line, 2 RBI3a Vercollone scored3a Kaufman scored.",10,2025-05-02T00:00:00-04:00,"Saint Bonaventure, NY",205,MBA,2025
6382218,596436,VCU Rams,596662,St. Bonaventure Bonnies,596662,1,bot,Hebenstreit singled to left field (1-1 KB)3a Little advanced to third.,11,2025-05-02T00:00:00-04:00,"Saint Bonaventure, NY",205,MBA,2025
6382218,596436,VCU Rams,596662,St. Bonaventure Bonnies,596662,1,bot,"Constantine singled, advanced to third on a fielding error by cf, RBI (1-0 B)3a Hebenstreit scored, unearned3a Little scored.",12,2025-05-02T00:00:00-04:00,"Saint Bonaventure, NY",205,MBA,2025
6382218,596436,VCU Rams,596662,St. Bonaventure Bonnies,596662,1,bot,Tharnish popped up to ss (0-0).,13,2025-05-02T00:00:00-04:00,"Saint Bonaventure, NY",205,MBA,2025
6382218,596436,VCU Rams,596662,St. Bonaventure Bonnies,596436,2,top,"Jimenez, A. grounded out to 2b (0-1 K).",14,2025-05-02T00:00:00-04:00,"Saint Bonaventure, NY",205,MBA,2025
6382218,596436,VCU Rams,596662,St. Bonaventure Bonnies,596436,2,top,"Adelman, T. fouled out to 1b (0-1 K).",15,2025-05-02T00:00:00-04:00,"Saint Bonaventure, NY",205,MBA,2025
6382218,596436,VCU Rams,596662,St. Bonaventure Bonnies,596436,2,top,"Swenson, S. lined out to 3b (0-0).",16,2025-05-02T00:00:00-04:00,"Saint Bonaventure, NY",205,MBA,2025
6382218,596436,VCU Rams,596662,St. Bonaventure Bonnies,596662,2,bot,"Marshall homered to center field, RBI (2-2 KBBFFFFFF).",17,2025-05-02T00:00:00-04:00,"Saint Bonaventure, NY",205,MBA,2025
6382218,596436,VCU Rams,596662,St. Bonaventure Bonnies,596662,2,bot,Hoalcraft fouled out to 1b (1-0 B).,18,2025-05-02T00:00:00-04:00,"Saint Bonaventure, NY",205,MBA,2025
6382218,596436,VCU Rams,596662,St. Bonaventure Bonnies,596662,2,bot,Kaufman struck out swinging (1-2 BSSS).,19,2025-05-02T00:00:00-04:00,"Saint Bonaventure, NY",205,MBA,2025
6382218,596436,VCU Rams,596662,St. Bonaventure Bonnies,596662,2,bot,Vercollone struck out looking (1-2 KFBFK).,20,2025-05-02T00:00:00-04:00,"Saint Bonaventure, NY",205,MBA,2025
6382218,596436,VCU Rams,596662,St. Bonaventure Bonnies,596436,3,top,"Werchan, S. doubled to left center (0-0).",21,2025-05-02T00:00:00-04:00,"Saint Bonaventure, NY",205,MBA,2025
6382218,596436,VCU Rams,596662,St. Bonaventure Bonnies,596436,3,top,"AprilGath flied out to rf (0-2 KKFF)3a Werchan, S. advanced to third.",22,2025-05-02T00:00:00-04:00,"Saint Bonaventure, NY",205,MBA,2025
6382218,596436,VCU Rams,596662,St. Bonaventure Bonnies,596436,3,top,"Sullivan, S. grounded out to ss, RBI (2-2 KBFB)3a Werchan, S. scored.",23,2025-05-02T00:00:00-04:00,"Saint Bonaventure, NY",205,MBA,2025
6382218,596436,VCU Rams,596662,St. Bonaventure Bonnies,596436,3,top,"Flores, N. lined out to p (1-0 B).",24,2025-05-02T00:00:00-04:00,"Saint Bonaventure, NY",205,MBA,2025
6382218,596436,VCU Rams,596662,St. Bonaventure Bonnies,596662,3,bot,Cordeiro walked (3-0 BBBB).,25,2025-05-02T00:00:00-04:00,"Saint Bonaventure, NY",205,MBA,2025
6382218,596436,VCU Rams,596662,St. Bonaventure Bonnies,596662,3,bot,Little flied out to lf (2-2 KBFB).,26,2025-05-02T00:00:00-04:00,"Saint Bonaventure, NY",205,MBA,2025
6382218,596436,VCU Rams,596662,St. Bonaventure Bonnies,596662,3,bot,Hebenstreit grounded out to ss (3-1 BBFB)3a Cordeiro advanced to second.,27,2025-05-02T00:00:00-04:00,"Saint Bonaventure, NY",205,MBA,2025
6382218,596436,VCU Rams,596662,St. Bonaventure Bonnies,596662,3,bot,"Constantine doubled down the lf line, RBI (0-0)3a Cordeiro scored.",28,2025-05-02T00:00:00-04:00,"Saint Bonaventure, NY",205,MBA,2025
6382218,596436,VCU Rams,596662,St. Bonaventure Bonnies,596662,3,bot,Tharnish fouled out to 1b (2-1 BBF).,29,2025-05-02T00:00:00-04:00,"Saint Bonaventure, NY",205,MBA,2025
6382218,596436,VCU Rams,596662,St. Bonaventure Bonnies,596436,4,top,"Kleinman, C. flied out to cf (0-1 K).",30,2025-05-02T00:00:00-04:00,"Saint Bonaventure, NY",205,MBA,2025
6382218,596436,VCU Rams,596662,St. Bonaventure Bonnies,596436,4,top,"Lee, Jacob homered to left center, RBI (0-0).",31,2025-05-02T00:00:00-04:00,"Saint Bonaventure, NY",205,MBA,2025
6382218,596436,VCU Rams,596662,St. Bonaventure Bonnies,596436,4,top,"Jimenez, A. reached on a throwing error by ss (1-1 FB).",32,2025-05-02T00:00:00-04:00,"Saint Bonaventure, NY",205,MBA,2025
6382218,596436,VCU Rams,596662,St. Bonaventure Bonnies,596436,4,top,"Adelman, T. struck out swinging (1-2 KFFBS).",33,2025-05-02T00:00:00-04:00,"Saint Bonaventure, NY",205,MBA,2025
6382218,596436,VCU Rams,596662,St. Bonaventure Bonnies,596436,4,top,"Swenson, S. struck out swinging (0-2 FFS).",34,2025-05-02T00:00:00-04:00,"Saint Bonaventure, NY",205,MBA,2025
6382218,596436,VCU Rams,596662,St. Bonaventure Bonnies,596662,4,bot,"Moore, M. to p for Tappy, O..",35,2025-05-02T00:00:00-04:00,"Saint Bonaventure, NY",205,MBA,2025
6382218,596436,VCU Rams,596662,St. Bonaventure Bonnies,596662,4,bot,Marshall singled through the left side (0-1 K).,36,2025-05-02T00:00:00-04:00,"Saint Bonaventure, NY",205,MBA,2025
6382218,596436,VCU Rams,596662,St. Bonaventure Bonnies,596662,4,bot,Hoalcraft flied out to rf (0-0).,37,2025-05-02T00:00:00-04:00,"Saint Bonaventure, NY",205,MBA,2025
6382218,596436,VCU Rams,596662,St. Bonaventure Bonnies,596662,4,bot,Kaufman struck out swinging (3-2 BBBFFS).,38,2025-05-02T00:00:00-04:00,"Saint Bonaventure, NY",205,MBA,2025
6382218,596436,VCU Rams,596662,St. Bonaventure Bonnies,596662,4,bot,Vercollone struck out looking (1-2 SKFBK).,39,2025-05-02T00:00:00-04:00,"Saint Bonaventure, NY",205,MBA,2025
6382218,596436,VCU Rams,596662,St. Bonaventure Bonnies,596436,5,top,"Werchan, S. struck out swinging (0-2 KFS).",40,2025-05-02T00:00:00-04:00,"Saint Bonaventure, NY",205,MBA,2025
6382218,596436,VCU Rams,596662,St. Bonaventure Bonnies,596436,5,top,AprilGath singled up the middle (0-0).,41,2025-05-02T00:00:00-04:00,"Saint Bonaventure, NY",205,MBA,2025
6382218,596436,VCU Rams,596662,St. Bonaventure Bonnies,596436,5,top,"Sullivan, S. lined out to 2b (0-2 KF).",42,2025-05-02T00:00:00-04:00,"Saint Bonaventure, NY",205,MBA,2025
6382218,596436,VCU Rams,596662,St. Bonaventure Bonnies,596436,5,top,"Flores, N. grounded out to 3b (0-0).",43,2025-05-02T00:00:00-04:00,"Saint Bonaventure, NY",205,MBA,2025
6382218,596436,VCU Rams,596662,St. Bonaventure Bonnies,596662,5,bot,Cordeiro flied out to rf (0-1 S).,44,2025-05-02T00:00:00-04:00,"Saint Bonaventure, NY",205,MBA,2025
6382218,596436,VCU Rams,596662,St. Bonaventure Bonnies,596662,5,bot,Little flied out to lf (1-0 B).,45,2025-05-02T00:00:00-04:00,"Saint Bonaventure, NY",205,MBA,2025
6382218,596436,VCU Rams,596662,St. Bonaventure Bonnies,596662,5,bot,Hebenstreit struck out looking (2-2 KBKBK).,46,2025-05-02T00:00:00-04:00,"Saint Bonaventure, NY",205,MBA,2025
6382218,596436,VCU Rams,596662,St. Bonaventure Bonnies,596436,6,top,"Kleinman, C. flied out to cf (0-0).",47,2025-05-02T00:00:00-04:00,"Saint Bonaventure, NY",205,MBA,2025
6382218,596436,VCU Rams,596662,St. Bonaventure Bonnies,596436,6,top,"Lee, Jacob singled to left field (0-0).",48,2025-05-02T00:00:00-04:00,"Saint Bonaventure, NY",205,MBA,2025
6382218,596436,VCU Rams,596662,St. Bonaventure Bonnies,596436,6,top,"Jimenez, A. singled through the right side (3-2 BSBKB)3a Lee, Jacob advanced to third.",49,2025-05-02T00:00:00-04:00,"Saint Bonaventure, NY",205,MBA,2025
6382218,596436,VCU Rams,596662,St. Bonaventure Bonnies,596436,6,top,"Adelman, T. popped up to 1b (0-1 F).",50,2025-05-02T00:00:00-04:00,"Saint Bonaventure, NY",205,MBA,2025
6382218,596436,VCU Rams,596662,St. Bonaventure Bonnies,596436,6,top,"Swenson, S. singled through the right side, RBI3a Jimenez, A. advanced to second3a Lee, Jacob scored.",51,2025-05-02T00:00:00-04:00,"Saint Bonaventure, NY",205,MBA,2025
6382218,596436,VCU Rams,596662,St. Bonaventure Bonnies,596436,6,top,"Werchan, S. struck out swinging (1-2 KBFS).",52,2025-05-02T00:00:00-04:00,"Saint Bonaventure, NY",205,MBA,2025
6382218,596436,VCU Rams,596662,St. Bonaventure Bonnies,596662,6,bot,Constantine struck out swinging (1-2 BKKS).,53,2025-05-02T00:00:00-04:00,"Saint Bonaventure, NY",205,MBA,2025
6382218,596436,VCU Rams,596662,St. Bonaventure Bonnies,596662,6,bot,Tharnish flied out to rf (0-0).,54,2025-05-02T00:00:00-04:00,"Saint Bonaventure, NY",205,MBA,2025
6382218,596436,VCU Rams,596662,St. Bonaventure Bonnies,596662,6,bot,Marshall grounded out to 2b (0-0).,55,2025-05-02T00:00:00-04:00,"Saint Bonaventure, NY",205,MBA,2025
6382218,596436,VCU Rams,596662,St. Bonaventure Bonnies,596436,7,top,AprilGath singled to center field (0-1 K).,56,2025-05-02T00:00:00-04:00,"Saint Bonaventure, NY",205,MBA,2025
6382218,596436,VCU Rams,596662,St. Bonaventure Bonnies,596436,7,top,"Sullivan, S. flied out to cf (2-2 FFBB).",57,2025-05-02T00:00:00-04:00,"Saint Bonaventure, NY",205,MBA,2025
6382218,596436,VCU Rams,596662,St. Bonaventure Bonnies,596436,7,top,"AprilGath out at second c to 2b, caught stealing.",58,2025-05-02T00:00:00-04:00,"Saint Bonaventure, NY",205,MBA,2025
6382218,596436,VCU Rams,596662,St. Bonaventure Bonnies,596436,7,top,"Flores, N. grounded out to 1b unassisted (1-2 BKK).",59,2025-05-02T00:00:00-04:00,"Saint Bonaventure, NY",205,MBA,2025
6382218,596436,VCU Rams,596662,St. Bonaventure Bonnies,596662,7,bot,Hoalcraft singled to left field (1-2 KFFB).,60,2025-05-02T00:00:00-04:00,"Saint Bonaventure, NY",205,MBA,2025
6382218,596436,VCU Rams,596662,St. Bonaventure Bonnies,596662,7,bot,Kaufman reached on a fielder's choice (0-0)3a Hoalcraft out at second 2b to ss.,61,2025-05-02T00:00:00-04:00,"Saint Bonaventure, NY",205,MBA,2025
6382218,596436,VCU Rams,596662,St. Bonaventure Bonnies,596662,7,bot,Vercollone struck out swinging (2-2 BBSKS).,62,2025-05-02T00:00:00-04:00,"Saint Bonaventure, NY",205,MBA,2025
6382218,596436,VCU Rams,596662,St. Bonaventure Bonnies,596662,7,bot,Cordeiro reached on a fielder's choice (1-1 BK)3a Kaufman out at second 3b to 2b.,63,2025-05-02T00:00:00-04:00,"Saint Bonaventure, NY",205,MBA,2025
6382218,596436,VCU Rams,596662,St. Bonaventure Bonnies,596436,8,top,"Kleinman, C. flied out to lf (0-1 K).",64,2025-05-02T00:00:00-04:00,"Saint Bonaventure, NY",205,MBA,2025
6382218,596436,VCU Rams,596662,St. Bonaventure Bonnies,596436,8,top,"Lee, Jacob flied out to cf (1-1 SB).",65,2025-05-02T00:00:00-04:00,"Saint Bonaventure, NY",205,MBA,2025
6382218,596436,VCU Rams,596662,St. Bonaventure Bonnies,596436,8,top,"Jimenez, A. singled up the middle (1-1 KB).",66,2025-05-02T00:00:00-04:00,"Saint Bonaventure, NY",205,MBA,2025
6382218,596436,VCU Rams,596662,St. Bonaventure Bonnies,596436,8,top,"Adelman, T. singled to second base (0-0)3a Jimenez, A. advanced to second.",67,2025-05-02T00:00:00-04:00,"Saint Bonaventure, NY",205,MBA,2025
6382218,596436,VCU Rams,596662,St. Bonaventure Bonnies,596436,8,top,"Swenson, S. fouled out to ss (2-2 BKBFFF).",68,2025-05-02T00:00:00-04:00,"Saint Bonaventure, NY",205,MBA,2025
6382218,596436,VCU Rams,596662,St. Bonaventure Bonnies,596662,8,bot,Mannino pinch hit for Little.,69,2025-05-02T00:00:00-04:00,"Saint Bonaventure, NY",205,MBA,2025
6382218,596436,VCU Rams,596662,St. Bonaventure Bonnies,596662,8,bot,Mannino singled to shortstop (0-1 K).,70,2025-05-02T00:00:00-04:00,"Saint Bonaventure, NY",205,MBA,2025
6382218,596436,VCU Rams,596662,St. Bonaventure Bonnies,596662,8,bot,Hebenstreit walked (3-1 BFBBB)3a Mannino advanced to second.,71,2025-05-02T00:00:00-04:00,"Saint Bonaventure, NY",205,MBA,2025
6382218,596436,VCU Rams,596662,St. Bonaventure Bonnies,596662,8,bot,Constantine struck out swinging (1-2 FBKS).,72,2025-05-02T00:00:00-04:00,"Saint Bonaventure, NY",205,MBA,2025
6382218,596436,VCU Rams,596662,St. Bonaventure Bonnies,596662,8,bot,Tharnish reached on a fielder's choice (0-0)3a Hebenstreit out at second ss to 2b3a Mannino advanced to third.,73,2025-05-02T00:00:00-04:00,"Saint Bonaventure, NY",205,MBA,2025
6382218,596436,VCU Rams,596662,St. Bonaventure Bonnies,596662,8,bot,"Marshall reached on a fielding error by 3b3a Tharnish advanced to third3a Mannino scored, unearned.",74,2025-05-02T00:00:00-04:00,"Saint Bonaventure, NY",205,MBA,2025
6382218,596436,VCU Rams,596662,St. Bonaventure Bonnies,596662,8,bot,Hoalcraft flied out to rf (0-0).,75,2025-05-02T00:00:00-04:00,"Saint Bonaventure, NY",205,MBA,2025
6382218,596436,VCU Rams,596662,St. Bonaventure Bonnies,596436,9,top,Mannino to 1b.,76,2025-05-02T00:00:00-04:00,"Saint Bonaventure, NY",205,MBA,2025
6382218,596436,VCU Rams,596662,St. Bonaventure Bonnies,596436,9,top,"Werchan, S. singled to shortstop (3-1 BBKB).",77,2025-05-02T00:00:00-04:00,"Saint Bonaventure, NY",205,MBA,2025
6382218,596436,VCU Rams,596662,St. Bonaventure Bonnies,596436,9,top,"AprilGath singled to center field (0-0)3a Werchan, S. advanced to second.",78,2025-05-02T00:00:00-04:00,"Saint Bonaventure, NY",205,MBA,2025
6382218,596436,VCU Rams,596662,St. Bonaventure Bonnies,596436,9,top,"Sullivan, S. singled to center field (2-1 BKB)3a AprilGath advanced to second3a Werchan, S. advanced to third.",79,2025-05-02T00:00:00-04:00,"Saint Bonaventure, NY",205,MBA,2025
6382218,596436,VCU Rams,596662,St. Bonaventure Bonnies,596436,9,top,"Flores, N. singled through the left side, RBI (0-2 KFF)3a Sullivan, S. advanced to second3a AprilGath advanced to third3a Werchan, S. scored.",80,2025-05-02T00:00:00-04:00,"Saint Bonaventure, NY",205,MBA,2025
6382218,596436,VCU Rams,596662,St. Bonaventure Bonnies,596436,9,top,Watts to p for Moore.,81,2025-05-02T00:00:00-04:00,"Saint Bonaventure, NY",205,MBA,2025
6382218,596436,VCU Rams,596662,St. Bonaventure Bonnies,596436,9,top,"Kleinman, C. reached on a fielder's choice, RBI (0-1 K)3a Flores, N. out at second 2b to ss3a Sullivan, S. advanced to third3a AprilGath scored.",82,2025-05-02T00:00:00-04:00,"Saint Bonaventure, NY",205,MBA,2025
6382218,596436,VCU Rams,596662,St. Bonaventure Bonnies,596436,9,top,"Lee, Jacob walked (3-1 FBBBB)3a Kleinman, C. advanced to second.",83,2025-05-02T00:00:00-04:00,"Saint Bonaventure, NY",205,MBA,2025
6382218,596436,VCU Rams,596662,St. Bonaventure Bonnies,596436,9,top,"Jimenez, A. walked, RBI (3-2 KBBKFBB)3a Lee, Jacob advanced to second3a Kleinman, C. advanced to third3a Sullivan, S. scored.",84,2025-05-02T00:00:00-04:00,"Saint Bonaventure, NY",205,MBA,2025
6382218,596436,VCU Rams,596662,St. Bonaventure Bonnies,596436,9,top,James to p for Watts.,85,2025-05-02T00:00:00-04:00,"Saint Bonaventure, NY",205,MBA,2025
6382218,596436,VCU Rams,596662,St. Bonaventure Bonnies,596436,9,top,"Adelman, T. flied out to rf, SF, RBI (1-2 BKKFF)3a Lee, Jacob advanced to third3a Kleinman, C. scored.",86,2025-05-02T00:00:00-04:00,"Saint Bonaventure, NY",205,MBA,2025
6382218,596436,VCU Rams,596662,St. Bonaventure Bonnies,596436,9,top,"Swenson, S. doubled to left center, 2 RBI (1-0 B)3a Jimenez, A. scored3a Lee, Jacob scored.",87,2025-05-02T00:00:00-04:00,"Saint Bonaventure, NY",205,MBA,2025
6382218,596436,VCU Rams,596662,St. Bonaventure Bonnies,596436,9,top,"Werchan, S. hit by pitch (2-1 KBB).",88,2025-05-02T00:00:00-04:00,"Saint Bonaventure, NY",205,MBA,2025
6382218,596436,VCU Rams,596662,St. Bonaventure Bonnies,596436,9,top,AprilGath lined out to cf (0-0).,89,2025-05-02T00:00:00-04:00,"Saint Bonaventure, NY",205,MBA,2025
6382218,596436,VCU Rams,596662,St. Bonaventure Bonnies,596662,9,bot,"Peters, Z. to p for Moore, M..",90,2025-05-02T00:00:00-04:00,"Saint Bonaventure, NY",205,MBA,2025
6382218,596436,VCU Rams,596662,St. Bonaventure Bonnies,596662,9,bot,Kaufman flied out to cf (0-0).,91,2025-05-02T00:00:00-04:00,"Saint Bonaventure, NY",205,MBA,2025
6382218,596436,VCU Rams,596662,St. Bonaventure Bonnies,596662,9,bot,Vercollone walked (3-0 BBBB).,92,2025-05-02T00:00:00-04:00,"Saint Bonaventure, NY",205,MBA,2025
6382218,596436,VCU Rams,596662,St. Bonaventure Bonnies,596662,9,bot,Vercollone advanced to second on a wild pitch.,93,2025-05-02T00:00:00-04:00,"Saint Bonaventure, NY",205,MBA,2025
6382218,596436,VCU Rams,596662,St. Bonaventure Bonnies,596662,9,bot,Cordeiro struck out looking (2-2 SSBFBFK).,94,2025-05-02T00:00:00-04:00,"Saint Bonaventure, NY",205,MBA,2025
6382218,596436,VCU Rams,596662,St. Bonaventure Bonnies,596662,9,bot,Mannino hit by pitch (0-1 F).,95,2025-05-02T00:00:00-04:00,"Saint Bonaventure, NY",205,MBA,2025
6382218,596436,VCU Rams,596662,St. Bonaventure Bonnies,596662,9,bot,"Hebenstreit struck out swinging, out at first c to 1b (0-2 KKS).",96,2025-05-02T00:00:00-04:00,"Saint Bonaventure, NY",205,MBA,2025
6382218,596436,VCU Rams,596662,St. Bonaventure Bonnies,596436,10,top,"Sullivan, S. grounded out to 1b unassisted (0-1 K).",97,2025-05-02T00:00:00-04:00,"Saint Bonaventure, NY",205,MBA,2025
6382218,596436,VCU Rams,596662,St. Bonaventure Bonnies,596436,10,top,"Flores, N. hit by pitch (0-1 K).",98,2025-05-02T00:00:00-04:00,"Saint Bonaventure, NY",205,MBA,2025
6382218,596436,VCU Rams,596662,St. Bonaventure Bonnies,596436,10,top,"Kleinman, C. flied out to lf (1-1 KB).",99,2025-05-02T00:00:00-04:00,"Saint Bonaventure, NY",205,MBA,2025
6382218,596436,VCU Rams,596662,St. Bonaventure Bonnies,596436,10,top,"Lee, Jacob hit by pitch (0-0)3a Flores, N. advanced to second.",100,2025-05-02T00:00:00-04:00,"Saint Bonaventure, NY",205,MBA,2025
6382218,596436,VCU Rams,596662,St. Bonaventure Bonnies,596436,10,top,"Jimenez, A. struck out swinging (3-2 BKBKBS).",101,2025-05-02T00:00:00-04:00,"Saint Bonaventure, NY",205,MBA,2025
6382218,596436,VCU Rams,596662,St. Bonaventure Bonnies,596662,10,bot,Constantine popped up to ss (0-0).,102,2025-05-02T00:00:00-04:00,"Saint Bonaventure, NY",205,MBA,2025
6382218,596436,VCU Rams,596662,St. Bonaventure Bonnies,596662,10,bot,Tharnish singled through the right side (0-2 KSF).,103,2025-05-02T00:00:00-04:00,"Saint Bonaventure, NY",205,MBA,2025
6382218,596436,VCU Rams,596662,St. Bonaventure Bonnies,596662,10,bot,"Tharnish advanced to second on an error by p, failed pickoff attempt.",104,2025-05-02T00:00:00-04:00,"Saint Bonaventure, NY",205,MBA,2025
6382218,596436,VCU Rams,596662,St. Bonaventure Bonnies,596662,10,bot,Marshall grounded out to 2b (1-2 FFB)3a Tharnish advanced to third.,105,2025-05-02T00:00:00-04:00,"Saint Bonaventure, NY",205,MBA,2025
6382218,596436,VCU Rams,596662,St. Bonaventure Bonnies,596662,10,bot,Hoalcraft intentionally walked (0-0).,106,2025-05-02T00:00:00-04:00,"Saint Bonaventure, NY",205,MBA,2025
6382218,596436,VCU Rams,596662,St. Bonaventure Bonnies,596662,10,bot,Hoalcraft stole second.,107,2025-05-02T00:00:00-04:00,"Saint Bonaventure, NY",205,MBA,2025
6382218,596436,VCU Rams,596662,St. Bonaventure Bonnies,596662,10,bot,Kaufman walked (3-2 FBBBKB).,108,2025-05-02T00:00:00-04:00,"Saint Bonaventure, NY",205,MBA,2025
6382218,596436,VCU Rams,596662,St. Bonaventure Bonnies,596662,10,bot,Vercollone struck out looking (1-2 FBSK).,109,2025-05-02T00:00:00-04:00,"Saint Bonaventure, NY",205,MBA,2025
6382218,596436,VCU Rams,596662,St. Bonaventure Bonnies,596436,11,top,Saunders to p for James.,110,2025-05-02T00:00:00-04:00,"Saint Bonaventure, NY",205,MBA,2025
6382218,596436,VCU Rams,596662,St. Bonaventure Bonnies,596436,11,top,"Adelman, T. popped up to 2b (0-1 K).",111,2025-05-02T00:00:00-04:00,"Saint Bonaventure, NY",205,MBA,2025
6382218,596436,VCU Rams,596662,St. Bonaventure Bonnies,596436,11,top,"Swenson, S. popped up to 1b (0-0).",112,2025-05-02T00:00:00-04:00,"Saint Bonaventure, NY",205,MBA,2025
6382218,596436,VCU Rams,596662,St. Bonaventure Bonnies,596436,11,top,"Werchan, S. walked (3-2 BBBKFFB).",113,2025-05-02T00:00:00-04:00,"Saint Bonaventure, NY",205,MBA,2025
6382218,596436,VCU Rams,596662,St. Bonaventure Bonnies,596436,11,top,"Werchan, S. stole second.",114,2025-05-02T00:00:00-04:00,"Saint Bonaventure, NY",205,MBA,2025
6382218,596436,VCU Rams,596662,St. Bonaventure Bonnies,596436,11,top,"AprilGath singled to shortstop (1-1 KB)3a Werchan, S. advanced to third.",115,2025-05-02T00:00:00-04:00,"Saint Bonaventure, NY",205,MBA,2025
6382218,596436,VCU Rams,596662,St. Bonaventure Bonnies,596436,11,top,"Sullivan, S. grounded out to p (0-1 K).",116,2025-05-02T00:00:00-04:00,"Saint Bonaventure, NY",205,MBA,2025
6382218,596436,VCU Rams,596662,St. Bonaventure Bonnies,596662,11,bot,Cordeiro flied out to cf (2-1 BBK).,117,2025-05-02T00:00:00-04:00,"Saint Bonaventure, NY",205,MBA,2025
6382218,596436,VCU Rams,596662,St. Bonaventure Bonnies,596662,11,bot,Mannino singled to left field (0-0).,118,2025-05-02T00:00:00-04:00,"Saint Bonaventure, NY",205,MBA,2025
6382218,596436,VCU Rams,596662,St. Bonaventure Bonnies,596662,11,bot,Davis pinch hit for Hebenstreit.,119,2025-05-02T00:00:00-04:00,"Saint Bonaventure, NY",205,MBA,2025
6382218,596436,VCU Rams,596662,St. Bonaventure Bonnies,596662,11,bot,Vossen pinch ran for Mannino.,120,2025-05-02T00:00:00-04:00,"Saint Bonaventure, NY",205,MBA,2025
6382218,596436,VCU Rams,596662,St. Bonaventure Bonnies,596662,11,bot,Davis grounded out to 2b (1-2 BKF)3a Vossen advanced to second.,121,2025-05-02T00:00:00-04:00,"Saint Bonaventure, NY",205,MBA,2025
6382218,596436,VCU Rams,596662,St. Bonaventure Bonnies,596662,11,bot,"Constantine singled down the rf line, RBI (1-0 B)3a Vossen scored.",122,2025-05-02T00:00:00-04:00,"Saint Bonaventure, NY",205,MBA,2025
