game_id,away_team_id,away_team_name,home_team_id,home_team_name,batting_team,inning,top_bot,event_text,event_num,game_datetime,stadium_name,attendance,sport_id,season
6383816,596473,FGCU Eagles,596947,West Ga. Wolves,596473,1,top,McKee lined out to ss.,1,2025-05-09T00:00:00-04:00,"Cole Field (Carrollton, GA)",237,MBA,2025
6383816,596473,FGCU Eagles,596947,West Ga. Wolves,596473,1,top,Dempsey doubled to left field.,2,2025-05-09T00:00:00-04:00,"Cole Field (Carrollton, GA)",237,MBA,2025
6383816,596473,FGCU Eagles,596947,West Ga. Wolves,596473,1,top,Hessemyer popped up to 2b.,3,2025-05-09T00:00:00-04:00,"Cole Field (Carrollton, GA)",237,MBA,2025
6383816,596473,FGCU Eagles,596947,West Ga. Wolves,596473,1,top,Nelson struck out swinging.,4,2025-05-09T00:00:00-04:00,"Cole Field (Carrollton, GA)",237,MBA,2025
6383816,596473,FGCU Eagles,596947,West Ga. Wolves,596947,1,bot,J. Witmer grounded out to 3b.,5,2025-05-09T00:00:00-04:00,"Cole Field (Carrollton, GA)",237,MBA,2025
6383816,596473,FGCU Eagles,596947,West Ga. Wolves,596947,1,bot,C. Prince grounded out to ss.,6,2025-05-09T00:00:00-04:00,"Cole Field (Carrollton, GA)",237,MBA,2025
6383816,596473,FGCU Eagles,596947,West Ga. Wolves,596947,1,bot,L. Weidner struck out swinging.,7,2025-05-09T00:00:00-04:00,"Cole Field (Carrollton, GA)",237,MBA,2025
6383816,596473,FGCU Eagles,596947,West Ga. Wolves,596473,2,top,Povey struck out looking.,8,2025-05-09T00:00:00-04:00,"Cole Field (Carrollton, GA)",237,MBA,2025
6383816,596473,FGCU Eagles,596947,West Ga. Wolves,596473,2,top,Embury singled through the right side.,9,2025-05-09T00:00:00-04:00,"Cole Field (Carrollton, GA)",237,MBA,2025
6383816,596473,FGCU Eagles,596947,West Ga. Wolves,596473,2,top,Herb flied out to lf.,10,2025-05-09T00:00:00-04:00,"Cole Field (Carrollton, GA)",237,MBA,2025
6383816,596473,FGCU Eagles,596947,West Ga. Wolves,596473,2,top,Moise flied out to rf.,11,2025-05-09T00:00:00-04:00,"Cole Field (Carrollton, GA)",237,MBA,2025
6383816,596473,FGCU Eagles,596947,West Ga. Wolves,596947,2,bot,C. Dierdorf struck out swinging.,12,2025-05-09T00:00:00-04:00,"Cole Field (Carrollton, GA)",237,MBA,2025
6383816,596473,FGCU Eagles,596947,West Ga. Wolves,596947,2,bot,B. McDevitt grounded out to 3b.,13,2025-05-09T00:00:00-04:00,"Cole Field (Carrollton, GA)",237,MBA,2025
6383816,596473,FGCU Eagles,596947,West Ga. Wolves,596947,2,bot,B. Brand flied out to lf.,14,2025-05-09T00:00:00-04:00,"Cole Field (Carrollton, GA)",237,MBA,2025
6383816,596473,FGCU Eagles,596947,West Ga. Wolves,596473,3,top,"Gagnon homered to right field, RBI.",15,2025-05-09T00:00:00-04:00,"Cole Field (Carrollton, GA)",237,MBA,2025
6383816,596473,FGCU Eagles,596947,West Ga. Wolves,596473,3,top,McKee flied out to rf.,16,2025-05-09T00:00:00-04:00,"Cole Field (Carrollton, GA)",237,MBA,2025
6383816,596473,FGCU Eagles,596947,West Ga. Wolves,596473,3,top,Dempsey singled to pitcher.,17,2025-05-09T00:00:00-04:00,"Cole Field (Carrollton, GA)",237,MBA,2025
6383816,596473,FGCU Eagles,596947,West Ga. Wolves,596473,3,top,Hessemyer singled through the right side3a Dempsey advanced to third.,18,2025-05-09T00:00:00-04:00,"Cole Field (Carrollton, GA)",237,MBA,2025
6383816,596473,FGCU Eagles,596947,West Ga. Wolves,596473,3,top,Hessemyer stole second.,19,2025-05-09T00:00:00-04:00,"Cole Field (Carrollton, GA)",237,MBA,2025
6383816,596473,FGCU Eagles,596947,West Ga. Wolves,596473,3,top,Nelson popped up to rf.,20,2025-05-09T00:00:00-04:00,"Cole Field (Carrollton, GA)",237,MBA,2025
6383816,596473,FGCU Eagles,596947,West Ga. Wolves,596473,3,top,"Povey tripled to right field, 2 RBI3a Hessemyer scored3a Dempsey scored.",21,2025-05-09T00:00:00-04:00,"Cole Field (Carrollton, GA)",237,MBA,2025
6383816,596473,FGCU Eagles,596947,West Ga. Wolves,596473,3,top,"Embury homered, 2 RBI3a Povey scored.",22,2025-05-09T00:00:00-04:00,"Cole Field (Carrollton, GA)",237,MBA,2025
6383816,596473,FGCU Eagles,596947,West Ga. Wolves,596473,3,top,Herb singled through the right side.,23,2025-05-09T00:00:00-04:00,"Cole Field (Carrollton, GA)",237,MBA,2025
6383816,596473,FGCU Eagles,596947,West Ga. Wolves,596473,3,top,Moise singled to left field3a Herb advanced to third.,24,2025-05-09T00:00:00-04:00,"Cole Field (Carrollton, GA)",237,MBA,2025
6383816,596473,FGCU Eagles,596947,West Ga. Wolves,596473,3,top,Moise stole second.,25,2025-05-09T00:00:00-04:00,"Cole Field (Carrollton, GA)",237,MBA,2025
6383816,596473,FGCU Eagles,596947,West Ga. Wolves,596473,3,top,Gagnon walked.,26,2025-05-09T00:00:00-04:00,"Cole Field (Carrollton, GA)",237,MBA,2025
6383816,596473,FGCU Eagles,596947,West Ga. Wolves,596473,3,top,"McKee doubled to center field, 3 RBI3a Gagnon scored3a Moise scored3a Herb scored.",27,2025-05-09T00:00:00-04:00,"Cole Field (Carrollton, GA)",237,MBA,2025
6383816,596473,FGCU Eagles,596947,West Ga. Wolves,596473,3,top,Dempsey lined out to 1b.,28,2025-05-09T00:00:00-04:00,"Cole Field (Carrollton, GA)",237,MBA,2025
6383816,596473,FGCU Eagles,596947,West Ga. Wolves,596947,3,bot,J. Bowman grounded out to 2b.,29,2025-05-09T00:00:00-04:00,"Cole Field (Carrollton, GA)",237,MBA,2025
6383816,596473,FGCU Eagles,596947,West Ga. Wolves,596947,3,bot,M. Cooper singled through the left side.,30,2025-05-09T00:00:00-04:00,"Cole Field (Carrollton, GA)",237,MBA,2025
6383816,596473,FGCU Eagles,596947,West Ga. Wolves,596947,3,bot,T. Presnell struck out swinging.,31,2025-05-09T00:00:00-04:00,"Cole Field (Carrollton, GA)",237,MBA,2025
6383816,596473,FGCU Eagles,596947,West Ga. Wolves,596947,3,bot,M. Cooper advanced to second on a wild pitch.,32,2025-05-09T00:00:00-04:00,"Cole Field (Carrollton, GA)",237,MBA,2025
6383816,596473,FGCU Eagles,596947,West Ga. Wolves,596947,3,bot,J. Witmer struck out swinging.,33,2025-05-09T00:00:00-04:00,"Cole Field (Carrollton, GA)",237,MBA,2025
6383816,596473,FGCU Eagles,596947,West Ga. Wolves,596473,4,top,W. Dean to p for S. Cole.,34,2025-05-09T00:00:00-04:00,"Cole Field (Carrollton, GA)",237,MBA,2025
6383816,596473,FGCU Eagles,596947,West Ga. Wolves,596473,4,top,Hessemyer struck out swinging.,35,2025-05-09T00:00:00-04:00,"Cole Field (Carrollton, GA)",237,MBA,2025
6383816,596473,FGCU Eagles,596947,West Ga. Wolves,596473,4,top,Nelson struck out looking.,36,2025-05-09T00:00:00-04:00,"Cole Field (Carrollton, GA)",237,MBA,2025
6383816,596473,FGCU Eagles,596947,West Ga. Wolves,596473,4,top,Povey struck out swinging.,37,2025-05-09T00:00:00-04:00,"Cole Field (Carrollton, GA)",237,MBA,2025
6383816,596473,FGCU Eagles,596947,West Ga. Wolves,596947,4,bot,C. Prince grounded out to 2b.,38,2025-05-09T00:00:00-04:00,"Cole Field (Carrollton, GA)",237,MBA,2025
6383816,596473,FGCU Eagles,596947,West Ga. Wolves,596947,4,bot,L. Weidner struck out swinging.,39,2025-05-09T00:00:00-04:00,"Cole Field (Carrollton, GA)",237,MBA,2025
6383816,596473,FGCU Eagles,596947,West Ga. Wolves,596947,4,bot,C. Dierdorf struck out swinging.,40,2025-05-09T00:00:00-04:00,"Cole Field (Carrollton, GA)",237,MBA,2025
6383816,596473,FGCU Eagles,596947,West Ga. Wolves,596473,5,top,Embury doubled to center field.,41,2025-05-09T00:00:00-04:00,"Cole Field (Carrollton, GA)",237,MBA,2025
6383816,596473,FGCU Eagles,596947,West Ga. Wolves,596473,5,top,Herb singled to right field3a Embury advanced to third.,42,2025-05-09T00:00:00-04:00,"Cole Field (Carrollton, GA)",237,MBA,2025
6383816,596473,FGCU Eagles,596947,West Ga. Wolves,596473,5,top,Moise grounded into double play ss to 2b to 1b3a Herb out on the play3a Embury scored.,43,2025-05-09T00:00:00-04:00,"Cole Field (Carrollton, GA)",237,MBA,2025
6383816,596473,FGCU Eagles,596947,West Ga. Wolves,596473,5,top,Gagnon grounded out to 3b.,44,2025-05-09T00:00:00-04:00,"Cole Field (Carrollton, GA)",237,MBA,2025
6383816,596473,FGCU Eagles,596947,West Ga. Wolves,596947,5,bot,B. McDevitt singled through the right side.,45,2025-05-09T00:00:00-04:00,"Cole Field (Carrollton, GA)",237,MBA,2025
6383816,596473,FGCU Eagles,596947,West Ga. Wolves,596947,5,bot,B. Brand reached on a fielder's choice3a B. McDevitt out at second 2b to ss.,46,2025-05-09T00:00:00-04:00,"Cole Field (Carrollton, GA)",237,MBA,2025
6383816,596473,FGCU Eagles,596947,West Ga. Wolves,596947,5,bot,J. Bowman struck out swinging.,47,2025-05-09T00:00:00-04:00,"Cole Field (Carrollton, GA)",237,MBA,2025
6383816,596473,FGCU Eagles,596947,West Ga. Wolves,596947,5,bot,M. Cooper struck out looking.,48,2025-05-09T00:00:00-04:00,"Cole Field (Carrollton, GA)",237,MBA,2025
6383816,596473,FGCU Eagles,596947,West Ga. Wolves,596473,6,top,McKee singled to center field.,49,2025-05-09T00:00:00-04:00,"Cole Field (Carrollton, GA)",237,MBA,2025
6383816,596473,FGCU Eagles,596947,West Ga. Wolves,596473,6,top,Dempsey reached on a fielder's choice3a McKee out at second 2b to ss.,50,2025-05-09T00:00:00-04:00,"Cole Field (Carrollton, GA)",237,MBA,2025
6383816,596473,FGCU Eagles,596947,West Ga. Wolves,596473,6,top,Hessemyer doubled3a Dempsey advanced to third.,51,2025-05-09T00:00:00-04:00,"Cole Field (Carrollton, GA)",237,MBA,2025
6383816,596473,FGCU Eagles,596947,West Ga. Wolves,596473,6,top,Nelson struck out swinging.,52,2025-05-09T00:00:00-04:00,"Cole Field (Carrollton, GA)",237,MBA,2025
6383816,596473,FGCU Eagles,596947,West Ga. Wolves,596473,6,top,Povey fouled out to c.,53,2025-05-09T00:00:00-04:00,"Cole Field (Carrollton, GA)",237,MBA,2025
6383816,596473,FGCU Eagles,596947,West Ga. Wolves,596947,6,bot,T. Presnell doubled to right field.,54,2025-05-09T00:00:00-04:00,"Cole Field (Carrollton, GA)",237,MBA,2025
6383816,596473,FGCU Eagles,596947,West Ga. Wolves,596947,6,bot,J. Witmer grounded out to ss.,55,2025-05-09T00:00:00-04:00,"Cole Field (Carrollton, GA)",237,MBA,2025
6383816,596473,FGCU Eagles,596947,West Ga. Wolves,596947,6,bot,C. Prince struck out swinging.,56,2025-05-09T00:00:00-04:00,"Cole Field (Carrollton, GA)",237,MBA,2025
6383816,596473,FGCU Eagles,596947,West Ga. Wolves,596947,6,bot,L. Weidner grounded out to 3b.,57,2025-05-09T00:00:00-04:00,"Cole Field (Carrollton, GA)",237,MBA,2025
6383816,596473,FGCU Eagles,596947,West Ga. Wolves,596473,7,top,Embury popped up to 1b.,58,2025-05-09T00:00:00-04:00,"Cole Field (Carrollton, GA)",237,MBA,2025
6383816,596473,FGCU Eagles,596947,West Ga. Wolves,596473,7,top,Herb flied out to lf.,59,2025-05-09T00:00:00-04:00,"Cole Field (Carrollton, GA)",237,MBA,2025
6383816,596473,FGCU Eagles,596947,West Ga. Wolves,596473,7,top,Moise walked.,60,2025-05-09T00:00:00-04:00,"Cole Field (Carrollton, GA)",237,MBA,2025
6383816,596473,FGCU Eagles,596947,West Ga. Wolves,596473,7,top,Gagnon flied out to cf.,61,2025-05-09T00:00:00-04:00,"Cole Field (Carrollton, GA)",237,MBA,2025
6383816,596473,FGCU Eagles,596947,West Ga. Wolves,596947,7,bot,C. Dierdorf out at first p to 2b to 1b.,62,2025-05-09T00:00:00-04:00,"Cole Field (Carrollton, GA)",237,MBA,2025
6383816,596473,FGCU Eagles,596947,West Ga. Wolves,596947,7,bot,B. McDevitt flied out to cf.,63,2025-05-09T00:00:00-04:00,"Cole Field (Carrollton, GA)",237,MBA,2025
6383816,596473,FGCU Eagles,596947,West Ga. Wolves,596947,7,bot,B. Brand grounded out to 3b.,64,2025-05-09T00:00:00-04:00,"Cole Field (Carrollton, GA)",237,MBA,2025
6383816,596473,FGCU Eagles,596947,West Ga. Wolves,596473,8,top,McKee flied out to cf.,65,2025-05-09T00:00:00-04:00,"Cole Field (Carrollton, GA)",237,MBA,2025
6383816,596473,FGCU Eagles,596947,West Ga. Wolves,596473,8,top,Dempsey singled to right field.,66,2025-05-09T00:00:00-04:00,"Cole Field (Carrollton, GA)",237,MBA,2025
6383816,596473,FGCU Eagles,596947,West Ga. Wolves,596473,8,top,Hessemyer singled3a Dempsey advanced to third.,67,2025-05-09T00:00:00-04:00,"Cole Field (Carrollton, GA)",237,MBA,2025
6383816,596473,FGCU Eagles,596947,West Ga. Wolves,596473,8,top,"Nelson singled to center field, RBI3a Hessemyer advanced to second3a Dempsey scored.",68,2025-05-09T00:00:00-04:00,"Cole Field (Carrollton, GA)",237,MBA,2025
6383816,596473,FGCU Eagles,596947,West Ga. Wolves,596473,8,top,C. Diamond to p for W. Dean.,69,2025-05-09T00:00:00-04:00,"Cole Field (Carrollton, GA)",237,MBA,2025
6383816,596473,FGCU Eagles,596947,West Ga. Wolves,596473,8,top,"Povey singled, RBI3a Nelson advanced to second3a Hessemyer scored.",70,2025-05-09T00:00:00-04:00,"Cole Field (Carrollton, GA)",237,MBA,2025
6383816,596473,FGCU Eagles,596947,West Ga. Wolves,596473,8,top,"Embury homered to left field, 3 RBI3a Povey scored3a Nelson scored.",71,2025-05-09T00:00:00-04:00,"Cole Field (Carrollton, GA)",237,MBA,2025
6383816,596473,FGCU Eagles,596947,West Ga. Wolves,596473,8,top,Herb flied out to cf.,72,2025-05-09T00:00:00-04:00,"Cole Field (Carrollton, GA)",237,MBA,2025
6383816,596473,FGCU Eagles,596947,West Ga. Wolves,596473,8,top,Moise struck out swinging.,73,2025-05-09T00:00:00-04:00,"Cole Field (Carrollton, GA)",237,MBA,2025
6383816,596473,FGCU Eagles,596947,West Ga. Wolves,596947,8,bot,W. McConnell pinch hit for J. Bowman.,74,2025-05-09T00:00:00-04:00,"Cole Field (Carrollton, GA)",237,MBA,2025
6383816,596473,FGCU Eagles,596947,West Ga. Wolves,596947,8,bot,W. McConnell struck out looking.,75,2025-05-09T00:00:00-04:00,"Cole Field (Carrollton, GA)",237,MBA,2025
6383816,596473,FGCU Eagles,596947,West Ga. Wolves,596947,8,bot,M. Cooper flied out to rf.,76,2025-05-09T00:00:00-04:00,"Cole Field (Carrollton, GA)",237,MBA,2025
6383816,596473,FGCU Eagles,596947,West Ga. Wolves,596947,8,bot,L. Johnson pinch hit for T. Presnell.,77,2025-05-09T00:00:00-04:00,"Cole Field (Carrollton, GA)",237,MBA,2025
6383816,596473,FGCU Eagles,596947,West Ga. Wolves,596947,8,bot,L. Johnson struck out looking.,78,2025-05-09T00:00:00-04:00,"Cole Field (Carrollton, GA)",237,MBA,2025
