game_id,away_team_id,away_team_name,home_team_id,home_team_name,batting_team,inning,top_bot,event_text,event_num,game_datetime,stadium_name,attendance,sport_id,season
6384166,596808,Seton Hill Griffins,596872,California (PA) Vulcans,596808,1,top,J. Whalen flied out to cf.,1,2025-05-15T00:00:00-04:00,"Bennett J. Cooper Park (Millersville, PA)",112,MBA,2025
6384166,596808,Seton Hill Griffins,596872,California (PA) Vulcans,596808,1,top,O. Henne grounded out to ss.,2,2025-05-15T00:00:00-04:00,"Bennett J. Cooper Park (Millersville, PA)",112,MBA,2025
6384166,596808,Seton Hill Griffins,596872,California (PA) Vulcans,596808,1,top,M. Mandler walked.,3,2025-05-15T00:00:00-04:00,"Bennett J. Cooper Park (Millersville, PA)",112,MBA,2025
6384166,596808,Seton Hill Griffins,596872,California (PA) Vulcans,596808,1,top,M. Frazetta singled to right field3a M. Mandler advanced to second.,4,2025-05-15T00:00:00-04:00,"Bennett J. Cooper Park (Millersville, PA)",112,MBA,2025
6384166,596808,Seton Hill Griffins,596872,California (PA) Vulcans,596808,1,top,"B. McGuire homered to left field, 3 RBI3a M. Frazetta scored3a M. Mandler scored.",5,2025-05-15T00:00:00-04:00,"Bennett J. Cooper Park (Millersville, PA)",112,MBA,2025
6384166,596808,Seton Hill Griffins,596872,California (PA) Vulcans,596808,1,top,M. Black flied out to cf to left center.,6,2025-05-15T00:00:00-04:00,"Bennett J. Cooper Park (Millersville, PA)",112,MBA,2025
6384166,596808,Seton Hill Griffins,596872,California (PA) Vulcans,596872,1,bot,J. Salvatori struck out swinging.,7,2025-05-15T00:00:00-04:00,"Bennett J. Cooper Park (Millersville, PA)",112,MBA,2025
6384166,596808,Seton Hill Griffins,596872,California (PA) Vulcans,596872,1,bot,P. Conte flied out to rf.,8,2025-05-15T00:00:00-04:00,"Bennett J. Cooper Park (Millersville, PA)",112,MBA,2025
6384166,596808,Seton Hill Griffins,596872,California (PA) Vulcans,596872,1,bot,R. Callahan singled to left field.,9,2025-05-15T00:00:00-04:00,"Bennett J. Cooper Park (Millersville, PA)",112,MBA,2025
6384166,596808,Seton Hill Griffins,596872,California (PA) Vulcans,596872,1,bot,S. Marra singled to right field3a R. Callahan advanced to second.,10,2025-05-15T00:00:00-04:00,"Bennett J. Cooper Park (Millersville, PA)",112,MBA,2025
6384166,596808,Seton Hill Griffins,596872,California (PA) Vulcans,596872,1,bot,N. Meeks flied out to cf.,11,2025-05-15T00:00:00-04:00,"Bennett J. Cooper Park (Millersville, PA)",112,MBA,2025
6384166,596808,Seton Hill Griffins,596872,California (PA) Vulcans,596808,2,top,C. Ahr singled to first base.,12,2025-05-15T00:00:00-04:00,"Bennett J. Cooper Park (Millersville, PA)",112,MBA,2025
6384166,596808,Seton Hill Griffins,596872,California (PA) Vulcans,596808,2,top,J. Haynes singled through the left side3a C. Ahr advanced to second.,13,2025-05-15T00:00:00-04:00,"Bennett J. Cooper Park (Millersville, PA)",112,MBA,2025
6384166,596808,Seton Hill Griffins,596872,California (PA) Vulcans,596808,2,top,"J. Fiedor out at first p to 2b, SAC, bunt3a J. Haynes advanced to second3a C. Ahr advanced to third.",14,2025-05-15T00:00:00-04:00,"Bennett J. Cooper Park (Millersville, PA)",112,MBA,2025
6384166,596808,Seton Hill Griffins,596872,California (PA) Vulcans,596808,2,top,"J. Whalen doubled up the middle, 2 RBI3a J. Haynes scored3a C. Ahr scored.",15,2025-05-15T00:00:00-04:00,"Bennett J. Cooper Park (Millersville, PA)",112,MBA,2025
6384166,596808,Seton Hill Griffins,596872,California (PA) Vulcans,596808,2,top,J. Whalen advanced to third on a wild pitch.,16,2025-05-15T00:00:00-04:00,"Bennett J. Cooper Park (Millersville, PA)",112,MBA,2025
6384166,596808,Seton Hill Griffins,596872,California (PA) Vulcans,596808,2,top,"O. Henne flied out to cf, sacrifice fly, RBI3a J. Whalen scored.",17,2025-05-15T00:00:00-04:00,"Bennett J. Cooper Park (Millersville, PA)",112,MBA,2025
6384166,596808,Seton Hill Griffins,596872,California (PA) Vulcans,596808,2,top,M. Mandler walked.,18,2025-05-15T00:00:00-04:00,"Bennett J. Cooper Park (Millersville, PA)",112,MBA,2025
6384166,596808,Seton Hill Griffins,596872,California (PA) Vulcans,596808,2,top,M. Frazetta flied out to cf.,19,2025-05-15T00:00:00-04:00,"Bennett J. Cooper Park (Millersville, PA)",112,MBA,2025
6384166,596808,Seton Hill Griffins,596872,California (PA) Vulcans,596872,2,bot,C. Patterson walked.,20,2025-05-15T00:00:00-04:00,"Bennett J. Cooper Park (Millersville, PA)",112,MBA,2025
6384166,596808,Seton Hill Griffins,596872,California (PA) Vulcans,596872,2,bot,C. Collins lined out to lf.,21,2025-05-15T00:00:00-04:00,"Bennett J. Cooper Park (Millersville, PA)",112,MBA,2025
6384166,596808,Seton Hill Griffins,596872,California (PA) Vulcans,596872,2,bot,K. Rizzo struck out looking.,22,2025-05-15T00:00:00-04:00,"Bennett J. Cooper Park (Millersville, PA)",112,MBA,2025
6384166,596808,Seton Hill Griffins,596872,California (PA) Vulcans,596872,2,bot,I. Jones flied out to lf.,23,2025-05-15T00:00:00-04:00,"Bennett J. Cooper Park (Millersville, PA)",112,MBA,2025
6384166,596808,Seton Hill Griffins,596872,California (PA) Vulcans,596808,3,top,B. McGuire grounded out to p.,24,2025-05-15T00:00:00-04:00,"Bennett J. Cooper Park (Millersville, PA)",112,MBA,2025
6384166,596808,Seton Hill Griffins,596872,California (PA) Vulcans,596808,3,top,M. Black hit by pitch.,25,2025-05-15T00:00:00-04:00,"Bennett J. Cooper Park (Millersville, PA)",112,MBA,2025
6384166,596808,Seton Hill Griffins,596872,California (PA) Vulcans,596808,3,top,M. Black stole second.,26,2025-05-15T00:00:00-04:00,"Bennett J. Cooper Park (Millersville, PA)",112,MBA,2025
6384166,596808,Seton Hill Griffins,596872,California (PA) Vulcans,596808,3,top,C. Ahr grounded out to 2b3a M. Black advanced to third.,27,2025-05-15T00:00:00-04:00,"Bennett J. Cooper Park (Millersville, PA)",112,MBA,2025
6384166,596808,Seton Hill Griffins,596872,California (PA) Vulcans,596808,3,top,"J. Haynes singled to center field, RBI3a M. Black scored.",28,2025-05-15T00:00:00-04:00,"Bennett J. Cooper Park (Millersville, PA)",112,MBA,2025
6384166,596808,Seton Hill Griffins,596872,California (PA) Vulcans,596808,3,top,L. Treloar to p for R. Gill.,29,2025-05-15T00:00:00-04:00,"Bennett J. Cooper Park (Millersville, PA)",112,MBA,2025
6384166,596808,Seton Hill Griffins,596872,California (PA) Vulcans,596808,3,top,J. Fiedor singled to left center3a J. Haynes advanced to second.,30,2025-05-15T00:00:00-04:00,"Bennett J. Cooper Park (Millersville, PA)",112,MBA,2025
6384166,596808,Seton Hill Griffins,596872,California (PA) Vulcans,596808,3,top,"J. Whalen singled to left field, RBI3a J. Fiedor advanced to second3a J. Haynes scored.",31,2025-05-15T00:00:00-04:00,"Bennett J. Cooper Park (Millersville, PA)",112,MBA,2025
6384166,596808,Seton Hill Griffins,596872,California (PA) Vulcans,596808,3,top,"O. Henne doubled to left center, 2 RBI3a J. Whalen scored3a J. Fiedor scored.",32,2025-05-15T00:00:00-04:00,"Bennett J. Cooper Park (Millersville, PA)",112,MBA,2025
6384166,596808,Seton Hill Griffins,596872,California (PA) Vulcans,596808,3,top,M. Mandler fouled out to 2b.,33,2025-05-15T00:00:00-04:00,"Bennett J. Cooper Park (Millersville, PA)",112,MBA,2025
6384166,596808,Seton Hill Griffins,596872,California (PA) Vulcans,596872,3,bot,J. Salvatori flied out to cf.,34,2025-05-15T00:00:00-04:00,"Bennett J. Cooper Park (Millersville, PA)",112,MBA,2025
6384166,596808,Seton Hill Griffins,596872,California (PA) Vulcans,596872,3,bot,P. Conte grounded out to 3b.,35,2025-05-15T00:00:00-04:00,"Bennett J. Cooper Park (Millersville, PA)",112,MBA,2025
6384166,596808,Seton Hill Griffins,596872,California (PA) Vulcans,596872,3,bot,R. Callahan flied out to cf.,36,2025-05-15T00:00:00-04:00,"Bennett J. Cooper Park (Millersville, PA)",112,MBA,2025
6384166,596808,Seton Hill Griffins,596872,California (PA) Vulcans,596808,4,top,M. Frazetta doubled to right center.,37,2025-05-15T00:00:00-04:00,"Bennett J. Cooper Park (Millersville, PA)",112,MBA,2025
6384166,596808,Seton Hill Griffins,596872,California (PA) Vulcans,596808,4,top,M. Frazetta advanced to third on a wild pitch.,38,2025-05-15T00:00:00-04:00,"Bennett J. Cooper Park (Millersville, PA)",112,MBA,2025
6384166,596808,Seton Hill Griffins,596872,California (PA) Vulcans,596808,4,top,"B. McGuire tripled to left center, RBI3a M. Frazetta scored.",39,2025-05-15T00:00:00-04:00,"Bennett J. Cooper Park (Millersville, PA)",112,MBA,2025
6384166,596808,Seton Hill Griffins,596872,California (PA) Vulcans,596808,4,top,J. Bryson to p for L. Treloar.,40,2025-05-15T00:00:00-04:00,"Bennett J. Cooper Park (Millersville, PA)",112,MBA,2025
6384166,596808,Seton Hill Griffins,596872,California (PA) Vulcans,596808,4,top,"M. Black flied out to rf, sacrifice fly, RBI3a B. McGuire scored.",41,2025-05-15T00:00:00-04:00,"Bennett J. Cooper Park (Millersville, PA)",112,MBA,2025
6384166,596808,Seton Hill Griffins,596872,California (PA) Vulcans,596808,4,top,C. Ahr grounded out to 2b.,42,2025-05-15T00:00:00-04:00,"Bennett J. Cooper Park (Millersville, PA)",112,MBA,2025
6384166,596808,Seton Hill Griffins,596872,California (PA) Vulcans,596808,4,top,J. Haynes flied out to lf.,43,2025-05-15T00:00:00-04:00,"Bennett J. Cooper Park (Millersville, PA)",112,MBA,2025
6384166,596808,Seton Hill Griffins,596872,California (PA) Vulcans,596872,4,bot,S. Marra grounded out to ss.,44,2025-05-15T00:00:00-04:00,"Bennett J. Cooper Park (Millersville, PA)",112,MBA,2025
6384166,596808,Seton Hill Griffins,596872,California (PA) Vulcans,596872,4,bot,N. Meeks grounded out to 3b.,45,2025-05-15T00:00:00-04:00,"Bennett J. Cooper Park (Millersville, PA)",112,MBA,2025
6384166,596808,Seton Hill Griffins,596872,California (PA) Vulcans,596872,4,bot,"C. Patterson struck out swinging, out at first c unassisted.",46,2025-05-15T00:00:00-04:00,"Bennett J. Cooper Park (Millersville, PA)",112,MBA,2025
6384166,596808,Seton Hill Griffins,596872,California (PA) Vulcans,596808,5,top,J. Fiedor singled to shortstop.,47,2025-05-15T00:00:00-04:00,"Bennett J. Cooper Park (Millersville, PA)",112,MBA,2025
6384166,596808,Seton Hill Griffins,596872,California (PA) Vulcans,596808,5,top,J. Fiedor stole second.,48,2025-05-15T00:00:00-04:00,"Bennett J. Cooper Park (Millersville, PA)",112,MBA,2025
6384166,596808,Seton Hill Griffins,596872,California (PA) Vulcans,596808,5,top,J. Whalen grounded out to ss.,49,2025-05-15T00:00:00-04:00,"Bennett J. Cooper Park (Millersville, PA)",112,MBA,2025
6384166,596808,Seton Hill Griffins,596872,California (PA) Vulcans,596808,5,top,O. Henne fouled out to rf3a J. Fiedor advanced to third.,50,2025-05-15T00:00:00-04:00,"Bennett J. Cooper Park (Millersville, PA)",112,MBA,2025
6384166,596808,Seton Hill Griffins,596872,California (PA) Vulcans,596808,5,top,M. Mandler hit by pitch.,51,2025-05-15T00:00:00-04:00,"Bennett J. Cooper Park (Millersville, PA)",112,MBA,2025
6384166,596808,Seton Hill Griffins,596872,California (PA) Vulcans,596808,5,top,"M. Frazetta singled through the left side, RBI3a M. Mandler advanced to second3a J. Fiedor scored.",52,2025-05-15T00:00:00-04:00,"Bennett J. Cooper Park (Millersville, PA)",112,MBA,2025
6384166,596808,Seton Hill Griffins,596872,California (PA) Vulcans,596808,5,top,B. McGuire struck out looking.,53,2025-05-15T00:00:00-04:00,"Bennett J. Cooper Park (Millersville, PA)",112,MBA,2025
6384166,596808,Seton Hill Griffins,596872,California (PA) Vulcans,596872,5,bot,C. Collins singled to center field.,54,2025-05-15T00:00:00-04:00,"Bennett J. Cooper Park (Millersville, PA)",112,MBA,2025
6384166,596808,Seton Hill Griffins,596872,California (PA) Vulcans,596872,5,bot,K. Rizzo flied out to cf.,55,2025-05-15T00:00:00-04:00,"Bennett J. Cooper Park (Millersville, PA)",112,MBA,2025
6384166,596808,Seton Hill Griffins,596872,California (PA) Vulcans,596872,5,bot,I. Jones singled to pitcher3a C. Collins advanced to second.,56,2025-05-15T00:00:00-04:00,"Bennett J. Cooper Park (Millersville, PA)",112,MBA,2025
6384166,596808,Seton Hill Griffins,596872,California (PA) Vulcans,596872,5,bot,J. Salvatori fouled out to lf.,57,2025-05-15T00:00:00-04:00,"Bennett J. Cooper Park (Millersville, PA)",112,MBA,2025
6384166,596808,Seton Hill Griffins,596872,California (PA) Vulcans,596872,5,bot,P. Conte singled to pitcher3a I. Jones advanced to second3a C. Collins advanced to third.,58,2025-05-15T00:00:00-04:00,"Bennett J. Cooper Park (Millersville, PA)",112,MBA,2025
6384166,596808,Seton Hill Griffins,596872,California (PA) Vulcans,596872,5,bot,"R. Callahan walked, RBI3a P. Conte advanced to second3a I. Jones advanced to third3a C. Collins scored.",59,2025-05-15T00:00:00-04:00,"Bennett J. Cooper Park (Millersville, PA)",112,MBA,2025
6384166,596808,Seton Hill Griffins,596872,California (PA) Vulcans,596872,5,bot,S. Marra flied out to cf.,60,2025-05-15T00:00:00-04:00,"Bennett J. Cooper Park (Millersville, PA)",112,MBA,2025
6384166,596808,Seton Hill Griffins,596872,California (PA) Vulcans,596808,6,top,M. Black walked.,61,2025-05-15T00:00:00-04:00,"Bennett J. Cooper Park (Millersville, PA)",112,MBA,2025
6384166,596808,Seton Hill Griffins,596872,California (PA) Vulcans,596808,6,top,C. Ahr singled to right field3a M. Black advanced to second.,62,2025-05-15T00:00:00-04:00,"Bennett J. Cooper Park (Millersville, PA)",112,MBA,2025
6384166,596808,Seton Hill Griffins,596872,California (PA) Vulcans,596808,6,top,O. Mandler pinch ran for C. Ahr.,63,2025-05-15T00:00:00-04:00,"Bennett J. Cooper Park (Millersville, PA)",112,MBA,2025
6384166,596808,Seton Hill Griffins,596872,California (PA) Vulcans,596808,6,top,J. Haynes popped up to ss.,64,2025-05-15T00:00:00-04:00,"Bennett J. Cooper Park (Millersville, PA)",112,MBA,2025
6384166,596808,Seton Hill Griffins,596872,California (PA) Vulcans,596808,6,top,O. Mandler stole second3a M. Black stole third.,65,2025-05-15T00:00:00-04:00,"Bennett J. Cooper Park (Millersville, PA)",112,MBA,2025
6384166,596808,Seton Hill Griffins,596872,California (PA) Vulcans,596808,6,top,"J. Fiedor flied out to rf, sacrifice fly, RBI3a O. Mandler advanced to third3a M. Black scored.",66,2025-05-15T00:00:00-04:00,"Bennett J. Cooper Park (Millersville, PA)",112,MBA,2025
6384166,596808,Seton Hill Griffins,596872,California (PA) Vulcans,596808,6,top,J. Whalen lined out to rf.,67,2025-05-15T00:00:00-04:00,"Bennett J. Cooper Park (Millersville, PA)",112,MBA,2025
6384166,596808,Seton Hill Griffins,596872,California (PA) Vulcans,596872,6,bot,M. Gregos to lf for O. Mandler.,68,2025-05-15T00:00:00-04:00,"Bennett J. Cooper Park (Millersville, PA)",112,MBA,2025
6384166,596808,Seton Hill Griffins,596872,California (PA) Vulcans,596872,6,bot,N. Meeks struck out looking.,69,2025-05-15T00:00:00-04:00,"Bennett J. Cooper Park (Millersville, PA)",112,MBA,2025
6384166,596808,Seton Hill Griffins,596872,California (PA) Vulcans,596872,6,bot,C. Patterson walked.,70,2025-05-15T00:00:00-04:00,"Bennett J. Cooper Park (Millersville, PA)",112,MBA,2025
6384166,596808,Seton Hill Griffins,596872,California (PA) Vulcans,596872,6,bot,C. Evans pinch ran for C. Patterson.,71,2025-05-15T00:00:00-04:00,"Bennett J. Cooper Park (Millersville, PA)",112,MBA,2025
6384166,596808,Seton Hill Griffins,596872,California (PA) Vulcans,596872,6,bot,C. Collins grounded out to 3b3a C. Evans advanced to second.,72,2025-05-15T00:00:00-04:00,"Bennett J. Cooper Park (Millersville, PA)",112,MBA,2025
6384166,596808,Seton Hill Griffins,596872,California (PA) Vulcans,596872,6,bot,C. McTighe pinch hit for K. Rizzo.,73,2025-05-15T00:00:00-04:00,"Bennett J. Cooper Park (Millersville, PA)",112,MBA,2025
6384166,596808,Seton Hill Griffins,596872,California (PA) Vulcans,596872,6,bot,C. McTighe grounded out to ss.,74,2025-05-15T00:00:00-04:00,"Bennett J. Cooper Park (Millersville, PA)",112,MBA,2025
6384166,596808,Seton Hill Griffins,596872,California (PA) Vulcans,596808,7,top,C. McTighe to c.,75,2025-05-15T00:00:00-04:00,"Bennett J. Cooper Park (Millersville, PA)",112,MBA,2025
6384166,596808,Seton Hill Griffins,596872,California (PA) Vulcans,596808,7,top,O. Henne grounded out to ss.,76,2025-05-15T00:00:00-04:00,"Bennett J. Cooper Park (Millersville, PA)",112,MBA,2025
6384166,596808,Seton Hill Griffins,596872,California (PA) Vulcans,596808,7,top,M. Mandler flied out to cf.,77,2025-05-15T00:00:00-04:00,"Bennett J. Cooper Park (Millersville, PA)",112,MBA,2025
6384166,596808,Seton Hill Griffins,596872,California (PA) Vulcans,596808,7,top,M. Frazetta grounded out to ss.,78,2025-05-15T00:00:00-04:00,"Bennett J. Cooper Park (Millersville, PA)",112,MBA,2025
6384166,596808,Seton Hill Griffins,596872,California (PA) Vulcans,596872,7,bot,S. Williams to p for I. Korn.,79,2025-05-15T00:00:00-04:00,"Bennett J. Cooper Park (Millersville, PA)",112,MBA,2025
6384166,596808,Seton Hill Griffins,596872,California (PA) Vulcans,596872,7,bot,"I. Jones struck out looking, out at first c to 1b.",80,2025-05-15T00:00:00-04:00,"Bennett J. Cooper Park (Millersville, PA)",112,MBA,2025
6384166,596808,Seton Hill Griffins,596872,California (PA) Vulcans,596872,7,bot,J. Salvatori popped up to 1b.,81,2025-05-15T00:00:00-04:00,"Bennett J. Cooper Park (Millersville, PA)",112,MBA,2025
6384166,596808,Seton Hill Griffins,596872,California (PA) Vulcans,596872,7,bot,P. Conte grounded out to 3b.,82,2025-05-15T00:00:00-04:00,"Bennett J. Cooper Park (Millersville, PA)",112,MBA,2025
6384166,596808,Seton Hill Griffins,596872,California (PA) Vulcans,596808,8,top,B. McGuire flied out to cf.,83,2025-05-15T00:00:00-04:00,"Bennett J. Cooper Park (Millersville, PA)",112,MBA,2025
6384166,596808,Seton Hill Griffins,596872,California (PA) Vulcans,596808,8,top,M. Black flied out to cf.,84,2025-05-15T00:00:00-04:00,"Bennett J. Cooper Park (Millersville, PA)",112,MBA,2025
6384166,596808,Seton Hill Griffins,596872,California (PA) Vulcans,596808,8,top,"M. Gregos struck out swinging, out at first c to 1b.",85,2025-05-15T00:00:00-04:00,"Bennett J. Cooper Park (Millersville, PA)",112,MBA,2025
6384166,596808,Seton Hill Griffins,596872,California (PA) Vulcans,596872,8,bot,L. McCoy to p for S. Williams.,86,2025-05-15T00:00:00-04:00,"Bennett J. Cooper Park (Millersville, PA)",112,MBA,2025
6384166,596808,Seton Hill Griffins,596872,California (PA) Vulcans,596872,8,bot,R. Callahan doubled down the lf line.,87,2025-05-15T00:00:00-04:00,"Bennett J. Cooper Park (Millersville, PA)",112,MBA,2025
6384166,596808,Seton Hill Griffins,596872,California (PA) Vulcans,596872,8,bot,S. Marra grounded out to 3b.,88,2025-05-15T00:00:00-04:00,"Bennett J. Cooper Park (Millersville, PA)",112,MBA,2025
6384166,596808,Seton Hill Griffins,596872,California (PA) Vulcans,596872,8,bot,N. Meeks hit by pitch.,89,2025-05-15T00:00:00-04:00,"Bennett J. Cooper Park (Millersville, PA)",112,MBA,2025
6384166,596808,Seton Hill Griffins,596872,California (PA) Vulcans,596872,8,bot,C. Evans hit by pitch3a N. Meeks advanced to second3a R. Callahan advanced to third.,90,2025-05-15T00:00:00-04:00,"Bennett J. Cooper Park (Millersville, PA)",112,MBA,2025
6384166,596808,Seton Hill Griffins,596872,California (PA) Vulcans,596872,8,bot,"C. Collins reached on a fielder's choice, RBI3a C. Evans advanced to second3a N. Meeks out at third ss to 3b3a R. Callahan scored.",91,2025-05-15T00:00:00-04:00,"Bennett J. Cooper Park (Millersville, PA)",112,MBA,2025
6384166,596808,Seton Hill Griffins,596872,California (PA) Vulcans,596872,8,bot,C. McTighe reached on a fielder's choice3a C. Collins out at second 2b unassisted.,92,2025-05-15T00:00:00-04:00,"Bennett J. Cooper Park (Millersville, PA)",112,MBA,2025
6384166,596808,Seton Hill Griffins,596872,California (PA) Vulcans,596808,9,top,J. Haynes fouled out to rf.,93,2025-05-15T00:00:00-04:00,"Bennett J. Cooper Park (Millersville, PA)",112,MBA,2025
6384166,596808,Seton Hill Griffins,596872,California (PA) Vulcans,596808,9,top,J. Fiedor grounded out to 2b.,94,2025-05-15T00:00:00-04:00,"Bennett J. Cooper Park (Millersville, PA)",112,MBA,2025
6384166,596808,Seton Hill Griffins,596872,California (PA) Vulcans,596808,9,top,J. Whalen grounded out to 3b.,95,2025-05-15T00:00:00-04:00,"Bennett J. Cooper Park (Millersville, PA)",112,MBA,2025
6384166,596808,Seton Hill Griffins,596872,California (PA) Vulcans,596872,9,bot,A. Winkleble to rf for M. Mandler.,96,2025-05-15T00:00:00-04:00,"Bennett J. Cooper Park (Millersville, PA)",112,MBA,2025
6384166,596808,Seton Hill Griffins,596872,California (PA) Vulcans,596872,9,bot,I. Jones struck out swinging.,97,2025-05-15T00:00:00-04:00,"Bennett J. Cooper Park (Millersville, PA)",112,MBA,2025
6384166,596808,Seton Hill Griffins,596872,California (PA) Vulcans,596872,9,bot,J. Salvatori fouled out to 1b.,98,2025-05-15T00:00:00-04:00,"Bennett J. Cooper Park (Millersville, PA)",112,MBA,2025
6384166,596808,Seton Hill Griffins,596872,California (PA) Vulcans,596872,9,bot,P. Conte fouled out to 3b.,99,2025-05-15T00:00:00-04:00,"Bennett J. Cooper Park (Millersville, PA)",112,MBA,2025
