game_id,away_team_id,away_team_name,home_team_id,home_team_name,batting_team,inning,top_bot,event_text,event_num,game_datetime,stadium_name,attendance,sport_id,season
6384812,596454,Xavier Musketeers,596529,Creighton Bluejays,596454,1,top,LAMBDIN grounded out to 3b (3-2 BBKBK).,1,2025-05-22T00:00:00-04:00,"Prasco Park (Mason, OH)",2928,MBA,2025
6384812,596454,Xavier Musketeers,596529,Creighton Bluejays,596454,1,top,"TUCKER, N. lined out to 2b (0-0).",2,2025-05-22T00:00:00-04:00,"Prasco Park (Mason, OH)",2928,MBA,2025
6384812,596454,Xavier Musketeers,596529,Creighton Bluejays,596454,1,top,HENDRICKSON reached on a fielding error by 2b (1-2 KBF).,3,2025-05-22T00:00:00-04:00,"Prasco Park (Mason, OH)",2928,MBA,2025
6384812,596454,Xavier Musketeers,596529,Creighton Bluejays,596454,1,top,"MISCH, C. singled to right field (0-0)3a HENDRICKSON advanced to third.",4,2025-05-22T00:00:00-04:00,"Prasco Park (Mason, OH)",2928,MBA,2025
6384812,596454,Xavier Musketeers,596529,Creighton Bluejays,596454,1,top,"BURDETTE, C. singled up the middle, RBI (0-2 FK)3a MISCH, C. advanced to third3a HENDRICKSON scored, unearned.",5,2025-05-22T00:00:00-04:00,"Prasco Park (Mason, OH)",2928,MBA,2025
6384812,596454,Xavier Musketeers,596529,Creighton Bluejays,596454,1,top,WACHSMANN grounded out to 2b (3-2 KBBBF).,6,2025-05-22T00:00:00-04:00,"Prasco Park (Mason, OH)",2928,MBA,2025
6384812,596454,Xavier Musketeers,596529,Creighton Bluejays,596529,1,bot,"Gillen, T. walked (3-2 BBBKFFB).",7,2025-05-22T00:00:00-04:00,"Prasco Park (Mason, OH)",2928,MBA,2025
6384812,596454,Xavier Musketeers,596529,Creighton Bluejays,596529,1,bot,"Gillen, T. stole second.",8,2025-05-22T00:00:00-04:00,"Prasco Park (Mason, OH)",2928,MBA,2025
6384812,596454,Xavier Musketeers,596529,Creighton Bluejays,596529,1,bot,"Scherrman, M struck out swinging (2-2 BFBKS).",9,2025-05-22T00:00:00-04:00,"Prasco Park (Mason, OH)",2928,MBA,2025
6384812,596454,Xavier Musketeers,596529,Creighton Bluejays,596529,1,bot,"Sailors, N. doubled to center field, RBI (1-2 SBF)3a Gillen, T. scored.",10,2025-05-22T00:00:00-04:00,"Prasco Park (Mason, OH)",2928,MBA,2025
6384812,596454,Xavier Musketeers,596529,Creighton Bluejays,596529,1,bot,"North, B. walked (3-0 BBBB).",11,2025-05-22T00:00:00-04:00,"Prasco Park (Mason, OH)",2928,MBA,2025
6384812,596454,Xavier Musketeers,596529,Creighton Bluejays,596529,1,bot,"Capece, C. doubled to right center, 2 RBI (1-1 KB)3a North, B. scored3a Sailors, N. scored.",12,2025-05-22T00:00:00-04:00,"Prasco Park (Mason, OH)",2928,MBA,2025
6384812,596454,Xavier Musketeers,596529,Creighton Bluejays,596529,1,bot,"MacLean, W. walked (3-1 BBKBB).",13,2025-05-22T00:00:00-04:00,"Prasco Park (Mason, OH)",2928,MBA,2025
6384812,596454,Xavier Musketeers,596529,Creighton Bluejays,596529,1,bot,"Deters, T. reached on a fielding error by ss (2-1 BKB)3a MacLean, W. advanced to second3a Capece, C. advanced to third.",14,2025-05-22T00:00:00-04:00,"Prasco Park (Mason, OH)",2928,MBA,2025
6384812,596454,Xavier Musketeers,596529,Creighton Bluejays,596529,1,bot,"Hess, K. flied out to cf (3-1 KBBB).",15,2025-05-22T00:00:00-04:00,"Prasco Park (Mason, OH)",2928,MBA,2025
6384812,596454,Xavier Musketeers,596529,Creighton Bluejays,596529,1,bot,"Torosian, J. flied out to lf (3-2 FBSBFB).",16,2025-05-22T00:00:00-04:00,"Prasco Park (Mason, OH)",2928,MBA,2025
6384812,596454,Xavier Musketeers,596529,Creighton Bluejays,596454,2,top,"ANDERSON,A. grounded out to 3b (0-0).",17,2025-05-22T00:00:00-04:00,"Prasco Park (Mason, OH)",2928,MBA,2025
6384812,596454,Xavier Musketeers,596529,Creighton Bluejays,596454,2,top,"JELIC, J. flied out to lf (0-0).",18,2025-05-22T00:00:00-04:00,"Prasco Park (Mason, OH)",2928,MBA,2025
6384812,596454,Xavier Musketeers,596529,Creighton Bluejays,596454,2,top,"HAMMOND, L. flied out to rf (2-2 KFBB).",19,2025-05-22T00:00:00-04:00,"Prasco Park (Mason, OH)",2928,MBA,2025
6384812,596454,Xavier Musketeers,596529,Creighton Bluejays,596529,2,bot,"Gillen, T. flied out to cf (2-1 BKB).",20,2025-05-22T00:00:00-04:00,"Prasco Park (Mason, OH)",2928,MBA,2025
6384812,596454,Xavier Musketeers,596529,Creighton Bluejays,596529,2,bot,"Scherrman, M flied out to rf (2-2 BKSB).",21,2025-05-22T00:00:00-04:00,"Prasco Park (Mason, OH)",2928,MBA,2025
6384812,596454,Xavier Musketeers,596529,Creighton Bluejays,596529,2,bot,"Sailors, N. grounded out to 1b unassisted (0-1 K).",22,2025-05-22T00:00:00-04:00,"Prasco Park (Mason, OH)",2928,MBA,2025
6384812,596454,Xavier Musketeers,596529,Creighton Bluejays,596454,3,top,LAMBDIN singled through the left side (2-2 BKBK).,23,2025-05-22T00:00:00-04:00,"Prasco Park (Mason, OH)",2928,MBA,2025
6384812,596454,Xavier Musketeers,596529,Creighton Bluejays,596454,3,top,"TUCKER, N. out at first 1b to p (0-0)3a LAMBDIN advanced to second.",24,2025-05-22T00:00:00-04:00,"Prasco Park (Mason, OH)",2928,MBA,2025
6384812,596454,Xavier Musketeers,596529,Creighton Bluejays,596454,3,top,"HENDRICKSON singled through the left side, advanced to second on a fielding error by 1b (2-1 FBB)3a LAMBDIN advanced to third.",25,2025-05-22T00:00:00-04:00,"Prasco Park (Mason, OH)",2928,MBA,2025
6384812,596454,Xavier Musketeers,596529,Creighton Bluejays,596454,3,top,"MISCH, C. singled to left center, 2 RBI (0-0)3a HENDRICKSON scored3a LAMBDIN scored.",26,2025-05-22T00:00:00-04:00,"Prasco Park (Mason, OH)",2928,MBA,2025
6384812,596454,Xavier Musketeers,596529,Creighton Bluejays,596454,3,top,"BURDETTE, C. homered to left center, 2 RBI (0-0)3a MISCH, C. scored.",27,2025-05-22T00:00:00-04:00,"Prasco Park (Mason, OH)",2928,MBA,2025
6384812,596454,Xavier Musketeers,596529,Creighton Bluejays,596454,3,top,WACHSMANN walked (3-2 BBKKBB).,28,2025-05-22T00:00:00-04:00,"Prasco Park (Mason, OH)",2928,MBA,2025
6384812,596454,Xavier Musketeers,596529,Creighton Bluejays,596454,3,top,"ANDERSON,A. struck out swinging (3-2 SBKBBS).",29,2025-05-22T00:00:00-04:00,"Prasco Park (Mason, OH)",2928,MBA,2025
6384812,596454,Xavier Musketeers,596529,Creighton Bluejays,596454,3,top,"JELIC, J. struck out swinging (2-2 BBKSFS).",30,2025-05-22T00:00:00-04:00,"Prasco Park (Mason, OH)",2928,MBA,2025
6384812,596454,Xavier Musketeers,596529,Creighton Bluejays,596529,3,bot,"North, B. flied out to rf (1-1 BS).",31,2025-05-22T00:00:00-04:00,"Prasco Park (Mason, OH)",2928,MBA,2025
6384812,596454,Xavier Musketeers,596529,Creighton Bluejays,596529,3,bot,"Capece, C. singled up the middle (1-1 BK).",32,2025-05-22T00:00:00-04:00,"Prasco Park (Mason, OH)",2928,MBA,2025
6384812,596454,Xavier Musketeers,596529,Creighton Bluejays,596529,3,bot,"MacLean, W. hit by pitch (3-2 BBBKFF)3a Capece, C. advanced to second.",33,2025-05-22T00:00:00-04:00,"Prasco Park (Mason, OH)",2928,MBA,2025
6384812,596454,Xavier Musketeers,596529,Creighton Bluejays,596529,3,bot,"Deters, T. singled through the left side, RBI (0-2 KS)3a MacLean, W. advanced to second3a Capece, C. scored.",34,2025-05-22T00:00:00-04:00,"Prasco Park (Mason, OH)",2928,MBA,2025
6384812,596454,Xavier Musketeers,596529,Creighton Bluejays,596529,3,bot,"Hess, K. walked (3-2 BKBSBB)3a Deters, T. advanced to second3a MacLean, W. advanced to third.",35,2025-05-22T00:00:00-04:00,"Prasco Park (Mason, OH)",2928,MBA,2025
6384812,596454,Xavier Musketeers,596529,Creighton Bluejays,596529,3,bot,"Torosian, J. struck out looking (2-2 KBFFBFFK).",36,2025-05-22T00:00:00-04:00,"Prasco Park (Mason, OH)",2928,MBA,2025
6384812,596454,Xavier Musketeers,596529,Creighton Bluejays,596529,3,bot,"Gillen, T. grounded out to 2b (3-2 KKBBFFB).",37,2025-05-22T00:00:00-04:00,"Prasco Park (Mason, OH)",2928,MBA,2025
6384812,596454,Xavier Musketeers,596529,Creighton Bluejays,596454,4,top,"Koosman, I. to p for Pineau, J..",38,2025-05-22T00:00:00-04:00,"Prasco Park (Mason, OH)",2928,MBA,2025
6384812,596454,Xavier Musketeers,596529,Creighton Bluejays,596454,4,top,"HAMMOND, L. popped up to ss (2-2 SBKFB).",39,2025-05-22T00:00:00-04:00,"Prasco Park (Mason, OH)",2928,MBA,2025
6384812,596454,Xavier Musketeers,596529,Creighton Bluejays,596454,4,top,LAMBDIN struck out swinging (1-2 BKKS).,40,2025-05-22T00:00:00-04:00,"Prasco Park (Mason, OH)",2928,MBA,2025
6384812,596454,Xavier Musketeers,596529,Creighton Bluejays,596454,4,top,"TUCKER, N. struck out swinging (2-2 KKBBS).",41,2025-05-22T00:00:00-04:00,"Prasco Park (Mason, OH)",2928,MBA,2025
6384812,596454,Xavier Musketeers,596529,Creighton Bluejays,596529,4,bot,"WYLIE, J. to p for PIECH.",42,2025-05-22T00:00:00-04:00,"Prasco Park (Mason, OH)",2928,MBA,2025
6384812,596454,Xavier Musketeers,596529,Creighton Bluejays,596529,4,bot,"Scherrman, M struck out looking (3-2 BKBFBK).",43,2025-05-22T00:00:00-04:00,"Prasco Park (Mason, OH)",2928,MBA,2025
6384812,596454,Xavier Musketeers,596529,Creighton Bluejays,596529,4,bot,"Sailors, N. grounded out to p (3-1 BBBK).",44,2025-05-22T00:00:00-04:00,"Prasco Park (Mason, OH)",2928,MBA,2025
6384812,596454,Xavier Musketeers,596529,Creighton Bluejays,596529,4,bot,"North, B. reached on a fielding error by 1b (3-2 BBFBF).",45,2025-05-22T00:00:00-04:00,"Prasco Park (Mason, OH)",2928,MBA,2025
6384812,596454,Xavier Musketeers,596529,Creighton Bluejays,596529,4,bot,"Capece, C. singled to left field (3-2 BBBKF)3a North, B. advanced to second, out at third lf to 3b.",46,2025-05-22T00:00:00-04:00,"Prasco Park (Mason, OH)",2928,MBA,2025
6384812,596454,Xavier Musketeers,596529,Creighton Bluejays,596454,5,top,HENDRICKSON flied out to rf to right center (1-0 B).,47,2025-05-22T00:00:00-04:00,"Prasco Park (Mason, OH)",2928,MBA,2025
6384812,596454,Xavier Musketeers,596529,Creighton Bluejays,596454,5,top,"MISCH, C. lined out to lf (1-0 B).",48,2025-05-22T00:00:00-04:00,"Prasco Park (Mason, OH)",2928,MBA,2025
6384812,596454,Xavier Musketeers,596529,Creighton Bluejays,596454,5,top,"BURDETTE, C. struck out swinging (3-2 SFBFFBBS).",49,2025-05-22T00:00:00-04:00,"Prasco Park (Mason, OH)",2928,MBA,2025
6384812,596454,Xavier Musketeers,596529,Creighton Bluejays,596529,5,bot,"MacLean, W. grounded out to 1b unassisted (0-1 K).",50,2025-05-22T00:00:00-04:00,"Prasco Park (Mason, OH)",2928,MBA,2025
6384812,596454,Xavier Musketeers,596529,Creighton Bluejays,596529,5,bot,"Deters, T. walked (3-1 BBBKB).",51,2025-05-22T00:00:00-04:00,"Prasco Park (Mason, OH)",2928,MBA,2025
6384812,596454,Xavier Musketeers,596529,Creighton Bluejays,596529,5,bot,"Deters, T. advanced to second on a balk.",52,2025-05-22T00:00:00-04:00,"Prasco Park (Mason, OH)",2928,MBA,2025
6384812,596454,Xavier Musketeers,596529,Creighton Bluejays,596529,5,bot,"Hess, K. homered to right field, 2 RBI (3-1 KBBB)3a Deters, T. scored.",53,2025-05-22T00:00:00-04:00,"Prasco Park (Mason, OH)",2928,MBA,2025
6384812,596454,Xavier Musketeers,596529,Creighton Bluejays,596529,5,bot,"Duffalo, D. pinch hit for Torosian, J..",54,2025-05-22T00:00:00-04:00,"Prasco Park (Mason, OH)",2928,MBA,2025
6384812,596454,Xavier Musketeers,596529,Creighton Bluejays,596529,5,bot,"Duffalo, D. struck out looking (2-2 BSBFK).",55,2025-05-22T00:00:00-04:00,"Prasco Park (Mason, OH)",2928,MBA,2025
6384812,596454,Xavier Musketeers,596529,Creighton Bluejays,596529,5,bot,"NOBE, J. to p for WYLIE, J..",56,2025-05-22T00:00:00-04:00,"Prasco Park (Mason, OH)",2928,MBA,2025
6384812,596454,Xavier Musketeers,596529,Creighton Bluejays,596529,5,bot,"Gillen, T. struck out looking (1-2 FFBK).",57,2025-05-22T00:00:00-04:00,"Prasco Park (Mason, OH)",2928,MBA,2025
6384812,596454,Xavier Musketeers,596529,Creighton Bluejays,596454,6,top,WACHSMANN popped up to ss (2-2 FKBFFFB).,58,2025-05-22T00:00:00-04:00,"Prasco Park (Mason, OH)",2928,MBA,2025
6384812,596454,Xavier Musketeers,596529,Creighton Bluejays,596454,6,top,"ANDERSON,A. struck out looking (2-2 BBKFK).",59,2025-05-22T00:00:00-04:00,"Prasco Park (Mason, OH)",2928,MBA,2025
6384812,596454,Xavier Musketeers,596529,Creighton Bluejays,596454,6,top,"JELIC, J. popped up to ss (0-1 S).",60,2025-05-22T00:00:00-04:00,"Prasco Park (Mason, OH)",2928,MBA,2025
6384812,596454,Xavier Musketeers,596529,Creighton Bluejays,596529,6,bot,"Scherrman, M singled through the right side (1-1 BK).",61,2025-05-22T00:00:00-04:00,"Prasco Park (Mason, OH)",2928,MBA,2025
6384812,596454,Xavier Musketeers,596529,Creighton Bluejays,596529,6,bot,"Sailors, N. struck out swinging (1-2 KBFS).",62,2025-05-22T00:00:00-04:00,"Prasco Park (Mason, OH)",2928,MBA,2025
6384812,596454,Xavier Musketeers,596529,Creighton Bluejays,596529,6,bot,"North, B. walked (3-0 BBBB)3a Scherrman, M advanced to second.",63,2025-05-22T00:00:00-04:00,"Prasco Park (Mason, OH)",2928,MBA,2025
6384812,596454,Xavier Musketeers,596529,Creighton Bluejays,596529,6,bot,"Capece, C. flied out to rf (2-2 BFBS).",64,2025-05-22T00:00:00-04:00,"Prasco Park (Mason, OH)",2928,MBA,2025
6384812,596454,Xavier Musketeers,596529,Creighton Bluejays,596529,6,bot,"MacLean, W. doubled down the lf line, 2 RBI, advanced to third on the throw (0-2 SK)3a North, B. scored3a Scherrman, M scored.",65,2025-05-22T00:00:00-04:00,"Prasco Park (Mason, OH)",2928,MBA,2025
6384812,596454,Xavier Musketeers,596529,Creighton Bluejays,596529,6,bot,"Deters, T. walked (3-1 BKBBB).",66,2025-05-22T00:00:00-04:00,"Prasco Park (Mason, OH)",2928,MBA,2025
6384812,596454,Xavier Musketeers,596529,Creighton Bluejays,596529,6,bot,"Hess, K. flied out to cf (0-2 KF).",67,2025-05-22T00:00:00-04:00,"Prasco Park (Mason, OH)",2928,MBA,2025
6384812,596454,Xavier Musketeers,596529,Creighton Bluejays,596454,7,top,"HAMMOND, L. walked (3-2 BFFBBB).",68,2025-05-22T00:00:00-04:00,"Prasco Park (Mason, OH)",2928,MBA,2025
6384812,596454,Xavier Musketeers,596529,Creighton Bluejays,596454,7,top,"LAMBDIN singled to center field (0-1 K)3a HAMMOND, L. advanced to second.",69,2025-05-22T00:00:00-04:00,"Prasco Park (Mason, OH)",2928,MBA,2025
6384812,596454,Xavier Musketeers,596529,Creighton Bluejays,596454,7,top,"TUCKER, N. flied out to rf to right center (2-0 BB)3a HAMMOND, L. advanced to third.",70,2025-05-22T00:00:00-04:00,"Prasco Park (Mason, OH)",2928,MBA,2025
6384812,596454,Xavier Musketeers,596529,Creighton Bluejays,596454,7,top,LAMBDIN advanced to second on a wild pitch.,71,2025-05-22T00:00:00-04:00,"Prasco Park (Mason, OH)",2928,MBA,2025
6384812,596454,Xavier Musketeers,596529,Creighton Bluejays,596454,7,top,"HENDRICKSON singled to left center, RBI (3-1 FBBB)3a LAMBDIN advanced to third3a HAMMOND, L. scored.",72,2025-05-22T00:00:00-04:00,"Prasco Park (Mason, OH)",2928,MBA,2025
6384812,596454,Xavier Musketeers,596529,Creighton Bluejays,596454,7,top,"Magers, W. to p for Koosman, I..",73,2025-05-22T00:00:00-04:00,"Prasco Park (Mason, OH)",2928,MBA,2025
6384812,596454,Xavier Musketeers,596529,Creighton Bluejays,596454,7,top,HENDRICKSON stole second.,74,2025-05-22T00:00:00-04:00,"Prasco Park (Mason, OH)",2928,MBA,2025
6384812,596454,Xavier Musketeers,596529,Creighton Bluejays,596454,7,top,"MISCH, C. flied out to cf, SF, RBI (2-2 BBKK)3a HENDRICKSON advanced to third3a LAMBDIN scored.",75,2025-05-22T00:00:00-04:00,"Prasco Park (Mason, OH)",2928,MBA,2025
6384812,596454,Xavier Musketeers,596529,Creighton Bluejays,596454,7,top,"BURDETTE, C. walked (3-1 FBBBB).",76,2025-05-22T00:00:00-04:00,"Prasco Park (Mason, OH)",2928,MBA,2025
6384812,596454,Xavier Musketeers,596529,Creighton Bluejays,596454,7,top,"BURDETTE, C. advanced to second.",77,2025-05-22T00:00:00-04:00,"Prasco Park (Mason, OH)",2928,MBA,2025
6384812,596454,Xavier Musketeers,596529,Creighton Bluejays,596454,7,top,WACHSMANN grounded out to ss (2-2 SBFB).,78,2025-05-22T00:00:00-04:00,"Prasco Park (Mason, OH)",2928,MBA,2025
6384812,596454,Xavier Musketeers,596529,Creighton Bluejays,596529,7,bot,"Duffalo, D. to dh.",79,2025-05-22T00:00:00-04:00,"Prasco Park (Mason, OH)",2928,MBA,2025
6384812,596454,Xavier Musketeers,596529,Creighton Bluejays,596529,7,bot,"Duffalo, D. struck out swinging (3-2 BBBKKS).",80,2025-05-22T00:00:00-04:00,"Prasco Park (Mason, OH)",2928,MBA,2025
6384812,596454,Xavier Musketeers,596529,Creighton Bluejays,596529,7,bot,"Gillen, T. grounded out to 2b (0-0).",81,2025-05-22T00:00:00-04:00,"Prasco Park (Mason, OH)",2928,MBA,2025
6384812,596454,Xavier Musketeers,596529,Creighton Bluejays,596529,7,bot,"Scherrman, M doubled through the right side (2-1 BKB).",82,2025-05-22T00:00:00-04:00,"Prasco Park (Mason, OH)",2928,MBA,2025
6384812,596454,Xavier Musketeers,596529,Creighton Bluejays,596529,7,bot,"GEDDES, T. to p for NOBE, J..",83,2025-05-22T00:00:00-04:00,"Prasco Park (Mason, OH)",2928,MBA,2025
6384812,596454,Xavier Musketeers,596529,Creighton Bluejays,596529,7,bot,"Sailors, N. walked (3-2 BBBKFB).",84,2025-05-22T00:00:00-04:00,"Prasco Park (Mason, OH)",2928,MBA,2025
6384812,596454,Xavier Musketeers,596529,Creighton Bluejays,596529,7,bot,"BOYLE to p for GEDDES, T..",85,2025-05-22T00:00:00-04:00,"Prasco Park (Mason, OH)",2928,MBA,2025
6384812,596454,Xavier Musketeers,596529,Creighton Bluejays,596529,7,bot,"Sailors, N. advanced to second on a wild pitch3a Scherrman, M advanced to third on a wild pitch.",86,2025-05-22T00:00:00-04:00,"Prasco Park (Mason, OH)",2928,MBA,2025
6384812,596454,Xavier Musketeers,596529,Creighton Bluejays,596529,7,bot,"North, B. walked (3-2 BBSBFB).",87,2025-05-22T00:00:00-04:00,"Prasco Park (Mason, OH)",2928,MBA,2025
6384812,596454,Xavier Musketeers,596529,Creighton Bluejays,596529,7,bot,"Capece, C. singled through the left side, 2 RBI (1-0 B)3a North, B. advanced to second3a Sailors, N. scored, unearned3a Scherrman, M scored, unearned.",88,2025-05-22T00:00:00-04:00,"Prasco Park (Mason, OH)",2928,MBA,2025
6384812,596454,Xavier Musketeers,596529,Creighton Bluejays,596529,7,bot,"MacLean, W. flied out to cf (1-1 FB).",89,2025-05-22T00:00:00-04:00,"Prasco Park (Mason, OH)",2928,MBA,2025
6384812,596454,Xavier Musketeers,596529,Creighton Bluejays,596454,8,top,"ANDERSON,A. homered to left field, RBI (0-0).",90,2025-05-22T00:00:00-04:00,"Prasco Park (Mason, OH)",2928,MBA,2025
6384812,596454,Xavier Musketeers,596529,Creighton Bluejays,596454,8,top,"CANTERBERRY pinch hit for JELIC, J..",91,2025-05-22T00:00:00-04:00,"Prasco Park (Mason, OH)",2928,MBA,2025
6384812,596454,Xavier Musketeers,596529,Creighton Bluejays,596454,8,top,CANTERBERRY grounded out to c (2-2 BBKKF).,92,2025-05-22T00:00:00-04:00,"Prasco Park (Mason, OH)",2928,MBA,2025
6384812,596454,Xavier Musketeers,596529,Creighton Bluejays,596454,8,top,"HAMMOND, L. grounded out to ss (3-1 BBKB).",93,2025-05-22T00:00:00-04:00,"Prasco Park (Mason, OH)",2928,MBA,2025
6384812,596454,Xavier Musketeers,596529,Creighton Bluejays,596454,8,top,LAMBDIN flied out to rf to right center (0-0).,94,2025-05-22T00:00:00-04:00,"Prasco Park (Mason, OH)",2928,MBA,2025
6384812,596454,Xavier Musketeers,596529,Creighton Bluejays,596529,8,bot,"STACK, T. to c for CANTERBERRY.",95,2025-05-22T00:00:00-04:00,"Prasco Park (Mason, OH)",2928,MBA,2025
6384812,596454,Xavier Musketeers,596529,Creighton Bluejays,596529,8,bot,"Deters, T. walked (3-0 BBBB).",96,2025-05-22T00:00:00-04:00,"Prasco Park (Mason, OH)",2928,MBA,2025
6384812,596454,Xavier Musketeers,596529,Creighton Bluejays,596529,8,bot,"Hess, K. grounded out to p, SAC, bunt (0-0)3a Deters, T. advanced to second.",97,2025-05-22T00:00:00-04:00,"Prasco Park (Mason, OH)",2928,MBA,2025
6384812,596454,Xavier Musketeers,596529,Creighton Bluejays,596529,8,bot,"McHugh, N. pinch hit for Duffalo, D..",98,2025-05-22T00:00:00-04:00,"Prasco Park (Mason, OH)",2928,MBA,2025
6384812,596454,Xavier Musketeers,596529,Creighton Bluejays,596529,8,bot,"McHugh, N. walked (3-2 BBKFBFB).",99,2025-05-22T00:00:00-04:00,"Prasco Park (Mason, OH)",2928,MBA,2025
6384812,596454,Xavier Musketeers,596529,Creighton Bluejays,596529,8,bot,CHRONISTER to p for BOYLE.,100,2025-05-22T00:00:00-04:00,"Prasco Park (Mason, OH)",2928,MBA,2025
6384812,596454,Xavier Musketeers,596529,Creighton Bluejays,596529,8,bot,"Gillen, T. singled up the middle, RBI (2-1 KBB)3a McHugh, N. advanced to second3a Deters, T. scored.",101,2025-05-22T00:00:00-04:00,"Prasco Park (Mason, OH)",2928,MBA,2025
6384812,596454,Xavier Musketeers,596529,Creighton Bluejays,596529,8,bot,"Scherrman, M struck out swinging (2-2 FBSBS).",102,2025-05-22T00:00:00-04:00,"Prasco Park (Mason, OH)",2928,MBA,2025
6384812,596454,Xavier Musketeers,596529,Creighton Bluejays,596529,8,bot,"Sailors, N. struck out swinging, grounded out to c unassisted (0-2 FKFS).",103,2025-05-22T00:00:00-04:00,"Prasco Park (Mason, OH)",2928,MBA,2025
6384812,596454,Xavier Musketeers,596529,Creighton Bluejays,596454,9,top,"TUCKER, N. singled to right field (0-2 FF).",104,2025-05-22T00:00:00-04:00,"Prasco Park (Mason, OH)",2928,MBA,2025
6384812,596454,Xavier Musketeers,596529,Creighton Bluejays,596454,9,top,HENDRICKSON lined out to lf to left center (0-1 K).,105,2025-05-22T00:00:00-04:00,"Prasco Park (Mason, OH)",2928,MBA,2025
6384812,596454,Xavier Musketeers,596529,Creighton Bluejays,596454,9,top,"MISCH, C. struck out looking (2-2 BKKBK).",106,2025-05-22T00:00:00-04:00,"Prasco Park (Mason, OH)",2928,MBA,2025
6384812,596454,Xavier Musketeers,596529,Creighton Bluejays,596454,9,top,"BURDETTE, C. reached on a fielder's choice (0-1 S)3a TUCKER, N. out at second ss to 2b.",107,2025-05-22T00:00:00-04:00,"Prasco Park (Mason, OH)",2928,MBA,2025
