game_id,away_team_id,away_team_name,home_team_id,home_team_name,batting_team,inning,top_bot,event_text,event_num,game_datetime,stadium_name,attendance,sport_id,season
6385150,596437,VMI Keydets,596445,Western Caro. Catamounts,596437,1,top,No play.,1,2025-05-21T00:00:00-04:00,"Fluor Field (Greenville, SC)",492,MBA,2025
6385150,596437,VMI Keydets,596445,Western Caro. Catamounts,596437,1,top,O. Prince singled to center field (0-2 KF).,2,2025-05-21T00:00:00-04:00,"Fluor Field (Greenville, SC)",492,MBA,2025
6385150,596437,VMI Keydets,596445,Western Caro. Catamounts,596437,1,top,B. Garner lined out to ss (2-0 BB).,3,2025-05-21T00:00:00-04:00,"Fluor Field (Greenville, SC)",492,MBA,2025
6385150,596437,VMI Keydets,596445,Western Caro. Catamounts,596437,1,top,G. Fitzwater popped up to 3b (2-1 BBS).,4,2025-05-21T00:00:00-04:00,"Fluor Field (Greenville, SC)",492,MBA,2025
6385150,596437,VMI Keydets,596445,Western Caro. Catamounts,596437,1,top,B. Torres grounded out to 1b unassisted (1-1 SB).,5,2025-05-21T00:00:00-04:00,"Fluor Field (Greenville, SC)",492,MBA,2025
6385150,596437,VMI Keydets,596445,Western Caro. Catamounts,596445,1,bot,"Corn singled to left field, out at second lf to 2b (1-1 FB).",6,2025-05-21T00:00:00-04:00,"Fluor Field (Greenville, SC)",492,MBA,2025
6385150,596437,VMI Keydets,596445,Western Caro. Catamounts,596445,1,bot,"Friese homered to right field, RBI (2-0 BB).",7,2025-05-21T00:00:00-04:00,"Fluor Field (Greenville, SC)",492,MBA,2025
6385150,596437,VMI Keydets,596445,Western Caro. Catamounts,596445,1,bot,Turner walked (3-0 BBBB).,8,2025-05-21T00:00:00-04:00,"Fluor Field (Greenville, SC)",492,MBA,2025
6385150,596437,VMI Keydets,596445,Western Caro. Catamounts,596445,1,bot,"Turner out at second p to 1b to ss, picked off, caught stealing.",9,2025-05-21T00:00:00-04:00,"Fluor Field (Greenville, SC)",492,MBA,2025
6385150,596437,VMI Keydets,596445,Western Caro. Catamounts,596445,1,bot,Spyke doubled to center field (3-2 BKBSB).,10,2025-05-21T00:00:00-04:00,"Fluor Field (Greenville, SC)",492,MBA,2025
6385150,596437,VMI Keydets,596445,Western Caro. Catamounts,596445,1,bot,"Holton reached on a throwing error by ss (1-1 BK)3a Spyke scored on the error, unearned.",11,2025-05-21T00:00:00-04:00,"Fluor Field (Greenville, SC)",492,MBA,2025
6385150,596437,VMI Keydets,596445,Western Caro. Catamounts,596445,1,bot,Stanley grounded out to 1b unassisted (0-1 F).,12,2025-05-21T00:00:00-04:00,"Fluor Field (Greenville, SC)",492,MBA,2025
6385150,596437,VMI Keydets,596445,Western Caro. Catamounts,596437,2,top,C. Raile struck out swinging (1-2 KBSFS).,13,2025-05-21T00:00:00-04:00,"Fluor Field (Greenville, SC)",492,MBA,2025
6385150,596437,VMI Keydets,596445,Western Caro. Catamounts,596437,2,top,"R. Peterson grounded out to p, bunt (0-1 F).",14,2025-05-21T00:00:00-04:00,"Fluor Field (Greenville, SC)",492,MBA,2025
6385150,596437,VMI Keydets,596445,Western Caro. Catamounts,596437,2,top,A. Schnarrs walked (3-2 KBKBBB).,15,2025-05-21T00:00:00-04:00,"Fluor Field (Greenville, SC)",492,MBA,2025
6385150,596437,VMI Keydets,596445,Western Caro. Catamounts,596437,2,top,"M. Perry grounded out to p, bunt (1-1 BF).",16,2025-05-21T00:00:00-04:00,"Fluor Field (Greenville, SC)",492,MBA,2025
6385150,596437,VMI Keydets,596445,Western Caro. Catamounts,596445,2,bot,Smith walked (3-2 SSBBBB).,17,2025-05-21T00:00:00-04:00,"Fluor Field (Greenville, SC)",492,MBA,2025
6385150,596437,VMI Keydets,596445,Western Caro. Catamounts,596445,2,bot,"Quarless homered to center field, 2 RBI (2-0 BB)3a Smith scored.",18,2025-05-21T00:00:00-04:00,"Fluor Field (Greenville, SC)",492,MBA,2025
6385150,596437,VMI Keydets,596445,Western Caro. Catamounts,596445,2,bot,Spees singled to center field (1-1 BK).,19,2025-05-21T00:00:00-04:00,"Fluor Field (Greenville, SC)",492,MBA,2025
6385150,596437,VMI Keydets,596445,Western Caro. Catamounts,596445,2,bot,N. Hawley to p for J. Lloyd.,20,2025-05-21T00:00:00-04:00,"Fluor Field (Greenville, SC)",492,MBA,2025
6385150,596437,VMI Keydets,596445,Western Caro. Catamounts,596445,2,bot,Spees advanced to second on a wild pitch.,21,2025-05-21T00:00:00-04:00,"Fluor Field (Greenville, SC)",492,MBA,2025
6385150,596437,VMI Keydets,596445,Western Caro. Catamounts,596445,2,bot,"Corn homered to left center, 2 RBI (0-2 FF)3a Spees scored.",22,2025-05-21T00:00:00-04:00,"Fluor Field (Greenville, SC)",492,MBA,2025
6385150,596437,VMI Keydets,596445,Western Caro. Catamounts,596445,2,bot,Friese hit by pitch (0-0).,23,2025-05-21T00:00:00-04:00,"Fluor Field (Greenville, SC)",492,MBA,2025
6385150,596437,VMI Keydets,596445,Western Caro. Catamounts,596445,2,bot,Turner reached on a fielder's choice (3-2 KBBKB)3a Friese out at second ss to 2b.,24,2025-05-21T00:00:00-04:00,"Fluor Field (Greenville, SC)",492,MBA,2025
6385150,596437,VMI Keydets,596445,Western Caro. Catamounts,596445,2,bot,Spyke walked (3-2 KFBBBB)3a Turner advanced to second.,25,2025-05-21T00:00:00-04:00,"Fluor Field (Greenville, SC)",492,MBA,2025
6385150,596437,VMI Keydets,596445,Western Caro. Catamounts,596445,2,bot,Holton flied out to rf (0-0).,26,2025-05-21T00:00:00-04:00,"Fluor Field (Greenville, SC)",492,MBA,2025
6385150,596437,VMI Keydets,596445,Western Caro. Catamounts,596445,2,bot,Stanley struck out looking (3-2 BBFBFFFFK).,27,2025-05-21T00:00:00-04:00,"Fluor Field (Greenville, SC)",492,MBA,2025
6385150,596437,VMI Keydets,596445,Western Caro. Catamounts,596437,3,top,K. Jordan struck out looking (1-2 BKSK).,28,2025-05-21T00:00:00-04:00,"Fluor Field (Greenville, SC)",492,MBA,2025
6385150,596437,VMI Keydets,596445,Western Caro. Catamounts,596437,3,top,O. Prince singled through the right side (1-2 KBFF).,29,2025-05-21T00:00:00-04:00,"Fluor Field (Greenville, SC)",492,MBA,2025
6385150,596437,VMI Keydets,596445,Western Caro. Catamounts,596437,3,top,B. Garner flied out to rf (2-2 FSBB).,30,2025-05-21T00:00:00-04:00,"Fluor Field (Greenville, SC)",492,MBA,2025
6385150,596437,VMI Keydets,596445,Western Caro. Catamounts,596437,3,top,"O. Prince out at second p to 1b to ss, picked off, caught stealing.",31,2025-05-21T00:00:00-04:00,"Fluor Field (Greenville, SC)",492,MBA,2025
6385150,596437,VMI Keydets,596445,Western Caro. Catamounts,596445,3,bot,Smith singled down the rf line (1-1 BK).,32,2025-05-21T00:00:00-04:00,"Fluor Field (Greenville, SC)",492,MBA,2025
6385150,596437,VMI Keydets,596445,Western Caro. Catamounts,596445,3,bot,Quarless singled to right field (0-2 KF)3a Smith advanced to second.,33,2025-05-21T00:00:00-04:00,"Fluor Field (Greenville, SC)",492,MBA,2025
6385150,596437,VMI Keydets,596445,Western Caro. Catamounts,596445,3,bot,"Spees out at first c to 2b, SAC, bunt (0-0)3a Quarless advanced to second3a Smith advanced to third.",34,2025-05-21T00:00:00-04:00,"Fluor Field (Greenville, SC)",492,MBA,2025
6385150,596437,VMI Keydets,596445,Western Caro. Catamounts,596445,3,bot,"Corn flied out to rf, SF, RBI (0-1 K)3a Quarless advanced to third3a Smith scored.",35,2025-05-21T00:00:00-04:00,"Fluor Field (Greenville, SC)",492,MBA,2025
6385150,596437,VMI Keydets,596445,Western Caro. Catamounts,596445,3,bot,Friese hit by pitch (2-2 FBBK).,36,2025-05-21T00:00:00-04:00,"Fluor Field (Greenville, SC)",492,MBA,2025
6385150,596437,VMI Keydets,596445,Western Caro. Catamounts,596445,3,bot,"Turner singled up the middle, RBI (2-0 BB)3a Friese advanced to second3a Quarless scored.",37,2025-05-21T00:00:00-04:00,"Fluor Field (Greenville, SC)",492,MBA,2025
6385150,596437,VMI Keydets,596445,Western Caro. Catamounts,596445,3,bot,Spyke grounded out to ss (1-1 BF).,38,2025-05-21T00:00:00-04:00,"Fluor Field (Greenville, SC)",492,MBA,2025
6385150,596437,VMI Keydets,596445,Western Caro. Catamounts,596437,4,top,G. Fitzwater flied out to cf (1-0 B).,39,2025-05-21T00:00:00-04:00,"Fluor Field (Greenville, SC)",492,MBA,2025
6385150,596437,VMI Keydets,596445,Western Caro. Catamounts,596437,4,top,B. Torres doubled to left field (2-2 KBBS).,40,2025-05-21T00:00:00-04:00,"Fluor Field (Greenville, SC)",492,MBA,2025
6385150,596437,VMI Keydets,596445,Western Caro. Catamounts,596437,4,top,C. Raile struck out looking (0-2 KFK).,41,2025-05-21T00:00:00-04:00,"Fluor Field (Greenville, SC)",492,MBA,2025
6385150,596437,VMI Keydets,596445,Western Caro. Catamounts,596437,4,top,R. Peterson hit by pitch (2-2 KBBF).,42,2025-05-21T00:00:00-04:00,"Fluor Field (Greenville, SC)",492,MBA,2025
6385150,596437,VMI Keydets,596445,Western Caro. Catamounts,596437,4,top,A. Schnarrs walked (3-1 BBKBB)3a R. Peterson advanced to second3a B. Torres advanced to third.,43,2025-05-21T00:00:00-04:00,"Fluor Field (Greenville, SC)",492,MBA,2025
6385150,596437,VMI Keydets,596445,Western Caro. Catamounts,596437,4,top,M. Perry popped up to ss (1-0 B).,44,2025-05-21T00:00:00-04:00,"Fluor Field (Greenville, SC)",492,MBA,2025
6385150,596437,VMI Keydets,596445,Western Caro. Catamounts,596445,4,bot,"Holton doubled to right field, ground-rule (1-1 BK).",45,2025-05-21T00:00:00-04:00,"Fluor Field (Greenville, SC)",492,MBA,2025
6385150,596437,VMI Keydets,596445,Western Caro. Catamounts,596445,4,bot,Stanley flied out to cf (2-2 FSBBFF)3a Holton advanced to third.,46,2025-05-21T00:00:00-04:00,"Fluor Field (Greenville, SC)",492,MBA,2025
6385150,596437,VMI Keydets,596445,Western Caro. Catamounts,596445,4,bot,M. Alstine to p for N. Hawley.,47,2025-05-21T00:00:00-04:00,"Fluor Field (Greenville, SC)",492,MBA,2025
6385150,596437,VMI Keydets,596445,Western Caro. Catamounts,596445,4,bot,"Smith doubled down the rf line, RBI (2-1 KBB)3a Holton scored.",48,2025-05-21T00:00:00-04:00,"Fluor Field (Greenville, SC)",492,MBA,2025
6385150,596437,VMI Keydets,596445,Western Caro. Catamounts,596445,4,bot,Quarless struck out swinging (3-2 BSFBBS).,49,2025-05-21T00:00:00-04:00,"Fluor Field (Greenville, SC)",492,MBA,2025
6385150,596437,VMI Keydets,596445,Western Caro. Catamounts,596445,4,bot,Spees grounded out to 3b (0-0).,50,2025-05-21T00:00:00-04:00,"Fluor Field (Greenville, SC)",492,MBA,2025
6385150,596437,VMI Keydets,596445,Western Caro. Catamounts,596437,5,top,K. Jordan walked (3-1 SBBBB).,51,2025-05-21T00:00:00-04:00,"Fluor Field (Greenville, SC)",492,MBA,2025
6385150,596437,VMI Keydets,596445,Western Caro. Catamounts,596437,5,top,O. Prince singled to right field (1-2 KBK)3a K. Jordan advanced to third.,52,2025-05-21T00:00:00-04:00,"Fluor Field (Greenville, SC)",492,MBA,2025
6385150,596437,VMI Keydets,596445,Western Caro. Catamounts,596437,5,top,B. Garner struck out swinging (2-2 BSBFS).,53,2025-05-21T00:00:00-04:00,"Fluor Field (Greenville, SC)",492,MBA,2025
6385150,596437,VMI Keydets,596445,Western Caro. Catamounts,596437,5,top,G. Fitzwater flied out to cf (1-1 BF)3a O. Prince advanced to second.,54,2025-05-21T00:00:00-04:00,"Fluor Field (Greenville, SC)",492,MBA,2025
6385150,596437,VMI Keydets,596445,Western Caro. Catamounts,596437,5,top,B. Torres hit by pitch (2-2 SFBB).,55,2025-05-21T00:00:00-04:00,"Fluor Field (Greenville, SC)",492,MBA,2025
6385150,596437,VMI Keydets,596445,Western Caro. Catamounts,596437,5,top,B. Torres advanced to second3a O. Prince advanced to third3a K. Jordan scored on a wild pitch.,56,2025-05-21T00:00:00-04:00,"Fluor Field (Greenville, SC)",492,MBA,2025
6385150,596437,VMI Keydets,596445,Western Caro. Catamounts,596437,5,top,C. Raile flied out to rf (2-2 SFFBBF).,57,2025-05-21T00:00:00-04:00,"Fluor Field (Greenville, SC)",492,MBA,2025
6385150,596437,VMI Keydets,596445,Western Caro. Catamounts,596445,5,bot,Corn singled to shortstop (0-2 KK).,58,2025-05-21T00:00:00-04:00,"Fluor Field (Greenville, SC)",492,MBA,2025
6385150,596437,VMI Keydets,596445,Western Caro. Catamounts,596445,5,bot,Friese grounded out to p (0-0)3a Corn advanced to second.,59,2025-05-21T00:00:00-04:00,"Fluor Field (Greenville, SC)",492,MBA,2025
6385150,596437,VMI Keydets,596445,Western Caro. Catamounts,596445,5,bot,Turner reached on a fielding error by 3b (0-0).,60,2025-05-21T00:00:00-04:00,"Fluor Field (Greenville, SC)",492,MBA,2025
6385150,596437,VMI Keydets,596445,Western Caro. Catamounts,596445,5,bot,Spyke singled to center field (0-2 KK)3a Turner advanced to second3a Corn advanced to third.,61,2025-05-21T00:00:00-04:00,"Fluor Field (Greenville, SC)",492,MBA,2025
6385150,596437,VMI Keydets,596445,Western Caro. Catamounts,596445,5,bot,"Holton singled to center field, RBI (1-2 BFF)3a Spyke advanced to second3a Turner advanced to third3a Corn scored.",62,2025-05-21T00:00:00-04:00,"Fluor Field (Greenville, SC)",492,MBA,2025
6385150,596437,VMI Keydets,596445,Western Caro. Catamounts,596445,5,bot,"Stanley singled to right field, advanced to second on a fielding error by rf, 2 RBI (0-0)3a Holton advanced to third, scored on the error, unearned3a Spyke scored3a Turner scored, unearned.",63,2025-05-21T00:00:00-04:00,"Fluor Field (Greenville, SC)",492,MBA,2025
6385150,596437,VMI Keydets,596445,Western Caro. Catamounts,596445,5,bot,Smith walked (3-2 BSBFBB).,64,2025-05-21T00:00:00-04:00,"Fluor Field (Greenville, SC)",492,MBA,2025
6385150,596437,VMI Keydets,596445,Western Caro. Catamounts,596445,5,bot,Quarless popped up to 1b (2-1 BFB).,65,2025-05-21T00:00:00-04:00,"Fluor Field (Greenville, SC)",492,MBA,2025
6385150,596437,VMI Keydets,596445,Western Caro. Catamounts,596445,5,bot,"Spees singled to right field, RBI (0-2 KK)3a Smith advanced to third3a Stanley scored, unearned.",66,2025-05-21T00:00:00-04:00,"Fluor Field (Greenville, SC)",492,MBA,2025
6385150,596437,VMI Keydets,596445,Western Caro. Catamounts,596445,5,bot,C. Plummer to p for M. Alstine.,67,2025-05-21T00:00:00-04:00,"Fluor Field (Greenville, SC)",492,MBA,2025
6385150,596437,VMI Keydets,596445,Western Caro. Catamounts,596445,5,bot,Corn hit by pitch (1-2 KBF)3a Spees advanced to second.,68,2025-05-21T00:00:00-04:00,"Fluor Field (Greenville, SC)",492,MBA,2025
6385150,596437,VMI Keydets,596445,Western Caro. Catamounts,596445,5,bot,"Friese walked, RBI (3-1 BBBKB)3a Corn advanced to second3a Spees advanced to third3a Smith scored, unearned.",69,2025-05-21T00:00:00-04:00,"Fluor Field (Greenville, SC)",492,MBA,2025
6385150,596437,VMI Keydets,596445,Western Caro. Catamounts,596445,5,bot,Turner flied out to rf (2-1 FBB).,70,2025-05-21T00:00:00-04:00,"Fluor Field (Greenville, SC)",492,MBA,2025
6385150,596437,VMI Keydets,596445,Western Caro. Catamounts,596437,6,top,Langston to p for Revis.,71,2025-05-21T00:00:00-04:00,"Fluor Field (Greenville, SC)",492,MBA,2025
6385150,596437,VMI Keydets,596445,Western Caro. Catamounts,596437,6,top,R. Peterson struck out swinging (0-2 KFS).,72,2025-05-21T00:00:00-04:00,"Fluor Field (Greenville, SC)",492,MBA,2025
6385150,596437,VMI Keydets,596445,Western Caro. Catamounts,596437,6,top,A. Schnarrs out at first 1b to p (0-1 K).,73,2025-05-21T00:00:00-04:00,"Fluor Field (Greenville, SC)",492,MBA,2025
6385150,596437,VMI Keydets,596445,Western Caro. Catamounts,596437,6,top,J. Newsome pinch hit for M. Perry.,74,2025-05-21T00:00:00-04:00,"Fluor Field (Greenville, SC)",492,MBA,2025
6385150,596437,VMI Keydets,596445,Western Caro. Catamounts,596437,6,top,J. Newsome singled through the right side (2-2 KBBF).,75,2025-05-21T00:00:00-04:00,"Fluor Field (Greenville, SC)",492,MBA,2025
6385150,596437,VMI Keydets,596445,Western Caro. Catamounts,596437,6,top,"K. Jordan grounded out to p, bunt (2-1 BBK).",76,2025-05-21T00:00:00-04:00,"Fluor Field (Greenville, SC)",492,MBA,2025
6385150,596437,VMI Keydets,596445,Western Caro. Catamounts,596445,6,bot,B. Garner to 2b.,77,2025-05-21T00:00:00-04:00,"Fluor Field (Greenville, SC)",492,MBA,2025
6385150,596437,VMI Keydets,596445,Western Caro. Catamounts,596445,6,bot,G. Fitzwater to rf.,78,2025-05-21T00:00:00-04:00,"Fluor Field (Greenville, SC)",492,MBA,2025
6385150,596437,VMI Keydets,596445,Western Caro. Catamounts,596445,6,bot,J. Newsome to 1b.,79,2025-05-21T00:00:00-04:00,"Fluor Field (Greenville, SC)",492,MBA,2025
6385150,596437,VMI Keydets,596445,Western Caro. Catamounts,596445,6,bot,K. Jordan to ss.,80,2025-05-21T00:00:00-04:00,"Fluor Field (Greenville, SC)",492,MBA,2025
6385150,596437,VMI Keydets,596445,Western Caro. Catamounts,596445,6,bot,Spyke grounded out to 2b (0-2 KK).,81,2025-05-21T00:00:00-04:00,"Fluor Field (Greenville, SC)",492,MBA,2025
6385150,596437,VMI Keydets,596445,Western Caro. Catamounts,596445,6,bot,Holton singled to right field (2-2 BKFFB).,82,2025-05-21T00:00:00-04:00,"Fluor Field (Greenville, SC)",492,MBA,2025
6385150,596437,VMI Keydets,596445,Western Caro. Catamounts,596445,6,bot,Stanley struck out swinging (3-2 BBFFFFBS).,83,2025-05-21T00:00:00-04:00,"Fluor Field (Greenville, SC)",492,MBA,2025
6385150,596437,VMI Keydets,596445,Western Caro. Catamounts,596445,6,bot,Smith singled up the middle (1-1 BK)3a Holton advanced to third.,84,2025-05-21T00:00:00-04:00,"Fluor Field (Greenville, SC)",492,MBA,2025
6385150,596437,VMI Keydets,596445,Western Caro. Catamounts,596445,6,bot,Quarless reached on a fielder's choice (2-0 BB)3a Smith out at second ss to 2b.,85,2025-05-21T00:00:00-04:00,"Fluor Field (Greenville, SC)",492,MBA,2025
6385150,596437,VMI Keydets,596445,Western Caro. Catamounts,596437,7,top,Kimbrell to p for Langston.,86,2025-05-21T00:00:00-04:00,"Fluor Field (Greenville, SC)",492,MBA,2025
6385150,596437,VMI Keydets,596445,Western Caro. Catamounts,596437,7,top,O. Prince hit by pitch (1-0 B).,87,2025-05-21T00:00:00-04:00,"Fluor Field (Greenville, SC)",492,MBA,2025
6385150,596437,VMI Keydets,596445,Western Caro. Catamounts,596437,7,top,B. Garner grounded into double play ss to 2b (2-1 BBK)3a O. Prince out on the play.,88,2025-05-21T00:00:00-04:00,"Fluor Field (Greenville, SC)",492,MBA,2025
6385150,596437,VMI Keydets,596445,Western Caro. Catamounts,596437,7,top,G. Fitzwater flied out to lf (1-2 BKK).,89,2025-05-21T00:00:00-04:00,"Fluor Field (Greenville, SC)",492,MBA,2025
